id,conversation_id,created_at,date,time,timezone,user_id,username,name,place,tweet,language,mentions,urls,photos,replies_count,retweets_count,likes_count,hashtags,cashtags,link,retweet,quote_url,video,thumbnail,near,geo,source,user_rt_id,user_rt,retweet_id,reply_to,retweet_date,translate,trans_src,trans_dest
1502503476957491205,1502380125651881984,2022-03-11 22:35:18 CST,2022-03-11,22:35:18,-0500,1067308276726054914,unofficialkj,kj (dude/bro),,@RJRCapital It’s good for a violent rip upwards tbh,en,[],[],[],0,0,1,[],[],https://twitter.com/UnofficialKJ/status/1502503476957491205,False,,0,,san antonio,,,,,,"[{'screen_name': 'RJRCapital', 'name': 'RJR Capital', 'id': '223520770'}]",,,,
1502502860319301632,1502313779119411205,2022-03-11 22:32:51 CST,2022-03-11,22:32:51,-0500,203759619,sephirothtx,Joshua Winters / sephiroth_tx 🏳️‍🌈,,@TexasDFPS Did you know @TexasDFPS was in hot water in 2019 when a case worker exposed their heirchy would lie about child abuse to remove children from good families?,en,"[{'screen_name': 'texasdfps', 'name': 'texas dfps', 'id': '250710465'}]",[],[],0,0,0,[],[],https://twitter.com/Sephirothtx/status/1502502860319301632,False,,0,,san antonio,,,,,,"[{'screen_name': 'TexasDFPS', 'name': 'Texas DFPS', 'id': '250710465'}]",,,,
1502501709834342401,1502501709834342401,2022-03-11 22:28:17 CST,2022-03-11,22:28:17,-0500,1242621820211212290,thecanesandboyz,mikey,,@OSjourney get that gun you have and do some man stufff cane! tough guy! PUSSY,en,[],[],[],1,0,0,[],[],https://twitter.com/thecanesandboyz/status/1502501709834342401,False,,0,,san antonio,,,,,,[],,,,
1502501672093986818,1502501672093986818,2022-03-11 22:28:08 CST,2022-03-11,22:28:08,-0500,1007788524379222016,memosamurai1,memosamurai,,When it’s okay to rule over women’s health and permit rape victims to continue to live with the memory of their attackers for the rest of their lives…. Way to go GOP. Way to show the people how you give a shit.,en,[],[],[],0,0,1,[],[],https://twitter.com/memosamurai1/status/1502501672093986818,False,https://twitter.com/stellablue9/status/1502451796639322113,0,,san antonio,,,,,,[],,,,
1502500740786540551,1496664838684262407,2022-03-11 22:24:26 CST,2022-03-11,22:24:26,-0500,423632195,sayitai24400765,SayItAintSo,,@SpiritedMusici1 @randapandaha11 @Hillary00060644 @CBSBigBrother Chile please you don't know what a racist comment is...cus we know you not black nor Hispanic.,en,[],[],[],1,0,0,[],[],https://twitter.com/SayItAi24400765/status/1502500740786540551,False,,0,,san antonio,,,,,,"[{'screen_name': 'SpiritedMusici1', 'name': 'SpiritedMusician', 'id': '1299048939858075648'}, {'screen_name': 'randapandaha11', 'name': 'Miranda Harmon', 'id': '2480466846'}, {'screen_name': 'Hillary00060644', 'name': 'Hillary Stewart', 'id': '1016452448846835712'}, {'screen_name': 'CBSBigBrother', 'name': 'Big Brother', 'id': '52791522'}]",,,,
1502500006502227970,1502492018496663555,2022-03-11 22:21:31 CST,2022-03-11,22:21:31,-0500,892510078074355713,champagnebrown6,Champagne Brown,,"@joshland A guy and some women were trying to snatch me up Tuesday, but they've been at this for sometime. He showed up Tuesday saying come outside, I see him parked but keep my distance, and notice a lady in driver seat... Also pics sent of him with gun sent to me.Police are involved now",en,[],[],[],1,0,0,[],[],https://twitter.com/ChampagneBrown6/status/1502500006502227970,False,,0,,san antonio,,,,,,"[{'screen_name': 'joshland', 'name': '⚡ White Boy Sumer 👑 ⚡️', 'id': '19100406'}]",,,,
1502499783553912835,1502401647829417984,2022-03-11 22:20:38 CST,2022-03-11,22:20:38,-0500,107230056,socal4life,SoCal Tony,,@AnonymousLRfan @Chris_Dascenzo What I’m saying is. There are players who have done things in life at times that might not be what others condone. I agree that Watson doesn’t look good in the public eye. Is he a pervert? Maybe. Tried getting happy endings? Maybe. But did he forcibly sexual assault them? 🤔,en,[],[],[],0,0,0,[],[],https://twitter.com/SoCal4Life/status/1502499783553912835,False,,0,,san antonio,,,,,,"[{'screen_name': 'AnonymousLRfan', 'name': 'Anonymous Raiders Fan', 'id': '1475198452246085634'}, {'screen_name': 'Chris_Dascenzo', 'name': ""Chris D'Ascenzo"", 'id': '55015693'}]",,,,
1502499695897321476,1502113342269243392,2022-03-11 22:20:17 CST,2022-03-11,22:20:17,-0500,1171682471538241536,samurai_antonio,🏯🧢⚔ San Antonio Samurai 🧢🏯⚔,,@LittleWingRae I believe in heirarchy.. Don't equate it to crime,en,[],[],[],0,0,0,[],[],https://twitter.com/samurai_antonio/status/1502499695897321476,False,,0,,san antonio,,,,,,"[{'screen_name': 'LittleWingRae', 'name': 'Earwig Hrothgarsen', 'id': '2814223411'}]",,,,
1502499574778413057,1502489611423174657,2022-03-11 22:19:48 CST,2022-03-11,22:19:48,-0500,3326636178,kris10sthoughts,Kristen in Black,,Okay so now she’s mad at Tony for killing her brother AND for wanting to turn himself in for that same murder???  Gotta say…this wouldn’t be an issue if she didn’t fall in love with some rando she just met. 🤷🏾‍♀️,en,[],[],[],1,0,0,[],[],https://twitter.com/kris10sthoughts/status/1502499574778413057,False,,0,,san antonio,,,,,,[],,,,
1502499261375729665,1502113342269243392,2022-03-11 22:18:33 CST,2022-03-11,22:18:33,-0500,1171682471538241536,samurai_antonio,🏯🧢⚔ San Antonio Samurai 🧢🏯⚔,,@LittleWingRae King pins are people who promote crime and have people do the crimes for them.  Big difference,en,[],[],[],0,0,0,[],[],https://twitter.com/samurai_antonio/status/1502499261375729665,False,,0,,san antonio,,,,,,"[{'screen_name': 'LittleWingRae', 'name': 'Earwig Hrothgarsen', 'id': '2814223411'}]",,,,
1502498859481772034,1502496951727796226,2022-03-11 22:16:57 CST,2022-03-11,22:16:57,-0500,1043755922,jaazlyyne,Jazlyne,,@luxurybalerion Hate crime,en,[],[],[],1,0,1,[],[],https://twitter.com/jaazlyyne/status/1502498859481772034,False,,0,,san antonio,,,,,,"[{'screen_name': 'luxurybalerion', 'name': 'balerion', 'id': '708916571821838338'}]",,,,
1502497958666854402,1502404709184847877,2022-03-11 22:13:23 CST,2022-03-11,22:13:23,-0500,1347544730545086464,hkp123248,Hkp,,@hatefulhermit1 Its so sad. Big reason why I dont even use this shit often anymore... People needa stop normalizing homophobia in HHT,en,[],[],[],0,0,2,[],[],https://twitter.com/Hkp123248/status/1502497958666854402,False,,0,,san antonio,,,,,,"[{'screen_name': 'hatefulhermit1', 'name': '🏳️\u200d🌈 The Hollow Is Abnormal 🏳️\u200d🌈🍴', 'id': '1382141910295400450'}]",,,,
1502497823237021696,1502497823237021696,2022-03-11 22:12:50 CST,2022-03-11,22:12:50,-0500,907635848342011905,phinsanity32,Ezekiel,,"Violence of any kind, especially domestic should be the harshest punishment of everything.",en,[],[],[],0,0,1,[],[],https://twitter.com/phinsanity32/status/1502497823237021696,False,https://twitter.com/theScore/status/1502497059357831169,0,,san antonio,,,,,,[],,,,
1502497770317484033,1502497770317484033,2022-03-11 22:12:38 CST,2022-03-11,22:12:38,-0500,1190845034473705472,ritzierchief,Darth Skittles 🇺🇦,,I wonder how racist I can be about Asians before people call me out for being asian,en,[],[],[],4,2,17,[],[],https://twitter.com/Ritzierchief/status/1502497770317484033,False,,0,,san antonio,,,,,,[],,,,
1502496738812186624,1502496738812186624,2022-03-11 22:08:32 CST,2022-03-11,22:08:32,-0500,3038314572,thadironbody,Thad Brandon Ironbody,,Being white is a crime now. Antifa must be stopped.    Middle Schoolers Face Hate Crime Charges After Attacking Students for Being White  #PatriotsUnite    https://t.co/XivbyYOfWu,en,[],['https://www.nbcmiami.com/news/local/students-arrested-on-hate-crime-charges-after-attack-in-coconut-creek/2710789/'],[],0,0,0,['patriotsunite'],[],https://twitter.com/thadironbody/status/1502496738812186624,False,,0,,san antonio,,,,,,[],,,,
1502496507014090754,1502479799335407623,2022-03-11 22:07:36 CST,2022-03-11,22:07:36,-0500,1329495365989625858,plongsticking,Pippy Longsticking,,"@cherdelaware Cher, please see this comment and listen.  In 2007 I accidentally injured a teammate in football practice. The next day someone asked me, “Are you gonna break any necks today?” I attempted to take my own life that year.   Luke probably feels like sh*t. Don’t make it worse. Please",en,[],[],[],0,0,10,[],[],https://twitter.com/PLongsticking/status/1502496507014090754,False,,0,,san antonio,,,,,,"[{'screen_name': 'cherdelaware', 'name': 'Cher', 'id': '27350909'}]",,,,
1502495462342991873,1502494013282299907,2022-03-11 22:03:27 CST,2022-03-11,22:03:27,-0500,1277730312244662272,teddithompsons1,Teddi (Teds) 🏳️‍🌈🏳️‍⚧️🇺🇦👭🪶🎷,,@angel_0f_deathx @GUN_Vanguard That’s my state 24/7/365.,en,[],[],[],1,0,7,[],[],https://twitter.com/TeddiThompsonS1/status/1502495462342991873,False,,0,,san antonio,,,,,,"[{'screen_name': 'angel_0f_deathx', 'name': 'death angel', 'id': '2830108242'}, {'screen_name': 'GUN_Vanguard', 'name': 'GUN_Vanguard, Juggernaut of Fuck It', 'id': '17444049'}]",,,,
1502495053649956864,1502495053649956864,2022-03-11 22:01:50 CST,2022-03-11,22:01:50,-0500,880627871596916738,nicolesamm_,sam⁷ gemini ᵕᴗᵕ,,COME ON SPURS ATTACK,en,[],[],[],0,0,0,[],[],https://twitter.com/nicolesamm_/status/1502495053649956864,False,,0,,san antonio,,,,,,[],,,,
1502494746555695107,1501600852917817352,2022-03-11 22:00:37 CST,2022-03-11,22:00:37,-0500,171880447,chrisoverland47,Chris Overland,,@JacobCharles_22 @BubbaWallace Do I think Kyle Larson is racist? No. Do I think he ended up in the 5 sooner rather than later because of what he said? Absolutely. Do I think he gained tons of fans from what he said despite being a phenomenal driver? Also yes.,en,[],[],[],0,0,0,[],[],https://twitter.com/ChrisOverland47/status/1502494746555695107,False,,0,,san antonio,,,,,,"[{'screen_name': 'JacobCharles_22', 'name': 'Jacob Antony', 'id': '1082743904791945216'}, {'screen_name': 'BubbaWallace', 'name': 'Bubba Wallace', 'id': '55457727'}]",,,,
1502494094882390016,1502494087399804934,2022-03-11 21:58:01 CST,2022-03-11,21:58:01,-0500,171880447,chrisoverland47,Chris Overland,,"Come to find out, Dominic was gay and told everyone we were dating while I was in ISS, came out and the homophobia was ridiculous. I sucker punch Nick for putting me in the situation, left and never came back. Rip oh well",en,[],[],[],0,0,0,[],[],https://twitter.com/ChrisOverland47/status/1502494094882390016,False,,0,,san antonio,,,,,,[],,,,
1502493098743681030,1502493098743681030,2022-03-11 21:54:04 CST,2022-03-11,21:54:04,-0500,21931173,geminiink,Gemini Ink,,"Join us for The Big Texas Read on Wed, 3/16. We’re reading &amp; discussing poet Mike Soto‘s collection A GRAVE IS GIVEN SUPPER, a Narco-Acid Western in poetic form, using themes from the ongoing drug war taking place in a fictional US/Mexico border town. RSVP  https://t.co/eCmgc7ZOzo  https://t.co/7qup6NycYE",en,[],['https://buff.ly/3e4W7F7'],['https://pbs.twimg.com/media/FNntgpIXEAI4aAG.jpg'],0,3,3,[],[],https://twitter.com/GeminiInk/status/1502493098743681030,False,,1,https://pbs.twimg.com/media/FNntgpIXEAI4aAG.jpg,san antonio,,,,,,[],,,,
1502492336659521539,1502492336659521539,2022-03-11 21:51:02 CST,2022-03-11,21:51:02,-0500,2649235405,alamocityhoops1,Alamo City Hoops,,"🚨6A State Semi🚨 📍Alamodome📍  @DuncanvilleBB 19  @AHS_Eagle_BBall 32   Halftime.   -Atascocita has 6 3’s to Dville’s 2.  -DVille has gone 5-11 from the FT line.  -DVille went 6-21 FG shooting 29%, Atascocita went 12-19 shooting 63%   #AlamoCityHoops #txhshoops",en,"[{'screen_name': 'duncanvillebb', 'name': 'duncanville bb', 'id': '2881361658'}, {'screen_name': 'ahs_eagle_bball', 'name': 'atascocitabasketball', 'id': '1013764082'}]",[],[],0,0,4,"['alamocityhoops', 'txhshoops']",[],https://twitter.com/AlamoCityHoops1/status/1502492336659521539,False,,0,,san antonio,,,,,,[],,,,
1502491958278828032,1502491958278828032,2022-03-11 21:49:32 CST,2022-03-11,21:49:32,-0500,880627871596916738,nicolesamm_,sam⁷ gemini ᵕᴗᵕ,,attack that paint guys,en,[],[],[],0,0,0,[],[],https://twitter.com/nicolesamm_/status/1502491958278828032,False,,0,,san antonio,,,,,,[],,,,
1502491900942721025,1502491900942721025,2022-03-11 21:49:18 CST,2022-03-11,21:49:18,-0500,4075241,sarahloyd,Sarah Loyd (she/her),,"Last night of #springbreakfoodietour and today's drive from New Orleans to Houston was kinda brutal, between traffic and weather. So we're enjoying some delivery sushi in our hotel room and taking it easy tonight!  https://t.co/ZRRSH6ARG2",en,[],[],['https://pbs.twimg.com/media/FNnsa_VWUAIuNPm.jpg'],0,0,2,['springbreakfoodietour'],[],https://twitter.com/sarahloyd/status/1502491900942721025,False,,1,https://pbs.twimg.com/media/FNnsa_VWUAIuNPm.jpg,san antonio,,,,,,[],,,,
1502491521744056321,1502491521744056321,2022-03-11 21:47:48 CST,2022-03-11,21:47:48,-0500,1439671038,casideedel23,Cass,,And they wonder why women are scared to speak? Because the case is either dismissed or the charges aren’t significant enough to fit the harsh crime.,en,[],[],[],0,0,1,[],[],https://twitter.com/CasideeDel23/status/1502491521744056321,False,https://twitter.com/ksatnews/status/1502489558855868423,0,,san antonio,,,,,,[],,,,
1502490527073198082,1502490527073198082,2022-03-11 21:43:51 CST,2022-03-11,21:43:51,-0500,1242621820211212290,thecanesandboyz,mikey,,"Nirvana - Rape Me (Live And Loud, Seattle / 1993)  https://t.co/8jqX6buell v@tbentley08 ia @YouTube",en,"[{'screen_name': 'youtube', 'name': 'youtube', 'id': '10228272'}]",['https://youtu.be/4TsqlT0rfJI'],[],1,0,1,[],[],https://twitter.com/thecanesandboyz/status/1502490527073198082,False,,0,,san antonio,,,,,,[],,,,
1502489630725259264,1502489628712001544,2022-03-11 21:40:17 CST,2022-03-11,21:40:17,-0500,892510078074355713,champagnebrown6,Champagne Brown,,"Then that's when I noticed gun, I feel he intentionally wanted me to see it,but idk he's dumb fuck anyways.",en,[],[],[],0,0,0,[],[],https://twitter.com/ChampagneBrown6/status/1502489630725259264,False,,0,,san antonio,,,,,,[],,,,
1502489628712001544,1502489628712001544,2022-03-11 21:40:17 CST,2022-03-11,21:40:17,-0500,892510078074355713,champagnebrown6,Champagne Brown,,"So I have not been in the best mood for days, police were finally called today, and they didn't even need to talk to the neighbor's because of text messages and photos with gun that  was more than enough evidence. Gurl in driver seat, but she did try to get out of the car, saw",en,[],[],[],1,0,0,[],[],https://twitter.com/ChampagneBrown6/status/1502489628712001544,False,,0,,san antonio,,,,,,[],,,,
1502489627122614274,1502489627122614274,2022-03-11 21:40:16 CST,2022-03-11,21:40:16,-0500,1160847148948365312,juki24k,*Juki💕,,"I be smiling on the inside, while having a anxiety attack at the same time",en,[],[],[],0,0,0,[],[],https://twitter.com/Juki24k/status/1502489627122614274,False,https://twitter.com/rexmainz/status/1502291687326076932,0,,san antonio,,,,,,[],,,,
1502489558855868423,1502489558855868423,2022-03-11 21:40:00 CST,2022-03-11,21:40:00,-0500,16425419,ksatnews,KSAT 12,,A grand jury has declined to indict Houston Texans quarterback Deshaun Watson following a police investigation sparked by lawsuits filed by 22 women who have accused him of harassment and sexual assault  https://t.co/kHhCSnO1hs,en,[],['https://www.ksat.com/news/2022/03/11/no-indictment-for-texans-qb-watson-over-sex-assault-claims/?utm_source=twitter&utm_medium=social&utm_campaign=snd&utm_content=ksat12'],[],0,1,3,[],[],https://twitter.com/ksatnews/status/1502489558855868423,False,,0,,san antonio,,,,,,[],,,,
1502489311270342657,1502489081011482625,2022-03-11 21:39:01 CST,2022-03-11,21:39:01,-0500,35631003,peti___,Jacob Brooks,,@TigeeDwayne Shooting the leather off the ball fr,en,[],[],[],0,0,1,[],[],https://twitter.com/Peti___/status/1502489311270342657,False,,0,,san antonio,,,,,,"[{'screen_name': 'TigeeDwayne', 'name': 'Coach Rideaux', 'id': '47740186'}]",,,,
1502489244216004612,1501968139000725505,2022-03-11 21:38:45 CST,2022-03-11,21:38:45,-0500,23897659,ingramjr,Jeffi got Pfizered,,@mojtviternalog @HillaryClinton A hospital damaged by NATO bombing designed to stop killings by Milosevic and other war criminals isn't the same as a hospital damaged in Putin's unprovoked attack on Ukraine. The two have nothing in common except they were both damaged by weapons of war.,en,[],[],[],1,0,0,[],[],https://twitter.com/ingramjr/status/1502489244216004612,False,,0,,san antonio,,,,,,"[{'screen_name': 'mojtviternalog', 'name': 'Давид Јовановић', 'id': '1196868789616418816'}, {'screen_name': 'HillaryClinton', 'name': 'Hillary Clinton', 'id': '1339835893'}]",,,,
1502489060497141760,1502489060497141760,2022-03-11 21:38:01 CST,2022-03-11,21:38:01,-0500,3366474136,aecothron,Dr. Annaliese Cothron she/her,,Remember that one time the state of Texas uncovered literal sex trafficking in our foster care system on the same day it tried to take more children away from loving parents and put them into foster care. #txlege,en,[],[],[],1,37,73,['txlege'],[],https://twitter.com/AECothron/status/1502489060497141760,False,https://twitter.com/kenpaxtontx/status/1502477644973101057,0,,san antonio,,,,,,[],,,,
1502488613334003716,1502488613334003716,2022-03-11 21:36:14 CST,2022-03-11,21:36:14,-0500,16752601,sarahkcarlson,Sarah Carlson,,"Disgusting. “An investigations supervisor at the Department of Family and Protective Services testified that abuse investigators had been told to prioritize cases involving the parents of transgender children and to investigate them without exception, after the governor’s order.”",en,[],[],[],0,2,2,[],[],https://twitter.com/sarahkcarlson/status/1502488613334003716,False,https://twitter.com/nytimes/status/1502433469909057538,0,,san antonio,,,,,,[],,,,
1502485597365153795,1502485597365153795,2022-03-11 21:24:15 CST,2022-03-11,21:24:15,-0500,807385804213514240,historianed_,Steve Arionus,,"Lonnie is so inconsistent. I wish he had a good drive to the basket game. On nights when he’s not shooting well, he has the athleticism to do what DeMar used to and get to the line any time he wants. He still prefers to pass it out instead of driving to score. #PorVida",en,[],[],[],0,0,1,['porvida'],[],https://twitter.com/historianed_/status/1502485597365153795,False,,0,,san antonio,,,,,,[],,,,
1502485056673259522,1502131008325443617,2022-03-11 21:22:06 CST,2022-03-11,21:22:06,-0500,23718846,meshabizz,Mesha Bizzell,,@happycrazytown @tedcruz You're a victim of propaganda,en,[],[],[],0,0,0,[],[],https://twitter.com/meshabizz/status/1502485056673259522,False,,0,,san antonio,,,,,,"[{'screen_name': 'happycrazytown', 'name': 'CAMPBIZZLE 🇺🇸❤🇺🇦', 'id': '2806946961'}, {'screen_name': 'tedcruz', 'name': 'Ted Cruz', 'id': '23022687'}]",,,,
1502483284768534533,1502483284768534533,2022-03-11 21:15:04 CST,2022-03-11,21:15:04,-0500,52047494,kabbfox29,KABB FOX 29,,"The Bexar County Grand Jury has indicted Krystal Rodriguez following a fatal shooting of her husband. On March 21, 2021, authorities accused Rodriguez of killing her husband, Jared Rodriguez, 40, in a domestic violence incident.  https://t.co/pc8SyxjGZA",en,[],['https://foxsanantonio.com/newsletter-daily/san-antonio-woman-indicted-in-fatal-shooting-of-husband'],[],1,0,1,[],[],https://twitter.com/KABBFOX29/status/1502483284768534533,False,,0,,san antonio,,,,,,[],,,,
1502483015750017030,1502483015750017030,2022-03-11 21:14:00 CST,2022-03-11,21:14:00,-0500,17194257,news4sa,News 4 San Antonio,,"On March 21, 2021, authorities accused Rodriguez of killing her husband, Jared Rodriguez, 40, in a domestic violence incident.  https://t.co/mrQZhCQNdC",en,[],['https://news4sanantonio.com/news/local/san-antonio-woman-indicted-in-fatal-shooting-of-husband'],[],0,0,4,[],[],https://twitter.com/News4SA/status/1502483015750017030,False,,0,,san antonio,,,,,,[],,,,
1502482503109599243,1502388042421526528,2022-03-11 21:11:58 CST,2022-03-11,21:11:58,-0500,936032961232809985,jamie_foxworthy,Jamie is Going to TFF!,,"@the_nerd_skull They don't care about child abuse. They only like using it as a weapon to try to destroy people they disapprove of. Because, remember, conservatives are the biggest predators out there.",en,[],[],[],0,1,8,[],[],https://twitter.com/Jamie_Foxworthy/status/1502482503109599243,False,,0,,san antonio,,,,,,"[{'screen_name': 'the_nerd_skull', 'name': 'The Nerdskull', 'id': '1288553498695483394'}]",,,,
1502482012955082756,1502401647829417984,2022-03-11 21:10:01 CST,2022-03-11,21:10:01,-0500,107230056,socal4life,SoCal Tony,,"@AnonymousLRfan @Chris_Dascenzo If you think he listens to what Biletnikoff advises, the Raiders wouldn’t have enough players to field a team. Drugs, domestic violence and accused sexual assault. I don’t condone the behavior but to call him a sexual predator is a bit too much. Unsubstantiated accusations.",en,[],[],[],1,0,0,[],[],https://twitter.com/SoCal4Life/status/1502482012955082756,False,,0,,san antonio,,,,,,"[{'screen_name': 'AnonymousLRfan', 'name': 'Anonymous Raiders Fan', 'id': '1475198452246085634'}, {'screen_name': 'Chris_Dascenzo', 'name': ""Chris D'Ascenzo"", 'id': '55015693'}]",,,,
1502481834537594881,1502481834537594881,2022-03-11 21:09:18 CST,2022-03-11,21:09:18,-0500,18371803,spurs,San Antonio Spurs,,LET'S GOOOOOOOOOOO!!!!  JRich went full ATTACK mode with this one 💪  https://t.co/5h9hPUsOif,en,[],[],[],5,42,381,[],[],https://twitter.com/spurs/status/1502481834537594881,False,,1,https://pbs.twimg.com/media/FNni0-JVgAEioMm.jpg,san antonio,,,,,,[],,,,
1502481318822789127,1502481318822789127,2022-03-11 21:07:15 CST,2022-03-11,21:07:15,-0500,892510078074355713,champagnebrown6,Champagne Brown,,"Traffickers are patient enough, until it turns to desperation then it becomes noticeable.  I thought I had a friend, when I told her last week, she was like how come you ain't tell me or get me. Tues guy shows up with a gun on his hip, her and husband been ghosted every since.  https://t.co/0GRSwOu5S5",en,[],[],['https://pbs.twimg.com/media/FNniy2oXEAgEIsQ.jpg'],1,0,0,[],[],https://twitter.com/ChampagneBrown6/status/1502481318822789127,False,,1,https://pbs.twimg.com/media/FNniy2oXEAgEIsQ.jpg,san antonio,,,,,,[],,,,
1502480843343900672,1502480843343900672,2022-03-11 21:05:22 CST,2022-03-11,21:05:22,-0500,1058596448651087872,kentweast,Kent Weast,,Everyone including Matt had to see that with the late hours in the gym just shooting…,en,[],[],[],0,0,2,[],[],https://twitter.com/KentWeast/status/1502480843343900672,False,https://twitter.com/I_am_PapaJohn/status/1502480572727316481,0,,san antonio,,,,,,[],,,,
1502479378420228102,1502479378420228102,2022-03-11 20:59:33 CST,2022-03-11,20:59:33,-0500,195790054,danweisspbp,Dan Weiss,,Jazz have missed their first 5 threes of the 2nd half and are now shooting below 40%,en,[],[],[],0,0,0,[],[],https://twitter.com/DanWeissPBP/status/1502479378420228102,False,https://twitter.com/danweisspbp/status/1502469831278346240,0,,san antonio,,,,,,[],,,,
1502478980447936512,1502331555104055300,2022-03-11 20:57:58 CST,2022-03-11,20:57:58,-0500,15670641,kmarvel,KarenMarvel,,@RilezTweetsEsq That’s just what we did. Finished a brutal trial at noon and we headed out.,en,[],[],[],0,0,2,[],[],https://twitter.com/kmarvel/status/1502478980447936512,False,,0,,san antonio,,,,,,"[{'screen_name': 'RilezTweetsEsq', 'name': 'Barred and Bearded', 'id': '233664559'}]",,,,
1502478929793277957,1502478929793277957,2022-03-11 20:57:46 CST,2022-03-11,20:57:46,-0500,1105263055045361664,binaleinchen,sabsi,,I feel like I've committed a crime  https://t.co/pHcEkat1VE,en,[],[],"['https://pbs.twimg.com/media/FNngm1DXEAARM_n.jpg', 'https://pbs.twimg.com/media/FNngngNX0AgRBNx.jpg']",0,0,0,[],[],https://twitter.com/binaleinchen/status/1502478929793277957,False,,1,https://pbs.twimg.com/media/FNngm1DXEAARM_n.jpg,san antonio,,,,,,[],,,,
1502478551651688449,1502416200109805573,2022-03-11 20:56:16 CST,2022-03-11,20:56:16,-0500,3171403062,donutoperator,Donut Operator 🍩,,@Breaking911 That guys name was Tommy Gun,en,[],[],[],10,3,252,[],[],https://twitter.com/DonutOperator/status/1502478551651688449,False,,0,,san antonio,,,,,,"[{'screen_name': 'Breaking911', 'name': 'Breaking911', 'id': '375721095'}]",,,,
1502478182523539456,1502478182523539456,2022-03-11 20:54:48 CST,2022-03-11,20:54:48,-0500,17180761,ybarrap,Paul,,"This also happened in Texas.  Anyone can carry a gun in the open, anywhere,  without training or a permit.  It's totally absurd.",en,[],[],[],2,7,10,[],[],https://twitter.com/ybarrap/status/1502478182523539456,False,https://twitter.com/lsarsour/status/1502471769470513155,0,,san antonio,,,,,,[],,,,
1502477591802187779,1502401647829417984,2022-03-11 20:52:27 CST,2022-03-11,20:52:27,-0500,107230056,socal4life,SoCal Tony,,@AnonymousLRfan @Chris_Dascenzo Big difference. He was accused. Not convicted. And Biletnikoff took a stance against domestic violence after his daughter was killed by her boyfriend. He helps those victims as well as provides substance abuse treatment for young women. Thought I should help you out.,en,[],[],[],1,0,0,[],[],https://twitter.com/SoCal4Life/status/1502477591802187779,False,,0,,san antonio,,,,,,"[{'screen_name': 'AnonymousLRfan', 'name': 'Anonymous Raiders Fan', 'id': '1475198452246085634'}, {'screen_name': 'Chris_Dascenzo', 'name': ""Chris D'Ascenzo"", 'id': '55015693'}]",,,,
