id,conversation_id,created_at,date,time,timezone,user_id,username,name,place,tweet,language,mentions,urls,photos,replies_count,retweets_count,likes_count,hashtags,cashtags,link,retweet,quote_url,video,thumbnail,near,geo,source,user_rt_id,user_rt,retweet_id,reply_to,retweet_date,translate,trans_src,trans_dest
1502719439086751747,1502719437237071878,2022-03-12 12:53:28 CST,2022-03-12,12:53:28,-0500,203759619,sephirothtx,Joshua Winters / sephiroth_tx 🏳️‍🌈,,This is also a violation of a judge ordered hault to the abuse of these trans children by the political tool @TexasDFPS   At this moment three things should happen. @KenPaxtonTX and @GovAbbott should be taken out of office and charged for #HateCrimes  against trans CHILDREN,en,"[{'screen_name': 'texasdfps', 'name': 'texas dfps', 'id': '250710465'}, {'screen_name': 'kenpaxtontx', 'name': 'attorney general ken paxton', 'id': '45840174'}, {'screen_name': 'govabbott', 'name': 'gov. greg abbott', 'id': '19291441'}]",[],[],1,0,0,['hatecrimes'],[],https://twitter.com/Sephirothtx/status/1502719439086751747,False,,0,,san antonio,,,,,,[],,,,
1502719425094500357,1502719425094500357,2022-03-12 12:53:24 CST,2022-03-12,12:53:24,-0500,886277318137659393,alvinthe1st,“J” the lyrical Veteran,,"Criticizing Government is a right under the Constitution. We’re not a fascist nation, yet. Sadly Right wing voters think that fascism will bring about the racist government they want. Read a history book. Hitler eliminated his supporters  in the SA before he dealt with the enemy.",en,[],[],[],0,0,0,[],[],https://twitter.com/Alvinthe1st/status/1502719425094500357,False,https://twitter.com/noliewithbtc/status/1502687995656380425,0,,san antonio,,,,,,[],,,,
1502719147414896642,1502719127953317893,2022-03-12 12:52:18 CST,2022-03-12,12:52:18,-0500,1378857811208208386,rights4swers,Rights4SexWorkers,,THIS IS GOD DAMN WORSE IN PERSON THIS IS WORSE THAN FUCKING HELP I'VE HAD MOTHERFUCKERS THAT HAVE BEEN ABUSING ME TELL ME THAT I'VE NEVER DONE THEM ANY WRONG BUT YET THEY STILL ABUSE THE FLIPPING FUCK OUT OF ME  AND YET I'M STILL SUPPOSED TO BE ASHAMED OF THEIR ABUSE,en,[],[],[],2,0,0,[],[],https://twitter.com/Rights4SWers/status/1502719147414896642,False,,0,,san antonio,,,,,,[],,,,
1502719138883686405,1502719127953317893,2022-03-12 12:52:16 CST,2022-03-12,12:52:16,-0500,1378857811208208386,rights4swers,Rights4SexWorkers,,I'M SO GOD DAMN SICK AND TIRED OF BEING MADE TO PROVE I'M A FUCKING VICTIM  I'M SO GOD DAMN SICK AND TIRED OF MY CREDIBILITY BEING QUESTIONED  WHEN IM A GODDAMN HUMAN TRAFFICKING VICTIM  I'M SO GOD DAMN SICK AND TIRED OF BEING ELECTRONIC BONDAGE OF THE GODDAMN IDENTITY THEFT,en,[],[],[],1,0,0,[],[],https://twitter.com/Rights4SWers/status/1502719138883686405,False,,0,,san antonio,,,,,,[],,,,
1502719136375451663,1502719127953317893,2022-03-12 12:52:15 CST,2022-03-12,12:52:15,-0500,1378857811208208386,rights4swers,Rights4SexWorkers,,Birth certificate getting the social security card because everybody kept stealing them THAT WAS KEEPING ME IN HUMAN TRAFFICKING  NOT BEING ABLE TO GO TO THE DOCTOR AND GET MEDICAL CARE BECAUSE OF FINANCIAL CONTROL OF CORROSIVE CONTROL,en,[],[],[],1,0,0,[],[],https://twitter.com/Rights4SWers/status/1502719136375451663,False,,0,,san antonio,,,,,,[],,,,
1502719134412546049,1502719127953317893,2022-03-12 12:52:15 CST,2022-03-12,12:52:15,-0500,1378857811208208386,rights4swers,Rights4SexWorkers,,BEING MADE FUN OF BECAUSE THEY WERE TAKEN FROM ME AND STOLEN.. THAT WAS PART OF TAKING ALL OF MY IDENTIFYING INFORMATION FOR ME SO THAT I CANNOT GET A JOB OR I CANNOT GET ANY KIND OF LIFE THAT'S PART OF HUMAN TRAFFICKING  AFTER 5 YEARS OF BEING HERE I JUST WAS ABLE TO GET MY,en,[],[],[],1,0,0,[],[],https://twitter.com/Rights4SWers/status/1502719134412546049,False,,0,,san antonio,,,,,,[],,,,
1502719127953317893,1502719127953317893,2022-03-12 12:52:13 CST,2022-03-12,12:52:13,-0500,1378857811208208386,rights4swers,Rights4SexWorkers,,"Ya know what I'm REALLY tired of being made ashamed of all the narcissistic abuse, the amount of satanic abuse the amount of stalking I'm tired of being made ashamed of being trapped in human trafficking and not being able to get out, I'm really tired of being discredited",en,[],[],[],1,0,0,[],[],https://twitter.com/Rights4SWers/status/1502719127953317893,False,,0,,san antonio,,,,,,[],,,,
1502718883223982081,1502718883223982081,2022-03-12 12:51:15 CST,2022-03-12,12:51:15,-0500,107620502,jjames12_,Justin,,It’s be a crime to leave A&amp;M out of the tournament,en,[],[],[],0,0,0,[],[],https://twitter.com/JJames12_/status/1502718883223982081,False,,0,,san antonio,,,,,,[],,,,
1502717593156730887,1502717593156730887,2022-03-12 12:46:08 CST,2022-03-12,12:46:08,-0500,23563628,alex_d_281,AlexD M̷x̶3̸,,"Ordered a couple Arduino boards, accessory kit and a tank tread assembly with motor. With the rise of crime in my area, thinking it would be cool to design a sort of digital dog that can identify intruders and either make a very loud noise ..",en,[],[],[],1,0,1,[],[],https://twitter.com/Alex_d_281/status/1502717593156730887,False,,0,,san antonio,,,,,,[],,,,
1502716731827142658,1502716731827142658,2022-03-12 12:42:42 CST,2022-03-12,12:42:42,-0500,825921009400299524,insure_ed,Edward Quisenberry,,"@GriffJenkins Griff should have pushed back on @BradSherman partisan attack on Trump. The two 1st year contexts are extremely different. No war w/ Russia against Ukraine in Trump years, &amp; Trump provided Ukraine w/ more than hats, unlike the Obama-Biden years before him. @FoxNews",en,"[{'screen_name': 'bradsherman', 'name': 'congressman brad sherman', 'id': '30216513'}, {'screen_name': 'foxnews', 'name': 'fox news', 'id': '1367531'}]",[],[],0,0,0,[],[],https://twitter.com/Insure_Ed/status/1502716731827142658,False,,0,,san antonio,,,,,,[],,,,
1502714220265283584,1502711818355191810,2022-03-12 12:32:43 CST,2022-03-12,12:32:43,-0500,937899468585828352,portarican_rt,Victor Ruiz -The Voice Of Rican-,,@AmyChous Exactly correct. I own a weapon. I want to know there is a law in place that prevents my neighbor with a history of violence from being able to carry a CONCEALED weapon without a license. (Texas),en,[],[],[],1,0,2,[],[],https://twitter.com/portarican_RT/status/1502714220265283584,False,,0,,san antonio,,,,,,"[{'screen_name': 'AmyChous', 'name': '(((🇺🇦🌻))) blue22🗳💙🗽💉', 'id': '1185042419764482050'}]",,,,
1502713164160458754,1502711818355191810,2022-03-12 12:28:32 CST,2022-03-12,12:28:32,-0500,937899468585828352,portarican_rt,Victor Ruiz -The Voice Of Rican-,,"-Second Amendment: They ALWAYS claim only the GOP wants the 2nd Amendment, but MANY Dems have served in the military and own a weapon. Wanting common sense regulations isnt a lack of support.",en,[],[],[],4,2,20,[],[],https://twitter.com/portarican_RT/status/1502713164160458754,False,,0,,san antonio,,,,,,[],,,,
1502710756051148802,1502710756051148802,2022-03-12 12:18:57 CST,2022-03-12,12:18:57,-0500,1013137577086464000,gal_judi,JudiProgressiveGal,,CNN Makes Outrageous Comment about Muslim Terrorist Taking Jewish Hostages - @IsraelVideos  https://t.co/QrHekYLG8z,en,"[{'screen_name': 'israelvideos', 'name': 'breaking news', 'id': '2601598453'}]",['https://www.israelunwired.com/cnn-makes-outrageous-comment-about-muslim-terrorist-taking-jewish-hostages/'],[],0,0,0,[],[],https://twitter.com/gal_judi/status/1502710756051148802,False,,0,,san antonio,,,,,,[],,,,
1502710091572817929,1502663957567336450,2022-03-12 12:16:19 CST,2022-03-12,12:16:19,-0500,1268376671381606402,thejovenpopo,TXCruz210,,"@TiffanyDCross Time out, America needs to grow a pair and attack Russia!",en,[],[],[],0,0,0,[],[],https://twitter.com/thejovenpopo/status/1502710091572817929,False,,0,,san antonio,,,,,,"[{'screen_name': 'TiffanyDCross', 'name': '@tiffanydcross', 'id': '200846651'}]",,,,
1502709996286525445,1502709996286525445,2022-03-12 12:15:56 CST,2022-03-12,12:15:56,-0500,432072191,iced_cofee,Gl⁰ria H⁰l3,,Been having toouch fun shooting the shit w these guys I forgot to use the restroom 😂😂,en,[],[],[],0,0,0,[],[],https://twitter.com/iced_cofee/status/1502709996286525445,False,,0,,san antonio,,,,,,[],,,,
1502709723216363531,1502661103981056009,2022-03-12 12:14:51 CST,2022-03-12,12:14:51,-0500,1169095814435807238,meeklo85,Danny Danger,,@andycomplains Are you gonna be in San Antonio Wednesday! I’ve missed you as ETID so now my only hope to see you is as the butcher Wednesday!!,en,[],[],[],0,0,1,[],[],https://twitter.com/meeklo85/status/1502709723216363531,False,,0,,san antonio,,,,,,"[{'screen_name': 'andycomplains', 'name': 'Bunkhouse Butch', 'id': '50789545'}]",,,,
1502707862119854081,1502707862119854081,2022-03-12 12:07:27 CST,2022-03-12,12:07:27,-0500,179673183,idraedu,IDRA,,"mi_castillo: At a time when the children of our state, country, &amp; world face seemingly insurmountable challenges: the existential threat of climate change, unending racial and gender violence, &amp; unnecessary world hunger; a book is not only a friend, but a lifeline.",en,[],[],[],0,0,1,[],[],https://twitter.com/IDRAedu/status/1502707862119854081,False,,0,,san antonio,,,,,,[],,,,
1502707785020198913,1502707785020198913,2022-03-12 12:07:09 CST,2022-03-12,12:07:09,-0500,179673183,idraedu,IDRA,,"mi_castillo: I am here today not only as an advocate but also as a mom of a 1.5 yr old born in a state that will target &amp; terrify the parents of transkiddos for simply loving their babies for the blessing they are, instead of targeting the child abuse in our TX foster care system",en,[],[],[],0,1,3,[],[],https://twitter.com/IDRAedu/status/1502707785020198913,False,,0,,san antonio,,,,,,[],,,,
1502707260811878406,1502411742026305536,2022-03-12 12:05:04 CST,2022-03-12,12:05:04,-0500,626603618,oneenergy12,defenderoftheforce,,"@JayTeeGeee @peepeefartbutt_ @FireBBplease @LOLCLT @Panthers You are right; people are allowed to have any opinion they want on someone's character, but there is nothing subjective about whether a person was convicted of a crime.",en,[],[],[],1,0,0,[],[],https://twitter.com/oneenergy12/status/1502707260811878406,False,,0,,san antonio,,,,,,"[{'screen_name': 'JayTeeGeee', 'name': '❄️Jeremy❄️', 'id': '57731111'}, {'screen_name': 'peepeefartbutt_', 'name': 'Maurice', 'id': '940025487665106944'}, {'screen_name': 'FireBBplease', 'name': 'Bob Vance', 'id': '1470519206387109891'}, {'screen_name': 'LOLCLT', 'name': 'LOL Charlotte', 'id': '2510377034'}, {'screen_name': 'Panthers', 'name': 'Carolina Panthers', 'id': '56443153'}]",,,,
1502705987144146944,1502705987144146944,2022-03-12 12:00:00 CST,2022-03-12,12:00:00,-0500,15342142,sacurrent,San Antonio Current,,"It was a busy news week, and the headlines ranged from bizarre crime stories to a piece about a local school earning big praise. #SanAntonio #SATX #SanAntonioTX #crime #schools #TexasMusic    https://t.co/uX1y5jOlk6",en,[],['https://www.sacurrent.com/sanantonio/keystone-school-abandoned-sapd-cruiser-the-top-10-headlines-in-san-antonio-this-week/Content?oid=28399445'],[],0,0,1,"['sanantonio', 'satx', 'sanantoniotx', 'crime', 'schools', 'texasmusic']",[],https://twitter.com/SAcurrent/status/1502705987144146944,False,,0,,san antonio,,,,,,[],,,,
1502705388419833856,1502705388419833856,2022-03-12 11:57:38 CST,2022-03-12,11:57:38,-0500,706909235230015488,bonglastrilla,Enrique Lastrilla,,"So if you call out a person’s IGNORANCE, you’re racist!!!  How???",en,[],[],[],0,0,1,[],[],https://twitter.com/Bonglastrilla/status/1502705388419833856,False,https://twitter.com/jennaellisesq/status/1502513523787808771,0,,san antonio,,,,,,[],,,,
1502705368392253447,1502705368392253447,2022-03-12 11:57:33 CST,2022-03-12,11:57:33,-0500,1850183588,ksalinas_25,Kat salinas🦥,,"If y’all like killer/murder documentaries, watch “worst roommate ever” on Netflix!",en,[],[],[],0,0,4,[],[],https://twitter.com/ksalinas_25/status/1502705368392253447,False,,0,,san antonio,,,,,,[],,,,
1502703825030766593,1502006557936021505,2022-03-12 11:51:25 CST,2022-03-12,11:51:25,-0500,37186507,robertt171,#PuckFutin,,"@DBolt20 @OdyseeTeam Well if Ukraine loses the war, prepare to bend over and be A$$ raped repeatedly by Putin’s totalitarianism. I know, some peeps actually look forward to rape. Might you be one of those?",en,[],[],[],1,0,0,[],[],https://twitter.com/Robertt171/status/1502703825030766593,False,,0,,san antonio,,,,,,"[{'screen_name': 'DBolt20', 'name': 'D.Bolt', 'id': '946539142497951749'}, {'screen_name': 'OdyseeTeam', 'name': 'odysee', 'id': '1280241715987660801'}]",,,,
1502703457454678024,1502510467851333636,2022-03-12 11:49:57 CST,2022-03-12,11:49:57,-0500,718769610,yeroc011,corey clark,,@jemelehill He wasn’t giving out jobs. He was giving hugs. Miss me with that racist shit until you giving out shit equally in all fronts.,en,[],[],[],0,0,0,[],[],https://twitter.com/yeroc011/status/1502703457454678024,False,,0,,san antonio,,,,,,"[{'screen_name': 'jemelehill', 'name': 'Jemele Hill', 'id': '35586563'}]",,,,
1502703448227291141,1502558167863017473,2022-03-12 11:49:55 CST,2022-03-12,11:49:55,-0500,1427323740392669187,jlawhorn1975,Jason Lawhorn,,"@general_ben Hmm let’s see, what weapon didn’t exist in 1940-41 that exists today?",en,[],[],[],0,0,0,[],[],https://twitter.com/jlawhorn1975/status/1502703448227291141,False,,0,,san antonio,,,,,,"[{'screen_name': 'general_ben', 'name': 'Ben Hodges', 'id': '1053324106148524032'}]",,,,
1502702844083847169,1502702844083847169,2022-03-12 11:47:31 CST,2022-03-12,11:47:31,-0500,61014484,saddamscribe,Sig Christenson 🏕,,Russia’s disinformation machinery breaks down in wake of Ukraine. How Putin lost it —&gt; What the Kremlin failed to anticipate is the invasion would be the equivalent of Putin screaming at our face in the street—a brief but violent jolt to our consciousness.  https://t.co/suRc8IWbjS,en,[],['https://apple.news/Ak-ptnpczTnaFkvP6cJsYlA'],[],0,0,0,[],[],https://twitter.com/saddamscribe/status/1502702844083847169,False,,0,,san antonio,,,,,,[],,,,
1502701261979848704,1502692213138018304,2022-03-12 11:41:14 CST,2022-03-12,11:41:14,-0500,1188333371103105024,edmundmakeath,Makeath,,@AntTennison Obviously they have different play styles but mj was the scoring leader for 7 years straight and 10 times in total… Bron might get his second this year cause he’s chasing Kareem by shooting a lot of threes,en,[],[],[],1,0,0,[],[],https://twitter.com/EdmundMakeath/status/1502701261979848704,False,,0,,san antonio,,,,,,"[{'screen_name': 'AntTennison', 'name': 'Anthony Tennison', 'id': '2152208978'}]",,,,
1502700219246460928,1502692350337855494,2022-03-12 11:37:05 CST,2022-03-12,11:37:05,-0500,756984697926725632,pstranges716,Peter,,"@ScottHech Police: Crime is out of control. Give us more money.   Also police: if you don’t give us more money, crime will be out of control.",en,[],[],[],4,36,158,[],[],https://twitter.com/pstranges716/status/1502700219246460928,False,,0,,san antonio,,,,,,"[{'screen_name': 'ScottHech', 'name': 'Scott Hechinger', 'id': '38354090'}]",,,,
1502699705188429828,1502679594905882634,2022-03-12 11:35:03 CST,2022-03-12,11:35:03,-0500,296228005,udtseals2,David Chan,,@joncoopertweets I'm glad he's no longer in office otherwise he would send our troops to help with his tyrant and dictator buddy Putin attack Ukraine,en,[],[],[],0,0,0,[],[],https://twitter.com/udtseals2/status/1502699705188429828,False,,0,,san antonio,,,,,,"[{'screen_name': 'joncoopertweets', 'name': 'Jon Cooper', 'id': '27493883'}]",,,,
1502699057021652997,1502655733636214788,2022-03-12 11:32:28 CST,2022-03-12,11:32:28,-0500,907635848342011905,phinsanity32,Ezekiel,,"@Hotstover @NMFins @DustFin13 @InchesNFL Has less to do with politics and more to do with morals and decency  I don't care of you are a republican or Democrat, but if you are hiding behind your politics and religion as a reason to hate and attack others then I don't want anything to do with you or anyone you support.",en,[],[],[],1,0,3,[],[],https://twitter.com/phinsanity32/status/1502699057021652997,False,,0,,san antonio,,,,,,"[{'screen_name': 'Hotstover', 'name': 'Let’s Go Mets! &🐬⬆️', 'id': '21880052'}, {'screen_name': 'NMFins', 'name': ""Seth 🐬 TVD '23"", 'id': '3938772794'}, {'screen_name': 'DustFin13', 'name': 'DUSTFIN 👀', 'id': '62932086'}, {'screen_name': 'InchesNFL', 'name': 'Vero McStaniel', 'id': '1304073854432743426'}]",,,,
1502698259604725760,1502658829191950342,2022-03-12 11:29:18 CST,2022-03-12,11:29:18,-0500,1438909640,pacothegreatest,Esai Herrera,,"@martinDouglas_ @endeavor54 @POTUS @VP You’d think that, but just like trying to show any crypto “maxi” proof that something doesn’t quite add up, the masses cling to every jumbled word this man says and treat it like the holy gospel  and if you disagree you must be a trump loving war mongering sexist/racist/whatever",en,[],[],[],0,0,2,[],[],https://twitter.com/Pacothegreatest/status/1502698259604725760,False,,0,,san antonio,,,,,,"[{'screen_name': 'martinDouglas_', 'name': 'ʍąɾէìղᎠօմցӀąʂ', 'id': '1445350039480639489'}, {'screen_name': 'endeavor54', 'name': 'Endeavor', 'id': '43412584'}, {'screen_name': 'POTUS', 'name': 'President Biden', 'id': '1349149096909668363'}, {'screen_name': 'VP', 'name': 'Vice President Kamala Harris', 'id': '803694179079458816'}]",,,,
1502697477606150145,1502697477606150145,2022-03-12 11:26:12 CST,2022-03-12,11:26:12,-0500,770115337266270208,thejesterprince,Evan,,Obviously harassment is bad but I think we can learn a lot about how to handle people talking mess about you from online trolls.  “You’re a loser Evan and aren’t ever going to go anywhere in life”  “This right here”,en,[],[],[],0,0,0,[],[],https://twitter.com/thejesterprince/status/1502697477606150145,False,https://twitter.com/AaronSeaney/status/1502446691487604736,0,,san antonio,,,,,,[],,,,
1502697464477978625,1502697464477978625,2022-03-12 11:26:08 CST,2022-03-12,11:26:08,-0500,237404587,alialexali1234,International Trading,,"Psaki won't say if Russian WMD attack in Ukraine is 'red line,' insists US won't send in troops  https://t.co/tCjMgXGTxi via @nypost",en,"[{'screen_name': 'nypost', 'name': 'new york post', 'id': '17469289'}]",['https://nypost.com/2022/03/10/white-house-says-us-trying-to-prevent-a-world-war-by-denying-ukraine-jets/?utm_source=twitter_sitebuttons&utm_medium=site%20buttons&utm_campaign=site%20buttons'],[],0,0,0,[],[],https://twitter.com/AliAlexAli1234/status/1502697464477978625,False,,0,,san antonio,,,,,,[],,,,
1502696859210551296,1502696859210551296,2022-03-12 11:23:44 CST,2022-03-12,11:23:44,-0500,237404587,alialexali1234,International Trading,,"Full-scale assault on Kyiv could be immanent, Ukrainian military says  https://t.co/p5ueq5j7Ax via @TheWeek",en,"[{'screen_name': 'theweek', 'name': 'the week', 'id': '16439471'}]",['https://theweek.com/russo-ukrainian-war/1011239/full-scale-assault-on-kyiv-could-be-immanent-ukrainian-military-says'],[],0,0,0,[],[],https://twitter.com/AliAlexAli1234/status/1502696859210551296,False,,0,,san antonio,,,,,,[],,,,
1502696638258819073,1502696638258819073,2022-03-12 11:22:51 CST,2022-03-12,11:22:51,-0500,1371910320357269504,aureleos,aureleo sans 🇨🇴 🏳️‍⚧️,,idk if this is my internalized homophobia or what but sometimes i wonder if my writing proclivities are too out there for mainstream audiences so i’ll pose a ?  would you be interested in reading a magical realist story about an indestructible anus?,en,[],[],[],0,4,5,[],[],https://twitter.com/aureleos/status/1502696638258819073,False,,0,,san antonio,,,,,,[],,,,
1502695721715351555,1502695721715351555,2022-03-12 11:19:13 CST,2022-03-12,11:19:13,-0500,1210574767,ti_tovell,Stone Fox ✌🏽💛☀️🌻,,This is so heartbreaking.. these girls thought they were in a “safe” place being finally rescued from sex trafficking.. only to be trafficked again by government child protective workers,en,[],[],[],0,0,0,[],[],https://twitter.com/Ti_Tovell/status/1502695721715351555,False,https://twitter.com/reeseoxner/status/1502074953365086210,0,,san antonio,,,,,,[],,,,
1502695488943886339,1502477816146935809,2022-03-12 11:18:17 CST,2022-03-12,11:18:17,-0500,1388121429019971584,chacar1177,ChaCar,,@inqdragon2 It's nothing fantastic but a personal feat. I'm terribly afraid of heights and small enclosed spaces. I took the elevator (packed) to the top of Sears Tower sky deck. I did it without having a major panic attack or crying. I was still trembling when we made it to ground level.  https://t.co/riAyq0FrKM,en,[],[],['https://pbs.twimg.com/tweet_video_thumb/FNqlk52XMAgVpta.jpg'],0,0,0,[],[],https://twitter.com/ChaCar1177/status/1502695488943886339,False,,1,https://pbs.twimg.com/tweet_video_thumb/FNqlk52XMAgVpta.jpg,san antonio,,,,,,"[{'screen_name': 'inqdragon2', 'name': 'Ann Koplow', 'id': '245013438'}]",,,,
1502695389622845441,1501958032527400964,2022-03-12 11:17:54 CST,2022-03-12,11:17:54,-0500,109230485,la_bentancourt,LeeAnn Bentancourt,,"@SpeakerPelosi But when it is an American saying ""You need to stop the abuse of your power!"" then you call it insertion, bulling and crazy. Why can't you see 🙈 you are being two faced? Your are not 🚫 a queen 👑.",en,[],[],[],0,0,0,[],[],https://twitter.com/LA_Bentancourt/status/1502695389622845441,False,,0,,san antonio,,,,,,"[{'screen_name': 'SpeakerPelosi', 'name': 'Nancy Pelosi', 'id': '15764644'}]",,,,
1502694748116688904,1502694640042004484,2022-03-12 11:15:21 CST,2022-03-12,11:15:21,-0500,852626199180222464,wamderingweapon,Eternal_Jack204,,@jifferey  https://t.co/WazjbC7Io9,und,[],[],['https://pbs.twimg.com/tweet_video_thumb/FNqk5_nX0AIuNf3.jpg'],0,0,15,[],[],https://twitter.com/WamderingWeapon/status/1502694748116688904,False,,1,https://pbs.twimg.com/tweet_video_thumb/FNqk5_nX0AIuNf3.jpg,san antonio,,,,,,[],,,,
1502694369979215877,1502693419596062722,2022-03-12 11:13:51 CST,2022-03-12,11:13:51,-0500,2376347299,zakman86,"Zak Whyte, Foiled Again",,"@JasonEAlt Racist and can't follow the rules, is anyone surprised?",en,[],[],[],1,0,1,[],[],https://twitter.com/Zakman86/status/1502694369979215877,False,,0,,san antonio,,,,,,"[{'screen_name': 'JasonEAlt', 'name': 'Jason Alt', 'id': '562329884'}]",,,,
1502692329538428937,1502692329538428937,2022-03-12 11:05:44 CST,2022-03-12,11:05:44,-0500,1124044084669288450,tonygonzales4tx,Tony Gonzales,,Russia imploding as we speak.  Russian spy chiefs ‘under house arrest’ as Putin blames them for Ukraine setbacks  https://t.co/UOLDbY0PWu,en,[],['https://www.independent.co.uk/news/world/europe/russian-spy-chiefs-putin-security-b2034350.html'],[],0,1,7,[],[],https://twitter.com/TonyGonzales4TX/status/1502692329538428937,False,,0,,san antonio,,,,,,[],,,,
1502691232493019141,1502690422556139526,2022-03-12 11:01:23 CST,2022-03-12,11:01:23,-0500,711722936802136064,zach__attack10,Zach Peterson,,@wshingtontoday I’m a Washington fan in TX…,en,[],[],[],1,0,7,[],[],https://twitter.com/zach__attack10/status/1502691232493019141,False,,0,,san antonio,,,,,,"[{'screen_name': 'wshingtontoday', 'name': 'Jordan Asri \uea00', 'id': '814980274043940868'}]",,,,
1502686804562042888,1502686804562042888,2022-03-12 10:43:47 CST,2022-03-12,10:43:47,-0500,34612598,stealhdz,Tyler Hernandez,,YOOOO @jk_rowling CHOSE VIOLENCE TODAY 😂😂😂,en,"[{'screen_name': 'jk_rowling', 'name': 'j.k. rowling', 'id': '62513246'}]",[],[],0,0,1,[],[],https://twitter.com/StealHdz/status/1502686804562042888,False,https://twitter.com/jk_rowling/status/1502675830249508865,0,,san antonio,,,,,,[],,,,
1502686062233231367,1502686062233231367,2022-03-12 10:40:50 CST,2022-03-12,10:40:50,-0500,2427359533,cryowhite,Johnthan Allen Carter,,"Journal ""A player shooting chickens for a Platinum Trophy!..."" on #Inkbunny  https://t.co/fWeTZQqnqb",en,[],['https://inkbunny.net/j/447800-Cryofreezer-a-player-shooting-chickens-for-a-platinum-trophy-'],[],0,0,0,['inkbunny'],[],https://twitter.com/Cryowhite/status/1502686062233231367,False,,0,,san antonio,,,,,,[],,,,
1502685595524603905,1502685595524603905,2022-03-12 10:38:59 CST,2022-03-12,10:38:59,-0500,38237031,hxmedina,Hector Medina,,18 GOP Senators Voted for Gun Control -  https://t.co/JsFBG1ovUe,en,[],['https://www.gunowners.org/na03112022/'],[],0,0,0,[],[],https://twitter.com/hxmedina/status/1502685595524603905,False,,0,,san antonio,,,,,,[],,,,
1502685126588784641,1502685126588784641,2022-03-12 10:37:07 CST,2022-03-12,10:37:07,-0500,826187484501594112,modsnapradio,ModSnap,,Massive Attack - Live With Me (With Terry Callier),en,[],[],[],0,0,0,[],[],https://twitter.com/modsnapradio/status/1502685126588784641,False,,0,,san antonio,,,,,,[],,,,
1502684677877940224,1502684677877940224,2022-03-12 10:35:20 CST,2022-03-12,10:35:20,-0500,868099249,nardisgunclub,Nardis Gun Club,,"Have you checked out the S&amp;W Shield 380 EZ? This gun is a fantastic option for self defense, &amp; is great for new shooters or anyone looking for an easy to operate firearm. Come in to any of our 3 locations to rent and test one out on the range today! #pewpew #SATX #SmithandWesson  https://t.co/us69B6lHK4",en,[],[],['https://pbs.twimg.com/media/FNqbv-aXwAEn4Mq.jpg'],0,0,0,"['pewpew', 'satx', 'smithandwesson']",[],https://twitter.com/NardisGunClub/status/1502684677877940224,False,,1,https://pbs.twimg.com/media/FNqbv-aXwAEn4Mq.jpg,san antonio,,,,,,[],,,,
1502681838170656774,1502612506589765634,2022-03-12 10:24:03 CST,2022-03-12,10:24:03,-0500,2452545620,banthefrontlawn,banthefrontlawn,,@bestoneTX Congratulations on reaching another year of life without falling prey to any number of bad things happening. COVID. Murder hornets. And worse. Happy birthday.,en,[],[],[],0,0,3,[],[],https://twitter.com/banthefrontlawn/status/1502681838170656774,False,,0,,san antonio,,,,,,"[{'screen_name': 'bestoneTX', 'name': 'Dr. Bryan Edward Stone', 'id': '1001346252'}]",,,,
