id,conversation_id,created_at,date,time,timezone,user_id,username,name,place,tweet,language,mentions,urls,photos,replies_count,retweets_count,likes_count,hashtags,cashtags,link,retweet,quote_url,video,thumbnail,near,geo,source,user_rt_id,user_rt,retweet_id,reply_to,retweet_date,translate,trans_src,trans_dest
1502846119109443584,1502765558013460482,2022-03-12 21:16:50 CST,2022-03-12,21:16:50,-0500,1441103577489948674,jovitapantry,Jovita Idár Free Pantry & Fridge,,"@kat_blaque Ironic misogyny, ESPECIALLY coming from a guy, is pretty much never helpful.",en,[],[],[],0,0,3,[],[],https://twitter.com/jovitapantry/status/1502846119109443584,False,,0,,san antonio,,,,,,"[{'screen_name': 'kat_blaque', 'name': 'Freaky Fishy', 'id': '1706101310'}]",,,,
1502845101957070849,1502838123474165774,2022-03-12 21:12:48 CST,2022-03-12,21:12:48,-0500,1378857811208208386,rights4swers,Rights4SexWorkers,,The only way that organized stalkers can do the things they do is by spying through your phone.   The only weapon they have to manipulate is spying through your devices. It's a big weapon but it's the only weapon. If they cannot fight through your devices they cannot manipulate,en,[],[],[],1,0,0,[],[],https://twitter.com/Rights4SWers/status/1502845101957070849,False,,0,,san antonio,,,,,,[],,,,
1502844444466364431,1502839110674927623,2022-03-12 21:10:11 CST,2022-03-12,21:10:11,-0500,1329495365989625858,plongsticking,Pippy Longsticking,,@KimIversenShow Why on earth would Iran just randomly start shooting missiles at a consulate office? Makes no sense.,en,[],[],[],1,0,0,[],[],https://twitter.com/PLongsticking/status/1502844444466364431,False,,0,,san antonio,,,,,,"[{'screen_name': 'KimIversenShow', 'name': 'Kim Iversen', 'id': '1426227719470157827'}]",,,,
1502843194660241409,1502843194660241409,2022-03-12 21:05:13 CST,2022-03-12,21:05:13,-0500,379287498,blueprint_j,Shifu🌊,,"When I hear 👂 the @SixFlags fireworks in the distance, I feel as if we’re being attack.",en,"[{'screen_name': 'sixflags', 'name': 'six flags', 'id': '25369216'}]",[],[],0,0,0,[],[],https://twitter.com/Blueprint_j/status/1502843194660241409,False,,0,,san antonio,,,,,,[],,,,
1502843082483642370,1502843082483642370,2022-03-12 21:04:46 CST,2022-03-12,21:04:46,-0500,1154504867152617498,awesomereesee,Awesomereesee 🇺🇦,,"Please tell me I am the only one who thinks The Critical Drinker is a bit of a hypocrite for complaining about ""bad lessons"" in modern films when his Ryan Drake series has the same ""woman gets stronger because she suffered abuse and r*pe"" shit from Game Of Thrones",en,[],[],[],0,0,1,[],[],https://twitter.com/awesomereesee/status/1502843082483642370,False,,0,,san antonio,,,,,,[],,,,
1502839290828673026,1502823496975589376,2022-03-12 20:49:42 CST,2022-03-12,20:49:42,-0500,2373825134,scarntage,Logan,,@cartelofvibes Self racist imo,en,[],[],[],0,0,0,[],[],https://twitter.com/Scarntage/status/1502839290828673026,False,,0,,san antonio,,,,,,"[{'screen_name': 'cartelofvibes', 'name': 'ᴠɪʙᴇꜱ ᴄᴀʀᴛᴇʟ💫', 'id': '1392968405150486531'}]",,,,
1502837564960563208,1502837468923678727,2022-03-12 20:42:51 CST,2022-03-12,20:42:51,-0500,1022311823477858304,maleekgs30,Maleek 💙,,@susan1234456789 Everyone appreciate klays shooting,en,[],[],[],0,0,2,[],[],https://twitter.com/MaleekGS30/status/1502837564960563208,False,,0,,san antonio,,,,,,"[{'screen_name': 'susan1234456789', 'name': 'ANA_WESTGOAT#0 💎', 'id': '1240784996958457856'}]",,,,
1502836282908622852,1502836282908622852,2022-03-12 20:37:45 CST,2022-03-12,20:37:45,-0500,624112241,blakjordanbreen,schwan humes,,"some of yall should take 5-7 shots less a game, watch how your efficiency goes up along w/ur pt  yall are shooting yourselves off the floor",en,[],[],[],1,0,1,[],[],https://twitter.com/blakjordanbreen/status/1502836282908622852,False,,0,,san antonio,,,,,,[],,,,
1502836226436612102,1502836226436612102,2022-03-12 20:37:32 CST,2022-03-12,20:37:32,-0500,52047494,kabbfox29,KABB FOX 29,,"According to investigators, evidence at the scene showed the driver of a Honda Element struck the right side of the motorcycle, causing the victim to be ejected from the bike.  https://t.co/oB3p0RuSXA",en,[],['https://foxsanantonio.com/news/local/motorcyclist-dies-in-north-side-car-crash-saturday-morning-san-antonio-driver-honda-harley-davidson'],[],0,0,0,[],[],https://twitter.com/KABBFOX29/status/1502836226436612102,False,,0,,san antonio,,,,,,[],,,,
1502835875964764167,1502835875964764167,2022-03-12 20:36:08 CST,2022-03-12,20:36:08,-0500,17194257,news4sa,News 4 San Antonio,,"JUST IN: According to investigators, evidence at the scene showed the driver of a Honda Element struck the right side of the motorcycle, causing the victim to be ejected from the bike.  https://t.co/Zp4zLSGV5X",en,[],['https://news4sanantonio.com/news/local/motorcyclist-dies-in-north-side-car-crash-saturday-morning-san-antonio-driver-honda-harley-davidson'],[],0,0,1,[],[],https://twitter.com/News4SA/status/1502835875964764167,False,,0,,san antonio,,,,,,[],,,,
1502835459696828417,1502835046008463361,2022-03-12 20:34:29 CST,2022-03-12,20:34:29,-0500,1281391883734876161,gregory_strauss,🕹🕹Metal Man 🕹🕹,,@JazzGaming101 Rambo shooting hearts nice,en,[],[],[],1,0,1,[],[],https://twitter.com/gregory_strauss/status/1502835459696828417,False,,0,,san antonio,,,,,,"[{'screen_name': 'JazzGaming101', 'name': 'ᒍᗩᘔᘔ (✿◠‿◠)', 'id': '954051591438561280'}]",,,,
1502834674820952066,1502701727543406602,2022-03-12 20:31:22 CST,2022-03-12,20:31:22,-0500,1456044884104814601,jmercado765jose,jose_mercado,,@BAMBOOMRAP @bluntandaux u still supporting ur boy the culture vulture racist @gothamhiphop who has been called out numerous times about being a racist? all u kkk mfs got that #blacklivesmatter on the top of ur profiles. that's the new kkk hood? some things never change. kkk is still alive on twitter,en,"[{'screen_name': 'gothamhiphop', 'name': 'joey', 'id': '1370022968651259904'}]",[],[],0,0,0,['blacklivesmatter'],[],https://twitter.com/Jmercado765Jose/status/1502834674820952066,False,,0,,san antonio,,,,,,"[{'screen_name': 'BAMBOOMRAP', 'name': 'BAM. RAP 🏂', 'id': '1171396946667474945'}, {'screen_name': 'bluntandaux', 'name': 'BLUNT & AUX (pass em) 🖤🕊️', 'id': '1078140888499585024'}]",,,,
1502834328220454913,1502834328220454913,2022-03-12 20:29:59 CST,2022-03-12,20:29:59,-0500,751857720,mcfarland_shawn,Shawn McFarland,,"Caldwell, an Ole Miss signee, was named 4A state championship game MVP after scoring 20 points on 4-for-8 shooting for Faith Family.   @SportsDayHS  https://t.co/SvJdIZ5iQS",en,"[{'screen_name': 'sportsdayhs', 'name': 'sportsdayhs', 'id': '17294956'}]",[],['https://pbs.twimg.com/media/FNsj2MrVIAEfgXQ.jpg'],0,6,23,[],[],https://twitter.com/McFarland_Shawn/status/1502834328220454913,False,https://twitter.com/mcfarland_shawn/status/1502833232131366914,1,https://pbs.twimg.com/media/FNsj2MrVIAEfgXQ.jpg,san antonio,,,,,,[],,,,
1502833310862565383,1502768767482351623,2022-03-12 20:25:57 CST,2022-03-12,20:25:57,-0500,1368020064,sasouthsports,Mike Considine,,@WorldofIsaac He tweeted that he forgot about being injured as the game went on. I look forward to seeing Hoggard and Christie develop as leaders next year.,en,[],[],[],0,0,0,[],[],https://twitter.com/SASouthSports/status/1502833310862565383,False,,0,,san antonio,,,,,,"[{'screen_name': 'WorldofIsaac', 'name': 'Isaac', 'id': '57328888'}]",,,,
1502830943236759554,1502830943236759554,2022-03-12 20:16:32 CST,2022-03-12,20:16:32,-0500,1498004554004287490,david685902872,David,,I hear all the guns were given to civilians. Understandably so. But to use a dead Russia’s gun is karmic,en,[],[],[],0,0,0,[],[],https://twitter.com/David685902872/status/1502830943236759554,False,,0,,san antonio,,,,,,[],,,,
1502829274998489089,1502829274998489089,2022-03-12 20:09:55 CST,2022-03-12,20:09:55,-0500,13323862,expressnews,San Antonio Express-News,,"Your Turn, March 13: Founding Fathers would understand need for gun regulation.  https://t.co/64M9laF4U5",en,[],['https://trib.al/ehOWcDf'],[],0,0,0,[],[],https://twitter.com/ExpressNews/status/1502829274998489089,False,,0,,san antonio,,,,,,[],,,,
1502829055707684865,1502701727543406602,2022-03-12 20:09:02 CST,2022-03-12,20:09:02,-0500,1456044884104814601,jmercado765jose,jose_mercado,,@BAMBOOMRAP @bluntandaux huh? ur embarrassing urself. u sound like that culture vulture racist @gothamhiphop   https://t.co/Cdjro02glv,en,"[{'screen_name': 'gothamhiphop', 'name': 'joey', 'id': '1370022968651259904'}]",['https://www.youtube.com/watch?v=vrzSFgjBM80'],[],1,0,2,[],[],https://twitter.com/Jmercado765Jose/status/1502829055707684865,False,,0,,san antonio,,,,,,"[{'screen_name': 'BAMBOOMRAP', 'name': 'BAM. RAP 🏂', 'id': '1171396946667474945'}, {'screen_name': 'bluntandaux', 'name': 'BLUNT & AUX (pass em) 🖤🕊️', 'id': '1078140888499585024'}]",,,,
1502828294118559746,1502828294118559746,2022-03-12 20:06:01 CST,2022-03-12,20:06:01,-0500,127762274,steph_in_texas,San Antonio Stephanie,,Driving home and a fox ran out in front of my car...and all I could think was  F-O-X 🦊 #IYKYK   PS...the fox was not injured.  https://t.co/bYOMg27eYM,en,[],[],['https://pbs.twimg.com/tweet_video_thumb/FNseXSKXIAUeoRG.jpg'],0,0,0,['iykyk'],[],https://twitter.com/Steph_In_Texas/status/1502828294118559746,False,,1,https://pbs.twimg.com/tweet_video_thumb/FNseXSKXIAUeoRG.jpg,san antonio,,,,,,[],,,,
1502826490215415815,1502818972038746113,2022-03-12 19:58:51 CST,2022-03-12,19:58:51,-0500,981404424642940928,jendialtoo,Bizy Eve,,"@JohnSmi05612180 @Snofox6 The news is still coming out. Now it’s an airbase in Iraq. As usual, we get the news in bits and it changes on a dime. Understandable. They’re blaming it on an Israeli attack on their generals, but then why hit the US? Believe after we verify, yes?",en,[],[],[],0,0,2,[],[],https://twitter.com/jendialtoo/status/1502826490215415815,False,,0,,san antonio,,,,,,"[{'screen_name': 'JohnSmi05612180', 'name': 'John Smith', 'id': '1482057052021219332'}, {'screen_name': 'Snofox6', 'name': '~TnT~', 'id': '1412219326854316035'}]",,,,
1502826156625645572,1502816994760011784,2022-03-12 19:57:31 CST,2022-03-12,19:57:31,-0500,1344496685108617217,gstkerl,Alex Gustke,,@PigRL_ idk you too well so nothing brutal but you seem mad chill homie,en,[],[],[],1,0,1,[],[],https://twitter.com/gstkeRL/status/1502826156625645572,False,,0,,san antonio,,,,,,"[{'screen_name': 'PigRL_', 'name': '🅿️ig lft', 'id': '1084686895135637504'}]",,,,
1502825916040417281,1502811398262476800,2022-03-12 19:56:34 CST,2022-03-12,19:56:34,-0500,1400469006008598530,jamesreid316,James,,@ElevatdElephant @EndGameWW3 In my honest opinion as a veteran it doesn’t matter. If we don’t respond with force it will just be open season on America. By no means do I want violence. But we didn’t ask for this. Don’t come knocking on our door if you don’t want the bad man to answer.,en,[],[],[],1,0,0,[],[],https://twitter.com/JamesReid316/status/1502825916040417281,False,,0,,san antonio,,,,,,"[{'screen_name': 'ElevatdElephant', 'name': 'Elevated Elephant', 'id': '80532194'}, {'screen_name': 'EndGameWW3', 'name': 'EndGameWW3 🇺🇸', 'id': '32792712'}]",,,,
1502825089972195333,1502803862683627521,2022-03-12 19:53:17 CST,2022-03-12,19:53:17,-0500,29747246,pablodurissimo,Paul Hardy,,@StarlaD14 @KyivIndependent Indeed!  It is possible they were ordered back to make preparations for an assault on Kiev…,en,[],[],[],0,0,2,[],[],https://twitter.com/PabloDurissimo/status/1502825089972195333,False,,0,,san antonio,,,,,,"[{'screen_name': 'StarlaD14', 'name': 'StarlaD😷🐈☕💙🌊🌟⚱', 'id': '1025446910218227712'}, {'screen_name': 'KyivIndependent', 'name': 'The Kyiv Independent', 'id': '1462548977367359490'}]",,,,
1502824513733545992,1502824513733545992,2022-03-12 19:50:59 CST,2022-03-12,19:50:59,-0500,9197982,lafifah,Dr. Habiba Noor,,Banning books. White-washing history. Electronic monitoring of teachers. This is the @RonDeSantisFL censorship &amp; surveillance state agenda. Help us put an end to this dangerous assault on freedom.  https://t.co/aeETMtxohF,en,"[{'screen_name': 'rondesantisfl', 'name': 'ron desantis', 'id': '487297085'}]",['https://wereadthebill.com'],[],0,0,1,[],[],https://twitter.com/lafifah/status/1502824513733545992,False,,0,,san antonio,,,,,,[],,,,
1502824389695447049,1502824389695447049,2022-03-12 19:50:30 CST,2022-03-12,19:50:30,-0500,966996265,ventifuenti,killua,,I will not be paying higher taxes because some men in tights and a ballerina with a gun wanna destroy downtown.,en,[],[],[],0,0,0,[],[],https://twitter.com/VentiFuenti/status/1502824389695447049,False,https://twitter.com/codeinefridge/status/1502695843933011970,0,,san antonio,,,,,,[],,,,
1502823933992701959,1502823933992701959,2022-03-12 19:48:41 CST,2022-03-12,19:48:41,-0500,1501493067433586688,freeukr65927291,Free Ukraine🇺🇦🌻,,If you can't stand the nonsense on Twitter maybe you shouldn't be here I just had a baby have five texts deleted because I called him the biggest twit on Twitter and told him he was almost as big a baby as Trump he boohooed and had tweets removed that had nada to do with violence,en,[],[],[],0,0,0,[],[],https://twitter.com/FreeUkr65927291/status/1502823933992701959,False,,0,,san antonio,,,,,,[],,,,
1502823850534440963,1502823850534440963,2022-03-12 19:48:21 CST,2022-03-12,19:48:21,-0500,1378857811208208386,rights4swers,Rights4SexWorkers,,You know this hits close to home because this is it's everywhere.. AND IT'S SO UGLY THAT I MYSELF BEING A VICTIM CANNOT EVEN I HAVE TO TURN AWAY BUT YET IS SOMETHING THAT CAN'T BE IGNORED ANYMORE.   THE TRUTH IS NOT PRETTY IT'S VERY UGLY I'M LIVING IN THAT UGLY,en,[],[],[],1,0,1,[],[],https://twitter.com/Rights4SWers/status/1502823850534440963,False,https://twitter.com/UVivy/status/1502622567726780420,0,,san antonio,,,,,,[],,,,
1502823225046319113,1502823225046319113,2022-03-12 19:45:52 CST,2022-03-12,19:45:52,-0500,832107584467275776,paulydeathwish,"Paul “Deathwish” Etheredge, MBA",,"Guess he had a leg up on those shopping at full-price stores.  @StevePieczenik  @RobSchneider  @rustyrockets   Elderly Brooklyn dismemberment suspect shopped at 99 Cent store with victim’s leg in tow, NYPD says  https://t.co/iAWEmRfxVO",en,"[{'screen_name': 'stevepieczenik', 'name': 'steve pieczenik', 'id': '801962070'}, {'screen_name': 'robschneider', 'name': 'rob schneider', 'id': '90552683'}, {'screen_name': 'rustyrockets', 'name': 'russell brand', 'id': '19562228'}]",['https://news.yahoo.com/elderly-brooklyn-dismemberment-suspect-shopped-020400637.html'],[],0,0,0,[],[],https://twitter.com/PaulyDeathwish/status/1502823225046319113,False,,0,,san antonio,,,,,,[],,,,
1502822665282859008,1502822665282859008,2022-03-12 19:43:39 CST,2022-03-12,19:43:39,-0500,465264998,frankyburrito,FrankySpurrito,,VASSELL IS NOW WANTED FOR MURDER,en,[],[],[],0,0,0,[],[],https://twitter.com/Frankyburrito/status/1502822665282859008,False,,0,,san antonio,,,,,,[],,,,
1502822542008107012,1502822542008107012,2022-03-12 19:43:09 CST,2022-03-12,19:43:09,-0500,832107584467275776,paulydeathwish,"Paul “Deathwish” Etheredge, MBA",,"That ain’t how it works, false-flagging, fake-hate-crime-concocting, Trump-supporter-impugning little bitch!  Jussie Smollett’s lawyers request protective custody for actor in jail  https://t.co/AKBULuIob6 via @ http://twitter.com/ubnews/",en,[],['https://www.union-bulletin.com/news/national/jussie-smollett-s-lawyers-request-protective-custody-for-actor-in-jail/article_765a9985-d0c5-5962-9335-f17b8c2b78d4.html?utm_medium=social&utm_source=twitter&utm_campaign=user-share'],[],0,0,0,[],[],https://twitter.com/PaulyDeathwish/status/1502822542008107012,False,,0,,san antonio,,,,,,[],,,,
1502822405772820490,1502822404191670273,2022-03-12 19:42:37 CST,2022-03-12,19:42:37,-0500,1378857811208208386,rights4swers,Rights4SexWorkers,,Abuse to be like handed over into human trafficking right off the bat that kind of shocked the shit out of me the other day when it hit me I was literally handed over into human trafficking on purpose.   I'M NOT FOR SALE I'M NOT TO BE GIVING AWAY I'M NOBODY'S PROPERTY BUT MY OWN,en,[],[],[],1,0,0,[],[],https://twitter.com/Rights4SWers/status/1502822405772820490,False,,0,,san antonio,,,,,,[],,,,
1502822404191670273,1502822404191670273,2022-03-12 19:42:36 CST,2022-03-12,19:42:36,-0500,1378857811208208386,rights4swers,Rights4SexWorkers,,I had complex PTSD even before moving to San Antonio and then everybody played on that just because more complex PTSD. After a total of 8 years abuse from the narcissistic child that had wanted to kill me only to turn around and mid to San Antonio to do with all this satanic,en,[],[],[],1,0,0,[],[],https://twitter.com/Rights4SWers/status/1502822404191670273,False,https://twitter.com/recovering_fam/status/1502730300270563332,0,,san antonio,,,,,,[],,,,
1502821250162384900,1502821250162384900,2022-03-12 19:38:01 CST,2022-03-12,19:38:01,-0500,1244249486924414976,chachhhhiiiiiii,chachi,,"i got cyber bullied HARD. i also had hundreds of dm requests and half of them were censored by ig. men went from my tiktok, found my ig, then felt the need to dm me vulgar and violent things… off of videos that i was appreciating things men do. make it make sense.",en,[],[],[],0,0,0,[],[],https://twitter.com/chachhhhiiiiiii/status/1502821250162384900,False,,0,,san antonio,,,,,,[],,,,
1502820917826789389,1502820917826789389,2022-03-12 19:36:42 CST,2022-03-12,19:36:42,-0500,17194257,news4sa,News 4 San Antonio,,"An employee tried stopping the suspects, but was confronted by one of the suspects. The man attempted to use a stun gun on the loss prevention officer several times before fleeing the business.  https://t.co/qzp3oMPsWX",en,[],['https://news4sanantonio.com/news/local/crime-stoppers-seek-suspects-in-connection-to-home-depot-aggravated-robbery-crime-san-antonio-bexar-business-guns'],[],1,1,2,[],[],https://twitter.com/News4SA/status/1502820917826789389,False,,0,,san antonio,,,,,,[],,,,
1502820378254659594,1502642625551216640,2022-03-12 19:34:33 CST,2022-03-12,19:34:33,-0500,19108310,chrisacorbett,Chris,,@3m0t1onal @joerogan I’d be curious how he tried to defend himself from being so brutal to peaceful protestors.,en,[],[],[],0,0,0,[],[],https://twitter.com/chrisacorbett/status/1502820378254659594,False,,0,,san antonio,,,,,,"[{'screen_name': '3m0t1onal', 'name': '🇨🇦EmOtIoNaL DaMaGe🇨🇦', 'id': '1001061562772209664'}, {'screen_name': 'joerogan', 'name': 'Joe Rogan', 'id': '18208354'}]",,,,
1502820183966162945,1502483551736020994,2022-03-12 19:33:47 CST,2022-03-12,19:33:47,-0500,835907299801710592,ismail07a,Ismail,,@cyb3ryas 🥺❤️ My homophobia 📉📉📉📉📉 My homosexuality 📈📈📈📈📈,en,[],[],[],0,0,0,[],[],https://twitter.com/Ismail07a/status/1502820183966162945,False,,0,,san antonio,,,,,,"[{'screen_name': 'cyb3ryas', 'name': '💐', 'id': '1493034931945197575'}]",,,,
1502819980626350080,1502819980626350080,2022-03-12 19:32:59 CST,2022-03-12,19:32:59,-0500,1378857811208208386,rights4swers,Rights4SexWorkers,,There's never any excuse for any kind of abuse  https://t.co/2ieq9hnHGm,en,[],[],['https://pbs.twimg.com/media/FNsWzw1XEAYcQpx.jpg'],0,3,5,[],[],https://twitter.com/Rights4SWers/status/1502819980626350080,False,https://twitter.com/nomoreassaults/status/1502618447653572616,1,https://pbs.twimg.com/media/FNsWzw1XEAYcQpx.jpg,san antonio,,,,,,[],,,,
1502819950775390212,1502816994760011784,2022-03-12 19:32:51 CST,2022-03-12,19:32:51,-0500,1344496685108617217,gstkerl,Alex Gustke,,"@CarBallMatt hey man, we’ve only interacted a few times but you pretty cool nothing brutal to say you just seem like a cool guy",en,[],[],[],1,0,0,[],[],https://twitter.com/gstkeRL/status/1502819950775390212,False,,0,,san antonio,,,,,,"[{'screen_name': 'CarBallMatt', 'name': 'matt @ LAN', 'id': '4874660099'}]",,,,
1502819510352556041,1502819510352556041,2022-03-12 19:31:06 CST,2022-03-12,19:31:06,-0500,237404587,alialexali1234,International Trading,,Rocket attack strike hits Erbil  https://t.co/UzTtKvZgks via @TheNationalNews,sv,"[{'screen_name': 'thenationalnews', 'name': 'the national', 'id': '20583993'}]",['https://www.thenationalnews.com/mena/2022/03/12/rocket-attack-confirmed-in-erbil/'],[],0,0,0,[],[],https://twitter.com/AliAlexAli1234/status/1502819510352556041,False,,0,,san antonio,,,,,,[],,,,
1502819458494119939,1502654917122605060,2022-03-12 19:30:54 CST,2022-03-12,19:30:54,-0500,846726228551876611,thomastypo,thomas,,@renjingles the endgame scaling problem seems exaggerated by the weapon meta. sorceries and bleed outdamage everything so much nothing else seems viable.,en,[],[],[],0,0,2,[],[],https://twitter.com/thomastypo/status/1502819458494119939,False,,0,,san antonio,,,,,,"[{'screen_name': 'renjingles', 'name': 'Rhodan', 'id': '1136540852631851008'}]",,,,
1502819072614014977,1502819057933950977,2022-03-12 19:29:22 CST,2022-03-12,19:29:22,-0500,2829008855,elohprojects,Eloh,,"13/24 Further, why shouldn’t you have a plan of attack?  Are the gaps unworthy of your work?  Are you indispensable because you make pictures?  Or are you just not that into liberty?",en,[],[],[],1,0,7,[],[],https://twitter.com/elohprojects/status/1502819072614014977,False,,0,,san antonio,,,,,,[],,,,
1502819013252034560,1502819013252034560,2022-03-12 19:29:08 CST,2022-03-12,19:29:08,-0500,358864071,the_real_jcal,JCal 💯,,Just got to the Eastside and heard some gun shots already,en,[],[],[],0,0,0,[],[],https://twitter.com/The_Real_JCal/status/1502819013252034560,False,,0,,san antonio,,,,,,[],,,,
1502818315055636486,1502818315055636486,2022-03-12 19:26:21 CST,2022-03-12,19:26:21,-0500,477471388,joeyprocell2,Joey Procell 🇺🇦🇺🇦🇺🇦,,These two guys @DustinPoirier and @DANGER_Caged are definitely from my home state and are without a doubt my fav fighters  https://t.co/7vmb9O1wQd,en,"[{'screen_name': 'dustinpoirier', 'name': 'the diamond', 'id': '45342709'}, {'screen_name': 'danger_caged', 'name': 'matt schnell', 'id': '353298912'}]",[],['https://pbs.twimg.com/media/FNsVQybVgAQZ-U2.jpg'],0,0,0,[],[],https://twitter.com/JoeyProcell2/status/1502818315055636486,False,,1,https://pbs.twimg.com/media/FNsVQybVgAQZ-U2.jpg,san antonio,,,,,,[],,,,
1502817375753846788,1502817375753846788,2022-03-12 19:22:38 CST,2022-03-12,19:22:38,-0500,3244826269,jadaiyuki,Chris Anguiano,,Ripping armor in Apex with a single clip of any weapon is free serotonin.,en,[],[],[],0,0,5,[],[],https://twitter.com/jadaiyuki/status/1502817375753846788,False,,0,,san antonio,,,,,,[],,,,
1502817367591632898,1502814628488884226,2022-03-12 19:22:36 CST,2022-03-12,19:22:36,-0500,224750526,thesquirrelyq,"Lonnie Walker, on the block",,@Sharpdiesel3 KU Remy’s all grown up 😭 Shooting shots and everything,en,[],[],[],1,0,0,[],[],https://twitter.com/TheSquirrelyq/status/1502817367591632898,False,,0,,san antonio,,,,,,"[{'screen_name': 'Sharpdiesel3', 'name': 'Strawhat Sharpdiesel', 'id': '3308804754'}]",,,,
1502815902613614601,1502814826338394117,2022-03-12 19:16:46 CST,2022-03-12,19:16:46,-0500,736668860904923136,deedee_belmares,DeeDee Belmares 🌎✌️🏖🌹,,"In 2008, Melissa Lucio was sentenced to death in Texas for the murder of her 2-year old daughter Mariah, who died two days after a tragic fall down a flight of stairs. In shock and grieving the loss of her baby,Ms. Lucio was taken into police custody and immediately blamed for",en,[],[],[],1,2,2,[],[],https://twitter.com/deedee_belmares/status/1502815902613614601,False,,0,,san antonio,,,,,,[],,,,
1502814580652888065,1502814580652888065,2022-03-12 19:11:31 CST,2022-03-12,19:11:31,-0500,993184856900325377,partznz,Izzy Enri,,Jesus that was brutal #UFCVegas50,en,[],[],[],0,0,0,['ufcvegas50'],[],https://twitter.com/Partznz/status/1502814580652888065,False,,0,,san antonio,,,,,,[],,,,
1502814187541733378,1502808447233974274,2022-03-12 19:09:57 CST,2022-03-12,19:09:57,-0500,317873764,charlesdunn2,Charles Dunn,,"@TTUmbbinsider Turn overs, poor foul shooting and no answer for McCormick. He has dominated inside. Can’t blame the refs.",en,[],[],[],2,0,2,[],[],https://twitter.com/CharlesDunn2/status/1502814187541733378,False,,0,,san antonio,,,,,,"[{'screen_name': 'TTUmbbinsider', 'name': 'Texas Tech Hoops Insider', 'id': '1025928777740836864'}]",,,,
1502810271449972736,1502766456538218498,2022-03-12 18:54:24 CST,2022-03-12,18:54:24,-0500,630588115,imjoeepstein,Joe Epstein,,"@AdamDeats @amodf It always has been in soulsborne, difference here is you can finally just jump then heavy attack instead of doing the finicky old flick-stick-with-R2 move",en,[],[],[],2,0,2,[],[],https://twitter.com/imjoeepstein/status/1502810271449972736,False,,0,,san antonio,,,,,,"[{'screen_name': 'AdamDeats', 'name': 'Adam Deats', 'id': '560802227'}, {'screen_name': 'amodf', 'name': 'Logan Sharp', 'id': '82392489'}]",,,,
1502808499805429763,1502808499805429763,2022-03-12 18:47:21 CST,2022-03-12,18:47:21,-0500,1154475092,rickyreyes01,Underground Assassin,,"Tomorrow morning off to South Texas!💪 Texas Wrestling Entertainment, Live Event!! #StrongStyleLucha #MainEventer #ProWrestling #wrestling #TexasTakeOver #luchalibre #Rudo  https://t.co/iKaWcKdG8G",en,[],[],['https://pbs.twimg.com/media/FNsMXcIVUAQi2Ui.jpg'],0,1,2,"['strongstylelucha', 'maineventer', 'prowrestling', 'wrestling', 'texastakeover', 'luchalibre', 'rudo']",[],https://twitter.com/RickyReyes01/status/1502808499805429763,False,,1,https://pbs.twimg.com/media/FNsMXcIVUAQi2Ui.jpg,san antonio,,,,,,[],,,,
