id,conversation_id,created_at,date,time,timezone,user_id,username,name,place,tweet,language,mentions,urls,photos,replies_count,retweets_count,likes_count,hashtags,cashtags,link,retweet,quote_url,video,thumbnail,near,geo,source,user_rt_id,user_rt,retweet_id,reply_to,retweet_date,translate,trans_src,trans_dest
1503031345274101762,1503010373238202372,2022-03-13 10:32:52 CDT,2022-03-13,10:32:52,-0500,1104144990211588096,georgeforder3,George Forder,,"@rbm3313 Attempted deep passes at a low rate, but was the most accurate QB in the NFL when he did. That tells me the pieces around him prevented them from going deep as much as they would have liked, which makes sense when you factor in the o-line struggles and lack of weapon-depth.",en,[],[],[],0,0,0,[],[],https://twitter.com/GeorgeForder3/status/1503031345274101762,False,,0,,san antonio,,,,,,"[{'screen_name': 'rbm3313', 'name': 'NJ Phins Fan', 'id': '1212201475'}]",,,,
1503031189879369729,1503031189879369729,2022-03-13 10:32:15 CDT,2022-03-13,10:32:15,-0500,117969987,craigdmorrison,Craig Morrison 🇺🇲 🇨🇦 🇧🇾 🇮🇪,,"Hey @GregAbbott_TX, what a miserable job you're doing protecting children and women from rape and sex trafficking. You promised you would make this stop, yet it continues under your very nose. #PromisesMadePromisesForgotten #AbbottFailedTexasAgain   https://t.co/kBGSkc39cC",en,"[{'screen_name': 'gregabbott_tx', 'name': 'greg abbott', 'id': '90651198'}]",['https://www.washingtonpost.com/nation/2022/03/11/foster-care-sex-trafficking/'],[],0,0,0,"['promisesmadepromisesforgotten', 'abbottfailedtexasagain']",[],https://twitter.com/CraigDMorrison/status/1503031189879369729,False,,0,,san antonio,,,,,,[],,,,
1503030178171265028,1503030178171265028,2022-03-13 10:28:14 CDT,2022-03-13,10:28:14,-0500,17194257,news4sa,News 4 San Antonio,,"James Brenden Rood, 24, was arrested for stealing a car and Bexar County Sheriff's (BCSO) Deputies say he was wearing body armor and had a 9mm gun in his pocket at the time. 📷: Bexar County Sheriff's Office MORE:  https://t.co/O6vRaXtNmI  https://t.co/GKdkZzR5oK",en,[],['https://bit.ly/3MLyPWj'],['https://pbs.twimg.com/media/FNvV-PLXEAIpe63.jpg'],1,0,1,[],[],https://twitter.com/News4SA/status/1503030178171265028,False,,1,https://pbs.twimg.com/media/FNvV-PLXEAIpe63.jpg,san antonio,,,,,,[],,,,
1503028710810820620,1502039672591159298,2022-03-13 10:22:24 CDT,2022-03-13,10:22:24,-0500,39045945,scar210,Scar Natal🇺🇦,,"@MotherSquid @Chrissy64375373 @ShaneWinsten @RonDeSantisFL Republicans are obsessed w/sex bc they're raised 2fear non-hetero sex that's not4 breeding or male pleasure. Like all abuse, this fear is passed on2 future gens. This policy is 2otherize &amp; criminalize the mere discussion of forms of sexuality they decide are ""sins"".",en,[],[],[],0,0,0,[],[],https://twitter.com/scar210/status/1503028710810820620,False,,0,,san antonio,,,,,,"[{'screen_name': 'MotherSquid', 'name': 'Sharon Thompson', 'id': '168392491'}, {'screen_name': 'Chrissy64375373', 'name': 'ChrissyM', 'id': '1394350043579228160'}, {'screen_name': 'ShaneWinsten', 'name': 'Shane Winsten', 'id': '1166854431570366469'}, {'screen_name': 'RonDeSantisFL', 'name': 'Ron DeSantis', 'id': '487297085'}]",,,,
1503028032025640960,1503028032025640960,2022-03-13 10:19:42 CDT,2022-03-13,10:19:42,-0500,892510078074355713,champagnebrown6,Champagne Brown,,"FBI, page! I know you watching, you see human trafficking. Y'all made it to the big leagues, had I not been 40 and just some girl in her teens or early twenties I probably would have been an easy snatch up. Human trafficking is slavery..BLACK LIVES MATTER😂  https://t.co/JzIk5C05op",en,[],[],['https://pbs.twimg.com/media/FNvT9LYXsAIB0Df.jpg'],0,0,1,[],[],https://twitter.com/ChampagneBrown6/status/1503028032025640960,False,,1,https://pbs.twimg.com/media/FNvT9LYXsAIB0Df.jpg,san antonio,,,,,,[],,,,
1503025897607241729,1503025278519427073,2022-03-13 10:11:13 CDT,2022-03-13,10:11:13,-0500,961747501,snake_born_,Michael Chrysaor (cm ellis),,"@mishacollins @NPR We must take sides. Neutrality helps the oppressor,never the victim.Silence encourages the tormentor,never the tormented.Sometimes we must interfere. When human lives are endangered, when human dignity is in jeopardy,national borders and sensitivities become irrelevant""E.Wiesel",en,[],[],[],0,0,9,[],[],https://twitter.com/Snake_Born_/status/1503025897607241729,False,,0,,san antonio,,,,,,"[{'screen_name': 'mishacollins', 'name': 'Misha Collins', 'id': '39689218'}, {'screen_name': 'NPR', 'name': 'NPR', 'id': '5392522'}]",,,,
1503025373877092354,1503020233770115078,2022-03-13 10:09:08 CDT,2022-03-13,10:09:08,-0500,56154664,cgstefko,Caroline Stefko,,"@samvuchenich Oh haha, I guess that was some subtle shade towards y’all 😛. You’re right though. They both hurt in different ways.  Yeah me too, we really can’t afford for Williams to be out. Simon is not my favorite but with Naz injured we really need her too.",en,[],[],[],0,0,0,[],[],https://twitter.com/cgstefko/status/1503025373877092354,False,,0,,san antonio,,,,,,"[{'screen_name': 'samvuchenich', 'name': 'Sam Vuchenich', 'id': '382504032'}]",,,,
1503025198525788162,1503025198525788162,2022-03-13 10:08:26 CDT,2022-03-13,10:08:26,-0500,4019317822,poppafossil,Poppa Fossil ❌❌❌,,#TrumpRally The reason that members of the 81 million club(both legal &amp; otherwise) who voted for Biden attack Trump is due to their unique frustration at Biden’s actions but their ego prevents them to admit their folly so they therefore attack Trump to vent!,en,[],[],[],4,0,1,['trumprally'],[],https://twitter.com/PoppaFossil/status/1503025198525788162,False,,0,,san antonio,,,,,,[],,,,
1503024911664787463,1503024911664787463,2022-03-13 10:07:18 CDT,2022-03-13,10:07:18,-0500,1501493067433586688,freeukr65927291,Free Ukraine🇺🇦🌻,,Russians are shooting their own injured soldiers and those they think may be wanting to escape they chained a man to his posts so he wouldn't run away as he shot grenades all night he froze to death,en,[],[],[],0,0,0,[],[],https://twitter.com/FreeUkr65927291/status/1503024911664787463,False,https://twitter.com/SayaniAnis/status/1502874994698821632,0,,san antonio,,,,,,[],,,,
1503024497653428225,1502988797260308480,2022-03-13 10:05:39 CDT,2022-03-13,10:05:39,-0500,2273120552,mellie252,Melissa 🇺🇸,,@GodBodyGordon @TheQuartering Let me dumb this down for ya... Heckling = words  Words ≠ violence,en,[],[],[],0,0,2,[],[],https://twitter.com/mellie252/status/1503024497653428225,False,,0,,san antonio,,,,,,"[{'screen_name': 'GodBodyGordon', 'name': 'GodBodyGordon', 'id': '1334276915667079170'}, {'screen_name': 'TheQuartering', 'name': 'TheQuartering', 'id': '880602945632575488'}]",,,,
1503024385761894400,1502992471881564161,2022-03-13 10:05:13 CDT,2022-03-13,10:05:13,-0500,406018425,ij14_,Irving,,"@UtdBrunoJr @soumyacristiano @FabrizioRomano If he deserved that, then arrest 2 league goal man for terrorism",en,[],[],[],1,0,1,[],[],https://twitter.com/IJ14_/status/1503024385761894400,False,,0,,san antonio,,,,,,"[{'screen_name': 'UtdBrunoJr', 'name': 'AJ', 'id': '1335327298426339328'}, {'screen_name': 'soumyacristiano', 'name': 'soumya', 'id': '884041980841533440'}, {'screen_name': 'FabrizioRomano', 'name': 'Fabrizio Romano', 'id': '330262748'}]",,,,
1503022235879100418,1503022235879100418,2022-03-13 09:56:40 CDT,2022-03-13,09:56:40,-0500,52047494,kabbfox29,KABB FOX 29,,"When police arrived, they found a victim in his late 40s with a gunshot wound. He was taken to to a nearby hospital where he died from his injuries.   https://t.co/Z7yD4G2ayI",en,[],['https://foxsanantonio.com/news/local/man-found-dead-from-gunshot-wound-san-antonio-texas-leon-valley-shooting-weapon-gun'],[],0,0,0,[],[],https://twitter.com/KABBFOX29/status/1503022235879100418,False,,0,,san antonio,,,,,,[],,,,
1503022235812040704,1503021312519942151,2022-03-13 09:56:40 CDT,2022-03-13,09:56:40,-0500,96172093,mburgosmd,"Mónica I. Burgos, MD",,@ArielisPrz Me encanta! jaja no tengo Netflij' pero eso he visto y he escuchado! Jajaja yo no paro de escuchar Crime podcasts el que ve mi Spotify searches pensara' lo peor JAJAJA. Morbid es mi favorito.,es,[],[],[],1,0,0,[],[],https://twitter.com/mburgosmd/status/1503022235812040704,False,,0,,san antonio,,,,,,"[{'screen_name': 'ArielisPrz', 'name': 'Arielis Pérez', 'id': '108131468'}]",,,,
1503022096330407938,1503022096330407938,2022-03-13 09:56:07 CDT,2022-03-13,09:56:07,-0500,1501493067433586688,freeukr65927291,Free Ukraine🇺🇦🌻,,Where does this idiotic quite supremacist get off talking about anybody's humanitarian needs? Separating children from their parents at the border was this evil monster's idea and he pushed it really he's no better than Putin,en,[],[],[],0,0,0,[],[],https://twitter.com/FreeUkr65927291/status/1503022096330407938,False,https://twitter.com/RonFilipkowski/status/1503013590420398082,0,,san antonio,,,,,,[],,,,
1503021956186218500,1503016224426536963,2022-03-13 09:55:33 CDT,2022-03-13,09:55:33,-0500,56154664,cgstefko,Caroline Stefko,,@DustinDietz18 She’s been MVP of the season since Kit Graham got injured. And pretty incredible when you consider that she’s been with club since the pre-WSL days.,en,[],[],[],1,0,2,[],[],https://twitter.com/cgstefko/status/1503021956186218500,False,,0,,san antonio,,,,,,"[{'screen_name': 'DustinDietz18', 'name': 'Dustin Dietz', 'id': '223733124'}]",,,,
1503021632167632899,1503008084767215622,2022-03-13 09:54:16 CDT,2022-03-13,09:54:16,-0500,765511120723468288,1reddragon696,Bob Garcia🔄,,"@curmudgeon44039 @Lindsay68365003 I can get into that. I only live a 10-hour drive from N'Orleans but Louisiana is just so Racist and Corrupt that I'm no longer willing to spend money in the state. Otherwise, I would love their 24-Hour Bars, Casinos and, of course, Mardi Gras.",en,[],[],[],0,0,1,[],[],https://twitter.com/1reddragon696/status/1503021632167632899,False,,0,,san antonio,,,,,,"[{'screen_name': 'curmudgeon44039', 'name': 'Steve', 'id': '1495452470327316486'}, {'screen_name': 'Lindsay68365003', 'name': 'Lindsay Houston 🌻🇺🇦', 'id': '1313944235452891144'}]",,,,
1503021413304778753,1503021413304778753,2022-03-13 09:53:24 CDT,2022-03-13,09:53:24,-0500,17194257,news4sa,News 4 San Antonio,,"When police arrived, they found a victim in his late 40s with a gunshot wound. He was taken to to a nearby hospital where he died from his injuries.  https://t.co/TCmt2h1fKT",en,[],['https://news4sanantonio.com/news/local/man-found-dead-from-gunshot-wound-san-antonio-texas-leon-valley-shooting-weapon-gun'],[],0,1,1,[],[],https://twitter.com/News4SA/status/1503021413304778753,False,,0,,san antonio,,,,,,[],,,,
1503021015026352138,1503021015026352138,2022-03-13 09:51:49 CDT,2022-03-13,09:51:49,-0500,46326721,kens5,KENS 5,,"BREAKING NEWS: Brent Renaud, who worked for the New York Times in the past, was killed and another journalist was injured near Kyiv, Ukrainian police said.  https://t.co/j4FInX05b6",en,[],['https://www.kens5.com/article/news/nation-world/ukraine/journalist-brent-renaud-killed-in-ukraine-authorities-say/507-567bd5b4-4832-4589-918b-9b07c72cce54'],[],0,2,5,[],[],https://twitter.com/KENS5/status/1503021015026352138,False,,0,,san antonio,,,,,,[],,,,
1503020555947159556,1502647561785597961,2022-03-13 09:49:59 CDT,2022-03-13,09:49:59,-0500,805615146471223296,tspawen,Trevor Ott,,@RealKurtAngle In a single match I would say you Kurt. No one could sell an injured leg like Bret. I would want it to be a submission match with a section of amateur wrestling thrown in. Than you target his leg to soften it up for the ankle lock. He sells that the rest of the match and you win.,en,[],[],[],0,0,0,[],[],https://twitter.com/tspawen/status/1503020555947159556,False,,0,,san antonio,,,,,,"[{'screen_name': 'RealKurtAngle', 'name': 'Kurt Angle', 'id': '111199728'}]",,,,
1503020435251859462,1502778071941730305,2022-03-13 09:49:31 CDT,2022-03-13,09:49:31,-0500,43156119,izrael75xx,israel rojas,,@samanthamarika1 I complain about that sonofabitch all the time. I think the whole Biden crime family should do the right thing and give themselves up to Putin but then we are left with Kamala. 🙄,en,[],[],[],0,0,0,[],[],https://twitter.com/izrael75xx/status/1503020435251859462,False,,0,,san antonio,,,,,,"[{'screen_name': 'samanthamarika1', 'name': 'samanthamarika', 'id': '1006474869570093056'}]",,,,
1503019635163209728,1503019635163209728,2022-03-13 09:46:20 CDT,2022-03-13,09:46:20,-0500,826187484501594112,modsnapradio,ModSnap,,Device - Hanging On A Heart Attack,en,[],[],[],0,0,0,[],[],https://twitter.com/modsnapradio/status/1503019635163209728,False,,0,,san antonio,,,,,,[],,,,
1503019252177068032,1503019252177068032,2022-03-13 09:44:49 CDT,2022-03-13,09:44:49,-0500,60933523,jarrickbrown,JARlamagne Tha God,,When you are in a fight - your best weapon is giving your battle to the Lord!,en,[],[],[],0,0,0,[],[],https://twitter.com/JarrickBrown/status/1503019252177068032,False,,0,,san antonio,,,,,,[],,,,
1503018339219738630,1502673870117081091,2022-03-13 09:41:11 CDT,2022-03-13,09:41:11,-0500,1573382210,nbn426,Neil Newman,,@DrScottHadland That was intense - antisemitism and homophobia. Shocking that someone who writes such awful words thinks that he is a victim ?,en,[],[],[],0,0,0,[],[],https://twitter.com/nbn426/status/1503018339219738630,False,,0,,san antonio,,,,,,"[{'screen_name': 'DrScottHadland', 'name': 'Scott Hadland, MD', 'id': '454086883'}]",,,,
1503018049204535297,1503018049204535297,2022-03-13 09:40:02 CDT,2022-03-13,09:40:02,-0500,209641062,mail_gun,Mailgun by Sinch,,How can you master the art of inboxing?   ✔️ Focus on list hygiene ✔️ Use proper authentication practices ✔️ Track reputation status  View our checklist! 📝↓  https://t.co/BUgGN8F7aR  #EmailGeeks #EmailLists #EmailList,en,[],['https://fal.cn/3mTFL'],[],0,0,0,"['emailgeeks', 'emaillists', 'emaillist']",[],https://twitter.com/Mail_Gun/status/1503018049204535297,False,,0,,san antonio,,,,,,[],,,,
1503015863343067140,1503015863343067140,2022-03-13 09:31:21 CDT,2022-03-13,09:31:21,-0500,1313241970211540992,chefmade_92,Chris.,,"Fellas if you’ve been a victim of this tactic, then your are entitled to compensation",en,[],[],[],0,3,5,[],[],https://twitter.com/chefmade_92/status/1503015863343067140,False,https://twitter.com/aadrianna__/status/1502482526388080641,0,,san antonio,,,,,,[],,,,
1503014784161169413,1502883889194414080,2022-03-13 09:27:03 CDT,2022-03-13,09:27:03,-0500,701398916,missionortho,Mission Orthodontics,,"@chambleebrandel @jjkilleentcu Simple, flip the tee and green. Brutal north wind makes it downwind and water only front/left of new “green”",en,[],[],[],0,0,0,[],[],https://twitter.com/missionortho/status/1503014784161169413,False,,0,,san antonio,,,,,,"[{'screen_name': 'chambleebrandel', 'name': 'Brandel Chamblee', 'id': '223008427'}, {'screen_name': 'jjkilleentcu', 'name': 'West Texas Driving Range Pro', 'id': '372250408'}]",,,,
1503013244444856324,1503013244444856324,2022-03-13 09:20:56 CDT,2022-03-13,09:20:56,-0500,115259540,heididm08,Heidi Langston,,#RussianArmy You aren't shooting Nazis. You're murdering innocent civilians. #PutinIsaWarCriminal #PutinHitler #StandWithUkraine,en,[],[],[],0,3,3,"['russianarmy', 'putinisawarcriminal', 'putinhitler', 'standwithukraine']",[],https://twitter.com/heididm08/status/1503013244444856324,False,,0,,san antonio,,,,,,[],,,,
1503012542481895425,1503012542481895425,2022-03-13 09:18:09 CDT,2022-03-13,09:18:09,-0500,1431964122900533250,allexxandraa__,Alex,,My kids woke up and chose violence 🤧,en,[],[],[],0,0,0,[],[],https://twitter.com/allexxandraa__/status/1503012542481895425,False,,0,,san antonio,,,,,,[],,,,
1503011638974337025,1503011638974337025,2022-03-13 09:14:33 CDT,2022-03-13,09:14:33,-0500,2852396118,jakeisfunny1,Jake Yarbrough,,"People ask me if there are racist in Texas, and I answer, ""Yes, they are called Texans and hate anyone not from there."" #Texans #Texas #comedy",en,[],[],[],0,0,1,"['texans', 'texas', 'comedy']",[],https://twitter.com/jakeisfunny1/status/1503011638974337025,False,,0,,san antonio,,,,,,[],,,,
1503011043894824961,1502818482999730185,2022-03-13 09:12:12 CDT,2022-03-13,09:12:12,-0500,3686954292,kiliandb67,Dennis Kilian,,@patriottakes Sounds like a premeditated attack against an airplane employee.,en,[],[],[],0,0,0,[],[],https://twitter.com/kiliandb67/status/1503011043894824961,False,,0,,san antonio,,,,,,"[{'screen_name': 'patriottakes', 'name': 'PatriotTakes 🇺🇸', 'id': '978265628426432512'}]",,,,
1503010307026960386,1502744599802036225,2022-03-13 09:09:16 CDT,2022-03-13,09:09:16,-0500,1431073751613980672,citizenpi314,Citizen Pi,,"@timecompactor @Still_Brooks @MadelineOnMars The way I understood Seago's comment is that it is an admission that what happened to the mother was violence against her. And that terminating the pregnancy to save her life was unacceptable because it was ""another"" act of violence. Telling verbal slip by Seago IMO.",en,[],[],[],0,0,0,[],[],https://twitter.com/citizenpi314/status/1503010307026960386,False,,0,,san antonio,,,,,,"[{'screen_name': 'timecompactor', 'name': '✨ tyler ✨ (she/her)', 'id': '12388532'}, {'screen_name': 'Still_Brooks', 'name': 'Alexis Thompson', 'id': '311235388'}, {'screen_name': 'MadelineOnMars', 'name': 'Madeline Marsanne', 'id': '16330903'}]",,,,
1503009934442651654,1502993129905037317,2022-03-13 09:07:47 CDT,2022-03-13,09:07:47,-0500,1609625694,tacozilla97,Chris Villegas,,@Halo Gun it Cheif-,en,[],[],[],0,0,0,[],[],https://twitter.com/TacoZilla97/status/1503009934442651654,False,,0,,san antonio,,,,,,"[{'screen_name': 'Halo', 'name': 'Halo', 'id': '59414975'}]",,,,
1503007922628046849,1503007922628046849,2022-03-13 08:59:47 CDT,2022-03-13,08:59:47,-0500,892510078074355713,champagnebrown6,Champagne Brown,,"I updated my case with new discovery now time to call the FBI.. I'm not even playing.. With your fake numbers and all that shyt you know they can still find out who you are? Human trafficking is serious, and the FBI also deals with that type of stuff. I'm too old to be a sexslave  https://t.co/tgVIZFw1cd",en,[],[],['https://pbs.twimg.com/media/FNvBvaQXIAUPvX0.jpg'],0,0,0,[],[],https://twitter.com/ChampagneBrown6/status/1503007922628046849,False,,1,https://pbs.twimg.com/media/FNvBvaQXIAUPvX0.jpg,san antonio,,,,,,[],,,,
1503007838486020096,1495473386436321290,2022-03-13 08:59:27 CDT,2022-03-13,08:59:27,-0500,1407000623892123650,issacjosephh5,Issac,,@tfw_troy @takeoffthemasks @NoPauseTv I mean.. he prolly has his dogs trained well. they probably don’t attack children. mf’s wanna keep walking their dogs around noisy streets &amp; this is what happens. should’ve been on leashes,en,[],[],[],0,0,0,[],[],https://twitter.com/Issacjosephh5/status/1503007838486020096,False,,0,,san antonio,,,,,,"[{'screen_name': 'tfw_troy', 'name': 'THE.TROY', 'id': '1062546886387818496'}, {'screen_name': 'takeoffthemasks', 'name': 'Booty Joose', 'id': '1274716870621442048'}, {'screen_name': 'NoPauseTv', 'name': 'NoPauseTv', 'id': '1155854603931541504'}]",,,,
1503006760797356034,1502842888010575878,2022-03-13 08:55:10 CDT,2022-03-13,08:55:10,-0500,234619253,morkavic,Bradley Morkavic,,@Global_Mil_Info “Retaliation” from Iran designed for domestic consumption. The attack on an empty complex signals to us they don’t intend to escalate but at home they will claim to have killed many satans,en,[],[],[],0,0,0,[],[],https://twitter.com/Morkavic/status/1503006760797356034,False,,0,,san antonio,,,,,,"[{'screen_name': 'Global_Mil_Info', 'name': 'Global: MilitaryInfo', 'id': '905563470707515394'}]",,,,
1503001953172926465,1503001953172926465,2022-03-13 08:36:04 CDT,2022-03-13,08:36:04,-0500,2288528018,dankdavid67,DTGS 🏹,,Lmao been struggling on watching DCeased for a month bc it reminds me of attack on titan,en,[],[],[],0,0,0,[],[],https://twitter.com/dankdavid67/status/1503001953172926465,False,,0,,san antonio,,,,,,[],,,,
1503001176450736140,1481692330356793347,2022-03-13 08:32:59 CDT,2022-03-13,08:32:59,-0500,203759619,sephirothtx,Joshua Winters / sephiroth_tx 🏳️‍🌈,,"@NoCollectivists @Calibamawife @JeffYoungerTex ""Victim hood"" as texas and florida start anti lgbtq laws, many of them abusevly targeting children and happy families, and whose ideals have spread to other states like a viral hate.",en,[],[],[],1,0,0,[],[],https://twitter.com/Sephirothtx/status/1503001176450736140,False,,0,,san antonio,,,,,,"[{'screen_name': 'NoCollectivists', 'name': 'Collectivists are the problem.', 'id': '1352220184153624577'}, {'screen_name': 'Calibamawife', 'name': 'Kathleen', 'id': '50930757'}, {'screen_name': 'JeffYoungerTex', 'name': 'Jeff Younger', 'id': '1467520154259046405'}]",,,,
1502999577158463489,1502999577158463489,2022-03-13 08:26:38 CDT,2022-03-13,08:26:38,-0500,936032961232809985,jamie_foxworthy,Jamie is Going to TFF!,,"I wasn't the only one to point this out. This rhetoric is giving Americans a reason to be comfortable with, or even fully on board with, the violent erasure of a minority group by the state.",en,[],[],[],0,0,3,[],[],https://twitter.com/Jamie_Foxworthy/status/1502999577158463489,False,https://twitter.com/ParkerMolloy/status/1502699864681029637,0,,san antonio,,,,,,[],,,,
1502999366524706826,1502787934394753027,2022-03-13 08:25:48 CDT,2022-03-13,08:25:48,-0500,4616837772,bjornjabsco,Tejas Pete Jabsco,,"@shuqilleoatmeal Biden be like ""well, a little attack on the consulate will be ok""",en,[],[],[],1,0,1,[],[],https://twitter.com/bjornjabsco/status/1502999366524706826,False,,0,,san antonio,,,,,,"[{'screen_name': 'shuqilleoatmeal', 'name': 'cowboyinB4itwascool', 'id': '1346547280808091651'}]",,,,
1502999170369662980,1502850280727015427,2022-03-13 08:25:01 CDT,2022-03-13,08:25:01,-0500,937899468585828352,portarican_rt,Victor Ruiz -The Voice Of Rican-,,"@RonFilipkowski When people see violence in the places they didnt see it before, remember where it came from. They claim they stand for peace. They claim they are the ""Christians"", but their actions are far from it.",en,[],[],[],1,7,45,[],[],https://twitter.com/portarican_RT/status/1502999170369662980,False,,0,,san antonio,,,,,,"[{'screen_name': 'RonFilipkowski', 'name': 'Ron Filipkowski', 'id': '1298372735383605249'}]",,,,
1502996770632212484,1502738421030215686,2022-03-13 08:15:29 CDT,2022-03-13,08:15:29,-0500,742778322271141889,artgarcia_pmp,"Art Garcia, PMP",,@GabeBock @TeamCoachBuzz @aggiembk @AggieNetwork @AggieCorps @OfficialAgBands @reveille @TAMUyell @TAMU_1988  🥾🥾 @Tyreceradford23 absolutely white hot shooting: - 80% from the field  - 100% from 3 point arc ¡Ese hombre está en fuego! 🔥 #bthoTennessee #Whoop #Gigem  🔥💓🇺🇸🏀🙌🏼💪🏼👍🏼,en,"[{'screen_name': 'aggiecorps', 'name': 'tamu corps of cadets', 'id': '67735085'}, {'screen_name': 'officialagbands', 'name': 'texas aggie bands', 'id': '4260974352'}, {'screen_name': 'reveille', 'name': 'reveille x', 'id': '2896738950'}, {'screen_name': 'tamuyell', 'name': 'texas a&m yell leaders', 'id': '331013295'}, {'screen_name': 'tamu_1988', 'name': 'tamu class of 1988', 'id': '2900053317'}, {'screen_name': 'tyreceradford23', 'name': 'boots👣', 'id': '2381434744'}]",[],[],0,0,1,"['bthotennessee', 'whoop', 'gigem']",[],https://twitter.com/artgarcia_pmp/status/1502996770632212484,False,,0,,san antonio,,,,,,"[{'screen_name': 'GabeBock', 'name': 'Gabe Bock', 'id': '2303814980'}, {'screen_name': 'TeamCoachBuzz', 'name': 'Buzz Williams', 'id': '1469989344'}, {'screen_name': 'aggiembk', 'name': 'Texas A&M Basketball', 'id': '57432795'}]",,,,
1502991813233324040,1502985922836582402,2022-03-13 07:55:47 CDT,2022-03-13,07:55:47,-0500,2727997541,serenamloy,serena,,"@davalosboyy__ ME TOOO, but it’s mainly like true crime",en,[],[],[],1,0,0,[],[],https://twitter.com/serenamloy/status/1502991813233324040,False,,0,,san antonio,,,,,,"[{'screen_name': 'davalosboyy__', 'name': 'chris 🍥', 'id': '2374740338'}]",,,,
1502988415754772484,1502930664642949121,2022-03-13 07:42:17 CDT,2022-03-13,07:42:17,-0500,1286444849806401537,maddie_badomen,Madalin Castro,,@WarrenMoney Me too. Thank you. I'm use to gun shots (I love near a shooting range) but not that damn close.,en,[],[],[],1,0,1,[],[],https://twitter.com/Maddie_BadOmen/status/1502988415754772484,False,,0,,san antonio,,,,,,"[{'screen_name': 'WarrenMoney', 'name': '👻Warren Money👻🎸🇦🇺', 'id': '20047616'}]",,,,
1502987484690587649,1502987484690587649,2022-03-13 07:38:35 CDT,2022-03-13,07:38:35,-0500,1238772990474694657,txcarmen_,💛,,One of my residents asked about my badge (zenitsu) so I showed him a clip of zenitsu chopping off a demons head and he was like holy crap!! And than he proceeded to ask me if I’ve ever killed anyone 🤣 he said those “cartoons” are promoting violence lmfaoooo,en,[],[],[],1,0,1,[],[],https://twitter.com/txcarmen_/status/1502987484690587649,False,,0,,san antonio,,,,,,[],,,,
1502986448953352196,1502834611151417348,2022-03-13 07:34:28 CDT,2022-03-13,07:34:28,-0500,2244975126,lomstudios,NicholasWatersArt,,@ALI_HDT @WiseATLBlackGuy @MalcolmNance But facilitated and trained at camps in Afganistan and formerly Sudan. It is a complicated issue you must admit and driven by Salafi Jihadists who stoked flames for decades. Sure the presence of the West doesn't help but the inherent violence within the faith exists regardless.,en,[],[],[],0,0,0,[],[],https://twitter.com/LOMStudios/status/1502986448953352196,False,,0,,san antonio,,,,,,"[{'screen_name': 'ALI_HDT', 'name': 'ALI HEDAYAT', 'id': '2424446455'}, {'screen_name': 'WiseATLBlackGuy', 'name': 'ATL Guy', 'id': '4684411333'}, {'screen_name': 'MalcolmNance', 'name': 'Malcolm Nance', 'id': '2573480784'}]",,,,
