id,conversation_id,created_at,date,time,timezone,user_id,username,name,place,tweet,language,mentions,urls,photos,replies_count,retweets_count,likes_count,hashtags,cashtags,link,retweet,quote_url,video,thumbnail,near,geo,source,user_rt_id,user_rt,retweet_id,reply_to,retweet_date,translate,trans_src,trans_dest
1138595970546110464,1138595970546110464,2019-06-11 18:56:48 CDT,2019-06-11,18:56:48,-0500,15989779,laurenflax,Sacra,,"Sneak peek of my remix of Acid Track by @djpierreacid. Pre-orders just went up today. I wouldn’t normally put my vocal on another persons remix, but it felt right. Our bodies are under attack again. I hope women feel empowered listening to this. ✊🏻✊🏿✊🏾  https://t.co/CP6w4kiGn7",en,"[{'screen_name': 'djpierreacid', 'name': 'djpierreacid', 'id': '1327771486984282113'}]",[],[],5,13,66,[],[],https://twitter.com/laurenflax/status/1138595970546110464,False,,1,https://pbs.twimg.com/ext_tw_video_thumb/1138595870654509056/pu/img/Xdrv-JiQ-xEnNvlS.jpg,new york city,,,,,,[],,,,
1138595944050626560,1138437983298867201,2019-06-11 18:56:41 CDT,2019-06-11,18:56:41,-0500,726365861620121600,mjastoria1,Mjastoria,,@DonaldJTrumpJr All were employees of your dad's crime syndicate?  Not amusing or surprising whatsoever.,en,[],[],[],0,0,0,[],[],https://twitter.com/mjastoria1/status/1138595944050626560,False,,0,,new york city,,,,,,"[{'screen_name': 'DonaldJTrumpJr', 'name': 'Donald Trump Jr.', 'id': '39344374'}]",,,,
1138595770054139905,1138595770054139905,2019-06-11 18:56:00 CDT,2019-06-11,18:56:00,-0500,219776760,stackbundles512,Dylan Stack,,Only way the #NBAFinals could be more depressing is if GS still wins so I guess my money is on them. Always a good time to be a Knicks fan though. Missed out on Zion now KD Achilles??? Shoot me. With a gun. In the head.,en,[],[],[],0,0,2,['nbafinals'],[],https://twitter.com/Stackbundles512/status/1138595770054139905,False,,0,,new york city,,,,,,[],,,,
1138595300250193920,1138595300250193920,2019-06-11 18:54:08 CDT,2019-06-11,18:54:08,-0500,29902828,steviederrick_,"𝐚𝐥𝐰𝐚𝐲𝐬,𝐚𝐮𝐭𝐡𝐞𝐧𝐭𝐢𝐜. 🤍",,* all these stories of domestic violence i just.....  https://t.co/8ubOkCp7mJ,en,[],[],['https://pbs.twimg.com/tweet_video_thumb/D80aYzWXYAApsVi.jpg'],0,0,0,[],[],https://twitter.com/StevieDerrick_/status/1138595300250193920,False,,1,https://pbs.twimg.com/tweet_video_thumb/D80aYzWXYAApsVi.jpg,new york city,,,,,,[],,,,
1138595250925113344,1138437983298867201,2019-06-11 18:53:56 CDT,2019-06-11,18:53:56,-0500,726365861620121600,mjastoria1,Mjastoria,,@TrumpStudents @DonaldJTrumpJr Students who think Hillary Rodham Clinton has been convicted of a crime and imprisoned. Sounds about right for trump morons.,en,[],[],[],0,0,0,[],[],https://twitter.com/mjastoria1/status/1138595250925113344,False,,0,,new york city,,,,,,"[{'screen_name': 'TrumpStudents', 'name': 'Students For Trump', 'id': '3981225735'}, {'screen_name': 'DonaldJTrumpJr', 'name': 'Donald Trump Jr.', 'id': '39344374'}]",,,,
1138594506331369472,1138467835263557633,2019-06-11 18:50:59 CDT,2019-06-11,18:50:59,-0500,3085154945,mzabnette,Mz.Abnette,,"@LeleeLyons The only thing with this, there will be a lot of false allegations or just plain lies. Trust me child molesters should be handled accordingly to their crime",en,[],[],[],0,0,0,[],[],https://twitter.com/mzabnette/status/1138594506331369472,False,,0,,new york city,,,,,,"[{'screen_name': 'LeleeLyons', 'name': 'Lelee Lyons SWV', 'id': '881392099'}]",,,,
1138593982118866946,1138593982118866946,2019-06-11 18:48:54 CDT,2019-06-11,18:48:54,-0500,916641229663866881,eddy_nieves,Eddy Nieves JR!,,#T183RDEH/FIVE FEET APART WALKIN' DEAD THE BOOK MORMON/BOSTON BY FOOT THE DINNER GANG GETS WILD/INJURED SURVIVOR LEFT A STRANGE WARNIN' FAVOR &amp; AFFECTION PATROL DUTY/MY CUP RUNNETH OVER TROUBLE/BOOZE CRUISE #MMG #TRUMP #EGGHEAD #MMGUNIT #PLATONICJR  https://t.co/7oeP4xlxT0,en,[],[],['https://pbs.twimg.com/media/D80ZL-LXYAICkNI.jpg'],0,0,1,"['t183rdeh', 'mmg', 'trump', 'egghead', 'mmgunit', 'platonicjr']",[],https://twitter.com/eddy_nieves/status/1138593982118866946,False,,1,https://pbs.twimg.com/media/D80ZL-LXYAICkNI.jpg,new york city,,,,,,[],,,,
1138592097408311296,1138592097408311296,2019-06-11 18:41:24 CDT,2019-06-11,18:41:24,-0500,2866253653,d_unikue_a,Trend Grifffy,,I’m about to commit premeditated murder on this Chicken Parmesan Hero ..,en,[],[],[],0,0,0,[],[],https://twitter.com/d_unikue_a/status/1138592097408311296,False,,0,,new york city,,,,,,[],,,,
1138591853257867264,1138591853257867264,2019-06-11 18:40:26 CDT,2019-06-11,18:40:26,-0500,1545257810,fendifamily,MoodyMoreno,,"I've gotten injured 3 fucking times this month. Once via car crash, twice via a shattered glass shower door, and the 3rd by a cat food can. Niggas is cursed",en,[],[],[],0,0,0,[],[],https://twitter.com/FendiFamily/status/1138591853257867264,False,,0,,new york city,,,,,,[],,,,
1138591300339609600,1138591300339609600,2019-06-11 18:38:14 CDT,2019-06-11,18:38:14,-0500,1545257810,fendifamily,MoodyMoreno,,This injured hand got me extra moody  https://t.co/iyjQv2OfQ6,en,[],[],['https://pbs.twimg.com/media/D80Wv82W4AAH8qP.jpg'],0,0,0,[],[],https://twitter.com/FendiFamily/status/1138591300339609600,False,,1,https://pbs.twimg.com/media/D80Wv82W4AAH8qP.jpg,new york city,,,,,,[],,,,
1138590712667226112,1138590712667226112,2019-06-11 18:35:54 CDT,2019-06-11,18:35:54,-0500,55390754,stushkaiser,stushy,,Because it goes against their core belief of Black people and Muslims being violent savages. To see them as victims would be to humanize them.,en,[],[],[],0,0,1,[],[],https://twitter.com/Stushkaiser/status/1138590712667226112,False,https://twitter.com/denzeldion/status/1138584654468898816,0,,new york city,,,,,,[],,,,
1138589644982013955,1138589644982013955,2019-06-11 18:31:39 CDT,2019-06-11,18:31:39,-0500,32968728,jusaire,Keith Nelson Jr,,That's literally child abuse. I don't care if there's no child being abused,en,[],[],[],0,0,1,[],[],https://twitter.com/JusAire/status/1138589644982013955,False,https://twitter.com/heyerinevans/status/1138559140337475585,0,,new york city,,,,,,[],,,,
1138589592242786305,1138587715769896960,2019-06-11 18:31:27 CDT,2019-06-11,18:31:27,-0500,18919909,lilibethstar,lilibeth✨,,Germany shut out Estonia 8-0 I don’t hear shit about people complaining about their goals and celebrations. Fuck that sexist shit.,en,[],[],[],3,0,3,[],[],https://twitter.com/lilibethstar/status/1138589592242786305,False,,0,,new york city,,,,,,[],,,,
1138589483371290624,1138589479038529536,2019-06-11 18:31:01 CDT,2019-06-11,18:31:01,-0500,281805591,cwebcruzer,David Cruz,,@RoryLancman says the Karina Vetrano murder case is parallel to the #CentralParkFive case and will investigate whether Chanel Lewis was investigated properly.  https://t.co/h2jymvBEFV,en,[],[],['https://pbs.twimg.com/media/D80VCaLXoAEjKHy.jpg'],0,0,0,['centralparkfive'],[],https://twitter.com/CWEBCRUZER/status/1138589483371290624,False,,1,https://pbs.twimg.com/media/D80VCaLXoAEjKHy.jpg,new york city,,,,,,[],,,,
1138588829747732480,1138588829747732480,2019-06-11 18:28:25 CDT,2019-06-11,18:28:25,-0500,983068117088849920,what_a_liar,American lies,,"Thank all those involved in the investigations for their hard work/devotion to arrested/persecute/detain those evil people in such cruel crimes against children.  Feds: Nearly 1,700 arrested in child porn, abuse crackdown  https://t.co/JhiWpkChBT via @Yahoo",en,"[{'screen_name': 'yahoo', 'name': 'yahoo', 'id': '19380829'}]",['https://news.yahoo.com/feds-nearly-1-700-arrested-163522977.html?soc_src=community&soc_trk=tw'],[],0,0,0,[],[],https://twitter.com/what_a_liar/status/1138588829747732480,False,,0,,new york city,,,,,,[],,,,
1138586802271522818,1138586802271522818,2019-06-11 18:20:22 CDT,2019-06-11,18:20:22,-0500,281805591,cwebcruzer,David Cruz,,@GregLasak wants to also see a #CureViolence model seeing it as a successful way to combat crime.  https://t.co/I1XrzES3Ub,en,[],[],['https://pbs.twimg.com/media/D80SogSX4AUFm7s.jpg'],0,1,2,['cureviolence'],[],https://twitter.com/CWEBCRUZER/status/1138586802271522818,False,,1,https://pbs.twimg.com/media/D80SogSX4AUFm7s.jpg,new york city,,,,,,[],,,,
1138586632620318720,1138586626815401984,2019-06-11 18:19:41 CDT,2019-06-11,18:19:41,-0500,281805591,cwebcruzer,David Cruz,,"@MinaMalikForDA wants to create a crime strategies unit to figure out how to stop violence before it ends.   Wants also to see a #CureViolence model, a little different from the crime strategies unit.  https://t.co/FDpmfheNa5",en,[],[],['https://pbs.twimg.com/media/D80SWnaWsAEdEKD.jpg'],0,1,2,['cureviolence'],[],https://twitter.com/CWEBCRUZER/status/1138586632620318720,False,,1,https://pbs.twimg.com/media/D80SWnaWsAEdEKD.jpg,new york city,,,,,,[],,,,
1138586629684301825,1138586626815401984,2019-06-11 18:19:41 CDT,2019-06-11,18:19:41,-0500,281805591,cwebcruzer,David Cruz,,"Wants faith-based community organizations getting involved in the fight against crime.   ""There is no trust in the criminal justice system. Why? Because it's not diverse,"" says Lugo.   Says crime has gone up because people are angry.  https://t.co/KsWehGwJXb",en,[],[],['https://pbs.twimg.com/media/D80SIkTWsAETiaU.jpg'],2,0,0,[],[],https://twitter.com/CWEBCRUZER/status/1138586629684301825,False,,1,https://pbs.twimg.com/media/D80SIkTWsAETiaU.jpg,new york city,,,,,,[],,,,
1138586626815401984,1138586626815401984,2019-06-11 18:19:40 CDT,2019-06-11,18:19:40,-0500,281805591,cwebcruzer,David Cruz,,"@JoseNievesForDA says he's personally driven to reduce crime because he has two kids of his    Meantime, he wants to conduct long-term investigations.  https://t.co/2A862eonpX",en,[],[],['https://pbs.twimg.com/media/D80SDQcWwAA1r_B.jpg'],2,0,0,[],[],https://twitter.com/CWEBCRUZER/status/1138586626815401984,False,,1,https://pbs.twimg.com/media/D80SDQcWwAA1r_B.jpg,new york city,,,,,,[],,,,
1138586374091620352,1138586374091620352,2019-06-11 18:18:40 CDT,2019-06-11,18:18:40,-0500,268498395,greggmf,GF,"{'type': 'Point', 'coordinates': [40.75301143, -73.97686958]}",this is how you do a proper #puppy #playdate. all #doggy bells and whistles and even a remote control treat shooting #toy #cute #dogs #play #bernedoodle #doodle #doodleromp…  https://t.co/kwVce26RCc,en,[],['https://www.instagram.com/p/Bylm_xnnMIr3YzbV585QUnWDeh6bF4EKGfiirg0/?igshid=1sspr8mkn6fz0'],[],0,0,0,"['puppy', 'playdate', 'doggy', 'toy', 'cute', 'dogs', 'play', 'bernedoodle', 'doodle', 'doodleromp']",[],https://twitter.com/greggmf/status/1138586374091620352,False,,0,,new york city,,,,,,[],,,,
1138585536308944897,1138583080539742208,2019-06-11 18:15:20 CDT,2019-06-11,18:15:20,-0500,41049805,frankeljeff,Jeff Frankel,,@fayemurman Did you have to knee the whole time? That sounds brutal to me.,en,[],[],[],1,0,0,[],[],https://twitter.com/frankeljeff/status/1138585536308944897,False,,0,,new york city,,,,,,"[{'screen_name': 'fayemurman', 'name': 'Faye Murman', 'id': '24658124'}]",,,,
1138585494462353408,1138585491115335684,2019-06-11 18:15:10 CDT,2019-06-11,18:15:10,-0500,281805591,cwebcruzer,David Cruz,,@MelindaKatz says one way to combat crime is to take their criminal justice message to schools.  https://t.co/HVLFe2MxTX,en,[],[],['https://pbs.twimg.com/media/D80RdflX4AE9SfF.jpg'],0,0,0,[],[],https://twitter.com/CWEBCRUZER/status/1138585494462353408,False,,1,https://pbs.twimg.com/media/D80RdflX4AE9SfF.jpg,new york city,,,,,,[],,,,
1138585491115335684,1138585491115335684,2019-06-11 18:15:09 CDT,2019-06-11,18:15:09,-0500,281805591,cwebcruzer,David Cruz,,@CabanForQueens says the way to combat crime is through using the Cure Violence model.  https://t.co/L67RXC87M4,en,[],[],['https://pbs.twimg.com/media/D80RM_yXsAAHL9q.jpg'],1,0,0,[],[],https://twitter.com/CWEBCRUZER/status/1138585491115335684,False,,1,https://pbs.twimg.com/media/D80RM_yXsAAHL9q.jpg,new york city,,,,,,[],,,,
1138585355748347904,1138585355748347904,2019-06-11 18:14:37 CDT,2019-06-11,18:14:37,-0500,27487492,rorylancman,(((Rory Lancman))),,We spend too much time prosecuting low-level violence offenses which detracts from dealing with violent crime #QueensDA  https://t.co/rxZaMOLYBM,en,[],[],['https://pbs.twimg.com/media/D80RKcOXoAArqHQ.jpg'],0,2,5,['queensda'],[],https://twitter.com/RoryLancman/status/1138585355748347904,False,,1,https://pbs.twimg.com/media/D80RKcOXoAArqHQ.jpg,new york city,,,,,,[],,,,
1138584355524292608,1138579767538536448,2019-06-11 18:10:38 CDT,2019-06-11,18:10:38,-0500,30041553,lean_dough21,High Views Podcast,,@SOULbeautifulme Knicks might keep dey pick cuz KD got injured,en,[],[],[],1,0,0,[],[],https://twitter.com/Lean_Dough21/status/1138584355524292608,False,,0,,new york city,,,,,,"[{'screen_name': 'SOULbeautifulme', 'name': '(Raquel) KOBE 🖤🐍', 'id': '34203989'}]",,,,
1138583326372106240,1138583324077826049,2019-06-11 18:06:33 CDT,2019-06-11,18:06:33,-0500,281805591,cwebcruzer,David Cruz,,"@RoryLancman pretty much came out and said it: the criminal justice system in #Queens is ""racist.""   Lancman positions himself as best candidate since he already investigates DAs in his Council post.  https://t.co/ffEQ7wCX41",en,[],[],['https://pbs.twimg.com/media/D80PH5nWsAEXmwM.jpg'],1,1,2,['queens'],[],https://twitter.com/CWEBCRUZER/status/1138583326372106240,False,,1,https://pbs.twimg.com/media/D80PH5nWsAEXmwM.jpg,new york city,,,,,,[],,,,
1138583000210464768,1138583000210464768,2019-06-11 18:05:15 CDT,2019-06-11,18:05:15,-0500,27487492,rorylancman,(((Rory Lancman))),,"“I am running for Queens District Attorney because the criminal justice system is racist, it discriminates against poor people,  and fails to protect women, immigrants, tenants, and working people.” #QueensDA #NY1Politics  https://t.co/0eHnZi1XJB",en,[],[],['https://pbs.twimg.com/media/D80PM5YXoAAhuPB.jpg'],0,7,8,"['queensda', 'ny1politics']",[],https://twitter.com/RoryLancman/status/1138583000210464768,False,,1,https://pbs.twimg.com/media/D80PM5YXoAAhuPB.jpg,new york city,,,,,,[],,,,
1138581306470801408,1138581306470801408,2019-06-11 17:58:31 CDT,2019-06-11,17:58:31,-0500,1344937584,jenniferevonne,Jennifer Green,,#NeverForget Plea To Lawmakers For 9/11 Victim Funding: 'You Shou...  https://t.co/dPqU3SDO9O via @YouTube #nyc #NewYork,en,"[{'screen_name': 'youtube', 'name': 'youtube', 'id': '10228272'}]",['https://youtu.be/Zyk1qasZdjQ'],[],0,0,0,"['neverforget', 'nyc', 'newyork']",[],https://twitter.com/JenniferEvonne/status/1138581306470801408,False,,0,,new york city,,,,,,[],,,,
1138581218700775424,1138581218700775424,2019-06-11 17:58:11 CDT,2019-06-11,17:58:11,-0500,2588437196,nicoamatullo,Nico Amatullo,,"Huge response by @FDNY in Gramercy for a stove fire on East 23rd between 1st and 2nd, hope no one is injured  https://t.co/m6C9fwwwBW",en,"[{'screen_name': 'fdny', 'name': 'fdny', 'id': '134846593'}]",[],[],1,0,1,[],[],https://twitter.com/NicoAmatullo/status/1138581218700775424,False,,1,https://pbs.twimg.com/ext_tw_video_thumb/1138581166397820928/pu/img/ZzgXrcW3HbnJo-bU.jpg,new york city,,,,,,[],,,,
1138581013469310977,1138581013469310977,2019-06-11 17:57:22 CDT,2019-06-11,17:57:22,-0500,1859056717,justjoeylopez,Joey Lopez-Powell,,Six gun sound is our claim to fame! 🎶  https://t.co/hlJUocjVMp,en,[],[],['https://pbs.twimg.com/tweet_video_thumb/D80NY7jXoAAhQpH.jpg'],0,0,1,[],[],https://twitter.com/justjoeylopez/status/1138581013469310977,False,,1,https://pbs.twimg.com/tweet_video_thumb/D80NY7jXoAAhQpH.jpg,new york city,,,,,,[],,,,
1138577686354378752,1138577686354378752,2019-06-11 17:44:08 CDT,2019-06-11,17:44:08,-0500,880522041564291073,netsrating,NetsRating,,Listening to Kendrick Perkins on a pod is brutal wow.,en,[],[],[],0,0,0,[],[],https://twitter.com/NetsRating/status/1138577686354378752,False,,0,,new york city,,,,,,[],,,,
1138576695529746434,1138576695529746434,2019-06-11 17:40:12 CDT,2019-06-11,17:40:12,-0500,349128836,badgalcharlee,UNFORGETTABLE 💋,,It’s time to start shooting predatory men.,en,[],[],[],1,0,0,[],[],https://twitter.com/badgalcharlee/status/1138576695529746434,False,https://twitter.com/HotCommieGal/status/1138206018834505730,0,,new york city,,,,,,[],,,,
1138576025619763206,1138576025619763206,2019-06-11 17:37:32 CDT,2019-06-11,17:37:32,-0500,746601140,iamra92,🇨🇴,,"So the #USWNT just scored 13 goals ( in comparison the #USMNT  has scored just 12 the past 4 world cups) in their World Cup debut, but only thing you all want to focus on is how these women should be in the kitchen?   Do better man. The misogyny needs to stop 🤦🏽‍♂️",en,[],[],[],0,0,1,"['uswnt', 'usmnt']",[],https://twitter.com/iAmRa92/status/1138576025619763206,False,,0,,new york city,,,,,,[],,,,
1138575262604546050,1138544841334411270,2019-06-11 17:34:30 CDT,2019-06-11,17:34:30,-0500,18242547,pandershirts,Queer Ponzi Scheme,,@maximecp That’s a crime,en,[],[],[],1,0,0,[],[],https://twitter.com/PanderShirts/status/1138575262604546050,False,,0,,new york city,,,,,,"[{'screen_name': 'maximecp', 'name': 'Maxime 💫', 'id': '3084306405'}]",,,,
1138574688635039750,1138569794746310656,2019-06-11 17:32:14 CDT,2019-06-11,17:32:14,-0500,23803621,sarahheartsnyc,Sarah French D’Imperio,,@yeeamfam Haha I jumped the gun.,en,[],[],[],0,0,1,[],[],https://twitter.com/SarahHeartsNYC/status/1138574688635039750,False,,0,,new york city,,,,,,"[{'screen_name': 'yeeamfam', 'name': 'YeeAmFam', 'id': '1086059187644317696'}]",,,,
1138574686462259200,1138574635069349889,2019-06-11 17:32:13 CDT,2019-06-11,17:32:13,-0500,1011195044542337024,yui_okey_,Yui Okuba / 尾久葉優衣,,您好~~~😆😆😆🇨🇳 🇺🇸Shooting was Brooklyn🌉 夕暮れ前のChinese❤️❤️❤️謝謝~~~🙏🙏🙏✨✨✨  https://t.co/hAHLtQSMjW,ja,[],[],"['https://pbs.twimg.com/media/D80Hmx0UIAE_VR3.jpg', 'https://pbs.twimg.com/media/D80HmyqU0AEUDSc.jpg', 'https://pbs.twimg.com/media/D80Hm0fV4AE5Oxj.jpg', 'https://pbs.twimg.com/media/D80Hm3FUcAAXVkC.jpg']",1,0,16,[],[],https://twitter.com/yui_okey_/status/1138574686462259200,False,,1,https://pbs.twimg.com/media/D80Hmx0UIAE_VR3.jpg,new york city,,,,,,[],,,,
1138574668179431424,1138574668179431424,2019-06-11 17:32:09 CDT,2019-06-11,17:32:09,-0500,473556189,eellisthomas,milesquarepriest,,Answer: it isn’t. An Arizona Teacher Helped Migrants. Jurors Couldn’t Decide if It Was a Crime.  https://t.co/gsjCuu22uH,en,[],['https://nyti.ms/2R6NXRP'],[],0,1,2,[],[],https://twitter.com/EEllisThomas/status/1138574668179431424,False,,0,,new york city,,,,,,[],,,,
1138574635069349889,1138574635069349889,2019-06-11 17:32:01 CDT,2019-06-11,17:32:01,-0500,1011195044542337024,yui_okey_,Yui Okuba / 尾久葉優衣,,🌻😘🌷🌸#TuesdayThoughts #shooting #photography #ny #portrait #coregraphy #ポートレート #チャイナ服 #ファインダー越しの私の世界❤️🐼❤️  https://t.co/h8b0hdzec5,und,[],[],"['https://pbs.twimg.com/media/D80Hff6V4AA87D7.jpg', 'https://pbs.twimg.com/media/D80Hff5VsAEau33.jpg', 'https://pbs.twimg.com/media/D80Hff3UwAE-vvY.jpg', 'https://pbs.twimg.com/media/D80Hff6UEAAszn4.jpg']",2,1,22,"['tuesdaythoughts', 'shooting', 'photography', 'ny', 'portrait', 'coregraphy', 'ポートレート', 'チャイナ服', 'ファインダー越しの私の世界']",[],https://twitter.com/yui_okey_/status/1138574635069349889,False,,1,https://pbs.twimg.com/media/D80Hff6V4AA87D7.jpg,new york city,,,,,,[],,,,
1138571936185933826,1138571936185933826,2019-06-11 17:21:17 CDT,2019-06-11,17:21:17,-0500,66691476,gabalexa,Gabrielle Alexa Noel,,"hello, me + a group of comedians and sex/dating experts are shooting a video where we review and provide suggestions on tinder profiles, hmu if you’d like your profile reviewed tysm",en,[],[],[],11,7,53,[],[],https://twitter.com/gabalexa/status/1138571936185933826,False,,0,,new york city,,,,,,[],,,,
1138571392159571968,1138571392159571968,2019-06-11 17:19:08 CDT,2019-06-11,17:19:08,-0500,44239450,mikebotz_,𝓜𝓲𝓴𝓮 𝓑𝓸𝓽𝔃,,"My bitch cheat , im shooting her friends too... Thot together get shot together 😭😂😭😂",en,[],[],[],1,1,9,[],[],https://twitter.com/MiKeBoTz_/status/1138571392159571968,False,,0,,new york city,,,,,,[],,,,
