id,conversation_id,created_at,date,time,timezone,user_id,username,name,place,tweet,language,mentions,urls,photos,replies_count,retweets_count,likes_count,hashtags,cashtags,link,retweet,quote_url,video,thumbnail,near,geo,source,user_rt_id,user_rt,retweet_id,reply_to,retweet_date,translate,trans_src,trans_dest
1144391526224662530,1144391526224662530,2019-06-27 18:46:16 CDT,2019-06-27,18:46:16,-0500,49532208,lesvdavis,News & Quotes,,MSNBC hosts clash when Donny Deutsch dishes out blatantly sexist punditry about the 2020 race  https://t.co/0pGGmz2ORE,en,[],['https://www.alternet.org/2019/06/msnbc-hosts-clash-when-donny-deutsch-dishes-out-blatantly-sexist-punditry-about-the-2020-race/#.XRVVPOZ7_dc.twitter'],[],0,0,0,[],[],https://twitter.com/LesVDavis/status/1144391526224662530,False,,0,,new york city,,,,,,[],,,,
1144391358918119424,1144390655763816448,2019-06-27 18:45:36 CDT,2019-06-27,18:45:36,-0500,731023872,mcb_ill,B-iLL,,"@missmayn She was doing so well, then just got tired? Between no impeachment and dismissing rape, she gots to go.",en,[],[],[],0,0,2,[],[],https://twitter.com/McB_iLL/status/1144391358918119424,False,,0,,new york city,,,,,,"[{'screen_name': 'missmayn', 'name': 'Ally Maynard', 'id': '23287527'}]",,,,
1144391319227445248,1144386453813833728,2019-06-27 18:45:26 CDT,2019-06-27,18:45:26,-0500,66691476,gabalexa,Gabrielle Alexa Noel,,"Also, we talk about veterans navigating PTSD in terms of like...war? But 55% of military women experience sexual harassment. And 23% reported sexual assault. I’m sure the number of actual assaults is higher tho.",en,[],[],[],1,6,34,[],[],https://twitter.com/gabalexa/status/1144391319227445248,False,,0,,new york city,,,,,,[],,,,
1144391278697865216,1144389273594077185,2019-06-27 18:45:17 CDT,2019-06-27,18:45:17,-0500,2600890711,delusionalant,al-Thanaa,,@saikatc being racially insensitive and being racist are the same thing bruh bruh,en,[],[],[],1,0,2,[],[],https://twitter.com/delusionalant/status/1144391278697865216,False,,0,,new york city,,,,,,"[{'screen_name': 'saikatc', 'name': 'Saikat Chakrabarti', 'id': '41154223'}]",,,,
1144390883351126017,1144390883351126017,2019-06-27 18:43:43 CDT,2019-06-27,18:43:43,-0500,2281482584,6ixgod_,Rico Wade,,At the crime scene lol,en,[],[],[],0,0,0,[],[],https://twitter.com/6ixgod_/status/1144390883351126017,False,,0,,new york city,,,,,,[],,,,
1144389749903433728,1144389749903433728,2019-06-27 18:39:12 CDT,2019-06-27,18:39:12,-0500,160640775,syradeath,Syra Sparkle📸✨🌙,"{'type': 'Point', 'coordinates': [40.7142, -74.0064]}",Garden of Eden lookbook shooting - Primal cork jacket holding animal spirits. Swipe left for more of the last and final looks for this behind the scenes series  Designer: @sho_konishi Model:…  https://t.co/jP8FlEWS5G,en,"[{'screen_name': 'sho_konishi', 'name': 'sho konishi', 'id': '1470914227326099471'}]",['https://www.instagram.com/p/BzO2EGUApXL/?igshid=dm1btogllhzp'],[],0,0,1,[],[],https://twitter.com/syradeath/status/1144389749903433728,False,,0,,new york city,,,,,,[],,,,
1144388506124509185,1144388506124509185,2019-06-27 18:34:16 CDT,2019-06-27,18:34:16,-0500,33393356,jadelove21__,🥀 Jade Love 🖤,,I need a weekend in PA again but not the city. One day at camel beach next day doing random shit .. gun range ... horseback riding casino go carts...,en,[],[],[],0,0,0,[],[],https://twitter.com/JadeLove21__/status/1144388506124509185,False,,0,,new york city,,,,,,[],,,,
1144386632763740162,1144386632763740162,2019-06-27 18:26:49 CDT,2019-06-27,18:26:49,-0500,121571476,joker363,Joker363,"{'type': 'Point', 'coordinates': [40.8679, -74.1545]}","There goes that bad man mama. #selfies #assassin #badmuthafucka @ Clifton, New Jersey  https://t.co/zJ10Im4s8W",en,[],['https://www.instagram.com/p/BzO0piLpbCbTpN63phEiAHYP9eB6c5M0EAs6Qg0/?igshid=1hd0x4vd73d1a'],[],0,0,0,"['selfies', 'assassin', 'badmuthafucka']",[],https://twitter.com/JOKER363/status/1144386632763740162,False,,0,,new york city,,,,,,[],,,,
1144382628390457346,1144382628390457346,2019-06-27 18:10:54 CDT,2019-06-27,18:10:54,-0500,1712422585,figue32bj,Hector J Figueroa,,"Don’t come back to recess and pretend to stand with us. Tragic that too many Dems will only do what is right under heavy pressure from the base. Seems the message to us is “challenge our leadership if you want us to fight confinement, cruelty &amp; murder of immigrants”.",en,[],[],[],0,3,8,[],[],https://twitter.com/figue32bj/status/1144382628390457346,False,https://twitter.com/Leahgreenb/status/1144365390556008448,0,,new york city,,,,,,[],,,,
1144381026912886785,1144381026912886785,2019-06-27 18:04:33 CDT,2019-06-27,18:04:33,-0500,11730212,ankushnarula,Kush,,"Would you rather be insulted about your personal characteristics with a bigoted slur (not gonna list them)?  Or would you rather be falsely accused of being a bigot (racist, misogynist, homophobe, antisemite, islamophobe, etc)?  (Yes I know - they’re both awful)",en,[],[],[],2,0,0,[],[],https://twitter.com/ankushnarula/status/1144381026912886785,False,,0,,new york city,,,,,,[],,,,
1144379922603024385,1144365323174449154,2019-06-27 18:00:09 CDT,2019-06-27,18:00:09,-0500,361412568,darreng60,Darren Green,,@andrewsands809 LOL! For Sure!!! And coming to a theater near you?  Attack Of The Basketball Hoop!! Rated H. For Hilarious!!! hahaha! 😎👍🤣🤣🤣  https://t.co/dANS6Kkssd,en,[],[],['https://pbs.twimg.com/tweet_video_thumb/D-GnK33XYAA8J1q.jpg'],0,0,0,[],[],https://twitter.com/darreng60/status/1144379922603024385,False,,1,https://pbs.twimg.com/tweet_video_thumb/D-GnK33XYAA8J1q.jpg,new york city,,,,,,[],,,,
1144379681233350656,1144379681233350656,2019-06-27 17:59:12 CDT,2019-06-27,17:59:12,-0500,556215059,chinainstitute_,China Institute,,"“In 16 weeks the government dropped the chargers, but our lives were racked” professor Xi on his false arrest by FBI. Watch professor Xi talking about his experience LIVE on our YouTube channel!  https://t.co/3gVHQB7wYh",en,[],['http://bit.ly/2LnpBlW'],[],0,0,0,[],[],https://twitter.com/ChinaInstitute_/status/1144379681233350656,False,,0,,new york city,,,,,,[],,,,
1144377086938886144,1144377086938886144,2019-06-27 17:48:53 CDT,2019-06-27,17:48:53,-0500,90921407,minkwoncenter,Minkwon Center (민권센터) #Citizenship4All,,"The moment the Citizenship Question became public, immense damage was already done to our communities’ trust of the #2020Census. We have a long way to go in mending and uniting our communities from the collective fear and trauma that this administration continues to assault on us  https://t.co/2EJjEAcqb2",en,[],[],['https://pbs.twimg.com/media/D-Gk45LXoAAX8U3.jpg'],0,3,3,['2020census'],[],https://twitter.com/MinKwonCenter/status/1144377086938886144,False,,1,https://pbs.twimg.com/media/D-Gk45LXoAAX8U3.jpg,new york city,,,,,,[],,,,
1144375602432086017,1144375602432086017,2019-06-27 17:42:59 CDT,2019-06-27,17:42:59,-0500,25869076,dj2020,"Next Lvl-DJ 20-20 - 20 Sack Ent, ASCAP, W.O.D.S","{'type': 'Point', 'coordinates': [40.60956, -73.7563]}","My UK Source In Town (SCMD-LiveNDirect), Shooting Our Interview On Saturday, Breakfast, Then At My Crib #Yesss #vladtv #fleetdjs @fleetdjs @DJLADYLOVEBX @MMRadioDotCom @Sony_Red_Music #vh1 #W_O_D_S_TV…  https://t.co/IaXRyOcjV6",en,"[{'screen_name': 'fleetdjs', 'name': ""fleet dj's"", 'id': '25666962'}, {'screen_name': 'djladylovebx', 'name': 'djladylovebx', 'id': '262745128'}, {'screen_name': 'mmradiodotcom', 'name': 'mixxmafiaradio', 'id': '2671529180'}]",['https://www.instagram.com/p/BzOvohGHL8f/?igshid=1928kau0v0ree'],[],0,0,0,"['yesss', 'vladtv', 'fleetdjs', 'vh1', 'w_o_d_s_tv']",[],https://twitter.com/DJ2020/status/1144375602432086017,False,,0,,new york city,,,,,,[],,,,
1144374948959588352,1144374948959588352,2019-06-27 17:40:23 CDT,2019-06-27,17:40:23,-0500,502314989,hcirhigher,𝕽𝖎𝖈𝖍𝖎𝖊 𝕽𝖎𝖈𝖍,,can’t man up if masculinity your only weapon.....,en,[],[],[],0,0,1,[],[],https://twitter.com/hcirhigher/status/1144374948959588352,False,,0,,new york city,,,,,,[],,,,
1144371322681810946,1144371322681810946,2019-06-27 17:25:59 CDT,2019-06-27,17:25:59,-0500,2157776765,jessiecuervo,jessica,,don’t you hate it when you’re eating a donut and the glaze sticks all over your phone? now the evidence is all over the crime scene.,en,[],[],[],0,0,0,[],[],https://twitter.com/jessiecuervo/status/1144371322681810946,False,,0,,new york city,,,,,,[],,,,
1144370623088668673,1144370623088668673,2019-06-27 17:23:12 CDT,2019-06-27,17:23:12,-0500,36734992,annezig,DrLooneyResist,,"Hideous Men.Jeanie Carroll,Indiana University Cheerleader,Miss Indiana University 1963.But in 1987 she became on Donald Trump most disgusting,recalling sexually rape at Bergdorf Woman's Dressing Room. His Repeal,she too ugly for him? #TrumpisARapist  #TrumpDoesNotCare4WM #Resist  https://t.co/H1QTvk8uHq",en,[],[],['https://pbs.twimg.com/media/D-GfBAFWsAACZ6A.jpg'],0,0,0,"['trumpisarapist', 'trumpdoesnotcare4wm', 'resist']",[],https://twitter.com/Annezig/status/1144370623088668673,False,,1,https://pbs.twimg.com/media/D-GfBAFWsAACZ6A.jpg,new york city,,,,,,[],,,,
1144370492108939266,1144370492108939266,2019-06-27 17:22:41 CDT,2019-06-27,17:22:41,-0500,357092583,jumaanewilliams,Jumaane Williams,,"The threat of gun violence is a daily reality in our schools, in our streets, for our kids.  This absurd and heartbreaking truth is on display at @Whisbe's 'Back To School Sale' of pastel pistols and designer bulletproof vests.  While an artistic parody, it showed sad realities.  https://t.co/baLQJrjn83",en,"[{'screen_name': 'whisbe', 'name': 'whisbe art', 'id': '1861387676'}]",[],"['https://pbs.twimg.com/media/D-Ge5H8XUAA1-gy.jpg', 'https://pbs.twimg.com/media/D-Ge5H7W4AIsb96.jpg', 'https://pbs.twimg.com/media/D-Ge5H6WkAA-z8J.jpg', 'https://pbs.twimg.com/media/D-Ge5H7W4AEB8-F.jpg']",3,2,11,[],[],https://twitter.com/JumaaneWilliams/status/1144370492108939266,False,,1,https://pbs.twimg.com/media/D-Ge5H8XUAA1-gy.jpg,new york city,,,,,,[],,,,
1144369831698927616,1144369831698927616,2019-06-27 17:20:03 CDT,2019-06-27,17:20:03,-0500,3089043479,writingliyakira,Li Cohen🌊☀️🌱,,The stories of transgender people of color are more important than ever: 10+ have been killed in 2019 and nearly half experience harassment &amp; violence. Very few are acknowledged in celebrations. @lawyergrrl @LGBTCenterNYC #Stonewall50 #Pride2019  https://t.co/MI9difftJQ,en,"[{'screen_name': 'lawyergrrl', 'name': 'chinyere ezie', 'id': '14555224'}, {'screen_name': 'lgbtcenternyc', 'name': 'the center', 'id': '25358498'}]",['https://www.amny.com/news/transgender-people-of-color-pride-1.33056284'],[],0,0,0,"['stonewall50', 'pride2019']",[],https://twitter.com/WritingLiYakira/status/1144369831698927616,False,,0,,new york city,,,,,,[],,,,
1144369760831987712,1144369760831987712,2019-06-27 17:19:47 CDT,2019-06-27,17:19:47,-0500,35148273,trulesrikan,i_Aviles,,Ok so I almost had a heart attack when my aunt called me to tell me @OneDayAtATime got fucking saved !!!!!,en,"[{'screen_name': 'onedayatatime', 'name': 'one day at a time', 'id': '4898738434'}]",[],[],0,0,0,[],[],https://twitter.com/trulesrikan/status/1144369760831987712,False,,0,,new york city,,,,,,[],,,,
1144369676128083968,1144369676128083968,2019-06-27 17:19:26 CDT,2019-06-27,17:19:26,-0500,2567702362,digggles,Chodie Foster,,Good evening to Massive Attack and Gui Boratto ONLYYYYYY🚨🚨🚨  https://t.co/R1u9S8AYxZ,en,[],['https://open.spotify.com/track/5Tyi10wvVbd3pu65GCHD8y?si=qUXtxAqoQx6jLTB9b1Jctg'],[],1,0,1,[],[],https://twitter.com/digggles/status/1144369676128083968,False,,0,,new york city,,,,,,[],,,,
1144369553302085632,1144369553302085632,2019-06-27 17:18:57 CDT,2019-06-27,17:18:57,-0500,177479265,averymsartistry,MsArtistry,"{'type': 'Point', 'coordinates': [40.6830331, -73.97586471]}","Tomorrow Tomorrow I need all of my industry friends, media personalities and bloggers to come visit the Peace Mobile/ Erica Ford’s save haven for the youth who undergone gun violence. Meet us in BK @ Barclays Center…  https://t.co/sGluawbJFs",en,[],['https://www.instagram.com/p/BzOs4SmlILL/?igshid=c71uzwivicpj'],[],0,0,2,[],[],https://twitter.com/AveryMsArtistry/status/1144369553302085632,False,,0,,new york city,,,,,,[],,,,
1144369121255202816,1144357889181724679,2019-06-27 17:17:14 CDT,2019-06-27,17:17:14,-0500,197509918,sweetiebabes08,Charina🇮🇹🇺🇸📖,,"@DeadlineWH @mega2e @NicolleDWallace It’s a frame of mind; rape is abt power; E.Jean is taking the power back. She fought Trump &amp;  while he managed to penetrate as crude as it sounds he didnt finish, he didnt get off, she denied him. He didnt take from her. In her mind, she fought, she got away, she won, not rape",en,[],[],[],0,0,0,[],[],https://twitter.com/sweetiebabes08/status/1144369121255202816,False,,0,,new york city,,,,,,"[{'screen_name': 'DeadlineWH', 'name': 'Deadline White House', 'id': '860123351154556928'}, {'screen_name': 'mega2e', 'name': 'megan twohey', 'id': '2598231787'}, {'screen_name': 'NicolleDWallace', 'name': 'Nicolle Wallace', 'id': '860555190'}]",,,,
1144367848770473986,1144367848770473986,2019-06-27 17:12:11 CDT,2019-06-27,17:12:11,-0500,3080565497,carmelynmalalis,Carmelyn P. Malalis,,Kudos to @NYWIFT for convening today’s summit at @FordFoundation to talk about combating sexual harassment &amp; creating inclusion in your industry!   Thx @docuqueen &amp; @SimoneForImpact for inviting me and @NYCCHR  https://t.co/bDAbYBbaNC,en,"[{'screen_name': 'nywift', 'name': 'ny women in film & tv', 'id': '69314352'}, {'screen_name': 'fordfoundation', 'name': 'ford foundation', 'id': '336218991'}, {'screen_name': 'docuqueen', 'name': 'cynthia lopez', 'id': '278204320'}, {'screen_name': 'simoneforimpact', 'name': 'simone', 'id': '20243305'}, {'screen_name': 'nycchr', 'name': 'nyc human rights', 'id': '104265378'}]",[],['https://pbs.twimg.com/media/D-GcPrbWsAA9BTM.jpg'],0,1,7,[],[],https://twitter.com/CarmelynMalalis/status/1144367848770473986,False,,1,https://pbs.twimg.com/media/D-GcPrbWsAA9BTM.jpg,new york city,,,,,,[],,,,
1144365467823431680,1144365467823431680,2019-06-27 17:02:43 CDT,2019-06-27,17:02:43,-0500,17071415,brianjstultz,Brian Stultz,,So many infuriating things in this: 1. His lenient jail sentence 2. The lack of background checks by NBA teams or them knowingly putting a pedophile on staff 3. Philo acting like he is the one that has struggled and has been victimized because of this.   A must read.,en,[],[],[],0,0,1,[],[],https://twitter.com/brianjstultz/status/1144365467823431680,False,https://twitter.com/Deadspin/status/1144293477657829377,0,,new york city,,,,,,[],,,,
1144364536641642496,1144364536641642496,2019-06-27 16:59:01 CDT,2019-06-27,16:59:01,-0500,1209181742,turainc,TURA INC.,"{'type': 'Point', 'coordinates': [40.7142, -74.0064]}","It’s National Sunglasses Day and Ted’s peeling fine  Frame featured: Ted Baker TBW045 GUN @ New York, New York  https://t.co/iYKENIz2wh",en,[],['https://www.instagram.com/p/BzOqYrrhE21/?igshid=gtdewpvw39av'],[],0,0,0,[],[],https://twitter.com/TURAINC/status/1144364536641642496,False,,0,,new york city,,,,,,[],,,,
1144363603006500864,1144363603006500864,2019-06-27 16:55:18 CDT,2019-06-27,16:55:18,-0500,1102927729,itsactuallyava,the main charactHER,,"the democratic     my original murder debate tonight      mystery parties                           🤝 -loosely scripted -socialist pandering -characters we don’t care about have one personality trait (fear of robots, Oprah’s friend, etc) -narrative is way too contrived to follow",en,[],[],[],0,1,15,[],[],https://twitter.com/itsactuallyAva/status/1144363603006500864,False,,0,,new york city,,,,,,[],,,,
1144363426258587655,1144354238048247809,2019-06-27 16:54:36 CDT,2019-06-27,16:54:36,-0500,2747043493,allenhopson2,Allen M. Hopson,,"@NXOnNetflix Let’s face it: The workplace should be the most violent place there is. Like, don’t go near the copier: There’s a skull over there. This anime now doubles as a documentary. Super excited to see this.",en,[],[],[],1,0,0,[],[],https://twitter.com/AllenHopson2/status/1144363426258587655,False,,0,,new york city,,,,,,[],,,,
1144362425510178817,1144362425510178817,2019-06-27 16:50:38 CDT,2019-06-27,16:50:38,-0500,22978903,jamifloyd,jami floyd,,It's the second installment in our new series @npratc examining legal system.  Next up #onTheDocket: #CopsTV and how the show has its worked its way into the national thinking about crime and justice. Listen. Then send YOUR topic ideas @WNYC.   https://t.co/wi4Mf7LCC7,en,"[{'screen_name': 'npratc', 'name': 'all things considered', 'id': '21918310'}, {'screen_name': 'wnyc', 'name': 'wnyc 🎙', 'id': '6576492'}]",['https://www.wnyc.org/story/docket-how-30-years-cops-has-shaped-americas-view-policing/'],[],0,1,5,"['onthedocket', 'copstv']",[],https://twitter.com/jamifloyd/status/1144362425510178817,False,,0,,new york city,,,,,,[],,,,
1144361974186369028,1144361974186369028,2019-06-27 16:48:50 CDT,2019-06-27,16:48:50,-0500,123485134,capithegreat,Capicu,"{'type': 'Point', 'coordinates': [40.85, -73.8669]}",Can't wait till this drops. #capicu and whos_rolo this shits gonna be 🔥🔥🔥 S/o to my cuzo freesmoke100 my nigga @Ricky_Bats make sure y'all follow him stan_x_elyoung._.jefe #watsonfam viewsfromfajardo for shooting the…  https://t.co/f4M86wY1i8,en,"[{'screen_name': 'ricky_bats', 'name': 'ricky bats', 'id': '868541526'}]",['https://www.instagram.com/p/BzOpUMjAfb3/?igshid=u8fj4oe667mi'],[],0,2,3,"['capicu', 'watsonfam']",[],https://twitter.com/CAPITHEGREAT/status/1144361974186369028,False,,0,,new york city,,,,,,[],,,,
1144361343555985408,1144361343555985408,2019-06-27 16:46:20 CDT,2019-06-27,16:46:20,-0500,855763848225333248,kochillin,Christopher A Koch,,Rape and assault has to do with the victim being the perpetrator’s “type” as white privilege has to do with intelligence and aptitude.,en,[],[],[],0,0,0,[],[],https://twitter.com/kochillin/status/1144361343555985408,False,,0,,new york city,,,,,,[],,,,
1144360578271633408,1144360578271633408,2019-06-27 16:43:17 CDT,2019-06-27,16:43:17,-0500,2646517530,nanyouthhuddle,NAN Youth Huddle,"{'type': 'Point', 'coordinates': [40.79795556, -73.94004722]}",Join us this Saturday for the East Harlem Peace march w/ NYC Council Member Diana Ayala and many more community groups and leaders to stand against violence in our community. #ArtOfHealingFestival #StopTheViolence…  https://t.co/mlPzGjUf1w,en,[],['https://www.instagram.com/p/BzOozUYBPll/?igshid=14929wwcl1fjz'],[],0,0,0,"['artofhealingfestival', 'stoptheviolence']",[],https://twitter.com/NANYouthHuddle/status/1144360578271633408,False,,0,,new york city,,,,,,[],,,,
1144360263375831040,1144360263375831040,2019-06-27 16:42:02 CDT,2019-06-27,16:42:02,-0500,813122851792449538,_rahims,D r e a m v i l l a i n,,"Ei wey girl she arrest Obo ien mind, soul and body like that?",en,[],[],[],1,1,3,[],[],https://twitter.com/_rahims/status/1144360263375831040,False,,0,,new york city,,,,,,[],,,,
1144359727847133184,1144359727847133184,2019-06-27 16:39:54 CDT,2019-06-27,16:39:54,-0500,378198281,marcliverman,Marc Liverman,,#Police are seeking three men accused of ambushing and robbing a man at knifepoint right in front of his home in the Soundview section of the #Bronx. Surveillance video caught the entire #attack.  https://t.co/e4SiTRvMpv,en,[],[],[],0,0,0,"['police', 'bronx', 'attack']",[],https://twitter.com/MarcLiverman/status/1144359727847133184,False,,1,https://pbs.twimg.com/ext_tw_video_thumb/1144359494299869184/pu/img/iO6PQK0jnTYSDsAs.jpg,new york city,,,,,,[],,,,
1144357885356519433,1144272932887322627,2019-06-27 16:32:35 CDT,2019-06-27,16:32:35,-0500,858309264,mariaorchid526,MEA2020,,@Ultravioletray2 @kristia93326673 Lol ! If anger is stating the brutal truth. I much rather be angry than in denial! I’m not angry at all I’m super proud and HAPPY bc I have Trump as the president of the USA KAG 2020🇺🇸,en,[],[],[],0,0,0,[],[],https://twitter.com/MariaOrchid526/status/1144357885356519433,False,,0,,new york city,,,,,,"[{'screen_name': 'Ultravioletray2', 'name': 'Ultravioletrayyy', 'id': '1112970258988576768'}, {'screen_name': 'kristia93326673', 'name': 'kristian', 'id': '1003307558956920832'}]",,,,
1144355392358477824,1144355392358477824,2019-06-27 16:22:41 CDT,2019-06-27,16:22:41,-0500,929308119645040640,rainbowrooaus,Rainbow Roo,,"The Stonewall riots were a series of spontaneous, violent demonstrations by the LGBT community.  Today, Gay Pride events are held annually throughout the world toward the end of June to mark the Stonewall riots.  Please Like 👍 Share 💌 Comment ⌨  #RainbowRoo #StonewallRiots  https://t.co/UIP8CJxk9S",en,[],[],['https://pbs.twimg.com/media/D-GRJ_CUEAAlXzd.jpg'],0,0,3,"['rainbowroo', 'stonewallriots']",[],https://twitter.com/RainbowRooAus/status/1144355392358477824,False,,1,https://pbs.twimg.com/media/D-GRJ_CUEAAlXzd.jpg,new york city,,,,,,[],,,,
1144354723874713604,1144354723874713604,2019-06-27 16:20:01 CDT,2019-06-27,16:20:01,-0500,3903525218,youssof_g,Youssof Ghafoorzai,,Addressed the #CTC Briefing on #ProtectingSoftTargets. Highlighted the nature of the threat facing civilians &amp; public infrastructure in #Afghanistan from terrorist &amp; extremist groups and the GoA’s national protection measures.  https://t.co/M2qscP5N8r,en,[],[],"['https://pbs.twimg.com/media/D-GQjjBXsAY2sqc.jpg', 'https://pbs.twimg.com/media/D-GQjjoXYAAH19l.jpg']",0,1,14,"['ctc', 'protectingsofttargets', 'afghanistan']",[],https://twitter.com/youssof_g/status/1144354723874713604,False,,1,https://pbs.twimg.com/media/D-GQjjBXsAY2sqc.jpg,new york city,,,,,,[],,,,
1144354522246144003,1144354522246144003,2019-06-27 16:19:13 CDT,2019-06-27,16:19:13,-0500,824317598414340102,bradleyrsimpson,Brad Simpson,,"@RepRaskin this bill is an abomination. As a constituent of yours who has long respected your support for immigrant rights, I strongly urge you to reject giving money to the Trump administration to imprison and abuse migrant children.",en,[],[],[],0,0,0,[],[],https://twitter.com/bradleyrsimpson/status/1144354522246144003,False,https://twitter.com/IndivisibleTeam/status/1144313566146781185,0,,new york city,,,,,,[],,,,
1144354472711335937,1144354472711335937,2019-06-27 16:19:02 CDT,2019-06-27,16:19:02,-0500,635923278,nezukostomato,Big Time Tommy⏩ Home,,copped the attack on titan game for $20 and im hyped to try dat ish it looks rlly fun,en,[],[],[],0,0,0,[],[],https://twitter.com/NezukosTomato/status/1144354472711335937,False,,0,,new york city,,,,,,[],,,,
1144354373323173901,1144354373323173901,2019-06-27 16:18:38 CDT,2019-06-27,16:18:38,-0500,245953646,joeborellinyc,Joe Borelli,,I am fully cognizant that there would be no reasons to make this a crime if folks would just stop airdroppin their junk.  https://t.co/A8ezLWLE1l via @nypmetro,en,"[{'screen_name': 'nypmetro', 'name': 'new york post metro', 'id': '1158638582'}]",['https://nypost.com/2019/06/27/nypd-backs-proposal-to-make-texting-unsolicited-lewd-pictures-a-crime/?utm_source=twitter_sitebuttons&utm_medium=site%20buttons&utm_campaign=site%20buttons'],[],0,1,2,[],[],https://twitter.com/JoeBorelliNYC/status/1144354373323173901,False,,0,,new york city,,,,,,[],,,,
