id,conversation_id,created_at,date,time,timezone,user_id,username,name,place,tweet,language,mentions,urls,photos,replies_count,retweets_count,likes_count,hashtags,cashtags,link,retweet,quote_url,video,thumbnail,near,geo,source,user_rt_id,user_rt,retweet_id,reply_to,retweet_date,translate,trans_src,trans_dest
1300221729344761868,1300205812875395072,2020-08-30 18:59:51 CDT,2020-08-30,18:59:51,-0500,102558152,yosoymichael,Exa Dark Sideræl,,"Unfortunately, Machine Gun Kelly is extremely hot and turns nothing but LOOKS. #VMAs",en,[],[],[],1,2,21,['vmas'],[],https://twitter.com/yosoymichael/status/1300221729344761868,False,,0,,new york city,,,,,,[],,,,
1300221534997565441,1300221534997565441,2020-08-30 18:59:05 CDT,2020-08-30,18:59:05,-0500,217994278,aara_jahaan,Peter Popoff,,Wait when did Machine Gun Kelly start making this kind of music or am i late?,en,[],[],[],1,0,0,[],[],https://twitter.com/aara_jahaan/status/1300221534997565441,False,,0,,new york city,,,,,,[],,,,
1300221375005831169,1300221375005831169,2020-08-30 18:58:27 CDT,2020-08-30,18:58:27,-0500,46257426,rep_melodrama,Mad Woman,,Machine gun Kelly.... hmm potentially h word right now,en,[],[],[],1,0,3,[],[],https://twitter.com/rep_melodrama/status/1300221375005831169,False,,0,,new york city,,,,,,[],,,,
1300221187210072065,1300221187210072065,2020-08-30 18:57:42 CDT,2020-08-30,18:57:42,-0500,3187809960,gorebiogger,dylan,,machine gun kelly i will suck your dick off.,en,[],[],[],1,3,8,[],[],https://twitter.com/gorebIogger/status/1300221187210072065,False,,0,,new york city,,,,,,[],,,,
1300221186681581569,1299515943559876611,2020-08-30 18:57:42 CDT,2020-08-30,18:57:42,-0500,1153045267714891776,fanaticalmodera,Debra Rothman,,"@mnchiguy @JackieRMark Civil Rights Movement.  I was still a child but others, including my parents, attended peaceful demonstrations where they knew police, KKK, even local citizens, could turn violent and that unfair arrests, carried out brutally, could occur.",en,[],[],[],2,0,0,[],[],https://twitter.com/FanaticalModera/status/1300221186681581569,False,,0,,new york city,,,,,,"[{'screen_name': 'mnchiguy', 'name': 'LJR', 'id': '201834109'}, {'screen_name': 'JackieRMark', 'name': 'Jackie Mark', 'id': '19930888'}]",,,,
1300221098362105864,1300221098362105864,2020-08-30 18:57:21 CDT,2020-08-30,18:57:21,-0500,97991720,breadleypasta,breadley,,who the fuck is machine gun kelly,en,[],[],[],0,0,6,[],[],https://twitter.com/breadleypasta/status/1300221098362105864,False,,0,,new york city,,,,,,[],,,,
1300221041730637825,1300221041730637825,2020-08-30 18:57:07 CDT,2020-08-30,18:57:07,-0500,1111779299714101248,malviciouss,BLUNT$Y NATRA aka,,"Dotson is almost exactly him. But i wouldnt mind i guess. Always need a Ronnie Brewer, Shawne Williams esque player off the bench or someone who can fill in for an injured starter",en,[],[],[],0,0,3,[],[],https://twitter.com/MALVICIOUSS/status/1300221041730637825,False,https://twitter.com/DailyKnicksFS/status/1300053084647944192,0,,new york city,,,,,,[],,,,
1300220877745860615,1300220877745860615,2020-08-30 18:56:28 CDT,2020-08-30,18:56:28,-0500,216883683,sabiotrix,Mack Milds 🌍,,Why does Adele get a pass for that hair style?? Y’all would attack any other Caucasian woman for it.,en,[],[],[],1,0,0,[],[],https://twitter.com/sabiotrix/status/1300220877745860615,False,,0,,new york city,,,,,,[],,,,
1300220868245762052,1300220868245762052,2020-08-30 18:56:26 CDT,2020-08-30,18:56:26,-0500,109604318,shrimpfriedflee,BUTTA BEANZ,,Machine Gun Kelly doing punk &gt;&gt;,en,[],[],[],0,0,1,[],[],https://twitter.com/SHRIMPFRIEDFLEE/status/1300220868245762052,False,,0,,new york city,,,,,,[],,,,
1300220672711569410,1300202697682038784,2020-08-30 18:55:39 CDT,2020-08-30,18:55:39,-0500,373520532,buaidh_bhoyshh,MadSweeneyHH🥃,,"@Iconic1967 @EasyPeasy_3 I can honestly say if they’re wearing tha Hoops, I’m a fan. I’ll make some dafty comments in jest, but that’s it. I just would rather hope they improve than give dug’s abuse. HH!🍀",en,[],[],[],0,0,1,[],[],https://twitter.com/Buaidh_BhoysHH/status/1300220672711569410,False,,0,,new york city,,,,,,"[{'screen_name': 'Iconic1967', 'name': '“World Firsts”.Plural.😎✌️🍀', 'id': '1205504458244993025'}, {'screen_name': 'EasyPeasy_3', 'name': 'James 🏴\U000e0067\U000e0062\U000e0073\U000e0063\U000e0074\U000e007f 🇺🇦', 'id': '710965244466741248'}]",,,,
1300220093905940480,1300220093905940480,2020-08-30 18:53:21 CDT,2020-08-30,18:53:21,-0500,216883683,sabiotrix,Mack Milds 🌍,,Didn’t touch his gun once.....,en,[],[],[],0,0,0,[],[],https://twitter.com/sabiotrix/status/1300220093905940480,False,https://twitter.com/RexChapman/status/1300084155880034315,0,,new york city,,,,,,[],,,,
1300219563209101315,1300219563209101315,2020-08-30 18:51:15 CDT,2020-08-30,18:51:15,-0500,1243771508,mleenycx,MLeeNYC Ⓥ,,Six-month-old puppy dies of horror injuries after being violently raped by monster sparking outrage in Chile  https://t.co/wzTM0I53la Praying #CoronaKarma #MotherNatureRevenge #COVID strikes down #Evil humans who abuse my #AnimalFriends ‼️,en,[],['https://www.newsbreakapp.com/n/0WnTVO9K?pd=06746d91&s=i4'],[],0,0,0,"['coronakarma', 'mothernaturerevenge', 'covid', 'evil', 'animalfriends']",[],https://twitter.com/MLeeNYCx/status/1300219563209101315,False,,0,,new york city,,,,,,[],,,,
1300219522633400320,1299856620965564417,2020-08-30 18:51:05 CDT,2020-08-30,18:51:05,-0500,2760578974,thecoolan,/ Nishat K. 🇺🇦,,@BrandonMeijers I meant cops in general even before they brutalize a victim,en,[],[],[],0,0,0,[],[],https://twitter.com/thecoolan/status/1300219522633400320,False,,0,,new york city,,,,,,[],,,,
1300219199839784961,1300219199839784961,2020-08-30 18:49:48 CDT,2020-08-30,18:49:48,-0500,1855950080,forceweilder_,KnifePrty,,Trump is a racist who hasn’t been caught saying the n-word yet.,en,[],[],[],0,0,1,[],[],https://twitter.com/forceweilder_/status/1300219199839784961,False,,0,,new york city,,,,,,[],,,,
1300218318255726592,1300218318255726592,2020-08-30 18:46:18 CDT,2020-08-30,18:46:18,-0500,213407144,ruthiecab,ruthie j caballero,,Trump supporters went to Portland &amp; Kenosha to engage in violent/criminal acts. Trump supports the violent actions from these White Nationalist/KKK groups. #TrumpViolence #TrumpFailure #VoteTrumpOut @realDonaldTrump @WhiteHouse Trump is All About Trump All The Time @cnnbrk @AP,en,"[{'screen_name': 'realdonaldtrump', 'name': 'donald j. trump', 'id': '25073877'}, {'screen_name': 'whitehouse', 'name': 'the white house', 'id': '1323730225067339784'}, {'screen_name': 'cnnbrk', 'name': 'cnn breaking news', 'id': '428333'}, {'screen_name': 'ap', 'name': 'the associated press', 'id': '51241574'}]",[],[],0,0,0,"['trumpviolence', 'trumpfailure', 'votetrumpout']",[],https://twitter.com/ruthiecab/status/1300218318255726592,False,,0,,new york city,,,,,,[],,,,
1300217652984512513,1300217652984512513,2020-08-30 18:43:40 CDT,2020-08-30,18:43:40,-0500,246506982,domodbaker,KT,,Satanic ritual child sex abuse &amp; sacrifice! #saveourchildren #pizzagateisreal #hollywoodpedophiles #60minutes #theracewarisadistraction #fakenewsistheenemyofthepeople #themediaiscomplicit #politicanpedos  https://t.co/BIVhRry9SC,en,[],[],[],0,0,2,"['saveourchildren', 'pizzagateisreal', 'hollywoodpedophiles', '60minutes', 'theracewarisadistraction', 'fakenewsistheenemyofthepeople', 'themediaiscomplicit', 'politicanpedos']",[],https://twitter.com/Domodbaker/status/1300217652984512513,False,,1,https://pbs.twimg.com/ext_tw_video_thumb/1300217580825829376/pu/img/bUti5xlff-WcbOC0.jpg,new york city,,,,,,[],,,,
1300216294340468736,1300150036181987329,2020-08-30 18:38:16 CDT,2020-08-30,18:38:16,-0500,1146896015519358977,dicey631,Dicey631 Louis,,@SenSchumer Stop lying chuck Democrats own the violence all in Democrat cities with Democrats leadership,en,[],[],[],0,1,3,[],[],https://twitter.com/dicey631/status/1300216294340468736,False,,0,,new york city,,,,,,"[{'screen_name': 'SenSchumer', 'name': 'Chuck Schumer', 'id': '17494010'}]",,,,
1300216237243486208,1300216237243486208,2020-08-30 18:38:02 CDT,2020-08-30,18:38:02,-0500,23797714,jamesphipps,James Phipps,,Why are so many of Trump’s sycophants deflecting from the accusations of child rape against him?   https://t.co/OMx4IN1n0C,en,[],['https://www.independent.co.uk/news/world/americas/donald-trump-accused-underage-rape-lawsuit-a7352976.html'],[],0,0,2,[],[],https://twitter.com/JamesPhipps/status/1300216237243486208,False,https://twitter.com/PrisonPlanet/status/1300211114232426503,0,,new york city,,,,,,[],,,,
1300216072944193538,1300113821894356997,2020-08-30 18:37:23 CDT,2020-08-30,18:37:23,-0500,720432251956248576,helen_highly,HelenHighly,,@dukeblue24 @AnthonyBenenati @Surfcityslicker @FrankieSaysNews @Weinsteinlaw @kurteichenwald They are wrong to resort to violence. We would be wrong to do the same. This is a time for us to know our principles &amp; what we stand for. We stand for free speech &amp; right to protest. We stand for democracy. We should not give up those things. But we do not make war on our streets,en,[],[],[],1,0,0,[],[],https://twitter.com/Helen_Highly/status/1300216072944193538,False,,0,,new york city,,,,,,"[{'screen_name': 'dukeblue24', 'name': 'Mike Sutton', 'id': '30278698'}, {'screen_name': 'Surfcityslicker', 'name': 'Dolphin Sunset - #IStandWithUkraine🇺🇦🌻', 'id': '3111049027'}, {'screen_name': 'FrankieSaysNews', 'name': 'Cobra Chicken® 🇨🇦', 'id': '497763032'}, {'screen_name': 'Weinsteinlaw', 'name': 'Andrew Weinstein', 'id': '22879254'}, {'screen_name': 'kurteichenwald', 'name': 'Kurt Eichenwald', 'id': '215207998'}]",,,,
1300215260402667522,1300193033581928448,2020-08-30 18:34:09 CDT,2020-08-30,18:34:09,-0500,574104652,uws89,Christine Kennedy,,@realDonaldTrump Stop inciting violence!,en,[],[],[],0,0,0,[],[],https://twitter.com/uws89/status/1300215260402667522,False,,0,,new york city,,,,,,"[{'screen_name': 'realDonaldTrump', 'name': 'Donald J. Trump', 'id': '25073877'}]",,,,
1300214952297459712,1300113821894356997,2020-08-30 18:32:56 CDT,2020-08-30,18:32:56,-0500,720432251956248576,helen_highly,HelenHighly,,"@dukeblue24 @AnthonyBenenati @Surfcityslicker @FrankieSaysNews @Weinsteinlaw @kurteichenwald A full on fire battle. Yes they’re attacking &amp; assaulting &amp; even killing now. The police are abusing their power. That’s not the same as declaring war. And we need to keep documenting, photographing, prosecuting. We need to continue peaceful protest &amp; call them out for abuse.",en,[],[],[],1,0,0,[],[],https://twitter.com/Helen_Highly/status/1300214952297459712,False,,0,,new york city,,,,,,"[{'screen_name': 'dukeblue24', 'name': 'Mike Sutton', 'id': '30278698'}, {'screen_name': 'Surfcityslicker', 'name': 'Dolphin Sunset - #IStandWithUkraine🇺🇦🌻', 'id': '3111049027'}, {'screen_name': 'FrankieSaysNews', 'name': 'Cobra Chicken® 🇨🇦', 'id': '497763032'}, {'screen_name': 'Weinsteinlaw', 'name': 'Andrew Weinstein', 'id': '22879254'}, {'screen_name': 'kurteichenwald', 'name': 'Kurt Eichenwald', 'id': '215207998'}]",,,,
1300214047598686208,1300166872671821824,2020-08-30 18:29:20 CDT,2020-08-30,18:29:20,-0500,217493128,daclementmusic,DeClementia,,@FriendlyJMC @onmyconnor @wieder_john @pnjaban @jenvanlaar @MrAndyNgo And yet there’s no evidence and then he was fired from Quillette for lying and misrepresenting videos and was filmed helping nazi proud boys plan an attack on a bar so ... it seems like there are a few thing to consider here,en,[],[],[],0,0,3,[],[],https://twitter.com/DaClementMusic/status/1300214047598686208,False,,0,,new york city,,,,,,"[{'screen_name': 'FriendlyJMC', 'name': 'TexasJan❤️🇺🇸', 'id': '4821375853'}, {'screen_name': 'wieder_john', 'name': 'john wieder', 'id': '1262596871828107264'}, {'screen_name': 'pnjaban', 'name': 'Harmeet K. Dhillon', 'id': '201066140'}, {'screen_name': 'jenvanlaar', 'name': 'Jennifer Van Laar', 'id': '775137023979958272'}, {'screen_name': 'MrAndyNgo', 'name': 'Andy Ngô 🏳️\u200d🌈', 'id': '2835451658'}]",,,,
1300213804794552324,1300130924147781633,2020-08-30 18:28:22 CDT,2020-08-30,18:28:22,-0500,3288147861,brianurhumble,Eugene B Douglas,,@BoyneSierra It's not your fault it is the terrible times we are in! It is the crazyness at the top!  #45Incites violence &amp; rage…!,en,[],[],[],0,0,1,['45incites'],[],https://twitter.com/brianurhumble/status/1300213804794552324,False,,0,,new york city,,,,,,[],,,,
1300213788340367361,1300210764997947393,2020-08-30 18:28:18 CDT,2020-08-30,18:28:18,-0500,23357627,susala77,Susala 77🇺🇸,,@myhubsdick Their son is alive and will never  be able sexually assault a woman again.,en,[],[],[],0,0,0,[],[],https://twitter.com/Susala77/status/1300213788340367361,False,,0,,new york city,,,,,,"[{'screen_name': 'myhubsdick', 'name': 'MHD ready for spring', 'id': '1250909900269654019'}]",,,,
1300213319895265282,1300173395213144065,2020-08-30 18:26:26 CDT,2020-08-30,18:26:26,-0500,217493128,daclementmusic,DeClementia,,"@laralogan @realDonaldTrump Andy Ngo who was fired from ultra conservative Qulliette for lying, editing videos to make it look like nazis were victims and then got caught helping said nazis plan an attack on a bar? That Andy Ngo?",en,[],[],[],0,0,1,[],[],https://twitter.com/DaClementMusic/status/1300213319895265282,False,,0,,new york city,,,,,,"[{'screen_name': 'laralogan', 'name': 'Lara Logan', 'id': '1098091506886471680'}, {'screen_name': 'realDonaldTrump', 'name': 'Donald J. Trump', 'id': '25073877'}]",,,,
1300213242938224640,1300213242938224640,2020-08-30 18:26:08 CDT,2020-08-30,18:26:08,-0500,213407144,ruthiecab,ruthie j caballero,,Trump promotes hate and violence actions in American cities. Trump the Racist is attacking American cities. #VoteTrumpOut #TrumpViolence #TrumpViolence #VoteBidenHarrisToSaveAmerica @politico @cnnbrk @MSNBC @AP @realDonaldTrump @WhiteHouse @politico #TrumpFailed Vote Trump out,en,"[{'screen_name': 'politico', 'name': 'politico', 'id': '9300262'}, {'screen_name': 'cnnbrk', 'name': 'cnn breaking news', 'id': '428333'}, {'screen_name': 'msnbc', 'name': 'msnbc', 'id': '2836421'}, {'screen_name': 'ap', 'name': 'the associated press', 'id': '51241574'}, {'screen_name': 'realdonaldtrump', 'name': 'donald j. trump', 'id': '25073877'}, {'screen_name': 'whitehouse', 'name': 'the white house', 'id': '1323730225067339784'}, {'screen_name': 'politico', 'name': 'politico', 'id': '9300262'}]",[],[],0,0,0,"['votetrumpout', 'trumpviolence', 'trumpviolence', 'votebidenharristosaveamerica', 'trumpfailed']",[],https://twitter.com/ruthiecab/status/1300213242938224640,False,https://twitter.com/BillKristol/status/1300076983754403840,0,,new york city,,,,,,[],,,,
1300212946321182720,1300206730006204418,2020-08-30 18:24:57 CDT,2020-08-30,18:24:57,-0500,1101617222,maziakuchie,M A A Z I,,"@AfamDeluxo The ones on Twitter are more knowledgeable, brutal, no-nonsense defenders of Ndigbo, next are those on Facebook... The ones on Instagram are there to salivate on pictures of Instagram celebrities, and fine girls.",en,[],[],[],1,0,13,[],[],https://twitter.com/MaziAkuchie/status/1300212946321182720,False,,0,,new york city,,,,,,"[{'screen_name': 'AfamDeluxo', 'name': 'Ajị bussu 🏳\u200d🌈', 'id': '159638969'}]",,,,
1300212412059136000,1300212412059136000,2020-08-30 18:22:50 CDT,2020-08-30,18:22:50,-0500,213407144,ruthiecab,ruthie j caballero,,This fake Christian site is a White Supremacy/White Nationalist hate site who follows &amp; promotes the Racist President Trump. #TrumpViolence #TrumpFailure #VoteTrumpOut2020 #VoteBidenHarrisToSaveAmerica Trump creates hate actions in American cities @cnnbrk @MSNBC @washingtonpost,en,"[{'screen_name': 'cnnbrk', 'name': 'cnn breaking news', 'id': '428333'}, {'screen_name': 'msnbc', 'name': 'msnbc', 'id': '2836421'}, {'screen_name': 'washingtonpost', 'name': 'the washington post', 'id': '2467791'}]",[],[],0,1,1,"['trumpviolence', 'trumpfailure', 'votetrumpout2020', 'votebidenharristosaveamerica']",[],https://twitter.com/ruthiecab/status/1300212412059136000,False,https://twitter.com/ImpeachmentHour/status/1300028643540979712,0,,new york city,,,,,,[],,,,
1300212191954644993,1300212190117605376,2020-08-30 18:21:57 CDT,2020-08-30,18:21:57,-0500,352580700,raediamond,💎Hefe O-Ren Ishii💎,,Where is the outreach to make sure those who are only in jail and haven’t been convicted of a crime that removes their right to vote ?! WHERE YOU FUCKING DEMS AT?? WHY YALL NOT TRYING TO GET THEM? Don’t they count?? Oh wait...y,en,[],[],[],1,0,0,[],[],https://twitter.com/RaeDiamond/status/1300212191954644993,False,,0,,new york city,,,,,,[],,,,
1300212136912842759,1300212136912842759,2020-08-30 18:21:44 CDT,2020-08-30,18:21:44,-0500,741733989333893120,tweetsbybub,jean,,If I seen this shit this man would not walk away with his life. Y’all talk all this crazy shit online but how come every time this happens all we see are people standing around? Y’all couldn’t push him off? Grab him? Put him in a citizens arrest until the cops came?,en,[],[],[],1,6,16,[],[],https://twitter.com/tweetsbybub/status/1300212136912842759,False,https://twitter.com/MylesMill/status/1300053562836299778,0,,new york city,,,,,,[],,,,
1300211451483820032,1300211451483820032,2020-08-30 18:19:01 CDT,2020-08-30,18:19:01,-0500,213407144,ruthiecab,ruthie j caballero,,Trump is a failure who golfs while the USA is in crisis. #TrumpViolence #TrumpFailure #VoteTrumpOut2020 @realDonaldTrump @WhiteHouse Trump the Racist/White Supremacist-KKK Supporter/Follower/Trump promotes violence against peaceful protestors. Trump promotes hate crimes @cnnbrk,en,"[{'screen_name': 'realdonaldtrump', 'name': 'donald j. trump', 'id': '25073877'}, {'screen_name': 'whitehouse', 'name': 'the white house', 'id': '1323730225067339784'}, {'screen_name': 'cnnbrk', 'name': 'cnn breaking news', 'id': '428333'}]",[],[],0,0,0,"['trumpviolence', 'trumpfailure', 'votetrumpout2020']",[],https://twitter.com/ruthiecab/status/1300211451483820032,False,https://twitter.com/KellyO/status/1300141213333495810,0,,new york city,,,,,,[],,,,
1300211163901370375,1299861482017042432,2020-08-30 18:17:52 CDT,2020-08-30,18:17:52,-0500,8609702,lorskyfink,Loren Finkelstein,,"@brooklyndan Thursday this week was really brutal for me, but Friday and Saturday made up for it.",en,[],[],[],0,0,0,[],[],https://twitter.com/Lorskyfink/status/1300211163901370375,False,,0,,new york city,,,,,,"[{'screen_name': 'brooklyndan', 'name': 'Dan Rosenbaum', 'id': '15585942'}]",,,,
1300210234309345283,1300210234309345283,2020-08-30 18:14:11 CDT,2020-08-30,18:14:11,-0500,213407144,ruthiecab,ruthie j caballero,,Trump your presence in Kenosha will only incite more violent protests. Trump you are a failure as President. #VoteTrumpOut2020 #TrumpFailed @realDonaldTrump @WhiteHouse Trump is a Racist/Promotes Violence Against Protestors/Follows KKK-White Supremacy Groups.  #VoteBidenHarris,en,"[{'screen_name': 'realdonaldtrump', 'name': 'donald j. trump', 'id': '25073877'}, {'screen_name': 'whitehouse', 'name': 'the white house', 'id': '1323730225067339784'}]",[],[],0,0,0,"['votetrumpout2020', 'trumpfailed', 'votebidenharris']",[],https://twitter.com/ruthiecab/status/1300210234309345283,False,https://twitter.com/KellyO/status/1300164310556184576,0,,new york city,,,,,,[],,,,
1300209518350086145,1300042524065587200,2020-08-30 18:11:20 CDT,2020-08-30,18:11:20,-0500,1103584340506755072,shadezoftabby,50Shadezoftabby,,@IAMBENZINO Do you have fans still?... not the officers that arrest you for harassing thi thi 🤣🤣,en,[],[],[],0,0,0,[],[],https://twitter.com/shadezoftabby/status/1300209518350086145,False,,0,,new york city,,,,,,"[{'screen_name': 'IAMBENZINO', 'name': 'Benzino', 'id': '574311511'}]",,,,
1300208881688293376,1300208881688293376,2020-08-30 18:08:48 CDT,2020-08-30,18:08:48,-0500,213407144,ruthiecab,ruthie j caballero,,Trump you are responsible for the violence in Portland. Trump you are a  Racist/The White Supremacy/KKK groups that you support bring shame to the USA #VoteTrumpOut2020 #TrumpViolence @realDonaldTrump @WhiteHouse #TrumpFailed #VoteBidenHarrisToSaveAmerica2020 @cnnbrk @MSNBC @AP,en,"[{'screen_name': 'realdonaldtrump', 'name': 'donald j. trump', 'id': '25073877'}, {'screen_name': 'whitehouse', 'name': 'the white house', 'id': '1323730225067339784'}, {'screen_name': 'cnnbrk', 'name': 'cnn breaking news', 'id': '428333'}, {'screen_name': 'msnbc', 'name': 'msnbc', 'id': '2836421'}, {'screen_name': 'ap', 'name': 'the associated press', 'id': '51241574'}]",[],[],0,0,0,"['votetrumpout2020', 'trumpviolence', 'trumpfailed', 'votebidenharristosaveamerica2020']",[],https://twitter.com/ruthiecab/status/1300208881688293376,False,https://twitter.com/KamalaHarris/status/1300190810202353674,0,,new york city,,,,,,[],,,,
1300208199824543744,1300208199824543744,2020-08-30 18:06:06 CDT,2020-08-30,18:06:06,-0500,3288147861,brianurhumble,Eugene B Douglas,,#45 incites violence,en,[],[],[],0,0,0,[],[],https://twitter.com/brianurhumble/status/1300208199824543744,False,https://twitter.com/Blake_RESISTS/status/1300201191297736704,0,,new york city,,,,,,[],,,,
1300208054554824704,1299184932384768001,2020-08-30 18:05:31 CDT,2020-08-30,18:05:31,-0500,217493128,daclementmusic,DeClementia,,"@Alex_will_sleep @DigbyPink @morgan313 @BlokeStokey @Styx666Official @JoeBiden Protest became riots when the masked feds with tape over their name plates starting attacking and abducting people. The city was calm in down before the heehaw brethren drive in from Idaho yesterday and started making, shooting pellets, and driving their vehicles into protesters.",en,[],[],[],3,0,1,[],[],https://twitter.com/DaClementMusic/status/1300208054554824704,False,,0,,new york city,,,,,,"[{'screen_name': 'Alex_will_sleep', 'name': 'Alex', 'id': '1030521728'}, {'screen_name': 'DigbyPink', 'name': 'Digby Pink', 'id': '885181875546988548'}, {'screen_name': 'morgan313', 'name': 'Morgan Raven', 'id': '34349145'}, {'screen_name': 'BlokeStokey', 'name': 'A Bloke From Stoke', 'id': '1203715886617710594'}, {'screen_name': 'Styx666Official', 'name': 'Styxhexenhammer666', 'id': '807812802761158656'}, {'screen_name': 'JoeBiden', 'name': 'Joe Biden', 'id': '939091'}]",,,,
1300207032654589956,1300207032654589956,2020-08-30 18:01:27 CDT,2020-08-30,18:01:27,-0500,1209419911,stevie_g_smith,Stevie,,@realDonaldTrump does not want to put an end to the violence in Portland. He is calling for armed militias to take to the street in his name.,en,[],[],[],0,0,0,[],[],https://twitter.com/stevie_g_smith/status/1300207032654589956,False,,0,,new york city,,,,,,[],,,,
1300206805751074822,1300206805751074822,2020-08-30 18:00:33 CDT,2020-08-30,18:00:33,-0500,1306117880,jaykyle8,Sir Jason of House Moderna 🏳️‍🌈,,"“Let’s tweet the word of God,” said Kenny, who proceeded to go on Twitter and post racist propaganda instead. .@Kenny_Sowellfan, just so it’s clear, God isn’t a fan of racism. Ok?  https://t.co/qYOaCkBK1v",en,[],[],"['https://pbs.twimg.com/media/EgtDMotX0AEs2yi.jpg', 'https://pbs.twimg.com/media/EgtDMpSXkAAJM54.jpg']",0,0,0,[],[],https://twitter.com/jaykyle8/status/1300206805751074822,False,,1,https://pbs.twimg.com/media/EgtDMotX0AEs2yi.jpg,new york city,,,,,,[],,,,
1300206431136776192,1299184932384768001,2020-08-30 17:59:04 CDT,2020-08-30,17:59:04,-0500,217493128,daclementmusic,DeClementia,,"@Alex_will_sleep @DigbyPink @morgan313 @BlokeStokey @Styx666Official @JoeBiden Dan Crenshaw? Really? He’s kind of a 33% of the time truth teller, which makes him special in gop Also, did you see the footage that THE PRESIDENT posted of his cult actually shooting PEACEFUL protesters with paintballs! Which is assault! And he was telling them how proud he is.",en,[],[],[],0,0,0,[],[],https://twitter.com/DaClementMusic/status/1300206431136776192,False,,0,,new york city,,,,,,"[{'screen_name': 'Alex_will_sleep', 'name': 'Alex', 'id': '1030521728'}, {'screen_name': 'DigbyPink', 'name': 'Digby Pink', 'id': '885181875546988548'}, {'screen_name': 'morgan313', 'name': 'Morgan Raven', 'id': '34349145'}, {'screen_name': 'BlokeStokey', 'name': 'A Bloke From Stoke', 'id': '1203715886617710594'}, {'screen_name': 'Styx666Official', 'name': 'Styxhexenhammer666', 'id': '807812802761158656'}, {'screen_name': 'JoeBiden', 'name': 'Joe Biden', 'id': '939091'}]",,,,
1300206379333029892,1300206379333029892,2020-08-30 17:58:52 CDT,2020-08-30,17:58:52,-0500,224063292,reggdogz,reggieregg,,"It takes one brave person to star a chain reaction, if I kick him in the head and he proceeded to attack me I would think a few of us could control the situation",en,[],[],[],0,0,0,[],[],https://twitter.com/reggdogz/status/1300206379333029892,False,https://twitter.com/PMavProducer/status/1300146364622536705,0,,new york city,,,,,,[],,,,
1300204922445721600,1300204922445721600,2020-08-30 17:53:04 CDT,2020-08-30,17:53:04,-0500,190488649,giaco1025,Paul Giacomino,,This is a brutal take. Lol,en,[],[],[],0,0,0,[],[],https://twitter.com/giaco1025/status/1300204922445721600,False,https://twitter.com/Joelsherman1/status/1300149685001297923,0,,new york city,,,,,,[],,,,
1300204143735267329,1300164706007740416,2020-08-30 17:49:59 CDT,2020-08-30,17:49:59,-0500,1306117880,jaykyle8,Sir Jason of House Moderna 🏳️‍🌈,,@Kenny_Sowellfan @JoeBiden I see you’re a pastor and it’s Sunday. Nice. Very very classy of you to post some racist propaganda like this. I’m sure god is “proud”  https://t.co/w9ZBHyxFH0,en,[],[],['https://pbs.twimg.com/tweet_video_thumb/EgtAxivXcAA3DAE.jpg'],2,0,0,[],[],https://twitter.com/jaykyle8/status/1300204143735267329,False,,1,https://pbs.twimg.com/tweet_video_thumb/EgtAxivXcAA3DAE.jpg,new york city,,,,,,"[{'screen_name': 'JoeBiden', 'name': 'Joe Biden', 'id': '939091'}]",,,,
