id,conversation_id,created_at,date,time,timezone,user_id,username,name,place,tweet,language,mentions,urls,photos,replies_count,retweets_count,likes_count,hashtags,cashtags,link,retweet,quote_url,video,thumbnail,near,geo,source,user_rt_id,user_rt,retweet_id,reply_to,retweet_date,translate,trans_src,trans_dest
1300203907583442950,1300203907583442950,2020-08-30 17:49:02 CDT,2020-08-30,17:49:02,-0500,1038208115525799936,nypdtips,NYPD Crime Stoppers,,￼🚨WANTED🚨￼for a SHOOTING 874 39th St  #SunsetPark  #Brooklyn  @NYPD66pct  on 8/29/20 @ 8:46PM ￼💰Reward up to $2500￼🕶Seen them? Know who they are?￼☎️Call 1-800-577-TIPS or DM us!￼📞Calls are CONFIDENTIAL! #YourCityYourCall @NYPDDetectives @NYPDShea @NYPDChiefofDept  https://t.co/H9pLJRmRLJ,en,"[{'screen_name': 'nypd66pct', 'name': 'nypd 66th precinct', 'id': '2372221230'}, {'screen_name': 'nypddetectives', 'name': 'chief james essig', 'id': '1374073866604150785'}, {'screen_name': 'nypdchiefofdept', 'name': 'chief kenneth corey', 'id': '2586249666'}]",[],[],1,30,24,"['sunsetpark', 'brooklyn', 'yourcityyourcall']",[],https://twitter.com/NYPDTips/status/1300203907583442950,False,,1,https://pbs.twimg.com/ext_tw_video_thumb/1300203875497119744/pu/img/3ZXUAXHmT32R9NsJ.jpg,new york city,,,,,,[],,,,
1300203832228675584,1300203832228675584,2020-08-30 17:48:44 CDT,2020-08-30,17:48:44,-0500,15918159,thebyron,Byron C. James,"{'type': 'Point', 'coordinates': [40.7142, -74.0064]}","We don’t want to read your novella about why so and so deserved to be shot, or about so and so’s past, or how racism isn’t real, or Black people commit more crime or whatever else you tell yourself to keep the status…  https://t.co/yWUJxYbhlL",en,[],['https://www.instagram.com/p/CEh-G9hjbQl/?igshid=5yzj6q8ryxhm'],[],0,0,0,[],[],https://twitter.com/thebyron/status/1300203832228675584,False,,0,,new york city,,,,,,[],,,,
1300203679216209921,1300203679216209921,2020-08-30 17:48:08 CDT,2020-08-30,17:48:08,-0500,272703444,earlamcduck,Sally Brown,,I don’t get it. #TinyHandsMcTreason is “president” so clearly if there is violence and incitement it is HIS America and HIS responsibility. Where does  @JoeBiden hold any accountability??? #GOPCorruptionOverCountry,en,"[{'screen_name': 'joebiden', 'name': 'joe biden', 'id': '939091'}]",[],[],0,0,0,"['tinyhandsmctreason', 'gopcorruptionovercountry']",[],https://twitter.com/earlamcduck/status/1300203679216209921,False,,0,,new york city,,,,,,[],,,,
1300203435267104774,1300103984997371904,2020-08-30 17:47:10 CDT,2020-08-30,17:47:10,-0500,872937544572444673,toniojen,Tonio2.0,,"@dbongino @realDonaldTrump The hillbillies of the right who listen to trumps call to divide who ""most"" are racist are taking advantage of a peaceful protest by sabotaging &amp; looting now killing &amp; the president says nothing  so i guess its George floyd &amp;Breanna Taylor they're dead in the prime of their lives",en,[],[],[],0,0,1,[],[],https://twitter.com/TonioJen/status/1300203435267104774,False,,0,,new york city,,,,,,"[{'screen_name': 'dbongino', 'name': 'Dan Bongino', 'id': '232901331'}, {'screen_name': 'realDonaldTrump', 'name': 'Donald J. Trump', 'id': '25073877'}]",,,,
1300203284825858048,1300203284825858048,2020-08-30 17:46:34 CDT,2020-08-30,17:46:34,-0500,1265492780,brianabelle_,BB🃏,,Agree with this but at the same time black on black crime most of the time they don’t get away with it . Point is police get away with it . Barely any consequences if any at all.,en,[],[],[],0,0,1,[],[],https://twitter.com/Brianabelle_/status/1300203284825858048,False,https://twitter.com/RayTooRaw/status/1300089959907459073,0,,new york city,,,,,,[],,,,
1300201629795450881,1300095373134921734,2020-08-30 17:39:59 CDT,2020-08-30,17:39:59,-0500,951979954325123072,oldmanwhobets,Old Man Who Bets,,@EMlbpicks @thegreatfoosini @MorphEEEyas @the_odds_fellow @SharksNSports @GunzPicks @Punisher_Picks @LOCK_BETS @40YearOldVision @MeganMakinMoney Short tempered after a brutal streak of picks and now trying to siphon some happiness out of mine and @thegreatfoosini’s day is my ultimate analysis   Cheers,en,"[{'screen_name': 'thegreatfoosini', 'name': 'the great foosini', 'id': '824818223891746818'}]",[],[],1,0,0,[],[],https://twitter.com/OldManWhoBets/status/1300201629795450881,False,,0,,new york city,,,,,,"[{'screen_name': 'EMlbpicks', 'name': 'E$MLB', 'id': '1103433262049959936'}, {'screen_name': 'thegreatfoosini', 'name': 'The Great Foosini', 'id': '824818223891746818'}, {'screen_name': 'the_odds_fellow', 'name': 'The Odds Fellow', 'id': '1145880596465541120'}, {'screen_name': 'SharksNSports', 'name': 'Sharky Waters NATION', 'id': '3215530575'}, {'screen_name': 'GunzPicks', 'name': 'GunzPicks', 'id': '1163136079005986817'}, {'screen_name': 'LOCK_BETS', 'name': 'LOCK BETS', 'id': '790648465156083712'}, {'screen_name': '40YearOldVision', 'name': 'C2', 'id': '1392955244'}, {'screen_name': 'MeganMakinMoney', 'name': 'Megan', 'id': '1194313478653325314'}]",,,,
1300201066500435973,1300201066500435973,2020-08-30 17:37:45 CDT,2020-08-30,17:37:45,-0500,170120491,rlly_james_smh,Chasing Pavements,,You A Whole Racist...,en,[],[],[],0,0,0,[],[],https://twitter.com/rlly_james_smh/status/1300201066500435973,False,https://twitter.com/RealJamesWoods/status/1299523393822183424,0,,new york city,,,,,,[],,,,
1300200940574846977,1300081593470648320,2020-08-30 17:37:15 CDT,2020-08-30,17:37:15,-0500,1016039958,m_e_g_a_megan,Megan wants a Union,,@NYCPBA_GC Why would you share this video? This is extremely triggering and exploitive to this victim.,en,[],[],[],0,0,0,[],[],https://twitter.com/M_e_g_a_Megan/status/1300200940574846977,False,,0,,new york city,,,,,,"[{'screen_name': 'NYCPBA_GC', 'name': 'NYCPBA Legal', 'id': '1064954050255470592'}]",,,,
1300200457948868614,1300051663651311616,2020-08-30 17:35:20 CDT,2020-08-30,17:35:20,-0500,21691459,icenycbx,Isaac BxHB,,"@Dangchick1 Love how they bring up the tokens. The good old I can’t be racist, I have that one black friend defense",en,[],[],[],0,0,0,[],[],https://twitter.com/icenycbx/status/1300200457948868614,False,,0,,new york city,,,,,,"[{'screen_name': 'Dangchick1', 'name': 'Debbie', 'id': '751031312648171520'}]",,,,
1300199557721133069,1300193547002482691,2020-08-30 17:31:45 CDT,2020-08-30,17:31:45,-0500,42291064,totallysamsays,Totallysamsays,,"@kirstiealley Bianca, Gurl! Just because someone doesn't have the same view, doesn't make them a racist.  I disagree w/my Kirstie. Obama did alot in the 8 years than any other president of our generation.  While it may not bn the big things ppl were lking for. The small things he did added up.",en,[],[],[],0,0,0,[],[],https://twitter.com/Totallysamsays/status/1300199557721133069,False,,0,,new york city,,,,,,"[{'screen_name': 'kirstiealley', 'name': 'Kirstie Alley', 'id': '36528126'}]",,,,
1300199531804594178,1300113821894356997,2020-08-30 17:31:39 CDT,2020-08-30,17:31:39,-0500,720432251956248576,helen_highly,HelenHighly,,"@AnthonyBenenati @Surfcityslicker @FrankieSaysNews @Weinsteinlaw @kurteichenwald If you’re talking about preparation, you should think about the endgame. What is trump’s goal? He doesn’t want a race war just for fun; it’s all about the election. It’s voter suppression. It’s intimidation. We have to stand up &amp; resist &amp; vote. But he’s not gonna start a gun war.",en,[],[],[],2,0,3,[],[],https://twitter.com/Helen_Highly/status/1300199531804594178,False,,0,,new york city,,,,,,"[{'screen_name': 'Surfcityslicker', 'name': 'Dolphin Sunset - #IStandWithUkraine🇺🇦🌻', 'id': '3111049027'}, {'screen_name': 'FrankieSaysNews', 'name': 'Cobra Chicken® 🇨🇦', 'id': '497763032'}, {'screen_name': 'Weinsteinlaw', 'name': 'Andrew Weinstein', 'id': '22879254'}, {'screen_name': 'kurteichenwald', 'name': 'Kurt Eichenwald', 'id': '215207998'}]",,,,
1300198676581810177,1300066428398325760,2020-08-30 17:28:15 CDT,2020-08-30,17:28:15,-0500,4056209999,jaywwalker1,Jay W. (#NoHateInNYC) Walker,,"@GOPLeader The people who incite the riots are murderous, #whitesupremacist #kkkops emboldened by your party's and #yourpresident's racist rhetoric. Fix the cause, not the result! @gop = #whitesupremacy",en,"[{'screen_name': 'gop', 'name': 'gop', 'id': '11134252'}]",[],[],0,2,4,"['whitesupremacist', 'kkkops', 'yourpresident', 'whitesupremacy']",[],https://twitter.com/jaywwalker1/status/1300198676581810177,False,,0,,new york city,,,,,,"[{'screen_name': 'GOPLeader', 'name': 'Kevin McCarthy', 'id': '19739126'}]",,,,
1300197905060503552,1300041598449917953,2020-08-30 17:25:11 CDT,2020-08-30,17:25:11,-0500,4056209999,jaywwalker1,Jay W. (#NoHateInNYC) Walker,,@realDonaldTrump ARREST WHITE SUPREMACIST TERRORISTS IMMEDIATELY. ARREST MURDEROUS COPS IMMEDIATELY.,en,[],[],[],0,2,1,[],[],https://twitter.com/jaywwalker1/status/1300197905060503552,False,,0,,new york city,,,,,,"[{'screen_name': 'realDonaldTrump', 'name': 'Donald J. Trump', 'id': '25073877'}]",,,,
1300197494438195203,1300141848552448001,2020-08-30 17:23:33 CDT,2020-08-30,17:23:33,-0500,58871089,seanpisano,Sean Pisano,,"@WalshFreedom See that's victim blaming. Let's remember that there were March's and pain under Obama. No Riot's took place even after 9 black people were shoot by a white supremacists. Just ask Nikki Haley how America came together after that. Obama is a leader, Trump is a trash fire.",en,[],[],[],0,0,0,[],[],https://twitter.com/seanpisano/status/1300197494438195203,False,,0,,new york city,,,,,,"[{'screen_name': 'WalshFreedom', 'name': 'Joe Walsh', 'id': '236487888'}]",,,,
1300195794138603525,1300195794138603525,2020-08-30 17:16:48 CDT,2020-08-30,17:16:48,-0500,32885835,lorac328,Carol Diaz,,"The Gov of Wisconsin and the Mayor of Kenosha, requested via letter for Trump not to go there. They feel it will take resources and more manpower, and will potentially ignite  violence from Trump supporters, and the peaceful BLM protestors.",en,[],[],[],7,66,113,[],[],https://twitter.com/lorac328/status/1300195794138603525,False,,0,,new york city,,,,,,[],,,,
1300195666732494851,1299959450544074758,2020-08-30 17:16:18 CDT,2020-08-30,17:16:18,-0500,183755664,gg067,Phoenix-G,,"@Gabriel4026 @LipsPuffer @topfotogmw @cnnbrk Where’s the gun absolutely no reports of a gun kids were in the car  and a woman possibly his wife/girlfriend screaming her lungs out telling the cop to stop, ppl telling cops he was there to brake up the situation why they didn’t simply listen.The continuous aggression need2stop",en,[],[],[],1,0,0,[],[],https://twitter.com/gg067/status/1300195666732494851,False,,0,,new york city,,,,,,"[{'screen_name': 'Gabriel4026', 'name': 'Gabriel402', 'id': '1128534294010351616'}, {'screen_name': 'topfotogmw', 'name': 'Martin Screw Covid Williams', 'id': '22679914'}, {'screen_name': 'cnnbrk', 'name': 'CNN Breaking News', 'id': '428333'}]",,,,
1300193890117586955,1299184932384768001,2020-08-30 17:09:14 CDT,2020-08-30,17:09:14,-0500,217493128,daclementmusic,DeClementia,,@Alex_will_sleep @DigbyPink @morgan313 @BlokeStokey @Styx666Official @JoeBiden Trump can and has sent troops in; dem mayor of Portland asked for help just an hour ago he asked that Trump stop encouraging violence. But we all know that won’t happen.  https://t.co/hrCZH80lVp,en,[],['https://www.nytimes.com/2020/08/27/us/elections/conway-says-the-more-violence-erupts-the-better-it-is-for-trumps-re-election-prospects.amp.html'],[],4,0,0,[],[],https://twitter.com/DaClementMusic/status/1300193890117586955,False,,0,,new york city,,,,,,"[{'screen_name': 'Alex_will_sleep', 'name': 'Alex', 'id': '1030521728'}, {'screen_name': 'DigbyPink', 'name': 'Digby Pink', 'id': '885181875546988548'}, {'screen_name': 'morgan313', 'name': 'Morgan Raven', 'id': '34349145'}, {'screen_name': 'BlokeStokey', 'name': 'A Bloke From Stoke', 'id': '1203715886617710594'}, {'screen_name': 'Styx666Official', 'name': 'Styxhexenhammer666', 'id': '807812802761158656'}, {'screen_name': 'JoeBiden', 'name': 'Joe Biden', 'id': '939091'}]",,,,
1300193642993385476,1300193642993385476,2020-08-30 17:08:15 CDT,2020-08-30,17:08:15,-0500,1146896015519358977,dicey631,Dicey631 Louis,,Joe Biden cares about the violence because of polling and now he blames it on Trump...Fox news is disgusting when they kno the violence is because of Democrats #foxnews,en,[],[],[],0,1,1,['foxnews'],[],https://twitter.com/dicey631/status/1300193642993385476,False,,0,,new york city,,,,,,[],,,,
1300193324456767488,1299919403786604544,2020-08-30 17:06:59 CDT,2020-08-30,17:06:59,-0500,973242841374822402,leakservicer,Lemon Pepper Strain 🌿,,@TimothyKing1 @RealMattCouch How about traveling with a gun he has illegally?? Does that mean anything to you?? Does that make him a trouble maker???,en,[],[],[],1,0,0,[],[],https://twitter.com/leakservicer/status/1300193324456767488,False,,0,,new york city,,,,,,"[{'screen_name': 'TimothyKing1', 'name': '#Trumpnation', 'id': '285321212'}, {'screen_name': 'RealMattCouch', 'name': 'Matt Couch', 'id': '601535938'}]",,,,
1300193169884286976,1300193169884286976,2020-08-30 17:06:22 CDT,2020-08-30,17:06:22,-0500,1146896015519358977,dicey631,Dicey631 Louis,,Adam Schiff is a disgrace...He has never denounced the violence #foxnews,en,[],[],[],0,0,1,['foxnews'],[],https://twitter.com/dicey631/status/1300193169884286976,False,,0,,new york city,,,,,,[],,,,
1300192896629583876,1300192896629583876,2020-08-30 17:05:17 CDT,2020-08-30,17:05:17,-0500,1146896015519358977,dicey631,Dicey631 Louis,,Democrats owns this violence all in Democrat controlled cities #foxnews  https://t.co/gyYVpwPBPr,en,[],[],['https://pbs.twimg.com/media/Egs2i-FXkAAXYRE.jpg'],0,0,0,['foxnews'],[],https://twitter.com/dicey631/status/1300192896629583876,False,,1,https://pbs.twimg.com/media/Egs2i-FXkAAXYRE.jpg,new york city,,,,,,[],,,,
1300192220608450560,1300053562836299778,2020-08-30 17:02:36 CDT,2020-08-30,17:02:36,-0500,23357627,susala77,Susala 77🇺🇸,,@TheGentleDonN @danielrocks007 What do you consider a “military style” weapon?,en,[],[],[],0,0,0,[],[],https://twitter.com/Susala77/status/1300192220608450560,False,,0,,new york city,,,,,,"[{'screen_name': 'TheGentleDonN', 'name': 'ThisisBait', 'id': '1104897988701442051'}, {'screen_name': 'danielrocks007', 'name': 'Joe', 'id': '1066955792'}]",,,,
1300191948486123520,1299959450544074758,2020-08-30 17:01:31 CDT,2020-08-30,17:01:31,-0500,183755664,gg067,Phoenix-G,,@Gabriel4026 @LipsPuffer @topfotogmw @cnnbrk And with all that said the cop life was absolutely not in any danger.,en,[],[],[],1,0,0,[],[],https://twitter.com/gg067/status/1300191948486123520,False,,0,,new york city,,,,,,"[{'screen_name': 'Gabriel4026', 'name': 'Gabriel402', 'id': '1128534294010351616'}, {'screen_name': 'topfotogmw', 'name': 'Martin Screw Covid Williams', 'id': '22679914'}, {'screen_name': 'cnnbrk', 'name': 'CNN Breaking News', 'id': '428333'}]",,,,
1300191414568050688,1299959450544074758,2020-08-30 16:59:24 CDT,2020-08-30,16:59:24,-0500,183755664,gg067,Phoenix-G,,@Gabriel4026 @LipsPuffer @topfotogmw @cnnbrk That’s the whole assumption and will be the argument. But if he have a knife in his hand and walking away going to the car what he’s going for a gun? there was no reports of a gun! why he’s going for another knife? That cop is guilty as hell 7 shots behind the back it BS.,en,[],[],[],2,0,0,[],[],https://twitter.com/gg067/status/1300191414568050688,False,,0,,new york city,,,,,,"[{'screen_name': 'Gabriel4026', 'name': 'Gabriel402', 'id': '1128534294010351616'}, {'screen_name': 'topfotogmw', 'name': 'Martin Screw Covid Williams', 'id': '22679914'}, {'screen_name': 'cnnbrk', 'name': 'CNN Breaking News', 'id': '428333'}]",,,,
1300191330216349699,1300072152775917569,2020-08-30 16:59:04 CDT,2020-08-30,16:59:04,-0500,1146493332182487041,levonhughey,Levon Hughey,,@RedheadAndRight @CHGoalie27 With a gun huh?!? Aren’t the cops there for everyone’s safety?!? #JayBishop is thug!!!,en,[],[],[],2,0,0,['jaybishop'],[],https://twitter.com/LevonHughey/status/1300191330216349699,False,,0,,new york city,,,,,,"[{'screen_name': 'RedheadAndRight', 'name': ""Let's go Brandy!"", 'id': '701784218'}, {'screen_name': 'CHGoalie27', 'name': 'Charles', 'id': '899411532169269248'}]",,,,
1300190633374687234,1300190633374687234,2020-08-30 16:56:18 CDT,2020-08-30,16:56:18,-0500,48112717,watergatesummer,enigma4ever 🌻🇺🇦🌻😷 #nycnurse #CovidIsAirborne,,Don't watch below if violence triggers you...but we are living in a very violent America right now ....Trump's America....,en,[],[],[],0,0,1,[],[],https://twitter.com/watergatesummer/status/1300190633374687234,False,https://twitter.com/ReallyAmerican1/status/1300099814219231235,0,,new york city,,,,,,[],,,,
1300190517431599115,1300186107670339586,2020-08-30 16:55:50 CDT,2020-08-30,16:55:50,-0500,1146896015519358977,dicey631,Dicey631 Louis,,@KlendathuCap @jakejakeny Seriously who are their strategists who thinks this will help them when people can see with their own eyes what’s happening and who’s really responsible for the violence????They know it’s Democrats promoting the violence and letting it continue,en,[],[],[],0,0,0,[],[],https://twitter.com/dicey631/status/1300190517431599115,False,,0,,new york city,,,,,,"[{'screen_name': 'KlendathuCap', 'name': 'The Artist Formerly Known As Klendathu Capitalist', 'id': '2645650158'}, {'screen_name': 'jakejakeny', 'name': 'Jake Novak', 'id': '33574174'}]",,,,
1300190441296605185,1299919403786604544,2020-08-30 16:55:32 CDT,2020-08-30,16:55:32,-0500,973242841374822402,leakservicer,Lemon Pepper Strain 🌿,,"@TimothyKing1 @RealMattCouch ""You people""???   Listen if you think grabbing an illegal gun and traveling to another state during a protest is ok then so be it... But please don't try and pretend he was helping people. He was there looking for trouble.. You know it.. Stop making excuses",en,[],[],[],0,0,0,[],[],https://twitter.com/leakservicer/status/1300190441296605185,False,,0,,new york city,,,,,,"[{'screen_name': 'TimothyKing1', 'name': '#Trumpnation', 'id': '285321212'}, {'screen_name': 'RealMattCouch', 'name': 'Matt Couch', 'id': '601535938'}]",,,,
1300189680596643841,1300189680596643841,2020-08-30 16:52:30 CDT,2020-08-30,16:52:30,-0500,4056209999,jaywwalker1,Jay W. (#NoHateInNYC) Walker,,".@Fundly, why are you allowing #whitesupremacists to fundraise for a terrorist, mass shooter? #klanfunders  https://t.co/Luaa8psl1G",en,"[{'screen_name': 'fundly', 'name': 'fundly', 'id': '96176261'}]",[],['https://pbs.twimg.com/media/Egszn8hXcAANlbv.jpg'],0,1,1,"['whitesupremacists', 'klanfunders']",[],https://twitter.com/jaywwalker1/status/1300189680596643841,False,,1,https://pbs.twimg.com/media/Egszn8hXcAANlbv.jpg,new york city,,,,,,[],,,,
1300189409594277893,1300171130326716418,2020-08-30 16:51:26 CDT,2020-08-30,16:51:26,-0500,1360156843,jamieob256,Jamie O'Brien,,@realDonaldTrump That was quite the crime wave you had going on at the White House last week. So many criminals gathered in one place.,en,[],[],[],0,0,2,[],[],https://twitter.com/jamieob256/status/1300189409594277893,False,,0,,new york city,,,,,,"[{'screen_name': 'realDonaldTrump', 'name': 'Donald J. Trump', 'id': '25073877'}]",,,,
1300189045973225473,1300164194776604674,2020-08-30 16:49:59 CDT,2020-08-30,16:49:59,-0500,147290864,coachnicodemo,Anthony Nicodemo🏳️‍🌈🇺🇸🏀,,@Coachjoan @tedwheeler @realDonaldTrump Please share any proof of the mayor pushing violence....,en,[],[],[],2,0,0,[],[],https://twitter.com/coachNicodemo/status/1300189045973225473,False,,0,,new york city,,,,,,"[{'screen_name': 'Coachjoan', 'name': 'Joan Sanchez', 'id': '139570093'}, {'screen_name': 'tedwheeler', 'name': 'Mayor Ted Wheeler', 'id': '18708561'}, {'screen_name': 'realDonaldTrump', 'name': 'Donald J. Trump', 'id': '25073877'}]",,,,
1300188786803040257,1300112380895145986,2020-08-30 16:48:57 CDT,2020-08-30,16:48:57,-0500,2994925737,chriscegegbara,Christopher C. Egegbara,,@ChrisMurphyCT The caravan wanted to incite violence and confrontation and were encouraged by DJT. It’s like Nazis matching through a Jewish neighborhood or the KKK matching through an African-American neighborhood.,en,[],[],[],0,0,0,[],[],https://twitter.com/chriscegegbara/status/1300188786803040257,False,,0,,new york city,,,,,,"[{'screen_name': 'ChrisMurphyCT', 'name': 'Chris Murphy', 'id': '150078976'}]",,,,
1300188419205869568,1300188419205869568,2020-08-30 16:47:30 CDT,2020-08-30,16:47:30,-0500,467330439,woodyjill,Jill Anderson,,I just donated to support @ChrisMurphyCT's fight to change our gun laws. Join me and get your own copy of his new book!  https://t.co/RVy1j31HfZ,en,"[{'screen_name': 'chrismurphyct', 'name': 'chris murphy', 'id': '150078976'}]",['https://secure.actblue.com/donate/ads-fb-dtd-csm-book-ps'],[],0,0,0,[],[],https://twitter.com/WoodyJill/status/1300188419205869568,False,,0,,new york city,,,,,,[],,,,
1300188190851117058,1300178602386960386,2020-08-30 16:46:35 CDT,2020-08-30,16:46:35,-0500,29383977,acapri114,Anna Monahan,,"@DesignationSix Definitely now. Now we have a crazy racist in charge, and no one seems to have the guts to stop him from destroying our democracy.",en,[],[],[],0,0,0,[],[],https://twitter.com/acapri114/status/1300188190851117058,False,,0,,new york city,,,,,,"[{'screen_name': 'DesignationSix', 'name': 'Secret Agent Number Six', 'id': '969138694308421632'}]",,,,
1300187854258221057,1300167633703239680,2020-08-30 16:45:15 CDT,2020-08-30,16:45:15,-0500,1146896015519358977,dicey631,Dicey631 Louis,,@sarahkendzior Where’s your story on the sex trafficking from Democrats or cartels raping minors while on their way to illegally cross the border ..Where’s your story in the slush fund our congress members have to cover up their sexual misconduct????Not interested because most are Democrats??,en,[],[],[],0,0,0,[],[],https://twitter.com/dicey631/status/1300187854258221057,False,,0,,new york city,,,,,,"[{'screen_name': 'sarahkendzior', 'name': 'Sarah Kendzior', 'id': '47475039'}]",,,,
1300187254099513344,1300084657241952258,2020-08-30 16:42:52 CDT,2020-08-30,16:42:52,-0500,1119074316321218560,conservativeko3,ConservativeKoolaid,,@saffship @KannoYoungs @Susan_Hennessey @ByMikeBaker Are they smuggling drugs and trafficking humans into the sex slave industry?  Nah not quite as dangerous,en,[],[],[],0,0,0,[],[],https://twitter.com/ConservativeKo3/status/1300187254099513344,False,,0,,new york city,,,,,,"[{'screen_name': 'saffship', 'name': 'saffron shipper', 'id': '276207099'}, {'screen_name': 'KannoYoungs', 'name': 'Zolan Kanno-Youngs', 'id': '1059273936'}, {'screen_name': 'Susan_Hennessey', 'name': 'Susan Hennessey', 'id': '7855062'}, {'screen_name': 'ByMikeBaker', 'name': 'Mike Baker', 'id': '178065733'}]",,,,
1300186963371274247,1300084657241952258,2020-08-30 16:41:43 CDT,2020-08-30,16:41:43,-0500,1119074316321218560,conservativeko3,ConservativeKoolaid,,@CMEPROS @KannoYoungs @ByMikeBaker Seems like you don’t need caravans of trump supporters to have violence and unrest in Portland.  Sorry but that’s just the truth.,en,[],[],[],0,1,1,[],[],https://twitter.com/ConservativeKo3/status/1300186963371274247,False,,0,,new york city,,,,,,"[{'screen_name': 'CMEPROS', 'name': 'Disgusted', 'id': '53099818'}, {'screen_name': 'KannoYoungs', 'name': 'Zolan Kanno-Youngs', 'id': '1059273936'}, {'screen_name': 'ByMikeBaker', 'name': 'Mike Baker', 'id': '178065733'}]",,,,
1300186794902933505,1300186794902933505,2020-08-30 16:41:02 CDT,2020-08-30,16:41:02,-0500,134576458,52sable,PUTIN IS A MONSTER 🇺🇦 🌻,,These are american born terrorists willing to kill american citizens. @FBI should label trump supporters a terrorist group.,en,"[{'screen_name': 'fbi', 'name': 'fbi', 'id': '17629860'}]",[],[],0,0,0,[],[],https://twitter.com/52sable/status/1300186794902933505,False,https://twitter.com/TheRealCoryElia/status/1299908378810957825,0,,new york city,,,,,,[],,,,
1300186630054084608,1300175154472013826,2020-08-30 16:40:23 CDT,2020-08-30,16:40:23,-0500,24992877,mezikenyc,Michael Lambert aka That’s Mr. Boomer 2U‼️,,@aaronnarraph Further into the video some of those in her group start to explain that she can help as the cops in riot gear show up and start establishing a perimeter for a crime scene moving every civilian away.  That fits with her tweet’s description.,en,[],[],[],1,0,0,[],[],https://twitter.com/Mezikenyc/status/1300186630054084608,False,,0,,new york city,,,,,,"[{'screen_name': 'aaronnarraph', 'name': '#FreePrakash', 'id': '828445012304265219'}]",,,,
1300185856901287936,1299919403786604544,2020-08-30 16:37:19 CDT,2020-08-30,16:37:19,-0500,973242841374822402,leakservicer,Lemon Pepper Strain 🌿,,@TimothyKing1 @RealMattCouch The guy has a loaded weapon that he obtained illegally. He was there to shoot someone. He just used protecting a business as an excuse.. 2 people dead that shouldn't have to.. All because a dumbass kid with a illegally firearm  wants to play hero.. But somehow this is ok with you,en,[],[],[],0,0,0,[],[],https://twitter.com/leakservicer/status/1300185856901287936,False,,0,,new york city,,,,,,"[{'screen_name': 'TimothyKing1', 'name': '#Trumpnation', 'id': '285321212'}, {'screen_name': 'RealMattCouch', 'name': 'Matt Couch', 'id': '601535938'}]",,,,
