id,conversation_id,created_at,date,time,timezone,user_id,username,name,place,tweet,language,mentions,urls,photos,replies_count,retweets_count,likes_count,hashtags,cashtags,link,retweet,quote_url,video,thumbnail,near,geo,source,user_rt_id,user_rt,retweet_id,reply_to,retweet_date,translate,trans_src,trans_dest
1300185154225352707,1300185154225352707,2020-08-30 16:34:31 CDT,2020-08-30,16:34:31,-0500,1258944734745239553,jsszrk,js szrk,,"Ok so NOW that we know that LOGICALLY we open IT up and VERIFY the INFO, right? So NOW have a LOOKSY, if it is as bad as I’m sure it is ARREST THEM!! Immediately WTF!! There’s a JAIL in the Capitol building for a reason @SpeakerPelosi @RepAdamSchiff @NewYorkStateAG @SenSchumer",en,"[{'screen_name': 'speakerpelosi', 'name': 'nancy pelosi', 'id': '15764644'}, {'screen_name': 'repadamschiff', 'name': 'adam schiff', 'id': '29501253'}, {'screen_name': 'newyorkstateag', 'name': 'ny ag james', 'id': '132496568'}, {'screen_name': 'senschumer', 'name': 'chuck schumer', 'id': '17494010'}]",[],[],0,0,0,[],[],https://twitter.com/JsSzrk/status/1300185154225352707,False,https://twitter.com/ericgarland/status/1300152734545588227,0,,new york city,,,,,,[],,,,
1300184601642532864,1300184601642532864,2020-08-30 16:32:19 CDT,2020-08-30,16:32:19,-0500,1146493332182487041,levonhughey,Levon Hughey,,#JayBishop accused of trying to bring gun to rally in Federally-controlled Portland park  https://t.co/zjlaBDtn4r,en,[],['https://katu.com/news/local/suspect-accused-of-trying-to-bring-gun-to-rally-in-federally-controlled-park-in-portland'],[],0,0,0,['jaybishop'],[],https://twitter.com/LevonHughey/status/1300184601642532864,False,,0,,new york city,,,,,,[],,,,
1300184331223216130,1300175154472013826,2020-08-30 16:31:15 CDT,2020-08-30,16:31:15,-0500,24992877,mezikenyc,Michael Lambert aka That’s Mr. Boomer 2U‼️,,"@aaronnarraph Yes, but the person who immediately  responded was in civilian clothes and extremely close proximity to the victim. That’s the person who shoved her initially.",en,[],[],[],1,0,0,[],[],https://twitter.com/Mezikenyc/status/1300184331223216130,False,,0,,new york city,,,,,,"[{'screen_name': 'aaronnarraph', 'name': '#FreePrakash', 'id': '828445012304265219'}]",,,,
1300183235876589568,1300174657237049344,2020-08-30 16:26:54 CDT,2020-08-30,16:26:54,-0500,62350999,kwarnockny,kwarnockny,,"@brat2381 I think this will happen more and more running up to the election. And I fear there will be some serious violence and casualties. Governors and Mayors need to take serious steps, since the feds aren't going to.",en,[],[],[],5,4,33,[],[],https://twitter.com/kwarnockny/status/1300183235876589568,False,,0,,new york city,,,,,,"[{'screen_name': 'brat2381', 'name': 'Miss Aja', 'id': '859993803066716160'}]",,,,
1300183212656865288,1300051064268488705,2020-08-30 16:26:48 CDT,2020-08-30,16:26:48,-0500,49430708,pwbnyc,🚲Peter W Beadle🚲,,@abigailm1971 @mjf_dfw @RaffishPaddy @johnlk_80 @Hammbear @mjs_DC @jakebackpack Why is it damaging to seek a better balance in our municipal budgets between excessive spending (&amp; militarization) on police and the social services we need to care for our people and even prevent the causes of crime in the first place?,en,[],[],[],1,0,1,[],[],https://twitter.com/pwbnyc/status/1300183212656865288,False,,0,,new york city,,,,,,"[{'screen_name': 'abigailm1971', 'name': 'Marquise de Merteuil (Abeille)', 'id': '24702086'}, {'screen_name': 'mjf_dfw', 'name': 'Michael Fisher 💉💉💉😷🏴\u200d☠️🇺🇸', 'id': '3096596018'}, {'screen_name': 'RaffishPaddy', 'name': 'PaddyFromNY', 'id': '841117266964017156'}, {'screen_name': 'johnlk_80', 'name': 'John', 'id': '381919736'}, {'screen_name': 'Hammbear', 'name': 'Keen Observer', 'id': '62081777'}, {'screen_name': 'mjs_DC', 'name': 'Mark Joseph Stern', 'id': '88215673'}, {'screen_name': 'jakebackpack', 'name': 'Jacob Bacharach', 'id': '38478122'}]",,,,
1300183029252530176,1300183029252530176,2020-08-30 16:26:05 CDT,2020-08-30,16:26:05,-0500,1258944734745239553,jsszrk,js szrk,,@SpeakerPelosi @RepAdamSchiff @SenSchumer @DNC @NewYorkStateAG and manhattan DA! Over 4yrs NO ARRESTS as he breaks felony law daily!        WHY? Is it because HE is a mobbed up crime front + GOV’T CI all at once and RATTED crime BOSSES in NY/PHILLY?   U don’t need him no more!  https://t.co/9BFxBtVcxv,en,"[{'screen_name': 'repadamschiff', 'name': 'adam schiff', 'id': '29501253'}, {'screen_name': 'senschumer', 'name': 'chuck schumer', 'id': '17494010'}, {'screen_name': 'dnc', 'name': 'democratic party', 'id': '722793491059769344'}, {'screen_name': 'newyorkstateag', 'name': 'ny ag james', 'id': '132496568'}]",[],['https://pbs.twimg.com/tweet_video_thumb/EgstkS2WkAoh02Q.jpg'],0,0,0,[],[],https://twitter.com/JsSzrk/status/1300183029252530176,False,https://twitter.com/EvanMcMullin/status/1300099812172410880,1,https://pbs.twimg.com/tweet_video_thumb/EgstkS2WkAoh02Q.jpg,new york city,,,,,,[],,,,
1300182873912283137,1300182873912283137,2020-08-30 16:25:28 CDT,2020-08-30,16:25:28,-0500,33343613,ireybear,BASSBEAR!!,,"Wait til the imaginary futures project succeed in their goal. That’s why they shooting for the skies. And you should support it. Im just reminded how again music business, and businesses alike are just head hunters.",en,[],[],[],0,0,1,[],[],https://twitter.com/iReyBear/status/1300182873912283137,False,,0,,new york city,,,,,,[],,,,
1300182784338620416,1300182784338620416,2020-08-30 16:25:06 CDT,2020-08-30,16:25:06,-0500,91947999,chismetime,Chisme Time,"{'type': 'Point', 'coordinates': [40.7332086, -74.00187056]}","Prosecutors Get Ballistics Report in Breonna Taylor Shooting: The Kentucky attorney general called the report a “critical piece” of the case, but he did not say what light it sheds on the fatal police shooting of a 26-year-old Black woman…  https://t.co/vhgTzpdy9D (vía NYtimes)  https://t.co/JuIei3ioSU",en,[],['http://dlvr.it/RffRPS'],['https://pbs.twimg.com/media/EgstWjAUcAAJauV.jpg'],0,0,0,[],[],https://twitter.com/chismetime/status/1300182784338620416,False,,1,https://pbs.twimg.com/media/EgstWjAUcAAJauV.jpg,new york city,,,,,,[],,,,
1300181670948208646,1300175154472013826,2020-08-30 16:20:41 CDT,2020-08-30,16:20:41,-0500,24992877,mezikenyc,Michael Lambert aka That’s Mr. Boomer 2U‼️,,@aaronnarraph Context matters.  Looks like the person who shoved her back wasn’t a police officer but a friend of the victim who was probably emotional and angry.  Also would cops want civilians disrupting an active crime scene without consent?,en,[],[],[],1,0,0,[],[],https://twitter.com/Mezikenyc/status/1300181670948208646,False,https://twitter.com/Mezikenyc/status/1300181038463946755,0,,new york city,,,,,,"[{'screen_name': 'aaronnarraph', 'name': '#FreePrakash', 'id': '828445012304265219'}]",,,,
1300181038463946755,1300181038463946755,2020-08-30 16:18:10 CDT,2020-08-30,16:18:10,-0500,24992877,mezikenyc,Michael Lambert aka That’s Mr. Boomer 2U‼️,,"Context matters  “She’s trying to help him!” another apparent protester thunders back. “She’s a f–king medic! She’s trying to help him, so let her help!”  New video shows chaotic aftermath of fatal Portland shooting amid protests  https://t.co/NSDjBZJft1 via @nypost",en,"[{'screen_name': 'nypost', 'name': 'new york post', 'id': '17469289'}]",['https://nypost.com/2020/08/30/new-video-captures-aftermath-of-portland-shooting-amid-protests/?utm_source=twitter_sitebuttons&utm_medium=site%20buttons&utm_campaign=site%20buttons'],[],0,0,3,[],[],https://twitter.com/Mezikenyc/status/1300181038463946755,False,,0,,new york city,,,,,,[],,,,
1300180791062941698,1300160613654634496,2020-08-30 16:17:11 CDT,2020-08-30,16:17:11,-0500,703419790,dameianterrell,Taylorcrawford Walker,,"@AngelJawed @MylesMill @CamEdwards @NYPDSVU @NYPDDetectives I wholeheartedly disagree. He committed a violent felony MOST certainly NOT a misdemeanor.  No Cash Bail release applies to misdemeanors and ""low-level"" crimes. Do yo-part with due diligence and investigate the FACTS.",en,[],[],[],5,0,4,[],[],https://twitter.com/dameianterrell/status/1300180791062941698,False,,0,,new york city,,,,,,"[{'screen_name': 'AngelJawed', 'name': 'IronJawedAngel', 'id': '1092848790908878849'}, {'screen_name': 'MylesMill', 'name': 'myles miller', 'id': '17425181'}, {'screen_name': 'CamEdwards', 'name': 'Cam Edwards', 'id': '18004009'}, {'screen_name': 'NYPDSVU', 'name': 'NYPD Special Victims', 'id': '2884353550'}, {'screen_name': 'NYPDDetectives', 'name': 'Chief James Essig', 'id': '1374073866604150785'}]",,,,
1300180118560813057,1300180118560813057,2020-08-30 16:14:31 CDT,2020-08-30,16:14:31,-0500,1223124221317926913,nogreenprivlege,Stop #GreenPrivilege,,"Racist...... it's ok for politicians to go to ""the hood"" to capture voters but not for police to patrol it to rid ""the hood"" of criminals.",en,[],[],[],0,0,0,[],[],https://twitter.com/NOGreenPrivlege/status/1300180118560813057,False,https://twitter.com/JamaalBowmanNY/status/1300155741253316609,0,,new york city,,,,,,[],,,,
1300179833595604995,1300179833595604995,2020-08-30 16:13:23 CDT,2020-08-30,16:13:23,-0500,170120491,rlly_james_smh,Chasing Pavements,,"The Indigenous &amp; Black Americans Submit 1492 As Well As 1619, Sir...  Trump Didn't Create This.   He Just Stirred The Pot That Black Ppl Were Always Telling You Was In Danger Of Bubbling Over. Y'all Didn't Care.💡",en,[],[],[],0,0,0,[],[],https://twitter.com/rlly_james_smh/status/1300179833595604995,False,https://twitter.com/tbottomly/status/1300163815758204928,0,,new york city,,,,,,[],,,,
1300178151058874373,1300178151058874373,2020-08-30 16:06:42 CDT,2020-08-30,16:06:42,-0500,710111395,newarkguy1973,Deplorable L Arroyo😆🇺🇸🇵🇷,,"Is this old senile bat even aware the victim was not black or democrat as originally reported by antifa &amp; msm? But rather, a TRUMP supporter?  How is it Trump's fault a Republican was assassinated by a democrat in a Democrat riot aka ""#PeacefulProtest""??",en,[],[],[],0,0,1,['peacefulprotest'],[],https://twitter.com/Newarkguy1973/status/1300178151058874373,False,https://twitter.com/JoeBiden/status/1300164707081498630,0,,new york city,,,,,,[],,,,
1300177958200639502,1299906190713913344,2020-08-30 16:05:56 CDT,2020-08-30,16:05:56,-0500,217493128,daclementmusic,DeClementia,,@Roninmonk1 @danrothwell1 @justadog @DevinCow Your willingness to ignore the prevalence of white nationalists and other “fine people” in this violence is everything we need to know.  https://t.co/uqYEAY4U35,en,[],['https://www.nytimes.com/2020/08/27/us/elections/conway-says-the-more-violence-erupts-the-better-it-is-for-trumps-re-election-prospects.html'],[],0,0,0,[],[],https://twitter.com/DaClementMusic/status/1300177958200639502,False,,0,,new york city,,,,,,"[{'screen_name': 'danrothwell1', 'name': 'Dan Rothwell', 'id': '50905313'}, {'screen_name': 'justadog', 'name': 'curl', 'id': '1921896235'}, {'screen_name': 'DevinCow', 'name': 'Devin Nunes’ cow 🐮', 'id': '892275857779118080'}]",,,,
1300177600439091200,1300177589223518208,2020-08-30 16:04:30 CDT,2020-08-30,16:04:30,-0500,1198403909359980547,stevepiccininni,Steve Piccininni 🇦🇶,,"In summary and conclusion, Trump is an ignorant, racist, dangerous baby that somehow has control of our nuclear codes.   Let’s change that come November.",en,[],[],[],0,10,15,[],[],https://twitter.com/StevePiccininni/status/1300177600439091200,False,,0,,new york city,,,,,,[],,,,
1300177593648504832,1300177589223518208,2020-08-30 16:04:29 CDT,2020-08-30,16:04:29,-0500,1198403909359980547,stevepiccininni,Steve Piccininni 🇦🇶,,"Instead, you intentionally anger protesters, further dividing the country, which led to some protesters utilizing violence as a means to express their anger with racial discrimination.   It’s not right, but you could have prevented most of it.",en,[],[],[],1,3,6,[],[],https://twitter.com/StevePiccininni/status/1300177593648504832,False,,0,,new york city,,,,,,[],,,,
1300177329168224257,1300177329168224257,2020-08-30 16:03:26 CDT,2020-08-30,16:03:26,-0500,170120491,rlly_james_smh,Chasing Pavements,,"Can We Please Stop This.   This Has Always Been Happening To Blk Ppl. It Is Not Worse Because Of Trump, It Just Gives You A Scapegoat When The Deeper Problem Is That America &amp; White Culture is RACIST. The only thing NEW is the ability to record &amp; share.",en,[],[],[],0,0,0,[],[],https://twitter.com/rlly_james_smh/status/1300177329168224257,False,https://twitter.com/W7VOA/status/1300165111294898176,0,,new york city,,,,,,[],,,,
1300177210679197696,1300177210679197696,2020-08-30 16:02:57 CDT,2020-08-30,16:02:57,-0500,1106037082319921152,guttermanhoward,Howard Gutterman,,AND THE DEMOCRAT LEADERSHIP LOOK EITHER INCAPABLE OR UNWILLIMG TO REIGN IN THE VIOLENCE!,en,[],[],[],0,0,0,[],[],https://twitter.com/GuttermanHoward/status/1300177210679197696,False,,0,,new york city,,,,,,[],,,,
1300176595026673667,1300176595026673667,2020-08-30 16:00:31 CDT,2020-08-30,16:00:31,-0500,1106037082319921152,guttermanhoward,Howard Gutterman,,"HAVE NEVER BEEN SO STARK THE DEMOCRATS ACTUALLY HAVE BEGUN DOING WHAT HAD NOT BEEN DONE BEFORE TO ANY REPUBLICANS AS FAR AS I KNOW, NAMELY, ACCUSING PRESIDENT TRUMP  OF WANTING THE VIOLENCE AND RIOTING TO CONTINUE IN THOSE LIBERAL -  DEMOCRAT - RUN CITIES SO AS TO MAKE JOE BIDEN",en,[],[],[],0,0,0,[],[],https://twitter.com/GuttermanHoward/status/1300176595026673667,False,,0,,new york city,,,,,,[],,,,
1300176389132488705,1300048329984872448,2020-08-30 15:59:41 CDT,2020-08-30,15:59:41,-0500,79016425,agordonstudio,Alan Gordon,,@MalcolmNance @jamesgarcia98 Violent protest plays right into Trump’s game plan to exploit his power to destroy our democracy. Don’t take the bait. Peaceful protest is the way to diffuse Trump’s abuse of power.,en,[],[],[],0,1,2,[],[],https://twitter.com/agordonstudio/status/1300176389132488705,False,,0,,new york city,,,,,,"[{'screen_name': 'MalcolmNance', 'name': 'Malcolm Nance', 'id': '2573480784'}, {'screen_name': 'jamesgarcia98', 'name': 'James Garcia S.', 'id': '951391256'}]",,,,
1300175666432880641,1300160613654634496,2020-08-30 15:56:49 CDT,2020-08-30,15:56:49,-0500,703419790,dameianterrell,Taylorcrawford Walker,,@1big6fan @MylesMill @CamEdwards @NYPDSVU @NYPDDetectives YOU are complicit when seeing a crime committed and do NOTHING.   Lock all of-em UP for failing to be HUMAN.  https://t.co/4xaATwWWlw,en,[],[],['https://pbs.twimg.com/tweet_video_thumb/Egsmh4tXgAAbH3M.jpg'],3,2,30,[],[],https://twitter.com/dameianterrell/status/1300175666432880641,False,,1,https://pbs.twimg.com/tweet_video_thumb/Egsmh4tXgAAbH3M.jpg,new york city,,,,,,"[{'screen_name': '1big6fan', 'name': 'Bill Alvarez', 'id': '426297527'}, {'screen_name': 'MylesMill', 'name': 'myles miller', 'id': '17425181'}, {'screen_name': 'CamEdwards', 'name': 'Cam Edwards', 'id': '18004009'}, {'screen_name': 'NYPDSVU', 'name': 'NYPD Special Victims', 'id': '2884353550'}, {'screen_name': 'NYPDDetectives', 'name': 'Chief James Essig', 'id': '1374073866604150785'}]",,,,
1300175278854070272,1300053562836299778,2020-08-30 15:55:17 CDT,2020-08-30,15:55:17,-0500,23357627,susala77,Susala 77🇺🇸,,@EngineerBarbie Exactly.  Less policing = more crime. You get a gold ⭐️,en,[],[],[],0,0,1,[],[],https://twitter.com/Susala77/status/1300175278854070272,False,,0,,new york city,,,,,,"[{'screen_name': 'EngineerBarbie', 'name': 'Nikki B', 'id': '25800613'}]",,,,
1300175255617630210,1300170576515026945,2020-08-30 15:55:11 CDT,2020-08-30,15:55:11,-0500,1282095068401336320,wilmaar01465843,Wilma Arnold,,"@realDonaldTrump Classic Trump. Stoking violence in a city trying to heal and ebb the tide of violence. Your weapon of choice is promoting racism, violence, and division. Your meanspirited , childess names calling is a direct reflection of your lack of humanity.",en,[],[],[],0,0,0,[],[],https://twitter.com/WilmaAr01465843/status/1300175255617630210,False,,0,,new york city,,,,,,"[{'screen_name': 'realDonaldTrump', 'name': 'Donald J. Trump', 'id': '25073877'}]",,,,
1300174243263643650,1300154777343586311,2020-08-30 15:51:10 CDT,2020-08-30,15:51:10,-0500,284624347,j_guav,Julian,,@tyleroday Crime everywhere!!!,en,[],[],[],0,0,0,[],[],https://twitter.com/J_GuAV/status/1300174243263643650,False,,0,,new york city,,,,,,"[{'screen_name': 'tyleroday', 'name': 'Tyler O’Day', 'id': '29029802'}]",,,,
1300173801691525121,1300173169333067778,2020-08-30 15:49:25 CDT,2020-08-30,15:49:25,-0500,14977429,vidiot_,S 😷💉💉💉,,@markknoller @DHS_Wolf @SecPompeo Commemorating the racist massacres and riots in Wilmington committed in 1898 by people the President would have admired?,en,[],[],[],0,0,1,[],[],https://twitter.com/vidiot_/status/1300173801691525121,False,,0,,new york city,,,,,,"[{'screen_name': 'markknoller', 'name': 'Mark Knoller', 'id': '31127446'}, {'screen_name': 'DHS_Wolf', 'name': 'Acting Secretary Chad Wolf', 'id': '1191733036133552128'}, {'screen_name': 'SecPompeo', 'name': 'Secretary Pompeo', 'id': '988573326376427520'}]",,,,
1300173127465537537,1300053153388335105,2020-08-30 15:46:44 CDT,2020-08-30,15:46:44,-0500,4056209999,jaywwalker1,Jay W. (#NoHateInNYC) Walker,,"@KazePlays_JC Hmmm. Let's see: asshole has 7 letters; coward has 6, pusillanimous has 13, mewling has 7, racist has 6. Sorry, I'm at a loss.",en,[],[],[],0,0,1,[],[],https://twitter.com/jaywwalker1/status/1300173127465537537,False,,0,,new york city,,,,,,[],,,,
1300172894610300934,1300172279503085569,2020-08-30 15:45:48 CDT,2020-08-30,15:45:48,-0500,14977429,vidiot_,S 😷💉💉💉,,"@markknoller @DHS_Wolf @SecPompeo He'll be solemnly commemorating the racist massacre and riots in 1898 in Wilmington as well, right?",en,[],[],[],0,0,1,[],[],https://twitter.com/vidiot_/status/1300172894610300934,False,,0,,new york city,,,,,,"[{'screen_name': 'markknoller', 'name': 'Mark Knoller', 'id': '31127446'}, {'screen_name': 'DHS_Wolf', 'name': 'Acting Secretary Chad Wolf', 'id': '1191733036133552128'}, {'screen_name': 'SecPompeo', 'name': 'Secretary Pompeo', 'id': '988573326376427520'}]",,,,
1300172548374769671,1300172548374769671,2020-08-30 15:44:26 CDT,2020-08-30,15:44:26,-0500,413595934,laseptimavieja,Marcial Godoy,,The echoes that reverberate between Kyle Rittenhouse’s gun and a lynch mob’s rope are too much to bear. Black people are angry. We are tired. And we have every right to be. The only thing that will calm this situation is tending to the festering wounds our nation has ignored.,en,[],[],[],0,1,2,[],[],https://twitter.com/laseptimavieja/status/1300172548374769671,False,https://twitter.com/RevJacquiLewis/status/1300076449701953536,0,,new york city,,,,,,[],,,,
1300172051697799177,1300130922008895493,2020-08-30 15:42:27 CDT,2020-08-30,15:42:27,-0500,217493128,daclementmusic,DeClementia,,"@mchwllms5 No one is saying that. If Lindsey feels less inspired to vote against oppressive gay laws because he’s being called out for over compensating, or a potential basher is shamed out of an attack ... I’m good.",en,[],[],[],1,0,0,[],[],https://twitter.com/DaClementMusic/status/1300172051697799177,False,,0,,new york city,,,,,,"[{'screen_name': 'mchwllms5', 'name': 'Micah Williams', 'id': '3147480614'}]",,,,
1300172038934589445,1300119856868515841,2020-08-30 15:42:24 CDT,2020-08-30,15:42:24,-0500,720432251956248576,helen_highly,HelenHighly,,"@Saje3D @WendyOrent @sergionegro @AynRandPaulRyan The thing about fascists is once you begin to play by their rules, they have you. We cannot comply. We cannot turn away. We cannot go home. Fascists come for you.  They want chaos &amp; violence and they’ll *create* it and blame it on us no matter what we do. We must stand our ground",en,[],[],[],0,0,3,[],[],https://twitter.com/Helen_Highly/status/1300172038934589445,False,,0,,new york city,,,,,,"[{'screen_name': 'Saje3D', 'name': 'Saje Williams', 'id': '62375254'}, {'screen_name': 'WendyOrent', 'name': '(((Wendy Orent)))', 'id': '1581466506'}, {'screen_name': 'sergionegro', 'name': 'Sergio Negro', 'id': '29226383'}, {'screen_name': 'AynRandPaulRyan', 'name': ""Holly Figueroa O'Reilly"", 'id': '755835576'}]",,,,
1300171889000800258,1300171889000800258,2020-08-30 15:41:49 CDT,2020-08-30,15:41:49,-0500,2688537892,mus1ymustafa,Mustafa A Nagi,,BREAKING: Man attempted to rape a 25-year-old at 11 Saturday on the 63/Lexington St Q platform in Manhattan—bystanders recorded—suspect ran away. @Ali_Albukhaiti تخيل هذا في نيويورك  #NYC #india  https://t.co/Nz37ggrYsC,en,"[{'screen_name': 'ali_albukhaiti', 'name': 'علي البخيتي', 'id': '416215702'}]",[],[],1,1,1,"['nyc', 'india']",[],https://twitter.com/Mus1yMustafa/status/1300171889000800258,False,,1,https://pbs.twimg.com/ext_tw_video_thumb/1300171856520130560/pu/img/-5eHASJbyh3NFokH.jpg,new york city,,,,,,[],,,,
