id,conversation_id,created_at,date,time,timezone,user_id,username,name,place,tweet,language,mentions,urls,photos,replies_count,retweets_count,likes_count,hashtags,cashtags,link,retweet,quote_url,video,thumbnail,near,geo,source,user_rt_id,user_rt,retweet_id,reply_to,retweet_date,translate,trans_src,trans_dest
621466869136908288,621466869136908288,2015-07-15 18:50:22 CDT,2015-07-15,18:50:22,-0500,162814209,stu_mundel,stu mundel,,LBC electrical vault fire 3rd &amp; Chestnut 2k customers without power was a danger off manhole covers being airborne  http://t.co/VzzmqUGiJC,en,[],[],['https://pbs.twimg.com/media/CJ_kztQUwAAHwf2.jpg'],3,6,3,[],[],https://twitter.com/Stu_Mundel/status/621466869136908288,False,,1,https://pbs.twimg.com/media/CJ_kztQUwAAHwf2.jpg,los angeles,,,,,,[],,,,
621466265392058368,621434025064861696,2015-07-15 18:47:58 CDT,2015-07-15,18:47:58,-0500,1140489188,sallybsaywhaat,Sally Borquez,,@HF_Monkey here's a couple of ours. We take these to the range and our rifles to the desert #guns #whiskey #shooting  http://t.co/chbJrwkFVl,en,[],[],['https://pbs.twimg.com/media/CJ_kRe-UkAAP5Ef.jpg'],2,0,1,"['guns', 'whiskey', 'shooting']",[],https://twitter.com/SallyBsaywhaat/status/621466265392058368,False,,1,https://pbs.twimg.com/media/CJ_kRe-UkAAP5Ef.jpg,los angeles,,,,,,[],,,,
621465509356138496,621465509356138496,2015-07-15 18:44:58 CDT,2015-07-15,18:44:58,-0500,2749904350,talk_bandz,lonewolf 🐺,,I fuckin hate anger managementK with a passion 😒,en,[],[],[],0,0,0,[],[],https://twitter.com/talk_bandz/status/621465509356138496,False,,0,,los angeles,,,,,,[],,,,
621463440591355908,621463440591355908,2015-07-15 18:36:45 CDT,2015-07-15,18:36:45,-0500,117647639,mathias4makeup,MATHIAS ALAN,"{'type': 'Point', 'coordinates': [34.1647949, -118.3762741]}",nigelbeautyemporium #proartist davidmake74 &amp; I r LONG TIME BFFs &amp; we r shooting for my youtube series…  https://t.co/2xHOj4V1wb,en,[],['https://instagram.com/p/5LOthFjuYK/'],[],0,0,0,['proartist'],[],https://twitter.com/mathias4makeup/status/621463440591355908,False,,0,,los angeles,,,,,,[],,,,
621463272059990016,621463272059990016,2015-07-15 18:36:04 CDT,2015-07-15,18:36:04,-0500,42619335,shokoshik,Chen Drachman,"{'type': 'Point', 'coordinates': [34.1509285, -118.3388901]}",Many a murder. #FuckingRosewood #PLL @ Warner Brothers Studios Back Lot  https://t.co/0BlAYHJrI3,en,[],['https://instagram.com/p/5LOpAFwmYd/'],[],0,0,1,"['fuckingrosewood', 'pll']",[],https://twitter.com/shokoshik/status/621463272059990016,False,,0,,los angeles,,,,,,[],,,,
621462031921614848,621462031921614848,2015-07-15 18:31:09 CDT,2015-07-15,18:31:09,-0500,76241678,yukasanoactress,Hana Yuka Sano,,ATTACK ON TITAN. It was a very crazy great movie!! I really recommend it #AOTmovie  http://t.co/nFFispTd8y,en,[],[],['https://pbs.twimg.com/media/CJ_gar2UMAE74uY.jpg'],0,0,1,['aotmovie'],[],https://twitter.com/YukaSanoActress/status/621462031921614848,False,,1,https://pbs.twimg.com/media/CJ_gar2UMAE74uY.jpg,los angeles,,,,,,[],,,,
621461654790762496,621461654790762496,2015-07-15 18:29:39 CDT,2015-07-15,18:29:39,-0500,76241678,yukasanoactress,Hana Yuka Sano,,Got sign from the Lead Haruma Miura Attending the premier of  ATTACK ON TITAN #AOTmovie  http://t.co/0lCh9P2LVI,en,[],[],['https://pbs.twimg.com/media/CJ_gE1ZUAAAx068.jpg'],0,0,1,['aotmovie'],[],https://twitter.com/YukaSanoActress/status/621461654790762496,False,,1,https://pbs.twimg.com/media/CJ_gE1ZUAAAx068.jpg,los angeles,,,,,,[],,,,
621461421902069760,621461421902069760,2015-07-15 18:28:43 CDT,2015-07-15,18:28:43,-0500,76241678,yukasanoactress,Hana Yuka Sano,,Attending the premier of  ATTACK ON TITAN #AOTmovie  http://t.co/mYR0zaroQK,en,[],[],['https://pbs.twimg.com/media/CJ_f3PVUkAE9w4q.jpg'],0,0,1,['aotmovie'],[],https://twitter.com/YukaSanoActress/status/621461421902069760,False,,1,https://pbs.twimg.com/media/CJ_f3PVUkAE9w4q.jpg,los angeles,,,,,,[],,,,
621460747717971972,621460747717971972,2015-07-15 18:26:03 CDT,2015-07-15,18:26:03,-0500,2474862894,navawevo,Lope⚡,,I have a feeling that Obama is going to give a speech about the amount of crime this city has so far in the past days. 😰,en,[],[],[],0,0,0,[],[],https://twitter.com/NavaWevo/status/621460747717971972,False,,0,,los angeles,,,,,,[],,,,
621458687874326528,621425419368042497,2015-07-15 18:17:51 CDT,2015-07-15,18:17:51,-0500,51125172,mirandacan,Miranda,,@ZEESHANMUJTABA1 @kshaw58 @Jonstradamus //The victim was murdered in the school gym and rolled up in a wrestling mat. Investigation shutdown,en,"[{'screen_name': 'kshaw58', 'name': 'the real crusader', 'id': '30728952'}, {'screen_name': 'jonstradamus', 'name': 'covid 19 hoax/psy op', 'id': '429031681'}]",[],[],0,2,1,[],[],https://twitter.com/Mirandacan/status/621458687874326528,False,,0,,los angeles,,,,,,[],,,,
621455233999187968,621454479255212033,2015-07-15 18:04:08 CDT,2015-07-15,18:04:08,-0500,229390362,darkkingzoro,Bryan Newton 🌹,"{'type': 'Point', 'coordinates': [34.1574394, -118.3439939]}",@kristinakolbert funny how some things dont change. America hasnt fully dealt with its #racist history,en,[],[],[],1,0,0,['racist'],[],https://twitter.com/DarkKingZoro/status/621455233999187968,False,,0,,los angeles,,,,,,[],,,,
621454660440756226,621454293241982976,2015-07-15 18:01:51 CDT,2015-07-15,18:01:51,-0500,23389972,emmdoubleyou,💀m💀,,"@FoxSpecOps3 their next endeavor should be a ""where's waldo"" themed murder adventure!",en,[],[],[],0,0,1,[],[],https://twitter.com/emmdoubleyou/status/621454660440756226,False,,0,,los angeles,,,,,,[],,,,
621453418784108544,621453157424570368,2015-07-15 17:56:55 CDT,2015-07-15,17:56:55,-0500,21953248,limeylizzie,Elizabeth West,,"@Kimberly124 He did say ""If"", not as if he flat-out called him a rapist, just said if he idid what he's accused of then it's rape.",en,[],[],[],0,0,0,[],[],https://twitter.com/Limeylizzie/status/621453418784108544,False,,0,,los angeles,,,,,,[],,,,
621452725599907840,621452725599907840,2015-07-15 17:54:10 CDT,2015-07-15,17:54:10,-0500,963365737,abc7sid,Sid Garcia,,#violent few days in #Norwalk. Father&amp;son dead. Details at 4 on #abc7eyewitness news  http://t.co/3xE4nk4Q3d,en,[],[],['https://pbs.twimg.com/media/CJ_X2ZRUYAA52HK.jpg'],0,0,0,"['violent', 'norwalk', 'abc7eyewitness']",[],https://twitter.com/abc7sid/status/621452725599907840,False,,1,https://pbs.twimg.com/media/CJ_X2ZRUYAA52HK.jpg,los angeles,,,,,,[],,,,
621452016208904193,621452016208904193,2015-07-15 17:51:21 CDT,2015-07-15,17:51:21,-0500,55218049,losangelescp,Los Angeles Now,"{'type': 'Point', 'coordinates': [34.05161048, -118.24533538]}",Obama on Cosby: Drugging anyone for sex 'is rape': When President Barack Obama is asked about the sexual…  http://t.co/pwCGIPNpmc,en,[],['http://losangeles.cityandpress.com/node/9887816'],[],0,1,0,[],[],https://twitter.com/LosAngelesCP/status/621452016208904193,False,,0,,los angeles,,,,,,[],,,,
621451315231625216,621451315231625216,2015-07-15 17:48:34 CDT,2015-07-15,17:48:34,-0500,202278855,_rosewoodave,Forever Rollin,,I've noticed blacks is the only race that's not racist,en,[],[],[],0,0,0,[],[],https://twitter.com/_RosewoodAVE/status/621451315231625216,False,,0,,los angeles,,,,,,[],,,,
621449764530327552,621449764530327552,2015-07-15 17:42:24 CDT,2015-07-15,17:42:24,-0500,2245148978,sp4cec0wboii,Noah (9-8),,Bitch always acting like a victim. XD.,en,[],[],[],0,0,0,[],[],https://twitter.com/Sp4ceC0wboii/status/621449764530327552,False,,0,,los angeles,,,,,,[],,,,
621444025464131584,621444025464131584,2015-07-15 17:19:36 CDT,2015-07-15,17:19:36,-0500,29058812,amandaxiola,amanda,,Remember when I wasn't feeling well and was twenty minutes late to work out of protest?,en,[],[],[],1,0,0,[],[],https://twitter.com/amandaxiola/status/621444025464131584,False,,0,,los angeles,,,,,,[],,,,
621442291744440320,621442291744440320,2015-07-15 17:12:42 CDT,2015-07-15,17:12:42,-0500,51361775,pyoff,Emelike,,HuntsmanAbby @piersmorgan Anger at who exactly? I hope he wins the primaries so they can have more time to be angry.,en,"[{'screen_name': 'piersmorgan', 'name': 'piers morgan', 'id': '216299334'}]",[],[],0,0,0,[],[],https://twitter.com/Pyoff/status/621442291744440320,False,,0,,los angeles,,,,,,[],,,,
621441633549176832,621425419368042497,2015-07-15 17:10:05 CDT,2015-07-15,17:10:05,-0500,51125172,mirandacan,Miranda,,@Jonstradamus @kshaw58 //This is a very interesting case where there is definitely a cover-up of a crime.,en,"[{'screen_name': 'kshaw58', 'name': 'the real crusader', 'id': '30728952'}]",[],[],1,2,1,[],[],https://twitter.com/Mirandacan/status/621441633549176832,False,,0,,los angeles,,,,,,[],,,,
621441437050126336,621441437050126336,2015-07-15 17:09:19 CDT,2015-07-15,17:09:19,-0500,72160645,gemarble357,Marble's Mind Blog: Gordon Marble,,"What trips me out is white people can say the most ugly racist shit, but if a person of color points it out we are race baiting. #gofigure",en,[],[],[],0,0,0,['gofigure'],[],https://twitter.com/gemarble357/status/621441437050126336,False,,0,,los angeles,,,,,,[],,,,
621435150920880128,621093854268125184,2015-07-15 16:44:20 CDT,2015-07-15,16:44:20,-0500,93256881,moet_kd,Henny dux,,@og_faby I thought we was shooting,en,[],[],[],0,0,0,[],[],https://twitter.com/MOET_KD/status/621435150920880128,False,,0,,los angeles,,,,,,[],,,,
621434693930455040,621314077311107072,2015-07-15 16:42:31 CDT,2015-07-15,16:42:31,-0500,30728952,kshaw58,The Real Crusader,,@ajplus Can someone help me find the threat?,en,[],[],[],0,0,0,[],[],https://twitter.com/kshaw58/status/621434693930455040,False,,0,,los angeles,,,,,,[],,,,
621433356958371841,621433356958371841,2015-07-15 16:37:12 CDT,2015-07-15,16:37:12,-0500,475560189,msbettyblue,betty,,Currently watching Child of Rage. Not creepy at all 👀,en,[],[],[],0,0,0,[],[],https://twitter.com/msbettyblue/status/621433356958371841,False,,0,,los angeles,,,,,,[],,,,
621432697563394048,621432697563394048,2015-07-15 16:34:35 CDT,2015-07-15,16:34:35,-0500,317875024,giannahammer,Gianna Hammer,,"I'm shooting on a rooftop today, what are you doing? 😏😎  http://t.co/5sM6GsgPWm",en,[],[],[],0,0,1,[],[],https://twitter.com/giannahammer/status/621432697563394048,False,,1,https://pbs.twimg.com/ext_tw_video_thumb/621431957654671360/pu/img/RUKcjQ7kVKkeSFm0.jpg,los angeles,,,,,,[],,,,
621427254162259968,621420192804020225,2015-07-15 16:12:57 CDT,2015-07-15,16:12:57,-0500,217311907,jaleesalashay,Jaleesa Lashay Diaz,,@AshUBKillinEm91 @Bmore_Noless of course it is. we live in a white supremacist system. that's the issue. but we don't have to agree,en,[],[],[],1,0,0,[],[],https://twitter.com/JaleesaLashay/status/621427254162259968,False,,0,,los angeles,,,,,,[],,,,
621425722486210561,621220584932794368,2015-07-15 16:06:52 CDT,2015-07-15,16:06:52,-0500,53473712,deejaylarios,D.J. Larios,,@lalalajenn thanks Jen. Let's go back to Rage cough cough,en,[],[],[],1,0,0,[],[],https://twitter.com/DeejayLarios/status/621425722486210561,False,,0,,los angeles,,,,,,[],,,,
621423783367147520,621423783367147520,2015-07-15 15:59:10 CDT,2015-07-15,15:59:10,-0500,334294212,paccouncil,Pacific Council,,Protests in #Athens turn violent as #Tsipras urges MPs to back him on vote:  http://t.co/Xu0B0bFiE2 @guardian #Greece  http://t.co/tKqgiIDLEi,en,"[{'screen_name': 'guardian', 'name': 'the guardian', 'id': '87818409'}]",['http://owl.li/PF6JL'],['https://pbs.twimg.com/media/CJ-9o15UMAAyXh4.jpg'],0,4,1,"['athens', 'tsipras', 'greece']",[],https://twitter.com/PacCouncil/status/621423783367147520,False,,1,https://pbs.twimg.com/media/CJ-9o15UMAAyXh4.jpg,los angeles,,,,,,[],,,,
621423677964333056,621420192804020225,2015-07-15 15:58:44 CDT,2015-07-15,15:58:44,-0500,217311907,jaleesalashay,Jaleesa Lashay Diaz,,"@AshUBKillinEm91 @Bmore_Noless a flag HAD to be taken down, it followed a domestic terrorist attack. that means nothing though.",en,[],[],[],0,0,0,[],[],https://twitter.com/JaleesaLashay/status/621423677964333056,False,,0,,los angeles,,,,,,[],,,,
621423580098629632,620974089927180288,2015-07-15 15:58:21 CDT,2015-07-15,15:58:21,-0500,341211819,bringbackfear,🎥Bring Back Fear Films🎥,,"@RealTomHolland Yes it is. We could say Chucky for the hell of it, lol. Sneaky, intelligent and a brutal killer.",en,[],[],[],1,0,1,[],[],https://twitter.com/bringbackfear/status/621423580098629632,False,,0,,los angeles,,,,,,[],,,,
621423211675136001,621423211675136001,2015-07-15 15:56:53 CDT,2015-07-15,15:56:53,-0500,837123020,therealkfloo,Katie Floyd,,But that USA JPN final was just a murder. Straight crushed !!!!!,en,[],[],[],0,0,0,[],[],https://twitter.com/therealkfloo/status/621423211675136001,False,,0,,los angeles,,,,,,[],,,,
621422462673137665,621422462673137665,2015-07-15 15:53:55 CDT,2015-07-15,15:53:55,-0500,190091411,onairbrooke,Brooke Morrison,,"Shout out to @POTUS for helping these young men understand what rape is, and why it is never ok. ✊🏼",en,"[{'screen_name': 'potus', 'name': 'president biden', 'id': '1349149096909668363'}]",[],[],0,0,0,[],[],https://twitter.com/OnAirBrooke/status/621422462673137665,False,,0,,los angeles,,,,,,[],,,,
621422259358437376,621420192804020225,2015-07-15 15:53:06 CDT,2015-07-15,15:53:06,-0500,217311907,jaleesalashay,Jaleesa Lashay Diaz,,"@AshUBKillinEm91 @Bmore_Noless no he's focused on gun control, and shifted the issue. it's black genocide period.",en,[],[],[],1,0,0,[],[],https://twitter.com/JaleesaLashay/status/621422259358437376,False,,0,,los angeles,,,,,,[],,,,
621421654996987904,621419269952286721,2015-07-15 15:50:42 CDT,2015-07-15,15:50:42,-0500,217311907,jaleesalashay,Jaleesa Lashay Diaz,,@Bmore_Noless like Woody Allen has has sexual assault accusations. serious ones. he's still out here making his films.,en,[],[],[],0,0,0,[],[],https://twitter.com/JaleesaLashay/status/621421654996987904,False,,0,,los angeles,,,,,,[],,,,
621421540375040000,621421540375040000,2015-07-15 15:50:15 CDT,2015-07-15,15:50:15,-0500,217311907,jaleesalashay,Jaleesa Lashay Diaz,,Woody Allen has had serious sexual assault accusations for YEARS.,en,[],[],[],0,0,0,[],[],https://twitter.com/JaleesaLashay/status/621421540375040000,False,,0,,los angeles,,,,,,[],,,,
621419536198316032,621419536198316032,2015-07-15 15:42:17 CDT,2015-07-15,15:42:17,-0500,217311907,jaleesalashay,Jaleesa Lashay Diaz,,Why is President Obama commenting on Bill Cosby rape accusations? I just don't understand why our President would have to address that,en,[],[],[],1,0,0,[],[],https://twitter.com/JaleesaLashay/status/621419536198316032,False,,0,,los angeles,,,,,,[],,,,
621419490534789120,621419490534789120,2015-07-15 15:42:06 CDT,2015-07-15,15:42:06,-0500,55218049,losangelescp,Los Angeles Now,"{'type': 'Point', 'coordinates': [34.05161048, -118.24533538]}",Five questions with 'Assassin's Creed: Syndicate's' female killer: Actress Victoria Atkin has made a splash in the…  http://t.co/jsiRoB7WKG,en,[],['http://losangeles.cityandpress.com/node/9886916'],[],0,0,0,[],[],https://twitter.com/LosAngelesCP/status/621419490534789120,False,,0,,los angeles,,,,,,[],,,,
621418411180978176,621418411180978176,2015-07-15 15:37:49 CDT,2015-07-15,15:37:49,-0500,29202632,mc_flyhigh,✨,,Yooo... That shooting in front of Gardena Carrows that happened a few years ago.. http://t.co/n67kMR3qbk,en,[],['http://m.worldstarhiphop.com/apple/video.php?v=wshhh7r82wP0uS3KT0T9'],[],0,0,0,[],[],https://twitter.com/mc_flyHIGH/status/621418411180978176,False,,0,,los angeles,,,,,,[],,,,
621418027406499840,621418027406499840,2015-07-15 15:36:17 CDT,2015-07-15,15:36:17,-0500,35425466,johnf_evans,John Evans,,"Lock in on the @RotoVizRadio podcast, Top Gun style, w/ @MattFtheOracle, guest host @TheFFGirl and @footballdiehard!  http://t.co/UuGYkm8ROk",en,"[{'screen_name': 'rotovizradio', 'name': 'rotoviz radio', 'id': '2692691426'}, {'screen_name': 'mattftheoracle', 'name': 'matthew freedman', 'id': '1265991506'}, {'screen_name': 'footballdiehard', 'name': 'bob harris', 'id': '24567876'}]",['http://rotoviz.com/radio/'],[],2,3,2,[],[],https://twitter.com/JohnF_Evans/status/621418027406499840,False,,0,,los angeles,,,,,,[],,,,
621416332953694208,621416332953694208,2015-07-15 15:29:33 CDT,2015-07-15,15:29:33,-0500,517462465,winter_time1776,amigostrangewinter.,,"Men are designed like sperms, designed to penetrate, attack. That's why theres so many prsoners criminals. Masculine Mideast. Europe feminin",en,[],[],[],0,0,0,[],[],https://twitter.com/winter_time1776/status/621416332953694208,False,,0,,los angeles,,,,,,[],,,,
