id,conversation_id,created_at,date,time,timezone,user_id,username,name,place,tweet,language,mentions,urls,photos,replies_count,retweets_count,likes_count,hashtags,cashtags,link,retweet,quote_url,video,thumbnail,near,geo,source,user_rt_id,user_rt,retweet_id,reply_to,retweet_date,translate,trans_src,trans_dest
797945791453114369,797945791453114369,2016-11-13 17:34:36 CST,2016-11-13,17:34:36,-0500,20873144,jenadler27,Jennifer,"{'type': 'Point', 'coordinates': [33.52728, -112.26223]}",My @azcardinals partner in crime is back...at least for the weekend. #Tradition #GoCards @…  https://t.co/OiIeKDnjD2,en,"[{'screen_name': 'azcardinals', 'name': 'arizona cardinals', 'id': '389038362'}]",['https://www.instagram.com/p/BMxNmF4h3W5/'],[],0,0,1,"['tradition', 'gocards']",[],https://twitter.com/jenadler27/status/797945791453114369,False,,0,,phoenix,,,,,,[],,,,
797944985832157184,797691388322160641,2016-11-13 17:31:24 CST,2016-11-13,17:31:24,-0500,53998098,sammayt,Sam Thompson,,@Mikemcmonigal1 thats sexist,en,[],[],[],0,0,0,[],[],https://twitter.com/SammayT/status/797944985832157184,False,,0,,phoenix,,,,,,[],,,,
797942019549077504,797942019549077504,2016-11-13 17:19:37 CST,2016-11-13,17:19:37,-0500,469851934,warsawarrior,Jake,,This is like saying you aren't sexist just because you have a wife hahahahahahah what ahhahahaha who thinks like this lmfao  https://t.co/3uwgiNYQQs,en,[],['https://twitter.com/drunkamerica/status/797529097807294464'],[],0,0,18,[],[],https://twitter.com/warsawarrior/status/797942019549077504,False,https://twitter.com/drunkamerica/status/797529097807294464,0,,phoenix,,,,,,[],,,,
797939278663720960,797939278663720960,2016-11-13 17:08:43 CST,2016-11-13,17:08:43,-0500,331734581,donigeorge1,D S George 🇺🇦🌻,,@IvankaTrump -so this is the vaunted great father you have? I thought you were smart but you all are racist heartless people  https://t.co/DhZVeqjFxp,en,[],['https://twitter.com/donigeorge1/status/797938642983358464'],[],0,0,0,[],[],https://twitter.com/DoniGeorge1/status/797939278663720960,False,https://twitter.com/donigeorge1/status/797938642983358464,0,,phoenix,,,,,,[],,,,
797938642983358464,797938642983358464,2016-11-13 17:06:12 CST,2016-11-13,17:06:12,-0500,331734581,donigeorge1,D S George 🇺🇦🌻,,"11/13-so far: Medicare privatizing begins,deportations, LGBT reversals, ACA repeal underway,Climate reversals, hate crime up #Democracy",en,[],[],[],0,1,0,['democracy'],[],https://twitter.com/DoniGeorge1/status/797938642983358464,False,,0,,phoenix,,,,,,[],,,,
797930865825153024,797930865825153024,2016-11-13 16:35:17 CST,2016-11-13,16:35:17,-0500,2557983457,kylealexrogers,general malaise,,"correction: ""This is Michelle. She voted for Trump. She is a racist. Her friend enables her to be racist by accepting her as one.""  https://t.co/8mJn32HxeC",en,[],['https://twitter.com/lovelyweird0/status/797845428909862912'],[],0,6,8,[],[],https://twitter.com/kylealexrogers/status/797930865825153024,False,0,0,,phoenix,,,,,,[],,,,
797930700708016128,797930700708016128,2016-11-13 16:34:38 CST,2016-11-13,16:34:38,-0500,15928705,goalbustersjim,"Jim Anderson, CFRE",,#PublicRadio/TV are in danger w likely push of defunding. Minority &amp; rural stations are at most risk.  https://t.co/xlX2OEUAkd,en,[],['http://acrnewsfeed.blogspot.com/2016/11/a-time-of-reckoning.html'],[],0,1,0,['publicradio'],[],https://twitter.com/GoalBustersJim/status/797930700708016128,False,,0,,phoenix,,,,,,[],,,,
797929449152884736,797929449152884736,2016-11-13 16:29:40 CST,2016-11-13,16:29:40,-0500,28146121,ijoshhammond,Joshua Hammond,,I'm not going to mince words. Steve Bannon is a white supremacist. He will now have the president's ear.  https://t.co/Xz81BQs41c,en,[],['https://twitter.com/ijoshhammond/status/797927906517209088'],[],0,0,0,[],[],https://twitter.com/iJoshHammond/status/797929449152884736,False,https://twitter.com/ijoshhammond/status/797927906517209088,0,,phoenix,,,,,,[],,,,
797927367607926789,797927367607926789,2016-11-13 16:21:23 CST,2016-11-13,16:21:23,-0500,15743525,nathantriplett,Nathan Triplett ⚖️🚌 🏕🥾,,"How do you responded to a rising tide of post-election harassment, intimidation, and violence? Here's an amazing, community-based answer.  https://t.co/atHABQjrgS",en,[],[],['https://pbs.twimg.com/media/CxLOpd3UkAE_Beh.jpg'],1,1,1,[],[],https://twitter.com/NathanTriplett/status/797927367607926789,False,,1,https://pbs.twimg.com/media/CxLOpd3UkAE_Beh.jpg,phoenix,,,,,,[],,,,
797915582658015232,797915582658015232,2016-11-13 15:34:34 CST,2016-11-13,15:34:34,-0500,788318868,bazisgirl,Karin 🇺🇸🐻,,"1) Absolutely despicable! 2) I thought Love trumps Hate! This is a threat against e-FLOTUS, @SecretService needs to arrest them!  https://t.co/s5kYIlX1qt",en,"[{'screen_name': 'secretservice', 'name': 'u.s. secret service', 'id': '115749048'}]",['https://twitter.com/dbargen/status/797910710659465216'],[],0,1,0,[],[],https://twitter.com/bazisgirl/status/797915582658015232,False,https://twitter.com/dbargen/status/797910710659465216,0,,phoenix,,,,,,[],,,,
797906286603997184,797906286603997184,2016-11-13 14:57:37 CST,2016-11-13,14:57:37,-0500,754075406,xsportiz,乂ᔕᑭට 𓃡,,Now this needs to happen. ⚡️ “Million Women March protest planned for the inauguration ”   https://t.co/GieFN5noZz,en,[],['https://twitter.com/i/moments/797577064656306177'],[],0,0,0,[],[],https://twitter.com/xsportiz/status/797906286603997184,False,,0,,phoenix,,,,,,[],,,,
797905663091347456,797905663091347456,2016-11-13 14:55:09 CST,2016-11-13,14:55:09,-0500,47384430,rfkracing,RFK Racing,,#RVT @stenhousejr and @Tbayne6 attack the corner @PhoenixRaceway #RFRDRIVEN  https://t.co/uKVHmZnwlD,en,"[{'screen_name': 'stenhousejr', 'name': 'ricky stenhouse jr.', 'id': '104203516'}, {'screen_name': 'tbayne6', 'name': 'trevor bayne', 'id': '106845822'}, {'screen_name': 'phoenixraceway', 'name': 'phoenix raceway', 'id': '19554713'}]",[],['https://pbs.twimg.com/media/CxK69GQUsAAzZ2W.jpg'],0,1,5,"['rvt', 'rfrdriven']",[],https://twitter.com/RFKracing/status/797905663091347456,False,,1,https://pbs.twimg.com/media/CxK69GQUsAAzZ2W.jpg,phoenix,,,,,,[],,,,
797898342806224896,797898342806224896,2016-11-13 14:26:03 CST,2016-11-13,14:26:03,-0500,56117318,phoenixcp,Phoenix Now,"{'type': 'Point', 'coordinates': [33.46889822, -112.09379298]}",Glendale PD are investigating a deadly shooting this afternoon near 51st Av. &amp; Northern. @FOX10Phoenix  https://t.co/GRh1nlcsPc,en,"[{'screen_name': 'fox10phoenix', 'name': 'fox 10 phoenix', 'id': '18999261'}]",['http://toplocalnow.com/us/phoenix'],[],1,0,0,[],[],https://twitter.com/PhoenixCP/status/797898342806224896,False,,0,,phoenix,,,,,,[],,,,
797883771198402560,797883771198402560,2016-11-13 13:28:09 CST,2016-11-13,13:28:09,-0500,755407686305394688,tbird168,freshair,,We could not stand this violent behavior happened in USA. Don‘t hesitate law enforce officiers lock them up. They are not hummanbeing.  https://t.co/oE1Qi1zwnF,en,[],['https://twitter.com/lynnmccain55/status/797823493253513216'],[],0,0,0,[],[],https://twitter.com/tbird168/status/797883771198402560,False,0,0,,phoenix,,,,,,[],,,,
797882334104023040,797882334104023040,2016-11-13 13:22:27 CST,2016-11-13,13:22:27,-0500,25152423,ericmates,Eric Mates,,The fact he continues to attack the press is extremely concerning.  https://t.co/8bKH7xkx9a,en,[],['https://twitter.com/cliffordlevy/status/797844508029358084'],[],0,0,0,[],[],https://twitter.com/ericmates/status/797882334104023040,False,https://twitter.com/cliffordlevy/status/797844508029358084,0,,phoenix,,,,,,[],,,,
797876285787820032,797876285787820032,2016-11-13 12:58:25 CST,2016-11-13,12:58:25,-0500,1284300716,weiscold25,Weis,,Can I protest Cutler? #NotMyQBanymore,en,[],[],[],0,0,0,['notmyqbanymore'],[],https://twitter.com/WeisCold25/status/797876285787820032,False,,0,,phoenix,,,,,,[],,,,
797872908047499264,797872908047499264,2016-11-13 12:44:59 CST,2016-11-13,12:44:59,-0500,628797827,frankrofl,Frank Berguin AKA Drip Daddy Dolla$,,I've never seen a better weapon than McGregor's left counter,en,[],[],[],1,0,3,[],[],https://twitter.com/frankrofl/status/797872908047499264,False,,0,,phoenix,,,,,,[],,,,
797872797959626752,796882683099955200,2016-11-13 12:44:33 CST,2016-11-13,12:44:33,-0500,35073791,bonneymolly,michele stock,,@joenikki3130 @SavageLantern Unfortunately most peoples of every color r racist.  Read history.  Very few have ever been tolerant😎,en,[],[],[],0,0,0,[],[],https://twitter.com/BonneyMolly/status/797872797959626752,False,,0,,phoenix,,,,,,"[{'screen_name': 'joenikki3130', 'name': 'deplorable joe', 'id': '3338225638'}]",,,,
797872568015339520,797872568015339520,2016-11-13 12:43:38 CST,2016-11-13,12:43:38,-0500,24771021,thebarbra1,"Barbra, Please!",,"Anti-Trump protest in Portland, Ore., devolves into riot  https://t.co/IUrS3yAtNZ via @usatoday :-)",en,"[{'screen_name': 'usatoday', 'name': 'usa today', 'id': '15754281'}]",['http://usat.ly/2fnIe9t'],[],0,0,0,[],[],https://twitter.com/thebarbra1/status/797872568015339520,False,,0,,phoenix,,,,,,[],,,,
797870359961739264,797870359961739264,2016-11-13 12:34:52 CST,2016-11-13,12:34:52,-0500,4074990432,1percent28,Enlightened Nameless,,r. President I promise you this will come out one day! The worse crime ever committed in the United States History!  Son of God,en,[],[],[],0,0,0,[],[],https://twitter.com/1percent28/status/797870359961739264,False,,0,,phoenix,,,,,,[],,,,
797862232243589120,797862232243589120,2016-11-13 12:02:34 CST,2016-11-13,12:02:34,-0500,23910844,withoutatrace,Trace,,"""Rape Melania"" TAKE IT DOWN! @twitter I need to have hope that regardless of how you feel about @realDonaldTrump This is despicable!",en,"[{'screen_name': 'twitter', 'name': 'twitter', 'id': '783214'}, {'screen_name': 'realdonaldtrump', 'name': 'donald j. trump', 'id': '25073877'}]",[],[],0,2,2,[],[],https://twitter.com/WithoutaTRACE/status/797862232243589120,False,,0,,phoenix,,,,,,[],,,,
797861078986203137,797861078986203137,2016-11-13 11:57:59 CST,2016-11-13,11:57:59,-0500,771721236,fsteinmetz70,Frank Steinmetz,,THESE SNOT NOSED KIDS SOULD BE HONORING THE VETERANS WHO LOST THEIR LIVES FOR THE FREEDOM SO THESE IDIOTS CAN PROTEST AND TEAR UP THINGS.,en,[],[],[],0,0,0,[],[],https://twitter.com/fsteinmetz70/status/797861078986203137,False,,0,,phoenix,,,,,,[],,,,
797856472109453312,797847816701886464,2016-11-13 11:39:41 CST,2016-11-13,11:39:41,-0500,443924415,marilynkj,AZ Voted Trump,,.@BillPeriman @jack Can u imagine if Twitter world had said Rape Michelle Obama?Take the hashtag down disrespectful pukes @twitter @Support,en,"[{'screen_name': 'billperiman', 'name': 'bill periman#feedthegitmo', 'id': '368544047'}, {'screen_name': 'jack', 'name': 'jack⚡️', 'id': '12'}, {'screen_name': 'twitter', 'name': 'twitter', 'id': '783214'}]",[],[],1,11,11,[],[],https://twitter.com/marilynkj/status/797856472109453312,False,,0,,phoenix,,,,,,[],,,,
797856393172643840,797856393172643840,2016-11-13 11:39:22 CST,2016-11-13,11:39:22,-0500,3443425634,faust418cook,Rosemary Cook,,"NORTH KORIA's ""NUCLIAR THREAT"" is lurking in the back ground. WE MUST NOT FALL ASLEEP to this  ""DANGEROUS and REAL THREAT ARIZING!.💥",en,[],[],[],0,0,0,[],[],https://twitter.com/faust418cook/status/797856393172643840,False,,0,,phoenix,,,,,,[],,,,
797848450725330944,797848450725330944,2016-11-13 11:07:48 CST,2016-11-13,11:07:48,-0500,780527133768552448,bowhunter42163,Ed,,Violence rape and murder the liberal way  https://t.co/h8vPg3ZYpD,en,[],['https://twitter.com/LeahRBoss/status/797847523910098944'],[],0,0,0,[],[],https://twitter.com/Bowhunter42163/status/797848450725330944,False,https://twitter.com/LeahRBoss/status/797847523910098944,0,,phoenix,,,,,,[],,,,
797842595636355072,797833571859886081,2016-11-13 10:44:32 CST,2016-11-13,10:44:32,-0500,1164331656,602ghouse,👈,,@TalibKweli @C_McCorey Not all Trump supporters are racist however if they sure as hell support it,en,[],[],[],1,0,0,[],[],https://twitter.com/602Ghouse/status/797842595636355072,False,,0,,phoenix,,,,,,"[{'screen_name': 'TalibKweli', 'name': 'Talib Kweli Greene', 'id': '18511475'}, {'screen_name': 'C_McCorey', 'name': 'I See Everything!!', 'id': '2333791198'}]",,,,
797835626896707584,797835095130288129,2016-11-13 10:16:51 CST,2016-11-13,10:16:51,-0500,1463105040,ttimbrooks,thad,,@smoothkobra 3) What point are you even trying to make? That Bernie is a sexist or a white nationalist?,en,[],[],[],1,0,0,[],[],https://twitter.com/ttimbrooks/status/797835626896707584,False,,0,,phoenix,,,,,,"[{'screen_name': 'smoothkobra', 'name': 'Smooth Kobra*', 'id': '1838347172'}]",,,,
797834362972610560,797834362972610560,2016-11-13 10:11:49 CST,2016-11-13,10:11:49,-0500,89298166,roncarpiomsw,"Ron Carpio, MSW","{'type': 'Point', 'coordinates': [33.52159, -112.064457]}","The slide begins unless WE stop it! Post-Trump victory bullying, harassment reported in schools  https://t.co/Jlpq5ELjsC",en,[],['http://www.cbsnews.com/news/post-trump-victory-bullying-harassment-reported-schools/'],[],0,0,0,[],[],https://twitter.com/RonCarpioMSW/status/797834362972610560,False,,0,,phoenix,,,,,,[],,,,
797834327539097604,797834327539097604,2016-11-13 10:11:41 CST,2016-11-13,10:11:41,-0500,700096122262425600,azrzdbyokie,AverageDeplorable,,Where r parents who PD tuition for violent training? Are u hiding in shame or r u calling college in outrage? #SundayMorning,en,[],[],[],0,0,0,['sundaymorning'],[],https://twitter.com/azrzdbyokie/status/797834327539097604,False,,0,,phoenix,,,,,,[],,,,
797832868500078592,797826901784068096,2016-11-13 10:05:53 CST,2016-11-13,10:05:53,-0500,35525602,cbarnella,CathyB in AZ🌵,,"@TimberlakeLaw @washingtonpost Hey, remember the anger and riots when BHO was elected...TWICE?  Sore losers.",en,[],[],[],0,0,1,[],[],https://twitter.com/cbarnella/status/797832868500078592,False,,0,,phoenix,,,,,,"[{'screen_name': 'TimberlakeLaw', 'name': 'Trademarks Are Magic', 'id': '787249747'}, {'screen_name': 'washingtonpost', 'name': 'The Washington Post', 'id': '2467791'}]",,,,
797832532637065216,797830512144502784,2016-11-13 10:04:33 CST,2016-11-13,10:04:33,-0500,512551046,emilyboxing,Emily 🌵🔆,,@Da_body2 @BenSotoKarass @ForzaCorrado it's terrible.I like that people are assembling to protest but vandalism &amp; this shit are unacceptable,en,[],[],[],0,0,0,[],[],https://twitter.com/emilyboxing/status/797832532637065216,False,,0,,phoenix,,,,,,"[{'screen_name': 'Da_body2', 'name': 'Bullet Tooth Tony', 'id': '302405272'}, {'screen_name': 'BenSotoKarass', 'name': 'Dolph LomaGGGringo 🇺🇸', 'id': '907186434'}, {'screen_name': 'ForzaCorrado', 'name': 'JCorrado', 'id': '784113080477347840'}]",,,,
797828645305749505,797828645305749505,2016-11-13 09:49:06 CST,2016-11-13,09:49:06,-0500,56117318,phoenixcp,Phoenix Now,"{'type': 'Point', 'coordinates': [33.46889822, -112.09379298]}","Paul Ryan says people should ""put their minds at ease"" about racist graffiti because the GOP doesn't support it  https://t.co/OJxqfYG5fn",en,[],['http://apne.ws/2g7ze9g'],[],0,0,1,[],[],https://twitter.com/PhoenixCP/status/797828645305749505,False,,0,,phoenix,,,,,,[],,,,
797824534300635136,797820823427891200,2016-11-13 09:32:46 CST,2016-11-13,09:32:46,-0500,85850590,byfernandas,Fernanda Santos,,@ronbailey19 @BrentNYT It's already a crime to employ undoc immigrants. There are civil &amp; criminal penalties. E-verify exists to prevent it,en,[],[],[],1,0,1,[],[],https://twitter.com/ByFernandaS/status/797824534300635136,False,,0,,phoenix,,,,,,"[{'screen_name': 'ronbailey19', 'name': 'ron bailey', 'id': '48412356'}, {'screen_name': 'BrentNYT', 'name': 'Brent Staples', 'id': '2439177534'}]",,,,
797820633635635200,797820633635635200,2016-11-13 09:17:16 CST,2016-11-13,09:17:16,-0500,700096122262425600,azrzdbyokie,AverageDeplorable,,IF OUR GOV IS GOING TO ALLOW THE VIOLENCE &amp; HATE MAYBE WE THE PPL NEED TO CLEAN THIS MESS CITIZENS LIKE PROTESTERS ARENT WORTH HAVING#UFC205,en,[],[],[],0,0,0,[],[],https://twitter.com/azrzdbyokie/status/797820633635635200,False,,0,,phoenix,,,,,,[],,,,
797818270027890688,797816142404481024,2016-11-13 09:07:52 CST,2016-11-13,09:07:52,-0500,700096122262425600,azrzdbyokie,AverageDeplorable,,@Kjames9191 Mad as hell at Obama &amp; Hillary for not denouncing the violence THE DEM PARTY IS TRULY DISGUSTING,en,[],[],[],0,0,1,[],[],https://twitter.com/azrzdbyokie/status/797818270027890688,False,,0,,phoenix,,,,,,"[{'screen_name': 'Kjames9191', 'name': 'Keith James', 'id': '705432017605947392'}]",,,,
797815381888888836,797814459670478852,2016-11-13 08:56:24 CST,2016-11-13,08:56:24,-0500,512551046,emilyboxing,Emily 🌵🔆,,"@SmelOdiesOG the fact that ""rape Melania"" is trending on twitter should be a slap on the face to rival the hottest take on where we're at",en,[],[],[],1,0,3,[],[],https://twitter.com/emilyboxing/status/797815381888888836,False,,0,,phoenix,,,,,,"[{'screen_name': 'SmelOdiesOG', 'name': 'Smelodies', 'id': '127054148'}]",,,,
797815087532675072,797815087532675072,2016-11-13 08:55:14 CST,2016-11-13,08:55:14,-0500,755407686305394688,tbird168,freshair,,"Trey Gowdy another noble man. Yes, this Rioting a political Hate Crime. Video tape them. Deport them to where they come from.  https://t.co/wHuiRK7Xqw",en,[],['https://twitter.com/Trump_Videos/status/797792369118740481'],[],0,0,0,[],[],https://twitter.com/tbird168/status/797815087532675072,False,https://twitter.com/Trump_Videos/status/797792369118740481,0,,phoenix,,,,,,[],,,,
797814459670478852,797814459670478852,2016-11-13 08:52:44 CST,2016-11-13,08:52:44,-0500,512551046,emilyboxing,Emily 🌵🔆,,I'm all for peaceful assembly but whoever made and is holding up a Rape Melania sign can seriously go fuck himself.,en,[],[],[],1,1,6,[],[],https://twitter.com/emilyboxing/status/797814459670478852,False,,0,,phoenix,,,,,,[],,,,
797811698031730689,797811698031730689,2016-11-13 08:41:46 CST,2016-11-13,08:41:46,-0500,22647649,joey_hancock,Joey Hancock,,. @keithellison isn’t helping his case on @MeetThePress. Too much anger in his voice when pressed by @chucktodd you could see it and hear it,en,"[{'screen_name': 'keithellison', 'name': 'keith ellison', 'id': '14135426'}, {'screen_name': 'meetthepress', 'name': 'meet the press', 'id': '11856892'}, {'screen_name': 'chucktodd', 'name': 'chuck todd', 'id': '50325797'}]",[],[],1,0,0,[],[],https://twitter.com/Joey_Hancock/status/797811698031730689,False,,0,,phoenix,,,,,,[],,,,
797809321375453185,797809321375453185,2016-11-13 08:32:19 CST,2016-11-13,08:32:19,-0500,39790896,bizziebaker,DesertDawg,,Can not believe she told Newt to work on his anger issues.  https://t.co/jJpsExCiVJ,en,[],['https://twitter.com/socal4trump/status/791149955742326789'],[],0,0,0,[],[],https://twitter.com/BizzieBaker/status/797809321375453185,False,https://twitter.com/socal4trump/status/791149955742326789,0,,phoenix,,,,,,[],,,,
797802027606687744,797802027606687744,2016-11-13 08:03:20 CST,2016-11-13,08:03:20,-0500,755407686305394688,tbird168,freshair,,We understand she suffered the loss of election.BUT SHE ISN‘T THE VICTIM.The country divided by Dems all deligent good citizens are victim.  https://t.co/TWJTSWsw0q,en,[],['https://twitter.com/e_plebnista/status/797799422134521856'],[],0,0,0,[],[],https://twitter.com/tbird168/status/797802027606687744,False,https://twitter.com/e_plebnista/status/797799422134521856,0,,phoenix,,,,,,[],,,,
797800546363027458,797800546363027458,2016-11-13 07:57:27 CST,2016-11-13,07:57:27,-0500,755407686305394688,tbird168,freshair,,"Her loss because her character. She is selfish, greedy, cheating, mean , murder and doesn‘t put Americans in 1st place.  https://t.co/VxQDpFWcyU",en,[],['https://twitter.com/thehill/status/797736033001570305'],[],0,0,0,[],[],https://twitter.com/tbird168/status/797800546363027458,False,https://twitter.com/thehill/status/797736033001570305,0,,phoenix,,,,,,[],,,,
797798530878320640,797793253567397888,2016-11-13 07:49:26 CST,2016-11-13,07:49:26,-0500,174267974,bobbyl_az,Bob L,,"@MGBazemoreJr  Not comparing either to sexual assault; but of the two, I personally found Clinton Found worse than emails",en,[],[],[],2,0,0,[],[],https://twitter.com/BobbyL_AZ/status/797798530878320640,False,,0,,phoenix,,,,,,[],,,,
797790207433011200,797790207433011200,2016-11-13 07:16:22 CST,2016-11-13,07:16:22,-0500,381666934,jacquelinehine1,Jacqueline Hines,,White Flight From Reality: Inside the Racist Panic that Fueled Donald Trump's Victory @alternet  https://t.co/KSdu8x2JS1,en,"[{'screen_name': 'alternet', 'name': 'alternet', 'id': '18851248'}]",['http://www.alternet.org/election-2016/white-flight-reality-inside-racist-panic-fueled-donald-trumps-victory#.WChnn-s97Lh.twitter'],[],0,0,0,[],[],https://twitter.com/JacquelineHine1/status/797790207433011200,False,,0,,phoenix,,,,,,[],,,,
797788194909483008,797781677544185856,2016-11-13 07:08:22 CST,2016-11-13,07:08:22,-0500,21063394,smenor,Scott #BLM #ACAB #AbolishThePolice Menor,,@AndreaKuszewski @JamesMelville do they need to ? They're already heavily armed and economic hardship could motivate them to attack,en,[],[],[],0,0,0,[],[],https://twitter.com/smenor/status/797788194909483008,False,,0,,phoenix,,,,,,"[{'screen_name': 'AndreaKuszewski', 'name': 'Andrea Kuszewski 🧠', 'id': '15150453'}, {'screen_name': 'JamesMelville', 'name': 'James Melville', 'id': '20675681'}]",,,,
797725551909748737,797725551909748737,2016-11-13 02:59:27 CST,2016-11-13,02:59:27,-0500,534723313,hayleeedawn,H A Y 🌹,,Me and Gords just saw the same shooting star 💫,en,[],[],[],0,0,1,[],[],https://twitter.com/hayleeedawn/status/797725551909748737,False,,0,,phoenix,,,,,,[],,,,
797707875053223936,797701585904119808,2016-11-13 01:49:12 CST,2016-11-13,01:49:12,-0500,343661446,joy_rolf,Joy To The World,,@nick14561 who do I have to assault?,en,[],[],[],0,0,0,[],[],https://twitter.com/joy_rolf/status/797707875053223936,False,,0,,phoenix,,,,,,"[{'screen_name': 'nick14561', 'name': 'Nick Cruz', 'id': '333852830'}]",,,,
797702430699835392,797702430699835392,2016-11-13 01:27:34 CST,2016-11-13,01:27:34,-0500,275603917,_boujayy,J ™,,"If I get a gun, can I get a high fashion holder for it ? I'm thinking Chanel, or Louis Vuitton.... hmmm 🤔🤔",en,[],[],[],0,0,0,[],[],https://twitter.com/_boujayy/status/797702430699835392,False,,0,,phoenix,,,,,,[],,,,
797702089199624192,797702089199624192,2016-11-13 01:26:13 CST,2016-11-13,01:26:13,-0500,17025746,reasonz01,𝔞𝔩𝔩𝔶𝔰𝔰𝔞,,Emanny Rage,en,[],[],[],0,0,0,[],[],https://twitter.com/reasonz01/status/797702089199624192,False,,0,,phoenix,,,,,,[],,,,
797685030390616065,797685030390616065,2016-11-13 00:18:26 CST,2016-11-13,00:18:26,-0500,588597181,sanchezmoses,Moses Sanchez,,"""OMG guys, I think America is racist?"" #DaveChappelle #Pookie  https://t.co/kqU4m7TXNf",en,[],[],['https://pbs.twimg.com/tweet_video_thumb/CxHyTItVEAEWOKj.jpg'],0,1,1,"['davechappelle', 'pookie']",[],https://twitter.com/SanchezMoses/status/797685030390616065,False,,1,https://pbs.twimg.com/tweet_video_thumb/CxHyTItVEAEWOKj.jpg,phoenix,,,,,,[],,,,
797683116659773440,797683116659773440,2016-11-13 00:10:49 CST,2016-11-13,00:10:49,-0500,28146121,ijoshhammond,Joshua Hammond,,Shark attack defense! Da da. Da da. Dadadadada #GoCougs,pt,[],[],[],0,0,0,['gocougs'],[],https://twitter.com/iJoshHammond/status/797683116659773440,False,,0,,phoenix,,,,,,[],,,,
797679322106511360,797678008911982592,2016-11-12 23:55:45 CST,2016-11-12,23:55:45,-0500,2749580133,peyunderwood,Peyton Underwood,,"@ChieeffKeefSosa stop cuming in her and she wouldn't have to abort, makes more sense to unload a gun rather than shoot at a bulletproof vest",en,[],[],[],0,0,2,[],[],https://twitter.com/PeyUnderwood/status/797679322106511360,False,,0,,phoenix,,,,,,"[{'screen_name': 'ChieeffKeefSosa', 'name': 'Chief Keef', 'id': '1063663872'}]",,,,
