id,conversation_id,created_at,date,time,timezone,user_id,username,name,place,tweet,language,mentions,urls,photos,replies_count,retweets_count,likes_count,hashtags,cashtags,link,retweet,quote_url,video,thumbnail,near,geo,source,user_rt_id,user_rt,retweet_id,reply_to,retweet_date,translate,trans_src,trans_dest
937832615721103360,937783712153944064,2017-12-04 17:54:54 CST,2017-12-04,17:54:54,-0500,253386721,karmelah97,Carmeezy Weezy,,@NickIsSoWhite How's that racist ahaha I have the Mexican emojis on my uncles ahah 😂,en,[],[],[],1,0,0,[],[],https://twitter.com/Karmelah97/status/937832615721103360,False,,0,,los angeles,,,,,,"[{'screen_name': 'nickissowhite', 'name': '.', 'id': '1245182767610109952'}]",,,,
937832350552952832,937832350552952832,2017-12-04 17:53:51 CST,2017-12-04,17:53:51,-0500,103734063,bens_head_space,Spider-FrankLasso,,It has always been ok to be white. Just don’t be racist. 🤷🏻‍♂️  https://t.co/3X5CTyQaWA,en,[],['https://twitter.com/theroot/status/937320579354497024'],[],0,0,0,[],[],https://twitter.com/Bens_head_space/status/937832350552952832,False,https://twitter.com/theroot/status/937320579354497024,0,,los angeles,,,,,,[],,,,
937831396642451456,937831396642451456,2017-12-04 17:50:03 CST,2017-12-04,17:50:03,-0500,15386891,johnnydpresents,John M. Duarte,,Hey @20thcenturyfox! Still need a replacement director for the last 2 weeks of shooting #BohemianRhapsody? I’m available! Call me.,en,[],[],[],0,0,0,['bohemianrhapsody'],[],https://twitter.com/JohnnyDPresents/status/937831396642451456,False,,0,,los angeles,,,,,,[],,,,
937827406848540673,937817426669924352,2017-12-04 17:34:12 CST,2017-12-04,17:34:12,-0500,1982791,bmac,Brian McPherson,,@Sam_Vecenie Child abuse.  SMH.,en,[],[],[],0,0,0,[],[],https://twitter.com/Bmac/status/937827406848540673,False,,0,,los angeles,,,,,,"[{'screen_name': 'Sam_Vecenie', 'name': 'Sam Vecenie', 'id': '116512229'}]",,,,
937821766822408192,937821766822408192,2017-12-04 17:11:47 CST,2017-12-04,17:11:47,-0500,27490977,lenonolvr9,Kim Edmonds,,Supreme Court allows full enforcement of Trump travel ban  https://t.co/0vL3h73TpL via @abc7  So it is true - the Supreme Court is RACIST/BIGOTTED  #WTF is our beautiful country coming to?  Trump has ruined it! #BREAKING,en,"[{'screen_name': 'abc7', 'name': 'abc7 eyewitness news', 'id': '16374678'}]",['http://abc7.com/2737364/'],[],0,0,0,"['wtf', 'breaking']",[],https://twitter.com/lenonolvr9/status/937821766822408192,False,,0,,los angeles,,,,,,[],,,,
937821358712487936,937821358712487936,2017-12-04 17:10:10 CST,2017-12-04,17:10:10,-0500,2830386926,vixens_rage,Anna 🥀,,"Walked to a new place to grub at lunch time, And guy gave me a free drink cuz it was my first time here.  Awww.",en,[],[],[],0,0,0,[],[],https://twitter.com/vixens_rage/status/937821358712487936,False,,0,,los angeles,,,,,,[],,,,
937819486752686081,937819486752686081,2017-12-04 17:02:44 CST,2017-12-04,17:02:44,-0500,2676196362,gods1blessings,B3lla TiffanyRenne,,Oh lord he tryna rape her,en,[],[],[],0,0,0,[],[],https://twitter.com/gods1blessings/status/937819486752686081,False,,0,,los angeles,,,,,,[],,,,
937819273099141121,937819273099141121,2017-12-04 17:01:53 CST,2017-12-04,17:01:53,-0500,178100355,needlepushers,NeedlePushers,"{'type': 'Point', 'coordinates': [34.20813, -118.5102]}","eacherton @robotbee37 tattoo artist on tattoo artist violence. These are for fun, and may not…  https://t.co/4Go0CgupLn",en,"[{'screen_name': 'robotbee37', 'name': 'liz sanchez', 'id': '281853817'}]",['https://www.instagram.com/p/BcTEhHAgNq8/'],[],0,0,0,[],[],https://twitter.com/NeedlePushers/status/937819273099141121,False,,0,,los angeles,,,,,,[],,,,
937818273134997504,937737045606391809,2017-12-04 16:57:54 CST,2017-12-04,16:57:54,-0500,831715544977911808,ray83745547,Raygun,,@HuffPost People like Trump unequivocally have no honor and integrity voting for Moore. And that includes the GOP. What is the state of our country if we turn a blind eye and vote for a pedophile ?,en,[],[],[],0,0,0,[],[],https://twitter.com/Ray83745547/status/937818273134997504,False,,0,,los angeles,,,,,,"[{'screen_name': 'HuffPost', 'name': 'HuffPost', 'id': '14511951'}]",,,,
937817850571644929,937817850571644929,2017-12-04 16:56:14 CST,2017-12-04,16:56:14,-0500,233980865,nmcrooks,Nathan Crooks,,"Got to see Call Me By Your Name in #LA over the weekend and was lucky enough to catch a Q&amp;A with director Luca Guadagnino and star Timothee Chalamet afterwards. Beautiful film, and the ending is brutal... @CMBYNFilm  https://t.co/9W988OnZqs",en,"[{'screen_name': 'cmbynfilm', 'name': 'call me by your name', 'id': '890223362370408449'}]",[],[],0,1,7,['la'],[],https://twitter.com/nmcrooks/status/937817850571644929,False,,1,https://pbs.twimg.com/ext_tw_video_thumb/937817713182937093/pu/img/-6HNTvwj0onsMg35.jpg,los angeles,,,,,,[],,,,
937817594840494080,937817594840494080,2017-12-04 16:55:13 CST,2017-12-04,16:55:13,-0500,22664654,mrcincali,MrC,,Ms Yates coincidentally concurs my other recent tweets. POTUS &amp; many other camera 🎥 facing Republicans publicly disrespect the rule of law repeatedly. Inciting many Americans to parrot disrespect vocally &amp; in violence. Term limits has promoted this degradation.  https://t.co/bfmXaVUaVu,en,[],['https://twitter.com/sallyqyates/status/937513284198117379'],[],0,0,0,[],[],https://twitter.com/MrCInCali/status/937817594840494080,False,https://twitter.com/sallyqyates/status/937513284198117379,0,,los angeles,,,,,,[],,,,
937816846094307328,937816846094307328,2017-12-04 16:52:14 CST,2017-12-04,16:52:14,-0500,871516379068850176,ballenpotus2020,Brian Allen GOP/Dem/Libertarian,,@SpeakerRyan Well At Least Your Honorable &amp; Admit Your Racism! Now Go Home &amp; Tell Your Children The Truth Mr Speaker! I Am A Racist!  https://t.co/DpIcVNJwFg,en,[],['http://thehill.com/homenews/house/363176-house-higher-education-bill-would-tie-funding-for-hbcus-to-performance?amp'],[],0,0,0,[],[],https://twitter.com/BAllenPOTUS2020/status/937816846094307328,False,,0,,los angeles,,,,,,[],,,,
937814305075904512,937814305075904512,2017-12-04 16:42:08 CST,2017-12-04,16:42:08,-0500,80132462,sagaftrafound,SAG-AFTRA Foundation,,"WATCH: “Addressing Sexual Harassment: Protection, Recourse, Recovery &amp; Culture Change” feat. @LowellPeterson #LydiaPilcher &amp; #AdamMoore -  https://t.co/Cgqos6Slgt  https://t.co/ZSArYMktvZ",en,"[{'screen_name': 'lowellpeterson', 'name': 'lowell peterson', 'id': '90709244'}]",['https://youtu.be/7eILwlKDyXU'],['https://pbs.twimg.com/media/DQPJI4EVwAAS8LS.jpg'],0,2,1,"['lydiapilcher', 'adammoore']",[],https://twitter.com/sagaftraFOUND/status/937814305075904512,False,,1,https://pbs.twimg.com/media/DQPJI4EVwAAS8LS.jpg,los angeles,,,,,,[],,,,
937813683136118784,937813683136118784,2017-12-04 16:39:40 CST,2017-12-04,16:39:40,-0500,18644074,scottstenholm,Scott Stenholm,,"Whether it's for domestic violence or one of the worst late hits in recent memory, comes not an apology or regret for any brain injury he could have caused, but the inevitable ""he will appeal."" THIS is what makes it hard to enjoy the @NFL anymore. #RobGronkowski  https://t.co/PMx1tTG5Pc",en,"[{'screen_name': 'nfl', 'name': 'nfl', 'id': '19426551'}]",['https://twitter.com/sportscenter/status/937783111743688704'],[],0,0,0,['robgronkowski'],[],https://twitter.com/ScottStenholm/status/937813683136118784,False,https://twitter.com/sportscenter/status/937783111743688704,0,,los angeles,,,,,,[],,,,
937812835773513729,937812835773513729,2017-12-04 16:36:18 CST,2017-12-04,16:36:18,-0500,2931630131,the_5th_turtle,Travis Wladkowski,,“On set chaos?!” That’s what we’re calling being a disgusting pedophile these days  https://t.co/tFFzjqWyHC,en,[],['https://twitter.com/thr/status/937803363902722049'],[],0,0,0,[],[],https://twitter.com/The_5th_Turtle/status/937812835773513729,False,https://twitter.com/thr/status/937803363902722049,0,,los angeles,,,,,,[],,,,
937812820866957312,937812820866957312,2017-12-04 16:36:14 CST,2017-12-04,16:36:14,-0500,871516379068850176,ballenpotus2020,Brian Allen GOP/Dem/Libertarian,,"Op Editorial Overlooks ""Mara Salvatruchas"" Having Lived In Honduras I Can Tell You Local Police Have Neither Arms Or Equipment! To Overcome Gangs of Narco Trafficantes! The US Has Allowed Narco Terrorism Spreading Mexico To Points South! Result Dictators!  https://t.co/CyxXw9e3ct",en,[],['http://amp.dw.com/en/opinion-honduras-crisis-was-long-in-the-making/a-41649907'],[],0,0,0,[],[],https://twitter.com/BAllenPOTUS2020/status/937812820866957312,False,,0,,los angeles,,,,,,[],,,,
937809519043690496,937809519043690496,2017-12-04 16:23:07 CST,2017-12-04,16:23:07,-0500,28043113,janetswags,Janet Wagner,,It’s very sad &amp; distrurbing that voters in AL are even considering voting for #RoyMooreChildMolester @GOP should be speaking out. #Trump has even defended Roy Moore.  Child sexual abuse is NOT okay. #ImpeachTrump #TrumpRussia  https://t.co/LxNxLXKlIS,en,"[{'screen_name': 'gop', 'name': 'gop', 'id': '11134252'}]",['https://twitter.com/maddowblog/status/937808126165901312'],[],0,0,2,"['roymoorechildmolester', 'trump', 'impeachtrump', 'trumprussia']",[],https://twitter.com/janetswags/status/937809519043690496,False,https://twitter.com/maddowblog/status/937808126165901312,0,,los angeles,,,,,,[],,,,
937807555270606848,937807555270606848,2017-12-04 16:15:19 CST,2017-12-04,16:15:19,-0500,403649395,lesternare,nare.eth,,"GUYS,  Pauline Walnuts tried to use a Kremlin agent to put an op ed out on his behalf to prove he didn’t have connections to the Kremlin 😂  Now he has to go back to house arrest  https://t.co/3uLX6sNmYS",en,[],['https://twitter.com/w7voa/status/937805328695152641'],[],1,0,1,[],[],https://twitter.com/lesternare/status/937807555270606848,False,https://twitter.com/w7voa/status/937805328695152641,0,,los angeles,,,,,,[],,,,
937806517297745920,937806517297745920,2017-12-04 16:11:11 CST,2017-12-04,16:11:11,-0500,28929451,delivknox,Deliv,,Sounds looks some good racist fun!  https://t.co/EAHmOIKyAI,en,[],['https://twitter.com/floribamashore/status/936715431515078656'],[],0,0,0,[],[],https://twitter.com/DelivKnox/status/937806517297745920,False,https://twitter.com/floribamashore/status/936715431515078656,0,,los angeles,,,,,,[],,,,
937806311273660417,937806311273660417,2017-12-04 16:10:22 CST,2017-12-04,16:10:22,-0500,1177606800,katie_blonde007,Katie Norman,"{'type': 'Point', 'coordinates': [34.09963005, -118.37618447]}",Fancy gyspy girl from The Hills today 🌞🎬🎾💁🏼‍♀️🔮💰Shooting the new show ‘Vida’ for starz 🎥 Photo…  https://t.co/oyW687UXbK,en,[],['https://www.instagram.com/p/BcS-ydynlRS/'],[],0,0,0,[],[],https://twitter.com/Katie_Blonde007/status/937806311273660417,False,,0,,los angeles,,,,,,[],,,,
937802508793028608,937802508793028608,2017-12-04 15:55:16 CST,2017-12-04,15:55:16,-0500,32181794,scott_bowser,The Man In The Desert,,I’d say we throw Trump Steaks into the Boston Harbor to protest unfair taxation but I don’t want bottom feeding fish to eat rancid meat.,en,[],[],[],0,0,2,[],[],https://twitter.com/scott_bowser/status/937802508793028608,False,,0,,los angeles,,,,,,[],,,,
937797019711586304,937797019711586304,2017-12-04 15:33:27 CST,2017-12-04,15:33:27,-0500,31326471,kennla,ken kader,,We all knew he was a racist and supports anti gay movements.  https://t.co/seEmrxtU2R,en,[],['https://twitter.com/susannow3/status/937782137499148288'],[],0,0,0,[],[],https://twitter.com/kennLA/status/937797019711586304,False,0,0,,los angeles,,,,,,[],,,,
937796406248587264,937796406248587264,2017-12-04 15:31:01 CST,2017-12-04,15:31:01,-0500,2244514345,chaoscolours,andrea ☭,,hello just wanted to say thank u for not retweeting the horrifying cat video on my timeline. thanks to your warnings I was able to avoid it entirely.  It’s comforting that most of us love furry babies and would never harm them like that. Appreciate it.,en,[],[],[],0,0,8,[],[],https://twitter.com/chaoscolours/status/937796406248587264,False,,0,,los angeles,,,,,,[],,,,
937795598429732864,937787416227618816,2017-12-04 15:27:48 CST,2017-12-04,15:27:48,-0500,401350043,ricklessabandon,rick maher,,"@SmashGizmo yeah 2.5d doesn’t deliver the crispness i want, and i was kind of hoping for a banger of a robot master theme preview or something. also the first weapon shown didn’t have obvious platforming aspects which is a little worrying — kind of want a sign that the platforming will be 💯",en,[],[],[],1,0,0,[],[],https://twitter.com/ricklessabandon/status/937795598429732864,False,,0,,los angeles,,,,,,"[{'screen_name': 'SmashGizmo', 'name': 'Wesley Ruttle', 'id': '1111045531'}]",,,,
937793617745211392,937793617745211392,2017-12-04 15:19:56 CST,2017-12-04,15:19:56,-0500,1497260364,valleycfthedead,a,,yesterday was the first day in months where i didnt have a single panic attack and it was coincidentally on the day of the super moon im not saying im a witch but......im a witch,en,[],[],[],0,0,0,[],[],https://twitter.com/valleycfthedead/status/937793617745211392,False,,0,,los angeles,,,,,,[],,,,
937790041320857600,937771230970728452,2017-12-04 15:05:43 CST,2017-12-04,15:05:43,-0500,822998890433507328,allen58voteblue,Allen #StopTheNazis,,"@SPEAKUPJULIA Different parts of the country will react differently to blue protest. In Los Angeles the police will look on to make things safe W/fee arrests In red states they may call in the National Guard &amp; shoot people. I am disabled and if/when arrested, I’ll wear it as a badge of honor",en,[],[],[],1,1,1,[],[],https://twitter.com/Allen58VoteBlue/status/937790041320857600,False,,0,,los angeles,,,,,,"[{'screen_name': 'SPEAKUPJULIA', 'name': 'Julia V Lawson', 'id': '823337401061937152'}]",,,,
937785231586631680,937785231586631680,2017-12-04 14:46:37 CST,2017-12-04,14:46:37,-0500,2163679886,jwatson0984,Jonathan Watson,,@VeniceMase @LAIreland Mason is under attack  https://t.co/bIeUKi5pld,en,"[{'screen_name': 'laireland', 'name': 'john ireland', 'id': '34541677'}]",['https://twitter.com/Rich_Hammond/status/937784661735915520'],[],0,0,0,[],[],https://twitter.com/JWatson0984/status/937785231586631680,False,https://twitter.com/Rich_Hammond/status/937784661735915520,0,,los angeles,,,,,,[],,,,
937782801239126016,937782801239126016,2017-12-04 14:36:57 CST,2017-12-04,14:36:57,-0500,2211044942,mikeyyzeee,Michael D'Angelo,,"We all living in a zombie movie, only weapon is common sense.",en,[],[],[],0,0,2,[],[],https://twitter.com/mikeyyzeee/status/937782801239126016,False,,0,,los angeles,,,,,,[],,,,
937782455670423552,937782455670423552,2017-12-04 14:35:35 CST,2017-12-04,14:35:35,-0500,62631142,luigitel180,Luis O. Mendoza,,La última vez que alguien propuso amnistía con los narcotraficantes creo que se llamaba Pablo Escobar y el cartel de Cali y ahora nuestro mesías tropical @lopezobrador_  revive a tan ilustres narco-politicos #baiabaia,es,"[{'screen_name': 'lopezobrador_', 'name': 'andrés manuel', 'id': '82119937'}]",[],[],0,1,1,['baiabaia'],[],https://twitter.com/luigitel180/status/937782455670423552,False,,0,,los angeles,,,,,,[],,,,
937782035623510016,937774009655218179,2017-12-04 14:33:55 CST,2017-12-04,14:33:55,-0500,2337137324,defymasters,John Blackman,,"@RedactedTonight Instead, they ignore that completely and drug test the victim of the police shooting.",en,[],[],[],1,0,8,[],[],https://twitter.com/DefyMasters/status/937782035623510016,False,,0,,los angeles,,,,,,"[{'screen_name': 'RedactedTonight', 'name': 'redacted tonight', 'id': '2374745089'}]",,,,
937781523452792832,937781523452792832,2017-12-04 14:31:52 CST,2017-12-04,14:31:52,-0500,18053163,laurieallee,laurie allee,,"In 80 as GOP he advocated for a 50 cent gas tax to discourage consumption, supported ERA, gun control, pro choice. He backed Nader in 2000.  https://t.co/vydNMa0eQj",en,[],['https://twitter.com/zekejmiller/status/937776705107845120'],[],0,0,0,[],[],https://twitter.com/laurieallee/status/937781523452792832,False,https://twitter.com/zekejmiller/status/937776705107845120,0,,los angeles,,,,,,[],,,,
937780537053274113,937780537053274113,2017-12-04 14:27:57 CST,2017-12-04,14:27:57,-0500,1520285306,adrianalisett_,Adriana,,Lately all I’ve been watching is crime documentaries,en,[],[],[],0,0,0,[],[],https://twitter.com/adrianalisett_/status/937780537053274113,False,,0,,los angeles,,,,,,[],,,,
937780260141023232,937780260141023232,2017-12-04 14:26:51 CST,2017-12-04,14:26:51,-0500,15757699,dances,ZaZa Gabor,,Only a dumb privileged white dude  Would think it’s smart to go for a retrial in a rape case he got a wild great deal on and then was in the public eye for  to change his character  That dummy should have went into hiding,en,[],[],[],0,0,7,[],[],https://twitter.com/dances/status/937780260141023232,False,,0,,los angeles,,,,,,[],,,,
937776424160657408,937776424160657408,2017-12-04 14:11:37 CST,2017-12-04,14:11:37,-0500,456468722,jacobmoral21,Carlos,,"Low key, I think my car is a victim of this. 🤔  https://t.co/pjOLdEg1h9",en,[],['https://twitter.com/whattheffacts/status/937749602463297536'],[],0,0,0,[],[],https://twitter.com/jacobmoral21/status/937776424160657408,False,https://twitter.com/whattheffacts/status/937749602463297536,0,,los angeles,,,,,,[],,,,
937775452457803776,937775452457803776,2017-12-04 14:07:45 CST,2017-12-04,14:07:45,-0500,309302492,mikeprysner,#ShutDownRedHill,,"Grand Staircase-Escalante is a treasure and one of the most epic, moving places I’ve ever seen. Of course President Monster wants to devour it for profits. Devastating crime against nature &amp; history.  https://t.co/1RrvQsVrM5",en,[],[],['https://pbs.twimg.com/media/DQOlyCZVoAADoVl.jpg'],9,58,168,[],[],https://twitter.com/MikePrysner/status/937775452457803776,False,,1,https://pbs.twimg.com/media/DQOlyCZVoAADoVl.jpg,los angeles,,,,,,[],,,,
937774476611149824,937774476611149824,2017-12-04 14:03:52 CST,2017-12-04,14:03:52,-0500,947101237,josuealaas,Josue Alas,,Is it normal for a latino person to be scared of white people ? 🤔 not all of them are racist though  https://t.co/uGcICdFcgL,en,[],[],['https://pbs.twimg.com/tweet_video_thumb/DQOk6P5UIAAovx5.jpg'],0,0,0,[],[],https://twitter.com/JosueAlaas/status/937774476611149824,False,,1,https://pbs.twimg.com/tweet_video_thumb/DQOk6P5UIAAovx5.jpg,los angeles,,,,,,[],,,,
937774162390630400,937737728816504832,2017-12-04 14:02:37 CST,2017-12-04,14:02:37,-0500,859122540,johndiglesias,John Iglesias,,@MooreSenate I guess all those women were a fiction of the media's and Washington's  imagination. As long as it's a guy of my party who cares if he's a pedophile?! He's a Christian! 👏,en,[],[],[],0,0,0,[],[],https://twitter.com/JohnDiglesias/status/937774162390630400,False,,0,,los angeles,,,,,,"[{'screen_name': 'MooreSenate', 'name': 'Best Attitude Status', 'id': '2594256721'}]",,,,
937772933581115392,937772933581115392,2017-12-04 13:57:45 CST,2017-12-04,13:57:45,-0500,15757699,dances,ZaZa Gabor,,Next time somebody comes up to me and asks am i  dances with white girls I’m just going to say I’m one of the 11 other black dudes in EDM and call them a racist  It will be believable,en,[],[],[],1,0,5,[],[],https://twitter.com/dances/status/937772933581115392,False,,0,,los angeles,,,,,,[],,,,
937769890466775040,937769890466775040,2017-12-04 13:45:39 CST,2017-12-04,13:45:39,-0500,15265993,kelly_connaire,Kelly Connaire,,URGENT: Politicians are trying to attack #PlannedParenthood and #reprohealth &amp; rights. Tell them you #StandwithPP:  https://t.co/yvP38ZCsXq,en,[],['http://istandwithpp.org/#pledge'],[],0,0,1,"['plannedparenthood', 'reprohealth', 'standwithpp']",[],https://twitter.com/kelly_connaire/status/937769890466775040,False,,0,,los angeles,,,,,,[],,,,
937768517385908224,937768517385908224,2017-12-04 13:40:12 CST,2017-12-04,13:40:12,-0500,2658525395,realkayls,ᴋᴀʏʟs 🦇,,my first time shooting cars &amp; i had so much fun doing it! ☺️🖤  https://t.co/koRB3sKiu0,en,[],[],"['https://pbs.twimg.com/media/DQOffVYU8AIXwtq.jpg', 'https://pbs.twimg.com/media/DQOffVZVoAA3UNA.jpg', 'https://pbs.twimg.com/media/DQOffVZU8AAR8Bz.jpg']",0,2,17,[],[],https://twitter.com/realkayls/status/937768517385908224,False,,1,https://pbs.twimg.com/media/DQOffVYU8AIXwtq.jpg,los angeles,,,,,,[],,,,
937767472320663555,937767472320663555,2017-12-04 13:36:02 CST,2017-12-04,13:36:02,-0500,267352671,pfrankwilliams,P. Frank Williams,"{'type': 'Point', 'coordinates': [33.9853, -118.424]}",Was Suge behind the murder of Tupac? Find out tomorrow night at ten pm only on A&amp;E! “Who Killed…  https://t.co/QXtWpo2ijb,en,[],['https://www.instagram.com/p/BcSswmTDLjq/'],[],1,0,1,[],[],https://twitter.com/pfrankwilliams/status/937767472320663555,False,,0,,los angeles,,,,,,[],,,,
937766302831144960,937766302831144960,2017-12-04 13:31:24 CST,2017-12-04,13:31:24,-0500,896827568,katmando24,Ian Katz,,My paper I'm writing against gun control is so sexy Sports Illustrated called me up and want to make my paper their next cover of 2018 swim suit edition 😍😍👅👅..,en,[],[],[],0,0,0,[],[],https://twitter.com/KatManDo24/status/937766302831144960,False,,0,,los angeles,,,,,,[],,,,
937765824143618048,937765824143618048,2017-12-04 13:29:29 CST,2017-12-04,13:29:29,-0500,3140907721,thefineauntie,Jay,,I️ literally just had a dream i was at a training and terrorist came outta no where firing on us. Like that really woke me up scared af.,en,[],[],[],0,0,0,[],[],https://twitter.com/TheFineAuntie/status/937765824143618048,False,,0,,los angeles,,,,,,[],,,,
937765470165331969,937765470165331969,2017-12-04 13:28:05 CST,2017-12-04,13:28:05,-0500,19216852,tearaci,Tearaci,,"Trump is a liar, a racist, possibly the worst human and definetly the worst President ever.   #resist",en,[],[],[],0,0,3,['resist'],[],https://twitter.com/TeaRACI/status/937765470165331969,False,,0,,los angeles,,,,,,[],,,,
937763511987400704,937753660787974146,2017-12-04 13:20:18 CST,2017-12-04,13:20:18,-0500,822998890433507328,allen58voteblue,Allen #StopTheNazis,,@TeaPainUSA @GypsySpirit46 This is a terrorist threat and I don’t know why anybody who wants a Civil War in the United States doesn’t get banned from Twitter. He needs to be investigated to see which white supremacist organization he belongs to and have them investigated. This is terrorism!This is fascism!,en,[],[],[],1,1,5,[],[],https://twitter.com/Allen58VoteBlue/status/937763511987400704,False,,0,,los angeles,,,,,,"[{'screen_name': 'TeaPainUSA', 'name': 'Tea Pain', 'id': '2421067430'}, {'screen_name': 'GypsySpirit46', 'name': 'Andrea Valentini 🇨🇦', 'id': '2155923307'}]",,,,
937762650687201281,937762650687201281,2017-12-04 13:16:53 CST,2017-12-04,13:16:53,-0500,3282166201,javierprusky,Javier Prusky,"{'type': 'Point', 'coordinates': [34.0522, -118.243]}",The night is where danger and pleasure mix and lurk 🌌 New still from one of my shows Deadline:…  https://t.co/TYNo0mi8bF,en,[],['https://www.instagram.com/p/BcSqytCFXuY/'],[],0,0,0,[],[],https://twitter.com/JavierPrusky/status/937762650687201281,False,,0,,los angeles,,,,,,[],,,,
937761374750437376,937761374750437376,2017-12-04 13:11:49 CST,2017-12-04,13:11:49,-0500,40590983,lobotamybarbie,𝓛𝓮𝔁𝓲 🐇🔪,,I sleep with literally 3 blankets and 2 comforters and the heat on and am still cold at night from the brutal 50 degree LA winter nights lolol,en,[],[],[],0,0,0,[],[],https://twitter.com/lobotamybarbie/status/937761374750437376,False,,0,,los angeles,,,,,,[],,,,
937761352571019264,937761352571019264,2017-12-04 13:11:43 CST,2017-12-04,13:11:43,-0500,15757699,dances,ZaZa Gabor,,Ur MCM is on twitter accusing people of lying about rape attempts for clout  https://t.co/AXEZE3dHJB,en,[],['https://twitter.com/elitebreak_/status/937760165658578944'],[],0,0,2,[],[],https://twitter.com/dances/status/937761352571019264,False,https://twitter.com/elitebreak_/status/937760165658578944,0,,los angeles,,,,,,[],,,,
937760660208807936,937760660208807936,2017-12-04 13:08:58 CST,2017-12-04,13:08:58,-0500,19499832,neverwear,Cat Mihos,,grand piece in the @latimes yesterday by @andmichaelgreen on murder &amp; Agatha Christie...  https://t.co/yqO5tCGbxP,en,"[{'screen_name': 'latimes', 'name': 'los angeles times', 'id': '16664681'}, {'screen_name': 'andmichaelgreen', 'name': 'michael green', 'id': '876219102'}]","['http://www.latimes.com/opinion/op-ed/la-oe-green-agatha-christie-orient-express-20171201-story,amp.html']",[],0,0,5,[],[],https://twitter.com/neverwear/status/937760660208807936,False,,0,,los angeles,,,,,,[],,,,
937760242087202817,937760242087202817,2017-12-04 13:07:19 CST,2017-12-04,13:07:19,-0500,4836008422,socalrehabs,Lotus Place Recovery,,"With so many drug and alcohol centers in California, finding #LGBTQ #addictiontreatment &amp; substance abuse recovery resources may provide the key to sobriety… https://t.co/Dibi4Pf1rD",en,[],['https://lotusplacerecovery.com/lgbtq-addiction-treatment/'],[],0,0,1,"['lgbtq', 'addictiontreatment']",[],https://twitter.com/SoCalRehabs/status/937760242087202817,False,,0,,los angeles,,,,,,[],,,,
937758725896470529,937758725896470529,2017-12-04 13:01:17 CST,2017-12-04,13:01:17,-0500,2268460802,knastyyyyy,♐️🇭🇳,,Lmaooooo she was really shooting on this nigga tho  https://t.co/PdiN0dlq1W,en,[],['https://twitter.com/_jaygwalla/status/937396646819790848'],[],0,0,0,[],[],https://twitter.com/Knastyyyyy/status/937758725896470529,False,https://twitter.com/_jaygwalla/status/937396646819790848,0,,los angeles,,,,,,[],,,,
