id,conversation_id,created_at,date,time,timezone,user_id,username,name,place,tweet,language,mentions,urls,photos,replies_count,retweets_count,likes_count,hashtags,cashtags,link,retweet,quote_url,video,thumbnail,near,geo,source,user_rt_id,user_rt,retweet_id,reply_to,retweet_date,translate,trans_src,trans_dest
833101924639571968,833101924639571968,2017-02-18 17:52:31 CST,2017-02-18,17:52:31,-0500,430741049,massimofaggioli,Massimo Faggioli,,"In #Trump and Bannon's attack against the ""global elite"" there is so much of the language of fascists in 1920s Europe",en,[],[],[],0,2,9,['trump'],[],https://twitter.com/MassimoFaggioli/status/833101924639571968,False,,0,,philadelphia,,,,,,[],,,,
833101082494636032,833101082494636032,2017-02-18 17:49:10 CST,2017-02-18,17:49:10,-0500,755477602501025792,annmariedoley,adthyme@aol.com,,"Trump says ""we cherish our police"" and what's happening to them is ""very unfair."" What about all the victims of police violence? #TrumpRally",en,[],[],[],1,1,7,['trumprally'],[],https://twitter.com/AnnMarieDoley/status/833101082494636032,False,,0,,philadelphia,,,,,,[],,,,
833100631917416448,833100631917416448,2017-02-18 17:47:23 CST,2017-02-18,17:47:23,-0500,151724707,alwaysbewrite,POUNDCAKE,"{'type': 'Point', 'coordinates': [39.97430373, -75.1809203]}","With @blunted215 and @thewurdsmith talkin shit (@ Crime &amp; Punishment Brewing Co. in Philadelphia, PA w/ @blunted215)  https://t.co/pwK9HVZhUQ",en,"[{'screen_name': 'blunted215', 'name': 'childless sambino', 'id': '68020673'}, {'screen_name': 'thewurdsmith', 'name': 'miles moral-less', 'id': '103116485'}, {'screen_name': 'blunted215', 'name': 'childless sambino', 'id': '68020673'}]",['https://www.swarmapp.com/c/iE9OMwfWjQr'],[],0,0,3,[],[],https://twitter.com/AlwaysBeWrite/status/833100631917416448,False,,0,,philadelphia,,,,,,[],,,,
833097577214181376,833097577214181376,2017-02-18 17:35:15 CST,2017-02-18,17:35:15,-0500,755477602501025792,annmariedoley,adthyme@aol.com,,"""I've directed the #DofJ...to protect our cops, our sheriffs, and police, from crimes of violence against them."" Uh, say what? #TrumpRally",en,[],[],[],0,0,0,"['dofj', 'trumprally']",[],https://twitter.com/AnnMarieDoley/status/833097577214181376,False,,0,,philadelphia,,,,,,[],,,,
833096060931284992,833095597536182273,2017-02-18 17:29:13 CST,2017-02-18,17:29:13,-0500,434608855,phillychristian,Contrarian,,@NBCPhiladelphia Sounds like someone didn't know that you don't bring a knife to a gun fight.,en,[],[],[],0,0,1,[],[],https://twitter.com/PhillyChristian/status/833096060931284992,False,,0,,philadelphia,,,,,,"[{'screen_name': 'NBCPhiladelphia', 'name': 'NBC10 Philadelphia', 'id': '15755669'}]",,,,
833093682387701760,833093682387701760,2017-02-18 17:19:46 CST,2017-02-18,17:19:46,-0500,3865434921,margueritesara1,Marguerite Sarah Ann,,drug and rape Sarah because he wanted another $100.000 and Sarah did not have it.,en,[],[],[],0,0,0,[],[],https://twitter.com/MargueriteSara1/status/833093682387701760,False,,0,,philadelphia,,,,,,[],,,,
833093328468062208,833093328468062208,2017-02-18 17:18:22 CST,2017-02-18,17:18:22,-0500,2724834285,eric__eaton,Eric Eaton 🧢,,Every Secret Service member had a heart attack.  https://t.co/HycMP5w92w,en,[],['https://twitter.com/cnnpolitics/status/833092012261900289'],[],0,0,0,[],[],https://twitter.com/Eric__Eaton/status/833093328468062208,False,https://twitter.com/cnnpolitics/status/833092012261900289,0,,philadelphia,,,,,,[],,,,
833089398031908864,833089398031908864,2017-02-18 17:02:45 CST,2017-02-18,17:02:45,-0500,755477602501025792,annmariedoley,adthyme@aol.com,,"He's hitting all the big buttons - xenophobia, crime, racism, special interests. ""Jobs are already starting to pour back in!"" #Impeachtrump",en,[],[],[],1,0,0,['impeachtrump'],[],https://twitter.com/AnnMarieDoley/status/833089398031908864,False,,0,,philadelphia,,,,,,[],,,,
833088810078568448,833088810078568448,2017-02-18 17:00:25 CST,2017-02-18,17:00:25,-0500,2240034134,doyiie,🤟🏻,,Are weirdo SJW writers really calling pewdiepie a white supremacist/Nazi? the liberal media is fucking weird dawg,en,[],[],[],0,0,0,[],[],https://twitter.com/DoyIIe/status/833088810078568448,False,,0,,philadelphia,,,,,,[],,,,
833087964045512704,833087964045512704,2017-02-18 16:57:03 CST,2017-02-18,16:57:03,-0500,755477602501025792,annmariedoley,adthyme@aol.com,,"OMG, Trump quotes #ThomasJefferson to viciously attack the media. #SteveBannon had to write this. This man is so dangerous. #TheResistance",en,[],[],[],0,0,0,"['thomasjefferson', 'stevebannon', 'theresistance']",[],https://twitter.com/AnnMarieDoley/status/833087964045512704,False,,0,,philadelphia,,,,,,[],,,,
833084177876647936,833084177876647936,2017-02-18 16:42:00 CST,2017-02-18,16:42:00,-0500,1332021805,twalshtim,There R sum who call me TIM,,"Wait for it, wait for it, the left will find a way to protest this. Perhaps Russian or those mean Corrections officers did this  https://t.co/lXBKIroBRM",en,[],['https://twitter.com/michellemalkin/status/833039510644604931'],[],0,0,1,[],[],https://twitter.com/TwalshTim/status/833084177876647936,False,https://twitter.com/michellemalkin/status/833039510644604931,0,,philadelphia,,,,,,[],,,,
833081410806304768,833081410806304768,2017-02-18 16:31:00 CST,2017-02-18,16:31:00,-0500,3865434921,margueritesara1,Marguerite Sarah Ann,,Calvin Manning maybe his first son that he got from the rape that he knew nothing about and he may not be aware that he was never to touch  https://t.co/6NHjNX5BWC,en,[],[],"['https://pbs.twimg.com/media/C4-zH08XUAEx9Fs.jpg', 'https://pbs.twimg.com/media/C4-zH18WAAALy59.jpg']",0,0,0,[],[],https://twitter.com/MargueriteSara1/status/833081410806304768,False,,1,https://pbs.twimg.com/media/C4-zH08XUAEx9Fs.jpg,philadelphia,,,,,,[],,,,
833077535135191040,833077535135191040,2017-02-18 16:15:36 CST,2017-02-18,16:15:36,-0500,755477602501025792,annmariedoley,adthyme@aol.com,,Who's paying for the plane &amp; security for Trump's Red Bull refuel rally in #Florida today? Sick of his abuse of our dollars. #Impeach45,en,[],[],[],0,0,1,"['florida', 'impeach45']",[],https://twitter.com/AnnMarieDoley/status/833077535135191040,False,,0,,philadelphia,,,,,,[],,,,
833077303261409281,833077303261409281,2017-02-18 16:14:41 CST,2017-02-18,16:14:41,-0500,56478667,darealny_,NY,,Don't understand how people play the victim in situations they create🤔,en,[],[],[],0,1,0,[],[],https://twitter.com/DaRealNY_/status/833077303261409281,False,,0,,philadelphia,,,,,,[],,,,
833075881824362496,833075881824362496,2017-02-18 16:09:02 CST,2017-02-18,16:09:02,-0500,3865434921,margueritesara1,Marguerite Sarah Ann,,"he became one by rape. You see, he maybe Elijah Muhammad and that body may have been open for gay men &amp; we do not know why he is in Bryheem  https://t.co/P2uCqefdcA",en,[],[],"['https://pbs.twimg.com/media/C4-uGDJXAAAiZjj.jpg', 'https://pbs.twimg.com/media/C4-uGGBXUAAHiP6.jpg']",0,0,0,[],[],https://twitter.com/MargueriteSara1/status/833075881824362496,False,,1,https://pbs.twimg.com/media/C4-uGDJXAAAiZjj.jpg,philadelphia,,,,,,[],,,,
833074894271188993,833074894271188993,2017-02-18 16:05:07 CST,2017-02-18,16:05:07,-0500,57976284,philadelphiacp,Philadelphia Now,"{'type': 'Point', 'coordinates': [39.93997834, -75.16645509]}","3 officers hospitalized after being sprayed with pepper spray during Center City protest, police say:…  https://t.co/7Zznu0ZgMU",en,[],['https://twitter.com/i/web/status/833072470622138369'],[],0,0,0,[],[],https://twitter.com/PhiladelphiaCP/status/833074894271188993,False,,0,,philadelphia,,,,,,[],,,,
833072709588365319,833072709588365319,2017-02-18 15:56:26 CST,2017-02-18,15:56:26,-0500,281278913,trickthetm,Patrick,,Oh so there was a protest somewhere around here. That's why the surge pricing,en,[],[],[],0,0,0,[],[],https://twitter.com/trickthetm/status/833072709588365319,False,,0,,philadelphia,,,,,,[],,,,
833071903480877058,833071903480877058,2017-02-18 15:53:14 CST,2017-02-18,15:53:14,-0500,30130162,swishmahoney34,† Deron Mahoney,,You know it's a nice day in north philly when you hear dirt bikes and gun shots,en,[],[],[],0,2,2,[],[],https://twitter.com/SwishMahoney34/status/833071903480877058,False,,0,,philadelphia,,,,,,[],,,,
833071205506772992,833071205506772992,2017-02-18 15:50:27 CST,2017-02-18,15:50:27,-0500,3865434921,margueritesara1,Marguerite Sarah Ann,,have sex and he keeps getting paid for the children that he has by rape and Sarah who is Marguerite never had a relationship with him and,en,[],[],[],0,0,0,[],[],https://twitter.com/MargueriteSara1/status/833071205506772992,False,,0,,philadelphia,,,,,,[],,,,
833067984998506496,833067984998506496,2017-02-18 15:37:39 CST,2017-02-18,15:37:39,-0500,3855293741,miller_report,THE MILLER REPORT ™️,,"Imhotep is playing suffocating defense &amp; getting easy looks on offense. MCS has to get their top gun, Malik Archer clean open looks",en,[],[],[],0,1,1,[],[],https://twitter.com/Miller_Report/status/833067984998506496,False,,0,,philadelphia,,,,,,[],,,,
833066240994320384,833066240994320384,2017-02-18 15:30:44 CST,2017-02-18,15:30:44,-0500,3865434921,margueritesara1,Marguerite Sarah Ann,,Bay and Martha called police and they came and pulled a gun to stop Marguerite from going after Bay and Martha killed her because she,en,[],[],[],1,0,0,[],[],https://twitter.com/MargueriteSara1/status/833066240994320384,False,,0,,philadelphia,,,,,,[],,,,
833065822767640577,833065822767640577,2017-02-18 15:29:04 CST,2017-02-18,15:29:04,-0500,57976284,philadelphiacp,Philadelphia Now,"{'type': 'Point', 'coordinates': [39.93997834, -75.16645509]}","Fight between two taxi drivers leads to shooting outside SEPTA station, according to police.  https://t.co/uIttoChiuO",en,[],['http://toplocalnow.com/us/philadelphia'],[],0,0,0,[],[],https://twitter.com/PhiladelphiaCP/status/833065822767640577,False,,0,,philadelphia,,,,,,[],,,,
833060312718905344,833060312718905344,2017-02-18 15:07:10 CST,2017-02-18,15:07:10,-0500,2289050799,erbefi5051,EricBF,"{'type': 'Point', 'coordinates': [39.952, -75.164]}","Ain't nothing like lil protest :D @ Center City, Philadelphia  https://t.co/0Di6d5mNCb",en,[],['https://www.instagram.com/p/BQqt1FtlLkQ/'],[],0,0,0,[],[],https://twitter.com/erbefi5051/status/833060312718905344,False,,0,,philadelphia,,,,,,[],,,,
833059435459313664,833059435459313664,2017-02-18 15:03:41 CST,2017-02-18,15:03:41,-0500,860523452,andygorel,AG,,Every time you think shooting stars by @bag_raiders is gonna start to fade away a little bit something wild happens and it gets even bigger,en,"[{'screen_name': 'bag_raiders', 'name': 'bag raiders', 'id': '23570225'}]",[],[],0,0,1,[],[],https://twitter.com/andygorel/status/833059435459313664,False,,0,,philadelphia,,,,,,[],,,,
833052639445315584,833052639445315584,2017-02-18 14:36:41 CST,2017-02-18,14:36:41,-0500,320705629,rick_money56,RF-fitness,,Who wanna go to the gun range with me 💢😎,en,[],[],[],0,0,0,[],[],https://twitter.com/Rick_Money56/status/833052639445315584,False,,0,,philadelphia,,,,,,[],,,,
833042243233673216,833042243233673216,2017-02-18 13:55:22 CST,2017-02-18,13:55:22,-0500,3855293741,miller_report,THE MILLER REPORT ™️,,"Final Score: King 62 vs. Del Val 58. Balanced scoring attack  figures. Kiah-El &amp; Holley w/ 13, McNair w/11, Burgess w/ 10",en,[],[],[],0,2,1,[],[],https://twitter.com/Miller_Report/status/833042243233673216,False,,0,,philadelphia,,,,,,[],,,,
833041884503228416,833041884503228416,2017-02-18 13:53:57 CST,2017-02-18,13:53:57,-0500,599547712,kherleesi,♡,,I think I have anger issues but like I don't rlly want to solve them so it's fine I'm fine,en,[],[],[],0,0,6,[],[],https://twitter.com/kherleesi/status/833041884503228416,False,,0,,philadelphia,,,,,,[],,,,
833033011620872195,833033011620872195,2017-02-18 13:18:41 CST,2017-02-18,13:18:41,-0500,148571651,shirenation,The Shire,,I will never forget this. Step on their throats. Murder them. Win by 100.  https://t.co/HFinkWHeFn,en,[],[],['https://pbs.twimg.com/tweet_video_thumb/C4-HETlUcAEZR4T.jpg'],4,9,29,[],[],https://twitter.com/ShireNation/status/833033011620872195,False,,1,https://pbs.twimg.com/tweet_video_thumb/C4-HETlUcAEZR4T.jpg,philadelphia,,,,,,[],,,,
833026211773296641,833025824471265280,2017-02-18 12:51:40 CST,2017-02-18,12:51:40,-0500,77278239,momsamango,Lisa Nelson-Haynes,,@thehill why? Our school children r in more danger w/her as #Secretary ofEd. #Trump,en,[],[],[],0,0,4,"['secretary', 'trump']",[],https://twitter.com/momsamango/status/833026211773296641,False,,0,,philadelphia,,,,,,"[{'screen_name': 'thehill', 'name': 'The Hill', 'id': '1917731'}]",,,,
833025358723153920,833025358723153920,2017-02-18 12:48:17 CST,2017-02-18,12:48:17,-0500,755477602501025792,annmariedoley,adthyme@aol.com,,"#Trump: ""I am the the least anti-Semitic person you ever met, I am the least racist."" Who answers questions like this? A defensive child?",en,[],[],[],0,0,0,['trump'],[],https://twitter.com/AnnMarieDoley/status/833025358723153920,False,,0,,philadelphia,,,,,,[],,,,
833025044364292096,833025044364292096,2017-02-18 12:47:02 CST,2017-02-18,12:47:02,-0500,2742935294,stanrails_store,Stan Feldman 🚂📷,," https://t.co/GYyAZEHSSS: 2 Philly police officers injured, 2 arrests in anti-gov't protests.  https://t.co/NDdiAwcmnm",en,[],"['http://6abc.com', 'http://6abc.com/news/2-philly-police-officers-injured-in-anti-govt-protests-/1760836/']",[],0,0,0,[],[],https://twitter.com/stanrails_store/status/833025044364292096,False,,0,,philadelphia,,,,,,[],,,,
833023839776931846,833023839776931846,2017-02-18 12:42:14 CST,2017-02-18,12:42:14,-0500,314368410,thetimkintz,Tim Kintz,"{'type': 'Point', 'coordinates': [39.93740536, -75.15823402]}",It's time to get in the fight and attack greatness! #attackgreatness #success #fightforsuccess…  https://t.co/MNCxmymFXW,en,[],['https://www.instagram.com/p/BQqdPUojWDQ/'],[],0,0,1,"['attackgreatness', 'success', 'fightforsuccess']",[],https://twitter.com/TheTimKintz/status/833023839776931846,False,,0,,philadelphia,,,,,,[],,,,
833021477976944640,833021477976944640,2017-02-18 12:32:51 CST,2017-02-18,12:32:51,-0500,3865434921,margueritesara1,Marguerite Sarah Ann,,"for rape, which Marguerite is sorry about but she cannot see and that's s problem.",en,[],[],[],0,0,0,[],[],https://twitter.com/MargueriteSara1/status/833021477976944640,False,,0,,philadelphia,,,,,,[],,,,
833021228764057600,833005479081164800,2017-02-18 12:31:52 CST,2017-02-18,12:31:52,-0500,309772940,wallwriting,Mike Wall,,"@FoxNews @SheriffClarke neo cons, far right wing, conservatives don't riot or attack police but the libs call them extreme?",en,[],[],[],0,0,1,[],[],https://twitter.com/wallwriting/status/833021228764057600,False,,0,,philadelphia,,,,,,"[{'screen_name': 'FoxNews', 'name': 'Fox News', 'id': '1367531'}, {'screen_name': 'SheriffClarke', 'name': 'David A. Clarke, Jr.', 'id': '118845216'}]",,,,
833019543547158529,832967993214775296,2017-02-18 12:25:10 CST,2017-02-18,12:25:10,-0500,2262997551,kopest1,Kevin Bernard,,@TNestel3 @eiserman27 we can't call this America if we can't protest! Assaulting police no violating others rights no protest yes!,en,[],[],[],0,0,0,[],[],https://twitter.com/kopest1/status/833019543547158529,False,,0,,philadelphia,,,,,,"[{'screen_name': 'TNestel3', 'name': 'Thomas J. Nestel III', 'id': '630402530'}]",,,,
833013422166048768,833013422166048768,2017-02-18 12:00:51 CST,2017-02-18,12:00:51,-0500,32768160,215gtownkid,Rémy Martin,,This is how you creat domestic terrorist.  https://t.co/lXhbWjgPjC,en,[],['https://twitter.com/sstroyed/status/832810703228645377'],[],0,0,0,[],[],https://twitter.com/215GtownKid/status/833013422166048768,False,0,0,,philadelphia,,,,,,[],,,,
833012618931609601,833012618931609601,2017-02-18 11:57:39 CST,2017-02-18,11:57:39,-0500,55019404,basslabbers,Bastiaan Slabbers,,mardigrass mummersparade counters protest with horns  https://t.co/V6FE9AxqA4,en,[],['https://www.pscp.tv/w/a3cw-DgxNzgxM3wxUkR4bFJEZ3puTUdMnToPAbuIYghdpvAgZzUSYsrrr8K7ff4_CgX2FObQ6RA='],[],0,0,0,[],[],https://twitter.com/BasSlabbers/status/833012618931609601,False,,0,,philadelphia,,,,,,[],,,,
833009944135876610,833009944135876610,2017-02-18 11:47:01 CST,2017-02-18,11:47:01,-0500,353869240,phillynewsguy,Joshua Crompton (The National Desk),,"#BREAKING ""The Blind Sheik"" Omar Abdel-Rahman responsible for planning and executing the 1993 World Trade Center attack has died at age 78  https://t.co/bvP3ErhpU5",en,[],[],['https://pbs.twimg.com/media/C49yHe-WQAAAF5l.jpg'],0,0,0,['breaking'],[],https://twitter.com/PhillyNewsGuy/status/833009944135876610,False,,1,https://pbs.twimg.com/media/C49yHe-WQAAAF5l.jpg,philadelphia,,,,,,[],,,,
833008571394772992,833008571394772992,2017-02-18 11:41:34 CST,2017-02-18,11:41:34,-0500,263887933,nydirah12,_Love,,"Sep24,12,July summer14,oct12,14,april,1,16, I've never been in so much BS.,Pain,Greef,Anger,ad Heartache in my life.😟😢😭😧😠😡😵😈. Never again!",en,[],[],[],0,0,0,[],[],https://twitter.com/Nydirah12/status/833008571394772992,False,,0,,philadelphia,,,,,,[],,,,
833007277699375104,833007277699375104,2017-02-18 11:36:26 CST,2017-02-18,11:36:26,-0500,31255935,thepplman,KENT L. MARSHALL,,50million USA Christian won't talk 2 their neighbors about Christ-forget Abortion.TRUMPUTIN being pro-life doesn't make u a Christian!Racist,en,[],[],[],0,0,0,[],[],https://twitter.com/THEPPLMAN/status/833007277699375104,False,,0,,philadelphia,,,,,,[],,,,
