id,conversation_id,created_at,date,time,timezone,user_id,username,name,place,tweet,language,mentions,urls,photos,replies_count,retweets_count,likes_count,hashtags,cashtags,link,retweet,quote_url,video,thumbnail,near,geo,source,user_rt_id,user_rt,retweet_id,reply_to,retweet_date,translate,trans_src,trans_dest
867892190642614272,867892190642614272,2017-05-25 18:56:37 CDT,2017-05-25,18:56:37,-0500,77122661,_sayyae,RestWellNIP,,Y'all Got The Wrong Type Of Friends😩 If I Get Jumped Best Believe We Coming Back Full Force‼️,en,[],[],[],1,0,0,[],[],https://twitter.com/_SayYae/status/867892190642614272,False,,0,,philadelphia,,,,,,[],,,,
867888180116295682,867888180116295682,2017-05-25 18:40:41 CDT,2017-05-25,18:40:41,-0500,478171118,kailcubbage,grogu’s mom,,"My tweets are never meant to hurt anyone's feelings, or lack there of. Just is what it is.",en,[],[],[],0,0,3,[],[],https://twitter.com/kailcubbage/status/867888180116295682,False,,0,,philadelphia,,,,,,[],,,,
867885627311894528,867885627311894528,2017-05-25 18:30:32 CDT,2017-05-25,18:30:32,-0500,18056407,dcamposfitness,Dan Campos,"{'type': 'Point', 'coordinates': [40.04883, -74.99242]}",Packed house for tonight's 6:30pm bootcamp 🔥🔥🔥  #teamcampos #dcf #dancamposfitness #gym #bullet…  https://t.co/VHbndcmzKr,en,[],['https://www.instagram.com/p/BUiKjHCFcRu/'],[],0,0,0,"['teamcampos', 'dcf', 'dancamposfitness', 'gym', 'bullet']",[],https://twitter.com/DCamposfitness/status/867885627311894528,False,,0,,philadelphia,,,,,,[],,,,
867885378891546629,867885378891546629,2017-05-25 18:29:33 CDT,2017-05-25,18:29:33,-0500,51919597,no__ugh,conduit 🧜🏽‍♂️🏔🧙🏽‍♀️,,It's funny when women of Philadelphia react to me in a hoody cause I'm dead ass a lightskin nigga humming Ariana grande,en,[],[],[],0,0,7,[],[],https://twitter.com/no__ugh/status/867885378891546629,False,,0,,philadelphia,,,,,,[],,,,
867882516732096512,867882516732096512,2017-05-25 18:18:11 CDT,2017-05-25,18:18:11,-0500,142680983,shizzydamanager,DA 〽️ANGER STUPID 🥶,"{'type': 'Point', 'coordinates': [40.0370271, -75.1753608]}",Tomorrow Kick Off Memorial Day Weekend Wit Us At mezzaninesuperclub…  https://t.co/sweFAxKwKq,en,[],['https://www.instagram.com/p/BUiJIrdjvbnycIUoTWWLg1CWSmixx-TawULFyo0/'],[],0,0,0,[],[],https://twitter.com/shizzydamanager/status/867882516732096512,False,,0,,philadelphia,,,,,,[],,,,
867880879632162816,867836680061038593,2017-05-25 18:11:40 CDT,2017-05-25,18:11:40,-0500,2567292679,fredwalton216,fred walton,,"@rcallimachi @YouTube and conduct of ISIS supporters regarding prior ""occurrences"" , didn't suicide bomber and his brother arrested In Tripoli belong to ISIS ? 2",en,[],[],[],0,1,0,[],[],https://twitter.com/fredwalton216/status/867880879632162816,False,,0,,philadelphia,,,,,,"[{'screen_name': 'rcallimachi', 'name': 'Rukmini Callimachi', 'id': '30699754'}, {'screen_name': 'YouTube', 'name': 'YouTube', 'id': '10228272'}]",,,,
867879590550790144,867878679157899265,2017-05-25 18:06:33 CDT,2017-05-25,18:06:33,-0500,16161610,kdallan1,kdallan1,,@KatTimpf So Sorry Constitution is not a suicide Pact.Suicide by Islam is EU Pact.,en,[],[],[],0,0,1,[],[],https://twitter.com/kdallan1/status/867879590550790144,False,,0,,philadelphia,,,,,,"[{'screen_name': 'KatTimpf', 'name': 'Kat Timpf', 'id': '170861207'}]",,,,
867872530148864000,867872530148864000,2017-05-25 17:38:30 CDT,2017-05-25,17:38:30,-0500,384215419,zenjekk,Ryan Weber,,@OriginalFunko are you guys still making the one punch man pops? Will the be up for reserve again at Gamestop? #askfunko,en,[],[],[],0,0,0,['askfunko'],[],https://twitter.com/Zenjekk/status/867872530148864000,False,,0,,philadelphia,,,,,,[],,,,
867871274755907584,867871274755907584,2017-05-25 17:33:30 CDT,2017-05-25,17:33:30,-0500,4921384505,bulldog2469,Bulldog John Thomas,,@sunny  Todays worlds changed dramatically in last year&amp;Lord Voldemorts Reason  Y people R LIKE THEY R-Saw Him Bully&amp;B an ASS&amp;They follow,en,[],[],[],0,0,0,[],[],https://twitter.com/Bulldog2469/status/867871274755907584,False,,0,,philadelphia,,,,,,[],,,,
867871263280246785,867871263280246785,2017-05-25 17:33:28 CDT,2017-05-25,17:33:28,-0500,411140020,s0ls,hypothetical hoe,,I think I deserve a guy who doesn't kick the coke bag in front of me the first time we hang out,en,[],[],[],2,0,7,[],[],https://twitter.com/s0ls/status/867871263280246785,False,,0,,philadelphia,,,,,,[],,,,
867870750954442752,867870750954442752,2017-05-25 17:31:25 CDT,2017-05-25,17:31:25,-0500,2826910270,townboul,ʕ•̫͡•ʕ•̫͡•ʔ•̫͡•ʔ•̫͡•ʕ•̫͡•ʔ•̫͡•ʕ•̫͡•ʕ•̫͡•ʔ•̫͡•ʔ,,"In philly with a dead battery, thanks Kerry",en,[],[],[],0,0,1,[],[],https://twitter.com/townboul/status/867870750954442752,False,,0,,philadelphia,,,,,,[],,,,
867869386748686338,867869386748686338,2017-05-25 17:26:00 CDT,2017-05-25,17:26:00,-0500,113559052,caseyyxsheridan,♡ cαseч ♡,,Wtf really wanna go to afrojack on Saturday too like @racheldiani come kidnap &amp; bring me home,en,"[{'screen_name': 'racheldiani', 'name': 'rachel 🥀', 'id': '595649848'}]",[],[],2,0,2,[],[],https://twitter.com/caseyyxsheridan/status/867869386748686338,False,,0,,philadelphia,,,,,,[],,,,
867868177383948288,867868177383948288,2017-05-25 17:21:12 CDT,2017-05-25,17:21:12,-0500,384215419,zenjekk,Ryan Weber,,@OriginalFunko Are you guys still making the one punch man pops? Will then be able to be reserved again at Gamestop?,en,[],[],[],0,0,0,[],[],https://twitter.com/Zenjekk/status/867868177383948288,False,,0,,philadelphia,,,,,,[],,,,
867868135235440641,867850331954094081,2017-05-25 17:21:02 CDT,2017-05-25,17:21:02,-0500,276643262,khaisview,Khai 🎧🎶,,@DaihuuPA Don't know if it's my lane lol but I guess it can't hurt to try,en,[],[],[],0,0,0,[],[],https://twitter.com/khaisview/status/867868135235440641,False,,0,,philadelphia,,,,,,"[{'screen_name': 'DaihuuPA', 'name': 'Long Huu', 'id': '516145716'}]",,,,
867865709875011584,867865709875011584,2017-05-25 17:11:24 CDT,2017-05-25,17:11:24,-0500,349142995,alantaedeior,❄️,,They gone be hurt when they find out about this one 😩❤,en,[],[],[],1,3,0,[],[],https://twitter.com/AlantaeDeior/status/867865709875011584,False,,0,,philadelphia,,,,,,[],,,,
867864166484369408,867864166484369408,2017-05-25 17:05:16 CDT,2017-05-25,17:05:16,-0500,366211003,mgrundel,Mark Grundel,,"Reading #Armada by @ErnestCline, too close.  U.S. Military Has ""Space Aggressor Squadron"" Trained  https://t.co/Fjqc9N9CMl via @Futurism",en,"[{'screen_name': 'ernestcline', 'name': 'ernest cline stuff', 'id': '455247714'}, {'screen_name': 'futurism', 'name': 'futurism', 'id': '2557446343'}]",['https://futurism.com/the-u-s-military-has-a-space-aggressor-squadron-trained-for-off-world-warfare/'],[],0,1,2,['armada'],[],https://twitter.com/MGrundel/status/867864166484369408,False,,0,,philadelphia,,,,,,[],,,,
867861689286270976,867861689286270976,2017-05-25 16:55:25 CDT,2017-05-25,16:55:25,-0500,41595905,dylanushler,Dylan Ushler,"{'type': 'Point', 'coordinates': [40.04883, -74.99242]}",Dead bruh. Two gym sessions in one day.  #gym #fitness #workout #lifting #dancamposfitness @ Dan…  https://t.co/8K8x04oQPs,en,[],['https://www.instagram.com/p/BUh_qjfBUj_/'],[],0,0,1,"['gym', 'fitness', 'workout', 'lifting', 'dancamposfitness']",[],https://twitter.com/DylanUshler/status/867861689286270976,False,,0,,philadelphia,,,,,,[],,,,
867860479280115713,867859676356112384,2017-05-25 16:50:36 CDT,2017-05-25,16:50:36,-0500,1519480027,mattymike0718,Matt Michaels,,@Dave_White Definitely packs a punch. @foundersbrewing Doom I'm planning on getting as well. It's their Double Trouble Aged in Bourbon Barrels.,en,"[{'screen_name': 'foundersbrewing', 'name': 'founders brewing co.', 'id': '30950136'}]",[],[],1,0,0,[],[],https://twitter.com/MattyMike0718/status/867860479280115713,False,,0,,philadelphia,,,,,,"[{'screen_name': 'Dave_White', 'name': 'Dave White', 'id': '14706648'}]",,,,
867857140190457856,867857140190457856,2017-05-25 16:37:20 CDT,2017-05-25,16:37:20,-0500,101179047,rejectreef,Pashmina Papi 🦦,,THIS SUNDAY FREE PARTY. We're kicking it off right with a HH🍺🥃 from 7-9 pm before we kick off the party from 9-2 am. #MemorialDayWeekend  https://t.co/CGlMg9xfO9,en,[],[],['https://pbs.twimg.com/media/DAs_drlXgAI2lno.jpg'],0,2,0,['memorialdayweekend'],[],https://twitter.com/ReJecTReef/status/867857140190457856,False,,1,https://pbs.twimg.com/media/DAs_drlXgAI2lno.jpg,philadelphia,,,,,,[],,,,
867856667198750721,867856667198750721,2017-05-25 16:35:28 CDT,2017-05-25,16:35:28,-0500,2324861572,kurrahh_,K Doll 🖤,,My head starting to hurt 😩,en,[],[],[],0,0,0,[],[],https://twitter.com/Kurrahh_/status/867856667198750721,False,,0,,philadelphia,,,,,,[],,,,
867854747767906304,867854747767906304,2017-05-25 16:27:50 CDT,2017-05-25,16:27:50,-0500,220541704,xkraynec,Hot Koko 🍫,,I see why people been mad at KD for leaving the Thunder.... but that's some more hurt y'all gotta let go lol,en,[],[],[],1,0,1,[],[],https://twitter.com/xKRAYneC/status/867854747767906304,False,,0,,philadelphia,,,,,,[],,,,
867852040164319233,867852040164319233,2017-05-25 16:17:04 CDT,2017-05-25,16:17:04,-0500,2447874323,quantum_mystic,Drew Kaiser 🏳️‍⚧️ 🏳️‍🌈,,@GregForMontana it's unfortunate that this aggressive behavior from a conservative politician created this scene at your campaign BBQ,en,[],[],[],0,0,0,[],[],https://twitter.com/quantum_mystic/status/867852040164319233,False,,0,,philadelphia,,,,,,[],,,,
867851924032413698,867851924032413698,2017-05-25 16:16:37 CDT,2017-05-25,16:16:37,-0500,2376464292,michellecron,♥️ ⍣,,Joy can not may not defeated for no weapon formed against it shall prosper. #nogreaterjoy it is STRENGTH.,en,[],[],[],0,0,0,['nogreaterjoy'],[],https://twitter.com/michellecron/status/867851924032413698,False,,0,,philadelphia,,,,,,[],,,,
867850028546629633,867850028546629633,2017-05-25 16:09:05 CDT,2017-05-25,16:09:05,-0500,69691452,colettesage,Colette's Sage,,Watching Trump doing the Saudi sword dance was like watching a horrible event happen on your nanny cam. Take the weapon away from the child.,en,[],[],[],0,0,0,[],[],https://twitter.com/ColetteSage/status/867850028546629633,False,,0,,philadelphia,,,,,,[],,,,
867850012713156609,867850012713156609,2017-05-25 16:09:01 CDT,2017-05-25,16:09:01,-0500,271781285,westside__kb,Kev,,Women change so much after being hurt..,en,[],[],[],0,23,19,[],[],https://twitter.com/westside__kb/status/867850012713156609,False,,0,,philadelphia,,,,,,[],,,,
867849541948723201,867849541948723201,2017-05-25 16:07:09 CDT,2017-05-25,16:07:09,-0500,107437673,sandy_cheeksxo,Princess Zelda ✨,,I picked Death Note lol  https://t.co/mXwrwScMeT,en,[],['https://twitter.com/I_DontKer/status/867845012867960832'],[],0,0,0,[],[],https://twitter.com/Sandy_CheeksxO/status/867849541948723201,False,https://twitter.com/I_DontKer/status/867845012867960832,0,,philadelphia,,,,,,[],,,,
867849019728461824,867848654064955392,2017-05-25 16:05:04 CDT,2017-05-25,16:05:04,-0500,544172532,demo_bounce,DeMo B,,@Red_Icy I like that concept especially for a relationship with a women wouldn't hurt yo always try and be the better partner,en,[],[],[],0,0,1,[],[],https://twitter.com/DeMo_Bounce/status/867849019728461824,False,,0,,philadelphia,,,,,,"[{'screen_name': 'Red_Icy', 'name': 'Nick', 'id': '924143762145710080'}]",,,,
867843368189124608,867843368189124608,2017-05-25 15:42:37 CDT,2017-05-25,15:42:37,-0500,60071895,mawehai,Della Mann,,Well we have seen the abuse of the 1st amendment. The republicans are now abusing reporters and continuing to call all media lyers. Djthitle,en,[],[],[],0,0,0,[],[],https://twitter.com/mawehai/status/867843368189124608,False,,0,,philadelphia,,,,,,[],,,,
867838008782970881,867838008782970881,2017-05-25 15:21:19 CDT,2017-05-25,15:21:19,-0500,55025223,djspontane,DJSpontane,"{'type': 'Point', 'coordinates': [39.9512, -75.1707]}",#MemorialDayWeekend kick off @dpjeter tomorrow night!!! FRIDAY NIGHTS!!!! 🔥🔥🔥 #VangoPhilly…  https://t.co/IN27iX8QjG,en,"[{'screen_name': 'dpjeter', 'name': '👑 queen danielle paige jeter', 'id': '53098537'}]",['https://www.instagram.com/p/BUh05d_A8nJ/'],[],0,0,0,"['memorialdayweekend', 'vangophilly']",[],https://twitter.com/djspontane/status/867838008782970881,False,,0,,philadelphia,,,,,,[],,,,
867835844614336512,867835844614336512,2017-05-25 15:12:43 CDT,2017-05-25,15:12:43,-0500,392075935,skiporourke1,SKIP O'ROURKE,,Trump hires crises team to fight all aspects of any &amp; all issues that may arise during this investigation. He wants to be the aggressor!,en,[],[],[],0,0,2,[],[],https://twitter.com/SkipORourke1/status/867835844614336512,False,,0,,philadelphia,,,,,,[],,,,
867833694152785920,867721881914400769,2017-05-25 15:04:10 CDT,2017-05-25,15:04:10,-0500,309772940,wallwriting,Mike Wall,,"@YoMellyMel @YouTube I first was made aware a few years ago. Our military hates this goes on, one soldiers death is directly attributable.",en,[],[],[],0,0,1,[],[],https://twitter.com/wallwriting/status/867833694152785920,False,,0,,philadelphia,,,,,,"[{'screen_name': 'YoMellyMel', 'name': 'ALilBitofJersey', 'id': '247543015'}, {'screen_name': 'YouTube', 'name': 'YouTube', 'id': '10228272'}]",,,,
867829546875326464,867829546875326464,2017-05-25 14:47:42 CDT,2017-05-25,14:47:42,-0500,2376464292,michellecron,♥️ ⍣,,They don't know how to ACT. It's trickery mockery rape incest and discust. #ihavethisthingwithfloors,en,[],[],[],0,0,0,['ihavethisthingwithfloors'],[],https://twitter.com/michellecron/status/867829546875326464,False,,0,,philadelphia,,,,,,[],,,,
867821099832274944,867821099832274944,2017-05-25 14:14:08 CDT,2017-05-25,14:14:08,-0500,29464537,tsellington,"Terrance S Ellington,LMT",,The Thing Injustice 2 Gets Right About Harley Quinn That Suicide Squad Got Wrong  https://t.co/sAiXyfoAN7 via @io9,en,"[{'screen_name': 'io9', 'name': 'io9', 'id': '13215132'}]",['http://io9.gizmodo.com/the-thing-injustice-2-gets-right-about-harley-quinn-tha-1795277813?utm_medium=sharefromsite&utm_source=io9_twitter'],[],1,0,0,[],[],https://twitter.com/tsellington/status/867821099832274944,False,,0,,philadelphia,,,,,,[],,,,
867818988415406081,867813825109647360,2017-05-25 14:05:44 CDT,2017-05-25,14:05:44,-0500,826574441706553344,brixbella,B🇺🇸,,@nia4_trump Its so disgusting that ppl are using his death to spread lies smh. This mans poor family😔,en,[],[],[],2,1,3,[],[],https://twitter.com/BrixBella/status/867818988415406081,False,,0,,philadelphia,,,,,,"[{'screen_name': 'nia4_trump', 'name': 'Nια', 'id': '704041886089084928'}]",,,,
867815926376353793,867815926376353793,2017-05-25 13:53:34 CDT,2017-05-25,13:53:34,-0500,249887319,rojahnaxrose,narcissistic_lover,,I'm with all the aggressive shit😊😌😁,en,[],[],[],0,2,1,[],[],https://twitter.com/rojahnaxrose/status/867815926376353793,False,,0,,philadelphia,,,,,,[],,,,
867814728726450176,867808899713437696,2017-05-25 13:48:49 CDT,2017-05-25,13:48:49,-0500,363319651,laurziezz,laurziez,,@mariadezz OMFGGG IM DEAD!!! LOL,en,[],[],[],0,0,1,[],[],https://twitter.com/laurziezz/status/867814728726450176,False,,0,,philadelphia,,,,,,"[{'screen_name': 'mariadezz', 'name': '♡ maria ♡', 'id': '364421238'}]",,,,
867810865470484481,867810865470484481,2017-05-25 13:33:28 CDT,2017-05-25,13:33:28,-0500,758348490795786240,jeremywade_cb,THERIVERPIMP 🎣,,If I punch em they gone sue me they ain't even worth the threat,en,[],[],[],0,0,2,[],[],https://twitter.com/jeremywade_cb/status/867810865470484481,False,,0,,philadelphia,,,,,,[],,,,
867805234453561345,867057042917171200,2017-05-25 13:11:05 CDT,2017-05-25,13:11:05,-0500,112055083,yaheart,YA Heart,,@GregForMontana How dare you assault a Jewish reporter and go on as if this is business as usual!,en,[],[],[],0,0,0,[],[],https://twitter.com/YAHeart/status/867805234453561345,False,,0,,philadelphia,,,,,,"[{'screen_name': 'GregForMontana', 'name': 'Greg Gianforte', 'id': '3420965229'}]",,,,
867801445575385090,867801445575385090,2017-05-25 12:56:02 CDT,2017-05-25,12:56:02,-0500,323648894,crendan_barbutt,BC,,"I can't even come on twitter anymore without every other post being about politics, racism, sexism and ppl getting their feelings hurt smh",en,[],[],[],0,0,4,[],[],https://twitter.com/Crendan_Barbutt/status/867801445575385090,False,,0,,philadelphia,,,,,,[],,,,
867797583405744128,867797583405744128,2017-05-25 12:40:41 CDT,2017-05-25,12:40:41,-0500,4471387526,distortionover,kevin armada,,"I want to make Chester Bennington an admin for Distortion Overload. And if you don't like it, he will ""stab you in the fucking face""",en,[],[],[],0,0,0,[],[],https://twitter.com/distortionover/status/867797583405744128,False,,0,,philadelphia,,,,,,[],,,,
