id,conversation_id,created_at,date,time,timezone,user_id,username,name,place,tweet,language,mentions,urls,photos,replies_count,retweets_count,likes_count,hashtags,cashtags,link,retweet,quote_url,video,thumbnail,near,geo,source,user_rt_id,user_rt,retweet_id,reply_to,retweet_date,translate,trans_src,trans_dest
891072950962601984,891072950962601984,2017-07-28 18:08:41 CDT,2017-07-28,18:08:41,-0500,2788298225,trazel_mccoy,Took,,Wwe promoting domestic violence lol 😂  https://t.co/c7lms3exCD,en,[],['https://twitter.com/wshhfans/status/891019091871490050'],[],0,0,0,[],[],https://twitter.com/trazel_mccoy/status/891072950962601984,False,0,0,,phoenix,,,,,,[],,,,
891072439152779265,890378656094105600,2017-07-28 18:06:39 CDT,2017-07-28,18:06:39,-0500,28476383,desertpundit,Desert Pundit,,"@thefreerifleman @Zero_Gov @incoherent_rage @0pfour @redhead57 @lojikil @Sharqtek @ClarkHat Don't worry, Bob will peacefully get on the train when told. He may not like it but it's the law. And Bob believes law is to be obeyed.",en,[],[],[],0,2,3,[],[],https://twitter.com/desertpundit/status/891072439152779265,False,,0,,phoenix,,,,,,"[{'screen_name': 'thefreerifleman', 'name': 'CollapsitARian-15', 'id': '2457553466'}, {'screen_name': 'incoherent_rage', 'name': 'Mister Savage', 'id': '2790560502'}, {'screen_name': '0pfour', 'name': 'Non State Actor', 'id': '2683317589'}, {'screen_name': 'redhead57', 'name': 'B  ن  ΜΟΛΩΝ ΛΑΒΕ', 'id': '700178942'}, {'screen_name': 'lojikil', 'name': 'Loji en la tempo de neĝoj', 'id': '369714291'}, {'screen_name': 'ClarkHat', 'name': ""Lucifer's Handplane"", 'id': '381017134'}]",,,,
891030479826300930,891030479826300930,2017-07-28 15:19:55 CDT,2017-07-28,15:19:55,-0500,229649884,nottylermccoy,Tyler McCoy,,"Playing COD for the first time in about a year, and the first game I join has a 12 year old kid being racist. Some things never change.",en,[],[],[],1,0,15,[],[],https://twitter.com/NotTylerMcCoy/status/891030479826300930,False,,0,,phoenix,,,,,,[],,,,
891023128414920705,890994861037559810,2017-07-28 14:50:42 CDT,2017-07-28,14:50:42,-0500,338420273,samhammer1,Sam Hammer,,"@SenJohnMcCain Oct. 26,1966  The USS Oriskany caught fire in Tonkin Gulf (VN) 44 died and over 150 injured. I pray for those and may both ships men r i p!!",en,[],[],[],0,0,0,[],[],https://twitter.com/SamHammer1/status/891023128414920705,False,,0,,phoenix,,,,,,"[{'screen_name': 'SenJohnMcCain', 'name': 'John McCain', 'id': '19394188'}]",,,,
891021204647063552,891021204647063552,2017-07-28 14:43:04 CDT,2017-07-28,14:43:04,-0500,2349385788,tristensgrillo,𝒯𝓇𝒾𝓈𝓉𝑒𝓃🍀,,My dad bought a 1200 dollar rifle yesterday and he just came home with another gun 🤦🏼‍♂️ this man is wild,en,[],[],[],0,0,4,[],[],https://twitter.com/tristensgrillo/status/891021204647063552,False,,0,,phoenix,,,,,,[],,,,
891015785820307456,891015785820307456,2017-07-28 14:21:32 CDT,2017-07-28,14:21:32,-0500,239294549,kirstyn_k,kirstyn,,I'm a danger noodle and there's just no getting around it.,en,[],[],[],1,0,3,[],[],https://twitter.com/kirstyn_k/status/891015785820307456,False,,0,,phoenix,,,,,,[],,,,
891012586442956800,890735104758296576,2017-07-28 14:08:49 CDT,2017-07-28,14:08:49,-0500,752997815295447040,eliasmrodrigue1,Elias m Rodriguez,,@McJesse Wow a human person makes a mistake and you attack her,en,[],[],[],0,0,0,[],[],https://twitter.com/EliasmRodrigue1/status/891012586442956800,False,,0,,phoenix,,,,,,"[{'screen_name': 'McJesse', 'name': 'Jesse McLaren', 'id': '27782837'}]",,,,
891004286729043968,891004286729043968,2017-07-28 13:35:50 CDT,2017-07-28,13:35:50,-0500,42739863,punkee_munky,Corina Perkins,,In regards to last wks eppy my ❤️ hopes drunk Nicole after shooting the electrical box grabbed the shot glass b4 they ran out! @WynonnaEarp,en,"[{'screen_name': 'wynonnaearp', 'name': 'wynonna earp', 'id': '4709232802'}]",[],[],1,0,0,[],[],https://twitter.com/punkee_munky/status/891004286729043968,False,,0,,phoenix,,,,,,[],,,,
891002201065177088,891002201065177088,2017-07-28 13:27:33 CDT,2017-07-28,13:27:33,-0500,1380830929,hutchb22,Brandi Hutch,,Ever have that brief panic attack thinking you forgot your earbuds and might have to socialize on a flight? #phew #thankGod,en,[],[],[],0,1,1,"['phew', 'thankgod']",[],https://twitter.com/HutchB22/status/891002201065177088,False,,0,,phoenix,,,,,,[],,,,
891001042707468289,891001042707468289,2017-07-28 13:22:57 CDT,2017-07-28,13:22:57,-0500,49258977,ub3rg00b3r,übergoober,,@PUBATTLEGROUNDS  when is the 5.56 caliber going to get graced with a new gun *cough* G36 *cough*,en,[],[],[],0,0,0,[],[],https://twitter.com/ub3rg00b3r/status/891001042707468289,False,,0,,phoenix,,,,,,[],,,,
890997433475383297,890601131520479232,2017-07-28 13:08:36 CDT,2017-07-28,13:08:36,-0500,512551046,emilyboxing,Emily 🌵🔆,,@PinchePippins @publicola05 @HotlineJosh Himself. It wasn't until probably 2 weeks ago that I saw an article about whether his protest is responsible for him not finding a team,en,[],[],[],1,0,0,[],[],https://twitter.com/emilyboxing/status/890997433475383297,False,,0,,phoenix,,,,,,"[{'screen_name': 'PinchePippins', 'name': 'Dick Buckles', 'id': '4258621158'}, {'screen_name': 'publicola05', 'name': 'Publicus', 'id': '60773564'}, {'screen_name': 'HotlineJosh', 'name': 'Josh Kraushaar', 'id': '21612122'}]",,,,
890993680781266944,890993680781266944,2017-07-28 12:53:42 CDT,2017-07-28,12:53:42,-0500,22506613,maryfbrooks,Mary Brooks,,.@RepAndyBiggsAZ Do you have any public comment on the remarks by Racist Congressman @SteveKingIA about the Senior Senator from AZ?  https://t.co/eegzO58SiK,en,"[{'screen_name': 'repandybiggsaz', 'name': 'rep andy biggs', 'id': '816652616625168388'}, {'screen_name': 'stevekingia', 'name': 'steve king', 'id': '48117116'}]",[],['https://pbs.twimg.com/media/DF1yBnpUwAE94aN.jpg'],0,0,0,[],[],https://twitter.com/MaryFBrooks/status/890993680781266944,False,,1,https://pbs.twimg.com/media/DF1yBnpUwAE94aN.jpg,phoenix,,,,,,[],,,,
890988747143077888,890601131520479232,2017-07-28 12:34:05 CDT,2017-07-28,12:34:05,-0500,512551046,emilyboxing,Emily 🌵🔆,,"@PinchePippins @publicola05 @HotlineJosh I actually learned more about police brutality doing reading inspired by him and his protest. Maybe you were too mad to see, but I was not.",en,[],[],[],2,0,1,[],[],https://twitter.com/emilyboxing/status/890988747143077888,False,,0,,phoenix,,,,,,"[{'screen_name': 'PinchePippins', 'name': 'Dick Buckles', 'id': '4258621158'}, {'screen_name': 'publicola05', 'name': 'Publicus', 'id': '60773564'}, {'screen_name': 'HotlineJosh', 'name': 'Josh Kraushaar', 'id': '21612122'}]",,,,
890986918317400064,890601131520479232,2017-07-28 12:26:49 CDT,2017-07-28,12:26:49,-0500,512551046,emilyboxing,Emily 🌵🔆,,"@PinchePippins @publicola05 @HotlineJosh Well it's your right to be bothered by it, just as it's his to protest. Cheers 🍻",en,[],[],[],1,0,1,[],[],https://twitter.com/emilyboxing/status/890986918317400064,False,,0,,phoenix,,,,,,"[{'screen_name': 'PinchePippins', 'name': 'Dick Buckles', 'id': '4258621158'}, {'screen_name': 'publicola05', 'name': 'Publicus', 'id': '60773564'}, {'screen_name': 'HotlineJosh', 'name': 'Josh Kraushaar', 'id': '21612122'}]",,,,
890983683787640832,890983683787640832,2017-07-28 12:13:58 CDT,2017-07-28,12:13:58,-0500,16480396,mackduncan,Mack Duncan,,.@SenJohnMcCain - the real life sequel to TOP GUN. I neither endorse nor denounce either of these things. #grainofsalt,en,"[{'screen_name': 'senjohnmccain', 'name': 'john mccain', 'id': '19394188'}]",[],[],0,1,0,['grainofsalt'],[],https://twitter.com/MackDuncan/status/890983683787640832,False,,0,,phoenix,,,,,,[],,,,
890979438086594561,890979438086594561,2017-07-28 11:57:06 CDT,2017-07-28,11:57:06,-0500,259133274,olivia_ricks,Olivia Ricks,,Definitely almost just committed a crime because @Apple DOESNT SELL THE PRODUCTS I NEED IN NORMAL STORES But @heathermsanchez calmed me down,en,"[{'screen_name': 'apple', 'name': 'apple', 'id': '380749300'}]",[],[],1,0,2,[],[],https://twitter.com/olivia_ricks/status/890979438086594561,False,,0,,phoenix,,,,,,[],,,,
890964556570214400,890964556570214400,2017-07-28 10:57:58 CDT,2017-07-28,10:57:58,-0500,1865661,timagne,Tim Agne,,Taco Bell DOESN’T EVEN HAVE CHIMICHANGAS. Clearly this robber isn’t an @unfunnyntangent listener.  https://t.co/e98T3XWfWR,en,"[{'screen_name': 'unfunnyntangent', 'name': 'unfunny nerd tangent', 'id': '823006915466625024'}]",['https://twitter.com/comicbook/status/890951911255494656'],[],0,0,0,[],[],https://twitter.com/timagne/status/890964556570214400,False,https://twitter.com/comicbook/status/890951911255494656,0,,phoenix,,,,,,[],,,,
890958071442395138,890923549740892161,2017-07-28 10:32:12 CDT,2017-07-28,10:32:12,-0500,28476383,desertpundit,Desert Pundit,,"@TSA You seem proud of disarming forgetful Americans. You've NEVER caught a terrorist. $3 Billion budget for @TSA ""officers"" that grope us.",en,"[{'screen_name': 'tsa', 'name': 'tsa', 'id': '414331122'}]",[],[],0,0,1,[],[],https://twitter.com/desertpundit/status/890958071442395138,False,,0,,phoenix,,,,,,"[{'screen_name': 'TSA', 'name': 'TSA', 'id': '414331122'}]",,,,
