id,conversation_id,created_at,date,time,timezone,user_id,username,name,place,tweet,language,mentions,urls,photos,replies_count,retweets_count,likes_count,hashtags,cashtags,link,retweet,quote_url,video,thumbnail,near,geo,source,user_rt_id,user_rt,retweet_id,reply_to,retweet_date,translate,trans_src,trans_dest
976609004041404417,910148521369665536,2018-03-21 18:58:25 CDT,2018-03-21,18:58:25,-0500,26596853,siciliantaurus,Victor Giardina,,"@MuslimIQ @teka21bat Stop being a racist it just makes you a hypocrite. Money, jealousy, lust, and greed is the root of all evil.",en,[],[],[],0,0,0,[],[],https://twitter.com/siciliantaurus/status/976609004041404417,False,,0,,new york city,,,,,,"[{'screen_name': 'MuslimIQ', 'name': 'Qasim Rashid', 'id': '1099817633497649154'}, {'screen_name': 'teka21bat', 'name': 'Terry Kalb 🔥', 'id': '2179089168'}]",,,,
976608426729050112,976510915544629248,2018-03-21 18:56:08 CDT,2018-03-21,18:56:08,-0500,4109576663,queueell,Ellie Queue,,@jade3457 The useful idiot of the nefarious and the international+wealthy crime lords is sitting POTUS.  https://t.co/AceVubx8Rm,en,[],[],['https://pbs.twimg.com/tweet_video_thumb/DY2cLvhW0AE02FH.jpg'],1,0,1,[],[],https://twitter.com/QueueEll/status/976608426729050112,False,,1,https://pbs.twimg.com/tweet_video_thumb/DY2cLvhW0AE02FH.jpg,new york city,,,,,,"[{'screen_name': 'jade3457', 'name': 'jade345', 'id': '1355202163677528070'}]",,,,
976607737902780416,976246282791596038,2018-03-21 18:53:23 CDT,2018-03-21,18:53:23,-0500,21120694,jonahgeffen,Rabbi Jonah Geffen,,"@JuniorCelente I don’t are if every single other Rabbi in the world thinks it’s “ok” to be a racist, I’m going to call them out for it. His words and attitude have no grounding in Torah, And his political position should give him no cover. As a Jew in this world, I have every right to comment.",en,[],[],[],1,0,1,[],[],https://twitter.com/JonahGeffen/status/976607737902780416,False,,0,,new york city,,,,,,"[{'screen_name': 'JuniorCelente', 'name': 'Junior Celente', 'id': '522643858'}]",,,,
976607469572100097,976607469572100097,2018-03-21 18:52:19 CDT,2018-03-21,18:52:19,-0500,28855190,huntersarchive,Hunter Salvatore,"{'type': 'Point', 'coordinates': [40.85, -73.8667]}",HUNTER SALVATORE PRESENTS “RAGE” Jaden Smith | U (Pt. 1)  “I was tryin' to love you but…  https://t.co/ImAjQ6t8gd,en,[],['https://www.instagram.com/p/BgmqKsKBG_5/'],[],0,0,0,[],[],https://twitter.com/HuntersArchive/status/976607469572100097,False,,0,,new york city,,,,,,[],,,,
976607150641434625,976607150641434625,2018-03-21 18:51:03 CDT,2018-03-21,18:51:03,-0500,485176495,nakedblunch,NakedBrunch,,"“Tight-knit, godly family”? He was a TERRORIST. A MURDERER who cut down 2 innocent lives and traumatized an entire city. Fuck you for trying to cast this monster as some sort of lost, solitary soul that lost his way. FUCK. YOU.  https://t.co/WBaEaxwHD1",en,[],['https://twitter.com/nytimes/status/976532172344561665'],[],0,0,1,[],[],https://twitter.com/NakedBlunch/status/976607150641434625,False,https://twitter.com/nytimes/status/976532172344561665,0,,new york city,,,,,,[],,,,
976606574025297920,976606574025297920,2018-03-21 18:48:46 CDT,2018-03-21,18:48:46,-0500,188470827,jberman92,JA,,@shermanatorrr maybe that’s why he isn’t being called a terrorist.  https://t.co/a5dLAs49u3,en,[],['https://twitter.com/officeofmike/status/976600188520411136'],[],1,0,0,[],[],https://twitter.com/Jberman92/status/976606574025297920,False,0,0,,new york city,,,,,,[],,,,
976606031659917313,976606031659917313,2018-03-21 18:46:37 CDT,2018-03-21,18:46:37,-0500,888748603921051648,artistrybyariel,Ariel Alexandra,,My mom thinks I’m crazy for going to the gym this morning and now she thinks I’m crazy for going out to drink. What I find crazy is that I didn’t murder her being home with her all day. #SnowDay,en,[],[],[],0,0,0,['snowday'],[],https://twitter.com/artistrybyariel/status/976606031659917313,False,,0,,new york city,,,,,,[],,,,
976605659570626560,976466040203939840,2018-03-21 18:45:08 CDT,2018-03-21,18:45:08,-0500,19948022,johntandlich,John Tandlich,,@politeracy Heart attack snow starting to accumulate.,en,[],[],[],1,0,0,[],[],https://twitter.com/johntandlich/status/976605659570626560,False,,0,,new york city,,,,,,"[{'screen_name': 'politeracy', 'name': 'Lisa', 'id': '23446740'}]",,,,
976604708185018368,976604117463371776,2018-03-21 18:41:21 CDT,2018-03-21,18:41:21,-0500,64596229,courtneycogburn,Dr. Courtney D. Cogburn,,@jbritt06 So he didn’t call himself a terrorist? Got it.,en,[],[],[],1,0,0,[],[],https://twitter.com/CourtneyCogburn/status/976604708185018368,False,,0,,new york city,,,,,,"[{'screen_name': 'jbritt06', 'name': 'James A. Britton, Esq. 🦍', 'id': '293115485'}]",,,,
976604341325922304,976604341325922304,2018-03-21 18:39:54 CDT,2018-03-21,18:39:54,-0500,115670062,nycimmigrants,NYC Immigrant Affairs,,"Armed with some of the strongest human rights laws nationally, New Yorkers have a right to live free of discrimination &amp; sexual harassment, regardless of immigration or docummentation status. #MeToo #BHeard  https://t.co/1spj7TvkgX",en,[],['https://twitter.com/nycchr/status/976602725860433920'],[],0,5,13,"['metoo', 'bheard']",[],https://twitter.com/NYCImmigrants/status/976604341325922304,False,https://twitter.com/nycchr/status/976602725860433920,0,,new york city,,,,,,[],,,,
976604310124531718,976604310124531718,2018-03-21 18:39:46 CDT,2018-03-21,18:39:46,-0500,225970038,iamgmjohnson,George M Johnson,,I can see why Morehouse needs a new President every other year.   Y’all love supporting anti-blackness. And misogyny. And homophobia. And...  Do better.  https://t.co/Vs5tObENvM,en,[],['https://twitter.com/morehouse/status/976457541323456513'],[],0,3,15,[],[],https://twitter.com/IamGMJohnson/status/976604310124531718,False,https://twitter.com/morehouse/status/976457541323456513,0,,new york city,,,,,,[],,,,
976603599177437184,976603599177437184,2018-03-21 18:36:57 CDT,2018-03-21,18:36:57,-0500,39648841,peoplerstupid13,L BOOGIE,,They just said Gun gun gun so they could justify shooting the kid because they know the body cam is on.  😢  https://t.co/R0Xez8ZpQZ,en,[],['https://twitter.com/i/moments/976590677906677761'],[],0,0,1,[],[],https://twitter.com/PeopleRStupid13/status/976603599177437184,False,,0,,new york city,,,,,,[],,,,
976602928189444096,976602928189444096,2018-03-21 18:34:17 CDT,2018-03-21,18:34:17,-0500,6837342,olisnoddy,Oliver Snoddy,,"Serious confessions from the social team tonight. @brownday hasn’t seen Terminator, Jurassic Park, Home Alone, Top Gun or any Bond movies. And that’s just for starters. Shocked.",en,"[{'screen_name': 'brownday', 'name': 'ryan brown', 'id': '20270911'}]",[],[],7,0,11,[],[],https://twitter.com/olisnoddy/status/976602928189444096,False,,0,,new york city,,,,,,[],,,,
976602869616037888,976602869616037888,2018-03-21 18:34:03 CDT,2018-03-21,18:34:03,-0500,3319196948,unhireableshow,UNHIREABLE,,"MISS US??? We took last week off to fight ea other bc we're the cunts u want to see in the world. This wk we're fighting the real enemy: straight white men who play football and rape!! Our guest is Eli Sairs (not Jewish, not not racist), who calls BEN RAPELISBERGER #thegreatone.  https://t.co/8idZX2eu8J",en,[],[],['https://pbs.twimg.com/media/DY2XIBKU0AArS7D.jpg'],1,0,4,['thegreatone'],[],https://twitter.com/UNHIREABLEshow/status/976602869616037888,False,,1,https://pbs.twimg.com/media/DY2XIBKU0AArS7D.jpg,new york city,,,,,,[],,,,
976602801915793409,976462400839929856,2018-03-21 18:33:47 CDT,2018-03-21,18:33:47,-0500,26596853,siciliantaurus,Victor Giardina,,@domenicaxx66xx @MissJules5x @BarbaraLNewsome Sick individuals do horrible things. He was a home grown terrorist. Terror is just a word. Does anybody know his motive yet?,en,[],[],[],0,0,1,[],[],https://twitter.com/siciliantaurus/status/976602801915793409,False,,0,,new york city,,,,,,"[{'screen_name': 'domenicaxx66xx', 'name': 'Domenica Stone', 'id': '3023520711'}, {'screen_name': 'MissJules5x', 'name': 'Jules 🌹☭', 'id': '23993215'}, {'screen_name': 'BarbaraLNewsome', 'name': 'Burn the shit down.', 'id': '4004609957'}]",,,,
976602640787431425,976602640787431425,2018-03-21 18:33:08 CDT,2018-03-21,18:33:08,-0500,2602671417,_metro6k,Toknowa Thomas,,Lost my homie to gun fire😩,en,[],[],[],0,1,0,[],[],https://twitter.com/_Metro6k/status/976602640787431425,False,,0,,new york city,,,,,,[],,,,
976602193372565506,976602193372565506,2018-03-21 18:31:21 CDT,2018-03-21,18:31:21,-0500,238675787,attorneygsb,Bongopuntos 🇺🇦🇺🇲,,And a terrorist  https://t.co/WiIMxolcnP,en,[],['https://twitter.com/nytimes/status/976532172344561665'],[],0,0,1,[],[],https://twitter.com/attorneygsb/status/976602193372565506,False,https://twitter.com/nytimes/status/976532172344561665,0,,new york city,,,,,,[],,,,
976601687866728448,976601687866728448,2018-03-21 18:29:21 CDT,2018-03-21,18:29:21,-0500,55893844,debraweinberg1,Debi C. Weinberg,,"HEROES: Heart-Attack Victim, 13, Rescued By Teaneck Ambulance Corps  https://t.co/0XCKji5Esv",en,[],['http://fortlee.dailyvoice.com/police-fire/heroes-heart-attack-victim-13-rescued-by-teaneck-ambulance-corps/734619/#.WrLqsM0sbE4.twitter'],[],0,0,0,[],[],https://twitter.com/debraweinberg1/status/976601687866728448,False,,0,,new york city,,,,,,[],,,,
976601357623922688,976601357623922688,2018-03-21 18:28:02 CDT,2018-03-21,18:28:02,-0500,51214716,erynroberts,Erin Roberts,"{'type': 'Point', 'coordinates': [40.7142, -74.0064]}","Rage seat. #mta #subway #nyc @ New York, New York  https://t.co/QesFVBGX33",en,[],['https://www.instagram.com/p/BgmoK7oBy9N/'],[],0,0,0,"['mta', 'subway', 'nyc']",[],https://twitter.com/erynroberts/status/976601357623922688,False,,0,,new york city,,,,,,[],,,,
976599922375102464,976599922375102464,2018-03-21 18:22:20 CDT,2018-03-21,18:22:20,-0500,162188132,ayootash_,Tashhhh,,"My body , my ice , my cash ALL REAL IMMA TRIPLE THREAT.",en,[],[],[],0,0,1,[],[],https://twitter.com/Ayootash_/status/976599922375102464,False,,0,,new york city,,,,,,[],,,,
976599491557101568,976589737942274048,2018-03-21 18:20:37 CDT,2018-03-21,18:20:37,-0500,2154985953,josegacol,Josga Garcen,,"@marianodealba @jacquebalza Los narco terroristas y crimínales como Maduro y su organización crimínal Bolivariana, no los deben permitir en una cumbre tan importante. A la cumbre de las Américas tiene que invitar a gobernantes con dignidad y calidad moral de respeto con su pueblo.",es,[],[],[],0,0,1,[],[],https://twitter.com/josegacol/status/976599491557101568,False,,0,,new york city,,,,,,"[{'screen_name': 'marianodealba', 'name': 'Mariano de Alba', 'id': '275013329'}, {'screen_name': 'jacquebalza', 'name': 'Jacqueline Balza', 'id': '47972166'}]",,,,
976598255172837377,976184206723182593,2018-03-21 18:15:43 CDT,2018-03-21,18:15:43,-0500,749657035374034948,chrisfaye622,Chris Faye,,@NancySinatra @funder Oh no😱😱! A consensual heterosexual relationship between private citizens is now a crime. Let’s impeach him NOW!!!!,en,[],[],[],0,0,0,[],[],https://twitter.com/chrisfaye622/status/976598255172837377,False,,0,,new york city,,,,,,"[{'screen_name': 'NancySinatra', 'name': 'Nancy Sinatra', 'id': '50735431'}, {'screen_name': 'funder', 'name': 'Scott Dworkin', 'id': '14247236'}]",,,,
976597320249769985,975582345528045569,2018-03-21 18:12:00 CDT,2018-03-21,18:12:00,-0500,912588259,kxnstantina,Konstantina,,"@kalebpatrick_ when i grew up in greece, a lot of albanian men would come to greece and work illegally while talking down on our country, also a lot of organized crime by them. my dad was stopped at gunpoint by them and robbed. so, there.",en,[],[],[],4,0,0,[],[],https://twitter.com/kxnstantina/status/976597320249769985,False,,0,,new york city,,,,,,"[{'screen_name': 'KalebPatrick_', 'name': 'Kaleb Patrick', 'id': '4209686774'}]",,,,
976596602252136448,976596602252136448,2018-03-21 18:09:08 CDT,2018-03-21,18:09:08,-0500,919266656,almighty_red,nasdaq red ggp,,in the crunch time im shooting the gym up!,en,[],[],[],1,0,0,[],[],https://twitter.com/almighty_red/status/976596602252136448,False,,0,,new york city,,,,,,[],,,,
976596247338520581,976405122757558272,2018-03-21 18:07:44 CDT,2018-03-21,18:07:44,-0500,247318544,tffiddler,Adam T 🇺🇸🏳️‍🌈,,@realDonaldTrump Why are you afraid of saying that he’s a terrorist? Where was he radicalized?,en,[],[],[],0,0,0,[],[],https://twitter.com/tffiddler/status/976596247338520581,False,,0,,new york city,,,,,,"[{'screen_name': 'realDonaldTrump', 'name': 'Donald J. Trump', 'id': '25073877'}]",,,,
976596031675813889,976596031675813889,2018-03-21 18:06:52 CDT,2018-03-21,18:06:52,-0500,196847221,mrdanielavery,Daniel Avery he/him,,"""RACIST"" screams a bunch of old white guys who are sure they're the victims.  https://t.co/2jv6CVntQh",en,[],['https://twitter.com/rjoseph7777/status/976594502331715584'],[],0,0,1,[],[],https://twitter.com/MrDanielavery/status/976596031675813889,False,https://twitter.com/rjoseph7777/status/976594502331715584,0,,new york city,,,,,,[],,,,
976595470817660929,976595470817660929,2018-03-21 18:04:39 CDT,2018-03-21,18:04:39,-0500,266253817,actioncorpsny,Action Corps NY,,"Thank you to all who came to our Saudi prince protest yesterday, 3/20/18, at New York City Hall. #PrinceOfFamine #MohammedbinSalman Thank you @NYCMayor for your support for peace in #Yemen. Beautiful photos and stories here:  https://t.co/r4lgcLUHBQ",en,"[{'screen_name': 'nycmayor', 'name': 'mayor eric adams', 'id': '19834403'}]",['https://www.facebook.com/events/1962469287346866/permalink/1974607182799743/'],[],0,2,3,"['princeoffamine', 'mohammedbinsalman', 'yemen']",[],https://twitter.com/ActionCorpsNY/status/976595470817660929,False,,0,,new york city,,,,,,[],,,,
976594990980829184,976594990980829184,2018-03-21 18:02:44 CDT,2018-03-21,18:02:44,-0500,293349604,alexgleas,Alexander Gleason,,"He’s talking about the [terrorist] nut who set off bombs everywhere and blew himself up, right?  https://t.co/wFMlgqLR9z",en,[],['https://twitter.com/nydailynews/status/976594528248500225'],[],0,0,2,[],[],https://twitter.com/AlexGleas/status/976594990980829184,False,https://twitter.com/nydailynews/status/976594528248500225,0,,new york city,,,,,,[],,,,
976594238870827008,976516167367118848,2018-03-21 17:59:45 CDT,2018-03-21,17:59:45,-0500,26596853,siciliantaurus,Victor Giardina,,@JuliaDavisNews @LibsInAmerica I'm not a Trump supporter and disagree with most of his actions. Does anybody have hard proof he committed a crime that the public can verify. My party doesn't talk about policies anymore just conspiracy theories. This explains things we care about.  https://t.co/ozLkqZqMoF,en,[],['https://youtu.be/XSRUmRYrRLY'],[],1,1,1,[],[],https://twitter.com/siciliantaurus/status/976594238870827008,False,,0,,new york city,,,,,,"[{'screen_name': 'JuliaDavisNews', 'name': 'Julia Davis', 'id': '105327432'}, {'screen_name': 'LibsInAmerica', 'name': 'LiA', 'id': '898533348'}]",,,,
976593979490947078,976590136401154048,2018-03-21 17:58:43 CDT,2018-03-21,17:58:43,-0500,2154985953,josegacol,Josga Garcen,,@la_patilla Definitivamente es un chiste a gran escala; esta indígena que tiene maduro como payaso si llena esos requisitos. Se imaginan la magnitud de ignorancia de los estupidos de esa organización narco crimínal Bolivariana de Venezuela.,es,[],[],[],0,1,0,[],[],https://twitter.com/josegacol/status/976593979490947078,False,,0,,new york city,,,,,,"[{'screen_name': 'la_patilla', 'name': 'La Patilla', 'id': '124172948'}]",,,,
976593212994449410,976587513312792577,2018-03-21 17:55:40 CDT,2018-03-21,17:55:40,-0500,732880612068036608,fr045054,Frank Rodriguez,,@thehill SO WHAT?  McCabe WAS CORRUPT AND BIAS AND HE WANTED TO CHANGE THE OUTCOME OF THE ELECTION OF TRUMP BEFORE AND AFTER.  THAT IS A CRIME SO HE IS A CRIMINAL MIND AND WITH COMEY DESTROYED FBI REPUTATION. HE DESERVES TO BE FIRED AND WHAT IS COMING FOR HIM. IS NOT OVER. NOT YET🤣,en,[],[],[],0,0,0,[],[],https://twitter.com/fr045054/status/976593212994449410,False,,0,,new york city,,,,,,"[{'screen_name': 'thehill', 'name': 'The Hill', 'id': '1917731'}]",,,,
976591277130121216,976252534963736576,2018-03-21 17:47:59 CDT,2018-03-21,17:47:59,-0500,2154985953,josegacol,Josga Garcen,,"@YAMBITARA @akenatton3 @JuanManSantos @petrogustavo Esos indígenas respaldan a Petro, ellos creen que cuando petro sea presidente, los siguen manteniendo gratis. Pero EE.UU. tiene que pedir en extradición a los colaboradores del narco tráfico y entre ellos están indígenas y aliados a petro y grupos terroristas.",es,[],[],[],0,0,1,[],[],https://twitter.com/josegacol/status/976591277130121216,False,,0,,new york city,,,,,,"[{'screen_name': 'YAMBITARA', 'name': 'Juan Manuel', 'id': '138235377'}, {'screen_name': 'akenatton3', 'name': 'alberto hecheverri', 'id': '2757511621'}, {'screen_name': 'JuanManSantos', 'name': 'Juan Manuel Santos', 'id': '64839766'}, {'screen_name': 'petrogustavo', 'name': 'Gustavo Petro', 'id': '49849732'}]",,,,
976590677445365765,976590677445365765,2018-03-21 17:45:36 CDT,2018-03-21,17:45:36,-0500,196847221,mrdanielavery,Daniel Avery he/him,,"People believed Hillary ran a vast international crime syndicate out of State and the Clinton Foundation, and that she trafficked children out of a pizza restaurant, which she deserved for living an exemplary life of public service.  https://t.co/sIVhjRwxsu",en,[],['https://twitter.com/imwithher61/status/976497644922163200'],[],1,2,3,[],[],https://twitter.com/MrDanielavery/status/976590677445365765,False,https://twitter.com/imwithher61/status/976497644922163200,0,,new york city,,,,,,[],,,,
976590081782960131,976252534963736576,2018-03-21 17:43:14 CDT,2018-03-21,17:43:14,-0500,2154985953,josegacol,Josga Garcen,,"@YAMBITARA @akenatton3 @JuanManSantos @petrogustavo Esos indígenas son terroristas informantes y seguidores de las farc, ELN, y grupos terroristas del narco tráfico. Siempre estos indígenas han sido simpatizantes de la guerrilla.",es,[],[],[],0,0,0,[],[],https://twitter.com/josegacol/status/976590081782960131,False,,0,,new york city,,,,,,"[{'screen_name': 'YAMBITARA', 'name': 'Juan Manuel', 'id': '138235377'}, {'screen_name': 'akenatton3', 'name': 'alberto hecheverri', 'id': '2757511621'}, {'screen_name': 'JuanManSantos', 'name': 'Juan Manuel Santos', 'id': '64839766'}, {'screen_name': 'petrogustavo', 'name': 'Gustavo Petro', 'id': '49849732'}]",,,,
976589703318265856,976589703318265856,2018-03-21 17:41:44 CDT,2018-03-21,17:41:44,-0500,3178875979,_viitai,Amazon / eBay Reseller,,@abcnews call this kid a fucking terrorist,en,[],[],[],0,0,0,[],[],https://twitter.com/_viitaI/status/976589703318265856,False,,0,,new york city,,,,,,[],,,,
976588311883059201,976588311883059201,2018-03-21 17:36:12 CDT,2018-03-21,17:36:12,-0500,6021962,tummler10,Tummler (means... Connector & Troublemaker),,.@AriMelber @TheBeatWithAri Assange put Turkish Erdogan dissenters in harm's way. And printed untrue materials. @Credico2016 does not pass sniff test. @scsazak,en,"[{'screen_name': 'arimelber', 'name': 'ari melber, msnbc', 'id': '15441965'}, {'screen_name': 'thebeatwithari', 'name': 'the beat with ari melber on msnbc 📺', 'id': '887418059501305858'}, {'screen_name': 'credico2016', 'name': 'randy credico', 'id': '178711992'}, {'screen_name': 'scsazak', 'name': 'selim sazak', 'id': '20957871'}]",[],[],0,0,0,[],[],https://twitter.com/tummler10/status/976588311883059201,False,,0,,new york city,,,,,,[],,,,
976586433233346561,976571999983202304,2018-03-21 17:28:44 CDT,2018-03-21,17:28:44,-0500,37191062,rogerclark41,Roger Clark,,@kshaughnessy2 @CentralParkNYC @mikescotto Jack was not under attack though 😀,en,[],[],[],1,0,4,[],[],https://twitter.com/RogerClark41/status/976586433233346561,False,,0,,new york city,,,,,,"[{'screen_name': 'kshaughnessy2', 'name': 'kristen shaughnessy', 'id': '22259843'}, {'screen_name': 'CentralParkNYC', 'name': 'Central Park', 'id': '96795310'}, {'screen_name': 'mikescotto', 'name': 'Michael Scotto', 'id': '81187683'}]",,,,
976585873088278529,976585873088278529,2018-03-21 17:26:30 CDT,2018-03-21,17:26:30,-0500,264058164,paradox4ever,DJ Para Dox,,"The news says the terrorist saw the police &amp; then blew himself up, he was 23, had no military experience, home schooled &amp; got the parts from Home Depot to make the bomb, yea ok...so what the hell was his parents exactly schooling him to do?",en,[],[],[],0,0,1,[],[],https://twitter.com/Paradox4ever/status/976585873088278529,False,,0,,new york city,,,,,,[],,,,
976585552123310080,976581189367750656,2018-03-21 17:25:14 CDT,2018-03-21,17:25:14,-0500,53675209,gregpliska,Greg Pliska,,"@Victorianotter At first, I read this: “since Trump was elected domestic white male terrorist”.",en,[],[],[],1,0,1,[],[],https://twitter.com/gregpliska/status/976585552123310080,False,,0,,new york city,,,,,,"[{'screen_name': 'Victorianotter', 'name': 'victoriajones 🌊', 'id': '1692512336'}]",,,,
976583786069659648,976583786069659648,2018-03-21 17:18:13 CDT,2018-03-21,17:18:13,-0500,93181814,daphnedi,Daphne Dimitriadi,,"It’s called denial,apathy &amp; not ignorance with such information my dear-plz don’t give them any excuses &amp; thank you for your lovely words-only me knows what depression &amp; anger means after finding out what’s happening to the voiceless as we speak- check my link at my bio.thx ❤️  https://t.co/Ty2MwhT2Bj",en,[],['https://twitter.com/goveganworld/status/976582330667229187'],[],1,0,0,[],[],https://twitter.com/DaphneDi/status/976583786069659648,False,https://twitter.com/goveganworld/status/976582330667229187,0,,new york city,,,,,,[],,,,
976582268482408448,976581422868819968,2018-03-21 17:12:11 CDT,2018-03-21,17:12:11,-0500,533668784,robertinno53,roberto lerebours,,"@marcthiessen The terrorist was a grown man who chose  to do evil, none is responsible for his actions, that's all",en,[],[],[],1,0,0,[],[],https://twitter.com/Robertinno53/status/976582268482408448,False,,0,,new york city,,,,,,"[{'screen_name': 'marcthiessen', 'name': 'Marc Thiessen 🆓🇺🇦', 'id': '27245742'}]",,,,
976581869423726593,976581869423726593,2018-03-21 17:10:36 CDT,2018-03-21,17:10:36,-0500,2789634587,godandglory,Arlene Gordon,,"Basic (2013) action, crime, drama-A DEA agent investigate the disappearance of an Army drill Sergeant and cadets during a training excercise gone awry.  https://t.co/X7QiiFB3Bc",en,[],[],['https://pbs.twimg.com/media/DY2EBEgVoAA7Uh-.jpg'],0,0,0,[],[],https://twitter.com/godandglory/status/976581869423726593,False,,1,https://pbs.twimg.com/media/DY2EBEgVoAA7Uh-.jpg,new york city,,,,,,[],,,,
976581802985951232,976579784552648704,2018-03-21 17:10:20 CDT,2018-03-21,17:10:20,-0500,64023636,timwil014,Tim Wilson,,@SallyAnMatthews There are nine altogether. I think this final episode is the aftermath of the Versace murder and Cunnanan’s comeuppance. It really has been one hell of a series.,en,[],[],[],0,0,1,[],[],https://twitter.com/TimWil014/status/976581802985951232,False,,0,,new york city,,,,,,"[{'screen_name': 'SallyAnMatthews', 'name': 'Sally Ann Matthews', 'id': '171480365'}]",,,,
976581513352568832,976581513352568832,2018-03-21 17:09:11 CDT,2018-03-21,17:09:11,-0500,888748603921051648,artistrybyariel,Ariel Alexandra,,The fact that Dr. Phil had a 12 year old girl talk about how she kills animals and how she has “anger issues” is disturbing. Stop glorifying child psychos!!!!,en,[],[],[],0,0,0,[],[],https://twitter.com/artistrybyariel/status/976581513352568832,False,,0,,new york city,,,,,,[],,,,
976579816043491328,976579816043491328,2018-03-21 17:02:26 CDT,2018-03-21,17:02:26,-0500,835300836469264384,genzexec,si • the gen z exec ⚡️,,"friends who protest together, are friends forever",en,[],[],[],0,0,0,[],[],https://twitter.com/genzexec/status/976579816043491328,False,,0,,new york city,,,,,,[],,,,
976579815754162176,976579815754162176,2018-03-21 17:02:26 CDT,2018-03-21,17:02:26,-0500,3027712469,juliannemcshane,Julianne McShane,,Twitter sphere: please confirm that “distracted dissent!” - for a story about a pack of Park Slope kids who abandoned their protest to watch a bloody brawl instead - was INDEED the greatest @Brooklyn_Paper lede/headline that NEVER was!   Only @jtharney3 supports me! 🤦🏻‍♀️,en,"[{'screen_name': 'jtharney3', 'name': 'james harney', 'id': '3016027052'}]",[],[],0,0,0,[],[],https://twitter.com/JulianneMcShane/status/976579815754162176,False,,0,,new york city,,,,,,[],,,,
976578360477470720,976577290837676032,2018-03-21 16:56:39 CDT,2018-03-21,16:56:39,-0500,749759701,jstarhenry,jhenry,,"@mnboss1 Yes, lots of whites have been voting for whit supremacists for over 200 hundreds years and continue to do so in 2017..Roy Moore, the pedophile, received about 70% of white males and about 65% of white female votes in Alabama..",en,[],[],[],0,0,0,[],[],https://twitter.com/jstarhenry/status/976578360477470720,False,,0,,new york city,,,,,,"[{'screen_name': 'mnboss1', 'name': 'US Navy Veteran 🇺🇸🇺🇦🌻🌻', 'id': '2167340796'}]",,,,
976577262333161476,976577262333161476,2018-03-21 16:52:17 CDT,2018-03-21,16:52:17,-0500,2254359132,angelicilda,Country First !,,Trump on KissCam with Putin an  attack Americans lawmakers they ques his lovefest for Putin !  Russia blamed USA of PoisonAttack in UK !  Darin Trump to bad mouth Russia,en,[],[],[],0,0,0,[],[],https://twitter.com/angelicilda/status/976577262333161476,False,,0,,new york city,,,,,,[],,,,
976577131407986694,976577131407986694,2018-03-21 16:51:46 CDT,2018-03-21,16:51:46,-0500,25168689,kellit71,Kelli Tinsley,"{'type': 'Point', 'coordinates': [40.65, -73.95]}",Are these ridiculous statements? Just as ridiculous as your gun arguments. #stfu #gunlawsnow…  https://t.co/RvxskzS77e,en,[],['https://www.instagram.com/p/BgmduH_hItn/'],[],0,0,0,"['stfu', 'gunlawsnow']",[],https://twitter.com/kellit71/status/976577131407986694,False,,0,,new york city,,,,,,[],,,,
