id,conversation_id,created_at,date,time,timezone,user_id,username,name,place,tweet,language,mentions,urls,photos,replies_count,retweets_count,likes_count,hashtags,cashtags,link,retweet,quote_url,video,thumbnail,near,geo,source,user_rt_id,user_rt,retweet_id,reply_to,retweet_date,translate,trans_src,trans_dest
997195054635679745,997195054635679745,2018-05-17 14:20:02 CDT,2018-05-17,14:20:02,-0500,15702236,hughe_dillon,PhillyChitChat,,OH my thank you paparazzi gods that was the best experience shooting a celebrity in a long time.   Pixs soon #creed2,en,[],[],[],0,1,8,['creed2'],[],https://twitter.com/HughE_Dillon/status/997195054635679745,False,,0,,philadelphia,,,,,,[],,,,
997194490816364544,997194224448651264,2018-05-17 14:17:48 CDT,2018-05-17,14:17:48,-0500,135637640,thuglife_marco,marco.,,@Looseleeaf *reports for harassment*,en,[],[],[],0,0,0,[],[],https://twitter.com/thuglife_marco/status/997194490816364544,False,,0,,philadelphia,,,,,,"[{'screen_name': 'Looseleeaf', 'name': 'Rams Fan #99', 'id': '1444768324257148928'}]",,,,
997193485106253825,997132564967120896,2018-05-17 14:13:48 CDT,2018-05-17,14:13:48,-0500,16379909,bhanjawn,BhanJawn🇺🇦,,"@eclecticbrotha @sweetatertot2 Racist traffic cone is a new one to me &amp; I say, nice one!",en,[],[],[],0,0,6,[],[],https://twitter.com/BhanJawn/status/997193485106253825,False,,0,,philadelphia,,,,,,"[{'screen_name': 'eclecticbrotha', 'name': 'Ragnarok Lobster', 'id': '300642262'}, {'screen_name': 'sweetatertot2', 'name': 'Sweetatertot2', 'id': '1033901839572496385'}]",,,,
997192059156160514,997186421613047808,2018-05-17 14:08:08 CDT,2018-05-17,14:08:08,-0500,80118583,holroyd42,Ben,,"@AuthenticPhan1 Like the ""N"" word? Because I'm sure that's happened.   And let's not throw around terms like ""prominent"" when we're talking about an extremist, with no room for other people's views, who still is on her parents' health insurance, because of a policy she opposes. LOL.",en,[],[],[],0,0,0,[],[],https://twitter.com/holroyd42/status/997192059156160514,False,,0,,philadelphia,,,,,,[],,,,
997191436125786126,997191436125786126,2018-05-17 14:05:39 CDT,2018-05-17,14:05:39,-0500,385721186,alex_barrett94,AB,,"My favorite take from this photo are the comments that said if the students were armed during the 1970 protest, they would've fired back at the National Guard. Bc nothing beats a full-fledged fire fight on a College Campus  https://t.co/Q9BV313gUe",en,[],['https://twitter.com/ChaseMit/status/996979983867297792'],[],0,0,1,[],[],https://twitter.com/Alex_Barrett94/status/997191436125786126,False,https://twitter.com/ChaseMit/status/996979983867297792,0,,philadelphia,,,,,,[],,,,
997190100730744833,997166787811856384,2018-05-17 14:00:21 CDT,2018-05-17,14:00:21,-0500,127905392,_big_l,Harden for Simmons,,"@therealmikekb @KevinOConnorNBA I’d rather keep Fultz, Dario and RoCo can go. I’d rather us have too strong a perimeter attack",en,[],[],[],0,0,0,[],[],https://twitter.com/_big_L/status/997190100730744833,False,,0,,philadelphia,,,,,,"[{'screen_name': 'therealmikekb', 'name': 'Michael K-B', 'id': '280335745'}, {'screen_name': 'KevinOConnorNBA', 'name': ""Kevin O'Connor"", 'id': '35355156'}]",,,,
997188197309444096,997179865743937537,2018-05-17 13:52:47 CDT,2018-05-17,13:52:47,-0500,311476378,tycolllllllllll,Ty Collins,,@Javaughn__Jones Damn your tv racist as shit,en,[],[],[],1,0,3,[],[],https://twitter.com/Tycolllllllllll/status/997188197309444096,False,,0,,philadelphia,,,,,,"[{'screen_name': 'Javaughn__Jones', 'name': 'De Jones', 'id': '417491221'}]",,,,
997183820544790528,997156966341513216,2018-05-17 13:35:24 CDT,2018-05-17,13:35:24,-0500,66776059,fabricdragon,kirsten houseknecht,,@Becky77777Becky @jostpauley @katstails @SaysHummingbird They were giving you a graceful out instead of assuming you were racist scum that approved of yelling at random women on the street because they had the nerve to speak spanish... Thanks for making your racism clear.,en,[],[],[],1,1,3,[],[],https://twitter.com/fabricdragon/status/997183820544790528,False,,0,,philadelphia,,,,,,"[{'screen_name': 'Becky77777Becky', 'name': 'Becky H', 'id': '796731152962908161'}, {'screen_name': 'katstails', 'name': 'Smocking Hot Trump-a-roni', 'id': '837558326883864576'}, {'screen_name': 'SaysHummingbird', 'name': 'The Hummingbird 🇵🇸', 'id': '810619093749559296'}]",,,,
997176350577438721,997097049609981953,2018-05-17 13:05:43 CDT,2018-05-17,13:05:43,-0500,784358082197479424,wilson1theresa,Theresa M. Wilson,,@VeryKrisTaylor I hope you don't think all Americans feel that way about Immigrants.  It's just Trump and his racist supporters who feel this way.,en,[],[],[],0,0,0,[],[],https://twitter.com/Wilson1Theresa/status/997176350577438721,False,,0,,philadelphia,,,,,,[],,,,
997174687523393536,997173197337448449,2018-05-17 12:59:06 CDT,2018-05-17,12:59:06,-0500,1390835672,justinfromswp,Justin,,"@RNB215 I think they should get whatever the jail time is for rape, they should get that",en,[],[],[],0,1,1,[],[],https://twitter.com/JustinFromSWP/status/997174687523393536,False,,0,,philadelphia,,,,,,"[{'screen_name': 'RNB215', 'name': 'KIΠG', 'id': '339526153'}]",,,,
997173076084355072,997170366324903936,2018-05-17 12:52:42 CDT,2018-05-17,12:52:42,-0500,156750517,downwiththemets,mike wallach,,"@ItalPiazza31 Barkley will open up the Giant attack, and take pressure off Eli, who will have ""chunk"" play opportunities down field vs ""single safety- high"" looks.",en,[],[],[],1,0,0,[],[],https://twitter.com/DownwiththeMets/status/997173076084355072,False,,0,,philadelphia,,,,,,"[{'screen_name': 'ItalPiazza31', 'name': 'G', 'id': '3865865597'}]",,,,
997172530963206145,996797338818670592,2018-05-17 12:50:32 CDT,2018-05-17,12:50:32,-0500,399574392,opeolabukola,Opéola Bukola,,"@nursemckenzy @AmyMichelleGe Is that supposed to excuse her racist behavior? If she's mentally fit enough to get into Yale, I think she can recognize sleeping in a residence hall shared space as legal.",en,[],[],[],1,1,2,[],[],https://twitter.com/OpeolaBukola/status/997172530963206145,False,,0,,philadelphia,,,,,,"[{'screen_name': 'nursemckenzy', 'name': 'Hey Nurse', 'id': '2149204256'}]",,,,
997166985166417922,997166985166417922,2018-05-17 12:28:30 CDT,2018-05-17,12:28:30,-0500,202407488,chels__miller,Chelsea 🤍,,"Hey @ASchlossbergLaw .... I hope you lose your career and everything important to you, you racist fucking asshole",en,"[{'screen_name': 'aschlossberglaw', 'name': 'aaronschlossberglaw', 'id': '1064032118'}]",[],[],0,0,0,[],[],https://twitter.com/chels__miller/status/997166985166417922,False,,0,,philadelphia,,,,,,[],,,,
997164881223831553,996834870235189248,2018-05-17 12:20:08 CDT,2018-05-17,12:20:08,-0500,419170792,86reality,m.r.,,"@SmhoakMosheein it’s awesome — about to buy the football version. basically perverted versions of Madden/NHL licensed games w extreme violence, so popular they spawned a licensed cartoon  if you lose a hockey fight against yr buddy, he gets 3min for fighting — you get 5 for fighting and losing.  https://t.co/6w1GMO5PWT",en,[],[],['https://pbs.twimg.com/media/DdakJseUwAAes7F.jpg'],0,0,0,[],[],https://twitter.com/86reality/status/997164881223831553,False,,1,https://pbs.twimg.com/media/DdakJseUwAAes7F.jpg,philadelphia,,,,,,"[{'screen_name': 'SmhoakMosheein', 'name': 'Smhoak', 'id': '321598389'}]",,,,
997164719533449216,996870387085520896,2018-05-17 12:19:30 CDT,2018-05-17,12:19:30,-0500,467472661,judyspags,Judy Spagnola,,@charliekirk11 The media covered it &amp; gave proper credit to the officer who had his gun. Please give correct fact,en,[],[],[],0,0,0,[],[],https://twitter.com/JudySpags/status/997164719533449216,False,,0,,philadelphia,,,,,,"[{'screen_name': 'charliekirk11', 'name': 'Charlie Kirk', 'id': '292929271'}]",,,,
997164518810800128,997164518810800128,2018-05-17 12:18:42 CDT,2018-05-17,12:18:42,-0500,127568461,innocencepa,PA Innocence Project,,"""Egregious"": Philadelphia man cleared of friend's murder after 11 years behind bars  https://t.co/WyC1MAFPlU via @cbsthismorning",en,"[{'screen_name': 'cbsthismorning', 'name': 'cbs mornings', 'id': '1434916155735564293'}]",['https://www.cbsnews.com/news/dontia-patterson-philadelphia-man-freed-after-11-years-behind-bars-for-murder/'],[],0,2,10,[],[],https://twitter.com/innocencepa/status/997164518810800128,False,,0,,philadelphia,,,,,,[],,,,
997163215405637632,996834870235189248,2018-05-17 12:13:31 CDT,2018-05-17,12:13:31,-0500,419170792,86reality,m.r.,,"@SmhoakMosheein got complete copy of “ETERNAL CHAMPIONS” w manual, gang of folded loose-leaf explaining how to unleash the most brutal variations on MK-style “fatalities.”  beautiful animation, smooth gameplay/control. amazed there’s no competitions for this; handling superior to SF3:A, IMHO.  https://t.co/2p8uyc7hhA",en,[],[],['https://pbs.twimg.com/media/DdaipSIV0AEo2KB.jpg'],1,0,0,[],[],https://twitter.com/86reality/status/997163215405637632,False,,1,https://pbs.twimg.com/media/DdaipSIV0AEo2KB.jpg,philadelphia,,,,,,"[{'screen_name': 'SmhoakMosheein', 'name': 'Smhoak', 'id': '321598389'}]",,,,
997162013322285057,997162013322285057,2018-05-17 12:08:45 CDT,2018-05-17,12:08:45,-0500,27225301,dennylive,THE DENNY LIVE HATER SHOW,,Leaked Jail Video Shows T.I. Questioning Cop About Arrest   https://t.co/yvkjBQ9F8w via @TheRoot,en,"[{'screen_name': 'theroot', 'name': 'the root', 'id': '23995748'}]",['https://thegrapevine.theroot.com/leaked-jail-video-shows-t-i-questioning-cop-about-arre-1826099777'],[],0,0,0,[],[],https://twitter.com/DennyLive/status/997162013322285057,False,,0,,philadelphia,,,,,,[],,,,
997161620236374018,996834870235189248,2018-05-17 12:07:11 CDT,2018-05-17,12:07:11,-0500,419170792,86reality,m.r.,,"@SmhoakMosheein really good run of getting hold to undisputed classics: “Streets Of Rage II,” “Zombies Ate My Neighbors,” “Marble Madness,” “Maximum Carnage,” “Mutant League Hockey” — but weirdness reigns, &amp; it’s really clear how low bar was relatively to receive “Seal Of Approval” for Genesis.",en,[],[],[],1,0,1,[],[],https://twitter.com/86reality/status/997161620236374018,False,,0,,philadelphia,,,,,,"[{'screen_name': 'SmhoakMosheein', 'name': 'Smhoak', 'id': '321598389'}]",,,,
997160525078417409,996874935934038016,2018-05-17 12:02:50 CDT,2018-05-17,12:02:50,-0500,834840662516387841,eddied1999,Ed,,@wotintarnations @nowthisnews @realDonaldTrump Stop!! Prove me wrong!!  That is NOT conservative behavior that is Trump behavior.  Bigoted and Racist,en,[],[],[],0,0,0,[],[],https://twitter.com/EddieD1999/status/997160525078417409,False,,0,,philadelphia,,,,,,"[{'screen_name': 'nowthisnews', 'name': 'NowThis', 'id': '701725963'}, {'screen_name': 'realDonaldTrump', 'name': 'Donald J. Trump', 'id': '25073877'}]",,,,
997160316948697088,997160316948697088,2018-05-17 12:02:00 CDT,2018-05-17,12:02:00,-0500,46309146,mmbmwc,Margo,,"One of the most underrated demographics on Facebook has got to be the little old ladies who seem like they’re sweet if you look at their profile (pics of flowers, their yorkie, a peaceful pond) but then you catch them in the comments of some news article being racist as FUCK.",en,[],[],[],0,1,3,[],[],https://twitter.com/mmbmwc/status/997160316948697088,False,,0,,philadelphia,,,,,,[],,,,
997160163869102080,997157347012132864,2018-05-17 12:01:24 CDT,2018-05-17,12:01:24,-0500,804698553578913792,billie4congress,Joe Billie,,@Liz_Wheeler Numerous times a good guy with a gun stops a bad guy with gun and the media is silent.. SMH,en,[],[],[],1,0,1,[],[],https://twitter.com/billie4congress/status/997160163869102080,False,,0,,philadelphia,,,,,,"[{'screen_name': 'Liz_Wheeler', 'name': 'Liz Wheeler', 'id': '264361128'}]",,,,
997159676847513600,997159676847513600,2018-05-17 11:59:27 CDT,2018-05-17,11:59:27,-0500,2303838683,sniperxbae,Who I Smoke ?,,Grabbing the gun &gt;&gt;&gt;&gt;&gt;&gt;  https://t.co/RpmPiay2bg,en,[],['https://twitter.com/faithfulmanny/status/997159372110422016'],[],0,0,0,[],[],https://twitter.com/SniperxBae/status/997159676847513600,False,0,0,,philadelphia,,,,,,[],,,,
997159602977468419,997159602977468419,2018-05-17 11:59:10 CDT,2018-05-17,11:59:10,-0500,2869854800,sherwmarabia,𝙰𝚋𝚒𝚐𝚊𝚒𝚕 𝙾𝚛𝚘𝚋𝚘𝚗𝚘,,Imagine if Jace saw Lilith slap Clary... ooooooh the rage he’d feel!!!,en,[],[],[],0,0,1,[],[],https://twitter.com/Sherwmarabia/status/997159602977468419,False,,0,,philadelphia,,,,,,[],,,,
997158110988062727,997158110988062727,2018-05-17 11:53:14 CDT,2018-05-17,11:53:14,-0500,555143678,gmind10,G!!!,,“these violent delights have violent ends”,en,[],[],[],0,0,0,[],[],https://twitter.com/gmind10/status/997158110988062727,False,,0,,philadelphia,,,,,,[],,,,
997156918404710401,997156918404710401,2018-05-17 11:48:30 CDT,2018-05-17,11:48:30,-0500,2869854800,sherwmarabia,𝙰𝚋𝚒𝚐𝚊𝚒𝚕 𝙾𝚛𝚘𝚋𝚘𝚗𝚘,,"Ok ok, Alec I love you but.... you can’t tell your mom let alone any mom to stand down when their kids are in danger. #shadowhunters #SpringFinale",en,[],[],[],0,0,0,"['shadowhunters', 'springfinale']",[],https://twitter.com/Sherwmarabia/status/997156918404710401,False,,0,,philadelphia,,,,,,[],,,,
997155328759422976,997154354737106945,2018-05-17 11:42:11 CDT,2018-05-17,11:42:11,-0500,47500268,tagjim,Jim Taggart,,"@Phylan ""1/34 okay let's break down Lord Humongous' latest series of rape-capitations:""",en,[],[],[],0,0,1,[],[],https://twitter.com/tagjim/status/997155328759422976,False,,0,,philadelphia,,,,,,"[{'screen_name': 'Phylan', 'name': 'phylan', 'id': '28171432'}]",,,,
997152566004809728,996918465049985024,2018-05-17 11:31:12 CDT,2018-05-17,11:31:12,-0500,2448303621,msg7122,Mark S.,,"@minnlion @GeorgeTakei They were born human, they gave that up with all the murder, rape, torture, dismemberment, etc.",en,[],[],[],1,0,3,[],[],https://twitter.com/msg7122/status/997152566004809728,False,,0,,philadelphia,,,,,,"[{'screen_name': 'minnlion', 'name': 'Richard the lionhearted', 'id': '26425847'}, {'screen_name': 'GeorgeTakei', 'name': 'George Takei', 'id': '237845487'}]",,,,
997152026395119616,997152026395119616,2018-05-17 11:29:03 CDT,2018-05-17,11:29:03,-0500,1443336864,dandoyie,Dan Doyle 🤟🏻,,"RoCo hurt his finger right around when his shooting % dipped, makes sense",en,[],[],[],0,0,0,[],[],https://twitter.com/DanDoyIe/status/997152026395119616,False,,0,,philadelphia,,,,,,[],,,,
997151773688320000,997151773688320000,2018-05-17 11:28:03 CDT,2018-05-17,11:28:03,-0500,2240034134,doyiie,🤟🏻,,Around December makes sense why his shooting dipped  https://t.co/jMWGbkUZ8F,en,[],['https://twitter.com/sixers/status/997147777833537536'],[],0,0,1,[],[],https://twitter.com/DoyIIe/status/997151773688320000,False,https://twitter.com/sixers/status/997147777833537536,0,,philadelphia,,,,,,[],,,,
997150784973430784,997150784973430784,2018-05-17 11:24:07 CDT,2018-05-17,11:24:07,-0500,1117796532,phillyfastbreak,Philly Fast Break,,"Non-shooting hand, but hopefully that explains some of the dreadfully inconsistent shooting from Covington.  https://t.co/OTXBF0eyZV",en,[],['https://twitter.com/APgelston/status/997147188118654976'],[],0,0,0,[],[],https://twitter.com/PhillyFastBreak/status/997150784973430784,False,https://twitter.com/APgelston/status/997147188118654976,0,,philadelphia,,,,,,[],,,,
997150564243988483,997150564243988483,2018-05-17 11:23:15 CDT,2018-05-17,11:23:15,-0500,42684074,25haj,The 🐐,,I gotta learn how to control my anger,en,[],[],[],0,0,0,[],[],https://twitter.com/25Haj/status/997150564243988483,False,,0,,philadelphia,,,,,,[],,,,
997146614149107714,997146614149107714,2018-05-17 11:07:33 CDT,2018-05-17,11:07:33,-0500,73016558,miguelmvalle,Miguel Martinez-Valle,,"Charges Include attempted rape, indecent assault, and false imprisonment  https://t.co/XYomFXPuLG",en,[],['https://twitter.com/nbcphiladelphia/status/996933139959345153'],[],0,0,0,[],[],https://twitter.com/MiguelMValle/status/997146614149107714,False,https://twitter.com/nbcphiladelphia/status/996933139959345153,0,,philadelphia,,,,,,[],,,,
997141010684760064,997141010684760064,2018-05-17 10:45:17 CDT,2018-05-17,10:45:17,-0500,466180291,emilysnyderx,EmilyGrace♡,,"It’s not a threat, it’s a warning; be careful with me. 🎶",en,[],[],[],0,0,0,[],[],https://twitter.com/EmilySnyderx/status/997141010684760064,False,,0,,philadelphia,,,,,,[],,,,
997138612239192064,997138612239192064,2018-05-17 10:35:45 CDT,2018-05-17,10:35:45,-0500,2887239641,names_quent,Nice To Meet You,,"Seen a thick bitch on spice gang that was from Milwaukee...had me like “what’s the weather &amp; crime rate out this bitch, shit I like the Bucks” 🤦🏾‍♂️😂",en,[],[],[],0,0,0,[],[],https://twitter.com/Names_Quent/status/997138612239192064,False,,0,,philadelphia,,,,,,[],,,,
997134473111142402,997134473111142402,2018-05-17 10:19:18 CDT,2018-05-17,10:19:18,-0500,108416118,phillyparttwo,Michael MPH 🇺🇸 ✌🏼,,"If you think #GunControlNow and #GunReformNow is just about school shootings &amp; mass shootings &amp; Waffle House shootings, those are only the media-friendly ones. Situations like this are the true horror of US gun proliferation. This doesn't happen elsewhere.  https://t.co/7fpFqOt6Z6",en,[],['https://www.buzzfeed.com/coralewis/after-her-ex-husband-killed-their-children-a-mother-said-on'],[],0,0,0,"['guncontrolnow', 'gunreformnow']",[],https://twitter.com/PhillyPartTwo/status/997134473111142402,False,,0,,philadelphia,,,,,,[],,,,
997128654466400256,997125608932040704,2018-05-17 09:56:11 CDT,2018-05-17,09:56:11,-0500,108416118,phillyparttwo,Michael MPH 🇺🇸 ✌🏼,,@6abc ... because of safety and insurance concerns. More Channel 6 inspiration anger clickbait.,en,[],[],[],0,0,0,[],[],https://twitter.com/PhillyPartTwo/status/997128654466400256,False,,0,,philadelphia,,,,,,"[{'screen_name': '6abc', 'name': 'Action News on 6abc', 'id': '18391051'}]",,,,
997127715579981825,996881037392138240,2018-05-17 09:52:27 CDT,2018-05-17,09:52:27,-0500,2601425146,patpatr1152rch,Patricia,,@ABC Anger management!  https://t.co/f4BYxg6cSJ,fr,[],[],['https://pbs.twimg.com/tweet_video_thumb/DdaCXhNV0AALObW.jpg'],0,0,0,[],[],https://twitter.com/PatPatr1152rch/status/997127715579981825,False,,1,https://pbs.twimg.com/tweet_video_thumb/DdaCXhNV0AALObW.jpg,philadelphia,,,,,,"[{'screen_name': 'ABC', 'name': 'ABC News', 'id': '28785486'}]",,,,
997126461457809409,997126461457809409,2018-05-17 09:47:28 CDT,2018-05-17,09:47:28,-0500,837480361152106496,michaelart123,Michael Grossman,,"Chuck Schumer: The president &amp; his allies continue to attack the Mueller investigation, blatantly distorting and lying. I have a steady belief that they will not succeed; despite allies like Nunes. We must allow it to proceed, to the unvarnished truth. Our democracy is at stake.",en,[],[],[],1,30,60,[],[],https://twitter.com/MichaelArt123/status/997126461457809409,False,,0,,philadelphia,,,,,,[],,,,
997124993787092994,997101773155221505,2018-05-17 09:41:38 CDT,2018-05-17,09:41:38,-0500,734569564974002177,ifwt107k,In Franklin We Trust,,"@PSULion98 Yeah i mean, dont get injured. Then youll wish it was more than a business decision.",en,[],[],[],0,0,1,[],[],https://twitter.com/ifwt107k/status/997124993787092994,False,,0,,philadelphia,,,,,,"[{'screen_name': 'PSULion98', 'name': 'Dave Trostle', 'id': '424647508'}]",,,,
997122992273584128,997122992273584128,2018-05-17 09:33:41 CDT,2018-05-17,09:33:41,-0500,27730004,jeanneleong,Jeanne Leong,,Anita Hill says We will never be the same after the me too movement. We can’t ignore or pretend that sexual harassment doesn’t exist. We need to see legislation passed to live and work in a safe environment. @RutgersLaw         @Rutgers_Camden #RUcamden18  https://t.co/mkCfchjqXq,en,"[{'screen_name': 'rutgerslaw', 'name': 'rutgers law ⚖️', 'id': '883020637'}, {'screen_name': 'rutgers_camden', 'name': 'rutgers–camden', 'id': '21427812'}]",[],['https://pbs.twimg.com/media/DdZ-EugWsAAUqi6.jpg'],0,4,4,['rucamden18'],[],https://twitter.com/JeanneLeong/status/997122992273584128,False,,1,https://pbs.twimg.com/media/DdZ-EugWsAAUqi6.jpg,philadelphia,,,,,,[],,,,
997122131703066624,997122131703066624,2018-05-17 09:30:16 CDT,2018-05-17,09:30:16,-0500,290328169,grace_shallow,Grace Shallow,,"Allison Herens, the harm reduction coordinator for @PHLPublicHealth, led the training.  https://t.co/EU64A851rt",en,"[{'screen_name': 'phlpublichealth', 'name': 'philadelphia public health', 'id': '500964316'}]",['https://twitter.com/grace_shallow/status/997117610385985537'],[],0,0,2,[],[],https://twitter.com/Grace_Shallow/status/997122131703066624,False,https://twitter.com/grace_shallow/status/997117610385985537,0,,philadelphia,,,,,,[],,,,
997117474775752705,997116592424210432,2018-05-17 09:11:46 CDT,2018-05-17,09:11:46,-0500,16454598,jdanton,Joey D'Antoni,,@zippy1981 @KenpoDBA @JenniferMcCown Scallions and fucking leeks murder edges like nothing else,en,[],[],[],2,0,0,[],[],https://twitter.com/jdanton/status/997117474775752705,False,,0,,philadelphia,,,,,,"[{'screen_name': 'zippy1981', 'name': 'Justin Dearing', 'id': '19685647'}, {'screen_name': 'KenpoDBA', 'name': 'Sean McCown', 'id': '944244253'}, {'screen_name': 'JenniferMcCown', 'name': 'Jen / Benedick @🏡', 'id': '31395667'}]",,,,
997116855595798529,993584110202273792,2018-05-17 09:09:18 CDT,2018-05-17,09:09:18,-0500,4025531193,borisdirnbach,"Bo Dirnbach w PDA fighting for #HR1976, #M4A.",,"@ScottyGustafski @MorganStanley Say remind me again when Obama was credibly accused of rape like @realDonaldTrump?  https://t.co/K8PiyzVTOR,  https://t.co/VecRDs32QD  https://t.co/hW6syqddie",en,"[{'screen_name': 'realdonaldtrump', 'name': 'donald j. trump', 'id': '25073877'}]","['https://vimeo.com/176181706', 'http://www.justiceforkatie.com/']","['https://pbs.twimg.com/media/DdZ4LtwWsAE_yYf.jpg', 'https://pbs.twimg.com/media/DdZ4LvEXUAMG8up.jpg', 'https://pbs.twimg.com/media/DdZ4P4KXUAARSwE.jpg', 'https://pbs.twimg.com/media/DdZ4QMyW4AELvuW.jpg']",0,0,1,[],[],https://twitter.com/BorisDirnbach/status/997116855595798529,False,,1,https://pbs.twimg.com/media/DdZ4LtwWsAE_yYf.jpg,philadelphia,,,,,,"[{'screen_name': 'ScottyGustafski', 'name': 'Scotty Gustafski', 'id': '64190669'}, {'screen_name': 'MorganStanley', 'name': 'Morgan Stanley', 'id': '426159377'}]",,,,
997116584723394560,996797338818670592,2018-05-17 09:08:13 CDT,2018-05-17,09:08:13,-0500,365651280,raine41879,raine,,@AmyMichelleGe @MrsHackett33 @Stanford I thought Jews could be racist like blacks can't? 🤔🤔🤔,en,[],[],[],0,0,0,[],[],https://twitter.com/Raine41879/status/997116584723394560,False,,0,,philadelphia,,,,,,"[{'screen_name': 'Stanford', 'name': 'Stanford University', 'id': '18036441'}]",,,,
997115992819027969,997109972440899590,2018-05-17 09:05:52 CDT,2018-05-17,09:05:52,-0500,381919736,johnlk_80,John,,"@normative The Nazis justified anti-Semitic policies by obsessing about ""Jewish crime.""",en,[],[],[],1,5,18,[],[],https://twitter.com/johnlk_80/status/997115992819027969,False,,0,,philadelphia,,,,,,"[{'screen_name': 'normative', 'name': 'Julian Sanchez', 'id': '8548612'}]",,,,
997115795246407680,997115795246407680,2018-05-17 09:05:05 CDT,2018-05-17,09:05:05,-0500,2546750773,mitchlarson58,Mitch Larson,,Please educate yourselves and understand that the racist and vile  #FakeNews smear campaign that @realDonaldTrump and the @GOP are running against immigrants is 110% factually incorrect. Immigrants make our country great and they are people NOT animals. #ThursdayThoughts  https://t.co/A9MwBcM2uA,en,"[{'screen_name': 'realdonaldtrump', 'name': 'donald j. trump', 'id': '25073877'}, {'screen_name': 'gop', 'name': 'gop', 'id': '11134252'}]",['https://twitter.com/calendow/status/996902196267528192'],[],0,0,0,"['fakenews', 'thursdaythoughts']",[],https://twitter.com/mitchlarson58/status/997115795246407680,False,https://twitter.com/calendow/status/996902196267528192,0,,philadelphia,,,,,,[],,,,
997113945319182336,997113945319182336,2018-05-17 08:57:44 CDT,2018-05-17,08:57:44,-0500,27730004,jeanneleong,Jeanne Leong,,One of the @RutgersLaw students graduating today is Christopher Bustamante Osorio. He became interested in law after hearing about and seeing injustices his parents faced in the U.S. after fleeing violence and corruption in Colombia.  https://t.co/mzzNjRHI6a  #RUCamden18  https://t.co/m2Wo6ewlTB,en,"[{'screen_name': 'rutgerslaw', 'name': 'rutgers law ⚖️', 'id': '883020637'}]",['https://news.camden.rutgers.edu/2018/05/rutgers-law-2018-graduate-advocates-for-civil-rights-lgbtq-rights/'],['https://pbs.twimg.com/media/DdZ12OTXUAI8feu.jpg'],0,0,1,['rucamden18'],[],https://twitter.com/JeanneLeong/status/997113945319182336,False,,1,https://pbs.twimg.com/media/DdZ12OTXUAI8feu.jpg,philadelphia,,,,,,[],,,,
997111571846455296,997098944231628800,2018-05-17 08:48:18 CDT,2018-05-17,08:48:18,-0500,290328169,grace_shallow,Grace Shallow,,He said politicians need to support harm reduction efforts like syringe exchanges and a comprehensive user engagement site.,en,[],[],[],1,0,0,[],[],https://twitter.com/Grace_Shallow/status/997111571846455296,False,,0,,philadelphia,,,,,,[],,,,
997110850375815169,997098944231628800,2018-05-17 08:45:26 CDT,2018-05-17,08:45:26,-0500,290328169,grace_shallow,Grace Shallow,,"Reaves is the executive director of the Pennsylvania Harm Reduction Coaliton. He was involved in orchestrating David's Law, which expanded access to naloxone. @sydneydschaefer details it, and others who carry Narcan, in her piece for @sojoaddiction:  https://t.co/dc55exoB1Q",en,"[{'screen_name': 'sydneydschaefer', 'name': 'sydney schaefer', 'id': '875709420210196480'}, {'screen_name': 'sojoaddiction', 'name': 'covering addiction', 'id': '821167509399339009'}]",['http://www.coveringaddiction.com/solutions/project/overdose/'],[],1,1,1,[],[],https://twitter.com/Grace_Shallow/status/997110850375815169,False,,0,,philadelphia,,,,,,[],,,,
