id,conversation_id,created_at,date,time,timezone,user_id,username,name,place,tweet,language,mentions,urls,photos,replies_count,retweets_count,likes_count,hashtags,cashtags,link,retweet,quote_url,video,thumbnail,near,geo,source,user_rt_id,user_rt,retweet_id,reply_to,retweet_date,translate,trans_src,trans_dest
997265066314510336,997207662499688448,2018-05-17 18:58:14 CDT,2018-05-17,18:58:14,-0500,245452873,jawnclaudvandam,JawnClaudVanDam,,"@ltrain3883 @TD_4800 @AP If you’re a terrorist from another country, no the US constitution does not apply to you",en,[],[],[],0,0,0,[],[],https://twitter.com/JawnClaudVanDam/status/997265066314510336,False,,0,,philadelphia,,,,,,"[{'screen_name': 'AP', 'name': 'The Associated Press', 'id': '51241574'}]",,,,
997264519478038529,997207662499688448,2018-05-17 18:56:04 CDT,2018-05-17,18:56:04,-0500,245452873,jawnclaudvandam,JawnClaudVanDam,,@ltrain3883 @DesertEWO @TD_4800 @AP If they are part of a terrorist organization like the hijackers were,en,[],[],[],0,0,0,[],[],https://twitter.com/JawnClaudVanDam/status/997264519478038529,False,,0,,philadelphia,,,,,,"[{'screen_name': 'DesertEWO', 'name': 'Devil EWOk', 'id': '4179066490'}, {'screen_name': 'AP', 'name': 'The Associated Press', 'id': '51241574'}]",,,,
997261468516192256,997261468516192256,2018-05-17 18:43:56 CDT,2018-05-17,18:43:56,-0500,22935330,khalifm,Tommy Vercetti,,"“Aaron, at what age did u decide u wanted to be a racist like this?” Is HILARIOUS  https://t.co/7UWV7ITeu8",en,[],['https://twitter.com/jordanuhl/status/997194573754617857'],[],0,0,1,[],[],https://twitter.com/KhalifM/status/997261468516192256,False,https://twitter.com/jordanuhl/status/997194573754617857,0,,philadelphia,,,,,,[],,,,
997261405681344512,997261405681344512,2018-05-17 18:43:41 CDT,2018-05-17,18:43:41,-0500,151931595,lianerozzell,Liane Rozzell,,"Powerful stories of violence, accountability and healing form @Common_Justice premiered tonight. #EverAfter",en,"[{'screen_name': 'common_justice', 'name': 'common justice', 'id': '974306250396717057'}]",[],[],0,2,7,['everafter'],[],https://twitter.com/LianeRozzell/status/997261405681344512,False,,0,,philadelphia,,,,,,[],,,,
997257977710051332,997247128383643649,2018-05-17 18:30:04 CDT,2018-05-17,18:30:04,-0500,715641134605688832,paindylady,PAIndy lady,,@realworldrj @LemieuxLGM No he racist like Trump-bet this dude is a Trump supporter,en,[],[],[],0,0,0,[],[],https://twitter.com/PaIndylady/status/997257977710051332,False,,0,,philadelphia,,,,,,"[{'screen_name': 'realworldrj', 'name': 'Пу́тін — хуйло́ 🇺🇦', 'id': '14570525'}, {'screen_name': 'LemieuxLGM', 'name': 'Scott Lemieux', 'id': '52253024'}]",,,,
997256508931883009,997256508931883009,2018-05-17 18:24:14 CDT,2018-05-17,18:24:14,-0500,43718606,wavespliffman67,NOGRAM WAVE 🇭🇹⛄️,,"If anger makes you disloyal, you was never loyal..",en,[],[],[],0,0,0,[],[],https://twitter.com/WaveSpliffman67/status/997256508931883009,False,,0,,philadelphia,,,,,,[],,,,
997254734200291328,997087399963340800,2018-05-17 18:17:11 CDT,2018-05-17,18:17:11,-0500,761358060,ennis_smith,Ennis Smith,,"@shannonrwatts White woman brings a weapon that was used 2 murder 17 ppl 3mos before, 2 a campus that is home 2 students being murdered by the NG 48yrs before. But she is a victim of racism 4 not recognizing where she brought the weapon TO or how she was TREATED while having IT. You don't say!!",en,[],[],[],0,0,0,[],[],https://twitter.com/Ennis_Smith/status/997254734200291328,False,,0,,philadelphia,,,,,,"[{'screen_name': 'shannonrwatts', 'name': 'Shannon Watts', 'id': '246939630'}]",,,,
997253151953637377,997252410870349824,2018-05-17 18:10:54 CDT,2018-05-17,18:10:54,-0500,30892456,y100adicsdmb,Tim,,"@unta8 Uhh. There are other things that are more cringeworthy from the band. I don't know, like sexual harassment.",en,[],[],[],1,0,0,[],[],https://twitter.com/y100adicsDMB/status/997253151953637377,False,,0,,philadelphia,,,,,,"[{'screen_name': 'unta8', 'name': 'Cyrus', 'id': '278741036'}]",,,,
997252872738885632,997252872738885632,2018-05-17 18:09:47 CDT,2018-05-17,18:09:47,-0500,7292502,isabanin,Ilya Sabanin,,Excellent video analysis of a forced landing (P-51 Mustang). It’s easy to forget how violent such landings can be. Glad to have Cirrus CAPS on board my airplane!  https://t.co/Pac5GTlxb5,en,[],['https://youtu.be/BBpqvPujZgM'],[],0,0,2,[],[],https://twitter.com/isabanin/status/997252872738885632,False,,0,,philadelphia,,,,,,[],,,,
997248953295962112,997248953295962112,2018-05-17 17:54:13 CDT,2018-05-17,17:54:13,-0500,3134973675,justinlgroen,justin groen,,@RudyGiuliani I must have missed the class in law school that taught the “can’t arrest a sitting President” Amendment.,en,[],[],[],0,0,0,[],[],https://twitter.com/JustinLgroen/status/997248953295962112,False,,0,,philadelphia,,,,,,[],,,,
997248564823666694,997248564823666694,2018-05-17 17:52:40 CDT,2018-05-17,17:52:40,-0500,2798026344,lewisblum,Lew Blum Towing,,"all monies collected from Drug bust and confiscated,should be reinvested,and given to the police department who made the arrest,that money could bulletproof ,all police vehicle windows .buy more and better body armor, body cameras for all police officers, the bucks stops here  https://t.co/vXu9LrDmfB",en,[],[],['https://pbs.twimg.com/media/DdbwRiuU8AE0XfJ.jpg'],0,0,0,[],[],https://twitter.com/LewisBlum/status/997248564823666694,False,,1,https://pbs.twimg.com/media/DdbwRiuU8AE0XfJ.jpg,philadelphia,,,,,,[],,,,
997245622871785472,997245622871785472,2018-05-17 17:40:59 CDT,2018-05-17,17:40:59,-0500,756987368092016640,megzybougs,megzybougs,,Perry De Marco’s (Ari Goldstein’s attorney) victim blaming is disgusting.  https://t.co/vOLNQvlE9W,en,[],['https://twitter.com/thetemplenews/status/997187083549708293'],[],0,1,4,[],[],https://twitter.com/megzybougs/status/997245622871785472,False,https://twitter.com/thetemplenews/status/997187083549708293,0,,philadelphia,,,,,,[],,,,
997244912063131649,997244912063131649,2018-05-17 17:38:09 CDT,2018-05-17,17:38:09,-0500,1008047148,bkh__,BOSSUP,,quinn Always playing the victim!😂 Like boyyyyyy... knock it off,en,[],[],[],0,0,0,[],[],https://twitter.com/bkh__/status/997244912063131649,False,,0,,philadelphia,,,,,,[],,,,
997240610103939072,997239866785230848,2018-05-17 17:21:03 CDT,2018-05-17,17:21:03,-0500,76546469,ishhmaael,‘Uh-mod’,,@brandibecker426 Didn’t hear about the rape room until you guys told me,en,[],[],[],1,0,0,[],[],https://twitter.com/ishhmaael/status/997240610103939072,False,,0,,philadelphia,,,,,,[],,,,
997239866785230848,997239866785230848,2018-05-17 17:18:06 CDT,2018-05-17,17:18:06,-0500,76546469,ishhmaael,‘Uh-mod’,,@brandibecker426 Hahahahahhahahahahahahhahah (prayers for the victim)  https://t.co/f5TMH3UN5V,tl,[],['https://twitter.com/phillymag/status/996887667328495616'],[],1,1,1,[],[],https://twitter.com/ishhmaael/status/997239866785230848,False,https://twitter.com/phillymag/status/996887667328495616,0,,philadelphia,,,,,,[],,,,
997239450911559682,997239450911559682,2018-05-17 17:16:27 CDT,2018-05-17,17:16:27,-0500,727134510391939072,tmotrucksouthnj,T-Mobile Truck Southern NJ,,It's a shark attack at @WizardWorld in the @PAConvention ..... tmob20 tpr 20% off ur tickets today through Sunday! #nerules #TruckLife  https://t.co/VjZ1AT4tZa,en,"[{'screen_name': 'wizardworld', 'name': 'wizardworld', 'id': '32455644'}, {'screen_name': 'paconvention', 'name': 'pa convention center', 'id': '281591551'}]",[],['https://pbs.twimg.com/media/Ddbn5JQVwAAdbOc.jpg'],0,1,8,"['nerules', 'trucklife']",[],https://twitter.com/TMoTruckSouthNJ/status/997239450911559682,False,,1,https://pbs.twimg.com/media/Ddbn5JQVwAAdbOc.jpg,philadelphia,,,,,,[],,,,
997237677442420736,997237677442420736,2018-05-17 17:09:24 CDT,2018-05-17,17:09:24,-0500,36688567,warpath,Historian on the Warpath,,This is a violent painting.  https://t.co/8lECVuDuVU,en,[],[],['https://pbs.twimg.com/media/DdbmXuTVMAAX-Bh.jpg'],0,0,1,[],[],https://twitter.com/warpath/status/997237677442420736,False,,1,https://pbs.twimg.com/media/DdbmXuTVMAAX-Bh.jpg,philadelphia,,,,,,[],,,,
997233856058097664,997233856058097664,2018-05-17 16:54:13 CDT,2018-05-17,16:54:13,-0500,56722736,carlyinnj,💛Carly Says Things Be💗Kind 💚🌍 #JusticeMatters,,"He's right wing activist⏩| After Racist Lawyer Goes Viral,Internet Sending Mariachis to His #NYC Office  https://t.co/HwsRMCRLDo via remezcla",en,[],['http://remezcla.com/culture/arron-schlossberg-racist-ny-internet/'],[],0,0,1,['nyc'],[],https://twitter.com/carlyinNJ/status/997233856058097664,False,,0,,philadelphia,,,,,,[],,,,
997233574511341568,997233572070285313,2018-05-17 16:53:06 CDT,2018-05-17,16:53:06,-0500,516718132,markhoofnagle,Mark Hoofnagle,,"Ending nonwhite immigration is also the primary goal of white-supremacists in this country, and this is why Trump enjoys their unwavering support.  At all levels, support or defense of Trump in this endeavor will one day be seen as collaboration with an amoral racist regime.",en,[],[],[],0,0,2,[],[],https://twitter.com/MarkHoofnagle/status/997233574511341568,False,,0,,philadelphia,,,,,,[],,,,
997227146119655425,997223984197525509,2018-05-17 16:27:33 CDT,2018-05-17,16:27:33,-0500,3245476737,vanreyrey,Vanna Rey,,@Campbel2Jr @NBCPhiladelphia Has nothing to do with color. How am I racist? Do you know me personally? Oh I’m racist but your president isn’t?,en,[],[],[],0,0,0,[],[],https://twitter.com/VanreyRey/status/997227146119655425,False,,0,,philadelphia,,,,,,"[{'screen_name': 'NBCPhiladelphia', 'name': 'NBC10 Philadelphia', 'id': '15755669'}]",,,,
997222651239202817,997222651239202817,2018-05-17 16:09:42 CDT,2018-05-17,16:09:42,-0500,476887362,chinomartino27,Martino,,"THIS is why domestic violence cases are so difficult. He said, she said...without video evidence there’s just no way to tell who’s lying and who isn’t. Just a bad situation overall...  https://t.co/TUKSJ7Bp1o",en,[],['https://twitter.com/caminman/status/997167973046435841'],[],0,0,0,[],[],https://twitter.com/ChinoMartino27/status/997222651239202817,False,https://twitter.com/caminman/status/997167973046435841,0,,philadelphia,,,,,,[],,,,
997221779407073280,997221779407073280,2018-05-17 16:06:14 CDT,2018-05-17,16:06:14,-0500,43409849,lilykakes,lauralea,,🚨🚨 *wee woo wee woo wee woo* 🚨🚨 🚧🚧🚧🚧🚧🚧🚧🚧🚧🚧🚧🚧🚧🚧🚧🚧 📣 ATTENTION. THIS IS THE POLICE! A severe crime has been committed! We will not rest until this atrocity is solved and order is restored! This case will not run cold. 🚨🚨 #savelucifer #pickuplucifer *wee woo*  https://t.co/h081dr5D4f,en,[],[],['https://pbs.twimg.com/tweet_video_thumb/DdbX6JXVwAIWKcS.jpg'],0,1,2,"['savelucifer', 'pickuplucifer']",[],https://twitter.com/Lilykakes/status/997221779407073280,False,,1,https://pbs.twimg.com/tweet_video_thumb/DdbX6JXVwAIWKcS.jpg,philadelphia,,,,,,[],,,,
997219826866237441,997219826866237441,2018-05-17 15:58:28 CDT,2018-05-17,15:58:28,-0500,1940779255,rayd1475,Ray Doherty,,"Prince Harry  Volunteered to go to Afghanistan Press made him leave, realized he could go back if he flew a helicopter. Became an Apache attack Helicopter pilot and went back.  Played Quarterback for the Eagles.  Not bad, not bad.........  https://t.co/qqNFRdSKQE",en,[],[],['https://pbs.twimg.com/tweet_video_thumb/DdbWJCCVMAAavEB.jpg'],0,0,1,[],[],https://twitter.com/rayd1475/status/997219826866237441,False,,1,https://pbs.twimg.com/tweet_video_thumb/DdbWJCCVMAAavEB.jpg,philadelphia,,,,,,[],,,,
997219506526347265,997219506526347265,2018-05-17 15:57:12 CDT,2018-05-17,15:57:12,-0500,16379909,bhanjawn,BhanJawn🇺🇦,,Don’t forget this racist scumbag advertises his ability to speak multiple languages including FLUENCY IN SPANISH which helps his business I suppose. (@RepEspaillat thanks for filing the complaint against this American embarrassment.)  https://t.co/qMLBuVOv68,en,"[{'screen_name': 'repespaillat', 'name': 'adriano espaillat', 'id': '817076257770835968'}]",['https://twitter.com/i/moments/997079160412606464'],[],0,0,0,[],[],https://twitter.com/BhanJawn/status/997219506526347265,False,,0,,philadelphia,,,,,,[],,,,
997218147454345216,997218147454345216,2018-05-17 15:51:48 CDT,2018-05-17,15:51:48,-0500,370356692,mhand36,Michael Hand,,@MikeMiss975 @NatalieEgenolf @TyJohnsonNews falsely accusing somebody of domestic violence should result in a jail sentence. Just cost that man some $$$$$$$,en,"[{'screen_name': 'natalieegenolf', 'name': 'natalie egenolf', 'id': '19274006'}, {'screen_name': 'tyjohnsonnews', 'name': 'tyrone johnson', 'id': '15679311'}]",[],[],0,0,0,[],[],https://twitter.com/MHand36/status/997218147454345216,False,,0,,philadelphia,,,,,,[],,,,
997216328871235585,996952191146610694,2018-05-17 15:44:34 CDT,2018-05-17,15:44:34,-0500,2321097177,saundersreanna,Re,,@malik_h15 I also get that she’s trying to make a statement but I’m pretty sure it’s probably against that schools policy for a gun to be on campus 🙃,en,[],[],[],0,0,2,[],[],https://twitter.com/saundersreanna/status/997216328871235585,False,,0,,philadelphia,,,,,,"[{'screen_name': 'malik_h15', 'name': 'LEEK⚡️', 'id': '2720877652'}]",,,,
997216169651310592,997191937890365440,2018-05-17 15:43:56 CDT,2018-05-17,15:43:56,-0500,394245564,kaiittnmo,kait,,"@okay_chini Heart attack, he was too thicc",en,[],[],[],1,0,1,[],[],https://twitter.com/kaiittnmo/status/997216169651310592,False,,0,,philadelphia,,,,,,"[{'screen_name': 'okay_chini', 'name': '🩸', 'id': '196603626'}]",,,,
997215768772317184,997215768772317184,2018-05-17 15:42:21 CDT,2018-05-17,15:42:21,-0500,305248002,_worstpimpever,Mike B,,Would LOVE to see everyone follow @JOEL9ONE and @MalcolmJenkins lead aka Malcolm Smith and not even go. @Eagles can we get Lurie behind this protest? It will send a great message from our city #Philly #RESIST #LoveTrumpsHate  https://t.co/4bJG8lYnKF,en,"[{'screen_name': 'joel9one', 'name': 'chris long aka the cod god', 'id': '1128886760'}, {'screen_name': 'malcolmjenkins', 'name': 'malcolm jenkins', 'id': '35575327'}, {'screen_name': 'eagles', 'name': 'philadelphia eagles', 'id': '180503626'}]",['https://twitter.com/adamschefter/status/997209963637428224'],[],0,0,0,"['philly', 'resist', 'lovetrumpshate']",[],https://twitter.com/_WorstPimpEver/status/997215768772317184,False,0,0,,philadelphia,,,,,,[],,,,
997213728419565573,997213728419565573,2018-05-17 15:34:14 CDT,2018-05-17,15:34:14,-0500,38666044,unclesush,Pierre Escargot,,Real talk. Women who lie on men about abuse should be charged.,en,[],[],[],0,4,1,[],[],https://twitter.com/UncleSush/status/997213728419565573,False,,0,,philadelphia,,,,,,[],,,,
997210264922705920,997210264922705920,2018-05-17 15:20:29 CDT,2018-05-17,15:20:29,-0500,34311057,juvlaw1975,Juvenile Law Center,,@RepVanessaBrown speaking about VisionQuest. She wrote an op ed about the conditions there after several youth ran away due to horrible conditions. She also speaks of kids talking about running away due to abuse and neglect.  #SafelyHomePhilly,en,[],[],[],0,0,0,['safelyhomephilly'],[],https://twitter.com/JuvLaw1975/status/997210264922705920,False,,0,,philadelphia,,,,,,[],,,,
997210072106315777,997210072106315777,2018-05-17 15:19:43 CDT,2018-05-17,15:19:43,-0500,716688050,mrernestowens,Ernest Owens,,"Yesterday, Aaron Schlossberg, a lawyer, was harrassing Latinx people with racist bigotry openly on camera.  Today, he is now hiding his face with an umbrella when asked about it.   The Alt-Right isn't about that accountability life.    https://t.co/fnmGjQkDLD",en,[],['https://twitter.com/andraydomise/status/997171566323601408/video/1'],[],3,18,45,[],[],https://twitter.com/MrErnestOwens/status/997210072106315777,False,,0,,philadelphia,,,,,,[],,,,
997208965938384898,997060529737871360,2018-05-17 15:15:19 CDT,2018-05-17,15:15:19,-0500,2537520897,drjfp33,Prop Joe,,@Ducato_d_Milano @SiavoushF @TonyMellace7 That’s where you are wrong. Yelling at a red is not a reprehensible act. You want it to be bc you are a hater. But the punishment (you trashing his reputation ) does not fit the crime (yelling at a ref in 1 game). Grow up.,en,[],[],[],1,0,0,[],[],https://twitter.com/drjfp33/status/997208965938384898,False,,0,,philadelphia,,,,,,"[{'screen_name': 'Ducato_d_Milano', 'name': 'Stevie Z', 'id': '995922630304821248'}, {'screen_name': 'SiavoushF', 'name': 'Siavoush Fallahi', 'id': '166517967'}, {'screen_name': 'TonyMellace7', 'name': 'Art Vendelay ⚜ 🇮🇹', 'id': '1881723888'}]",,,,
997207039205150723,997207039205150723,2018-05-17 15:07:40 CDT,2018-05-17,15:07:40,-0500,168227814,kingxfinesse,Todoroki,,y’all really try to make this man the poster child for domestic violence. y’all gotta take Rihanna off too then.  https://t.co/QKNl76dpII,en,[],['https://twitter.com/complex/status/996162017022173184'],[],0,3,6,[],[],https://twitter.com/kingxfinesse/status/997207039205150723,False,https://twitter.com/complex/status/996162017022173184,0,,philadelphia,,,,,,[],,,,
997206576334364675,997206576334364675,2018-05-17 15:05:49 CDT,2018-05-17,15:05:49,-0500,469830482,bbg173,B,,I won’t be able to go to the gym for three days I’m low key having a panic attack,en,[],[],[],0,0,0,[],[],https://twitter.com/bbg173/status/997206576334364675,False,,0,,philadelphia,,,,,,[],,,,
997206462668660736,997185650762760192,2018-05-17 15:05:22 CDT,2018-05-17,15:05:22,-0500,9897602,rgodfrey,Ryan Godfrey,,"@walterkirn No great conspiracy necessary. Trump's strengths were abundant free media and low standards for veracity and accomplishment, plus a self-immolating opponent and what amounted to a Russian crime super PAC with no real need to coordinate.",en,[],[],[],2,0,1,[],[],https://twitter.com/rgodfrey/status/997206462668660736,False,,0,,philadelphia,,,,,,"[{'screen_name': 'walterkirn', 'name': 'Walter Kirn', 'id': '45516657'}]",,,,
997202199850733573,997181187280928768,2018-05-17 14:48:26 CDT,2018-05-17,14:48:26,-0500,245452873,jawnclaudvandam,JawnClaudVanDam,,"@Codymchenry3 @JordanClarke @CamInman @JerodBrown_ When that payment hit the account , he still has the gun charges too",en,[],[],[],2,0,0,[],[],https://twitter.com/JawnClaudVanDam/status/997202199850733573,False,,0,,philadelphia,,,,,,"[{'screen_name': 'Codymchenry3', 'name': 'Cody mchenry', 'id': '803773189264437249'}, {'screen_name': 'JordanClarke', 'name': 'J', 'id': '17175544'}, {'screen_name': 'CamInman', 'name': 'Cam Inman', 'id': '20737672'}, {'screen_name': 'JerodBrown_', 'name': 'Jerod Brown', 'id': '147084217'}]",,,,
997200508464058370,997171911376416768,2018-05-17 14:41:42 CDT,2018-05-17,14:41:42,-0500,128124947,conzmoleman,Warren Commission Test Skull,,@Jamesma87950747 @jasomnambulism @FoxNews @PressSec @POTUS so you are saying this person who already fears you /does/ need protection from you? sounds like a threat.,en,[],[],[],1,0,0,[],[],https://twitter.com/conzmoleman/status/997200508464058370,False,,0,,philadelphia,,,,,,"[{'screen_name': 'Jamesma87950747', 'name': 'James madison', 'id': '979529412495454208'}, {'screen_name': 'jasomnambulism', 'name': 'Jasomnambulism', 'id': '196202006'}, {'screen_name': 'FoxNews', 'name': 'Fox News', 'id': '1367531'}, {'screen_name': 'PressSec', 'name': 'Jen Psaki', 'id': '1349170292564905988'}, {'screen_name': 'POTUS', 'name': 'President Biden', 'id': '1349149096909668363'}]",,,,
997199757595594752,997199757595594752,2018-05-17 14:38:43 CDT,2018-05-17,14:38:43,-0500,3291687077,4361a4be893d4c0,Pedro Dixon,,"@CNN @ABC @NYTIMES @WASHINGTONPOST @MSNBC @CBSNEWS @FOXNEWS  Remember Trump discriminate against Hispanics,Blacks, Muslims. Carlin White Supremacist good fine people. Just called immigrants animals and blame it on MS-13. Trump never announced or told people is against racism.",en,"[{'screen_name': 'abc', 'name': 'abc news', 'id': '28785486'}, {'screen_name': 'nytimes', 'name': 'the new york times', 'id': '807095'}, {'screen_name': 'washingtonpost', 'name': 'the washington post', 'id': '2467791'}, {'screen_name': 'msnbc', 'name': 'msnbc', 'id': '2836421'}, {'screen_name': 'cbsnews', 'name': 'cbs news', 'id': '15012486'}, {'screen_name': 'foxnews', 'name': 'fox news', 'id': '1367531'}]",[],[],0,0,0,[],[],https://twitter.com/4361a4be893d4c0/status/997199757595594752,False,,0,,philadelphia,,,,,,[],,,,
997198726857920512,996550912570257410,2018-05-17 14:34:38 CDT,2018-05-17,14:34:38,-0500,64636022,wyldestorm,Wyldestorm,,@gohomejosh You came at me Chief? Especially with your racist nonsense. How could I not feel attacked. You don't know me but want to make racist assumptions.,en,[],[],[],0,0,0,[],[],https://twitter.com/WyldeStorm/status/997198726857920512,False,,0,,philadelphia,,,,,,"[{'screen_name': 'gohomejosh', 'name': 'gohomejosh', 'id': '1386427253995700225'}]",,,,
997198303703060480,997198303703060480,2018-05-17 14:32:57 CDT,2018-05-17,14:32:57,-0500,53111711,smarrrrie,official rocco hate account,,You do not need that type of ducking weapon  https://t.co/4LC56YYK1b,en,[],['https://twitter.com/evilemilie/status/996849457412091905'],[],0,0,0,[],[],https://twitter.com/smarrrrie/status/997198303703060480,False,0,0,,philadelphia,,,,,,[],,,,
997198238674538499,997198238674538499,2018-05-17 14:32:41 CDT,2018-05-17,14:32:41,-0500,2798026344,lewisblum,Lew Blum Towing,,"all monies collected from Drug bust and confiscated,should be reinvested,and given to the police department who made the arrest,that money could bulletproof ,all police vehicle windows .buy more and better body armor, body cameras for all police officers, the bucks stops here  https://t.co/LfR7lzyl8i",en,[],[],['https://pbs.twimg.com/media/DdbCUN0V4AAcCCx.jpg'],0,0,0,[],[],https://twitter.com/LewisBlum/status/997198238674538499,False,,1,https://pbs.twimg.com/media/DdbCUN0V4AAcCCx.jpg,philadelphia,,,,,,[],,,,
997198101420093441,997198101420093441,2018-05-17 14:32:09 CDT,2018-05-17,14:32:09,-0500,3291687077,4361a4be893d4c0,Pedro Dixon,,@CNN @ABC @NYTIMES @WASHINGTONPOST @MSNBC @CBSNEWS @FOXNEWS  Did anybody notice that this guy being racist against anybody other than white happened to be protesting in the middle of a group of people that is  pro Trump.,en,"[{'screen_name': 'abc', 'name': 'abc news', 'id': '28785486'}, {'screen_name': 'nytimes', 'name': 'the new york times', 'id': '807095'}, {'screen_name': 'washingtonpost', 'name': 'the washington post', 'id': '2467791'}, {'screen_name': 'msnbc', 'name': 'msnbc', 'id': '2836421'}, {'screen_name': 'cbsnews', 'name': 'cbs news', 'id': '15012486'}, {'screen_name': 'foxnews', 'name': 'fox news', 'id': '1367531'}]",[],[],0,0,0,[],[],https://twitter.com/4361a4be893d4c0/status/997198101420093441,False,,0,,philadelphia,,,,,,[],,,,
997197805038067712,997187493320626177,2018-05-17 14:30:58 CDT,2018-05-17,14:30:58,-0500,316289459,rebelyellin65,👁@m💯%ⓜⓨAnc∑stor§™,,"@Erich_Leproso That was #Amerikkkas 🇺🇸 all out, no holds barred assault on any remnants of leftover liberation culture from the 70's. We had a strong blk/brown bond 🇨🇺, linked via the same exact policy attacks geared towards us. #Amerikkka 🇺🇸 is a cut throat cunning bitch 🏛️🗽.",en,[],[],[],1,0,0,"['amerikkkas', 'amerikkka']",[],https://twitter.com/RebelYellin65/status/997197805038067712,False,,0,,philadelphia,,,,,,[],,,,
997197624989143043,997197624989143043,2018-05-17 14:30:15 CDT,2018-05-17,14:30:15,-0500,2798026344,lewisblum,Lew Blum Towing,,"all monies collected from Drug bust and confiscated,should be reinvested,and given to the police department who made the arrest,that money could bulletproof ,all police vehicle windows .buy more and better body armor, body cameras for all police officers, the bucks stops here  https://t.co/Xr28BHHFkI",en,[],[],['https://pbs.twimg.com/media/DdbBjPHV0AAp5e0.jpg'],0,0,0,[],[],https://twitter.com/LewisBlum/status/997197624989143043,False,,1,https://pbs.twimg.com/media/DdbBjPHV0AAp5e0.jpg,philadelphia,,,,,,[],,,,
997197514607677440,997185650762760192,2018-05-17 14:29:49 CDT,2018-05-17,14:29:49,-0500,9897602,rgodfrey,Ryan Godfrey,,"@walterkirn The relevant pre-election crime seems to be ""willingness to collude,"" along with some post-election obstruction, so 1. (His opponent defeated herself, with help from Russia.)",en,[],[],[],1,0,0,[],[],https://twitter.com/rgodfrey/status/997197514607677440,False,,0,,philadelphia,,,,,,"[{'screen_name': 'walterkirn', 'name': 'Walter Kirn', 'id': '45516657'}]",,,,
997197187900682241,997197187900682241,2018-05-17 14:28:31 CDT,2018-05-17,14:28:31,-0500,56722736,carlyinnj,💛Carly Says Things Be💗Kind 💚🌍 #JusticeMatters,,"No place to hide sorry a*s, he'll play victim. ⏩| #Racist lawyer runs scared from cameras outside home  https://t.co/CE0PY3VWjo via nypmetro",en,[],['https://nyp.st/2GsnR4t'],[],0,0,1,['racist'],[],https://twitter.com/carlyinNJ/status/997197187900682241,False,,0,,philadelphia,,,,,,[],,,,
997196993746427905,997196993746427905,2018-05-17 14:27:44 CDT,2018-05-17,14:27:44,-0500,327697369,coyneoftherealm,James C.Coyne,,"Yes, incident depression after a heart attack is often mild and I wonder some of it represents damage that is not really syndromal depression.  https://t.co/vVoHlTSyZ2",en,[],['https://twitter.com/ninakupper/status/997189958053060608'],[],0,0,1,[],[],https://twitter.com/CoyneoftheRealm/status/997196993746427905,False,https://twitter.com/ninakupper/status/997189958053060608,0,,philadelphia,,,,,,[],,,,
997196911231762432,997191854197235713,2018-05-17 14:27:25 CDT,2018-05-17,14:27:25,-0500,2798026344,lewisblum,Lew Blum Towing,,"@joshkodroff all monies collected from Drug bust and confiscated,should be reinvested,and given to the police department who made the arrest,that money could bulletproof ,all police vehicle windows .buy more and better body armor, body cameras for all police officers, the bucks stops here",en,[],[],[],0,0,0,[],[],https://twitter.com/LewisBlum/status/997196911231762432,False,,0,,philadelphia,,,,,,[],,,,
