id,conversation_id,created_at,date,time,timezone,user_id,username,name,place,tweet,language,mentions,urls,photos,replies_count,retweets_count,likes_count,hashtags,cashtags,link,retweet,quote_url,video,thumbnail,near,geo,source,user_rt_id,user_rt,retweet_id,reply_to,retweet_date,translate,trans_src,trans_dest
1020457133702250496,1020457133702250496,2018-07-20 18:55:14 CDT,2018-07-20,18:55:14,-0500,40492439,spookymun,Eileen Munson,,It's not surprising that most people working in the slaughterhouses murdering animals or seeing sentient beings being murdered  on a daily basis have PTSD or may have violent tendencies of the serial killer variety? It's!not!natural!,en,[],[],[],0,0,0,[],[],https://twitter.com/spookymun/status/1020457133702250496,False,https://twitter.com/MercyForAnimals/status/1020444491390517248,0,,new york city,,,,,,[],,,,
1020457005113364480,1020457005113364480,2018-07-20 18:54:43 CDT,2018-07-20,18:54:43,-0500,753582467894931456,jen_muschler,Jen Muschler,,"Why WOMEN like Whoopi, Maxine, Michelle Obama exhibit UNCONTRLLABLE anger in PUBLIC/on air?!   Page6: “Goldberg &amp;Pirro got into explosive argument backstage @“The View”-Pirro tried telling her she’s fought for victims &amp;Goldberg shouted ‘F–k you, get the f–k out of here""! Wow!",en,[],[],[],0,0,0,[],[],https://twitter.com/jen_muschler/status/1020457005113364480,False,,0,,new york city,,,,,,[],,,,
1020456713898676226,1020456713898676226,2018-07-20 18:53:34 CDT,2018-07-20,18:53:34,-0500,88826456,maggieserota,Maggie Serota,,One thing the Trump presidency taught me is that a shit ton of white collar crime can go unscrutinized as long as you don’t seek the highest office in the land.,en,[],[],[],2,19,183,[],[],https://twitter.com/maggieserota/status/1020456713898676226,False,,0,,new york city,,,,,,[],,,,
1020455851524489217,1020455851524489217,2018-07-20 18:50:08 CDT,2018-07-20,18:50:08,-0500,3257162043,homerikofficial,Homerik,,"NEW BLOG POST:  Dear Traveler,   It is our sworn duty to be absolutely truthful to you...  To remind you of the trials and tribulations that we all face, that we attack together...  Read more at  https://t.co/mc3uvrPKnG  https://t.co/JqKuRIAzh9",en,[],['https://www.homerik.org/news'],['https://pbs.twimg.com/media/DiljLy5XcAEWCCo.jpg'],0,0,1,[],[],https://twitter.com/HomerikOfficial/status/1020455851524489217,False,,1,https://pbs.twimg.com/media/DiljLy5XcAEWCCo.jpg,new york city,,,,,,[],,,,
1020455568794955776,1020455568794955776,2018-07-20 18:49:01 CDT,2018-07-20,18:49:01,-0500,49731221,iamtrenation,iamTReNATiON,"{'type': 'Point', 'coordinates': [40.65, -73.95]}",Note to self: Smile. Remember that the universe (the creator of all that is) is on your side; that you are a co-creator of (not a victim of) your reality. Choose the highest vibrations…  https://t.co/sNcSyE1HRJ,en,[],['https://www.instagram.com/p/BlePTlHDBv1/?utm_source=ig_twitter_share&igshid=1j1pmz1s8r5ju'],[],0,0,0,[],[],https://twitter.com/IamTReNATiON/status/1020455568794955776,False,,0,,new york city,,,,,,[],,,,
1020454358780170241,1020454358780170241,2018-07-20 18:44:12 CDT,2018-07-20,18:44:12,-0500,416769229,angryedblackman,Tommy Hawkins,"{'type': 'Point', 'coordinates': [40.797, -73.949]}",We knew papa John's owner was racist after his support for Trump and racist comments towards Kap... but using nigga in a conference call?!?! Really bruh... #PapaJohn #nigga…  https://t.co/VVAit5dRwQ,en,[],['https://www.instagram.com/p/BleOZxgDGK1/?utm_source=ig_twitter_share&igshid=jf5xf8wk4f39'],[],0,0,0,"['papajohn', 'nigga']",[],https://twitter.com/AngryEdBlackMan/status/1020454358780170241,False,,0,,new york city,,,,,,[],,,,
1020453563661799424,1020453563661799424,2018-07-20 18:41:03 CDT,2018-07-20,18:41:03,-0500,4269662482,13jtjr,J Torres,,"Ted Cruz on attack over ICE and impeachment, hoping to overcome Beto O'Rourke's fundraising ...   https://t.co/IgqjNXSJzG  Shared from my Google feed",en,[],['https://www.dallasnews.com/news/politics/2018/07/20/ted-cruz-attack-ice-impeachment-hoping-overcome-beto-orourkes-fundraising-prowess'],[],0,1,0,[],[],https://twitter.com/13JTJR/status/1020453563661799424,False,,0,,new york city,,,,,,[],,,,
1020452102982729728,1020433794325798912,2018-07-20 18:35:15 CDT,2018-07-20,18:35:15,-0500,16305138,halifaxbeard,Logan,,"@WayeMason @TwoWheelNeil @rapaport1010 @LindellSmithHFX @shawncleary @downtownpaul @tjhfx @GregZwicker @AnneWinters12 @IBIKEHFX You'd catch more flies with that than ""well we're not planning to enforce this except in egregious cases""- because that reeks of potential for abuse, and sounds out of touch. What you just said makes it sound like you give a shit.",en,[],[],[],0,0,0,[],[],https://twitter.com/halifaxbeard/status/1020452102982729728,False,,0,,new york city,,,,,,"[{'screen_name': 'WayeMason', 'name': 'Waye Mason 🇺🇦', 'id': '15495778'}, {'screen_name': 'rapaport1010', 'name': 'eric bubble rap -aport', 'id': '960975354'}, {'screen_name': 'LindellSmithHFX', 'name': 'Lindell Smith', 'id': '619467873'}, {'screen_name': 'shawncleary', 'name': 'Shawn Cleary', 'id': '69251362'}, {'screen_name': 'downtownpaul', 'name': 'paul mackinnon', 'id': '78357013'}, {'screen_name': 'tjhfx', 'name': 'TJ Maguire', 'id': '752223955'}, {'screen_name': 'GregZwicker', 'name': 'GREG ZWICKER', 'id': '378281007'}, {'screen_name': 'AnneWinters12', 'name': 'Anne Winters', 'id': '2169409356'}, {'screen_name': 'IBIKEHFX', 'name': 'Halifax Cycling', 'id': '201505154'}]",,,,
1020451476416626688,1020451476416626688,2018-07-20 18:32:45 CDT,2018-07-20,18:32:45,-0500,2675241528,hig68,Mrs HIG RN Vaxxed X 3 Leftist Maniac 🏳️‍🌈 🌊,,"I had look up Mike Cernovich.. Did you know Cernovich was charged with rape in 2003, but he denied the allegations.The charge was reduced to misdemeanor battery, for which he performed community service..  James Gunn said some  things..  Mike Cernovich actually did them..",en,[],[],[],0,0,3,[],[],https://twitter.com/hig68/status/1020451476416626688,False,,0,,new york city,,,,,,[],,,,
1020449328291360770,1020228361384341504,2018-07-20 18:24:13 CDT,2018-07-20,18:24:13,-0500,71756857,damanvenu,damanvenu,,@Shehla_Rashid @NancyJha Hugger’s papa. The bugger murdered couple of thousands of sikhs in 1984.None were prosecuted. The perfect murder!,en,[],[],[],0,0,0,[],[],https://twitter.com/damanvenu/status/1020449328291360770,False,,0,,new york city,,,,,,"[{'screen_name': 'Shehla_Rashid', 'name': 'Shehla Rashid', 'id': '194022170'}, {'screen_name': 'NancyJha', 'name': 'Nancy Jha', 'id': '2223490351'}]",,,,
1020448935507263489,1020425365301465088,2018-07-20 18:22:39 CDT,2018-07-20,18:22:39,-0500,21716596,mattaningram,Mattan Ingram,,"@smokeiris @IlIfadeIlI @kenklippenstein Seriously? If a girl gets drunk on her own and passes out and her date has sex with her that’s rape, and no force is involved. And it happens all the time. Did I really need to explain that? Cernovich is wrong about pretty much everything.",en,[],[],[],0,0,7,[],[],https://twitter.com/mattaningram/status/1020448935507263489,False,,0,,new york city,,,,,,"[{'screen_name': 'IlIfadeIlI', 'name': 'Fade', 'id': '527937455'}, {'screen_name': 'kenklippenstein', 'name': 'Ken Klippenstein', 'id': '1634248890'}]",,,,
1020447770598100992,1020019291318497280,2018-07-20 18:18:02 CDT,2018-07-20,18:18:02,-0500,16657726,waltfrasier,Walt Frasier (he/him),,@castlerockhulu @hulu @Comic_Con Another victim of 405 road rage?,en,[],[],[],0,0,0,[],[],https://twitter.com/waltfrasier/status/1020447770598100992,False,,0,,new york city,,,,,,"[{'screen_name': 'castlerockhulu', 'name': '𝙲𝚊𝚜𝚝𝚕𝚎 𝚁𝚘𝚌𝚔', 'id': '887439489047474176'}, {'screen_name': 'hulu', 'name': 'Hulu', 'id': '15033883'}, {'screen_name': 'Comic_Con', 'name': 'San Diego Comic-Con', 'id': '16786977'}]",,,,
1020446082353033219,1020446082353033219,2018-07-20 18:11:19 CDT,2018-07-20,18:11:19,-0500,21113237,nickgulotta,Nick Gulotta (He/Him),,"Every New Yorker has right to live, work, pray free from harassment or discrimination, regardless of religion or immigration status. 👏🏽👏🏽👏🏽 @NYCCHR @ArabAmericanNY @NYCImmigrants @mayorsCAU for today's Day of Visibility in Bay Ridge  https://t.co/ONFJUiLcyC",en,"[{'screen_name': 'nycchr', 'name': 'nyc human rights', 'id': '104265378'}, {'screen_name': 'arabamericanny', 'name': 'aaany', 'id': '281703471'}, {'screen_name': 'nycimmigrants', 'name': 'nyc immigrant affairs', 'id': '115670062'}, {'screen_name': 'mayorscau', 'name': ""nyc mayor's cau"", 'id': '214976391'}]",[],"['https://pbs.twimg.com/media/DilaR6NVsAApnWZ.jpg', 'https://pbs.twimg.com/media/DilaTLJVMAAUNNW.jpg']",0,6,20,[],[],https://twitter.com/NickGulotta/status/1020446082353033219,False,,1,https://pbs.twimg.com/media/DilaR6NVsAApnWZ.jpg,new york city,,,,,,[],,,,
1020445686448484353,1020445686448484353,2018-07-20 18:09:45 CDT,2018-07-20,18:09:45,-0500,13534712,ppelkonen,Paul J. Pelkonen 🦉🇫🇮,,Trump is flailing about the NFL and players kneeling in (constitutionally protected) protest. He is trying to whip this up because his former lawyer has tapes of him that are going to destroy his farce of an illegitimate presidency. He should #Resign,en,[],[],[],0,0,0,['resign'],[],https://twitter.com/ppelkonen/status/1020445686448484353,False,,0,,new york city,,,,,,[],,,,
1020445564415201281,1020442408679559168,2018-07-20 18:09:16 CDT,2018-07-20,18:09:16,-0500,251854061,eedoogie,Dave Brower,,@pbaez87 @TheMeadowlands Take your time. Traffic brutal...,en,[],[],[],2,0,0,[],[],https://twitter.com/eedoogie/status/1020445564415201281,False,,0,,new york city,,,,,,"[{'screen_name': 'TheMeadowlands', 'name': 'Meadowlands Racing', 'id': '23264001'}]",,,,
1020445479983861761,1020445479983861761,2018-07-20 18:08:56 CDT,2018-07-20,18:08:56,-0500,249510714,lenalovesstuff,Lena Anne Krug,,All the homophobia you can eat.,en,[],[],[],1,0,1,[],[],https://twitter.com/LenaLovesStuff/status/1020445479983861761,False,https://twitter.com/ABC13News/status/1020386671240630272,0,,new york city,,,,,,[],,,,
1020445095764680704,1020363613712809984,2018-07-20 18:07:24 CDT,2018-07-20,18:07:24,-0500,81961799,nzambarda,Nancy Zambarda,,@w_terrence @JudgeJeanine Judge Janine is intelligent and classy. Whoopster is racist and ugly inside and out! Thanks for the continuing parallel to republicans being smart and Dummycrats continuing to embarrass themselves.  Midterms will tell! Can’t wait!,en,[],[],[],0,0,0,[],[],https://twitter.com/nzambarda/status/1020445095764680704,False,,0,,new york city,,,,,,"[{'screen_name': 'w_terrence', 'name': 'Terrence K. Williams', 'id': '47293791'}, {'screen_name': 'JudgeJeanine', 'name': 'Jeanine Pirro', 'id': '29458079'}]",,,,
1020445040164917249,1020445040164917249,2018-07-20 18:07:11 CDT,2018-07-20,18:07:11,-0500,17992138,mciscart,Matthew,,First time shooting on a boat and I swear I'm used to it. I need to do this again asap!  https://t.co/A4gniDpd1e,en,[],[],['https://pbs.twimg.com/media/DilZWhRXsAEB2bE.jpg'],1,0,1,[],[],https://twitter.com/MCiscart/status/1020445040164917249,False,,1,https://pbs.twimg.com/media/DilZWhRXsAEB2bE.jpg,new york city,,,,,,[],,,,
1020444770525642753,1020352640415195137,2018-07-20 18:06:06 CDT,2018-07-20,18:06:06,-0500,1003704854676680704,jlikides,John Likides,,"@ReubenInTexas @NPR You are obviously a very kind person. Again, I apologize. I didn't mean to attack his memory.",en,[],[],[],1,0,0,[],[],https://twitter.com/JLikides/status/1020444770525642753,False,,0,,new york city,,,,,,"[{'screen_name': 'ReubenInTexas', 'name': 'r3', 'id': '546392600'}, {'screen_name': 'NPR', 'name': 'NPR', 'id': '5392522'}]",,,,
1020443667012743168,1020443667012743168,2018-07-20 18:01:43 CDT,2018-07-20,18:01:43,-0500,484920413,kaylajardinev,Kayla Jardine,,This is so horrific and offensive. I’m so disappointed that in 2018 we’re still pushing the ideas that:   1. Skinny is hot  2. Food restriction is safe  3. People will accept you if you’re thin  4. Thin actresses can wear fat suits  5. Violence is an appropriate response,en,[],[],[],1,2,14,[],[],https://twitter.com/KaylaJardineV/status/1020443667012743168,False,https://twitter.com/insatiable_/status/1019960051237294080,0,,new york city,,,,,,[],,,,
1020441091332591616,1020441091332591616,2018-07-20 17:51:29 CDT,2018-07-20,17:51:29,-0500,66496935,444ferns,Ferns,,Eyebrow threading is brutal u don’t get used to that,en,[],[],[],2,109,181,[],[],https://twitter.com/444Ferns/status/1020441091332591616,False,,0,,new york city,,,,,,[],,,,
1020439358514565121,1020439358514565121,2018-07-20 17:44:36 CDT,2018-07-20,17:44:36,-0500,55263193,lildelain,LiLsWord Grey Matter,,trump is a RACIST LYING CORRUPT MOB TIES TREASONOUS COWARD!!  trump KNEW RUSSIA WAS  CYBER ATTACKING THE ELECTION!!  #Arresttrump4Treason NOW     https://t.co/QotGUQEi40,en,[],['https://www.dailykos.com/stories/2018/7/19/1781882/-Bombshell-report-Donald-Trump-was-shown-definitive-proof-Putin-ordered-cyber-attacks-on-the-U-S'],[],0,1,1,['arresttrump4treason'],[],https://twitter.com/LiLDELain/status/1020439358514565121,False,,0,,new york city,,,,,,[],,,,
1020438906636984320,1020309476816183296,2018-07-20 17:42:48 CDT,2018-07-20,17:42:48,-0500,15698407,rjgnyc,RJG,,"@estrogenocide_ Given he doesn’t remotely care about his supporters I just figured it would be something that would get him in legal trouble, harm his business, or embarrass him in the eyes of the people whose approval he doesn’t want (ironically, rich New Yorkers).",en,[],[],[],0,0,0,[],[],https://twitter.com/rjgnyc/status/1020438906636984320,False,,0,,new york city,,,,,,"[{'screen_name': 'estrogenocide_', 'name': 'mona | منى🇵🇸', 'id': '23780848'}]",,,,
1020437499003506688,1020427415036874752,2018-07-20 17:37:13 CDT,2018-07-20,17:37:13,-0500,793948438597484545,mai_keez,EL Mikkey,,@artedemorir @sushitrash @richbrian They were photo shooting and they were leaving so I didn’t wanna bother them,en,[],[],[],1,0,0,[],[],https://twitter.com/mai_keez/status/1020437499003506688,False,,0,,new york city,,,,,,"[{'screen_name': 'artedemorir', 'name': '❦', 'id': '4703106920'}, {'screen_name': 'sushitrash', 'name': 'JOJI', 'id': '2579706949'}, {'screen_name': 'richbrian', 'name': 'Rich Brian', 'id': '178690996'}]",,,,
1020437458905952258,1019428882821369856,2018-07-20 17:37:03 CDT,2018-07-20,17:37:03,-0500,6355882,nrafter,Nick Rafter 🇺🇦,,@kimdesok @Mountain2M @JasonWSchaver @EmmaVigeland @Ocasio2018 It’s causing division but you guys are making it cause division. Crowley isn’t a threat. He isn’t running. He won’t get 5%. The WFP made a stupid decision and now they have to suck it up.,en,[],[],[],0,0,0,[],[],https://twitter.com/NRafter/status/1020437458905952258,False,,0,,new york city,,,,,,"[{'screen_name': 'Mountain2M', 'name': '🎙Mountain2Mountain Podcast', 'id': '890922555678359553'}, {'screen_name': 'JasonWSchaver', 'name': 'Drunken Progressive', 'id': '390458956'}, {'screen_name': 'EmmaVigeland', 'name': 'Emma Vigeland', 'id': '742453163098296320'}]",,,,
1020437023839186950,1020344722538319872,2018-07-20 17:35:19 CDT,2018-07-20,17:35:19,-0500,14545457,lawrences59,Yankee Ludi Champion,,@TeeOPatra_ Long Island white folks is extremely racist. Them and Staten Island. Crazy.,en,[],[],[],1,0,1,[],[],https://twitter.com/lawrenceS59/status/1020437023839186950,False,,0,,new york city,,,,,,"[{'screen_name': 'TeeOPatra_', 'name': 'tp', 'id': '859075591'}]",,,,
1020435988051611649,1020435988051611649,2018-07-20 17:31:12 CDT,2018-07-20,17:31:12,-0500,23126232,jessepstein,Sandwich Lady 🇺🇦,,This is terrible verging on abuse.,en,[],[],[],0,0,0,[],[],https://twitter.com/jessepstein/status/1020435988051611649,False,https://twitter.com/NBCNews/status/1020299562081312768,0,,new york city,,,,,,[],,,,
1020435686019788806,1020435686019788806,2018-07-20 17:30:00 CDT,2018-07-20,17:30:00,-0500,17501428,jenn_chowdhury,Jennifer Chowdhury,,I’m no longer going to respond to my internalized misogyny by cringing to my voice while transcribing interviews.,en,[],[],[],0,0,1,[],[],https://twitter.com/Jenn_Chowdhury/status/1020435686019788806,False,https://twitter.com/katchow/status/1020093219772796928,0,,new york city,,,,,,[],,,,
1020434611271360512,1020432992856969216,2018-07-20 17:25:44 CDT,2018-07-20,17:25:44,-0500,136706317,eligit,eli friedmann,,"@ClaraJeffery If she ignored the angry tweets (both the justified and unjustified) people would give up because they’d think they were doing something pointless. Instead she gets very defensive, often purposely missing the point being made. It just makes the anger worse.",en,[],[],[],0,0,0,[],[],https://twitter.com/eligit/status/1020434611271360512,False,,0,,new york city,,,,,,"[{'screen_name': 'ClaraJeffery', 'name': 'Clara Jeffery', 'id': '43412697'}]",,,,
1020433774709018624,1020433774709018624,2018-07-20 17:22:25 CDT,2018-07-20,17:22:25,-0500,1708517628,byrnemom,Carolyn Byrne ☘️,,Bronson Harmon should be ashamed of himself for “letting his emotions get the best of him”. PolyCal has every right to revoke his scholarship and dad should realize his son has anger issues.,en,[],[],[],1,0,1,[],[],https://twitter.com/ByrneMom/status/1020433774709018624,False,https://twitter.com/thehill/status/1020416327826239489,0,,new york city,,,,,,[],,,,
1020433531036684289,1020433531036684289,2018-07-20 17:21:27 CDT,2018-07-20,17:21:27,-0500,39603710,gsarafan,"Greg Sarafan, Esq.",,"It's not a ""scare"" if the perceived level of threat is equivalent to the actual threat. If anything a large portion of us are having Red Complacency.",en,[],[],[],0,3,9,[],[],https://twitter.com/GSarafan/status/1020433531036684289,False,https://twitter.com/davidhogg111/status/1020415673246208000,0,,new york city,,,,,,[],,,,
1020433278178930689,1020433278178930689,2018-07-20 17:20:26 CDT,2018-07-20,17:20:26,-0500,379297386,tatianycoeuvre,tatianyc.oeuvre,, https://t.co/hLZRM6Xewh The issue has been a source of anger for Russia -- which shares a border with both countries and does not want to see them join what it regards as a hostile military bloc.,en,[],['https://www.yahoo.com/news/putin-warns-nato-against-closer-ties-ukraine-georgia-171305604.html?.tsrc=daily_mail&uh_test=1_16'],[],1,0,1,[],[],https://twitter.com/tatianycoeuvre/status/1020433278178930689,False,,0,,new york city,,,,,,[],,,,
1020433207806881793,1020433207806881793,2018-07-20 17:20:10 CDT,2018-07-20,17:20:10,-0500,304087129,breeze_loo,Brian Sy,"{'type': 'Point', 'coordinates': [40.889745, -74.21661361]}","I flew into New York for vacation, and guess where my cousin took me today. @ Gun For Hire, LLC  https://t.co/pf9jl039rT",en,[],['https://www.instagram.com/p/BleEM1llwDy/?utm_source=ig_twitter_share&igshid=6bqz11xj4lgw'],[],0,0,1,[],[],https://twitter.com/Breeze_Loo/status/1020433207806881793,False,,0,,new york city,,,,,,[],,,,
1020431817579655169,1020401166625230848,2018-07-20 17:14:38 CDT,2018-07-20,17:14:38,-0500,951249258811936774,rockdi5,Rock Di,,@therealrkl @CarmineSabia @TomiLahren New York Wiretapping Law. ... New York makes it a crime to record to record or eavesdrop on an in-person or telephone conversation unless one party to the conversation consents. N.Y.,en,[],[],[],1,0,0,[],[],https://twitter.com/RockDi5/status/1020431817579655169,False,,0,,new york city,,,,,,"[{'screen_name': 'therealrkl', 'name': 'Robin Littlefield', 'id': '2862494769'}, {'screen_name': 'CarmineSabia', 'name': 'Carmine Sabia', 'id': '143169070'}, {'screen_name': 'TomiLahren', 'name': 'Tomi Lahren', 'id': '468646961'}]",,,,
1020431471520223232,1020431471520223232,2018-07-20 17:13:16 CDT,2018-07-20,17:13:16,-0500,516890011,iamsoularmada,Angello Pizarro 🌹,,"@cnn ..@msnbc...i just don't see why you wouldnt cover or air her speeches-- she,,and @SenSanders ...and and @keithellison ...and hundreds of other #Progressive candidates ARE the future,  the fix , the path to change leading us away from extremist capitalist's iron grip in D.C.",en,"[{'screen_name': 'msnbc', 'name': 'msnbc', 'id': '2836421'}, {'screen_name': 'sensanders', 'name': 'bernie sanders', 'id': '29442313'}, {'screen_name': 'keithellison', 'name': 'keith ellison', 'id': '14135426'}]",[],[],0,0,0,['progressive'],[],https://twitter.com/iamSoulArmada/status/1020431471520223232,False,https://twitter.com/People4Bernie/status/1020382296367554560,0,,new york city,,,,,,[],,,,
1020431324266549248,1020392201493401600,2018-07-20 17:12:41 CDT,2018-07-20,17:12:41,-0500,760542905480146944,botkitchenamy,Amy Drill,,@SenGillibrand @realDonaldTrump stop using #meddling. it was/IS #attack. ask @Experian_US @yahoo @wellfargo if data was #meddled,en,"[{'screen_name': 'experian_us', 'name': 'experian', 'id': '85951959'}, {'screen_name': 'yahoo', 'name': 'yahoo', 'id': '19380829'}, {'screen_name': 'wellfargo', 'name': 'chin nguyen', 'id': '47531985'}]",[],[],0,0,0,"['meddling', 'attack', 'meddled']",[],https://twitter.com/botkitchenamy/status/1020431324266549248,False,,0,,new york city,,,,,,"[{'screen_name': 'SenGillibrand', 'name': 'Kirsten Gillibrand', 'id': '72198806'}, {'screen_name': 'realDonaldTrump', 'name': 'Donald J. Trump', 'id': '25073877'}]",,,,
1020430270263169037,1020430270263169037,2018-07-20 17:08:29 CDT,2018-07-20,17:08:29,-0500,17941941,wqueens7,WesternQueensLand,"{'type': 'Point', 'coordinates': [40.74282444, -73.95457392]}","I wonder what preetbharara thinks of this post @innocence ・・・ The Crime Report recently published an informative Q+A with Professor Frank Baumgartner about his new book, Suspect Citizens:…  https://t.co/3o4dypbs27",en,"[{'screen_name': 'innocence', 'name': 'the innocence project', 'id': '16455297'}]",['https://www.instagram.com/p/BleD0TJFE_I/?utm_source=ig_twitter_share&igshid=ghqx3c3x5imo'],[],0,0,0,[],[],https://twitter.com/wqueens7/status/1020430270263169037,False,,0,,new york city,,,,,,[],,,,
1020430219897950210,1020430219897950210,2018-07-20 17:08:17 CDT,2018-07-20,17:08:17,-0500,27900953,shentonstage,Mark Shenton 💙,,"MAGGIE HABERMAN @maggieNYT: “@Twitter is now an anger video game for many users. It is the only platform on which people feel free to say things they’d never say to someone’s face. For me, it had become an enormous and pointless drain on my time and mental energy.” (2/2)",en,"[{'screen_name': 'maggienyt', 'name': 'maggie haberman', 'id': '93069110'}, {'screen_name': 'twitter', 'name': 'twitter', 'id': '783214'}]",[],[],0,0,5,[],[],https://twitter.com/ShentonStage/status/1020430219897950210,False,,0,,new york city,,,,,,[],,,,
1020430007552929792,1020430007552929792,2018-07-20 17:07:27 CDT,2018-07-20,17:07:27,-0500,61271910,ncmattingly11,Colleen Mattingly,,"“Knew I was a robber, first time that he saw me. Stealing hearts and running off and never saying sorry!” #RepTourEastRutherford Sec 332 Row 21 Seat 14 @taylornation13  https://t.co/bG5Q8RLvqs",en,"[{'screen_name': 'taylornation13', 'name': 'taylor nation', 'id': '80144576'}]",[],['https://pbs.twimg.com/media/DilLrYCUwAAQ4zM.jpg'],0,0,1,['reptoureastrutherford'],[],https://twitter.com/ncmattingly11/status/1020430007552929792,False,,1,https://pbs.twimg.com/media/DilLrYCUwAAQ4zM.jpg,new york city,,,,,,[],,,,
1020429936195264512,1020429936195264512,2018-07-20 17:07:10 CDT,2018-07-20,17:07:10,-0500,27900953,shentonstage,Mark Shenton 💙,,"MAGGIE HABERMAN @maggieNYT on @Twitter: “The viciousness, toxic partisan anger, intellectual dishonesty, motive-questioning &amp; sexism are at all-time highs. It is a place where people go to feed their anger, where the underbelly of free speech is at its most bilious.” (1/2)",en,"[{'screen_name': 'maggienyt', 'name': 'maggie haberman', 'id': '93069110'}, {'screen_name': 'twitter', 'name': 'twitter', 'id': '783214'}]",[],[],0,0,1,[],[],https://twitter.com/ShentonStage/status/1020429936195264512,False,,0,,new york city,,,,,,[],,,,
1020429488751108096,1020429488751108096,2018-07-20 17:05:23 CDT,2018-07-20,17:05:23,-0500,41302778,mayerfertig,Mayer Fertig,,I’ve seen this movie. #SpoilerAlert Hamas always keeps shooting.,en,[],[],[],0,1,2,['spoileralert'],[],https://twitter.com/MayerFertig/status/1020429488751108096,False,https://twitter.com/Jerusalem_Post/status/1020425380501413888,0,,new york city,,,,,,[],,,,
1020428626267959297,1020417925293932544,2018-07-20 17:01:57 CDT,2018-07-20,17:01:57,-0500,232688359,juliendecanali,Jules,,"@JCMacriNBA JR provides too much shooting, the Lakers are looking for STRICTLY mid-range players.",en,[],[],[],0,0,0,[],[],https://twitter.com/JulienDecanali/status/1020428626267959297,False,,0,,new york city,,,,,,"[{'screen_name': 'JCMacriNBA', 'name': 'Jonathan Macri', 'id': '4903730746'}]",,,,
1020428109890359296,1020428109890359296,2018-07-20 16:59:54 CDT,2018-07-20,16:59:54,-0500,379297386,tatianycoeuvre,tatianyc.oeuvre,," https://t.co/EovCReT2h1 Why anyone who tries to solve #SethRich murder ends up either dead, or nearly killed? #HillaryClinton's tentacles must be cut off. @Jack_Burkman are you reading this?",en,"[{'screen_name': 'jack_burkman', 'name': 'jack burkman', 'id': '2330662620'}]",['https://www.washingtonpost.com/local/public-safety/lobbyist-says-he-was-nearly-killed-by-man-he-hired-to-investigate-seth-richs-death/2018/03/19/a4261e48-2baa-11e8-8688-e053ba58f1e4_story.html?utm_term=.e2b577971554'],[],0,0,0,"['sethrich', 'hillaryclinton']",[],https://twitter.com/tatianycoeuvre/status/1020428109890359296,False,,0,,new york city,,,,,,[],,,,
