id,conversation_id,created_at,date,time,timezone,user_id,username,name,place,tweet,language,mentions,urls,photos,replies_count,retweets_count,likes_count,hashtags,cashtags,link,retweet,quote_url,video,thumbnail,near,geo,source,user_rt_id,user_rt,retweet_id,reply_to,retweet_date,translate,trans_src,trans_dest
999798408020873217,999072492751699968,2018-05-24 18:44:50 CDT,2018-05-24,18:44:50,-0500,1964828892,tiestotattoogrl,🇺🇸TiestoTattooGirl🇺🇸,,@HutchWrites @ArtAcevedo @NRATV @DLoesch I sure as hell don't think it's ok to murder unborn children... as you said taking children from families,en,[],[],[],1,0,0,[],[],https://twitter.com/TiestoTattooGrl/status/999798408020873217,False,,0,,houston,,,,,,"[{'screen_name': 'ArtAcevedo', 'name': 'Chief Art Acevedo', 'id': '554468819'}, {'screen_name': 'NRATV', 'name': 'NRATV', 'id': '17564591'}, {'screen_name': 'DLoesch', 'name': 'Dana Loesch', 'id': '7702542'}]",,,,
999797257317695488,999797257317695488,2018-05-24 18:40:16 CDT,2018-05-24,18:40:16,-0500,281998968,maddezmom,Beth Bryson,,"HRC agrees. “It is all but an act of war when such an attack is orchestrated by a foreign government.""  https://t.co/tAUPItJstm",en,[],['https://twitter.com/nbcnews/status/999771292680249344'],[],1,1,1,[],[],https://twitter.com/maddezmom/status/999797257317695488,False,https://twitter.com/nbcnews/status/999771292680249344,0,,houston,,,,,,[],,,,
999793900645638144,999793900645638144,2018-05-24 18:26:55 CDT,2018-05-24,18:26:55,-0500,385853680,spobtx5,Stephen O'Brien,,Was shooting the Astros on deck circle with a very wide angle lens before Tuesday night’s Giants-Astros game when Astros owner Jim Crane decided to walk by in the background. Will share more pics at a later..  https://t.co/N1oTaEmjy9,en,[],[],['https://pbs.twimg.com/media/Dd_7PVHU8AAgx9J.jpg'],0,0,0,[],[],https://twitter.com/SPOBTX5/status/999793900645638144,False,,1,https://pbs.twimg.com/media/Dd_7PVHU8AAgx9J.jpg,houston,,,,,,[],,,,
999792346299482113,999792346299482113,2018-05-24 18:20:45 CDT,2018-05-24,18:20:45,-0500,1411657154,oziyseris,Morning Star,,As long as your racist*  https://t.co/swL15dZ7pb,en,[],['https://twitter.com/vanesssaaa2/status/998709435458465792'],[],0,0,1,[],[],https://twitter.com/oziyseris/status/999792346299482113,False,0,0,,houston,,,,,,[],,,,
999791973769691136,999791973769691136,2018-05-24 18:19:16 CDT,2018-05-24,18:19:16,-0500,2208770664,unicorn_qbert,∝,,Uncontrollable anger gets worse every day,en,[],[],[],0,2,6,[],[],https://twitter.com/Unicorn_Qbert/status/999791973769691136,False,,0,,houston,,,,,,[],,,,
999791272146563072,999787770917937152,2018-05-24 18:16:29 CDT,2018-05-24,18:16:29,-0500,813981274897600512,malixxvx,mali 🍒,,@ovomarcc Im pretty sure there will be literally ended w him holding a gun,en,[],[],[],1,0,0,[],[],https://twitter.com/malixxvx/status/999791272146563072,False,,0,,houston,,,,,,"[{'screen_name': 'ovomarcc', 'name': 'marc', 'id': '4711634298'}]",,,,
999790464445239296,999790464445239296,2018-05-24 18:13:16 CDT,2018-05-24,18:13:16,-0500,2523369989,kenzzzzzz_17,kenzie,,The road rage is real today,en,[],[],[],0,0,0,[],[],https://twitter.com/kenzzzzzz_17/status/999790464445239296,False,,0,,houston,,,,,,[],,,,
999790058445025282,999790058445025282,2018-05-24 18:11:39 CDT,2018-05-24,18:11:39,-0500,879134553671073792,brebre__09,Bre 🥀,,I have a full on panic attack😕😂  https://t.co/buAnCOL77N,en,[],['https://twitter.com/aerooooo_/status/999114201925935109'],[],0,1,0,[],[],https://twitter.com/brebre__09/status/999790058445025282,False,https://twitter.com/aerooooo_/status/999114201925935109,0,,houston,,,,,,[],,,,
999786653311942656,999786653311942656,2018-05-24 17:58:07 CDT,2018-05-24,17:58:07,-0500,1172791782,cfrights,C. Fletch,,10 Modest Steps to Cut Gun Violence  https://t.co/EMln0mLU2t,en,[],['https://nyti.ms/2LpA1iC'],[],0,0,1,[],[],https://twitter.com/CFrights/status/999786653311942656,False,,0,,houston,,,,,,[],,,,
999785463790452736,999785463790452736,2018-05-24 17:53:24 CDT,2018-05-24,17:53:24,-0500,126838103,mptw96,TW ❤️‍🔥,,"No, he shouldn’t be out period. He’s a danger to humanity. He’s a killer.  https://t.co/zZ2j6VdMow",en,[],['https://twitter.com/steveabc13/status/999762040356032517'],[],0,0,0,[],[],https://twitter.com/MPTW96/status/999785463790452736,False,https://twitter.com/steveabc13/status/999762040356032517,0,,houston,,,,,,[],,,,
999784224176553986,999784224176553986,2018-05-24 17:48:28 CDT,2018-05-24,17:48:28,-0500,4623940842,wesleyjones014,Wesley Jones,,“You can’t come to Texas with a loaded gun” - Kdodd,en,[],[],[],0,0,0,[],[],https://twitter.com/wesleyjones014/status/999784224176553986,False,,0,,houston,,,,,,[],,,,
999783540576272384,999783540576272384,2018-05-24 17:45:45 CDT,2018-05-24,17:45:45,-0500,327729718,nkjm8d,Natalie says:,,“Protest on your own time” is the most ignorant thing I’ve ever heard. Do you understand... at all... what it means... to protest something... ?????,en,[],[],[],0,0,3,[],[],https://twitter.com/NKJM8D/status/999783540576272384,False,,0,,houston,,,,,,[],,,,
999780223859085313,999780223859085313,2018-05-24 17:32:35 CDT,2018-05-24,17:32:35,-0500,157759844,juliacantu,Julia Cantu,,"i was bullied, dealt w serious mental illness, and ultimately physically hurt myself in the process but never thought about hurting someone else??? this just doesn't make sense. he is a murderer not a victim.  https://t.co/KvzaXDYzWj",en,[],['https://twitter.com/apcentralregion/status/998952797637890048'],[],0,3,3,[],[],https://twitter.com/juliacantu/status/999780223859085313,False,https://twitter.com/apcentralregion/status/998952797637890048,0,,houston,,,,,,[],,,,
999779896275623936,999642415072935937,2018-05-24 17:31:16 CDT,2018-05-24,17:31:16,-0500,282125277,mangonadamami,LaTina Fey,,@tanksfeet You want the black players on NFL teams to go back to Africa.. when they were brought here in chains. Also why not call out the white football players and team owner that’s against this policy too. Cause you’re a racist.  https://t.co/UTzdAWaYx0,en,[],[],['https://pbs.twimg.com/tweet_video_thumb/Dd_ugwqV0AEODxK.jpg'],0,1,16,[],[],https://twitter.com/MangonadaMami/status/999779896275623936,False,,1,https://pbs.twimg.com/tweet_video_thumb/Dd_ugwqV0AEODxK.jpg,houston,,,,,,"[{'screen_name': 'tanksfeet', 'name': 'tank', 'id': '4700764517'}]",,,,
999778201231540224,999699655255474176,2018-05-24 17:24:32 CDT,2018-05-24,17:24:32,-0500,2275654446,gsib2453,IB,,"@MontePooleNBCS All that really matters is if Igoudala’s biceps are ok, Houston gonna need some gun control legislation ASAP",en,[],[],[],0,0,1,[],[],https://twitter.com/GSIB2453/status/999778201231540224,False,,0,,houston,,,,,,"[{'screen_name': 'MontePooleNBCS', 'name': 'Monte Poole', 'id': '489750466'}]",,,,
999778199004332032,999778199004332032,2018-05-24 17:24:32 CDT,2018-05-24,17:24:32,-0500,261469386,winkwestwood,🐻+🍯=❤️,"{'type': 'Point', 'coordinates': [29.746407, -95.36563]}","People, mostly white people, trying to spin that Mahmoud Abdul-Rauf got blackballed for his protest during the anthem. And that’s far from the truth",en,[],[],[],0,0,0,[],[],https://twitter.com/WinkWestwood/status/999778199004332032,False,,0,,houston,,,,,,[],,,,
999777627073167362,999777627073167362,2018-05-24 17:22:15 CDT,2018-05-24,17:22:15,-0500,531715282,_sheskimberly,winner.,,ugh can racist idiots stop having kids. it’s disgusting how y’all raise them  https://t.co/ONT1Uz5Ool,en,[],['https://twitter.com/soufesha/status/998917618441641984'],[],0,0,0,[],[],https://twitter.com/_ShesKimberly/status/999777627073167362,False,0,0,,houston,,,,,,[],,,,
999775210206248960,999775210206248960,2018-05-24 17:12:39 CDT,2018-05-24,17:12:39,-0500,378951887,slickricksham_,Doogie2foolie,,"Just a warning ⚠️ I’m with all Road Rage shit meaning fights , pistol play , and wrecked cars ,just letting it be known",en,[],[],[],0,0,0,[],[],https://twitter.com/SlickRicksHam_/status/999775210206248960,False,,0,,houston,,,,,,[],,,,
999774501037576193,999774501037576193,2018-05-24 17:09:50 CDT,2018-05-24,17:09:50,-0500,67708945,melidmgz,M. Dominguez,,Not just a suspect. Savage crime so screw his request for reasonable bond.  https://t.co/qFMRw5Nhox,en,[],['https://twitter.com/abc13houston/status/999758231277780993'],[],0,0,0,[],[],https://twitter.com/melidmgz/status/999774501037576193,False,https://twitter.com/abc13houston/status/999758231277780993,0,,houston,,,,,,[],,,,
999774307390668800,999774307390668800,2018-05-24 17:09:04 CDT,2018-05-24,17:09:04,-0500,391056988,12k_poppa,Poppa Hyuga,,"on Morgan Freeman behalf das why sexual harassment shouldn’t b so loose , bro simply could have said dey look beautiful and dey would have grounds to defame his name",en,[],[],[],0,1,2,[],[],https://twitter.com/12k_poppa/status/999774307390668800,False,,0,,houston,,,,,,[],,,,
