id,conversation_id,created_at,date,time,timezone,user_id,username,name,place,tweet,language,mentions,urls,photos,replies_count,retweets_count,likes_count,hashtags,cashtags,link,retweet,quote_url,video,thumbnail,near,geo,source,user_rt_id,user_rt,retweet_id,reply_to,retweet_date,translate,trans_src,trans_dest
1006686481916755969,1006637373629722624,2018-06-12 18:55:35 CDT,2018-06-12,18:55:35,-0500,55105678,devindishes,Devin,,"@Hugall_journo @rufo_ruffneck @forddeborah3 @Velma40844061 @realDonaldTrump Natural disasters aren’t a President’s fault, genius. Also, 4,600 didn’t die in Puerto Rico. It’s a lie. Look up the WaPo article. Also, maybe parents shouldn’t be stupid enough to commit a crime so they won’t be separated. Obama did this. Stop defending crime! 🤷🏻‍♂️",en,[],[],[],2,0,1,[],[],https://twitter.com/DevinDishes/status/1006686481916755969,False,,0,,new york city,,,,,,"[{'screen_name': 'rufo_ruffneck', 'name': 'RuFO', 'id': '4633894692'}, {'screen_name': 'forddeborah3', 'name': 'Deborah ford', 'id': '3068121651'}, {'screen_name': 'Velma40844061', 'name': 'Velma', 'id': '976911476068880386'}, {'screen_name': 'realDonaldTrump', 'name': 'Donald J. Trump', 'id': '25073877'}]",,,,
1006686334524813313,1006686214018207745,2018-06-12 18:55:00 CDT,2018-06-12,18:55:00,-0500,960402608,crolinss,Caroline Madden 🦄,,@ChattingCat I had a heart attack,en,[],[],[],0,0,0,[],[],https://twitter.com/crolinss/status/1006686334524813313,False,,0,,new york city,,,,,,"[{'screen_name': 'ChattingCat', 'name': 'Virginia ♀', 'id': '24100418'}]",,,,
1006684626759413761,1006684626759413761,2018-06-12 18:48:12 CDT,2018-06-12,18:48:12,-0500,258592024,marquispick_,Marquis Pickering,,I think imma take a break from shooting people 😂 IG: _PicksPics  https://t.co/rVWXt4wqfh,en,[],[],"['https://pbs.twimg.com/media/Dfh2UyXVAAAS_xM.jpg', 'https://pbs.twimg.com/media/Dfh2UyXUcAAk2P3.jpg', 'https://pbs.twimg.com/media/Dfh2UyXUwAAE22Z.jpg']",2,27,96,[],[],https://twitter.com/MarquisPick_/status/1006684626759413761,False,,1,https://pbs.twimg.com/media/Dfh2UyXVAAAS_xM.jpg,new york city,,,,,,[],,,,
1006684170020638721,1006652039919800320,2018-06-12 18:46:24 CDT,2018-06-12,18:46:24,-0500,52617572,mikecherepko,Mike Cherepko,,“There has been a huge link between the school shootings and video games.”  And she’s asking if teens need more technology. People applaud her! (He has already said customers under 18 won’t be allowed to play violent games.),en,[],[],[],1,1,5,[],[],https://twitter.com/mikecherepko/status/1006684170020638721,False,,0,,new york city,,,,,,[],,,,
1006683280404566020,1006683280404566020,2018-06-12 18:42:51 CDT,2018-06-12,18:42:51,-0500,39603710,gsarafan,"Greg Sarafan, Esq.",,"1 in 13 African-American adults cannot vote bc of a felony conviction. In FL, KY, TN and VA, more than 1 in 5 African-Americans cannot vote. A black person is far more likely to be convicted of a felony than a white person who committed the *same crime*.   https://t.co/5onLctMHLz",en,[],['https://www.nytimes.com/interactive/2016/10/06/us/unequal-effect-of-laws-that-block-felons-from-voting.html'],[],2,27,31,[],[],https://twitter.com/GSarafan/status/1006683280404566020,False,,0,,new york city,,,,,,[],,,,
1006683055900299264,1006637373629722624,2018-06-12 18:41:58 CDT,2018-06-12,18:41:58,-0500,55105678,devindishes,Devin,,"@ChadReighard @forddeborah3 @Velma40844061 @realDonaldTrump If the “evidence is all over,” and there’s no question a crime was committed, then why are we still in the same place as 2016. Please show your evidence that makes you more in the know that the government.",en,[],[],[],3,0,0,[],[],https://twitter.com/DevinDishes/status/1006683055900299264,False,,0,,new york city,,,,,,"[{'screen_name': 'ChadReighard', 'name': 'Chad Reighard', 'id': '898013691085549572'}, {'screen_name': 'forddeborah3', 'name': 'Deborah ford', 'id': '3068121651'}, {'screen_name': 'Velma40844061', 'name': 'Velma', 'id': '976911476068880386'}, {'screen_name': 'realDonaldTrump', 'name': 'Donald J. Trump', 'id': '25073877'}]",,,,
1006682509109878784,1006496229210099712,2018-06-12 18:39:48 CDT,2018-06-12,18:39:48,-0500,1411902361,chayesmatthew,Matthew Chayes,,@KeeganNYC Define “crime.”,en,[],[],[],0,0,0,[],[],https://twitter.com/chayesmatthew/status/1006682509109878784,False,,0,,new york city,,,,,,"[{'screen_name': 'KeeganNYC', 'name': 'Keegan Stephan', 'id': '93879982'}]",,,,
1006681730768662528,1006681730768662528,2018-06-12 18:36:42 CDT,2018-06-12,18:36:42,-0500,2183238350,chefjustrob,Chef Just Rob,,"You want gun laws to change? Dress a bunch of people in hijabs and burkas and turbans and walk them into any gun store in a red state and have them buy lots and lots of guns. Big guns. Make sure they are speaking in a foreign accent. It doesn’t matter which one. German, Spanish..",en,[],[],[],0,0,1,[],[],https://twitter.com/chefjustrob/status/1006681730768662528,False,,0,,new york city,,,,,,[],,,,
1006681070513934336,1006661023376592898,2018-06-12 18:34:05 CDT,2018-06-12,18:34:05,-0500,1711620576,afarray,❄❄❄ Bodak Red ☃☃❄☃,,@JajTyson @Mackingday More like they protest too much. Harry wrote that letter because imo he was genuinely shocked and sickened by the racism of the British tabs. They got mad because he called them out not because it wasn't true,en,[],[],[],1,0,3,[],[],https://twitter.com/AFarray/status/1006681070513934336,False,,0,,new york city,,,,,,"[{'screen_name': 'JajTyson', 'name': 'jaj&tyson', 'id': '921489584944492545'}, {'screen_name': 'Mackingday', 'name': 'Maria', 'id': '363019229'}]",,,,
1006680852737163264,1006680852737163264,2018-06-12 18:33:13 CDT,2018-06-12,18:33:13,-0500,507855677,lustclouds,zah zah,,im about to catch an assault case,en,[],[],[],0,0,0,[],[],https://twitter.com/lustclouds/status/1006680852737163264,False,,0,,new york city,,,,,,[],,,,
1006680573174218754,1006680573174218754,2018-06-12 18:32:06 CDT,2018-06-12,18:32:06,-0500,39663864,n_th_n_,N th n — #FreeThemAll,,Criminalization of domestic and sexual violence survivors is rampant and morally repugnant.  #CuomoMIA #FreeThemNY  https://t.co/rj3egWQ8IZ,en,[],['https://twitter.com/survivepunish/status/1006670930897088512'],[],0,0,4,"['cuomomia', 'freethemny']",[],https://twitter.com/n_th_n_/status/1006680573174218754,False,https://twitter.com/survivepunish/status/1006670930897088512,0,,new york city,,,,,,[],,,,
1006678686236598279,1006678686236598279,2018-06-12 18:24:36 CDT,2018-06-12,18:24:36,-0500,42377905,jaydelovell,Jayde Lovell,,Who will lead us? Who will rid science of sexual harassment? *crickets* #ScienceToo  https://t.co/Z3YKGA86HD,en,[],[],[],2,7,12,['sciencetoo'],[],https://twitter.com/JaydeLovell/status/1006678686236598279,False,,1,https://pbs.twimg.com/ext_tw_video_thumb/1006678593710313472/pu/img/dr-VbM8ABemsDJ4r.jpg,new york city,,,,,,[],,,,
1006678302784925696,1006664539411222528,2018-06-12 18:23:05 CDT,2018-06-12,18:23:05,-0500,260478229,dwallacewells,David Wallace-Wells,,@chrislhayes @Nate_Cohn @EsotericCD He has a domestic assault charge in his past.,en,[],[],[],0,0,1,[],[],https://twitter.com/dwallacewells/status/1006678302784925696,False,,0,,new york city,,,,,,"[{'screen_name': 'chrislhayes', 'name': 'Chris Hayes', 'id': '4207961'}, {'screen_name': 'Nate_Cohn', 'name': 'Nate Cohn', 'id': '463765807'}, {'screen_name': 'EsotericCD', 'name': 'Jeff B. is *BOX OFFICE POISON*', 'id': '161163311'}]",,,,
1006678274460782594,1006678274460782594,2018-06-12 18:22:58 CDT,2018-06-12,18:22:58,-0500,42640432,totaltrafficnyc,Total Traffic NYC,"{'type': 'Point', 'coordinates': [40.87832, -73.87015]}","Accident cleared in #Bronx:OnTheBronxRiverParkway on The Bronx River Pkwy NB at Gun Hl Rd, stop and go traffic back to 174th St #traffic",en,[],[],[],0,0,0,"['bronx', 'traffic']",[],https://twitter.com/TotalTrafficNYC/status/1006678274460782594,False,,0,,new york city,,,,,,[],,,,
1006677999373160448,1006677999373160448,2018-06-12 18:21:52 CDT,2018-06-12,18:21:52,-0500,195882037,milobogardus,getting a lot of scarsdale vibes from this,,American panic over child sex trafficking is genuinely confounding/disturbing/fascinating to me,en,[],[],[],1,0,0,[],[],https://twitter.com/milobogardus/status/1006677999373160448,False,,0,,new york city,,,,,,[],,,,
1006677981450919937,1006677981450919937,2018-06-12 18:21:48 CDT,2018-06-12,18:21:48,-0500,26284998,luiscueto,LC,,"Florence, Troye and now Lykke Li playing on the same damn day.  Homophobia at its worst.",en,[],[],[],0,0,0,[],[],https://twitter.com/luiscueto/status/1006677981450919937,False,,0,,new york city,,,,,,[],,,,
1006677527790870530,1006677527790870530,2018-06-12 18:20:00 CDT,2018-06-12,18:20:00,-0500,35745054,rudyinnewyork,Rudy Antonio,,Don’t go letting Your Blind Faith in your Nazi Ringleader @realDonaldTrump get Your Asses Kicked on a #ViralVideo ... WATCH HOW THE FUCK YOU ADDRESS US ....  #Racism #Equality #Race #World  #Trump #Racist  https://t.co/bnFumQyLbr,en,"[{'screen_name': 'realdonaldtrump', 'name': 'donald j. trump', 'id': '25073877'}]",[],['https://pbs.twimg.com/media/Dfhv36yXkAAoocb.jpg'],0,0,0,"['viralvideo', 'racism', 'equality', 'race', 'world', 'trump', 'racist']",[],https://twitter.com/RudyInNewYork/status/1006677527790870530,False,,1,https://pbs.twimg.com/media/Dfhv36yXkAAoocb.jpg,new york city,,,,,,[],,,,
1006676401360162823,1006676401360162823,2018-06-12 18:15:31 CDT,2018-06-12,18:15:31,-0500,559175202,anthonycurtis68,Anthony Curtis,,🤔 could TB12 be a MVP threat after missing his first four games? Nah. Could he thrive with Gronk our? Nah. 😂 I think people who doubt Brady just fuel his 🔥.  https://t.co/SHok5LnVjM,en,[],['https://twitter.com/thehateful8ff/status/1006530065113538561'],[],0,0,7,[],[],https://twitter.com/AnthonyCurtis68/status/1006676401360162823,False,https://twitter.com/thehateful8ff/status/1006530065113538561,0,,new york city,,,,,,[],,,,
1006676302559145984,1006637373629722624,2018-06-12 18:15:08 CDT,2018-06-12,18:15:08,-0500,55105678,devindishes,Devin,,"@MyDogisHarv @keith_troke @forddeborah3 @Velma40844061 @realDonaldTrump 😂😂😂😂😂 Actually, no, I have a full time salary/benefit job where I’m a manager and performer.  But thanks for playing. And how mature of you to try and personally attack me instead of presenting me with facts to change my mind. Grow up, child!",en,[],[],[],1,0,2,[],[],https://twitter.com/DevinDishes/status/1006676302559145984,False,,0,,new york city,,,,,,"[{'screen_name': 'MyDogisHarv', 'name': 'Blue cheese or ranch', 'id': '816453600733822976'}, {'screen_name': 'keith_troke', 'name': 'Keith Troke', 'id': '4252038980'}, {'screen_name': 'forddeborah3', 'name': 'Deborah ford', 'id': '3068121651'}, {'screen_name': 'Velma40844061', 'name': 'Velma', 'id': '976911476068880386'}, {'screen_name': 'realDonaldTrump', 'name': 'Donald J. Trump', 'id': '25073877'}]",,,,
1006676039173574657,1006567170090852352,2018-06-12 18:14:05 CDT,2018-06-12,18:14:05,-0500,74709822,sumitengineer,krafty Vanguard,,"@sharkeatsman @Swainstache_CR @Negrallo @DFPSheikh17 @T1gigz @CrucibleRadio @Josh_Hamrick Low TTK on a primary weapon like HC is absolutely must as shotgun spam will just snowball . This is the best way to ""counter"" in close range .""DON'T FORGET WHAT Happened  WITH D1 SHOT GUN SPAM "". It was not the ""SNIPING but ""APE-ING"" that broke the balance , Rest is HISTORY .  https://t.co/bbjaMJ9CYD",en,[],[],['https://pbs.twimg.com/tweet_video_thumb/Dfhugj9XcAAhEB7.jpg'],0,0,0,[],[],https://twitter.com/sumitengineer/status/1006676039173574657,False,,1,https://pbs.twimg.com/tweet_video_thumb/Dfhugj9XcAAhEB7.jpg,new york city,,,,,,"[{'screen_name': 'sharkeatsman', 'name': 'Jon Weisnewski', 'id': '152894637'}, {'screen_name': 'Negrallo', 'name': 'Negrallo', 'id': '794588101075173376'}, {'screen_name': 'T1gigz', 'name': 'Connor White', 'id': '1062517987473743873'}, {'screen_name': 'CrucibleRadio', 'name': 'Crucible Radio', 'id': '1114262435660087296'}, {'screen_name': 'Josh_Hamrick', 'name': 'Hamrick @FirewalkStudios', 'id': '14531269'}]",,,,
1006675724323913728,1006675724323913728,2018-06-12 18:12:50 CDT,2018-06-12,18:12:50,-0500,90435637,tedshaffrey,Ted Shaffrey,,This Is What a Nuclear Attack in New York Would Look Like  https://t.co/psMkHYB2H9 via @intelligencer,en,"[{'screen_name': 'intelligencer', 'name': 'intelligencer', 'id': '45565185'}]",['http://nymag.com/daily/intelligencer/2018/06/what-a-nuclear-attack-in-new-york-would-look-like.html?utm_source=tw&utm_medium=s3&utm_campaign=sharebutton-t'],[],0,0,0,[],[],https://twitter.com/TedShaffrey/status/1006675724323913728,False,,0,,new york city,,,,,,[],,,,
1006675478520975362,1006631397669425152,2018-06-12 18:11:51 CDT,2018-06-12,18:11:51,-0500,747981800903946240,metsavenue,MetsAvenue,,"@JGCardinale The only thing I could think is, even with Nimmo getting on base the #Mets haven’t been able to do anything about it. So perhaps now if Conforto and Frazier happen to get on, the one consistent offensive threat, Nimmo, could do some damage #LGM",en,[],[],[],1,0,1,"['mets', 'lgm']",[],https://twitter.com/MetsAvenue/status/1006675478520975362,False,,0,,new york city,,,,,,[],,,,
1006674924730187776,1006278395401986048,2018-06-12 18:09:39 CDT,2018-06-12,18:09:39,-0500,26753804,rebbacaprice,Sandstone,,@TimJGraham @newsbusters What gives a woman the right to murder her child?,en,[],[],[],0,0,0,[],[],https://twitter.com/Rebbacaprice/status/1006674924730187776,False,,0,,new york city,,,,,,"[{'screen_name': 'TimJGraham', 'name': 'Tim Graham', 'id': '22033805'}, {'screen_name': 'newsbusters', 'name': 'NewsBusters', 'id': '45190383'}]",,,,
1006674917201514496,1006637373629722624,2018-06-12 18:09:38 CDT,2018-06-12,18:09:38,-0500,55105678,devindishes,Devin,,"@EthanHoosiers @forddeborah3 @Velma40844061 @realDonaldTrump Oh, I know. But I get so much joy out of the liberals having complete meltdowns! Plus, watching them attack those who think differently just continues to help validate that I’ll never be a liberal again.",en,[],[],[],0,0,1,[],[],https://twitter.com/DevinDishes/status/1006674917201514496,False,,0,,new york city,,,,,,"[{'screen_name': 'EthanHoosiers', 'name': 'Ethan Smith', 'id': '1296056629'}, {'screen_name': 'forddeborah3', 'name': 'Deborah ford', 'id': '3068121651'}, {'screen_name': 'Velma40844061', 'name': 'Velma', 'id': '976911476068880386'}, {'screen_name': 'realDonaldTrump', 'name': 'Donald J. Trump', 'id': '25073877'}]",,,,
1006674774968455171,1006674774968455171,2018-06-12 18:09:04 CDT,2018-06-12,18:09:04,-0500,336856945,killahertz_,kHz,,"Honestly feel ultimate is the best thing for the scene. 64/melee/pm have threat of their players switching, and s4 players can switch w/o feeling like theyre “betraying their game”. And hopefully its a bit faster and more aggressive",en,[],[],[],1,0,2,[],[],https://twitter.com/killahertz_/status/1006674774968455171,False,,0,,new york city,,,,,,[],,,,
1006673668485853185,1006673668485853185,2018-06-12 18:04:40 CDT,2018-06-12,18:04:40,-0500,319205360,radiobren,B,,"Since Tyler has been the butt of the joke in so, so, so many photoshops &amp; .gifs (a ton of great ones, he's such an easy target) it would be hypocritical of me to retaliate at this time. BUT(!!), do it again, and you'll get some smoke  https://t.co/fLjBg4FJ6w",en,[],['https://twitter.com/tyleroday/status/1006590541210050560'],[],0,0,2,[],[],https://twitter.com/RadioBren/status/1006673668485853185,False,0,0,,new york city,,,,,,[],,,,
1006672041565655040,1006317746626400256,2018-06-12 17:58:12 CDT,2018-06-12,17:58:12,-0500,400003895,jamie2568,jamie lawenda,,@tonyschwartz having a different opinion isn’t necessarily rage fyi,en,[],[],[],0,0,0,[],[],https://twitter.com/jamie2568/status/1006672041565655040,False,,0,,new york city,,,,,,"[{'screen_name': 'tonyschwartz', 'name': 'Tony Schwartz', 'id': '17579312'}]",,,,
1006669648090234880,1006669648090234880,2018-06-12 17:48:41 CDT,2018-06-12,17:48:41,-0500,934617576,askdrlloyd,Lloyd Sederer MD,,"Join me, NYT writer Dr. Richard Friedman, WNYC host @TalkOnPointe &amp; Terrell Jones NY Harm Reduction Educators @brooklynhistory, Wed, 6.13.2018, 6:30 pm. We discuss the opioid epidemic in NYC and everywhere.  https://t.co/A5BPm7sNXf @NYTHealth @perripeltz @kellyryanobrien @NYAMNYC",en,"[{'screen_name': 'talkonpointe', 'name': 'alexandra botti', 'id': '2295136615'}, {'screen_name': 'brooklynhistory', 'name': 'center for brooklyn history', 'id': '29141019'}, {'screen_name': 'nythealth', 'name': 'nyt health', 'id': '1769551'}, {'screen_name': 'perripeltz', 'name': 'perri peltz', 'id': '84340664'}, {'screen_name': 'kellyryanobrien', 'name': 'kelly chamath palihapitiya fanpage', 'id': '21586778'}, {'screen_name': 'nyamnyc', 'name': 'the new york academy of medicine', 'id': '318424022'}]",['https://opioidsnyc.eventbrite.com/'],[],1,0,1,[],[],https://twitter.com/askdrlloyd/status/1006669648090234880,False,,0,,new york city,,,,,,[],,,,
1006669560563552256,1006669560563552256,2018-06-12 17:48:20 CDT,2018-06-12,17:48:20,-0500,141286022,maketheroadny,Make the Road NY 🦋,,"“Homophobia pa’ fuera! Xenophobia pa’ fuera! Transphobia pa’ fuera!”  The Jackson Heights community responds to TWO hate violence incidents that happened last week. We won’t stand for this, especially during #PrideMonth!  https://t.co/zWqYUxvDTW",en,[],[],['https://pbs.twimg.com/media/DfhooBcX0AE0pUc.jpg'],0,14,25,['pridemonth'],[],https://twitter.com/MaketheRoadNY/status/1006669560563552256,False,,1,https://pbs.twimg.com/media/DfhooBcX0AE0pUc.jpg,new york city,,,,,,[],,,,
1006668565750206464,1006668278306164741,2018-06-12 17:44:23 CDT,2018-06-12,17:44:23,-0500,345191484,vitaminsteve,Steve Flack,,@billykeable I’m really uncomfortable with how violent Spider-Man gets. He just swings in and beats the shit out of people.,en,[],[],[],0,0,0,[],[],https://twitter.com/VitaminSteve/status/1006668565750206464,False,,0,,new york city,,,,,,"[{'screen_name': 'billykeable', 'name': 'billy 2k22 ultimate edition', 'id': '53487239'}]",,,,
1006668201600708608,1006668201600708608,2018-06-12 17:42:56 CDT,2018-06-12,17:42:56,-0500,127662196,jillianwoelpper,massive,,Anger frustration,en,[],[],[],1,0,0,[],[],https://twitter.com/jillianwoelpper/status/1006668201600708608,False,,0,,new york city,,,,,,[],,,,
1006667809911459841,1006636286797631488,2018-06-12 17:41:23 CDT,2018-06-12,17:41:23,-0500,26753804,rebbacaprice,Sandstone,,@LionelMedia @la700 This really must be investigated. Another victim of Hillary?,en,[],[],[],0,0,0,[],[],https://twitter.com/Rebbacaprice/status/1006667809911459841,False,,0,,new york city,,,,,,"[{'screen_name': 'LionelMedia', 'name': '🇺🇸Lionel🇺🇸', 'id': '24787367'}, {'screen_name': 'la700', 'name': 'Truth Social 🙏🏻 ASAP', 'id': '79468315'}]",,,,
1006667118367203330,1006667118367203330,2018-06-12 17:38:38 CDT,2018-06-12,17:38:38,-0500,41615720,jdny2,Chairman Meow,,"I workout anywhere between 3 and 5 times a week.  How come it is when I get injured, it only occurs on the days I DON’T workout?",en,[],[],[],1,0,2,[],[],https://twitter.com/jdny2/status/1006667118367203330,False,,0,,new york city,,,,,,[],,,,
1006666362410938374,1006664183482548224,2018-06-12 17:35:38 CDT,2018-06-12,17:35:38,-0500,142908773,thedarktower__,aintshitleathernigga,,@shaunte_holiday No harm. I just found it hilarious.,en,[],[],[],0,0,0,[],[],https://twitter.com/TheDarkTower__/status/1006666362410938374,False,,0,,new york city,,,,,,[],,,,
1006665872965029889,1006662263523209218,2018-06-12 17:33:41 CDT,2018-06-12,17:33:41,-0500,48815641,denisgorman,Denis P. Gorman,,"@JessicaLynn312 Her alleged actions have basically become a multi-pronged issue. The harassment could be a criminal charge, depending on the laws in the province of Quebec. The trolling has affected the Karlssons personally and professionally; its affected her boyfriend professionally; and...",en,[],[],[],1,0,0,[],[],https://twitter.com/DenisGorman/status/1006665872965029889,False,,0,,new york city,,,,,,"[{'screen_name': 'JessicaLynn312', 'name': 'Jess', 'id': '402881038'}]",,,,
1006665851397959681,1006665851397959681,2018-06-12 17:33:36 CDT,2018-06-12,17:33:36,-0500,386851602,swkoti,the truth is out there AKA the orchid man,,Take a moment.  Stop what you are doing.  Look at the pictures. Today is two years since the mass murder in Orlando.  And we are no closer to gun control than we were two years ago.  https://t.co/OQfuVPxhqv,en,[],[],['https://pbs.twimg.com/media/DfhlQKxUcAEFLF5.jpg'],1,1,4,[],[],https://twitter.com/swkoti/status/1006665851397959681,False,,1,https://pbs.twimg.com/media/DfhlQKxUcAEFLF5.jpg,new york city,,,,,,[],,,,
1006664802968760320,1006664802968760320,2018-06-12 17:29:26 CDT,2018-06-12,17:29:26,-0500,580213796,deborahkass,Deborah Kass,,@jeffsessions @GOP @realDonaldTrump  #childabuse #CrimesAgainstHumanity #Nazis #psychopath #inhuman #murderous #inhuman #cruel #sadistic #racist #WhereAreTheChildren #WhereAreTheChildren,und,"[{'screen_name': 'gop', 'name': 'gop', 'id': '11134252'}, {'screen_name': 'realdonaldtrump', 'name': 'donald j. trump', 'id': '25073877'}]",[],[],0,0,0,"['childabuse', 'crimesagainsthumanity', 'nazis', 'psychopath', 'inhuman', 'murderous', 'inhuman', 'cruel', 'sadistic', 'racist', 'wherearethechildren', 'wherearethechildren']",[],https://twitter.com/deborahkass/status/1006664802968760320,False,,0,,new york city,,,,,,[],,,,
1006664765333213186,1006664765333213186,2018-06-12 17:29:17 CDT,2018-06-12,17:29:17,-0500,141286022,maketheroadny,Make the Road NY 🦋,,“How many more trans members do have to lose to trans violence? Who will be next? Will it be me? We demand: NO MORE VIOLENCE!”   #EndTransViolence #PrideMonth  https://t.co/XkxAFG0Iwn,en,[],[],['https://pbs.twimg.com/media/DfhkQ3jWsAEUpXy.jpg'],0,8,12,"['endtransviolence', 'pridemonth']",[],https://twitter.com/MaketheRoadNY/status/1006664765333213186,False,,1,https://pbs.twimg.com/media/DfhkQ3jWsAEUpXy.jpg,new york city,,,,,,[],,,,
1006664520075390976,1006664520075390976,2018-06-12 17:28:19 CDT,2018-06-12,17:28:19,-0500,190007294,stevewestdanger,Steve West,"{'type': 'Point', 'coordinates': [40.7142, -74.0064]}",Had a blast playing some old Danger Danger songs…  https://t.co/BlqdjFpjZY,en,[],['https://www.instagram.com/p/Bj8P4P5HKCF/?utm_source=ig_twitter_share&igshid=pg0bjzxtrawo'],[],1,3,23,[],[],https://twitter.com/SteveWestDanger/status/1006664520075390976,False,,0,,new york city,,,,,,[],,,,
1006663879018143744,1006663879018143744,2018-06-12 17:25:46 CDT,2018-06-12,17:25:46,-0500,141286022,maketheroadny,Make the Road NY 🦋,,"TGNCIQ Communities won’t stay quiet to hate! We are demanding an end to trans violence, and homophobic attacks, two of which happened last week in Jackson Heights, Queens. #EndTransViolence #PrideMonth  Tune in:  https://t.co/BUdgbYaLqx  https://t.co/XkNMhyRMJ1",en,[],['https://www.facebook.com/MakeTheRoadNewYork/videos/10155323272471296/'],"['https://pbs.twimg.com/media/DfhjboAW0AA1_V8.jpg', 'https://pbs.twimg.com/media/Dfhjbn-X4AYB8by.jpg', 'https://pbs.twimg.com/media/Dfhjbn6WAAAeTYD.jpg']",0,8,8,"['endtransviolence', 'pridemonth']",[],https://twitter.com/MaketheRoadNY/status/1006663879018143744,False,,1,https://pbs.twimg.com/media/DfhjboAW0AA1_V8.jpg,new york city,,,,,,[],,,,
1006663077620781057,1006662418565562370,2018-06-12 17:22:35 CDT,2018-06-12,17:22:35,-0500,48815641,denisgorman,Denis P. Gorman,,"... could ‘help’ Voynov, even though domestic violence has never once been prevented because an athlete is on a team.   So a team is going to con itself into believing it can fix Voynov, when the truth is that they want him for what he can do on the ice.",en,[],[],[],1,0,0,[],[],https://twitter.com/DenisGorman/status/1006663077620781057,False,,0,,new york city,,,,,,[],,,,
1006662867423293441,1006662867423293441,2018-06-12 17:21:45 CDT,2018-06-12,17:21:45,-0500,857696101012561921,seedsovereignty,Seeding Sovereignty,,Today NYC youth led a powerful rally and die-in and called on elected officials to take meaningful action to end systemic gun violence. #NationalDieIn #DieIn #NeverAgain #MarchForOurLives #youthoverguns  https://t.co/YdlIobh4OA,en,[],[],['https://pbs.twimg.com/media/DfhiiMPX0AEcH2b.jpg'],1,12,32,"['nationaldiein', 'diein', 'neveragain', 'marchforourlives', 'youthoverguns']",[],https://twitter.com/SeedSovereignty/status/1006662867423293441,False,,1,https://pbs.twimg.com/media/DfhiiMPX0AEcH2b.jpg,new york city,,,,,,[],,,,
1006660886814187520,1006637373629722624,2018-06-12 17:13:52 CDT,2018-06-12,17:13:52,-0500,31586296,rburke08,Richard E. Burke,,@realDonaldTrump Trump got TRUMPED!!! Kim got everything- murder got all he wanted!!! Played by a tyrant/—-liar in chief - Putin puppetphoto ops -  https://t.co/aTAxEtkxmp,en,[],[],['https://pbs.twimg.com/media/DfhgvSSWAAIwb6O.jpg'],0,0,0,[],[],https://twitter.com/rburke08/status/1006660886814187520,False,,1,https://pbs.twimg.com/media/DfhgvSSWAAIwb6O.jpg,new york city,,,,,,"[{'screen_name': 'realDonaldTrump', 'name': 'Donald J. Trump', 'id': '25073877'}]",,,,
1006660243445682177,1006612915993108482,2018-06-12 17:11:19 CDT,2018-06-12,17:11:19,-0500,31586296,rburke08,Richard E. Burke,,@seanhannity Trump got Trumped!!! Kim the murder got everything he wanted-  total confession for nothing— Judy like Jerusalem !!! Disaster in chief- liar in chief - Putinnpuppet!! Collusion proved  https://t.co/IiMdmnnrxJ,en,[],[],['https://pbs.twimg.com/media/DfhgJxbW4AIPykN.jpg'],0,0,0,[],[],https://twitter.com/rburke08/status/1006660243445682177,False,,1,https://pbs.twimg.com/media/DfhgJxbW4AIPykN.jpg,new york city,,,,,,"[{'screen_name': 'seanhannity', 'name': 'Sean Hannity', 'id': '41634520'}]",,,,
