id,conversation_id,created_at,date,time,timezone,user_id,username,name,place,tweet,language,mentions,urls,photos,replies_count,retweets_count,likes_count,hashtags,cashtags,link,retweet,quote_url,video,thumbnail,near,geo,source,user_rt_id,user_rt,retweet_id,reply_to,retweet_date,translate,trans_src,trans_dest
1126273911564525569,1126273911564525569,2019-05-08 18:53:20 CDT,2019-05-08,18:53:20,-0500,567512736,nicktheman287,Nick19,,@Bulls_Peck do you think Fleming will help the offense become modernized ?,en,[],[],[],0,0,0,[],[],https://twitter.com/nicktheman287/status/1126273911564525569,False,,0,,chicago,,,,,,[],,,,
1126273474950062080,1126273474950062080,2019-05-08 18:51:36 CDT,2019-05-08,18:51:36,-0500,172458559,ayeluhairik,Luh AIRIK,,"Trigger Words to Make People Emotionally upset: Sexist, Misogynistic, Racist, Homophobic, Uncle Tom, Rapist, Hotep, All Women/Men, Retarded",en,[],[],[],1,0,2,[],[],https://twitter.com/AyeLuhAirik/status/1126273474950062080,False,,0,,chicago,,,,,,[],,,,
1126272644880502785,1126272644880502785,2019-05-08 18:48:18 CDT,2019-05-08,18:48:18,-0500,865228468212178944,stl_softball,St. Laurence Softball,,"Pochie fans 9 against a tough RB offense. The defense plays errorless behind Pochie. Juarez, Seropian and E. Flores with hits! #OnVikings  https://t.co/QoBaosrdlo",en,[],[],['https://pbs.twimg.com/media/D6FS_8nWAAEAN5p.jpg'],0,4,31,['onvikings'],[],https://twitter.com/STL_Softball/status/1126272644880502785,False,,1,https://pbs.twimg.com/media/D6FS_8nWAAEAN5p.jpg,chicago,,,,,,[],,,,
1126271885690294272,1126271885690294272,2019-05-08 18:45:17 CDT,2019-05-08,18:45:17,-0500,67150707,thechefjulius,Chef Julius Russell,"{'type': 'Point', 'coordinates': [41.883222, -87.632496]}","Needed a moment of clarity and I wound up spending a minute with a member of the #culinarybrotherhood. He reminded me that we have a #WHIP! @ Chicago, Illinois  https://t.co/dXvYziHRlU",en,[],['https://www.instagram.com/p/BxOHAa3pwy3/?igshid=t43owjr5jcjd'],[],0,0,0,"['culinarybrotherhood', 'whip']",[],https://twitter.com/TheChefJulius/status/1126271885690294272,False,,0,,chicago,,,,,,[],,,,
1126271178300108800,1126271178300108800,2019-05-08 18:42:28 CDT,2019-05-08,18:42:28,-0500,55415872,cdcole55,Clinton Cole,,Pretty easy for me.. Derrick Rose never gets hurt.,en,[],[],[],3,0,5,[],[],https://twitter.com/cdcole55/status/1126271178300108800,False,https://twitter.com/barstoolchicago/status/1126171504109076483,0,,chicago,,,,,,[],,,,
1126269482094276609,1125033743922728960,2019-05-08 18:35:44 CDT,2019-05-08,18:35:44,-0500,263782146,cashoverclout,CashOverClout®️,,@ixohuda The lil bites out the apple got me dead😂,en,[],[],[],0,0,0,[],[],https://twitter.com/CashOverClout/status/1126269482094276609,False,,0,,chicago,,,,,,"[{'screen_name': 'ixohuda', 'name': '♔ hudaa', 'id': '1054936074953388032'}]",,,,
1126269344328114176,1126269344328114176,2019-05-08 18:35:11 CDT,2019-05-08,18:35:11,-0500,920161472,paulie_marie33,🔪,,ryan come to riot fest challenge,en,[],[],[],0,0,0,[],[],https://twitter.com/Paulie_Marie33/status/1126269344328114176,False,,0,,chicago,,,,,,[],,,,
1126266075501428736,993841959218409472,2019-05-08 18:22:12 CDT,2019-05-08,18:22:12,-0500,117321429,drowsyredhead,Mary H🌹,,"@ericrennerbrown @GratefulDead @mickeyhart Wait, you got to interview a Dead member??!!",en,[],[],[],1,0,0,[],[],https://twitter.com/Drowsyredhead/status/1126266075501428736,False,,0,,chicago,,,,,,"[{'screen_name': 'ericrennerbrown', 'name': 'Eric Renner Brown', 'id': '193053803'}, {'screen_name': 'GratefulDead', 'name': 'Grateful Dead', 'id': '25609013'}, {'screen_name': 'mickeyhart', 'name': 'Mickey Hart', 'id': '15459894'}]",,,,
1126264002315730952,1126264002315730952,2019-05-08 18:13:57 CDT,2019-05-08,18:13:57,-0500,20183517,tdegg,Trisha Degg,,"Excited to kick off @ChiTechAcademy Little Black Dress Night, hosted by @ITA member @ActiveCampaign #LBDN2019  https://t.co/VRFog22I1z",en,"[{'screen_name': 'chitechacademy', 'name': 'chicago tech academy', 'id': '237782850'}, {'screen_name': 'ita', 'name': 'ita', 'id': '4121221'}, {'screen_name': 'activecampaign', 'name': 'activecampaign', 'id': '18035122'}]",[],"['https://pbs.twimg.com/media/D6FLI2hWwAEOZvQ.jpg', 'https://pbs.twimg.com/media/D6FLI2jXkAE5Shn.jpg']",1,2,11,['lbdn2019'],[],https://twitter.com/tdegg/status/1126264002315730952,False,,1,https://pbs.twimg.com/media/D6FLI2hWwAEOZvQ.jpg,chicago,,,,,,[],,,,
1126258088208678917,1126258088208678917,2019-05-08 17:50:27 CDT,2019-05-08,17:50:27,-0500,28205523,stuartbrainerd,stuart brainerd,,Some bloody fantastic retorts to a very dumb post from Candidate Swalwell,en,[],[],[],0,0,0,[],[],https://twitter.com/stuartbrainerd/status/1126258088208678917,False,https://twitter.com/michaeljknowles/status/1126243270151921664,0,,chicago,,,,,,[],,,,
1126255624487079937,1126123945625882626,2019-05-08 17:40:40 CDT,2019-05-08,17:40:40,-0500,1152663343,tony_rocco17,Tony,,@Suntimes Anyone between the ages of roughly 23-33 knows this sign is clearly just something you hold below your waste and if your friend looks at it then you get to give them a friendly punch or two (depending on where you’re from) in the arm. No racist intent at all.,en,[],[],[],1,0,1,[],[],https://twitter.com/tony_rocco17/status/1126255624487079937,False,,0,,chicago,,,,,,"[{'screen_name': 'Suntimes', 'name': 'Chicago Sun-Times', 'id': '12811952'}]",,,,
1126255510397902849,1126255510397902849,2019-05-08 17:40:13 CDT,2019-05-08,17:40:13,-0500,198359359,raymond_oc,Ray O'Connell,,Death. Taxes. Northwestern golf in May.,en,[],[],[],0,1,15,[],[],https://twitter.com/Raymond_OC/status/1126255510397902849,False,https://twitter.com/NUGolf_Live/status/1126253163315466241,0,,chicago,,,,,,[],,,,
1126254916203360257,1126254916203360257,2019-05-08 17:37:51 CDT,2019-05-08,17:37:51,-0500,2911178257,diedistrict,“,,"if you don’t heal what hurt you, you’ll bleed on people who didn’t cut you",en,[],[],[],0,33,77,[],[],https://twitter.com/diedistrict/status/1126254916203360257,False,,0,,chicago,,,,,,[],,,,
1126252314539507713,1126147781339561985,2019-05-08 17:27:31 CDT,2019-05-08,17:27:31,-0500,360180215,step_nie,step,,"@FoeckeKeith @JoshDorner Laws prohibiting taking minors out of the state with the intent to have sex with them (statutory rape in the home state) to a state with lower age of consent is completely Constitutional in the same way this would be. Criminal conduct, like abortion would be, is different.",en,[],[],[],0,0,0,[],[],https://twitter.com/step_nie/status/1126252314539507713,False,,0,,chicago,,,,,,"[{'screen_name': 'FoeckeKeith', 'name': 'EndBigMoney🔥⚔️🏴☭', 'id': '1095724474828091393'}, {'screen_name': 'JoshDorner', 'name': 'Josh Dorner', 'id': '23819676'}]",,,,
1126252050457735169,1126224292277104642,2019-05-08 17:26:28 CDT,2019-05-08,17:26:28,-0500,2350440798,irish_kreem,Ryan.ptsd,,"@ParkerMolloy I’m sure you have an insanely large support group here already, but as someone who’s suffered from a few mental health issues and suicide himself please feel free to reach out if you need an unbiased opinion. Genuinely care.",en,[],[],[],0,0,0,[],[],https://twitter.com/Irish_Kreem/status/1126252050457735169,False,,0,,chicago,,,,,,"[{'screen_name': 'ParkerMolloy', 'name': 'Parker Molloy', 'id': '634734888'}]",,,,
1126249376245063680,1126245064383057920,2019-05-08 17:15:50 CDT,2019-05-08,17:15:50,-0500,2544903272,wednesdaycomix,Wednesday Comix,,"@stalkdefenders Origin stories of many tried &amp; true comic book characters, singular moments that transcend the comics themselves, have bled into popular culture. They include:  • Death of Thomas &amp; Martha Wayne • Peter Parker bit by a radioactive spider | Uncle Ben’s death | W/ great power...  https://t.co/jseG0pw8Qa",en,[],[],['https://pbs.twimg.com/media/D6E91b-W0AAPX_6.jpg'],0,0,0,[],[],https://twitter.com/WednesdayComix/status/1126249376245063680,False,,1,https://pbs.twimg.com/media/D6E91b-W0AAPX_6.jpg,chicago,,,,,,"[{'screen_name': 'stalkdefenders', 'name': ""Let's Talk Defenders"", 'id': '1060220273440555008'}]",,,,
1126247927620472833,1126247927620472833,2019-05-08 17:10:05 CDT,2019-05-08,17:10:05,-0500,2350440798,irish_kreem,Ryan.ptsd,,I’m fucking dead,en,[],[],[],0,0,0,[],[],https://twitter.com/Irish_Kreem/status/1126247927620472833,False,https://twitter.com/Pisqe/status/1116432456079630336,0,,chicago,,,,,,[],,,,
1126247447670476802,1126247447670476802,2019-05-08 17:08:10 CDT,2019-05-08,17:08:10,-0500,132129777,katechicago,Kate Hannigan Books,,Debbie is a force of nature! Like sunshine! ☀️,en,[],[],[],0,0,0,[],[],https://twitter.com/KateChicago/status/1126247447670476802,False,https://twitter.com/_jacqueline_ill/status/1125882832272994306,0,,chicago,,,,,,[],,,,
1126247288698036224,1126247288698036224,2019-05-08 17:07:32 CDT,2019-05-08,17:07:32,-0500,2464203966,mikecaballerro,Michael Ray,,Background checks are nowhere near enough thorough for you to own such a weapon.,en,[],[],[],0,0,1,[],[],https://twitter.com/MikeCaballerro/status/1126247288698036224,False,,0,,chicago,,,,,,[],,,,
1126246529386336258,1126246529386336258,2019-05-08 17:04:31 CDT,2019-05-08,17:04:31,-0500,2464203966,mikecaballerro,Michael Ray,,Here’s a sensible question to ask: WHY CAN I LEGALLY OWN A WEAPON OF MASS DESTRUCTION BEFORE I CAN LEGALLY BUY TOBACCO PRODUCTS? THINK ABOUT IT.,en,[],[],[],0,7,13,[],[],https://twitter.com/MikeCaballerro/status/1126246529386336258,False,,0,,chicago,,,,,,[],,,,
