id,conversation_id,created_at,date,time,timezone,user_id,username,name,place,tweet,language,mentions,urls,photos,replies_count,retweets_count,likes_count,hashtags,cashtags,link,retweet,quote_url,video,thumbnail,near,geo,source,user_rt_id,user_rt,retweet_id,reply_to,retweet_date,translate,trans_src,trans_dest
1087498679643074560,1087498679643074560,2019-01-21 17:54:24 CST,2019-01-21,17:54:24,-0500,111000626,sabrinaanicole_,Sabrina,,Hurt,en,[],[],[],0,0,0,[],[],https://twitter.com/SabrinaaNicole_/status/1087498679643074560,False,,0,,phoenix,,,,,,[],,,,
1087498615042465793,1087498615042465793,2019-01-21 17:54:09 CST,2019-01-21,17:54:09,-0500,507805507,nyeshaajordann,Nyesha,,Men are literally delusional. This man blatantly said that a women deserved to get raped because she was twerking and her dress came up and shorty was wearing no underwear ITS 2019 NO WOMAN OR MAN DESERVES TO BE RAPED. Y’all some sick individuals,en,[],[],[],0,0,0,[],[],https://twitter.com/nyeshaajordann/status/1087498615042465793,False,,0,,phoenix,,,,,,[],,,,
1087490465228742656,1087490465228742656,2019-01-21 17:21:46 CST,2019-01-21,17:21:46,-0500,954861089409257472,zealotwrestling,Zealot,,Don’t miss your chance to see one of pro wrestling’s hottest up and coming talents. You haven’t seen spectacular until you’ve seen @Adrian__Quest in person. Come do that on 1/25 and kick off your #RoyalRumble weekend on a high flying note.  https://t.co/XhxdvBxAlt,en,"[{'screen_name': 'adrian__quest', 'name': 'young fuego', 'id': '2946832389'}]",[],['https://pbs.twimg.com/media/DxeKz8CUUAIyZHs.jpg'],0,3,5,['royalrumble'],[],https://twitter.com/ZealotWrestling/status/1087490465228742656,False,,1,https://pbs.twimg.com/media/DxeKz8CUUAIyZHs.jpg,phoenix,,,,,,[],,,,
1087490038873579521,1087469450352345093,2019-01-21 17:20:04 CST,2019-01-21,17:20:04,-0500,1590657698,burntcheeesee,burntcheeesee gaming,,@A_Fatal_Chick I remember when destiny was a thing I might be back for d3,en,[],[],[],0,0,1,[],[],https://twitter.com/burntcheeesee/status/1087490038873579521,False,,0,,phoenix,,,,,,"[{'screen_name': 'A_Fatal_Chick', 'name': 'A Fatal Chick', 'id': '3100033813'}]",,,,
1087488497751973890,1087488497751973890,2019-01-21 17:13:57 CST,2019-01-21,17:13:57,-0500,615229079,alexander_avina,Alexander Aviña,,🤣🤣🤣 ok gov “border strike force”,en,[],[],[],0,0,3,[],[],https://twitter.com/Alexander_Avina/status/1087488497751973890,False,https://twitter.com/DougDucey/status/1087318893566124032,0,,phoenix,,,,,,[],,,,
1087483246881853440,1087483246881853440,2019-01-21 16:53:05 CST,2019-01-21,16:53:05,-0500,3282903901,latraymusik,La'Tray,,Listen to LaTray- 5 Minutes of Def (Pt.2) by LaTray #np on #SoundCloud  https://t.co/dS1cRgRjHg  #Xxxtentacion #RIPX #Riot #Freestyle #LaTrayMusik #AZ #Soundcloud  https://t.co/DmDGbJGn43,en,[],['https://soundcloud.com/user-403977382/latray-5-minutes-of-def-pt2'],[],0,0,5,"['np', 'soundcloud', 'xxxtentacion', 'ripx', 'riot', 'freestyle', 'latraymusik', 'az', 'soundcloud']",[],https://twitter.com/latraymusik/status/1087483246881853440,False,,1,https://pbs.twimg.com/ext_tw_video_thumb/1087483158793056256/pu/img/ioIuunGplmUTOWU-.jpg,phoenix,,,,,,[],,,,
1087481103303069697,1086700362499670017,2019-01-21 16:44:34 CST,2019-01-21,16:44:34,-0500,2248052018,pamelynnjones,Pamela Cooper,,@NDoloughty @tedlieu @CovCathColonels You don't get to act like a bully because you went to war. Sorry. He was instigating a fight. That's what he's paid to do.,en,[],[],[],0,1,2,[],[],https://twitter.com/pamelynnjones/status/1087481103303069697,False,,0,,phoenix,,,,,,"[{'screen_name': 'NDoloughty', 'name': 'Noreen Doloughty', 'id': '3410452565'}, {'screen_name': 'tedlieu', 'name': 'Ted Lieu', 'id': '21059255'}, {'screen_name': 'CovCathColonels', 'name': 'Cov Cath Colonels', 'id': '1237405952'}]",,,,
1087478401160626176,1087478401160626176,2019-01-21 16:33:49 CST,2019-01-21,16:33:49,-0500,83814631,chrismotivador,Chris Lee,"{'type': 'Point', 'coordinates': [33.4482, -112.0777]}","“Love is the only force capable of transforming and enemy into friend” Martin Luther King  Happy Birthday and Thank You for the Legacy of Peace , Love and Equality you left behind!” Thank…  https://t.co/5iwRHwmddK",en,[],['https://www.instagram.com/p/Bs6dx7MlV4I/?utm_source=ig_twitter_share&igshid=1whvoa39xyet7'],[],0,0,3,[],[],https://twitter.com/chrismotivador/status/1087478401160626176,False,,0,,phoenix,,,,,,[],,,,
1087477788897042434,1087477788897042434,2019-01-21 16:31:23 CST,2019-01-21,16:31:23,-0500,3281052636,llexc3,lex,,I finished all of walking dead and now I need something new to binge watch,en,[],[],[],0,0,0,[],[],https://twitter.com/llexc3/status/1087477788897042434,False,,0,,phoenix,,,,,,[],,,,
1087473493501927424,1087473493501927424,2019-01-21 16:14:19 CST,2019-01-21,16:14:19,-0500,34297954,7_bert,Alberto Caballero,,I think I’ve figured it out! I think Salt Yard is like a hipster version of Culinary Dropout or Punch Bowl Social,en,[],[],[],0,0,12,[],[],https://twitter.com/7_Bert/status/1087473493501927424,False,,0,,phoenix,,,,,,[],,,,
1087471513513615360,1087471513513615360,2019-01-21 16:06:27 CST,2019-01-21,16:06:27,-0500,870905940,pmo_le,Slime Lé🖤🐍,,"My mom want me to go to the navy for the benefits after my bachelors but I gotta better plan, ima just marry a girl that’s in the navy or air force already😈😈👺",en,[],[],[],0,0,3,[],[],https://twitter.com/PMO_Le/status/1087471513513615360,False,,0,,phoenix,,,,,,[],,,,
1087465469211160576,1087446122086453249,2019-01-21 15:42:26 CST,2019-01-21,15:42:26,-0500,44108482,lufc_arizona,Martin Collinson,,@BurgundyBlog @JPFinlayNBCS I had this on a MUCH smaller scale for a finger injury many years ago. It hurt like a bitch the couple of days after surgery. I can’t imagine what Alex Smith was feeling like!,en,[],[],[],0,0,0,[],[],https://twitter.com/LUFC_Arizona/status/1087465469211160576,False,,0,,phoenix,,,,,,"[{'screen_name': 'BurgundyBlog', 'name': 'Burgundy Blog', 'id': '140847427'}, {'screen_name': 'JPFinlayNBCS', 'name': 'JP Finlay', 'id': '39736881'}]",,,,
1087462723305144320,1087183495993057280,2019-01-21 15:31:31 CST,2019-01-21,15:31:31,-0500,2757942805,jonnuhfin,Eren Jeager 💥,,@antinyokay Or because they raped her,en,[],[],[],1,0,6,[],[],https://twitter.com/jonnuhfin/status/1087462723305144320,False,,0,,phoenix,,,,,,"[{'screen_name': 'antinyokay', 'name': 'anthony', 'id': '2384853662'}]",,,,
1087458943201202177,1087458943201202177,2019-01-21 15:16:30 CST,2019-01-21,15:16:30,-0500,942851995001536512,millerdave10,Miller Dave 🍺🤠🌵🇺🇸,,That’s just not right Bullock you should be kick to the curb stop drinking LaLa water. As far as the audience go to h*ll. Worthless ppl. Do don’t have read the signs saying to clap or laugh you should of walked out low life ppl. Amen,en,[],[],[],0,0,0,[],[],https://twitter.com/MillerDave10/status/1087458943201202177,False,https://twitter.com/fleccas/status/1086373138173091840,0,,phoenix,,,,,,[],,,,
1087454738105290752,1087447875456520192,2019-01-21 14:59:48 CST,2019-01-21,14:59:48,-0500,2342995538,boocurley,Dr. Curley Boo Johnson,,@StanSting @EMPEHIAthletics @michaelsobrien @IHSAState What’s causing him to verbally abuse the ref?,en,[],[],[],1,0,0,[],[],https://twitter.com/BooCurley/status/1087454738105290752,False,,0,,phoenix,,,,,,"[{'screen_name': 'StanSting', 'name': 'Ingo', 'id': '2221676522'}, {'screen_name': 'EMPEHIAthletics', 'name': 'Morgan Park Athletics', 'id': '2880065142'}, {'screen_name': 'michaelsobrien', 'name': ""Michael O'Brien"", 'id': '14477392'}, {'screen_name': 'IHSAState', 'name': 'IHSA State', 'id': '1112436504'}]",,,,
1087450795853766656,1087450795853766656,2019-01-21 14:44:08 CST,2019-01-21,14:44:08,-0500,1107984234,socalvall,Val 🇲🇽,,IM DEAD BRUH,en,[],[],[],0,0,0,[],[],https://twitter.com/SoCalVall/status/1087450795853766656,False,https://twitter.com/nateb_14/status/1086633719832735744,0,,phoenix,,,,,,[],,,,
1087447584451391488,1087447584451391488,2019-01-21 14:31:22 CST,2019-01-21,14:31:22,-0500,535505753,_spicygal,✨,,The comments have me dead 💀😭😂,en,[],[],[],0,1,1,[],[],https://twitter.com/_spicygal/status/1087447584451391488,False,https://twitter.com/iamcardib/status/1086446268589649920,0,,phoenix,,,,,,[],,,,
1087441076783173632,1087440139322880000,2019-01-21 14:05:31 CST,2019-01-21,14:05:31,-0500,931747828862296064,polesgoat,PolesGoat,,"@PFF_Mike True, but I find the most enjoyable side of football is the do or death moment. It was so intense when the patriots got to the red zone last night. Every play just mattered that much more",en,[],[],[],1,0,0,[],[],https://twitter.com/Polesgoat/status/1087441076783173632,False,,0,,phoenix,,,,,,"[{'screen_name': 'PFF_Mike', 'name': 'Mike Renner', 'id': '766111532'}]",,,,
1087439692939882496,1087439692939882496,2019-01-21 14:00:01 CST,2019-01-21,14:00:01,-0500,399707090,_princessjena,Jena ♕,,I just got a tattoo then five minutes latter got stung by a bee and the bee sting hurt SO MUCH WORSE,en,[],[],[],2,0,2,[],[],https://twitter.com/_PrincessJena/status/1087439692939882496,False,,0,,phoenix,,,,,,[],,,,
1087435042366713856,1087435042366713856,2019-01-21 13:41:32 CST,2019-01-21,13:41:32,-0500,1337484122,thelasthimbo,cody 🦝,,"been listening to a lot of la dispute, basement, and the wonder years this past week so the argument could be made that I am in fact going through it",en,[],[],[],7,6,120,[],[],https://twitter.com/TheLastHimbo/status/1087435042366713856,False,,0,,phoenix,,,,,,[],,,,
1087434821276655619,1087434821276655619,2019-01-21 13:40:39 CST,2019-01-21,13:40:39,-0500,19684573,andreaaftershok,ANDRÉ,,The news is at the airport doing a story about the shutdown and I think I was in the back of their shot and I look dead. 🤙🏼,en,[],[],[],0,0,6,[],[],https://twitter.com/AndreaAftershok/status/1087434821276655619,False,,0,,phoenix,,,,,,[],,,,
1087433314032484352,1087433314032484352,2019-01-21 13:34:40 CST,2019-01-21,13:34:40,-0500,28011368,rj_price,R.J. Price,,Reminiscent of Marilyn Manson covering “Suicide Is Painless”,en,[],[],[],0,0,0,[],[],https://twitter.com/RJ_Price/status/1087433314032484352,False,https://twitter.com/mysweetlord/status/1086703540029001728,0,,phoenix,,,,,,[],,,,
1087431397759901696,1087431397759901696,2019-01-21 13:27:03 CST,2019-01-21,13:27:03,-0500,729213864,montythedford,ひOfficialMontyひ,,Asking girls wearing Thrasher shirts to do a kick flip&gt;&gt;&gt; 😩😍,en,[],[],[],2,1,13,[],[],https://twitter.com/MontyThedford/status/1087431397759901696,False,,0,,phoenix,,,,,,[],,,,
1087428132380991488,1087280883474857984,2019-01-21 13:14:04 CST,2019-01-21,13:14:04,-0500,221282896,thelightspeedz,⚡️LIGHTSPEED⚡️LS3D⚡️,,@JacksFilament @FilamentFrenzy @wekster2507 @BondtechAB @Prusa3D @Simplify3D @crussty @3dmakernoob @HAWK3DPROTO @EmvioEng @Greg191134 @irblinx @chimpusmaximus @mad_monkey01 @Euan_Todd I got one..  it don’t hurt,en,[],[],[],1,0,2,[],[],https://twitter.com/TheLightSpeedz/status/1087428132380991488,False,,0,,phoenix,,,,,,"[{'screen_name': 'JacksFilament', 'name': 'Jack', 'id': '896040649270714368'}, {'screen_name': 'FilamentFrenzy', 'name': 'Filament Frenzy ™', 'id': '889555556830203905'}, {'screen_name': 'wekster2507', 'name': 'Vedran Marjanovic Wekster', 'id': '402786903'}, {'screen_name': 'BondtechAB', 'name': 'Bondtech', 'id': '608051427'}, {'screen_name': 'Prusa3D', 'name': 'Prusa3D by Josef Prusa', 'id': '957913144617259009'}, {'screen_name': 'Simplify3D', 'name': 'Simplify3D', 'id': '1034404694'}, {'screen_name': 'crussty', 'name': 'Chris Russell🌴Practical Printing', 'id': '30157504'}, {'screen_name': 'EmvioEng', 'name': 'Emvio Engineering', 'id': '4540536747'}, {'screen_name': 'Greg191134', 'name': 'Greg3D', 'id': '808282129041858561'}, {'screen_name': 'irblinx', 'name': 'IR Blinx', 'id': '40956304'}, {'screen_name': 'chimpusmaximus', 'name': 'Chris Lee', 'id': '18552150'}, {'screen_name': 'mad_monkey01', 'name': 'Jordon - Mad Monkey', 'id': '217098798'}, {'screen_name': 'Euan_Todd', 'name': 'Euan Todd (Ori)', 'id': '2813441344'}]",,,,
1087426199112929280,1087426199112929280,2019-01-21 13:06:23 CST,2019-01-21,13:06:23,-0500,14067629,mtruby,Mark Truby,,The auto show (as we know it) is dead. Long live the auto show.  https://t.co/1FGrH5fLnn via @PRWeekUS,en,"[{'screen_name': 'prweekus', 'name': 'prweekus', 'id': '15580384'}]",['https://www.prweek.com/article/1523355'],[],0,0,1,[],[],https://twitter.com/mtruby/status/1087426199112929280,False,,0,,phoenix,,,,,,[],,,,
1087424626420903945,1087424626420903945,2019-01-21 13:00:08 CST,2019-01-21,13:00:08,-0500,1330157610,dr_whitaker,Dr. Matthew C. Whitaker,,“Love is the only force capable of transforming an enemy into a friend.” #MLK2019 #MLKMarch  https://t.co/OwgD5oUkT3,en,[],[],['https://pbs.twimg.com/media/DxdO7YHUcAU1uL0.jpg'],0,0,7,"['mlk2019', 'mlkmarch']",[],https://twitter.com/Dr_Whitaker/status/1087424626420903945,False,,1,https://pbs.twimg.com/media/DxdO7YHUcAU1uL0.jpg,phoenix,,,,,,[],,,,
1087423393740218368,1087420251308847106,2019-01-21 12:55:15 CST,2019-01-21,12:55:15,-0500,1337484122,thelasthimbo,cody 🦝,,@babywubz pls drop kick him I need to go to the gym,en,[],[],[],1,0,5,[],[],https://twitter.com/TheLastHimbo/status/1087423393740218368,False,,0,,phoenix,,,,,,[],,,,
1087418817347604480,1087418817347604480,2019-01-21 12:37:03 CST,2019-01-21,12:37:03,-0500,51884027,batfandotcom,Ben Rollier,,"Excluding the whole Weapon 11 thing, I actually enjoy X-Men Origins: Wolverine. It's a lot of fun.",en,[],[],[],0,0,0,[],[],https://twitter.com/batfandotcom/status/1087418817347604480,False,https://twitter.com/JonathanBarkan/status/1085212514680397824,0,,phoenix,,,,,,[],,,,
1087417800786759680,1087330416430845952,2019-01-21 12:33:01 CST,2019-01-21,12:33:01,-0500,2939902568,granny008,Richard Knox Granville,,"@J_Shantel_Ro Should be interesting to see how usual double standard is applied insofar as legendary asignations with Willy Brown toward career advancement goes. Is it fair game? Or does Me Too obviate?   I expect that if it is broached, the matter will be skewed, portraying her a victim.",en,[],[],[],0,0,0,[],[],https://twitter.com/Granny008/status/1087417800786759680,False,,0,,phoenix,,,,,,"[{'screen_name': 'J_Shantel_Ro', 'name': '♑️🚀Jamereia🇺🇸', 'id': '955385132818534400'}]",,,,
1087417685162348544,1087417685162348544,2019-01-21 12:32:34 CST,2019-01-21,12:32:34,-0500,26642136,_daeneraaassss_,🇯🇲_MaRi_J_Bomboclaat_🇯🇲,,I hope the ladies take notes on the BUMS tweeting that see nothing wrong with the ATL club RAPE situation.. screenshots alladat.,en,[],[],[],2,0,1,[],[],https://twitter.com/_DaeneRaaassss_/status/1087417685162348544,False,,0,,phoenix,,,,,,[],,,,
1087416272336211968,1087411226861363200,2019-01-21 12:26:57 CST,2019-01-21,12:26:57,-0500,931747828862296064,polesgoat,PolesGoat,,"@schillfactor @kfishbain Lol not butt hurt, just pointing out the clear haters. Not many GMs have ever been able to gain a franchise QB who had a top 5 season in the franchises history and two all pros from one draft, but sure keep doubting",en,[],[],[],0,0,0,[],[],https://twitter.com/Polesgoat/status/1087416272336211968,False,,0,,phoenix,,,,,,"[{'screen_name': 'kfishbain', 'name': 'Kevin Fishbain', 'id': '41463529'}]",,,,
1087412951223394304,1086787917748494336,2019-01-21 12:13:45 CST,2019-01-21,12:13:45,-0500,971035334,raornosaj,Jason Roar,,@FinchJenn This song is going number one on the Pre-teen Contemporary Charts with a bullet!,en,[],[],[],0,0,1,[],[],https://twitter.com/raornosaj/status/1087412951223394304,False,,0,,phoenix,,,,,,"[{'screen_name': 'FinchJenn', 'name': 'Jennifer Erickson', 'id': '863315006'}]",,,,
1087411672183070720,1087395016530526209,2019-01-21 12:08:40 CST,2019-01-21,12:08:40,-0500,1161351854,automaticmaiden,ᴍɪsᴛʏ ᴏᴘᴘᴇʀᴛᴜɴɪᴛʏ ♡,,@Rhonda9080 @Mikeggibbs So do onto others as they do onto you? So just treat other people with disrespect because your group got hurt by being called gay? Are they really that insecure? Heaven forbid that these kids actually have minds of their own and take charge for their own disgraceful actions!,en,[],[],[],0,0,1,[],[],https://twitter.com/AutomaticMaiden/status/1087411672183070720,False,,0,,phoenix,,,,,,"[{'screen_name': 'Rhonda9080', 'name': 'ProUSAJournalist', 'id': '297795505'}, {'screen_name': 'Mikeggibbs', 'name': 'Mike Gibbs🏳️\u200d🌈', 'id': '90732175'}]",,,,
1087403800325844993,1087403024681586688,2019-01-21 11:37:23 CST,2019-01-21,11:37:23,-0500,39599785,redrumcollab,Amanda Valentine,,I’m gonna be real. I’m not a huge fan of tiny humans. They screech and they are always sticky and I know they see dead people... but when I walk through the court yard and they follow me on their tiny scooters asking me questions it really does warm my heart. Pure innocence!,en,[],[],[],0,0,2,[],[],https://twitter.com/RedrumCollab/status/1087403800325844993,False,,0,,phoenix,,,,,,[],,,,
1087402640923754499,1087400621890711552,2019-01-21 11:32:47 CST,2019-01-21,11:32:47,-0500,502461580,toddkrieger1,Todd Krieger,,"@JacobAWohl Bernie Sanders' case is not unique.... It's a dead ringer for the behavior of socialist elites. Pelosi behaves like that, as does Al Gore, Hillary Clinton, etc. ... Heck, even John McCain behaved like that.",en,[],[],[],1,0,4,[],[],https://twitter.com/ToddKrieger1/status/1087402640923754499,False,,0,,phoenix,,,,,,"[{'screen_name': 'JacobAWohl', 'name': 'Jacob Wohl', 'id': '736959136164806657'}]",,,,
1087402452503023616,1087400146902470656,2019-01-21 11:32:02 CST,2019-01-21,11:32:02,-0500,380042466,gouldenboyg,Gannøn,,"@kozielalexander Completely agree. Start the ball at the 50. NFL gets what they want too. More offense. That game is talked about more and could be considered one of the best games of all-time if Mahomes goes down and scores a TD. Each team trying to get a stop, opposed to one side.",en,[],[],[],1,0,1,[],[],https://twitter.com/GouldenBoyG/status/1087402452503023616,False,,0,,phoenix,,,,,,"[{'screen_name': 'kozielalexander', 'name': 'Alexander Koziel', 'id': '725450694'}]",,,,
1087399358478221312,1087399358478221312,2019-01-21 11:19:44 CST,2019-01-21,11:19:44,-0500,380042466,gouldenboyg,Gannøn,,"I hate the ""make a stop"" argument. Who's to say the opposing team could ""make a stop"". The Patriots couldn't stop anything that 4th quarter. Both defenses were gassed. Whoever got ball 1st wins that game. NFL rules greatly favor the offense. Heads or tails decided that game.",en,[],[],[],0,0,2,[],[],https://twitter.com/GouldenBoyG/status/1087399358478221312,False,https://twitter.com/BarstoolBigCat/status/1087391317385248773,0,,phoenix,,,,,,[],,,,
1087396356488974341,1087396356488974341,2019-01-21 11:07:48 CST,2019-01-21,11:07:48,-0500,720685813,esragadelhak,Esra 🎀,,No offense but im waiting for @BetoORourke to annouce his run for presidency lol,en,"[{'screen_name': 'betoorourke', 'name': ""beto o'rourke"", 'id': '342863309'}]",[],[],0,0,0,[],[],https://twitter.com/EsraGadelhak/status/1087396356488974341,False,https://twitter.com/AP/status/1087331506899599361,0,,phoenix,,,,,,[],,,,
1087395756229615616,1087378494386913280,2019-01-21 11:05:25 CST,2019-01-21,11:05:25,-0500,21367679,vincentorleck,Vincent Orleck | #NotAGuru 🇺🇦,,@NickJRishwain Yelling. Yelling can work and doesn’t really hurt them much.,en,[],[],[],1,0,1,[],[],https://twitter.com/VincentOrleck/status/1087395756229615616,False,,0,,phoenix,,,,,,"[{'screen_name': 'NickJRishwain', 'name': 'Nick Rishwain', 'id': '188531255'}]",,,,
1087395518043439104,1087358207297765376,2019-01-21 11:04:28 CST,2019-01-21,11:04:28,-0500,21367679,vincentorleck,Vincent Orleck | #NotAGuru 🇺🇦,,"@martinlieberman @BPucino Yeah refs for sure blew the roughing the passer call. But did get the Edelman call right, and the Dee Ford offsides call. Look, the Pats benefited from some ref calls and so did the Chiefs, and they also both were hurt by them. I have never believed the league wants NE to succeed",en,[],[],[],0,0,0,[],[],https://twitter.com/VincentOrleck/status/1087395518043439104,False,,0,,phoenix,,,,,,"[{'screen_name': 'martinlieberman', 'name': 'Martin Lieberman', 'id': '84712958'}, {'screen_name': 'BPucino', 'name': 'Bernie Pucino', 'id': '1256195656634568704'}]",,,,
1087392971979255809,1087293793714417664,2019-01-21 10:54:21 CST,2019-01-21,10:54:21,-0500,48942633,dankinia,Kini,,"@iyagovos Yeah I’m not a fan of the notebook you can buy through there, but any notebook will work. I actually switched to using a note taking app (GoodNotes) on my iPad for my bullet journal and that works just as well.",en,[],[],[],0,0,1,[],[],https://twitter.com/Dankinia/status/1087392971979255809,False,,0,,phoenix,,,,,,"[{'screen_name': 'iyagovos', 'name': 'James Bartholomeou', 'id': '110058074'}]",,,,
1087392260193509376,1087392260193509376,2019-01-21 10:51:32 CST,2019-01-21,10:51:32,-0500,232711036,drj_productions,Donnie Jones,"{'type': 'Point', 'coordinates': [33.6203018, -111.87473856]}",Very cool and different place! Breakfast and Bloody Mary bar plus a dj place rocks #hash #hash #scottsdale @ Hash Kitchen  https://t.co/0khR9Um4Eb,en,[],['https://www.instagram.com/p/Bs52mC9Ftv6/?utm_source=ig_twitter_share&igshid=1k7eye6w3w924'],[],0,0,0,"['hash', 'hash', 'scottsdale']",[],https://twitter.com/drj_productions/status/1087392260193509376,False,,0,,phoenix,,,,,,[],,,,
1087389450265489408,1087386512105312256,2019-01-21 10:40:22 CST,2019-01-21,10:40:22,-0500,3985646473,isaiahemingway,Isaiah,,@Stopper2000 @LifesCrazyMan__ @BleacherReport @thephillyvoice With bums on his offense 😂. Put Dak on that 2016 eagles team and he wouldnt be in the league. Context my guy,en,[],[],[],1,0,0,[],[],https://twitter.com/isaiahemingway/status/1087389450265489408,False,,0,,phoenix,,,,,,"[{'screen_name': 'stopper2000', 'name': 'CatfishStopper2000', 'id': '1249728781557923840'}, {'screen_name': 'LifesCrazyMan__', 'name': 'Ryan', 'id': '709896463648567298'}, {'screen_name': 'BleacherReport', 'name': 'Bleacher Report', 'id': '890891'}, {'screen_name': 'thephillyvoice', 'name': 'PhillyVoice', 'id': '2557592940'}]",,,,
1087389206551220224,1087389206551220224,2019-01-21 10:39:24 CST,2019-01-21,10:39:24,-0500,321083839,azpipetrades469,Arizona Pipe Trades,,"Today we honor the life of Martin Luther King Jr., who fought tirelessly for civil rights, economic justice and workers’ rights. He once said, “The labor movement was the principal force that transformed misery and despair into hope and progress.”  https://t.co/3OooYlSrVQ",en,[],[],['https://pbs.twimg.com/media/DxcuuAzVAAIUqnq.jpg'],0,0,9,[],[],https://twitter.com/AZPipeTrades469/status/1087389206551220224,False,,1,https://pbs.twimg.com/media/DxcuuAzVAAIUqnq.jpg,phoenix,,,,,,[],,,,
1087388350971953152,1087388350971953152,2019-01-21 10:36:00 CST,2019-01-21,10:36:00,-0500,2556208099,warbabyyy,warbabyyy,,"You couldn’t force me to wipe anyone’s butt. I’ll hose you down in a minute, though.",en,[],[],[],2,1,8,[],[],https://twitter.com/warbabyyy/status/1087388350971953152,False,https://twitter.com/nypost/status/1087379371705421825,0,,phoenix,,,,,,[],,,,
1087382952055435264,1087359397053911046,2019-01-21 10:14:33 CST,2019-01-21,10:14:33,-0500,1002567292599689216,danielgoodwin__,D,,@Burnsy987 Ease the pain. Not like Paxson misses that 3 and we are NBA Champs. We just force a game 7 against Jordan.,en,[],[],[],0,0,0,[],[],https://twitter.com/danielgoodwin__/status/1087382952055435264,False,,0,,phoenix,,,,,,"[{'screen_name': 'Burnsy987', 'name': 'Dave Burns', 'id': '27937449'}]",,,,
1087382644730417152,1087382644730417152,2019-01-21 10:13:19 CST,2019-01-21,10:13:19,-0500,724803098049269760,keeshayodabarb,Keesha@Keeshadoggie,,"Doesn’t like it when they come to her but loves it when they hurt other people!  Activists and Illegals Jump Nancy Pelosi’s Home Wall, She Has Them Deported by Police  https://t.co/6XMwU7tHXJ",en,[],['https://patrioticviralnews.com/articles/activists-and-illegals-jump-nancy-pelosis-home-wall-she-has-them-deported-by-police/'],[],0,1,1,[],[],https://twitter.com/KeeshaYodabarb/status/1087382644730417152,False,,0,,phoenix,,,,,,[],,,,
1087380638921945089,1087380638921945089,2019-01-21 10:05:21 CST,2019-01-21,10:05:21,-0500,290301427,donarizona,Scar,,You can still be in love with someone and hurt them...,en,[],[],[],0,0,1,[],[],https://twitter.com/DonArizona/status/1087380638921945089,False,,0,,phoenix,,,,,,[],,,,
1087378663719354368,1087170166310486016,2019-01-21 09:57:30 CST,2019-01-21,09:57:30,-0500,248021765,jschln1,Gerald A Johnson,,"@KamalaHarris The Racist in Chief, Donald Chump has been hellbent of removing, tearing down  all things with Barack Obama's prints on it. I liken that to the film ""The Ten Commandments"" when Pharoah had Moses' name removed from everything and the threat of death if you even mentioned his name.",en,[],[],[],0,0,0,[],[],https://twitter.com/jschln1/status/1087378663719354368,False,,0,,phoenix,,,,,,"[{'screen_name': 'KamalaHarris', 'name': 'Kamala Harris', 'id': '30354991'}]",,,,
1087376194922721281,1087376194922721281,2019-01-21 09:47:41 CST,2019-01-21,09:47:41,-0500,724803098049269760,keeshayodabarb,Keesha@Keeshadoggie,,'Wonder if it may have been right and they’re hiding it? No one has seen her for a long time!  Fox &amp; Friends' accidentally shows graphic saying Ruth Bader Ginsburg is dead  https://t.co/NjJcBJkwQ7,en,[],['https://thehill.com/homenews/media/426276-fox-friends-accidentally-shows-graphic-saying-ruth-bader-ginsburg-is-dead'],[],0,0,1,[],[],https://twitter.com/KeeshaYodabarb/status/1087376194922721281,False,,0,,phoenix,,,,,,[],,,,
