id,conversation_id,created_at,date,time,timezone,user_id,username,name,place,tweet,language,mentions,urls,photos,replies_count,retweets_count,likes_count,hashtags,cashtags,link,retweet,quote_url,video,thumbnail,near,geo,source,user_rt_id,user_rt,retweet_id,reply_to,retweet_date,translate,trans_src,trans_dest
1139320615607947265,1139320615607947265,2019-06-13 18:56:16 CDT,2019-06-13,18:56:16,-0500,889927852854038529,omarion_legend,♒️Sheree Jen’ell Moore♒️,,Yo @GUHH_WEtv in  a few minutes the brand new episode the exploded first episode is  Bow wow got arrested  for domestic violence  turn up time is in 15 minutes #guhhatl,en,"[{'screen_name': 'guhh_wetv', 'name': 'growing up hip hop', 'id': '3234215006'}]",[],[],0,0,0,['guhhatl'],[],https://twitter.com/Omarion_Legend/status/1139320615607947265,False,,0,,chicago,,,,,,[],,,,
1139320377170157569,1139320377170157569,2019-06-13 18:55:20 CDT,2019-06-13,18:55:20,-0500,172458559,ayeluhairik,Luh AIRIK,,Rage Against the Machine,en,[],[],[],0,0,0,[],[],https://twitter.com/AyeLuhAirik/status/1139320377170157569,False,,0,,chicago,,,,,,[],,,,
1139320262271389696,1139171722547159040,2019-06-13 18:54:52 CDT,2019-06-13,18:54:52,-0500,407988095,monicelatrice24,♍️ Gucci Membrane ♍️,,"@NettaJ88 We are synced. As my partner in pants crime, I feel for you.  https://t.co/ERSrNM8B4X",en,[],[],['https://pbs.twimg.com/tweet_video_thumb/D8-tuPwXYAAiJdl.jpg'],0,0,1,[],[],https://twitter.com/MoniceLatrice24/status/1139320262271389696,False,,1,https://pbs.twimg.com/tweet_video_thumb/D8-tuPwXYAAiJdl.jpg,chicago,,,,,,"[{'screen_name': 'NettaJ88', 'name': 'Netta THEE Cardigan', 'id': '21827777'}]",,,,
1139318091916161024,1139278657078398978,2019-06-13 18:46:15 CDT,2019-06-13,18:46:15,-0500,3159888878,dahliazahava,Dahlia Zahava,,"@limcommaabbey like if it helps you feel better then go right ahead, but most people wield it as a way to attack marginalised people or just ignore them completely.",en,[],[],[],0,0,1,[],[],https://twitter.com/DahliaZahava/status/1139318091916161024,False,,0,,chicago,,,,,,[],,,,
1139317449927602178,1139278657078398978,2019-06-13 18:43:42 CDT,2019-06-13,18:43:42,-0500,3159888878,dahliazahava,Dahlia Zahava,,"@limcommaabbey well i'm poor, black, and disabled and was vegan for over a year. that doesn't change the fact that most vegan/environmental discourse is inherently anti-poor, racist, and ableist. and that's what i'm addressing. exceptions don't really matter when this is a general issue!",en,[],[],[],1,0,3,[],[],https://twitter.com/DahliaZahava/status/1139317449927602178,False,,0,,chicago,,,,,,[],,,,
1139311253434904583,1139311253434904583,2019-06-13 18:19:04 CDT,2019-06-13,18:19:04,-0500,3059151905,ilchildrenmh,ICMHP,,Thank you to @SCY_Chicago for including us in today’s critically important talk on Violence Prevention and the New Administration! We were thrilled to join so many powerful partners. #SCYQM,en,"[{'screen_name': 'scy_chicago', 'name': 'scy chicago', 'id': '403654248'}]",[],[],0,0,2,['scyqm'],[],https://twitter.com/ILChildrenMH/status/1139311253434904583,False,https://twitter.com/SCY_Chicago/status/1139266070768947201,0,,chicago,,,,,,[],,,,
1139310583231188993,1139310583231188993,2019-06-13 18:16:25 CDT,2019-06-13,18:16:25,-0500,61851951,michaelconochan,Michael Conochan,,I don’t think Lakers fans realize how often Lonzo is injured. Dude hasn’t played 100 games total in 2 years.,en,[],[],[],0,0,0,[],[],https://twitter.com/MichaelConochan/status/1139310583231188993,False,https://twitter.com/YaBoyBrea/status/1139277906557984768,0,,chicago,,,,,,[],,,,
1139310119039225857,1139296254335356934,2019-06-13 18:14:34 CDT,2019-06-13,18:14:34,-0500,616369407,whitemencantfnk,Mr. FOE-LAYY,,"@AverageJoeOPk @SBN_Ricky @Bulls_Jay For sure, I do too. Just thinking long term in regards to timeline for real contention (at least 2 years) as it pertains to the cost of Zach LaVine’s 3rd contract (in 3 years) and its value compared to resigning a two-way threat like OPJ, extending Laurie and Wendell, plus change",en,[],[],[],1,0,1,[],[],https://twitter.com/WhiteMenCantFnk/status/1139310119039225857,False,,0,,chicago,,,,,,"[{'screen_name': 'AverageJoeOPk', 'name': 'Joey bag o’ Sunshine', 'id': '248647732'}, {'screen_name': 'SBN_Ricky', 'name': ""Ricky O'Donnell"", 'id': '22316661'}, {'screen_name': 'Bulls_Jay', 'name': 'Jason Patt', 'id': '120123576'}]",,,,
1139302034837053440,1139302034837053440,2019-06-13 17:42:26 CDT,2019-06-13,17:42:26,-0500,108811654,sassybritches13,Britt H.,,200% having a full-blown anxiety attack in Walgreens bc healthcare in this country is a FUCKING JOKE.,en,[],[],[],1,0,0,[],[],https://twitter.com/sassyBRITches13/status/1139302034837053440,False,,0,,chicago,,,,,,[],,,,
1139301080343470081,1139301080343470081,2019-06-13 17:38:39 CDT,2019-06-13,17:38:39,-0500,1620682477,sallyldot,Sally LaRowe,,Bonnaroo Single Life Log - Day 2: I bought a huge block of cheese to make cacio e pepe and fully intend to watch television and listen to murder podcasts for several hours.,en,[],[],[],0,0,4,[],[],https://twitter.com/sallyLdot/status/1139301080343470081,False,,0,,chicago,,,,,,[],,,,
1139299938830082049,1139299938830082049,2019-06-13 17:34:07 CDT,2019-06-13,17:34:07,-0500,1009665405076606976,nbatwhite,Thomas White,,I almost said Doug because his shooting but Tyrus Thomas was supposed to be Amare 2.0. 🤷🏾‍♂️,en,[],[],[],0,0,0,[],[],https://twitter.com/NBATWhite/status/1139299938830082049,False,https://twitter.com/NBCSBulls/status/1139174788075786242,0,,chicago,,,,,,[],,,,
1139295141993361409,1139250552817299457,2019-06-13 17:15:03 CDT,2019-06-13,17:15:03,-0500,407988095,monicelatrice24,♍️ Gucci Membrane ♍️,,"@PCM87 People over property, my guy. No one deserves that for shoplifting...and the fact it was a rando that the friend called to the store makes it worse. Don't let these corporations make you believe that murder for stealing is deserved.",en,[],[],[],1,1,22,[],[],https://twitter.com/MoniceLatrice24/status/1139295141993361409,False,,0,,chicago,,,,,,[],,,,
1139293870427164680,1139293870427164680,2019-06-13 17:10:00 CDT,2019-06-13,17:10:00,-0500,805496108587909120,cammikala,Cam Mikala,,#SkateJam2k19 will be dedicated to those who lost their loved ones to gun violence🙏🏽  #2TurntNation 💔✌🏽   https://t.co/p5aKMGvkns  https://t.co/9thSis4jZB,en,[],['https://skatejam2k19.splashthat.com/'],['https://pbs.twimg.com/media/D8-VuxzXkAU7iJ5.jpg'],0,10,6,"['skatejam2k19', '2turntnation']",[],https://twitter.com/CamMikala/status/1139293870427164680,False,,1,https://pbs.twimg.com/media/D8-VuxzXkAU7iJ5.jpg,chicago,,,,,,[],,,,
1139292015966007296,1139281523570610177,2019-06-13 17:02:38 CDT,2019-06-13,17:02:38,-0500,19272393,lex_albrecht,Lex Albrecht,,@TheDailyPeloton @VeoStrip @teamTIBCO VeoStrip is a self adhesive strip that keeps sweat from your eyes.  I scoffed at it... until I tried it. @VeoStrip is like a secret weapon.,en,"[{'screen_name': 'veostrip', 'name': 'veostrip', 'id': '758413814521929729'}]",[],[],1,1,2,[],[],https://twitter.com/Lex_Albrecht/status/1139292015966007296,False,,0,,chicago,,,,,,"[{'screen_name': 'TheDailyPeloton', 'name': 'The Daily Peloton', 'id': '100370471'}, {'screen_name': 'VeoStrip', 'name': 'VeoStrip', 'id': '758413814521929729'}]",,,,
1139290139975442433,1139290139975442433,2019-06-13 16:55:11 CDT,2019-06-13,16:55:11,-0500,560805551,skillhorn12,Luke Billhorn,,"@nbastats Zach Lavine averaged 23.7 PPG 4.5 AST 4.7 REB while shooting 46.7% while playing almost the whole season at age 23.  Cant be many other 23 year olds to put up those numbers, eh?",en,[],[],[],0,0,0,[],[],https://twitter.com/skillhorn12/status/1139290139975442433,False,,0,,chicago,,,,,,[],,,,
1139289471583756288,1139289471583756288,2019-06-13 16:52:31 CDT,2019-06-13,16:52:31,-0500,24276699,tvbrad,Brad Edwards,,"EXCLUSIVE: JoAnn Cunningham, accused in her son - AJ Freund’s murder, delivered a baby girl. Named her Gracie Faith. The baby was taken into state custody after 48 hours, and mom was sent back to the clink.    https://t.co/ZtKZal1XyH  https://t.co/FUicWwjaJn",en,[],['https://chicago.cbslocal.com/2019/06/13/joann-cunningham-accused-in-murder-of-son-a-j-freund-gives-birth-to-baby-daughter-named-gracie-faith/'],['https://pbs.twimg.com/media/D8-RvD6WwAAa0Oy.jpg'],4,12,9,[],[],https://twitter.com/tvbrad/status/1139289471583756288,False,,1,https://pbs.twimg.com/media/D8-RvD6WwAAa0Oy.jpg,chicago,,,,,,[],,,,
1139283193402679303,1139231182888087553,2019-06-13 16:27:34 CDT,2019-06-13,16:27:34,-0500,1075457277740662785,upupandagay,Batgay!,,@aurvnxia The only crime is thinking you can tell Seina what she can or can’t do 😉,en,[],[],[],0,0,0,[],[],https://twitter.com/UpUpandaGay/status/1139283193402679303,False,,0,,chicago,,,,,,[],,,,
1139281254615015424,1139280712513794048,2019-06-13 16:19:52 CDT,2019-06-13,16:19:52,-0500,3309503369,str8statsmlb,AA,,"We could have a bullpen with $18M. Instead, AA took large gambles with an already injured, aging O’Day (albeit was a leg injury to start) and a pitcher (Gausman) with a career ERA over 4. These guys are big risks, especially earning the $ they make. We are a middle market budget",en,[],[],[],0,0,0,[],[],https://twitter.com/Str8StatsMLB/status/1139281254615015424,False,,0,,chicago,,,,,,[],,,,
1139280325874507776,1139280325874507776,2019-06-13 16:16:11 CDT,2019-06-13,16:16:11,-0500,36475665,biddlebrian,Friendly Gayborhood Daddyman,,"It was an enormously healing night singing with the best group of LGBTQ singers in Chicago on the anniversary of the #Pulse shooting.  Let the river run, let all the dreamers wake the nation - come the new Jerusalem.  @WindyCitySings @PigLatinHaiku @ohthebill  https://t.co/2PW7ifxbgi",en,"[{'screen_name': 'windycitysings', 'name': 'windy city performing arts', 'id': '75854674'}, {'screen_name': 'piglatinhaiku', 'name': 'zombie gums', 'id': '56287107'}, {'screen_name': 'ohthebill', 'name': 'ohthebill - #wearamask #blacklivesmatter', 'id': '14298829'}]",[],[],1,1,13,['pulse'],[],https://twitter.com/biddlebrian/status/1139280325874507776,False,,1,https://pbs.twimg.com/ext_tw_video_thumb/1139279871249723392/pu/img/hAFJaYL8YnbSVqQX.jpg,chicago,,,,,,[],,,,
1139276690696392705,1139239212035821568,2019-06-13 16:01:44 CDT,2019-06-13,16:01:44,-0500,52167439,jpgraziano,Jim Graziano,,"@KenWo4LiFe @barstoolWSD @EddieBarstool Parking is pretty brutal to be honest. The move to make is order online or call in for pickup. Your sub will be ready, double park or park right in front. Cops are cool with our customers.",en,[],[],[],1,0,1,[],[],https://twitter.com/JPGraziano/status/1139276690696392705,False,,0,,chicago,,,,,,"[{'screen_name': 'KenWo4LiFe', 'name': 'Ken.W.o.', 'id': '162289496'}, {'screen_name': 'barstoolWSD', 'name': 'whitesoxdave', 'id': '714669102'}, {'screen_name': 'EddieBarstool', 'name': 'Eddie', 'id': '1621367814'}]",,,,
