id,conversation_id,created_at,date,time,timezone,user_id,username,name,place,tweet,language,mentions,urls,photos,replies_count,retweets_count,likes_count,hashtags,cashtags,link,retweet,quote_url,video,thumbnail,near,geo,source,user_rt_id,user_rt,retweet_id,reply_to,retweet_date,translate,trans_src,trans_dest
1136784441232240640,1136784441232240640,2019-06-06 18:58:25 CDT,2019-06-06,18:58:25,-0500,3060449330,rdr_nyc,Rescue Dogs Rock NYC,"{'type': 'Point', 'coordinates': [40.7142, -74.0064]}","🛑URGENT🛑  8 puppies, an entire litter are in danger and  need rescue immediately  These precious babies have no idea how dire their situation is right now   We will NOT sit back and allow this to happen  We MUST…  https://t.co/wc3GZJPZXz",en,[],['https://www.instagram.com/p/ByYzkSLAyV2/?igshid=1g5w5sjx0lgtf'],[],2,23,17,[],[],https://twitter.com/RDR_NYC/status/1136784441232240640,False,,0,,new york city,,,,,,[],,,,
1136784436144611328,1136427169578594304,2019-06-06 18:58:24 CDT,2019-06-06,18:58:24,-0500,18527224,merocity,Deplorable Neanderthal Merocity,,@TamikaQueenz Then sweetie you’re the racist. Hating white people or any other color or race just because. Just hating makes your whole persona a whole negative vibe. Negative will always follow you for the rest of your life.,en,[],[],[],0,0,0,[],[],https://twitter.com/Merocity/status/1136784436144611328,False,,0,,new york city,,,,,,"[{'screen_name': 'TamikaQueenz', 'name': 'Mika 💎', 'id': '1136343503980466176'}]",,,,
1136784167574941698,1136782879046930432,2019-06-06 18:57:20 CDT,2019-06-06,18:57:20,-0500,810220801,josh_fti,joshua,,"as for what i’m going to be performing, i figured this (basement show) style of show would not be the right place to do the whole J,FTI LIVE SHOW soooooo i decided to do a J,FTI themed DJ set!!!!!! 🎶✨...let’s have fun and rage together...it’s been a looong year already...",en,[],[],[],1,0,0,[],[],https://twitter.com/josh_fti/status/1136784167574941698,False,,0,,new york city,,,,,,[],,,,
1136783223437045760,1136783223437045760,2019-06-06 18:53:35 CDT,2019-06-06,18:53:35,-0500,76752057,vcpalliance,VCP Alliance,,Join us for Movie Night!  Bring a blanket and come out to enjoy a free movie on the lush green lawn. Friday June 7th at 8pm at Sachkerah Woods- enter the park at West Gun Hill Road and Jerome Avenue.  https://t.co/CTyPqWHHEE,en,[],[],['https://pbs.twimg.com/media/D8aqULpWkAAfLve.jpg'],0,0,0,[],[],https://twitter.com/vcpalliance/status/1136783223437045760,False,,1,https://pbs.twimg.com/media/D8aqULpWkAAfLve.jpg,new york city,,,,,,[],,,,
1136782549815050240,1136782549815050240,2019-06-06 18:50:54 CDT,2019-06-06,18:50:54,-0500,20722409,jdavidjackson,David Jackson,,All Eyez On Me - Tupac Evil Empire - Rage Against The Machine Sublime - Sublime,en,[],[],[],0,0,1,[],[],https://twitter.com/jdavidjackson/status/1136782549815050240,False,https://twitter.com/Jrodius/status/1136750205066330113,0,,new york city,,,,,,[],,,,
1136780953911795714,1136780953911795714,2019-06-06 18:44:34 CDT,2019-06-06,18:44:34,-0500,746601140,iamra92,🇨🇴,,Songs kids at my school made me hate because they sing it too much  1.) Lil Nas X - Old town Road 2.) That Shark Doo Doo Doo song 3.) YNW Melly - Murder on my mind 4.) Ciara - Level Up  5.) A boogie with a hoodie - Look back at it  Don’t sing those songs around me please,en,[],[],[],0,0,2,[],[],https://twitter.com/iAmRa92/status/1136780953911795714,False,,0,,new york city,,,,,,[],,,,
1136780871346925568,1136777413306855425,2019-06-06 18:44:14 CDT,2019-06-06,18:44:14,-0500,24069529,realjonabrams,Jon Abrams,,"I’m 100% fine, unharmed, just really irked. Had death threats screamed at me, but there wasn’t violence. Didn’t intend to bring up bad memories for anybody who’s been through worse.",en,[],[],[],3,0,2,[],[],https://twitter.com/RealJonAbrams/status/1136780871346925568,False,,0,,new york city,,,,,,[],,,,
1136780599950303232,1136778849323061248,2019-06-06 18:43:10 CDT,2019-06-06,18:43:10,-0500,15410368,melissa_ful,Melissa M. Sutherland,,@UCBeau I guess proto-fascist white supremacist was too long.,en,[],[],[],1,0,1,[],[],https://twitter.com/melissa_ful/status/1136780599950303232,False,,0,,new york city,,,,,,[],,,,
1136779587696963584,1136779587696963584,2019-06-06 18:39:08 CDT,2019-06-06,18:39:08,-0500,20992322,drantbradley,"Anthony B. Bradley, PhD",,Sounds like someone doesn’t know the research (&amp; sociological literature on Greek life) and doesn’t know the difference between rape and “rape culture.” Somebody also hasn’t read much “theology of the body.” 👇🏾👇🏾...[And that’s “Dr. or Professor Sir.”],en,[],[],[],2,0,16,[],[],https://twitter.com/drantbradley/status/1136779587696963584,False,https://twitter.com/_ablackguy/status/1136777870288850946,0,,new york city,,,,,,[],,,,
1136778497194713089,1136778497194713089,2019-06-06 18:34:48 CDT,2019-06-06,18:34:48,-0500,24546792,lamarspeaks,Jason Lamar Walker,,Also add apologizing for racist marijuana arrests,en,[],[],[],0,0,5,[],[],https://twitter.com/LamarSpeaks/status/1136778497194713089,False,https://twitter.com/melissagira/status/1136688484121534466,0,,new york city,,,,,,[],,,,
1136776444674228225,1136776444674228225,2019-06-06 18:26:39 CDT,2019-06-06,18:26:39,-0500,949049168248614913,sobrinosstore,Sobrinos Kids,,"Since James H took the dive, I’ve done everything to protest Jeopardy. #Stinks",en,[],[],[],0,0,0,['stinks'],[],https://twitter.com/SobrinosStore/status/1136776444674228225,False,,0,,new york city,,,,,,[],,,,
1136776247860744192,1136776247860744192,2019-06-06 18:25:52 CDT,2019-06-06,18:25:52,-0500,42245367,qing__k,Mr. World Tour ✈️,,Just had to stop myself and walk away before i caught an assault charge... AGAIN 😡,en,[],[],[],0,0,0,[],[],https://twitter.com/Qing__k/status/1136776247860744192,False,,0,,new york city,,,,,,[],,,,
1136775341391962112,1136775341391962112,2019-06-06 18:22:16 CDT,2019-06-06,18:22:16,-0500,17393196,nypdnews,NYPD NEWS,,"📰 “When a survivor comes forward to report a sexual assault they’re showing a tremendous amount of strength &amp; courage. So it’s very important that when they muster up the strength &amp; courage to come forward, we support them.” -@NYPDSVU Chief Harrison ⬇️    https://t.co/Lv8wBzlH9V",en,"[{'screen_name': 'nypdsvu', 'name': 'nypd special victims', 'id': '2884353550'}]",['http://ow.ly/K8iU30oTFNN'],[],3,7,47,[],[],https://twitter.com/NYPDnews/status/1136775341391962112,False,,0,,new york city,,,,,,[],,,,
1136775006128627718,1136775006128627718,2019-06-06 18:20:56 CDT,2019-06-06,18:20:56,-0500,392987005,flexcaruso,alex unfortunately,,worst fucking video i’ve ever seen. filmed maybe 3.5 seconds of the attack and the rest is you ruining my ear drums. smh 2/10 needs better work,en,[],[],[],1,1,7,[],[],https://twitter.com/flexcaruso/status/1136775006128627718,False,https://twitter.com/katiemcward/status/1136119398945689601,0,,new york city,,,,,,[],,,,
1136774202093166592,1136699337952636929,2019-06-06 18:17:44 CDT,2019-06-06,18:17:44,-0500,1090682603651383296,riordainn,riordainn 👾,,@BDS_Girl @estheramma @Alyssa_Milano What?? How is a 2 state solution racist?,en,[],[],[],1,0,1,[],[],https://twitter.com/riordainn/status/1136774202093166592,False,,0,,new york city,,,,,,"[{'screen_name': 'BDS_Girl', 'name': 'JM Parker 🇺🇦', 'id': '3938162955'}, {'screen_name': 'estheramma', 'name': 'Estheramma', 'id': '443925556'}, {'screen_name': 'Alyssa_Milano', 'name': 'Alyssa Milano', 'id': '26642006'}]",,,,
1136773228289024005,1136773228289024005,2019-06-06 18:13:52 CDT,2019-06-06,18:13:52,-0500,485022214,millidollababe6,RareGem6,,Aye bro @KwabenaSharif what they doing in east orange they shooting a film,en,"[{'screen_name': 'kwabenasharif', 'name': 'bunchy carter', 'id': '234903659'}]",[],[],1,0,0,[],[],https://twitter.com/millidollababe6/status/1136773228289024005,False,,0,,new york city,,,,,,[],,,,
1136773136916131840,1136773136916131840,2019-06-06 18:13:30 CDT,2019-06-06,18:13:30,-0500,72334903,realtaradevlin,Tara Devlin 🇺🇦❤️💪,,"Honor the fallen by RESISTING TRUMP- the greatest threat to freedom, democracy and decency since the Revolution!  #TheGreatestGeneration #NewNewDeal #DDay75Anniversary #Resist  https://t.co/7x82KVRJY8",en,[],[],['https://pbs.twimg.com/media/D8ahIw3XUAASCCx.jpg'],2,1,2,"['thegreatestgeneration', 'newnewdeal', 'dday75anniversary', 'resist']",[],https://twitter.com/REALTaraDevlin/status/1136773136916131840,False,,1,https://pbs.twimg.com/media/D8ahIw3XUAASCCx.jpg,new york city,,,,,,[],,,,
1136771583912161280,1136771583912161280,2019-06-06 18:07:20 CDT,2019-06-06,18:07:20,-0500,351895654,therockawaywave,The Wave,"{'type': 'Point', 'coordinates': [40.59459459, -73.77269287]}",The one-man coalition Bruce Jacobs is armed and ready at the CB14 Health &amp; Human Services Committee meeting. Tonight's topic is a proposed outpatient substance abuse clinic on Beach 102nd Street.  https://t.co/3y0Y6DxQBw,en,[],[],['https://pbs.twimg.com/media/D8afuxRW4AAvr2-.jpg'],0,0,2,[],[],https://twitter.com/TheRockawayWave/status/1136771583912161280,False,,1,https://pbs.twimg.com/media/D8afuxRW4AAvr2-.jpg,new york city,,,,,,[],,,,
1136771021619552262,1136771021619552262,2019-06-06 18:05:06 CDT,2019-06-06,18:05:06,-0500,1579257762,blanc2618,Brian Lancet,,"As North Korea Threat Grows, U.S. Anti-Missile Warhead Stumbles  https://t.co/PzX3b38pl0",en,[],['https://a.msn.com/r/2/AACuM4Q?m=en-us&referrerID=InAppShare'],[],0,0,0,[],[],https://twitter.com/blanc2618/status/1136771021619552262,False,,0,,new york city,,,,,,[],,,,
1136770679242743809,1136770679242743809,2019-06-06 18:03:44 CDT,2019-06-06,18:03:44,-0500,64670367,cleverironictag,TheInsistence,,‘Largest Undercover Dairy Investigation in History’ Uncovers Shocking Abuse at ‘Disneyland’ of Farms  https://t.co/liC1z9ZgJl,en,[],['https://www.ecowatch.com/largest-undercover-dairy-investigation-in-history-uncovers-shocking-abuse-at-disneyland-of-farms-2638712260.html'],[],0,0,0,[],[],https://twitter.com/cleverironictag/status/1136770679242743809,False,,0,,new york city,,,,,,[],,,,
1136770374820093952,1136770374820093952,2019-06-06 18:02:32 CDT,2019-06-06,18:02:32,-0500,351895654,therockawaywave,The Wave,"{'type': 'Point', 'coordinates': [40.59459459, -73.77269287]}",The Wave is here live at the Bayswater Jewish Center to discuss a proposed out-patient substance abuse clinic on Beach 102nd Street. Lots of discussions are taking place outside the meeting room. The session is about to kick off in a matter of minutes.  https://t.co/oC3tvzWxgO,en,[],[],['https://pbs.twimg.com/media/D8aeoXcXkAEkDkk.jpg'],0,2,0,[],[],https://twitter.com/TheRockawayWave/status/1136770374820093952,False,,1,https://pbs.twimg.com/media/D8aeoXcXkAEkDkk.jpg,new york city,,,,,,[],,,,
1136770031331762181,1136760651811053568,2019-06-06 18:01:10 CDT,2019-06-06,18:01:10,-0500,635923278,nezukostomato,Big Time Tommy⏩ Home,,@the_KandiKid @chellywithaboge go suck his dick rn hes been injured for months,en,[],[],[],1,0,1,[],[],https://twitter.com/NezukosTomato/status/1136770031331762181,False,,0,,new york city,,,,,,"[{'screen_name': 'the_KandiKid', 'name': 'breaux', 'id': '557979987'}, {'screen_name': 'chellywithaboge', 'name': 'c h e l l y ♡', 'id': '966797736'}]",,,,
1136769562375049216,1136769562375049216,2019-06-06 17:59:18 CDT,2019-06-06,17:59:18,-0500,736260811740610560,liana_bro0ke,Liana Brooke,,"If you dont #wearorange for gun violence awareness tomorrow, Sorry, We can't be friends.",en,[],[],[],0,0,2,['wearorange'],[],https://twitter.com/Liana_bro0ke/status/1136769562375049216,False,,0,,new york city,,,,,,[],,,,
1136769391360651265,1136581761230606336,2019-06-06 17:58:37 CDT,2019-06-06,17:58:37,-0500,813902060,mamaredfield,Sandy Phillips,,"@vamomvb   Problem is gun violence happens anywhere, anytime to anyone. No one is safe. #SurvivorsEmpowered",en,[],[],[],0,0,1,['survivorsempowered'],[],https://twitter.com/MamaRedfield/status/1136769391360651265,False,,0,,new york city,,,,,,"[{'screen_name': 'vamomvb', 'name': 'Kathy Bartkus', 'id': '23359841'}]",,,,
1136768184491696130,1136581761230606336,2019-06-06 17:53:49 CDT,2019-06-06,17:53:49,-0500,813902060,mamaredfield,Sandy Phillips,,"@vamomvb   We just left there yesterday. Hoping to help the survivors with their ""new normal"". 11th response to a public mass shooting.",en,[],[],[],4,0,22,[],[],https://twitter.com/MamaRedfield/status/1136768184491696130,False,,0,,new york city,,,,,,"[{'screen_name': 'vamomvb', 'name': 'Kathy Bartkus', 'id': '23359841'}]",,,,
1136767448219303938,1136767448219303938,2019-06-06 17:50:54 CDT,2019-06-06,17:50:54,-0500,78761383,gneely,Genevieve Neely,"{'type': 'Point', 'coordinates': [40.76265798, -73.9714247]}",Y’all.  WTF kinda sexist fortune is THIS??? #bull$#!t @ TAO Uptown  https://t.co/PoBw86djC9,en,[],['https://www.instagram.com/p/ByYr2DzhFNTt5mCBOMjoOQIFHuob86J0Ic1KdI0/?igshid=1p3w9dlai269g'],[],0,0,0,['bull'],[],https://twitter.com/gneely/status/1136767448219303938,False,,0,,new york city,,,,,,[],,,,
1136766474033541121,1136685443288842241,2019-06-06 17:47:02 CDT,2019-06-06,17:47:02,-0500,55895345,lesliehamer7,leslie,,@TrumpsGAGirl @xXCASCABELXx @SpeakerPelosi Nobody in MAGA land could understand. Total IQ is too low What is a nationalist? Racist?,en,[],[],[],0,0,0,[],[],https://twitter.com/lesliehamer7/status/1136766474033541121,False,,0,,new york city,,,,,,"[{'screen_name': 'TrumpsGAGirl', 'name': '🇺🇸~Lori~🇺🇸⭐️⭐️⭐️', 'id': '1101660031630491648'}, {'screen_name': 'xXCASCABELXx', 'name': 'Snake', 'id': '61303166'}, {'screen_name': 'SpeakerPelosi', 'name': 'Nancy Pelosi', 'id': '15764644'}]",,,,
1136765403735179264,1136765403735179264,2019-06-06 17:42:46 CDT,2019-06-06,17:42:46,-0500,1473930913,tino_fuentes123,🇵🇷TinoFuentes🇨🇺,"{'type': 'Point', 'coordinates': [40.84166667, -73.9375]}","I don't know who or why they would put all this shit inside these bags, but they are definitely doing some harm. I've seen some of the weirdest overdoses due to these mixture. We definitely need a way to check these…  https://t.co/NN6EJ9CFG7",en,[],['https://www.instagram.com/p/ByYq6PkAKcU/?igshid=ulqcze8oalks'],[],0,0,0,[],[],https://twitter.com/tino_fuentes123/status/1136765403735179264,False,,0,,new york city,,,,,,[],,,,
1136765083105845253,1136765083105845253,2019-06-06 17:41:30 CDT,2019-06-06,17:41:30,-0500,622153967,vkchopragw,Vijay Chopra,,Fox News Has a Hard Time Processing the Las Vegas Shooting: The Daily Show  https://t.co/Zf7EUCaexP via @YouTube,en,"[{'screen_name': 'youtube', 'name': 'youtube', 'id': '10228272'}]",['https://youtu.be/nV5fXPVeZoQ'],[],0,0,0,[],[],https://twitter.com/vkchopragw/status/1136765083105845253,False,,0,,new york city,,,,,,[],,,,
1136764707359117313,1136764707359117313,2019-06-06 17:40:00 CDT,2019-06-06,17:40:00,-0500,1380397489,joannegair,Joanne Gair,"{'type': 'Point', 'coordinates': [40.7142, -74.0064]}","#Repost @DamienCarney ・・・ It’s a wrap. Another fantastic day of shooting. Hair and photography me. Make up @joannegair 🙏 @ New York, New York  https://t.co/hFmGfSwqnL",en,"[{'screen_name': 'damiencarney', 'name': 'damien carney', 'id': '179571074'}, {'screen_name': 'joannegair', 'name': 'joanne gair', 'id': '1380397489'}]",['https://www.instagram.com/p/ByYqmJqjt3g/?igshid=1v5az8n2ln2gz'],[],0,0,1,['repost'],[],https://twitter.com/JoanneGair/status/1136764707359117313,False,,0,,new york city,,,,,,[],,,,
1136762282678071297,1136761475551387653,2019-06-06 17:30:22 CDT,2019-06-06,17:30:22,-0500,2257737920,irreverentgamer,⛧ Rob ⛧,,"@Beat2Perfection Blast ""No Easy Way Out"" by Robert Tepper during the ride and just fucking rage.",en,[],[],[],0,1,1,[],[],https://twitter.com/IrreverentGamer/status/1136762282678071297,False,,0,,new york city,,,,,,"[{'screen_name': 'Beat2Perfection', 'name': 'PhoenixMew', 'id': '75157579'}]",,,,
1136762173051592705,1136762173051592705,2019-06-06 17:29:56 CDT,2019-06-06,17:29:56,-0500,4875466151,jamilla_uddin,Jamilla Uddin,,"Suffering from #mentalillness is NO JOKE. It affects EVERYONE; it knows no boundaries. Maybe now people will start taking it seriously &amp; give it the attention it truly deserves.  If you’re having thoughts of self-harm/ harming others, please call 911 immediately!  Don’t give up!!",en,[],[],[],0,1,4,['mentalillness'],[],https://twitter.com/jamilla_uddin/status/1136762173051592705,False,https://twitter.com/ChaimDeutsch/status/1136739199565074433,0,,new york city,,,,,,[],,,,
1136762030763982854,1136751120901124096,2019-06-06 17:29:22 CDT,2019-06-06,17:29:22,-0500,291518861,michaeltotka,michael totka,,"@Smoove_maco @NBCNews the nypd is racist af and still awful much of the time (cops, shocking) but that doesn't give you license to be a bigot. illegal activities inside sw were directly related to it *being a gay bar pre riot*  ex: the riot started bc it was ""illegal to sell alcohol to homosexuals""",en,[],[],[],2,0,0,[],[],https://twitter.com/michaeltotka/status/1136762030763982854,False,,0,,new york city,,,,,,"[{'screen_name': 'Smoove_maco', 'name': 'Smoove44', 'id': '819712655221026819'}, {'screen_name': 'NBCNews', 'name': 'NBC News', 'id': '14173315'}]",,,,
1136761692900265988,1136761692900265988,2019-06-06 17:28:02 CDT,2019-06-06,17:28:02,-0500,14545457,lawrences59,Yankee Ludi Champion,,I’m bout to witness white on white crime in this quiet car on the metro north.  https://t.co/u8ksIQFcd0,en,[],[],['https://pbs.twimg.com/tweet_video_thumb/D8aWuZvWwAsV-ub.jpg'],0,0,0,[],[],https://twitter.com/lawrenceS59/status/1136761692900265988,False,,1,https://pbs.twimg.com/tweet_video_thumb/D8aWuZvWwAsV-ub.jpg,new york city,,,,,,[],,,,
1136757916336361473,1136757916336361473,2019-06-06 17:13:01 CDT,2019-06-06,17:13:01,-0500,770781940341288960,rudygiuliani,Rudy W. Giuliani,,"Nancy Peolosi has lost it. She wants to see @realDonaldTrump in prison. Mueller’s Angry Dems conducted a scorched earth investigation and couldn’t find a crime. There’s actual evidence Comey, McCabe, Stroyk, and the Bidens committed crimes. Prison for them?",en,"[{'screen_name': 'realdonaldtrump', 'name': 'donald j. trump', 'id': '25073877'}]",[],[],10998,6538,23513,[],[],https://twitter.com/RudyGiuliani/status/1136757916336361473,False,,0,,new york city,,,,,,[],,,,
1136756421872275462,1136756421872275462,2019-06-06 17:07:05 CDT,2019-06-06,17:07:05,-0500,909433231904268288,quickstickblog,QuickStick,,Kavanagh and Garnsey on attack together? Party like it’s 2016! @NDlacrosse,en,"[{'screen_name': 'ndlacrosse', 'name': 'notre dame lacrosse', 'id': '94621195'}]",[],[],0,11,46,[],[],https://twitter.com/quickstickblog/status/1136756421872275462,False,https://twitter.com/PLLRedwoods/status/1136715028638212096,0,,new york city,,,,,,[],,,,
1136755529391464448,1136755529391464448,2019-06-06 17:03:32 CDT,2019-06-06,17:03:32,-0500,2595687982,vc_migs,Migs Flores Jr. 🇵🇷,,"I was 6 years old I had a Sega genesis and Streets of Rage 1,Street Fighter 2: Championship Edition &amp; MK1 were the only games I had. It changed my life in a good way cause it made me stay out of trouble.",en,[],[],[],1,1,5,[],[],https://twitter.com/VC_Migs/status/1136755529391464448,False,https://twitter.com/Jemmillion/status/1136645720306585602,0,,new york city,,,,,,[],,,,
1136751756019470337,1136427230580563969,2019-06-06 16:48:33 CDT,2019-06-06,16:48:33,-0500,749759701,jstarhenry,jhenry,,@TenaciousE5 @rotherwell @nowthisnews @netminnow @AOC Like long live the Klan- and then you murder black folks?,en,[],[],[],0,0,2,[],[],https://twitter.com/jstarhenry/status/1136751756019470337,False,,0,,new york city,,,,,,"[{'screen_name': 'TenaciousE5', 'name': 'TenaciousE', 'id': '1325782298378301440'}, {'screen_name': 'rotherwell', 'name': 'gary long', 'id': '20646393'}, {'screen_name': 'nowthisnews', 'name': 'NowThis', 'id': '701725963'}, {'screen_name': 'netminnow', 'name': 'Park Ranger', 'id': '242051914'}, {'screen_name': 'AOC', 'name': 'Alexandria Ocasio-Cortez', 'id': '138203134'}]",,,,
1136751534736400384,1136079244965163008,2019-06-06 16:47:40 CDT,2019-06-06,16:47:40,-0500,1460188722,patatadisastra,Pecan Shannageddon,,"@CassandraPeak @macdugong YES THIS TOO. I’m autistic as well and a ringing phone is an immediate anxiety attack, no matter who’s calling.",en,[],[],[],0,0,0,[],[],https://twitter.com/patatadisastra/status/1136751534736400384,False,,0,,new york city,,,,,,"[{'screen_name': 'CassandraPeak', 'name': 'Cassandra Peak', 'id': '1184562283793539074'}, {'screen_name': 'macdugong', 'name': 'Sempronius ꙮ MacDugong', 'id': '941403164917534720'}]",,,,
1136750731162279945,1136740023901020160,2019-06-06 16:44:28 CDT,2019-06-06,16:44:28,-0500,50383497,schmeelk,John Schmeelk,,"@robrobinson7 Im sorry for your issues, but lay off the pedophile jokes.",en,[],[],[],0,0,0,[],[],https://twitter.com/Schmeelk/status/1136750731162279945,False,,0,,new york city,,,,,,"[{'screen_name': 'robrobinson7', 'name': 'Robert Robinson', 'id': '93192821'}]",,,,
1136750086006935552,1136741024968187920,2019-06-06 16:41:54 CDT,2019-06-06,16:41:54,-0500,20992322,drantbradley,"Anthony B. Bradley, PhD",,"@Brandon_McCord No it hasn’t in the civilized West. Other things marked it. Rites of passage ceremonies were about conquering animals, enemies, war, etc. not conquering women. And the threat of pregnancy 100% kept men away from sex in the US. That’s not even disputed in in gender studies.",en,[],[],[],3,0,2,[],[],https://twitter.com/drantbradley/status/1136750086006935552,False,,0,,new york city,,,,,,"[{'screen_name': 'Brandon_McCord', 'name': 'Brandon McCord', 'id': '376586404'}]",,,,
1136749905609990144,1136749905609990144,2019-06-06 16:41:11 CDT,2019-06-06,16:41:11,-0500,2779649272,bradleyflowers7,Bradley Flowers,,Had a blast shooting a podcast with @garyvee today!  https://t.co/Zp2DWektN2,en,"[{'screen_name': 'garyvee', 'name': 'gary vaynerchuk', 'id': '5768872'}]",[],['https://pbs.twimg.com/media/D8aMA0AX4AI5m0j.jpg'],2,1,22,[],[],https://twitter.com/Bradleyflowers7/status/1136749905609990144,False,,1,https://pbs.twimg.com/media/D8aMA0AX4AI5m0j.jpg,new york city,,,,,,[],,,,
1136749101931012097,1136733110975025152,2019-06-06 16:38:00 CDT,2019-06-06,16:38:00,-0500,316043737,brittianycierra,brittianycierra,,"@TheRaroLae @michellers1313 I do this too! So far I have, in order:  A sankofa Shooting stars that I designed A Phoenix Matching “heart with a b cubed” sister tattoos   A new one is coming.",en,[],[],[],1,1,2,[],[],https://twitter.com/brittianycierra/status/1136749101931012097,False,,0,,new york city,,,,,,"[{'screen_name': 'TheRaroLae', 'name': 'Raro Lae', 'id': '2189205949'}, {'screen_name': 'michellers1313', 'name': 'Mrs. Lamar Jackson 😈🇰🇪', 'id': '1507003543'}]",,,,
1136748831335505920,1136748831335505920,2019-06-06 16:36:55 CDT,2019-06-06,16:36:55,-0500,1123248922045091840,malik_jpg,Malik,,Can’t wait to start shooting at the beach soon.  https://t.co/XIs5yFXvWC,en,[],[],['https://pbs.twimg.com/media/D8aLCRXXYAEusy_.jpg'],1,0,4,[],[],https://twitter.com/malik_jpg/status/1136748831335505920,False,,1,https://pbs.twimg.com/media/D8aLCRXXYAEusy_.jpg,new york city,,,,,,[],,,,
1136748482897862656,1136748482897862656,2019-06-06 16:35:32 CDT,2019-06-06,16:35:32,-0500,1277172313,revdionneb,Dionne P. Boissiere,,Because if it takes a village to raise a child then it must take the village to protect them! Together we can end ALL forms of gender-based violence in our lifetime! #ThursdaysInBlack #LinkUp2EndGBV  https://t.co/qG3jJzyxq2,en,[],[],['https://pbs.twimg.com/media/D8aKuBzXoAYZQWH.jpg'],0,3,2,"['thursdaysinblack', 'linkup2endgbv']",[],https://twitter.com/revdionneb/status/1136748482897862656,False,,1,https://pbs.twimg.com/media/D8aKuBzXoAYZQWH.jpg,new york city,,,,,,[],,,,
1136748200004661248,1136748200004661248,2019-06-06 16:34:25 CDT,2019-06-06,16:34:25,-0500,868017237722005504,thouxanchas,chas,,"I am not the type to attack my man over nothing. Im chill as hell, we both know how to behave. All you need is a healthy mind, healthy body, healthy pockets ❣️",en,[],[],[],0,1,4,[],[],https://twitter.com/thouxanchas/status/1136748200004661248,False,,0,,new york city,,,,,,[],,,,
1136748039207563265,1136748039207563265,2019-06-06 16:33:46 CDT,2019-06-06,16:33:46,-0500,16113072,julianzelizer,Julian Zelizer,,"While there is almost no bipartisan support for an impeachment process, that does not mean that supporting the process is partisan or “extremist.” That is just a talking point from the White House. @justinamash @gtconway3d have both outlined the conservative case.",en,"[{'screen_name': 'justinamash', 'name': 'justin amash', 'id': '233842454'}, {'screen_name': 'gtconway3d', 'name': 'george conway🌻', 'id': '471677441'}]",[],[],0,7,37,[],[],https://twitter.com/julianzelizer/status/1136748039207563265,False,,0,,new york city,,,,,,[],,,,
1136744957249822721,1136744957249822721,2019-06-06 16:21:32 CDT,2019-06-06,16:21:32,-0500,361717258,buddhabeerbar,BuddhaBeerBar,"{'type': 'Point', 'coordinates': [40.8572822, -73.9319424]}",Gun Hill/Big Alice Nothin To it on tap now.  https://t.co/V1Y9nybjDc @gunhillbrewery #BeerMenus,en,"[{'screen_name': 'gunhillbrewery', 'name': 'gun hill brewery', 'id': '1474945586'}]",['https://www.beermenus.com/places/3693-buddha-beer-bar?b_id=311799&utm_content=beer-311799&utm_medium=serving-share&utm_source=twitter'],[],0,0,1,['beermenus'],[],https://twitter.com/BuddhaBeerBar/status/1136744957249822721,False,,0,,new york city,,,,,,[],,,,
