id,conversation_id,created_at,date,time,timezone,user_id,username,name,place,tweet,language,mentions,urls,photos,replies_count,retweets_count,likes_count,hashtags,cashtags,link,retweet,quote_url,video,thumbnail,near,geo,source,user_rt_id,user_rt,retweet_id,reply_to,retweet_date,translate,trans_src,trans_dest
1091848037234892800,1091848037234892800,2019-02-02 17:57:12 CST,2019-02-02,17:57:12,-0500,46863371,sydneysanders_,honey mustard,,I fucking wish I was dead,en,[],[],[],1,0,2,[],[],https://twitter.com/sydneysanders_/status/1091848037234892800,False,,0,,philadelphia,,,,,,[],,,,
1091833149611479041,1091833149611479041,2019-02-02 16:58:02 CST,2019-02-02,16:58:02,-0500,1117531088,piczbybootz,Lisa Marie,"{'type': 'Point', 'coordinates': [40.0743, -75.2027]}",Isnt it 😄 - Drinking a Kick In the Pants by Chestnut Hill Brewing Company @ Chestnut Hill Brewing Company  —  https://t.co/mTbA0Naq4x,en,[],['http://untp.beer/s/c708053773'],[],0,0,0,[],[],https://twitter.com/piczbybootz/status/1091833149611479041,False,,0,,philadelphia,,,,,,[],,,,
1091828398622687232,1091828398622687232,2019-02-02 16:39:10 CST,2019-02-02,16:39:10,-0500,3403668707,romegs_,Romey 😈🥶,,"You not gonna talk me to death, because you got free nights and weekends. 😂",en,[],[],[],1,0,1,[],[],https://twitter.com/romegs_/status/1091828398622687232,False,,0,,philadelphia,,,,,,[],,,,
1091825935458992130,1091812451627294721,2019-02-02 16:29:22 CST,2019-02-02,16:29:22,-0500,1238910540,yungtilla7,Yung Tilla,,@Kiing_Jordan Oh nah not broad street that’s death 😭 maybe like Cecil B,en,[],[],[],0,0,1,[],[],https://twitter.com/YungTilla7/status/1091825935458992130,False,,0,,philadelphia,,,,,,"[{'screen_name': 'Kiing_Jordan', 'name': '⚡️J.C.', 'id': '427880421'}]",,,,
1091825367520890883,1091822315246112768,2019-02-02 16:27:07 CST,2019-02-02,16:27:07,-0500,3404474350,_melissyy,Melissa 🐞,,@krisss_x3 Dead 😂,en,[],[],[],0,0,0,[],[],https://twitter.com/_melissyy/status/1091825367520890883,False,,0,,philadelphia,,,,,,[],,,,
1091823233123401728,1091823233123401728,2019-02-02 16:18:38 CST,2019-02-02,16:18:38,-0500,768802638209093632,thecookeepuss,☆Squishy Munchkin☆,,#ThingsConfuciusNeverSaid Bruce Lee ain't dead you know. They got him frozen in carbonite down under Chatsworth. They're gonna melt him down as soon as the economy gets better. #DCCab,en,[],[],[],0,0,0,"['thingsconfuciusneversaid', 'dccab']",[],https://twitter.com/TheCookeePuss/status/1091823233123401728,False,,0,,philadelphia,,,,,,[],,,,
1091822419172577281,1091822419172577281,2019-02-02 16:15:24 CST,2019-02-02,16:15:24,-0500,1048414729297977344,joeyknowstoo,AS MY GUARDIAN ANGEL PROTECTS ME I CALL ALL ANGELS,,@IIIDeaton Please send prayers to my-sister-law LISA @walshmt  she going through the death of her FATHER PLEASE SEND HER HOPE DURING HER GRIEF. She lost her mother at 12 yrs old and my brother in 2005. With three small children .She in faithful in GOD.but of you to lift her/love.,en,"[{'screen_name': 'walshmt', 'name': 'matthew walsh', 'id': '66155071'}]",[],[],6,3,14,[],[],https://twitter.com/JOEYKNOWSTOO/status/1091822419172577281,False,,0,,philadelphia,,,,,,[],,,,
1091822262121103361,1091791832927879168,2019-02-02 16:14:47 CST,2019-02-02,16:14:47,-0500,40281442,englishby,Billy Englishby,,@TPiMBW Principle  Attack to Defense Sub principals: Disrupt Organize Direction  Principle  Defense Sub principals: Isolation  Termination Dispossession  Principle  Defense to Offense Sub principals: Space Direction Movement,en,[],[],[],1,0,4,[],[],https://twitter.com/Englishby/status/1091822262121103361,False,,0,,philadelphia,,,,,,"[{'screen_name': 'TPiMBW', 'name': 'Jed Davies', 'id': '88313974'}]",,,,
1091819894985891840,1091819894985891840,2019-02-02 16:05:22 CST,2019-02-02,16:05:22,-0500,67326663,tweetydimes_,Numerology handicapping,,Putting the finishing touches on a night card   We ain’t done yet we got some more ass to kick,en,[],[],[],0,1,4,[],[],https://twitter.com/tweetydimes_/status/1091819894985891840,False,,0,,philadelphia,,,,,,[],,,,
1091819087959941121,1091819087959941121,2019-02-02 16:02:10 CST,2019-02-02,16:02:10,-0500,430741049,massimofaggioli,Massimo Faggioli,,Difficult to explain how it feels to arrive home to your kids after two days of always talking and listening about sexual abuse of children,en,[],[],[],3,1,15,[],[],https://twitter.com/MassimoFaggioli/status/1091819087959941121,False,,0,,philadelphia,,,,,,[],,,,
1091818214051459072,1091804312915845128,2019-02-02 15:58:41 CST,2019-02-02,15:58:41,-0500,176317930,doncali_,Don Cali 👑,,@_d_will_ I would assume one of two things 1. The way they have handled the protest/ topic of police brutality or 2. For the way they have handled officiating and rule guidelines,en,[],[],[],2,0,0,[],[],https://twitter.com/DonCali_/status/1091818214051459072,False,,0,,philadelphia,,,,,,"[{'screen_name': '_d_will_', 'name': 'DayQuan', 'id': '106608095'}]",,,,
1091817515636924416,1091799642298335233,2019-02-02 15:55:55 CST,2019-02-02,15:55:55,-0500,808849638778400769,searcher9090,Drifter,,"@pennys_scar @YouTube Yup, the whole album is  https://t.co/dScnLZx9uX was actually the first tape cassette I ever bought.I still listen to parts of it at least once a week.Not the cassette of course, which was beaten to death and didn't last  https://t.co/dvdRcVBuYq  https://t.co/dVS2S5WHvF",en,[],"['http://fantastic.It', 'http://long.lol']",['https://pbs.twimg.com/tweet_video_thumb/DybqPBoW0AAOjPI.jpg'],1,0,1,[],[],https://twitter.com/searcher9090/status/1091817515636924416,False,,1,https://pbs.twimg.com/tweet_video_thumb/DybqPBoW0AAOjPI.jpg,philadelphia,,,,,,"[{'screen_name': 'pennys_scar', 'name': 'Scars and Shadows', 'id': '1002671020782866434'}, {'screen_name': 'YouTube', 'name': 'YouTube', 'id': '10228272'}]",,,,
1091817082164051968,1091817082164051968,2019-02-02 15:54:12 CST,2019-02-02,15:54:12,-0500,37146892,deeqbeknowing,Sturdy Sanchez,,I’m Dead-Dead  https://t.co/2TZF3RHZJn,en,[],[],['https://pbs.twimg.com/media/Dybp2JmWsAYl43W.jpg'],0,0,0,[],[],https://twitter.com/DeeqBeKnowing/status/1091817082164051968,False,,1,https://pbs.twimg.com/media/Dybp2JmWsAYl43W.jpg,philadelphia,,,,,,[],,,,
1091815140255850496,1091815140255850496,2019-02-02 15:46:29 CST,2019-02-02,15:46:29,-0500,32308617,typogawd,Bry Mar| 🗣 ♠ The Chemist| Pain,,Noggas is dead ruining the world right in front of our eyes and nobody gives a fuck lmao 😂,en,[],[],[],0,0,0,[],[],https://twitter.com/TypoGawd/status/1091815140255850496,False,,0,,philadelphia,,,,,,[],,,,
1091814257375825920,1091804312915845128,2019-02-02 15:42:58 CST,2019-02-02,15:42:58,-0500,176317930,doncali_,Don Cali 👑,,"@_d_will_ There’s no hurt until Sunday my team is STiLL the reigning super bowl champs, I just find it slightly hypocritical to say fuck the nfl for something your entire organization represents but I guess 🤷🏾‍♂️",en,[],[],[],1,0,0,[],[],https://twitter.com/DonCali_/status/1091814257375825920,False,,0,,philadelphia,,,,,,"[{'screen_name': '_d_will_', 'name': 'DayQuan', 'id': '106608095'}]",,,,
1091810652161785857,1091440567110823937,2019-02-02 15:28:38 CST,2019-02-02,15:28:38,-0500,14070672,spudrph,Michael,,"@TragenHerrick @Baer_Bill My real answer is, whatever laws result in a reduction of gun death, I’m for them. Period. And there are dozens of examples of laws that do that.",en,[],[],[],1,0,0,[],[],https://twitter.com/spudrph/status/1091810652161785857,False,,0,,philadelphia,,,,,,"[{'screen_name': 'TragenHerrick', 'name': 'Tragen Herrick', 'id': '1674230738'}, {'screen_name': 'Baer_Bill', 'name': 'Bill Baer', 'id': '55851119'}]",,,,
1091808823906574337,1091808823906574337,2019-02-02 15:21:23 CST,2019-02-02,15:21:23,-0500,158075545,decadentfag,deplorable,,everyone better go like my insta selfie or you’re all fucking dead to me,en,[],[],[],0,0,1,[],[],https://twitter.com/decadentfag/status/1091808823906574337,False,,0,,philadelphia,,,,,,[],,,,
1091805030976491520,1091805030976491520,2019-02-02 15:06:18 CST,2019-02-02,15:06:18,-0500,370362206,ttell3m,Dinwiddie PHILLY,,This FLYERS SQUAD isnt CRAPPIN OUT at 7 W’s in Row now on their way to CRAZY 8th.The PP was the DIFFERENCE MAKER being able to have 2 PP LINES that are LEGIT n IMO JVR big reAson for it cuz hes camps out front screening the goalie too bad he got hurt in 3gm of Season,en,[],[],[],0,0,0,[],[],https://twitter.com/TTeLL3M/status/1091805030976491520,False,https://twitter.com/NHLFlyers/status/1091799022594076677,0,,philadelphia,,,,,,[],,,,
1091804186860240896,1091804186860240896,2019-02-02 15:02:57 CST,2019-02-02,15:02:57,-0500,237524560,pio__mac,🤢PIO_MAC🤢🏁🏁🏁,,Dealing with headaches from a person that ain’t yours is dead ✌🏽✌🏽,en,[],[],[],0,0,0,[],[],https://twitter.com/PIO__MAC/status/1091804186860240896,False,,0,,philadelphia,,,,,,[],,,,
1091801246510522369,1091746981783973888,2019-02-02 14:51:16 CST,2019-02-02,14:51:16,-0500,797219844466900992,haindlkathleen,Kathleen Haindl,,@NamiKim_DogsSK How can anyone hurt that puppy? Someone explain,en,[],[],[],0,0,0,[],[],https://twitter.com/HaindlKathleen/status/1091801246510522369,False,,0,,philadelphia,,,,,,"[{'screen_name': 'NamiKim_DogsSK', 'name': 'SaveKoreanDogs', 'id': '897181759217049600'}]",,,,
1091797582165225472,1091797582165225472,2019-02-02 14:36:42 CST,2019-02-02,14:36:42,-0500,77111443,jaixo__,Jigga,,I’ve read so many Hollywood death stories. Sharon Tate’s was definitely one of the saddest,en,[],[],[],0,0,0,[],[],https://twitter.com/jaixo__/status/1091797582165225472,False,,0,,philadelphia,,,,,,[],,,,
1091797154971160577,1091797154971160577,2019-02-02 14:35:01 CST,2019-02-02,14:35:01,-0500,842050030970277888,suevelez19,Sue Velez,,Punish Man for Reported Assault on Iraqi Neighbors  https://t.co/8Efjm0fBkN,en,[],['https://forcechange.com/524759/punish-man-for-reported-assault-on-iraqi-neighbors/'],[],0,0,0,[],[],https://twitter.com/SueVelez19/status/1091797154971160577,False,,0,,philadelphia,,,,,,[],,,,
1091797062222520320,1091797062222520320,2019-02-02 14:34:38 CST,2019-02-02,14:34:38,-0500,41917912,notbrianfallon,kat graves 🌙,,me getting a tattoo: this literally doesn’t hurt at all   me getting my eyebrows waxed &amp; plucked: [SCREAM CRIES],en,[],[],[],0,0,13,[],[],https://twitter.com/notbrianfallon/status/1091797062222520320,False,,0,,philadelphia,,,,,,[],,,,
1091792794677665793,1091792794677665793,2019-02-02 14:17:41 CST,2019-02-02,14:17:41,-0500,1633853574,bryan_e_leib,Bryan E. Leib,,"I think that @Edelman11 &amp; the people of #Israel have a lot in common! Resilient. Passionate. Gritty. And finally,  they are both small but pack a big punch!!! Do you agree? 🇺🇲✡️🇮🇱",en,"[{'screen_name': 'edelman11', 'name': 'julian edelman', 'id': '272250951'}]",[],[],0,0,0,['israel'],[],https://twitter.com/Bryan_E_Leib/status/1091792794677665793,False,https://twitter.com/NFL/status/1091490149303758854,0,,philadelphia,,,,,,[],,,,
1091790550309761025,1091790550309761025,2019-02-02 14:08:46 CST,2019-02-02,14:08:46,-0500,788079787625607169,forward_promise,Forward Promise,,"Context matters. @MoniqueWMorris’ #PUSHOUT brings up the notion of confinement. She says “one doesn’t have to be formally engaged with the criminal justice system to be in confinement. Violence, physical abuse, sex trafficking are all forms of confinement.”  https://t.co/0NX6bRNNKV",en,"[{'screen_name': 'moniquewmorris', 'name': 'monique w morris, edd', 'id': '615434631'}]",[],['https://pbs.twimg.com/media/DybRtxcWwAYyCqk.jpg'],0,0,3,['pushout'],[],https://twitter.com/Forward_Promise/status/1091790550309761025,False,,1,https://pbs.twimg.com/media/DybRtxcWwAYyCqk.jpg,philadelphia,,,,,,[],,,,
1091787638837858305,1091787208401526784,2019-02-02 13:57:12 CST,2019-02-02,13:57:12,-0500,4603914503,king_poppa_dom,🐛,,"He took his hand and placed it under her chin,raised her head looked her dead in the eyes with a fire of excitement,mischievously grins and responded with, and why might that be?",en,[],[],[],1,0,1,[],[],https://twitter.com/King_Poppa_Dom/status/1091787638837858305,False,,0,,philadelphia,,,,,,[],,,,
1091779648445444096,1091779648445444096,2019-02-02 13:25:27 CST,2019-02-02,13:25:27,-0500,128313714,broadstbull,Sam Carchidi,,The long layoff has really hurt the #Oilers....NOT!,en,[],[],[],6,2,7,['oilers'],[],https://twitter.com/BroadStBull/status/1091779648445444096,False,,0,,philadelphia,,,,,,[],,,,
1091779531223023616,1091779531223023616,2019-02-02 13:24:59 CST,2019-02-02,13:24:59,-0500,96893355,mingzdaking,King Domo 😜🌿,,I wanna partner with a tattoo shop that’s willing do donate their time cover people’s suicide/self harm scars.. I think that’ll be so dope 🙌🏾,en,[],[],[],0,0,0,[],[],https://twitter.com/MinGzDaKing/status/1091779531223023616,False,,0,,philadelphia,,,,,,[],,,,
1091774617189056515,1091774617189056515,2019-02-02 13:05:27 CST,2019-02-02,13:05:27,-0500,394686084,tatiyanahdoe,Ms.Doe,,I’m dead😭,en,[],[],[],0,0,0,[],[],https://twitter.com/TatiyanahDoe/status/1091774617189056515,False,https://twitter.com/1chaingang/status/1091713470867955713,0,,philadelphia,,,,,,[],,,,
1091773567073693697,1091773567073693697,2019-02-02 13:01:17 CST,2019-02-02,13:01:17,-0500,392916584,luvlilakay,AK🪐,,Iont talk ya mans only heard what the tec said and his ass dead,en,[],[],[],0,0,0,[],[],https://twitter.com/LUVLILAKAY/status/1091773567073693697,False,,0,,philadelphia,,,,,,[],,,,
1091771971128512512,1091771971128512512,2019-02-02 12:54:56 CST,2019-02-02,12:54:56,-0500,239431784,lillazyturtle,super lazy,,The episode of Martin when becomes brother sunflower be having me dead 😂😭 najiramba,en,[],[],[],0,0,1,[],[],https://twitter.com/LilLazyTurtle/status/1091771971128512512,False,,0,,philadelphia,,,,,,[],,,,
1091769737154043909,1091769737154043909,2019-02-02 12:46:04 CST,2019-02-02,12:46:04,-0500,4603914503,king_poppa_dom,🐛,,I wonder who else is gonna be on Jump Force,en,[],[],[],0,0,0,[],[],https://twitter.com/King_Poppa_Dom/status/1091769737154043909,False,,0,,philadelphia,,,,,,[],,,,
1091769570090733574,1091769570090733574,2019-02-02 12:45:24 CST,2019-02-02,12:45:24,-0500,1122427309,joshkrugerphl,Josh Kruger,,"It took TWO Mr. Clean Magic Erasers for me to get my cat’s snot off my one wall. It’s near where he regularly sits directly in front of a heat vent. I regularly change the furnace’s air filter, but he’s dead set on sitting there which of course causes sneezes. 🎨 🐈 🤧",en,[],[],[],3,0,11,[],[],https://twitter.com/JoshKrugerPHL/status/1091769570090733574,False,,0,,philadelphia,,,,,,[],,,,
1091767309784440833,1091767309784440833,2019-02-02 12:36:25 CST,2019-02-02,12:36:25,-0500,398116208,kiki31817,Kimberly Keyser,"{'type': 'Point', 'coordinates': [40.1713, -75.0947]}",Circle of death #blackbelttest #tangsoodo 🇰🇷 @ Emerald Karate  https://t.co/frohkB4gF5,en,[],['https://www.instagram.com/p/BtY8EhfFDSuxnkcPU_3KDdPOSCIFZm1xGbpMi00/?utm_source=ig_twitter_share&igshid=1i2jd74t7tvht'],[],0,0,0,"['blackbelttest', 'tangsoodo']",[],https://twitter.com/KiKi31817/status/1091767309784440833,False,,0,,philadelphia,,,,,,[],,,,
1091765050375921665,1091765050375921665,2019-02-02 12:27:26 CST,2019-02-02,12:27:26,-0500,2544227579,mikeand1kefgc,Devon,,Damn I was asleep for most of this Jump Force beta session. Curse my sleep schedule. 😭,en,[],[],[],0,0,0,[],[],https://twitter.com/Mikeand1keFGC/status/1091765050375921665,False,,0,,philadelphia,,,,,,[],,,,
1091764878199717888,1091730558370103296,2019-02-02 12:26:45 CST,2019-02-02,12:26:45,-0500,2617616291,pb11379,Trisha Baum,,@AGirlInPhilly @Target Nice! I need to kick it up a notch and do the same! 👙🙌🏼 Have fun shopping!,en,[],[],[],1,0,1,[],[],https://twitter.com/Pb11379/status/1091764878199717888,False,,0,,philadelphia,,,,,,"[{'screen_name': 'AGirlInPhilly', 'name': 'Kimberly..In Philly', 'id': '633932055'}, {'screen_name': 'Target', 'name': 'Target', 'id': '89084561'}]",,,,
1091764491900145664,1091762963986501634,2019-02-02 12:25:13 CST,2019-02-02,12:25:13,-0500,381919736,johnlk_80,John,,"@LPDonovan I might have been willing to buy this if he hadn't fucking copped to it last night. It's too late now! If you want to mount a shaggy defense, you can't admit to the offense and apologize first.",en,[],[],[],0,0,1,[],[],https://twitter.com/johnlk_80/status/1091764491900145664,False,,0,,philadelphia,,,,,,"[{'screen_name': 'LPDonovan', 'name': 'Liam Donovan', 'id': '48012011'}]",,,,
1091764398211952646,1091764398211952646,2019-02-02 12:24:51 CST,2019-02-02,12:24:51,-0500,2155759573,emiliogallard,Emiliano Gallardo,,There ain’t nothing in my chest a hollow cave that caused my death,en,[],[],[],0,0,0,[],[],https://twitter.com/EmilioGallard/status/1091764398211952646,False,,0,,philadelphia,,,,,,[],,,,
1091764095207030785,1091504600706887681,2019-02-02 12:23:38 CST,2019-02-02,12:23:38,-0500,519567295,biddle23,Hot Whistle,,Leer just hurt his back twerking to back that ass up....told him shit gets real in your 30s,en,[],[],[],1,0,1,[],[],https://twitter.com/Biddle23/status/1091764095207030785,False,,0,,philadelphia,,,,,,[],,,,
1091758192411987975,1091758192411987975,2019-02-02 12:00:11 CST,2019-02-02,12:00:11,-0500,229980228,pradasy,HAMILTON THE USURPER,,All my exes are dead,en,[],[],[],0,0,0,[],[],https://twitter.com/PradaSy/status/1091758192411987975,False,https://twitter.com/DollFaceBeautii/status/1091695127398096896,0,,philadelphia,,,,,,[],,,,
