id,conversation_id,created_at,date,time,timezone,user_id,username,name,place,tweet,language,mentions,urls,photos,replies_count,retweets_count,likes_count,hashtags,cashtags,link,retweet,quote_url,video,thumbnail,near,geo,source,user_rt_id,user_rt,retweet_id,reply_to,retweet_date,translate,trans_src,trans_dest
1136744307782819853,1136102113610805250,2019-06-06 16:18:57 CDT,2019-06-06,16:18:57,-0500,357818335,justthrownback,Luke D.I.,,@kijster_1217 @RobertNorCal @BigBangBudd @timjhogan @ChuckWendig @HillaryClinton Imagine not being able to make a good point so you attack someone grammar on Twitter. lol now that's irony,en,[],[],[],0,0,0,[],[],https://twitter.com/JustThrownBack/status/1136744307782819853,False,,0,,new york city,,,,,,"[{'screen_name': 'RobertNorCal', 'name': 'Robert', 'id': '2168939118'}, {'screen_name': 'BigBangBudd', 'name': 'Budd “Big Bang” Dwyer', 'id': '1103152279358750721'}, {'screen_name': 'timjhogan', 'name': 'Tim Hogan', 'id': '221298491'}, {'screen_name': 'ChuckWendig', 'name': 'Chuck Wendig', 'id': '26029878'}, {'screen_name': 'HillaryClinton', 'name': 'Hillary Clinton', 'id': '1339835893'}]",,,,
1136743731166683136,1136743731166683136,2019-06-06 16:16:39 CDT,2019-06-06,16:16:39,-0500,859457982,omarshahjaffrey,Omar Shah Jaffrey 💻,,"So the security at Move On's event with Kamala were able to find work I see. ""Woman rushes on stage during Jeff Bezos Q&amp;A to protest chicken farming practices""   https://t.co/iWLLyhD3Sg",en,[],['https://twitter.com/i/events/1136713302883463168'],[],0,0,0,[],[],https://twitter.com/OmarShahJaffrey/status/1136743731166683136,False,,0,,new york city,,,,,,[],,,,
1136741581434839040,1136369437781553152,2019-06-06 16:08:07 CDT,2019-06-06,16:08:07,-0500,569623011,nyota_nuru,Barbara Jackson,,@RealMuckmaker The head of the department of justice of these United States stated that staff lying to investigators was not a crime.  How does he still have his job.  What happen to the “whole truth and nothing but the truth”? Fuk.,en,[],[],[],0,0,0,[],[],https://twitter.com/Nyota_nuru/status/1136741581434839040,False,,0,,new york city,,,,,,"[{'screen_name': 'RealMuckmaker', 'name': 'Muckmaker™', 'id': '732515283902943232'}]",,,,
1136741024968187920,1136741024968187920,2019-06-06 16:05:54 CDT,2019-06-06,16:05:54,-0500,20992322,drantbradley,"Anthony B. Bradley, PhD",,"When the birth control pill became mainstream post-1920s, masculinity began to be defined by sexual conquest. Threat of pregnancy kept men in check. Post 1960s women’s sexual liberalism redefined masculinity for frats opening the door for today’s college sexual assault crisis.🤯  https://t.co/BfGl4PuEK2",en,[],[],['https://pbs.twimg.com/media/D8aD2wwWsAA2g0Y.jpg'],13,6,45,[],[],https://twitter.com/drantbradley/status/1136741024968187920,False,,1,https://pbs.twimg.com/media/D8aD2wwWsAA2g0Y.jpg,new york city,,,,,,[],,,,
1136740603423858692,1136740603423858692,2019-06-06 16:04:14 CDT,2019-06-06,16:04:14,-0500,20997115,sannydamet,Danny Samet,,I remember syrup sandwiches and crime allowances.  https://t.co/oVxtZs2m4X,en,[],[],['https://pbs.twimg.com/media/D8aDjSsXUAAPqju.jpg'],0,1,4,[],[],https://twitter.com/SannyDamet/status/1136740603423858692,False,,1,https://pbs.twimg.com/media/D8aDjSsXUAAPqju.jpg,new york city,,,,,,[],,,,
1136740194294607873,1136641070132080641,2019-06-06 16:02:36 CDT,2019-06-06,16:02:36,-0500,839283383784071168,jrod2110,Yusuf Omar,,"@TygerManz @AIPAC @RepSchneider Why U.S. is going after #Iran, not letting them get their hands on A nuklear weapon,  SANCTIONS put, while #Israel the most dangerous ""country"" isn't saying what they have. How many nuclear warheads do they have?400+ aimed @ #Iran. All Enemies even U.S. if we stop shielding them.",en,[],[],[],0,0,0,"['iran', 'israel', 'iran']",[],https://twitter.com/Jrod2110/status/1136740194294607873,False,,0,,new york city,,,,,,"[{'screen_name': 'TygerManz', 'name': 'Tyger Manz', 'id': '988419242101018624'}, {'screen_name': 'AIPAC', 'name': 'AIPAC', 'id': '15987296'}, {'screen_name': 'RepSchneider', 'name': 'Rep. Brad Schneider', 'id': '1071840474'}]",,,,
1136739720703221763,1136739720703221763,2019-06-06 16:00:43 CDT,2019-06-06,16:00:43,-0500,21469731,theadvoc8te,Nikki Peele,"{'type': 'Point', 'coordinates': [40.7207559, -74.0007613]}","CRIME ALERT - Homicide on 3500 Block of 22nd Street, SE    https://t.co/shL6WTpnSr",en,[],['https://www.congressheightsontherise.com/blog/homicide-on-3500-block-of-22nd-street-se'],[],1,0,0,[],[],https://twitter.com/TheAdvoc8te/status/1136739720703221763,False,,0,,new york city,,,,,,[],,,,
1136739268435615745,1136738583426080774,2019-06-06 15:58:55 CDT,2019-06-06,15:58:55,-0500,94704964,dfnbrown1,"DeForrest Brown, Jr. | Speaker Music",,"...simmering and sullied rage, a “porous self“ amongst a collection of equally open selves as they are all interwoven into a singular vibrational ontology as a means of evoking a coming outside of oneself within a shared sphere of intimacy.  https://t.co/HlJcDQAwID",en,[],[],[],0,1,5,[],[],https://twitter.com/dfnbrown1/status/1136739268435615745,False,,1,https://pbs.twimg.com/ext_tw_video_thumb/1136738614187044864/pu/img/pXkeAvlNX-vlVYSo.jpg,new york city,,,,,,[],,,,
1136737290385072129,1136712500550995968,2019-06-06 15:51:04 CDT,2019-06-06,15:51:04,-0500,14528754,killerbebe,KillerBebe,,"@SoCalDisney Lol yes, and I found out they are actually filming a murder scene.",en,[],[],[],1,0,0,[],[],https://twitter.com/KillerBebe/status/1136737290385072129,False,,0,,new york city,,,,,,"[{'screen_name': 'SoCalDisney', 'name': 'Greg', 'id': '347606574'}]",,,,
1136736803581566978,1136736803581566978,2019-06-06 15:49:08 CDT,2019-06-06,15:49:08,-0500,715539325,eddiewynn7,Eddie Wynn 🇺🇸 KAG2020,,Hint hint : that actually makes you racist 🤷🏼‍♂️ what a concept I know,en,[],[],[],0,0,0,[],[],https://twitter.com/eddiewynn7/status/1136736803581566978,False,https://twitter.com/20TimesUtd/status/1136620004890349568,0,,new york city,,,,,,[],,,,
1136734837308629001,1136734837308629001,2019-06-06 15:41:19 CDT,2019-06-06,15:41:19,-0500,23897833,gracec4david,GRACE ❤🎶😷,,#tbt  … Janie's Got A Gun by Aerosmith  https://t.co/a7m9Ud9CWz,en,[],['https://open.spotify.com/track/5fMwvrqujbQjUxcNPcYrUF?context=spotify%3Auser%3Aspotify%3Aplaylist%3A37i9dQZF1DWWwaxRea1LWS&si=XK4Vwpc2SWi8PPXrFU4c2w'],[],0,0,0,['tbt'],[],https://twitter.com/GraceC4David/status/1136734837308629001,False,,0,,new york city,,,,,,[],,,,
1136733568791658496,1136733568791658496,2019-06-06 15:36:16 CDT,2019-06-06,15:36:16,-0500,239104613,champagneyonnie,AtomicBombYon🇯🇲,,Hmm  sounds like a civil assault and battery case is in order 🧐,en,[],[],[],0,0,0,[],[],https://twitter.com/champagneyonnie/status/1136733568791658496,False,https://twitter.com/JustinPierceTV/status/1136667354161590272,0,,new york city,,,,,,[],,,,
1136733517306617857,1136733517306617857,2019-06-06 15:36:04 CDT,2019-06-06,15:36:04,-0500,124201767,franky_webcomic,John Hazard,,"15K+ followers on Instagram LOVE our daily comic Background Noise. They’re asking for a book &amp; we need an agent!  365 Days on the Couch follows Lisa &amp; John -- love, parenting, protest marches, &amp; struggles with mental illness &amp; the gig economy in modern-day NYC  #pitmad  #GN #Mem",en,[],[],[],0,6,0,"['pitmad', 'gn', 'mem']",[],https://twitter.com/Franky_WebComic/status/1136733517306617857,False,,0,,new york city,,,,,,[],,,,
1136733066037276672,1136733066037276672,2019-06-06 15:34:17 CDT,2019-06-06,15:34:17,-0500,17539413,niketa,Niketa Patel,,“The institution of journalism is under attack so we need to do everything we can to support each other.” - @donlemon talking about newsroom collaboration #FTFutureNews  https://t.co/3K3AZj8CpM,en,"[{'screen_name': 'donlemon', 'name': 'don lemon', 'id': '16051471'}]",[],['https://pbs.twimg.com/media/D8Z8sntXYAAVv7s.jpg'],0,0,0,['ftfuturenews'],[],https://twitter.com/Niketa/status/1136733066037276672,False,,1,https://pbs.twimg.com/media/D8Z8sntXYAAVv7s.jpg,new york city,,,,,,[],,,,
1136732467031924736,1136650996191551488,2019-06-06 15:31:54 CDT,2019-06-06,15:31:54,-0500,35831257,frankdigiacomo,Frank DiGiacomo,,@henryfingjames Take the gun. Leave the cannoli.,en,[],[],[],0,0,3,[],[],https://twitter.com/frankdigiacomo/status/1136732467031924736,False,,0,,new york city,,,,,,"[{'screen_name': 'henryfingjames', 'name': 'Bruce Handy', 'id': '382706561'}]",,,,
1136732239348285442,1136620498194968576,2019-06-06 15:30:59 CDT,2019-06-06,15:30:59,-0500,183755664,gg067,Phoenix-G,,"@BullPup2A @mattyfree01 @POTUS what about the first time he visited.  all the protest against him, so please dont say all people of the UK love him.  dont get that shit twisted.",en,[],[],[],0,0,0,[],[],https://twitter.com/gg067/status/1136732239348285442,False,,0,,new york city,,,,,,"[{'screen_name': 'mattyfree01', 'name': 'Protector of Truth', 'id': '20736424'}, {'screen_name': 'POTUS', 'name': 'President Biden', 'id': '1349149096909668363'}]",,,,
1136729356443824129,1136729356443824129,2019-06-06 15:19:32 CDT,2019-06-06,15:19:32,-0500,37818167,tasiajensen,Tasia Jensen,,Today there was a protest against a Drag Queen Story Hour in Brooklyn. It was met with a counter protest.  https://t.co/35uNf9n8cT,en,[],[],[],0,1,4,[],[],https://twitter.com/tasiajensen/status/1136729356443824129,False,,1,https://pbs.twimg.com/ext_tw_video_thumb/1136729302664450049/pu/img/I1JUUmJtaCmUyczI.jpg,new york city,,,,,,[],,,,
1136729328975306753,1136729328975306753,2019-06-06 15:19:26 CDT,2019-06-06,15:19:26,-0500,1566494670,silsterinpensel,SilvinaSterinPensel,,#FTFutureNews @jason_w_white  @facebook answers a question from @RanaForoohar about their responsibility when terrorists use the platform  (the mosque massacre in NZealand was live-streamed. “We do good helping organize 4example the #MillionWomenMarch &amp; we try hard2 minimize harm,en,"[{'screen_name': 'jason_w_white', 'name': 'jason white', 'id': '34018040'}, {'screen_name': 'facebook', 'name': 'facebook', 'id': '217804739'}, {'screen_name': 'ranaforoohar', 'name': 'rana foroohar', 'id': '468823008'}]",[],[],0,0,2,"['ftfuturenews', 'millionwomenmarch']",[],https://twitter.com/SilSterinPensel/status/1136729328975306753,False,,0,,new york city,,,,,,[],,,,
1136728536755122177,1136728536755122177,2019-06-06 15:16:17 CDT,2019-06-06,15:16:17,-0500,50179868,britshaniece,Brittany♚,,"Danger can happen any and everywhere, but the DR has been in the news a little too much 😐",en,[],[],[],2,2,1,[],[],https://twitter.com/britshaniece/status/1136728536755122177,False,,0,,new york city,,,,,,[],,,,
1136726781967437824,1136726781967437824,2019-06-06 15:09:18 CDT,2019-06-06,15:09:18,-0500,14563023,landryst,Stephen Landry,,The #economics of #privacy: major tech companies are less of a threat to our actual privacy than is typically assumed. - @TylerCowen @MargRev    https://t.co/kJCzXxGJa4  https://t.co/PB9rjQg71X,en,"[{'screen_name': 'tylercowen', 'name': 'tylercowen', 'id': '8496762'}, {'screen_name': 'margrev', 'name': 'marginal revolution', 'id': '252672612'}]",['https://marginalrevolution.com/marginalrevolution/2019/06/the-economics-of-privacy.html'],['https://pbs.twimg.com/media/D8Z2-pWWsAADQ3Y.png'],0,0,0,"['economics', 'privacy']",[],https://twitter.com/landryst/status/1136726781967437824,False,,1,https://pbs.twimg.com/media/D8Z2-pWWsAADQ3Y.png,new york city,,,,,,[],,,,
1136726266776903680,1136726266776903680,2019-06-06 15:07:16 CDT,2019-06-06,15:07:16,-0500,250716147,globalactionpw,GlobalActionPW,,"Now at UN, General Assembly high level discussion on crime prevention and regional organizations, @MexOnu cites recent ""synergies"" to combat the illegal trafficking of small arms and light weapons.  Yet, the challenges associated with arms trafficking continue to multiply.",en,"[{'screen_name': 'mexonu', 'name': 'misión de méxico onu', 'id': '1703926747'}]",[],[],0,2,1,[],[],https://twitter.com/GlobalActionPW/status/1136726266776903680,False,,0,,new york city,,,,,,[],,,,
1136725694262763520,1136725694262763520,2019-06-06 15:04:59 CDT,2019-06-06,15:04:59,-0500,250716147,globalactionpw,GlobalActionPW,,"Now at UN, General Assembly high level discussion on crime prevention and regional organizations, @ColombiaONU cites the many economic and social benefits that would accrue from a country with fewer guns and lower crime rates.",en,"[{'screen_name': 'colombiaonu', 'name': 'colombia at the united nations in new york', 'id': '246538620'}]",[],[],0,0,0,[],[],https://twitter.com/GlobalActionPW/status/1136725694262763520,False,,0,,new york city,,,,,,[],,,,
1136725458937098240,1136720390523432961,2019-06-06 15:04:03 CDT,2019-06-06,15:04:03,-0500,101816065,joelockhart,Joe Lockhart,,"13. has not moved any of them to the floor. A. should it? what's in those bills? Q. Things like gun safety, election integrity and health care? A. No, it doesn't concern the President at all. Now if it was about abusing migrants and their families or imposing tariffs on anyone",en,[],[],[],2,4,28,[],[],https://twitter.com/joelockhart/status/1136725458937098240,False,,0,,new york city,,,,,,[],,,,
1136725430503976960,1136512359055462400,2019-06-06 15:03:56 CDT,2019-06-06,15:03:56,-0500,1000705917590130688,100percentman20,PEACFUL_WARRIOR,,@realDonaldTrump What about the active hate crimes that are being done to the Lgbt community? Illegal porn being filmed without the victims knowledge for gay shaming. Everyone but the victim has been paid.,en,[],[],[],0,0,0,[],[],https://twitter.com/100percentMan20/status/1136725430503976960,False,,0,,new york city,,,,,,"[{'screen_name': 'realDonaldTrump', 'name': 'Donald J. Trump', 'id': '25073877'}]",,,,
1136725069739319303,1136725069739319303,2019-06-06 15:02:30 CDT,2019-06-06,15:02:30,-0500,250716147,globalactionpw,GlobalActionPW,,"Now at UN, General Assembly high level discussion on crime prevention and regional organizations, @courtenayrat (Jamaica) cites priority of minimizing vulnerabilities in communities, creating increased statistical robustness to track criminality.  Illegal firearms remain rampant.",en,"[{'screen_name': 'courtenayrat', 'name': 'courtenay rattray', 'id': '489964891'}]",[],[],0,0,0,[],[],https://twitter.com/GlobalActionPW/status/1136725069739319303,False,,0,,new york city,,,,,,[],,,,
1136724362118258689,1136720390523432961,2019-06-06 14:59:41 CDT,2019-06-06,14:59:41,-0500,101816065,joelockhart,Joe Lockhart,,"10. on the President's abuse of power would make them accountable to their voters.  And, like I said before, that would be a disaster for Republicans.  The President is counting on the media to forget that Republicans actually are still on Capitol Hill.  In fact its central to",en,[],[],[],1,8,42,[],[],https://twitter.com/joelockhart/status/1136724362118258689,False,,0,,new york city,,,,,,[],,,,
1136724282803965953,1136724282803965953,2019-06-06 14:59:22 CDT,2019-06-06,14:59:22,-0500,250716147,globalactionpw,GlobalActionPW,,"Now at UN, General Assembly high level discussion on crime prevention and regional organizations, @courtenayrat (Jamaica) cites a high murder rate that directly impacts SDG and national development implementation and has ""worrisome implications"" for the health of our societies.",en,"[{'screen_name': 'courtenayrat', 'name': 'courtenay rattray', 'id': '489964891'}]",[],[],0,0,0,[],[],https://twitter.com/GlobalActionPW/status/1136724282803965953,False,,0,,new york city,,,,,,[],,,,
1136723726630891526,1136723726630891526,2019-06-06 14:57:10 CDT,2019-06-06,14:57:10,-0500,250716147,globalactionpw,GlobalActionPW,,"Now at UN, General Assembly high level discussion on crime prevention and regional organizations, @AustriaUN seeks clarity from the panel on ""obstacles to cooperation"" on organized criminal matters. @CARICOMorg urges ""respect for the knowledge on the ground"" in crime prevention.",en,"[{'screen_name': 'austriaun', 'name': 'austria un 💙💛', 'id': '3733032917'}, {'screen_name': 'caricomorg', 'name': 'caribbean community (caricom)', 'id': '2690862564'}]",[],[],0,1,0,[],[],https://twitter.com/GlobalActionPW/status/1136723726630891526,False,,0,,new york city,,,,,,[],,,,
1136723361055301639,1136723361055301639,2019-06-06 14:55:43 CDT,2019-06-06,14:55:43,-0500,2686870282,painpearson,Arnell Pearson,,Why do some Hispanic and white people act surprised or shock when you tell them a lot of they people are racist lol,en,[],[],[],0,1,1,[],[],https://twitter.com/painpearson/status/1136723361055301639,False,,0,,new york city,,,,,,[],,,,
1136723013011935232,1136723013011935232,2019-06-06 14:54:20 CDT,2019-06-06,14:54:20,-0500,250716147,globalactionpw,GlobalActionPW,,"Now at UN, General Assembly high level discussion on crime prevention and regional organizations, @AustriaUN lauds @INTERPOL_HQ efforts on behalf of SDG 16 implementation.  Notes the importance of endorsing common standards for criminal response to guide cooperation in this area.",en,"[{'screen_name': 'austriaun', 'name': 'austria un 💙💛', 'id': '3733032917'}, {'screen_name': 'interpol_hq', 'name': 'interpol', 'id': '50643002'}]",[],[],0,0,0,[],[],https://twitter.com/GlobalActionPW/status/1136723013011935232,False,,0,,new york city,,,,,,[],,,,
1136722912692580352,1136722912692580352,2019-06-06 14:53:56 CDT,2019-06-06,14:53:56,-0500,14848078,alecperkins,Alec Perkins,,In 2017 there was a terrorist attack not far from this spot by someone using a car as a weapon against people on bikes.  It is shameful but unsurprising that the @NYPDnews neglected to hold this reckless thug accountable.   https://t.co/i9gsPd6rph,en,"[{'screen_name': 'nypdnews', 'name': 'nypd news', 'id': '17393196'}]",['https://twitter.com/thelizgonzales/status/1136640224325488642?s=21'],[],0,1,6,[],[],https://twitter.com/alecperkins/status/1136722912692580352,False,https://twitter.com/thelizgonzales/status/1136640224325488642?s=21,0,,new york city,,,,,,[],,,,
1136722170028199936,1136722170028199936,2019-06-06 14:50:59 CDT,2019-06-06,14:50:59,-0500,52695440,shola_olushola,Olúsholá,,"Breaking: The @MBuhari Federal Government of Nigeria via NBC shuts down @AIT_Online, @Raypowerfm100 indefinitely.  Attack of free speech begins?",en,"[{'screen_name': 'mbuhari', 'name': 'muhammadu buhari', 'id': '2936714848'}, {'screen_name': 'ait_online', 'name': 'ait', 'id': '508912396'}, {'screen_name': 'raypowerfm100', 'name': 'raypowerfm', 'id': '957758656220672000'}]",[],[],0,1,0,[],[],https://twitter.com/shola_olushola/status/1136722170028199936,False,,0,,new york city,,,,,,[],,,,
