id,conversation_id,created_at,date,time,timezone,user_id,username,name,place,tweet,language,mentions,urls,photos,replies_count,retweets_count,likes_count,hashtags,cashtags,link,retweet,quote_url,video,thumbnail,near,geo,source,user_rt_id,user_rt,retweet_id,reply_to,retweet_date,translate,trans_src,trans_dest
1176647172043026435,1176647172043026435,2019-09-24 18:58:41 CDT,2019-09-24,18:58:41,-0500,523415459,dannydecent1,Danny D.,"{'type': 'Point', 'coordinates': [40.7035, -73.6906]}",Drinking an Abuse of Science 2 by @DUBeerCo @ The Dungeon —  https://t.co/k0p33ehGko,en,"[{'screen_name': 'dubeerco', 'name': 'destination unknown', 'id': '2383833425'}]",['http://untp.beer/s/c809008961'],[],0,0,0,[],[],https://twitter.com/dannydecent1/status/1176647172043026435,False,,0,,new york city,,,,,,[],,,,
1176646850813689858,1176646850813689858,2019-09-24 18:57:24 CDT,2019-09-24,18:57:24,-0500,1561817474,primordials0und,trashcan man,,"Coming off private bc I gotta say this:  Every single woman I know now and have EVER known have at least one story, if not more, about a man doing something intimidating to them, if not being openly sexually aggressive or violent more often than not.",en,[],[],[],1,0,3,[],[],https://twitter.com/primordials0und/status/1176646850813689858,False,,0,,new york city,,,,,,[],,,,
1176644795852361729,1176644795852361729,2019-09-24 18:49:14 CDT,2019-09-24,18:49:14,-0500,3429868503,cyreejarelle,cyree jarelle,,"As an black autistic person dx’d as a kid I was harshly punished for the sort of righteous autistic rage that is currently en vogue—at school, in church, and at home.   The anger and big feels you’re praising in Greta is allowed because she’s a white girl. And that’s important.",en,[],[],[],1,88,346,[],[],https://twitter.com/cyreejarelle/status/1176644795852361729,False,,0,,new york city,,,,,,[],,,,
1176644239796637696,1176570123643060224,2019-09-24 18:47:02 CDT,2019-09-24,18:47:02,-0500,3420154708,rmontea4,Robert Monteagudo,,"@realDonaldTrump @WhiteHouse History will not agree with your opinion. You've admitted to the Ukraine call &amp; request regarding Biden which is a crime. Your withholding the whistleblower complaint was obstruction. House will impeach, Congress won't. History will be harsh.",en,[],[],[],0,0,0,[],[],https://twitter.com/RMontea4/status/1176644239796637696,False,,0,,new york city,,,,,,"[{'screen_name': 'realDonaldTrump', 'name': 'Donald J. Trump', 'id': '25073877'}, {'screen_name': 'WhiteHouse', 'name': 'The White House', 'id': '1323730225067339784'}]",,,,
1176644195379044352,1176575346407354370,2019-09-24 18:46:51 CDT,2019-09-24,18:46:51,-0500,1935833262,merrylwiener,Merryl Wiener aka Biden Booster Boomer Babe,,@gdfuego @gumboqueen3030 No surprise from a man who was a member of Jeffrey Epstein’s pedophile club.,en,[],[],[],1,1,2,[],[],https://twitter.com/MerrylWiener/status/1176644195379044352,False,,0,,new york city,,,,,,"[{'screen_name': 'gumboqueen3030', 'name': 'CeCeIsBoosted', 'id': '4730403444'}]",,,,
1176641726867546112,1176641726867546112,2019-09-24 18:37:03 CDT,2019-09-24,18:37:03,-0500,16085646,carolineheldman,Dr. Caroline Heldman,,Napolitano is right. Trump violated the Constitution and readily admitted it. This ceased to be a partisan issue the moment Trump handed Congress his smoking gun. They have to act.,en,[],[],[],0,2,10,[],[],https://twitter.com/carolineheldman/status/1176641726867546112,False,https://twitter.com/howardfineman/status/1176624585174859777,0,,new york city,,,,,,[],,,,
1176640997197000704,1176640997197000704,2019-09-24 18:34:09 CDT,2019-09-24,18:34:09,-0500,36095915,hope_fl0ats,Darkness Falls 🪐,,7 reasons to #ImpeachDonaldTrumpNOW  1. 10 counts of obstruction in the Mueller Report 2. Campaign finance felonies for paying Stormy to STFU 3. The Ukraine bribery shit show 4. Refusal to protect our election security 5. Emoluments 6. Human rights abuse at the border 7. Nepotism,en,[],[],[],0,0,1,['impeachdonaldtrumpnow'],[],https://twitter.com/Hope_Fl0ats/status/1176640997197000704,False,,0,,new york city,,,,,,[],,,,
1176640765390254080,1176518676444565506,2019-09-24 18:33:14 CDT,2019-09-24,18:33:14,-0500,704132052724142081,mickeytip,Maureen,,@thehill She is being used by the left. The anger &amp; venom from this girl is a political ploy to hurt Trump. She needs to speak to China &amp; the other countries that pollute this earth not the USA. Who is backing her &amp; invited her to the UN? School marching at same time was planned by left.,en,[],[],[],0,0,0,[],[],https://twitter.com/mickeytip/status/1176640765390254080,False,,0,,new york city,,,,,,"[{'screen_name': 'thehill', 'name': 'The Hill', 'id': '1917731'}]",,,,
1176640038349803522,1176640038349803522,2019-09-24 18:30:20 CDT,2019-09-24,18:30:20,-0500,882400622582083584,dexsheeran,Peter Parker,,"Such a sweetheart, thank you for inviting #TeamSpidey to the show @StanSethMeyers. 🕷 Been receiving so many messages about my ‘lil sarcasm during the interview, but I just wanna say @CameranEvans and I are still a thing. Sorry for giving ya a heart attack, just a joke. 👽✨  https://t.co/Vh5tUrWhG5",en,"[{'screen_name': 'stansethmeyers', 'name': 'seth meyers', 'id': '1104751457620951040'}, {'screen_name': 'cameranevans', 'name': 'ᥫ᭡', 'id': '756874590622781440'}]",[],"['https://pbs.twimg.com/media/EFRD18YXsAAlyr1.jpg', 'https://pbs.twimg.com/media/EFRD2s2XYAA0RiO.jpg', 'https://pbs.twimg.com/media/EFRD2swXsAE1_xX.jpg', 'https://pbs.twimg.com/media/EFRD2tJX4AE88ck.jpg']",1,0,1,['teamspidey'],[],https://twitter.com/dexsheeran/status/1176640038349803522,False,,1,https://pbs.twimg.com/media/EFRD18YXsAAlyr1.jpg,new york city,,,,,,[],,,,
1176639602989391872,1176639602989391872,2019-09-24 18:28:36 CDT,2019-09-24,18:28:36,-0500,66496935,444ferns,Ferns,,I felt real anger for the first time in a minute,en,[],[],[],1,0,1,[],[],https://twitter.com/444Ferns/status/1176639602989391872,False,,0,,new york city,,,,,,[],,,,
1176639278396444672,1176518676444565506,2019-09-24 18:27:19 CDT,2019-09-24,18:27:19,-0500,704132052724142081,mickeytip,Maureen,,@thehill This young girl is so fake. Who put her up to this very angry speech and who is behind this political leftist young girl. It was scary to look at her mean face &amp; hear her anger. She needs to speak to China. Who invited her to speak at UN?,en,[],[],[],0,0,0,[],[],https://twitter.com/mickeytip/status/1176639278396444672,False,,0,,new york city,,,,,,"[{'screen_name': 'thehill', 'name': 'The Hill', 'id': '1917731'}]",,,,
1176638860710862849,1176638860710862849,2019-09-24 18:25:39 CDT,2019-09-24,18:25:39,-0500,23201559,tylekurner,kyle 中和 turner,,"“Policymakers must provide the resources for increased HIV screening and counseling in settings that treat survivors of sexual violence, &amp; health care providers should screen people living w HIV for histories of trauma &amp; link them to appropriate services.”  https://t.co/jhi8Vfhcr7",en,[],['https://www.nytimes.com/2019/09/24/opinion/jonathan-van-ness-hiv.amp.html'],[],0,0,3,[],[],https://twitter.com/TyleKurner/status/1176638860710862849,False,,0,,new york city,,,,,,[],,,,
1176638429947469826,1176638429947469826,2019-09-24 18:23:57 CDT,2019-09-24,18:23:57,-0500,63127726,blairglencorse,Blair Glencorse,,Min Findlay for @GeorgeWeahOff of #Liberia recommits to the #ruleoflaw and #justice at #UNGA- particularly implementation of the law against #gender based violence. Let's go Liberia- lots to do on #sdg16 #gbv #UNClimateSummit  https://t.co/ZRIeX936Us,en,"[{'screen_name': 'georgeweahoff', 'name': 'george weah', 'id': '2208781436'}]",[],['https://pbs.twimg.com/media/EFRCaFbXUAIuR8s.jpg'],0,7,5,"['liberia', 'ruleoflaw', 'justice', 'unga', 'gender', 'sdg16', 'gbv', 'unclimatesummit']",[],https://twitter.com/blairglencorse/status/1176638429947469826,False,,1,https://pbs.twimg.com/media/EFRCaFbXUAIuR8s.jpg,new york city,,,,,,[],,,,
1176638305074655233,1176637122243104774,2019-09-24 18:23:27 CDT,2019-09-24,18:23:27,-0500,3317653701,dotpebble,J. R.,,@DanLoney36 I don’t hate Bernie. But his misogyny is noticeable. His recent comment about how the only reason people liked Warren was because she was a woman was very telling.,en,[],[],[],1,0,0,[],[],https://twitter.com/dotPebble/status/1176638305074655233,False,,0,,new york city,,,,,,"[{'screen_name': 'DanLoney36', 'name': 'Dan Loney', 'id': '457988556'}]",,,,
1176637774033805313,1176634553932374018,2019-09-24 18:21:20 CDT,2019-09-24,18:21:20,-0500,1056205408501727232,glitterjeezus,william,,"@poeticdiction If anything, he plays clueless really well. Pence has heavy Cheney vibes - orchestrating everything form behind the scenes but not revealing himself as the influencer. He’s more vehemently racist and homophobic than Trump, which people forget...",en,[],[],[],1,0,2,[],[],https://twitter.com/glitterjeezus/status/1176637774033805313,False,,0,,new york city,,,,,,"[{'screen_name': 'poeticdiction', 'name': '🌈🧶MaryBeth♿🧚', 'id': '19754386'}]",,,,
1176636713705377792,1176636713705377792,2019-09-24 18:17:08 CDT,2019-09-24,18:17:08,-0500,26644743,dorachapiadora,lín.,,My dad had a sexual harassment training today; I went up to give him a hug and this man goes “no te acerque que te puedo acusar”,en,[],[],[],1,0,2,[],[],https://twitter.com/dorachapiadora/status/1176636713705377792,False,,0,,new york city,,,,,,[],,,,
1176636154713653249,1126902416492855297,2019-09-24 18:14:54 CDT,2019-09-24,18:14:54,-0500,958230330003148800,ddgaddis,Trenton ‘Pureblood’ Gaddis,,"@adamscrabble You might find this censorship of the Huawei 5G threat interesting, especially after today’s events at the UN   https://t.co/tWg4kgE3Dq",en,[],['https://twitter.com/ddgaddis/status/1173959227448135681?s=21'],[],0,0,0,[],[],https://twitter.com/DDGaddis/status/1176636154713653249,False,https://twitter.com/ddgaddis/status/1173959227448135681?s=21,0,,new york city,,,,,,"[{'screen_name': 'adamscrabble', 'name': 'Adam Townsend', 'id': '198179597'}]",,,,
1176635247506726914,1176616037976031237,2019-09-24 18:11:18 CDT,2019-09-24,18:11:18,-0500,3317653701,dotpebble,J. R.,,@justin67141200 @rokkman7 @Timcast I didn’t say collusion. I said obstruction of justice. People are in jail for the crime. Thus you agree that he committed a crime. Are you ok with people getting away with crimes?,en,[],[],[],1,0,0,[],[],https://twitter.com/dotPebble/status/1176635247506726914,False,,0,,new york city,,,,,,"[{'screen_name': 'justin67141200', 'name': 'totally bri 😂', 'id': '1016756533831577600'}, {'screen_name': 'rokkman7', 'name': 'Rocco', 'id': '1380491401'}, {'screen_name': 'Timcast', 'name': 'Tim Pool', 'id': '27000730'}]",,,,
1176634561154965505,1175133791163228160,2019-09-24 18:08:34 CDT,2019-09-24,18:08:34,-0500,22082576,karenferrara,The Real Karen,,@HayleyJones15 Yes it does because as explained in many tweets by others Presidential harassment is literally harrasment by the president. His Grammer is so  second grade.,en,[],[],[],0,0,0,[],[],https://twitter.com/KarenFerrara/status/1176634561154965505,False,,0,,new york city,,,,,,"[{'screen_name': 'HayleyJones15', 'name': 'hayl', 'id': '337390464'}]",,,,
1176634495212171266,1176634495212171266,2019-09-24 18:08:19 CDT,2019-09-24,18:08:19,-0500,763769888896790528,eweclac,EWEC LAC,,"Ms Kim Simplis, chair of #SCLAN #Caribbean First Ladies, announce their commitment with #EWEC “for every child to reach their full potential, eradicate gender-bias violence, attending Cancer survivors and bringing a very needed attention to Mental health” #EWECisMe  https://t.co/ZS31VeEEYE",en,[],[],['https://pbs.twimg.com/media/EFQ-0FJWkAAPpB4.jpg'],1,2,3,"['sclan', 'caribbean', 'ewec', 'ewecisme']",[],https://twitter.com/EWECLAC/status/1176634495212171266,False,,1,https://pbs.twimg.com/media/EFQ-0FJWkAAPpB4.jpg,new york city,,,,,,[],,,,
