id,conversation_id,created_at,date,time,timezone,user_id,username,name,place,tweet,language,mentions,urls,photos,replies_count,retweets_count,likes_count,hashtags,cashtags,link,retweet,quote_url,video,thumbnail,near,geo,source,user_rt_id,user_rt,retweet_id,reply_to,retweet_date,translate,trans_src,trans_dest
1194041366990512130,1194018393185230850,2019-11-11 17:57:00 CST,2019-11-11,17:57:00,-0500,487190998,jizzyholland,Jaycee,,@tiffneeroses All time fave is Crime Junkie. My Favorite Murder is another really good one!,en,[],[],[],0,0,0,[],[],https://twitter.com/JizzyHolland/status/1194041366990512130,False,,0,,houston,,,,,,[],,,,
1194037741765496835,1194037741765496835,2019-11-11 17:42:36 CST,2019-11-11,17:42:36,-0500,720806082,neveractiiv,✭ justine ✭,,sex trafficking is at an all time high don’t forget the strap ladies,en,[],[],[],0,7,30,[],[],https://twitter.com/NeverActiiv/status/1194037741765496835,False,,0,,houston,,,,,,[],,,,
1194032206102048769,1193914086955859975,2019-11-11 17:20:36 CST,2019-11-11,17:20:36,-0500,3985069693,huncholondo_,Londo,,@kenyon_rankin They might arrest you for causing a scene. Or for calling police,en,[],[],[],0,0,0,[],[],https://twitter.com/huncholondo_/status/1194032206102048769,False,,0,,houston,,,,,,"[{'screen_name': 'kenyon_rankin', 'name': '🔝Shotta K💸', 'id': '711703350044065792'}]",,,,
1194031381195698177,1194031381195698177,2019-11-11 17:17:19 CST,2019-11-11,17:17:19,-0500,892254072,justincanscream,Real.Life.Murdoc,,2 min into a match and you still don’t have a gun #fortnite #ApexLegends #pubg  https://t.co/LBCcI0UFuU,en,[],[],[],0,4,4,"['fortnite', 'apexlegends', 'pubg']",[],https://twitter.com/JustinCanScream/status/1194031381195698177,False,,1,https://pbs.twimg.com/ext_tw_video_thumb/1194031306105065472/pu/img/St7jKywyeSHlLvz9.jpg,houston,,,,,,[],,,,
1194029461341134850,1194027889517350912,2019-11-11 17:09:42 CST,2019-11-11,17:09:42,-0500,36354551,mike_hixenbaugh,Mike Hixenbaugh,,A CPS spokesman said the letter ruling out abuse came more than a year after the fact because of “a simple oversight.”,en,[],[],[],0,2,1,[],[],https://twitter.com/Mike_Hixenbaugh/status/1194029461341134850,False,,0,,houston,,,,,,[],,,,
1194027889517350912,1194027889517350912,2019-11-11 17:03:27 CST,2019-11-11,17:03:27,-0500,36354551,mike_hixenbaugh,Mike Hixenbaugh,,"'They put us through hell': CPS took their kids. Now, more than a year later, the agency acknowledges it found no evidence of abuse.  https://t.co/36rMVusphw W/ @nbcnews, @HoustonChron, @keribla",en,"[{'screen_name': 'nbcnews', 'name': 'nbc news', 'id': '14173315'}, {'screen_name': 'houstonchron', 'name': 'houston chronicle', 'id': '8940342'}, {'screen_name': 'keribla', 'name': 'keri blakinger', 'id': '71424847'}]",['https://www.nbcnews.com/news/us-news/cps-took-their-kids-now-agency-says-it-found-no-n1080226'],[],1,9,2,[],[],https://twitter.com/Mike_Hixenbaugh/status/1194027889517350912,False,,0,,houston,,,,,,[],,,,
1194027510595502081,1194027510595502081,2019-11-11 17:01:57 CST,2019-11-11,17:01:57,-0500,94879935,_hendriqs,THE HENDRIQS EXPERIENCE,,"Boston University, the same school that graduated Martin Luther King, is hosting Ben Shapiro, a documented racist, bigot and anti-Semite on November 13. And they want you to be okay with that. @BU_Tweets",en,"[{'screen_name': 'bu_tweets', 'name': 'boston university', 'id': '104561488'}]",[],[],9,10,19,[],[],https://twitter.com/_HendriQs/status/1194027510595502081,False,,0,,houston,,,,,,[],,,,
1194024189033926656,1194024189033926656,2019-11-11 16:48:45 CST,2019-11-11,16:48:45,-0500,51882334,gjossiell,Joss,,A weekend for the books. May the rage live forever. @trvisXX  https://t.co/ndwXJRs08L,en,"[{'screen_name': 'trvisxx', 'name': 'travis scott', 'id': '135019364'}]",[],"['https://pbs.twimg.com/media/EJIGqpUXkAE1ijI.jpg', 'https://pbs.twimg.com/media/EJIGqpSXsAYkrEV.jpg']",0,1,4,[],[],https://twitter.com/gjossiell/status/1194024189033926656,False,,1,https://pbs.twimg.com/media/EJIGqpUXkAE1ijI.jpg,houston,,,,,,[],,,,
1194024001573662720,1194024001573662720,2019-11-11 16:48:00 CST,2019-11-11,16:48:00,-0500,126933196,isiahcareyfox26,Isiah Carey,"{'type': 'Point', 'coordinates': [29.72825762, -95.44650452]}",Just horrible!   A Popeyes worker recorded throwing a woman onto the pavement outside a restaurant in Tennessee has been charged with felony aggravated assault.  29-year-old Deriance Ra'Shaiel Hughes was arrested…  https://t.co/YK6EF31wRM,en,[],['https://www.instagram.com/p/B4vhHFJn2K2/?igshid=7jrg7q80204e'],[],0,1,7,[],[],https://twitter.com/isiahcareyFOX26/status/1194024001573662720,False,,0,,houston,,,,,,[],,,,
1194020598772580364,1194018559271288833,2019-11-11 16:34:29 CST,2019-11-11,16:34:29,-0500,341934034,24noflyzone,Hardy Hill,,@Redd21_ Lol Nah You Good I’m Just Shooting The Shits With You,en,[],[],[],0,0,0,[],[],https://twitter.com/24NoFlyZone/status/1194020598772580364,False,,0,,houston,,,,,,"[{'screen_name': 'Redd21_', 'name': '💞', 'id': '237132526'}]",,,,
1194018393185230850,1194018393185230850,2019-11-11 16:25:43 CST,2019-11-11,16:25:43,-0500,487190998,jizzyholland,Jaycee,,I’m very passionate about my true crime podcast &amp; i just wanna say... NEVER take a polygraph test. Literally ever. And EVERYONE should have an “if I go missing” folder. That’s all.,en,[],[],[],0,1,6,[],[],https://twitter.com/JizzyHolland/status/1194018393185230850,False,,0,,houston,,,,,,[],,,,
1194012304846786560,1193987309668052992,2019-11-11 16:01:31 CST,2019-11-11,16:01:31,-0500,429936310,kevfromdacounty,kev,,@FrankJC509 19/4/3 shooting 39 from the field and 30 from 3 🤢,en,[],[],[],1,0,1,[],[],https://twitter.com/kevfromdacounty/status/1194012304846786560,False,,0,,houston,,,,,,"[{'screen_name': 'FrankJC509', 'name': 'Frank', 'id': '2902004353'}]",,,,
1194012226212040713,1194012226212040713,2019-11-11 16:01:13 CST,2019-11-11,16:01:13,-0500,895097859196026880,waldoslovechild,perc-y 💊 jackson,,"I just got called ignorant by someone who said ""he isnt guilty if rape, he said in this interview he didnt know the girls""  Someone that believes someone being accused of rape is innocent bc they said what people accused of rape say, which is ""I didnt do it""",en,[],[],[],1,0,0,[],[],https://twitter.com/waldoslovechild/status/1194012226212040713,False,,0,,houston,,,,,,[],,,,
1194008234169978880,1194008234169978880,2019-11-11 15:45:21 CST,2019-11-11,15:45:21,-0500,735705552567685120,marcelmcclinton,Marcel,,Really shocked to read this from @Everytown and @MomsDemand   “ Congress will be worse off without Pete King...”   Supporting background checks doesn’t make you any less islamaphobic or racist. 👋🏾 👋🏾  https://t.co/ikf6luEfA7,en,"[{'screen_name': 'everytown', 'name': 'everytown', 'id': '250386727'}, {'screen_name': 'momsdemand', 'name': 'moms demand action', 'id': '1017637447'}]",[],['https://pbs.twimg.com/media/EJH4JVUWsAIH11f.jpg'],3,3,10,[],[],https://twitter.com/MarcelMcClinton/status/1194008234169978880,False,,1,https://pbs.twimg.com/media/EJH4JVUWsAIH11f.jpg,houston,,,,,,[],,,,
1194006622953234434,1194006622953234434,2019-11-11 15:38:57 CST,2019-11-11,15:38:57,-0500,553890238,natalie_chavez3,CHAVEZ,,What’s a good pre-workout that will allow me to run a 2 mile and not have a heart attack lol,en,[],[],[],0,0,0,[],[],https://twitter.com/Natalie_Chavez3/status/1194006622953234434,False,,0,,houston,,,,,,[],,,,
1194004804529532928,1194004804529532928,2019-11-11 15:31:43 CST,2019-11-11,15:31:43,-0500,1074577694401159169,loyaltohouston1,T.J.♓️ | 2/23,,"UH cornerback Ka'Darian Smith arrested, charged with assault  https://t.co/pHpywQU0Gr",en,[],['https://www.thescore.com/s/12452205'],[],0,0,0,[],[],https://twitter.com/loyaltohouston1/status/1194004804529532928,False,,0,,houston,,,,,,[],,,,
1194004722530897920,1194004722530897920,2019-11-11 15:31:24 CST,2019-11-11,15:31:24,-0500,393758049,buttahhpecan,CEEEEEESHHH …,,so many girls missing so many women being approached ! Dead ass told my man I’m scared &amp; ima need guns cuz men be approaching me too often &amp; Des trafficking is real,en,[],[],[],0,1,0,[],[],https://twitter.com/buttahhpecan/status/1194004722530897920,False,,0,,houston,,,,,,[],,,,
1193996651851063301,1193996651851063301,2019-11-11 14:59:19 CST,2019-11-11,14:59:19,-0500,79476989,bespoke_god,Marcus,,"I go through about 1 anxiety attack a day, shit is real",en,[],[],[],1,0,3,[],[],https://twitter.com/bespoke_god/status/1193996651851063301,False,,0,,houston,,,,,,[],,,,
1193993687761608704,1193993687761608704,2019-11-11 14:47:33 CST,2019-11-11,14:47:33,-0500,24492273,mrcarter2028,Young,,"I need to buy a shirt that says, “I am not a threat to your safety.”",en,[],[],[],0,0,0,[],[],https://twitter.com/MrCarter2028/status/1193993687761608704,False,,0,,houston,,,,,,[],,,,
1193988518583910407,1193972921586372615,2019-11-11 14:27:00 CST,2019-11-11,14:27:00,-0500,63895849,brozojoe,Joseph Brozovich,,"@AOC What a disappointment to read an emerging leader play judge of a complicated situation, clearly without any information. Bolivians have been in pacific protest for over 20 days to demand a corrupt government to step down after FRAUD was proven.",en,[],[],[],0,0,4,[],[],https://twitter.com/brozojoe/status/1193988518583910407,False,,0,,houston,,,,,,"[{'screen_name': 'AOC', 'name': 'Alexandria Ocasio-Cortez', 'id': '138203134'}]",,,,
1193981084251365376,1193981084251365376,2019-11-11 13:57:28 CST,2019-11-11,13:57:28,-0500,350940396,crimestophou,Crime Stoppers HOU,,"Crime Stoppers CEO @theraniareport was the guest speaker at today’s Aggies Traditions Lunch, a monthly networking lunch sponsored by the @HoustonAMClub. It was our pleasure to be able to share more about our mission with this very active &amp; community-driven alumni group!  https://t.co/Km2XkY69mj",en,"[{'screen_name': 'theraniareport', 'name': 'rania mankarious', 'id': '614408418'}, {'screen_name': 'houstonamclub', 'name': 'houston a&m club', 'id': '496265654'}]",[],"['https://pbs.twimg.com/media/EJHfdt4WwAAKlUC.jpg', 'https://pbs.twimg.com/media/EJHfdt6X0AIQ4g6.jpg']",0,3,7,[],[],https://twitter.com/CrimeStopHOU/status/1193981084251365376,False,,1,https://pbs.twimg.com/media/EJHfdt4WwAAKlUC.jpg,houston,,,,,,[],,,,
1193980954764861441,1193980954764861441,2019-11-11 13:56:57 CST,2019-11-11,13:56:57,-0500,295661326,yobo_smooth,Jeff Odia,,"Lookin at me like a triple threat. Every time a nigga talk, a check",en,[],[],[],0,0,1,[],[],https://twitter.com/YOBO_Smooth/status/1193980954764861441,False,,0,,houston,,,,,,[],,,,
1193978592700649472,1193978592700649472,2019-11-11 13:47:34 CST,2019-11-11,13:47:34,-0500,1634486161,gatofri0,Kat stevens 🌙,,Quit being violent with me,en,[],[],[],0,0,0,[],[],https://twitter.com/Gatofri0/status/1193978592700649472,False,,0,,houston,,,,,,[],,,,
1193977560130031616,1193915761812819969,2019-11-11 13:43:28 CST,2019-11-11,13:43:28,-0500,457974446,ceejaa3,CC,,@JohnCornyn No Bribery is a high crime and misdemeanor.  Unlike a blow job. Oh no that’s impeachable you dig into personal life but national security. HELL NO!  So proud of. Yep no you are a disgrace,en,[],[],[],0,0,0,[],[],https://twitter.com/ceejaa3/status/1193977560130031616,False,,0,,houston,,,,,,"[{'screen_name': 'JohnCornyn', 'name': 'Senator John Cornyn', 'id': '13218102'}]",,,,
1193975807431053318,1193975807431053318,2019-11-11 13:36:30 CST,2019-11-11,13:36:30,-0500,1973227663,stormirdgz,Stormi Rodriguez,,"Omg I lied. We aren’t out of the danger zone my friend, the botched long bob and bad dye job urge is still there.",en,[],[],[],0,0,3,[],[],https://twitter.com/stormirdgz/status/1193975807431053318,False,https://twitter.com/stormirdgz/status/1193927328595955712,0,,houston,,,,,,[],,,,
1193967562742226944,1193967562742226944,2019-11-11 13:03:44 CST,2019-11-11,13:03:44,-0500,1149322594732191745,repp_shannon,Shannon Repp,,"‘if secularism resulted in moral deterioration, then highly secular societies would be decaying bastions of crime and misery, while the strongly religious would be shining beacons of liberty and harmony. But we find just the opposite reality...’",en,[],[],[],0,1,3,[],[],https://twitter.com/repp_shannon/status/1193967562742226944,False,https://twitter.com/RichardDawkins/status/1193822743789068289,0,,houston,,,,,,[],,,,
1193959892475957250,1193959892475957250,2019-11-11 12:33:15 CST,2019-11-11,12:33:15,-0500,509107778,edconsulting_ah,Anna Hardway,,Great coverage of our Human Trafficking Summit last week  https://t.co/lMkb4hOAqs,en,[],['https://www.campussafetymagazine.com/safety/human-trafficking-summit/'],[],0,0,0,[],[],https://twitter.com/edconsulting_ah/status/1193959892475957250,False,,0,,houston,,,,,,[],,,,
1193956125277855749,1193956125277855749,2019-11-11 12:18:17 CST,2019-11-11,12:18:17,-0500,821156890369519616,bvsedgawdlover2,jadauris! (ovërlörd),,A boy is a gun,en,[],[],[],0,0,0,[],[],https://twitter.com/bvsedgawdlover2/status/1193956125277855749,False,https://twitter.com/tylerthecreator/status/1193331553356529664,0,,houston,,,,,,[],,,,
1193953512171982848,1193953512171982848,2019-11-11 12:07:54 CST,2019-11-11,12:07:54,-0500,1050028347378597890,krashindo,JR,,When you don't tell everyone your moves people don't know what to attack.,en,[],[],[],0,5,6,[],[],https://twitter.com/krashindo/status/1193953512171982848,False,,0,,houston,,,,,,[],,,,
1193950688671338499,1193948730556403714,2019-11-11 11:56:41 CST,2019-11-11,11:56:41,-0500,607930970,crisjanaya,Cris,,@METAL_Savior Oh well he’s racist better to have him off the streets,en,[],[],[],1,0,0,[],[],https://twitter.com/CrisJAnaya/status/1193950688671338499,False,,0,,houston,,,,,,"[{'screen_name': 'METAL_Savior', 'name': 'Nordic Warrior', 'id': '584420704'}]",,,,
1193949885613182978,1193865758792716288,2019-11-11 11:53:29 CST,2019-11-11,11:53:29,-0500,33950990,jimsem53,James Semaski,,"@jimsciutto @NikkiHaley They believed trump was a danger to the country and didn’t say goddammed thing about it. Just slinked off to make money off it. That’s the American way. Ignore truth, avoid justice, make money.",en,[],[],[],0,0,0,[],[],https://twitter.com/jimsem53/status/1193949885613182978,False,,0,,houston,,,,,,"[{'screen_name': 'jimsciutto', 'name': 'Jim Sciutto', 'id': '22129280'}, {'screen_name': 'NikkiHaley', 'name': 'Nikki Haley', 'id': '1079776144524754944'}]",,,,
1193949213815721985,1193925270870396929,2019-11-11 11:50:49 CST,2019-11-11,11:50:49,-0500,898365419723141124,goat_gun,zaya,,@dani3lcasas @OwenTurn3r @chhrissssss NIGGA HOEIN LMFAOOOOO,en,[],[],[],0,0,0,[],[],https://twitter.com/goat_gun/status/1193949213815721985,False,,0,,houston,,,,,,"[{'screen_name': 'chhrissssss', 'name': 'Chris', 'id': '1183474999413354497'}]",,,,
1193941402968821766,1193941402968821766,2019-11-11 11:19:47 CST,2019-11-11,11:19:47,-0500,23014692,rebeccagorena,Rebecca Gorena,,"Tired of reading tweets telling Trump to read the Constution as if it wasn’t created by white pedophile racists, does anything other than grant “rights” to certain people living in the most violent empire in history, or has ever meant anything to people in power regardless.",en,[],[],[],0,1,15,[],[],https://twitter.com/rebeccagorena/status/1193941402968821766,False,,0,,houston,,,,,,[],,,,
1193940384688283655,1193937913756684289,2019-11-11 11:15:44 CST,2019-11-11,11:15:44,-0500,739829322,marlymar87,MarlyMar_87,,@C0ACH_ Lmao I think the universal corporate code of cussing somebody out is always “per my last email” lmao I abuse the hell out the phrase 😆,en,[],[],[],1,0,2,[],[],https://twitter.com/MarlyMar87/status/1193940384688283655,False,,0,,houston,,,,,,"[{'screen_name': 'C0ACH_', 'name': 'Wassup Bri?', 'id': '23914433'}]",,,,
1193939763792756736,1193665776303116288,2019-11-11 11:13:16 CST,2019-11-11,11:13:16,-0500,727037664625496064,yeovanny1,Yeovanny Cuevas,,@andreaa_rioss @v_kay_c @yoselynnk And fuck the cop that was chocking and tryna arrest me and shit,en,[],[],[],0,0,0,[],[],https://twitter.com/yeovanny1/status/1193939763792756736,False,,0,,houston,,,,,,"[{'screen_name': 'andreaa_rioss', 'name': 'andrea 🌸', 'id': '970785157836832769'}, {'screen_name': 'v_kay_c', 'name': 'Karla', 'id': '752618062612795392'}, {'screen_name': 'yoselynnk', 'name': 'keiry', 'id': '3885552974'}]",,,,
1193938967521103872,1193906648349368321,2019-11-11 11:10:06 CST,2019-11-11,11:10:06,-0500,109657942,ysl_ron,T.U.C.K. (Top U Can Keep),,@kingray_m Okay!!! Pussy popping and shooting niggas!!!,en,[],[],[],0,0,1,[],[],https://twitter.com/YSL_Ron/status/1193938967521103872,False,,0,,houston,,,,,,"[{'screen_name': 'kingray_m', 'name': 'ray 🦄', 'id': '836564917016739840'}]",,,,
1193932648927956992,1193921329143021569,2019-11-11 10:45:00 CST,2019-11-11,10:45:00,-0500,239151365,yoitskenneth,Houston’s Very Own,,@HoustonRockets 340% three point shooting with Gordon? Let’s go.,en,[],[],[],1,1,3,[],[],https://twitter.com/YoItsKenneth/status/1193932648927956992,False,,0,,houston,,,,,,"[{'screen_name': 'HoustonRockets', 'name': 'Houston Rockets', 'id': '19077044'}]",,,,
1193929656077971456,1193929656077971456,2019-11-11 10:33:06 CST,2019-11-11,10:33:06,-0500,3317142264,iriskotico,Iris ✌🏻️,,people who play the victim role will never understand where they went wrong then they’ll always manipulate the situation as if you’re the bad guy... smh,en,[],[],[],2,1,2,[],[],https://twitter.com/iriskotico/status/1193929656077971456,False,,0,,houston,,,,,,[],,,,
1193927077763911680,1193925167954759681,2019-11-11 10:22:52 CST,2019-11-11,10:22:52,-0500,565941543,princivicious,Mister Vicious 🦹🏿‍♂️,,@Samthadon @Chibunine_ Let’s RAGE,en,[],[],[],0,1,1,[],[],https://twitter.com/Princivicious/status/1193927077763911680,False,,0,,houston,,,,,,"[{'screen_name': 'Samthadon', 'name': 'Strawhat JB Luffy', 'id': '3016283284'}, {'screen_name': 'Chibunine_', 'name': 'Himbu', 'id': '450101734'}]",,,,
1193918809222078465,1193873613746778114,2019-11-11 09:50:00 CST,2019-11-11,09:50:00,-0500,2352014832,jpvivier,Jason P Bergman,,"@SenSchumer Whaaaaa? Were you not paying attention for the entirety of President Obama's two terms. You, sir, are just as much a part if the problem as the extremist conservatives. You ARE the ""old normal""",en,[],[],[],0,0,0,[],[],https://twitter.com/jpvivier/status/1193918809222078465,False,,0,,houston,,,,,,"[{'screen_name': 'SenSchumer', 'name': 'Chuck Schumer', 'id': '17494010'}]",,,,
