id,conversation_id,created_at,date,time,timezone,user_id,username,name,place,tweet,language,mentions,urls,photos,replies_count,retweets_count,likes_count,hashtags,cashtags,link,retweet,quote_url,video,thumbnail,near,geo,source,user_rt_id,user_rt,retweet_id,reply_to,retweet_date,translate,trans_src,trans_dest
1087374918495330305,1087204205721378817,2019-01-21 09:42:37 CST,2019-01-21,09:42:37,-0500,502461580,toddkrieger1,Todd Krieger,,@LukeLapinski The only real difference between Kuemper and Raanta is that Kuemper doesn't get seriously hurt when making a mind-blowing save........,en,[],[],[],0,0,0,[],[],https://twitter.com/ToddKrieger1/status/1087374918495330305,False,,0,,phoenix,,,,,,"[{'screen_name': 'LukeLapinski', 'name': 'Luke Lapinski', 'id': '58324585'}]",,,,
1087364617225945094,1087361996826337281,2019-01-21 09:01:41 CST,2019-01-21,09:01:41,-0500,931747828862296064,polesgoat,PolesGoat,,"@mo_12_sanufan Learn situational football before you tag me lol. And be factually correct.  Kamara ran the ball on second down.  Pre-penalty: Run ball 3 times and kick the FG would give Rams ball back with about 1:20  Post penalty: run ball 3 times, kick FG and rams get ball back with 28 secs",en,[],[],[],0,0,2,[],[],https://twitter.com/Polesgoat/status/1087364617225945094,False,,0,,phoenix,,,,,,[],,,,
1087363109512048646,1087363109512048646,2019-01-21 08:55:42 CST,2019-01-21,08:55:42,-0500,63136435,electgarrick,"Garrick A. McFadden, Esq.",,"On this day, we remember how much the  King family gave to propel our country forward. Not only was MLK jr. assassinated, but so was his mother a few years after his death. His father was able to escape the assassin’s mark.  This day is a day of sacrifice and service.",en,[],[],[],0,0,10,[],[],https://twitter.com/electgarrick/status/1087363109512048646,False,,0,,phoenix,,,,,,[],,,,
1087360659921092608,1087004684303376384,2019-01-21 08:45:58 CST,2019-01-21,08:45:58,-0500,806185369943146496,cblk08,CLB,,@ScottGreenfield @christianjbdev It’s opinions like yours that continue the downward slide of a great America into a xenophobic mob of posing little rich boys. Bullies get punched. Deal with it.,en,[],[],[],1,0,0,[],[],https://twitter.com/CBLK08/status/1087360659921092608,False,,0,,phoenix,,,,,,"[{'screen_name': 'ScottGreenfield', 'name': 'Scott Greenfield', 'id': '14792263'}, {'screen_name': 'christianjbdev', 'name': '(((Christian JB))) 🚜---Z', 'id': '1242530948'}]",,,,
1087348757275070464,1087348757275070464,2019-01-21 07:58:40 CST,2019-01-21,07:58:40,-0500,28734347,the_writetime,🏳️‍🌈Melanin🖤Queen👑,"{'type': 'Point', 'coordinates': [33.5386, -112.186]}","Getting over a 💔 ain’t easy. Being vulnerable and fragile after a 💔 ain’t easy. GOD restore the mind and the heart, to both love like I’ve never been hurt…  https://t.co/hZESNZQ2Cd",en,[],['https://www.instagram.com/p/Bs5i0XEFfzOjdGbOEtBS1T70KOpX9yyieUclmM0/?utm_source=ig_twitter_share&igshid=3vnklvrefxq8'],[],0,0,0,[],[],https://twitter.com/the_writetime/status/1087348757275070464,False,,0,,phoenix,,,,,,[],,,,
1087332105367900160,1087332105367900160,2019-01-21 06:52:30 CST,2019-01-21,06:52:30,-0500,2434898760,teschleristaken,Garrett,,Riot really does great work with their cinematics this is insane,en,[],[],[],0,0,2,[],[],https://twitter.com/TeschlerIsTaken/status/1087332105367900160,False,https://twitter.com/LeagueOfLegends/status/1087318894933471233,0,,phoenix,,,,,,[],,,,
1087327354140147712,1087327354140147712,2019-01-21 06:33:37 CST,2019-01-21,06:33:37,-0500,496622418,haqeemroslam,haqeem,"{'type': 'Point', 'coordinates': [33.66221, -112.10656]}",not shy of a spark a knife twists at the thought that I should fall short of the mark @ 505  https://t.co/OkObKq3a5V,en,[],['https://www.instagram.com/p/Bs5ZEhmlLLn/?utm_source=ig_twitter_share&igshid=13w0kxchmeot7'],[],0,0,1,[],[],https://twitter.com/haqeemroslam/status/1087327354140147712,False,,0,,phoenix,,,,,,[],,,,
1087258433592553473,1087258433592553473,2019-01-21 01:59:45 CST,2019-01-21,01:59:45,-0500,757025035974434817,anastasialyonss,anastasia.,,guys get so aggressive when you turn them down it’s scary,en,[],[],[],0,0,2,[],[],https://twitter.com/anastasialyonss/status/1087258433592553473,False,,0,,phoenix,,,,,,[],,,,
1087256379855757312,1087246734281998337,2019-01-21 01:51:35 CST,2019-01-21,01:51:35,-0500,166279657,kaayllaa_atl,kayla,,@EVERYTHlNGSFINE i’m trying i’m currently sitting in a CVS parking lot aka my death bed,en,[],[],[],0,0,0,[],[],https://twitter.com/kaayllaa_atl/status/1087256379855757312,False,,0,,phoenix,,,,,,"[{'screen_name': 'EVERYTHlNGSFINE', 'name': 'kaitlin', 'id': '2460763500'}]",,,,
1087252659726438400,1087252659726438400,2019-01-21 01:36:48 CST,2019-01-21,01:36:48,-0500,104703006,legiscanaz,LegiScan AZ,"{'type': 'Point', 'coordinates': [33.448113, -112.097037]}",HB2247 [NEW] Prohibited weapon; bump-fire device; accessory.  https://t.co/qYukXmkEuk,en,[],['http://bitly.com/XKWxms'],[],0,0,0,[],[],https://twitter.com/LegiScanAZ/status/1087252659726438400,False,,0,,phoenix,,,,,,[],,,,
1087248834088980480,1087248834088980480,2019-01-21 01:21:36 CST,2019-01-21,01:21:36,-0500,409647931,d_desean,Desean Goodman,,All the niggas who tried getting at my girl when we wasn’t together and wanna be friends with her now that shit dead stop it it’s not gone happen and what’s crazy I know most of all you niggas 😂,en,[],[],[],0,0,0,[],[],https://twitter.com/d_desean/status/1087248834088980480,False,,0,,phoenix,,,,,,[],,,,
1087240053716221953,1087232371915669505,2019-01-21 00:46:43 CST,2019-01-21,00:46:43,-0500,261532008,greekgreatness,𝒊𝒎𝒎𝒂𝒄𝒖𝒍𝒂𝒕𝒆 𝒗𝒐𝒊𝒃𝒆𝒔,,@wingedwaifu Is that Meliodas from the seven deadly sins?,en,[],[],[],1,0,1,[],[],https://twitter.com/greekgreatness/status/1087240053716221953,False,,0,,phoenix,,,,,,"[{'screen_name': 'wingedwaifu', 'name': 'Lelouch.angel♡incarnate', 'id': '1048536171251474432'}]",,,,
1087225615277645825,1087222859431321600,2019-01-20 23:49:21 CST,2019-01-20,23:49:21,-0500,23722706,amiradelagarza,Mindful Heretic Prof (Dr.) 🇲🇽🇺🇸📚🖋🧘🏾,,@MattMurph24 Someone might be dead now.,en,[],[],[],0,0,0,[],[],https://twitter.com/amiradelagarza/status/1087225615277645825,False,,0,,phoenix,,,,,,"[{'screen_name': 'MattMurph24', 'name': 'Matt Murphy', 'id': '49800332'}]",,,,
1087222097712050177,1087222097712050177,2019-01-20 23:35:22 CST,2019-01-20,23:35:22,-0500,30385360,jackiemichele,Jackie Michele,,Rewatching the first season of The Walking Dead.  I’ve seen it many times.  So why did my cat jumping on the ottoman cause me to almost pee my pants? 😱 #TWD,en,[],[],[],0,0,1,['twd'],[],https://twitter.com/JackieMichele/status/1087222097712050177,False,,0,,phoenix,,,,,,[],,,,
1087221768069177349,1087217340192677890,2019-01-20 23:34:03 CST,2019-01-20,23:34:03,-0500,233367576,savnryansprvate,Ryan,,@Slobbotry @LampshadeSlob He doesn't even watch any good manga. Just Walking Dead,en,[],[],[],2,0,0,[],[],https://twitter.com/SavnRyansPrvate/status/1087221768069177349,False,,0,,phoenix,,,,,,"[{'screen_name': 'Slobbotry', 'name': 'tauri', 'id': '963414074'}, {'screen_name': 'LampShadeSlob', 'name': 'Zyklon Slob', 'id': '1208224388866285569'}]",,,,
1087216812909940737,1087216064813969408,2019-01-20 23:14:22 CST,2019-01-20,23:14:22,-0500,3189077240,writermaggie16,"naps and memes 🇺🇦- BLM, LGBTQ+",,"I lean on the side of safety. Most people think I’m being paranoid, but I’d rather be called paranoid than have some one get hurt (even if it’s just a tiny scrape). Today, I think my paranoia came in handy.",en,[],[],[],1,0,0,[],[],https://twitter.com/writermaggie16/status/1087216812909940737,False,,0,,phoenix,,,,,,[],,,,
1087214091100278784,1087214091100278784,2019-01-20 23:03:33 CST,2019-01-20,23:03:33,-0500,373533486,0ryuge,ryuge,,"MSM:  Sorry, bud, but the Democratic Party's top priority, promoting #OrangeManBad, requires scapegoats - innocent or otherwise - from time to time. Just think of your brother's pain with the same pride the family of an Aztec sacrificial victim might.  https://t.co/6XinAuPjPp",en,[],['https://twitter.com/PikePlaceTechie/status/1087117202749378560'],[],1,2,3,['orangemanbad'],[],https://twitter.com/0ryuge/status/1087214091100278784,False,0,0,,phoenix,,,,,,[],,,,
1087213656532606977,1087213656532606977,2019-01-20 23:01:49 CST,2019-01-20,23:01:49,-0500,47841049,stebeven,stephen,,Has the United States had a spiritual leader since MLKs death? Perhaps Billy Graham senior? But he was hugely None political. None of the televangelists. Who even comes close? And into this vacuum steps a man like trump.   #bluewave2020 #resist,en,[],[],[],0,0,0,"['bluewave2020', 'resist']",[],https://twitter.com/stebeven/status/1087213656532606977,False,,0,,phoenix,,,,,,[],,,,
1087212242477539328,1087212242477539328,2019-01-20 22:56:12 CST,2019-01-20,22:56:12,-0500,943257067,rob_huang,rob huang,,"This one hurt, no question #ChiefKingdom but despite the bad calls and our D, we had our chances.  If Mahomes doesn’t overthrow those 2 TD passes, we’re celebrating. Mahomes will only get better and hopefully the D will as well. Let’s not waste Mahomes talent with 31st ranked Ds",en,[],[],[],0,0,1,['chiefkingdom'],[],https://twitter.com/rob_huang/status/1087212242477539328,False,,0,,phoenix,,,,,,[],,,,
1087210760567046144,1087210760567046144,2019-01-20 22:50:19 CST,2019-01-20,22:50:19,-0500,167480347,ziah_bishop,Z,,im fucken dead😭💀,en,[],[],[],0,0,1,[],[],https://twitter.com/ziah_bishop/status/1087210760567046144,False,https://twitter.com/trevor_norris0/status/1086714323249098752,0,,phoenix,,,,,,[],,,,
1087207872599973888,1087141089067323393,2019-01-20 22:38:50 CST,2019-01-20,22:38:50,-0500,192684183,dav1dap,DAVE PROCTOR,,@Crunk5454 @John_KissMyBot I think Pelosi been around since the signing and Schumer shortly after term limits are definitely needed two terms that's it it's supposed to be by the people and for the people not a few till death do us part,en,[],[],[],0,0,0,[],[],https://twitter.com/DAV1DAP/status/1087207872599973888,False,,0,,phoenix,,,,,,"[{'screen_name': 'Crunk5454', 'name': '🌟Crunk5454🌟', 'id': '1546606536'}, {'screen_name': 'John_KissMyBot', 'name': 'John~💋Kiss My Bot', 'id': '975217231'}]",,,,
1087207615023636480,1087207615023636480,2019-01-20 22:37:49 CST,2019-01-20,22:37:49,-0500,47841049,stebeven,stephen,,How in the fucking world can this happen?  Ex-Baylor frat president indicted on 4 counts of sex assault won't go to prison - CNN  https://t.co/F0dHOlPsBw,en,[],['https://www.cnn.com/2018/12/11/us/baylor-ex-frat-president-rape-allegation/index.html'],[],0,1,1,[],[],https://twitter.com/stebeven/status/1087207615023636480,False,,0,,phoenix,,,,,,[],,,,
1087204521418190848,1087204521418190848,2019-01-20 22:25:31 CST,2019-01-20,22:25:31,-0500,2328086485,juarezjanely_,Janely Juarez,,Any girl who has their nipples pierced i give you props because HOLY fudge nugget this nose piercing hurt lmao 😂,en,[],[],[],1,0,3,[],[],https://twitter.com/JuarezJanely_/status/1087204521418190848,False,,0,,phoenix,,,,,,[],,,,
1087201288327114752,1087196677776203776,2019-01-20 22:12:41 CST,2019-01-20,22:12:41,-0500,774149298,natejay400,The Truth,,@Aintucello Hell yeah they are. That nigga gurley too and the rams offense is nice. It's gon be a good though I think,en,[],[],[],1,0,0,[],[],https://twitter.com/NateJay400/status/1087201288327114752,False,,0,,phoenix,,,,,,"[{'screen_name': 'Aintucello', 'name': 'cell', 'id': '1689965154'}]",,,,
1087200255626473472,1087191191639060480,2019-01-20 22:08:34 CST,2019-01-20,22:08:34,-0500,576789359,70j_furious,Ace Trainer Jesse,,@PJuncie No. They get death.,en,[],[],[],1,0,0,[],[],https://twitter.com/70j_furious/status/1087200255626473472,False,,0,,phoenix,,,,,,"[{'screen_name': 'PJuncie', 'name': 'Papa Juncie', 'id': '1058578084062851073'}]",,,,
1087197599998795778,1087197599998795778,2019-01-20 21:58:01 CST,2019-01-20,21:58:01,-0500,464079384,stefxac,stef ♡,,My feet hurt so bad now. I hope they dont get swollen again. 😔,en,[],[],[],0,0,0,[],[],https://twitter.com/stefxac/status/1087197599998795778,False,,0,,phoenix,,,,,,[],,,,
1087196264318459906,1087196264318459906,2019-01-20 21:52:43 CST,2019-01-20,21:52:43,-0500,351292755,iowamonkeyboy,Iowa Monkey Boy,,"Yep, be happy about the RAPE call that wasn't. Those Refs SUCKED!!!!",en,[],[],[],0,0,0,[],[],https://twitter.com/IowaMonkeyboy/status/1087196264318459906,False,https://twitter.com/Panthers/status/1087128770660761600,0,,phoenix,,,,,,[],,,,
1087193610318110721,1087193610318110721,2019-01-20 21:42:10 CST,2019-01-20,21:42:10,-0500,755280933121499136,jakiwiii,jaccc 🥳,,My mom when I slam the door and she about to kick my ass,en,[],[],[],0,0,1,[],[],https://twitter.com/Jakiwiii/status/1087193610318110721,False,https://twitter.com/cochinasierra/status/1087055657906384897,0,,phoenix,,,,,,[],,,,
1087193079537295360,1087193079537295360,2019-01-20 21:40:03 CST,2019-01-20,21:40:03,-0500,125216656,tingstofollow,Trap Ghandi,,Gonna let a team lose cuz they lost a coin flip and can’t stop a team cuz the defense can’t touch anyone Ina pass happy offense friendly league .. yet gonna put a defense on a touchdown wins the game situation in a fuckin playoff game .. gtfoh @NFL,en,"[{'screen_name': 'nfl', 'name': 'nfl', 'id': '19426551'}]",[],[],0,0,2,[],[],https://twitter.com/TingstoFollow/status/1087193079537295360,False,,0,,phoenix,,,,,,[],,,,
1087192253225816064,1087192253225816064,2019-01-20 21:36:46 CST,2019-01-20,21:36:46,-0500,43339361,dahomes,Danny,,"Pats ran exactly twice as many plays and outgained Chiefs by 234 yards. Credit to them that it went to OT. Man, their offense is explosive!",en,[],[],[],1,0,3,[],[],https://twitter.com/dahomes/status/1087192253225816064,False,,0,,phoenix,,,,,,[],,,,
