id,conversation_id,created_at,date,time,timezone,user_id,username,name,place,tweet,language,mentions,urls,photos,replies_count,retweets_count,likes_count,hashtags,cashtags,link,retweet,quote_url,video,thumbnail,near,geo,source,user_rt_id,user_rt,retweet_id,reply_to,retweet_date,translate,trans_src,trans_dest
1202734773212307456,1202573673049272320,2019-12-05 17:41:30 CST,2019-12-05,17:41:30,-0500,942882360,sandman619x,Mark,,@DebbieA83090390 @TheRightMelissa @realDonaldTrump Ignore the facts of her comment just disparage her personally. Trump uses this b/c he can’t form a cogent remark about the facts. His only ability to discredit the issue is to personally attack them. A hollow argument.,en,[],[],[],0,0,0,[],[],https://twitter.com/Sandman619x/status/1202734773212307456,False,,0,,san diego,,,,,,"[{'screen_name': 'DebbieA83090390', 'name': 'Debbie Anderson', 'id': '744668616503758848'}, {'screen_name': 'TheRightMelissa', 'name': 'Melissa Tate', 'id': '762389795037294592'}, {'screen_name': 'realDonaldTrump', 'name': 'Donald J. Trump', 'id': '25073877'}]",,,,
1202729231509155840,1202729231509155840,2019-12-05 17:19:29 CST,2019-12-05,17:19:29,-0500,16300915,vasquezmk,melindakvásquez,,".@HuntsmanAbby Parents choose a child’s name; thus it was directed at #45 because he’s acting like a King. Stop manufacturing a political attack against a minor; we have actual attacks against minors that need defending; Minors @ the boarder, or minors w/o food stamps. #GOPBias",en,"[{'screen_name': 'huntsmanabby', 'name': 'abby huntsman', 'id': '531627880'}]",[],[],0,0,0,['gopbias'],[],https://twitter.com/vasquezmk/status/1202729231509155840,False,,0,,san diego,,,,,,[],,,,
1202723041504968705,1202680886346412032,2019-12-05 16:54:53 CST,2019-12-05,16:54:53,-0500,214089996,aztezcan,Ayse Tezcan 🐬,,"@causalinf Updating to Catalina fixed that prob for me!!! It wiped my computer clean &amp; after a brief period of panic attack &amp; grief, i picked my pieces up  started fresh. Still not sure what i have lost...",en,[],[],[],0,0,1,[],[],https://twitter.com/aztezcan/status/1202723041504968705,False,,0,,san diego,,,,,,"[{'screen_name': 'causalinf', 'name': 'scott cunningham', 'id': '392977409'}]",,,,
1202718037356339200,1202559215417647106,2019-12-05 16:35:00 CST,2019-12-05,16:35:00,-0500,2705192316,gtsrv12,Jim Carnicom,,@IngrahamAngle Where did the President abuse his power? Was he protecting the American people? Yes.,en,[],[],[],0,0,0,[],[],https://twitter.com/gtsrv12/status/1202718037356339200,False,,0,,san diego,,,,,,"[{'screen_name': 'IngrahamAngle', 'name': 'Laura Ingraham', 'id': '50769180'}]",,,,
1202714327993634817,1202710877734088709,2019-12-05 16:20:15 CST,2019-12-05,16:20:15,-0500,993170276,wattasecond,Run the Joules,,@greentheonly Is the incoherent rage caused by lead poisoning or frustration? Who can say,en,[],[],[],0,0,3,[],[],https://twitter.com/wattasecond/status/1202714327993634817,False,,0,,san diego,,,,,,"[{'screen_name': 'greentheonly', 'name': 'green', 'id': '140668859'}]",,,,
1202711282199064576,1202710877734088709,2019-12-05 16:08:09 CST,2019-12-05,16:08:09,-0500,993170276,wattasecond,Run the Joules,,@greentheonly Couldn’t you just use solder paste and a heat gun for that too?,en,[],[],[],1,0,1,[],[],https://twitter.com/wattasecond/status/1202711282199064576,False,,0,,san diego,,,,,,"[{'screen_name': 'greentheonly', 'name': 'green', 'id': '140668859'}]",,,,
1202711150225264640,1202711150225264640,2019-12-05 16:07:38 CST,2019-12-05,16:07:38,-0500,786225934856810496,lucasdyer34,JB,,Gun control= Inhale. Exhale. Stop breathing. Squeeze trigger. Bang.,en,[],[],[],0,0,3,[],[],https://twitter.com/LucasDyer34/status/1202711150225264640,False,,0,,san diego,,,,,,[],,,,
1202708889940172800,1202708889940172800,2019-12-05 15:58:39 CST,2019-12-05,15:58:39,-0500,1693265342,tshombe77,Bishop Cornelius Bowser Sr.,"{'type': 'Point', 'coordinates': [32.7949, -116.954]}","SDPD Says nothing in the #CampaignZero audit report proves they are racist. Yet, SDPD gang units have the most severe racial disparities. Black and LatinX were 78% of the 4,128 people stopped by Gang Enforcement…  https://t.co/tDFOLdRhhz",en,[],['https://www.instagram.com/p/B5tOim1HnIE/?igshid=8nl3g6xxqu93'],[],0,0,0,['campaignzero'],[],https://twitter.com/Tshombe77/status/1202708889940172800,False,,0,,san diego,,,,,,[],,,,
1202706947390103552,1202706947390103552,2019-12-05 15:50:56 CST,2019-12-05,15:50:56,-0500,1146601379131117568,jamessm84408015,james smith,,"Barr wants respect for police 👮‍♀️ only those that support ICE and the trump crime syndicate, where is the respect for career FBI and CIA chiefs.Mcabe fired one day before his pension.Grand jury would not indict for the B.S he was fired for.",en,[],[],[],0,0,0,[],[],https://twitter.com/jamessm84408015/status/1202706947390103552,False,,0,,san diego,,,,,,[],,,,
1202706224283709440,1201962225638035456,2019-12-05 15:48:03 CST,2019-12-05,15:48:03,-0500,805811403642654720,nanarosylara,Rosy Morales,,@Jim_Jordan So tell us about your time OSU (Ohio State University) how many young men came to you for help and you turned your back on them and allow them to continue to be SEXUALLY ABUSE by their team doctor. Maybe you were complicit in his crimes.,en,[],[],[],0,0,0,[],[],https://twitter.com/NanaRosyLara/status/1202706224283709440,False,,0,,san diego,,,,,,"[{'screen_name': 'Jim_Jordan', 'name': 'Rep. Jim Jordan', 'id': '18166778'}]",,,,
1202705263494488064,1202705224554688513,2019-12-05 15:44:14 CST,2019-12-05,15:44:14,-0500,217511133,jonhuckins,Jon Huckins,,"One year ago today, I stood with my Mexican colleagues as part of a collective act of solidarity with migrants facing violence and hatred on our southern border.   Today, I’m reflecting on what solidarity means for me as a white privileged man in USAmerica.  https://t.co/WOivNxJKjC",en,[],[],['https://pbs.twimg.com/media/ELDeCW4U8AAr6z4.jpg'],1,0,0,[],[],https://twitter.com/jonhuckins/status/1202705263494488064,False,,1,https://pbs.twimg.com/media/ELDeCW4U8AAr6z4.jpg,san diego,,,,,,[],,,,
1202694513891766273,1202694513891766273,2019-12-05 15:01:31 CST,2019-12-05,15:01:31,-0500,2423937938,fsmarra17,Phil M 🇵🇭⚓🎳🇺🇸,,The way you conducted the bunker hearing was abuse of your power. The biased selection of no fact witnesses was abuse of your power. The whole NO DUE PROCESS was abuse of your power.  SCHIFTY SCHIFF...abuse of power was on YOU!,en,[],[],[],0,0,0,[],[],https://twitter.com/fsmarra17/status/1202694513891766273,False,https://twitter.com/RepAdamSchiff/status/1202658577372061697,0,,san diego,,,,,,[],,,,
1202685002166616064,1202685002166616064,2019-12-05 14:23:43 CST,2019-12-05,14:23:43,-0500,390409143,samie_williams,Samie,,Cant believe this shooting in Pearl Harbor that shit is scary,en,[],[],[],0,0,2,[],[],https://twitter.com/samie_williams/status/1202685002166616064,False,,0,,san diego,,,,,,[],,,,
1202683516317646848,1202683516317646848,2019-12-05 14:17:49 CST,2019-12-05,14:17:49,-0500,1114970489942753280,buddjenn,Jenn Budd,,"Is this an actual photo or a staged one? Bc it took you many days to get this out. Also, people die in your custody, and once she recovers, you will either send her and her daughter to Mexico or Guatemala where they will likely be victims of violence. No honor, no medal for you.",en,[],[],[],2,8,46,[],[],https://twitter.com/BuddJenn/status/1202683516317646848,False,https://twitter.com/CBPSanDiego/status/1201960841618345992,0,,san diego,,,,,,[],,,,
1202681141473398784,1202681141473398784,2019-12-05 14:08:23 CST,2019-12-05,14:08:23,-0500,629187240,yourdoindos,🚧🚧🚧🚧,,SDPD: Man held after fatally shooting mother of his children outside City Heights home |  https://t.co/s04fRrTTQP  https://t.co/DYMmelrDiA,en,[],"['http://760kfmb.com', 'https://twitter.com/intent/user?screen_name=760kfmb']",[],0,0,0,[],[],https://twitter.com/Yourdoindos/status/1202681141473398784,False,,0,,san diego,,,,,,[],,,,
1202677936966385664,1202677936966385664,2019-12-05 13:55:39 CST,2019-12-05,13:55:39,-0500,21397275,stellaescotv,Stella Escobedo,,Timothy Cook found guilty of 2nd degree murder.,en,[],[],[],0,0,0,[],[],https://twitter.com/StellaEscoTV/status/1202677936966385664,False,https://twitter.com/CBS8/status/1202676854068408321,0,,san diego,,,,,,[],,,,
1202676341704757248,1202676341704757248,2019-12-05 13:49:19 CST,2019-12-05,13:49:19,-0500,202252143,tiny_rita,⚔️Rita of Bebbanburg⚔️,,"Okay TX, I will be in your Dec 19th-23rd. Shooting a wedding the 21st. Excited to see y'all.",en,[],[],[],3,0,21,[],[],https://twitter.com/tiny_rita/status/1202676341704757248,False,,0,,san diego,,,,,,[],,,,
1202663966788292608,1202325543150137345,2019-12-05 13:00:08 CST,2019-12-05,13:00:08,-0500,22802063,tsleyton,Terri Leyton,,"@GOPLeader How on earth do you call that an attack? #dotard Firing up your uneducated base with falsehoods. Serve the people, not 45’s bidding.",en,[],[],[],0,0,0,['dotard'],[],https://twitter.com/tsleyton/status/1202663966788292608,False,,0,,san diego,,,,,,"[{'screen_name': 'GOPLeader', 'name': 'Kevin McCarthy', 'id': '19739126'}]",,,,
1202657794890989568,1202657794890989568,2019-12-05 12:35:37 CST,2019-12-05,12:35:37,-0500,21691269,ziggy_daddy,ZiggyDaddy™,,"Watch how men will misinterpret Pelosi’s anger as her ‘losing it’, ‘being nervous’ or some other disparaging explanation other than she was angry. Because sexism.",en,[],[],[],0,2,6,[],[],https://twitter.com/Ziggy_Daddy/status/1202657794890989568,False,,0,,san diego,,,,,,[],,,,
1202650348092977152,1202650348092977152,2019-12-05 12:06:01 CST,2019-12-05,12:06:01,-0500,1581252942,mikestatz__,mike,,it’s a beautiful day outside we’re playing luv is rage 2 all day,en,[],[],[],0,1,7,[],[],https://twitter.com/mikestatz__/status/1202650348092977152,False,,0,,san diego,,,,,,[],,,,
