id,conversation_id,created_at,date,time,timezone,user_id,username,name,place,tweet,language,mentions,urls,photos,replies_count,retweets_count,likes_count,hashtags,cashtags,link,retweet,quote_url,video,thumbnail,near,geo,source,user_rt_id,user_rt,retweet_id,reply_to,retweet_date,translate,trans_src,trans_dest
1193308161995874305,1193308161995874305,2019-11-09 17:23:31 CST,2019-11-09,17:23:31,-0500,2473026932,bjewing2,bj  #BeKindToAnimals,,I think he does protest too much,en,[],[],[],0,0,1,[],[],https://twitter.com/bjewing2/status/1193308161995874305,False,https://twitter.com/jadedcreative/status/1193251687269568519,0,,philadelphia,,,,,,[],,,,
1193307256051445764,1193307256051445764,2019-11-09 17:19:55 CST,2019-11-09,17:19:55,-0500,783381320818892804,graham_foley3,Graham Foley,,"“We can’t bank on fast breaks all the time,” @qrose_3 said. “When we get to conference play, teams aren’t going to be turning over the ball like that. We just have to get our half-court offense together.”  In a tough afternoon shooting, Temple’s defense got the job done ⤵️",en,"[{'screen_name': 'qrose_3', 'name': 'silk.', 'id': '552770773'}]",[],[],0,0,1,[],[],https://twitter.com/graham_foley3/status/1193307256051445764,False,https://twitter.com/phillysport/status/1193306616134881283,0,,philadelphia,,,,,,[],,,,
1193304976250015744,1193304976250015744,2019-11-09 17:10:51 CST,2019-11-09,17:10:51,-0500,998293328318926849,ez1weeze1,ez1weeze,,"I cried for 3 days and prayed. I'm in this fight to give what I can give towards encouraging folks to help end this nightmare. He was never worthy or qualified, he's evil &amp; racist  spreading negative energy and bad KARMA. Her work is a process, KARMA is on that ass.  https://t.co/Q3wpjnukHi",en,[],[],['https://pbs.twimg.com/tweet_video_thumb/EI94iPnX0AAYNa6.jpg'],0,0,0,[],[],https://twitter.com/ez1weeze1/status/1193304976250015744,False,https://twitter.com/DogginTrump/status/1193259034595299328,1,https://pbs.twimg.com/tweet_video_thumb/EI94iPnX0AAYNa6.jpg,philadelphia,,,,,,[],,,,
1193299468852043776,1193299468852043776,2019-11-09 16:48:58 CST,2019-11-09,16:48:58,-0500,2502746886,justin4_osu,❄️ Justin Groshon 🌊,,"I know everyone wants to support Joe Burrow, but LSU is our biggest threat to win the title and we really shouldn’t be rooting for them. Do we really want to have our season end having to hear about losing to our former 3rd stringer?",en,[],[],[],5,0,7,[],[],https://twitter.com/Justin4_OSU/status/1193299468852043776,False,,0,,philadelphia,,,,,,[],,,,
1193298844764844032,1193298844764844032,2019-11-09 16:46:29 CST,2019-11-09,16:46:29,-0500,2233712478,vince_lobiondo,vince,,Everyone stands by when women assault men but as soon as the man defends himself everyone steps in. Makes absolutely no sense,en,[],[],[],2,0,9,[],[],https://twitter.com/vince_lobiondo/status/1193298844764844032,False,https://twitter.com/Comeoutsidefoo_/status/1191433847088353282,0,,philadelphia,,,,,,[],,,,
1193298216856502272,1193283394312036358,2019-11-09 16:43:59 CST,2019-11-09,16:43:59,-0500,2488832495,danaelatrice,Danaé Latrice,,"@OnlyFreezer The two girls in the pic were roomates/friends. One night them and the girl boyfriend was drinking, the girl boyfriend tried to have sex with the other girl while she was drunk, she reported it as sexual assault, she goes missing, the roommate and her BF confessed to her murder.",en,[],[],[],0,0,0,[],[],https://twitter.com/DanaeLatrice/status/1193298216856502272,False,,0,,philadelphia,,,,,,"[{'screen_name': 'OnlyFreezer', 'name': 'Super Sayian Fajita', 'id': '242561415'}]",,,,
1193296930404745217,1192574542536937472,2019-11-09 16:38:53 CST,2019-11-09,16:38:53,-0500,835760608297508864,camilleromeo1,Camille Romeo,,@DANVERSCOVEN @LeesDeceased Omg this is so sexist!!  🤢🤮  https://t.co/wmxMFLXiOC,en,[],[],['https://pbs.twimg.com/tweet_video_thumb/EI9xOpWXUAA36wJ.jpg'],0,0,0,[],[],https://twitter.com/CamilleRomeo1/status/1193296930404745217,False,,1,https://pbs.twimg.com/tweet_video_thumb/EI9xOpWXUAA36wJ.jpg,philadelphia,,,,,,[],,,,
1193293423484252160,1193293423484252160,2019-11-09 16:24:57 CST,2019-11-09,16:24:57,-0500,24467116,hitaahir,euros ⚓️,"{'type': 'Point', 'coordinates': [39.9527, -75.1651]}","NEWWWW SONGG DROPPED ⚠️🥵🤠🤮🤩❤️❄️🤘🏽 HARM ME ⚠️#OUTNOW❗️**ON ALL PLATFORMS ⌨️ Prod: producedbywalk  🥰SHARE THIS MF 🥰 @ Philadelphia, Pennsylvania  https://t.co/k2zUVazm1Q",en,[],['https://www.instagram.com/p/B4qU4eoABV7/?igshid=19jpa5lh88p36'],[],0,2,2,['outnow'],[],https://twitter.com/HiTaahir/status/1193293423484252160,False,,0,,philadelphia,,,,,,[],,,,
1193293400814104577,1193293400814104577,2019-11-09 16:24:51 CST,2019-11-09,16:24:51,-0500,15284701,dramaguycjm,Chris McGuinness,,"""It's Missile Assault Man, Charlie Brown.""  ...Dammit, @TheDinosawyer",en,"[{'screen_name': 'thedinosawyer', 'name': ""hey it's me dino!"", 'id': '1236436704'}]",[],[],0,0,1,[],[],https://twitter.com/DramaGuyCJM/status/1193293400814104577,False,,0,,philadelphia,,,,,,[],,,,
1193291412630114313,1193283616480153600,2019-11-09 16:16:57 CST,2019-11-09,16:16:57,-0500,917294706,athompstone,Dr. Adam Stone,,"@layla_d13 @KaraDiDomizio @TimeTravelTalks @USAS_WW1 @PeacoatTravels @epicureanexpats @livylove90 @M_A_Catalano @DeepintoHistory @HeidiMalagisi1 @e_terren @GuessWhereIWent @snapshotsmade Maybe so, but there had to be a less violent way to settle differences.",en,[],[],[],0,1,3,[],[],https://twitter.com/athompstone/status/1193291412630114313,False,,0,,philadelphia,,,,,,"[{'screen_name': 'KaraDiDomizio', 'name': 'Kara', 'id': '203779185'}, {'screen_name': 'TimeTravelTalks', 'name': 'Time Travel Talks', 'id': '1158889909207412737'}, {'screen_name': 'USAS_WW1', 'name': 'USAS - Military History', 'id': '95708774'}, {'screen_name': 'PeacoatTravels', 'name': 'Peacoat Travels', 'id': '1114968349589561345'}, {'screen_name': 'epicureanexpats', 'name': 'Tiffany K. Pence - Mexico Wine Tours', 'id': '209247915'}, {'screen_name': 'livylove90', 'name': 'Liv', 'id': '3217803303'}, {'screen_name': 'M_A_Catalano', 'name': 'Michael Catalano', 'id': '335421522'}, {'screen_name': 'DeepintoHistory', 'name': 'Deep into History', 'id': '1017886163468800000'}, {'screen_name': 'HeidiMalagisi1', 'name': 'Heidi Malagisi', 'id': '519835531'}, {'screen_name': 'e_terren', 'name': 'E J Terren', 'id': '965086384682885120'}, {'screen_name': 'GuessWhereIWent', 'name': 'Guess where I went?', 'id': '1155015694301446145'}, {'screen_name': 'snapshotsmade', 'name': 'Snapshots Made Yesterday', 'id': '1104433394929287168'}]",,,,
1193290045651861504,1193250863487311872,2019-11-09 16:11:31 CST,2019-11-09,16:11:31,-0500,248747207,phillyprosper,🇺🇸 ”Dems in array” 🌊,,"@AnandWrites @MikeBloomberg David Dirota did the same thing, did you attack him too?    https://t.co/tFIGHVyUH7",en,[],['https://www.google.com/amp/s/amp.theatlantic.com/amp/article/585259/'],[],0,0,0,[],[],https://twitter.com/phillyprosper/status/1193290045651861504,False,,0,,philadelphia,,,,,,"[{'screen_name': 'AnandWrites', 'name': 'Anand Giridharadas @ The.Ink', 'id': '24889586'}, {'screen_name': 'MikeBloomberg', 'name': 'Mike Bloomberg', 'id': '16581604'}]",,,,
1193290035296124929,1193290035296124929,2019-11-09 16:11:29 CST,2019-11-09,16:11:29,-0500,1084979096273211392,wanthisd,Deja,,I wanna go to the gun range.,en,[],[],[],1,0,1,[],[],https://twitter.com/Wanthisd/status/1193290035296124929,False,,0,,philadelphia,,,,,,[],,,,
1193288514202480640,1193270744886730752,2019-11-09 16:05:26 CST,2019-11-09,16:05:26,-0500,289322631,ianadastra,Ian,,"@ijbailey The cumulative effect of forced total inclusion's the Hive Mind. Every bit of nuance, expression, dissention snuffed out for fear it excludes someone. I choose freedom with all its danger! Better to be free &amp; suffer some hate than be a drone! Conformity's for cowards!Grow a pair!",en,[],[],[],0,0,3,[],[],https://twitter.com/IanAdAstra/status/1193288514202480640,False,,0,,philadelphia,,,,,,"[{'screen_name': 'ijbailey', 'name': '@ijbailey', 'id': '17905026'}]",,,,
1193288284853743616,1193288284853743616,2019-11-09 16:04:31 CST,2019-11-09,16:04:31,-0500,319474572,tfromthedeuce,COUNT_IT_UP,,Mind in a rage I’m way to young to feel this pain,en,[],[],[],0,0,0,[],[],https://twitter.com/Tfromthedeuce/status/1193288284853743616,False,,0,,philadelphia,,,,,,[],,,,
1193284836716425217,1193284836716425217,2019-11-09 15:50:49 CST,2019-11-09,15:50:49,-0500,2473026932,bjewing2,bj  #BeKindToAnimals,,He already knows he's not going to make it into another four years in office so he's trying to make a deal for television I want to see the outtakes from the original Apprentice so that we can all see what a racist he really is,en,[],[],[],0,0,0,[],[],https://twitter.com/bjewing2/status/1193284836716425217,False,https://twitter.com/GeorgeTakei/status/1193242355752722435,0,,philadelphia,,,,,,[],,,,
1193280352120451072,1193280352120451072,2019-11-09 15:33:00 CST,2019-11-09,15:33:00,-0500,1836938280,richflanagan33,Rich Flanagan,,"Bailey Greenberg (@WoodGirlsBball) tied a career-high with 31 points on 12-for-24 shooting including 5-for-9 from behind the arc in @DrexelWBB’s 74-63 win over Davidson. She also had 31 points in the season opener vs. Quinnipiac, setting a school record going 19-21 at the FT line",en,"[{'screen_name': 'woodgirlsbball', 'name': 'archbishop wood girls basketball', 'id': '870843864'}, {'screen_name': 'drexelwbb', 'name': ""drexel women's basketball"", 'id': '823670647'}]",[],[],0,1,5,[],[],https://twitter.com/richflanagan33/status/1193280352120451072,False,,0,,philadelphia,,,,,,[],,,,
1193278435654852616,1193278435654852616,2019-11-09 15:25:23 CST,2019-11-09,15:25:23,-0500,465748073,bel_shots,BelShots Visuals LLC,,@Target always on some racist shit..fuck em,en,[],[],[],0,0,0,[],[],https://twitter.com/Bel_Shots/status/1193278435654852616,False,,0,,philadelphia,,,,,,[],,,,
1193275593602797569,1193262528123604994,2019-11-09 15:14:06 CST,2019-11-09,15:14:06,-0500,249155974,belmostickey,Chris Garrity,,@BeemieAwards They should all send James Franklin a thank you note. He was BRUTAL.,en,[],[],[],0,0,0,[],[],https://twitter.com/belmostickey/status/1193275593602797569,False,,0,,philadelphia,,,,,,"[{'screen_name': 'BeemieAwards', 'name': 'Jason Beem', 'id': '3541263614'}]",,,,
1193265178357456896,1193265178357456896,2019-11-09 14:32:42 CST,2019-11-09,14:32:42,-0500,2473026932,bjewing2,bj  #BeKindToAnimals,,The only reason your protest too much as because you were involved you were part of the sexual assault admit it get it over with and leave office,en,[],[],[],0,0,0,[],[],https://twitter.com/bjewing2/status/1193265178357456896,False,https://twitter.com/bjewing2/status/1193234602091057152,0,,philadelphia,,,,,,[],,,,
1193262450398904320,1193262450398904320,2019-11-09 14:21:52 CST,2019-11-09,14:21:52,-0500,414895256,patrickmaloney4,Patrick Maloney,,"Not a Penn State fan but they just got screwed, twice. Brutal.",en,[],[],[],0,0,0,[],[],https://twitter.com/PatrickMaloney4/status/1193262450398904320,False,,0,,philadelphia,,,,,,[],,,,
