id,conversation_id,created_at,date,time,timezone,user_id,username,name,place,tweet,language,mentions,urls,photos,replies_count,retweets_count,likes_count,hashtags,cashtags,link,retweet,quote_url,video,thumbnail,near,geo,source,user_rt_id,user_rt,retweet_id,reply_to,retweet_date,translate,trans_src,trans_dest
1117938471979634691,1117938471979634691,2019-04-15 18:51:16 CDT,2019-04-15,18:51:16,-0500,2314739330,deebofitness,Carwin Richard Jr CEO of Deebo Fitness,"{'type': 'Point', 'coordinates': [29.74396725, -95.4664083]}","The harsh reality is your body does not have to stand for the abuse or neglect, it WILL die on you. Your mind shouldn’t have to and won’t put up with the constant stress you apply to it, it WILL also leave you! Only what you take care of with remain with you. Trust me!",en,[],[],[],0,0,1,[],[],https://twitter.com/DEEBOfitness/status/1117938471979634691,False,,0,,houston,,,,,,[],,,,
1117938403411144704,1117938403411144704,2019-04-15 18:51:00 CDT,2019-04-15,18:51:00,-0500,740310882542968833,sleepyleilah,leilah,,Idk why I even bother opening my mouth anymore literally everyone I know is just a huge dick to me always??? Ok done playing the victim gonna go take a nap now happy end of tax season!!!!!!!,en,[],[],[],0,0,1,[],[],https://twitter.com/sleepyleilah/status/1117938403411144704,False,,0,,houston,,,,,,[],,,,
1117937277190197248,1117937277190197248,2019-04-15 18:46:31 CDT,2019-04-15,18:46:31,-0500,20023247,tiffistrying,tiff,,I arrest one autobot and suddenly I’m a “robocop”,en,[],[],[],1,4,17,[],[],https://twitter.com/tiffistrying/status/1117937277190197248,False,,0,,houston,,,,,,[],,,,
1117932025070149632,1117932025070149632,2019-04-15 18:25:39 CDT,2019-04-15,18:25:39,-0500,635534855,grinningpicking,Mike Sasser-still much to do,,"It's obvious that he is using words to inspire violence in our great country. It does have to stop if anybody can figure out how to squelch his violently profane rethoric it needs to happen. I have no answer to that question, neither does anyone in his administration. Resist evil",en,[],[],[],0,0,0,[],[],https://twitter.com/grinningpicking/status/1117932025070149632,False,https://twitter.com/Ilhan/status/1117611712679694336,0,,houston,,,,,,[],,,,
1117931440459657217,1117931440459657217,2019-04-15 18:23:20 CDT,2019-04-15,18:23:20,-0500,1201443878,rosemac56,Rosebud,,@JoeNBC @LindseyGrahamSC @realDonaldTrump is a Criminal.  We know this.  He is the smoking gun.  Who is buying his ammunity?,en,"[{'screen_name': 'lindseygrahamsc', 'name': 'lindsey graham', 'id': '432895323'}, {'screen_name': 'realdonaldtrump', 'name': 'donald j. trump', 'id': '25073877'}]",[],[],0,0,0,[],[],https://twitter.com/rosemac56/status/1117931440459657217,False,,0,,houston,,,,,,[],,,,
1117924111337103360,1117825163234426882,2019-04-15 17:54:12 CDT,2019-04-15,17:54:12,-0500,25917851,handleys,Susan Handley,,"@realDonaldTrump Oh Mr. Trump, we will never ever forget the crime.  We have seen it play out in plain site, right in front of our eyes, since 2016. #NotMyPresident #TrumpCrimeFamily",en,[],[],[],0,3,6,"['notmypresident', 'trumpcrimefamily']",[],https://twitter.com/Handleys/status/1117924111337103360,False,,0,,houston,,,,,,"[{'screen_name': 'realDonaldTrump', 'name': 'Donald J. Trump', 'id': '25073877'}]",,,,
1117922690378215424,1117922690378215424,2019-04-15 17:48:34 CDT,2019-04-15,17:48:34,-0500,619714291,stefaniaokolie,Stefania Okolie,,"OFFICER HELD AT GUNPOINT: Houston PD tell us that an officer inside Verizon store when 2 men came in to rob the place, had her gun taken and was then held at gunpoint! CRAZY! Live report coming up at 6:30 #Abc13  https://t.co/ivzZoK1kma",en,[],[],['https://pbs.twimg.com/media/D4OowZzWAAgBGVG.jpg'],0,2,1,['abc13'],[],https://twitter.com/StefaniaOkolie/status/1117922690378215424,False,,1,https://pbs.twimg.com/media/D4OowZzWAAgBGVG.jpg,houston,,,,,,[],,,,
1117916840980701186,1117916840980701186,2019-04-15 17:25:19 CDT,2019-04-15,17:25:19,-0500,370288537,leestewart281,C.Y.3.2022....♀💯🇱🇷🏁🚀❄💰,,Will the Night Knight send his army North &amp; He fly to the South to raise another army of the dead &amp; attack Cersai  #AskTheMaester,en,[],[],[],0,0,0,['askthemaester'],[],https://twitter.com/Leestewart281/status/1117916840980701186,False,,0,,houston,,,,,,[],,,,
1117910804391550976,1117910804391550976,2019-04-15 17:01:20 CDT,2019-04-15,17:01:20,-0500,747343627500740610,sugarbabee001,Brenda SUGAR BABEE,"{'type': 'Point', 'coordinates': [29.86, -95.39]}","Mrs. Coco Martinez made a donation for the Children of domestic violence to help with their up coming events. @ Harris County, Texas  https://t.co/A7yHyDymLg",en,[],['https://www.instagram.com/p/BwSs1pnFbuV/?utm_source=ig_twitter_share&igshid=1ct5a0s4enztp'],[],0,0,0,[],[],https://twitter.com/sugarbabee001/status/1117910804391550976,False,,0,,houston,,,,,,[],,,,
1117902348628574208,1117902348628574208,2019-04-15 16:27:44 CDT,2019-04-15,16:27:44,-0500,99789849,kate_baldwin,Kate Baldwin,,I hate we live in a world that when I tell people who haven't heard about Notre dame the first thing they respond with is: was it an attack?,en,[],[],[],3,0,5,[],[],https://twitter.com/Kate_Baldwin/status/1117902348628574208,False,,0,,houston,,,,,,[],,,,
1117900697964617728,1117894121811632128,2019-04-15 16:21:10 CDT,2019-04-15,16:21:10,-0500,619548893,segovianoooo,Delmi,,"@Dannyel2014 Poppin, key lime og, rage, countin up, pressing me, SMACK A BITCH be a big ass mood!!",en,[],[],[],0,0,1,[],[],https://twitter.com/segovianoooo/status/1117900697964617728,False,,0,,houston,,,,,,[],,,,
1117894806724702209,1117894806724702209,2019-04-15 15:57:46 CDT,2019-04-15,15:57:46,-0500,181084017,_dirtbagjay,It’s Jay Nigga‼️💮🍃,,Somebody Send Valee Miami Beat So I Can Murder That Shit,en,[],[],[],0,0,0,[],[],https://twitter.com/_DirtbagJay/status/1117894806724702209,False,,0,,houston,,,,,,[],,,,
1117894530089414657,1117894530089414657,2019-04-15 15:56:40 CDT,2019-04-15,15:56:40,-0500,2148299316,bsu_uh,UH Black Student Union,,Dr Marc Lamont Hill was a CNN political commentator and professor who was fired for speaking out against Israeli state sanctioned violence against Palestinians. He will connect the historic struggles of Black diaspora globally to that of the Palestinian people.  https://t.co/zOmR9L7Uyb,en,[],[],['https://pbs.twimg.com/media/D4OPJfiW4AA8z4H.jpg'],0,25,35,[],[],https://twitter.com/bsu_uh/status/1117894530089414657,False,,1,https://pbs.twimg.com/media/D4OPJfiW4AA8z4H.jpg,houston,,,,,,[],,,,
1117891487461601280,1117891487461601280,2019-04-15 15:44:34 CDT,2019-04-15,15:44:34,-0500,4333558162,reeltorealpro,Reel,,"You do realize that they equate racist, homophobic, and patriarchal tendencies to Religion because it is the PC way to defend your terrible beliefs and practices without a easy out to anyone to stupid to understand the difference, right?  Everyone else sees right through this.",en,[],[],[],1,0,4,[],[],https://twitter.com/ReelToRealPro/status/1117891487461601280,False,https://twitter.com/RightWingWatch/status/1117807221310664704,0,,houston,,,,,,[],,,,
1117891397099479042,1117499876328267787,2019-04-15 15:44:13 CDT,2019-04-15,15:44:13,-0500,781608212764123136,karenfronick,Karen M A Fronick,,@charmon2000 @SpeakerPelosi @realDonaldTrump @Ilhan She is not a christan anymore. She thinks she is catholic but as the pope stated if you beleive in abortion you are excommunicated. Removed from being Catholic. She also beleives in aboration of a 9mos baby who can live. She supports murder of full term babies.,en,[],[],[],2,0,0,[],[],https://twitter.com/KarenFronick/status/1117891397099479042,False,,0,,houston,,,,,,"[{'screen_name': 'charmon2000', 'name': 'Chris Harmon', 'id': '21824055'}, {'screen_name': 'SpeakerPelosi', 'name': 'Nancy Pelosi', 'id': '15764644'}, {'screen_name': 'realDonaldTrump', 'name': 'Donald J. Trump', 'id': '25073877'}, {'screen_name': 'Ilhan', 'name': 'Rep. Ilhan Omar', 'id': '1082334352711790593'}]",,,,
1117885744268267520,1117885744268267520,2019-04-15 15:21:45 CDT,2019-04-15,15:21:45,-0500,32274356,dakdoncic,Dak Doncic,,@first_dirty_dan dude step up your tweet game. Go attack some feminists.,en,[],[],[],0,0,0,[],[],https://twitter.com/DakDoncic/status/1117885744268267520,False,,0,,houston,,,,,,[],,,,
1117885550801735683,1117883290860445698,2019-04-15 15:20:59 CDT,2019-04-15,15:20:59,-0500,786281895134760960,donnaad80917063,Donna A,,@ArchKennedy @bellagirlnola But they are just peace loving people that mean no harm.,en,[],[],[],0,0,3,[],[],https://twitter.com/DonnaAd80917063/status/1117885550801735683,False,,0,,houston,,,,,,"[{'screen_name': 'ArchKennedy', 'name': 'Arch Kennedy', 'id': '304123273'}, {'screen_name': 'bellagirlnola', 'name': 'BellaGirl', 'id': '791146925038927872'}]",,,,
1117884576628711424,1117879049731346432,2019-04-15 15:17:07 CDT,2019-04-15,15:17:07,-0500,786281895134760960,donnaad80917063,Donna A,,@TheRighToExist @henryrodgersdc Don’t forget Maxine Waters she told people to go out and attack Trump supporters,en,[],[],[],1,0,2,[],[],https://twitter.com/DonnaAd80917063/status/1117884576628711424,False,,0,,houston,,,,,,"[{'screen_name': 'TheRighToExist', 'name': '🇺🇸🇺🇸TheRighToExist🇮🇱🇮🇱', 'id': '2704584638'}, {'screen_name': 'henryrodgersdc', 'name': 'Henry Rodgers', 'id': '4808402532'}]",,,,
1117874112586747904,1117874112586747904,2019-04-15 14:35:32 CDT,2019-04-15,14:35:32,-0500,261469386,winkwestwood,🐻+🍯=❤️,"{'type': 'Point', 'coordinates': [29.745629, -95.365994]}",Especially that racist ass city he plays in. It’s gonna be ugly the day he wants out.,en,[],[],[],2,2,2,[],[],https://twitter.com/WinkWestwood/status/1117874112586747904,False,https://twitter.com/ESPNFrankie/status/1117869974578556930,0,,houston,,,,,,[],,,,
1117870032284004352,1117870032284004352,2019-04-15 14:19:19 CDT,2019-04-15,14:19:19,-0500,41709928,therealtwo_a_m,Iam2A.M,,@IngrahamAngle is a racist  unempotheic #Crackerasscracker  @chrisrock   https://t.co/LzOMwlEBrK,en,"[{'screen_name': 'chrisrock', 'name': 'chris rock', 'id': '238319766'}]",['https://youtu.be/kgkz1Mz1qmw'],[],0,0,0,['crackerasscracker'],[],https://twitter.com/therealtwo_a_m/status/1117870032284004352,False,,0,,houston,,,,,,[],,,,
