id,conversation_id,created_at,date,time,timezone,user_id,username,name,place,tweet,language,mentions,urls,photos,replies_count,retweets_count,likes_count,hashtags,cashtags,link,retweet,quote_url,video,thumbnail,near,geo,source,user_rt_id,user_rt,retweet_id,reply_to,retweet_date,translate,trans_src,trans_dest
1328848153089617922,1328848153089617922,2020-11-17 17:51:03 CST,2020-11-17,17:51:03,-0500,948610730340663296,msbrehaut,Jaz,,"1 thing about me is I’m not a petty, jealous, malicious or messy woman at all. I don’t talk shit &amp; I don’t purposely do harm to anyone. When I tell you I NEVER have drama. Like it’s rare. Because that’s not my mentality. I’ll just cut you off &amp; stop giving a f**k. I do me.",en,[],[],[],1,0,0,[],[],https://twitter.com/msbrehaut/status/1328848153089617922,False,,0,,new york city,,,,,,[],,,,
1328845656388202496,1328845656388202496,2020-11-17 17:41:07 CST,2020-11-17,17:41:07,-0500,1228703967175151621,gomezcreatesx,cristina,,Colombians that are racist don’t need much fuel to show it.,en,[],[],[],0,0,0,[],[],https://twitter.com/gomezcreatesx/status/1328845656388202496,False,,0,,new york city,,,,,,[],,,,
1328845109346045952,1328845109346045952,2020-11-17 17:38:57 CST,2020-11-17,17:38:57,-0500,1883718734,mathewjmari,Mathew J. Mari,,Hey @POTUS @netanyahu The time is shrinking to protect the world from Iran having a nuclear weapon! @JoeBiden WILL restore agreement to allow Iran to have a weapon soon. Will you ACT? @NorahODonnell @LesterHoltNBC @DavidMuir,en,"[{'screen_name': 'potus', 'name': 'president biden', 'id': '1349149096909668363'}, {'screen_name': 'netanyahu', 'name': 'benjamin netanyahu', 'id': '17061263'}, {'screen_name': 'joebiden', 'name': 'joe biden', 'id': '939091'}, {'screen_name': 'norahodonnell', 'name': ""norah o'donnell 🇺🇸"", 'id': '21111896'}, {'screen_name': 'lesterholtnbc', 'name': 'lester holt', 'id': '25300308'}, {'screen_name': 'davidmuir', 'name': 'david muir', 'id': '56223278'}]",[],[],0,0,0,[],[],https://twitter.com/mathewjmari/status/1328845109346045952,False,,0,,new york city,,,,,,[],,,,
1328844896313204736,1328844896313204736,2020-11-17 17:38:06 CST,2020-11-17,17:38:06,-0500,33914743,rutgersal4real,RutgersAl,,Wild Parking Spot Brawl in NYC Turns Into Violent Road Rage Crash  https://t.co/UX2lco0mkS via @TMZ,en,"[{'screen_name': 'tmz', 'name': 'tmz', 'id': '16331010'}]",['https://www.tmz.com/2020/11/17/parking-spot-brawl-nyc-violent-road-rage-crash-rainbow-bakery/'],[],0,0,0,[],[],https://twitter.com/RutgersAl4Real/status/1328844896313204736,False,,0,,new york city,,,,,,[],,,,
1328842858460221446,1328842858460221446,2020-11-17 17:30:00 CST,2020-11-17,17:30:00,-0500,547693795,nkagetsu,Nolan #VeryAsian Kagetsu 花月 is #boosted,,"It's not ""stranger danger """,en,[],[],[],0,1,0,[],[],https://twitter.com/nkagetsu/status/1328842858460221446,False,https://twitter.com/VickyNguyenTV/status/1328842312546476032,0,,new york city,,,,,,[],,,,
1328841656339148803,1328841656339148803,2020-11-17 17:25:14 CST,2020-11-17,17:25:14,-0500,935481992,johnquaglione,John Quaglione,,Want to talk about crime in the community? Log-in to the 68th Precinct Community Council meeting tomorrow night? #BayRidge #DykerHeights #FortHamilton  https://t.co/esKv5sCKqM @NYPD68Pct,en,"[{'screen_name': 'nypd68pct', 'name': 'nypd 68th precinct', 'id': '2372223306'}]",['https://us02web.zoom.us/webinar/register/WN_5YgBeAeuS8i7dTjqisQaOA?fbclid=IwAR1dY2yPbhR4bbdhyN8uAsbGC0Ld-bqBZxZbEiBcFBkih3pUwlxt75KRY6o'],[],0,0,1,"['bayridge', 'dykerheights', 'forthamilton']",[],https://twitter.com/JohnQuaglione/status/1328841656339148803,False,,0,,new york city,,,,,,[],,,,
1328841110546944001,1328841110546944001,2020-11-17 17:23:04 CST,2020-11-17,17:23:04,-0500,28896834,itsegc,eliza.,,sushi and a crime documentary? never been happier.,en,[],[],[],2,0,3,[],[],https://twitter.com/itsegc/status/1328841110546944001,False,,0,,new york city,,,,,,[],,,,
1328839993348026368,1328839993348026368,2020-11-17 17:18:37 CST,2020-11-17,17:18:37,-0500,336248276,bookofbran,🧠,,Y’all glorify and promote violence then be hurt and sad when rappers get shot up. Make up y’all mind.,en,[],[],[],0,0,0,[],[],https://twitter.com/BookOfBran/status/1328839993348026368,False,https://twitter.com/yoyotrav/status/1328833708095369219,0,,new york city,,,,,,[],,,,
1328837290341380097,1328837290341380097,2020-11-17 17:07:53 CST,2020-11-17,17:07:53,-0500,2320034306,_krownjules,Julian,,"If they eat dinner before 7pm, they’re racist.",en,[],[],[],0,0,0,[],[],https://twitter.com/_krownjules/status/1328837290341380097,False,,0,,new york city,,,,,,[],,,,
1328837220493615108,1328837220493615108,2020-11-17 17:07:36 CST,2020-11-17,17:07:36,-0500,143305350,tunejackson,Long Island Papì,,"""War on drugs"" isn't meant to actually stop a thing.. Chase cargo ship had 20 TONS of cocaine... haven't heard about a single arrest; but Wayne facing 10 yrs on a fed charge for ""guns and drugs"".. they conveniently concentrate on lower level prosecution",en,[],[],[],0,1,2,[],[],https://twitter.com/TuneJackson/status/1328837220493615108,False,,0,,new york city,,,,,,[],,,,
1328837140495687685,1328837140495687685,2020-11-17 17:07:17 CST,2020-11-17,17:07:17,-0500,1883718734,mathewjmari,Mathew J. Mari,,Hey @loristokes If the “poor” people get the vaccine first the MEDIA will say they are being USED! But if they get it last it will be RACIST! So ask your viewers HOW do THEY want the vaccine to be distributed! @fox5ny,en,"[{'screen_name': 'loristokes', 'name': 'lori stokes tv', 'id': '32386092'}, {'screen_name': 'fox5ny', 'name': 'fox5ny', 'id': '9229672'}]",[],[],0,0,0,[],[],https://twitter.com/mathewjmari/status/1328837140495687685,False,,0,,new york city,,,,,,[],,,,
1328837001186074626,1328836730405990409,2020-11-17 17:06:44 CST,2020-11-17,17:06:44,-0500,186258648,majinjerms,Super Vegeta,,@lesshumbleteej False claiming gang member ain’t no outside threat either. I’ve watched that boy since Kentucky,en,[],[],[],0,0,0,[],[],https://twitter.com/MajinJerms/status/1328837001186074626,False,,0,,new york city,,,,,,"[{'screen_name': 'lesshumbleteej', 'name': 'Lifelong Knicks of the South fan', 'id': '1178843650781896704'}]",,,,
1328836377438543874,1328825497325867008,2020-11-17 17:04:15 CST,2020-11-17,17:04:15,-0500,38039087,lomtevas,Peter Lomtevas,,@NBCNews Destroy lives one gun at a time.,en,[],[],[],0,0,2,[],[],https://twitter.com/lomtevas/status/1328836377438543874,False,,0,,new york city,,,,,,"[{'screen_name': 'NBCNews', 'name': 'NBC News', 'id': '14173315'}]",,,,
1328835628574838792,1328835628574838792,2020-11-17 17:01:17 CST,2020-11-17,17:01:17,-0500,98774665,boyofthebadland,D.,,Senator Lucas had the charges dropped against her and fired the police chief after letting people finally tear down that racist statue. Iconic,en,[],[],[],1,1,1,[],[],https://twitter.com/boyofthebadland/status/1328835628574838792,False,,0,,new york city,,,,,,[],,,,
1328835506701004800,1328835506701004800,2020-11-17 17:00:48 CST,2020-11-17,17:00:48,-0500,19257498,nycking,BIG ED,,She is crazy how the hell you don’t remember shooting your own sister to death and to make matters worse buying one way ticket to VA for work.,en,[],[],[],0,0,0,[],[],https://twitter.com/NYCKING/status/1328835506701004800,False,,0,,new york city,,,,,,[],,,,
1328835390376185860,1328835123144499207,2020-11-17 17:00:20 CST,2020-11-17,17:00:20,-0500,3213462226,seismically,ronald (*˘︶˘*).｡.:*♡✧*。,,@mariajoliexo i love a car that smells like homophobia 💖💖💖💖💖,en,[],[],[],0,0,2,[],[],https://twitter.com/seismically/status/1328835390376185860,False,,0,,new york city,,,,,,[],,,,
1328834002883665920,1328775641324548098,2020-11-17 16:54:49 CST,2020-11-17,16:54:49,-0500,3092520167,calebloschiavo,"Caleb LoSchiavo, MPH",,"@julie_cristello @AcademicChatter I took a class on the psychology of “drug use and abuse” (it was still the DSM-IV days) in undergrad and we used a mix of scholarly readings+ autobiographical books from people with lived experience. I really liked it, and was definitely better (and less $$$) than a textbook!",en,[],[],[],0,0,1,[],[],https://twitter.com/calebloschiavo/status/1328834002883665920,False,,0,,new york city,,,,,,"[{'screen_name': 'julie_cristello', 'name': 'Julie Cristello', 'id': '1020100868044214273'}, {'screen_name': 'AcademicChatter', 'name': 'Academic Chatter', 'id': '885953601067208705'}]",,,,
1328833639560450050,1328530678569373696,2020-11-17 16:53:22 CST,2020-11-17,16:53:22,-0500,199878972,far1762,Franklyn Robinson,,@samstein The right terminology isn't a scandal. Ssm Stein. It's premeditated murder or perhaps accessory to murder. Plain and simple!! And the perpetrators isn't just Donald Trump but McConnell Graham Grassley Cruz Rubio Collins Johnston McCarthy and entire Republicon party!!,en,[],[],[],0,0,0,[],[],https://twitter.com/far1762/status/1328833639560450050,False,,0,,new york city,,,,,,"[{'screen_name': 'samstein', 'name': 'Sam Stein', 'id': '15463671'}]",,,,
1328832429365276674,1328795501605625858,2020-11-17 16:48:34 CST,2020-11-17,16:48:34,-0500,29480455,delarosaelite,Jeff De La Rosa (Creator / Host of “The Culture”),,@Dotsonisthegoat The bottom line is that the NBA isn’t what we grew up watching anymore it’s all about offense and shooting 3s... nobody plays defense anymore ... we need scorers,en,[],[],[],0,0,0,[],[],https://twitter.com/delarosaelite/status/1328832429365276674,False,,0,,new york city,,,,,,[],,,,
1328832019443412992,1328832019443412992,2020-11-17 16:46:56 CST,2020-11-17,16:46:56,-0500,40366613,lenibriscoe,elena ilana alana alina elana,,I keep thinking about that horrific case in Brownsville where five boys were arrested on false rape allegations. Their names were all over the press.,en,[],[],[],0,0,9,[],[],https://twitter.com/lenibriscoe/status/1328832019443412992,False,https://twitter.com/lenibriscoe/status/1328830968053063691,0,,new york city,,,,,,[],,,,
1328831713993248768,1328795003511054337,2020-11-17 16:45:43 CST,2020-11-17,16:45:43,-0500,1324046916,kittenbutmeow,kitten portakal yemeli,,@hellomodalay @celingul @pekgizlikadin Cunku kadinlar gercekten yasiyir bunu her gun?? Bu bi saka degil o yuzden. Durup dururken keyfi olarak kocasini olduren yillik 200 kadin sayabilir misin? Cunku ben 200 erkek sayarim.,tr,[],[],[],1,0,27,[],[],https://twitter.com/kittenbutmeow/status/1328831713993248768,False,,0,,new york city,,,,,,"[{'screen_name': 'hellomodalay', 'name': 'aç kapa düzelir', 'id': '86933291'}, {'screen_name': 'celingul', 'name': 'celin gul', 'id': '97134468'}, {'screen_name': 'pekgizlikadin', 'name': 'simone ve bitmek bilmeyen tivitleri 🏳️\u200d🌈', 'id': '828623741328429056'}]",,,,
1328831405288288259,1328831405288288259,2020-11-17 16:44:30 CST,2020-11-17,16:44:30,-0500,1184315835243995138,stamped24x,paulz,,bro my hand still fucked up 😔 so as far as altercations go just know ima have a weapon,en,[],[],[],0,0,0,[],[],https://twitter.com/stamped24x/status/1328831405288288259,False,,0,,new york city,,,,,,[],,,,
1328831204381102080,1328831204381102080,2020-11-17 16:43:42 CST,2020-11-17,16:43:42,-0500,739899767585640448,bardh_ves,"Fatbardh Veselaj, CPA",,"@RichardGrenell @USAmbKosovo You respect these people across the negotiating table and forget the events that took place that have you involved today which left many massacred, injured, displaced, and through unthinkable tragedy.",en,"[{'screen_name': 'usambkosovo', 'name': 'ambassador jeff hovenier', 'id': '1327195026'}]",[],[],0,0,0,[],[],https://twitter.com/Bardh_Ves/status/1328831204381102080,False,https://twitter.com/admirim/status/1311755451537686532,0,,new york city,,,,,,[],,,,
1328829931099475969,1328829931099475969,2020-11-17 16:38:38 CST,2020-11-17,16:38:38,-0500,68633188,kancunkayla,Carmen Sandifuego✨ | 🇧🇿,,I will hold your heart &amp; your gun... I don’t care if they come. .,en,[],[],[],0,0,0,[],[],https://twitter.com/KancunKayla/status/1328829931099475969,False,,0,,new york city,,,,,,[],,,,
1328828959296016385,1328440267259699205,2020-11-17 16:34:47 CST,2020-11-17,16:34:47,-0500,1253860640105562112,vincent45984943,3nzof3rrari3,,"@EdMarkey If my student debt was forgiven, I would enroll again in college and reaccumulate more student debt. I've come to realize I cannot live without the constant, looming threat of debt and financial ruin. There is a certain comfort in all that anxiety.",en,[],[],[],0,0,0,[],[],https://twitter.com/Vincent45984943/status/1328828959296016385,False,,0,,new york city,,,,,,"[{'screen_name': 'EdMarkey', 'name': 'Ed Markey', 'id': '1129029661'}]",,,,
1328828206657495041,1328828206657495041,2020-11-17 16:31:47 CST,2020-11-17,16:31:47,-0500,383641543,baginski3927,Walter Baginski,,That maybe a FAKE hate crime but its DEFINITELY INSURANCE FRAUD LOLLL,en,[],[],[],0,0,0,[],[],https://twitter.com/Baginski3927/status/1328828206657495041,False,https://twitter.com/ShawnG927/status/1328806439960387585,0,,new york city,,,,,,[],,,,
1328826413995192322,1328826413995192322,2020-11-17 16:24:40 CST,2020-11-17,16:24:40,-0500,171116175,vote48gens,ObamaMomma🐾,,Oh wait—another republican getting away with a crime on tRump’s watch????  No way.,en,[],[],[],0,0,0,[],[],https://twitter.com/vote48gens/status/1328826413995192322,False,https://twitter.com/funder/status/1328777677642362883,0,,new york city,,,,,,[],,,,
1328826298584748034,1328818289527689216,2020-11-17 16:24:12 CST,2020-11-17,16:24:12,-0500,18919909,lilibethstar,lilibeth✨,,@SergioRamos @SeFutbol @EURO2020 But ARE U INJURED ???,en,[],[],[],0,0,0,[],[],https://twitter.com/lilibethstar/status/1328826298584748034,False,,0,,new york city,,,,,,"[{'screen_name': 'SergioRamos', 'name': 'Sergio Ramos', 'id': '151123001'}, {'screen_name': 'SeFutbol', 'name': 'Selección Española de Fútbol', 'id': '1139001474'}]",,,,
1328826286211538950,1328440550182227969,2020-11-17 16:24:09 CST,2020-11-17,16:24:09,-0500,867424803002748928,godofalgebra,Gregg Thomas,,@NYPDDetectives Why is he alone and unsupervised? Where are the parents. Arrest them to for child neglect.,en,[],[],[],0,0,0,[],[],https://twitter.com/godofalgebra/status/1328826286211538950,False,,0,,new york city,,,,,,"[{'screen_name': 'NYPDDetectives', 'name': 'Chief James Essig', 'id': '1374073866604150785'}]",,,,
1328825569165922304,1328823045516120069,2020-11-17 16:21:18 CST,2020-11-17,16:21:18,-0500,290306139,theculinarylens,Michael Richardson,,@JoannaMeier @Bonn1eGreer His battles with The Carting (private sanitation) industry’s and Fulton Fish Market’s involvement with organized crime predated his knee jerk pro cop racism as mayor.,en,[],[],[],1,0,1,[],[],https://twitter.com/TheCulinaryLens/status/1328825569165922304,False,,0,,new york city,,,,,,"[{'screen_name': 'JoannaMeier', 'name': 'Joanna Meier', 'id': '961103496'}, {'screen_name': 'Bonn1eGreer', 'name': 'Bonnie Greer', 'id': '611585332'}]",,,,
1328825352177790983,1328825352177790983,2020-11-17 16:20:26 CST,2020-11-17,16:20:26,-0500,872119258385461248,cagmanarthur,Arthur Cagman,,Arrest him,en,[],[],[],0,0,0,[],[],https://twitter.com/CagmanArthur/status/1328825352177790983,False,https://twitter.com/politvidchannel/status/1328764179616911360,0,,new york city,,,,,,[],,,,
1328824996261744644,1328824994692993026,2020-11-17 16:19:02 CST,2020-11-17,16:19:02,-0500,187012572,ladiavolina,Elizabeth Cotignola,,"Pro tip: if you're going to scam someone by sending a fraudulent cashier's check ...  choose someone who doesn't have a background in financial crime and has a direct line to the state's Attorney General, js.",en,[],[],[],0,0,2,[],[],https://twitter.com/LaDiavolina/status/1328824996261744644,False,,0,,new york city,,,,,,[],,,,
1328823886163619840,1328823886163619840,2020-11-17 16:14:37 CST,2020-11-17,16:14:37,-0500,340418291,rulajebreal,Rula Jebreal,,"Zuckerberg confirmed that Bannon calling for Dr. Fauci’s beheading doesn’t warrant a ban. FB supposedly bans accounts that make terrorist threats-except, it seems, threats issued by white supremacist terrorists, which are # one domestic terrorist threat.  https://t.co/NmWOKOOnZS",en,[],[],[],14,102,259,[],[],https://twitter.com/rulajebreal/status/1328823886163619840,False,,1,https://pbs.twimg.com/amplify_video_thumb/1328729860219559937/img/GxLEfUdNdCjijTLo.jpg,new york city,,,,,,[],,,,
1328821991386845184,1328821991386845184,2020-11-17 16:07:05 CST,2020-11-17,16:07:05,-0500,2374067010,nypd106pct,NYPD 106th Precinct,,WANTED!! Osvaldo Garcia is wanted For Attempted Murder in the vicinity of Liberty Avenue and 112 Street. Please call 718-845-2261 with any information on his whereabouts.  https://t.co/li9aDszjHy,en,[],[],['https://pbs.twimg.com/media/EnDsjn3XIAIw08g.jpg'],2,2,7,[],[],https://twitter.com/NYPD106Pct/status/1328821991386845184,False,,1,https://pbs.twimg.com/media/EnDsjn3XIAIw08g.jpg,new york city,,,,,,[],,,,
1328820910543998977,1328820910543998977,2020-11-17 16:02:48 CST,2020-11-17,16:02:48,-0500,2231675132,deborahpavek,#I am 1 of the 1 in 4,,They love to intimidate everyday citizens why not a sitting state Senator? Maybe now folks will believe 98% of violence at protests in NYC instigated by NYPD.,en,[],[],[],0,0,0,[],[],https://twitter.com/DeborahPavek/status/1328820910543998977,False,https://twitter.com/kurteichenwald/status/1328803642841960455,0,,new york city,,,,,,[],,,,
1328820036123947013,1328820036123947013,2020-11-17 15:59:19 CST,2020-11-17,15:59:19,-0500,541065603,denmark_un,Denmark in UN NY🇩🇰,,"The death penalty does little to serve victims or deter crime.   🇩🇰 reaffirms opposition to the use of capital punishment, joining 119 States calling for a universal moratorium on the use of the death penalty by voting FOR this 🔑 @un #thirdcommittee resolution (Y 120 N 39 A 24)  https://t.co/bJWEY2juVl",en,"[{'screen_name': 'un', 'name': 'united nations', 'id': '14159148'}]",[],"['https://pbs.twimg.com/media/EnDqp04XMAwJpmn.jpg', 'https://pbs.twimg.com/media/EnDqp1YXUAIKY9b.jpg']",2,17,67,['thirdcommittee'],[],https://twitter.com/Denmark_UN/status/1328820036123947013,False,,1,https://pbs.twimg.com/media/EnDqp04XMAwJpmn.jpg,new york city,,,,,,[],,,,
1328819739582468097,1328533211979329536,2020-11-17 15:58:08 CST,2020-11-17,15:58:08,-0500,839283383784071168,jrod2110,Yusuf Omar,,"@BillyNRA @SCUBANERDMiami Ppl tie left leaning VOTERS to HATE GUNS. I love my GLOCK. That's all I need here in #NYC to protect myself. I'm NOT in a drug cartel, and I'm not down with Militias. I haven't had to use it other than in a shooting range, Thank GOD (SWT). We're also AGAINST de-funding POLICE!!!",en,[],[],[],0,0,0,['nyc'],[],https://twitter.com/Jrod2110/status/1328819739582468097,False,,0,,new york city,,,,,,"[{'screen_name': 'BillyNRA', 'name': 'Billy McLaughlin', 'id': '982100930970566656'}, {'screen_name': 'SCUBANERDMiami', 'name': 'AGF 🇺🇸🇻🇪🇪🇸', 'id': '47781149'}]",,,,
1328819452524306439,1328819452524306439,2020-11-17 15:57:00 CST,2020-11-17,15:57:00,-0500,1072197185742270466,helloamaris,daft cunt,,White girls wearing bb belts is racist,en,[],[],[],1,3,8,[],[],https://twitter.com/helloamaris/status/1328819452524306439,False,,0,,new york city,,,,,,[],,,,
1328818391566733312,1328818391566733312,2020-11-17 15:52:47 CST,2020-11-17,15:52:47,-0500,21435728,mrgomi,Kazuhiko Gomi,"{'type': 'Point', 'coordinates': [40.7142, -74.0064]}","Just finished fantastic me and @aaronkgray photo shooting with @serebenyc . Thank you for your support friendship and hospitality. 🙏🙏🙏📸📸📸🌟🌟🌟 @ New York, New York  https://t.co/i0xpq9ngfR",en,"[{'screen_name': 'aaronkgray', 'name': 'aaron k gray', 'id': '2730473326'}]",['https://www.instagram.com/p/CHtSgKJgf2n/?igshid=n7bkjmhs5y39'],[],1,0,1,[],[],https://twitter.com/MRGOMI/status/1328818391566733312,False,,0,,new york city,,,,,,[],,,,
1328818079250440195,1328818079250440195,2020-11-17 15:51:32 CST,2020-11-17,15:51:32,-0500,349338475,kait_nova,Kait Nova🏳️‍🌈,,Being an #educator in #NYC right now means that every #zoom meeting has the potential to make me infuriated &amp; frustrated beyond what I previously thought possible. (&amp; that’s saying a lot... I’ve quit a teaching job b/c of my anger with a boss before) #teachertwitter #teacherlife,en,[],[],[],0,0,3,"['educator', 'nyc', 'zoom', 'teachertwitter', 'teacherlife']",[],https://twitter.com/kait_nova/status/1328818079250440195,False,,0,,new york city,,,,,,[],,,,
1328817194688532481,1328816576179675139,2020-11-17 15:48:02 CST,2020-11-17,15:48:02,-0500,1637074453,davidewlucas,Dave Lucas,,@DrDaniJackson Don’t you want up-to-the-minute pics of what all our harm reduction peers are eating? (I sorta do.),en,[],[],[],1,0,1,[],[],https://twitter.com/davidewlucas/status/1328817194688532481,False,,0,,new york city,,,,,,"[{'screen_name': 'DrDaniJackson', 'name': 'Dani Jackson, MD, MPH 🖤', 'id': '1149156679159865345'}]",,,,
1328816760674508806,1328816760674508806,2020-11-17 15:46:18 CST,2020-11-17,15:46:18,-0500,144577821,vodkasnowflake,Arn Anderson Cooper,,tfw Republicans do not view you as a threat,en,[],[],[],1,0,3,[],[],https://twitter.com/vodkasnowflake/status/1328816760674508806,False,https://twitter.com/therecount/status/1328798071686377474,0,,new york city,,,,,,[],,,,
1328815663704645638,1328815663704645638,2020-11-17 15:41:57 CST,2020-11-17,15:41:57,-0500,883524943,palacios__14,Palacios,,THIS IS MURDER LMFAO 🇪🇨🇪🇨🇪🇨 VAMOS,en,[],[],[],0,1,0,[],[],https://twitter.com/Palacios__14/status/1328815663704645638,False,,0,,new york city,,,,,,[],,,,
1328813956631293956,1328808675050450944,2020-11-17 15:35:10 CST,2020-11-17,15:35:10,-0500,600258186,ariesinglot,Aries 🏄🏻‍♂️,,@ExplicitMarquis No and you can’t have a bullet in the chamber or a clip in the gun because “you have intent to kill”,en,[],[],[],1,0,0,[],[],https://twitter.com/AriesInglot/status/1328813956631293956,False,,0,,new york city,,,,,,"[{'screen_name': 'ExplicitMarquis', 'name': 'Cashout Quis', 'id': '198915023'}]",,,,
1328813337736585224,1328813337736585224,2020-11-17 15:32:42 CST,2020-11-17,15:32:42,-0500,46303085,only_tony_,Nurd.Casual: Driver in Training,,Kamala Harris looking at Lil Wayne's gun charges.  https://t.co/2dt8MtxlsR,en,[],[],['https://pbs.twimg.com/tweet_video_thumb/EnDkrz7WEAMt0s_.jpg'],0,1,2,[],[],https://twitter.com/Only_Tony_/status/1328813337736585224,False,,1,https://pbs.twimg.com/tweet_video_thumb/EnDkrz7WEAMt0s_.jpg,new york city,,,,,,[],,,,
1328810531646545921,1328810531646545921,2020-11-17 15:21:33 CST,2020-11-17,15:21:33,-0500,1008110425865621504,bikindob,Bearded one,,Twitter now has a story feature?. Pple bout to abuse it and make it irritating  fast  https://t.co/uUWffpJHJd,en,[],[],['https://pbs.twimg.com/media/EnDiIqDXEAU75oa.jpg'],0,0,0,[],[],https://twitter.com/BikinDoB/status/1328810531646545921,False,,1,https://pbs.twimg.com/media/EnDiIqDXEAU75oa.jpg,new york city,,,,,,[],,,,
1328809711534288897,1328775507643666433,2020-11-17 15:18:17 CST,2020-11-17,15:18:17,-0500,524076913,rr2go,its jork!,,@fired4anime @barndingus that one just posts actual dumb racist gamer shit lol,en,[],[],[],0,0,1,[],[],https://twitter.com/RR2GO/status/1328809711534288897,False,,0,,new york city,,,,,,"[{'screen_name': 'fired4anime', 'name': 'pat', 'id': '852358966583582720'}, {'screen_name': 'barndingus', 'name': 'The no one?', 'id': '2747772936'}]",,,,
1328809020648460296,1328582434468859905,2020-11-17 15:15:33 CST,2020-11-17,15:15:33,-0500,46328615,_jennamoney,Jenna,,@heynixon I did last night! I was literally shaking with anger at every Charles and Camilla scene!,en,[],[],[],1,0,0,[],[],https://twitter.com/_Jennamoney/status/1328809020648460296,False,,0,,new york city,,,,,,"[{'screen_name': 'heynixon', 'name': 'heynixon', 'id': '29050425'}]",,,,
1328808668398317571,1328808668398317571,2020-11-17 15:14:09 CST,2020-11-17,15:14:09,-0500,2314125349,runbklyn,vin pickles,,A lot of you follow racist accounts and dont know it. Or maybe you do,en,[],[],[],1,0,0,[],[],https://twitter.com/RunBklyn/status/1328808668398317571,False,,0,,new york city,,,,,,[],,,,
1328807258843729924,1328510155693015040,2020-11-17 15:08:33 CST,2020-11-17,15:08:33,-0500,985306560237899777,mellowglow,Peace be still...,,"@Ashley4Kxxx @8SparkyGrl8 @hotdiggityDR No! It's more like asking others to be responsible and considerate of the health and safety of others, as against being reckless and dumb as those that defy and deny the severity of the danger posed by the virus. Not everyone has access to Walter Reed. Ref: Herman Cain (RIP)!",en,[],[],[],1,0,0,[],[],https://twitter.com/MellowGlow/status/1328807258843729924,False,,0,,new york city,,,,,,"[{'screen_name': 'Ashley4Kxxx', 'name': 'Ashley Sinclair', 'id': '1104044635289255937'}, {'screen_name': '8SparkyGrl8', 'name': 'Anna-bear', 'id': '16337690'}, {'screen_name': 'hotdiggityDR', 'name': 'Dr. Cosmopolitan 🇺🇲🇺🇦 Support Ukraine🧣🌊♀️', 'id': '4408326137'}]",,,,
1328806914000564228,1328806914000564228,2020-11-17 15:07:10 CST,2020-11-17,15:07:10,-0500,890781668491096067,kah_arii,K.rel_W💙✨🍃,,One thing COVID ain’t gun do is embarrass me so....NO,en,[],[],[],0,2,6,[],[],https://twitter.com/Kah_Arii/status/1328806914000564228,False,https://twitter.com/naveb_/status/1328806549196861442,0,,new york city,,,,,,[],,,,
