id,conversation_id,created_at,date,time,timezone,user_id,username,name,place,tweet,language,mentions,urls,photos,replies_count,retweets_count,likes_count,hashtags,cashtags,link,retweet,quote_url,video,thumbnail,near,geo,source,user_rt_id,user_rt,retweet_id,reply_to,retweet_date,translate,trans_src,trans_dest
1328806703735988230,1328778509158912005,2020-11-17 15:06:20 CST,2020-11-17,15:06:20,-0500,1205281117,dark305knight,Alex Carter,,@johnjackson6666 @TiePilotX1 @WPLGLocal10 That’s bullshit..... if you’ve been convicted of a felony your ass going to jail caring a gun.  https://t.co/kGdyhbFgoy,en,[],[],['https://pbs.twimg.com/tweet_video_thumb/EnDeptkW4AcW9NG.jpg'],0,0,0,[],[],https://twitter.com/Dark305Knight/status/1328806703735988230,False,,1,https://pbs.twimg.com/tweet_video_thumb/EnDeptkW4AcW9NG.jpg,new york city,,,,,,"[{'screen_name': 'johnjackson6666', 'name': 'Temper-Le Bleu', 'id': '2900204559'}, {'screen_name': 'WPLGLocal10', 'name': 'WPLG Local 10 News', 'id': '18728203'}]",,,,
1328805692090802176,1328805692090802176,2020-11-17 15:02:19 CST,2020-11-17,15:02:19,-0500,19567690,monteverdy_,Scared of Gas Prices,,Meghan Markle is a real threat. I don’t buy her entitled victim-like attitude.,en,[],[],[],1,0,1,[],[],https://twitter.com/Monteverdy_/status/1328805692090802176,False,https://twitter.com/rmcq48/status/1328064796747571203,0,,new york city,,,,,,[],,,,
1328805381188018178,1328689892633808897,2020-11-17 15:01:05 CST,2020-11-17,15:01:05,-0500,17843715,queensarahsatur,Sarah Rachel Jacobs | #BOHICA #TANSTAAFL,,"@neontaster Has anyone commented on the fact that  the Witches is a work of anti-Semitism?  The women kill children. They meet in secret, international conventions to plot the mass murder of children. To iron out their protocols, one might say.   They speak in Germanic accents (&gt;&gt;&gt;",en,[],[],[],1,0,2,[],[],https://twitter.com/QueenSarahSatur/status/1328805381188018178,False,,0,,new york city,,,,,,"[{'screen_name': 'neontaster', 'name': 'Noam Blum', 'id': '19217369'}]",,,,
1328805331321958401,1328805331321958401,2020-11-17 15:00:53 CST,2020-11-17,15:00:53,-0500,52769915,kjohnnyhockey,Kyle Roberts,,Citizen app getting the source credit for a shooting on a bus. Based.,en,[],[],[],0,0,0,[],[],https://twitter.com/KJohnnyHockey/status/1328805331321958401,False,,0,,new york city,,,,,,[],,,,
1328804807323291651,1328804807323291651,2020-11-17 14:58:48 CST,2020-11-17,14:58:48,-0500,39603710,gsarafan,"Greg Sarafan, Esq.",,"Road rage brawl in Flushing, Queens yesterday. Wow, watch until the end. 😬  https://t.co/ZE1dqJC5Lk  https://t.co/lMbbC2lPIy",en,[],['https://gothamist.com/news/video-parking-spot-brawl-escalates-road-rage-assault-injuring-four-and-wrecking-bakery'],[],17,9,42,[],[],https://twitter.com/GSarafan/status/1328804807323291651,False,,1,https://pbs.twimg.com/ext_tw_video_thumb/1328784142117576704/pu/img/TIypz6pkPWvl2d0L.jpg,new york city,,,,,,[],,,,
1328804446609039365,1328497470528221185,2020-11-17 14:57:22 CST,2020-11-17,14:57:22,-0500,46257426,rep_melodrama,Mad Woman,,"@syddiebid @JohnMayer The same person who ok’d the 2019 terrorist attack, ME!",en,[],[],[],0,0,1,[],[],https://twitter.com/rep_melodrama/status/1328804446609039365,False,,0,,new york city,,,,,,"[{'screen_name': 'syddiebid', 'name': 'um tiquinho de carninha', 'id': '321783959'}, {'screen_name': 'JohnMayer', 'name': 'John Mayer', 'id': '335534204'}]",,,,
1328803810718912515,1328452800989237255,2020-11-17 14:54:51 CST,2020-11-17,14:54:51,-0500,1638758143,questfanning,Quest #AntiWar Fanning,,"@Sicut_Jailbroke 2/2) “Give onto Caesar what is Caesar’s..” — Let the earthly governments deal with basic administrative things &amp; protection from violent crime, but personal morality isn’t the domain of govt— don’t you TRUST God to hold the wicked to account?  Stop being sanctimonious!  #Liberty",en,[],[],[],0,3,3,['liberty'],[],https://twitter.com/QuestFanning/status/1328803810718912515,False,,0,,new york city,,,,,,"[{'screen_name': 'Sicut_Jailbroke', 'name': 'Sicut 🇻🇦', 'id': '1266704573185445888'}]",,,,
1328802419585789956,1327506558322880514,2020-11-17 14:49:19 CST,2020-11-17,14:49:19,-0500,169157226,anneayail,Anneayail,,@earthbulb70 @sainsburys @NoShariaHere18 Your racist. There are THREE different advertisements. Why one earth does this one bother you?,en,[],[],[],0,0,7,[],[],https://twitter.com/Anneayail/status/1328802419585789956,False,,0,,new york city,,,,,,"[{'screen_name': 'earthbulb70', 'name': 'Chris', 'id': '278147318'}, {'screen_name': 'sainsburys', 'name': ""Sainsbury's"", 'id': '80685646'}, {'screen_name': 'NoShariaHere18', 'name': 'Susan (The Great Reset) 👀🔎', 'id': '1078996381581365249'}]",,,,
1328802240480628744,1328802240480628744,2020-11-17 14:48:36 CST,2020-11-17,14:48:36,-0500,169157226,anneayail,Anneayail,,Whew do racist people like this hear themselves?,en,[],[],[],0,0,1,[],[],https://twitter.com/Anneayail/status/1328802240480628744,False,https://twitter.com/earthbulb70/status/1327770471186771970,0,,new york city,,,,,,[],,,,
