id,conversation_id,created_at,date,time,timezone,user_id,username,name,place,tweet,language,mentions,urls,photos,replies_count,retweets_count,likes_count,hashtags,cashtags,link,retweet,quote_url,video,thumbnail,near,geo,source,user_rt_id,user_rt,retweet_id,reply_to,retweet_date,translate,trans_src,trans_dest
1255011967103795202,1255011967103795202,2020-04-28 00:52:24 CDT,2020-04-28,00:52:24,-0500,239506525,timnxtdoor_,Tim ®,,I ain’t heard of murder worth until I got to Dallas actually,en,[],[],[],0,0,1,[],[],https://twitter.com/timnxtdoor_/status/1255011967103795202,False,,0,,dallas,,,,,,[],,,,
1255003371209134081,1255002652422950912,2020-04-28 00:18:15 CDT,2020-04-28,00:18:15,-0500,421395580,rebeccabowling,Rebecca Bowling,,Even normal people are having a hard time staying home. Wanting to protest shut down orders. They have no idea what it is like for those who are trapped in their own failing brains.  Looking for advice what to say to her on the phone to help calm and reassure her.,en,[],[],[],4,0,6,[],[],https://twitter.com/RebeccaBowling/status/1255003371209134081,False,,0,,dallas,,,,,,[],,,,
1254987669219794947,1254984433263955970,2020-04-27 23:15:51 CDT,2020-04-27,23:15:51,-0500,724755562953461760,ellnsmith,el | רהל אורה,,@Calebrn01 Why is this a DIRECT ATTACK,en,[],[],[],0,0,2,[],[],https://twitter.com/ellnsmith/status/1254987669219794947,False,,0,,dallas,,,,,,[],,,,
1254987103143952385,1254984650709180416,2020-04-27 23:13:36 CDT,2020-04-27,23:13:36,-0500,4004308274,alyssaaaaaa16,A🦖,,@bryanraymundo10 i never said he was or wasn’t tho. just saying how stupid his “ friends “ and other people look when they say free someone from jail who is charged with shit like that lmfaoo it’s not a petty drug charge it’s murder we talking about,en,[],[],[],1,1,1,[],[],https://twitter.com/alyssaaaaaa16/status/1254987103143952385,False,,0,,dallas,,,,,,"[{'screen_name': 'bryanraymundo10', 'name': 'Raymundo', 'id': '929776272213008386'}]",,,,
1254983916496326656,1254983916496326656,2020-04-27 23:00:56 CDT,2020-04-27,23:00:56,-0500,1452570672,maryashleyh,HIGHLY EDUCATED SUBURBAN RIGHT WOMAN,,"Not afraid for ME, I'm afraid for the likes of Thoses running ENTITIES as a Facebook, Twitter or Yahoo, 1 thing this WUHAN VIRUS has shown us is the only thing DEMOCRATS have 2 challenge IT is, U guessed it "" the RACIST Card"". And Guys, that might stop Americans but never CHINA!",en,[],[],[],0,0,0,[],[],https://twitter.com/MaryashleyH/status/1254983916496326656,False,https://twitter.com/SerendipityDizl/status/1254971282560450560,0,,dallas,,,,,,[],,,,
1254980928373391360,1254980129765367808,2020-04-27 22:49:04 CDT,2020-04-27,22:49:04,-0500,26156260,ubathediplomat,"Uba, M.J.",,@OhThatsAT Honorable mention: VA Tech shooting. Boston Marathon bombing. Bombing at the 1996 Olympics.,en,[],[],[],1,0,1,[],[],https://twitter.com/ubathediplomat/status/1254980928373391360,False,,0,,dallas,,,,,,"[{'screen_name': 'OhThatsAT', 'name': 'A.T. The Ambassador | Good Culture', 'id': '96428187'}]",,,,
1254977975495413760,1254967747898941446,2020-04-27 22:37:20 CDT,2020-04-27,22:37:20,-0500,182556190,mdixon2003,Matthew Dixon,,"@StanfordSteve82 This is brutal, and I would feel terrible to lose this way, but after player 1 only put up 90, player 2 was behind the 8-ball the whole way",en,[],[],[],0,0,0,[],[],https://twitter.com/mdixon2003/status/1254977975495413760,False,,0,,dallas,,,,,,"[{'screen_name': 'StanfordSteve82', 'name': 'Stanford Steve', 'id': '42065669'}]",,,,
1254977496434475008,1254909545115156481,2020-04-27 22:35:26 CDT,2020-04-27,22:35:26,-0500,848177788653850624,cocopuffdaddi,Zoekage,,@ClaytonBigsby00 @Superevilnine @hayley_vick Putting yourself in danger for someone else's pockets is better for you?,en,[],[],[],0,1,6,[],[],https://twitter.com/Cocopuffdaddi/status/1254977496434475008,False,,0,,dallas,,,,,,"[{'screen_name': 'ClaytonBigsby00', 'name': 'clayton bigsby', 'id': '2753645832'}, {'screen_name': 'Superevilnine', 'name': 'Superevilnine 🇺🇸', 'id': '992241895'}]",,,,
1254975425429848065,1254971798665539584,2020-04-27 22:27:12 CDT,2020-04-27,22:27:12,-0500,237173405,work_eat_live,ZXR,,"@denisedavilaart Lmao ahhh helllll naahhh, you better ask somebody ! Me and him the ones that be shooting lol",en,[],[],[],0,0,0,[],[],https://twitter.com/Work_Eat_Live/status/1254975425429848065,False,,0,,dallas,,,,,,"[{'screen_name': 'denisedavilaart', 'name': 'ART PLUG 🎨🔌', 'id': '988800416400932866'}]",,,,
1254970196479168513,1254855493203275776,2020-04-27 22:06:25 CDT,2020-04-27,22:06:25,-0500,3240914610,greg_a_1,Greg,,@BreitbartNews @DonaldJTrumpJr Every word you speak every crime you commit.,en,[],[],[],0,0,0,[],[],https://twitter.com/Greg_a_1/status/1254970196479168513,False,,0,,dallas,,,,,,"[{'screen_name': 'BreitbartNews', 'name': 'Breitbart News', 'id': '457984599'}, {'screen_name': 'DonaldJTrumpJr', 'name': 'Donald Trump Jr.', 'id': '39344374'}]",,,,
1254963630484992005,1254921356069789697,2020-04-27 21:40:20 CDT,2020-04-27,21:40:20,-0500,119202522,texasguy37,Donnie Belk,,"@andrew_amarone @peterjhasson You don’t? Trump was elected despise allegations of sexual assault by over a dozen women, thus this has become a non-issue in electing a President.",en,[],[],[],0,0,0,[],[],https://twitter.com/texasguy37/status/1254963630484992005,False,,0,,dallas,,,,,,"[{'screen_name': 'andrew_amarone', 'name': 'Andrew Amarone', 'id': '743071374646857728'}, {'screen_name': 'peterjhasson', 'name': 'Peter J. Hasson', 'id': '2935489123'}]",,,,
1254955393018736640,1254946743239794691,2020-04-27 21:07:36 CDT,2020-04-27,21:07:36,-0500,5728672,tammyrants,Tammy,,@512BTH same reason nobody talked about Trump’s10 sexual assault allegations.,en,[],[],[],0,0,0,[],[],https://twitter.com/tammyrants/status/1254955393018736640,False,,0,,dallas,,,,,,"[{'screen_name': '512BTH', 'name': 'b', 'id': '1367418835'}]",,,,
1254953953286139909,1254953810138521602,2020-04-27 21:01:53 CDT,2020-04-27,21:01:53,-0500,869912716885999616,brendaaxx_,Brenda,,@JackJ I hope you don’t mean racist jokes type of humor🤔,en,[],[],[],0,0,0,[],[],https://twitter.com/brendaaxx_/status/1254953953286139909,False,,0,,dallas,,,,,,[],,,,
1254952532520116225,1254952527998652418,2020-04-27 20:56:14 CDT,2020-04-27,20:56:14,-0500,16602049,harpertx,Mike Harper,,"about COVID-19, I was worried about HIV, MRSA, Staph, Strep, Tuberculosis and more, FOR YOU. One of the safest places you could possibly be is in my chair, with me. And now I’m being forced to stay home, because I am a danger to society. This is a joke.",en,[],[],[],1,0,0,[],[],https://twitter.com/harpertx/status/1254952532520116225,False,,0,,dallas,,,,,,[],,,,
1254949215127601154,1254742188749176834,2020-04-27 20:43:03 CDT,2020-04-27,20:43:03,-0500,3231065592,tj40in1975,Todd,,@IvankaTrump @SchaeferWicke @realDonaldTrump The movement is to stop human trafficking and look at the disgusting comments. This is the epitome of some of the horrible comments on a post promoting something good 😐,en,[],[],[],0,0,2,[],[],https://twitter.com/TJ40in1975/status/1254949215127601154,False,,0,,dallas,,,,,,"[{'screen_name': 'IvankaTrump', 'name': 'Ivanka Trump', 'id': '52544275'}, {'screen_name': 'SchaeferWicke', 'name': 'Patrick Fighting for Freedom SGT MAJ 4 Life🇺🇸⭐⭐⭐', 'id': '948548991112925184'}, {'screen_name': 'realDonaldTrump', 'name': 'Donald J. Trump', 'id': '25073877'}]",,,,
1254946743239794691,1254946743239794691,2020-04-27 20:33:14 CDT,2020-04-27,20:33:14,-0500,1367418835,512bth,b,,Um...why is no one talking about Joe Biden’s sexual assault case,en,[],[],[],1,0,0,[],[],https://twitter.com/512BTH/status/1254946743239794691,False,,0,,dallas,,,,,,[],,,,
1254946602978086915,1254946602978086915,2020-04-27 20:32:40 CDT,2020-04-27,20:32:40,-0500,14444534,mrsf5,amy,,"What I planned to do: eat @Tasty_Tails with the fam, then watch Attack of the Clones.   What I will actually do: make out with this peach daiquiri for 10-15 minutes, then pass out.  https://t.co/P0I6Vn922s",en,"[{'screen_name': 'tasty_tails', 'name': 'tasty tails', 'id': '1317564128'}]",[],['https://pbs.twimg.com/media/EWp3SDFWoAAJiCM.jpg'],1,0,11,[],[],https://twitter.com/mrsF5/status/1254946602978086915,False,,1,https://pbs.twimg.com/media/EWp3SDFWoAAJiCM.jpg,dallas,,,,,,[],,,,
1254946498992881665,1254946498992881665,2020-04-27 20:32:15 CDT,2020-04-27,20:32:15,-0500,387886169,coliosis6,𝕔𝕠𝕝𝕚𝕠𝕤𝕚𝕤,,This clip of GaGa asking Moscow to arrest her is ~arousing~ to me.  https://t.co/Uw6v6Um55c,en,[],[],[],0,0,5,[],[],https://twitter.com/coliosis6/status/1254946498992881665,False,,1,https://pbs.twimg.com/ext_tw_video_thumb/1254946473147588610/pu/img/ytJOfzIyISQGFSXa.jpg,dallas,,,,,,[],,,,
1254945911802863616,1254938717367738368,2020-04-27 20:29:55 CDT,2020-04-27,20:29:55,-0500,1204633192021577729,powerthephotog,PowerThePhotographer,,@Ntwana_Ka_Sonto They’re 🔥🔥🔥 keep shooting! ❤️,en,[],[],[],1,0,1,[],[],https://twitter.com/PowerThePhotog/status/1254945911802863616,False,,0,,dallas,,,,,,"[{'screen_name': 'Ntwana_Ka_Sonto', 'name': 'Ntwana Ka Sonto', 'id': '1136894317367320576'}]",,,,
1254945105976360966,1254942679919734784,2020-04-27 20:26:43 CDT,2020-04-27,20:26:43,-0500,96428187,ohthatsat,A.T. The Ambassador | Good Culture,,"The refs tried to cheat us multiple times too. Twice we had a shooting foul, and they either didn't call it, or called it on the floor smh. And they sent Wade to the line on a foul where it WAS on the floor!! I'm mad all over again 😂😂😂",en,[],[],[],1,0,1,[],[],https://twitter.com/OhThatsAT/status/1254945105976360966,False,,0,,dallas,,,,,,[],,,,
1254944877999259649,1254944877999259649,2020-04-27 20:25:49 CDT,2020-04-27,20:25:49,-0500,938200284207157248,tellshay_,Juicy Tits🦋,,Y’all the attorney I been shooting at finally accepted my friend request on Facebook  https://t.co/Q64IDM781Q,en,[],[],['https://pbs.twimg.com/tweet_video_thumb/EWp1tlfWsAA6P4f.jpg'],0,0,1,[],[],https://twitter.com/tellshay_/status/1254944877999259649,False,,1,https://pbs.twimg.com/tweet_video_thumb/EWp1tlfWsAA6P4f.jpg,dallas,,,,,,[],,,,
1254941309246283778,1254941309246283778,2020-04-27 20:11:38 CDT,2020-04-27,20:11:38,-0500,9272142,dwcook,Darrell W. Cook,,I am studying the governor’s 64 page pamphlet. Note that restaurants cannot offer valet services. Unthinkable. I’m going to organize a protest.  https://t.co/z0LOafLR5N,en,[],[],['https://pbs.twimg.com/media/EWpydvYWAAAyRzl.jpg'],1,0,0,[],[],https://twitter.com/DWCook/status/1254941309246283778,False,,1,https://pbs.twimg.com/media/EWpydvYWAAAyRzl.jpg,dallas,,,,,,[],,,,
1254938423946809345,1254872001312968712,2020-04-27 20:00:10 CDT,2020-04-27,20:00:10,-0500,540554346,isn_marie,Mode Avion,,"@thatGalroro Listen British twitter dig past tweets and they found influencers who were colorist and made rape jokes, and one of the Burundian Sisters was among them",en,[],[],[],1,0,2,[],[],https://twitter.com/isn_marie/status/1254938423946809345,False,,0,,dallas,,,,,,"[{'screen_name': 'thatGalroro', 'name': 'Rehemaal_🤍', 'id': '1194789156188278784'}]",,,,
1254923638362583041,1254923108806426629,2020-04-27 19:01:25 CDT,2020-04-27,19:01:25,-0500,540554346,isn_marie,Mode Avion,,"@NucciChris Reba Reba, aha nukurubuga. I have been the victim though",en,[],[],[],1,0,0,[],[],https://twitter.com/isn_marie/status/1254923638362583041,False,,0,,dallas,,,,,,"[{'screen_name': 'NucciChris', 'name': 'Chris Nucci 🇧🇮', 'id': '609771059'}]",,,,
1254922880304979968,1254921570440679428,2020-04-27 18:58:24 CDT,2020-04-27,18:58:24,-0500,114955084,tbgutierrez,*An Educated Rebel*,,"@BmoreBeloved Too violent 🤦🏾‍♀️ smh they just don’t know. But my advice while there is to connect with any non native black person you see. An indicator that they are not from Iowa is: they dress nice, they look groomed, they have an accent, they give a nasty side eye at peach folk",en,[],[],[],0,0,0,[],[],https://twitter.com/TBGutierrez/status/1254922880304979968,False,,0,,dallas,,,,,,"[{'screen_name': 'BmoreBeloved', 'name': 'Harriet Tubman’s Gunsmoke 💨', 'id': '104947614'}]",,,,
1254915645961109515,1254915645961109515,2020-04-27 18:29:39 CDT,2020-04-27,18:29:39,-0500,1886966870,earlinlemongrab,Sunday Kandy .,,Protecting yourself and your energy is not a crime,en,[],[],[],0,5,7,[],[],https://twitter.com/EARLinLEMONGRAB/status/1254915645961109515,False,,0,,dallas,,,,,,[],,,,
1254914677835993088,1254914677835993088,2020-04-27 18:25:49 CDT,2020-04-27,18:25:49,-0500,42912666,boomer_patriot,❌John W. Wilson ن❌ #GreenIsTheNewRed,,Tara Reade‘s Former Neighbor Says They Discussed Biden‘s Alleged Assault in Mid-90s  https://t.co/F9DLUnYD9M via @BreitbartNews,en,"[{'screen_name': 'breitbartnews', 'name': 'breitbart news', 'id': '457984599'}]",['https://www.breitbart.com/2020-election/2020/04/27/tara-reades-former-neighbor-says-they-discussed-alleged-biden-sex-assault-in-mid-90s/'],[],0,0,0,[],[],https://twitter.com/Boomer_Patriot/status/1254914677835993088,False,,0,,dallas,,,,,,[],,,,
1254914379805536256,1254914379805536256,2020-04-27 18:24:37 CDT,2020-04-27,18:24:37,-0500,114955084,tbgutierrez,*An Educated Rebel*,,Which part are you in again? They really only be shooting in the south side that’s where all the Chicago transplants live,en,[],[],[],1,0,0,[],[],https://twitter.com/TBGutierrez/status/1254914379805536256,False,https://twitter.com/BmoreBeloved/status/1254913289475276805,0,,dallas,,,,,,[],,,,
1254914091266826241,1254914091266826241,2020-04-27 18:23:29 CDT,2020-04-27,18:23:29,-0500,563418112,amber_alert94,AMBER,,"I might not agree 💯% with Steven Morrissey at all times, but we can both agree meat is murder. I try my best to limit meat consumption, but here I am making a chicken and bacon fettuccine carbonara pasta. 😟",en,[],[],[],0,0,0,[],[],https://twitter.com/amber_alert94/status/1254914091266826241,False,,0,,dallas,,,,,,[],,,,
1254913660968976384,1254913660968976384,2020-04-27 18:21:46 CDT,2020-04-27,18:21:46,-0500,42912666,boomer_patriot,❌John W. Wilson ن❌ #GreenIsTheNewRed,,@nytimes columnist @michelleinbklyn laments ‘what a nightmare’ it’s become for @JoeBiden in light of developments in Tara Reade Rape case  https://t.co/JqgVq8637d,en,"[{'screen_name': 'michelleinbklyn', 'name': 'michelle goldberg', 'id': '212657985'}, {'screen_name': 'joebiden', 'name': 'joe biden', 'id': '939091'}]",['https://twitchy.com/sarahd-313035/2020/04/27/nyt-columnist-michelle-goldberg-laments-what-a-nightmare-its-become-for-joe-biden-in-light-of-developments-in-tara-reade-case/'],[],0,0,0,[],[],https://twitter.com/Boomer_Patriot/status/1254913660968976384,False,,0,,dallas,,,,,,[],,,,
1254913188715511810,1254912668131098625,2020-04-27 18:19:54 CDT,2020-04-27,18:19:54,-0500,868601456970084356,theflipperjones,chief diggum,,"You don’t have to acknowledge a man EITHER, it’s a lose lose battle for y’all!!! But get pepper spray, a gun, something, this world isn’t set of for WOMANHOOD, y’all have to band together and proctect it for yourselves!!! AT ALL COSTS!",en,[],[],[],0,0,0,[],[],https://twitter.com/THEflipperjones/status/1254913188715511810,False,,0,,dallas,,,,,,[],,,,
