id,conversation_id,created_at,date,time,timezone,user_id,username,name,place,tweet,language,mentions,urls,photos,replies_count,retweets_count,likes_count,hashtags,cashtags,link,retweet,quote_url,video,thumbnail,near,geo,source,user_rt_id,user_rt,retweet_id,reply_to,retweet_date,translate,trans_src,trans_dest
1243324939215634433,1242512626594320384,2020-03-26 18:52:20 CDT,2020-03-26,18:52:20,-0500,2445839868,kpotluru,Pale Kate Durga 🐬,,"@LesBreeding1 @RealCandaceO There are very few greatest generation left. I'm okay with protecting any old codgers, even Vietnam draft dodgers. Or young people, for that matter. Economies recover, but you don't recover from being dead.",en,[],[],[],0,0,1,[],[],https://twitter.com/KPotluru/status/1243324939215634433,False,,0,,san diego,,,,,,"[{'screen_name': 'LesBreeding1', 'name': '🇺🇸Les Breeding is boosted 💫', 'id': '377796715'}, {'screen_name': 'RealCandaceO', 'name': 'Candace Owens', 'id': '878247600096509952'}]",,,,
1243321589044674560,1243320939867037696,2020-03-26 18:39:01 CDT,2020-03-26,18:39:01,-0500,2353753020,juliandlv24,Juju,,@_jeseniaaaaa Spears comma Britney 😂😂😂. DEAD!!!☠️☠️☠️,en,[],[],[],0,0,1,[],[],https://twitter.com/juliandlv24/status/1243321589044674560,False,,0,,san diego,,,,,,"[{'screen_name': '_jeseniaaaaa', 'name': 'youdriveme_crazy', 'id': '1884512407'}]",,,,
1243318351880810496,1243318351880810496,2020-03-26 18:26:09 CDT,2020-03-26,18:26:09,-0500,152758352,dianefyi,Distinctly Diane,,'He Penetrated Me With His Fingers': Joe Biden Accused of Sexual Assault  https://t.co/hxyxToW5Vm via @lawcrimenews,en,"[{'screen_name': 'lawcrimenews', 'name': 'law & crime', 'id': '4068337756'}]",['https://lawandcrime.com/high-profile/he-penetrated-me-with-his-fingers-joe-biden-accused-of-sexual-assault/'],[],1,0,0,[],[],https://twitter.com/DianeFYI/status/1243318351880810496,False,,0,,san diego,,,,,,[],,,,
1243311572174270465,1243311572174270465,2020-03-26 17:59:13 CDT,2020-03-26,17:59:13,-0500,555434788,adambfit,Adam Baldwin,,Coronado Islander IPA Stone Fear Movie Lions DIPA Green Flash Green Bullet Tripple IPA,en,[],[],[],2,0,1,[],[],https://twitter.com/adambfit/status/1243311572174270465,False,https://twitter.com/garyvee/status/1243304115305943044,0,,san diego,,,,,,[],,,,
1243308093775077376,1243308093775077376,2020-03-26 17:45:23 CDT,2020-03-26,17:45:23,-0500,3152996071,savana_reneau,Savana Summer,,One I wish I wish I would’ve known when I was younger is that I shouldn’t have to change myself to fit in with a group of friends. And also to not force myself into friendships. 🤦🏼‍♀️,en,[],[],[],0,0,6,[],[],https://twitter.com/savana_reneau/status/1243308093775077376,False,,0,,san diego,,,,,,[],,,,
1243305803051749378,1243305803051749378,2020-03-26 17:36:17 CDT,2020-03-26,17:36:17,-0500,18550652,xdr_jon3sx,xDR_JON3Sx 🍥,,"My favorite thing to do in Animal Crossing right now, is bully Rocket. I follow him around and hit him with my net. I can confidently say, he don’t want this smoke. #AnimalCrossing #ACNH  https://t.co/rVffShZdFN",en,[],[],['https://pbs.twimg.com/media/EUEcCMgUUAAPkxF.jpg'],1,0,13,"['animalcrossing', 'acnh']",[],https://twitter.com/xDR_JON3Sx/status/1243305803051749378,False,,1,https://pbs.twimg.com/media/EUEcCMgUUAAPkxF.jpg,san diego,,,,,,[],,,,
1243296631031808000,1243296631031808000,2020-03-26 16:59:50 CDT,2020-03-26,16:59:50,-0500,4875409416,jbravoii,Juan Barrios II,"{'type': 'Point', 'coordinates': [32.7155, -117.1585]}","Go to  https://t.co/zqFKtOuEMX for all info.  Please share the knowledge and do not abuse this act of generosity if you are not in need. #sandiego @ San Diego, California  https://t.co/x6GYPcULes",en,[],"['http://bit.ly/sdmarch28', 'https://www.instagram.com/p/B-NntbJARd6/?igshid=1faoj9mivkpxj']",[],0,0,0,['sandiego'],[],https://twitter.com/JBravoii/status/1243296631031808000,False,,0,,san diego,,,,,,[],,,,
1243295665259565056,1243295665259565056,2020-03-26 16:56:00 CDT,2020-03-26,16:56:00,-0500,277796372,bythesea66,bythesea,,VIRGINIA: Pastor Who Denounced Virus Response As “Mass Hysteria” To Hurt Trump Dies Of Coronavirus  https://t.co/Q3CJ4lXx57,en,[],['https://www.joemygod.com/2020/03/virginia-pastor-who-denounced-coronavirus-as-mass-hysteria-to-hurt-trump-dies-of-coronavirus/'],[],0,0,0,[],[],https://twitter.com/bythesea66/status/1243295665259565056,False,,0,,san diego,,,,,,[],,,,
1243294694685065217,1243294694685065217,2020-03-26 16:52:09 CDT,2020-03-26,16:52:09,-0500,742832297880100864,thelasthotsauce,TheLastHotSauce,,"Think all the news is giving me anxiety. Everything is like panic panic, panic, death, death, stay at home, everyone is infected. Hearing it everywhere definitely affecting me.",en,[],[],[],3,0,11,[],[],https://twitter.com/thelasthotsauce/status/1243294694685065217,False,,0,,san diego,,,,,,[],,,,
1243290343811899394,1243290343811899394,2020-03-26 16:34:51 CDT,2020-03-26,16:34:51,-0500,277796372,bythesea66,bythesea,,VIRGINIA: Pastor Who Denounced Virus Response As “Mass Hysteria” To Hurt Trump Dies Of Coronavirus  https://t.co/Q3CJ4lXx57,en,[],['https://www.joemygod.com/2020/03/virginia-pastor-who-denounced-coronavirus-as-mass-hysteria-to-hurt-trump-dies-of-coronavirus/'],[],0,0,0,[],[],https://twitter.com/bythesea66/status/1243290343811899394,False,,0,,san diego,,,,,,[],,,,
1243286304005087232,1243286304005087232,2020-03-26 16:18:48 CDT,2020-03-26,16:18:48,-0500,29484927,alayarochelle,nina🦋azarova,,"okay instead of two cups of coffee i had one &amp; im still near death...  so if 2 cups of green tea doesn't do shit, &amp; 1 cup of coffee is too much... i think that equals needing yerba matte.",en,[],[],[],2,0,5,[],[],https://twitter.com/alayarochelle/status/1243286304005087232,False,,0,,san diego,,,,,,[],,,,
1243285987414773760,1243285987414773760,2020-03-26 16:17:33 CDT,2020-03-26,16:17:33,-0500,23365626,tbogg,TBogg,,"It’s very important right now to leave explicit written instructions for your family that, in the event of your death from the coronavirus, the cause of death in your obituary must read “murdered by Donald Trump, who is a stupid motherfucker”",en,[],[],[],32,471,1562,[],[],https://twitter.com/tbogg/status/1243285987414773760,False,,0,,san diego,,,,,,[],,,,
1243280196041465857,1243280196041465857,2020-03-26 15:54:32 CDT,2020-03-26,15:54:32,-0500,130989968,trenchcoach619,Coach Michael T,,#MMATwitter at what point is enough tho. Take fighting and personality out of it.   Facts:  -Hit and Run with a pregnant woman - Failed multiple drug test - Stripper assault case  Help me understand how you back this guy still?   Hint:  “bEcAUsE iM A RiDeR” isn’t the answer  https://t.co/PnIog2FcmZ,en,[],[],['https://pbs.twimg.com/tweet_video_thumb/EUEEvq5U8AUhN_q.jpg'],0,0,0,['mmatwitter'],[],https://twitter.com/TrenchCoach619/status/1243280196041465857,False,,1,https://pbs.twimg.com/tweet_video_thumb/EUEEvq5U8AUhN_q.jpg,san diego,,,,,,[],,,,
1243271846780338177,1243271846780338177,2020-03-26 15:21:21 CDT,2020-03-26,15:21:21,-0500,143179168,mrjosephbonner,Joseph Bonner,,"United Airlines Reports COVID-19 Related Employee Death Before Family Notified, but it gets worse   https://t.co/Rz9Fyyom13 #COVID2019 #StayHome #CoronaCrisis #news #BREAKING  https://t.co/jHUfe2pqzr",en,[],['https://www.legendmgz.com/post/united-airlines-covid-19'],['https://pbs.twimg.com/media/EUD9J9uU4AAO9Sh.jpg'],3,3,3,"['covid2019', 'stayhome', 'coronacrisis', 'news', 'breaking']",[],https://twitter.com/mrjosephbonner/status/1243271846780338177,False,,1,https://pbs.twimg.com/media/EUD9J9uU4AAO9Sh.jpg,san diego,,,,,,[],,,,
1243270984909668352,1243210705190424576,2020-03-26 15:17:56 CDT,2020-03-26,15:17:56,-0500,627251902,dadreamer23,Kris Brown,,@Eddie_Edmundo91 @SportsCenter @CameronNewton He was hurt for most of them so yea cut the bs plus if you go into some of those games his had great stats just the defense couldn't stop a nose bleed smfh.,en,[],[],[],1,0,0,[],[],https://twitter.com/DaDreamer23/status/1243270984909668352,False,,0,,san diego,,,,,,"[{'screen_name': 'Eddie_Edmundo91', 'name': 'Eddie Edmundo', 'id': '1211161804048453632'}, {'screen_name': 'SportsCenter', 'name': 'SportsCenter', 'id': '26257166'}, {'screen_name': 'CameronNewton', 'name': 'Cameron 1 Newton', 'id': '252663106'}]",,,,
1243262515200458752,1243207650738876416,2020-03-26 14:44:16 CDT,2020-03-26,14:44:16,-0500,1067795989723922433,highlan63620036,Highlander,,@AdamMilstein DOJ Barr needs to issue dead or alive warrants this man Maduro is pure scum. For $15MM One of his own generals will turn against him. Hell that's what Iran issued on President Trump.,en,[],[],[],0,0,0,[],[],https://twitter.com/Highlan63620036/status/1243262515200458752,False,,0,,san diego,,,,,,"[{'screen_name': 'AdamMilstein', 'name': 'Adam Milstein', 'id': '93637779'}]",,,,
1243253496935092226,1243171139695730693,2020-03-26 14:08:26 CDT,2020-03-26,14:08:26,-0500,2389605558,shrekop,Josefumi ✨,,"@BadLegalTakes It's like the dude that came into McDonalds and threatened to punch my manager saying over a lukewarm coffee saying ""I own McDonalds stocks"" as if it makes anything going on ok or makes them an authority figure",en,[],[],[],0,0,0,[],[],https://twitter.com/ShrekOP/status/1243253496935092226,False,,0,,san diego,,,,,,"[{'screen_name': 'BadLegalTakes', 'name': 'Bad Legal Takes', 'id': '1180871463395454979'}]",,,,
1243249493903994882,1243249493903994882,2020-03-26 13:52:32 CDT,2020-03-26,13:52:32,-0500,709234249,reidmeloy,Reid Meloy,,"If u have had Covid, and u r now feeling better with no temp, u can do less isolating.  If u have vulnerable family member, another sick family member shud not be there. If u are short of breath, go to the hospital; it is not a death sentence  ——David Price, MD, ER Cornell Med",en,[],[],[],0,2,3,[],[],https://twitter.com/ReidMeloy/status/1243249493903994882,False,,0,,san diego,,,,,,[],,,,
1243248914888708096,1243244626313482241,2020-03-26 13:50:14 CDT,2020-03-26,13:50:14,-0500,1942427982,partybruin15,Karina Vega🇲🇽 (she/her/ella),,@GabrielJesse @JoeBiden I’m tired of people trying to force me to pick between two evil &amp; horrible candidates. I vote for who I feel represents me in office &amp; who has earned my vote. I will never vote out of fear!,en,[],[],[],1,0,1,[],[],https://twitter.com/Partybruin15/status/1243248914888708096,False,,0,,san diego,,,,,,"[{'screen_name': 'gabrieljesse', 'name': 'Gerb', 'id': '35755695'}, {'screen_name': 'JoeBiden', 'name': 'Joe Biden', 'id': '939091'}]",,,,
1243233468881850368,1243233468881850368,2020-03-26 12:48:51 CDT,2020-03-26,12:48:51,-0500,1180214197948301312,dani_m_walker,Dani Walker 🧨,,"Media please show the times lines of recovery and amounts, Versus just total diagnosed and death rates. It makes it seem like these people are all still actively sick. We need to see a number of those currently being treated for a hospital capacity amount and the actual curve.",en,[],[],[],2,0,1,[],[],https://twitter.com/Dani_M_Walker/status/1243233468881850368,False,,0,,san diego,,,,,,[],,,,
