id,conversation_id,created_at,date,time,timezone,user_id,username,name,place,tweet,language,mentions,urls,photos,replies_count,retweets_count,likes_count,hashtags,cashtags,link,retweet,quote_url,video,thumbnail,near,geo,source,user_rt_id,user_rt,retweet_id,reply_to,retweet_date,translate,trans_src,trans_dest
1255284324636786691,1255271006786260992,2020-04-28 18:54:39 CDT,2020-04-28,18:54:39,-0500,1005574688481964032,maknaeangiee,𝑎𝑛𝑔𝑖𝑒⁷🤎beomgyu day🐻,,@nuby1324 Why must he attack us this way 😂💀  https://t.co/rxMWmOjJx4,en,[],[],['https://pbs.twimg.com/media/EWuqbXkXgAA4QZC.jpg'],0,0,1,[],[],https://twitter.com/maknaeangiee/status/1255284324636786691,False,,1,https://pbs.twimg.com/media/EWuqbXkXgAA4QZC.jpg,dallas,,,,,,"[{'screen_name': 'nuby1324', 'name': 'N⁷ YOONGI DAY', 'id': '229281451'}]",,,,
1255283989352525825,1254811933531934721,2020-04-28 18:53:19 CDT,2020-04-28,18:53:19,-0500,3231065592,tj40in1975,Todd,,@Indiana510 @RichMcHugh @jaketapper Ford had zero proof but the left was slobbering all over that bullshit story to attack Kavanaugh,en,[],[],[],0,0,0,[],[],https://twitter.com/TJ40in1975/status/1255283989352525825,False,,0,,dallas,,,,,,"[{'screen_name': 'Indiana510', 'name': 'Indiana5', 'id': '1225824200537071617'}, {'screen_name': 'RichMcHugh', 'name': 'Rich McHugh', 'id': '110500280'}, {'screen_name': 'jaketapper', 'name': 'Jake Tapper', 'id': '14529929'}]",,,,
1255282930026516482,1255282930026516482,2020-04-28 18:49:07 CDT,2020-04-28,18:49:07,-0500,2891641567,sancheztania4,tania,,it’s too early for my neighbors to be shooting,en,[],[],[],0,0,0,[],[],https://twitter.com/sancheztania4/status/1255282930026516482,False,,0,,dallas,,,,,,[],,,,
1255282045120589824,1255282045120589824,2020-04-28 18:45:36 CDT,2020-04-28,18:45:36,-0500,4566437424,dpdcentralnpo,Dallas Central,,Central Business Crime Watch Meeting while practicing social distance @ChiefHallDPD @DPDTCastro @C_M_Shead @DerrickVWDPD  https://t.co/SH4ivxFbSk,en,"[{'screen_name': 'c_m_shead', 'name': 'catrina m. shead', 'id': '1137771115'}, {'screen_name': 'derrickvwdpd', 'name': 'derrick wright', 'id': '900010357082771457'}]",[],['https://pbs.twimg.com/media/EWuoWzHWAAUfTvl.jpg'],0,2,8,[],[],https://twitter.com/DPDCentralNPO/status/1255282045120589824,False,,1,https://pbs.twimg.com/media/EWuoWzHWAAUfTvl.jpg,dallas,,,,,,[],,,,
1255277785398067204,1255277413904375808,2020-04-28 18:28:40 CDT,2020-04-28,18:28:40,-0500,728754542494420992,7ftvonn,TALK TO EM VONN 🗣⚡️,,@nessroshay They cut out the part when they Rock Paper Scissors or spend a bottle to see who gone get the BB gun and shoot everybody,en,[],[],[],0,0,2,[],[],https://twitter.com/7ftvonn/status/1255277785398067204,False,,0,,dallas,,,,,,"[{'screen_name': 'nessroshay', 'name': 'Vanessa ✨', 'id': '1168754784'}]",,,,
1255272144713506823,1255272144713506823,2020-04-28 18:06:15 CDT,2020-04-28,18:06:15,-0500,42912666,boomer_patriot,❌John W. Wilson ن❌ #GreenIsTheNewRed,,@HillaryClinton to Endorse @JoeBiden Amid Sexual Assault Scandal  https://t.co/sAshrANTSc via @BreitbartNews What more proof does anyone need that @TheDemocrats support women only when I’d doesn’t interfere with their political agenda?,en,"[{'screen_name': 'joebiden', 'name': 'joe biden', 'id': '939091'}, {'screen_name': 'breitbartnews', 'name': 'breitbart news', 'id': '457984599'}, {'screen_name': 'thedemocrats', 'name': 'the democrats', 'id': '14377605'}]",['https://www.breitbart.com/2020-election/2020/04/28/hillary-clinton-to-endorse-joe-biden/'],[],0,0,0,[],[],https://twitter.com/Boomer_Patriot/status/1255272144713506823,False,,0,,dallas,,,,,,[],,,,
1255260963399499779,1255260963399499779,2020-04-28 17:21:49 CDT,2020-04-28,17:21:49,-0500,864745800,bebraesfull,"Brae, “SINGING does not put food on the table”",,If bird box was real do y’all think people would protest to go outside so they could die?,en,[],[],[],1,6,23,[],[],https://twitter.com/BeBraesFull/status/1255260963399499779,False,,0,,dallas,,,,,,[],,,,
1255259135039455234,1255259135039455234,2020-04-28 17:14:34 CDT,2020-04-28,17:14:34,-0500,89598185,mykeytailor,TokinThinker.eth 🧠💡,,"As a black man, the rape topic isn’t one I’ll ever discuss on twitter again. It’s so easy for words to get taken outta context, and some people will purposely do it to get you bashed.",en,[],[],[],0,0,0,[],[],https://twitter.com/MyKeyTailor/status/1255259135039455234,False,,0,,dallas,,,,,,[],,,,
1255253195376545795,1255233885581070337,2020-04-28 16:50:57 CDT,2020-04-28,16:50:57,-0500,1033904820,jeffparr3000,Jeffrey Parr,,"@peterjholley @TexasMonthly the industry was not a victim of covid, its been exposed by covid. I tweet as a member of the industry involved in a covid infected nursing home .",en,[],[],[],0,0,0,[],[],https://twitter.com/jeffparr3000/status/1255253195376545795,False,,0,,dallas,,,,,,"[{'screen_name': 'peterjholley', 'name': 'Peter Holley', 'id': '92314114'}, {'screen_name': 'TexasMonthly', 'name': 'Texas Monthly', 'id': '16365305'}]",,,,
1255249427704545286,1254872953503780865,2020-04-28 16:35:59 CDT,2020-04-28,16:35:59,-0500,894758222514405377,jfu_amy,A.F.,,"@ABC ""I think the schools are going to be open soon,"" the president said. ""I think a lot of governors are already talking about schools being open.""  A reckless fool can commit serious crime at the ""war time""!",en,[],[],[],0,0,0,[],[],https://twitter.com/jfu_amy/status/1255249427704545286,False,,0,,dallas,,,,,,"[{'screen_name': 'ABC', 'name': 'ABC News', 'id': '28785486'}]",,,,
1255246586877300739,1253744928129155073,2020-04-28 16:24:42 CDT,2020-04-28,16:24:42,-0500,51887192,notjamesparsons,James Parsons,,"Daily Streaming  Recommendation: Lethal Weapon, @netflix  #StayHome   **Since I’ve been posting a lot of @PrimeVideo lately.**  https://t.co/uFaMqXstM4",en,"[{'screen_name': 'netflix', 'name': 'netflix', 'id': '16573941'}, {'screen_name': 'primevideo', 'name': 'prime video', 'id': '17220817'}]",[],['https://pbs.twimg.com/media/EWuIHacWkAgMTde.jpg'],1,0,0,['stayhome'],[],https://twitter.com/NotJamesParsons/status/1255246586877300739,False,,1,https://pbs.twimg.com/media/EWuIHacWkAgMTde.jpg,dallas,,,,,,[],,,,
1255244360758833153,1255244360758833153,2020-04-28 16:15:51 CDT,2020-04-28,16:15:51,-0500,898054632156659713,rhinestonexeyes,Drew Barrymore ✂️,,Just worked out for the first time in the longest. Going to use this anger for good. I know people say don’t loose weight for other but doing it for myself never works. Sorry I care more about what other think.,en,[],[],[],0,0,0,[],[],https://twitter.com/Rhinestonexeyes/status/1255244360758833153,False,,0,,dallas,,,,,,[],,,,
1255239920970534921,1255239920970534921,2020-04-28 15:58:13 CDT,2020-04-28,15:58:13,-0500,615489370,sailorchristy,Christy 🌙✨,,"I’m a victim of sexual assault from a previous relationship. This tweet doesn’t address that sexual assault is not constrained to just women. Man, woman, whatever you identify as, if you have been/think you may have been sexually assaulted, my DMs are always open. ❤️",en,[],[],[],0,0,10,[],[],https://twitter.com/SailorChristy/status/1255239920970534921,False,https://twitter.com/_Shyanne_w/status/1254810742479638532,0,,dallas,,,,,,[],,,,
1255233833978466304,1255233833978466304,2020-04-28 15:34:01 CDT,2020-04-28,15:34:01,-0500,85670141,pressleypeters,Pressley H. Peters,,"“Enough water, like enough time, can make anything disappear.” Casey Cep, Furious Hours. Happy birthday Harper Lee! #alabama #quotes #harperlee #crime #writing #nonfiction #truecrime #booksconnectus #women #happybirthday #tuesdayvibes #RollTide #WritingCommunity  https://t.co/3ACCfaSiwB",en,[],[],['https://pbs.twimg.com/media/EWt8hFkWkAADq4j.jpg'],0,2,4,"['alabama', 'quotes', 'harperlee', 'crime', 'writing', 'nonfiction', 'truecrime', 'booksconnectus', 'women', 'happybirthday', 'tuesdayvibes', 'rolltide', 'writingcommunity']",[],https://twitter.com/PressleyPeters/status/1255233833978466304,False,,1,https://pbs.twimg.com/media/EWt8hFkWkAADq4j.jpg,dallas,,,,,,[],,,,
1255233675161108482,1255233675161108482,2020-04-28 15:33:23 CDT,2020-04-28,15:33:23,-0500,554789279,___incandescent,Muted. Argue with yourself.,,"I’m honestly not interested in any more “discourse” on twitter regarding sexual assault. Women say the same thing over and over, y’all just don’t want to get it.",en,[],[],[],0,21,34,[],[],https://twitter.com/___inCANdescent/status/1255233675161108482,False,,0,,dallas,,,,,,[],,,,
1255232801382830082,1255213796970414089,2020-04-28 15:29:55 CDT,2020-04-28,15:29:55,-0500,165530675,thatbobertguy,Bobert à Grande Vitesse 🇺🇦🕊,,"@anneapplebaum It's also absolutely a signal to supporters not to do so as well, which will certainly bring harm others. And these people say they're pro-life. Ugh!!",en,[],[],[],0,0,0,[],[],https://twitter.com/thatbobertguy/status/1255232801382830082,False,,0,,dallas,,,,,,"[{'screen_name': 'anneapplebaum', 'name': 'Anne Applebaum', 'id': '297100174'}]",,,,
1255232121146310657,1255230619031920643,2020-04-28 15:27:13 CDT,2020-04-28,15:27:13,-0500,328171679,beyoncefanacct,megan thee stallion fan acct,,@NotTheDrink what if i unintentionally make the same mistake or unintentionally harm them without realizing it and then they come back later with this trauma?,en,[],[],[],1,0,0,[],[],https://twitter.com/beyoncefanacct/status/1255232121146310657,False,,0,,dallas,,,,,,"[{'screen_name': 'NotTheDrink', 'name': 'cheongsan my beloved (｡♡‿♡｡)', 'id': '462530503'}]",,,,
1255231707374125057,1255222063121432580,2020-04-28 15:25:34 CDT,2020-04-28,15:25:34,-0500,1028725332457807872,moose2pointzero,Moose,,@gab_wilkens Zip line. Because I’d prob have a heart attack falling from a perfectly good airplane.,en,[],[],[],1,0,0,[],[],https://twitter.com/Moose2pointzero/status/1255231707374125057,False,,0,,dallas,,,,,,"[{'screen_name': 'gab_wilkens', 'name': 'Gab-brhi🌻', 'id': '220816946'}]",,,,
1255223527004872705,1255122846306537472,2020-04-28 14:53:04 CDT,2020-04-28,14:53:04,-0500,189696620,janthony818,Joe Anthony✊🏽🇵🇷,,"@damonm389 @nowthisnews Exactly. It's as though the cops are saying ""look, I'm going to arrest you, but I'm going to do it in a way where you're just going to walk away w/ a slap on the wrist"".",en,[],[],[],0,0,1,[],[],https://twitter.com/JAnthony818/status/1255223527004872705,False,,0,,dallas,,,,,,"[{'screen_name': 'damonm389', 'name': 'DJ Evol D', 'id': '1317490646'}, {'screen_name': 'nowthisnews', 'name': 'NowThis', 'id': '701725963'}]",,,,
1255222508720205827,1255222508720205827,2020-04-28 14:49:01 CDT,2020-04-28,14:49:01,-0500,1021824698840231937,dbvibes1999,youngKING 🤴🏾,,Unfortunately that’s not good enough... the opportunities be racist as hell. They just accept the roles because he’s a black director and writer.,en,[],[],[],1,0,5,[],[],https://twitter.com/dbvibes1999/status/1255222508720205827,False,https://twitter.com/_DashawnJ_/status/1255011504577003522,0,,dallas,,,,,,[],,,,
1255222133854220288,1255115069790306304,2020-04-28 14:47:32 CDT,2020-04-28,14:47:32,-0500,943892841201324037,gay_socialite,The Gay Socialite,,"@kenolin1 As long as he remains true to their most important value; being racist, They will support him.  Let him come out one day and say something hinting towards equal anything for people of color, then  watch them run for the hills and their trailers.",en,[],[],[],0,1,3,[],[],https://twitter.com/gay_socialite/status/1255222133854220288,False,,0,,dallas,,,,,,"[{'screen_name': 'kenolin1', 'name': 'Ken Olin', 'id': '164679813'}]",,,,
1255222091198222336,1255222091198222336,2020-04-28 14:47:22 CDT,2020-04-28,14:47:22,-0500,31331256,branillionaire,alternative factos 👍🏾👀,,bandeja paisa is a guaranteed heart attack but worth it,en,[],[],[],0,0,0,[],[],https://twitter.com/branillionaire/status/1255222091198222336,False,https://twitter.com/JeanAndre_24/status/1254990162334937088,0,,dallas,,,,,,[],,,,
1255219989440839681,1255219989440839681,2020-04-28 14:39:00 CDT,2020-04-28,14:39:00,-0500,76104736,keylockmvp,🏳️‍🌈KeyLock🏳️‍🌈,,Nothing like trouble shooting capture card issues 🙄,en,[],[],[],0,0,3,[],[],https://twitter.com/KeyLockMVP/status/1255219989440839681,False,,0,,dallas,,,,,,[],,,,
1255217676202508289,1255217676202508289,2020-04-28 14:29:49 CDT,2020-04-28,14:29:49,-0500,761803734,princehl,Prince HL,,White NFL draft pick wears racist tattoo as Kaepernick remains unsigned #Topbuzz  https://t.co/PQ5EvfBhNk,en,[],['https://va.topbuzz.com/s/sjhsZy'],[],0,0,1,['topbuzz'],[],https://twitter.com/PrinceHL/status/1255217676202508289,False,,0,,dallas,,,,,,[],,,,
1255216987682361346,1255136888819613699,2020-04-28 14:27:05 CDT,2020-04-28,14:27:05,-0500,1235379102401671168,mpsallusti73,MPSallusti,,"@Olivianuzzi I would never wish harm on another fellow human being and that’s awful.  I would, however, that you ask a question that provides actual information as opposed to advancing a political narrative.",en,[],[],[],0,0,0,[],[],https://twitter.com/MPSallusti73/status/1255216987682361346,False,,0,,dallas,,,,,,"[{'screen_name': 'Olivianuzzi', 'name': 'Olivia Nuzzi', 'id': '21212087'}]",,,,
1255216106547150851,1255216106547150851,2020-04-28 14:23:35 CDT,2020-04-28,14:23:35,-0500,453799826,cambone88,ᥴꪖꪑᦓꪮꪀ  🇺🇦,,Dang it Bobby why isn't there an official King Of The Hill page on Twitter should be a crime i tell you what  https://t.co/djWCpRuBxs,en,[],[],['https://pbs.twimg.com/media/EWtsZBeWAAoJ8Er.jpg'],0,2,9,[],[],https://twitter.com/Cambone88/status/1255216106547150851,False,,1,https://pbs.twimg.com/media/EWtsZBeWAAoJ8Er.jpg,dallas,,,,,,[],,,,
1255202975376642050,1255202975376642050,2020-04-28 13:31:24 CDT,2020-04-28,13:31:24,-0500,2772205013,jerkyxbacon,Jarvis_AB,,"I Eat Sleep Breath for SUCCESS, I’m not settling to be AVERAGE. Wake up, pray, and attack for what is yours. I believe we weren’t born to be average, we all want more.  https://t.co/q0VBctn90O",en,[],[],['https://pbs.twimg.com/media/EWtgck1XsAE6w_C.jpg'],0,0,2,[],[],https://twitter.com/JerkyxBacon/status/1255202975376642050,False,,1,https://pbs.twimg.com/media/EWtgck1XsAE6w_C.jpg,dallas,,,,,,[],,,,
1255194696302972929,1255194696302972929,2020-04-28 12:58:30 CDT,2020-04-28,12:58:30,-0500,466568111,joseileyvajr,JL 🥊🏇,,"Why aren't yall covering #TaraReade @CNN ? If another Trump victim came out with allegations; you would cover them in a heartbeat. But this one is against #CornPop @JoeBiden so, lets give a pass? #MeToo #MeTooUnlessItsBiden",en,"[{'screen_name': 'cnn', 'name': 'cnn', 'id': '759251'}, {'screen_name': 'joebiden', 'name': 'joe biden', 'id': '939091'}]",[],[],0,0,1,"['tarareade', 'cornpop', 'metoo', 'metoounlessitsbiden']",[],https://twitter.com/JoseILeyvajr/status/1255194696302972929,False,,0,,dallas,,,,,,[],,,,
1255193299004067841,1255193299004067841,2020-04-28 12:52:57 CDT,2020-04-28,12:52:57,-0500,89598185,mykeytailor,TokinThinker.eth 🧠💡,,"Not to sound like a coon, but y’all need to just let them arrest you. Squirming and shit is not gonna make them release you, it gives them the “right” to curb stomp you.",en,[],[],[],0,0,0,[],[],https://twitter.com/MyKeyTailor/status/1255193299004067841,False,https://twitter.com/destiinoo_/status/1254955873123749888,0,,dallas,,,,,,[],,,,
1255188006060929024,1255188006060929024,2020-04-28 12:31:55 CDT,2020-04-28,12:31:55,-0500,42912666,boomer_patriot,❌John W. Wilson ن❌ #GreenIsTheNewRed,,"They Asked Every Senate Dem About @JoeBiden Sex Assault Allegation, Not a Single One Acknowledged It  https://t.co/ICtAfVoHLd",en,"[{'screen_name': 'joebiden', 'name': 'joe biden', 'id': '939091'}]",['https://www.westernjournal.com/asked-every-senate-dem-biden-sex-assault-allegation-not-single-one-acknowledged/?utm_source=Twitter&utm_medium=PostTopSharingButtons&utm_campaign=websitesharingbuttons'],[],0,0,0,[],[],https://twitter.com/Boomer_Patriot/status/1255188006060929024,False,,0,,dallas,,,,,,[],,,,
1255182705169502209,1255182705169502209,2020-04-28 12:10:51 CDT,2020-04-28,12:10:51,-0500,1074783224876986369,un_happy_meal,✨,,"A crime show finally broke me.   The Case That Haunts Me, S1E8  The end of the episode made me physically sick.",en,[],[],[],0,0,1,[],[],https://twitter.com/Un_Happy_Meal/status/1255182705169502209,False,,0,,dallas,,,,,,[],,,,
1255182027835531265,1255182027835531265,2020-04-28 12:08:10 CDT,2020-04-28,12:08:10,-0500,1025207641,thekennyreeves,PLEASE SAY THE “THE”,,"“My good man, did you simply get carried away with your dramatic gesture or are you pointing your weapon at me with lethal intention”  That line was cold. He was never shook.",en,[],[],[],0,1,3,[],[],https://twitter.com/TheKennyReeves/status/1255182027835531265,False,,0,,dallas,,,,,,[],,,,
1255176359938330624,1255145773882204161,2020-04-28 11:45:38 CDT,2020-04-28,11:45:38,-0500,61012423,ryansternmd,M  D Ryan Stern,,"@SkyTNewton I left out 9/11/2001! I was in hospital after my first heart attack awaiting surgery. Five CA, 10 stents, 4xCAB, pacemaker; HIV+30years, diabetes, broken lumbar vertebrae, scoliosis thoracic vertebrae, kyphosis cervical vertebrae (hunchback).",en,[],[],[],0,0,0,[],[],https://twitter.com/RyanSternMD/status/1255176359938330624,False,,0,,dallas,,,,,,"[{'screen_name': 'SkyTNewton', 'name': 'Thomas Newton', 'id': '29067808'}]",,,,
1255168182106677251,1255168182106677251,2020-04-28 11:13:09 CDT,2020-04-28,11:13:09,-0500,703622044680720384,lvelovelace,LVE🎨,,"I’ll keep saying this till the day I die,if he never got injured he would’ve been RUNNING the whole NBA rn",en,[],[],[],0,0,3,[],[],https://twitter.com/lvelovelace/status/1255168182106677251,False,https://twitter.com/BleacherReport/status/1255127277131698176,0,,dallas,,,,,,[],,,,
1255168113081036801,1255168113081036801,2020-04-28 11:12:52 CDT,2020-04-28,11:12:52,-0500,982018656354922497,live_brice,Brice Live Sketch Co,,"The man is killing citizens , he qualify for article he's nuts and putting Americans in danger and outright killing them ingest bleach? How do I file that article, I'd be happy to do it  https://t.co/9AkQhKhSxi",en,[],[],['https://pbs.twimg.com/tweet_video_thumb/EWtAu__XsAwoYTY.jpg'],0,0,1,[],[],https://twitter.com/live_brice/status/1255168113081036801,False,,1,https://pbs.twimg.com/tweet_video_thumb/EWtAu__XsAwoYTY.jpg,dallas,,,,,,[],,,,
1255144160220176384,1255144160220176384,2020-04-28 09:37:41 CDT,2020-04-28,09:37:41,-0500,42912666,boomer_patriot,❌John W. Wilson ن❌ #GreenIsTheNewRed,,Two Democrats Corroborate Tara Reade's Sexual Assault Allegation Against @JoeBiden  https://t.co/lVr1cCMIft,en,"[{'screen_name': 'joebiden', 'name': 'joe biden', 'id': '939091'}]",['https://townhall.com/tipsheet/bethbaumann/2020/04/27/someone-just-stepped-forward-to-corroborate-tara-reades-sexual-assault-allegation-against-joe-biden-n2567735'],[],1,2,1,[],[],https://twitter.com/Boomer_Patriot/status/1255144160220176384,False,,0,,dallas,,,,,,[],,,,
1255143316556926976,1255143316556926976,2020-04-28 09:34:20 CDT,2020-04-28,09:34:20,-0500,259109877,mookied_blastem,Bird App Josh 🐦🤠,,For my birthday if the world is open i wanna do paint ball shooting n go kart racing during the day n at night go out to eat,en,[],[],[],1,0,0,[],[],https://twitter.com/MookieD_Blastem/status/1255143316556926976,False,,0,,dallas,,,,,,[],,,,
1255140308213395456,1255140308213395456,2020-04-28 09:22:23 CDT,2020-04-28,09:22:23,-0500,42912666,boomer_patriot,❌John W. Wilson ن❌ #GreenIsTheNewRed,,1993 episode of ‘Larry King Live’ goes missing from Google Play amid Biden sex assault controversy: Report  https://t.co/eaO9CfUqDh,en,[],['https://conservativeinstitute.org/conservative-news/episode-larry-king-missing.htm'],[],0,0,0,[],[],https://twitter.com/Boomer_Patriot/status/1255140308213395456,False,,0,,dallas,,,,,,[],,,,
1255136733340954625,1255136733340954625,2020-04-28 09:08:11 CDT,2020-04-28,09:08:11,-0500,189726412,theleahfrazier,Leah Frazier,,Don’t allow yourself to fall victim to the rat race - trying to keep up with everyone around you and feeling like what you’re doing or working on isn’t enough.   Maybe at this time or in this season — God is calling you to slow down and to be still. #TuesdayMotivation  https://t.co/5yn4S8BXTh,en,[],[],['https://pbs.twimg.com/media/EWskNEtUwAMnR5J.jpg'],0,0,6,['tuesdaymotivation'],[],https://twitter.com/TheLeahFrazier/status/1255136733340954625,False,,1,https://pbs.twimg.com/media/EWskNEtUwAMnR5J.jpg,dallas,,,,,,[],,,,
1255127925415911424,1255127925415911424,2020-04-28 08:33:11 CDT,2020-04-28,08:33:11,-0500,204116856,xoxoebaby,e.,,how can niggas do you wrong &amp; still play the victim.,en,[],[],[],0,0,0,[],[],https://twitter.com/xoxoebaby/status/1255127925415911424,False,,0,,dallas,,,,,,[],,,,
1255123432347443200,1255123432347443200,2020-04-28 08:15:19 CDT,2020-04-28,08:15:19,-0500,905084921189978112,ureneehall,Reneé Hall,,"Street racing is illegal. It is not safe and can be expensive. Drivers and spectators are often injured as a result of reckless driving. Citations are issued, people are arrested and vehicles are towed. Respect your community by keeping it safe. #NotWorthTheRisk @DallasPD",en,"[{'screen_name': 'dallaspd', 'name': 'dallas police dept', 'id': '28758060'}]",[],[],2,6,22,['notworththerisk'],[],https://twitter.com/UReneeHall/status/1255123432347443200,False,https://twitter.com/wfaa/status/1254976132794982400,0,,dallas,,,,,,[],,,,
1255111582939582464,1255111582939582464,2020-04-28 07:28:14 CDT,2020-04-28,07:28:14,-0500,164416840,ayokasystems,Ayoka Systems,,#Amazon crime? GOP Sen. Hawley asks DOJ to open a criminal investigation into @Amazon - charging the #ecommerce software development company with “predatory and exclusionary #data practices to build and maintain a monopoly” on its #database from @CNBC   https://t.co/0RWDQRrJHK,en,"[{'screen_name': 'amazon', 'name': 'amazon', 'id': '20793816'}, {'screen_name': 'cnbc', 'name': 'cnbc', 'id': '20402945'}]",['https://www.cnbc.com/2020/04/28/gop-sen-hawley-asks-doj-to-open-a-criminal-investigation-into-amazon.html?__source=iosappshare%7Ccom.apple.UIKit.activity.PostToTwitter'],[],0,1,1,"['amazon', 'ecommerce', 'data', 'database']",[],https://twitter.com/ayokasystems/status/1255111582939582464,False,,0,,dallas,,,,,,[],,,,
1255102216802836482,1254908621021941760,2020-04-28 06:51:01 CDT,2020-04-28,06:51:01,-0500,52247328,dallasanalytics,Reason and analytics in Dallas,,@BradyWalters @RCaseyONeill @FOX4 Which may well be also due to fear based hospital avoidance and other issues. Heart attack visits are down 40%.   With respect to children Massachusetts is a hotspot with 55k cases and only 11 children are hospitalized. Children are generally spared by COVID-19.,en,[],[],[],1,0,1,[],[],https://twitter.com/DallasAnalytics/status/1255102216802836482,False,,0,,dallas,,,,,,"[{'screen_name': 'BradyWalters', 'name': 'Brady Walters', 'id': '1296144310442893316'}, {'screen_name': 'RCaseyONeill', 'name': ""Casey O'Neill"", 'id': '831749280'}, {'screen_name': 'FOX4', 'name': 'FOX 4 NEWS', 'id': '16656350'}]",,,,
1255096004141101058,1255096004141101058,2020-04-28 06:26:20 CDT,2020-04-28,06:26:20,-0500,329203010,daniel_noise,noise 🦂,,I have a fucking massage gun what am I doing laying here wallowing in this soreness!,en,[],[],[],1,0,0,[],[],https://twitter.com/Daniel_Noise/status/1255096004141101058,False,,0,,dallas,,,,,,[],,,,
1255086217403793408,1254877836852289540,2020-04-28 05:47:27 CDT,2020-04-28,05:47:27,-0500,119202522,texasguy37,Donnie Belk,,@willsommer Now the others on Fox News who downplayed the threat which has costed human lives need to go.,en,[],[],[],0,0,0,[],[],https://twitter.com/texasguy37/status/1255086217403793408,False,,0,,dallas,,,,,,"[{'screen_name': 'willsommer', 'name': 'Will Sommer', 'id': '274294204'}]",,,,
1255062363746840576,1255062363746840576,2020-04-28 04:12:40 CDT,2020-04-28,04:12:40,-0500,1452570672,maryashleyh,HIGHLY EDUCATED SUBURBAN RIGHT WOMAN,,"How sad, we find ourselves being lead by Doctors who are either COWARDS or PSYCHOTIC PRACTITIONERS only TRUMP has the HEART to bring any Weapons he has against the assault of DEATH! He's the guy U'd want 2go to WAR beside U!!  https://t.co/baRgV3T5Yw",en,[],[],['https://pbs.twimg.com/media/EWrgkXdXkAENNUR.jpg'],0,0,0,[],[],https://twitter.com/MaryashleyH/status/1255062363746840576,False,https://twitter.com/AKA_RealDirty/status/1254975054464630784,1,https://pbs.twimg.com/media/EWrgkXdXkAENNUR.jpg,dallas,,,,,,[],,,,
1255035129849950208,1255034094704103424,2020-04-28 02:24:27 CDT,2020-04-28,02:24:27,-0500,703622044680720384,lvelovelace,LVE🎨,,@RYAVEEEE Is attack on titan good?👀,en,[],[],[],1,0,1,[],[],https://twitter.com/lvelovelace/status/1255035129849950208,False,,0,,dallas,,,,,,"[{'screen_name': 'RYAVEEEE', 'name': 'RY!', 'id': '1092203908687110144'}]",,,,
1255026394045841409,1254971906954088450,2020-04-28 01:49:44 CDT,2020-04-28,01:49:44,-0500,1073529640046788608,ramouth1,Ramouth,,@DdaengLife @BTS_twt Welcome to the Danger Zone...,en,[],[],[],0,0,0,[],[],https://twitter.com/Ramouth1/status/1255026394045841409,False,,0,,dallas,,,,,,"[{'screen_name': 'DdaengLife', 'name': 'BTS: PAVING THE WAY since²⁰¹³', 'id': '968436867304710144'}, {'screen_name': 'BTS_twt', 'name': '방탄소년단', 'id': '335141638'}]",,,,
1255015831039348737,1254823356005666816,2020-04-28 01:07:45 CDT,2020-04-28,01:07:45,-0500,2342381,rhuntington3,Richard Huntington,,@SantaMonicaProb @S_BixlerPhoto @LACoSheriff Maybe a sign saying ‘Gun Free Zone’ will help.,en,[],[],[],1,0,1,[],[],https://twitter.com/rhuntington3/status/1255015831039348737,False,,0,,dallas,,,,,,"[{'screen_name': 'SantaMonicaProb', 'name': 'Santa Monica Problems', 'id': '1107389470343458816'}, {'screen_name': 'S_BixlerPhoto', 'name': 'Richard Scott Bixler', 'id': '212691729'}, {'screen_name': 'LACoSheriff', 'name': 'Alex Villanueva', 'id': '1067499378175238144'}]",,,,
