id,conversation_id,created_at,date,time,timezone,user_id,username,name,place,tweet,language,mentions,urls,photos,replies_count,retweets_count,likes_count,hashtags,cashtags,link,retweet,quote_url,video,thumbnail,near,geo,source,user_rt_id,user_rt,retweet_id,reply_to,retweet_date,translate,trans_src,trans_dest
1242964374630928384,1242959664419147785,2020-03-25 18:59:34 CDT,2020-03-25,18:59:34,-0500,939640416231723008,vvvfffnnnnnnn,faye🐅💚,,@valllll__ If you like crime &amp; serial killers go with MINDHUNTERS ( I tell this to everyone),en,[],[],[],1,0,2,[],[],https://twitter.com/vvvfffnnnnnnn/status/1242964374630928384,False,,0,,san antonio,,,,,,"[{'screen_name': 'valllll__', 'name': 'valerie', 'id': '1537457888'}]",,,,
1242959092886286336,1242959092886286336,2020-03-25 18:38:35 CDT,2020-03-25,18:38:35,-0500,296592184,cakesgod,marcus,,Facts I hope they put this bitch in the Gulag with no weapon,en,[],[],[],0,0,0,[],[],https://twitter.com/CAKESGOD/status/1242959092886286336,False,https://twitter.com/phan1om_/status/1242765462410321921,0,,san antonio,,,,,,[],,,,
1242953429464555521,1242953429464555521,2020-03-25 18:16:05 CDT,2020-03-25,18:16:05,-0500,29130467,arrrkane,rob kane,,This too is brutal.,en,[],[],[],0,0,1,[],[],https://twitter.com/arrrkane/status/1242953429464555521,False,https://twitter.com/MollyGriffard/status/1242926755746402306,0,,san antonio,,,,,,[],,,,
1242952909656133632,1242952909656133632,2020-03-25 18:14:01 CDT,2020-03-25,18:14:01,-0500,29130467,arrrkane,rob kane,,This is brutal.,en,[],[],[],0,0,1,[],[],https://twitter.com/arrrkane/status/1242952909656133632,False,https://twitter.com/brianstelter/status/1242940053187375104,0,,san antonio,,,,,,[],,,,
1242938532831821825,1242938068006567937,2020-03-25 17:16:53 CDT,2020-03-25,17:16:53,-0500,25162417,thatbravesgirl,Commish Cassie,,@BravesWendy That’s a straight up attack on your emotional well being at a time like this.,en,[],[],[],1,0,1,[],[],https://twitter.com/ThatBravesGirl/status/1242938532831821825,False,,0,,san antonio,,,,,,[],,,,
1242915224346398722,1242915224346398722,2020-03-25 15:44:16 CDT,2020-03-25,15:44:16,-0500,1047971557,cwilltooill,“A Wetumpka Baby” Coming Soon 🤞🏾,,Y’all listen to this man. We all know who he is! And his mom is a victim. Stop playing with T-Rona,en,[],[],[],0,0,0,[],[],https://twitter.com/Cwilltooill/status/1242915224346398722,False,https://twitter.com/KarlTowns/status/1242688948335456256,0,,san antonio,,,,,,[],,,,
1242910385574985731,1242910385574985731,2020-03-25 15:25:02 CDT,2020-03-25,15:25:02,-0500,715211464953319424,usgs_texasrain,USGS TX RainWatch,"{'type': 'Point', 'coordinates': [29.39301189, -98.4947392]}","#USGS08178050 - San Antonio Rv at Mitchell St, San Antonio, TX  Violent Rain (2.52 in/hr) over the last 5 minutes   https://t.co/s41sJF0uFi",en,[],['http://waterdata.usgs.gov/tx/nwis/uv?site_no=08178050&t=20200325151500'],[],0,0,0,['usgs08178050'],[],https://twitter.com/USGS_TexasRain/status/1242910385574985731,False,,0,,san antonio,,,,,,[],,,,
1242904612778237955,1242887562433363968,2020-03-25 15:02:06 CDT,2020-03-25,15:02:06,-0500,16375552,awhirlydoodle,Luis,,"@CarIosMartinez And the editing, and the research and pulling all clips from the web, and shooting the actual car 🥵 I finished at like 4 am last night",en,[],[],[],0,0,0,[],[],https://twitter.com/aWhirlydoodle/status/1242904612778237955,False,,0,,san antonio,,,,,,"[{'screen_name': 'CarIosMartinez', 'name': 'Carlos M', 'id': '47717503'}]",,,,
1242902832942022656,1242902832942022656,2020-03-25 14:55:02 CDT,2020-03-25,14:55:02,-0500,715211464953319424,usgs_texasrain,USGS TX RainWatch,"{'type': 'Point', 'coordinates': [29.39301189, -98.4947392]}","#USGS08178050 - San Antonio Rv at Mitchell St, San Antonio, TX  Violent Rain (2.88 in/hr) over the last 5 minutes   https://t.co/NDGCcTFnnL",en,[],['http://waterdata.usgs.gov/tx/nwis/uv?site_no=08178050&t=20200325144500'],[],0,0,0,['usgs08178050'],[],https://twitter.com/USGS_TexasRain/status/1242902832942022656,False,,0,,san antonio,,,,,,[],,,,
1242894310615515138,1242894310615515138,2020-03-25 14:21:10 CDT,2020-03-25,14:21:10,-0500,708326471303954433,cruzmando210,Mando,,"We need civil unrest , protest, riots, and a guillotin , anything to make these big cats in DC bend to the will of the people",en,[],[],[],0,0,2,[],[],https://twitter.com/cruzmando210/status/1242894310615515138,False,,0,,san antonio,,,,,,[],,,,
1242889164141531137,1242888894284259329,2020-03-25 14:00:43 CDT,2020-03-25,14:00:43,-0500,427784405,kaitlynpettis,k8,,"not trying to play the pity party “oh I’m on the frontlines”, it’s just annoying that I can’t get gas after work without people staring at me as if I have a gun in my hand",en,[],[],[],0,0,3,[],[],https://twitter.com/kaitlynpettis/status/1242889164141531137,False,,0,,san antonio,,,,,,[],,,,
1242866859386560516,1242866859386560516,2020-03-25 12:32:05 CDT,2020-03-25,12:32:05,-0500,4922494238,nayhinojosa,nay 🧚🏼‍♀️,,I’m learning my brother has serious anger issues 💀💀,en,[],[],[],0,0,0,[],[],https://twitter.com/nayhinojosa/status/1242866859386560516,False,,0,,san antonio,,,,,,[],,,,
1242854975098757120,1242848930028638211,2020-03-25 11:44:51 CDT,2020-03-25,11:44:51,-0500,128429068,alamoontherise,Alamo_On_The_Rise 😷🇺🇲,,@dstanglin @JenniferJJacobs Is it not a medical procedure?  Is it not health care? Is is not legal?  What are they going to do? Arrest the doctor and the patient? Proceed and force the governor to commit political suicide.,en,[],[],[],0,1,2,[],[],https://twitter.com/AlamoOnTheRise/status/1242854975098757120,False,,0,,san antonio,,,,,,"[{'screen_name': 'dstanglin', 'name': 'Doug Stanglin', 'id': '15754742'}, {'screen_name': 'JenniferJJacobs', 'name': 'Jennifer Jacobs', 'id': '15433452'}]",,,,
1242840050657824773,1242840050657824773,2020-03-25 10:45:33 CDT,2020-03-25,10:45:33,-0500,3180996476,gadams2486,Greg Adams,,1) Destroyer 2) Love Gun 3) Asylum,en,[],[],[],0,0,0,[],[],https://twitter.com/gadams2486/status/1242840050657824773,False,https://twitter.com/KISSopolis/status/1242614392077692929,0,,san antonio,,,,,,[],,,,
1242825860274688002,1242825860274688002,2020-03-25 09:49:10 CDT,2020-03-25,09:49:10,-0500,4504003993,emo_daddy_,taking back grey,,I have to wait for Bo to finish attack on Titan so I think I’ll watch a short and fast anime today.. is it wrong to try to pick up girls in a dungeon?,en,[],[],[],1,0,1,[],[],https://twitter.com/emo_daddy_/status/1242825860274688002,False,,0,,san antonio,,,,,,[],,,,
1242806312163053568,1241530817081249792,2020-03-25 08:31:29 CDT,2020-03-25,08:31:29,-0500,3300869829,nursekc_,KC 🎀,,@popitmike @PinkSizzy @SwDreaa @tyrone_brother @_ayannaE Was the girl’s mom in middle school too or a grown ass racist woman?,en,[],[],[],1,0,0,[],[],https://twitter.com/NurseKC_/status/1242806312163053568,False,,0,,san antonio,,,,,,"[{'screen_name': 'popitmike', 'name': 'Chief', 'id': '45217034'}, {'screen_name': 'PinkSizzy', 'name': 'consciousness over coochie', 'id': '401603130'}, {'screen_name': 'SwDreaa', 'name': 'Drea', 'id': '1496321215757275144'}, {'screen_name': 'tyrone_brother', 'name': 'Brother tyrone X', 'id': '1155828440400093186'}, {'screen_name': '_ayannaE', 'name': 'ekane .', 'id': '932838938'}]",,,,
1242694698894012421,1242694698894012421,2020-03-25 01:07:59 CDT,2020-03-25,01:07:59,-0500,1188486327987249153,bestdeporter,Lil Pur Vert,,Let me die from cardiac arrest,en,[],[],[],0,0,0,[],[],https://twitter.com/BestDeporter/status/1242694698894012421,False,,0,,san antonio,,,,,,[],,,,
1242693649059758080,1242693649059758080,2020-03-25 01:03:48 CDT,2020-03-25,01:03:48,-0500,442108204,saucedpancake,Juan Sauce-Doh!,,"Oh God, we're in danger now.",en,[],[],[],0,0,1,[],[],https://twitter.com/saucedpancake/status/1242693649059758080,False,https://twitter.com/WAFB/status/1242588481504845830,0,,san antonio,,,,,,[],,,,
1242691992976572416,1242691992976572416,2020-03-25 00:57:13 CDT,2020-03-25,00:57:13,-0500,517021522,_triplephone,Kaido Modesto 天,,Moonsault assault,et,[],[],[],0,0,0,[],[],https://twitter.com/_triplephone/status/1242691992976572416,False,,0,,san antonio,,,,,,[],,,,
1242676611515908098,1242675685430157313,2020-03-24 23:56:06 CDT,2020-03-24,23:56:06,-0500,860256210725081088,punknbread,Autumn 🎃 🍞,,@UltraNick24 SO VIOLENT LMAO,en,[],[],[],2,0,2,[],[],https://twitter.com/PunkNbread/status/1242676611515908098,False,,0,,san antonio,,,,,,"[{'screen_name': 'UltraNick24', 'name': 'Dominic', 'id': '454253058'}]",,,,
1242675807232942081,1242675807232942081,2020-03-24 23:52:54 CDT,2020-03-24,23:52:54,-0500,987069131647307776,saracamposano12,Sara 🤍,,"When rue said “it wasn’t the violence that scared her, it was the fact that she knew no matter what he did, she’d still love him” My heart dropped and I started crying ???",en,[],[],[],0,0,3,[],[],https://twitter.com/SaraCamposano12/status/1242675807232942081,False,,0,,san antonio,,,,,,[],,,,
1242671646374268930,1242536704600391684,2020-03-24 23:36:22 CDT,2020-03-24,23:36:22,-0500,131706008,natethegreat118,2natez,,@roisbelh @matchu_chutrain Sexual orientation should have no bearing on whether or not it’s acceptable to be a bigot. Racism/sexism/homophobia have no place in society and bigots should be exposed and face the public backlash of their actions.,en,[],[],[],0,0,1,[],[],https://twitter.com/natethegreat118/status/1242671646374268930,False,,0,,san antonio,,,,,,"[{'screen_name': 'roisbelh', 'name': 'Roy Hernandez', 'id': '1686180224'}, {'screen_name': 'matchu_chutrain', 'name': 'Mat George', 'id': '339914949'}]",,,,
1242670182876798978,1242670182876798978,2020-03-24 23:30:33 CDT,2020-03-24,23:30:33,-0500,1248817488,jaimer829,“jaime”,,Wow the corona virus is sexist too smh  https://t.co/8loAQT6b36,en,[],[],['https://pbs.twimg.com/media/ET7Z8Z_XsAAsyIc.jpg'],0,0,3,[],[],https://twitter.com/jaimer829/status/1242670182876798978,False,,1,https://pbs.twimg.com/media/ET7Z8Z_XsAAsyIc.jpg,san antonio,,,,,,[],,,,
1242665487064064007,1242665487064064007,2020-03-24 23:11:54 CDT,2020-03-24,23:11:54,-0500,3301736354,destinyyy_rosee,DestinyRose 🌶,,Why do people love to play victim?,en,[],[],[],1,2,5,[],[],https://twitter.com/destinyyy_rosee/status/1242665487064064007,False,,0,,san antonio,,,,,,[],,,,
1242661911998717953,1242661911998717953,2020-03-24 22:57:42 CDT,2020-03-24,22:57:42,-0500,2166019555,thesilversoul2,"爪ㄖ几Ҝ乇ㄚ, ᗪ ﾌ乇几几ㄚ",,Adriel and I just saw a shooting star,en,[],[],[],0,0,1,[],[],https://twitter.com/TheSilverSoul2/status/1242661911998717953,False,,0,,san antonio,,,,,,[],,,,
1242658225931063297,1242657578854895619,2020-03-24 22:43:03 CDT,2020-03-24,22:43:03,-0500,14802766,nan,"Nan Palmero, MBA",,@SheaSerrano Rowdy was racist!?,en,[],[],[],0,0,1,[],[],https://twitter.com/nan/status/1242658225931063297,False,,0,,san antonio,,,,,,"[{'screen_name': 'SheaSerrano', 'name': 'Shea Serrano', 'id': '57162282'}]",,,,
1242656181040144385,1242643286571003904,2020-03-24 22:34:55 CDT,2020-03-24,22:34:55,-0500,1480869571,tbirdtr3y_10,Trey Felder,,"@redditspurs JD from ""Scrubs"" Mikasa Ackerman from ""Attack on Titan"" Jess from ""New Girl"" Barney Fife from ""The Andy Griffith Show"" ""Dexter""",en,[],[],[],5,0,2,[],[],https://twitter.com/TbirdTr3y_10/status/1242656181040144385,False,,0,,san antonio,,,,,,"[{'screen_name': 'redditspurs', 'name': '/r/spurs', 'id': '1145003091651112962'}]",,,,
1242655579803443201,1242655579803443201,2020-03-24 22:32:32 CDT,2020-03-24,22:32:32,-0500,4504003993,emo_daddy_,taking back grey,,Attack on Titan is sooooo good,en,[],[],[],2,0,7,[],[],https://twitter.com/emo_daddy_/status/1242655579803443201,False,,0,,san antonio,,,,,,[],,,,
1242628040196263937,1242628040196263937,2020-03-24 20:43:06 CDT,2020-03-24,20:43:06,-0500,2439163164,8fca8b5354c1454,Texas K,,@TheJusticeDept   https://t.co/m9SIvk8Lpb Is this a threat to the President?,en,[],['https://twitter.com/ReckoningTruth/status/1242593638280036355?s=19'],[],0,0,0,[],[],https://twitter.com/8fca8b5354c1454/status/1242628040196263937,False,0,0,,san antonio,,,,,,[],,,,
1242614376512831490,1242614376512831490,2020-03-24 19:48:48 CDT,2020-03-24,19:48:48,-0500,3618130152,charlesmckinle7,Charles Mckinley,,Oh great now the thieves can rob the gun store with little risk. Morons of California.,en,[],[],[],0,0,0,[],[],https://twitter.com/CharlesMckinle7/status/1242614376512831490,False,https://twitter.com/HouseCracka/status/1242586594109992962,0,,san antonio,,,,,,[],,,,
1242613057702027264,1242550438572044289,2020-03-24 19:43:34 CDT,2020-03-24,19:43:34,-0500,995427698884390913,sebas_the_storm,Sebastian,,"@jordanhalee Choose where your subconscious and intelligent energy go. However where you channel this energy needs to be chosen carefully. For it not, the energy can become abrasive and violent(metaphor)  https://t.co/2P0Q3U70U3",en,[],[],['https://pbs.twimg.com/media/ET6l_FwXsAU3cLc.jpg'],1,0,1,[],[],https://twitter.com/Sebas_the_storm/status/1242613057702027264,False,,1,https://pbs.twimg.com/media/ET6l_FwXsAU3cLc.jpg,san antonio,,,,,,"[{'screen_name': 'jordanhalee', 'name': 'jordan hale', 'id': '276334991'}]",,,,
1242608740584558592,1242525633613307904,2020-03-24 19:26:24 CDT,2020-03-24,19:26:24,-0500,15458968,meganfangirl,mfangirl captain of many ships and OG Candygirl,,@emtothea This is the gay agenda right? Make the worlds best show with the best team/people/characters/cast about a gun that kills revenants within a set city limits... that then turns everyone gay because of awesomeness.,en,[],[],[],0,0,0,[],[],https://twitter.com/Meganfangirl/status/1242608740584558592,False,,0,,san antonio,,,,,,"[{'screen_name': 'emtothea', 'name': 'Emily Andras', 'id': '90472293'}]",,,,
1242604838606770179,1242566137176633350,2020-03-24 19:10:54 CDT,2020-03-24,19:10:54,-0500,936645535104151553,hope411adcock,Samantha,,"@process_x @bonniez45 @esteckler2 SMH   there's no need for folks to be that way.  It's possible to have differing perspectives &amp; discuss them without making it a personal attack.  Or being Rude😕  As a fall back.. Agreeing to disagree.  But, remaining civil.",en,[],[],[],0,0,1,[],[],https://twitter.com/hope411adcock/status/1242604838606770179,False,,0,,san antonio,,,,,,"[{'screen_name': 'process_x', 'name': 'D.S. Nelson', 'id': '97065490'}, {'screen_name': 'bonniez45', 'name': 'bonnie zimmerman', 'id': '25703546'}]",,,,
1242600107859759107,1242600107859759107,2020-03-24 18:52:06 CDT,2020-03-24,18:52:06,-0500,261393871,b_baby318,B Baby,,What be pissin me off when nigga do allllll that shooting &amp; don’t hit shii 🤨 I’m glad nobody died tho but still,en,[],[],[],0,0,0,[],[],https://twitter.com/B_Baby318/status/1242600107859759107,False,,0,,san antonio,,,,,,[],,,,
1242598161966944256,1242595437942583296,2020-03-24 18:44:22 CDT,2020-03-24,18:44:22,-0500,739065966,pro_nuke,WE0209,,In spite of the fact that the San Antonio mayor claimed no harassment of people on the road I printed out a couple of the documents to wave at the police in case.  https://t.co/k8ZXqVw9ZD,en,[],[],['https://pbs.twimg.com/tweet_video_thumb/ET6YbMpWoAcM7v7.jpg'],1,0,0,[],[],https://twitter.com/Pro_Nuke/status/1242598161966944256,False,,1,https://pbs.twimg.com/tweet_video_thumb/ET6YbMpWoAcM7v7.jpg,san antonio,,,,,,[],,,,
1242588775617830919,1242588775617830919,2020-03-24 18:07:04 CDT,2020-03-24,18:07:04,-0500,859824361888468992,parkerandquinoa,🐩,,This is ASSAULT.,en,[],[],[],0,1,1,[],[],https://twitter.com/parkerandquinoa/status/1242588775617830919,False,https://twitter.com/Zeonta_Smith/status/1242120625663205379,0,,san antonio,,,,,,[],,,,
1242570224060203016,1242570224060203016,2020-03-24 16:53:21 CDT,2020-03-24,16:53:21,-0500,25407461,rarerubyc,"Ruby C, RareRubyC","{'type': 'Point', 'coordinates': [29.4167, -98.5]}","To my fellow Lupus peeps please get with the Lupus Foundation. I was on Plaquenil a while back but my eyes began to attack themselves. Thus I gave it back. If you have it and aren’t using it, please give it back in…  https://t.co/Ms9uZH265T",en,[],['https://www.instagram.com/p/B-IdYBxF7yz/?igshid=1j5ba16savaj8'],[],0,0,1,[],[],https://twitter.com/rarerubyc/status/1242570224060203016,False,,0,,san antonio,,,,,,[],,,,
1242569302559072256,1242569302559072256,2020-03-24 16:49:42 CDT,2020-03-24,16:49:42,-0500,560865887,fadings,Mario 😵‍💫,,Mfs on house arrest probably just Vibin lmfao,en,[],[],[],0,1,0,[],[],https://twitter.com/Fadings/status/1242569302559072256,False,,0,,san antonio,,,,,,[],,,,
1242562046765469701,1242458321208123393,2020-03-24 16:20:52 CDT,2020-03-24,16:20:52,-0500,1129356582444326912,erniesoliz1,Mexican American Hammer,,@JeffGSpursZone Danger zone,da,[],[],[],0,0,1,[],[],https://twitter.com/Erniesoliz1/status/1242562046765469701,False,,0,,san antonio,,,,,,"[{'screen_name': 'JeffGSpursZone', 'name': 'JeffGSpursKENS5', 'id': '18785182'}]",,,,
1242558680601628678,1242558680601628678,2020-03-24 16:07:29 CDT,2020-03-24,16:07:29,-0500,1325349458,ldelao76,LisaDelao 🇺🇦,,"GOOD luck with that, you impeached moron- now, truly a THREAT to our very SURVIVAL.. If it weren't for CUOMO,  and local govts- we would be liyerally dropping in the streets!",en,[],[],[],1,2,4,[],[],https://twitter.com/ldelao76/status/1242558680601628678,False,https://twitter.com/washingtonpost/status/1242543812746137603,0,,san antonio,,,,,,[],,,,
1242556902787211264,1242549051968626694,2020-03-24 16:00:25 CDT,2020-03-24,16:00:25,-0500,1325349458,ldelao76,LisaDelao 🇺🇦,,@BilyHoliday Noone is buying his BS- except those already poisoned by his koolaid! Jim Jones got Nothin' on THIS citizen KILLER.. He is as much of a threat to our well being as the virus itself!,en,[],[],[],0,1,1,[],[],https://twitter.com/ldelao76/status/1242556902787211264,False,,0,,san antonio,,,,,,"[{'screen_name': 'BilyHoliday', 'name': 'Billy Holiday', 'id': '210415891'}]",,,,
1242556267278864390,1242556267278864390,2020-03-24 15:57:54 CDT,2020-03-24,15:57:54,-0500,1325349458,ldelao76,LisaDelao 🇺🇦,,"Is anyone surprised that WH Virus mentor is now breaking from even his hand picked Scientific/ Medical professionals?  Intellect, public well being, scientific fact- and  DJT simply CANNOT  Coexist! Which is a direct threat to our very SURVIVAL right now!",en,[],[],[],0,1,1,[],[],https://twitter.com/ldelao76/status/1242556267278864390,False,,0,,san antonio,,,,,,[],,,,
1242554920559140865,1242554920559140865,2020-03-24 15:52:33 CDT,2020-03-24,15:52:33,-0500,407073035,katiekleinnn15,Katerina,,I really should get off social media. Seeing people bash our president when he has done much more than any other president would have done and has taken so much precaution in trying to stop the spread infuriates me! You libs will find anything and everything to attack him about!,en,[],[],[],1,0,5,[],[],https://twitter.com/Katiekleinnn15/status/1242554920559140865,False,,0,,san antonio,,,,,,[],,,,
1242549879244836866,1242445686836207619,2020-03-24 15:32:31 CDT,2020-03-24,15:32:31,-0500,1325349458,ldelao76,LisaDelao 🇺🇦,,@mdnij34 YES! He is providing zero leadership-  His pathological lying is now truly COSTING LIVES!  He is a DANGER to NATL security &amp; health!,en,[],[],[],0,0,1,[],[],https://twitter.com/ldelao76/status/1242549879244836866,False,,0,,san antonio,,,,,,"[{'screen_name': 'mdnij34', 'name': 'Political Poet', 'id': '558180233'}]",,,,
1242549402193059842,1242549402193059842,2020-03-24 15:30:37 CDT,2020-03-24,15:30:37,-0500,3754441995,brizzybrice1,Brice Johnson,,"Y’all on here going crazy, it’s prolly because y’all on house arrest.",en,[],[],[],0,0,3,[],[],https://twitter.com/BrizzyBrice1/status/1242549402193059842,False,,0,,san antonio,,,,,,[],,,,
1242530486456631296,1242530486456631296,2020-03-24 14:15:27 CDT,2020-03-24,14:15:27,-0500,936645535104151553,hope411adcock,Samantha,,"Almost half, 46.5%, of the infections aboard the Diamond Princess were asymptomatic when they were tested, partially explaining the ""high attack rate"" of the virus among passengers and crew.",en,[],[],[],0,1,2,[],[],https://twitter.com/hope411adcock/status/1242530486456631296,False,https://twitter.com/michaelmina_lab/status/1242320437788409856,0,,san antonio,,,,,,[],,,,
1242529097802186752,1242529097802186752,2020-03-24 14:09:56 CDT,2020-03-24,14:09:56,-0500,991377778737143809,clazzycruz,adrian c,,please stop letting the leaders of sexual trafficking minors tweet on twitter.,en,[],[],[],0,4,1,[],[],https://twitter.com/clazzycruz/status/1242529097802186752,False,https://twitter.com/HillaryClinton/status/1242482103457062913,0,,san antonio,,,,,,[],,,,
1242484126592139269,1242352294651400192,2020-03-24 11:11:14 CDT,2020-03-24,11:11:14,-0500,993866879625302017,maxbailee,mbyc👁👁,,@Nas_Rebel_6 @Niamah_ @1yamaguci The homophobia jumped out 🤢,en,[],[],[],1,0,0,[],[],https://twitter.com/maxbailee/status/1242484126592139269,False,,0,,san antonio,,,,,,"[{'screen_name': 'Nas_Rebel_6', 'name': 'Nas Bell', 'id': '1679670276'}, {'screen_name': 'Niamah_', 'name': '♛', 'id': '378961872'}, {'screen_name': '1yamaguci', 'name': 'PLAY MAKER', 'id': '4872946486'}]",,,,
1242482534551879680,1242482534551879680,2020-03-24 11:04:55 CDT,2020-03-24,11:04:55,-0500,725073541809332224,ethan_hassinger,yaboyethan,,@SahBabii this day gun be squidrific 🐙,en,[],[],[],0,0,0,[],[],https://twitter.com/ethan_hassinger/status/1242482534551879680,False,,0,,san antonio,,,,,,[],,,,
1242469672810876928,1242300364277383169,2020-03-24 10:13:48 CDT,2020-03-24,10:13:48,-0500,552178640,noeysplanet,Noel,,@IssacLugo_ what did I do this early on the morning for you to attack me and my birds,en,[],[],[],1,0,0,[],[],https://twitter.com/NoeysPlanet/status/1242469672810876928,False,,0,,san antonio,,,,,,"[{'screen_name': 'IssacLugo_', 'name': 'ogul cassi', 'id': '598143063'}]",,,,
1242458483238277125,1242458483238277125,2020-03-24 09:29:20 CDT,2020-03-24,09:29:20,-0500,166836610,joshscottbailey,Joshua Scott Bailey,,I love that gun shops are considered an essential business. God bless America,en,[],[],[],0,0,1,[],[],https://twitter.com/joshscottbailey/status/1242458483238277125,False,,0,,san antonio,,,,,,[],,,,
1242456107047628806,1242456107047628806,2020-03-24 09:19:54 CDT,2020-03-24,09:19:54,-0500,132673664,jaleesareports,Jaleesa Irizarry,,Never thought I would be shooting a wedding through a window on a Tuesday morning but… here we are.  https://t.co/9pqmgnXJOv,en,[],[],['https://pbs.twimg.com/media/ET4XO6TXYAAmxHO.jpg'],1,6,25,[],[],https://twitter.com/JaleesaReports/status/1242456107047628806,False,,1,https://pbs.twimg.com/media/ET4XO6TXYAAmxHO.jpg,san antonio,,,,,,[],,,,
1242451141381758976,1242451141381758976,2020-03-24 09:00:10 CDT,2020-03-24,09:00:10,-0500,925595912260304897,iricardoherrera,🇻🇪Ricardito de la isla,,"""Your has been marching forward, The enemy has been shooting at you  for two to three weeks now. And nobody has looked down to see if they are bleeding yet"" #StayHome #StayHomeTexas  https://t.co/FGhhgl6QUQ",en,[],['https://www.nytimes.com/2020/03/24/podcasts/the-daily/coronavirus.html'],[],0,0,0,"['stayhome', 'stayhometexas']",[],https://twitter.com/Iricardoherrera/status/1242451141381758976,False,,0,,san antonio,,,,,,[],,,,
1242443046677028864,1242443046677028864,2020-03-24 08:28:00 CDT,2020-03-24,08:28:00,-0500,2206692661,kimbuck1983,Kim Buck,,@myfamilydollar    I own a pet emergency hospital.  We take care of injured and sick pets for the city of San Antonio and the general public.  We were running out of bleach and paper towels. I told my situation to Renee at Family Dollar and she found some for me! I’m so grateful!,en,[],[],[],0,0,0,[],[],https://twitter.com/KimBuck1983/status/1242443046677028864,False,,0,,san antonio,,,,,,[],,,,
1242357168499818497,1242357168499818497,2020-03-24 02:46:45 CDT,2020-03-24,02:46:45,-0500,2572959263,jacobfu85388283,La Voz de Culebra Park,,"To The Citizens of the World! I do NOT share or Agree with the Sanctions that the U.S. is Imposing on Iran,  even now as it is attempting to Battle the Scourge of the #CoronaVirus that is being waged as a Biohazard Weapon",en,[],[],[],0,0,0,['coronavirus'],[],https://twitter.com/JacobFu85388283/status/1242357168499818497,False,,0,,san antonio,,,,,,[],,,,
1242348035805511680,1242340906524540928,2020-03-24 02:10:28 CDT,2020-03-24,02:10:28,-0500,280770757,pablosinferno,Pablito,,"@EthanAlba9 @sbunny666 @ADAMRAYOKAY Yikes, imagine being this racist and exposing your own self? Bc I’m from the hood and brown you assume a lot. I’m glad he made it out the hood. I just wish he didn’t collaborate with a racist is all. Move around with your 1 follower ass.",en,[],[],[],0,0,11,[],[],https://twitter.com/Pablosinferno/status/1242348035805511680,False,,0,,san antonio,,,,,,"[{'screen_name': 'EthanAlba9', 'name': 'EthanAlba', 'id': '1443207803829506053'}, {'screen_name': 'sbunny666', 'name': 'bluntsbunny', 'id': '4714967480'}, {'screen_name': 'ADAMRAYOKAY', 'name': 'ADAMRAYOKAY', 'id': '1478023304'}]",,,,
1242344216929468422,1242340906524540928,2020-03-24 01:55:17 CDT,2020-03-24,01:55:17,-0500,280770757,pablosinferno,Pablito,,@EthanAlba9 @sbunny666 @ADAMRAYOKAY james put himslef in his own positions. Why should anyone feel bad for him? He should have lost his whole damn career w/ his racist ass boo.,en,[],[],[],0,1,22,[],[],https://twitter.com/Pablosinferno/status/1242344216929468422,False,,0,,san antonio,,,,,,"[{'screen_name': 'EthanAlba9', 'name': 'EthanAlba', 'id': '1443207803829506053'}, {'screen_name': 'sbunny666', 'name': 'bluntsbunny', 'id': '4714967480'}, {'screen_name': 'ADAMRAYOKAY', 'name': 'ADAMRAYOKAY', 'id': '1478023304'}]",,,,
1242321620313784321,1242321620313784321,2020-03-24 00:25:30 CDT,2020-03-24,00:25:30,-0500,343626154,falconfiend2,Marío,,Get rid of anger  Get rid of jealousy  Get rid of rage  Get rid of Covid - 19,en,[],[],[],0,0,0,[],[],https://twitter.com/falconfiend2/status/1242321620313784321,False,,0,,san antonio,,,,,,[],,,,
