id,conversation_id,created_at,date,time,timezone,user_id,username,name,place,tweet,language,mentions,urls,photos,replies_count,retweets_count,likes_count,hashtags,cashtags,link,retweet,quote_url,video,thumbnail,near,geo,source,user_rt_id,user_rt,retweet_id,reply_to,retweet_date,translate,trans_src,trans_dest
1234991561684840450,1234991561684840450,2020-03-03 17:58:27 CST,2020-03-03,17:58:27,-0500,1345959620,pattyb__,FIG.,,"I think anyone who murders an innocent child should automatically get the death sentence, I said what I said.",en,[],[],[],2,11,33,[],[],https://twitter.com/PattyB__/status/1234991561684840450,False,,0,,san antonio,,,,,,[],,,,
1234984641590771712,1234984641590771712,2020-03-03 17:30:58 CST,2020-03-03,17:30:58,-0500,452501463,bluemanutsa,Señor Blue,,"I just parked on campus...realized I forgot my phone charger and my headphones. Came and sat down at a table, pulled out my laptop....DEAD! Annnddd I forgot my laptop charger. #Losing",en,[],[],[],1,0,6,['losing'],[],https://twitter.com/BlueManUTSA/status/1234984641590771712,False,,0,,san antonio,,,,,,[],,,,
1234977634422935552,1234977622104240129,2020-03-03 17:03:07 CST,2020-03-03,17:03:07,-0500,983429340,wxblakeharms,Blake Harms,,"Several major stores were closed, presumably ones she visited - note the cleaning crew in Pink. Even stores that were open had employees spraying &amp; bleaching surfaces and products. An employee told me she’s never seen it so dead here before...  https://t.co/Tx7kTKlPC5",en,[],[],"['https://pbs.twimg.com/media/ESOFm3NWoAAyTOm.jpg', 'https://pbs.twimg.com/media/ESOFm5YXkAA1bFC.jpg', 'https://pbs.twimg.com/media/ESOFm39X0AEv8fJ.jpg', 'https://pbs.twimg.com/media/ESOFm4mWAAAQkEd.jpg']",1,0,2,[],[],https://twitter.com/wxblakeharms/status/1234977634422935552,False,,1,https://pbs.twimg.com/media/ESOFm3NWoAAyTOm.jpg,san antonio,,,,,,[],,,,
1234977284571852800,1234975580698726400,2020-03-03 17:01:44 CST,2020-03-03,17:01:44,-0500,1060569469649608704,royal_rinaa,karina,,"@Alexissog_ @itsnandayo Tu nomás di , who’s ass do we have to kick lol 😂",en,[],[],[],0,0,0,[],[],https://twitter.com/Royal_Rinaa/status/1234977284571852800,False,,0,,san antonio,,,,,,"[{'screen_name': 'Alexissog_', 'name': '∆LEX', 'id': '207353888'}]",,,,
1234971644696784896,1234963777705140226,2020-03-03 16:39:19 CST,2020-03-03,16:39:19,-0500,207353888,alexissog_,∆LEX,,@RoyalRegine @joegarcia018 Dead af bro 😂,da,[],[],[],1,0,2,[],[],https://twitter.com/Alexissog_/status/1234971644696784896,False,,0,,san antonio,,,,,,"[{'screen_name': 'RoyalRegine', 'name': 'R✨', 'id': '116608380'}, {'screen_name': 'joegarcia018', 'name': 'Joeknowme', 'id': '2590801423'}]",,,,
1234962914190249984,1234962914190249984,2020-03-03 16:04:37 CST,2020-03-03,16:04:37,-0500,277633806,realrobinflores,Robin Flores,,"""My feet hurt"" I'm too tired to #GoVote is not a reason #SuperTuesday #SanAntonio  https://t.co/qgGgv7GcL9",en,[],[],['https://pbs.twimg.com/media/ESN4N9eWAAEbJfm.jpg'],0,0,0,"['govote', 'supertuesday', 'sanantonio']",[],https://twitter.com/realRobinFlores/status/1234962914190249984,False,,1,https://pbs.twimg.com/media/ESN4N9eWAAEbJfm.jpg,san antonio,,,,,,[],,,,
1234962567585505286,1234957303897559040,2020-03-03 16:03:15 CST,2020-03-03,16:03:15,-0500,1325349458,ldelao76,LisaDelao 🇺🇦,,"@TonyTsgro75 Bad, yet- not nearly as awful as another Moron's hairdon't of DEATH!!😉😘❤",en,[],[],[],1,0,1,[],[],https://twitter.com/ldelao76/status/1234962567585505286,False,,0,,san antonio,,,,,,"[{'screen_name': 'TonyTsgro75', 'name': 'soundguyt 🇺🇦', 'id': '3303789382'}]",,,,
1234961881552560130,1234961881552560130,2020-03-03 16:00:31 CST,2020-03-03,16:00:31,-0500,804776048143593477,macboyssoccer,MacArthur FC,,Kick the tires and light the fires ladies and gentlemen!! Best of luck!,en,[],[],[],0,0,4,[],[],https://twitter.com/MacBoysSoccer/status/1234961881552560130,False,https://twitter.com/MacArthurDance/status/1234865327831420928,0,,san antonio,,,,,,[],,,,
1234961337870102528,1234957303897559040,2020-03-03 15:58:22 CST,2020-03-03,15:58:22,-0500,1325349458,ldelao76,LisaDelao 🇺🇦,,"@TonyTsgro75 But so dead ON, never in same category",en,[],[],[],0,0,0,[],[],https://twitter.com/ldelao76/status/1234961337870102528,False,,0,,san antonio,,,,,,"[{'screen_name': 'TonyTsgro75', 'name': 'soundguyt 🇺🇦', 'id': '3303789382'}]",,,,
1234960120246870023,1234960120246870023,2020-03-03 15:53:31 CST,2020-03-03,15:53:31,-0500,37661858,radiofabian,Fabian,,What happens if you get scared half to death twice?,en,[],[],[],0,0,0,[],[],https://twitter.com/RADIOFABIAN/status/1234960120246870023,False,,0,,san antonio,,,,,,[],,,,
1234957054458068997,1234955999867482112,2020-03-03 15:41:20 CST,2020-03-03,15:41:20,-0500,404433292,spurslouie210,Louie,,@WarEA6LE Dead asf!!!! 🤣🤣🤣,en,[],[],[],1,0,1,[],[],https://twitter.com/SpursLouie210/status/1234957054458068997,False,,0,,san antonio,,,,,,"[{'screen_name': 'WarEA6LE', 'name': '🌮', 'id': '2997455833'}]",,,,
1234956896303550465,1234956896303550465,2020-03-03 15:40:43 CST,2020-03-03,15:40:43,-0500,836050621413281794,henry_lestrange,Goudy Stout,,"When people tell me they “don’t vote” in a way that makes them sound proud of it, I’m immediately turned off to them as a person. Like we can kick it or whatever but we’re clearly not the same kind of human. ✌🏼",en,[],[],[],1,1,7,[],[],https://twitter.com/henry_lestrange/status/1234956896303550465,False,,0,,san antonio,,,,,,[],,,,
1234953366616276993,1234680826882715651,2020-03-03 15:26:41 CST,2020-03-03,15:26:41,-0500,1325349458,ldelao76,LisaDelao 🇺🇦,,"@ExOmelas @sirala6 What the hell? I deleted because ot was a misspelled mess. If you WANT me to restate, i will do so. But what is the point, Col? I didnt mean that you phyisically 'smacked' me ffs- Look, let's  agree to disagree. But i stand by my opinion and the well doc media of bbro abuse",en,[],[],[],2,0,0,[],[],https://twitter.com/ldelao76/status/1234953366616276993,False,,0,,san antonio,,,,,,"[{'screen_name': 'sirala6', 'name': 'Danny Pinion', 'id': '3272905836'}]",,,,
1234953310173614083,1234953310173614083,2020-03-03 15:26:28 CST,2020-03-03,15:26:28,-0500,18286717,psowill,psowill-comicbook creator.,,Dear marvel.  Can Tony stark stick to one love interest and can you not force so many around him.,en,[],[],[],0,0,0,[],[],https://twitter.com/psowill/status/1234953310173614083,False,,0,,san antonio,,,,,,[],,,,
1234948294184439808,1234927057764855808,2020-03-03 15:06:32 CST,2020-03-03,15:06:32,-0500,855096134318030848,jazzexploring,JazzExploring,,@brita313 Dead 💀,en,[],[],[],0,0,1,[],[],https://twitter.com/JazzExploring/status/1234948294184439808,False,,0,,san antonio,,,,,,"[{'screen_name': 'brita313', 'name': 'briana', 'id': '1036752495438180353'}]",,,,
1234947804373581825,1234712759901786115,2020-03-03 15:04:35 CST,2020-03-03,15:04:35,-0500,816661365691707392,fire2fall,Ann Marie Caldwell,,@washingtonpost And if Coronavirus doesn’t hurt the economy Dems will go nuts!,en,[],[],[],0,0,0,[],[],https://twitter.com/fire2fall/status/1234947804373581825,False,,0,,san antonio,,,,,,"[{'screen_name': 'washingtonpost', 'name': 'The Washington Post', 'id': '2467791'}]",,,,
1234947260380844033,1234680826882715651,2020-03-03 15:02:25 CST,2020-03-03,15:02:25,-0500,1325349458,ldelao76,LisaDelao 🇺🇦,,"@ExOmelas And YNLIKE BBros, I WILL be voting BLUE.  No matter who. Sorry if i hurt your feelings.",en,[],[],[],1,0,1,[],[],https://twitter.com/ldelao76/status/1234947260380844033,False,,0,,san antonio,,,,,,[],,,,
1234945692935716865,1234945692935716865,2020-03-03 14:56:12 CST,2020-03-03,14:56:12,-0500,1325349458,ldelao76,LisaDelao 🇺🇦,,"Yet ANOTHER institution- supposedly independ of Exec power ABUSE- CAVED again to WH moron!!! Fed rate DENIED Moron's tweets had anything to do w cut, but - i , who NEVER agrees w Wall Street- agree abother ind institution fell.",en,[],[],[],0,1,1,[],[],https://twitter.com/ldelao76/status/1234945692935716865,False,,0,,san antonio,,,,,,[],,,,
1234940876780179456,1234940876780179456,2020-03-03 14:37:03 CST,2020-03-03,14:37:03,-0500,3142205150,kalebthewonder,kaleb,,Ehnwueeneisjejrhr this gets me sooooo excited for Svdden Death at Buku eiiehrbdosjshdhf,de,[],[],[],0,0,0,[],[],https://twitter.com/KalebtheWonder/status/1234940876780179456,False,https://twitter.com/jasonhuezo/status/1234601243504455681,0,,san antonio,,,,,,[],,,,
1234940334867701764,1234940334867701764,2020-03-03 14:34:54 CST,2020-03-03,14:34:54,-0500,2627752036,_ohsodopesalas,♡,,Work is dead. I’m taking a fat ass nap,en,[],[],[],0,0,1,[],[],https://twitter.com/_ohsodopesalas/status/1234940334867701764,False,,0,,san antonio,,,,,,[],,,,
1234940043611033600,1234940043611033600,2020-03-03 14:33:45 CST,2020-03-03,14:33:45,-0500,901804591,ellesigxx,giselle🌙,,I can’t play bts when my boss is in salon so it’s one direction till 5 🥳 they are gonna kick me off Spotify,en,[],[],[],0,0,1,[],[],https://twitter.com/ellesigxx/status/1234940043611033600,False,,0,,san antonio,,,,,,[],,,,
1234939651749605376,1234939651749605376,2020-03-03 14:32:11 CST,2020-03-03,14:32:11,-0500,319716081,havok1775,Branden Vice,"{'type': 'Point', 'coordinates': [29.43670391, -98.71502911]}","Workout Brought to by  https://t.co/1UqZKuhRAQ, if you want some amazing supplements and kick ass post-workout then click the link at the bottom of the post. It is definitely a game changer!  FST-7 Get Big And Ripped In 8…  https://t.co/CN8Fh9Mhqu",en,[],"['http://blackmagic.supply', 'https://www.instagram.com/p/B9SPZGpJ3DY/?igshid=1kg1x7fmkmc3f']",[],0,0,0,[],[],https://twitter.com/Havok1775/status/1234939651749605376,False,,0,,san antonio,,,,,,[],,,,
1234938884104105985,1234938884104105985,2020-03-03 14:29:08 CST,2020-03-03,14:29:08,-0500,752577289217466377,alexsantosiam,𝘼𝙇𝙀𝙓 𝙎𝘼𝙉𝙏𝙊𝙎 | Photographer,,Im Fucking Dead!!!!😂😂😂,en,[],[],[],0,0,0,[],[],https://twitter.com/AlexSantosIAm/status/1234938884104105985,False,https://twitter.com/chaselyons/status/1234893530847424518,0,,san antonio,,,,,,[],,,,
1234937521282437122,1234937521282437122,2020-03-03 14:23:43 CST,2020-03-03,14:23:43,-0500,582190409,1_judson,lord gremlin,,I still remember being forced to play QB in 8th grade cause angelos ass got hurt 😑,en,[],[],[],0,0,5,[],[],https://twitter.com/1_judson/status/1234937521282437122,False,,0,,san antonio,,,,,,[],,,,
1234937125772124160,1234915532710694912,2020-03-03 14:22:09 CST,2020-03-03,14:22:09,-0500,112830331,tinaaabean_,t 🍓🍯,,@BeckyKinney20 I don’t get why it’s even a TREND. He’s clearly so hurt by this.,en,[],[],[],1,0,1,[],[],https://twitter.com/tinaaabean_/status/1234937125772124160,False,,0,,san antonio,,,,,,"[{'screen_name': 'BeckyKinney20', 'name': 'Becky Boo 🤍', 'id': '1007855552792150018'}]",,,,
1234934102387838978,1234934102387838978,2020-03-03 14:10:08 CST,2020-03-03,14:10:08,-0500,128429068,alamoontherise,Alamo_On_The_Rise 😷🇺🇲,,Death toll in Washington from the coronavirus virus climbs to 9.,en,[],[],[],0,3,3,[],[],https://twitter.com/AlamoOnTheRise/status/1234934102387838978,False,,0,,san antonio,,,,,,[],,,,
1234923979560718336,1234923979560718336,2020-03-03 13:29:55 CST,2020-03-03,13:29:55,-0500,552852117,sugemyke,COMP,,everybody got dead homies,en,[],[],[],0,0,1,[],[],https://twitter.com/sugemyke/status/1234923979560718336,False,,0,,san antonio,,,,,,[],,,,
1234922507548942337,1234922507548942337,2020-03-03 13:24:04 CST,2020-03-03,13:24:04,-0500,2535653741,annalisgonzalez,Mulan,,I’m at my breaking point with this army gig I signed myself up for. Tomorrow I’m calling in dead,en,[],[],[],0,0,1,[],[],https://twitter.com/annalisgonzalez/status/1234922507548942337,False,,0,,san antonio,,,,,,[],,,,
1234921872187412480,1234921872187412480,2020-03-03 13:21:32 CST,2020-03-03,13:21:32,-0500,147756279,jxlvz,joebrian,,my favorite coffee shop is closing down at the end of the month and I’m actually really hurt lmao,en,[],[],[],0,0,0,[],[],https://twitter.com/jxlvz/status/1234921872187412480,False,,0,,san antonio,,,,,,[],,,,
1234917324894998528,1234909080541523969,2020-03-03 13:03:28 CST,2020-03-03,13:03:28,-0500,1325349458,ldelao76,LisaDelao 🇺🇦,,"@rethe125 She is indeed a force to reckon with! I used to really like her as Ohio Sen- then Bern came along, 2016. She is a fierce advocate, for sure! My peob with her was that when it came time for Hil, she was NOT as fierce as obviously for Bern. She was very reluctant most interviews",en,[],[],[],0,0,0,[],[],https://twitter.com/ldelao76/status/1234917324894998528,False,,0,,san antonio,,,,,,"[{'screen_name': 'rethe125', 'name': 'rethe craig', 'id': '3409105401'}]",,,,
1234914651202293762,1234914651202293762,2020-03-03 12:52:51 CST,2020-03-03,12:52:51,-0500,339119998,joegallinews,Joe Galli,,Preparations are on our way at the San Antonio International Airport as 120 folks who were in quarantine at Lackland Air Force Base are expected to arrive at any moment￼￼. We will be streaming the arrival on @News4SA &amp; @KABBFOX29  https://t.co/XyPdtuo6nz,en,"[{'screen_name': 'news4sa', 'name': 'news 4 san antonio', 'id': '17194257'}, {'screen_name': 'kabbfox29', 'name': 'kabb fox 29', 'id': '52047494'}]",[],['https://pbs.twimg.com/media/ESNMU7dWAAATeZG.jpg'],0,1,0,[],[],https://twitter.com/JoeGalliNews/status/1234914651202293762,False,,1,https://pbs.twimg.com/media/ESNMU7dWAAATeZG.jpg,san antonio,,,,,,[],,,,
1234912789656940544,1234912789656940544,2020-03-03 12:45:27 CST,2020-03-03,12:45:27,-0500,18570045,sorrymckenzie,all rowdy.,,i see 666 all the time when is my death coming i need that,en,[],[],[],0,0,4,[],[],https://twitter.com/sorrymckenzie/status/1234912789656940544,False,,0,,san antonio,,,,,,[],,,,
1234909955028852738,1234909955028852738,2020-03-03 12:34:11 CST,2020-03-03,12:34:11,-0500,307762912,juicycheaa,Julie Olivares Liggins,,My boobs hurt so much. Being a woman is so annoying 😩,en,[],[],[],0,0,0,[],[],https://twitter.com/juicycheaa/status/1234909955028852738,False,,0,,san antonio,,,,,,[],,,,
1234901510762483712,1234901510762483712,2020-03-03 12:00:38 CST,2020-03-03,12:00:38,-0500,432072191,iced_cofee,Gl⁰ria H⁰l3,,Merc rx is kicking mandos ass. Both his vehicles dead,en,[],[],[],0,0,0,[],[],https://twitter.com/iced_cofee/status/1234901510762483712,False,,0,,san antonio,,,,,,[],,,,
1234899045321146368,1233568982600421376,2020-03-03 11:50:50 CST,2020-03-03,11:50:50,-0500,1325349458,ldelao76,LisaDelao 🇺🇦,,"@Denton21990 It is heartbreaking, reading how in that provence, they are locking away infected in homes , left to starve to death and die as a fa.ily.",en,[],[],[],0,0,1,[],[],https://twitter.com/ldelao76/status/1234899045321146368,False,,0,,san antonio,,,,,,"[{'screen_name': 'Denton21990', 'name': 'Natalie..THE GOP IS SHORT FOR *GROUPIES* OF PUTIN!', 'id': '1073958022400102407'}]",,,,
1234897343436161024,1234897343436161024,2020-03-03 11:44:04 CST,2020-03-03,11:44:04,-0500,586473104,mmedinanews,Mariah Medina,,"Hours before Super Tuesday, the sheriff drove to Floresville in his personal vehicle to arrest a child sexual assault suspect who was mistakenly released. The sheriff’s office says the sheriff returned his specially trained team to service...  https://t.co/45fly8uZMz",en,[],[],['https://pbs.twimg.com/media/ESM8kR5WkAASpy3.jpg'],2,3,5,[],[],https://twitter.com/MMedinanews/status/1234897343436161024,False,,1,https://pbs.twimg.com/media/ESM8kR5WkAASpy3.jpg,san antonio,,,,,,[],,,,
1234892861268774914,1234892861268774914,2020-03-03 11:26:15 CST,2020-03-03,11:26:15,-0500,965469024929935360,puutarican,mamas 🇵🇷🇮🇳✨,,Y’all I can’t these responses have me dead I love my melanin mom group lol  https://t.co/PLC24hbuEJ,en,[],[],[],0,0,0,[],[],https://twitter.com/puutarican/status/1234892861268774914,False,,1,https://pbs.twimg.com/ext_tw_video_thumb/1234892803819425794/pu/img/PwEXd1n6t6QA28OE.jpg,san antonio,,,,,,[],,,,
1234892336049655811,1234892336049655811,2020-03-03 11:24:10 CST,2020-03-03,11:24:10,-0500,983161115873038338,larialariaa,L ✨,,Joel elbowed the shit out of me in his sleep last night and my head is just now starting to hurt 😿🥺,en,[],[],[],0,0,0,[],[],https://twitter.com/LariaLariaa/status/1234892336049655811,False,,0,,san antonio,,,,,,[],,,,
1234891335766810625,1234891335766810625,2020-03-03 11:20:12 CST,2020-03-03,11:20:12,-0500,19704183,joeycules,Joey Palacios 😷,,DEVELOPING: Quarantined evacuees from the diamond princess cruise ship at Lackland Air Force Base are being released today.   Only people who have been asymptomatic for the last 14 days are being released.   They’ll be escorted by CDC to the San Antonio Airport.   @TPRNews  https://t.co/wDRZxQciSQ,en,"[{'screen_name': 'tprnews', 'name': 'texas public radio', 'id': '18739107'}]",[],"['https://pbs.twimg.com/media/ESM3HzbXUAAbx7h.jpg', 'https://pbs.twimg.com/media/ESM3HzkXUAIToqO.jpg']",1,10,4,[],[],https://twitter.com/Joeycules/status/1234891335766810625,False,,1,https://pbs.twimg.com/media/ESM3HzbXUAAbx7h.jpg,san antonio,,,,,,[],,,,
1234891116677390337,1234891116677390337,2020-03-03 11:19:20 CST,2020-03-03,11:19:20,-0500,1325349458,ldelao76,LisaDelao 🇺🇦,,"To me, ever since Biden started to toss the prescripted stump speeches- And started speaking freely from his most potent weapon- his HEART!- has been quite the difference! Thankfully, they finally allowed JOE to be JOE!  GO, JOE, GO !!",en,[],[],[],0,0,0,[],[],https://twitter.com/ldelao76/status/1234891116677390337,False,,0,,san antonio,,,,,,[],,,,
1234886182275878912,1234879903809458177,2020-03-03 10:59:43 CST,2020-03-03,10:59:43,-0500,1325349458,ldelao76,LisaDelao 🇺🇦,,"@notswedish1 @NicolasEdny We Latinos are trying to help share the load! I want us to be carrying our share, too! No better example to follow, than the heart, soul, backbone of our Dem party!!! Thank you for serving as ex of what we can aspire to! A true force!",en,[],[],[],0,0,2,[],[],https://twitter.com/ldelao76/status/1234886182275878912,False,,0,,san antonio,,,,,,"[{'screen_name': 'NicolasEdny', 'name': 'Trust Black women *We tried to tell you*', 'id': '977565912848101377'}]",,,,
1234880890234449921,1234880890234449921,2020-03-03 10:38:41 CST,2020-03-03,10:38:41,-0500,266969301,aidanguro,Aidan Gurovitsch,,I want @Hertz to hurt,en,"[{'screen_name': 'hertz', 'name': 'hertz', 'id': '18001417'}]",[],[],0,0,0,[],[],https://twitter.com/AidanGuro/status/1234880890234449921,False,,0,,san antonio,,,,,,[],,,,
1234873645832556550,1234873645832556550,2020-03-03 10:09:54 CST,2020-03-03,10:09:54,-0500,3286812240,odalysxmacias,odalys,,im dead I did a giveaway on my business page on Facebook page and my grandma won 😂,en,[],[],[],0,0,4,[],[],https://twitter.com/odalysxmacias/status/1234873645832556550,False,,0,,san antonio,,,,,,[],,,,
1234869194509950977,1234869194509950977,2020-03-03 09:52:13 CST,2020-03-03,09:52:13,-0500,926699264016830465,atonyg45,ᵉˡ ᵗᵒⁿʸ,,"If the FED cut rates today, what’s going to happen when the economy is in full recession?   Negative interest rates?  They really going to force the regular consumer to spend their savings in order to prop up the economy?",en,[],[],[],0,0,0,[],[],https://twitter.com/atonyg45/status/1234869194509950977,False,,0,,san antonio,,,,,,[],,,,
1234868059413909504,1234645484561715200,2020-03-03 09:47:42 CST,2020-03-03,09:47:42,-0500,273166701,rationalanimal9,Robert Koenigsberg,,"@sunsetmma Not atrocious. Not bad at all.   Try working on rotating, that inside foot more before the kick. That’s why your hips aren’t turning over fast enough. Good luck bro",en,[],[],[],1,0,2,[],[],https://twitter.com/RationalAnimal9/status/1234868059413909504,False,,0,,san antonio,,,,,,"[{'screen_name': 'sunsetmma', 'name': 'Jim', 'id': '1191498157705908225'}]",,,,
1234858936060305415,1234858936060305415,2020-03-03 09:11:27 CST,2020-03-03,09:11:27,-0500,586473104,mmedinanews,Mariah Medina,,NEW: The sheriff’s office confirms an inmate facing a capital murder charge and drug charges committed suicide this morning at the jail. This comes a day after a child sexual assault suspect was mistakenly released.  https://t.co/uDlDK1Ytcd,en,[],['https://www.kens5.com/article/news/local/bexar-county-inmate-attempts-suicide-later-dies-in-hospital/273-274af5cf-98b0-48be-8caa-7b660f5fcd6e'],[],2,0,5,[],[],https://twitter.com/MMedinanews/status/1234858936060305415,False,,0,,san antonio,,,,,,[],,,,
1234857390803169281,1234857390803169281,2020-03-03 09:05:19 CST,2020-03-03,09:05:19,-0500,230593671,dilloncollier,Dillon Collier,,"DEVELOPING Bexar County Sheriff’s officials confirm an inmate committed suicide this morning at the facility. He had been there on capital murder, drug charges #KSATnews",en,[],[],[],0,0,1,['ksatnews'],[],https://twitter.com/dilloncollier/status/1234857390803169281,False,,0,,san antonio,,,,,,[],,,,
1234857260771422209,1234612815786319872,2020-03-03 09:04:48 CST,2020-03-03,09:04:48,-0500,854066296920657923,cd_davis93,Cory Davis,,@ruinedurnight Sounds like he needs a swift kick in the face,en,[],[],[],0,0,0,[],[],https://twitter.com/cd_davis93/status/1234857260771422209,False,,0,,san antonio,,,,,,"[{'screen_name': 'ruinedurnight', 'name': 'on avery island', 'id': '557263334'}]",,,,
1234848259010486272,1234848259010486272,2020-03-03 08:29:01 CST,2020-03-03,08:29:01,-0500,2218175935,chenrywrites,Crystal ✨Henry ✍️,"{'type': 'Point', 'coordinates': [29.4167, -98.5]}","Used the force today. 😎💪🏼✊🏼💥🇺🇸 . #useyourvoice #govote #theforceawakens #supertuesday @ San Antonio, Texas  https://t.co/dFWgkYT3OL",en,[],['https://www.instagram.com/p/B9Rl1YoHZRk/?igshid=ifh9o12872op'],[],0,0,0,"['useyourvoice', 'govote', 'theforceawakens', 'supertuesday']",[],https://twitter.com/CHenryWrites/status/1234848259010486272,False,,0,,san antonio,,,,,,[],,,,
1234847371508535303,1234847371508535303,2020-03-03 08:25:30 CST,2020-03-03,08:25:30,-0500,3014453401,jhoregeii,Jorge,,Hitting the gym a this time always makes me feel like I could bully Thor,en,[],[],[],0,0,1,[],[],https://twitter.com/Jhoregeii/status/1234847371508535303,False,,0,,san antonio,,,,,,[],,,,
1234802164863770625,1234517329549107200,2020-03-03 05:25:52 CST,2020-03-03,05:25:52,-0500,21168281,happy2badad,Brian A. Billeck,,@KatLing9 @miss_LulaMae @Lobby_Hero @MarkRuffalo When Damon was first diagnosed @Pharrell sent him this video. It literally changed how we fought cancer &amp; dealt with life. This video made us fight cancer with a smile &amp; our family to fight his death with the same smile!  https://t.co/R1M1XcKdpo,en,"[{'screen_name': 'pharrell', 'name': 'pharrell williams', 'id': '338084918'}]",['https://youtu.be/KtX54oQlLyk'],[],1,0,2,[],[],https://twitter.com/happy2badad/status/1234802164863770625,False,,0,,san antonio,,,,,,"[{'screen_name': 'KatLing9', 'name': 'KatKins', 'id': '1020774909507751938'}, {'screen_name': 'miss_LulaMae', 'name': 'Lene ⍟⧗', 'id': '2377181622'}, {'screen_name': 'Lobby_Hero', 'name': 'Lobby Hero', 'id': '771654248907939840'}, {'screen_name': 'MarkRuffalo', 'name': 'Mark Ruffalo', 'id': '47285504'}]",,,,
1234793832589537281,1234793832589537281,2020-03-03 04:52:45 CST,2020-03-03,04:52:45,-0500,2397436332,shampoww23,Katie,,really wanna punch a wall right about now.,en,[],[],[],0,0,0,[],[],https://twitter.com/shampoww23/status/1234793832589537281,False,,0,,san antonio,,,,,,[],,,,
1234724688808599552,1234724688808599552,2020-03-03 00:18:00 CST,2020-03-03,00:18:00,-0500,2902452307,g59aly,aly,,Bro I’m dead as fuckk,en,[],[],[],0,0,0,[],[],https://twitter.com/g59aly/status/1234724688808599552,False,https://twitter.com/_niquexoxo_/status/1234185289314242561,0,,san antonio,,,,,,[],,,,
1234713962849198081,1234713962849198081,2020-03-02 23:35:23 CST,2020-03-02,23:35:23,-0500,161553538,tatigummibear,selina kyle,,Finally watching the Gabriel Fernandez documentary. Never has a child abuse case made me so angry and sad. These bitches are getting what they fucking deserve.,en,[],[],[],0,0,1,[],[],https://twitter.com/tatigummibear/status/1234713962849198081,False,,0,,san antonio,,,,,,[],,,,
1234711141340917761,1234549650696306688,2020-03-02 23:24:10 CST,2020-03-02,23:24:10,-0500,3142205150,kalebthewonder,kaleb,,"@stephh_nicolee2 She had gotten life in prison without parole and the boyfriend got the death sentence, which in my opinion it should have been the other way around or they both get the death sentence, because, just how, can a MOTHER do that to her own kid 🥺",en,[],[],[],0,0,0,[],[],https://twitter.com/KalebtheWonder/status/1234711141340917761,False,,0,,san antonio,,,,,,"[{'screen_name': 'stephh_nicolee2', 'name': 'Stephanie Armstrong', 'id': '934642872'}]",,,,
1234710223513845760,1234710223513845760,2020-03-02 23:20:31 CST,2020-03-02,23:20:31,-0500,1129569006,stylistaviviana,V i v i a n a,,Dead 💀,en,[],[],[],0,0,0,[],[],https://twitter.com/stylistaviviana/status/1234710223513845760,False,https://twitter.com/lamevivi/status/1234630676332236800,0,,san antonio,,,,,,[],,,,
1234704678673354753,1234704678673354753,2020-03-02 22:58:29 CST,2020-03-02,22:58:29,-0500,18003520,starfishncoffee,Your Friendly Neighborhood Spinster,,Oh my god this is the guy with the daughter in his lap on Fox News. Geesh. Not blaming the victim but...,en,[],[],[],0,0,0,[],[],https://twitter.com/starfishncoffee/status/1234704678673354753,False,https://twitter.com/sarahkliff/status/1234470678344224768,0,,san antonio,,,,,,[],,,,
