id,conversation_id,created_at,date,time,timezone,user_id,username,name,place,tweet,language,mentions,urls,photos,replies_count,retweets_count,likes_count,hashtags,cashtags,link,retweet,quote_url,video,thumbnail,near,geo,source,user_rt_id,user_rt,retweet_id,reply_to,retweet_date,translate,trans_src,trans_dest
1419433506141179906,1419433506141179906,2021-07-25 18:04:54 CDT,2021-07-25,18:04:54,-0500,1138158504345198592,mercedeslucille,money making crybaby💎,,"Old people make me cry. Sometimes out of sadness, sometimes out of rage, it’s circumstantial.",en,[],[],[],0,0,0,[],[],https://twitter.com/mercedeslucille/status/1419433506141179906,False,,0,,phoenix,,,,,,[],,,,
1419431239149252615,1419431239149252615,2021-07-25 17:55:53 CDT,2021-07-25,17:55:53,-0500,3287304109,_arianuhhhh,ari 👼🏻,,kinda wanna go to a rage room,en,[],[],[],0,0,0,[],[],https://twitter.com/_arianuhhhh/status/1419431239149252615,False,,0,,phoenix,,,,,,[],,,,
1419400358611230722,1419400358611230722,2021-07-25 15:53:11 CDT,2021-07-25,15:53:11,-0500,763217858008494080,monicahabla,Mónica,,Nothing like a Sunday afternoon shooting down anti-Blackness in the WhatsApp Tia’s chat.   Latinos need to call out our own familia’s anti-Blackness and I just did.  https://t.co/a5lsR1tQFY,en,[],[],['https://pbs.twimg.com/tweet_video_thumb/E7K5GazVoAMIuUl.jpg'],0,0,3,[],[],https://twitter.com/MonicaHabla/status/1419400358611230722,False,,1,https://pbs.twimg.com/tweet_video_thumb/E7K5GazVoAMIuUl.jpg,phoenix,,,,,,[],,,,
1419384377620893697,1419384377620893697,2021-07-25 14:49:41 CDT,2021-07-25,14:49:41,-0500,1351942391599489025,asuyaliberty,ASU Young Americans for Liberty,,Pretty sure you have this backwards ACLU.  We encourage you to look into the origin of gun control.  The first gun control laws were established to prevent freed slaves from being able to defend themselves.,en,[],[],[],0,0,4,[],[],https://twitter.com/asuyaliberty/status/1419384377620893697,False,https://twitter.com/ACLU/status/1419294620417155074,0,,phoenix,,,,,,[],,,,
1419381058739478528,1419375690139504645,2021-07-25 14:36:29 CDT,2021-07-25,14:36:29,-0500,1166303052443332608,besch_ma,Vincent VanHoe,,@TrillSosa_ Why are you so violent,en,[],[],[],0,0,0,[],[],https://twitter.com/Besch_MA/status/1419381058739478528,False,,0,,phoenix,,,,,,"[{'screen_name': 'TrillSosa_', 'name': 'Slim🦍', 'id': '130034994'}]",,,,
1419373809082126338,1419340033400651783,2021-07-25 14:07:41 CDT,2021-07-25,14:07:41,-0500,344997428,debramoge,Debra Moge,,@trekkie10 They are trying to work us up to be as unhinged as them-violent. Not going to happen.,en,[],[],[],1,0,0,[],[],https://twitter.com/DebraMoge/status/1419373809082126338,False,,0,,phoenix,,,,,,"[{'screen_name': 'trekkie10', 'name': 'Anne Pate', 'id': '189719210'}]",,,,
1419367766469971969,1419367766469971969,2021-07-25 13:43:40 CDT,2021-07-25,13:43:40,-0500,540312402,hannahhunicke,hannah autumn,,commenting “sir please read a book” on racist women’s tiktoks who have “i don’t care about your pronouns” as their bio,en,[],[],[],0,0,5,[],[],https://twitter.com/HannahHunicke/status/1419367766469971969,False,,0,,phoenix,,,,,,[],,,,
1419364987655524352,1419364987655524352,2021-07-25 13:32:38 CDT,2021-07-25,13:32:38,-0500,18639485,lulub1,JuicyLuci,,Protest all over the world. WE ARE SICK OF THE BS NARRATIVE!,en,[],[],[],0,0,0,[],[],https://twitter.com/luluB1/status/1419364987655524352,False,https://twitter.com/w0ng_d0_Me1n/status/1418789454521634817,0,,phoenix,,,,,,[],,,,
1419354101826031617,1419351487147241472,2021-07-25 12:49:22 CDT,2021-07-25,12:49:22,-0500,2433580892,jwfathereedc,James Fatheree,,@GeraldBourguet Shooting 36% makes it hard to beat anyone.,en,[],[],[],0,0,0,[],[],https://twitter.com/jwfathereeDC/status/1419354101826031617,False,,0,,phoenix,,,,,,"[{'screen_name': 'GeraldBourguet', 'name': 'Gerald Bourguet', 'id': '68509324'}]",,,,
1419353325443682305,1419353325443682305,2021-07-25 12:46:17 CDT,2021-07-25,12:46:17,-0500,305946514,steve_gallardo,Supervisor Steve Gallardo,,"My final years as a Senator, (13D+3R) nearly had to remove the Senate President (Biggs) to pass a Budget and Medicaid Expansion.... (14D+3R) can put an end to this national embarrassment and the attack on our democracy. Remove @FannKfann and fire the cyber ninjas!",en,"[{'screen_name': 'fannkfann', 'name': 'karen fann', 'id': '3134359560'}]",[],[],50,54,172,[],[],https://twitter.com/Steve_Gallardo/status/1419353325443682305,False,https://twitter.com/stephen_richer/status/1419118829943234560,0,,phoenix,,,,,,[],,,,
1419343405482614784,1419105204147003392,2021-07-25 12:06:52 CDT,2021-07-25,12:06:52,-0500,22109566,joelgalvan,Joe Galvan,,"@nekr0mantix All I remember is the original title was Killing Mrs. Tingle (due to a school shooting, it was changed ) and the studio fucked with the edit. That rumor soured my viewing. But it was so long ago.",en,[],[],[],0,0,0,[],[],https://twitter.com/JoeLGalvan/status/1419343405482614784,False,,0,,phoenix,,,,,,"[{'screen_name': 'nekr0mantix', 'name': 'Daddy Krueger', 'id': '41477322'}]",,,,
1419338095892209667,1419338095892209667,2021-07-25 11:45:46 CDT,2021-07-25,11:45:46,-0500,822663933588713472,donnabstill,Donna Still,,It seems to me they are the same threat. We would be done with COVId if it weren’t for the GQP.,en,[],[],[],0,0,0,[],[],https://twitter.com/donnabstill/status/1419338095892209667,False,https://twitter.com/grandmagrit/status/1418930108618969102,0,,phoenix,,,,,,[],,,,
1419331862539882496,1419331862539882496,2021-07-25 11:21:00 CDT,2021-07-25,11:21:00,-0500,1157474628,threat_lvl_mdnt,x - clinched,,US basketball for you. All everyone wants to do is shoot 3’s now. You’re down two? Take the ball to the rack!,en,[],[],[],0,0,0,[],[],https://twitter.com/threat_lvl_mdnt/status/1419331862539882496,False,https://twitter.com/WorldWideWobUSA/status/1419294864789975041,0,,phoenix,,,,,,[],,,,
1419302782473957379,1419302782473957379,2021-07-25 09:25:27 CDT,2021-07-25,09:25:27,-0500,1077028435,charityoriabure,Charity Oriabure,,"No weapon formed against you shall prosper,   https://t.co/Jwv4KXvVA8  https://t.co/zwKx5Sxz1z",en,[],['https://bible.com/bible/114/isa.54.17.NKJV'],['https://pbs.twimg.com/media/E7JgW6RUUAMLeyJ.jpg'],0,0,1,[],[],https://twitter.com/CharityOriabure/status/1419302782473957379,False,,1,https://pbs.twimg.com/media/E7JgW6RUUAMLeyJ.jpg,phoenix,,,,,,[],,,,
1419228802677317639,1419228802677317639,2021-07-25 04:31:29 CDT,2021-07-25,04:31:29,-0500,418347589,carlsanders13,Carl Sanders,,"Report: More Than Half of Women Serving in UK Armed Forces Face Harassment, Bullying, and Sex Abuse   https://t.co/fqNG6RhdHv",en,[],['https://sputniknews.com/uk/202107251083457304-report-more-than-half-of-women-serving-in-uk-armed-forces-face-harassment-bullying-and-sex-abuse/'],[],0,1,1,[],[],https://twitter.com/carlsanders13/status/1419228802677317639,False,,0,,phoenix,,,,,,[],,,,
1419182717950775302,1419157479657676810,2021-07-25 01:28:21 CDT,2021-07-25,01:28:21,-0500,361390554,adam_waltz,Adam Waltz,,"LATEST: Dude drives RV straight at police, who shoot and hit him. Guy drives two miles to Frye and Dobson where he causes a 6 car crash. @abc15 3 badly hurt, 7 others injured.  https://t.co/OHhxhml1aq",en,"[{'screen_name': 'abc15', 'name': 'abc15 arizona', 'id': '9721292'}]",['https://www.abc15.com/news/region-southeast-valley/chandler/pd-three-people-seriously-hurt-in-six-car-collision-at-chandler-intersection-police-shooting-connected-to-crash'],[],1,0,2,[],[],https://twitter.com/Adam_Waltz/status/1419182717950775302,False,,0,,phoenix,,,,,,[],,,,
1419157479657676810,1419157479657676810,2021-07-24 23:48:04 CDT,2021-07-24,23:48:04,-0500,361390554,adam_waltz,Adam Waltz,,"HAPPENING NOW: 3 people are seriously hurt, 7 others injured after an officer involved shooting at Dobson and Frye. Person crashed while running from police. @abc15  https://t.co/LwpWufbh9T",en,"[{'screen_name': 'abc15', 'name': 'abc15 arizona', 'id': '9721292'}]",[],['https://pbs.twimg.com/media/E7HcM5_VgAU9spJ.jpg'],3,4,10,[],[],https://twitter.com/Adam_Waltz/status/1419157479657676810,False,,1,https://pbs.twimg.com/media/E7HcM5_VgAU9spJ.jpg,phoenix,,,,,,[],,,,
1419154902224306179,1419154902224306179,2021-07-24 23:37:49 CDT,2021-07-24,23:37:49,-0500,2856068648,__andresv,.,,D rose never getting injured. easily. basketball would be so much different if he never got hurt.,en,[],[],[],0,0,0,[],[],https://twitter.com/__andresv/status/1419154902224306179,False,https://twitter.com/TheHoopCentral/status/1419111252878454785,0,,phoenix,,,,,,[],,,,
1419140866275414022,1419140866275414022,2021-07-24 22:42:03 CDT,2021-07-24,22:42:03,-0500,418347589,carlsanders13,Carl Sanders,,"Six People Detained in London During Anti-Lockdown Protest, Four Officers Injured - Videos   https://t.co/kkxlOjB3wy",en,[],['https://sputniknews.com/uk/202107241083456336-six-people-detained-in-london-during-anti-lockdown-protest-four-officers-injured---videos/'],[],0,1,1,[],[],https://twitter.com/carlsanders13/status/1419140866275414022,False,,0,,phoenix,,,,,,[],,,,
1419115690515070977,1419115690515070977,2021-07-24 21:02:01 CDT,2021-07-24,21:02:01,-0500,88562662,theguybieber,Guy Bieber,,Arrest him.,en,[],[],[],0,0,0,[],[],https://twitter.com/theguybieber/status/1419115690515070977,False,https://twitter.com/gtconway3d/status/1419114147267162115,0,,phoenix,,,,,,[],,,,
