id,conversation_id,created_at,date,time,timezone,user_id,username,name,place,tweet,language,mentions,urls,photos,replies_count,retweets_count,likes_count,hashtags,cashtags,link,retweet,quote_url,video,thumbnail,near,geo,source,user_rt_id,user_rt,retweet_id,reply_to,retweet_date,translate,trans_src,trans_dest
1392988766667558912,1392872330842542080,2021-05-13 18:42:57 CDT,2021-05-13,18:42:57,-0500,1528246526,lisabeohm,Lisa Beohm,,@TomCruise @TopGunMovie Can’t wait to see the new movie! Top Gun was such an iconic movie and I still don’t get tired of watching it.,en,[],[],[],0,0,0,[],[],https://twitter.com/LisaBeohm/status/1392988766667558912,False,,0,,phoenix,,,,,,"[{'screen_name': 'TomCruise', 'name': 'Tom Cruise', 'id': '48410093'}, {'screen_name': 'TopGunMovie', 'name': 'Top Gun', 'id': '725413623871332352'}]",,,,
1392972380474019847,1392972380474019847,2021-05-13 17:37:50 CDT,2021-05-13,17:37:50,-0500,108996950,nleaclark,Highmark Stadium@theRalph,,@Titans Do you allow this on your field? Child abuse!,en,[],[],[],0,0,0,[],[],https://twitter.com/nleaclark/status/1392972380474019847,False,https://twitter.com/J9Talley/status/1392295913410998288,0,,phoenix,,,,,,[],,,,
1392964092164411396,1392963827700953089,2021-05-13 17:04:54 CDT,2021-05-13,17:04:54,-0500,1617032035,dinojagger,Dino Jagger III,,@jaylexjess you attending or shooting?? 👀 either way congrats! Lol,en,[],[],[],1,0,1,[],[],https://twitter.com/dinojagger/status/1392964092164411396,False,,0,,phoenix,,,,,,"[{'screen_name': 'jaylexjess', 'name': '𝙅𝙖𝙮𝙡𝙚𝙭', 'id': '607534232'}]",,,,
1392963452872785925,1392963452872785925,2021-05-13 17:02:21 CDT,2021-05-13,17:02:21,-0500,20490995,vadergrrrl,Mir.I.am White,,This is not defense!!  This is aggression. US must stop supporting Israel. Time to sanction Israel. #DefundIsrael snd hold UN war crime investigations #GazaUnderAttack,en,[],[],[],0,0,1,"['defundisrael', 'gazaunderattack']",[],https://twitter.com/vadergrrrl/status/1392963452872785925,False,,0,,phoenix,,,,,,[],,,,
1392940573993017346,1392940573993017346,2021-05-13 15:31:27 CDT,2021-05-13,15:31:27,-0500,336847865,habarient,Habari Entertainment,,Meghan McCain hits Biden's approach to Middle East violence: Support for Israel sounds like 'just words'   https://t.co/hyskGbUIIF,en,[],['https://habarientertainment.com/meghan-mccain-hits-bidens-approach-to-middle-east-violence-support-for-israel-sounds-like-just-words-fox-news/'],[],0,0,0,[],[],https://twitter.com/Habarient/status/1392940573993017346,False,,0,,phoenix,,,,,,[],,,,
1392939545834889218,1392919153997062147,2021-05-13 15:27:21 CDT,2021-05-13,15:27:21,-0500,407329611,blakemurphy7,Blake Allen Murphy,,@theAdamGreen @chrismedina I wouldn’t be as upset about people abusing the system if the same people upset over people doing it weren’t the ones writing off personal lunches as a business expense (true story).  Abuse is abuse but really the rules aren’t the same for people with resources hah,en,[],[],[],0,0,0,[],[],https://twitter.com/blakemurphy7/status/1392939545834889218,False,,0,,phoenix,,,,,,"[{'screen_name': 'theAdamGreen', 'name': 'Adam Green', 'id': '147763423'}, {'screen_name': 'chrismedina', 'name': 'Chris Medina', 'id': '25797667'}]",,,,
1392937326179864578,1392922238974709760,2021-05-13 15:18:32 CDT,2021-05-13,15:18:32,-0500,315398585,_waffle_bandit_,🧇 🪑CS | WaffleBandit | #RAZERebellion 🪑🧇,,"@jeffleach The only Wrong Doing I am seeing here is the hatred that @Activision sheds towards people when they get a rage boner for cancel culture.  this isn't right, and this isn't fair for you at all. #IStandWithJeffLeach",en,"[{'screen_name': 'activision', 'name': 'activision', 'id': '612782611'}]",[],[],2,2,85,['istandwithjeffleach'],[],https://twitter.com/_Waffle_Bandit_/status/1392937326179864578,False,,0,,phoenix,,,,,,"[{'screen_name': 'jeffleach', 'name': 'Jeff Leach', 'id': '24741334'}]",,,,
1392936958905655298,1392936958905655298,2021-05-13 15:17:05 CDT,2021-05-13,15:17:05,-0500,180423094,cm_energyintel,Casey Merriman,,"Things I never expected to read in my inbox:  “Permian Scout: Devon’s Danger Noodle IP30s over 5,000 boe/d”  And here I used to get a kick out of Hess’ Tubular Bells development",en,[],[],[],3,0,15,[],[],https://twitter.com/cm_energyintel/status/1392936958905655298,False,,0,,phoenix,,,,,,[],,,,
1392934639929462784,1392934639929462784,2021-05-13 15:07:52 CDT,2021-05-13,15:07:52,-0500,2650226498,cheekychand,cheeks mcgee,,pls don’t say misogyny doesn’t exist in the workplace when my manager told me I should get an arts degree instead of biochemistry and questioned my knowledge on chemistry. I work in insurance.,en,[],[],[],0,1,6,[],[],https://twitter.com/cheekychand/status/1392934639929462784,False,,0,,phoenix,,,,,,[],,,,
1392931266354290688,1392931266354290688,2021-05-13 14:54:27 CDT,2021-05-13,14:54:27,-0500,857302155669012480,theinhaleexhale,BirdsAteHerFace,,"Me and Bae talking about murder and other nefarious crime:  Me: “NO FACE, NO CASE!”  Her: “NO BODY, NO CRIME”  I’m gonna marry this woman.",en,[],[],[],0,1,3,[],[],https://twitter.com/theinhaleexhale/status/1392931266354290688,False,,0,,phoenix,,,,,,[],,,,
1392924930132504576,1392924930132504576,2021-05-13 14:29:17 CDT,2021-05-13,14:29:17,-0500,25706772,valerianus,Colin B.,"{'type': 'Point', 'coordinates': [33.58452758, -112.15165059]}",Finishing up Charlemagne. Next homeschool unit: the looming threat to Charlemagne's heirs - my ancestors! I may have an overabundance of materials to teach about the Vikings . . .  https://t.co/VSUhNNguf8,en,[],['https://www.instagram.com/p/CO0yx97BBtY8v0PZsV7JRv5dhak0857veTQMBI0/?igshid=nvsfwfnv5wmf'],[],0,0,0,[],[],https://twitter.com/Valerianus/status/1392924930132504576,False,,0,,phoenix,,,,,,[],,,,
1392920976329904129,1392920976329904129,2021-05-13 14:13:34 CDT,2021-05-13,14:13:34,-0500,2562783187,brandybutternub,brandy savage 🤸🏻‍♀️,,Can someone go to a rage room with me pls,en,[],[],[],0,0,3,[],[],https://twitter.com/BrandyButternub/status/1392920976329904129,False,,0,,phoenix,,,,,,[],,,,
1392914996900765697,1392914996900765697,2021-05-13 13:49:49 CDT,2021-05-13,13:49:49,-0500,65346850,kaxelfoley,Jamaica 🇯🇲,,I’m starting to think that this whole United protest is just to inconvenience Liverpool,en,[],[],[],0,0,0,[],[],https://twitter.com/KaxelFoley/status/1392914996900765697,False,,0,,phoenix,,,,,,[],,,,
1392900600178769926,1392900600178769926,2021-05-13 12:52:36 CDT,2021-05-13,12:52:36,-0500,407329611,blakemurphy7,Blake Allen Murphy,,@davemedjr No clue how MB will react if they aren’t bad but aren’t 10 win either. I think it depends on a quick start and the brutal finish. Go 3-1 and you’re a playoff team.  Go 1-3 in both and maybe Kliff is gone. No clue on Keim but MB is loyal...,en,[],[],[],0,0,0,[],[],https://twitter.com/blakemurphy7/status/1392900600178769926,False,,0,,phoenix,,,,,,[],,,,
1392898398798245890,1392898398798245890,2021-05-13 12:43:51 CDT,2021-05-13,12:43:51,-0500,1281611145497980930,flood989,flood,,TW/CW: sexual violence  . . . . . . . . .,en,[],[],[],0,0,0,[],[],https://twitter.com/flood989/status/1392898398798245890,False,https://twitter.com/TRF_Stories/status/1392380539445841922,0,,phoenix,,,,,,[],,,,
1392896559147225090,1392896559147225090,2021-05-13 12:36:33 CDT,2021-05-13,12:36:33,-0500,52004650,marcometer,Marc,,I guess I wasn't paying enough attention to #AEWDynamite last night but I missed Orange Cassidy getting injured.  So is it legit or.....?,en,[],[],[],0,0,0,['aewdynamite'],[],https://twitter.com/marcometer/status/1392896559147225090,False,,0,,phoenix,,,,,,[],,,,
1392887980239429637,1392887980239429637,2021-05-13 12:02:27 CDT,2021-05-13,12:02:27,-0500,1554113684,peaceofdepay,cHarlie🇺🇦,,"if United supporters protest &amp; the game gets called off again, surely Liverpool get all 3 points?",en,[],[],[],0,0,1,[],[],https://twitter.com/peaceofdepay/status/1392887980239429637,False,,0,,phoenix,,,,,,[],,,,
1392883189740232705,1392883189740232705,2021-05-13 11:43:25 CDT,2021-05-13,11:43:25,-0500,137476484,aquariusinaz,AquariusinAZ,,"What is Taylor-Greene's problem? It looks to me like she desperately needs to attend some anti-bullying &amp; anger mgmt!  Rep. Greene aggressively confronts Rep. Ocasio-Cortez, causing New York congresswoman to raise security concerns By Marianna Sotomayor   https://t.co/RtTga9Lc3s",en,[],['https://www.washingtonpost.com/politics/greene-ocasio-cortez/2021/05/12/fd61d664-b37e-11eb-a3b5-f994536fe84a_story.html'],[],2,1,2,[],[],https://twitter.com/AquariusinAZ/status/1392883189740232705,False,,0,,phoenix,,,,,,[],,,,
1392878440957636610,1392878440957636610,2021-05-13 11:24:33 CDT,2021-05-13,11:24:33,-0500,1089692699794554880,tandy_21,❤️‍🔥,,Not having daily cuddles is taking a toll on my anger management skills.,en,[],[],[],0,1,0,[],[],https://twitter.com/tandy_21/status/1392878440957636610,False,,0,,phoenix,,,,,,[],,,,
1392877054425661442,1392877054425661442,2021-05-13 11:19:02 CDT,2021-05-13,11:19:02,-0500,137476484,aquariusinaz,AquariusinAZ,,This is just awful! I wish this would stop!  CBS News: Religious violence spreads across Israel as death toll from Gaza airstrikes mounts.  https://t.co/GPPALFdS0X  via @GoogleNews,en,"[{'screen_name': 'googlenews', 'name': 'google news', 'id': '33584794'}]",['https://www.cbsnews.com/news/israel-palestine-hamas-religious-violence-streets-2021-05-13/'],[],0,0,0,[],[],https://twitter.com/AquariusinAZ/status/1392877054425661442,False,,0,,phoenix,,,,,,[],,,,
