id,conversation_id,created_at,date,time,timezone,user_id,username,name,place,tweet,language,mentions,urls,photos,replies_count,retweets_count,likes_count,hashtags,cashtags,link,retweet,quote_url,video,thumbnail,near,geo,source,user_rt_id,user_rt,retweet_id,reply_to,retweet_date,translate,trans_src,trans_dest
1401551795617296384,1401551795617296384,2021-06-06 09:49:22 CDT,2021-06-06,09:49:22,-0500,51787803,growingupbipola,Michael Kolton,,Always try to be kind to others. What you say or how you treat them will resonate inside of them long after the reason for your words or behavior is forgotten. #mentalhealth #abused  #narcissisticabuse #abuse #bipolar #bipolardisorder #CPTSD #PTSD #borderline #BPD #autism #ASD,en,[],[],[],0,1,3,"['mentalhealth', 'abused', 'narcissisticabuse', 'abuse', 'bipolar', 'bipolardisorder', 'cptsd', 'ptsd', 'borderline', 'bpd', 'autism', 'asd']",[],https://twitter.com/growingupbipola/status/1401551795617296384,False,,0,,san diego,,,,,,[],,,,
1401525333904412675,1401124406018162688,2021-06-06 08:04:13 CDT,2021-06-06,08:04:13,-0500,23108016,amcelvain,Anne McElvain-Volm #Lucifan,,"@teamdeckerstar Especially considering that Chloe had a giant, legit reason to use the knife.",en,[],[],[],0,0,0,[],[],https://twitter.com/AMcElvain/status/1401525333904412675,False,,0,,san diego,,,,,,"[{'screen_name': 'teamdeckerstar', 'name': 'lucifan maria', 'id': '1135984770675089409'}]",,,,
1401438118712991744,1401438118712991744,2021-06-06 02:17:39 CDT,2021-06-06,02:17:39,-0500,16016450,nadomom,Cindy McNary,,"Jim Acosta re GOP:  ""Wasted away in Mar-a-Lagoville, looking for that next election to assault. Some people claim that there's an orange man to blame, But I know it's my own damned fault.""  Where's the lie?",en,[],[],[],0,0,0,[],[],https://twitter.com/Nadomom/status/1401438118712991744,False,https://twitter.com/MmekwaMrtv/status/1401291613763260417,0,,san diego,,,,,,[],,,,
1401424195217547268,1401298226850971649,2021-06-06 01:22:19 CDT,2021-06-06,01:22:19,-0500,52811999,alyssajsalter,Alyssa Salter,,@JoannaNoBanana DEAD,en,[],[],[],0,0,0,[],[],https://twitter.com/AlyssaJSalter/status/1401424195217547268,False,,0,,san diego,,,,,,"[{'screen_name': 'JoannaNoBanana', 'name': 'Joanna No Banana', 'id': '1113482654354235392'}]",,,,
1401419083690561539,1401231363915739138,2021-06-06 01:02:01 CDT,2021-06-06,01:02:01,-0500,16019523,sickobrand,Vic Murillo,,"@TheMikeCosta Sunday morn death pharts, roses will wilt, grossness",en,[],[],[],0,0,0,[],[],https://twitter.com/sickobrand/status/1401419083690561539,False,,0,,san diego,,,,,,"[{'screen_name': 'TheMikeCosta', 'name': 'TheMikeCosta', 'id': '1186061938951741440'}]",,,,
1401402092808413184,1401167287139328001,2021-06-05 23:54:30 CDT,2021-06-05,23:54:30,-0500,18172061,drvogelmann,Dr Christopher S. Vogelmann,,@BeschlossDC Abusers often accuse others of abuse. It is their M.O.,en,[],[],[],0,0,0,[],[],https://twitter.com/DrVogelmann/status/1401402092808413184,False,,0,,san diego,,,,,,"[{'screen_name': 'BeschlossDC', 'name': 'Michael Beschloss', 'id': '874916178'}]",,,,
1401400906646659072,1401400906646659072,2021-06-05 23:49:47 CDT,2021-06-05,23:49:47,-0500,866985042,thereeljz,Jacob Zweiback,,"Jacob deGrom, #WhiteCastleSpecial 🍔🍔🍔  Blows Wil Myers away with 3 straight sliders for whiffs. The best pitcher in baseball has lowered his ERA to 0️⃣.6️⃣2️⃣ with 7 scoreless innings of 3-hit ball. 11 K’s against a great offense 🔥 #LGM  https://t.co/8jIukqav4s",en,[],[],[],1,1,9,"['whitecastlespecial', 'lgm']",[],https://twitter.com/TheReelJZ/status/1401400906646659072,False,,1,https://pbs.twimg.com/ext_tw_video_thumb/1401400840884166657/pu/img/RPrSogJ0y-NUFpoa.jpg,san diego,,,,,,[],,,,
1401399390477058052,1401264543486074885,2021-06-05 23:43:46 CDT,2021-06-05,23:43:46,-0500,759893053641338881,darkfirecapital,Darkfire Capital LLC: MexicanSoccerRiot Blockchain,,"@ohcapideas Gotta appreciate a traditional Peruvian named candidate like George Forsyth running… 😂  But seriously, Fujimori has to win this. My cousin was kidnapped and killed by the Shining Path while he was backpacking there, f those guys, it’s personal.",en,[],[],[],2,0,4,[],[],https://twitter.com/DarkfireCapital/status/1401399390477058052,False,,0,,san diego,,,,,,"[{'screen_name': 'ohcapideas', 'name': 'Ohio Capital Ideas', 'id': '1281982214394253314'}]",,,,
1401398218898903040,1400721114431635460,2021-06-05 23:39:06 CDT,2021-06-05,23:39:06,-0500,18172061,drvogelmann,Dr Christopher S. Vogelmann,,@Sosowski Punch cards,en,[],[],[],0,0,0,[],[],https://twitter.com/DrVogelmann/status/1401398218898903040,False,,0,,san diego,,,,,,"[{'screen_name': 'Sosowski', 'name': 'Sos Sosowski', 'id': '96394264'}]",,,,
1401397671277973506,1401396710987898885,2021-06-05 23:36:56 CDT,2021-06-05,23:36:56,-0500,69434141,ilseguido,Ilse Guido-Jackson,,@aeguido And the ref said corner kick off of a Phoenix player!?!? 😡 or did I see wrong.,en,[],[],[],0,0,4,[],[],https://twitter.com/IlseGuido/status/1401397671277973506,False,,0,,san diego,,,,,,"[{'screen_name': 'aeguido', 'name': 'Alejandro Guido', 'id': '372053731'}]",,,,
1401394905516154880,1401394580126408704,2021-06-05 23:25:56 CDT,2021-06-05,23:25:56,-0500,2841991235,sebatlab,Jonathan Sebat,,@jpirruccello Bloody weather  https://t.co/4UF69xLVPe,en,[],[],['https://pbs.twimg.com/tweet_video_thumb/E3LBPKNUUAEsajJ.jpg'],1,0,2,[],[],https://twitter.com/sebatlab/status/1401394905516154880,False,,1,https://pbs.twimg.com/tweet_video_thumb/E3LBPKNUUAEsajJ.jpg,san diego,,,,,,"[{'screen_name': 'jpirruccello', 'name': 'James Pirruccello', 'id': '27490760'}]",,,,
1401394276123115522,1401394276123115522,2021-06-05 23:23:26 CDT,2021-06-05,23:23:26,-0500,2872695860,escallatte,christian,,"@GoPBCardinals When are the Jacob deGrom victim, support group meetings?",en,[],[],[],0,0,0,[],[],https://twitter.com/escallatte/status/1401394276123115522,False,,0,,san diego,,,,,,[],,,,
1401384564694548480,1401384564694548480,2021-06-05 22:44:51 CDT,2021-06-05,22:44:51,-0500,1686751519,rodog619,Rodel,,Our offense has to be better! Bases loaded with 1 out and zero runs?! Unacceptable #Padres,en,[],[],[],0,0,0,['padres'],[],https://twitter.com/Rodog619/status/1401384564694548480,False,,0,,san diego,,,,,,[],,,,
1401365912788213761,1401363664125317126,2021-06-05 21:30:44 CDT,2021-06-05,21:30:44,-0500,1158172088,t_mac_11,Taylor,,"@XpatinX Hey man, that’s assault. We are an injured horse, don’t kick us 😂",en,[],[],[],0,0,1,[],[],https://twitter.com/T_Mac_11/status/1401365912788213761,False,,0,,san diego,,,,,,"[{'screen_name': 'XpatinX', 'name': 'xxPatinxx', 'id': '1701014474'}]",,,,
1401365463129411586,1401363566645579779,2021-06-05 21:28:57 CDT,2021-06-05,21:28:57,-0500,948997669,trillbiill,auntie from the 80’s,,"@KatDDon Listen, I played in in my head 5 different ways! Am I gon stab them, throw the grill at them, grab this skateboard, this speaker .. the car too far.. idk but fuck it, it’s whatever at this point 😭😭😭",en,[],[],[],1,0,0,[],[],https://twitter.com/trillbiill/status/1401365463129411586,False,,0,,san diego,,,,,,"[{'screen_name': 'KatDDon', 'name': 'Kat', 'id': '718892226'}]",,,,
1401363906266689537,1401303850011799553,2021-06-05 21:22:45 CDT,2021-06-05,21:22:45,-0500,2166800150,brandnewcool1,Pamela,,@NOFSpodcast Shaun of the dead.,en,[],[],[],0,0,0,[],[],https://twitter.com/brandnewcool1/status/1401363906266689537,False,,0,,san diego,,,,,,"[{'screen_name': 'NOFSpodcast', 'name': 'NIGHTMARE ON FILM STREET', 'id': '765307341533220864'}]",,,,
1401348092792770561,1401348092792770561,2021-06-05 20:19:55 CDT,2021-06-05,20:19:55,-0500,67952688,firstpossession,Anthony Ware,,"Christ loved, spoke truth and didnt hurt anyone so why didnt he get the same in return? Because of evil, ignorant people.",en,[],[],[],0,0,0,[],[],https://twitter.com/firstpossession/status/1401348092792770561,False,,0,,san diego,,,,,,[],,,,
