id,conversation_id,created_at,date,time,timezone,user_id,username,name,place,tweet,language,mentions,urls,photos,replies_count,retweets_count,likes_count,hashtags,cashtags,link,retweet,quote_url,video,thumbnail,near,geo,source,user_rt_id,user_rt,retweet_id,reply_to,retweet_date,translate,trans_src,trans_dest
1402043029360287746,1402034880431726599,2021-06-07 18:21:21 CDT,2021-06-07,18:21:21,-0500,1101136561167462402,thebrianasman,Brian Asman,,@MattFini Incredible how they’ve gone from a simple story about two Italian guys who like stomping wildlife to death to THAT,en,[],[],[],0,0,1,[],[],https://twitter.com/thebrianasman/status/1402043029360287746,False,,0,,san diego,,,,,,"[{'screen_name': 'MattFini', 'name': 'Matt Serafini', 'id': '21935934'}]",,,,
1402035755875127297,1402035755875127297,2021-06-07 17:52:27 CDT,2021-06-07,17:52:27,-0500,997289169742262272,savagepupper_,savagepupperlover,,Just a little mid day knife fight with some peaceful and loving unhoused neighbors. This is obviously a housing problem. #KnifeFight #UnhousedNeighbors  https://t.co/simpEnnQ3q,en,[],[],[],1,0,3,"['knifefight', 'unhousedneighbors']",[],https://twitter.com/savagepupper_/status/1402035755875127297,False,,1,https://pbs.twimg.com/ext_tw_video_thumb/1402034771220303874/pu/img/URjKYAUcE3J1sl-r.jpg,san diego,,,,,,[],,,,
1402022990162776071,1402022990162776071,2021-06-07 17:01:43 CDT,2021-06-07,17:01:43,-0500,948997669,trillbiill,auntie from the 80’s,,Anxiety through the roof BC o take offense to certain shit when it comes to love ones I’ve lost that aren’t here to speak on their own behalf.,en,[],[],[],0,1,0,[],[],https://twitter.com/trillbiill/status/1402022990162776071,False,,0,,san diego,,,,,,[],,,,
1402013204473995264,1402013204473995264,2021-06-07 16:22:50 CDT,2021-06-07,16:22:50,-0500,1239554337191243776,dodgerscabal,Matt,,Boxing is dead AF.,en,[],[],[],0,0,0,[],[],https://twitter.com/DodgersCabal/status/1402013204473995264,False,,0,,san diego,,,,,,[],,,,
1401992622089011200,1401992622089011200,2021-06-07 15:01:03 CDT,2021-06-07,15:01:03,-0500,1257124241268301825,leyrayleen,rae,,I’m making my aunts go to the gym tonight and I already know my abs are going to hurt. Not from working out but bc of how funny these bitches are.,en,[],[],[],1,0,1,[],[],https://twitter.com/leyrayleen/status/1401992622089011200,False,,0,,san diego,,,,,,[],,,,
1401969085081001989,1401969085081001989,2021-06-07 13:27:31 CDT,2021-06-07,13:27:31,-0500,30003452,jgoldbeck,Janessa Goldbeck,,"“Not only are these attacks on civilian control a huge problem for civil-mil relations, they are a direct assault on the strategic effectiveness of the future force. A force that can't recruit/retain people with a diverse set of perspectives &amp; skills will lose.” - @CarrieALee1",en,"[{'screen_name': 'carriealee1', 'name': 'carrie a lee', 'id': '776095237735317504'}]",[],[],0,1,3,[],[],https://twitter.com/jgoldbeck/status/1401969085081001989,False,https://twitter.com/CarrieALee1/status/1401917373800660995,0,,san diego,,,,,,[],,,,
1401965033811157006,1401965033811157006,2021-06-07 13:11:25 CDT,2021-06-07,13:11:25,-0500,1955688696,sheeeshsimon,ˢʰᵉᵉˢʰ Santa 🎄,,If you have ever named an animal “Creamsicle” you deserve the death penalty,en,[],[],[],0,1,2,[],[],https://twitter.com/SheeeshSimon/status/1401965033811157006,False,,0,,san diego,,,,,,[],,,,
1401961834257649665,1401961834257649665,2021-06-07 12:58:43 CDT,2021-06-07,12:58:43,-0500,1292734616,colinsummers22,Summas,,Get well soon Duane!! Kick cancers butt!,en,[],[],[],0,0,1,[],[],https://twitter.com/ColinSummers22/status/1401961834257649665,False,https://twitter.com/SFGiants/status/1401947666003619840,0,,san diego,,,,,,[],,,,
1401957519866535944,1401928169934950400,2021-06-07 12:41:34 CDT,2021-06-07,12:41:34,-0500,1399846448846364674,teddyrussellv2,Teddy Russell V,,@JRubinBlogger Precisely!  Thanks.  Proverbs of Kings David &amp; Solomon.  A closed mouth the beginning of wisdom.  From Dead Sea Scrolls there is no is.  I was an English teacher substitute Atlantic City High 1973  tRu,en,[],[],[],0,0,0,[],[],https://twitter.com/TeddyRussellV2/status/1401957519866535944,False,,0,,san diego,,,,,,"[{'screen_name': 'JRubinBlogger', 'name': ""Jennifer 'I stand with Ukraine' Rubin 🇺🇦🇺🇦"", 'id': '218975278'}]",,,,
1401940002255237120,1401931447368306695,2021-06-07 11:31:57 CDT,2021-06-07,11:31:57,-0500,995141821977083906,rorointhe619,Eva Circles™️ 6️⃣1️⃣9️⃣,,@guelphgirlchris @katrn80 Told him to wait because they're swarming. Unless the bees are real aggressive if he can leave them they might swarm away. They're going where the queen bee goes.,en,[],[],[],0,0,1,[],[],https://twitter.com/RoRoInthe619/status/1401940002255237120,False,,0,,san diego,,,,,,"[{'screen_name': 'guelphgirlchris', 'name': 'Christine', 'id': '878030383522213889'}, {'screen_name': 'katrn80', 'name': 'Kat 🐝🌻', 'id': '1678104925'}]",,,,
1401936762646142976,1401936762646142976,2021-06-07 11:19:05 CDT,2021-06-07,11:19:05,-0500,189479708,jondrjon,Brady & Luca's Butler 🇬🇧🏳️‍🌈🇺🇦,,"""Nature red in tooth and claw"" indeed... as I collect the fuzzy bunny paws left behind in the front garden this morning.  My suspicion is one of the (beautiful but deadly) local barn owls... poor wild bunny - frequent visitor to our garden, we barely knew you 💔🐇 #nature",en,[],[],[],0,0,1,['nature'],[],https://twitter.com/jondrjon/status/1401936762646142976,False,,0,,san diego,,,,,,[],,,,
1401933702431608834,1401931633616244739,2021-06-07 11:06:55 CDT,2021-06-07,11:06:55,-0500,984404393096232960,van_essavan,🦋an,,@nick_weil It’s called narcissistic bullies deciding what they want is more important than anything else. Bull Gates is a narcissistic bully.,en,[],[],[],0,0,1,[],[],https://twitter.com/van_essavan/status/1401933702431608834,False,,0,,san diego,,,,,,"[{'screen_name': 'nick_weil', 'name': 'nick', 'id': '535864275'}]",,,,
1401928538849087491,1401928538849087491,2021-06-07 10:46:24 CDT,2021-06-07,10:46:24,-0500,2269733802,tvfellonme,VVVVVVV,,People who ride their bikes on the sidewalk deserve the death penalty,en,[],[],[],0,0,0,[],[],https://twitter.com/Tvfellonme/status/1401928538849087491,False,,0,,san diego,,,,,,[],,,,
1401914329536946177,1401914329536946177,2021-06-07 09:49:57 CDT,2021-06-07,09:49:57,-0500,24012354,jailerma,Yesterdays Gas is Not Todays Gas,,"This one is actually productive because Kwame was a self Wound, West Virginia Senator stop Democracy l How can you be for #Gerrymandering @Sen_JoeManchin You a Clown Indeed",en,"[{'screen_name': 'sen_joemanchin', 'name': 'senator joe manchin', 'id': '234374703'}]",[],[],0,0,0,['gerrymandering'],[],https://twitter.com/Jailerma/status/1401914329536946177,False,https://twitter.com/amauney28/status/1401719973412851716,0,,san diego,,,,,,[],,,,
1401794646586454017,1401794646586454017,2021-06-07 01:54:22 CDT,2021-06-07,01:54:22,-0500,47532651,djgeneticz,DJ Geneticz,,Dead ☠️☠️,en,[],[],[],0,0,0,[],[],https://twitter.com/DJGeneticz/status/1401794646586454017,False,https://twitter.com/JDaIey/status/1401748855453016068,0,,san diego,,,,,,[],,,,
1401778345084276738,1401778345084276738,2021-06-07 00:49:35 CDT,2021-06-07,00:49:35,-0500,1307054410896302081,yaimgoood,??????,,as much as we bully beatboxers they’re probably good at head. imagine them housemusicing ur junk,en,[],[],[],0,0,3,[],[],https://twitter.com/yaimgoood/status/1401778345084276738,False,,0,,san diego,,,,,,[],,,,
1401777126899023877,1401750271999369218,2021-06-07 00:44:45 CDT,2021-06-07,00:44:45,-0500,48635751,vani_valentine,Donut Level Black Mage,,Now we are both dead. 🥺wonder if I should come back as a teifling again or a cat person? This really blows chunks y’all.,en,[],[],[],1,0,4,[],[],https://twitter.com/vani_valentine/status/1401777126899023877,False,,0,,san diego,,,,,,[],,,,
1401757671070613504,1401757671070613504,2021-06-06 23:27:26 CDT,2021-06-06,23:27:26,-0500,510165233,tannenbaum_mike,۞ ᘻᓰᖽᐸᘿ ₮₳₦₦Ɇ₦฿₳Ʉ₥ ۞,,FUN FACT: You can't murder 50 people from long range in one minute with a Swiss Army Knife.  Judge Benitez is an idiot.,en,[],[],[],0,0,0,[],[],https://twitter.com/Tannenbaum_Mike/status/1401757671070613504,False,,0,,san diego,,,,,,[],,,,
1401755095486791682,1400860530575691778,2021-06-06 23:17:12 CDT,2021-06-06,23:17:12,-0500,37138194,timmetcalf,Tim Metcalf,,@CAPublicHealth I’ll give you a few good reasons NOT to:  1) The blood clots in my lungs. Thanks Pfizer!  2) 5000+ dead on VAERS  3) These companies are claiming blanket immunity from lawsuits/prosecution. They don’t even believe in their own product but they want to put it in your children.,en,[],[],[],2,3,16,[],[],https://twitter.com/timmetcalf/status/1401755095486791682,False,,0,,san diego,,,,,,"[{'screen_name': 'CAPublicHealth', 'name': 'CA Public Health', 'id': '33934492'}]",,,,
1401751523470704641,1401751523470704641,2021-06-06 23:03:01 CDT,2021-06-06,23:03:01,-0500,978621527414509568,littleblndebish,yeorange,,“What if Hes changed” my Bestfriend as she speaks of her ex who stabbed her in the back with a literal knife 😂,en,[],[],[],1,0,0,[],[],https://twitter.com/littleblndebish/status/1401751523470704641,False,,0,,san diego,,,,,,[],,,,
1401750334045790208,1401750334045790208,2021-06-06 22:58:17 CDT,2021-06-06,22:58:17,-0500,251921869,huntersowards3,Hunter Sowards,,"#BREAKING: Two people have been arrested in the road rage death of 6-year-old Aiden Leos on an Orange County freeway. CHP says Eriz Marcus Anthony, 24, and Lee Wynne, 23, were arrested at their home in Costa Mesa. They’re potentially facing murder charges.  https://t.co/iXrnaSmxuY",en,[],[],['https://pbs.twimg.com/media/E3QEf-1UUAcWi_3.jpg'],2,9,48,['breaking'],[],https://twitter.com/huntersowards3/status/1401750334045790208,False,,1,https://pbs.twimg.com/media/E3QEf-1UUAcWi_3.jpg,san diego,,,,,,[],,,,
1401747664593592326,1401747664593592326,2021-06-06 22:47:41 CDT,2021-06-06,22:47:41,-0500,911683857384136704,dsudbish,David Sudbeck,,Boxing is dead and if you’re still a fan of boxing you’re a loser.,en,[],[],[],0,0,0,[],[],https://twitter.com/DSudbish/status/1401747664593592326,False,,0,,san diego,,,,,,[],,,,
1401743260683436047,1401731054520524800,2021-06-06 22:30:11 CDT,2021-06-06,22:30:11,-0500,1083382129,kennedyy_boyd,~KennedyyB~,,Dis this dead bitch jump down in HEELS??!,en,[],[],[],1,0,0,[],[],https://twitter.com/Kennedyy_Boyd/status/1401743260683436047,False,,0,,san diego,,,,,,[],,,,
1401740893204357125,1401739789603246085,2021-06-06 22:20:46 CDT,2021-06-06,22:20:46,-0500,251921869,huntersowards3,Hunter Sowards,,"@wins_morality Sadly yes. One fatal, in a separate one— the driver was arrested for DUI.  Here’s information from the fatality  https://t.co/EnvkuVdO6h",en,[],['https://www.kusi.com/driver-killed-in-crash-as-wrong-way-racing-vehicle-runs-red-light-in-chula-vista/'],[],1,0,1,[],[],https://twitter.com/huntersowards3/status/1401740893204357125,False,,0,,san diego,,,,,,"[{'screen_name': 'wins_morality', 'name': 'Laying in the cut like Neosporin', 'id': '1309973105729658880'}]",,,,
1401740402437214210,1401740402437214210,2021-06-06 22:18:49 CDT,2021-06-06,22:18:49,-0500,41474455,kielarobinson,Kiel Robinson 🕊,,Logan is dead tired and it’s only the 5th round 🤣🤣,en,[],[],[],0,0,2,[],[],https://twitter.com/KielARobinson/status/1401740402437214210,False,,0,,san diego,,,,,,[],,,,
1401735708662849545,1401735708662849545,2021-06-06 22:00:10 CDT,2021-06-06,22:00:10,-0500,541365110,schwackinit,meko,,Remember: Floyd can lose and his record won’t change aka fix might be in. No one will remember this fight in the “goat” conversation across time. A loss won’t hurt Floyd...,en,[],[],[],0,0,0,[],[],https://twitter.com/schwackinit/status/1401735708662849545,False,https://twitter.com/schwackinit/status/1401731304031358977,0,,san diego,,,,,,[],,,,
1401735695249510411,1401735695249510411,2021-06-06 22:00:07 CDT,2021-06-06,22:00:07,-0500,525983112,jigomez89,Jaime Gomez,,Zack steffan hurt..... fuck #USAvMEX,en,[],[],[],0,0,1,['usavmex'],[],https://twitter.com/JIGomez89/status/1401735695249510411,False,,0,,san diego,,,,,,[],,,,
1401733347290718211,1401733347290718211,2021-06-06 21:50:47 CDT,2021-06-06,21:50:47,-0500,1078047002,hideyotip,not The Milk Police,,A suicide ft. Migos,es,[],[],[],0,0,3,[],[],https://twitter.com/HideYoTip/status/1401733347290718211,False,,0,,san diego,,,,,,[],,,,
1401731453797289988,1401731453797289988,2021-06-06 21:43:16 CDT,2021-06-06,21:43:16,-0500,4197642312,nadinemarcus22,nadine,,bloody noses will be my downfall.,en,[],[],[],0,0,0,[],[],https://twitter.com/nadinemarcus22/status/1401731453797289988,False,,0,,san diego,,,,,,[],,,,
1401731054520524800,1401731054520524800,2021-06-06 21:41:40 CDT,2021-06-06,21:41:40,-0500,1083382129,kennedyy_boyd,~KennedyyB~,,Just started watching Army of the Dead..... what the fuck is going on 😂😂😂,en,[],[],[],1,0,1,[],[],https://twitter.com/Kennedyy_Boyd/status/1401731054520524800,False,,0,,san diego,,,,,,[],,,,
1401718065549643777,1401718065549643777,2021-06-06 20:50:04 CDT,2021-06-06,20:50:04,-0500,471763658,ivansanchezc90,Ivan Sanchez,,Early defensive plan for the USA is kick the ankles i see #USAvMEX,en,[],[],[],0,0,0,['usavmex'],[],https://twitter.com/IvanSanchezC90/status/1401718065549643777,False,,0,,san diego,,,,,,[],,,,
1401703679896416259,1401703679896416259,2021-06-06 19:52:54 CDT,2021-06-06,19:52:54,-0500,975206740898664448,oterr_17,Oscar,,"Don’t look now, but the Padres offense has been shit",en,[],[],[],0,0,2,[],[],https://twitter.com/oterr_17/status/1401703679896416259,False,https://twitter.com/AJCassavell/status/1401669425850322944,0,,san diego,,,,,,[],,,,
1401702486042460164,1401702486042460164,2021-06-06 19:48:09 CDT,2021-06-06,19:48:09,-0500,1033921966732926976,ksusportschris,Chris Drummond,"{'type': 'Point', 'coordinates': [32.74941778, -117.10062481]}","Taking girl home and we going to see my auntie Shannon, Kaleighs momma and kick it for a minute! Dennys was poppin! @ Denny's  https://t.co/SpFmHapfnc",en,[],['https://www.instagram.com/p/CPzKWdSjDFajtlowYBcvLn2vPNaZEvst07eMNA0/?utm_medium=twitter'],[],0,0,0,[],[],https://twitter.com/KSUsportschris/status/1401702486042460164,False,,0,,san diego,,,,,,[],,,,
1401700825831858180,1401700825831858180,2021-06-06 19:41:33 CDT,2021-06-06,19:41:33,-0500,40048224,brooklynsd,Marco Mendoza,,@ShowtimeBoxing Chad was winning until the last punch. If we kept score Chad wins. But damn bro. Lol @ChadOchocincoo respect,en,"[{'screen_name': 'chadochocincoo', 'name': 'chad ochocinco', 'id': '369751037'}]",[],[],0,0,0,[],[],https://twitter.com/brooklynsd/status/1401700825831858180,False,,0,,san diego,,,,,,[],,,,
1401689123694338048,1401689123694338048,2021-06-06 18:55:03 CDT,2021-06-06,18:55:03,-0500,461353049,catherineofmars,Sparkling Dumb Bitch Juice.,,No you psycho.   I’m bad at directions and scared of being kidnapped.,en,[],[],[],0,0,0,[],[],https://twitter.com/Catherineofmars/status/1401689123694338048,False,https://twitter.com/quarantinebee/status/1401587187443900416,0,,san diego,,,,,,[],,,,
1401685955845652482,1401683151215157251,2021-06-06 18:42:28 CDT,2021-06-06,18:42:28,-0500,29125655,stkras1,Steve Krasner,,@dennistlin Eight games is not a large enough sample size too panic or rush into a trade. Grisham has been on the IL during those 8 games and should be back in the lineup next week. With Grish and Nola the offense was very solid during the 9 -0 homestand.,en,[],[],[],1,0,2,[],[],https://twitter.com/stkras1/status/1401685955845652482,False,,0,,san diego,,,,,,"[{'screen_name': 'dennistlin', 'name': 'Dennis Lin', 'id': '96534215'}]",,,,
1401668021047894017,1401668017168154626,2021-06-06 17:31:12 CDT,2021-06-06,17:31:12,-0500,997289169742262272,savagepupper_,savagepupperlover,,@nathanfletcher calls the modern sporting rifle a weapon of war and uses his service in the Marines as a qualifier to speak of such issues when he knows that his words are hollow scare tactics designed to stoke fear in uninformed voters and betray the truth.,en,[],[],[],1,0,1,[],[],https://twitter.com/savagepupper_/status/1401668021047894017,False,,0,,san diego,,,,,,[],,,,
1401668020255166466,1401668017168154626,2021-06-06 17:31:12 CDT,2021-06-06,17:31:12,-0500,997289169742262272,savagepupper_,savagepupperlover,,"These numbers are important to our community, because one of these “issues” will be beaten to death in the media and by our leftist and completely detached overlords on the San Diego city council and the other will be a quiet afterthought.",en,[],[],[],1,0,1,[],[],https://twitter.com/savagepupper_/status/1401668020255166466,False,,0,,san diego,,,,,,[],,,,
1401667107629060098,1401667107629060098,2021-06-06 17:27:34 CDT,2021-06-06,17:27:34,-0500,391811115,mrjaycroft,JAY CR◎FT 🌴,,California is dead   don’t come here  https://t.co/w8TnOf2GzX,en,[],[],"['https://pbs.twimg.com/media/E3O4zdFVUAIMtCD.jpg', 'https://pbs.twimg.com/media/E3O4zdNUcAEv7uW.jpg', 'https://pbs.twimg.com/media/E3O4zdnUYAIxyKl.jpg', 'https://pbs.twimg.com/media/E3O4zeBVEAEWXDS.jpg']",0,0,4,[],[],https://twitter.com/MrJayCroft/status/1401667107629060098,False,https://twitter.com/TheWinston_/status/1401628123557339138,1,https://pbs.twimg.com/media/E3O4zdFVUAIMtCD.jpg,san diego,,,,,,[],,,,
1401665633142460417,1401605151727788041,2021-06-06 17:21:43 CDT,2021-06-06,17:21:43,-0500,996953143802920960,misinfoscience,Critical Misinformation Theory,,@MantleMoky @poldiscoursebot Some shitty dead economist I think idk,en,[],[],[],0,0,1,[],[],https://twitter.com/MISINFOSCIENCE/status/1401665633142460417,False,,0,,san diego,,,,,,"[{'screen_name': 'MantleMoky', 'name': 'Richard Hogie', 'id': '1397399761557336064'}, {'screen_name': 'poldiscoursebot', 'name': 'political discourse bot', 'id': '1290024049599545345'}]",,,,
1401662400395235331,1401662400395235331,2021-06-06 17:08:52 CDT,2021-06-06,17:08:52,-0500,127588417,joshaztec,Jobu Needs Another Refill,,Chris Paddack has put up a solid start today and the offense hasn’t done shit for him.,en,[],[],[],0,0,1,[],[],https://twitter.com/Joshaztec/status/1401662400395235331,False,,0,,san diego,,,,,,[],,,,
1401653601102008321,1401653601102008321,2021-06-06 16:33:54 CDT,2021-06-06,16:33:54,-0500,127588417,joshaztec,Jobu Needs Another Refill,,#padres offense  https://t.co/f5h2QVfMAT,en,[],[],['https://pbs.twimg.com/tweet_video_thumb/E3OshLWUcAAJl-9.jpg'],0,0,1,['padres'],[],https://twitter.com/Joshaztec/status/1401653601102008321,False,,1,https://pbs.twimg.com/tweet_video_thumb/E3OshLWUcAAJl-9.jpg,san diego,,,,,,[],,,,
1401634816177565697,1401629814377926661,2021-06-06 15:19:15 CDT,2021-06-06,15:19:15,-0500,1101136561167462402,thebrianasman,Brian Asman,,"@realeverywriter AMERICAN VANDAL, ASH VS EVIL DEAD, JOHN FROM CINCINNATI",en,[],[],[],0,0,2,[],[],https://twitter.com/thebrianasman/status/1401634816177565697,False,,0,,san diego,,,,,,"[{'screen_name': 'realeverywriter', 'name': 'Richard EveryWriter', 'id': '1203807212096958466'}]",,,,
1401619453415026690,1401619453415026690,2021-06-06 14:18:13 CDT,2021-06-06,14:18:13,-0500,363999767,dannysayswoof,5’6 CJ Watson,,It’s been one game omg and Embiid is hurt.,en,[],[],[],0,0,0,[],[],https://twitter.com/dannysayswoof/status/1401619453415026690,False,https://twitter.com/PointGods/status/1401611763620196355,0,,san diego,,,,,,[],,,,
1401619012048457728,1401619012048457728,2021-06-06 14:16:27 CDT,2021-06-06,14:16:27,-0500,513742993,ann_whitley,AMW,,Patio Punch at the Del Coronado Hotel is the way to go. Soaking in the sun and stunning views  #SanDiego #CoronadaIsland #DelCoronadoHotel  https://t.co/7MGSGuwbxm,en,[],[],['https://pbs.twimg.com/media/E3ONDtcUcAEEuBO.jpg'],2,0,3,"['sandiego', 'coronadaisland', 'delcoronadohotel']",[],https://twitter.com/ann_whitley/status/1401619012048457728,False,,1,https://pbs.twimg.com/media/E3ONDtcUcAEEuBO.jpg,san diego,,,,,,[],,,,
1401615746669551616,1401615743922278402,2021-06-06 14:03:29 CDT,2021-06-06,14:03:29,-0500,823825,mitchwagner,this IS my inside voice,,"“... things like poverty and inequality and death and disease and climate change and war can all be easily quantified, defined and debated in a meaningful way. ...  /3",en,[],[],[],1,0,0,[],[],https://twitter.com/MitchWagner/status/1401615746669551616,False,,0,,san diego,,,,,,[],,,,
1401613038906593283,1401613038906593283,2021-06-06 13:52:43 CDT,2021-06-06,13:52:43,-0500,3124673581,beeeccaaaaaaa,Rebecca Kincade,,"In church w a loaded weapon, can’t een trust the reverend",en,[],[],[],0,0,0,[],[],https://twitter.com/beeeccaaaaaaa/status/1401613038906593283,False,,0,,san diego,,,,,,[],,,,
1401605580498771971,1401605580498771971,2021-06-06 13:23:05 CDT,2021-06-06,13:23:05,-0500,1234717136431378432,dailyfz,Daily Football Zone,,The #Titans offense got a lot more explosive! 🔥🏈  #NFL #NFLTwitter  https://t.co/5xUbnqStYD,en,[],[],"['https://pbs.twimg.com/media/E3OA2IhVgAIlycS.jpg', 'https://pbs.twimg.com/media/E3OA2IhVcAEdAKT.jpg', 'https://pbs.twimg.com/media/E3OA2IgVgAMS4Ir.jpg', 'https://pbs.twimg.com/media/E3OA2IiVcAAGWYb.jpg']",0,2,6,"['titans', 'nfl', 'nfltwitter']",[],https://twitter.com/DailyFZ/status/1401605580498771971,False,,1,https://pbs.twimg.com/media/E3OA2IhVgAIlycS.jpg,san diego,,,,,,[],,,,
1401597716644261890,1401597716644261890,2021-06-06 12:51:50 CDT,2021-06-06,12:51:50,-0500,221563766,evilgreenrangr,BAEBEL🥊🇲🇽,,"This motherfucker is talking his ass off to me and i’ve said ""that’s crazy"" already 18220305858210 times. I might punch him soon if he doesn’t stop.",en,[],[],[],0,0,5,[],[],https://twitter.com/EvilGreenRangr/status/1401597716644261890,False,,0,,san diego,,,,,,[],,,,
1401592836621930503,1401592836621930503,2021-06-06 12:32:27 CDT,2021-06-06,12:32:27,-0500,1466431232,jennyfrmdabl0cc,JENNY FROM DA BLOCC,,They want to see me make the wrong but I fuck around and bite the bullet bitch,en,[],[],[],0,0,0,[],[],https://twitter.com/jennyfrmdabl0cc/status/1401592836621930503,False,,0,,san diego,,,,,,[],,,,
1401591987468308481,1401591987468308481,2021-06-06 12:29:04 CDT,2021-06-06,12:29:04,-0500,419063106,obey_little,Sebastian Gorka Izagirre🏴☭🚩,,Six years ago today I was lamenting with @BikeSD the death of the Washington/University Uptown bike plan. What I had forgotten was how disappointed with/mad at we were with Todd Gloria.,en,"[{'screen_name': 'bikesd', 'name': 'bikesd', 'id': '67447369'}]",[],[],0,0,2,[],[],https://twitter.com/obey_little/status/1401591987468308481,False,,0,,san diego,,,,,,[],,,,
1401591840571215872,1401591324281819136,2021-06-06 12:28:29 CDT,2021-06-06,12:28:29,-0500,830230512249606144,_coachsiegel,Alex Siegel,,@danarestia I think you see the Dogs holding their slides when he dodges and force him to be a scorer.,en,[],[],[],1,0,1,[],[],https://twitter.com/_coachsiegel/status/1401591840571215872,False,,0,,san diego,,,,,,"[{'screen_name': 'danarestia', 'name': 'Dan Arestia', 'id': '66823384'}]",,,,
1401582522400526341,1401348774027538441,2021-06-06 11:51:28 CDT,2021-06-06,11:51:28,-0500,878349315235819520,saintkhoi,pls booker just win.,,@lilm0chi_ I smell abuse,en,[],[],[],0,0,1,[],[],https://twitter.com/saintkhoi/status/1401582522400526341,False,,0,,san diego,,,,,,"[{'screen_name': 'lilm0chi_', 'name': 'z🦂', 'id': '3172892672'}]",,,,
1401579892131520515,1401579892131520515,2021-06-06 11:41:01 CDT,2021-06-06,11:41:01,-0500,366189323,ealvareznews,ELIZABETH ALVAREZ,,-Memorial grows at PD headquarters for 2 married officers killed in a wrong-way crash; a candlelight vigil today at 4thof July Park in Escondido the city where they lived -CA longtime ban on assault weapons being overturned  -Prince Harry and Meghan Markle announce birth of baby  https://t.co/hzF0uKnyIp,en,[],[],['https://pbs.twimg.com/media/E3Npe5UVkAEINuQ.jpg'],0,1,6,[],[],https://twitter.com/ealvareznews/status/1401579892131520515,False,,1,https://pbs.twimg.com/media/E3Npe5UVkAEINuQ.jpg,san diego,,,,,,[],,,,
1401567489822138375,1401563089489780736,2021-06-06 10:51:44 CDT,2021-06-06,10:51:44,-0500,52811999,alyssajsalter,Alyssa Salter,,@BlondeHistorian I was watching Shazam last night and they had one of the kids play a crutch user but he is fully able bodied. It was so upsetting. And he was the victim of a hate crime due to his disability. I was furious.,en,[],[],[],0,0,10,[],[],https://twitter.com/AlyssaJSalter/status/1401567489822138375,False,,0,,san diego,,,,,,"[{'screen_name': 'BlondeHistorian', 'name': 'Dr Amy Kavanagh', 'id': '351094548'}]",,,,
1401560912083832832,1401560912083832832,2021-06-06 10:25:35 CDT,2021-06-06,10:25:35,-0500,752515688468590592,poorlivesmatt3r,PoorLivesMatt3r,,"@FreeShitPB please read...then retweet, vote don't count, but interest, and KNOWLEDGEABLE constituents DO #YesWEcanSD #IfWEwillSD #StanUpSD #SpeakOutSD don't be lame🦆'd out of power @LuckyDuckFound ABUSE power push DT&amp; beyond ..ass🤑ciated w/ @SDPartnership=BIZ abuse via taxes!!  https://t.co/9zNhZFGZPB",en,"[{'screen_name': 'luckyduckfound', 'name': 'lucky duck foundation', 'id': '111093219'}, {'screen_name': 'sdpartnership', 'name': 'downtown san diego', 'id': '362197703'}]",[],"['https://pbs.twimg.com/media/E3NYLQCVEAUff2K.jpg', 'https://pbs.twimg.com/media/E3NYMVZVoAYbpF8.jpg', 'https://pbs.twimg.com/media/E3NYNPAVoAArEHV.jpg', 'https://pbs.twimg.com/media/E3NYOLcVkAA6_Bf.jpg']",0,0,0,"['yeswecansd', 'ifwewillsd', 'stanupsd', 'speakoutsd']",[],https://twitter.com/PoorLivesMatt3r/status/1401560912083832832,False,https://twitter.com/PoorLivesMatt3r/status/1398978147500974080,1,https://pbs.twimg.com/media/E3NYLQCVEAUff2K.jpg,san diego,,,,,,[],,,,
