id,conversation_id,created_at,date,time,timezone,user_id,username,name,place,tweet,language,mentions,urls,photos,replies_count,retweets_count,likes_count,hashtags,cashtags,link,retweet,quote_url,video,thumbnail,near,geo,source,user_rt_id,user_rt,retweet_id,reply_to,retweet_date,translate,trans_src,trans_dest
1447369300419952642,1447369300419952642,2021-10-10 20:11:46 CDT,2021-10-10,20:11:46,-0500,1110359805703741441,sincityho,𝕊𝕚𝕟 𝔸𝕗𝕥𝕖𝕣 𝔻𝕒𝕣𝕜,,This the worse panic attack I’ve had in a while,en,[],[],[],0,0,0,[],[],https://twitter.com/sincityho/status/1447369300419952642,False,,0,,dallas,,,,,,[],,,,
1447368092078772224,1447368092078772224,2021-10-10 20:06:58 CDT,2021-10-10,20:06:58,-0500,853963909,sixsixsixtos,$ I X T O $,,"squid game oak cliff version but for the last game you gotta stop basing your personality off which gun you own, for 5 minutes",en,[],[],[],0,0,1,[],[],https://twitter.com/SixSixSixtos/status/1447368092078772224,False,,0,,dallas,,,,,,[],,,,
1447366158290722818,1447366158290722818,2021-10-10 19:59:17 CDT,2021-10-10,19:59:17,-0500,231976309,kingmoniibanks,Tony Bravo Snoww❄️❄️,,Ashley inserted her self for no reason n Candiace business so she can’t keep playing victim #RHOP  https://t.co/ZB9q4EUTtf,en,[],[],['https://pbs.twimg.com/tweet_video_thumb/FBYT2MjXIAQN0tn.jpg'],0,0,5,['rhop'],[],https://twitter.com/kingmoniibanks/status/1447366158290722818,False,,1,https://pbs.twimg.com/tweet_video_thumb/FBYT2MjXIAQN0tn.jpg,dallas,,,,,,[],,,,
1447364220908097536,1447364220908097536,2021-10-10 19:51:35 CDT,2021-10-10,19:51:35,-0500,333254122,dahighlight20,Coach De'Lano,,@Spencthegoat kicked off the 2021-22 Season with a very solid performance. 22 point on 8 for 17 shooting with 7 rebounds @Eastfieldsports @SWOSUHoops @LittleRockMBB @LamarMBB @SFA_MBB @UAPBMBB @AStateMB  https://t.co/fwIShlCwv4,en,"[{'screen_name': 'eastfieldsports', 'name': 'dallas college eastfield athletics', 'id': '1162190072919339009'}, {'screen_name': 'swosuhoops', 'name': 'swosu hoops', 'id': '360936120'}, {'screen_name': 'littlerockmbb', 'name': 'little rock basketball', 'id': '1914200730'}, {'screen_name': 'lamarmbb', 'name': ""lamar men's hoops"", 'id': '2508096398'}, {'screen_name': 'sfa_mbb', 'name': 'sfa men’s basketball', 'id': '784792262'}, {'screen_name': 'uapbmbb', 'name': 'uapb men’s basketball', 'id': '910230859185311744'}, {'screen_name': 'astatemb', 'name': 'astatemb', 'id': '2740407250'}]",[],['https://pbs.twimg.com/media/FBYSFUWWEAEcdVP.jpg'],3,12,37,[],[],https://twitter.com/dahighlight20/status/1447364220908097536,False,,1,https://pbs.twimg.com/media/FBYSFUWWEAEcdVP.jpg,dallas,,,,,,[],,,,
1447362983563235331,1447362983563235331,2021-10-10 19:46:40 CDT,2021-10-10,19:46:40,-0500,557190047,quitmanstephens,Q Stephens (#UncleQ) 🇺🇦🇺🇸,,"Not getting vaccinated is a dumb hill to die on.  But as devoted adherents of #FoxNews and #OAN continue to prove: you can’t fix stupid.  700,000 deaths aren’t enough for them to see the danger is real.   Maybe they’ll realize they’ve been punked when they end up on a ventilator.",en,[],[],[],0,0,1,"['foxnews', 'oan']",[],https://twitter.com/QuitmanStephens/status/1447362983563235331,False,,0,,dallas,,,,,,[],,,,
1447362945667698695,1447082507346878466,2021-10-10 19:46:31 CDT,2021-10-10,19:46:31,-0500,982018656354922497,live_brice,Brice Live Sketch Co,,@tribelaw Arrest  https://t.co/AtKlmQ4Lcw,en,[],[],['https://pbs.twimg.com/tweet_video_thumb/FBYQ7NyXEAEm_qg.jpg'],0,0,0,[],[],https://twitter.com/live_brice/status/1447362945667698695,False,,1,https://pbs.twimg.com/tweet_video_thumb/FBYQ7NyXEAEm_qg.jpg,dallas,,,,,,"[{'screen_name': 'tribelaw', 'name': 'Laurence Tribe', 'id': '4091551984'}]",,,,
1447354431314534401,1447347193325699072,2021-10-10 19:12:41 CDT,2021-10-10,19:12:41,-0500,27309566,sonnysscroll,Sonny Tejeda,,"@TherealCANDIACE Girl… here you go playing victim, with that folded napkin and dry ass hair!",en,[],[],[],0,0,9,[],[],https://twitter.com/SonnysScroll/status/1447354431314534401,False,,0,,dallas,,,,,,"[{'screen_name': 'TherealCANDIACE', 'name': 'CANDIACE', 'id': '34737115'}]",,,,
1447348574430404613,1447279650753892363,2021-10-10 18:49:25 CDT,2021-10-10,18:49:25,-0500,38366213,emlandis1,champlain🍾,,@Rissa1412 BRUH I got Mixon AND Barkley injured. What the actual fuck do I do next week?! My back ups ain’t doin shit so far 😭,en,[],[],[],0,0,1,[],[],https://twitter.com/Emlandis1/status/1447348574430404613,False,,0,,dallas,,,,,,"[{'screen_name': 'Rissa1412', 'name': 'Mcnah🌈', 'id': '351441327'}]",,,,
1447338767552061442,1263699288116408326,2021-10-10 18:10:27 CDT,2021-10-10,18:10:27,-0500,1398764129171783681,larrykuchenmei5,United States Diplomat Larry Kuchenmeister,,@LarryKuchenmei4 YOU ARE AN IDENTITY THEIF OF A UNITED STATES DIPLOMAT WITH IMMUNITY AND AMNESTY THEIR FOR YOU WILL BE CHARGED WITH MURDER FOR ALL UNSOLVED MURDERS IN YOUR AREA MY AMNESTY WILL PUT YOU IN THE ELECTRIC CHAIR FOR THE THEFT A UNITED STATES DIPLOMAT YOU ARE NOT LARRY KUCHENMEISTER  https://t.co/pglaot6PKG,en,[],[],[],0,0,0,[],[],https://twitter.com/LarryKuchenmei5/status/1447338767552061442,False,,1,https://pbs.twimg.com/ext_tw_video_thumb/1447338678083280899/pu/img/0S4i8ELiDgUFYzQ8.jpg,dallas,,,,,,"[{'screen_name': 'LarryKuchenmei4', 'name': 'Larry Kuchenmeister', 'id': '1263193402050568192'}]",,,,
1447337304452894721,1447337304452894721,2021-10-10 18:04:38 CDT,2021-10-10,18:04:38,-0500,96428187,ohthatsat,A.T. The Ambassador | Good Culture,,Just letting it be known now: It's not the Cowboys fault that the Giants had players get injured. But we woulda won regardless.,en,[],[],[],1,7,17,[],[],https://twitter.com/OhThatsAT/status/1447337304452894721,False,,0,,dallas,,,,,,[],,,,
1447332842908889091,1447332842908889091,2021-10-10 17:46:54 CDT,2021-10-10,17:46:54,-0500,2742941960,pastordmack,Dwight McKissic,,"“Dumboriss Smith has lips the size of Michelin tires”-Jon Gruden. He was referring to an AA named DeMaurice Smith,Ex Dir of NFLPA. I’m more offended by the “Dumboriss”reference than his lip size. Gruden’s statement is racist, even if he’s not. Players shouldn’t have 2 play 4 him!",en,[],[],[],2,1,34,[],[],https://twitter.com/pastordmack/status/1447332842908889091,False,,0,,dallas,,,,,,[],,,,
1447332677204553733,1447332677204553733,2021-10-10 17:46:15 CDT,2021-10-10,17:46:15,-0500,816709246024716292,jodibeth21,jOdï 👆🏼,,I need this game to end before I have heart attack #bears,en,[],[],[],1,0,6,['bears'],[],https://twitter.com/jodibeth21/status/1447332677204553733,False,,0,,dallas,,,,,,[],,,,
1447330025729101827,1447309941291761664,2021-10-10 17:35:42 CDT,2021-10-10,17:35:42,-0500,243569949,texaslegalguy,Nathan Schwartz,,"@BLUGRN12THMAN @CarolAlmero1 Not exactly true. They can refer the case to the US Attorney for DC. The US Attorney must present the car to the grand jury. If the grand jury indicts, it would be hard for DOJ not to prosecute. Congress can also bring a civil action or have the Sgt At Arms arrest the miscreant.",en,[],[],[],0,0,1,[],[],https://twitter.com/TexasLegalGuy/status/1447330025729101827,False,,0,,dallas,,,,,,"[{'screen_name': 'BLUGRN12THMAN', 'name': 'Liberty*And*Justice*For*All', 'id': '35404871'}, {'screen_name': 'CarolAlmero1', 'name': 'Carol Almero', 'id': '822856475965915136'}]",,,,
