id,conversation_id,created_at,date,time,timezone,user_id,username,name,place,tweet,language,mentions,urls,photos,replies_count,retweets_count,likes_count,hashtags,cashtags,link,retweet,quote_url,video,thumbnail,near,geo,source,user_rt_id,user_rt,retweet_id,reply_to,retweet_date,translate,trans_src,trans_dest
1458945900814897155,1458945900814897155,2021-11-11 17:53:03 CST,2021-11-11,17:53:03,-0500,18974563,aarontyson,Aaron Tyson,"{'type': 'Point', 'coordinates': [33.4482, -112.0777]}","Maybe someday we could become friends. Friends who ride majestic, translucent steeds, shooting flaming arrows across the bridge of Hemdale @ Phoenix, Arizona  https://t.co/tc0WuXYLkK",en,[],['https://www.instagram.com/p/CWJ5pGoPrKgXPwwJg6q9wlP04PlEnueJvjnDCE0/?utm_medium=twitter'],[],0,0,0,[],[],https://twitter.com/aarontyson/status/1458945900814897155,False,,0,,phoenix,,,,,,[],,,,
1458941542857510912,1458506733668782081,2021-11-11 17:35:44 CST,2021-11-11,17:35:44,-0500,432121461,daveedwards30,Dave Edwards,,"@PamKeithFL You racism towards white people gets more visceral everyday Pam. How does it feel to be openly racist for the world to see? You act like black people don’t own AR-15s. Please, educate yourself, people of all colors own AR-15s. Owning a gun isn’t a “white people” thing ffs.",en,[],[],[],0,0,0,[],[],https://twitter.com/DaveEdwards30/status/1458941542857510912,False,,0,,phoenix,,,,,,"[{'screen_name': 'PamKeithFL', 'name': 'Pam Keith, Esq.', 'id': '2966770391'}]",,,,
1458938230636572688,1458937135776481280,2021-11-11 17:22:34 CST,2021-11-11,17:22:34,-0500,344997428,debramoge,Debra Moge,,@TheBlooch It’s horrible. He would date single mothers and rape their young sons. He got caught 5 times!!,en,[],[],[],1,2,2,[],[],https://twitter.com/DebraMoge/status/1458938230636572688,False,,0,,phoenix,,,,,,"[{'screen_name': 'TheBlooch', 'name': 'The Blooch', 'id': '315872795'}]",,,,
1458934252385431552,1458932861554233344,2021-11-11 17:06:46 CST,2021-11-11,17:06:46,-0500,2652986352,skywlkr_luked,forgetter of things 🏴,,"there is no ""better than nothing"" approach. advocating state solutions does nothing but channel community power into the state. we can mitigate state harm by direct action and horizontal mutual aid, and we can attack the state at every opportunity. don't give them an inch.",en,[],[],[],1,1,2,[],[],https://twitter.com/skywlkr_luked/status/1458934252385431552,False,,0,,phoenix,,,,,,[],,,,
1458932862833422362,1458932861554233344,2021-11-11 17:01:14 CST,2021-11-11,17:01:14,-0500,2652986352,skywlkr_luked,forgetter of things 🏴,,"the state will never solve anything. the state cannot provide solutions for the harm it inflicts. systemic does not mean ""the justice system"" it means everything. systemic oppression requires systemic abolition. that means total. reform isn't a stepping stone, it's pro-state.",en,[],[],[],1,1,3,[],[],https://twitter.com/skywlkr_luked/status/1458932862833422362,False,,0,,phoenix,,,,,,[],,,,
1458932526030876673,1458932526030876673,2021-11-11 16:59:54 CST,2021-11-11,16:59:54,-0500,1083212665160253440,owenmparker,Owen Michael Parker,,"It is a sad state of affairs when the judge says the jury was selected with a racist bias and then the defense says they don't want any more black pastors in the courtroom, especially seeing as racism was the clear motive for murder in this trial. #AhmaudArberyTrial",en,[],[],[],1,0,1,['ahmaudarberytrial'],[],https://twitter.com/owenmparker/status/1458932526030876673,False,,0,,phoenix,,,,,,[],,,,
1458930547099463680,1458909467748220931,2021-11-11 16:52:02 CST,2021-11-11,16:52:02,-0500,501336243,jrxixaz,Jose Garcia,,@PGutierrezESPN Please find a better way to tweet your information! You almost gave me a heart attack! I can’t take another another loss! #RaiderNation,en,[],[],[],1,0,15,['raidernation'],[],https://twitter.com/jrxixaz/status/1458930547099463680,False,,0,,phoenix,,,,,,"[{'screen_name': 'PGutierrezESPN', 'name': 'Paul Gutierrez', 'id': '47871775'}]",,,,
1458930529768644609,1458930529768644609,2021-11-11 16:51:58 CST,2021-11-11,16:51:58,-0500,739610405266292736,brigee_24,Brianna ☾ *:･ﾟ✧,,nothing makes me wanna commit murder faster than a mf who almost hits me then acts like the victim,en,[],[],[],0,0,4,[],[],https://twitter.com/brigee_24/status/1458930529768644609,False,,0,,phoenix,,,,,,[],,,,
1458928634471673858,1458928634471673858,2021-11-11 16:44:26 CST,2021-11-11,16:44:26,-0500,1157474628,threat_lvl_mdnt,x - clinched,,This bull shit 🤣🤣🤣 its hopeless,en,[],[],[],0,0,0,[],[],https://twitter.com/threat_lvl_mdnt/status/1458928634471673858,False,https://twitter.com/iamdamonallred/status/1458923200067223590,0,,phoenix,,,,,,[],,,,
1458916123282325523,1458916123282325523,2021-11-11 15:54:43 CST,2021-11-11,15:54:43,-0500,344997428,debramoge,Debra Moge,,I have an idea. Why don’t we arrest them if they do riot?,en,[],[],[],2,1,7,[],[],https://twitter.com/DebraMoge/status/1458916123282325523,False,https://twitter.com/charliekirk11/status/1458893506726948884,0,,phoenix,,,,,,[],,,,
1458912120641241100,1458910910802759680,2021-11-11 15:38:49 CST,2021-11-11,15:38:49,-0500,2322988729,ncsweetest,¿unknown¿,,@ChanleyCourtTV @CourtTV Why isn't the car lot owner not being prosecuted for hiring a underage person having a weapon that he's not legally to use,en,[],[],[],1,0,2,[],[],https://twitter.com/ncsweetest/status/1458912120641241100,False,,0,,phoenix,,,,,,"[{'screen_name': 'ChanleyCourtTV', 'name': 'Chanley Shá Painter', 'id': '4730732546'}, {'screen_name': 'CourtTV', 'name': 'Court TV', 'id': '1031946753510203392'}]",,,,
1458911652984733709,1458911652984733709,2021-11-11 15:36:57 CST,2021-11-11,15:36:57,-0500,1179335138343153664,lucasmattson2,lucas,,Only time I ever feel unbridled rage is when a new call of duty comes out and I just suck,en,[],[],[],0,0,4,[],[],https://twitter.com/LucasMattson2/status/1458911652984733709,False,,0,,phoenix,,,,,,[],,,,
1458908080725377025,1458908080725377025,2021-11-11 15:22:46 CST,2021-11-11,15:22:46,-0500,1428786561705906179,robertl13791327,Robert Langley,,"BLM has threatened NYC with ""riots and bloodshed"" if the police anti crime units are reinstated. I say, if they want war, give them war. This time take the gloves off.  https://t.co/FOU9CPLDwQ",en,[],[],['https://pbs.twimg.com/media/FD8VKwvVQA0bMds.jpg'],0,0,1,[],[],https://twitter.com/RobertL13791327/status/1458908080725377025,False,,1,https://pbs.twimg.com/media/FD8VKwvVQA0bMds.jpg,phoenix,,,,,,[],,,,
1458907649525698562,1458907649525698562,2021-11-11 15:21:03 CST,2021-11-11,15:21:03,-0500,137476484,aquariusinaz,AquariusinAZ,,"😭😭😭  Astroworld victim Bharti Shahani has died, bringing the death toll to 9   https://t.co/ZalgVAAyxp",en,[],['https://www.cnn.com/2021/11/11/us/travis-scott-concert-houston-thursday/index.html'],[],1,0,2,[],[],https://twitter.com/AquariusinAZ/status/1458907649525698562,False,,0,,phoenix,,,,,,[],,,,
1458906264226783236,1458905743743234054,2021-11-11 15:15:33 CST,2021-11-11,15:15:33,-0500,2322988729,ncsweetest,¿unknown¿,,@HarleyHoney91 To much yelling to understand what is going on. But Glock is definitely a racist,en,[],[],[],1,0,0,[],[],https://twitter.com/ncsweetest/status/1458906264226783236,False,,0,,phoenix,,,,,,"[{'screen_name': 'HarleyHoney91', 'name': 'HarleyHoney ✨', 'id': '1349516547304415237'}]",,,,
1458903365379772416,1458903365379772416,2021-11-11 15:04:02 CST,2021-11-11,15:04:02,-0500,1639547144,asu_sdasa,Sun Devils Against Sexual Assault,,SDASA is anonymously surveying current and former students on ASU's sexual violence prevention program.   Take and share the survey:  https://t.co/Rfd2OMB4M8  https://t.co/mpii76JZRv,en,[],['http://tinyurl.com/ASUSVPSurvey'],['https://pbs.twimg.com/media/FD8Q4OzVEAQvGp4.jpg'],0,0,1,[],[],https://twitter.com/asu_sdasa/status/1458903365379772416,False,,1,https://pbs.twimg.com/media/FD8Q4OzVEAQvGp4.jpg,phoenix,,,,,,[],,,,
1458894020655017992,1458894020655017992,2021-11-11 14:26:54 CST,2021-11-11,14:26:54,-0500,14590607,bkadams,Dr. B. K. Adams,,"‘Murder was the case and they blamed me’: Barnabe Barnes, John Ford, John Webster",en,[],[],[],1,0,18,[],[],https://twitter.com/bkadams/status/1458894020655017992,False,https://twitter.com/lauraingalli/status/1458568158206365702,0,,phoenix,,,,,,[],,,,
1458881808968282126,1458618693278121987,2021-11-11 13:38:22 CST,2021-11-11,13:38:22,-0500,917483373085392896,natebrownnews,Nathan Brown,,"@_alex_joshua I went to a bar in rural Idaho once that had pro-union and anti-right to work stickers on the wall from the '80s, next to a couple of newer ones making racist jokes about Obama.",en,[],[],[],1,0,3,[],[],https://twitter.com/NateBrownNews/status/1458881808968282126,False,,0,,phoenix,,,,,,"[{'screen_name': '_alex_joshua', 'name': 'Alex 🇺🇦', 'id': '921116757510754304'}]",,,,
1458878841959579649,1458878504359976962,2021-11-11 13:26:35 CST,2021-11-11,13:26:35,-0500,1179335138343153664,lucasmattson2,lucas,,I almost became the violent homophobic man,en,[],[],[],0,0,3,[],[],https://twitter.com/LucasMattson2/status/1458878841959579649,False,,0,,phoenix,,,,,,[],,,,
