id,conversation_id,created_at,date,time,timezone,user_id,username,name,place,tweet,language,mentions,urls,photos,replies_count,retweets_count,likes_count,hashtags,cashtags,link,retweet,quote_url,video,thumbnail,near,geo,source,user_rt_id,user_rt,retweet_id,reply_to,retweet_date,translate,trans_src,trans_dest
1447713284241739778,1447713284241739778,2021-10-11 18:58:38 CDT,2021-10-11,18:58:38,-0500,1045355066138513408,tajbutterworth,Dr. Bandage Face Butterworth,,"I could never murder anyone. I'd forget to turn off my Google map information, and the cops would just have to look at my timeline to see every place I went.",en,[],[],[],1,0,0,[],[],https://twitter.com/TajButterworth/status/1447713284241739778,False,,0,,dallas,,,,,,[],,,,
1447702531682054151,1447702531682054151,2021-10-11 18:15:55 CDT,2021-10-11,18:15:55,-0500,217980908,bausanova,Davis,,"In Texas you can be fired for virtually any reason. In fact, there’s no state law on the books banning anti-LGBT discrimination in employment. The only protected class in our state is the voter base of the GOP - evangelical, anti-science idiots - and they’re a danger to us all.",en,[],[],[],0,0,4,[],[],https://twitter.com/bausanova/status/1447702531682054151,False,https://twitter.com/stevanzetti/status/1447694620918534147,0,,dallas,,,,,,[],,,,
1447699569144475652,1447690393752117249,2021-10-11 18:04:08 CDT,2021-10-11,18:04:08,-0500,33189500,ruthellaowens,RUTH ELLA OWENS,,"@KarenHo28373490 @NBCNews 💯💯💯💯💔💔💔💔  They had been working toward this moment since their ancestors lost the Civil War. It took more than Trump to bring a out this attack. Those prosecuted are receiving very light sentences, if any. They will do it again.",en,[],[],[],0,0,0,[],[],https://twitter.com/ruthellaowens/status/1447699569144475652,False,,0,,dallas,,,,,,"[{'screen_name': 'NBCNews', 'name': 'NBC News', 'id': '14173315'}]",,,,
1447687619605766152,1447687619605766152,2021-10-11 17:16:39 CDT,2021-10-11,17:16:39,-0500,797076778032463874,iamangela1967,Angela Sumner Hopkins,,"Where are the kids truly safe?  With all the killings and social-trauma, another major incident of those up high turning ears to the cries?  🙏🏽  Indian Health Service Managers Protected a Pedophile in Their Midst. Now the U.S. Agency Is Protecting Them.  https://t.co/sdGxMjaY9q",en,[],['https://www.wsj.com/articles/indian-health-service-managers-protected-a-pedophile-in-their-midst-now-the-u-s-agency-is-protecting-them-11633987505'],[],0,0,1,[],[],https://twitter.com/iamangela1967/status/1447687619605766152,False,,0,,dallas,,,,,,[],,,,
1447683288429178883,1447683288429178883,2021-10-11 16:59:27 CDT,2021-10-11,16:59:27,-0500,106550973,arilrale,LBMC🧁📚✈️,,"So Instagram brought back chronological order, so they could attack your timeline with accounts you don’t follow?!?!",en,[],[],[],0,0,0,[],[],https://twitter.com/ArilRale/status/1447683288429178883,False,,0,,dallas,,,,,,[],,,,
1447680639189274628,1447661756013285381,2021-10-11 16:48:55 CDT,2021-10-11,16:48:55,-0500,3077692207,witchingheure,McKayla Rosser,,@scumbelievable @thechairness It's so awful! Rape Me is already a poignant piece of art about sexual assault. She didn't need to cram a shitty song into it to highlight that rape is bad.,en,[],[],[],0,0,7,[],[],https://twitter.com/witchingheure/status/1447680639189274628,False,,0,,dallas,,,,,,"[{'screen_name': 'scumbelievable', 'name': 'Gretchen Felker-Martin', 'id': '294981115'}, {'screen_name': 'thechairness', 'name': 'Tara Rose Red 👻', 'id': '624884162'}]",,,,
1447667670413979654,1447667670413979654,2021-10-11 15:57:23 CDT,2021-10-11,15:57:23,-0500,63372201,_ellimac__,Camille Denise ⚖️,,Actually I'm go an say Obama. When I went to shake his hand I tripped and secret service was ready to end me. 😩. Guess they thought I was a threat. But Obama just put his hand out to steady me. So yeah I appreciate not getting the Ashli Babbitt treatment,en,[],[],[],0,0,0,[],[],https://twitter.com/_Ellimac__/status/1447667670413979654,False,https://twitter.com/_mothers__/status/1447625833200422925,0,,dallas,,,,,,[],,,,
1447659383027027972,1447659383027027972,2021-10-11 15:24:27 CDT,2021-10-11,15:24:27,-0500,3178729561,abixhinojosa,Abi 🍒⛓🔪,,"Hate being self aware, I wanna go back to being violent and delusional!!",en,[],[],[],1,0,6,[],[],https://twitter.com/abixhinojosa/status/1447659383027027972,False,,0,,dallas,,,,,,[],,,,
1447651995523948552,1447651995523948552,2021-10-11 14:55:06 CDT,2021-10-11,14:55:06,-0500,34348670,martylreid,Marty L Reid,,Greg Abbott’s appointees unanimously recommend he pardon George Floyd for a crime the deceased individual pled guilty to over a decade ago! #fireabbott,en,[],[],[],0,0,0,['fireabbott'],[],https://twitter.com/MartyLReid/status/1447651995523948552,False,,0,,dallas,,,,,,[],,,,
1447644039872929795,1447641417254379524,2021-10-11 14:23:29 CDT,2021-10-11,14:23:29,-0500,1350794357524340736,mikoybass,Mark,,@MerrittForTexas I follow @ndncollective as a resource and community to support. In the summer of 2020 when President Trump spoke in the Black Hills they held a pretty effective protest that delayed the president speech.,en,"[{'screen_name': 'ndncollective', 'name': 'ndn collective', 'id': '878789583273578500'}]",[],[],0,0,1,[],[],https://twitter.com/MikoyBass/status/1447644039872929795,False,,0,,dallas,,,,,,"[{'screen_name': 'MerrittForTexas', 'name': 'Lee Merritt', 'id': '1415386915'}]",,,,
1447638124016934920,1447638124016934920,2021-10-11 13:59:59 CDT,2021-10-11,13:59:59,-0500,347298109,mahonri12,Mo Mendoza,,Timo Werner will lead the attack today vs Macedonia. If Germany wins today they have a huge automatic chance to qualify to the World Cup.  📸: @DFB_Team_EN  https://t.co/J0l4JXDBXt,en,"[{'screen_name': 'dfb_team_en', 'name': 'germany', 'id': '2350218440'}]",[],['https://pbs.twimg.com/media/FBcLMrAXEAUFfbD.jpg'],1,0,1,[],[],https://twitter.com/mahonri12/status/1447638124016934920,False,,1,https://pbs.twimg.com/media/FBcLMrAXEAUFfbD.jpg,dallas,,,,,,[],,,,
1447634644753584129,1447634644753584129,2021-10-11 13:46:09 CDT,2021-10-11,13:46:09,-0500,920203649610952704,andruxflux,AndruxFlux,,"Honestly... My favorite part of MMOs is the MASSIVE part. If I wanna go back and do old content to get an old weapon or armor set for ornaments or just for nostalgia sake, I wanna be able to do that!",en,[],[],[],0,0,2,[],[],https://twitter.com/AndruxFlux/status/1447634644753584129,False,https://twitter.com/cinemamotionss/status/1447587377275457538,0,,dallas,,,,,,[],,,,
1447621104919580675,1447621104919580675,2021-10-11 12:52:21 CDT,2021-10-11,12:52:21,-0500,100507316,hoeitsrocuervo,$w@g God 🙏🏽,,He ain’t lying because anytime Black people unify we are seen as a threat .,en,[],[],[],0,0,1,[],[],https://twitter.com/HoeItsRoCuervo/status/1447621104919580675,False,https://twitter.com/USATODAY/status/1447336077736529920,0,,dallas,,,,,,[],,,,
1447619893562576901,1447619553639505929,2021-10-11 12:47:32 CDT,2021-10-11,12:47:32,-0500,583926188,t_bucholtz,Tommy Bucholtz,,@kingcurtis27 Wtf was he thinking? I mean I’ll take it but that was brutal,en,[],[],[],1,0,0,[],[],https://twitter.com/t_bucholtz/status/1447619893562576901,False,,0,,dallas,,,,,,"[{'screen_name': 'kingcurtis27', 'name': 'Andrew Stewart', 'id': '1652098063'}]",,,,
1447618386758881283,1447612959455387650,2021-10-11 12:41:33 CDT,2021-10-11,12:41:33,-0500,19535908,metrikk,Kris Krysknife,,"@bannedfromu @MattWalshBlog @ShawnQuinn83 Have you watched the whinefest on MAGAA media?  It's non stop victim hood 😂 apparently Socialists are indoctrinating kids, cancelling thought leaders, mounting a war on Christmas while partners in oppression censor right-wingers &amp; caravans of invaders being disease &amp; steal jobs",en,[],[],[],2,0,0,[],[],https://twitter.com/metrikk/status/1447618386758881283,False,,0,,dallas,,,,,,"[{'screen_name': 'bannedfromu', 'name': 'BannedFromU', 'id': '1433826143409479690'}, {'screen_name': 'MattWalshBlog', 'name': 'Matt Walsh', 'id': '1500129642'}, {'screen_name': 'ShawnQuinn83', 'name': '✨Shawn Quinn✨', 'id': '781869059805745152'}]",,,,
1447611310368305160,1447611310368305160,2021-10-11 12:13:26 CDT,2021-10-11,12:13:26,-0500,2989290751,yeehawdrunk,that yeehaw b*tch 🔜 Beyond SoCal,,I know you all saw how this man threw down in Los Angeles over the weekend. Dallas get ready to rage 😈  Get your tickets ASAP these are GOING TO SELL OUT ❤️‍🔥❤️‍🔥   Click 👉  https://t.co/WCOvW0S59l  https://t.co/cR1UoTQLob,en,[],['http://FullGrindTexas.com'],['https://pbs.twimg.com/media/FBbyzGNWYAkrtMq.jpg'],1,2,5,[],[],https://twitter.com/yeehawdrunk/status/1447611310368305160,False,,1,https://pbs.twimg.com/media/FBbyzGNWYAkrtMq.jpg,dallas,,,,,,[],,,,
1447611218458468354,1447611218458468354,2021-10-11 12:13:04 CDT,2021-10-11,12:13:04,-0500,283087536,claytonneville,Clayton Neville,,.@DPDChiefGarcia sets goal to lower domestic violence trends. DPD committs to reviewing all recommendations from task force. Chief says Comprehensive response is necessary.   @WBAP247NEWS @570KLIF  https://t.co/i2cVYjCuBR,en,"[{'screen_name': 'dpdchiefgarcia', 'name': 'eddie garcia', 'id': '1345454056505044993'}, {'screen_name': 'wbap247news', 'name': 'wbap 24/7 news', 'id': '29975548'}, {'screen_name': '570klif', 'name': 'klif', 'id': '23074218'}]",[],['https://pbs.twimg.com/media/FBbyuk7X0AQRfa8.jpg'],0,2,0,[],[],https://twitter.com/ClaytonNeville/status/1447611218458468354,False,,1,https://pbs.twimg.com/media/FBbyuk7X0AQRfa8.jpg,dallas,,,,,,[],,,,
1447609609850691586,1447609609850691586,2021-10-11 12:06:40 CDT,2021-10-11,12:06:40,-0500,20294324,slavbritt,Brittany S,,"Argument over Alabama, Texas A&amp;M game led to fatal shooting - ABC News via @ABC -  https://t.co/ZVwUFnzmtV",en,"[{'screen_name': 'abc', 'name': 'abc news', 'id': '28785486'}]",['https://abcn.ws/3lrVifs'],[],0,0,0,[],[],https://twitter.com/SlavBritt/status/1447609609850691586,False,,0,,dallas,,,,,,[],,,,
1447609338827247616,1447609338827247616,2021-10-11 12:05:36 CDT,2021-10-11,12:05:36,-0500,283087536,claytonneville,Clayton Neville,,".@DallasMayor and @DPDChiefGarcia discuss the police department's new plan to reduce domestic violence. Last year, domestic violence aggravated assaults increased by 13.6% in Dallas over 2019. Numbers this year have been flat so far compared to 2020. @WBAP247NEWS @570KLIF  https://t.co/JU6eJb3VA9",en,"[{'screen_name': 'dallasmayor', 'name': 'office of mayor eric johnson', 'id': '1140744396255707138'}, {'screen_name': 'dpdchiefgarcia', 'name': 'eddie garcia', 'id': '1345454056505044993'}, {'screen_name': 'wbap247news', 'name': 'wbap 24/7 news', 'id': '29975548'}, {'screen_name': '570klif', 'name': 'klif', 'id': '23074218'}]",[],['https://pbs.twimg.com/media/FBbxBELWQAsISzL.jpg'],1,8,8,[],[],https://twitter.com/ClaytonNeville/status/1447609338827247616,False,,1,https://pbs.twimg.com/media/FBbxBELWQAsISzL.jpg,dallas,,,,,,[],,,,
1447603219836907521,1447601139931746305,2021-10-11 11:41:17 CDT,2021-10-11,11:41:17,-0500,920472193846296576,wyattp22,wyatt,,@rat_cuck32 Panic attack music,en,[],[],[],0,0,1,[],[],https://twitter.com/wyattp22/status/1447603219836907521,False,,0,,dallas,,,,,,[],,,,
1447599043757150211,1446932252949192705,2021-10-11 11:24:41 CDT,2021-10-11,11:24:41,-0500,33189500,ruthellaowens,RUTH ELLA OWENS,,"@Isle_of_Sun @teamtrace @AlainStephens @USATODAY @willcarless Johnson is alive. No way he pointed a gun at cops.  However, cops DID murder Breonna Taylor in her bed.  I don't like the term 'extremist'. Those experts in extremism don't see occupation, brutality, murder, and white militias as extreme.",en,[],[],[],10,2,31,[],[],https://twitter.com/ruthellaowens/status/1447599043757150211,False,,0,,dallas,,,,,,"[{'screen_name': 'Isle_of_Sun', 'name': 'Prosecute All Insurrectionists! 🇺🇦🇺🇸', 'id': '749280257228808193'}, {'screen_name': 'teamtrace', 'name': 'The Trace', 'id': '3243500510'}, {'screen_name': 'AlainStephens', 'name': 'Alain Stephens', 'id': '2527916755'}, {'screen_name': 'USATODAY', 'name': 'USA TODAY', 'id': '15754281'}, {'screen_name': 'willcarless', 'name': 'Will Carless', 'id': '31435689'}]",,,,
1447587174501728256,1447587174501728256,2021-10-11 10:37:31 CDT,2021-10-11,10:37:31,-0500,31203879,tagabeach,J🅰️e S🐗 #ATTB,,Listen you sore loser fan base quit reporting people on Twitter on baseless facts. Accusing of someone being a racist is not right. Don’t be a sore loser just like you athletic program. @twitter free my friend @Knockkn96454091,en,"[{'screen_name': 'twitter', 'name': 'twitter', 'id': '783214'}, {'screen_name': 'knockkn96454091', 'name': 'm & a harris! woo pig sooie 🐗🐗🐗', 'id': '1388339938786168832'}]",[],[],1,0,1,[],[],https://twitter.com/tagabeach/status/1447587174501728256,False,,0,,dallas,,,,,,[],,,,
1447585907348058113,1447585907348058113,2021-10-11 10:32:29 CDT,2021-10-11,10:32:29,-0500,31203879,tagabeach,J🅰️e S🐗 #ATTB,,Hey @willschulte17 you like to report people and accuse them of being racist when you are the one? Get a life sore loser. @Knockkn96454091  @ThatDamnBentley,en,"[{'screen_name': 'knockkn96454091', 'name': 'm & a harris! woo pig sooie 🐗🐗🐗', 'id': '1388339938786168832'}, {'screen_name': 'thatdamnbentley', 'name': 'bentley 🐗🏀🇺🇸', 'id': '1302497883397206017'}]",[],[],1,0,0,[],[],https://twitter.com/tagabeach/status/1447585907348058113,False,,0,,dallas,,,,,,[],,,,
1447584980671078409,1447584980671078409,2021-10-11 10:28:48 CDT,2021-10-11,10:28:48,-0500,4169033414,ghaakattack,Green Screen Greg,,Pretty sure they called it Columbus Day to make up being racist to Italians in the 70's.,en,[],[],[],0,0,0,[],[],https://twitter.com/GHaakAttack/status/1447584980671078409,False,,0,,dallas,,,,,,[],,,,
1447577981707341832,1447577981707341832,2021-10-11 10:01:00 CDT,2021-10-11,10:01:00,-0500,997257406240444416,bernalvick,Vick Javier Bernal,,I can’t watch and listen to @stephenasmith anymore. His black victim mentality is overwhelming. He doesn’t create or inspire change. He creates the same issues he cries about daily.,en,"[{'screen_name': 'stephenasmith', 'name': 'stephen a smith', 'id': '16302242'}]",[],[],0,0,0,[],[],https://twitter.com/BernalVick/status/1447577981707341832,False,,0,,dallas,,,,,,[],,,,
1447575872848941064,1447575872848941064,2021-10-11 09:52:37 CDT,2021-10-11,09:52:37,-0500,395682791,theblonde_don,Sydney Robinson,,All my picks on Hulu are either crime shows or scary movies lol,en,[],[],[],1,0,1,[],[],https://twitter.com/TheBlonde_Don/status/1447575872848941064,False,,0,,dallas,,,,,,[],,,,
1447572090857603072,1447195063767887886,2021-10-11 09:37:35 CDT,2021-10-11,09:37:35,-0500,17991463,jenny2x,𝖍𝖊𝖎𝖗𝖊𝖘𝖘 𝖔𝖋 𝖊𝖗𝖗𝖔𝖗,,@mgaruccio @ayelet_leah @thomas_violence in the decade i’ve bartended in texas i’ve only ever served vodka cokes to british ppl or very very white trash folk and i’m still surprised every time,en,[],[],[],0,0,0,[],[],https://twitter.com/jenny2x/status/1447572090857603072,False,,0,,dallas,,,,,,"[{'screen_name': 'mgaruccio', 'name': 'Mike Garuccio', 'id': '35301409'}, {'screen_name': 'ayelet_leah', 'name': 'em', 'id': '1397669377'}, {'screen_name': 'thomas_violence', 'name': 'thomas violence', 'id': '62208940'}]",,,,
1447562901326344194,1447357276331905025,2021-10-11 09:01:04 CDT,2021-10-11,09:01:04,-0500,35876118,daltx85,THEE daltx85,,@Donna_Barr @LaurenAshley087 It’s racist. Big time,en,[],[],[],0,0,6,[],[],https://twitter.com/daltx85/status/1447562901326344194,False,,0,,dallas,,,,,,"[{'screen_name': 'Donna_Barr', 'name': '🇺🇦🌻ScienceHag', 'id': '17088715'}, {'screen_name': 'LaurenAshley087', 'name': '💛🐝 Lauren-Ashley Arts', 'id': '4277624481'}]",,,,
1447562811010387969,1447562811010387969,2021-10-11 09:00:43 CDT,2021-10-11,09:00:43,-0500,341172526,naturalllysadie,Sadie B,,Apple calendar sending me notifications about Columbus Day feels a little racist,en,[],[],[],0,0,0,[],[],https://twitter.com/NaturalllySadie/status/1447562811010387969,False,,0,,dallas,,,,,,[],,,,
1447555542088658951,1447555542088658951,2021-10-11 08:31:50 CDT,2021-10-11,08:31:50,-0500,319718469,mfjones69_,Don’t Miss This Jet Hoe,,I woke up and chose violence.  https://t.co/V3IcUpfJi8,en,[],[],['https://pbs.twimg.com/media/FBbAF6HWUAARqgK.jpg'],0,0,3,[],[],https://twitter.com/mfjones69_/status/1447555542088658951,False,,1,https://pbs.twimg.com/media/FBbAF6HWUAARqgK.jpg,dallas,,,,,,[],,,,
1447554776732995586,1447554776732995586,2021-10-11 08:28:47 CDT,2021-10-11,08:28:47,-0500,1483009740,brookethedon,#1 hustler,,I try to do my best to do good but at the very least I try not to do harm.,en,[],[],[],0,0,0,[],[],https://twitter.com/BrookeTheDon/status/1447554776732995586,False,,0,,dallas,,,,,,[],,,,
1447551698554261505,1447551698554261505,2021-10-11 08:16:33 CDT,2021-10-11,08:16:33,-0500,17348587,dgolfer25,David Whitmore,,"""The first sin was NOT murder, adultery or any other action we commonly label as sin.  The first was...and still is..the desire to be one's own god, to control one's own life, and be in charge."" - Will Dunn, THE MULLIGAN - A PARABLE OF SECOND CHANCES",en,[],[],[],0,0,2,[],[],https://twitter.com/dgolfer25/status/1447551698554261505,False,,0,,dallas,,,,,,[],,,,
1447550823052070919,1447550823052070919,2021-10-11 08:13:05 CDT,2021-10-11,08:13:05,-0500,1212548023152037893,i35sportscxn,i35sportsconnection,,"That was brutal #ChiefsKingdom , we did nail the keyssss to the game though",en,[],[],[],0,0,2,['chiefskingdom'],[],https://twitter.com/i35SportsCxn/status/1447550823052070919,False,https://twitter.com/i35SportsCxn/status/1446331215519305772,0,,dallas,,,,,,[],,,,
1447548208444542978,1447548208444542978,2021-10-11 08:02:41 CDT,2021-10-11,08:02:41,-0500,166670276,rocwynn_,The^Concept,,Gunna say this once. I'm sick of Saquan Barkley. Missed 2+ games every year since his rookie year. I know players can't control when &amp; how they get injured but we can't keep relying on someone that can't stay healthy. Same for Shep unfortunately 😔,en,[],[],[],0,0,2,[],[],https://twitter.com/Rocwynn_/status/1447548208444542978,False,,0,,dallas,,,,,,[],,,,
1447547679635038208,1447506007660367872,2021-10-11 08:00:35 CDT,2021-10-11,08:00:35,-0500,714238343459053570,rickdorsey262,Rick Dorsey,,@MacFarlaneNews This soon-to-be grandmother is a domestic terrorist and should be treated accordingly.,en,[],[],[],0,0,0,[],[],https://twitter.com/RickDorsey262/status/1447547679635038208,False,,0,,dallas,,,,,,"[{'screen_name': 'MacFarlaneNews', 'name': 'Scott MacFarlane', 'id': '20280088'}]",,,,
1447546886831972354,1447546886831972354,2021-10-11 07:57:26 CDT,2021-10-11,07:57:26,-0500,1266103658757984272,tesfugeb11,Tesfu G,,"@GissaAbba trying to hide the truth story of Ethiopian air line transporting ten thousands Eritrean soldiers  Ethiopia troops and war machine is a fact coverup story is not working,it is time to stop victimized mentality as a weapon",en,[],[],[],0,0,0,[],[],https://twitter.com/tesfugeb11/status/1447546886831972354,False,,0,,dallas,,,,,,[],,,,
1447538996884692998,1447538996884692998,2021-10-11 07:26:05 CDT,2021-10-11,07:26:05,-0500,1237826784525197314,ankleztwisted,Twisted AnklezResist,,TRUMP SAVAGELY RAPED A 13 YR OLD CHILD.  TRUMP RAPED A 13 YR OLD CHILD WITH PEDOPHILE EPSTEIN.,en,[],[],[],0,0,0,[],[],https://twitter.com/AnklezTwisted/status/1447538996884692998,False,https://twitter.com/NatalieJHarp/status/1447004315495723010,0,,dallas,,,,,,[],,,,
1447536696426369029,1447026787062530053,2021-10-11 07:16:57 CDT,2021-10-11,07:16:57,-0500,1237826784525197314,ankleztwisted,Twisted AnklezResist,,@realLizUSA Right...FREE to RAPE. Right...FREE to PAYTAXES WHILE THE RICH DON'T RIGHT...FREE NOT YO GET VACCINATED WHILE EVERYONE AROUND TRUMP IS VACCINATED...  THEY DON'T WANT TO DIE... LIKE ALL FOX NEWS PEOPLE .  ALL FOX NEWS PEOPLE ARE VACCINATED... THEY DON'T WANT TO DIE.,en,[],[],[],0,1,0,[],[],https://twitter.com/AnklezTwisted/status/1447536696426369029,False,,0,,dallas,,,,,,"[{'screen_name': 'realLizUSA', 'name': 'Liz Harrington', 'id': '757832485'}]",,,,
1447524472697802756,1447175402104004612,2021-10-11 06:28:22 CDT,2021-10-11,06:28:22,-0500,173107422,gb3202,GB,,@meantomyself My wife tells me I fall asleep at the wheel too much… I tell her who wants to go on a whole adventure if it doesn’t have a danger element.,en,[],[],[],0,0,0,[],[],https://twitter.com/GB3202/status/1447524472697802756,False,,0,,dallas,,,,,,"[{'screen_name': 'meantomyself', 'name': 'mean things I say to myself', 'id': '62839037'}]",,,,
1447522175301427200,1447522175301427200,2021-10-11 06:19:14 CDT,2021-10-11,06:19:14,-0500,1237826784525197314,ankleztwisted,Twisted AnklezResist,,"A SLAVE OWNER? A MAN AGAINST FREEDOM FOR ""BLACK AMERICANS?  That kind of ""RACIST MAN""?",en,[],[],[],0,1,1,[],[],https://twitter.com/AnklezTwisted/status/1447522175301427200,False,https://twitter.com/RonFilipkowski/status/1447260658995707904,0,,dallas,,,,,,[],,,,
1447478607601967107,1447314023561768960,2021-10-11 03:26:07 CDT,2021-10-11,03:26:07,-0500,211221220,nchute2010,lord severn,,@CuatroJoe @ReginaWilhelmi1 @GregAbbott_TX I live in TX &amp; gotta love going to buy groceries &amp; Mr. macho in front of U is carrying a gun to buy milk + greggy-poo wants to control my body &amp; take away my voting rights NEED to VOTE HIM O.U.T. @dallasnews @HoustonChron @NBCDFW @CNNOpinion @maddow @FOX4 @nytpolitics @DallasGOP,en,"[{'screen_name': 'dallasnews', 'name': 'dallas morning news', 'id': '15679641'}, {'screen_name': 'houstonchron', 'name': 'houston chronicle', 'id': '8940342'}, {'screen_name': 'nbcdfw', 'name': 'nbc dfw', 'id': '15933690'}, {'screen_name': 'cnnopinion', 'name': 'cnn opinion', 'id': '259074538'}, {'screen_name': 'maddow', 'name': 'rachel maddow msnbc', 'id': '16129920'}, {'screen_name': 'fox4', 'name': 'fox 4 news', 'id': '16656350'}, {'screen_name': 'nytpolitics', 'name': 'nyt politics', 'id': '14434063'}, {'screen_name': 'dallasgop', 'name': 'dallas county gop', 'id': '17681489'}]",[],[],1,0,0,[],[],https://twitter.com/nchute2010/status/1447478607601967107,False,,0,,dallas,,,,,,"[{'screen_name': 'CuatroJoe', 'name': 'Joe', 'id': '346359982'}, {'screen_name': 'ReginaWilhelmi1', 'name': 'Regy', 'id': '1155847250251341824'}, {'screen_name': 'GregAbbott_TX', 'name': 'Greg Abbott', 'id': '90651198'}]",,,,
1447431299006926850,1447431299006926850,2021-10-11 00:18:08 CDT,2021-10-11,00:18:08,-0500,1313199085277663233,iancass30649034,Ian CASSIDY,,"Godzilla is use his huge mass as a weapon and immense physical strength, along with Godzilla's claws. #GodzillavsKong  https://t.co/b6WFBDsaUX",en,[],[],['https://pbs.twimg.com/media/FBZPGFLWUAYY7hf.jpg'],0,0,1,['godzillavskong'],[],https://twitter.com/IanCASS30649034/status/1447431299006926850,False,,1,https://pbs.twimg.com/media/FBZPGFLWUAYY7hf.jpg,dallas,,,,,,[],,,,
1447426975648342016,1447424629157552128,2021-10-11 00:00:57 CDT,2021-10-11,00:00:57,-0500,1402698868509315081,m0rgasm98,cabeth,,wouldn’t it be sexy of me to have a warrant for my arrest ??? idk,en,[],[],[],0,0,0,[],[],https://twitter.com/m0rgasm98/status/1447426975648342016,False,,0,,dallas,,,,,,[],,,,
1447379701022986241,1447379701022986241,2021-10-10 20:53:06 CDT,2021-10-10,20:53:06,-0500,333254122,dahighlight20,Coach De'Lano,,Anthony @theupdatedwoo23 Hunter lead @Eastfieldsports in scoring with 25 points on 9/11 shooting along with 5 assist. With a monster 2 hand baseline dunk in traffic 😬😬😬 @BamaStateMBB @UCAMBB @GSAthletics_MBB @CoachCam3345 @SolomonBozeman  https://t.co/dtZs1F5XqD,en,"[{'screen_name': 'theupdatedwoo23', 'name': 'anthonymontrell', 'id': '4657109780'}, {'screen_name': 'eastfieldsports', 'name': 'dallas college eastfield athletics', 'id': '1162190072919339009'}, {'screen_name': 'bamastatembb', 'name': 'alabama state mbb', 'id': '824666593301041152'}, {'screen_name': 'ucambb', 'name': ""uca men's basketball"", 'id': '1853341387'}, {'screen_name': 'gsathletics_mbb', 'name': ""georgia southern men's basketball"", 'id': '1601669708'}, {'screen_name': 'coachcam3345', 'name': 'cameron henderson', 'id': '831242668445310976'}, {'screen_name': 'solomonbozeman', 'name': 'coach solo', 'id': '116069406'}]",[],['https://pbs.twimg.com/media/FBYgKc2XoAIp_cV.jpg'],3,6,34,[],[],https://twitter.com/dahighlight20/status/1447379701022986241,False,,1,https://pbs.twimg.com/media/FBYgKc2XoAIp_cV.jpg,dallas,,,,,,[],,,,
1447376829011136518,1447373906889879553,2021-10-10 20:41:41 CDT,2021-10-10,20:41:41,-0500,2742941960,pastordmack,Dwight McKissic,,"@NBCNews A racist spirit has been let loose in the land targeting education. Because the church has not taught the truth about race in Scripture, society is suffering, because of a lack of knowledge.",en,[],[],[],14,6,108,[],[],https://twitter.com/pastordmack/status/1447376829011136518,False,,0,,dallas,,,,,,"[{'screen_name': 'NBCNews', 'name': 'NBC News', 'id': '14173315'}]",,,,
1447375559537926144,1447375559537926144,2021-10-10 20:36:38 CDT,2021-10-10,20:36:38,-0500,132986228,dawnmcnary,Dawn McNary,,APs who do this are POS #mentalhealth #abuse Adoptees DESERVE BETTER THAN YOU! Krista shares #truth Check out Kirsta's video! #TikTok  https://t.co/b5MpcX2DsL,en,[],['https://vm.tiktok.com/ZM8R38fqM/'],[],0,0,0,"['mentalhealth', 'abuse', 'truth', 'tiktok']",[],https://twitter.com/DawnMcNary/status/1447375559537926144,False,,0,,dallas,,,,,,[],,,,
1447374300630110208,1447374300630110208,2021-10-10 20:31:38 CDT,2021-10-10,20:31:38,-0500,132986228,dawnmcnary,Dawn McNary,,Some APs should NEVER BE GIVEN THE PRIVILEGE! 🤬🤬🤬 POS adults! #mentalhealth #abuse Check out Kirsta's video! #TikTok  https://t.co/KOlnvA1NZY,en,[],['https://vm.tiktok.com/ZM8RcMdSH/'],[],0,0,0,"['mentalhealth', 'abuse', 'tiktok']",[],https://twitter.com/DawnMcNary/status/1447374300630110208,False,,0,,dallas,,,,,,[],,,,
