id,conversation_id,created_at,date,time,timezone,user_id,username,name,place,tweet,language,mentions,urls,photos,replies_count,retweets_count,likes_count,hashtags,cashtags,link,retweet,quote_url,video,thumbnail,near,geo,source,user_rt_id,user_rt,retweet_id,reply_to,retweet_date,translate,trans_src,trans_dest
1414593979203526668,1414593979203526668,2021-07-12 09:34:21 CDT,2021-07-12,09:34:21,-0500,794811590,loudervisuals,kelly,,My dogs agenda this morning: -wake up -choose violence,en,[],[],[],1,1,11,[],[],https://twitter.com/LouderVisuals/status/1414593979203526668,False,,0,,phoenix,,,,,,[],,,,
1414587853498032133,1414587853498032133,2021-07-12 09:10:00 CDT,2021-07-12,09:10:00,-0500,926190936316506112,carlenaorosco,Carlena (Lena) Orosco,,Very proud to be part of the @TempePolice “Crime Analyst Team” mentioned in the article who compiled and analyzed these data!    https://t.co/hzUnZM1Bab,en,"[{'screen_name': 'tempepolice', 'name': 'tempe police', 'id': '293111734'}]",['https://www.abc15.com/news/operation-safe-roads/tempe-police-use-new-data-to-identify-crash-hotspots-ahead-of-drivers-returning-to-normal'],[],1,4,20,[],[],https://twitter.com/CarlenaOrosco/status/1414587853498032133,False,,0,,phoenix,,,,,,[],,,,
1414525328479772672,1414525328479772672,2021-07-12 05:01:33 CDT,2021-07-12,05:01:33,-0500,920024191,calizonie,Ray Adams,,"@POTUS wanna stop crime... #EnforceTheLaw! Most of the cities seeing a spike in crime are #GunFreeZones they also want to #DefundThePolice! This didn't help either... ""Prisoners Sent Home Because of Covid May Have to Go Back - The New York Times""  https://t.co/BsONb8U1fr",en,[],['https://www.nytimes.com/2021/06/27/us/politics/biden-prison-coronavirus.html'],[],0,0,0,"['enforcethelaw', 'gunfreezones', 'defundthepolice']",[],https://twitter.com/calizonie/status/1414525328479772672,False,https://twitter.com/NBCLA/status/1414453055395934213,0,,phoenix,,,,,,[],,,,
1414466421430517762,1414466421430517762,2021-07-12 01:07:29 CDT,2021-07-12,01:07:29,-0500,28121878,weslamar07,Wes Sells,,That second quarter was brutal.,en,[],[],[],0,0,0,[],[],https://twitter.com/WesLamar07/status/1414466421430517762,False,,0,,phoenix,,,,,,[],,,,
1414458580103680000,1414458580103680000,2021-07-12 00:36:19 CDT,2021-07-12,00:36:19,-0500,58240642,shaneagainst,🖤KING EMO🖤,,Arrest this bitch.,en,[],[],[],0,0,0,[],[],https://twitter.com/ShaneAgainst/status/1414458580103680000,False,https://twitter.com/MeidasTouch/status/1414437253619716100,0,,phoenix,,,,,,[],,,,
1414439717467148289,1414342074888040462,2021-07-11 23:21:22 CDT,2021-07-11,23:21:22,-0500,387291080,vincentmondry,Vincent Mondry,,@CoachHauck @astros That’s cold bro. 😆 I was in NJ for that game and it was brutal. Politics yes. A fellow Democrat.,en,[],[],[],1,0,0,[],[],https://twitter.com/vincentmondry/status/1414439717467148289,False,,0,,phoenix,,,,,,"[{'screen_name': 'CoachHauck', 'name': 'Kevin Hauck', 'id': '1087869338'}, {'screen_name': 'astros', 'name': 'Houston Astros', 'id': '52803520'}]",,,,
1414429580991995906,1414341121753419784,2021-07-11 22:41:05 CDT,2021-07-11,22:41:05,-0500,1400667267533217793,marvinisnotdyin,Marvin,,@Out5p0ken @ElizManresa The difference between a conservative and a compassionate conservative is the compassionate conservative will pray for your soul after they murder you.,en,[],[],[],0,2,9,[],[],https://twitter.com/MarvinIsNotDyin/status/1414429580991995906,False,,0,,phoenix,,,,,,"[{'screen_name': 'Out5p0ken', 'name': 'Outspoken™️', 'id': '3930472251'}, {'screen_name': 'ElizManresa', 'name': '🎙News You Need', 'id': '3303002295'}]",,,,
1414423845079945226,1414383855121879053,2021-07-11 22:18:18 CDT,2021-07-11,22:18:18,-0500,2973753417,thecboshow,Wakey Wakey!!! We've been asleep long enough!! 😴,,"@iamdjeastwood @evxz17 He doesn't have the ball dude, he can't just barrel into people without the ball. You must be new to the NBA, because if a 6'11"" 250 pound man runs into you, I'm gonna grab him, I don't want to hit the court and get injured because this freak of nature tried to run me over #Jeez",en,[],[],[],2,0,20,['jeez'],[],https://twitter.com/TheCboShow/status/1414423845079945226,False,,0,,phoenix,,,,,,"[{'screen_name': 'iAmDjEastwood', 'name': 'Run It Back No Intros', 'id': '156529873'}, {'screen_name': 'evxz17', 'name': 'evan', 'id': '974452734345723904'}]",,,,
1414423362894372869,1414423362894372869,2021-07-11 22:16:23 CDT,2021-07-11,22:16:23,-0500,226684105,mszebraprint,👑MsClassyAntonia👑,,Had a Mini anxiety attack this morning 😰🥴,en,[],[],[],0,0,0,[],[],https://twitter.com/MsZebraPrint/status/1414423362894372869,False,,0,,phoenix,,,,,,[],,,,
1414417888564314118,1414414373213270017,2021-07-11 21:54:37 CDT,2021-07-11,21:54:37,-0500,3243947276,jpoppe94,Johnathon Poppe,,"@arnie63 I agree. They dictate the play style. I chalk up our rebounded woes to them. We boxed out well in the first quarter and they didn’t call any over the backs. Giannis will always get his FT attempts. That is what it is. All that said, we weren’t winning tonight shooting like we did",en,[],[],[],1,0,1,[],[],https://twitter.com/jpoppe94/status/1414417888564314118,False,,0,,phoenix,,,,,,"[{'screen_name': 'arnie63', 'name': 'Arnie 🇺🇸 🇮🇪 🏴\U000e0067\U000e0062\U000e0073\U000e0063\U000e0074\U000e007f', 'id': '25009656'}]",,,,
1414416396772016128,1414416396772016128,2021-07-11 21:48:42 CDT,2021-07-11,21:48:42,-0500,892225822475472897,sociopathlete,Noble Brown🗡,,You have no idea how many of you I'd murder to bring back Randy Savage,en,[],[],[],4,0,11,[],[],https://twitter.com/Sociopathlete/status/1414416396772016128,False,https://twitter.com/JerasIkehorn/status/1413965250559234048,0,,phoenix,,,,,,[],,,,
1414413696823042050,1414413696823042050,2021-07-11 21:37:58 CDT,2021-07-11,21:37:58,-0500,3107785350,everyshowjoe,Joe Maier,,"Washer already going as the clean freak in me rejoices to wear a clean shirt during games again. Blowouts easy to swallow and rare to see this bad a shooting performance from Booker, the Suns. Let's see what Game 4 brings. Sorry bands next Saturday, Suns in the Finals priority.",en,[],[],[],1,0,3,[],[],https://twitter.com/everyshowjoe/status/1414413696823042050,False,,0,,phoenix,,,,,,[],,,,
1414413363862327301,1414413363862327301,2021-07-11 21:36:39 CDT,2021-07-11,21:36:39,-0500,141965435,mrdbake,David Baker,,Brutal  https://t.co/swZ2fugTB1,no,[],[],['https://pbs.twimg.com/media/E6EBc2jVgAA5Fj3.jpg'],0,0,0,[],[],https://twitter.com/MrDBake/status/1414413363862327301,False,,1,https://pbs.twimg.com/media/E6EBc2jVgAA5Fj3.jpg,phoenix,,,,,,[],,,,
1414412768401235972,1414412768401235972,2021-07-11 21:34:17 CDT,2021-07-11,21:34:17,-0500,1523091876,kevinjhurley,Kevin Hurley,,This was a brutal watch,en,[],[],[],0,0,12,[],[],https://twitter.com/KevinJHurley/status/1414412768401235972,False,,0,,phoenix,,,,,,[],,,,
1414409307475439619,1414409307475439619,2021-07-11 21:20:32 CDT,2021-07-11,21:20:32,-0500,892225822475472897,sociopathlete,Noble Brown🗡,,"""The brave man inattentive to his duty, is worth little more to his country than the coward who deserts in the hour of danger.""  https://t.co/6BY5VZp1Kl",en,[],[],['https://pbs.twimg.com/media/E6D9xQPVEAQHakT.jpg'],0,1,18,[],[],https://twitter.com/Sociopathlete/status/1414409307475439619,False,,1,https://pbs.twimg.com/media/E6D9xQPVEAQHakT.jpg,phoenix,,,,,,[],,,,
1414406058022297600,1414405473365741573,2021-07-11 21:07:37 CDT,2021-07-11,21:07:37,-0500,278346096,rocsstarlife,Rocs,,@TheJuiceManYo I don’t remember Kobe shooting this bad in the playoffs I know he’s had bad shooting games tho,en,[],[],[],1,0,0,[],[],https://twitter.com/RocsStarLife/status/1414406058022297600,False,,0,,phoenix,,,,,,"[{'screen_name': 'TheJuiceManYo', 'name': 'Kenshi Wins', 'id': '83730140'}]",,,,
1414404485745582080,1414383145823006720,2021-07-11 21:01:22 CDT,2021-07-11,21:01:22,-0500,285504068,csfallers99,Chad Fallers,,"@iamtheflowerkid Step back, you wack son, did you learn nothing from what Em did to Machine Gun!?!",en,[],[],[],0,0,0,[],[],https://twitter.com/csfallers99/status/1414404485745582080,False,,0,,phoenix,,,,,,"[{'screen_name': 'iamtheflowerkid', 'name': 'sky hi', 'id': '709123120079052800'}]",,,,
1414403805861400576,1414331152886865921,2021-07-11 20:58:40 CDT,2021-07-11,20:58:40,-0500,1160690122200891393,pueblo_man,PuebloMan,,@judgeyourself99 Six Gun,en,[],[],[],0,0,1,[],[],https://twitter.com/Pueblo_man/status/1414403805861400576,False,,0,,phoenix,,,,,,"[{'screen_name': 'judgeyourself99', 'name': 'KeanoTheDog', 'id': '1172545640360022019'}]",,,,
1414399533702795267,1414399533702795267,2021-07-11 20:41:41 CDT,2021-07-11,20:41:41,-0500,96835486,terpsu,Julian Garcia,,hello 911 I’d like to report a murder,en,[],[],[],0,0,2,[],[],https://twitter.com/terpsu/status/1414399533702795267,False,https://twitter.com/TrashTalk_fr/status/1414398973478162437,0,,phoenix,,,,,,[],,,,
1414399150062329858,1414399150062329858,2021-07-11 20:40:10 CDT,2021-07-11,20:40:10,-0500,1684699008,eproms_son,Ramen King,,A murder was just committed,en,[],[],[],0,1,3,[],[],https://twitter.com/Eproms_Son/status/1414399150062329858,False,,0,,phoenix,,,,,,[],,,,
1414398969485029378,1414398969485029378,2021-07-11 20:39:27 CDT,2021-07-11,20:39:27,-0500,2766755807,oly_gav,x-Gav (53-14),,I JUST WITNESSED A MURDER AT THE FISERV FORUM IN MILWAUKEE SOMEONE CALL AN AMBULANCE,en,[],[],[],0,0,0,[],[],https://twitter.com/Oly_Gav/status/1414398969485029378,False,,0,,phoenix,,,,,,[],,,,
1414396110538371073,1414395726264631298,2021-07-11 20:28:05 CDT,2021-07-11,20:28:05,-0500,2766755807,oly_gav,x-Gav (53-14),,"Racist and islamophobic in the same tweet, that’s pretty English of David here.",en,[],[],[],1,0,1,[],[],https://twitter.com/Oly_Gav/status/1414396110538371073,False,,0,,phoenix,,,,,,[],,,,
1414392968820129794,1414392968820129794,2021-07-11 20:15:36 CDT,2021-07-11,20:15:36,-0500,1514920874,brian_wonder23,Daniel,,Booker needs to step it up.  He’s shooting like shit again,en,[],[],[],0,1,3,[],[],https://twitter.com/brian_wonder23/status/1414392968820129794,False,,0,,phoenix,,,,,,[],,,,
1414390864273571843,1414390864273571843,2021-07-11 20:07:14 CDT,2021-07-11,20:07:14,-0500,12739092,azjd,Jeff Delp,,Keep shooting D Book #GoSuns #RallyTheValley,en,[],[],[],0,0,0,"['gosuns', 'rallythevalley']",[],https://twitter.com/azjd/status/1414390864273571843,False,,0,,phoenix,,,,,,[],,,,
1414386951600451587,1414386724919123972,2021-07-11 19:51:41 CDT,2021-07-11,19:51:41,-0500,2536086784,jwlewis4262,Jwlewis4262,,@Burnsy987 Chris Paul is in assassin mode tonight!  He wants to end it here.,en,[],[],[],1,0,0,[],[],https://twitter.com/jwlewis4262/status/1414386951600451587,False,,0,,phoenix,,,,,,"[{'screen_name': 'Burnsy987', 'name': 'Dave Burns', 'id': '27937449'}]",,,,
1414385868144451586,1414385868144451586,2021-07-11 19:47:23 CDT,2021-07-11,19:47:23,-0500,1314532418,smoovazz_,Smoov,,Bench holiday … dude is out of his shits shooting all these 3”s,en,[],[],[],0,0,0,[],[],https://twitter.com/Smoovazz_/status/1414385868144451586,False,,0,,phoenix,,,,,,[],,,,
1414384616480198657,1414384616480198657,2021-07-11 19:42:25 CDT,2021-07-11,19:42:25,-0500,141965435,mrdbake,David Baker,,Love to see it: Ayton leading all scorers with 12 points on 6/7 shooting. #Suns up 28-25 after 1st quarter #RallyTheValley,en,[],[],[],0,0,1,"['suns', 'rallythevalley']",[],https://twitter.com/MrDBake/status/1414384616480198657,False,,0,,phoenix,,,,,,[],,,,
1414381133299474432,1414318609917267982,2021-07-11 19:28:34 CDT,2021-07-11,19:28:34,-0500,1160690122200891393,pueblo_man,PuebloMan,,"@FPWellman @JohannTWayne1 Arrest him, you can’t shoot from a road like that!",en,[],[],[],0,0,1,[],[],https://twitter.com/Pueblo_man/status/1414381133299474432,False,,0,,phoenix,,,,,,"[{'screen_name': 'FPWellman', 'name': 'Fred Wellman', 'id': '42518865'}, {'screen_name': 'JohannTWayne1', 'name': 'Johan T. Wane', 'id': '1282083247963254784'}]",,,,
1414379193777876997,1413629886049132545,2021-07-11 19:20:52 CDT,2021-07-11,19:20:52,-0500,21365708,avcastaway,Anthony Castaway,,"@caljamb2000 1st Qtr, If Giannis Is Injured. Suns Could Squeak Out A Win.",en,[],[],[],0,0,0,[],[],https://twitter.com/AVCastaway/status/1414379193777876997,False,,0,,phoenix,,,,,,"[{'screen_name': 'caljamb2000', 'name': 'Caljamb2000@yahoo.com', 'id': '1337140870093688833'}]",,,,
1414378820530892803,1414378820530892803,2021-07-11 19:19:23 CDT,2021-07-11,19:19:23,-0500,65439118,pearsonurheart,Cordell 🏜️,,Is he having a panic attack?,en,[],[],[],1,0,0,[],[],https://twitter.com/pearsonURheart/status/1414378820530892803,False,,0,,phoenix,,,,,,[],,,,
1414378505886830593,1413629886049132545,2021-07-11 19:18:08 CDT,2021-07-11,19:18:08,-0500,21365708,avcastaway,Anthony Castaway,,"@caljamb2000 WNBA Is Tough.  Any Team Can Beat Each Other.     Also,  A Lot Of Teams Have Players Injured.",en,[],[],[],0,0,0,[],[],https://twitter.com/AVCastaway/status/1414378505886830593,False,,0,,phoenix,,,,,,"[{'screen_name': 'caljamb2000', 'name': 'Caljamb2000@yahoo.com', 'id': '1337140870093688833'}]",,,,
