id,conversation_id,created_at,date,time,timezone,user_id,username,name,place,tweet,language,mentions,urls,photos,replies_count,retweets_count,likes_count,hashtags,cashtags,link,retweet,quote_url,video,thumbnail,near,geo,source,user_rt_id,user_rt,retweet_id,reply_to,retweet_date,translate,trans_src,trans_dest
1415097541352325127,1415097541352325127,2021-07-13 18:55:19 CDT,2021-07-13,18:55:19,-0500,27186418,sigilk,A Moderna Man_Sigurd 😷,,Wooooooo baby… “Slavery wasn’t racist” might be the worst take of all-time on this god forsaken app from hell.,en,[],[],[],0,0,1,[],[],https://twitter.com/SigiLK/status/1415097541352325127,False,https://twitter.com/NikkiMcR/status/1415040742259576833,0,,phoenix,,,,,,[],,,,
1415087122273300482,1415022489252638724,2021-07-13 18:13:55 CDT,2021-07-13,18:13:55,-0500,2652344228,therealtywilson,tylonwilson,,@JeffOnTheRight You’re deflecting bro . You’re trying diminish those domestic terrorist by comparing it to something catastrophic. If you compare it to the Holocaust of course it’s not gonna be as bad. GOP just can’t take an L like a man. They’re trash.,en,[],[],[],1,0,0,[],[],https://twitter.com/therealtywilson/status/1415087122273300482,False,,0,,phoenix,,,,,,"[{'screen_name': 'JeffOnTheRight', 'name': ""Jeff Charles, AKA Seamus O'Charley"", 'id': '18342379'}]",,,,
1415050900691771394,1415050900691771394,2021-07-13 15:49:59 CDT,2021-07-13,15:49:59,-0500,2577136380,andres_moreno35,Andres,,It should be a crime for EOS on 75th to only have 3 benches,en,[],[],[],3,2,16,[],[],https://twitter.com/andres_moreno35/status/1415050900691771394,False,,0,,phoenix,,,,,,[],,,,
1415050793846071296,1414978976901222411,2021-07-13 15:49:34 CDT,2021-07-13,15:49:34,-0500,60216046,deceptibling,Nathan Allen,,@BryanDMcNally how they gonna extradite and arrest them in dc?,en,[],[],[],1,1,1,[],[],https://twitter.com/deceptibling/status/1415050793846071296,False,,0,,phoenix,,,,,,"[{'screen_name': 'BryanDMcNally', 'name': 'Bryan McNally', 'id': '800114400614957056'}]",,,,
1415039904698966018,1415026831233847297,2021-07-13 15:06:18 CDT,2021-07-13,15:06:18,-0500,2652344228,therealtywilson,tylonwilson,,@JeffOnTheRight I’ve never heard anyone compare it to 911. I’ve heard it referred to as a terrorist attack which is what it was in my opinion.,en,[],[],[],0,0,0,[],[],https://twitter.com/therealtywilson/status/1415039904698966018,False,,0,,phoenix,,,,,,"[{'screen_name': 'JeffOnTheRight', 'name': ""Jeff Charles, AKA Seamus O'Charley"", 'id': '18342379'}]",,,,
1415029698841645057,1415029698841645057,2021-07-13 14:25:44 CDT,2021-07-13,14:25:44,-0500,148523724,unionamber,"xoxo, amber",,they should really do a documentary about the sexual assault scandals in the alt music industry…like 2007-now. I feel like people who aren’t in that community don’t even know what has happened,en,[],[],[],1,0,6,[],[],https://twitter.com/unionamber/status/1415029698841645057,False,,0,,phoenix,,,,,,[],,,,
1415024423657111555,1406184460446490625,2021-07-13 14:04:47 CDT,2021-07-13,14:04:47,-0500,1344813752235880448,frisky60az,Freebird 🐦,,@CoulombeMax @SchmidtyBuck @OperatorCoffee1 @mark7666656 @Bogey15010933 @Brittan60572844 @terescavs @ZeeeOntario @BeyondContesta1 @Outliergirl @hamricksteve @QueenofBaconz @TrumpsMustache @bat_roger @tfer68 @kevinkeary1 @seanshardy @HardCelt @67ShelbyGT500E @zee_georgie @gettinjm @starr_rider @dodiewill2 @Midges_Homer @cherylml1 @CRZYRedHead2018 @Wolfonthecliff @Firewrench_69 @thatsassyJolene @Sconaboy1 @StephanieOxygen @TheRealDogPoun1 Sweet Weapon👍,en,[],[],[],0,0,2,[],[],https://twitter.com/Frisky60AZ/status/1415024423657111555,False,,0,,phoenix,,,,,,"[{'screen_name': 'CoulombeMax', 'name': 'MadMax', 'id': '1338547431290630145'}, {'screen_name': 'OperatorCoffee1', 'name': 'Dylan (Canucks 29-23-7)', 'id': '1207428001790488576'}, {'screen_name': 'mark7666656', 'name': 'mark', 'id': '1348887642339991552'}, {'screen_name': 'Bogey15010933', 'name': ""Bogey's Weird News."", 'id': '1390788592285388804'}, {'screen_name': 'Brittan60572844', 'name': 'Brittany Anne', 'id': '1228489679324012544'}, {'screen_name': 'terescavs', 'name': 'Bubo🦉da droid - NYC 🇨🇦🇺🇦🇺🇸', 'id': '804480175652147200'}, {'screen_name': 'ZeeeOntario', 'name': 'Zee', 'id': '1243668578165022723'}, {'screen_name': 'BeyondContesta1', 'name': 'Beyond Contestation', 'id': '1273684075690127360'}, {'screen_name': 'hamricksteve', 'name': 'steve hamrick', 'id': '3805649595'}, {'screen_name': 'QueenofBaconz', 'name': '🍊Bacon Queen 🥓👸🏼🥓 🚛', 'id': '71625602'}, {'screen_name': 'TrumpsMustache', 'name': ""Trump's Mustache"", 'id': '1183852973421662208'}, {'screen_name': 'bat_roger', 'name': 'Roger Bat 🦇', 'id': '1259458814270562306'}, {'screen_name': 'tfer68', 'name': 'Trent Ferguson', 'id': '47824236'}, {'screen_name': 'kevinkeary1', 'name': 'Hong Kong Phooey🇨🇦🇨🇦🇺🇲🇺🇲🇬🇧🇬🇧🇮🇱🇮🇱', 'id': '1411905716558831618'}, {'screen_name': 'seanshardy', 'name': '🇺🇸❤️Brew-ster 🚛🇨🇦', 'id': '556892704'}, {'screen_name': 'HardCelt', 'name': 'Master 🦁 HardCelt - The Punisher', 'id': '1294800540497350656'}, {'screen_name': '67ShelbyGT500E', 'name': 'Fuck Off', 'id': '2247668288'}, {'screen_name': 'zee_georgie', 'name': 'GeorgieZee', 'id': '1410714309638905858'}, {'screen_name': 'gettinjm', 'name': 'Love my Boxer', 'id': '1661302838'}, {'screen_name': 'starr_rider', 'name': 'starrrider @gab', 'id': '810334272'}, {'screen_name': 'dodiewill2', 'name': 'Dodie Williams', 'id': '16459899'}, {'screen_name': 'Midges_Homer', 'name': 'Lord Evil Monkey', 'id': '1224782713783291906'}, {'screen_name': 'cherylml1', 'name': 'cherylml', 'id': '1291069648574832640'}, {'screen_name': 'CRZYRedHead2018', 'name': '💙 BlueEyedRedhead 💙', 'id': '882357070204424193'}, {'screen_name': 'Wolfonthecliff', 'name': 'Count Wolf of Monte Cristo.😎', 'id': '1169378551315030018'}, {'screen_name': 'Firewrench_69', 'name': 'Fringe minority Firewrench', 'id': '88226082'}, {'screen_name': 'Sconaboy1', 'name': 'Sconaboy (aka Sambuca Sam)', 'id': '1180563497811247104'}, {'screen_name': 'StephanieOxygen', 'name': 'Unacceptable Fringe Stephanie - Non GMO', 'id': '1381380304376537089'}, {'screen_name': 'TheRealDogPoun1', 'name': 'Chris in Alberta', 'id': '1375596793891676169'}]",,,,
1415018988828954624,1415013862022254592,2021-07-13 13:43:11 CDT,2021-07-13,13:43:11,-0500,15248392,karyncupcakes,🦄 🎀 Karyn 🎀🦄,,"@esther0672 @sarahhisfunny Same! My husband asked me once if he should be concerned with how much I'm into true crime and I'm like ""You've seen me eat spaghetti. I'm not gonna be able to clean a crime scene."" 😂",en,[],[],[],1,0,3,[],[],https://twitter.com/karyncupcakes/status/1415018988828954624,False,,0,,phoenix,,,,,,"[{'screen_name': 'esther0672', 'name': 'Esther', 'id': '15639831'}, {'screen_name': 'sarahhisfunny', 'name': 'Sarah', 'id': '701736254'}]",,,,
1415011924740247553,1415011924740247553,2021-07-13 13:15:07 CDT,2021-07-13,13:15:07,-0500,301979242,lifeishoops,Shawn 🇯🇵♦️,,“No weapon formed against me every time i pray at night”,en,[],[],[],0,0,0,[],[],https://twitter.com/LifeIsHoops/status/1415011924740247553,False,,0,,phoenix,,,,,,[],,,,
1415011257392898049,1415011257392898049,2021-07-13 13:12:28 CDT,2021-07-13,13:12:28,-0500,418347589,carlsanders13,Carl Sanders,,Beloved Grandmother’s Murder Finally Solved #NewsBreak   https://t.co/20RTGXrv33,en,[],['https://www.newsbreakapp.com/n/0asvr9cb?share_id=eyJ1c2VyaWQiOjU2NzU0NDY3LCJkb2NfaWQiOiIwYXN2cjljYiIsInRpbWVzdGFtcCI6MTYyNjE5OTkwOTI2MH0=&s=a2&pd=03q8Qdeh&hl=en_US'],[],0,0,0,['newsbreak'],[],https://twitter.com/carlsanders13/status/1415011257392898049,False,,0,,phoenix,,,,,,[],,,,
1415009602320539656,1415009602320539656,2021-07-13 13:05:53 CDT,2021-07-13,13:05:53,-0500,552253775,brittsummers123,B SUMS☀️,,"If you have friends that work in customer service, please check on them it’s brutal out here 😥 #CustomerServiceLife",en,[],[],[],0,1,5,['customerservicelife'],[],https://twitter.com/BrittSummers123/status/1415009602320539656,False,,0,,phoenix,,,,,,[],,,,
1414997598646071299,1414997598646071299,2021-07-13 12:18:11 CDT,2021-07-13,12:18:11,-0500,1266645078254075904,phoenixheat9,Fire Hawk,,The people who started video game violence 😎😎  https://t.co/0poKrrFtdT,en,[],[],['https://pbs.twimg.com/media/E6MU0SMVIAEVEaM.jpg'],0,0,1,[],[],https://twitter.com/Phoenixheat9/status/1414997598646071299,False,,1,https://pbs.twimg.com/media/E6MU0SMVIAEVEaM.jpg,phoenix,,,,,,[],,,,
1414974062418284549,1414974062418284549,2021-07-13 10:44:40 CDT,2021-07-13,10:44:40,-0500,440279001,emthethird,Emerson,,"@ShannonSharpe we are giving Ben a Simmons a pass. It’s not that he’s afraid to shoot. He KNOWS he can’t, lol. And it’s been this way since high school. Shooters shoot and we’ve never seen any highlight tape from HS to now of him busting people up shooting the 🏀…",en,[],[],[],0,0,0,[],[],https://twitter.com/emthethird/status/1414974062418284549,False,,0,,phoenix,,,,,,[],,,,
1414956411440746509,1414956411440746509,2021-07-13 09:34:31 CDT,2021-07-13,09:34:31,-0500,336847865,habarient,Habari Entertainment,,How to unlock Mace weapon in Warzone &amp; Black Ops Cold War Season 4 Reloaded update  - Habari Entertainment #BlackOpsColdWar  https://t.co/9GykGiOxJ4,en,[],['https://habarientertainment.com/how-to-unlock-mace-weapon-in-warzone-black-ops-cold-war-season-4-reloaded-update-dexerto/'],[],0,0,0,['blackopscoldwar'],[],https://twitter.com/Habarient/status/1414956411440746509,False,,0,,phoenix,,,,,,[],,,,
1414954612377931778,1414809736457990145,2021-07-13 09:27:22 CDT,2021-07-13,09:27:22,-0500,1257164489562046465,nutz_beat,BeatNutz,,@Yxng66 He’d fucking murder this shit man,en,[],[],[],1,0,2,[],[],https://twitter.com/nutz_beat/status/1414954612377931778,False,,0,,phoenix,,,,,,"[{'screen_name': 'Yxng66', 'name': 'Yxng God', 'id': '1294449610367393795'}]",,,,
1414942471562227712,1414942471562227712,2021-07-13 08:39:08 CDT,2021-07-13,08:39:08,-0500,11151842,geek3point0,🇺🇲 That James 🏳️‍🌈,,"I heard Biden met with the mayor of Chicago to discuss a solution to him violence. Wouldn't it be better to invite a mayor of a city that hasn't shit the bed on gun violence? Oh we see your city is a total failure, tell us your secrets.",en,[],[],[],0,0,1,[],[],https://twitter.com/geek3point0/status/1414942471562227712,False,,0,,phoenix,,,,,,[],,,,
1414939299544375296,1414939299544375296,2021-07-13 08:26:31 CDT,2021-07-13,08:26:31,-0500,1344813752235880448,frisky60az,Freebird 🐦,," https://t.co/9QPy1U6fnm  Sound Familiar🤔🤔 Outnumbered police,pieces of 💩 with absolutely no self-respect.  And don't forget it's ""OKIE DOKIE"" because to see it otherwise is surely Racist. I'd say Reparations are paid in full,case closed🙂",en,[],['https://www.theguardian.com/world/video/2021/jul/13/south-africa-military-deployed-to-tackle-violence-over-zuma-jailing-video?CMP=Share_AndroidApp_Other'],[],1,0,0,[],[],https://twitter.com/Frisky60AZ/status/1414939299544375296,False,,0,,phoenix,,,,,,[],,,,
1414913794749304837,1414913794749304837,2021-07-13 06:45:11 CDT,2021-07-13,06:45:11,-0500,867709140075921408,keyahnajoyxo,333,,Bitch he got a gun 😩,en,[],[],[],0,0,0,[],[],https://twitter.com/keyahnajoyxo/status/1414913794749304837,False,,0,,phoenix,,,,,,[],,,,
1414859178003161091,1414859178003161091,2021-07-13 03:08:09 CDT,2021-07-13,03:08:09,-0500,505527532,versacepikachu,Rangers 37-17-5,,I’m gonna stop being a victim I’m just gonna love me and ride with it,en,[],[],[],0,1,6,[],[],https://twitter.com/VersacePikachu/status/1414859178003161091,False,,0,,phoenix,,,,,,[],,,,
1414846718483521537,1414846718483521537,2021-07-13 02:18:38 CDT,2021-07-13,02:18:38,-0500,1388313655,big_red_rage,🏆🏀💥The Red Rage💥🏀🏆,"{'type': 'Point', 'coordinates': [33.414035, -111.831562]}","Just posted a photo @ Mesa, Arizona  https://t.co/am9Z28pzHS",en,[],['https://www.instagram.com/p/CRQjp6klam8/?utm_medium=twitter'],[],0,0,0,[],[],https://twitter.com/Big_Red_Rage/status/1414846718483521537,False,,0,,phoenix,,,,,,[],,,,
1414828171652861962,1414793158609698819,2021-07-13 01:04:57 CDT,2021-07-13,01:04:57,-0500,1035284869381730304,zppmint,ellie mair,,"@Alihandro013 @ValdovinosAldo You know what, maybe murder is ok",en,[],[],[],0,0,1,[],[],https://twitter.com/zppmint/status/1414828171652861962,False,,0,,phoenix,,,,,,"[{'screen_name': 'Alihandro013', 'name': 'Alejandro Meza', 'id': '1106788447493095424'}, {'screen_name': 'ValdovinosAldo', 'name': 'Å!DΩ', 'id': '954991739902705665'}]",,,,
1414821498376785941,1414821498376785941,2021-07-13 00:38:25 CDT,2021-07-13,00:38:25,-0500,151365743,diegonachoaz,Diego Lozano 🌵🎮,,"I’m really digging the cast in Tales of Berseria.   Velvet is one of the best main characters in the series, having such a dark and violent past. Haven’t seen a character this complex.",en,[],[],[],0,0,0,[],[],https://twitter.com/DiegoNachoAZ/status/1414821498376785941,False,,0,,phoenix,,,,,,[],,,,
1414820430649565184,1414820430649565184,2021-07-13 00:34:11 CDT,2021-07-13,00:34:11,-0500,1105919801329741824,bellaxbrat,la bella durmiente,,Crime documentaries have taught me that ugly white men r not to be trusted whatsoever,en,[],[],[],0,2,3,[],[],https://twitter.com/bellaxbrat/status/1414820430649565184,False,,0,,phoenix,,,,,,[],,,,
1414807320144453634,1414661337028902918,2021-07-12 23:42:05 CDT,2021-07-12,23:42:05,-0500,1088889080685817858,reservebank1913,WorldBank/FederalReserve/PrivateReserve,,@FBI How about when you have a lot of money. I know people hate when you have a ton of money. Everybody wanna mess you up. Does that count as a hate crime. They start shutting you down. I can't help it if I can program something with the higher power which humans aren't able to count.,en,[],[],[],0,0,0,[],[],https://twitter.com/ReserveBank1913/status/1414807320144453634,False,,0,,phoenix,,,,,,"[{'screen_name': 'FBI', 'name': 'FBI', 'id': '17629860'}]",,,,
1414793110995968029,1414793110995968029,2021-07-12 22:45:37 CDT,2021-07-12,22:45:37,-0500,2955379599,swrvo_,Down Bad Seahawks Fan,,"House arrest tings, rebels kick it. Etc ain’t in this 🤨",en,[],[],[],0,0,1,[],[],https://twitter.com/swrvo_/status/1414793110995968029,False,https://twitter.com/TheRealTjayy/status/1414784619031957513,0,,phoenix,,,,,,[],,,,
1414774035557220353,1414773000570695684,2021-07-12 21:29:49 CDT,2021-07-12,21:29:49,-0500,838459944055648257,wittenmatt,Matt the Technician,,@jlock4820 Hopefully the end of the month. We are trying to be patient. Rosa may murder me before we get to move. She really wants to be in her new home. Had our first monsoon the other night. Crazy weather.,en,[],[],[],1,0,1,[],[],https://twitter.com/WittenMatt/status/1414774035557220353,False,,0,,phoenix,,,,,,"[{'screen_name': 'jlock4820', 'name': 'Just Jim 🌻', 'id': '257989032'}]",,,,
1414767050656940037,1414767050656940037,2021-07-12 21:02:04 CDT,2021-07-12,21:02:04,-0500,1368772062349848581,cinephilefit,Cinephile Hissy Fit Podcast,,It gets harder and harder to defend my love of both the Lethal Weapon films and the Mad Max series.  Just got to keep saying to myself “Danny Glover is the best. Danny Glover is the best.”  https://t.co/nBFnFzgw6A,en,[],[],['https://pbs.twimg.com/tweet_video_thumb/E6JDIZiUcAAb35P.jpg'],1,0,0,[],[],https://twitter.com/CinephileFit/status/1414767050656940037,False,,1,https://pbs.twimg.com/tweet_video_thumb/E6JDIZiUcAAb35P.jpg,phoenix,,,,,,[],,,,
1414765482943516676,1414764754934001664,2021-07-12 20:55:50 CDT,2021-07-12,20:55:50,-0500,1397646982198358018,thejfkreport,TheJFKReport,,"@CalamiaSam3 Yes, no matter the crime and once punishment is served.",en,[],[],[],1,0,1,[],[],https://twitter.com/TheJFKReport/status/1414765482943516676,False,,0,,phoenix,,,,,,"[{'screen_name': 'CalamiaSam3', 'name': 'calsam75', 'id': '1125538657090318339'}]",,,,
1414754372731342848,1414690501383516160,2021-07-12 20:11:41 CDT,2021-07-12,20:11:41,-0500,1449139368,wxpete75,Pete Miramontes 🇺🇦,,"@drhenz_wx @MikeOlbinski Just to be clear, this isn’t an attack on anyone and I’m not calling anyone out. I just know that I hear it a lot every season since I’ve been here, compared to just a few times heard in NC as storm reports came in.",en,[],[],[],0,0,0,[],[],https://twitter.com/wxpete75/status/1414754372731342848,False,,0,,phoenix,,,,,,"[{'screen_name': 'drhenz_wx', 'name': 'Daniel Henz', 'id': '770574782'}, {'screen_name': 'MikeOlbinski', 'name': 'Mike Olbinski', 'id': '11282582'}]",,,,
1414753321609359360,1414753321609359360,2021-07-12 20:07:31 CDT,2021-07-12,20:07:31,-0500,1183825888380518400,thearanastotle,#HowUDoin,,"I'll never understand the idiots at a #HRDerby that will literally cause themselves physical, bodily harm trying to catch a home run. Seen 3 guys go head first over a rail tonight. Literally saw a guy jump from second level to pool in PHX a few years back too #Idiots 🤦‍♂️",en,[],[],[],0,0,0,"['hrderby', 'idiots']",[],https://twitter.com/TheAranastotle/status/1414753321609359360,False,,0,,phoenix,,,,,,[],,,,
1414749699668471808,1414749699668471808,2021-07-12 19:53:07 CDT,2021-07-12,19:53:07,-0500,44370676,jlpng2013,Jeffrey Pourier,,"Finally getting to some nabi games.   Run N Gun over Lady Unity Red 65 to 32  Star Anderson, Mya Johnson and Adiyah Chee Showing out on both ends of the court.  @AZSPORTSNETWORK @JadaPourier",en,"[{'screen_name': 'azsportsnetwork', 'name': 'azsportsnetwork', 'id': '30022929'}, {'screen_name': 'jadapourier', 'name': 'jada pourier', 'id': '1184546049488121856'}]",[],[],0,1,1,[],[],https://twitter.com/jlpng2013/status/1414749699668471808,False,,0,,phoenix,,,,,,[],,,,
1414743766934581269,1414743766934581269,2021-07-12 19:29:33 CDT,2021-07-12,19:29:33,-0500,44370676,jlpng2013,Jeffrey Pourier,,NABI 2021 RUN N GUN up at the half 23 15 over Lady Unity Red @AZSPORTSNETWORK  https://t.co/6F1FTxbduP,en,"[{'screen_name': 'azsportsnetwork', 'name': 'azsportsnetwork', 'id': '30022929'}]",[],['https://pbs.twimg.com/media/E6It7kEVIAIuh4b.jpg'],0,1,4,[],[],https://twitter.com/jlpng2013/status/1414743766934581269,False,,1,https://pbs.twimg.com/media/E6It7kEVIAIuh4b.jpg,phoenix,,,,,,[],,,,
1414743004221345796,1414743004221345796,2021-07-12 19:26:31 CDT,2021-07-12,19:26:31,-0500,44370676,jlpng2013,Jeffrey Pourier,,"Finally getting to som nabi games.   Run N Gun up over Lady Unity Red 23 to 15 at the half.  Star Anderson, Mya Johnson and Adiyah Chee Showing out in the 1st half.  @AZSPORTSNETWORK @JadaPourier",en,"[{'screen_name': 'azsportsnetwork', 'name': 'azsportsnetwork', 'id': '30022929'}, {'screen_name': 'jadapourier', 'name': 'jada pourier', 'id': '1184546049488121856'}]",[],[],0,1,1,[],[],https://twitter.com/jlpng2013/status/1414743004221345796,False,,0,,phoenix,,,,,,[],,,,
1414739722535006219,1414730850831273984,2021-07-12 19:13:29 CDT,2021-07-12,19:13:29,-0500,1639547144,asu_sdasa,Sun Devils Against Sexual Assault,,"“Sep. 2019, Wear was allowed to go w #ASU donors to a game at MSU. By then there were ‘ten credible reports of Wear’s assaults and sexual harassment’ and the school was investigating his conduct. ‘Nonetheless, Wear continued to enjoy the benefits of being a prominent ASU donor.’”",en,[],[],[],0,1,0,['asu'],[],https://twitter.com/asu_sdasa/status/1414739722535006219,False,,0,,phoenix,,,,,,[],,,,
1414730850831273984,1414730850831273984,2021-07-12 18:38:13 CDT,2021-07-12,18:38:13,-0500,1639547144,asu_sdasa,Sun Devils Against Sexual Assault,,“The lawsuit alleges that #ASU officials waited nearly 5 mo. to investigate claims of ‘assault &amp; sexual harassment’ from wives of 3 athletic department employees. ASU admitted last year the situation ‘could have been resolved in a quicker time frame.’”   https://t.co/uzBYYdIjUm,en,[],['https://yhoo.it/36tKtRT'],[],2,2,5,['asu'],[],https://twitter.com/asu_sdasa/status/1414730850831273984,False,,0,,phoenix,,,,,,[],,,,
1414727732642992130,1414721272244801537,2021-07-12 18:25:50 CDT,2021-07-12,18:25:50,-0500,1159261994,bricepartain92,Brice Partain,,@MSNBC @MaddowBlog No he sees you as the enemy… as you are Rachel you see your seething anger is why your  viewership is falling you carry the hate … I’ll give the benefit of the doubt that you are blinded by your hate but it is in the end your hate. Tell the truth! It will set you free,en,[],[],[],0,0,0,[],[],https://twitter.com/BricePartain92/status/1414727732642992130,False,,0,,phoenix,,,,,,"[{'screen_name': 'MSNBC', 'name': 'MSNBC', 'id': '2836421'}, {'screen_name': 'MaddowBlog', 'name': 'Maddow Blog', 'id': '91180720'}]",,,,
1414719401983582210,1414659885891997697,2021-07-12 17:52:44 CDT,2021-07-12,17:52:44,-0500,16071835,azmatthews,AzSandi,,"@Suite_Tea @killafran What in the absolute Fuck? Did she say ""she tried to grab me""? Did the cops come for this crime of ""she's taping me""?",en,[],[],[],0,1,10,[],[],https://twitter.com/azmatthews/status/1414719401983582210,False,,0,,phoenix,,,,,,"[{'screen_name': 'Suite_Tea', 'name': 'Racial Nichols', 'id': '800637505'}, {'screen_name': 'killafran', 'name': 'Or Maybe We Can Just Be Silent', 'id': '63032347'}]",,,,
1414712187227041794,1414712184228040708,2021-07-12 17:24:04 CDT,2021-07-12,17:24:04,-0500,844408839252398082,fakenews4utoo,Cornelius James,,news. The biggest surprise at the U.S. trials was Donavon Brazier. I really did feel sorry for him. He showed signs of severe distress with 300m to go and was definitely in serious danger with 200m to go.  It was sad to watch the anguish in his facial expression with 150m to go.,en,[],[],[],0,0,0,[],[],https://twitter.com/fakenews4utoo/status/1414712187227041794,False,,0,,phoenix,,,,,,[],,,,
1414707896307179521,1414707896307179521,2021-07-12 17:07:01 CDT,2021-07-12,17:07:01,-0500,1128388810239164416,chaunceysprague,🌹Socialist Shih Tzu🐶,,We need to educate people about the harm that sanctions actually bring to the people of countries and not the government.,en,[],[],[],0,0,1,[],[],https://twitter.com/ChaunceySprague/status/1414707896307179521,False,,0,,phoenix,,,,,,[],,,,
1414698060265902092,1414698060265902092,2021-07-12 16:27:56 CDT,2021-07-12,16:27:56,-0500,31006910,kitotterkat,kate,,Seeing the instances of horrific racism and domestic violence following #EURO2020 has me completely and totally demoralized. Racism is a cancer that has infected this whole world.,en,[],[],[],0,0,0,['euro2020'],[],https://twitter.com/kitotterkat/status/1414698060265902092,False,,0,,phoenix,,,,,,[],,,,
1414679913022431232,1414679913022431232,2021-07-12 15:15:49 CDT,2021-07-12,15:15:49,-0500,1639547144,asu_sdasa,Sun Devils Against Sexual Assault,,⚠️ Trigger Warning: Sexual assault  “I had to stay in two classes for the rest of the semester and be reminded of what happened. I told myself the bruises on my neck from him holding me down were hickeys.” — #MeTooASU #52  https://t.co/MOyDoVYxPG  #ASU  https://t.co/OnUgxrLxKd,en,[],['http://bit.ly/metooasu52'],['https://pbs.twimg.com/media/E6Hz4ObUcAEFX-a.jpg'],0,0,0,"['metooasu', 'asu']",[],https://twitter.com/asu_sdasa/status/1414679913022431232,False,,1,https://pbs.twimg.com/media/E6Hz4ObUcAEFX-a.jpg,phoenix,,,,,,[],,,,
1414673433380605954,1414663207772254209,2021-07-12 14:50:04 CDT,2021-07-12,14:50:04,-0500,702721914981085184,7noslen,LAKESHOW,,@rockyxjoaquin97 Just bought a gun,en,[],[],[],1,0,0,[],[],https://twitter.com/7noslen/status/1414673433380605954,False,,0,,phoenix,,,,,,"[{'screen_name': 'rockyxjoaquin97', 'name': 'asshole.', 'id': '171129505'}]",,,,
1414665265216835585,1414665265216835585,2021-07-12 14:17:37 CDT,2021-07-12,14:17:37,-0500,1397646982198358018,thejfkreport,TheJFKReport,,Crime in blue cities will never go back down unless you give the law abiding citizens it's 2nd Amendment back. Watch how closely criminals stop being criminals.,en,[],[],[],0,0,0,[],[],https://twitter.com/TheJFKReport/status/1414665265216835585,False,,0,,phoenix,,,,,,[],,,,
1414661243630067730,1414465436339560452,2021-07-12 14:01:38 CDT,2021-07-12,14:01:38,-0500,1257164489562046465,nutz_beat,BeatNutz,,@NicoNiceWitIt Understandable really fake love is pretty weird I don’t get why people get bent over you just not wanting that in yo life like it’s a crime 😂💯,en,[],[],[],0,0,1,[],[],https://twitter.com/nutz_beat/status/1414661243630067730,False,,0,,phoenix,,,,,,"[{'screen_name': 'NicoNiceWitIt', 'name': 'Nico ⛈', 'id': '1004018029548666881'}]",,,,
1414641448226496512,1414636423387533317,2021-07-12 12:42:58 CDT,2021-07-12,12:42:58,-0500,917483373085392896,natebrownnews,Nathan Brown,,"@kramerp33 @DrewSav Kind of, but local/state police can arrest people in an airport which is what matters here.",en,[],[],[],0,0,14,[],[],https://twitter.com/NateBrownNews/status/1414641448226496512,False,,0,,phoenix,,,,,,"[{'screen_name': 'kramerp33', 'name': 'PK', 'id': '520645591'}, {'screen_name': 'DrewSav', 'name': 'Drew Savicki', 'id': '901915347556675584'}]",,,,
1414635686158761989,1414635686158761989,2021-07-12 12:20:04 CDT,2021-07-12,12:20:04,-0500,84962565,spearman23,Spearknight,,"A million tiny dicked men are rage tweeting ""the gub'ment is cumin Fer our guns"" right now.  https://t.co/Xc699pXsn2",en,[],[],['https://pbs.twimg.com/media/E6HLqGVUYAgom6Z.jpg'],0,0,0,[],[],https://twitter.com/spearman23/status/1414635686158761989,False,,1,https://pbs.twimg.com/media/E6HLqGVUYAgom6Z.jpg,phoenix,,,,,,[],,,,
1414616256481665024,1414279558891675650,2021-07-12 11:02:52 CDT,2021-07-12,11:02:52,-0500,19282667,daryosharlah,Jessiey,,@cheezygraham Someday i gotta tell you about my horrible pitch for the sequel with muscle gun Wispin lol,en,[],[],[],0,0,1,[],[],https://twitter.com/DaryoSharlah/status/1414616256481665024,False,,0,,phoenix,,,,,,"[{'screen_name': 'cheezygraham', 'name': 'Chris Graham', 'id': '2266305030'}]",,,,
