id,conversation_id,created_at,date,time,timezone,user_id,username,name,place,tweet,language,mentions,urls,photos,replies_count,retweets_count,likes_count,hashtags,cashtags,link,retweet,quote_url,video,thumbnail,near,geo,source,user_rt_id,user_rt,retweet_id,reply_to,retweet_date,translate,trans_src,trans_dest
1491904735036821505,1491904735036821505,2022-02-10 16:39:41 CST,2022-02-10,16:39:41,-0500,753973393,benfennell_nfl,Ben Fennell,,Nearly every explosive play from Skyy Moore in 2021 was vs press coverage…  Impressive player with speed/suddenness and excellent hands. YAC weapon and vertical threat  DB/QB in HS at Shady Side Academy in Pittsburgh  https://t.co/iuyHMWnlQU,en,[],[],[],18,43,250,[],[],https://twitter.com/BenFennell_NFL/status/1491904735036821505,False,,1,https://pbs.twimg.com/ext_tw_video_thumb/1491904687368511494/pu/img/ZXvCDx_OB8Gx2h66.jpg,philadelphia,,,,,,[],,,,
1491902154440949761,1491902154440949761,2022-02-10 16:29:26 CST,2022-02-10,16:29:26,-0500,952315901243772929,kyekapri,𝕾𝖈𝖆𝖗𝖑𝖊𝖙 𝖂𝖆𝖗𝖑𝖔𝖈₭,,NGL next big avengers level threat we need our #MCUBig4 to do their big one and tear some shit up BUT together @comics2fun  https://t.co/Bc8o3GwK5m,en,"[{'screen_name': 'comics2fun', 'name': 'comics2fun', 'id': '1475600828383870983'}]",[],['https://pbs.twimg.com/media/FLRNGffXsAAvBfn.jpg'],1,1,3,['mcubig4'],[],https://twitter.com/KyeKapri/status/1491902154440949761,False,,1,https://pbs.twimg.com/media/FLRNGffXsAAvBfn.jpg,philadelphia,,,,,,[],,,,
1491897898304475136,1491897898304475136,2022-02-10 16:12:31 CST,2022-02-10,16:12:31,-0500,18667966,supertrucker,Justin Martin,,Sure they could be investigating human trafficking but I hope the agent snooping my shitposts gets a chuckle here and there.,en,[],[],[],1,0,2,[],[],https://twitter.com/supertrucker/status/1491897898304475136,False,https://twitter.com/ChuckCallesto/status/1491798170182897664,0,,philadelphia,,,,,,[],,,,
1491897882580029444,1491890914352111626,2022-02-10 16:12:27 CST,2022-02-10,16:12:27,-0500,221887034,njburm,Shari,,@fred_guttenberg @jim_lamon @GabbyGiffords @CaptMarkKelly Sadly this is in AZ where people wear their holstered weapon to the grocery store,en,[],[],[],0,0,0,[],[],https://twitter.com/njburm/status/1491897882580029444,False,,0,,philadelphia,,,,,,"[{'screen_name': 'fred_guttenberg', 'name': 'Fred Guttenberg', 'id': '967027984426242053'}, {'screen_name': 'jim_lamon', 'name': 'Jim Lamon', 'id': '1381993390968086533'}, {'screen_name': 'GabbyGiffords', 'name': 'Gabrielle Giffords', 'id': '44177383'}, {'screen_name': 'CaptMarkKelly', 'name': 'Captain Mark Kelly', 'id': '65707359'}]",,,,
1491889287050244103,1491107920154853378,2022-02-10 15:38:18 CST,2022-02-10,15:38:18,-0500,1384880608325865475,irish191919,Irish1919,,"@DiceCookPlate @stevanzetti Biden is terrible. We don’t need kids getting safe smoking kids. We don’t really need him at all. He’s pitching an ofer last 12 months if you’re up on current events..border crisis, major crime surge, inflation all time high of 30 years, Ukraine, Russia. Nothing major. Hahaha",en,[],[],[],1,0,0,[],[],https://twitter.com/irish191919/status/1491889287050244103,False,,0,,philadelphia,,,,,,"[{'screen_name': 'DiceCookPlate', 'name': 'Lisa', 'id': '418825721'}, {'screen_name': 'stevanzetti', 'name': 'steven monacelli, gonzo journeyman', 'id': '1079916807257939968'}]",,,,
1491887549639495682,1491854448867651587,2022-02-10 15:31:24 CST,2022-02-10,15:31:24,-0500,291759261,tdurkin34,Tim Durkin Sr.,,@DZangaroNBCS Wendy’s suspending free frosty and fries when nets are in town. Figure they might go bankrupt with Ben shooting foul shots!! #hackaben,en,[],[],[],0,0,0,['hackaben'],[],https://twitter.com/tdurkin34/status/1491887549639495682,False,,0,,philadelphia,,,,,,"[{'screen_name': 'DZangaroNBCS', 'name': 'Dave Zangaro', 'id': '221845267'}]",,,,
1491887402767552515,1491877933346013190,2022-02-10 15:30:49 CST,2022-02-10,15:30:49,-0500,291759261,tdurkin34,Tim Durkin Sr.,,@JClarkNBCS Wendy’s suspending free frosty and fries when nets are in town. Figure they might go bankrupt with Ben shooting foul shots!! #hackaben @KevinNegandhi,en,"[{'screen_name': 'kevinnegandhi', 'name': 'kevin negandhi', 'id': '41023170'}]",[],[],0,0,0,['hackaben'],[],https://twitter.com/tdurkin34/status/1491887402767552515,False,,0,,philadelphia,,,,,,"[{'screen_name': 'JClarkNBCS', 'name': 'John Clark', 'id': '148476464'}]",,,,
1491879217423867906,1491849458996301827,2022-02-10 14:58:17 CST,2022-02-10,14:58:17,-0500,291759261,tdurkin34,Tim Durkin Sr.,,@NBCSPhilly @JHarden13 Wendy’s suspending free frosty and fries when nets are in town. Figure they might go bankrupt with Ben shooting foul shots!! #hackaben,en,[],[],[],0,0,4,['hackaben'],[],https://twitter.com/tdurkin34/status/1491879217423867906,False,,0,,philadelphia,,,,,,"[{'screen_name': 'NBCSPhilly', 'name': 'NBC Sports Philadelphia', 'id': '17799205'}, {'screen_name': 'JHarden13', 'name': 'James Harden', 'id': '50811932'}]",,,,
1491876854843719681,1491836715182563328,2022-02-10 14:48:54 CST,2022-02-10,14:48:54,-0500,1453797714710368256,melissacaren3,Melissa Milarsky🌹,,"@snifflesnack Oh no, I look at them and get scared.  I think that would freak me out with my anxiety, I hope it’s coming out.. drink tons of water Kevin.. that’s brutal.  Sending hugs 🤗",en,[],[],[],1,0,1,[],[],https://twitter.com/MelissaCaren3/status/1491876854843719681,False,,0,,philadelphia,,,,,,"[{'screen_name': 'snifflesnack', 'name': 'KEVIN', 'id': '1258253579347013632'}]",,,,
1491875192431337472,1491875192431337472,2022-02-10 14:42:18 CST,2022-02-10,14:42:18,-0500,3224680493,ppd16dist,PPD 16thDistrict,,State Rep. Brown speaking with 16th District Officers and Community Organizer at Anti-Gun Violence Rally. 38th Wallace Streets  https://t.co/xD6LdiFJt1,en,[],[],['https://pbs.twimg.com/media/FLQ0jaSXIAIK3nw.jpg'],0,1,4,[],[],https://twitter.com/PPD16Dist/status/1491875192431337472,False,,1,https://pbs.twimg.com/media/FLQ0jaSXIAIK3nw.jpg,philadelphia,,,,,,[],,,,
1491873000496545797,1491872458030288896,2022-02-10 14:33:35 CST,2022-02-10,14:33:35,-0500,922226420398678016,gilliamdray,Meowcus 🐈 Smart,,Wow i botched this.   *but I doubt doubt his shooting was sustainable*,en,[],[],[],0,0,0,[],[],https://twitter.com/gilliamdray/status/1491873000496545797,False,,0,,philadelphia,,,,,,[],,,,
1491872458030288896,1491872458030288896,2022-02-10 14:31:26 CST,2022-02-10,14:31:26,-0500,922226420398678016,gilliamdray,Meowcus 🐈 Smart,,I will miss Josh Richardson his shooting was sustainable given his career numbers. Cs probably sold high on him.,en,[],[],[],1,0,2,[],[],https://twitter.com/gilliamdray/status/1491872458030288896,False,,0,,philadelphia,,,,,,[],,,,
1491869299287502853,1491869299287502853,2022-02-10 14:18:53 CST,2022-02-10,14:18:53,-0500,3650129776,pfdfiremedic32,James A Kalb,,Delaware County fire company suspended pending investigation into alleged racist comments   https://t.co/HsqEVeU8mD,en,[],['http://fox29.com/news/delaware-county-fire-company-suspended-pending-investigation-into-alleged-racist-comments'],[],0,0,0,[],[],https://twitter.com/PFDFIREMEDIC32/status/1491869299287502853,False,,0,,philadelphia,,,,,,[],,,,
1491869020215287818,1491869020215287818,2022-02-10 14:17:46 CST,2022-02-10,14:17:46,-0500,3224680493,ppd16dist,PPD 16thDistrict,,Officers Riley &amp; Marks standing with Sam Samuels (MCA) at the protest. 38th &amp; Wallace Streets.  https://t.co/nqplCqA7Cq,en,[],[],['https://pbs.twimg.com/media/FLQu9WmXwAET2H9.jpg'],0,1,3,[],[],https://twitter.com/PPD16Dist/status/1491869020215287818,False,,1,https://pbs.twimg.com/media/FLQu9WmXwAET2H9.jpg,philadelphia,,,,,,[],,,,
1491866642866970627,1491866642866970627,2022-02-10 14:08:19 CST,2022-02-10,14:08:19,-0500,3224680493,ppd16dist,PPD 16thDistrict,,"Captain Herder speaking with Councilwoman Guthier and Rikeyah from MVMCDC at the anti- gun violence rally, 38th &amp; Wallace.  https://t.co/ydnOM3m9Bu",en,[],[],['https://pbs.twimg.com/media/FLQsy4yX0AY_ru1.jpg'],0,1,3,[],[],https://twitter.com/PPD16Dist/status/1491866642866970627,False,,1,https://pbs.twimg.com/media/FLQsy4yX0AY_ru1.jpg,philadelphia,,,,,,[],,,,
1491862276885950471,1491474124518141958,2022-02-10 13:50:58 CST,2022-02-10,13:50:58,-0500,1581500556,abumarjaanah,Naasirud-Deen,,"@KhalilDDarwish @SalafiPubs Very well-known fact. Many new comers don’t know… And those who are in opposition that actually know, they prey on the ignorance of the newcomers and fuel their ignorance with misinformation. May Allah relieve us of their harm.",en,[],[],[],0,1,4,[],[],https://twitter.com/AbuMarjaanah/status/1491862276885950471,False,,0,,philadelphia,,,,,,"[{'screen_name': 'KhalilDDarwish', 'name': 'Khalil Darwish', 'id': '2830199805'}, {'screen_name': 'SalafiPubs', 'name': 'Salafi Publications', 'id': '89741981'}]",,,,
1491861449685274636,1491609897359843329,2022-02-10 13:47:41 CST,2022-02-10,13:47:41,-0500,1202657267251908618,theephanatic215,Phanatic215,,@Allia22222 @SampathPanini @michaelmalice @DailyCoffee533 They do the same thing at every protest that gets crazy and then pretends that what they're showing is reality. It's a shame it took that incident for everyone to realize the shenanigans that were afoot in summer of 2020.,en,[],[],[],1,0,1,[],[],https://twitter.com/TheePhanatic215/status/1491861449685274636,False,,0,,philadelphia,,,,,,"[{'screen_name': 'Allia22222', 'name': 'Allia22', 'id': '1284117743810347009'}, {'screen_name': 'SampathPanini', 'name': 'Sam Pāṇini ® 🇺🇸', 'id': '3564491'}, {'screen_name': 'michaelmalice', 'name': 'Michael Malice', 'id': '44067298'}, {'screen_name': 'DailyCoffee533', 'name': 'The Daily Trucking 🇺🇸', 'id': '1400155155744661511'}]",,,,
1491854759288086532,1491527198834003970,2022-02-10 13:21:06 CST,2022-02-10,13:21:06,-0500,1483667844,billtruthfinder,Bill Fleisher,,@luvwhiskey_wine No. It would be a crime against humanity.,en,[],[],[],0,0,0,[],[],https://twitter.com/BillTruthfinder/status/1491854759288086532,False,,0,,philadelphia,,,,,,"[{'screen_name': 'luvwhiskey_wine', 'name': 'Kim Whiskey 💃🥃🥂', 'id': '1131271887047266311'}]",,,,
1491854177366159360,1491847898342043651,2022-02-10 13:18:47 CST,2022-02-10,13:18:47,-0500,23511468,jillco,Jill,,@JeffGold81 @joe_manniello He's been sick and injured all season. Scored about 4 points last game.,en,[],[],[],1,0,0,[],[],https://twitter.com/jillco/status/1491854177366159360,False,,0,,philadelphia,,,,,,"[{'screen_name': 'JeffGold81', 'name': 'Jeff Gold', 'id': '419823873'}, {'screen_name': 'joe_manniello', 'name': 'Joe Manniello', 'id': '3611568795'}]",,,,
1491852894706012162,1491852894706012162,2022-02-10 13:13:42 CST,2022-02-10,13:13:42,-0500,166042328,the_peace_mann,🅰️li,,Why did u slide through there solo with out a gun is still my point 🤦🏾‍♂️😅,en,[],[],[],0,0,0,[],[],https://twitter.com/The_peace_mann/status/1491852894706012162,False,https://twitter.com/madeitnewztv/status/1491726009464504322,0,,philadelphia,,,,,,[],,,,
