id,conversation_id,created_at,date,time,timezone,user_id,username,name,place,tweet,language,mentions,urls,photos,replies_count,retweets_count,likes_count,hashtags,cashtags,link,retweet,quote_url,video,thumbnail,near,geo,source,user_rt_id,user_rt,retweet_id,reply_to,retweet_date,translate,trans_src,trans_dest
659517914056425472,659517914056425472,2015-10-28 18:51:38 CDT,2015-10-28,18:51:38,-0500,1102016894,phillyed592,philEDelphia,,@JahlilOkafor looking great so far! 10 points on 5 of 5 shooting halfway through the 1st quarter! Hell yeah! Kids on🔥🔥🔥 #Sixers,en,[],[],[],0,0,0,['sixers'],[],https://twitter.com/PhillyEd592/status/659517914056425472,False,,0,,philadelphia,,,,,,[],,,,
659515717121871872,659515717121871872,2015-10-28 18:42:54 CDT,2015-10-28,18:42:54,-0500,442306310,shakurw_,shake🦍💯,,2 days++ Luv Is Rage🎸🎸,en,[],[],[],0,0,0,[],[],https://twitter.com/shakurW_/status/659515717121871872,False,,0,,philadelphia,,,,,,[],,,,
659513638504390656,659513638504390656,2015-10-28 18:34:39 CDT,2015-10-28,18:34:39,-0500,1543372111,kwineland02,krysXXX,,"happy birthday to my partner in crime since 5th grade💓 thanks for always being there, love you lots have a gr8 day😽  https://t.co/p0sEhW0GUg",en,[],[],['https://pbs.twimg.com/media/CScQJvqWUAAt3B_.jpg'],2,0,4,[],[],https://twitter.com/kwineland02/status/659513638504390656,False,,1,https://pbs.twimg.com/media/CScQJvqWUAAt3B_.jpg,philadelphia,,,,,,[],,,,
659511855086350336,659511855086350336,2015-10-28 18:27:34 CDT,2015-10-28,18:27:34,-0500,185194792,dominickambro,dominick ambrosia,"{'type': 'Point', 'coordinates': [40.0298359, -75.0537091]}","CNN: Dog named Trigger steps on gun, shoots owner @CNN  https://t.co/DQXSUSTjwN",en,"[{'screen_name': 'cnn', 'name': 'cnn', 'id': '759251'}]",['http://cnn.it/1P2tGWU'],[],0,0,0,[],[],https://twitter.com/dominickambro/status/659511855086350336,False,,0,,philadelphia,,,,,,[],,,,
659503724621127683,659503724621127683,2015-10-28 17:55:15 CDT,2015-10-28,17:55:15,-0500,182527683,dr7854,Dennis R,,"@MSNBC Said b4I'll say again,as is truly no-brainer!If girl's father did what officer did,father'd b in jail4child abuse&amp;likely lose child!",en,[],[],[],0,0,0,[],[],https://twitter.com/dr7854/status/659503724621127683,False,,0,,philadelphia,,,,,,[],,,,
659498999074942981,659498999074942981,2015-10-28 17:36:28 CDT,2015-10-28,17:36:28,-0500,143913915,nygiantssuck,Let's go Brandon,,@cnnbrk #CNN IS RACIST WHATs IT MATTER IF THE KID WAS BLACK are they trying to say white people are better Cuz the kid arrested was BLACK,en,[],[],[],0,0,0,['cnn'],[],https://twitter.com/NYgiantsSUCK/status/659498999074942981,False,,0,,philadelphia,,,,,,[],,,,
659493038167891968,659493038167891968,2015-10-28 17:12:47 CDT,2015-10-28,17:12:47,-0500,222618037,shuffleboxpro,Shufflebox Pro,"{'type': 'Point', 'coordinates': [39.9479942, -75.1643524]}",Spending the night in #Philadelphia before shooting a talk in the morning.   #videoproduction…  https://t.co/pLhRVL8S1J,en,[],['https://instagram.com/p/9Zck0ClXtr/'],[],0,1,2,"['philadelphia', 'videoproduction']",[],https://twitter.com/shuffleboxpro/status/659493038167891968,False,,0,,philadelphia,,,,,,[],,,,
659483576094691329,659483576094691329,2015-10-28 16:35:11 CDT,2015-10-28,16:35:11,-0500,57976284,philadelphiacp,Philadelphia Now,"{'type': 'Point', 'coordinates': [39.93997834, -75.16645509]}","Man, 84, Victim of Society Hill Home Invasion, Robbery: A robber targeted an 84-year-old man in Society Hill on…  https://t.co/e6wVUuBzQG",en,[],['http://philadelphia.cityandpress.com/node/10378432'],[],0,0,0,[],[],https://twitter.com/PhiladelphiaCP/status/659483576094691329,False,,0,,philadelphia,,,,,,[],,,,
659483567093772288,659483567093772288,2015-10-28 16:35:09 CDT,2015-10-28,16:35:09,-0500,57976284,philadelphiacp,Philadelphia Now,"{'type': 'Point', 'coordinates': [39.93997834, -75.16645509]}",Anti-violence group releases rap video for Murray Bailey: Campaign raps are definitely becoming a thing in…  https://t.co/Gi7nQoA87e,en,[],['http://philadelphia.cityandpress.com/node/10378114'],[],0,0,0,[],[],https://twitter.com/PhiladelphiaCP/status/659483567093772288,False,,0,,philadelphia,,,,,,[],,,,
659480844545998848,659466758210854912,2015-10-28 16:24:20 CDT,2015-10-28,16:24:20,-0500,58926582,chantheplug,Chandre 3k,,@MyMamas_Gun exactly. They never tell you the truth.,en,[],[],[],0,0,0,[],[],https://twitter.com/chantheplug/status/659480844545998848,False,,0,,philadelphia,,,,,,[],,,,
659478784479993856,659478784479993856,2015-10-28 16:16:09 CDT,2015-10-28,16:16:09,-0500,43532023,schemaly,Soraya Chemaly,,Estimates of officer-perpetrated domestic violence range between 4 and 15x rates in the general public. #DVAM  https://t.co/nZMjmcFhaj,en,[],['https://medium.com/@schemaly/a-criminal-justice-system-that-won-t-police-itself-can-t-be-trusted-to-police-communities-fadab53dfd11#.ftrjsq3cq'],[],0,13,6,['dvam'],[],https://twitter.com/schemaly/status/659478784479993856,False,,0,,philadelphia,,,,,,[],,,,
659472782842052608,659472782842052608,2015-10-28 15:52:18 CDT,2015-10-28,15:52:18,-0500,2759857940,killa7_,-R.I.P AD7️⃣,,"Gun fights every night,",en,[],[],[],0,0,0,[],[],https://twitter.com/Killa7_/status/659472782842052608,False,,0,,philadelphia,,,,,,[],,,,
659471744428855296,659471744428855296,2015-10-28 15:48:10 CDT,2015-10-28,15:48:10,-0500,635425663,ringsideruckus,RINGSIDE RUCKUS,,@ThaboSefolosha The sad reality in this Country is that anyone can fall victim to these renegade police.  https://t.co/hTUd5MQsKO,en,[],[],['https://pbs.twimg.com/tweet_video_thumb/CSbqCjEWcAAYiEQ.png'],0,0,0,[],[],https://twitter.com/RINGSIDERUCKUS/status/659471744428855296,False,,1,https://pbs.twimg.com/tweet_video_thumb/CSbqCjEWcAAYiEQ.png,philadelphia,,,,,,[],,,,
659469479517265920,659469479517265920,2015-10-28 15:39:10 CDT,2015-10-28,15:39:10,-0500,241463537,schneidremarks,Marty Schneider,,Anger towards remakes or adaptations just makes me think you're mad the new generation likes things slightly different than what you like.,en,[],[],[],1,0,1,[],[],https://twitter.com/SchneidRemarks/status/659469479517265920,False,,0,,philadelphia,,,,,,[],,,,
659466329926275072,659466052720533504,2015-10-28 15:26:40 CDT,2015-10-28,15:26:40,-0500,58926582,chantheplug,Chandre 3k,,@MyMamas_Gun I swear I never learned that growing up. I'm not sure what I learned now that I think about it. Lol,en,[],[],[],1,0,0,[],[],https://twitter.com/chantheplug/status/659466329926275072,False,,0,,philadelphia,,,,,,[],,,,
659453573344964612,659453573344964612,2015-10-28 14:35:58 CDT,2015-10-28,14:35:58,-0500,492119820,cocainecowboy92,Stew Pit,,I'm not going to kill your mother just because I watch murder porn,en,[],[],[],0,0,0,[],[],https://twitter.com/cocainecowboy92/status/659453573344964612,False,,0,,philadelphia,,,,,,[],,,,
659453402569666560,659443900378124289,2015-10-28 14:35:17 CDT,2015-10-28,14:35:17,-0500,2272057687,merma_bixies,Merma🐾,,"@BrigoLOTRO Most likely not, these days it's call the cops and ruin a dumb kids life. OKshe was wrong but punishment should mirror the crime",en,[],[],[],2,0,0,[],[],https://twitter.com/Merma_bixies/status/659453402569666560,False,,0,,philadelphia,,,,,,[],,,,
659452552237350912,659442059443576832,2015-10-28 14:31:55 CDT,2015-10-28,14:31:55,-0500,603249104,gowestyoungman1,ONEFeltonvilleCCDA,,"@PPDJimCoughlin incidentally, Tom (JNews) said ""Yes"" to your request for Crime Report each week. THANKS!",en,[],[],[],0,0,0,[],[],https://twitter.com/GoWestYoungMan1/status/659452552237350912,False,,0,,philadelphia,,,,,,[],,,,
659452483002081280,659452483002081280,2015-10-28 14:31:38 CDT,2015-10-28,14:31:38,-0500,33717365,karenfox29,Karen Hepp,,".@BensalemPolice say this is the hit and run victim killed last night, the driver is being questioned  @FOX29philly  https://t.co/7L91ZcdGta",en,"[{'screen_name': 'bensalempolice', 'name': 'bensalem police', 'id': '296903457'}, {'screen_name': 'fox29philly', 'name': 'fox 29', 'id': '14787713'}]",[],['https://pbs.twimg.com/media/CSbYictUwAAMLCK.jpg'],1,2,3,[],[],https://twitter.com/KarenFox29/status/659452483002081280,False,,1,https://pbs.twimg.com/media/CSbYictUwAAMLCK.jpg,philadelphia,,,,,,[],,,,
659452125840351232,659452125840351232,2015-10-28 14:30:13 CDT,2015-10-28,14:30:13,-0500,2263836066,emmabaerrera,EKB,,convinced that boys use snapchat as a weapon to play some weird mind game,en,[],[],[],0,0,7,[],[],https://twitter.com/emmaBAErrera/status/659452125840351232,False,,0,,philadelphia,,,,,,[],,,,
