id,conversation_id,created_at,date,time,timezone,user_id,username,name,place,tweet,language,mentions,urls,photos,replies_count,retweets_count,likes_count,hashtags,cashtags,link,retweet,quote_url,video,thumbnail,near,geo,source,user_rt_id,user_rt,retweet_id,reply_to,retweet_date,translate,trans_src,trans_dest
567834020777615360,567834020777615360,2015-02-17 17:52:35 CST,2015-02-17,17:52:35,-0500,555434056,arianalvearr,Ariana Alvear,"{'type': 'Point', 'coordinates': [30.37776476, -97.7317487]}",Brutal leg day💦💪,no,[],[],[],1,0,0,[],[],https://twitter.com/arianalvearr/status/567834020777615360,False,,0,,austin,,,,,,[],,,,
567806057336053760,567805397425262592,2015-02-17 16:01:28 CST,2015-02-17,16:01:28,-0500,234150705,zweiliga,Troy,,"Contrarily, Crosby's career SH% is 14.7%. Currently under 12, so if he starts shooting the puck over the last 30 games he's bound to score",en,[],[],[],0,0,0,[],[],https://twitter.com/zweiLiga/status/567806057336053760,False,,0,,austin,,,,,,[],,,,
567801454636883968,567801454636883968,2015-02-17 15:43:10 CST,2015-02-17,15:43:10,-0500,62413708,austin_cp,Austin Now,"{'type': 'Point', 'coordinates': [30.26960519, -97.74361687]}",Police: Round Rock teen fired gun while chasing vehicle: A Round Rock teenager was charged with deadly conduct…  http://t.co/k3pKbGw9bQ,en,[],['http://austin.cityandpress.com/node/9148624'],[],0,0,0,[],[],https://twitter.com/Austin_CP/status/567801454636883968,False,,0,,austin,,,,,,[],,,,
567784334296248321,567780838235181056,2015-02-17 14:35:08 CST,2015-02-17,14:35:08,-0500,2431105921,choppymoore,Choppy Moore,"{'type': 'Point', 'coordinates': [30.4468379, -97.7526811]}",@OTLonESPN I didn't see many athletes protesting the shooting of two innocent police officers. What about their families?,en,[],[],[],0,0,0,[],[],https://twitter.com/ChoppyMoore/status/567784334296248321,False,,0,,austin,,,,,,[],,,,
567767710168125440,567422825300889600,2015-02-17 13:29:05 CST,2015-02-17,13:29:05,-0500,32252141,snickerszlove,cottagecore demon,,"@fukuropinion @LFESexuality by the way, we weren't talking about robberies/mugging. We were talking about rape. But hey, that's nice to know",en,"[{'screen_name': 'lfesexuality', 'name': 'libfemequalsexuality', 'id': '2987439296'}]",[],[],3,0,0,[],[],https://twitter.com/snickerszlove/status/567767710168125440,False,,0,,austin,,,,,,[],,,,
567766945895026688,567766945895026688,2015-02-17 13:26:03 CST,2015-02-17,13:26:03,-0500,104715525,legiscantx,LegiScan TX,"{'type': 'Point', 'coordinates': [30.274001, -97.740631]}","HR551 [NEW] Recognizing February 23, 2015, as Crime Stoppers Day at the State Capitol.  http://t.co/yUqhC7cD04",en,[],['http://bitly.com/ZpzXk4'],[],0,0,0,[],[],https://twitter.com/LegiScanTX/status/567766945895026688,False,,0,,austin,,,,,,[],,,,
567763285061201920,567422825300889600,2015-02-17 13:11:30 CST,2015-02-17,13:11:30,-0500,32252141,snickerszlove,cottagecore demon,,"@Mztxh you just did, when you dismissed rape statistics by saying girls ""cry wolf"" all the time anyway instead of believing them",en,[],[],[],0,0,0,[],[],https://twitter.com/snickerszlove/status/567763285061201920,False,,0,,austin,,,,,,[],,,,
567762091017121792,567422825300889600,2015-02-17 13:06:45 CST,2015-02-17,13:06:45,-0500,32252141,snickerszlove,cottagecore demon,,@Mztxh @LFESexuality but i'll let you go on your ignorant merry way as you laugh at abuse/rape victims &amp; buy american sniper on DVD,en,"[{'screen_name': 'lfesexuality', 'name': 'libfemequalsexuality', 'id': '2987439296'}]",[],[],0,0,1,[],[],https://twitter.com/snickerszlove/status/567762091017121792,False,,0,,austin,,,,,,[],,,,
567760929522483200,567760929522483200,2015-02-17 13:02:08 CST,2015-02-17,13:02:08,-0500,74902669,pisaac12,♚OhSayMyName.,"{'type': 'Point', 'coordinates': [30.28352367, -97.74144904]}",Oh we had a power outage and a bomb threat UT? Sorry I was asleep 💤,en,[],[],[],0,0,2,[],[],https://twitter.com/Pisaac12/status/567760929522483200,False,,0,,austin,,,,,,[],,,,
567759774217797632,561717825698406400,2015-02-17 12:57:33 CST,2015-02-17,12:57:33,-0500,1020050376,barbarabpiwetz,Diggums OTRB 8-19-20 ♥RIP Finlay♥🌈,,@LBisaillon @LKSWMICHAEL @RiePhillips @SophietheCat3 @PookieMacalpi @Lazlovely Hmm Sir being sexist Him a little too quick to call speciest.,en,"[{'screen_name': 'lkswmichael', 'name': 'michael lksw & sir ❤️u2 infinity & beyond jeannie❤', 'id': '443168368'}, {'screen_name': 'riephillips', 'name': 'marie phillips', 'id': '2346139157'}, {'screen_name': 'sophiethecat3', 'name': 'sophie mcsmelly rip muh diggums', 'id': '1631737117'}, {'screen_name': 'pookiemacalpi', 'name': 'angel pookie macalpi', 'id': '2194535720'}, {'screen_name': 'lazlovely', 'name': 'bobfatty❤rip❤digsy❤seanieboy❤finlay❤', 'id': '2364568038'}]",[],[],2,0,2,[],[],https://twitter.com/BarbaraBpiwetz/status/567759774217797632,False,,0,,austin,,,,,,[],,,,
567755147788439552,567422825300889600,2015-02-17 12:39:10 CST,2015-02-17,12:39:10,-0500,32252141,snickerszlove,cottagecore demon,,@MrDynastyEdits evidence of...the existence of rape culture? sure.  http://t.co/7roSuMVWSr,en,[],['http://time.com/40110/rape-culture-is-real/'],[],0,0,0,[],[],https://twitter.com/snickerszlove/status/567755147788439552,False,,0,,austin,,,,,,[],,,,
567755042938056705,567422825300889600,2015-02-17 12:38:45 CST,2015-02-17,12:38:45,-0500,32252141,snickerszlove,cottagecore demon,,@MrDynastyEdits @Mztxh @bluezcluez69 @twinkyyslayerr evidence of?.. rape statistics? sure.  http://t.co/X2lqXIXn7S,en,"[{'screen_name': 'mztxh', 'name': 'mztxh', 'id': '1044665467804119040'}]",['http://www.rrsonline.org/?page_id=944'],[],0,0,0,[],[],https://twitter.com/snickerszlove/status/567755042938056705,False,,0,,austin,,,,,,[],,,,
567748074265526274,567725395676377089,2015-02-17 12:11:03 CST,2015-02-17,12:11:03,-0500,20946303,kitoconnell,Kit O'Connell (They/He),"{'type': 'Point', 'coordinates': [30.2553292, -97.7191509]}",@Sporty1546 people like you implying my Muslim friends are making it up are part of the problem. Fuck you and your victim blaming,en,[],[],[],1,0,0,[],[],https://twitter.com/KitOConnell/status/567748074265526274,False,,0,,austin,,,,,,[],,,,
567744997639086080,567744997639086080,2015-02-17 11:58:50 CST,2015-02-17,11:58:50,-0500,103972253,erictessmerband,Eric Tessmer,"{'type': 'Point', 'coordinates': [30.226245, -97.762505]}","Shooting demos today with @uscalaveras of the killer, new Fuzz Wave made by local Austin builder, Tim…  http://t.co/U250C9VPi1",en,[],['http://instagram.com/p/zNiZfVCVjH/'],[],0,1,2,[],[],https://twitter.com/erictessmerband/status/567744997639086080,False,,0,,austin,,,,,,[],,,,
567743832012226560,567743832012226560,2015-02-17 11:54:12 CST,2015-02-17,11:54:12,-0500,1670703572,shelby_light1,LightAlmighty,"{'type': 'Point', 'coordinates': [30.2907459, -97.74001507]}",Campus power went out and we had a bomb threat also my lab was cancelled! Lovely morning 😄,en,[],[],[],0,0,0,[],[],https://twitter.com/shelby_light1/status/567743832012226560,False,,0,,austin,,,,,,[],,,,
567741056549007360,567741056549007360,2015-02-17 11:43:10 CST,2015-02-17,11:43:10,-0500,35481742,_trayhand,Dee W,"{'type': 'Point', 'coordinates': [30.235492, -97.7197577]}",What grown ass man is gonna get on national radio &amp; admit he's involved in statutory rape? I'll wait ...  you damn right he lied his ass off,en,[],[],[],0,1,0,[],[],https://twitter.com/_trayhand/status/567741056549007360,False,,0,,austin,,,,,,[],,,,
567740553274482688,567740553274482688,2015-02-17 11:41:10 CST,2015-02-17,11:41:10,-0500,19943825,shawnwilsie,Shawn Wilsie,"{'type': 'Point', 'coordinates': [30.25459743, -97.74686261]}","A plane crash, a murder, Nikki needing a drink, #YR is using everything in the soap opera arsenal today.",en,[],[],[],0,0,1,['yr'],[],https://twitter.com/ShawnWilsie/status/567740553274482688,False,,0,,austin,,,,,,[],,,,
567731135958896640,567731135958896640,2015-02-17 11:03:45 CST,2015-02-17,11:03:45,-0500,48049658,monicav_04,monicuuhhh 🌷✨,"{'type': 'Point', 'coordinates': [30.35764853, -97.75325792]}","Not only a campus wide outage, but a bomb threat in West Campus too?! #UTPowerOutage2015",en,[],[],[],0,0,0,['utpoweroutage2015'],[],https://twitter.com/monicav_04/status/567731135958896640,False,,0,,austin,,,,,,[],,,,
567727578127937540,567727578127937540,2015-02-17 10:49:37 CST,2015-02-17,10:49:37,-0500,76719823,wesleychatham,Wesley Chatham,"{'type': 'Point', 'coordinates': [30.28978833, -97.73614605]}",A bomb threat and a campus wide power outage all in one morning... And I slept through it? Classic.,en,[],[],[],0,0,0,[],[],https://twitter.com/wesleychatham/status/567727578127937540,False,,0,,austin,,,,,,[],,,,
567726580563075072,567726580563075072,2015-02-17 10:45:39 CST,2015-02-17,10:45:39,-0500,1342874934,nathanpf1,Nathan es #Verde,"{'type': 'Point', 'coordinates': [30.29072289, -97.74338035]}",There's a bomb threat and a power outage but don't worry we're still gonna have class,en,[],[],[],0,0,3,[],[],https://twitter.com/nathanpf1/status/567726580563075072,False,,0,,austin,,,,,,[],,,,
567726434894893056,567726434894893056,2015-02-17 10:45:04 CST,2015-02-17,10:45:04,-0500,2343142435,lyndseykohn,Lyndsey Kohn,,"@UTAustin Power outage, bomb threat...Usual events for 1st round of exams!  #UTPowerOutage2015  #UTBlackout2015",en,[],[],[],0,0,1,"['utpoweroutage2015', 'utblackout2015']",[],https://twitter.com/LyndseyKohn/status/567726434894893056,False,,0,,austin,,,,,,[],,,,
567726397058457601,567726397058457601,2015-02-17 10:44:55 CST,2015-02-17,10:44:55,-0500,45754042,alec_is_awesome,Alec Sanchez,"{'type': 'Point', 'coordinates': [30.28421729, -97.73672641]}",What has a bomb threat and total campus black out? #UT #ATX #turntuptuesday @ The University of Texas…  http://t.co/Cdmv5UeUYk,en,[],['http://instagram.com/p/zNZ8JEq8OG/'],[],0,0,0,"['ut', 'atx', 'turntuptuesday']",[],https://twitter.com/alec_is_awesome/status/567726397058457601,False,,0,,austin,,,,,,[],,,,
567722906197557248,567722906197557248,2015-02-17 10:31:03 CST,2015-02-17,10:31:03,-0500,113549748,vrod_74,Vic,"{'type': 'Point', 'coordinates': [30.28358061, -97.73712268]}",Soooo @UTAustin ... About that bomb threat less than a mile from campus...,en,"[{'screen_name': 'utaustin', 'name': 'ut austin', 'id': '15637375'}]",[],[],0,0,1,[],[],https://twitter.com/vrod_74/status/567722906197557248,False,,0,,austin,,,,,,[],,,,
567722718796079105,567111293015187457,2015-02-17 10:30:18 CST,2015-02-17,10:30:18,-0500,1020050376,barbarabpiwetz,Diggums OTRB 8-19-20 ♥RIP Finlay♥🌈,,@Lazlovely It's why we gets along so gud. We is cheeky!!! Staff gets all nervous. Say: Him sweet 90% of time. But he mite attack you.,en,[],[],[],1,0,2,[],[],https://twitter.com/BarbaraBpiwetz/status/567722718796079105,False,,0,,austin,,,,,,[],,,,
567722428105625601,567722428105625601,2015-02-17 10:29:09 CST,2015-02-17,10:29:09,-0500,39641837,jcqlnwng,Jackie Wang,"{'type': 'Point', 'coordinates': [30.28817923, -97.74787649]}",APD looking at filing charges against suspect who made bomb threat,en,[],[],[],0,0,0,[],[],https://twitter.com/jcqlnwng/status/567722428105625601,False,,0,,austin,,,,,,[],,,,
567722310044377088,567513371436929024,2015-02-17 10:28:41 CST,2015-02-17,10:28:41,-0500,153934874,ritanikole,RiTAxNiKOLEE,"{'type': 'Point', 'coordinates': [30.39544576, -97.67315165]}",“@DaRealAmberRose:U think because ur dad was a professional football player that got away with murder ur better than me girl? Haaaaannnnn?”😭,en,"[{'screen_name': 'darealamberrose', 'name': 'amber rose', 'id': '155620016'}]",[],[],0,0,0,[],[],https://twitter.com/RitaNikole/status/567722310044377088,False,,0,,austin,,,,,,[],,,,
567719439437553665,567719439437553665,2015-02-17 10:17:16 CST,2015-02-17,10:17:16,-0500,14208527,cyborg_ski,Cyborg_ski,"{'type': 'Point', 'coordinates': [30.28803456, -97.74732328]}",Arab Cowboy bomb threat scene wrapping up. Firefighters packing up and bomb squad putting equipment away. Looks like nothing happened.,en,[],[],[],0,0,0,[],[],https://twitter.com/Cyborg_ski/status/567719439437553665,False,,0,,austin,,,,,,[],,,,
567718961861513216,567718961861513216,2015-02-17 10:15:22 CST,2015-02-17,10:15:22,-0500,39641837,jcqlnwng,Jackie Wang,"{'type': 'Point', 'coordinates': [30.28836586, -97.74781136]}",24th and San Gabriel are sectioned off; police currently investigating bomb threat in the area.,en,[],[],[],0,1,0,[],[],https://twitter.com/jcqlnwng/status/567718961861513216,False,,0,,austin,,,,,,[],,,,
567712452607868928,567712452607868928,2015-02-17 09:49:30 CST,2015-02-17,09:49:30,-0500,944589247,coachdayla,Alex De La Torre,"{'type': 'Point', 'coordinates': [30.28242082, -97.73431852]}",Bomb threat should mean no class.,en,[],[],[],0,0,3,[],[],https://twitter.com/CoachDayLa/status/567712452607868928,False,,0,,austin,,,,,,[],,,,
567709386827526145,567709386827526145,2015-02-17 09:37:20 CST,2015-02-17,09:37:20,-0500,62413708,austin_cp,Austin Now,"{'type': 'Point', 'coordinates': [30.26960519, -97.74361687]}",APD responds to bomb threat near University of Texas: Austin Police are responding to two apparent bomb threats…  http://t.co/cWmV833uNu,en,[],['http://austin.cityandpress.com/node/9146455'],[],0,0,0,[],[],https://twitter.com/Austin_CP/status/567709386827526145,False,,0,,austin,,,,,,[],,,,
567706952067596290,567706952067596290,2015-02-17 09:27:39 CST,2015-02-17,09:27:39,-0500,113549748,vrod_74,Vic,"{'type': 'Point', 'coordinates': [30.28421268, -97.73723392]}","No power, no wifi and a WC bomb threat. Wtf UT. Cancel this bitch already!! #UTPowerOutage2015",en,[],[],[],0,0,1,['utpoweroutage2015'],[],https://twitter.com/vrod_74/status/567706952067596290,False,,0,,austin,,,,,,[],,,,
567589647102918656,567589647102918656,2015-02-17 01:41:31 CST,2015-02-17,01:41:31,-0500,634114799,mishindacut,Mi$H,"{'type': 'Point', 'coordinates': [30.46126972, -97.63798764]}",not good w expressing anything but anger..,en,[],[],[],0,0,1,[],[],https://twitter.com/mishindacut/status/567589647102918656,False,,0,,austin,,,,,,[],,,,
567579328217505792,567579328217505792,2015-02-17 01:00:31 CST,2015-02-17,01:00:31,-0500,306876618,alxmartenez,₭ł₵₭ ł₮,"{'type': 'Point', 'coordinates': [30.2315977, -97.7790308]}",Fucking a colored person doesn't make you any less of a racist,en,[],[],[],0,0,1,[],[],https://twitter.com/alxmartenez/status/567579328217505792,False,,0,,austin,,,,,,[],,,,
567578075756367872,567578075756367872,2015-02-17 00:55:33 CST,2015-02-17,00:55:33,-0500,260035667,robertanthonyd,♛Rob Dutcher♛,"{'type': 'Point', 'coordinates': [30.4367094, -97.73410717]}",When you get to where I'm at you gotta remind em where the fuck you at every time they talkin its behind my back gotta line em up and attack,en,[],[],[],0,0,0,[],[],https://twitter.com/RobertAnthonyD/status/567578075756367872,False,,0,,austin,,,,,,[],,,,
567577164573200384,567577164573200384,2015-02-17 00:51:55 CST,2015-02-17,00:51:55,-0500,1544662992,preli03,Instincts 🎆🅿️,"{'type': 'Point', 'coordinates': [30.21202775, -97.69557038]}",Accused “American Sniper” killer said he knew shooting was wrong in 2013 recording  http://t.co/yG7KOh2lvW  http://t.co/B6UaAIK01N,en,[],['http://abcn.ws/1vzYz9d'],['https://pbs.twimg.com/media/B-Bp0peCUAAT0u0.jpg'],0,0,0,[],[],https://twitter.com/Preli03/status/567577164573200384,False,,1,https://pbs.twimg.com/media/B-Bp0peCUAAT0u0.jpg,austin,,,,,,[],,,,
567576368557199361,567576368557199361,2015-02-17 00:48:45 CST,2015-02-17,00:48:45,-0500,1544662992,preli03,Instincts 🎆🅿️,"{'type': 'Point', 'coordinates': [30.21194904, -97.69559609]}",Jury hears voice mail messages that accused killer left for Chris Kyle before shooting:  http://t.co/Fw9D0LKah8  http://t.co/bTMw481Y1j,en,[],['http://abcn.ws/19pFXEd'],['https://pbs.twimg.com/media/B-AgInVIUAAYDop.png'],0,0,0,[],[],https://twitter.com/Preli03/status/567576368557199361,False,,1,https://pbs.twimg.com/media/B-AgInVIUAAYDop.png,austin,,,,,,[],,,,
567575288800747520,567575288800747520,2015-02-17 00:44:28 CST,2015-02-17,00:44:28,-0500,252758038,bsonntag,Barrett Sonntag,"{'type': 'Point', 'coordinates': [30.40053144, -97.84927145]}",One problem with fighting &amp; trying to quantify anonymous online abuse is that one person can seem like many &amp; you can't prove the difference,en,[],[],[],0,0,0,[],[],https://twitter.com/bsonntag/status/567575288800747520,False,,0,,austin,,,,,,[],,,,
567570097753964544,567570097753964544,2015-02-17 00:23:50 CST,2015-02-17,00:23:50,-0500,42514101,artstrada,🅰🆁🆃🆂🆃🆁🅰🅳🅰 🅼🅰🅶🅰🆉🅸🅽🅴,,"""R-400S"" Remote Weapon System with 30mm ATK M230 LF cannon in a 0.4 tonne system. engagement up to 2 km  http://t.co/kpYhOBZ183",en,[],[],['https://pbs.twimg.com/media/B-Bp_wiCYAAaEto.jpg'],0,0,1,[],[],https://twitter.com/Artstrada/status/567570097753964544,False,,1,https://pbs.twimg.com/media/B-Bp_wiCYAAaEto.jpg,austin,,,,,,[],,,,
