id,conversation_id,created_at,date,time,timezone,user_id,username,name,place,tweet,language,mentions,urls,photos,replies_count,retweets_count,likes_count,hashtags,cashtags,link,retweet,quote_url,video,thumbnail,near,geo,source,user_rt_id,user_rt,retweet_id,reply_to,retweet_date,translate,trans_src,trans_dest
713870374316847104,713848283978829824,2016-03-26 18:28:54 CDT,2016-03-26,18:28:54,-0500,83610674,nkura52,Nagaraj,,@ExSecular @HMOIndia (3) The reason is why should non terrorist families pay tax on Killing terrorists but instead the amount shud come (4),en,"[{'screen_name': 'hmoindia', 'name': 'गृहमंत्री कार्यालय, hmo india', 'id': '2541363451'}]",[],[],0,0,0,[],[],https://twitter.com/nkura52/status/713870374316847104,False,,0,,dallas,,,,,,[],,,,
713869688158064640,713848283978829824,2016-03-26 18:26:11 CDT,2016-03-26,18:26:11,-0500,83610674,nkura52,Nagaraj,,"@ExSecular @HMOIndia India should bring a new law on Terrorism, called as Tax Terrorism. It means if a terrorist is Indian, then Entire (2)",en,"[{'screen_name': 'hmoindia', 'name': 'गृहमंत्री कार्यालय, hmo india', 'id': '2541363451'}]",[],[],0,0,0,[],[],https://twitter.com/nkura52/status/713869688158064640,False,,0,,dallas,,,,,,[],,,,
713864740687077377,713864740687077377,2016-03-26 18:06:31 CDT,2016-03-26,18:06:31,-0500,470655993,whotf_iskee,Kiara💜,,"If Bri Cheats , TRUST ME I WILL NOT RETALIATE ! Ima Just Take That L , Cause I'm Never Going Back To Jail Period !!!",en,[],[],[],0,1,1,[],[],https://twitter.com/WhoTf_IsKee/status/713864740687077377,False,,0,,dallas,,,,,,[],,,,
713862205305847808,713862205305847808,2016-03-26 17:56:27 CDT,2016-03-26,17:56:27,-0500,387422230,mikewhore,michael:),,@RestingPlatypus #askjack please murder me and get away with it,en,[],[],[],0,0,1,['askjack'],[],https://twitter.com/mikewhore/status/713862205305847808,False,,0,,dallas,,,,,,[],,,,
713850527826620417,713850527826620417,2016-03-26 17:10:03 CDT,2016-03-26,17:10:03,-0500,464321828,mayaanay_,Maya 💋,,i wanna go to a gun range bro.,en,[],[],[],0,0,0,[],[],https://twitter.com/MayaAnay_/status/713850527826620417,False,,0,,dallas,,,,,,[],,,,
713842987957035008,713842987957035008,2016-03-26 16:40:05 CDT,2016-03-26,16:40:05,-0500,577319503,allmight316,braulio,,"but to be real, u would die in like 2 seconds if u bring a machete to w gun fight",en,[],[],[],0,0,0,[],[],https://twitter.com/ALLMIGHT316/status/713842987957035008,False,,0,,dallas,,,,,,[],,,,
713842138119733248,713840647501783040,2016-03-26 16:36:42 CDT,2016-03-26,16:36:42,-0500,522370988,mooklongway,LeOne Eye James 👑,,@Pdot_Smirf @Cj_Caliente_ right and defense and iffy shooting is our issue,en,[],[],[],2,0,0,[],[],https://twitter.com/MookLongway/status/713842138119733248,False,,0,,dallas,,,,,,[],,,,
713840421831487488,713840421831487488,2016-03-26 16:29:53 CDT,2016-03-26,16:29:53,-0500,874763772,idk_ty,2022,,I'm gonna cause someone to have a heart attack 😂  https://t.co/lGDddAyYR8,en,[],[],['https://pbs.twimg.com/media/CegSE9uWwAELY39.jpg'],0,0,0,[],[],https://twitter.com/IDK_TY/status/713840421831487488,False,,1,https://pbs.twimg.com/media/CegSE9uWwAELY39.jpg,dallas,,,,,,[],,,,
713831929263427584,713831929263427584,2016-03-26 15:56:08 CDT,2016-03-26,15:56:08,-0500,2460735360,gwayy318,🦍4SNHS©️,,Don't turn the vip into a shooting range,en,[],[],[],0,0,0,[],[],https://twitter.com/Gwayy318/status/713831929263427584,False,,0,,dallas,,,,,,[],,,,
713830744590712832,713830744590712832,2016-03-26 15:51:26 CDT,2016-03-26,15:51:26,-0500,1110750655,ilive_to_hoop,🗣,,Lmfao Dead 💀💀 I'm telling all y'all right now y'all done lost it I'll murder all yall  https://t.co/IJPD7NYivB,en,[],['https://twitter.com/RayneilWilliams/status/713830155337252865'],[],1,0,0,[],[],https://twitter.com/ILive_To_Hoop/status/713830744590712832,False,https://twitter.com/RayneilWilliams/status/713830155337252865,0,,dallas,,,,,,[],,,,
713828213886173185,713828213886173185,2016-03-26 15:41:23 CDT,2016-03-26,15:41:23,-0500,431108001,thismyonlyfans,welterweight,,"most of the people who have guns, are the people you don't want to have a gun",en,[],[],[],0,0,2,[],[],https://twitter.com/thismyonlyfans/status/713828213886173185,False,,0,,dallas,,,,,,[],,,,
713827286437330945,713827286437330945,2016-03-26 15:37:42 CDT,2016-03-26,15:37:42,-0500,27143395,biogirl2003,angela_fayann 🇺🇦🌻,,Can you take this Disney Show upstairs? Adults are allergic to this because it's TOO happy. We need shows about murder. 😚#stepmomoftheyear,en,[],[],[],0,0,1,['stepmomoftheyear'],[],https://twitter.com/biogirl2003/status/713827286437330945,False,,0,,dallas,,,,,,[],,,,
713816973763710976,713816973763710976,2016-03-26 14:56:43 CDT,2016-03-26,14:56:43,-0500,354041953,mattrinalditx,Matt Rinaldi,,"But not as brutal as the ""vote McKinley"" chalk messages that would terrorize campus in just a few short years.  https://t.co/4wBj0V7DvF",en,[],['https://twitter.com/historyinpics/status/713809767546880001'],[],0,1,2,[],[],https://twitter.com/MattRinaldiTX/status/713816973763710976,False,https://twitter.com/historyinpics/status/713809767546880001,0,,dallas,,,,,,[],,,,
713816349261189120,713816349261189120,2016-03-26 14:54:14 CDT,2016-03-26,14:54:14,-0500,36446717,queentimbo_,✨ est. 2.29.96✨,,I have terrible road rage. I'm not even driving and cussing ppl out left and right.,en,[],[],[],0,0,0,[],[],https://twitter.com/QueenTimbo_/status/713816349261189120,False,,0,,dallas,,,,,,[],,,,
713815624158302209,713815624158302209,2016-03-26 14:51:21 CDT,2016-03-26,14:51:21,-0500,893607625,haleylouisaray,Haley Ray,,If I had to choose between her and the sun I'd be one nocturnal son of a gun,en,[],[],[],0,1,8,[],[],https://twitter.com/haleylouisaray/status/713815624158302209,False,,0,,dallas,,,,,,[],,,,
713813403161071617,713813403161071617,2016-03-26 14:42:31 CDT,2016-03-26,14:42:31,-0500,356414404,antt_flvcko,.,,You so fine it's a damn crime you gone end up on a news special,en,[],[],[],0,0,0,[],[],https://twitter.com/Antt_Flvcko/status/713813403161071617,False,,0,,dallas,,,,,,[],,,,
713811274451169280,713811274451169280,2016-03-26 14:34:04 CDT,2016-03-26,14:34:04,-0500,398422892,mr_manika,Devon Manika™🇿🇼,,Public Service announcement to all my friends of color @FlickMicky is a racist!,en,"[{'screen_name': 'flickmicky', 'name': 'dontflickme', 'id': '3002884770'}]",[],[],1,0,6,[],[],https://twitter.com/mr_manika/status/713811274451169280,False,,0,,dallas,,,,,,[],,,,
713799748617109505,713799748617109505,2016-03-26 13:48:16 CDT,2016-03-26,13:48:16,-0500,296039179,rami_tla,RAMI,,"The point is a patrol car is to prevent Crime from happening, not to sneak around an catch crimes happening...",en,[],[],[],0,0,1,[],[],https://twitter.com/rami_tla/status/713799748617109505,False,,0,,dallas,,,,,,[],,,,
713794808377020417,713767318472499200,2016-03-26 13:28:38 CDT,2016-03-26,13:28:38,-0500,67952873,jayfan07,Hard Drive,,@abedelrey @iLLmak3Ufamous nah she just about to make killers and racist mad again...,en,"[{'screen_name': 'illmak3ufamous', 'name': 'ese negrito', 'id': '151661481'}]",[],[],0,1,1,[],[],https://twitter.com/jayfan07/status/713794808377020417,False,,0,,dallas,,,,,,[],,,,
713792729298313216,713792729298313216,2016-03-26 13:20:22 CDT,2016-03-26,13:20:22,-0500,1105278612,dgonzalez_7,Dianaaaaa💕,,I hate this fool LMFAO it's too early for all this violence,en,[],[],[],0,0,0,[],[],https://twitter.com/dgonzalez_7/status/713792729298313216,False,,0,,dallas,,,,,,[],,,,
