id,conversation_id,created_at,date,time,timezone,user_id,username,name,place,tweet,language,mentions,urls,photos,replies_count,retweets_count,likes_count,hashtags,cashtags,link,retweet,quote_url,video,thumbnail,near,geo,source,user_rt_id,user_rt,retweet_id,reply_to,retweet_date,translate,trans_src,trans_dest
745041734044770304,745037755730669568,2016-06-20 18:52:46 CDT,2016-06-20,18:52:46,-0500,238855350,jvsylvester,Jim Sylvester 🇺🇦,,@erinscafe Why do you think it's called DEATH VALLEY?,en,[],[],[],0,0,0,[],[],https://twitter.com/JVSylvester/status/745041734044770304,False,,0,,austin,,,,,,"[{'screen_name': 'erinscafe', 'name': 'Scafe says wear a gd mask', 'id': '19683903'}]",,,,
745039853818085376,745039853818085376,2016-06-20 18:45:17 CDT,2016-06-20,18:45:17,-0500,4625132508,barracudaaustin,Barracuda,"{'type': 'Point', 'coordinates': [30.26717, -97.7365]}","OBN IIIs, Rusted Shut, Total Abuse, Filth, Empty Markets THIS SATURDAY 6/25 at Barracuda!!…  https://t.co/0dPiPa33DZ",en,[],['https://www.instagram.com/p/BG5SweRDJiu/'],[],0,0,0,[],[],https://twitter.com/barracudaaustin/status/745039853818085376,False,,0,,austin,,,,,,[],,,,
745029749756551168,745029749756551168,2016-06-20 18:05:08 CDT,2016-06-20,18:05:08,-0500,218632788,heyschreiber,benjamin_button,,Oh man it's been a minute. This gonna hurt 💪🏼,en,[],[],[],0,0,0,[],[],https://twitter.com/heyschreiber/status/745029749756551168,False,,0,,austin,,,,,,[],,,,
745023427140947968,745023427140947968,2016-06-20 17:40:01 CDT,2016-06-20,17:40:01,-0500,424224241,mrdenova,Benny,,Dead,en,[],[],[],0,0,0,[],[],https://twitter.com/MrDenova/status/745023427140947968,False,,0,,austin,,,,,,[],,,,
745018942800830464,745018942800830464,2016-06-20 17:22:12 CDT,2016-06-20,17:22:12,-0500,7145052,ingsocbloc,ʟᴜᴋᴇ ᴘᴇʙʟᴇʀ,,I'll take a stab in the dark and guess he mains a titan?  https://t.co/kwFAxk7Eze,en,[],['https://twitter.com/Bungie/status/744997488445165568'],[],0,0,0,[],[],https://twitter.com/ingsocbloc/status/745018942800830464,False,https://twitter.com/Bungie/status/744997488445165568,0,,austin,,,,,,[],,,,
745016264125358081,744877802772701184,2016-06-20 17:11:33 CDT,2016-06-20,17:11:33,-0500,480517935,jacksbr1,Jack Murray,,@endurancewire @highfiveevents got my @nuunhydration fruit punch ready for today's hot run!,en,"[{'screen_name': 'nuunhydration', 'name': 'nuun hydration', 'id': '33835869'}]",[],[],1,1,0,[],[],https://twitter.com/JackSBR1/status/745016264125358081,False,,0,,austin,,,,,,"[{'screen_name': 'endurancewire', 'name': 'Endurance Sportswire', 'id': '38907348'}, {'screen_name': 'highfiveevents', 'name': 'High Five Events', 'id': '126372145'}]",,,,
745003105914281986,745003105914281986,2016-06-20 16:19:16 CDT,2016-06-20,16:19:16,-0500,823779692,itsthisguyaz,Adrian Zepeda,,'Star Trek' Star Anton Yelchin -- Dead After Freak Accident  https://t.co/r1IejR748t via @TMZ @MrChuck_Finley,en,"[{'screen_name': 'tmz', 'name': 'tmz', 'id': '16331010'}, {'screen_name': 'mrchuck_finley', 'name': 'daone8701', 'id': '316086979'}]",['http://www.tmz.com/2016/06/19/star-trek-anton-yelchin-dead/'],[],1,0,0,[],[],https://twitter.com/ItsThisGuyAZ/status/745003105914281986,False,,0,,austin,,,,,,[],,,,
744992085669871617,744990775117656066,2016-06-20 15:35:29 CDT,2016-06-20,15:35:29,-0500,26869655,shipperhipster,call me sam,,@_mercurialgirl ok like declawing I don't agree with but I kind of 'get it' but who fuck deteeths a cat?! How is that not animal abuse?!,en,[],[],[],3,0,0,[],[],https://twitter.com/shipperhipster/status/744992085669871617,False,,0,,austin,,,,,,"[{'screen_name': '_mercurialgirl', 'name': 'Misha', 'id': '374868116'}]",,,,
744991191750500352,744962278273908736,2016-06-20 15:31:56 CDT,2016-06-20,15:31:56,-0500,24320701,tiger78232,Chump Tiger,,@NancyPelosi NO. i want to keep my weapon. Stop the Muslims from coming into our country. Th rug are the problem.,en,[],[],[],0,0,0,[],[],https://twitter.com/tiger78232/status/744991191750500352,False,,0,,austin,,,,,,[],,,,
744985574025527296,744985574025527296,2016-06-20 15:09:36 CDT,2016-06-20,15:09:36,-0500,245353459,nostalgicjay,Jay,,Smalling with almost a fatal error. He keeps messing up. Extremely susceptible to making errors.,en,[],[],[],0,0,0,[],[],https://twitter.com/NostalgicJay/status/744985574025527296,False,,0,,austin,,,,,,[],,,,
744979414652354560,744969657409507328,2016-06-20 14:45:08 CDT,2016-06-20,14:45:08,-0500,24573654,gdigitalzsmooth,Hands off Ukraine 🇺🇦 🌻,,@AlanKestrel750 Millennials care about the future. Dead-enders get more attn. They need to be told they don't speak for most millennials.,en,[],[],[],1,0,4,[],[],https://twitter.com/gdigitalzsmooth/status/744979414652354560,False,,0,,austin,,,,,,"[{'screen_name': 'AlanKestrel750', 'name': 'mahmoud shater', 'id': '811259426309099520'}]",,,,
744976938167500800,744976938167500800,2016-06-20 14:35:17 CDT,2016-06-20,14:35:17,-0500,4270107672,garygerber2,Gary gerber,,"@GOP you better not screw with our voters, we don't care about hurt feelings we voted TRUMP as our nominee",en,[],[],[],0,0,0,[],[],https://twitter.com/Garygerber2/status/744976938167500800,False,,0,,austin,,,,,,[],,,,
744975192833679361,744975192833679361,2016-06-20 14:28:21 CDT,2016-06-20,14:28:21,-0500,52573702,awzurcher,Anthony Zurcher,,One participant had decades of experience in Washington political knife fights. The other... didn't   https://t.co/8qqaNbIr7R,en,[],['https://twitter.com/markhalperin/status/744909881656872960'],[],0,3,1,[],[],https://twitter.com/awzurcher/status/744975192833679361,False,https://twitter.com/markhalperin/status/744909881656872960,0,,austin,,,,,,[],,,,
744971930977984512,744971930977984512,2016-06-20 14:15:23 CDT,2016-06-20,14:15:23,-0500,1115049517,king_eraww97,E,,Could it be 22th so my lonestar and EBT kick on ' 😧,en,[],[],[],0,0,0,[],[],https://twitter.com/KING_ERAWW97/status/744971930977984512,False,,0,,austin,,,,,,[],,,,
744967645422772226,744967645422772226,2016-06-20 13:58:22 CDT,2016-06-20,13:58:22,-0500,4270107672,garygerber2,Gary gerber,,"Muslims if sharia ok get out, if death to non believers ok get out, if your area no go get out, one=GET OUT LEAVE  https://t.co/nw1CxYpSw8",en,[],['https://twitter.com/dcexaminer/status/744533134251794432'],[],0,0,0,[],[],https://twitter.com/Garygerber2/status/744967645422772226,False,https://twitter.com/dcexaminer/status/744533134251794432,0,,austin,,,,,,[],,,,
744962270975799296,744962270975799296,2016-06-20 13:37:00 CDT,2016-06-20,13:37:00,-0500,149942264,javmaher9,Maher. Save Democracy Vote in Blue Waves🗳,,Investigate #Oakland Police For Rape of #Trafficked #Child  https://t.co/6CFYG2FKx0 via @ForceChange #Police #Rape,en,"[{'screen_name': 'forcechange', 'name': 'forcechange', 'id': '16475248'}]",['https://forcechange.com/158513/investigate-oakland-police-after-alleged-rape-of-trafficked-child/'],[],0,0,0,"['oakland', 'trafficked', 'child', 'police', 'rape']",[],https://twitter.com/javmaher9/status/744962270975799296,False,,0,,austin,,,,,,[],,,,
744960874075422724,744960874075422724,2016-06-20 13:31:27 CDT,2016-06-20,13:31:27,-0500,60938680,mmaliiii,mali,,So I was scared out of my damn mind because he was super creepy and drove a legit rape van.,en,[],[],[],1,0,0,[],[],https://twitter.com/mmaliiii/status/744960874075422724,False,,0,,austin,,,,,,[],,,,
744960825526366208,744959588567388160,2016-06-20 13:31:16 CDT,2016-06-20,13:31:16,-0500,488757636,skrillaasam,LONELY CHILD 💔,,@_blaxican96 @__SStevens @OfficialSeanB_ omg dead af,en,[],[],[],0,0,0,[],[],https://twitter.com/skrillaasam/status/744960825526366208,False,,0,,austin,,,,,,"[{'screen_name': 'officialseanb_', 'name': 'Sean', 'id': '907994068579504133'}]",,,,
744959057270759424,744959057270759424,2016-06-20 13:24:14 CDT,2016-06-20,13:24:14,-0500,239999045,okaylivz,OLIVIALOY,,Thanks Dwight D. Eisenhower for creating the largest death trap on earth.,en,[],[],[],0,0,0,[],[],https://twitter.com/okaylivz/status/744959057270759424,False,,0,,austin,,,,,,[],,,,
744938520481980416,744938520481980416,2016-06-20 12:02:38 CDT,2016-06-20,12:02:38,-0500,4344660498,notannkitchen,NOT Ann Kitchen,,time for me to shed some dead weight. @GregCasar @SheriGalloD10 @DGarzaforD2 ✌ Pool is smart enough to divide and get reelected 👍,en,"[{'screen_name': 'gregcasar', 'name': 'greg casar', 'id': '1683515731'}, {'screen_name': 'sherigallod10', 'name': 'sheri gallo dist 10', 'id': '2578682947'}]",[],[],0,0,0,[],[],https://twitter.com/NOTAnnKitchen/status/744938520481980416,False,,0,,austin,,,,,,[],,,,
744938346019860480,744938346019860480,2016-06-20 12:01:56 CDT,2016-06-20,12:01:56,-0500,340606102,_ilovekamikaaa,Paradi$ee 🌴,,I need to learn how to let all this hurt and anger go....😩,en,[],[],[],0,0,1,[],[],https://twitter.com/_ILoveKamikaaa/status/744938346019860480,False,,0,,austin,,,,,,[],,,,
744933348745875456,744933348745875456,2016-06-20 11:42:05 CDT,2016-06-20,11:42:05,-0500,28169603,jennil_kvue,Jenni Lee,,AISD: no weapon found in Gus Garcia Young Men's Leadership Academy. Lockdown over.,en,[],[],[],0,4,1,[],[],https://twitter.com/JenniL_KVUE/status/744933348745875456,False,,0,,austin,,,,,,[],,,,
744932230720524288,744932230720524288,2016-06-20 11:37:38 CDT,2016-06-20,11:37:38,-0500,19078878,lakeaustinspa,Lake Austin Spa,"{'type': 'Point', 'coordinates': [30.32775632, -97.92429543]}",#behindthescenes with photographer @laststopbook as we kick off the #firstdayofsummer redefining…  https://t.co/B9YqvblSRl,en,"[{'screen_name': 'laststopbook', 'name': 'the last stop book', 'id': '2880429424'}]",['https://www.instagram.com/p/BG4h0oOR2ZF/'],[],0,0,0,"['behindthescenes', 'firstdayofsummer']",[],https://twitter.com/lakeaustinspa/status/744932230720524288,False,,0,,austin,,,,,,[],,,,
744929599520276480,744929599520276480,2016-06-20 11:27:11 CDT,2016-06-20,11:27:11,-0500,172179209,laurel_kinney,Laurel Kinney,"{'type': 'Point', 'coordinates': [30.29099, -97.71505]}",The schedule is set for my Style Shifters! We kick off in 2 days with a whole hour devoted to…  https://t.co/0AzeHBF2Ee,en,[],['https://www.instagram.com/p/BG4gn_WiCJj/'],[],0,0,0,[],[],https://twitter.com/laurel_kinney/status/744929599520276480,False,,0,,austin,,,,,,[],,,,
744919729886814209,744919729886814209,2016-06-20 10:47:58 CDT,2016-06-20,10:47:58,-0500,2661012829,ambebeho,am,,Walking around campus and a cute boy started talking to me and I tripped over a dead bird 😶,en,[],[],[],1,1,23,[],[],https://twitter.com/ambebeho/status/744919729886814209,False,,0,,austin,,,,,,[],,,,
744919076133208064,744903059424182272,2016-06-20 10:45:22 CDT,2016-06-20,10:45:22,-0500,9020432,bukowsky,Jeff Flowers,,@MotherRoadBeer Thank you! You kick ass.,en,[],[],[],0,0,1,[],[],https://twitter.com/Bukowsky/status/744919076133208064,False,,0,,austin,,,,,,"[{'screen_name': 'MotherRoadBeer', 'name': 'Mother Road Brewing', 'id': '186582202'}]",,,,
744917656667459586,744917656667459586,2016-06-20 10:39:43 CDT,2016-06-20,10:39:43,-0500,176865279,wardkc63,The Pulling Guard #StripesLife,,We are two days away from football talk being back in full force,en,[],[],[],0,0,0,[],[],https://twitter.com/wardkc63/status/744917656667459586,False,,0,,austin,,,,,,[],,,,
744916138564300801,744916138564300801,2016-06-20 10:33:41 CDT,2016-06-20,10:33:41,-0500,31330144,magicblue940,Dr. FAT CAT,,*Sees a pic of my friends bastard ex on my Instagram feed and now I wanna punch 2 ppl in the face*,en,[],[],[],0,0,0,[],[],https://twitter.com/Magicblue940/status/744916138564300801,False,,0,,austin,,,,,,[],,,,
744901132024086529,744901132024086529,2016-06-20 09:34:04 CDT,2016-06-20,09:34:04,-0500,2278523756,atx_reeb,Brandon,,More kick than a  Power Ranger⚡️,en,[],[],[],0,0,0,[],[],https://twitter.com/Atx_Reeb/status/744901132024086529,False,,0,,austin,,,,,,[],,,,
744897117768949760,744897117768949760,2016-06-20 09:18:07 CDT,2016-06-20,09:18:07,-0500,15723081,tplohetski,Tony Plohetski,,"NOW: New charge against Pat Johnson stems from injuries to Austin musician Kenneth Johnson, the most injured victim in attacks.",en,[],[],[],0,5,3,[],[],https://twitter.com/tplohetski/status/744897117768949760,False,,0,,austin,,,,,,[],,,,
744896874100862976,744896874100862976,2016-06-20 09:17:08 CDT,2016-06-20,09:17:08,-0500,15723081,tplohetski,Tony Plohetski,,"BREAKING: New, more serious charge, for accused rock thrower Pat Johnson. Now charged with agg assault.",en,[],[],[],1,7,6,[],[],https://twitter.com/tplohetski/status/744896874100862976,False,,0,,austin,,,,,,[],,,,
744892653926506496,744892653926506496,2016-06-20 09:00:22 CDT,2016-06-20,09:00:22,-0500,15370082,captspastic,Capt. Spastic,"{'type': 'Point', 'coordinates': [30.43243243, -97.75648358]}","Mexican Police Clash With Teachers Over Education Reforms, Leaving 3 Dead   https://t.co/DWXMM7NZUa",en,[],['http://flip.it/xhZeN'],[],0,0,0,[],[],https://twitter.com/captspastic/status/744892653926506496,False,,0,,austin,,,,,,[],,,,
744892587039825925,744892587039825925,2016-06-20 09:00:06 CDT,2016-06-20,09:00:06,-0500,11560052,aimiessfriend,Jordan,,When gun nuts accidently make the arguement that novice mass shooters are much more deadly with an assault weapon  https://t.co/iFkBToGNBU,en,[],[],['https://pbs.twimg.com/media/ClZj2TfUsAI0dp6.jpg'],1,0,7,[],[],https://twitter.com/AimIessFriend/status/744892587039825925,False,,1,https://pbs.twimg.com/media/ClZj2TfUsAI0dp6.jpg,austin,,,,,,[],,,,
744885351710265344,744885351710265344,2016-06-20 08:31:21 CDT,2016-06-20,08:31:21,-0500,324414739,misdeal_vestil,Ryan Vestil,"{'type': 'Point', 'coordinates': [30.26533463, -97.74724168]}",My heart like a kick drum... • • @theavettbros live at @acllive  • 📸 for @bandsintown…  https://t.co/qj0eXIYnKC,en,"[{'screen_name': 'theavettbros', 'name': 'the avett brothers', 'id': '34935679'}, {'screen_name': 'acllive', 'name': 'acl live', 'id': '193100641'}, {'screen_name': 'bandsintown', 'name': 'bandsintown', 'id': '15837725'}]",['https://www.instagram.com/p/BG4MgEWpafb/'],[],0,0,0,[],[],https://twitter.com/Misdeal_Vestil/status/744885351710265344,False,,0,,austin,,,,,,[],,,,
744873721693765632,744873510183395328,2016-06-20 07:45:08 CDT,2016-06-20,07:45:08,-0500,128744920,literarygrrrl,Shana Roy,,It wasn't much. Roman came back from the dead. Sammy was scheming something. Stefano was up to no good. #DOOL,en,[],[],[],1,0,0,['dool'],[],https://twitter.com/Literarygrrrl/status/744873721693765632,False,,0,,austin,,,,,,[],,,,
744872422294228992,744872422294228992,2016-06-20 07:39:59 CDT,2016-06-20,07:39:59,-0500,375368230,hold_u_4_ransom,Reid Ransom,,I named the dead bird at the corner of my street Roberto amd this is week 2 of saying hi to him,en,[],[],[],1,0,7,[],[],https://twitter.com/hold_u_4_ransom/status/744872422294228992,False,,0,,austin,,,,,,[],,,,
744857893984477184,744857893984477184,2016-06-20 06:42:15 CDT,2016-06-20,06:42:15,-0500,14760150,newsradioklbj,News Radio KLBJ,,The mother of a victim of a rock throwing says the UT officer should get the reward after the arrest of a rock throwing suspect. Tune in,en,[],[],[],0,0,2,[],[],https://twitter.com/NewsRadioKLBJ/status/744857893984477184,False,,0,,austin,,,,,,[],,,,
744802778329972736,744802778329972736,2016-06-20 03:03:14 CDT,2016-06-20,03:03:14,-0500,17602448,ztinthesouth,ｚｏｅ̈,,Trying to remain zen and not punch things. But I really want to punch things.,en,[],[],[],0,0,0,[],[],https://twitter.com/ztinthesouth/status/744802778329972736,False,,0,,austin,,,,,,[],,,,
744783406261624832,744721812316028929,2016-06-20 01:46:16 CDT,2016-06-20,01:46:16,-0500,151100442,kimhawk912,Kimberly  (Kimbob),,"@GregAbbott_TX okay, then ban assault weapons like he did or do you cherry pick Reagans policies like you do the bible?",en,[],[],[],0,0,0,[],[],https://twitter.com/KimHawk912/status/744783406261624832,False,,0,,austin,,,,,,"[{'screen_name': 'GregAbbott_TX', 'name': 'Greg Abbott', 'id': '90651198'}]",,,,
744782687160852481,744782687160852481,2016-06-20 01:43:24 CDT,2016-06-20,01:43:24,-0500,117016411,kacidanger,Kaci Beeler,,I just had one of the most insane and bizarre weeks of my entire life. I am dead tired and wide awake. I gotta let this body slow down...,en,[],[],[],0,0,0,[],[],https://twitter.com/KaciDanger/status/744782687160852481,False,,0,,austin,,,,,,[],,,,
