id,conversation_id,created_at,date,time,timezone,user_id,username,name,place,tweet,language,mentions,urls,photos,replies_count,retweets_count,likes_count,hashtags,cashtags,link,retweet,quote_url,video,thumbnail,near,geo,source,user_rt_id,user_rt,retweet_id,reply_to,retweet_date,translate,trans_src,trans_dest
814973146289713153,814973146289713153,2016-12-30 17:15:14 CST,2016-12-30,17:15:14,-0500,121189705,thajoker_24,Zac Schaefer,,Lmao been living next to this dude for year and just found out today that he got convicted of murder back in the 70's!,en,[],[],[],0,0,0,[],[],https://twitter.com/ThaJoker_24/status/814973146289713153,False,,0,,san antonio,,,,,,[],,,,
814967591064244224,814967591064244224,2016-12-30 16:53:09 CST,2016-12-30,16:53:09,-0500,3781948933,susannahardy007,Susanna Hardy,,NY’s School Board Chief Just Destroyed Trump’s Carl Paladino To His Face For Racist Michell Obama Emails -  https://t.co/12jyS21wMt,en,[],['http://occupydemocrats.com/2016/12/30/nys-school-board-chair-just-destroyed-trumps-carl-paladino-face-racist-michell-obama-emails/'],[],0,0,2,[],[],https://twitter.com/SusannaHardy007/status/814967591064244224,False,,0,,san antonio,,,,,,[],,,,
814967463091662848,814843507168935936,2016-12-30 16:52:39 CST,2016-12-30,16:52:39,-0500,4530019292,212degreesnow,Tricia,,@people thx for highlighting @shannonrwatts. I'm a proud @MomsDemand vol &amp; also a gun owner. Common sense laws to save lives aren't anti-2A.,en,"[{'screen_name': 'shannonrwatts', 'name': 'shannon watts', 'id': '246939630'}, {'screen_name': 'momsdemand', 'name': 'moms demand action', 'id': '1017637447'}]",[],[],1,17,31,[],[],https://twitter.com/212degreesnow/status/814967463091662848,False,,0,,san antonio,,,,,,"[{'screen_name': 'people', 'name': 'People', 'id': '25589776'}]",,,,
814967304668794880,814967304668794880,2016-12-30 16:52:01 CST,2016-12-30,16:52:01,-0500,2800565790,cfriedmantv,KSAT Courtney Friedman,,San Antonio mother killed in chairlift accident has been identified. Her 2 daughters were also injured in the fall.  https://t.co/AhDDmoZQQQ,en,[],['http://www.ksat.com/news/san-antonio-mother-dies-2-children-injured-in-colorado-chairlift-fall'],[],0,3,2,[],[],https://twitter.com/cfriedmanTV/status/814967304668794880,False,,0,,san antonio,,,,,,[],,,,
814964658062823424,814889564317818880,2016-12-30 16:41:30 CST,2016-12-30,16:41:30,-0500,155807365,bluedrummajor,Jonathan Garza,,@seangrandillo a sexist term used to objectify women.,en,[],[],[],0,0,0,[],[],https://twitter.com/bluedrummajor/status/814964658062823424,False,,0,,san antonio,,,,,,"[{'screen_name': 'seangrandillo', 'name': 'Sean Grandillo', 'id': '52195306'}]",,,,
814958773106315264,814958773106315264,2016-12-30 16:18:07 CST,2016-12-30,16:18:07,-0500,1676675323,fserrat223,Frank 🍥,,Miss the abuse we put our bodies through on Fridays nights  https://t.co/RApUuaKbBX,en,[],[],['https://pbs.twimg.com/media/C09PhH8VIAARORU.jpg'],0,1,11,[],[],https://twitter.com/Fserrat223/status/814958773106315264,False,,1,https://pbs.twimg.com/media/C09PhH8VIAARORU.jpg,san antonio,,,,,,[],,,,
814956775225040896,814956775225040896,2016-12-30 16:10:11 CST,2016-12-30,16:10:11,-0500,1707406464,akinahh5,Kɪɴᴀᴀ ᒪɪɴᴀᴀ ^_−☆,,"Don't abuse my kindness, I'm not here to be taking care of your issues....that's not my job....I don't even like you ✋🏽 #workprobs",en,[],[],[],0,0,1,['workprobs'],[],https://twitter.com/akinahh5/status/814956775225040896,False,,0,,san antonio,,,,,,[],,,,
814940749443768320,814940749443768320,2016-12-30 15:06:30 CST,2016-12-30,15:06:30,-0500,3632543412,ach_gbb,Alamo City Hoops GBB,,"All tied up 38 a piece.  McKayla Tenhave just fouled while shooting a 3ptr for Stevens, at the line now #SheCanGo",en,[],[],[],0,0,0,['shecango'],[],https://twitter.com/ACH_GBB/status/814940749443768320,False,,0,,san antonio,,,,,,[],,,,
814936131070521346,814936131070521346,2016-12-30 14:48:09 CST,2016-12-30,14:48:09,-0500,14131945,xkot,xkot 🏳️‍🌈,,A puppet of Russia being elected president is the greatest threat to our country since the civil war.,en,[],[],[],0,0,0,[],[],https://twitter.com/xkot/status/814936131070521346,False,,0,,san antonio,,,,,,[],,,,
814928777365098496,814928777365098496,2016-12-30 14:18:55 CST,2016-12-30,14:18:55,-0500,2900702340,itsjayyangel,ANGELITO,,"I don't let myself fall victim to bs. Niggas hate on me regardless, I don't respond",en,[],[],[],0,0,0,[],[],https://twitter.com/ItsJayyAngel/status/814928777365098496,False,,0,,san antonio,,,,,,[],,,,
814928207233380353,814928207233380353,2016-12-30 14:16:39 CST,2016-12-30,14:16:39,-0500,3237876689,xavier28__,Axel,,"It's really low to vandalize someone's car and not care, like that's a fucking crime you dumbasses",en,[],[],[],0,0,1,[],[],https://twitter.com/Xavier28__/status/814928207233380353,False,,0,,san antonio,,,,,,[],,,,
814892184310870018,814892184310870018,2016-12-30 11:53:31 CST,2016-12-30,11:53:31,-0500,260560686,transcomics,Alexis Sara 🏳️‍⚧️ 🏳️‍🌈 TSL,,"holy cow there is a mark miller anti gun story here, alright buddy.",en,[],[],[],0,0,2,[],[],https://twitter.com/TransComics/status/814892184310870018,False,,0,,san antonio,,,,,,[],,,,
814874211177164800,814874211177164800,2016-12-30 10:42:06 CST,2016-12-30,10:42:06,-0500,181984901,hisbelovedmess,Jamie Escareño,,#Lupus friends with #tattoos: Do your lupus rashes attack your #ink? My rashes almost always do!,en,[],[],[],0,0,0,"['lupus', 'tattoos', 'ink']",[],https://twitter.com/HisBelovedMess/status/814874211177164800,False,,0,,san antonio,,,,,,[],,,,
814871429003038720,814871429003038720,2016-12-30 10:31:02 CST,2016-12-30,10:31:02,-0500,153880080,hoesayb_,jose,,"Rest assured, I will assault you with a firearm",en,[],[],[],0,0,0,[],[],https://twitter.com/hoesayb_/status/814871429003038720,False,,0,,san antonio,,,,,,[],,,,
814849602373480448,814849602373480448,2016-12-30 09:04:19 CST,2016-12-30,09:04:19,-0500,22742044,crissyrenee,XTINA,,"Had a dream #DannyDeVito was the latest victim of 2016. Woke up to confirm that it was only a dream, thank goodness!",en,[],[],[],0,0,0,['dannydevito'],[],https://twitter.com/crissyrenee/status/814849602373480448,False,,0,,san antonio,,,,,,[],,,,
814847569868292096,814847569868292096,2016-12-30 08:56:14 CST,2016-12-30,08:56:14,-0500,2880802645,tybo10000,Harrison Calvert,,@DrexelUniv I am very saddened you are condoning @ciccmaher tweets about white genocide. I guess it's now acceptable to be racist.,en,"[{'screen_name': 'ciccmaher', 'name': 'katie sartin', 'id': '1357864493632610306'}]",[],[],1,0,0,[],[],https://twitter.com/tybo10000/status/814847569868292096,False,,0,,san antonio,,,,,,[],,,,
814840477119705088,814840477119705088,2016-12-30 08:28:03 CST,2016-12-30,08:28:03,-0500,58101529,sanantoniocp,San Antonio Now,"{'type': 'Point', 'coordinates': [29.42989111, -98.48699646]}",Texas cop lets teen do 200 pushups instead of arrest for marijuana  https://t.co/RsqLDE8BVj,en,[],['http://www.mysanantonio.com/news/houston-texas/texas/article/Arlington-Texas-cop-lets-teen-do-200-pushups-10824408.php'],[],0,0,0,[],[],https://twitter.com/SanAntonioCP/status/814840477119705088,False,,0,,san antonio,,,,,,[],,,,
814807531042275329,814807531042275329,2016-12-30 06:17:08 CST,2016-12-30,06:17:08,-0500,17052311,jocelyn9000,Jocelyn Durand,"{'type': 'Point', 'coordinates': [29.57810825, -98.44198074]}",Police have peacefully taken a man into custody after a standoff this morning. He was threatening his own life with an air gun.  https://t.co/jxfL8hhMLB,en,[],[],['https://pbs.twimg.com/media/C07HHzmUkAAR_qM.jpg'],0,3,4,[],[],https://twitter.com/jocelyn9000/status/814807531042275329,False,,1,https://pbs.twimg.com/media/C07HHzmUkAAR_qM.jpg,san antonio,,,,,,[],,,,
814763664783843328,814711179142565888,2016-12-30 03:22:49 CST,2016-12-30,03:22:49,-0500,17415600,dnsbty,Dennis Beatty,,@bryce depends what you're shooting. For portraits it's my 50mm f/1.4 but for landscapes (and stars) the Rokinon 14mm 2.8 is incredible,en,[],[],[],0,0,0,[],[],https://twitter.com/dnsbty/status/814763664783843328,False,,0,,san antonio,,,,,,"[{'screen_name': 'bryce', 'name': 'Bryce Roberts', 'id': '6160742'}]",,,,
814743093463416832,814743093463416832,2016-12-30 02:01:05 CST,2016-12-30,02:01:05,-0500,2466928146,chloecheyenne07,chloe 🌷,,:( ⚡️ “Serial's Adnan Syed denied bail ahead of retrial for murder”   https://t.co/17aJ9VFpkc,en,[],['https://twitter.com/i/moments/814568635578494976'],[],0,0,2,[],[],https://twitter.com/chloecheyenne07/status/814743093463416832,False,,0,,san antonio,,,,,,[],,,,
814728047551217664,814728047551217664,2016-12-30 01:01:18 CST,2016-12-30,01:01:18,-0500,18570045,sorrymckenzie,all rowdy.,,taking a nap shooting in the morning  someone call me at 6,en,[],[],[],0,0,0,[],[],https://twitter.com/sorrymckenzie/status/814728047551217664,False,,0,,san antonio,,,,,,[],,,,
814722693320835073,814722693320835073,2016-12-30 00:40:01 CST,2016-12-30,00:40:01,-0500,2271024810,rekdtek,Ed Modlin,,That sounds like a pop gun @PointJules #pnweekly,en,"[{'screen_name': 'pointjules', 'name': 'jules wang 王竣穎', 'id': '40124380'}]",[],[],0,0,0,['pnweekly'],[],https://twitter.com/RekdTek/status/814722693320835073,False,,0,,san antonio,,,,,,[],,,,
814707449848594432,814697157974441984,2016-12-29 23:39:27 CST,2016-12-29,23:39:27,-0500,329322619,fxckingenrique,enrique,,@_nnnylhsa how to get away with murder,en,[],[],[],0,0,1,[],[],https://twitter.com/fxckingenrique/status/814707449848594432,False,,0,,san antonio,,,,,,[],,,,
814707390448857088,814697299230257153,2016-12-29 23:39:13 CST,2016-12-29,23:39:13,-0500,260560686,transcomics,Alexis Sara 🏳️‍⚧️ 🏳️‍🌈 TSL,,"13 extended: 2017 is going to be a rough year for everyone but all marginalized communities are in serious danger, we need cash.",en,[],[],[],1,1,7,[],[],https://twitter.com/TransComics/status/814707390448857088,False,,0,,san antonio,,,,,,[],,,,
814705067613884416,814705067613884416,2016-12-29 23:29:59 CST,2016-12-29,23:29:59,-0500,1529390766,handses,REAP™️,,There's so much anger and hate I have inside me and I wish I could let it out.,en,[],[],[],0,0,0,[],[],https://twitter.com/handses/status/814705067613884416,False,,0,,san antonio,,,,,,[],,,,
814699224805818368,814699224805818368,2016-12-29 23:06:46 CST,2016-12-29,23:06:46,-0500,2959029384,kamarionair,Kamari Esquerra NBC,,I had an anxiety attack just watching this  https://t.co/jpPKPSLwjl,en,[],['https://twitter.com/woridstarvide0s/status/814621893743570945'],[],0,0,0,[],[],https://twitter.com/kamarionair/status/814699224805818368,False,https://twitter.com/woridstarvide0s/status/814621893743570945,0,,san antonio,,,,,,[],,,,
814684075818708992,814684075818708992,2016-12-29 22:06:34 CST,2016-12-29,22:06:34,-0500,761969686506418177,sylee1720,𝚂𝚢𝚟𝚊𝚗𝚗𝚊 🌵🦋,,It is . I'm in full agreement . I hope this topic comes to rise because the effects of sexual assault are by far worse than it happening .  https://t.co/vClHL7yAtq,en,[],['https://twitter.com/jessimeno/status/814683136550465536'],[],1,0,1,[],[],https://twitter.com/sylee1720/status/814684075818708992,False,https://twitter.com/jessimeno/status/814683136550465536,0,,san antonio,,,,,,[],,,,
814676710419529728,814676710419529728,2016-12-29 21:37:18 CST,2016-12-29,21:37:18,-0500,109769504,cbseric,Eric Christensen,,"Outside of Wazzu game, @cubuffs O has been average. They'd take that tonight. #brutal #cubuffs",en,"[{'screen_name': 'cubuffs', 'name': 'colorado buffaloes', 'id': '10828932'}]",[],[],0,0,0,"['brutal', 'cubuffs']",[],https://twitter.com/cbseric/status/814676710419529728,False,,0,,san antonio,,,,,,[],,,,
814673693200809984,814673693200809984,2016-12-29 21:25:19 CST,2016-12-29,21:25:19,-0500,243400801,thaolivegirl,liv.✨,,A Triple Threat as always 💙🍫  https://t.co/HS6m6iy8nA,en,[],[],['https://pbs.twimg.com/media/C05NZ2DUQAAeEPo.jpg'],0,0,1,[],[],https://twitter.com/ThaOliveGirl/status/814673693200809984,False,,1,https://pbs.twimg.com/media/C05NZ2DUQAAeEPo.jpg,san antonio,,,,,,[],,,,
814672299500728320,814672299500728320,2016-12-29 21:19:46 CST,2016-12-29,21:19:46,-0500,410397062,_christiandoria,CD,,"that's the danger in starting a fire, you never know how many bridges you'll burn",en,[],[],[],0,0,0,[],[],https://twitter.com/_ChristianDoria/status/814672299500728320,False,,0,,san antonio,,,,,,[],,,,
814668800952070144,814668800952070144,2016-12-29 21:05:52 CST,2016-12-29,21:05:52,-0500,67424644,nystaceyintx,🇺🇸Trump4Life🇺🇸,,What an ugly washed up hag #KathyGriffin is. Cant show anger on her face even if she wanted to. #hasbeen #TrumpWon #IDrinkYourLiberalTears  https://t.co/mUXBZgm5ne,en,[],['https://twitter.com/kathygriffin/status/814377581894111234'],[],0,0,0,"['kathygriffin', 'hasbeen', 'trumpwon', 'idrinkyourliberaltears']",[],https://twitter.com/NYStaceyInTX/status/814668800952070144,False,https://twitter.com/kathygriffin/status/814377581894111234,0,,san antonio,,,,,,[],,,,
814665637930868736,814657632183189504,2016-12-29 20:53:18 CST,2016-12-29,20:53:18,-0500,4530019292,212degreesnow,Tricia,,@qofcode *sigh PRIVATE sale doesn't require bckgrnd chk. SAXET gun show has unlicensed sellers. Also Interwebs.  https://t.co/KKbDfpekwz,en,[],['https://www.thetrace.org/2016/01/internet-gun-sales-background-checks/'],[],5,0,0,[],[],https://twitter.com/212degreesnow/status/814665637930868736,False,,0,,san antonio,,,,,,"[{'screen_name': 'qofcode', 'name': 'TTT', 'id': '46726562'}]",,,,
814663769938948097,814663769938948097,2016-12-29 20:45:53 CST,2016-12-29,20:45:53,-0500,443112893,inconsistencyy_,kaetexxxas*^!,,shooting with my left hand ginobili,en,[],[],[],0,0,0,[],[],https://twitter.com/inconsistencyy_/status/814663769938948097,False,,0,,san antonio,,,,,,[],,,,
814661932917592065,814616254195650560,2016-12-29 20:38:35 CST,2016-12-29,20:38:35,-0500,4530019292,212degreesnow,Tricia,,@asphaultangel13 it's LEGAL. That's why @MomsDemand exists. We're changing what's broken w/ gun laws.  @RGifford09 @shannonrwatts,en,"[{'screen_name': 'momsdemand', 'name': 'moms demand action', 'id': '1017637447'}, {'screen_name': 'rgifford09', 'name': 'ryan', 'id': '472105187'}, {'screen_name': 'shannonrwatts', 'name': 'shannon watts', 'id': '246939630'}]",[],[],2,0,2,[],[],https://twitter.com/212degreesnow/status/814661932917592065,False,,0,,san antonio,,,,,,[],,,,
814660431344238595,814616254195650560,2016-12-29 20:32:37 CST,2016-12-29,20:32:37,-0500,4530019292,212degreesnow,Tricia,,@asphaultangel13 it's true. I'm in Texas. Can buy ANY gun at a gun show from private seller w/o bckgrnd chk. @RGifford09 @shannonrwatts,en,"[{'screen_name': 'rgifford09', 'name': 'ryan', 'id': '472105187'}, {'screen_name': 'shannonrwatts', 'name': 'shannon watts', 'id': '246939630'}]",[],[],0,0,2,[],[],https://twitter.com/212degreesnow/status/814660431344238595,False,,0,,san antonio,,,,,,[],,,,
814659288090210304,814657176044191744,2016-12-29 20:28:04 CST,2016-12-29,20:28:04,-0500,4530019292,212degreesnow,Tricia,,@mkamin15 any wkend I can go to a Texas gun show &amp; buy from a private seller or arrange on armslistdotcom @shannonrwatts @Kimberly_Corban,en,"[{'screen_name': 'shannonrwatts', 'name': 'shannon watts', 'id': '246939630'}, {'screen_name': 'kimberly_corban', 'name': 'kimberly corban', 'id': '477064682'}]",[],[],0,0,0,[],[],https://twitter.com/212degreesnow/status/814659288090210304,False,,0,,san antonio,,,,,,"[{'screen_name': 'MKAmin15', 'name': 'M K Amin', 'id': '1219572905186451457'}]",,,,
814658712983994368,814616254195650560,2016-12-29 20:25:47 CST,2016-12-29,20:25:47,-0500,4530019292,212degreesnow,Tricia,,"@asphaultangel13 I'm a gun owner &amp; @MomsDemand vol. Nothing anti-#2A abt bckgrnd chks, gun safety. @RGifford09 @BassProShops @shannonrwatts",en,"[{'screen_name': 'momsdemand', 'name': 'moms demand action', 'id': '1017637447'}, {'screen_name': 'rgifford09', 'name': 'ryan', 'id': '472105187'}, {'screen_name': 'bassproshops', 'name': 'bass pro shops', 'id': '22695018'}, {'screen_name': 'shannonrwatts', 'name': 'shannon watts', 'id': '246939630'}]",[],[],2,0,3,['2a'],[],https://twitter.com/212degreesnow/status/814658712983994368,False,,0,,san antonio,,,,,,[],,,,
814657632183189504,814657632183189504,2016-12-29 20:21:29 CST,2016-12-29,20:21:29,-0500,4530019292,212degreesnow,Tricia,,"It's super easy. I live in Texas &amp; can go to a gun show any given weekend, buy through a private party w/o a bckgrnd chk. Study up, son.  https://t.co/VOz82dMTIX",en,[],['https://twitter.com/qofcode/status/814525936565678080'],[],1,4,3,[],[],https://twitter.com/212degreesnow/status/814657632183189504,False,https://twitter.com/qofcode/status/814525936565678080,0,,san antonio,,,,,,[],,,,
814657176044191744,814657176044191744,2016-12-29 20:19:41 CST,2016-12-29,20:19:41,-0500,4530019292,212degreesnow,Tricia,,"Another one that thinks all gun sales require background checks. 🙄 Son, thousands of moms wouldn't be fighting for them if we had them.  https://t.co/wcwW6a2Pye",en,[],['https://twitter.com/mkamin15/status/814541119799357440'],[],1,8,7,[],[],https://twitter.com/212degreesnow/status/814657176044191744,False,0,0,,san antonio,,,,,,[],,,,
814650188195385344,814650188195385344,2016-12-29 19:51:54 CST,2016-12-29,19:51:54,-0500,365689448,j_chapa15,j,,My brother kept saying it doesn't hurt to get hit by the NERF gun so guess where my dad shot him?! 🤣🤣🤣  https://t.co/mGnxqFZsKw,en,[],[],['https://pbs.twimg.com/media/C044BdlUkAA4L2m.jpg'],0,0,2,[],[],https://twitter.com/j_chapa15/status/814650188195385344,False,,1,https://pbs.twimg.com/media/C044BdlUkAA4L2m.jpg,san antonio,,,,,,[],,,,
