id,conversation_id,created_at,date,time,timezone,user_id,username,name,place,tweet,language,mentions,urls,photos,replies_count,retweets_count,likes_count,hashtags,cashtags,link,retweet,quote_url,video,thumbnail,near,geo,source,user_rt_id,user_rt,retweet_id,reply_to,retweet_date,translate,trans_src,trans_dest
938919680667996160,938919680667996160,2017-12-07 17:54:30 CST,2017-12-07,17:54:30,-0500,485178392,lf_p,Paul ツ,"{'type': 'Point', 'coordinates': [40.759913, -73.988592]}","Apparently it’s just kick you in the crotch spit on your neck fantastic! (@ Friends - The Musical in New York, NY w/ @nath89)  https://t.co/ayl6xApD9I  https://t.co/76FC0QeeMk",en,"[{'screen_name': 'nath89', 'name': 'nath', 'id': '20769759'}]",['https://www.swarmapp.com/c/6jxOunxjOsR'],['https://pbs.twimg.com/media/DQe2eQPWkAAlmpL.jpg'],0,1,1,[],[],https://twitter.com/lf_p/status/938919680667996160,False,,1,https://pbs.twimg.com/media/DQe2eQPWkAAlmpL.jpg,new york city,,,,,,[],,,,
938918524348784640,938918524348784640,2017-12-07 17:49:55 CST,2017-12-07,17:49:55,-0500,90560433,godsbestsinner,King of The North,,I had a dream my ex got jumped and I dead turned around and told everyone too suit up like I was really Batman lmfao .. I had a secret lair and everything. 😂,en,[],[],[],0,0,0,[],[],https://twitter.com/GodsBestSinner/status/938918524348784640,False,,0,,new york city,,,,,,[],,,,
938918210598064133,938918210598064133,2017-12-07 17:48:40 CST,2017-12-07,17:48:40,-0500,3166286551,princessbubz2,LadyAizawa 💕💕💕,,If you want her god ur gonna have to pry her from my cold dead hands,en,[],[],[],0,0,0,[],[],https://twitter.com/princessbubz2/status/938918210598064133,False,,0,,new york city,,,,,,[],,,,
938918052032282624,938918052032282624,2017-12-07 17:48:02 CST,2017-12-07,17:48:02,-0500,23308566,hirshi,ҍìց ʝąՀՀӀҽɾ,"{'type': 'Point', 'coordinates': [40.7128, -73.937]}",Yes y😃u can! - Drinking a Can I Kick It? by @interboronyc @ Interboro Spirits and Ales  —  https://t.co/UYK0tJmSzM #photo,en,"[{'screen_name': 'interboronyc', 'name': 'interboro', 'id': '2983402054'}]",['http://untp.beer/s/c535585371'],[],0,0,0,['photo'],[],https://twitter.com/hirshi/status/938918052032282624,False,,0,,new york city,,,,,,[],,,,
938918023301423104,938918023301423104,2017-12-07 17:47:55 CST,2017-12-07,17:47:55,-0500,14859602,theotnerd,Will Laughner,"{'type': 'Point', 'coordinates': [40.6595, -73.9548]}","You don't wanna hurt me But see how deep the bullet lies Unaware I'm tearing you asunder Oh,…  https://t.co/S8BMa1u980",en,[],['https://www.instagram.com/p/Bca4V7THDCT/'],[],0,0,0,[],[],https://twitter.com/theotnerd/status/938918023301423104,False,,0,,new york city,,,,,,[],,,,
938916050762166272,938916050762166272,2017-12-07 17:40:05 CST,2017-12-07,17:40:05,-0500,54113697,nunonicplague,Nuno Cardoso,,Surprised and shocked about #AugustAmes death. #RIPAugustAmes,en,[],[],[],0,0,0,"['augustames', 'ripaugustames']",[],https://twitter.com/NunonicPlague/status/938916050762166272,False,,0,,new york city,,,,,,[],,,,
938915556551548928,938915556551548928,2017-12-07 17:38:07 CST,2017-12-07,17:38:07,-0500,15758715,soapboxx,Sam swing and a drive to deep center,,@PodSaveAmerica whyyyyy did Dems agree to the CR. It makes no sense at all. Why not force the issue?,en,[],[],[],0,0,0,[],[],https://twitter.com/soapboxx/status/938915556551548928,False,,0,,new york city,,,,,,[],,,,
938914536647811072,938914536647811072,2017-12-07 17:34:04 CST,2017-12-07,17:34:04,-0500,479562736,ginsburgjobs,Andrew S. Ginsburg,,Sen. Jeff Merkley Just Called On Trump To Resign Over Sexual Assault Allegations via @politicususa  https://t.co/DqjNj2zA3Z,en,"[{'screen_name': 'politicususa', 'name': 'politicususa', 'id': '14792049'}]",['http://www.politicususa.com/2017/12/07/sen-jeff-merkley-called-trump-resign-sexual-assault-allegations.html'],[],0,17,21,[],[],https://twitter.com/GinsburgJobs/status/938914536647811072,False,,0,,new york city,,,,,,[],,,,
938914526627495937,938914526627495937,2017-12-07 17:34:01 CST,2017-12-07,17:34:01,-0500,124982134,d_gyme,tyop knig 🇭🇹🇭🇹,,Who has better punch lines 2chaniz or fabulous??,en,[],[],[],0,0,0,[],[],https://twitter.com/D_GymE/status/938914526627495937,False,,0,,new york city,,,,,,[],,,,
938913797171044354,938913797171044354,2017-12-07 17:31:08 CST,2017-12-07,17:31:08,-0500,132760570,edfig81,EdFig81🥃,,@Boogie2988 I luv ure videos but when people like Anita call u out u need to respond better. Being natural is b.s. no offense. She has an issue with Mario saving the princess. What u sed on that panel is u being real.  She has no right to say jack smfh.,en,[],[],[],0,0,0,[],[],https://twitter.com/EdFig81/status/938913797171044354,False,,0,,new york city,,,,,,[],,,,
938912652612587520,938912652612587520,2017-12-07 17:26:35 CST,2017-12-07,17:26:35,-0500,800131766623178753,shirdcherrie,Cherrie shird,,Margaret is a good friend she wanted to take off her shoes and kick ass thanks pigtails #RHONJ,en,[],[],[],0,0,0,['rhonj'],[],https://twitter.com/ShirdCherrie/status/938912652612587520,False,,0,,new york city,,,,,,[],,,,
938911318811189248,938911318811189248,2017-12-07 17:21:17 CST,2017-12-07,17:21:17,-0500,103410640,bryankalbrosky,Bryan Kalbrosky,,"As a rookie, Jahlil Okafor scored 1.34 points per possession while in transition offense. Brooklyn currently has the worst transition offense (0.97 points per possession) in the NBA:  https://t.co/VM7CNP7vkl #WeGoHard  https://t.co/SZhFJSGfzF",en,[],['https://usat.ly/2kxyBcP'],['https://pbs.twimg.com/media/DQeu3ZTW0AE8D-R.jpg'],0,10,26,['wegohard'],[],https://twitter.com/BryanKalbrosky/status/938911318811189248,False,,1,https://pbs.twimg.com/media/DQeu3ZTW0AE8D-R.jpg,new york city,,,,,,[],,,,
938911131950821377,938911131950821377,2017-12-07 17:20:32 CST,2017-12-07,17:20:32,-0500,38108094,gabriellegabby,Gabrielle Rosenberg Stylist,,Off Broadway Review: Chloe Sevigny in ‘Downtown Race Riot’  https://t.co/RdyVkzhcvs via @variety,en,"[{'screen_name': 'variety', 'name': 'variety', 'id': '17525171'}]",['http://variety.com/2017/legit/reviews/downtown-race-riot-review-chloe-sevigny-2-1202632856/#utm_medium=social&utm_source=twitter&utm_campaign=social_bar&utm_content=bottom&utm_id=1202632856'],[],0,0,0,[],[],https://twitter.com/GabrielleGabby/status/938911131950821377,False,,0,,new york city,,,,,,[],,,,
938910591200190470,938910591200190470,2017-12-07 17:18:23 CST,2017-12-07,17:18:23,-0500,49226953,georgewarnock,George Warnock,,"@NYPDnews Congress is going to pass 50 state concealed weapon permit, someone tell O'neal to get out of the stone age and accept the fact that honest americans have the right to bear arms in the city for protection",en,[],[],[],0,0,0,[],[],https://twitter.com/GeorgeWarnock/status/938910591200190470,False,,0,,new york city,,,,,,[],,,,
938910421683236864,938908050085294080,2017-12-07 17:17:43 CST,2017-12-07,17:17:43,-0500,16037486,gregavola,Greg Avola,,@brianleroux If I’m on the web - I want to be the web. Don’t force me into things I don’t want to do.,en,[],[],[],1,0,1,[],[],https://twitter.com/gregavola/status/938910421683236864,False,,0,,new york city,,,,,,"[{'screen_name': 'brianleroux', 'name': 'Brian LeRoux', 'id': '676363'}]",,,,
938909021402206208,938909021402206208,2017-12-07 17:12:09 CST,2017-12-07,17:12:09,-0500,116562409,aprilsblessing_,you deadass?🏌🏼‍♀️,,"Sometimes the devils temptations will force you, but one thing about the Lord is he’ll never cross you..",en,[],[],[],0,1,1,[],[],https://twitter.com/AprilsBlessing_/status/938909021402206208,False,,0,,new york city,,,,,,[],,,,
938908862312304641,938908862312304641,2017-12-07 17:11:31 CST,2017-12-07,17:11:31,-0500,25163231,convertbond,Lawrence McDonald,,"U.S. Treasuries, backed by the full faith and credit (and thankfully, efforts) of the Army, Navy, Air Force, and Marine Corps  #PearlHarbor76   December 7, 1941  Via @BrianYelvington",en,"[{'screen_name': 'brianyelvington', 'name': 'brian yelvington', 'id': '377936495'}]",[],[],0,3,8,['pearlharbor76'],[],https://twitter.com/Convertbond/status/938908862312304641,False,,0,,new york city,,,,,,[],,,,
938908325080596480,938908325080596480,2017-12-07 17:09:23 CST,2017-12-07,17:09:23,-0500,163961760,bmillllz_,Big B 🍒,,Ezra dead fell asleep in 2.5 snoring and all ❤️😂,en,[],[],[],0,0,0,[],[],https://twitter.com/bmillllz_/status/938908325080596480,False,,0,,new york city,,,,,,[],,,,
938907508500025344,938907508500025344,2017-12-07 17:06:08 CST,2017-12-07,17:06:08,-0500,19638460,mrdturner,Mr D Turner,"{'type': 'Point', 'coordinates': [40.72843, -73.99988]}",Sorry not sorry. Death to ampegs!!! Lol @rongilmorejr on the cameo lol @ (le) poisson rouge  https://t.co/VMJOilAgXo,en,"[{'screen_name': 'rongilmorejr', 'name': 'ron gilmore', 'id': '1243141022'}]",['https://www.instagram.com/p/BcazP1LFtLJ/'],[],0,0,0,[],[],https://twitter.com/MRDTURNER/status/938907508500025344,False,,0,,new york city,,,,,,[],,,,
938906626496630784,938906626496630784,2017-12-07 17:02:38 CST,2017-12-07,17:02:38,-0500,16259251,revolttv,REVOLT,,#KMichelle keeps it real when asked about former mentor #RKelly and abuse allegations. Watch the full interview here:  https://t.co/ZkgUL8iieX  https://t.co/6ZzBVa9TQz,en,[],['https://revolt.tv/stories/2017/12/06/kmichelle-speaks-rkelly-abuse-allegations-experience-abuse-0700efc136'],[],1,4,10,"['kmichelle', 'rkelly']",[],https://twitter.com/revolttv/status/938906626496630784,False,,1,https://pbs.twimg.com/ext_tw_video_thumb/938906495156023297/pu/img/mPjb6j3aymUiDWAU.jpg,new york city,,,,,,[],,,,
938906393960243200,938906393960243200,2017-12-07 17:01:43 CST,2017-12-07,17:01:43,-0500,1641050708,trentxmadison,t.,,when I'm old i dead  ass wanna have a show on food network just traveling and eating crazy food id die happy lol,en,[],[],[],0,0,5,[],[],https://twitter.com/trentxmadison/status/938906393960243200,False,,0,,new york city,,,,,,[],,,,
938906128452407296,938906128452407296,2017-12-07 17:00:39 CST,2017-12-07,17:00:39,-0500,17054057,kingpryze,🅿️rizeraci,,Imagine a world where Jay Z wasn't used by some Russian guy to force the Nets to leave Jersey and go to Brooklyn.... &gt;&gt;&gt;&gt;,en,[],[],[],0,0,0,[],[],https://twitter.com/KingPryze/status/938906128452407296,False,,0,,new york city,,,,,,[],,,,
938904963983560704,938904963983560704,2017-12-07 16:56:02 CST,2017-12-07,16:56:02,-0500,272900787,kiyanjajp,John Paul Kiyanja,,"Bloody! #GEJobcuts GE’s Power Division to eliminate 12,000 jobs as part of cost cuts  https://t.co/H1BeSmdsRu via @WSJ",en,"[{'screen_name': 'wsj', 'name': 'the wall street journal', 'id': '3108351'}]",['https://www.wsj.com/articles/ges-power-division-to-eliminate-12-000-jobs-1512648486'],[],0,0,0,['gejobcuts'],[],https://twitter.com/kiyanjajp/status/938904963983560704,False,,0,,new york city,,,,,,[],,,,
938904172375760903,938900062188523522,2017-12-07 16:52:53 CST,2017-12-07,16:52:53,-0500,25190937,wordtokay,champagne mami thelz,,@deeadavisbk dead ass,en,[],[],[],1,0,0,[],[],https://twitter.com/wordtoKay/status/938904172375760903,False,,0,,new york city,,,,,,"[{'screen_name': 'deeadavisbk', 'name': 'Dee A.Davis', 'id': '158603824'}]",,,,
938903981367099393,938903981367099393,2017-12-07 16:52:07 CST,2017-12-07,16:52:07,-0500,3122417261,http_wasabi,Mr. Rager,,my sides hurt  https://t.co/dOiCIKjGwu,en,[],['https://twitter.com/sophiachiari/status/938438931586207744'],[],0,0,0,[],[],https://twitter.com/Http_wasabi/status/938903981367099393,False,https://twitter.com/sophiachiari/status/938438931586207744,0,,new york city,,,,,,[],,,,
938903947942809600,938903947942809600,2017-12-07 16:51:59 CST,2017-12-07,16:51:59,-0500,3719814394,tsunderesushi,Non-Functioning Testical (NFT),,So I have a hot doctor and my heart rate starting going up. My body dead ass ratted me out 🙄,en,[],[],[],0,0,1,[],[],https://twitter.com/tsunderesushi/status/938903947942809600,False,,0,,new york city,,,,,,[],,,,
938903548435337216,938903548435337216,2017-12-07 16:50:24 CST,2017-12-07,16:50:24,-0500,733956876,neeceyneece,𝕘𝕦𝕒𝕧𝕒𝕝𝕚𝕔𝕚𝕠𝕦𝕤,,*something falls on Olivia*  Olivia: *looking up* Jesus? Lisa: OLIVIA THAT'S BLASPHEMY Debbie: Olivia don't be silly. Jesus is dead.,en,[],[],[],0,0,1,[],[],https://twitter.com/NeeceyNeece/status/938903548435337216,False,,0,,new york city,,,,,,[],,,,
938903302321958912,938903302321958912,2017-12-07 16:49:25 CST,2017-12-07,16:49:25,-0500,182688923,seth_price10,Seth Price 🐢,,Hot dog eating champion Joey Chestnut is gonna be on The Amazing Race I'm DEAD 😂 can't wait for Season 30,en,[],[],[],0,0,0,[],[],https://twitter.com/Seth_Price10/status/938903302321958912,False,,0,,new york city,,,,,,[],,,,
938902873534029825,938902873534029825,2017-12-07 16:47:43 CST,2017-12-07,16:47:43,-0500,487025430,hallie_roneson,hal thee gal | BLM,,I just sent my #wordsofhope17 to survivors of prisoner rape for the holidays. Will you join me and @justdetention?  https://t.co/FdpKz4hWJj,en,"[{'screen_name': 'justdetention', 'name': ""just detention int'l"", 'id': '120147232'}]",['http://justdetention.org/hope'],[],0,0,1,['wordsofhope17'],[],https://twitter.com/hallie_roneson/status/938902873534029825,False,,0,,new york city,,,,,,[],,,,
938902698514149377,938902698514149377,2017-12-07 16:47:01 CST,2017-12-07,16:47:01,-0500,866424801585487873,zayskywalker,blue,,Dead thought this was bali  https://t.co/Q5c3ChxlnR,en,[],['https://twitter.com/DiscoverMag/status/873230168265027586'],[],0,0,0,[],[],https://twitter.com/zayskywalker/status/938902698514149377,False,https://twitter.com/DiscoverMag/status/873230168265027586,0,,new york city,,,,,,[],,,,
938902413720936449,938902413720936449,2017-12-07 16:45:54 CST,2017-12-07,16:45:54,-0500,882365209389793280,evolsylv,kris 🥀,,I can’t believe I got drunk the other night and started a riot basically lmfaooo.,en,[],[],[],1,0,1,[],[],https://twitter.com/evolsylv/status/938902413720936449,False,,0,,new york city,,,,,,[],,,,
938902169310425088,938902169310425088,2017-12-07 16:44:55 CST,2017-12-07,16:44:55,-0500,459117608,brusheild0n,Brushy🇬🇾,,So fucking hurt and confused.,en,[],[],[],0,0,0,[],[],https://twitter.com/Brusheild0n/status/938902169310425088,False,,0,,new york city,,,,,,[],,,,
938898303600726016,938898303600726016,2017-12-07 16:29:34 CST,2017-12-07,16:29:34,-0500,190102963,ladyjaydyn,JeSsIi,,@TwitterSupport you guys NEED to tell @TMZ @HarveyLevinTMZ 2 remove their posts about @ChesterBe  these could trigger others 2 hurt themselves! #fucktmz not even going 2 watch @fox5ny as this stupid show airs on that channel,en,"[{'screen_name': 'tmz', 'name': 'tmz', 'id': '16331010'}, {'screen_name': 'harveylevintmz', 'name': 'harvey levin', 'id': '36098990'}, {'screen_name': 'chesterbe', 'name': 'chester bennington', 'id': '36880083'}, {'screen_name': 'fox5ny', 'name': 'fox5ny', 'id': '9229672'}]",[],[],0,0,1,['fucktmz'],[],https://twitter.com/LaDyJaYdYn/status/938898303600726016,False,,0,,new york city,,,,,,[],,,,
938898224865267712,938898224865267712,2017-12-07 16:29:15 CST,2017-12-07,16:29:15,-0500,28618917,xyzxyz101101,smiling,,Bernie Sanders wrote about women fantasizing about being raped. They LOVE it. Really Bernie? How do you know?,en,[],[],[],1,2,3,[],[],https://twitter.com/xyzxyz101101/status/938898224865267712,False,,0,,new york city,,,,,,[],,,,
938898009630367748,938898009630367748,2017-12-07 16:28:24 CST,2017-12-07,16:28:24,-0500,2309882507,maxedge051,↪MAX EDGE↩,,#WeirdPlacesToSeeSanta Starring in a dinner theater production of death of a salesman,en,[],[],[],0,0,3,['weirdplacestoseesanta'],[],https://twitter.com/maxedge051/status/938898009630367748,False,,0,,new york city,,,,,,[],,,,
938896256105054208,936714362517106689,2017-12-07 16:21:25 CST,2017-12-07,16:21:25,-0500,117798867,siggyflicker,Siggy Flicker,,@anniedef24 Hello @Andy @Bravotv #RHONJ. This is what a fake account looks like. These troll accounts have been created daily by you know who to bully &amp; harass me. I won’t shrink my fabulous self so others feel comfortable. #geeenwithenvy #walkastraightlineinlife  https://t.co/ntvChqZNeo,en,"[{'screen_name': 'andy', 'name': 'andy cohen', 'id': '48100887'}, {'screen_name': 'bravotv', 'name': 'bravo', 'id': '15169907'}]",[],['https://pbs.twimg.com/media/DQehIrUVAAAFQEA.jpg'],0,0,1,"['rhonj', 'geeenwithenvy', 'walkastraightlineinlife']",[],https://twitter.com/siggyflicker/status/938896256105054208,False,,1,https://pbs.twimg.com/media/DQehIrUVAAAFQEA.jpg,new york city,,,,,,"[{'screen_name': 'anniedef24', 'name': 'Annie Defesche', 'id': '939293755'}]",,,,
938895863031746560,938890310448549889,2017-12-07 16:19:52 CST,2017-12-07,16:19:52,-0500,39257389,michaelgbaron,Michael Baron,,"@ashah6397 You maybe right, but they were as aggressive as they could’ve been on Céspedes last winter.",en,[],[],[],2,0,0,[],[],https://twitter.com/michaelgbaron/status/938895863031746560,False,,0,,new york city,,,,,,"[{'screen_name': 'ashah6397', 'name': 'TheSwami', 'id': '255811969'}]",,,,
938895373229273088,938895373229273088,2017-12-07 16:17:55 CST,2017-12-07,16:17:55,-0500,1705766497,mariahevee,❤️‍🔥,,Calling me ugly doesn’t hurt my feelings cause i know I’m not 🤣,en,[],[],[],0,0,1,[],[],https://twitter.com/mariahevee/status/938895373229273088,False,,0,,new york city,,,,,,[],,,,
938893233941286913,938893233941286913,2017-12-07 16:09:25 CST,2017-12-07,16:09:25,-0500,321440152,ezra731,Ezra Mann,,"@robert_beyda gotta give credit to the Nets for making some solid moves and having a bright future. DRuss and Okafor, not a bad 1-2 punch.",en,[],[],[],1,0,0,[],[],https://twitter.com/ezra731/status/938893233941286913,False,,0,,new york city,,,,,,[],,,,
938892225303506945,938892225303506945,2017-12-07 16:05:24 CST,2017-12-07,16:05:24,-0500,2182727279,olive_olivia_,Liv,,"Walter Scott didn’t deserve his death, but Michael Slager sure as hell deserves to rot in a cell. Finally, finally, a sliver of Justice is served. #restinpower",en,[],[],[],0,0,0,['restinpower'],[],https://twitter.com/olive_olivia_/status/938892225303506945,False,,0,,new york city,,,,,,[],,,,
