id,conversation_id,created_at,date,time,timezone,user_id,username,name,place,tweet,language,mentions,urls,photos,replies_count,retweets_count,likes_count,hashtags,cashtags,link,retweet,quote_url,video,thumbnail,near,geo,source,user_rt_id,user_rt,retweet_id,reply_to,retweet_date,translate,trans_src,trans_dest
882387478111453185,882387478111453185,2017-07-04 18:55:43 CDT,2017-07-04,18:55:43,-0500,1223554518,sandybell710,Sandy Bell 🐻,,@Midget_Rage  https://t.co/RAKaiaDs4Y,und,[],['https://twitter.com/nytimes/status/882378604096757761'],[],0,0,0,[],[],https://twitter.com/SandyBell710/status/882387478111453185,False,https://twitter.com/nytimes/status/882378604096757761,0,,new york city,,,,,,[],,,,
882386680916967424,882386680916967424,2017-07-04 18:52:33 CDT,2017-07-04,18:52:33,-0500,2417009840,childiissh,Childii$h,,I just wanna kiss under some gun shots tonight and then run or whatever 😭😭.,en,[],[],[],0,1,3,[],[],https://twitter.com/childiissh/status/882386680916967424,False,,0,,new york city,,,,,,[],,,,
882386085447426048,882386085447426048,2017-07-04 18:50:11 CDT,2017-07-04,18:50:11,-0500,337509522,kdwashington,KDW,,Cubs sign son of Charleston shooting victim   https://t.co/WT3xPynLXm,en,[],['http://bleacherreport.com/articles/2718808-a-qa-with-cubs-draftee-chris-singleton-son-of-charleston-shooting-victim?utm_source=cnn.com&utm_campaign=editorial&utm_medium=referral'],[],0,0,0,[],[],https://twitter.com/KDWashington/status/882386085447426048,False,,0,,new york city,,,,,,[],,,,
882384855836884992,882384855836884992,2017-07-04 18:45:18 CDT,2017-07-04,18:45:18,-0500,2212548205,funbythebasket,CityAuntie,,Melania get a real voice.  Puppet women are a crime against all women &amp; symbol of old Wrld views like those of your ignorant husb.  https://t.co/8q0sptHsop,en,[],['https://twitter.com/FLOTUS/status/882228697339711489'],[],0,0,0,[],[],https://twitter.com/funbythebasket/status/882384855836884992,False,https://twitter.com/FLOTUS/status/882228697339711489,0,,new york city,,,,,,[],,,,
882384156176658432,882384156176658432,2017-07-04 18:42:31 CDT,2017-07-04,18:42:31,-0500,2433099824,blkforestgirl,VJ,,"This poor bald eagle. It was supposed to be injured from a series of thunderstorms, but I think it just read one of Trump's tweets.  https://t.co/9qjMmQ2xjU",en,[],[],['https://pbs.twimg.com/media/DD7bdToUIAA-4UK.jpg'],0,0,0,[],[],https://twitter.com/BlkForestGirl/status/882384156176658432,False,,1,https://pbs.twimg.com/media/DD7bdToUIAA-4UK.jpg,new york city,,,,,,[],,,,
882382772580503552,882382772580503552,2017-07-04 18:37:01 CDT,2017-07-04,18:37:01,-0500,26119217,brandonmckinney,Brandon Edward,"{'type': 'Point', 'coordinates': [40.74728297, -73.95695839]}",Can't wait for the @macys firework show. They are shooting them off…  https://t.co/vlIu8m9Nk7,en,"[{'screen_name': 'macys', 'name': ""macy's"", 'id': '50687788'}]",['https://www.instagram.com/p/BWJLFYHgBYCFM77xjJr2dFUNz2-6cBDAReYOh00/'],[],0,0,1,[],[],https://twitter.com/BrandonMcKinney/status/882382772580503552,False,,0,,new york city,,,,,,[],,,,
882382638899748866,882382638899748866,2017-07-04 18:36:29 CDT,2017-07-04,18:36:29,-0500,25369197,fubarahh,END THE FILIBUSTER!! END THE FILIBUSTER!!,,#25thAmendmentNow  #25thAmendment  #ImpeachTrumpNow   Keep this trending. Trump's head will explode. He's already in a rage. 😁  https://t.co/5qn6NrgsIF,en,[],['https://twitter.com/joncoopertweets/status/882328520927698944'],[],0,0,0,"['25thamendmentnow', '25thamendment', 'impeachtrumpnow']",[],https://twitter.com/Fubarahh/status/882382638899748866,False,https://twitter.com/joncoopertweets/status/882328520927698944,0,,new york city,,,,,,[],,,,
882379207342514178,882379207342514178,2017-07-04 18:22:51 CDT,2017-07-04,18:22:51,-0500,4056791195,filippfrenkel,Filipp Frenkel,,"superstitions  and even venoms  of vicious anti-Americanism , racism  anti-Semitism   and  calling even to violence against the USA",en,[],[],[],0,0,0,[],[],https://twitter.com/FilippFrenkel/status/882379207342514178,False,,0,,new york city,,,,,,[],,,,
882378475159638016,882378475159638016,2017-07-04 18:19:56 CDT,2017-07-04,18:19:56,-0500,258475649,saradietschy,Sara Dietschy 🍑y,,took me the entire day to edit tonights video for some reason lol I had a lot of fun shooting it tho also happy merica day will be up soon,en,[],[],[],5,2,135,[],[],https://twitter.com/saradietschy/status/882378475159638016,False,,0,,new york city,,,,,,[],,,,
882378463772110848,882378463772110848,2017-07-04 18:19:54 CDT,2017-07-04,18:19:54,-0500,47835582,hey_kaykay,Kyla Sylvers,"{'type': 'Point', 'coordinates': [40.80903333, -73.94837222]}","When racist white people tried you today and you not only checked them, but also decided that…  https://t.co/Z2WAhdz0o5",en,[],['https://www.instagram.com/p/BWJJILKlERR/'],[],0,0,0,[],[],https://twitter.com/Hey_KayKay/status/882378463772110848,False,,0,,new york city,,,,,,[],,,,
882376068547698688,882376068547698688,2017-07-04 18:10:23 CDT,2017-07-04,18:10:23,-0500,144325625,mauricemichael,Maurice Ross,,"After all, Missouri is the show me state.  Show Me racism, homophobia, white supremacy and fascism.  https://t.co/Mrh5LJvl27",en,[],['https://twitter.com/sarahkendzior/status/882219527966273536'],[],0,1,1,[],[],https://twitter.com/MauriceMichael/status/882376068547698688,False,https://twitter.com/sarahkendzior/status/882219527966273536,0,,new york city,,,,,,[],,,,
882372851592024064,882372851592024064,2017-07-04 17:57:36 CDT,2017-07-04,17:57:36,-0500,1012305104,emma_922,emM.A.,,"Time for every New Yorker's favorite game on the 4th of July, fireworks or gun shots?",en,[],[],[],1,4,14,[],[],https://twitter.com/emma_922/status/882372851592024064,False,,0,,new york city,,,,,,[],,,,
882372458942214149,882372458942214149,2017-07-04 17:56:02 CDT,2017-07-04,17:56:02,-0500,104714715,legiscanny,LegiScan NY,"{'type': 'Point', 'coordinates': [40.77112, -73.97419]}",S03344 [NEW] Increases access to substance abuse programming for prisoners whose first language is not English.  https://t.co/TyCCQUCY5v,en,[],['http://bitly.com/WNHI4w'],[],0,0,0,[],[],https://twitter.com/LegiScanNY/status/882372458942214149,False,,0,,new york city,,,,,,[],,,,
882372409336246272,882372409336246272,2017-07-04 17:55:50 CDT,2017-07-04,17:55:50,-0500,3160325790,dalton_cole12,dalton,,my uncles buddy had to tackle someone at trump tower today bc someone georgia hick brought a gun in hahaha,en,[],[],[],0,0,0,[],[],https://twitter.com/dalton_cole12/status/882372409336246272,False,,0,,new york city,,,,,,[],,,,
882371439495720962,882371439495720962,2017-07-04 17:51:59 CDT,2017-07-04,17:51:59,-0500,826125474464153603,realamccoy23,Alisa McCoy,,@Number10gov Save Charlie Gardnor! It is Parents decision to make not Courts! This is a child's UK court ordered murder,en,[],[],[],0,0,0,[],[],https://twitter.com/realAMcCoy23/status/882371439495720962,False,,0,,new york city,,,,,,[],,,,
882369551924703233,850398760266072064,2017-07-04 17:44:29 CDT,2017-07-04,17:44:29,-0500,22460413,innaroz,NeuroEd,,@DrDavidDuke What Israel has 2do wISIS?  Syrian pple fight against ISIS - bcz it's their existential threat. Syrians hate Israel bcz they were taught so!,en,[],[],[],0,0,0,[],[],https://twitter.com/innaroz/status/882369551924703233,False,,0,,new york city,,,,,,"[{'screen_name': 'DrDavidDuke', 'name': 'David Duke', 'id': '72931184'}]",,,,
882368691400130561,882368691400130561,2017-07-04 17:41:04 CDT,2017-07-04,17:41:04,-0500,491818566,amypinardphoto,Amy Pinard,"{'type': 'Point', 'coordinates': [40.7406616, -74.0067978]}",Had so much fun shooting with @leahblock this week. Our quest to find this flag was about as…  https://t.co/5GdgaF29x1,en,"[{'screen_name': 'leahblock', 'name': 'leah block', 'id': '98273828'}]",['https://www.instagram.com/p/BWJErt3BpQh/'],[],1,0,2,[],[],https://twitter.com/amypinardphoto/status/882368691400130561,False,,0,,new york city,,,,,,[],,,,
882368626547990529,882368626547990529,2017-07-04 17:40:48 CDT,2017-07-04,17:40:48,-0500,15298426,sedaman,SeDa •BoDeGa •Q.W.P.,,7/4 is a celebration founded on the theft of land... murder of native ppls.... rape of native women.... 🤷🏽‍♂️🤷🏽‍♂️🤷🏽‍♂️,en,[],[],[],1,0,1,[],[],https://twitter.com/SeDaMaN/status/882368626547990529,False,,0,,new york city,,,,,,[],,,,
882368612467707904,882368612467707904,2017-07-04 17:40:45 CDT,2017-07-04,17:40:45,-0500,1372668180,michaelgarofola,Michael G.,,"If you truly love the U.S. &amp; grasp what that means, you can't possibly ignore the threat to our democracy that Putin's interference intends  https://t.co/MCxYBuCwxe",en,[],['https://twitter.com/michaelgarofola/status/882367844004048897'],[],0,0,7,[],[],https://twitter.com/MichaelGarofola/status/882368612467707904,False,https://twitter.com/michaelgarofola/status/882367844004048897,0,,new york city,,,,,,[],,,,
882367095517962243,882367095517962243,2017-07-04 17:34:43 CDT,2017-07-04,17:34:43,-0500,144325625,mauricemichael,Maurice Ross,,So on the forth of July we celebrate Democracy by shooting off rockets and guns? Sorry but it's twisted,en,[],[],[],0,0,1,[],[],https://twitter.com/MauriceMichael/status/882367095517962243,False,,0,,new york city,,,,,,[],,,,
882363161369878529,882359233618030592,2017-07-04 17:19:05 CDT,2017-07-04,17:19:05,-0500,635923278,nezukostomato,Big Time Tommy⏩ Home,,@EDM_Goddess @ElGarySanchez and hes been injured with 14 hrs... hes on track to do at the very least 25.... for a catcher thats power numbers,en,[],[],[],1,0,1,[],[],https://twitter.com/NezukosTomato/status/882363161369878529,False,,0,,new york city,,,,,,"[{'screen_name': 'ElGarySanchez', 'name': 'Gary Sanchez', 'id': '958288105'}]",,,,
882362443376336897,882362443376336897,2017-07-04 17:16:14 CDT,2017-07-04,17:16:14,-0500,4056791195,filippfrenkel,Filipp Frenkel,,"eleven cities of America from Florida to Boston , from Seattle   to  Denver, From New York  to Houston ,  that various  Terrorist networks",en,[],[],[],0,0,0,[],[],https://twitter.com/FilippFrenkel/status/882362443376336897,False,,0,,new york city,,,,,,[],,,,
882362226421760000,882362226421760000,2017-07-04 17:15:22 CDT,2017-07-04,17:15:22,-0500,41187603,penenberg,Adam L. Penenberg,,And the media seizes onto high-profile errors Trump makes to attack him.  https://t.co/YptWLQwXoH,en,[],['https://twitter.com/thehill/status/882361650111815680'],[],0,0,0,[],[],https://twitter.com/Penenberg/status/882362226421760000,False,https://twitter.com/thehill/status/882361650111815680,0,,new york city,,,,,,[],,,,
882362132813287424,882362132813287424,2017-07-04 17:15:00 CDT,2017-07-04,17:15:00,-0500,4056791195,filippfrenkel,Filipp Frenkel,,"Steven  Emerson  even points  out ,that   Osama  bin  Laden’s terrorist murderous thugs of  al Qaeda networks were already in",en,[],[],[],0,0,0,[],[],https://twitter.com/FilippFrenkel/status/882362132813287424,False,,0,,new york city,,,,,,[],,,,
882359558311641088,882245480805281792,2017-07-04 17:04:46 CDT,2017-07-04,17:04:46,-0500,28086543,ajweberman,A. J. Weberman,,@GodfreyElfwick @EuroRaver get a gun,en,[],[],[],0,0,0,[],[],https://twitter.com/AJWeberman/status/882359558311641088,False,,0,,new york city,,,,,,"[{'screen_name': 'GodfreyElfwick', 'name': 'Godfrey Elfwick™', 'id': '4216879030'}, {'screen_name': 'EuroRaver', 'name': '✝️ Ҝŗïšדּө╒ữЯ', 'id': '16062087'}]",,,,
882358594020233216,882358594020233216,2017-07-04 17:00:56 CDT,2017-07-04,17:00:56,-0500,315413642,daly_jack,JD,,Ugh. Get a sense of awareness. An escalating nuke threat isn't just an inconvenience to your holiday plans. 20k U.S. troops on the peninsula  https://t.co/hKxsVoUH01,en,[],['https://twitter.com/nikkihaley/status/882344158232539138'],[],0,0,0,[],[],https://twitter.com/daly_jack/status/882358594020233216,False,https://twitter.com/nikkihaley/status/882344158232539138,0,,new york city,,,,,,[],,,,
882357865457045504,882357865457045504,2017-07-04 16:58:03 CDT,2017-07-04,16:58:03,-0500,17680193,karmaportrait,chris,,stayed in a house and room last night where there was a double murder years ago. featured in Law and Order season 5. sadly i'm still alive.,en,[],[],[],0,0,1,[],[],https://twitter.com/karmaportrait/status/882357865457045504,False,,0,,new york city,,,,,,[],,,,
882355614860460032,882355614860460032,2017-07-04 16:49:06 CDT,2017-07-04,16:49:06,-0500,480064823,njdivorce,"Artusa Law Firm, P.C","{'type': 'Point', 'coordinates': [40.6897945, -74.0728249]}",#thetrumpreport Free-press groups warn of violence against media - Politico  https://t.co/908dnZAj4X #artusalawfirm  https://t.co/gXJzOsU56e,en,[],['http://dlvr.it/PSDhFm'],['https://pbs.twimg.com/media/DD7BwPWVYAYhU35.jpg'],0,0,0,"['thetrumpreport', 'artusalawfirm']",[],https://twitter.com/NJdivorce/status/882355614860460032,False,,1,https://pbs.twimg.com/media/DD7BwPWVYAYhU35.jpg,new york city,,,,,,[],,,,
882355245610921984,882355245610921984,2017-07-04 16:47:38 CDT,2017-07-04,16:47:38,-0500,20035593,nottjmiller,t.j. miller,,"I grew up on the crime side, the New York Times side. Now i'm a new New Yorker and the only ally is the west coast main players, right?",en,[],[],[],13,1,124,[],[],https://twitter.com/nottjmiller/status/882355245610921984,False,,0,,new york city,,,,,,[],,,,
882354616914120713,882354616914120713,2017-07-04 16:45:08 CDT,2017-07-04,16:45:08,-0500,28787181,ohnomatopia,Pia 🌷,,Rage Cage tho 🙃🙃🙃,en,[],[],[],1,0,1,[],[],https://twitter.com/ohnomatopia/status/882354616914120713,False,,0,,new york city,,,,,,[],,,,
882351702250336257,882351702250336257,2017-07-04 16:33:33 CDT,2017-07-04,16:33:33,-0500,348557830,daisymaxey,Daisy Maxey,,N. Korea Missile Launch Threatens U.S. Strategy in Asia; Apparent success of weapon is tough fgn-policy test  https://t.co/v3gc1CikwR,en,[],['http://on.wsj.com/2tNLi6y'],[],0,0,0,[],[],https://twitter.com/DaisyMaxey/status/882351702250336257,False,,0,,new york city,,,,,,[],,,,
882351485807460353,880876748942036992,2017-07-04 16:32:42 CDT,2017-07-04,16:32:42,-0500,330002394,jelorthe,Jean-Elie Lorthe,,"@Im_TheAntiTrump @realDonaldTrump Trump &amp; Republicans are odious, but Dems deserve blame too. ObamaCare wouldn't be in danger now if Dems included public option.",en,[],[],[],0,0,0,[],[],https://twitter.com/JELorthe/status/882351485807460353,False,,0,,new york city,,,,,,"[{'screen_name': 'Im_TheAntiTrump', 'name': '♀️ ᵀᴴᴱ A҉N҉T҉I҉-T҉R҉U҉M҉P҉', 'id': '778933753150251008'}, {'screen_name': 'realDonaldTrump', 'name': 'Donald J. Trump', 'id': '25073877'}]",,,,
882350557419245572,882344394594148357,2017-07-04 16:29:00 CDT,2017-07-04,16:29:00,-0500,23891217,coreyptownsend,Moderna Thee Stallion,,"@MoreAndAgain I'm not a muggle, simple things such as those don't pose a threat",en,[],[],[],1,0,0,[],[],https://twitter.com/CoreyPTownsend/status/882350557419245572,False,,0,,new york city,,,,,,"[{'screen_name': 'MoreAndAgain', 'name': 'Genie Lauren', 'id': '18302204'}]",,,,
882346000626724873,882346000626724873,2017-07-04 16:10:54 CDT,2017-07-04,16:10:54,-0500,321787750,aaronschickwx,Aaron Schick,,If it manages to do that and stay north of Hispaniola (Haiti and Dominican Republic) it could be a threat to the CONUS,en,[],[],[],0,0,0,[],[],https://twitter.com/aaronschickWX/status/882346000626724873,False,,0,,new york city,,,,,,[],,,,
