id,conversation_id,created_at,date,time,timezone,user_id,username,name,place,tweet,language,mentions,urls,photos,replies_count,retweets_count,likes_count,hashtags,cashtags,link,retweet,quote_url,video,thumbnail,near,geo,source,user_rt_id,user_rt,retweet_id,reply_to,retweet_date,translate,trans_src,trans_dest
831650337853317120,831650337853317120,2017-02-14 17:44:26 CST,2017-02-14,17:44:26,-0500,3575656032,knowledgecrnch,Knowledge Crunch,,"Definition of a socialist: communist w/o a gun. Play #WordPash,  https://t.co/FM2APJbV66 and study history to refine important definitions.  https://t.co/UC1xqTb61N",en,[],['http://tinyurl.com/zwhakqs'],"['https://pbs.twimg.com/media/C4qdax9UEAA_K_1.jpg', 'https://pbs.twimg.com/media/C4qdi9DVcAIbuUy.jpg']",0,0,0,['wordpash'],[],https://twitter.com/KnowledgeCrnch/status/831650337853317120,False,,1,https://pbs.twimg.com/media/C4qdax9UEAA_K_1.jpg,san diego,,,,,,[],,,,
831647878338670592,831647878338670592,2017-02-14 17:34:40 CST,2017-02-14,17:34:40,-0500,54399472,thewebbreport,The Webb Report,,Sad about ballast point and sculpin. Voting with your wallet is non violence in action.  https://t.co/yv9epzJBkF,en,[],['https://twitter.com/thewebbreport/status/831646254228598785'],[],0,0,0,[],[],https://twitter.com/thewebbreport/status/831647878338670592,False,https://twitter.com/thewebbreport/status/831646254228598785,0,,san diego,,,,,,[],,,,
831646475524284416,831617871428087809,2017-02-14 17:29:05 CST,2017-02-14,17:29:05,-0500,109957403,jasonrrmartinez,Jason R.R. Martinez,,"@mkauf1383 MLB DL. They can't option him if he's injured. Plus, it might be 60-Day DL, in which case they'd free up 40-man spot.",en,[],[],[],0,0,0,[],[],https://twitter.com/JasonRRMartinez/status/831646475524284416,False,,0,,san diego,,,,,,"[{'screen_name': 'mkauf1383', 'name': 'Marc Kaufman', 'id': '36363195'}]",,,,
831643881582247936,831609171208445957,2017-02-14 17:18:47 CST,2017-02-14,17:18:47,-0500,532178306,riverinechop,Chris Wilson,,"@RedState was an attack by libs aided by a press that's in the tank for them, n wrse a conservative media that's playing a fiddle for them.",en,[],[],[],0,0,0,[],[],https://twitter.com/riverinechop/status/831643881582247936,False,,0,,san diego,,,,,,"[{'screen_name': 'RedState', 'name': 'RedState', 'id': '3135241'}]",,,,
831641130802376704,831641130802376704,2017-02-14 17:07:51 CST,2017-02-14,17:07:51,-0500,534963838,rjellyman,Jellyman,,Rd 1 #TopBrewsTues Wolf Among Weeds DIPA. Great bitter bite. Clean finish. Hides 8% ABV with full frontal attack hoppyness👍🏼💯🍻‼ @BrewStuds  https://t.co/7ArmJz32Wu,en,"[{'screen_name': 'brewstuds', 'name': 'no such thing as a just war', 'id': '613497601'}]",[],['https://pbs.twimg.com/media/C4qVMlaUEAAlKwm.jpg'],0,0,6,['topbrewstues'],[],https://twitter.com/RJellyman/status/831641130802376704,False,,1,https://pbs.twimg.com/media/C4qVMlaUEAAlKwm.jpg,san diego,,,,,,[],,,,
831640299902341120,831346252008656897,2017-02-14 17:04:33 CST,2017-02-14,17:04:33,-0500,303518690,jrobh1988,Jacob Hubbard,,"@dannysd1998 @Kja23nst I'm not sure the article you're citing is arguing that vgs ""cause"" violence. Did you mean vgs increase aggression?",en,[],[],[],0,0,0,[],[],https://twitter.com/JRobH1988/status/831640299902341120,False,,0,,san diego,,,,,,[],,,,
831620687995363328,831620687995363328,2017-02-14 15:46:37 CST,2017-02-14,15:46:37,-0500,2834452756,victoriaevieir1,Victoria Vieira,,Just had a sneeze attack on the highway... gods on my side today,en,[],[],[],0,0,1,[],[],https://twitter.com/victoriaevieir1/status/831620687995363328,False,,0,,san diego,,,,,,[],,,,
831618346877489152,831618346877489152,2017-02-14 15:37:19 CST,2017-02-14,15:37:19,-0500,738540789861486592,cavedaddy420,Thud,,"@realDonaldTrump Russia is testing new missel systems,What you say about that,where's the #ImpotentRage for putting our NATO allies Danger🇺🇸",en,[],[],[],0,0,0,['impotentrage'],[],https://twitter.com/cavedaddy420/status/831618346877489152,False,,0,,san diego,,,,,,[],,,,
831607183896752128,831607183896752128,2017-02-14 14:52:57 CST,2017-02-14,14:52:57,-0500,800526780922593280,rockypettengil2,Rocky Pettengill,,@PressSec but I'm labeled a racist and other things because I don't hold their beliefs what should I think and do I'm a Veteran loyal to USA,en,[],[],[],0,0,0,[],[],https://twitter.com/RockyPettengil2/status/831607183896752128,False,,0,,san diego,,,,,,[],,,,
831604473705304064,831604473705304064,2017-02-14 14:42:11 CST,2017-02-14,14:42:11,-0500,50568360,__danie__,danie,,Home from the gun range!!! Had a blast shooting the 240 and 50 cal!!! Haha,en,[],[],[],0,0,0,[],[],https://twitter.com/__danie__/status/831604473705304064,False,,0,,san diego,,,,,,[],,,,
831592047794597889,831592047794597889,2017-02-14 13:52:49 CST,2017-02-14,13:52:49,-0500,358288456,obrienspubsd,"O'Brien's Pub, SD","{'type': 'Point', 'coordinates': [32.82491, -117.15566]}",Pub grub specials! @mikkellerbeer Fruit face and @figmtnbrew Weapon of Mass Seduction on tap for…  https://t.co/Ssqxj6PIQT,en,"[{'screen_name': 'mikkellerbeer', 'name': 'mikkellerbeer', 'id': '101269077'}, {'screen_name': 'figmtnbrew', 'name': 'figueroa mountain brewing co.', 'id': '423804827'}]",['https://www.instagram.com/p/BQgSI9yF69k/'],[],0,0,0,[],[],https://twitter.com/OBriensPubSD/status/831592047794597889,False,,0,,san diego,,,,,,[],,,,
831579837458370560,831579837458370560,2017-02-14 13:04:17 CST,2017-02-14,13:04:17,-0500,16627727,techglance,techglance.net,"{'type': 'Point', 'coordinates': [32.54377799, -117.04064445]}",Attack of the drones  https://t.co/w8GylCPmFo,en,[],['http://tcrn.ch/2ku0vAG'],[],0,0,0,[],[],https://twitter.com/techglance/status/831579837458370560,False,,0,,san diego,,,,,,[],,,,
831576269275795456,831576269275795456,2017-02-14 12:50:07 CST,2017-02-14,12:50:07,-0500,60115647,sandiegocp,San Diego Now,"{'type': 'Point', 'coordinates': [32.7143122, -117.16627197]}","The ""golden protesters,"" maybe? Meet the senior women who've come out of retirement to protest the Trump admin.…  https://t.co/IkRGN7af3u",en,[],['http://toplocalnow.com/us/san-diego'],[],0,0,0,[],[],https://twitter.com/SanDiegoCP/status/831576269275795456,False,,0,,san diego,,,,,,[],,,,
831575881642500097,831575881642500097,2017-02-14 12:48:34 CST,2017-02-14,12:48:34,-0500,34061480,dcuf33,David C,,"""immigration is consistently linked to decreases in violent crime."" immigration DOESNT= crime #nationofimmigrants   https://t.co/FwHzx6dZS2",en,[],['http://bit.ly/2kPMhxB'],[],0,0,0,['nationofimmigrants'],[],https://twitter.com/dcuf33/status/831575881642500097,False,,0,,san diego,,,,,,[],,,,
831565564577394688,831565564577394688,2017-02-14 12:07:34 CST,2017-02-14,12:07:34,-0500,2767309488,imjuliofigueroa,IamJulioFigueroa,,The Kingdom of God suffers violence but violent men take it by force! Territorial Anointing! Media mountain. #concretepulpit  https://t.co/InFjT7jTPo,en,[],[],['https://pbs.twimg.com/media/C4pQdWAVYAAdVIs.jpg'],0,0,1,['concretepulpit'],[],https://twitter.com/ImJulioFigueroa/status/831565564577394688,False,,1,https://pbs.twimg.com/media/C4pQdWAVYAAdVIs.jpg,san diego,,,,,,[],,,,
831564237277310976,831564237277310976,2017-02-14 12:02:18 CST,2017-02-14,12:02:18,-0500,16627727,techglance,techglance.net,"{'type': 'Point', 'coordinates': [32.54377799, -117.04064445]}",Twitter quickly kills a poorly thought out anti-abuse measure  https://t.co/J5B6j7MHCD,en,[],['http://tcrn.ch/2lgvPHg'],[],0,0,0,[],[],https://twitter.com/techglance/status/831564237277310976,False,,0,,san diego,,,,,,[],,,,
831563193994485760,831563193994485760,2017-02-14 11:58:09 CST,2017-02-14,11:58:09,-0500,60115647,sandiegocp,San Diego Now,"{'type': 'Point', 'coordinates': [32.7143122, -117.16627197]}","Report of strong smell of gas in Grantville near I-8 &amp; Waring Road. SDG&amp;E says no danger, loud work being conducted…  https://t.co/IkRGN7af3u",en,[],['http://toplocalnow.com/us/san-diego'],[],0,0,0,[],[],https://twitter.com/SanDiegoCP/status/831563193994485760,False,,0,,san diego,,,,,,[],,,,
831556665929392129,831556665929392129,2017-02-14 11:32:13 CST,2017-02-14,11:32:13,-0500,500154514,haroldwnelson,Harold W Nelson,,A group of nearly 200 police chiefs slammed @realDonaldTrump 'law and order' crime plan  https://t.co/ULw0Y3L26U  #TheResistance,en,"[{'screen_name': 'realdonaldtrump', 'name': 'donald j. trump', 'id': '25073877'}]",['http://read.bi/2lIhj7Y'],[],0,3,0,['theresistance'],[],https://twitter.com/HaroldWNelson/status/831556665929392129,False,,0,,san diego,,,,,,[],,,,
831553201488826368,831553201488826368,2017-02-14 11:18:27 CST,2017-02-14,11:18:27,-0500,500154514,haroldwnelson,Harold W Nelson,,Donald Trump's national security adviser just resigned. Now there are calls 4 the President's arrest  https://t.co/l4BCR21Rii #TheResistance,en,[],['http://www.independent.co.uk/news/world/americas/us-politics/donald-trump-arrested-michael-flynn-russia-talks-michael-moore-national-security-adviser-resigns-a7578996.html'],[],1,1,0,['theresistance'],[],https://twitter.com/HaroldWNelson/status/831553201488826368,False,,0,,san diego,,,,,,[],,,,
831542450665558016,831542450665558016,2017-02-14 10:35:44 CST,2017-02-14,10:35:44,-0500,741123229327228932,advancedstats23,"B-L-M, life long Suns fan",,Terrence Ross's true shooting % with Kyle Lowry off the floor since start of 2015 season: 51.8%. (58.3% with him on). Per @nbawowy,en,"[{'screen_name': 'nbawowy', 'name': 'nbawowy.com', 'id': '1310869940'}]",[],[],1,1,1,[],[],https://twitter.com/advancedstats23/status/831542450665558016,False,,0,,san diego,,,,,,[],,,,
831527198951497733,831527198951497733,2017-02-14 09:35:07 CST,2017-02-14,09:35:07,-0500,60115647,sandiegocp,San Diego Now,"{'type': 'Point', 'coordinates': [32.7143122, -117.16627197]}",San Diego crime rates drop to lowest level in four decades  https://t.co/IkRGN7af3u,en,[],['http://toplocalnow.com/us/san-diego'],[],0,0,0,[],[],https://twitter.com/SanDiegoCP/status/831527198951497733,False,,0,,san diego,,,,,,[],,,,
831518128999788544,831518128999788544,2017-02-14 08:59:05 CST,2017-02-14,08:59:05,-0500,60115647,sandiegocp,San Diego Now,"{'type': 'Point', 'coordinates': [32.7143122, -117.16627197]}",New report: San Diego one of America's safest cities. Crime down by 2.3% in 2016 from year before and violent crime…  https://t.co/IkRGN7af3u,en,[],['http://toplocalnow.com/us/san-diego'],[],0,0,0,[],[],https://twitter.com/SanDiegoCP/status/831518128999788544,False,,0,,san diego,,,,,,[],,,,
831512935331565570,831512935331565570,2017-02-14 08:38:27 CST,2017-02-14,08:38:27,-0500,50568360,__danie__,danie,,I feel like crap so day one at the gun range is gunna suck 😒,en,[],[],[],0,0,0,[],[],https://twitter.com/__danie__/status/831512935331565570,False,,0,,san diego,,,,,,[],,,,
831511133165023233,831511133165023233,2017-02-14 08:31:17 CST,2017-02-14,08:31:17,-0500,130489141,genekangtv,Gene Kang,,New report: San Diego one of America's safest cities. Crime down by 2.3% in 2016 from year before and violent crime dropped by 4.5%. @CBS8  https://t.co/PF7w9kzQx3,en,"[{'screen_name': 'cbs8', 'name': 'cbs 8 san diego', 'id': '27745484'}]",[],['https://pbs.twimg.com/media/C4oe9x5UEAIJqXB.jpg'],2,12,11,[],[],https://twitter.com/GeneKangTV/status/831511133165023233,False,,1,https://pbs.twimg.com/media/C4oe9x5UEAIJqXB.jpg,san diego,,,,,,[],,,,
831498025797160961,831498025797160961,2017-02-14 07:39:12 CST,2017-02-14,07:39:12,-0500,1151865259,allenfrancesmd,Allen Frances,,I'm so tired of amatuer analyses of Trump's psychology or diagnosis Focus on real danger- his grab of dictator power  https://t.co/MfS3k4tPRt,en,[],['https://www.psychologytoday.com/blog/saving-normal/201702/focus-trumps-acts-not-his-psychology'],[],55,116,205,[],[],https://twitter.com/AllenFrancesMD/status/831498025797160961,False,,0,,san diego,,,,,,[],,,,
831472578325684224,831472578325684224,2017-02-14 05:58:05 CST,2017-02-14,05:58:05,-0500,60115647,sandiegocp,San Diego Now,"{'type': 'Point', 'coordinates': [32.7143122, -117.16627197]}",Jerry Sandusky’s son arrested on child abuse charges  https://t.co/IkRGN7af3u,en,[],['http://toplocalnow.com/us/san-diego'],[],0,0,0,[],[],https://twitter.com/SanDiegoCP/status/831472578325684224,False,,0,,san diego,,,,,,[],,,,
831447376833306624,831447376833306624,2017-02-14 04:17:56 CST,2017-02-14,04:17:56,-0500,48249418,luhrsman,Scott Luhrs,,I have to go to bar tomorrow at 5 PM to follow up on a threat.,en,[],[],[],0,0,2,[],[],https://twitter.com/luhrsman/status/831447376833306624,False,,0,,san diego,,,,,,[],,,,
831423588880183296,831423588880183296,2017-02-14 02:43:25 CST,2017-02-14,02:43:25,-0500,801007038,babybello24,Lily Rebello,,I'm pretty sure I'm having a heart attack,en,[],[],[],1,0,4,[],[],https://twitter.com/babybello24/status/831423588880183296,False,,0,,san diego,,,,,,[],,,,
831407089041829889,831407089041829889,2017-02-14 01:37:51 CST,2017-02-14,01:37:51,-0500,38629846,soulgritgrace,your fave 🇵🇭🇺🇸,,With the broskiiii @WorldWideBenga! Not his first time shooting but it was his first time at my shooting range. Dude is a natural!  https://t.co/TADBJihXx0,en,"[{'screen_name': 'worldwidebenga', 'name': 'gbenga eshugbohungbe 🇳🇬', 'id': '43057614'}]",[],[],0,1,0,[],[],https://twitter.com/soulgritgrace/status/831407089041829889,False,,1,https://pbs.twimg.com/ext_tw_video_thumb/831407048508125184/pu/img/MGbwln_7m25Jd6yu.jpg,san diego,,,,,,[],,,,
831395101591031808,831395101591031808,2017-02-14 00:50:13 CST,2017-02-14,00:50:13,-0500,601661532,nooch___,Nooch,,Durant needed to drop 45 with klay out they way Steph was shooting,en,[],[],[],0,0,1,[],[],https://twitter.com/nooch___/status/831395101591031808,False,,0,,san diego,,,,,,[],,,,
831394281398996992,831394281398996992,2017-02-14 00:46:57 CST,2017-02-14,00:46:57,-0500,1943085452,pouya666,ϟabbathBloodyϟabbath,,I might get a heart attack and die,en,[],[],[],1,0,0,[],[],https://twitter.com/Pouya666/status/831394281398996992,False,,0,,san diego,,,,,,[],,,,
831392755247046656,831392755247046656,2017-02-14 00:40:54 CST,2017-02-14,00:40:54,-0500,52807019,betbs,Brichaun Smolmes,,My favorite Kings memory is winning a dollar from Dick Motta in a free throw shooting contest. #SacramentoProud,en,[],[],[],0,9,3,['sacramentoproud'],[],https://twitter.com/betbs/status/831392755247046656,False,,0,,san diego,,,,,,[],,,,
831384859461292033,831384859461292033,2017-02-14 00:09:31 CST,2017-02-14,00:09:31,-0500,1700406391,rpp_r,ronnie profeta,"{'type': 'Point', 'coordinates': [32.84610173, -117.2732805]}",Shadow people u will not get away with it cold blooded murder.  https://t.co/xTs0TwfGAj,en,[],[],"['https://pbs.twimg.com/media/C4msG3WUEAA-OtQ.jpg', 'https://pbs.twimg.com/media/C4msHJFVYAAUvvS.jpg', 'https://pbs.twimg.com/media/C4msHeaVMAIdbuu.jpg', 'https://pbs.twimg.com/media/C4msHyvUoAEyHWn.jpg']",0,0,0,[],[],https://twitter.com/rpp_r/status/831384859461292033,False,,1,https://pbs.twimg.com/media/C4msG3WUEAA-OtQ.jpg,san diego,,,,,,[],,,,
831383888899371008,831383888899371008,2017-02-14 00:05:40 CST,2017-02-14,00:05:40,-0500,1700406391,rpp_r,ronnie profeta,"{'type': 'Point', 'coordinates': [32.84624007, -117.27348646]}",Shadow and ghost looking at us. Cold blooded murder.  https://t.co/Ou1t7iiiCV,en,[],[],['https://pbs.twimg.com/media/C4mrPQZVYAIYdGk.jpg'],0,0,0,[],[],https://twitter.com/rpp_r/status/831383888899371008,False,,1,https://pbs.twimg.com/media/C4mrPQZVYAIYdGk.jpg,san diego,,,,,,[],,,,
831383159816073216,831383159816073216,2017-02-14 00:02:46 CST,2017-02-14,00:02:46,-0500,38629846,soulgritgrace,your fave 🇵🇭🇺🇸,,I was a little rusty tonight bc I haven't shot a gun in a month... not my best work but yeah  https://t.co/HeSJtDmuQe,en,[],[],['https://pbs.twimg.com/media/C4mqkpNUkAAprMq.jpg'],1,0,0,[],[],https://twitter.com/soulgritgrace/status/831383159816073216,False,,1,https://pbs.twimg.com/media/C4mqkpNUkAAprMq.jpg,san diego,,,,,,[],,,,
831379832340516865,831379832340516865,2017-02-13 23:49:32 CST,2017-02-13,23:49:32,-0500,38629846,soulgritgrace,your fave 🇵🇭🇺🇸,,After a long day in the office. I go to my fave spot. 😊 Gun Range. ❤️  https://t.co/l2FHZmuuLR,en,[],[],[],0,0,0,[],[],https://twitter.com/soulgritgrace/status/831379832340516865,False,,1,https://pbs.twimg.com/ext_tw_video_thumb/831379710722527232/pu/img/Y9TjYZTWml6xQn9l.jpg,san diego,,,,,,[],,,,
831377955985125377,831377955985125377,2017-02-13 23:42:05 CST,2017-02-13,23:42:05,-0500,38629846,soulgritgrace,your fave 🇵🇭🇺🇸,,I love shooting. Great time tonight as always. Shoutout to my boys at The Gun Range SD for always taking care of me. 🤙🏽😇🤗 #hobby #shooting  https://t.co/x8fAL1dYt5,en,[],[],[],0,0,0,"['hobby', 'shooting']",[],https://twitter.com/soulgritgrace/status/831377955985125377,False,,1,https://pbs.twimg.com/ext_tw_video_thumb/831377825009541122/pu/img/65sBBZqtW1sxZWnM.jpg,san diego,,,,,,[],,,,
831363572454158336,831363572454158336,2017-02-13 22:44:56 CST,2017-02-13,22:44:56,-0500,816489531289444352,caarlsbad,carls,,Do you ever feel like ?? Literally vicious ?? Like not conventional anger or frustration but just literally poisonous,en,[],[],[],0,0,4,[],[],https://twitter.com/caarlsbad/status/831363572454158336,False,,0,,san diego,,,,,,[],,,,
831363424168730626,831363424168730626,2017-02-13 22:44:20 CST,2017-02-13,22:44:20,-0500,50568360,__danie__,danie,,I just gave my baby (my truck) a bath the other day and tomorrow I'm driving to the gun range where it's nothing but dirt 😫 lol,en,[],[],[],0,0,0,[],[],https://twitter.com/__danie__/status/831363424168730626,False,,0,,san diego,,,,,,[],,,,
831361552619970562,831361552619970562,2017-02-13 22:36:54 CST,2017-02-13,22:36:54,-0500,553137182,sara_bluhm,Sara,,Stop letting people use their talent in order to abuse women and impressionable underage girls. Don't support rapists. Speak out against it.,en,[],[],[],0,0,2,[],[],https://twitter.com/Sara_Bluhm/status/831361552619970562,False,,0,,san diego,,,,,,[],,,,
