id,conversation_id,created_at,date,time,timezone,user_id,username,name,place,tweet,language,mentions,urls,photos,replies_count,retweets_count,likes_count,hashtags,cashtags,link,retweet,quote_url,video,thumbnail,near,geo,source,user_rt_id,user_rt,retweet_id,reply_to,retweet_date,translate,trans_src,trans_dest
895071124140290048,895071124140290048,2017-08-08 18:56:00 CDT,2017-08-08,18:56:00,-0500,2920905437,tayy2015,Tay🖤🌻,,"I'm still in college, just not in alpine🙄 and I was on birth control and used a condom. Things happen. you want to attack me? Be an adult  https://t.co/UlOBZL2oFS",en,[],[],['https://pbs.twimg.com/media/DGvucHRVoAAIVVa.jpg'],0,0,0,[],[],https://twitter.com/tayy2015/status/895071124140290048,False,,1,https://pbs.twimg.com/media/DGvucHRVoAAIVVa.jpg,san antonio,,,,,,[],,,,
895066908579340290,895055172816310272,2017-08-08 18:39:15 CDT,2017-08-08,18:39:15,-0500,32487224,ginadem,🧢Gina Turn Texas Blue 2022🧢,,@peterdaou We better brace ourselves...  Trump will see a #NorthKorea attack as a solution for his woes and his agenda. #Fascism #TrumpRussia  https://t.co/POJlCDXC1l,en,[],[],['https://pbs.twimg.com/media/DGvqVhkUQAEV27z.jpg'],1,3,5,"['northkorea', 'fascism', 'trumprussia']",[],https://twitter.com/ginadem/status/895066908579340290,False,,1,https://pbs.twimg.com/media/DGvqVhkUQAEV27z.jpg,san antonio,,,,,,"[{'screen_name': 'peterdaou', 'name': 'Peter Daou', 'id': '18464266'}]",,,,
895063836721651712,895063836721651712,2017-08-08 18:27:02 CDT,2017-08-08,18:27:02,-0500,56698684,pamusvi,Pamela Stommel,,People yelling about POTUS instead of yelling at crazy dictators threatening nuclear attack.  https://t.co/HydameqOTA,en,[],['https://twitter.com/JoaquinCastrotx/status/895062364722270208'],[],0,0,0,[],[],https://twitter.com/PamUSVI/status/895063836721651712,False,https://twitter.com/JoaquinCastrotx/status/895062364722270208,0,,san antonio,,,,,,[],,,,
895056615673659394,895056615673659394,2017-08-08 17:58:21 CDT,2017-08-08,17:58:21,-0500,16078203,ryanwolf,Ryan Wolf,,Escalating threats of violence  https://t.co/QoZSiaowxu,en,[],['https://twitter.com/foxnews/status/895055079853654018'],[],0,0,0,[],[],https://twitter.com/ryanwolf/status/895056615673659394,False,https://twitter.com/foxnews/status/895055079853654018,0,,san antonio,,,,,,[],,,,
895053635738009600,895053635738009600,2017-08-08 17:46:30 CDT,2017-08-08,17:46:30,-0500,168965995,cam_trill,SNIPER ON THE ROOF,,"Extra percent for my assassin, told my shooter do him nasty",en,[],[],[],0,0,0,[],[],https://twitter.com/Cam_Trill/status/895053635738009600,False,,0,,san antonio,,,,,,[],,,,
895051103900925955,895051103900925955,2017-08-08 17:36:27 CDT,2017-08-08,17:36:27,-0500,10985382,jasonsamfield,ॐ,,"Bluster. If legit, what will that accomplish? It'll provoke USA to attack them?  What if the missile is errant and hits Beijing?! Sad irony.  https://t.co/uGEu5hcoFY",en,[],['https://twitter.com/businessinsider/status/895046180429811712'],[],0,0,0,[],[],https://twitter.com/JasonSamfield/status/895051103900925955,False,https://twitter.com/businessinsider/status/895046180429811712,0,,san antonio,,,,,,[],,,,
895021021631217664,895021021631217664,2017-08-08 15:36:54 CDT,2017-08-08,15:36:54,-0500,790958682712317952,findingsept,Finding September,,The sun was brutal at Freedom Fest but we still had a great time! #findingseptember #livemusic #punkrock #poppunk #hotaf #txheat  #altrock  https://t.co/eilh8tH5AE,en,[],[],['https://pbs.twimg.com/media/DGvA3ExUMAAYliH.jpg'],0,0,0,"['findingseptember', 'livemusic', 'punkrock', 'poppunk', 'hotaf', 'txheat', 'altrock']",[],https://twitter.com/FindingSept/status/895021021631217664,False,,1,https://pbs.twimg.com/media/DGvA3ExUMAAYliH.jpg,san antonio,,,,,,[],,,,
895016743709663232,894611937904013312,2017-08-08 15:19:54 CDT,2017-08-08,15:19:54,-0500,3629180713,devans143831,Deanna,,@RouserNews You are a threat Mayor to the ppl living there!  Your putting their lives at stake!  Vote him OUT ppl!,en,[],[],[],0,0,1,[],[],https://twitter.com/devans143831/status/895016743709663232,False,,0,,san antonio,,,,,,[],,,,
895009620909068288,895009620909068288,2017-08-08 14:51:36 CDT,2017-08-08,14:51:36,-0500,169381435,acunabatflip,Brian Olson,,Strapping up my Nerf gun as we speak fam  https://t.co/6nfuLI10sL,en,[],['https://twitter.com/kawhifi/status/895006809630666756'],[],1,1,0,[],[],https://twitter.com/acunabatflip/status/895009620909068288,False,https://twitter.com/kawhifi/status/895006809630666756,0,,san antonio,,,,,,[],,,,
895004190174478336,895004190174478336,2017-08-08 14:30:01 CDT,2017-08-08,14:30:01,-0500,381476865,keepemcominnn,Avery D’Sean,,Now is this rape??  https://t.co/nstWXnFJcS,en,[],['https://twitter.com/TeeeWilliams/status/894979618096136192'],[],0,0,0,[],[],https://twitter.com/KeepEmCominnn/status/895004190174478336,False,0,0,,san antonio,,,,,,[],,,,
894997831366344705,894977783058837506,2017-08-08 14:04:45 CDT,2017-08-08,14:04:45,-0500,901080366,dxandertx,Demonte Alexander,,@willcruzshaw @TPRSource Yep! Now someone tell the media that. Stop prefacing every win on the eastside with lights and crime tape. #throwusabone,en,[],[],[],0,1,2,['throwusabone'],[],https://twitter.com/DXanderTX/status/894997831366344705,False,,0,,san antonio,,,,,,"[{'screen_name': 'willcruzshaw', 'name': 'William ""Cruz"" Shaw', 'id': '809601574523826180'}, {'screen_name': 'TPRSource', 'name': 'TPR: The Source', 'id': '1225344060'}]",,,,
894990456920170497,894990456920170497,2017-08-08 13:35:27 CDT,2017-08-08,13:35:27,-0500,569569432,glitz_queen15,MikPick2,,I'm so done with my grandma and jacob. Like a murder is about to take place in my house.,en,[],[],[],0,0,1,[],[],https://twitter.com/Glitz_Queen15/status/894990456920170497,False,,0,,san antonio,,,,,,[],,,,
894984203355529216,894984203355529216,2017-08-08 13:10:36 CDT,2017-08-08,13:10:36,-0500,763069643766444033,hopemorganjazz,Hope Morgan,,#TASSCC40 Prof Janes.  The world is full of obvious things which nobody by any chance observes.  Murder by the numbers. Project metrics,en,[],[],[],0,0,0,['tasscc40'],[],https://twitter.com/hopemorganjazz/status/894984203355529216,False,,0,,san antonio,,,,,,[],,,,
894962804251348992,894962804251348992,2017-08-08 11:45:34 CDT,2017-08-08,11:45:34,-0500,14629939,spara,spara,,Watching Cassidy take care of his dying son amid the the usual camp and violence of Preacher was pretty remarkable.,en,[],[],[],0,0,0,[],[],https://twitter.com/spara/status/894962804251348992,False,,0,,san antonio,,,,,,[],,,,
894953623167406080,894953623167406080,2017-08-08 11:09:05 CDT,2017-08-08,11:09:05,-0500,14629939,spara,spara,,"I keep seeing people saying science isn't sexist. I agree the method is not the sexist, the people performing science are sexist.",en,[],[],[],0,0,3,[],[],https://twitter.com/spara/status/894953623167406080,False,,0,,san antonio,,,,,,[],,,,
894951496881774598,894951496881774598,2017-08-08 11:00:38 CDT,2017-08-08,11:00:38,-0500,257716354,aleekuh,Aleekuh,,A gun is not a toy. I haven't touched mine in weeks 🤷🏽‍♀️,en,[],[],[],0,0,1,[],[],https://twitter.com/aleekuh/status/894951496881774598,False,,0,,san antonio,,,,,,[],,,,
894926395716976640,894926395716976640,2017-08-08 09:20:54 CDT,2017-08-08,09:20:54,-0500,2534527629,_gabe_77,Gabe,,Selling my paintball gun Dm if interested,en,[],[],[],0,0,0,[],[],https://twitter.com/_gabe_77/status/894926395716976640,False,,0,,san antonio,,,,,,[],,,,
894910066205372417,894910066205372417,2017-08-08 08:16:01 CDT,2017-08-08,08:16:01,-0500,23802198,mcowartlaw,Matthew Cowart,,"Writing ""stop restricting programs or classes to certain genders or races"" = ""violence"" and led to ""workers fearing for their safety."" #2017",en,[],[],[],0,0,0,[],[],https://twitter.com/mcowartlaw/status/894910066205372417,False,,0,,san antonio,,,,,,[],,,,
894907253244952576,894907253244952576,2017-08-08 08:04:50 CDT,2017-08-08,08:04:50,-0500,23802198,mcowartlaw,Matthew Cowart,,2010: Violence is violence. 2017: Words are violence.  https://t.co/gIPZNMaItw,en,[],['https://twitter.com/sometimesalex/status/894762459298357251'],[],0,0,1,[],[],https://twitter.com/mcowartlaw/status/894907253244952576,False,0,0,,san antonio,,,,,,[],,,,
