id,conversation_id,created_at,date,time,timezone,user_id,username,name,place,tweet,language,mentions,urls,photos,replies_count,retweets_count,likes_count,hashtags,cashtags,link,retweet,quote_url,video,thumbnail,near,geo,source,user_rt_id,user_rt,retweet_id,reply_to,retweet_date,translate,trans_src,trans_dest
963196527849095169,963196527849095169,2018-02-12 17:42:02 CST,2018-02-12,17:42:02,-0500,486882102,meow____mix,Litterbox,,OVER MY DEAD BODY  https://t.co/HK52wcc1Io,en,[],['https://twitter.com/foxnews/status/963194873523458049'],[],0,0,1,[],[],https://twitter.com/meow____mix/status/963196527849095169,False,https://twitter.com/foxnews/status/963194873523458049,0,,phoenix,,,,,,[],,,,
963189079507582979,963189079507582979,2018-02-12 17:12:26 CST,2018-02-12,17:12:26,-0500,940368309307949056,bjarneolsen9,Bjarne Olsen,,The Democratic Party is dead. This is the doing of Schumer and Pelosi. We need to lower the age requirements of our legislators to 5 years old.,en,[],[],[],0,0,0,[],[],https://twitter.com/BjarneOlsen9/status/963189079507582979,False,,0,,phoenix,,,,,,[],,,,
963183866990088192,963183866990088192,2018-02-12 16:51:43 CST,2018-02-12,16:51:43,-0500,255813114,jawhileonard,Mr. Chavez,,I wish death on nobody no matter how much i dislike a person.. This is just a weird day,en,[],[],[],0,0,0,[],[],https://twitter.com/jawhileonard/status/963183866990088192,False,,0,,phoenix,,,,,,[],,,,
963177420604948480,963177420604948480,2018-02-12 16:26:06 CST,2018-02-12,16:26:06,-0500,756647670,vegasx07,Vegasx07🐧,,@NvidiaGFN make this Mac game please 😂 my gtx 1080 died on me so my former gaming pc is dead for now ( think power surge fried it ) and I'm not buying a 2x overpriced GPU right now so I'm kinda screwed  https://t.co/b1akF1xdI0,en,[],[],['https://pbs.twimg.com/media/DV3kuqFVQAAid_2.jpg'],0,0,0,[],[],https://twitter.com/Vegasx07/status/963177420604948480,False,,1,https://pbs.twimg.com/media/DV3kuqFVQAAid_2.jpg,phoenix,,,,,,[],,,,
963172854941474816,963172854941474816,2018-02-12 16:07:58 CST,2018-02-12,16:07:58,-0500,930566357984329728,oliviabrunkow,Olivia Brunkow,,"I swear to god if my grandmother doesn't stay out of my business I'm going to hurt her before she leaves!! ""No grandma, I don't like you coming into my room and trying to organize my shit!!!""",en,[],[],[],0,1,1,[],[],https://twitter.com/OliviaBrunkow/status/963172854941474816,False,,0,,phoenix,,,,,,[],,,,
963171924619636736,963171924619636736,2018-02-12 16:04:16 CST,2018-02-12,16:04:16,-0500,2246199140,itsisaacjoel,I S A A C,,No need to apologize. You’re good. People are just misreading that entire scene and taking offense to nothing at all.  https://t.co/cbggEkJe1w,en,[],['https://twitter.com/comicbooknow/status/963161287831142400'],[],0,0,2,[],[],https://twitter.com/itsisaacjoel/status/963171924619636736,False,https://twitter.com/comicbooknow/status/963161287831142400,0,,phoenix,,,,,,[],,,,
963170406436814848,963127506055217152,2018-02-12 15:58:14 CST,2018-02-12,15:58:14,-0500,3146727188,qswaggiee,5’2 Q,,@Jerome2Savage @thelatinoosux That just hurt me reading that,en,[],[],[],1,1,2,[],[],https://twitter.com/qswaggiee/status/963170406436814848,False,,0,,phoenix,,,,,,"[{'screen_name': 'Jerome2Savage', 'name': '🏯Rome🏯', 'id': '2932967802'}, {'screen_name': 'thelatinoosux', 'name': 'Echo Chamber Participant', 'id': '1395760015'}]",,,,
963162182669123584,963162182669123584,2018-02-12 15:25:33 CST,2018-02-12,15:25:33,-0500,3288194994,glitterngus,KimB123 💜🤟🏻💛,,It is NEVER my intention to hurt people or make them feel bad #SpreadHappiness,en,[],[],[],0,0,1,['spreadhappiness'],[],https://twitter.com/GlitterNGus/status/963162182669123584,False,,0,,phoenix,,,,,,[],,,,
963161698109501440,963161698109501440,2018-02-12 15:23:38 CST,2018-02-12,15:23:38,-0500,4775038740,demitriapilatos,Demitria,,"See how women are making moves to protect themselves. Sparking the awareness for sexual assault in the “me too” movement, right here in AZ. Tonight on @cronkitenews 👌🏼  https://t.co/d3AuLUSO6W",en,"[{'screen_name': 'cronkitenews', 'name': 'cronkite news', 'id': '15446773'}]",[],['https://pbs.twimg.com/media/DV3WdOFVoAA5_9C.jpg'],0,2,8,[],[],https://twitter.com/demitriapilatos/status/963161698109501440,False,,1,https://pbs.twimg.com/media/DV3WdOFVoAA5_9C.jpg,phoenix,,,,,,[],,,,
963155051245051904,963155051245051904,2018-02-12 14:57:13 CST,2018-02-12,14:57:13,-0500,41153855,craigharrisusat,Craig Harris,,State House Banking Comm looking to raise 55 different court fees to shore up underfunded pension fund for politicians and judges. HB 2564 also cuts funding for domestic violence services and child abuse prevention.,en,[],[],[],1,1,0,[],[],https://twitter.com/CraigHarrisUSAT/status/963155051245051904,False,,0,,phoenix,,,,,,[],,,,
963151489483993089,963151489483993089,2018-02-12 14:43:04 CST,2018-02-12,14:43:04,-0500,558296170,timeisonmyside9,2CΩΩl4SkΩΩl,,Be honest if a dude tell you he doesn’t want to JUST fuck that would scare women to death,en,[],[],[],0,0,0,[],[],https://twitter.com/TimEisonmyside9/status/963151489483993089,False,,0,,phoenix,,,,,,[],,,,
963150543832010752,963150543832010752,2018-02-12 14:39:18 CST,2018-02-12,14:39:18,-0500,25240417,aedling,Andrew Edling,,"""If after every tempest come such calms, May the winds blow till they have waken'd death!""  Hang in there, people. Life is exactly how it should be, and be sure to love every bit of it. #AmorFati ✌️",en,[],[],[],0,0,2,['amorfati'],[],https://twitter.com/AEDLING/status/963150543832010752,False,,0,,phoenix,,,,,,[],,,,
963148047243857920,963148047243857920,2018-02-12 14:29:23 CST,2018-02-12,14:29:23,-0500,795046976509255681,unpackedsparkle,Sparkle King ✨👑,,"Same with haters. Always remember that hurt people hurt people, so when people treat you badly they are just reacting from a place of pain. Don’t let it break you - stay in your #power and #riseabove it all with #love. #ReasonsNotToGiveUp 👊 @Oprah #WWHL #hatersgonnahate  https://t.co/8JjkG5NvO6",en,"[{'screen_name': 'oprah', 'name': 'oprah winfrey', 'id': '19397785'}]",[],['https://pbs.twimg.com/media/DV3KCspU0AAn-8f.jpg'],0,2,4,"['power', 'riseabove', 'love', 'reasonsnottogiveup', 'wwhl', 'hatersgonnahate']",[],https://twitter.com/unpackedsparkle/status/963148047243857920,False,,1,https://pbs.twimg.com/media/DV3KCspU0AAn-8f.jpg,phoenix,,,,,,[],,,,
963143275606454272,963143275606454272,2018-02-12 14:10:25 CST,2018-02-12,14:10:25,-0500,1633669140,actualgayrobot,Rei simp 💙💛,,I wanna hurt myself and end up in the hospital so I don't have to work,en,[],[],[],1,0,1,[],[],https://twitter.com/actualgayrobot/status/963143275606454272,False,,0,,phoenix,,,,,,[],,,,
963128813507854336,963128813507854336,2018-02-12 13:12:57 CST,2018-02-12,13:12:57,-0500,3142669854,photosilvas,Andy Silvas Photo LLC,,Sad to hear the death of Country music Singer @Darylesing (Daryle Singletary) #RIP #roper  https://t.co/If2gflpQVW,en,"[{'screen_name': 'darylesing', 'name': 'daryle singletary', 'id': '251323107'}]",[],['https://pbs.twimg.com/media/DV24i92U0AAbaWS.jpg'],0,0,0,"['rip', 'roper']",[],https://twitter.com/PhotoSilvas/status/963128813507854336,False,,1,https://pbs.twimg.com/media/DV24i92U0AAbaWS.jpg,phoenix,,,,,,[],,,,
963126812833300481,963126812833300481,2018-02-12 13:05:00 CST,2018-02-12,13:05:00,-0500,24222396,bertholomey,Packwolf,,"Having bad luck in @EAMaddenNFL online On @Xbox Some online games, I have no kick meter, others, I’m ahead and get a message, “experiencing problems, trying to reconnect you” then I get a loss even tho I’m winning. Frustrating when it’s hard enough to earn a win 1 Handed.. Ugh",en,"[{'screen_name': 'eamaddennfl', 'name': 'madden nfl 22', 'id': '50096544'}, {'screen_name': 'xbox', 'name': 'xbox', 'id': '24742040'}]",[],[],0,0,0,[],[],https://twitter.com/Bertholomey/status/963126812833300481,False,,0,,phoenix,,,,,,[],,,,
963124115799355392,963124115799355392,2018-02-12 12:54:17 CST,2018-02-12,12:54:17,-0500,768524094,nikkamangano,Nikka,,"As a parent, there’s nothing you want more in life than to be able to protect your child from hurt and disappointment. Not being able to do that in some situations is a shitty ass feeling.",en,[],[],[],0,1,13,[],[],https://twitter.com/nikkamangano/status/963124115799355392,False,,0,,phoenix,,,,,,[],,,,
963117101815799808,963117101815799808,2018-02-12 12:26:25 CST,2018-02-12,12:26:25,-0500,3282860396,suicide_blonde9,Bitchthatlovesherdog,,I bought my best friend a nightmare before Christmas shot glass because she’s an alcoholic.,en,[],[],[],0,0,2,[],[],https://twitter.com/suicide_blonde9/status/963117101815799808,False,,0,,phoenix,,,,,,[],,,,
963116118155001856,963110691833081858,2018-02-12 12:22:31 CST,2018-02-12,12:22:31,-0500,40780444,arthg,Arthur '2 Blockchainz' Gustafson,,@KommanderKlobb hg branch bloody feature...,en,[],[],[],0,0,0,[],[],https://twitter.com/ArthG/status/963116118155001856,False,,0,,phoenix,,,,,,"[{'screen_name': 'KommanderKlobb', 'name': 'Ricky Haggett', 'id': '62613968'}]",,,,
963108790978555904,963108790978555904,2018-02-12 11:53:24 CST,2018-02-12,11:53:24,-0500,291740968,jcampanellinyc,Julia Campanelli,,"Very good article about immersive theatre audience, boundaries, sexual assault if performers in Sleep No More NY.  #MeToo  The problem with immersive theatre: why actors need extra protection from sexual assault  https://t.co/uD8evobFsm",en,[],['https://www.theguardian.com/stage/2018/feb/12/immersive-theatre-punchdrunk-sleep-no-more?CMP=share_btn_tw'],[],0,0,1,['metoo'],[],https://twitter.com/jcampanelliNYC/status/963108790978555904,False,,0,,phoenix,,,,,,[],,,,
