id,conversation_id,created_at,date,time,timezone,user_id,username,name,place,tweet,language,mentions,urls,photos,replies_count,retweets_count,likes_count,hashtags,cashtags,link,retweet,quote_url,video,thumbnail,near,geo,source,user_rt_id,user_rt,retweet_id,reply_to,retweet_date,translate,trans_src,trans_dest
1057784189322436608,1057784189322436608,2018-10-31 18:59:38 CDT,2018-10-31,18:59:38,-0500,41428186,poppy_haze,Rev. Poppy Haze,,"For Halloween here’s the last radio messages from my GRU “P” sleeper pod: 19/12/83 DDR invades BRD to force fugitive return 22/12/83 Warsaw Pact joins after NATO invades DDR 01/01/84 Happy New Year  16/02/84 Operation Narodnaya success, Japan occupied 18/02/84 Perimeter Received",en,[],[],[],1,0,1,[],[],https://twitter.com/poppy_haze/status/1057784189322436608,False,,0,,new york city,,,,,,[],,,,
1057783283977764871,1057771872253812737,2018-10-31 18:56:02 CDT,2018-10-31,18:56:02,-0500,15449962,lochnesscheska,existential bread 🥖,,@jokeyweisguy I’m dead,en,[],[],[],0,0,1,[],[],https://twitter.com/lochnesscheska/status/1057783283977764871,False,,0,,new york city,,,,,,[],,,,
1057783109977079808,1057783109977079808,2018-10-31 18:55:20 CDT,2018-10-31,18:55:20,-0500,1723627166,may_gilmer212,cynthia may,,Yes I noticed. All they talk about is him getting the death penalty #TreeOfLifeSynagogue,en,[],[],[],0,0,0,['treeoflifesynagogue'],[],https://twitter.com/may_gilmer212/status/1057783109977079808,False,https://twitter.com/TalbertSwan/status/1057462717529907200,0,,new york city,,,,,,[],,,,
1057782940103557120,1057782940103557120,2018-10-31 18:54:40 CDT,2018-10-31,18:54:40,-0500,1059727285,katharsisravyn,✨ KRT ✨ ✿,"{'type': 'Point', 'coordinates': [40.73799, -74.003445]}","Potential next member of The Angry Inch??? After all I just find these people, and this one surely won’t be the only one who’s dead inside!!! 🎺💀🎺 @ Grounded  https://t.co/a0IYOaZYbd",en,[],['https://www.instagram.com/p/Bpnd1xKhPAf/?utm_source=ig_twitter_share&igshid=nmjcp6pxyizp'],[],0,0,0,[],[],https://twitter.com/KatharsisRavyn/status/1057782940103557120,False,,0,,new york city,,,,,,[],,,,
1057782341337313281,1057693827488759810,2018-10-31 18:52:17 CDT,2018-10-31,18:52:17,-0500,947156075492634624,shayewyllie,Shaye is a 4 Townie 4 Life ❤️,,@justabxmom Girl! Lol I force it because if I think I look good then I won’t feel as bad. Lol But I be TIRED! 😂 It’s to trick my staff into thinking I got everything under control. It works! Lol,en,[],[],[],1,0,1,[],[],https://twitter.com/shayewyllie/status/1057782341337313281,False,,0,,new york city,,,,,,"[{'screen_name': 'justabxmom', 'name': 'melissa #nycmom', 'id': '707758634709753856'}]",,,,
1057781297580593152,1057781297580593152,2018-10-31 18:48:08 CDT,2018-10-31,18:48:08,-0500,1045779134,bstkeptsecret_,ѕιn -ღ,,"It kills me to see my Fiancé so hurt and he doesn’t want to talk to me about it, I wish there was something I could do to ease his pain ... Lord please help him 😔",en,[],[],[],0,0,0,[],[],https://twitter.com/bstkeptsecret_/status/1057781297580593152,False,,0,,new york city,,,,,,[],,,,
1057781269453594625,1057761043127169026,2018-10-31 18:48:01 CDT,2018-10-31,18:48:01,-0500,512062569,cgonzalez908,Christopher Gonzalez 🦁,,@G_Gonzalez908 Lmfao I’m dead,en,[],[],[],0,0,0,[],[],https://twitter.com/Cgonzalez908/status/1057781269453594625,False,,0,,new york city,,,,,,"[{'screen_name': 'G_Gonzalez908', 'name': 'Gerson', 'id': '555328700'}]",,,,
1057781045821689856,1035226546624053248,2018-10-31 18:47:08 CDT,2018-10-31,18:47:08,-0500,199722981,creditpsycho,Credit Psycho,,@FreedomDebt #debt Freedom Debt Relief is a fancy phrase for Debt Counseling! The Kiss of Death in the #creditreport World Shows Lack of Discipline to control your own #creditdestiney Bankruptcy is the better option and be #debtfree in 2-4 months! Help is Coming Soon in 3 languages! @YCCYCS,en,"[{'screen_name': 'yccycs', 'name': 'you can change your credit score', 'id': '1045320036121030656'}]",[],[],1,0,1,"['debt', 'creditreport', 'creditdestiney', 'debtfree']",[],https://twitter.com/CreditPsycho/status/1057781045821689856,False,,0,,new york city,,,,,,"[{'screen_name': 'FreedomDebt', 'name': 'Freedom Debt Relief', 'id': '21262600'}]",,,,
1057779456465494017,1057779456465494017,2018-10-31 18:40:49 CDT,2018-10-31,18:40:49,-0500,475919012,avicari2,Angelo Vicari,"{'type': 'Point', 'coordinates': [40.73361111, -74.00166667]}",When #Death has somewhere to be but New York doesn't give a fuck... Lol  #halloween #halloweenparade #nyc #thecity #greenwichvillage #nofucksgiven #traffic #peoplejam @ Greenwich Village  https://t.co/M6b4K519Od,en,[],['https://www.instagram.com/p/BpncQOsl61_/?utm_source=ig_twitter_share&igshid=1rtoidthaxm05'],[],0,0,1,"['death', 'halloween', 'halloweenparade', 'nyc', 'thecity', 'greenwichvillage', 'nofucksgiven', 'traffic', 'peoplejam']",[],https://twitter.com/avicari2/status/1057779456465494017,False,,0,,new york city,,,,,,[],,,,
1057779143264239616,1057779143264239616,2018-10-31 18:39:34 CDT,2018-10-31,18:39:34,-0500,225709644,breakinnewsboy,Darren McQuade,,It has been one year since the deadly #halloween terror attack in #NYC.  Me and @AyanaHarry were just a few blocks away and RAN to the scene.  I'm proud of the work everyone at #PIX11NEWS did that day. It still feels very fresh. #RealNews  https://t.co/B4telfXzo4,en,"[{'screen_name': 'ayanaharry', 'name': 'ayana harry pix11', 'id': '100349032'}]",[],[],0,2,1,"['halloween', 'nyc', 'pix11news', 'realnews']",[],https://twitter.com/BreakinNewsBoy/status/1057779143264239616,False,,1,https://pbs.twimg.com/ext_tw_video_thumb/1057778896198922240/pu/img/OXLW5g5QYu6XxjBE.jpg,new york city,,,,,,[],,,,
1057778651893239808,1057778651893239808,2018-10-31 18:37:37 CDT,2018-10-31,18:37:37,-0500,32863881,getthrutheday,Kar Ma,,@realDonaldTrump Gee @realDonaldTrump  it’s odd how fake claims against mueller have surfaced just in time to dispute your claims dems sent themselves bombs and I won’t go to the slaughter in Pittsburgh but you know what you said #Sad,en,"[{'screen_name': 'realdonaldtrump', 'name': 'donald j. trump', 'id': '25073877'}]",[],[],0,0,0,['sad'],[],https://twitter.com/getthrutheday/status/1057778651893239808,False,,0,,new york city,,,,,,[],,,,
1057778651356372992,1057778651356372992,2018-10-31 18:37:37 CDT,2018-10-31,18:37:37,-0500,17542254,varnado,Victor Varnado,,I think this is the most important thing that has ever happened.   You play Red Dead and Spiderman.  Pass me this shit.    https://t.co/OkrOoZi96w,en,[],['https://youtu.be/b8ERaueJt5s'],[],0,0,1,[],[],https://twitter.com/varnado/status/1057778651356372992,False,,0,,new york city,,,,,,[],,,,
1057777858288984064,1057742623920848906,2018-10-31 18:34:28 CDT,2018-10-31,18:34:28,-0500,46030458,rai_bella,Ray,,@Miss_AnaG @NayriiTime @WinstonSwing Dead ass.,en,[],[],[],1,0,0,[],[],https://twitter.com/Rai_Bella/status/1057777858288984064,False,,0,,new york city,,,,,,"[{'screen_name': 'Miss_AnaG', 'name': 'AnA G.', 'id': '271175129'}, {'screen_name': 'NayriiTime', 'name': 'Katara', 'id': '357284759'}, {'screen_name': 'WinstonSwing', 'name': 'Swing.⚡', 'id': '66893339'}]",,,,
1057777623911329792,1057765171870007297,2018-10-31 18:33:32 CDT,2018-10-31,18:33:32,-0500,17054057,kingpryze,🅿️rizeraci,,@MartTheMartian Sonnnn she so dead ass too,en,[],[],[],0,0,0,[],[],https://twitter.com/KingPryze/status/1057777623911329792,False,,0,,new york city,,,,,,"[{'screen_name': 'martthemartian', 'name': 'Ⓜ️art 🏴\u200d☠️', 'id': '314568859'}]",,,,
1057777420277874688,1057777420277874688,2018-10-31 18:32:44 CDT,2018-10-31,18:32:44,-0500,50550768,lamamaetc,La MaMa E.T.C.,,La MaMa celebrates the life and legacy of María Irene Fornés who inspired and influenced generations of playwrights and theatre makers.   A force and a spirit that we will not forget....  This photo was taken at La MaMa in April of 1969.  https://t.co/NMGmGwmqbx,en,[],[],['https://pbs.twimg.com/media/Dq3688RWoAIldW5.jpg'],0,2,5,[],[],https://twitter.com/LaMaMaETC/status/1057777420277874688,False,,1,https://pbs.twimg.com/media/Dq3688RWoAIldW5.jpg,new york city,,,,,,[],,,,
1057777396676407297,1057777396676407297,2018-10-31 18:32:38 CDT,2018-10-31,18:32:38,-0500,157140564,imperatormagnus,Efrain Suarez II,"{'type': 'Point', 'coordinates': [40.77195338, -73.87288343]}","I'd punch him in the throat and say ""Not funny dude"".  #happyhalloween   @Regran_ed from @TheSamplerBk  -  Airport Halloween Winner!!! #happyhalloween #halloween #halloweencostume #pilot…  https://t.co/kXK5adPgO2",en,"[{'screen_name': 'regran_ed', 'name': 'regran_ed', 'id': '949512260'}, {'screen_name': 'thesamplerbk', 'name': 'the sampler', 'id': '1546341481'}]",['https://www.instagram.com/p/BpnbSvmhKwT/?utm_source=ig_twitter_share&igshid=hjnnnfohgc3a'],[],0,0,0,"['happyhalloween', 'happyhalloween', 'halloween', 'halloweencostume', 'pilot']",[],https://twitter.com/ImperatorMagnus/status/1057777396676407297,False,,0,,new york city,,,,,,[],,,,
1057774914055344129,1057774914055344129,2018-10-31 18:22:46 CDT,2018-10-31,18:22:46,-0500,513901881,drebuckz_,CROWD RANGER,,@MetroBoomin @21savage if ya drop tonight ya gonna force me to stay up all night and face  https://t.co/rko8A0jWri,en,"[{'screen_name': '21savage', 'name': 'saint laurent don', 'id': '260114837'}]",[],['https://pbs.twimg.com/media/Dq34qs3XQAItjRS.jpg'],0,0,1,[],[],https://twitter.com/Drebuckz_/status/1057774914055344129,False,,1,https://pbs.twimg.com/media/Dq34qs3XQAItjRS.jpg,new york city,,,,,,[],,,,
1057774514900267008,1057774514900267008,2018-10-31 18:21:11 CDT,2018-10-31,18:21:11,-0500,461308315,kareemygoodness,Kareem Woods,"{'type': 'Point', 'coordinates': [40.69771427, -73.93134265]}",Night of the LITTY dead👻🔥 ERA FREESTYLE IS LIVE (LINK IN BIO)  Filmed by: @tgi_phil  A/C: hannahteresa1    #era #rlgrime #nova #freestyle #improvisation #halloween #halloweenvibes #spooky…  https://t.co/iTNKThRYYs,en,"[{'screen_name': 'tgi_phil', 'name': 'philippe taglioni', 'id': '949292816638898176'}]",['https://www.instagram.com/p/BpnYC6xAQt-/?utm_source=ig_twitter_share&igshid=10bmo3las2ih2'],[],0,0,0,"['era', 'rlgrime', 'nova', 'freestyle', 'improvisation', 'halloween', 'halloweenvibes', 'spooky']",[],https://twitter.com/KareemyGoodness/status/1057774514900267008,False,,0,,new york city,,,,,,[],,,,
1057774340702380032,1057774340702380032,2018-10-31 18:20:29 CDT,2018-10-31,18:20:29,-0500,719910580698628096,daniellapuitiza,Daniella Puitiza,,YAS @NYCFC that kick 👌🏽,en,"[{'screen_name': 'nycfc', 'name': 'new york city fc', 'id': '1415791555'}]",[],[],0,0,0,[],[],https://twitter.com/DaniellaPuitiza/status/1057774340702380032,False,,0,,new york city,,,,,,[],,,,
1057774029610909696,1057774029610909696,2018-10-31 18:19:15 CDT,2018-10-31,18:19:15,-0500,3075845932,jaynordlinger,Jay Nordlinger,,"In December 1998, on the eve of impeachment, Clinton bombed Iraq. A lot of people thought he was “wagging the dog.” Today, Trump is talking about 15,000 troops on our southern border. Is that a proper use of the military? Or an abuse?",en,[],[],[],6,8,20,[],[],https://twitter.com/jaynordlinger/status/1057774029610909696,False,,0,,new york city,,,,,,[],,,,
1057773234437980167,1057773234437980167,2018-10-31 18:16:06 CDT,2018-10-31,18:16:06,-0500,2778575407,backdoor_pharma,Backdoor Pharmacist,,Force-femming myself to own the libs,en,[],[],[],0,0,2,[],[],https://twitter.com/backdoor_pharma/status/1057773234437980167,False,https://twitter.com/whitequark/status/1057697671752892416,0,,new york city,,,,,,[],,,,
1057772848176160768,1057772848176160768,2018-10-31 18:14:34 CDT,2018-10-31,18:14:34,-0500,37518754,chrisr3ed,Im HIM Thats WHO!,,“My life is like a speeding bullet that just hasn’t hit the target.”  https://t.co/hDprGvVAlf,en,[],[],['https://pbs.twimg.com/media/Dq32yuYUUAA5o3H.jpg'],0,0,2,[],[],https://twitter.com/ChrisR3ed/status/1057772848176160768,False,,1,https://pbs.twimg.com/media/Dq32yuYUUAA5o3H.jpg,new york city,,,,,,[],,,,
1057772107906629632,1057772107906629632,2018-10-31 18:11:37 CDT,2018-10-31,18:11:37,-0500,2389927563,bananawicz,kathleen bananawicz,,Giving out candy to kids is so fun but this full grown dude dead ass had a full beard and said “trick or treat” about eight octaves lower than my dad would so I’m done for the night,en,[],[],[],0,0,13,[],[],https://twitter.com/bananawicz/status/1057772107906629632,False,,0,,new york city,,,,,,[],,,,
1057771256286756864,1057771256286756864,2018-10-31 18:08:14 CDT,2018-10-31,18:08:14,-0500,1138261262,jamiehomage,jamie homage,,Someone give me new eyeballs for halloween your bloody eye socket costume will go off at the halloween dance,en,[],[],[],0,0,3,[],[],https://twitter.com/jamiehomage/status/1057771256286756864,False,,0,,new york city,,,,,,[],,,,
1057770969375432704,1057770969375432704,2018-10-31 18:07:06 CDT,2018-10-31,18:07:06,-0500,51595502,iamdanny_,.,,Dead can’t drink the way I used to since I turned 21,en,[],[],[],1,0,1,[],[],https://twitter.com/iamDanny_/status/1057770969375432704,False,,0,,new york city,,,,,,[],,,,
1057770443841695744,1057714919766925314,2018-10-31 18:05:00 CDT,2018-10-31,18:05:00,-0500,32863881,getthrutheday,Kar Ma,,@realDonaldTrump You are disgraceful is everything about you? Does the world just revolve around you? This is NOT ABOUT YOU JUST SAY IT ITS ABOUT THE DEAD THE MURDERED BY A TRUMP SUPPORTER AND AN ANTI CARAVAN PERSON WHO SAID JEWS HELPED ILLIGAL IMMIGRANTS #SICK,en,[],[],[],0,0,0,['sick'],[],https://twitter.com/getthrutheday/status/1057770443841695744,False,,0,,new york city,,,,,,"[{'screen_name': 'realDonaldTrump', 'name': 'Donald J. Trump', 'id': '25073877'}]",,,,
1057770111015235584,1057770111015235584,2018-10-31 18:03:41 CDT,2018-10-31,18:03:41,-0500,29141019,brooklynhistory,Center for Brooklyn History,,"Today, we’re more likely to die of a long, anticipated death than a sudden heart attack. This allows for the dying &amp; their families to engage with the shrouding process. “The more we put our hands on death, the more we understand what our culture needs,” explains Amy Cunningham.",en,[],[],[],0,0,0,[],[],https://twitter.com/brooklynhistory/status/1057770111015235584,False,,0,,new york city,,,,,,[],,,,
1057769563390124033,1057769563390124033,2018-10-31 18:01:30 CDT,2018-10-31,18:01:30,-0500,888544077746241536,teethinmyeye,aidan aidan aidan,,"Honestly fuck Red Dead Redemption, it’s all about Blue Alive Sinfulness",en,[],[],[],1,0,0,[],[],https://twitter.com/teethinmyeye/status/1057769563390124033,False,,0,,new york city,,,,,,[],,,,
1057769081779249152,1057713899561054209,2018-10-31 17:59:36 CDT,2018-10-31,17:59:36,-0500,1473529741,chuco91,Edgar Damian Gaspar 🇲🇽,,@ReguloCaro Red dead redemption,en,[],[],[],0,0,0,[],[],https://twitter.com/chuco91/status/1057769081779249152,False,,0,,new york city,,,,,,"[{'screen_name': 'ReguloCaro', 'name': 'Régulo Caro', 'id': '162132730'}]",,,,
1057768538948227075,1057768538948227075,2018-10-31 17:57:26 CDT,2018-10-31,17:57:26,-0500,188449160,robertbalkovich,Robert Balkovich,,Wow and in an instant Who? Jackman is dead to me.,en,[],[],[],2,0,13,[],[],https://twitter.com/robertbalkovich/status/1057768538948227075,False,https://twitter.com/Variety/status/1057754218759516160,0,,new york city,,,,,,[],,,,
1057768455875842048,1057768455875842048,2018-10-31 17:57:06 CDT,2018-10-31,17:57:06,-0500,714542318485942272,chel_irizarry,Chelsea Irizarry,,Police say four teenagers were seriously hurt in a multi-vehicle crash this afternoon. I'll be live at 7 with the latest on the investigation @FiOS1News_LI  https://t.co/z0sREikNNU,en,"[{'screen_name': 'fios1news_li', 'name': 'fios1 long island', 'id': '278144816'}]",[],['https://pbs.twimg.com/media/Dq3yzTiU0AAhRe-.jpg'],0,3,0,[],[],https://twitter.com/chel_irizarry/status/1057768455875842048,False,,1,https://pbs.twimg.com/media/Dq3yzTiU0AAhRe-.jpg,new york city,,,,,,[],,,,
1057768372199481345,1057768372199481345,2018-10-31 17:56:46 CDT,2018-10-31,17:56:46,-0500,29141019,brooklynhistory,Center for Brooklyn History,,"Each culture has its own approach to funerary shrouds. Some Great Plains Native Americans wrap the dead and hoist them above ground on platforms; in Japan, many families clothe their deceased relatives in pajamas.",en,[],[],[],0,0,0,[],[],https://twitter.com/brooklynhistory/status/1057768372199481345,False,,0,,new york city,,,,,,[],,,,
1057768079999074304,1057768079999074304,2018-10-31 17:55:37 CDT,2018-10-31,17:55:37,-0500,121828398,aurachiefy,AuraChiefy,"{'type': 'Point', 'coordinates': [40.7601982, -73.9152666]}","Lmao us big dudes barely die tho Join me Tonight! Ticket Link In Bio Murder at 42-18 Wed, Oct 31st, spyce_astoria with 2 Rooms of #Death, an Outdoor Cemetery, over 20 Live Performers, 5…  https://t.co/KO6fTNyw83",en,[],['https://www.instagram.com/p/BpnW_bkA3Yu/?utm_source=ig_twitter_share&igshid=1acco3tuolxax'],[],0,0,0,['death'],[],https://twitter.com/AuraChiefy/status/1057768079999074304,False,,0,,new york city,,,,,,[],,,,
1057767342653034501,1057767342653034501,2018-10-31 17:52:41 CDT,2018-10-31,17:52:41,-0500,2236391857,thehobokenmary,The Hoboken Mary,,Hope Everyone Is Having A Bloody Ghoul Halloween! #trickortreat #HalloweenCandyDrama #Halloween18 #Hoboken  📍@Sorellina_hbkn  https://t.co/cTexnx2S6Y,en,"[{'screen_name': 'sorellina_hbkn', 'name': 'sorellina hoboken', 'id': '3389166502'}]",[],['https://pbs.twimg.com/media/Dq3xyYHUwAAuwV0.jpg'],0,0,0,"['trickortreat', 'halloweencandydrama', 'halloween18', 'hoboken']",[],https://twitter.com/TheHobokenMary/status/1057767342653034501,False,,1,https://pbs.twimg.com/media/Dq3xyYHUwAAuwV0.jpg,new york city,,,,,,[],,,,
1057767287896334336,1057767287896334336,2018-10-31 17:52:28 CDT,2018-10-31,17:52:28,-0500,249682810,savthegenius,SAV. 🧠,,On my bully! Come get produced by the God,en,[],[],[],1,1,2,[],[],https://twitter.com/savthegenius/status/1057767287896334336,False,,0,,new york city,,,,,,[],,,,
1057767078583775232,1057620518751428608,2018-10-31 17:51:38 CDT,2018-10-31,17:51:38,-0500,427951650,adrian_benepe,Adrian Benepe,,"@realDonaldTrump You were shunned by everyone: all the elected officials, all the families of the dead and wounded, all of #Pittsburgh. You are loathed as the person who sparked the anti-Semitic hate and fanned the flames. #Resign",en,[],[],[],0,1,24,"['pittsburgh', 'resign']",[],https://twitter.com/Adrian_Benepe/status/1057767078583775232,False,,0,,new york city,,,,,,"[{'screen_name': 'realDonaldTrump', 'name': 'Donald J. Trump', 'id': '25073877'}]",,,,
1057767064935587840,1057767064935587840,2018-10-31 17:51:35 CDT,2018-10-31,17:51:35,-0500,174853677,jjdevaney,JJ Devaney,,There are very people here.  This can’t kick off at 7pm.,en,[],[],[],1,0,0,[],[],https://twitter.com/JJDevaney/status/1057767064935587840,False,,0,,new york city,,,,,,[],,,,
1057766763646124032,1057766763646124032,2018-10-31 17:50:23 CDT,2018-10-31,17:50:23,-0500,2465162653,someonenotjuwan,Juwan has left this Account,,"The Maryland Board of Regents felt it was more important for DJ Durkin to keep his job then to find him responsible for the death of his student-athlete, Jordan McNair. The University President and state Governor felt otherwise.  https://t.co/6j2cn7Qdmb",en,[],['http://www.espn.com/college-football/story/_/id/25137549/maryland-terrapins-coach-dj-durkin-fired-wake-probe?platform=amp'],[],0,0,0,[],[],https://twitter.com/someonenotjuwan/status/1057766763646124032,False,,0,,new york city,,,,,,[],,,,
1057765995966877696,1057765995966877696,2018-10-31 17:47:20 CDT,2018-10-31,17:47:20,-0500,67133804,starbrightnyc,Starbright Floral Design,,"It's a  ""Dia De Los Muertos"" (or Day of the Dead) celebrated in NYC and sponsored by San Francisco Travel. It's an event for the tour &amp; travel industry.  Complete with flower walls, prayer candles, and sugar sculls. At the Moxy Hotel Times Square Rooftop Lounge. @MoxyTimesSquare  https://t.co/krsXjuFeEt",en,"[{'screen_name': 'moxytimessquare', 'name': 'moxy times square', 'id': '771777814685245440'}]",[],"['https://pbs.twimg.com/media/Dq3wD8iWoAAUpJE.jpg', 'https://pbs.twimg.com/media/Dq3wD8QW4AIIUyp.jpg', 'https://pbs.twimg.com/media/Dq3wDZpWwAAkZRy.jpg', 'https://pbs.twimg.com/media/Dq3wC2hW4AA3SOH.jpg']",0,1,0,[],[],https://twitter.com/StarbrightNYC/status/1057765995966877696,False,,1,https://pbs.twimg.com/media/Dq3wD8iWoAAUpJE.jpg,new york city,,,,,,[],,,,
1057764468296425472,1057757201081815046,2018-10-31 17:41:16 CDT,2018-10-31,17:41:16,-0500,552971272,iamrahbanks,RAH • BANKS,,@KxnqMasiyah @hoeslovegianni @NickiMBabyy I didn’t say he was a barb but Devyn dead love Nicki.,en,[],[],[],0,0,0,[],[],https://twitter.com/IAMRAHBANKS/status/1057764468296425472,False,,0,,new york city,,,,,,"[{'screen_name': 'KxnqMasiyah', 'name': 'KXNGMASIYAH 🦄', 'id': '153515108'}, {'screen_name': 'hoeslovegianni', 'name': 'Gianni ⚡️', 'id': '294773074'}, {'screen_name': 'NickiMBabyy', 'name': 'Ms. Petty 🦄', 'id': '979337533'}]",,,,
