id,conversation_id,created_at,date,time,timezone,user_id,username,name,place,tweet,language,mentions,urls,photos,replies_count,retweets_count,likes_count,hashtags,cashtags,link,retweet,quote_url,video,thumbnail,near,geo,source,user_rt_id,user_rt,retweet_id,reply_to,retweet_date,translate,trans_src,trans_dest
1027335057789386757,1027335057789386757,2018-08-08 18:25:39 CDT,2018-08-08,18:25:39,-0500,724618886,almightylukee,Luk’ 🗿,,Y’all really desperate for a arrest 🤦‍♂️,en,[],[],[],0,0,0,[],[],https://twitter.com/AlmightyLukee/status/1027335057789386757,False,https://twitter.com/ATLBlackStar/status/1026858905316601859,0,,san antonio,,,,,,[],,,,
1027329694457315340,1027316889180098565,2018-08-08 18:04:20 CDT,2018-08-08,18:04:20,-0500,355199901,crumblebumbles,Jordan Crumb🦈 (aka The Shark Head Guy),,@UzamakiJ @Heinekenrana @Kaibutsu It's weapon is a beam ribbon whip,en,[],[],[],0,0,0,[],[],https://twitter.com/CrumbleBumbles/status/1027329694457315340,False,,0,,san antonio,,,,,,"[{'screen_name': 'UzamakiJ', 'name': 'UzamakiJ', 'id': '15301490'}, {'screen_name': 'Heinekenrana', 'name': 'no', 'id': '3030443903'}, {'screen_name': 'Kaibutsu', 'name': 'Kokujin ♐', 'id': '17350532'}]",,,,
1027324262716264448,1027324262716264448,2018-08-08 17:42:45 CDT,2018-08-08,17:42:45,-0500,757013945198612480,papaguyo3,Guy Roger,,"@GeraldoRivera Socialized medicine means everyone in the medical industry essentially works for the govt. Since cyber warfare is a threat to the US, it’s more important for the US that #tech should become ‘socialized’ benefiting our citizens &amp; not  our adversaries?",en,[],[],[],0,0,0,['tech'],[],https://twitter.com/papaguyo3/status/1027324262716264448,False,,0,,san antonio,,,,,,[],,,,
1027317803622309889,1027317803622309889,2018-08-08 17:17:05 CDT,2018-08-08,17:17:05,-0500,761670391,judsonmcculloch,Judson McCulloch,,Communists that promote human trafficking can be so petty. 😾,en,[],[],[],0,1,3,[],[],https://twitter.com/JudsonMcCulloch/status/1027317803622309889,False,https://twitter.com/soledadobrien/status/1027180922892967943,0,,san antonio,,,,,,[],,,,
1027317120386965505,1027317120386965505,2018-08-08 17:14:22 CDT,2018-08-08,17:14:22,-0500,1325349458,ldelao76,LisaDelao 🇺🇦,,"Reasonable  Americans of all political stripes surely draw the line at rampant criminal acts of past 24 hrs, and immigration families abuse and refusal to obey orders of family  reunification. ... Riiiiight????",en,[],[],[],0,0,0,[],[],https://twitter.com/ldelao76/status/1027317120386965505,False,https://twitter.com/chrislhayes/status/1027019621772259328,0,,san antonio,,,,,,[],,,,
1027315961903374336,1027315961903374336,2018-08-08 17:09:46 CDT,2018-08-08,17:09:46,-0500,1325349458,ldelao76,LisaDelao 🇺🇦,,Noone can possibly be okay with immigration abuse and children separated from asylum seeking parents!!!,en,[],[],[],0,0,0,[],[],https://twitter.com/ldelao76/status/1027315961903374336,False,https://twitter.com/SenFeinstein/status/1027218691300188166,0,,san antonio,,,,,,[],,,,
1027314182998446081,1027314182998446081,2018-08-08 17:02:42 CDT,2018-08-08,17:02:42,-0500,734963277529128960,cleoh22,cleoo,,if you’re not having a panic attack while packing for college wyd,en,[],[],[],0,0,0,[],[],https://twitter.com/cleoh22/status/1027314182998446081,False,,0,,san antonio,,,,,,[],,,,
1027307755898634241,1027279752565014529,2018-08-08 16:37:10 CDT,2018-08-08,16:37:10,-0500,1325349458,ldelao76,LisaDelao 🇺🇦,,"@JeffMerkley Absolutely the precise policy platform that defines us as Democratic voters-and exactly what we must run with. ..although, as they say, ""all politics are local..."" &amp; where we CAN , time to be unafraid to call for Impeachment. ..and MUST keep cruelty of border  family abuse dialog",en,[],[],[],0,1,1,[],[],https://twitter.com/ldelao76/status/1027307755898634241,False,,0,,san antonio,,,,,,"[{'screen_name': 'JeffMerkley', 'name': 'Jeff Merkley', 'id': '223166587'}]",,,,
1027296430187266048,1027296430187266048,2018-08-08 15:52:09 CDT,2018-08-08,15:52:09,-0500,3262976671,texunmade,Tex Unmade,,"All of the violence in Chicago could literally stop for an entire year and rich conservative will feign concern over cities like Baltimore, or Detroit. This is what you call: Moving the Goalpost",en,[],[],[],0,0,1,[],[],https://twitter.com/TexUnmade/status/1027296430187266048,False,,0,,san antonio,,,,,,[],,,,
1027289982539583489,1027289982539583489,2018-08-08 15:26:32 CDT,2018-08-08,15:26:32,-0500,492842272,toreerori,Tori,,@Carrasco2395 Happy Birthday brother! Can’t wait to rage with you again! 🤘🏼💚,en,[],[],[],1,0,0,[],[],https://twitter.com/ToreeRori/status/1027289982539583489,False,,0,,san antonio,,,,,,[],,,,
1027288758339731456,1027288758339731456,2018-08-08 15:21:40 CDT,2018-08-08,15:21:40,-0500,461336572,abena_314,key.,,"I AM SO PROUD OF THE CITY/COUNTY OF ST. LOUIS!! I been saying get his raggedy racist ass out, hell even my parents been saying it for years...and now that sob is OUT. Cant wait to see what you do!! Screaming from Texas! #weneededchange #wesleybell #deucesbob #youwontbemissed",en,[],[],[],0,0,0,"['weneededchange', 'wesleybell', 'deucesbob', 'youwontbemissed']",[],https://twitter.com/AbenA_314/status/1027288758339731456,False,,0,,san antonio,,,,,,[],,,,
1027278703569588229,1027278703569588229,2018-08-08 14:41:43 CDT,2018-08-08,14:41:43,-0500,2270630270,curtisfdickinso,❌Curtis🇺🇸🎉❌,,City of Philadelphia gives permission to illegal aliens to rape children. Is the Philly mayor still dancing that awkward jig?   https://t.co/wGG6Mum1Dz,en,[],['http://dailycaller.com/2018/08/08/illegal-released-sanctuary-child-rape/'],[],0,0,0,[],[],https://twitter.com/CurtisFDickinso/status/1027278703569588229,False,,0,,san antonio,,,,,,[],,,,
1027265735016546310,1026967638503776257,2018-08-08 13:50:11 CDT,2018-08-08,13:50:11,-0500,978214756829028352,jaime57140690,Blue_Legion,,@bellobrunelli @steven10471 @Obamaboozled @charliekirk11 I'm detecting a condescending tone. Are you insinuating a crime occurred? There was 13 hours of testimony...yet no charges...hmm. How could this be? I mean if the law was broken then the subject should be in jail...but somehow they're not .. Strange?  https://t.co/Pz2lHCOJOG,en,[],[],['https://pbs.twimg.com/tweet_video_thumb/DkGUvDMUcAAy8yQ.jpg'],0,0,0,[],[],https://twitter.com/Jaime57140690/status/1027265735016546310,False,,1,https://pbs.twimg.com/tweet_video_thumb/DkGUvDMUcAAy8yQ.jpg,san antonio,,,,,,"[{'screen_name': 'bellobrunelli', 'name': 'Franco', 'id': '599449552'}, {'screen_name': 'Obamaboozled', 'name': 'Obamaboozled', 'id': '157876270'}, {'screen_name': 'charliekirk11', 'name': 'Charlie Kirk', 'id': '292929271'}]",,,,
1027262350230003712,1027262350230003712,2018-08-08 13:36:44 CDT,2018-08-08,13:36:44,-0500,307627780,ragingrhinopod,Raging Rhino,,"Arguably the best #Titans story - Judas Contract: brutal betrayal by teammate, story has possible allusions to pedophilia.   My personal favorite - Terror of Trigon: columns of humans in twisted torment, heroes face literal inner demons.   “Fuck Batman” doesn’t bother me.",en,[],[],[],0,0,0,['titans'],[],https://twitter.com/RagingRhinoPod/status/1027262350230003712,False,,0,,san antonio,,,,,,[],,,,
1027257100572000257,1027257100572000257,2018-08-08 13:15:52 CDT,2018-08-08,13:15:52,-0500,2324441594,manders_1017,✨the amanda show✨,,"MOMMA, JUST KILLED A MAN. PUT A GUN AGAINST HIS HEAD, PULLED MY TRIGGER, NOW HE’S DEAD. MOMMA!! LIFE HAD JUST BEGUN!!!  https://t.co/CfxDXipoEe",en,[],[],['https://pbs.twimg.com/media/DkGM29TVAAAXyX9.jpg'],0,1,2,[],[],https://twitter.com/manders_1017/status/1027257100572000257,False,,1,https://pbs.twimg.com/media/DkGM29TVAAAXyX9.jpg,san antonio,,,,,,[],,,,
1027246683330146304,1027246683330146304,2018-08-08 12:34:29 CDT,2018-08-08,12:34:29,-0500,2572959263,jacobfu85388283,La Voz de Culebra Park,,"I have NEVER placed my Faith, Hopes and Dreams into this Wicked Nation of Babylon and It's Racist KKKonservative Ideals,  ESPECIALLY when it Comes to the Realization of Being Anti-POC, Anti-Raza!!!",en,[],[],[],1,0,0,[],[],https://twitter.com/JacobFu85388283/status/1027246683330146304,False,,0,,san antonio,,,,,,[],,,,
1027244897731072001,1027244897731072001,2018-08-08 12:27:23 CDT,2018-08-08,12:27:23,-0500,471688181,maricutielynn,Chin,,I’m literally about to have an anxiety attack!!!!!!!,en,[],[],[],0,0,0,[],[],https://twitter.com/maricutielynn/status/1027244897731072001,False,,0,,san antonio,,,,,,[],,,,
1027232938423930880,1026311819126886400,2018-08-08 11:39:52 CDT,2018-08-08,11:39:52,-0500,2572959263,jacobfu85388283,La Voz de Culebra Park,,@kaitlinmaarie @foreverlibra93 HELL YEAH PEDOPHILIA is a DEATH Sentence that should be Given to ANYBODY whom has Tendencies to Rape or Want to be with CHILDREN.  FIRST Gay Marriage Agenda was Introduced and it did NOT stop there!! It NEVER DOES!! #LGBTPESOPHILIA,en,[],[],[],0,0,0,['lgbtpesophilia'],[],https://twitter.com/JacobFu85388283/status/1027232938423930880,False,,0,,san antonio,,,,,,"[{'screen_name': 'foreverlibra93', 'name': 'IamMonaé💜🦄', 'id': '819178358663741442'}]",,,,
1027229020981739520,1027229020981739520,2018-08-08 11:24:18 CDT,2018-08-08,11:24:18,-0500,582190409,1_judson,lord gremlin,,"People want to talk shit but play victim when I hurt they feelings, foh",en,[],[],[],0,1,1,[],[],https://twitter.com/1_judson/status/1027229020981739520,False,,0,,san antonio,,,,,,[],,,,
1027216905604612097,1027216905604612097,2018-08-08 10:36:09 CDT,2018-08-08,10:36:09,-0500,29981528,witrayler,Aquilla❌⁉️,,Danger! Do NOT grow complacent!! #KeepRepublicanMajorities in #Congress2018 #GetAngry #GetEnergized  #Take4orMoreWithYouToVoteRed do not let any Democrat win!  #PatriotsEffectingChange #RedWaveRising2018  #WalkAwayFromDemocrats #MAGA2018toKAG2020 #VoteSCOTUSandTAXECUTS,en,[],[],[],0,0,0,"['keeprepublicanmajorities', 'congress2018', 'getangry', 'getenergized', 'take4ormorewithyoutovotered', 'patriotseffectingchange', 'redwaverising2018', 'walkawayfromdemocrats', 'maga2018tokag2020', 'votescotusandtaxecuts']",[],https://twitter.com/witrayler/status/1027216905604612097,False,,0,,san antonio,,,,,,[],,,,
