id,conversation_id,created_at,date,time,timezone,user_id,username,name,place,tweet,language,mentions,urls,photos,replies_count,retweets_count,likes_count,hashtags,cashtags,link,retweet,quote_url,video,thumbnail,near,geo,source,user_rt_id,user_rt,retweet_id,reply_to,retweet_date,translate,trans_src,trans_dest
1047274667642425344,1047190873878843392,2018-10-02 18:58:32 CDT,2018-10-02,18:58:32,-0500,3472473101,bxbomber2011,⚾️Bxbomber2011⚾️,,@davidtabrown We are the dark side the force is strong #DefendTheBronx with #pinstripepride,en,[],[],[],0,0,0,"['defendthebronx', 'pinstripepride']",[],https://twitter.com/bxbomber2011/status/1047274667642425344,False,,0,,new york city,,,,,,[],,,,
1047274412410646529,1047274412410646529,2018-10-02 18:57:31 CDT,2018-10-02,18:57:31,-0500,636530484,mykameier,Myka Meier,,"Are you falling victim to ""oblication"" travel?! Learn how to handle it today on @lonelyplanet -  https://t.co/lpYAr4Jytr",en,"[{'screen_name': 'lonelyplanet', 'name': 'lonely planet', 'id': '15066760'}]",['https://www.lonelyplanet.com/news/2018/10/01/what-is-oblication-travel/'],[],0,0,0,[],[],https://twitter.com/MykaMeier/status/1047274412410646529,False,,0,,new york city,,,,,,[],,,,
1047274237524889601,1047274237524889601,2018-10-02 18:56:50 CDT,2018-10-02,18:56:50,-0500,487818280,barbara_render,Barbara Render,,Rory Feek Builds School for Daughter with Special Needs Thanks to Donations After Wife's Death. Happy beginning for the 4 yr old  https://t.co/UNv3t3HnDw,en,[],['https://people.com/parents/rory-feek-builds-schoolhouse-daughter-indiana-down-syndrome/?utm_source=twitter.com&utm_medium=social&utm_campaign=social-share-article'],[],0,0,0,[],[],https://twitter.com/barbara_render/status/1047274237524889601,False,,0,,new york city,,,,,,[],,,,
1047274072101588992,1047272373366476800,2018-10-02 18:56:10 CDT,2018-10-02,18:56:10,-0500,29330450,sheglar_gd,Gus u know the rest,,"@Astrochologist True she came at for nothing,  called me old lol , I'm on offense right now",en,[],[],[],1,0,1,[],[],https://twitter.com/Sheglar_GD/status/1047274072101588992,False,,0,,new york city,,,,,,"[{'screen_name': 'Astrochologist', 'name': 'Astrochologist.Crypto ♐', 'id': '45957815'}]",,,,
1047273255659339777,1047273255659339777,2018-10-02 18:52:56 CDT,2018-10-02,18:52:56,-0500,24095289,taurian_b,El Padrino,,".@ScottieBeam has started a necessary dialogue and her bravery is admirable. I hope the gentleman disrespecting her keep that same energy if their mothers, sisters or daughters get raped or sexually assaulted because at the very least not having sympathy speaks volumes.",en,"[{'screen_name': 'scottiebeam', 'name': 'scottie.', 'id': '20343405'}]",[],[],0,5,5,[],[],https://twitter.com/Taurian_B/status/1047273255659339777,False,,0,,new york city,,,,,,[],,,,
1047273087086067714,1047273087086067714,2018-10-02 18:52:16 CDT,2018-10-02,18:52:16,-0500,824150005745385472,koshertechmedia,KosherTech,,"About to go live on Twitch. Swing by if y'all wanna kick it, we #gaming",en,[],[],[],1,0,2,['gaming'],[],https://twitter.com/KosherTechMedia/status/1047273087086067714,False,,0,,new york city,,,,,,[],,,,
1047273058325712896,1047273058325712896,2018-10-02 18:52:09 CDT,2018-10-02,18:52:09,-0500,884133781573181440,mvazque35072498,Supportive Wife,,Approve the deal and kick Spectrum  the hell out of NY,en,[],[],[],0,3,2,[],[],https://twitter.com/MVazque35072498/status/1047273058325712896,False,https://twitter.com/fasulo_chris/status/1046924207911841792,0,,new york city,,,,,,[],,,,
1047271946944241664,1047263038989127680,2018-10-02 18:47:44 CDT,2018-10-02,18:47:44,-0500,2280237599,alyssaisonline,alyssa ♡,,@sarahhceleste I was just going to say I dead have to go on like a hunt and I barely ever find dairy free ones,en,[],[],[],1,0,1,[],[],https://twitter.com/alyssaisonline/status/1047271946944241664,False,,0,,new york city,,,,,,"[{'screen_name': 'sarahhceleste', 'name': 'celeste', 'id': '720690346'}]",,,,
1047271675371446274,1046962208347963394,2018-10-02 18:46:39 CDT,2018-10-02,18:46:39,-0500,53108210,jav1ts,Javits Arias,,@LowKeeee @SanfordKelly @AutoMattock @HiFightTH @NeonVerte @Outkreyd @Nephew237142 @momochi212 @efpoongko No one really. Someone just posted a video and claimed it was max. It didn’t look like max to me at all so I took a stab at it and got this.,en,[],[],[],2,0,2,[],[],https://twitter.com/jav1ts/status/1047271675371446274,False,,0,,new york city,,,,,,"[{'screen_name': 'LowKeeee', 'name': '~Luna~ ルナ 🌙', 'id': '2779131445'}, {'screen_name': 'SanfordKelly', 'name': 'EMP Sanford Kelly', 'id': '90130733'}, {'screen_name': 'AutoMattock', 'name': 'AutoMattock', 'id': '31651951'}, {'screen_name': 'HiFightTH', 'name': 'HiFight(ハイファイト)', 'id': '3226263367'}, {'screen_name': 'NeonVerte', 'name': 'Neon', 'id': '4919355772'}, {'screen_name': 'momochi212', 'name': 'ももち MOMOCHI', 'id': '389397317'}, {'screen_name': 'efpoongko', 'name': 'PoongKo', 'id': '210779860'}]",,,,
1047270706155868160,1047270706155868160,2018-10-02 18:42:48 CDT,2018-10-02,18:42:48,-0500,550440743,jelinthemix,DJ JEL | The Soca Boss,,Yooo... I nearly dead with @djtravisworld yankee accent. I hope you not coming Miami to use that one eh... LMAOOO,en,[],[],[],0,1,1,[],[],https://twitter.com/jelinthemix/status/1047270706155868160,False,,0,,new york city,,,,,,[],,,,
1047270499087241216,1047270497816330240,2018-10-02 18:41:58 CDT,2018-10-02,18:41:58,-0500,814244136152862720,not_addictive,a summer’s day is not a bitch,,A moderate stance would be that assault rifles are bad but hunting rifles should be legal.  Or that illegal immigration should be curbed by making legal immigration less impossible.   Or even whether or not Kavanaugh should be prosecuted and impeached from his current judgeship,en,[],[],[],1,0,0,[],[],https://twitter.com/not_addictive/status/1047270499087241216,False,,0,,new york city,,,,,,[],,,,
1047270291393728512,1047270291393728512,2018-10-02 18:41:09 CDT,2018-10-02,18:41:09,-0500,1901860716,tina_mescudi,Mrs. Goldie - Rachel Roth 🌘✨,,Lmaoooooo bro you’re dead an asshole,en,[],[],[],1,1,1,[],[],https://twitter.com/Tina_mescudi/status/1047270291393728512,False,https://twitter.com/supersaeyan/status/1047270163022848002,0,,new york city,,,,,,[],,,,
1047269904322314240,1046857521967689728,2018-10-02 18:39:37 CDT,2018-10-02,18:39:37,-0500,252566795,malyndanyc,M,,"@funkychicken @allenerobs @nani_booboo @MonitorBroke @h_grillmore @yepsuzn @malkabethwendy @RealBadFrog @ComradeMcCarthy @D_Mo2016 @KaydeeKing @eurekaskastle @treehugger1605 @GodandtheBear @CottonAndieRaS @syd_viciously @GUAlumni @GUPolitics @Georgetown @YouTube Yup, and they don't care who gets hurt, 50/50% chance it could be someone on their side, the paid organizers aren't going to get their hands dirty.",en,[],[],[],0,0,2,[],[],https://twitter.com/MalyndaNyc/status/1047269904322314240,False,,0,,new york city,,,,,,"[{'screen_name': 'funkychicken', 'name': 'funkychicken', 'id': '13130902'}, {'screen_name': 'allenerobs', 'name': 'President DebraMessinwidyu ❤️🖤❤️🖤❤️', 'id': '724755506137563137'}, {'screen_name': 'MonitorBroke', 'name': 'OMEGA MAN aka $warthy Greek Immigrant', 'id': '916792728700309505'}, {'screen_name': 'h_grillmore', 'name': 'HappyGrillmore', 'id': '4806865755'}, {'screen_name': 'yepsuzn', 'name': 'Susan H', 'id': '346958657'}, {'screen_name': 'malkabethwendy', 'name': '♿🔯 ⏳🍀🔥 🌸 Origami artist', 'id': '48845861'}, {'screen_name': 'ComradeMcCarthy', 'name': 'Lenin McCarthy #ReconnectJulian', 'id': '920602865382473728'}, {'screen_name': 'KaydeeKing', 'name': 'Kaydee King', 'id': '3903052998'}, {'screen_name': 'eurekaskastle', 'name': 'GiantMeteor2024 🧐🤔🤨 ☄️', 'id': '44217853'}, {'screen_name': 'treehugger1605', 'name': 'Susantreehugger1605', 'id': '47261104'}, {'screen_name': 'GodandtheBear', 'name': 'GodandtheBear☭', 'id': '3230944180'}, {'screen_name': 'CottonAndieRaS', 'name': 'Andi', 'id': '983502419110674433'}, {'screen_name': 'syd_viciously', 'name': 'Queen of AnCapistan', 'id': '170019894'}, {'screen_name': 'GUAlumni', 'name': 'Georgetown Alumni', 'id': '12409812'}, {'screen_name': 'GUPolitics', 'name': 'Georgetown Institute of Politics & Public Service', 'id': '3386436927'}, {'screen_name': 'Georgetown', 'name': 'Georgetown University', 'id': '7856542'}, {'screen_name': 'YouTube', 'name': 'YouTube', 'id': '10228272'}]",,,,
1047269764383555584,1047269764383555584,2018-10-02 18:39:03 CDT,2018-10-02,18:39:03,-0500,2856900377,thankfultobeble,sylvia ,,"Clinton accuser Juanita Broaddrick demands FBI probe on Clinton rape claim, amid Kavanaugh furor  https://t.co/6FSLQow6ej #FoxNews",en,[],['https://fxn.ws/2RpIe9s'],[],0,0,0,['foxnews'],[],https://twitter.com/thankfultobeble/status/1047269764383555584,False,,0,,new york city,,,,,,[],,,,
1047269352880394244,1047267735070302208,2018-10-02 18:37:25 CDT,2018-10-02,18:37:25,-0500,928021057583411200,livkristen,CHE GUEVARA,,I’ll be the same person if I had a dollar to my name! Stop showing off to people who wouldn’t care if you dropped dead tomorrow! No one cares! The only person you should be trying to compete with is the person you were yesterday!,en,[],[],[],0,1,0,[],[],https://twitter.com/LivKristen/status/1047269352880394244,False,,0,,new york city,,,,,,[],,,,
1047268514900447232,1047265214322724864,2018-10-02 18:34:05 CDT,2018-10-02,18:34:05,-0500,3656362036,karri_hart,Karri Hart,,@chandra7thomas @BookedHashtag He should’ve punched Neil LaBute in the face.,en,[],[],[],1,0,1,[],[],https://twitter.com/karri_hart/status/1047268514900447232,False,,0,,new york city,,,,,,"[{'screen_name': 'chandra7thomas', 'name': 'chandra thomas', 'id': '59827106'}]",,,,
1047268487146741760,1047268487146741760,2018-10-02 18:33:59 CDT,2018-10-02,18:33:59,-0500,2480184147,souloftwhit,Tom Whitney,,"Attempting to offer a defense of Kavanaugh, this former classmate is seemingly unaware the movie he's chosen as a comparison includes one of the protagonists perpetrating a rape (played as a joke, of course)  https://t.co/PEJSbC1UO3",en,[],[],['https://pbs.twimg.com/media/DoilIg1X0AIZS4y.jpg'],0,0,0,[],[],https://twitter.com/SoulofTwhit/status/1047268487146741760,False,,1,https://pbs.twimg.com/media/DoilIg1X0AIZS4y.jpg,new york city,,,,,,[],,,,
1047268092437581825,1047268092437581825,2018-10-02 18:32:25 CDT,2018-10-02,18:32:25,-0500,236140469,bridagawd,✨Bri-Llustrations✨,,if someone i called my “friend” don’t show me love on my birthday you not gonna receive love from me when your shit comes around🤷🏽‍♀️ dont be butt hurt and unfollow me cus i gave you that same energy right back idcidcidc 😂,en,[],[],[],0,0,0,[],[],https://twitter.com/bridagawd/status/1047268092437581825,False,,0,,new york city,,,,,,[],,,,
1047267494816337920,1047267494816337920,2018-10-02 18:30:02 CDT,2018-10-02,18:30:02,-0500,378189745,lindsay_stein,Lindsay Stein,"{'type': 'Point', 'coordinates': [40.7425, -74.02861111]}","I’ve been kidnapped to Hoboken by my colleagues... 🤦‍♀️ @Campaignmag campaignliveus @ Hoboken, New Jersey  https://t.co/q0OceQUQED",en,"[{'screen_name': 'campaignmag', 'name': 'campaign', 'id': '16468227'}]",['https://www.instagram.com/p/Bocv-JXAsnX/?utm_source=ig_twitter_share&igshid=1ktudh3nxtkdx'],[],0,0,5,[],[],https://twitter.com/Lindsay_Stein/status/1047267494816337920,False,,0,,new york city,,,,,,[],,,,
1047266764088905728,1047266764088905728,2018-10-02 18:27:08 CDT,2018-10-02,18:27:08,-0500,84614511,leamerman,"Laura Amerman, CFRE 🛶 she/her","{'type': 'Point', 'coordinates': [40.71992, -74.00715]}",Dead. Gone to heaven. @ Brandy Library  https://t.co/x85ptZdzUJ,en,[],['https://www.instagram.com/p/BocvpIGh6T4/?utm_source=ig_twitter_share&igshid=157r4h2rkknx0'],[],0,0,0,[],[],https://twitter.com/LEAmerman/status/1047266764088905728,False,,0,,new york city,,,,,,[],,,,
1047266548317126656,1047266548317126656,2018-10-02 18:26:17 CDT,2018-10-02,18:26:17,-0500,104714715,legiscanny,LegiScan NY,"{'type': 'Point', 'coordinates': [40.77112, -73.97419]}",S08034 [NEW] Relates to presumptions for the death of an injured worker due to opioid overdose where that injured worker was prescribed opio  https://t.co/bKQ7AKMCpm,en,[],['http://bitly.com/1WDFWmh'],[],0,0,0,[],[],https://twitter.com/LegiScanNY/status/1047266548317126656,False,,0,,new york city,,,,,,[],,,,
1047266358050873344,1046489672094908416,2018-10-02 18:25:31 CDT,2018-10-02,18:25:31,-0500,1380313832,sprad3s,sb,,@TheJordanRachel What if....wait for it....we taught men to not rape?,en,[],[],[],1,0,15,[],[],https://twitter.com/sprad3s/status/1047266358050873344,False,,0,,new york city,,,,,,"[{'screen_name': 'TheJordanRachel', 'name': 'Jordan Rachel', 'id': '58348452'}]",,,,
1047266330293035008,1047266330293035008,2018-10-02 18:25:25 CDT,2018-10-02,18:25:25,-0500,2782895615,juaninqns,Juan Restrepo 🚲,,".@TransAlt is hearing a powerful Q&amp;A from @NYC_SafeStreets Raul Ampuero talking about his son’s death on #FixNorthernBlvd, his advocacy for #EverySchool Speed Cameras and how he feels about getting involved  https://t.co/FIoGLnzr2h",en,"[{'screen_name': 'transalt', 'name': 'transportation alternatives', 'id': '14928734'}, {'screen_name': 'nyc_safestreets', 'name': 'families for safe streets', 'id': '2336006322'}]",[],"['https://pbs.twimg.com/media/DoijLFVXUAA-2MD.jpg', 'https://pbs.twimg.com/media/DoijLFWXgAA-gFg.jpg']",0,7,22,"['fixnorthernblvd', 'everyschool']",[],https://twitter.com/juaninQNS/status/1047266330293035008,False,,1,https://pbs.twimg.com/media/DoijLFVXUAA-2MD.jpg,new york city,,,,,,[],,,,
1047266275481866244,1047266275481866244,2018-10-02 18:25:11 CDT,2018-10-02,18:25:11,-0500,458060155,smokeylibs,Libby,,Wish @AnaKasparian was one of those female reporters that Trump cut down today. We would have seen a verbal round-house kick to his balls. #tytlive #tytstrong #tyt #riseup ✊🏽,en,"[{'screen_name': 'anakasparian', 'name': 'ana kasparian', 'id': '23865382'}]",[],[],1,0,13,"['tytlive', 'tytstrong', 'tyt', 'riseup']",[],https://twitter.com/smokeylibs/status/1047266275481866244,False,,0,,new york city,,,,,,[],,,,
1047266199351046144,1047254845953122304,2018-10-02 18:24:53 CDT,2018-10-02,18:24:53,-0500,2267474773,tonypopejoy212,anthony popejoy,,@PTTheFireman I was thinking about that earlier. Unfortunately for Milw I don't think they have the starting pitching. ( or its average /overachieving at best ). ... they have great bullpen and offense but starting pitching falls short imho. They get beat by LA And Cubs ( IF they make it ),en,[],[],[],0,0,0,[],[],https://twitter.com/tonypopejoy212/status/1047266199351046144,False,,0,,new york city,,,,,,[],,,,
1047265949970300928,1046964726138359809,2018-10-02 18:23:54 CDT,2018-10-02,18:23:54,-0500,1278275286,slvrblkempireny,Silver&BlackEmpire,,@TheRaidersDaily 24hr news cycle this is the insanity it becomes “Everyone has a plan 'till they get punched in the mouth.” And it will happen @PatrickMahomes5 hasn’t had that yet . And it will come,en,"[{'screen_name': 'patrickmahomes5', 'name': '⬅️raiders icon', 'id': '1095094845335453698'}]",[],[],0,0,1,[],[],https://twitter.com/SlvrBlkEmpireNY/status/1047265949970300928,False,,0,,new york city,,,,,,"[{'screen_name': 'TheRaidersDaily', 'name': '𝙎𝙩𝙚𝙫𝙚 𝙈𝙞𝙘𝙝𝙖𝙚𝙡𝙨 ™️', 'id': '1626646135'}]",,,,
1047265741827919872,1046946308932526080,2018-10-02 18:23:04 CDT,2018-10-02,18:23:04,-0500,2680204754,hanabalplays,Ⱨ₳₦₳,,@ManWhoPlantSwag Congrats!! So happy for you &lt;3 Can't wait to see you kick ass &gt;:D,en,[],[],[],0,0,1,[],[],https://twitter.com/HanabalPlays/status/1047265741827919872,False,,0,,new york city,,,,,,[],,,,
1047265245411135488,1047265245411135488,2018-10-02 18:21:06 CDT,2018-10-02,18:21:06,-0500,2744711079,squeakyvelvet,Madame VP Harris aka 47,,IT'S RAPE! @NBCNews G*%$*&amp;$ IT! Underage means unable to consent. STOP BEING A PART OF RAPE CULTURE AND REPORT THE NEWS ACCURATELY!!,en,"[{'screen_name': 'nbcnews', 'name': 'nbc news', 'id': '14173315'}]",[],[],0,0,2,[],[],https://twitter.com/SqueakyVelvet/status/1047265245411135488,False,https://twitter.com/NBCNews/status/1046908897938804736,0,,new york city,,,,,,[],,,,
1047265207763030016,1047265207763030016,2018-10-02 18:20:57 CDT,2018-10-02,18:20:57,-0500,30404017,ericbrownzzz,Eric Brown,,"thinning about making my new bit being really into the Grateful Dead, but exclusively the studio albums",en,[],[],[],2,0,4,[],[],https://twitter.com/ericbrownzzz/status/1047265207763030016,False,,0,,new york city,,,,,,[],,,,
1047264993954209792,1047264993954209792,2018-10-02 18:20:06 CDT,2018-10-02,18:20:06,-0500,138668717,greydnls,Graham Hoefer,,"A recruiter sent an email to my dead name email and it took everything I had not to reply with   ""Nvm, she ded""",en,[],[],[],2,0,18,[],[],https://twitter.com/greydnls/status/1047264993954209792,False,,0,,new york city,,,,,,[],,,,
1047264890648518656,1047259440242720768,2018-10-02 18:19:41 CDT,2018-10-02,18:19:41,-0500,347827071,helenbholmes,Helen Holmes,,@KeldyOrtiz kidding! i don’t punch down,en,[],[],[],0,0,0,[],[],https://twitter.com/helenbholmes/status/1047264890648518656,False,,0,,new york city,,,,,,"[{'screen_name': 'KeldyOrtiz', 'name': 'Keldy', 'id': '138660620'}]",,,,
1047264409582784512,1047264409582784512,2018-10-02 18:17:47 CDT,2018-10-02,18:17:47,-0500,218197940,joby_jacob,ജോബി,,Dead man bound with chains around his feet found floating off the Flushing waterfront   https://t.co/Gjfdfr6bAF,en,[],['https://qns.com/story/2018/10/02/dead-man-bounded-chains-around-feet-found-floating-off-flushing-waterfront/'],[],0,0,0,[],[],https://twitter.com/joby_jacob/status/1047264409582784512,False,,0,,new york city,,,,,,[],,,,
1047263802486607873,1047262256931790850,2018-10-02 18:15:22 CDT,2018-10-02,18:15:22,-0500,212792524,seahoodie,🏳️‍⚧️ Cashmere Comrade 🇺🇦,,"@joeyarochokelly My favorite part is that the whole premise of that part is he's like ""I think u look like someone I know, maybe my dead ex?"" and she's just like lol u go to my strip club",en,[],[],[],1,0,1,[],[],https://twitter.com/seahoodie/status/1047263802486607873,False,,0,,new york city,,,,,,[],,,,
1047263085457752064,1047263085457752064,2018-10-02 18:12:31 CDT,2018-10-02,18:12:31,-0500,59374810,ratedrforrich,IT’S GIVIN’ RICH GUNCLE,"{'type': 'Point', 'coordinates': [40.73974615, -73.98440123]}","Got plans Thursday??! Come kick it with me and a few of my friends at @freehandmiami from 10P-1AM! —————————————————The Studio Social Club is a weekly, chill space created with creatives…  https://t.co/81dvxSrnua",en,[],['https://www.instagram.com/p/Boct3yGnuP_/?utm_source=ig_twitter_share&igshid=4c88q59fe5z8'],[],0,0,0,[],[],https://twitter.com/RatedRforRich/status/1047263085457752064,False,,0,,new york city,,,,,,[],,,,
1047262684272623616,1047262684272623616,2018-10-02 18:10:55 CDT,2018-10-02,18:10:55,-0500,116354137,bookswithahtiya,✨🧜🏾‍♀️BookinItWithAhtiya || YONCÉathon🐝👑,,"I tried to force a play idea yesterday (for a program I’m applying to) &amp; of course I came up with ideas I hated.   But after 24+ hours not thinking about this impending deadline, I’m realizing one of the ideas might not actually suck lol.  Is this...progress?",en,[],[],[],0,0,1,[],[],https://twitter.com/bookswithahtiya/status/1047262684272623616,False,,0,,new york city,,,,,,[],,,,
1047261655506341888,1047261655506341888,2018-10-02 18:06:50 CDT,2018-10-02,18:06:50,-0500,766278278952943616,kingdrob3,King Dev,,"Odd... but someone can physically abuse there wife, and only get a 4 game suspension? 🧐. Do better!",en,[],[],[],0,0,0,[],[],https://twitter.com/KingDrob3/status/1047261655506341888,False,https://twitter.com/brgridiron/status/1047237697952276480,0,,new york city,,,,,,[],,,,
1047260891018944513,1047260891018944513,2018-10-02 18:03:48 CDT,2018-10-02,18:03:48,-0500,1045751084,fsinani13,Balenci,,This professor dead just called this kid “Big bird” I’m so outta here ☠️☠️,en,[],[],[],0,0,5,[],[],https://twitter.com/fsinani13/status/1047260891018944513,False,,0,,new york city,,,,,,[],,,,
1047258606540918786,1047232691505188867,2018-10-02 17:54:43 CDT,2018-10-02,17:54:43,-0500,867151159,laurareagent,LAURA,,@davidvisentin1 What’s the alternative? Death?,en,[],[],[],0,0,2,[],[],https://twitter.com/lauraREAgent/status/1047258606540918786,False,,0,,new york city,,,,,,"[{'screen_name': 'davidvisentin1', 'name': 'David Visentin', 'id': '75037076'}]",,,,
1047258155682598913,1046915541007577090,2018-10-02 17:52:56 CDT,2018-10-02,17:52:56,-0500,957445533156519936,newyorkpogo,Pokemon Go NewYorkCity,,@ludoklack @DeadGuyPlays @NianticHelp @NianticLabs @PokemonGoApp It doesn't hurt to ask.  I would welcome one letter.  One crappy letter.,en,[],[],[],2,0,2,[],[],https://twitter.com/NewYorkPoGo/status/1047258155682598913,False,,0,,new york city,,,,,,"[{'screen_name': 'ludoklack', 'name': 'LudoKlack ❤🧡💛💚💙💜🖤', 'id': '764435623667130370'}, {'screen_name': 'DeadGuyPlays', 'name': 'DeadGuy Plays', 'id': '790955499059417089'}, {'screen_name': 'NianticHelp', 'name': 'Niantic Support', 'id': '849344094681870336'}, {'screen_name': 'NianticLabs', 'name': 'Niantic 🧭', 'id': '631577690'}, {'screen_name': 'PokemonGoApp', 'name': 'Pokémon GO', 'id': '2839430431'}]",,,,
1047258138104287232,1047245241802248192,2018-10-02 17:52:51 CDT,2018-10-02,17:52:51,-0500,380427127,amaliamayita,Mayita Mendez,,"@brittawolfrum On subway and watched man try to intimidate woman w/ angry stare, so aggressive. Stared at him and made eye contact til he looked away. After he left I sat next to her, she was almost in tears and said “I knew you had my back, thank god you were here.” Shit we deal w/ everyday",en,[],[],[],0,0,2,[],[],https://twitter.com/AmaliaMayita/status/1047258138104287232,False,,0,,new york city,,,,,,"[{'screen_name': 'brittawolfrum', 'name': 'britta wolfrum', 'id': '194385565'}]",,,,
