id,conversation_id,created_at,date,time,timezone,user_id,username,name,place,tweet,language,mentions,urls,photos,replies_count,retweets_count,likes_count,hashtags,cashtags,link,retweet,quote_url,video,thumbnail,near,geo,source,user_rt_id,user_rt,retweet_id,reply_to,retweet_date,translate,trans_src,trans_dest
1062490375942758400,1062490375942758400,2018-11-13 17:40:20 CST,2018-11-13,17:40:20,-0500,583146242,ms_scorpio1027,♏️✈️,,I don’t wanna get my gun license bcuz I promise I will use on mfz that gets on my nerves ✌🏼✌🏼,en,[],[],[],0,0,0,[],[],https://twitter.com/Ms_Scorpio1027/status/1062490375942758400,False,,0,,philadelphia,,,,,,[],,,,
1062485035129946113,1062440867120726017,2018-11-13 17:19:07 CST,2018-11-13,17:19:07,-0500,2945994771,robw521,Rob,,"@TuckerCell @DrDutchTweets @ForzaCorrado @fan_grumpy @SudsGlenside @Behindthechains @Ruin2day @jgaynor0730 @ChipReiderson I don’t listen to him.I see him as a blowhard who’s full of himself. It’s not a matter of him being “racist/reverse-racist”, it comes across as phony AF to me. I’ve worked with ppl from every community in the city for 40+ yrs, and I’d never act “brotha” to anyone. Ever. It’s BS.",en,[],[],[],1,1,3,[],[],https://twitter.com/RobW521/status/1062485035129946113,False,,0,,philadelphia,,,,,,"[{'screen_name': 'TuckerCell', 'name': 'DRAFT DEVIN WHITE', 'id': '54706548'}, {'screen_name': 'DrDutchTweets', 'name': 'Dr. (Redacted)', 'id': '799670714311774208'}, {'screen_name': 'ForzaCorrado', 'name': 'JCorrado', 'id': '784113080477347840'}, {'screen_name': 'fan_grumpy', 'name': 'grumpy_old_fan', 'id': '1396269927854530562'}, {'screen_name': 'SudsGlenside', 'name': 'Bonner', 'id': '990120367'}, {'screen_name': 'jgaynor0730', 'name': 'Jim', 'id': '449274873'}, {'screen_name': 'ChipReiderson', 'name': 'The (Redacted) Reiderson', 'id': '2937764498'}]",,,,
1062484670997237760,1062484670997237760,2018-11-13 17:17:40 CST,2018-11-13,17:17:40,-0500,24894213,penn,Penn,,"Another obstacle is implicit bias against women and stereotypes of masculinity. From 2012 to 2016, republican voters have become more willing to own sexist views.",en,[],[],[],1,1,3,[],[],https://twitter.com/Penn/status/1062484670997237760,False,,0,,philadelphia,,,,,,[],,,,
1062484158969270274,1062473945805393920,2018-11-13 17:15:38 CST,2018-11-13,17:15:38,-0500,785690572551966720,marciaarndt2,Marci,,@SafetyPinDaily @DysfunctFelines And doctors are restricted from talking to their patients about guns if they own one about gun safety if they have children it's a disgrace in this country,en,[],[],[],0,0,1,[],[],https://twitter.com/MarciaArndt2/status/1062484158969270274,False,,0,,philadelphia,,,,,,"[{'screen_name': 'SafetyPinDaily', 'name': 'SafetyPin-Daily', 'id': '449600949'}, {'screen_name': 'DysfunctFelines', 'name': 'DYSFUNCTIONAL FELINES ☎️202-224-3121', 'id': '4866930863'}]",,,,
1062483899991969793,1062483899991969793,2018-11-13 17:14:36 CST,2018-11-13,17:14:36,-0500,2473026932,bjewing2,bj  #BeKindToAnimals,,You misunderstood...I mean not hitting him but near him...I have used a bottle with all my cats..there is no harm,en,[],[],[],1,0,0,[],[],https://twitter.com/bjewing2/status/1062483899991969793,False,https://twitter.com/JoshKrugerPHL/status/1062479747152822272,0,,philadelphia,,,,,,[],,,,
1062482482011009026,1062482482011009026,2018-11-13 17:08:58 CST,2018-11-13,17:08:58,-0500,376151982,absinthefather,"greenville, sc tap water fan account",,"this was very fun to do!!! got to talk about why i love some of my favorite artists, a few of whom also happen to be my friends including @origamiangeldc, @queersandkevins, and @GleemerBand 💓  (also cw: sex/sexuality, domestic violence)",en,"[{'screen_name': 'origamiangeldc', 'name': ""it's @gamigang now:)"", 'id': '1135762668852305920'}, {'screen_name': 'queersandkevins', 'name': 'queer kevin', 'id': '1015782846970105857'}, {'screen_name': 'gleemerband', 'name': 'gleemer', 'id': '1632072751'}]",[],[],2,2,13,[],[],https://twitter.com/absinthefather/status/1062482482011009026,False,https://twitter.com/Doittumorrow/status/1062480352902610945,0,,philadelphia,,,,,,[],,,,
1062477617121632257,1062477617121632257,2018-11-13 16:49:38 CST,2018-11-13,16:49:38,-0500,774190671016198144,karanveerpannu,Karanveer S. Pannu,,"The Indian ambassador to the US pictured at the White House today celebrating Diwali with @realDonaldTrump does not represent me..   My faith reminds me to stand up against bigotry, racism, misogyny, etc... #sikhs #democrats #morals",en,"[{'screen_name': 'realdonaldtrump', 'name': 'donald j. trump', 'id': '25073877'}]",[],[],1,2,3,"['sikhs', 'democrats', 'morals']",[],https://twitter.com/KaranveerPannu/status/1062477617121632257,False,,0,,philadelphia,,,,,,[],,,,
1062477405821001728,1062477405821001728,2018-11-13 16:48:48 CST,2018-11-13,16:48:48,-0500,321370809,holdmyd_fense,Deadwing,,"“Ships from an alien source are approaching from the sky, radio contain has been attempted but cannot be established, instructions are to prepare for an attack from an unknown enemy”   HUUH!!!",en,[],[],[],1,0,0,[],[],https://twitter.com/holdmyD_fense/status/1062477405821001728,False,,0,,philadelphia,,,,,,[],,,,
1062476945693249536,1062470347566575616,2018-11-13 16:46:58 CST,2018-11-13,16:46:58,-0500,1483667844,billtruthfinder,Bill Fleisher,,"@jilevin Saturday night my wife and I were out for dinner. A guy at a nearby table starting loudly talking racist stuff. I said to my wife also loudly, ""Should I go just over and tell him to shut TFU?"" He heard me and did. Same thing. DW is a place to go to relax. Not listen to or see BS.",en,[],[],[],0,0,0,[],[],https://twitter.com/BillTruthfinder/status/1062476945693249536,False,,0,,philadelphia,,,,,,"[{'screen_name': 'jilevin', 'name': 'Jeffrey Levin 🇺🇦', 'id': '24733117'}]",,,,
1062476245475213312,1062374783910694912,2018-11-13 16:44:11 CST,2018-11-13,16:44:11,-0500,105525281,sonarman626,SonarMan,,"@HusaynPS @pond4cobb @PhilBryantMS classic what aboutism, Gov!  Do you know what a false Equivalence is?  You clearly are a racist and a white evangelical hypocrite! Heres a similar example. Have you stopped beating your wife?  Nobody’s talking about that! Do you see the trap?  #falseEQ",en,[],[],[],0,0,0,['falseeq'],[],https://twitter.com/Sonarman626/status/1062476245475213312,False,,0,,philadelphia,,,,,,"[{'screen_name': 'pond4cobb', 'name': 'That Chicken Guy', 'id': '2459931671'}]",,,,
1062470942088138752,1062049830262972424,2018-11-13 16:23:07 CST,2018-11-13,16:23:07,-0500,998293328318926849,ez1weeze1,ez1weeze,,@ApurvaYRawal That teacher could not have just asked the student to leave? The cops seem too extreme. Black folks don't fair too well when it comes to cops even in non violent situations.,en,[],[],[],0,0,0,[],[],https://twitter.com/ez1weeze1/status/1062470942088138752,False,,0,,philadelphia,,,,,,"[{'screen_name': 'ApurvaYRawal', 'name': 'Apurva Rawal', 'id': '334305385'}]",,,,
1062459913778159616,1060648741315653632,2018-11-13 15:39:17 CST,2018-11-13,15:39:17,-0500,28383764,harrysgrl94,HarrysGrl💙💚,,@esjedelaat @AnnieRouge @adamlambert Alot if not all of these mass shootings could've been min. The reason the shooters target these places is because they're known gun free zones. If some of the people legally allowed to carry were permitted to enter with their weapons they could've taken out the shooter min damage,en,[],[],[],0,0,0,[],[],https://twitter.com/harrysgrl94/status/1062459913778159616,False,,0,,philadelphia,,,,,,"[{'screen_name': 'esjedelaat', 'name': 'Esther de Laat', 'id': '34960447'}, {'screen_name': 'AnnieRouge', 'name': 'rougeannie024💚', 'id': '2876672775'}, {'screen_name': 'adamlambert', 'name': 'ADAM LAMBERT', 'id': '46576295'}]",,,,
1062459440023158787,1062409632675704835,2018-11-13 15:37:24 CST,2018-11-13,15:37:24,-0500,785690572551966720,marciaarndt2,Marci,,@safeagain1 @MFrance923 @johncusack Another racist for the Trump Administration,en,[],[],[],0,1,1,[],[],https://twitter.com/MarciaArndt2/status/1062459440023158787,False,,0,,philadelphia,,,,,,"[{'screen_name': 'safeagain1', 'name': 'TRUMP IS FASCISM -#TrumpOut2020', 'id': '797920536357720065'}, {'screen_name': 'MFrance923', 'name': 'VOTE BLUE 🇺🇸2022 🇺🇸', 'id': '242696283'}, {'screen_name': 'johncusack', 'name': 'John Cusack', 'id': '17017636'}]",,,,
1062458263931887617,1060648741315653632,2018-11-13 15:32:44 CST,2018-11-13,15:32:44,-0500,28383764,harrysgrl94,HarrysGrl💙💚,,@esjedelaat @AnnieRouge @adamlambert Just think if your country came under attack from terrorists if there was a weapon in e/o household the people would stand a chance defending themselves. You cant punish everyone for the mistakes of a few.,en,[],[],[],1,0,0,[],[],https://twitter.com/harrysgrl94/status/1062458263931887617,False,,0,,philadelphia,,,,,,"[{'screen_name': 'esjedelaat', 'name': 'Esther de Laat', 'id': '34960447'}, {'screen_name': 'AnnieRouge', 'name': 'rougeannie024💚', 'id': '2876672775'}, {'screen_name': 'adamlambert', 'name': 'ADAM LAMBERT', 'id': '46576295'}]",,,,
1062457758325321728,1062457758325321728,2018-11-13 15:30:43 CST,2018-11-13,15:30:43,-0500,3139457004,wifefoxx,Katrina🌊🌊🌊,,Sitting in the waiting room of Urgent Care.Took a friend who was having an anxiety attack that she thought was leading to a heart attack.I wanted to know how best to help. “It’s amazing how you can affect someone for the better by being a healthy mirror”  https://t.co/B1rMJRCNVb,en,[],['https://upliftconnect.com/8-things-not-to-say-to-someone-with-anxiety/'],[],1,0,0,[],[],https://twitter.com/Wifefoxx/status/1062457758325321728,False,,0,,philadelphia,,,,,,[],,,,
1062457169709293568,1060648741315653632,2018-11-13 15:28:23 CST,2018-11-13,15:28:23,-0500,28383764,harrysgrl94,HarrysGrl💙💚,,"@esjedelaat @AnnieRouge @adamlambert So yall are completely gun free. How do people hunt? What about the military or police? Are they also gun free or are you only referring to the gen pop? News flash, a gun of any kind can fall into a criminals hands. Which is why a person deserves the right to defend themselves.",en,[],[],[],1,0,0,[],[],https://twitter.com/harrysgrl94/status/1062457169709293568,False,,0,,philadelphia,,,,,,"[{'screen_name': 'esjedelaat', 'name': 'Esther de Laat', 'id': '34960447'}, {'screen_name': 'AnnieRouge', 'name': 'rougeannie024💚', 'id': '2876672775'}, {'screen_name': 'adamlambert', 'name': 'ADAM LAMBERT', 'id': '46576295'}]",,,,
1062456771854458886,1062061589753298944,2018-11-13 15:26:48 CST,2018-11-13,15:26:48,-0500,45731216,marionleary,Marion Leary MSN MPH RN (she/her) 🏳️‍🌈,,@theSTEMsquad @TScicommunity @SciComm I use #virtualreality and #augmentedreality to study bystander response for cardiac arrest and also to improve #CPR training and education. #techforgood,en,[],[],[],0,0,4,"['virtualreality', 'augmentedreality', 'cpr', 'techforgood']",[],https://twitter.com/marionleary/status/1062456771854458886,False,,0,,philadelphia,,,,,,"[{'screen_name': 'theSTEMsquad', 'name': 'The STEM Squad', 'id': '776682573401501696'}, {'screen_name': 'TScicommunity', 'name': 'The SciCommunity', 'id': '995323105571680256'}, {'screen_name': 'SciComm', 'name': 'ScienceCommunication', 'id': '37393217'}]",,,,
1062454355981418498,1062454355981418498,2018-11-13 15:17:12 CST,2018-11-13,15:17:12,-0500,345798491,mike_e_kaye,Mike Kaye,,TE Richard Rodgers is the #Eagles’ first player to receive a return designation on injured reserve. He has been cleared to practice.,en,[],[],[],0,1,3,['eagles'],[],https://twitter.com/mike_e_kaye/status/1062454355981418498,False,,0,,philadelphia,,,,,,[],,,,
1062451533017739266,1062451533017739266,2018-11-13 15:05:59 CST,2018-11-13,15:05:59,-0500,1249633410,lshphilly,Lutheran Settlement House,,Thank you @SenatorHaywood and @SenJudySchwank! Access to safe housing is so critical for victims of domestic violence.,en,"[{'screen_name': 'senatorhaywood', 'name': 'senator art haywood', 'id': '2894826527'}, {'screen_name': 'senjudyschwank', 'name': 'sen. judy schwank', 'id': '390800749'}]",[],[],0,0,3,[],[],https://twitter.com/LSHphilly/status/1062451533017739266,False,https://twitter.com/PCADVorg/status/1062450795352735744,0,,philadelphia,,,,,,[],,,,
1062447897961250821,1062447887156760577,2018-11-13 14:51:32 CST,2018-11-13,14:51:32,-0500,3291687077,4361a4be893d4c0,Pedro Dixon,,"Certifications are normally 135 for weapons other than fire arms. 235 for all weapons including fire arms. And 128.or 150 which gives Security Officers the State Power of Arrest. Police Officers needs today to work with all forms of law enforcement, putting their live in the line",en,[],[],[],1,0,0,[],[],https://twitter.com/4361a4be893d4c0/status/1062447897961250821,False,,0,,philadelphia,,,,,,[],,,,
