id,conversation_id,created_at,date,time,timezone,user_id,username,name,place,tweet,language,mentions,urls,photos,replies_count,retweets_count,likes_count,hashtags,cashtags,link,retweet,quote_url,video,thumbnail,near,geo,source,user_rt_id,user_rt,retweet_id,reply_to,retweet_date,translate,trans_src,trans_dest
979869423078055936,979867912969207808,2018-03-30 18:54:10 CDT,2018-03-30,18:54:10,-0500,2359352021,teach2progress,A.D.,,"It doesn’t matter whether a cell phone looks like a gun, it matters that a racist system put these cops in a position to open fire on a man in his grandmother’s backyard, shooting him 18x, shooting him dead, leaving a hole in his family, leaving his baby boys without a daddy.",en,[],[],[],1,0,1,[],[],https://twitter.com/Teach2Progress/status/979869423078055936,False,,0,,san diego,,,,,,[],,,,
979865707302207488,979865707302207488,2018-03-30 18:39:24 CDT,2018-03-30,18:39:24,-0500,52939158,jenijoy1,Jennifer Peterson,,Awesome game to kick off the 2018 season!  https://t.co/oc2ei87sMx,en,[],['https://twitter.com/brewers/status/979508557837041664'],[],0,0,0,[],[],https://twitter.com/Jenijoy1/status/979865707302207488,False,https://twitter.com/brewers/status/979508557837041664,0,,san diego,,,,,,[],,,,
979857051844145152,979566869878370310,2018-03-30 18:05:00 CDT,2018-03-30,18:05:00,-0500,419779987,ironmnsar69,Jeff,,@davidhogg111 @IngrahamAngle Aww did little snowflake David get his feelings hurt.  Wanna be an man then take the criticism like a man.  Why did you post your college non acceptance if you didn't want people talking about it?,en,[],[],[],0,0,0,[],[],https://twitter.com/ironmnsar69/status/979857051844145152,False,,0,,san diego,,,,,,"[{'screen_name': 'davidhogg111', 'name': 'David Hogg 🌻', 'id': '1915033663'}, {'screen_name': 'IngrahamAngle', 'name': 'Laura Ingraham', 'id': '50769180'}]",,,,
979855680227061760,979855680227061760,2018-03-30 17:59:33 CDT,2018-03-30,17:59:33,-0500,1676647800,pastelwife,pastel ♡,,Never let the person that hurt you make you miss out on someone that wants to love you.,en,[],[],[],2,51,159,[],[],https://twitter.com/pastelwife/status/979855680227061760,False,,0,,san diego,,,,,,[],,,,
979850807284674560,979850807284674560,2018-03-30 17:40:11 CDT,2018-03-30,17:40:11,-0500,835978597047271424,barbaramain07,Barbara Main 🌻,,So what’s the difference of them in pictures of brutality killed animals that face extinction 🤔  https://t.co/1dz523xpXZ,en,[],['https://twitter.com/foxfriendsfirst/status/979249808056770560'],[],5,0,7,[],[],https://twitter.com/BarbaraMain07/status/979850807284674560,False,https://twitter.com/foxfriendsfirst/status/979249808056770560,0,,san diego,,,,,,[],,,,
979849710868553728,979849710868553728,2018-03-30 17:35:50 CDT,2018-03-30,17:35:50,-0500,18247597,fox5sandiego,FOX 5 San Diego,"{'type': 'Point', 'coordinates': [32.686662, -117.105934]}",Arrest made in deadly South Bay shooting  https://t.co/jQD8nOJcTj,en,[],['http://bit.ly/2pOuU2b'],[],0,1,3,[],[],https://twitter.com/fox5sandiego/status/979849710868553728,False,,0,,san diego,,,,,,[],,,,
979849029918982144,979797744138227712,2018-03-30 17:33:08 CDT,2018-03-30,17:33:08,-0500,159537262,whereismybeer3,Melinda Hooker,,@LeoredhookBKLYN @JoyAnnReid @raye8405 I tried not to comment on the assassination of #StephenClark because I’m sick and tired and being tired. But I want someone to tell me when breaking windows or stealing or any other non-violent crime warrants a fucking death sentence. America wake up the Stasi is here.,en,[],[],[],0,0,1,['stephenclark'],[],https://twitter.com/whereismybeer3/status/979849029918982144,False,,0,,san diego,,,,,,"[{'screen_name': 'JoyAnnReid', 'name': 'Joy-Ann (Pro-Democracy) Reid 😷', 'id': '49698134'}, {'screen_name': 'raye8405', 'name': 'Renee Rousseau', 'id': '62848722'}]",,,,
979843196493574144,979843196493574144,2018-03-30 17:09:57 CDT,2018-03-30,17:09:57,-0500,135895353,teezytaughtyou_,Chantel,,"Let that hurt go, king.",en,[],[],[],0,0,1,[],[],https://twitter.com/teezytaughtyou_/status/979843196493574144,False,,0,,san diego,,,,,,[],,,,
979836235836305408,979836235836305408,2018-03-30 16:42:17 CDT,2018-03-30,16:42:17,-0500,601198929,bryce_a_miller,Bryce Miller,,The trainer and his horse remained side by side during the deadly Lilac Fire. So it’s no surprise they’re side by side now.  https://t.co/RcvE0m4E2U @DelMarRacing,en,"[{'screen_name': 'delmarracing', 'name': 'del mar racetrack', 'id': '22168739'}]",['https://bit.ly/2E8qzei'],[],2,12,43,[],[],https://twitter.com/Bryce_A_Miller/status/979836235836305408,False,,0,,san diego,,,,,,[],,,,
979826373702443009,979826373702443009,2018-03-30 16:03:06 CDT,2018-03-30,16:03:06,-0500,152817122,needmoregusto,Carl Gustafson,"{'type': 'Point', 'coordinates': [32.71359584, -117.16016754]}",Bloody Mary with a grilled cheese on it?? Hell yes. @ Cafe 21…  https://t.co/0Y9G0ADkdn,en,[],['https://www.instagram.com/p/Bg9jNcDABQsIjxq63VI4sno_Bvgtg215bBZ4480/'],[],0,0,0,[],[],https://twitter.com/needmoregusto/status/979826373702443009,False,,0,,san diego,,,,,,[],,,,
979825462502334464,979103004153597954,2018-03-30 15:59:29 CDT,2018-03-30,15:59:29,-0500,47276926,rahorakhty,Kitty Hetheriton,,"@neverknowbest_ @FemaleMigo the mom did the girls hair for her birthday, she and her husband aren't together, they are getting a divorce, she was visiting her dad for the weekend, the ex's girlfriend held her as the dad cut her hair, so yes the mother is treating it as an assault, that's not right",en,[],[],[],0,0,0,[],[],https://twitter.com/RaHorakhty/status/979825462502334464,False,,0,,san diego,,,,,,"[{'screen_name': 'NeverKnowBest_', 'name': 'Melly Gibbs', 'id': '604753138'}]",,,,
979821052988571651,979426502088544256,2018-03-30 15:41:57 CDT,2018-03-30,15:41:57,-0500,711007492038201345,luzenlafrontera,Nicole Elizabeth Ramos #BurnItAllDown - views mine,,@ScooteHung @StephGrisham45 @FLOTUS @StMarysMC @CBP @ICEgov Chivalry is not dead. I am certain that she appreciates the valiant gesture.,en,[],[],[],1,0,0,[],[],https://twitter.com/luzenlafrontera/status/979821052988571651,False,,0,,san diego,,,,,,"[{'screen_name': 'ScooteHung', 'name': 'Hung Daddy', 'id': '3380519409'}, {'screen_name': 'StephGrisham45', 'name': 'Stephanie Grisham 45 Archived', 'id': '823638938590085124'}, {'screen_name': 'FLOTUS', 'name': 'Jill Biden', 'id': '1349154719386775552'}, {'screen_name': 'StMarysMC', 'name': ""St.Mary's Med Center"", 'id': '160669592'}, {'screen_name': 'CBP', 'name': 'CBP', 'id': '16613128'}, {'screen_name': 'ICEgov', 'name': 'ICE', 'id': '39384517'}]",,,,
979820906691219456,979820906691219456,2018-03-30 15:41:23 CDT,2018-03-30,15:41:23,-0500,973075416,la_ramrz,litzy,,The Fresh Prince of Bel-Air is on @netflix in Mexico but not in the US and I’m truly hurt,en,"[{'screen_name': 'netflix', 'name': 'netflix', 'id': '16573941'}]",[],[],1,0,3,[],[],https://twitter.com/la_ramrz/status/979820906691219456,False,,0,,san diego,,,,,,[],,,,
979819148984295425,979757974133657601,2018-03-30 15:34:23 CDT,2018-03-30,15:34:23,-0500,2147958649,d_figuer,Daphne Figueroa,,@05dd082f65984a2 My heart is heavy.  I lost my cousin to suicide 2 years ago  and a dear friend of my husband’s just a few months ago.  Depression is in our family and I am determined to be a survivor.  It is a lifelong struggle and I am so very sorry that your nephew lost his battle. 😢🌹,en,[],[],[],1,0,2,[],[],https://twitter.com/d_figuer/status/979819148984295425,False,,0,,san diego,,,,,,[],,,,
979815145042948097,979815145042948097,2018-03-30 15:18:29 CDT,2018-03-30,15:18:29,-0500,456971292,kendracinnamon,‎ Kenchis,,This is such bs omg. I hope you find better and continue to kick ass  https://t.co/0xIA35GXAB,en,[],['https://twitter.com/manduhmia/status/979552096293871617'],[],0,0,2,[],[],https://twitter.com/kendracinnamon/status/979815145042948097,False,https://twitter.com/manduhmia/status/979552096293871617,0,,san diego,,,,,,[],,,,
979813893869527040,979813677070102528,2018-03-30 15:13:31 CDT,2018-03-30,15:13:31,-0500,14598491,animecwboy,Justin Greene,,Doing my best to force some way to get this working with @IFTTT and Google Home.,en,"[{'screen_name': 'ifttt', 'name': 'ifttt', 'id': '75079616'}]",[],[],0,0,0,[],[],https://twitter.com/AnimeCwboy/status/979813893869527040,False,,0,,san diego,,,,,,[],,,,
979809277324836864,979809277324836864,2018-03-30 14:55:10 CDT,2018-03-30,14:55:10,-0500,1163377976,eroweedu,Eric Alan Rowe,,Closing Keynote with Jeff Duncan-Andrade at Deeper Learning 2018.   Three forms of HOPE to combat the unrelenting toxic stress of this world. Are we ready to handle the truth of our wounded children and love them through their pain.  Teaching as an act of love and hope.,en,[],[],[],0,0,2,[],[],https://twitter.com/eroweedu/status/979809277324836864,False,,0,,san diego,,,,,,[],,,,
979806129893998594,979799192938958852,2018-03-30 14:42:39 CDT,2018-03-30,14:42:39,-0500,869154817,savtah8,(((savtah8)) JINO #JewsByInsemination,,"@haaretzcom @AaronMagid IN PEACEFUL DEMONSTRATION , NO ONE GETS HURT.",en,[],[],[],1,0,0,[],[],https://twitter.com/savtah8/status/979806129893998594,False,,0,,san diego,,,,,,"[{'screen_name': 'haaretzcom', 'name': 'Haaretz.com', 'id': '24506246'}, {'screen_name': 'AaronMagid', 'name': 'Aaron Magid', 'id': '934602547'}]",,,,
979805547384881152,979802012375289857,2018-03-30 14:40:21 CDT,2018-03-30,14:40:21,-0500,18401584,iseeyoumotel6,#Motel6 Killed My Dog 🐾,,"@riotwomennn @LibertyMutual @IngrahamAngle So, what about @SandalsResorts? Seems they are holding fast to bully #LauraIngraham   Until #Sandals pulls advertising, it’s new slogan will be “Alt-right, Alt the Time.”  https://t.co/xZxbmEldc1",en,"[{'screen_name': 'sandalsresorts', 'name': 'sandals resorts', 'id': '16831165'}]",[],['https://pbs.twimg.com/media/DZj37neU8AAfzwY.jpg'],1,0,0,"['lauraingraham', 'sandals']",[],https://twitter.com/ISeeYouMotel6/status/979805547384881152,False,,1,https://pbs.twimg.com/media/DZj37neU8AAfzwY.jpg,san diego,,,,,,"[{'screen_name': 'riotwomennn', 'name': '☇RiotWomenn☇', 'id': '16721452'}, {'screen_name': 'LibertyMutual', 'name': 'Liberty Mutual', 'id': '1707305418'}, {'screen_name': 'IngrahamAngle', 'name': 'Laura Ingraham', 'id': '50769180'}]",,,,
979801082703441920,979801082703441920,2018-03-30 14:22:36 CDT,2018-03-30,14:22:36,-0500,2525455892,emorydominique,em🦷,,anything I do today feels guilty because Jesus is DYING. And anything I do tomorrow just feels wrong bc that dude will be DEAD,en,[],[],[],0,1,11,[],[],https://twitter.com/emorydominique/status/979801082703441920,False,,0,,san diego,,,,,,[],,,,
