id,conversation_id,created_at,date,time,timezone,user_id,username,name,place,tweet,language,mentions,urls,photos,replies_count,retweets_count,likes_count,hashtags,cashtags,link,retweet,quote_url,video,thumbnail,near,geo,source,user_rt_id,user_rt,retweet_id,reply_to,retweet_date,translate,trans_src,trans_dest
955225840572276736,955225840572276736,2018-01-21 17:49:22 CST,2018-01-21,17:49:22,-0500,2915103600,ronaldblain12,Ronald Blain™️,,Yo I’m dead 😂😂😂  https://t.co/KdiV7O4dtJ,en,[],['https://twitter.com/mastertes/status/954780250239533056'],[],0,0,0,[],[],https://twitter.com/RonaldBlain12/status/955225840572276736,False,https://twitter.com/mastertes/status/954780250239533056,0,,san diego,,,,,,[],,,,
955222875149127680,955208881893933057,2018-01-21 17:37:35 CST,2018-01-21,17:37:35,-0500,4760765953,stevenbroberson,Acai Bowl,,"@getnickwright Oh ya ..... everyone talkin about the Jags defense , what about the Patriots offense ......",en,[],[],[],0,0,0,[],[],https://twitter.com/StevenBRoberson/status/955222875149127680,False,,0,,san diego,,,,,,"[{'screen_name': 'getnickwright', 'name': 'nick wright', 'id': '93129160'}]",,,,
955220718827929600,955219950972502016,2018-01-21 17:29:01 CST,2018-01-21,17:29:01,-0500,770990968724041728,jack__w__,Jack W,,"@da_squatch0418 Exactly why you have to force him to do so. Everyone was praising him last week for a high completion %, but he threw it more than 10 yards down the field 5 times and it was almost picked twice. Dink and dunk all day.",en,[],[],[],1,0,1,[],[],https://twitter.com/Jack__W__/status/955220718827929600,False,,0,,san diego,,,,,,[],,,,
955218994843107330,955218994843107330,2018-01-21 17:22:10 CST,2018-01-21,17:22:10,-0500,3653414774,sdaheatwave,Alan Hernandez,,@dead_nd_buried just curious but did you enjoy the text i sent you? 🤔🤔,en,[],[],[],0,0,0,[],[],https://twitter.com/sdaheatwave/status/955218994843107330,False,,0,,san diego,,,,,,[],,,,
955218254678573056,955218254678573056,2018-01-21 17:19:13 CST,2018-01-21,17:19:13,-0500,2543896994,browniewell,Ryan Brownewell,,"Death, taxes, and Tom Brady completing the comeback.",en,[],[],[],0,1,3,[],[],https://twitter.com/browniewell/status/955218254678573056,False,,0,,san diego,,,,,,[],,,,
955218139045797888,954878124214415360,2018-01-21 17:18:46 CST,2018-01-21,17:18:46,-0500,33110211,twingrammya,Antoinette Hille,,"@realDonaldTrump Your interpretation of getting rid of unnecessary regulation. Has only helped corporations. It has hurt the environment, America’s health, global warming, our waterways... the negative impact of your getting rid of regulations hurts Americans. All you care about is yourself &amp; $!",en,[],[],[],0,0,0,[],[],https://twitter.com/Twingrammya/status/955218139045797888,False,,0,,san diego,,,,,,"[{'screen_name': 'realDonaldTrump', 'name': 'Donald J. Trump', 'id': '25073877'}]",,,,
955217841648619520,955217841648619520,2018-01-21 17:17:35 CST,2018-01-21,17:17:35,-0500,39045004,flourishordie,Dom.,,"Big facts &amp; Jax was still up 10 in the 4th. Just gotta close that deal, prevent offense = L every time smh.  https://t.co/98MLXoJOpC",en,[],['https://twitter.com/ericrayweather/status/955216619499859971'],[],0,1,0,[],[],https://twitter.com/FlourishOrDie/status/955217841648619520,False,https://twitter.com/ericrayweather/status/955216619499859971,0,,san diego,,,,,,[],,,,
955215665702477824,955214448310046720,2018-01-21 17:08:56 CST,2018-01-21,17:08:56,-0500,486117271,sdfritz,Fritz,,@DavidAltonDodd 'Twas their 2nd half offense.,en,[],[],[],0,0,0,[],[],https://twitter.com/SDFritz/status/955215665702477824,False,,0,,san diego,,,,,,"[{'screen_name': 'DavidAltonDodd', 'name': 'David Alton Dodd', 'id': '61594311'}]",,,,
955214333499158528,955214333499158528,2018-01-21 17:03:38 CST,2018-01-21,17:03:38,-0500,32334742,mcbainsgoggles,Trevor,,"Philip Rivers should hold out and force a trade to Jacksonville, that way I can become a Jaguars fan and Phil can win himself a super bowl",en,[],[],[],0,1,2,[],[],https://twitter.com/McBainsGoggles/status/955214333499158528,False,,0,,san diego,,,,,,[],,,,
955213990648414209,955213990648414209,2018-01-21 17:02:17 CST,2018-01-21,17:02:17,-0500,37854655,sourpatchpar3nt,🌸Gabe is back in the grind,,God is dead.,en,[],[],[],0,0,1,[],[],https://twitter.com/SourPatchPar3nt/status/955213990648414209,False,,0,,san diego,,,,,,[],,,,
955211785388285952,955211785388285952,2018-01-21 16:53:31 CST,2018-01-21,16:53:31,-0500,835978597047271424,barbaramain07,Barbara Main 🌻,,We move on as we are a force to not be taken seriously 🤔 #PowerToThePolls #BlueWave2018  https://t.co/p8mk4W2tqF,en,[],['https://twitter.com/nanamof5/status/955210203489820672'],[],0,0,0,"['powertothepolls', 'bluewave2018']",[],https://twitter.com/BarbaraMain07/status/955211785388285952,False,https://twitter.com/nanamof5/status/955210203489820672,0,,san diego,,,,,,[],,,,
955210545707106307,954899334079832064,2018-01-21 16:48:35 CST,2018-01-21,16:48:35,-0500,461719953,matteosandiego,Matteo,,@jlahaye76 They’ve never been blown out in these conference games. When they are clicking on all 4’s they are deadly. Its still a long season. You coming out to Vegas for the tourney?,en,[],[],[],1,0,1,[],[],https://twitter.com/MatteoSanDiego/status/955210545707106307,False,,0,,san diego,,,,,,"[{'screen_name': 'jlahaye76', 'name': 'Rebar619', 'id': '188425472'}]",,,,
955209042414133248,955204616341385216,2018-01-21 16:42:37 CST,2018-01-21,16:42:37,-0500,47701213,lyka2000,Quetzelcoatl Jones,,"@KBAndersen @POTUS Well, we can be certain that at least 18% of those polled are brain dead Imbeciles.",en,[],[],[],0,0,0,[],[],https://twitter.com/lyka2000/status/955209042414133248,False,,0,,san diego,,,,,,"[{'screen_name': 'KBAndersen', 'name': 'Kurt Andersen', 'id': '16855888'}, {'screen_name': 'POTUS', 'name': 'President Biden', 'id': '1349149096909668363'}]",,,,
955206589253742592,955206589253742592,2018-01-21 16:32:52 CST,2018-01-21,16:32:52,-0500,2935885962,bameronballer,Cameron with a B,,I swear dola is awful or hurt in the regular season but in the playoffs he plays like hes a top 10 WR,en,[],[],[],0,0,0,[],[],https://twitter.com/BameronBaller/status/955206589253742592,False,,0,,san diego,,,,,,[],,,,
955206529338114048,955206529338114048,2018-01-21 16:32:38 CST,2018-01-21,16:32:38,-0500,2421484710,dianteleefb,Diante Lee,,The Death Star is looming....,en,[],[],[],0,0,3,[],[],https://twitter.com/DianteLeeFB/status/955206529338114048,False,,0,,san diego,,,,,,[],,,,
955201100558184448,955201100558184448,2018-01-21 16:11:03 CST,2018-01-21,16:11:03,-0500,704696823001124864,christie_d22,Christie,,This #jaguars offense tho 👀,en,[],[],[],0,0,4,['jaguars'],[],https://twitter.com/Christie_D22/status/955201100558184448,False,,0,,san diego,,,,,,[],,,,
955199091541123072,955199091541123072,2018-01-21 16:03:04 CST,2018-01-21,16:03:04,-0500,67141122,melodycgreen,𝙼𝙴𝙻𝙾𝙳𝚈,,"Hurt me once, shame on you. Hurt me twice shame on me. Hurt me 3 times... I must be a fucking idiot.",en,[],[],[],1,0,0,[],[],https://twitter.com/melodycgreen/status/955199091541123072,False,,0,,san diego,,,,,,[],,,,
955196828135272448,955196828135272448,2018-01-21 15:54:05 CST,2018-01-21,15:54:05,-0500,403837532,taylortexas1994,Scott elder TNF 🏀,,Pats got white boy playmakers all over the field on offense lol,en,[],[],[],0,0,0,[],[],https://twitter.com/taylortexas1994/status/955196828135272448,False,,0,,san diego,,,,,,[],,,,
955192271221219328,955192271221219328,2018-01-21 15:35:58 CST,2018-01-21,15:35:58,-0500,569407131,mainelykeating,Keating Bartlett,"{'type': 'Point', 'coordinates': [32.7153, -117.156]}",Bloody Mary in hand and ready for the second half of the game! Let’s go Pats! . . . . #halftime…  https://t.co/vMK4eUXXaO,en,[],['https://www.instagram.com/p/BeOhAeynIDH/'],[],0,0,0,['halftime'],[],https://twitter.com/mainelykeating/status/955192271221219328,False,,0,,san diego,,,,,,[],,,,
955188196463161344,955188196463161344,2018-01-21 15:19:47 CST,2018-01-21,15:19:47,-0500,221563766,evilgreenrangr,BAEBEL🥊🇲🇽,,That better be PI on offense!!!,en,[],[],[],0,0,0,[],[],https://twitter.com/EvilGreenRangr/status/955188196463161344,False,,0,,san diego,,,,,,[],,,,
955183575812337664,955183575812337664,2018-01-21 15:01:25 CST,2018-01-21,15:01:25,-0500,1004811571,chicora8,Chicora Martin,,Ready to kick off #Manicur18,en,[],[],[],0,0,5,['manicur18'],[],https://twitter.com/Chicora8/status/955183575812337664,False,,0,,san diego,,,,,,[],,,,
955182047970041856,955182047970041856,2018-01-21 14:55:21 CST,2018-01-21,14:55:21,-0500,61519488,dmorton78,Dan,,Wow. This is awesome. NE getting punched in face.,en,[],[],[],1,0,4,[],[],https://twitter.com/DMorton78/status/955182047970041856,False,,0,,san diego,,,,,,[],,,,
955181019191115776,955181019191115776,2018-01-21 14:51:16 CST,2018-01-21,14:51:16,-0500,68081225,breequila,it girl,,I always put a little bit of chili flakes in my eggs for a little KICK  https://t.co/0dDtGF7DVd,en,[],[],['https://pbs.twimg.com/tweet_video_thumb/DUF8EdRVwAAfaQR.jpg'],0,0,0,[],[],https://twitter.com/Breequila/status/955181019191115776,False,,1,https://pbs.twimg.com/tweet_video_thumb/DUF8EdRVwAAfaQR.jpg,san diego,,,,,,[],,,,
955173440004145152,955173440004145152,2018-01-21 14:21:09 CST,2018-01-21,14:21:09,-0500,2891700313,rozzdawggg,✨✨,,Be fucking nice. It’s doesn’t hurt. I promise.,en,[],[],[],0,0,0,[],[],https://twitter.com/rozzdawggg/status/955173440004145152,False,,0,,san diego,,,,,,[],,,,
955171350242508806,839536166865010688,2018-01-21 14:12:50 CST,2018-01-21,14:12:50,-0500,2629489590,higginsgggg,NEO-EXPOSINGTRUTH,,"MAJOR BREAKING NEWS!! Global Targeting/""Aggressive Remote Control"" of EVERYONE Uncovered--Implanted Devices, Human ""Wetware,"" Weaponized &amp; Stolen Patents, Big Electronics companies involved. Note, IMPLANTS at core! Meet Big Brother  https://t.co/O7zj6DS6CA  https://t.co/M3twz7orFJ  https://t.co/m5MZeiWPtd",en,[],"['https://youtu.be/PIIbqNQj8Is', 'https://patriots4truth.org/2018/01/12/how-they-plan-to-control-everything-in-your-life/']",['https://pbs.twimg.com/media/DUFzRE9UMAArtsA.jpg'],1,4,2,[],[],https://twitter.com/higginsgggg/status/955171350242508806,False,,1,https://pbs.twimg.com/media/DUFzRE9UMAArtsA.jpg,san diego,,,,,,[],,,,
955168009403883520,955167555546619904,2018-01-21 13:59:34 CST,2018-01-21,13:59:34,-0500,1252702310,theenforcerv3,Vlad The Enforcer,,@joshknighttt I think it was all marketing. Especially with his wife holding up the knife to his throat . Just marketing shit,en,[],[],[],1,0,0,[],[],https://twitter.com/theenforcerV3/status/955168009403883520,False,,0,,san diego,,,,,,"[{'screen_name': 'joshknighttt', 'name': 'Joshua Knight', 'id': '261318671'}]",,,,
955167946610950144,955167946610950144,2018-01-21 13:59:19 CST,2018-01-21,13:59:19,-0500,1120788770,mikenzi_walker,Ⓜ️ETRO Ⓜ️IK,,cause hurt cause i been hurt before. love don’t live here anymore 💔,en,[],[],[],0,0,0,[],[],https://twitter.com/mikenzi_walker/status/955167946610950144,False,,0,,san diego,,,,,,[],,,,
955167110920945664,953987636057821184,2018-01-21 13:56:00 CST,2018-01-21,13:56:00,-0500,313571603,katefangman,Kate Fangman,,@realDonaldTrump Wasn't it Claire McCaskill (D-MO) who introduced measure to give pay and death benefits to the military during shut down? Why did Mitch McConnell (R-KY) block it?,en,[],[],[],1,0,0,[],[],https://twitter.com/KateFangman/status/955167110920945664,False,,0,,san diego,,,,,,"[{'screen_name': 'realDonaldTrump', 'name': 'Donald J. Trump', 'id': '25073877'}]",,,,
955163535268433920,955162716108341249,2018-01-21 13:41:47 CST,2018-01-21,13:41:47,-0500,206560051,shawnpwalchef,Shawn Walchef,,"@TheFifthPofmkt Better talking about death when family is alive then the alternative. Uncomfortable conversations equal resolution, understanding and growth. Proud of you.",en,[],[],[],0,0,2,[],[],https://twitter.com/shawnpwalchef/status/955163535268433920,False,,0,,san diego,,,,,,[],,,,
955162603893932032,955162603893932032,2018-01-21 13:38:05 CST,2018-01-21,13:38:05,-0500,237391285,roy_papii,Money Man Roy💸,,Boy them shit dead good😭  https://t.co/a6FOArptgK,en,[],['https://twitter.com/courtneehendrix/status/954559673109237761'],[],0,4,0,[],[],https://twitter.com/Roy_Papii/status/955162603893932032,False,https://twitter.com/courtneehendrix/status/954559673109237761,0,,san diego,,,,,,[],,,,
955161751875502080,955161751875502080,2018-01-21 13:34:42 CST,2018-01-21,13:34:42,-0500,902964882,melissajladner,MeGwacie mini Schnauzarina EXTRODINAIRE ‼️,,"#jodiarias.. I am so happy 🤣 she got LIFE without parole!  Cuz each day she sits, is absolutely miserable &amp; torturous!  Exactly what she did to Travis Alexander!”  “Death” would of been way to easy.  TRAVIS ALEXANDER 😇, remember him!  He did not deserve to be murdered!",en,[],[],[],1,0,6,['jodiarias'],[],https://twitter.com/MelissaJLadner/status/955161751875502080,False,,0,,san diego,,,,,,[],,,,
955159769584562176,955159769584562176,2018-01-21 13:26:49 CST,2018-01-21,13:26:49,-0500,158137693,deadly_embrace,Libby MonStar,"{'type': 'Point', 'coordinates': [32.7153, -117.156]}",#plantsofinstagram #plantfriends #prettyflowers #pretty #life #love #grow #growth #nature…  https://t.co/FxPdKmirb2,und,[],['https://www.instagram.com/p/BeOSOjeB_wa/'],[],0,0,0,"['plantsofinstagram', 'plantfriends', 'prettyflowers', 'pretty', 'life', 'love', 'grow', 'growth', 'nature']",[],https://twitter.com/deadly_embrace/status/955159769584562176,False,,0,,san diego,,,,,,[],,,,
955158193100832768,955158193100832768,2018-01-21 13:20:33 CST,2018-01-21,13:20:33,-0500,702576431952322560,sarahjansky,Sarah Jansky,,Why do I feel like Brady’s “hurt hand” might be nothing more than a conspiracy created by the Patriots &amp; he’s actually completely fine lol #FakeNews,en,[],[],[],0,0,3,['fakenews'],[],https://twitter.com/SarahJansky/status/955158193100832768,False,,0,,san diego,,,,,,[],,,,
955156238911782912,955146303004065793,2018-01-21 13:12:47 CST,2018-01-21,13:12:47,-0500,768022268,kyleschmid_,Kyle Schmid,,"@DasShiner @ReginaldRegency @pedershk @RealPatriot1976 @LillyLeon @NancyPelosi Whenever someone says facts don’t care about feelings, it’s clear they got their feelings hurt by actual facts.",en,[],[],[],0,0,0,[],[],https://twitter.com/kyleschmid_/status/955156238911782912,False,,0,,san diego,,,,,,"[{'screen_name': 'DasShiner', 'name': 'Matt', 'id': '728006647319158785'}, {'screen_name': 'pedershk', 'name': 'pedershk', 'id': '1044911176574889984'}, {'screen_name': 'RealPatriot1976', 'name': 'American Patriot', 'id': '915303951125196800'}, {'screen_name': 'LillyLeon', 'name': 'LillyLeon', 'id': '1101544017903394816'}]",,,,
955153537742266368,955146339943268352,2018-01-21 13:02:03 CST,2018-01-21,13:02:03,-0500,2421484710,dianteleefb,Diante Lee,,"@BrendanLeister @alltwentytwo The shallow crosser stuff is the only new ""wrinkle"". I'd probably argue that the offense has actually devolved over time.",en,[],[],[],0,0,0,[],[],https://twitter.com/DianteLeeFB/status/955153537742266368,False,,0,,san diego,,,,,,"[{'screen_name': 'BrendanLeister', 'name': 'Brendan Leister', 'id': '42826418'}, {'screen_name': 'alltwentytwo', 'name': 'PFF', 'id': '1959173222'}]",,,,
955152088782184448,955149526024667136,2018-01-21 12:56:18 CST,2018-01-21,12:56:18,-0500,891798014628474880,sneekpeeks,🖤AngryBoi🖤,,"@ItsZombae My manager handed me a bottle of sake last night and says ""who hurt you?"" I was dying haha",en,[],[],[],1,1,1,[],[],https://twitter.com/SneekPeeks/status/955152088782184448,False,,0,,san diego,,,,,,"[{'screen_name': 'ItsZombae', 'name': 'ZOMBAE🍻', 'id': '2672491362'}]",,,,
955149515140431872,955149515140431872,2018-01-21 12:46:04 CST,2018-01-21,12:46:04,-0500,39919568,kyleaye0,k¥,,Drank Hennessy after the tequila last night and wound up missin,en,[],[],[],0,1,2,[],[],https://twitter.com/KyleAye0/status/955149515140431872,False,,0,,san diego,,,,,,[],,,,
955148892810633216,955148892810633216,2018-01-21 12:43:36 CST,2018-01-21,12:43:36,-0500,2421484710,dianteleefb,Diante Lee,,I'm officially a West coast offense disciple.,en,[],[],[],1,0,14,[],[],https://twitter.com/DianteLeeFB/status/955148892810633216,False,,0,,san diego,,,,,,[],,,,
955147245564801024,955147245564801024,2018-01-21 12:37:03 CST,2018-01-21,12:37:03,-0500,413232367,camprunamuttpl,Camp Run-A-Mutt PL,,"Looking for love, or a really good Bloody Mary? We're teaming up with @ZoesDogTraining to raise money for @2ndChanceDog on Feb 11th. Don't miss this pooch party! See you at @BubsBallpark !  https://t.co/inig76glnO",en,"[{'screen_name': 'zoesdogtraining', 'name': ""zoe's dog training"", 'id': '4750825214'}, {'screen_name': '2ndchancedog', 'name': 'secondchancedog', 'id': '35692690'}, {'screen_name': 'bubsballpark', 'name': ""bub's @ the ballpark"", 'id': '186594704'}]",[],['https://pbs.twimg.com/media/DUFdWS5VQAAHH0M.jpg'],0,0,2,[],[],https://twitter.com/CampRunAMuttPL/status/955147245564801024,False,,1,https://pbs.twimg.com/media/DUFdWS5VQAAHH0M.jpg,san diego,,,,,,[],,,,
955146339943268352,955146339943268352,2018-01-21 12:33:27 CST,2018-01-21,12:33:27,-0500,2421484710,dianteleefb,Diante Lee,,So smash mouth spread in Tennessee with Derrick Henry ain't the worst idea. The Vertical play action game and Shallow cross &amp; Sprintout base passes ain't either... but there's not a whole lot more to that Meyer offense.  https://t.co/ljAhudj5R1,en,[],['https://twitter.com/adamschefter/status/955097936563761153'],[],1,2,1,[],[],https://twitter.com/DianteLeeFB/status/955146339943268352,False,https://twitter.com/adamschefter/status/955097936563761153,0,,san diego,,,,,,[],,,,
955145466466861057,955145466466861057,2018-01-21 12:29:59 CST,2018-01-21,12:29:59,-0500,55784823,mmrisss,RISS AGAINST THE MACHINE✩,,"Ignorant &amp; uneducated. Pit bulls were once considered the perfect “nanny dog” bc of its friendly nature, loyalty and stability. The “vicious” dogs are a result of abuse&amp; torture of criminal owners bc they believe this BULLSHIT NARRATIVE  https://t.co/Qim41Ns5Of",en,[],['https://twitter.com/dogbitelaw/status/954211802912641024'],[],0,2,2,[],[],https://twitter.com/mmrisss/status/955145466466861057,False,https://twitter.com/dogbitelaw/status/954211802912641024,0,,san diego,,,,,,[],,,,
955144789653045254,955143458125176835,2018-01-21 12:27:18 CST,2018-01-21,12:27:18,-0500,47701213,lyka2000,Quetzelcoatl Jones,,"@dat_Matt_tho Nope.  The point to the ""movement"" is to focus on genitals.  Abuse of power makes victims out of many people.  Not just women in Hollywood. Let me know when they start advocating for marginalized populations based on something other than their genitals.",en,[],[],[],0,0,0,[],[],https://twitter.com/lyka2000/status/955144789653045254,False,,0,,san diego,,,,,,[],,,,
955144075572686849,955144075572686849,2018-01-21 12:24:27 CST,2018-01-21,12:24:27,-0500,1587559244,mamaakae,Kaela,,Mental and verbal abuse is a fucking thing .,en,[],[],[],0,1,1,[],[],https://twitter.com/mamaakae/status/955144075572686849,False,,0,,san diego,,,,,,[],,,,
955143750325436416,955143750325436416,2018-01-21 12:23:10 CST,2018-01-21,12:23:10,-0500,3101767885,papiblendz,BLENDZ,,Kick the cup people‼️,en,[],[],[],0,0,2,[],[],https://twitter.com/PapiBlendz/status/955143750325436416,False,,0,,san diego,,,,,,[],,,,
955139241457065984,955138276452651009,2018-01-21 12:05:15 CST,2018-01-21,12:05:15,-0500,47701213,lyka2000,Quetzelcoatl Jones,,@FreedomEthics @KevinCanWaitCBS @CBS Scientology works overtime to assassinate the character of it's opponents,en,[],[],[],0,0,0,[],[],https://twitter.com/lyka2000/status/955139241457065984,False,,0,,san diego,,,,,,"[{'screen_name': 'FreedomEthics', 'name': 'Freedom Media Ethics', 'id': '2977762993'}, {'screen_name': 'KevinCanWaitCBS', 'name': 'Kevin Can Wait', 'id': '730800433795616769'}, {'screen_name': 'CBS', 'name': 'CBS', 'id': '97739866'}]",,,,
955133262602498048,955120118605983745,2018-01-21 11:41:29 CST,2018-01-21,11:41:29,-0500,798243777500454912,gleasonedel,Latina Edel. Always Respectfull!,,@RealCandaceO Democrats will never support any laws that MAGA. Can’t wait to kick them all out!!!,en,[],[],[],0,0,0,[],[],https://twitter.com/GleasonEdel/status/955133262602498048,False,,0,,san diego,,,,,,"[{'screen_name': 'RealCandaceO', 'name': 'Candace Owens', 'id': '878247600096509952'}]",,,,
955131715512496128,955078487093710848,2018-01-21 11:35:21 CST,2018-01-21,11:35:21,-0500,47701213,lyka2000,Quetzelcoatl Jones,,"@o0Antonia0o @misszing ""dear sisters""  Looks to me this ""movement"" is fixated on genitals.  Abuse of power takes place in all sorts of contexts.  Sometimes the victims of that abuse happen to have a penis.🙄",en,[],[],[],0,0,1,[],[],https://twitter.com/lyka2000/status/955131715512496128,False,,0,,san diego,,,,,,"[{'screen_name': 'misszing', 'name': 'Zing Tsjeng', 'id': '31213'}]",,,,
955126010562752513,955078487093710848,2018-01-21 11:12:40 CST,2018-01-21,11:12:40,-0500,47701213,lyka2000,Quetzelcoatl Jones,,"@o0Antonia0o @misszing From what I have seen, the focus of all this horse shit is Hollywood.  #TimesUp  is meaningless unless it addresses all abuses of power, regardless of the genitals the victim is sporting.",en,[],[],[],2,0,1,['timesup'],[],https://twitter.com/lyka2000/status/955126010562752513,False,,0,,san diego,,,,,,"[{'screen_name': 'misszing', 'name': 'Zing Tsjeng', 'id': '31213'}]",,,,
955125638603550720,955125638603550720,2018-01-21 11:11:12 CST,2018-01-21,11:11:12,-0500,25349253,modernxmike,calicocutpants.com,,I’d rather die than live in a world where I can’t kick your ass.  https://t.co/BbVL9VlnfF,en,[],[],['https://pbs.twimg.com/tweet_video_thumb/DUFJsrTVMAE6YOA.jpg'],0,0,1,[],[],https://twitter.com/modernxmike/status/955125638603550720,False,,1,https://pbs.twimg.com/tweet_video_thumb/DUFJsrTVMAE6YOA.jpg,san diego,,,,,,[],,,,
955123223460376576,955118980892536832,2018-01-21 11:01:36 CST,2018-01-21,11:01:36,-0500,1382549815,iammikedup,Mix,,the only way to eradicate patriarchy and rape culture is for us men to strongly and unequivocally support our fellow women cuz the change they strive for will be incomplete without our eagerness to accept it,en,[],[],[],0,0,3,[],[],https://twitter.com/iammikedup/status/955123223460376576,False,,0,,san diego,,,,,,[],,,,
955122339762421760,955121626772852737,2018-01-21 10:58:05 CST,2018-01-21,10:58:05,-0500,825807728002035712,sydneymasser,sydney,,"if you want to eliminate the need for abortions, there’s a CLEAR solution. pick a step in the process to fund and actively support. protect women from unwanted pregnancies. don’t force abstinence or motherhood- that’s bullshit",en,[],[],[],0,1,6,[],[],https://twitter.com/sydneymasser/status/955122339762421760,False,,0,,san diego,,,,,,[],,,,
955120979079938049,955120979079938049,2018-01-21 10:52:41 CST,2018-01-21,10:52:41,-0500,635884793,loveme_here,ZEE🖤,,"🤔 well I’m not gonna say it wasn’t rape .... but she did start sucking bro , so to me (Just an opinion) she either didn’t wanna be recorded or have sex with bro who was tryna hit from the back 🤷🏽‍♀️🤗 but I mean it’s wrong doe  https://t.co/cgXpo0CQvw",en,[],['https://twitter.com/nateclip/status/954648834415751168'],[],0,0,0,[],[],https://twitter.com/LoveMe_Here/status/955120979079938049,False,0,0,,san diego,,,,,,[],,,,
955120341587607552,955118980892536832,2018-01-21 10:50:09 CST,2018-01-21,10:50:09,-0500,1382549815,iammikedup,Mix,,rape culture is as transparent than ever with actions/behaviors now visible than ever,en,[],[],[],1,0,1,[],[],https://twitter.com/iammikedup/status/955120341587607552,False,,0,,san diego,,,,,,[],,,,
955111108251074566,954888380768182272,2018-01-21 10:13:27 CST,2018-01-21,10:13:27,-0500,9904602,mclanea,Adam McLane,,"@sdsportsfiend @MattSkraby Yeah, that would be death.",en,[],[],[],1,0,1,[],[],https://twitter.com/mclanea/status/955111108251074566,False,,0,,san diego,,,,,,"[{'screen_name': 'sdsportsfiend', 'name': 'SD Sports Fiend', 'id': '785837083965423616'}, {'screen_name': 'MattSkraby', 'name': 'Matt Skraby', 'id': '296868443'}]",,,,
955108384260333568,954959620316917760,2018-01-21 10:02:38 CST,2018-01-21,10:02:38,-0500,837527450049359873,j_hayata3,Justin Hayata,,"@KunalKhaitani It’s probably a lineup that could make the tournament theoretically. That’s assuming they don’t hunt for a grad transfer either. Don’t forget about Eli Weaver either he’s a legit PG. it does hurt but if we can’t recruit players the right way, better not to have them",en,[],[],[],0,0,0,[],[],https://twitter.com/j_hayata3/status/955108384260333568,False,,0,,san diego,,,,,,"[{'screen_name': 'KunalKhaitani', 'name': 'KSPN', 'id': '59555806'}]",,,,
955104259028078593,955104259028078593,2018-01-21 09:46:14 CST,2018-01-21,09:46:14,-0500,23915136,michelleincal,Michelle ⚾️,,Glad I dodged that bullet  https://t.co/Lo0qq1l4Ef,en,[],['https://twitter.com/fox5sandiego/status/955093915316695040'],[],0,0,1,[],[],https://twitter.com/MichelleInCAL/status/955104259028078593,False,https://twitter.com/fox5sandiego/status/955093915316695040,0,,san diego,,,,,,[],,,,
955095206432464897,954718417918947330,2018-01-21 09:10:16 CST,2018-01-21,09:10:16,-0500,495652171,wctidefans,West Coast Tide Fans,,@rburn20 @polynesiabowl I only saw Ekiyor on the field.  Tommy was hurt from UA game.  I never heard Latu’s name when playing.  Anoma wasn’t there.  Penei and ITS weren’t suited up.  Tanner McKee got MVP,en,[],[],[],1,0,0,[],[],https://twitter.com/WCTideFans/status/955095206432464897,False,,0,,san diego,,,,,,"[{'screen_name': 'rburn20', 'name': 'Tua to Smitty!!!', 'id': '441001237'}, {'screen_name': 'polynesiabowl', 'name': 'Polynesian Bowl', 'id': '767795670451232768'}]",,,,
