id,conversation_id,created_at,date,time,timezone,user_id,username,name,place,tweet,language,mentions,urls,photos,replies_count,retweets_count,likes_count,hashtags,cashtags,link,retweet,quote_url,video,thumbnail,near,geo,source,user_rt_id,user_rt,retweet_id,reply_to,retweet_date,translate,trans_src,trans_dest
1168214696949886981,1167874288357011460,2019-09-01 12:31:02 CDT,2019-09-01,12:31:02,-0500,31180179,bunson8r,Eric Bunson,,@thejasonhopkins @DailyCaller And yet nonimmigrants continue to commit crime at a significantly higher rate.,en,[],[],[],0,0,0,[],[],https://twitter.com/Bunson8r/status/1168214696949886981,False,,0,,chicago,,,,,,"[{'screen_name': 'thejasonhopkins', 'name': 'Jason Hopkins', 'id': '852764509613707264'}, {'screen_name': 'DailyCaller', 'name': 'Daily Caller', 'id': '39308549'}]",,,,
1168213438885183489,1168213438885183489,2019-09-01 12:26:02 CDT,2019-09-01,12:26:02,-0500,1122533006,prinnylee,𝐀𝐚𝐥𝐢𝐲𝐚𝐡,,me and alexis are literally partners in crime and sometimes that is not a good thing cos the shenanigans we get into 🤦🏾‍♀️ lol but we’re good people! 😂,en,[],[],[],0,0,0,[],[],https://twitter.com/prinnylee/status/1168213438885183489,False,,0,,chicago,,,,,,[],,,,
1168206676136255489,1167975732049403905,2019-09-01 11:59:10 CDT,2019-09-01,11:59:10,-0500,15079805,dnaunton,David Naunton,,@nharesound Is the earliest victim healthy so they can care for you?,en,[],[],[],1,0,0,[],[],https://twitter.com/dnaunton/status/1168206676136255489,False,,0,,chicago,,,,,,"[{'screen_name': 'nharesound', 'name': 'Nathaniel Hare', 'id': '46901153'}]",,,,
1168206300364333056,659427797853536256,2019-09-01 11:57:40 CDT,2019-09-01,11:57:40,-0500,10487222,claes69,"Tom Mater 🌻Русский корабль, иди нахуй",,@GregAbbott_TX @NRA that gun race seems to have worked out well,en,[],[],[],0,0,0,[],[],https://twitter.com/claes69/status/1168206300364333056,False,,0,,chicago,,,,,,"[{'screen_name': 'GregAbbott_TX', 'name': 'Greg Abbott', 'id': '90651198'}, {'screen_name': 'NRA', 'name': 'NRA', 'id': '21829541'}]",,,,
1168205675157237761,1168205675157237761,2019-09-01 11:55:11 CDT,2019-09-01,11:55:11,-0500,26296758,trini87,Darnell Lowe 🇹🇹,,Somebody show me in the Bible where it says owning a gun is a God given right.,en,[],[],[],0,1,3,[],[],https://twitter.com/trini87/status/1168205675157237761,False,https://twitter.com/RepMattSchaefer/status/1167989249745899521,0,,chicago,,,,,,[],,,,
1168205146746236928,1168205146746236928,2019-09-01 11:53:05 CDT,2019-09-01,11:53:05,-0500,756903193901162496,reesetheone1,NewDemocrat4Life,,He can say motherfucka like Bernie Mac.... It won't change shit.  Gun control won't get passed without Bipartisan buy-in and it starts state and locally.,en,[],[],[],1,1,11,[],[],https://twitter.com/reesetheone1/status/1168205146746236928,False,https://twitter.com/Angry_Staffer/status/1168194834773024774,0,,chicago,,,,,,[],,,,
1168204683367919621,1167625935085953024,2019-09-01 11:51:15 CDT,2019-09-01,11:51:15,-0500,44255126,drconine,Brandon Conine,,@NadiaInBC @Pflax1 This is your take away from this video? Anger that they’re riding in the street. GTFOH with that crap take.,en,[],[],[],0,0,1,[],[],https://twitter.com/drconine/status/1168204683367919621,False,,0,,chicago,,,,,,"[{'screen_name': 'NadiaInBC', 'name': 'NadiaInBC', 'id': '1165027684423913472'}, {'screen_name': 'Pflax1', 'name': 'Peter Flax', 'id': '28574479'}]",,,,
1168202667518320646,1168202667518320646,2019-09-01 11:43:14 CDT,2019-09-01,11:43:14,-0500,505071021,castleengineer,Cristian “Castle” Castillo,,"Well, with Cavani and Mbappe injured, we need him now. We’ll see how it goes.",en,[],[],[],0,0,0,[],[],https://twitter.com/castleengineer/status/1168202667518320646,False,https://twitter.com/ParisUnitedEN/status/1168161867325460481,0,,chicago,,,,,,[],,,,
1168195824859406336,1168195824859406336,2019-09-01 11:16:03 CDT,2019-09-01,11:16:03,-0500,790886306,southsideclau,La Miche Girl 🍅🍺🥒,,"Telling him he has to stop being friends with people cause they’re girls is abuse , telling him he can’t go out is abuse , making him give you money is abuse not only that but it’s controlling and manipulative .",en,[],[],[],0,0,0,[],[],https://twitter.com/SouthsideClau/status/1168195824859406336,False,https://twitter.com/EllixFlowers/status/1165734796447764480,0,,chicago,,,,,,[],,,,
1168195791028203522,1168067831973285889,2019-09-01 11:15:55 CDT,2019-09-01,11:15:55,-0500,91186432,msnlb216,Nancy Billows,,"@RealDeanCain Your compassion is understandable, but, abilities be damned, you got injured! Unanswered prayers happen for a reason, even though they suck sometimes! 😔  They can try next year right?",en,[],[],[],0,0,0,[],[],https://twitter.com/msnlb216/status/1168195791028203522,False,,0,,chicago,,,,,,"[{'screen_name': 'RealDeanCain', 'name': 'Dean Cain', 'id': '581999965'}]",,,,
1168195281667665921,1168193132166549506,2019-09-01 11:13:53 CDT,2019-09-01,11:13:53,-0500,52282018,leonardpierce,Leonard Pierce,,@david_j_roth Dear sir please remind your misguided commenters that “Clown Prince of Crime” is at best an honorofic and that actual titles of hereditary nobility exist in neither the criminal nor clown communities   Send tweet,en,[],[],[],0,0,15,[],[],https://twitter.com/leonardpierce/status/1168195281667665921,False,,0,,chicago,,,,,,"[{'screen_name': 'david_j_roth', 'name': 'David Roth', 'id': '171346034'}]",,,,
1168194500763824128,1168146165130518528,2019-09-01 11:10:47 CDT,2019-09-01,11:10:47,-0500,863480442707726337,tbarnett500,Tony Barnett,,"@TweetJDUB2017 @PupMom76 @MLeeRanch @LeeHolly81 @realDonaldTrump Oh, then can I have a nuclear weapon. I feel threatened. You don’t need a weapon and chews through skin, bone and organs in a matter of seconds with multiple rounds to hunt or defend yourself. Are you expecting Hillary and Obama to come storming up your lawn with an army? Coward.",en,[],[],[],1,1,2,[],[],https://twitter.com/tbarnett500/status/1168194500763824128,False,,0,,chicago,,,,,,"[{'screen_name': 'TweetJDUB2017', 'name': 'JDUB', 'id': '2466334644'}, {'screen_name': 'PupMom76', 'name': 'Pup Mom', 'id': '1491641916'}, {'screen_name': 'LeeHolly81', 'name': 'Holly Lee', 'id': '779742611628175360'}, {'screen_name': 'realDonaldTrump', 'name': 'Donald J. Trump', 'id': '25073877'}]",,,,
1168194491829968896,1168194491829968896,2019-09-01 11:10:45 CDT,2019-09-01,11:10:45,-0500,351044510,anayelinews,Anayeli Ruiz KHOU,,This video is so hard to watch!!!  Praying for all those West Texas families affected by this horrific shooting! #OdessaShooting,en,[],[],[],0,2,4,['odessashooting'],[],https://twitter.com/AnayeliNews/status/1168194491829968896,False,https://twitter.com/fl0w3rp0w3r01/status/1167985618753687552,0,,chicago,,,,,,[],,,,
1168193923010957315,1168146165130518528,2019-09-01 11:08:29 CDT,2019-09-01,11:08:29,-0500,863480442707726337,tbarnett500,Tony Barnett,,"@MLeeRanch @LeeHolly81 @realDonaldTrump And what person freedoms would those be, specifically?  Gun control does not mean banning guns. You don’t need a weapon that shreds skin and bone in a matter of seconds with consecutive rounds to hunt dear or defend yourself. Unless you’re worried about an army of Hulk-like deer.",en,[],[],[],0,0,0,[],[],https://twitter.com/tbarnett500/status/1168193923010957315,False,,0,,chicago,,,,,,"[{'screen_name': 'LeeHolly81', 'name': 'Holly Lee', 'id': '779742611628175360'}, {'screen_name': 'realDonaldTrump', 'name': 'Donald J. Trump', 'id': '25073877'}]",,,,
1168191223494037506,1167824578057506816,2019-09-01 10:57:46 CDT,2019-09-01,10:57:46,-0500,897102022339694592,keithh6910,Keith,,"@KwikWarren @chaplinlives If that black family had pulled the gun on the white woman; however, they would have been charged with attempted murder &amp; the death penalty would be sought.",en,[],[],[],3,3,7,[],[],https://twitter.com/KeithH6910/status/1168191223494037506,False,,0,,chicago,,,,,,"[{'screen_name': 'KwikWarren', 'name': 'Kenny BooYah! 🖖🏾', 'id': '842432472'}, {'screen_name': 'chaplinlives', 'name': 'chaplinlives', 'id': '225189494'}]",,,,
1168189916737679360,1167885145845596167,2019-09-01 10:52:34 CDT,2019-09-01,10:52:34,-0500,829533419575111680,gringolocoog,GringoLoco,,@gettinmelt @erickstevens82 @OphidianCobra It’s happened @GCWrestling_  you should check it out. Show was called Crime Wave 👍🏻,en,"[{'screen_name': 'gcwrestling_', 'name': 'gamechangerwrestling', 'id': '1024814245'}]",[],[],1,0,3,[],[],https://twitter.com/GringoLocoOG/status/1168189916737679360,False,,0,,chicago,,,,,,"[{'screen_name': 'gettinmelt', 'name': 'uncle goldberg needs a new display name', 'id': '142882344'}, {'screen_name': 'OphidianCobra', 'name': 'Ophidian The Maniac!', 'id': '62992766'}]",,,,
1168189596196376578,1168189591351955457,2019-09-01 10:51:18 CDT,2019-09-01,10:51:18,-0500,897102022339694592,keithh6910,Keith,,"He expressed doubt about the shootings &amp; incoherently mentioned the Orlando nightclub shooting. I told him that it was REAL &amp; that people DID DIE!  He pivoted &amp; agreed that it was real, people died, but said that they’ve found that some of the people on scene are crisis actors!",en,[],[],[],1,0,4,[],[],https://twitter.com/KeithH6910/status/1168189596196376578,False,,0,,chicago,,,,,,[],,,,
1168189595114188801,1168189591351955457,2019-09-01 10:51:18 CDT,2019-09-01,10:51:18,-0500,897102022339694592,keithh6910,Keith,,"Needless to say, I was shocked!  I told him that it didn’t happen under Obama. I also told him that the reason there are so many gun laws coming is because of all of the mass shootings!  I told him that people are DYING all across the country! Something has to give!",en,[],[],[],1,0,4,[],[],https://twitter.com/KeithH6910/status/1168189595114188801,False,,0,,chicago,,,,,,[],,,,
1168189594048880641,1168189591351955457,2019-09-01 10:51:17 CDT,2019-09-01,10:51:17,-0500,897102022339694592,keithh6910,Keith,,He mentioned that his dad is a Vietnam War veteran &amp; he’s a responsible gun owner. He said that gun restrictions are coming (reference Gov Rauner).  Mentioned that he cannot transport his high capacity magazine to Florida anymore.,en,[],[],[],1,0,3,[],[],https://twitter.com/KeithH6910/status/1168189594048880641,False,,0,,chicago,,,,,,[],,,,
1168187676870217730,1168187676870217730,2019-09-01 10:43:40 CDT,2019-09-01,10:43:40,-0500,119790662,bjrisman,Dr.barbara risman,,Another mass shooting.  Do not normalize!  This is horrific.  We must reduce access to weapons.,en,[],[],[],0,0,1,[],[],https://twitter.com/bjrisman/status/1168187676870217730,False,https://twitter.com/NPR/status/1168181524270899200,0,,chicago,,,,,,[],,,,
1168185038984269825,1168185038984269825,2019-09-01 10:33:11 CDT,2019-09-01,10:33:11,-0500,897102022339694592,keithh6910,Keith,,"In case you’ve missed it, TEXASISTAN just LOOSENED gun laws the day after this last mass shooting in their state!!!!  MORE GUNS!!!!  EVERYWHERE!!!",en,[],[],[],1,0,2,[],[],https://twitter.com/KeithH6910/status/1168185038984269825,False,https://twitter.com/KeithH6910/status/1168169878773219330,0,,chicago,,,,,,[],,,,
1168183949870424064,1168183949870424064,2019-09-01 10:28:52 CDT,2019-09-01,10:28:52,-0500,2283960169,giannocaldwell,Gianno Caldwell,"{'type': 'Point', 'coordinates': [41.883222, -87.632496]}","I have the #1 solution to stopping the violence in Chicago, it’s time to start snitching. That means working with the police and informing them on whose committing the crimes. @ Chicago, Illinois  https://t.co/wtP18V1Otr",en,[],['https://www.instagram.com/p/B136CrLntni/?igshid=hu24zgo2oqa'],[],6,5,66,[],[],https://twitter.com/GiannoCaldwell/status/1168183949870424064,False,,0,,chicago,,,,,,[],,,,
1168181773743927297,1168181773743927297,2019-09-01 10:20:13 CDT,2019-09-01,10:20:13,-0500,195429270,natalieportw,The Hamburger Helper Mascot,,Curling up with a good mass shooting,en,[],[],[],0,0,0,[],[],https://twitter.com/natalieportw/status/1168181773743927297,False,,0,,chicago,,,,,,[],,,,
1168180969200898049,1168180969200898049,2019-09-01 10:17:01 CDT,2019-09-01,10:17:01,-0500,48115899,conspiracylife,"Darius (Taylor's Version), MSW",,Another damn mass shooting in Texas. Jesus.....,en,[],[],[],0,0,0,[],[],https://twitter.com/conspiracylife/status/1168180969200898049,False,,0,,chicago,,,,,,[],,,,
1168178006428463104,1168178006428463104,2019-09-01 10:05:15 CDT,2019-09-01,10:05:15,-0500,806110936914427905,sam_widmayer,Sam Widmayer,,Shouts out to my girl because one of her goals this season was to be more of a defensive threat 💗💗,en,[],[],[],0,0,15,[],[],https://twitter.com/sam_widmayer/status/1168178006428463104,False,https://twitter.com/PhxUltimate/status/1168177297846951943,0,,chicago,,,,,,[],,,,
1168176584366415877,1168176584366415877,2019-09-01 09:59:36 CDT,2019-09-01,09:59:36,-0500,1726948620,countonrodney,ردني,,Take on poverty and it will take care of most of the “gun violence”,en,[],[],[],0,0,0,[],[],https://twitter.com/CountOnRodney/status/1168176584366415877,False,https://twitter.com/BernieSanders/status/1168156925898477570,0,,chicago,,,,,,[],,,,
1168173181611458566,1168172574997667841,2019-09-01 09:46:04 CDT,2019-09-01,09:46:04,-0500,756903193901162496,reesetheone1,NewDemocrat4Life,,"The mass shooting in Aurora Illinois was covered last year... And a black man was responsible.  The crazy motherfucker in Dallas that the police used J-5 to blow up to stop... He was black and it was covered.  Trust me, lack of media coverage on mass shootings isn't the issue.",en,[],[],[],2,0,11,[],[],https://twitter.com/reesetheone1/status/1168173181611458566,False,,0,,chicago,,,,,,[],,,,
1168172574997667841,1168172574997667841,2019-09-01 09:43:40 CDT,2019-09-01,09:43:40,-0500,756903193901162496,reesetheone1,NewDemocrat4Life,,Some crazy ass white dude killed seven and injured another 20plus.... So he stepped on the news cycle.,en,[],[],[],2,2,12,[],[],https://twitter.com/reesetheone1/status/1168172574997667841,False,https://twitter.com/johncardillo/status/1168130319020711936,0,,chicago,,,,,,[],,,,
1168169878773219330,1168169878773219330,2019-09-01 09:32:57 CDT,2019-09-01,09:32:57,-0500,897102022339694592,keithh6910,Keith,,"Because they are soulless, mindless idiots...  Texas gun laws: Weapons will be allowed in churches and on school grounds - CNN  https://t.co/LJ70CSNctO",en,[],['https://www.cnn.com/2019/09/01/us/texas-new-gun-laws-trnd/index.html'],[],0,0,6,[],[],https://twitter.com/KeithH6910/status/1168169878773219330,False,,0,,chicago,,,,,,[],,,,
1168169359791087617,1168072341622001665,2019-09-01 09:30:53 CDT,2019-09-01,09:30:53,-0500,78719856,chitownkev,Chitown Kev,,"@Ravenswood2016 @Marlencha1992 @democratista @AizenSo1989 To my knowledge, Beto has only cussed in public about shootings in Texas...if there were a mass shooting in California, Harris would be given some (not much) leeway",en,[],[],[],0,0,0,[],[],https://twitter.com/ChitownKev/status/1168169359791087617,False,,0,,chicago,,,,,,"[{'screen_name': 'Ravenswood2016', 'name': 'DymphnaThePirate', 'id': '2576610500'}, {'screen_name': 'marlencha1992', 'name': 'Mar 🇺🇦🌻🇺🇦🌻🇺🇦🌻', 'id': '886949642478305285'}, {'screen_name': 'democratista', 'name': '🛹RuthieKessler🛹', 'id': '14415571'}, {'screen_name': 'AizenSo1989', 'name': 'Monarch Butterfly🎖️ 🇿🇦🇲🇽🇨🇦🇺🇸🇩🇪🇬🇧🇯🇵', 'id': '1112485163676524544'}]",,,,
1168169114747265024,1168024994355589120,2019-09-01 09:29:55 CDT,2019-09-01,09:29:55,-0500,117321429,drowsyredhead,Mary H🌹,,@claudbalog Imagine thinking what the South needs is more guns/violence. These fucking people are no better than incels. And it’s also totally not misogynistic in any way to tell me to ‘seek help’. Good left we got here.,en,[],[],[],1,0,1,[],[],https://twitter.com/Drowsyredhead/status/1168169114747265024,False,,0,,chicago,,,,,,[],,,,
1168168587883945984,1167989160507895809,2019-09-01 09:27:49 CDT,2019-09-01,09:27:49,-0500,330276372,rowardsinc,Jon,,"@RepMattSchaefer Hi.  Where exactly in the Bible does it say you have the God given right to have an assault weapon?  I don’t remember that lesson in Sunday School, Church camp or in any homily.  Please direct me to that passage.  Thank you.",en,[],[],[],0,0,0,[],[],https://twitter.com/RoWardsInc/status/1168168587883945984,False,,0,,chicago,,,,,,"[{'screen_name': 'RepMattSchaefer', 'name': 'Matt Schaefer', 'id': '907182024'}]",,,,
1168167564226248704,1168167564226248704,2019-09-01 09:23:45 CDT,2019-09-01,09:23:45,-0500,756903193901162496,reesetheone1,NewDemocrat4Life,,8 dead and 24 shot so far this labor day weekend...  39 hours left.  Expect the GOP to use my city as to why gun control laws suck.,en,[],[],[],2,6,20,[],[],https://twitter.com/reesetheone1/status/1168167564226248704,False,,0,,chicago,,,,,,[],,,,
1168165510493683712,1168165510493683712,2019-09-01 09:15:35 CDT,2019-09-01,09:15:35,-0500,1525010869,join_rage,R.A.G.E. Englewood,,"Thank You to all our supporters, volunteers, donors and members to help make our Back to School Edition of So Fresh Saturday another successful experience for our students in Englewood! #BackToSchoolEdition #SoFreshSaturday  https://t.co/OEzPcPsCBi",en,[],[],[],0,0,5,"['backtoschooledition', 'sofreshsaturday']",[],https://twitter.com/Join_RAGE/status/1168165510493683712,False,,1,https://pbs.twimg.com/ext_tw_video_thumb/1168165435696734208/pu/img/k4yj4VFSqtySaW4j.jpg,chicago,,,,,,[],,,,
1168164339657904130,1168108757320196096,2019-09-01 09:10:56 CDT,2019-09-01,09:10:56,-0500,19380764,dimitri246,Shuri's Lab Partner,,@Twilightseven You saying a black man shooting 4 people not getting the same coverage as a white man shooting 20 is bc white supremacy is under attack- That’s the reason I think you’re racist.,en,[],[],[],1,0,0,[],[],https://twitter.com/Dimitri246/status/1168164339657904130,False,,0,,chicago,,,,,,"[{'screen_name': 'Twilightseven', 'name': 'tribute 776 🇺🇸 🇯🇵 🏴\U000e0067\U000e0062\U000e0073\U000e0063\U000e0074\U000e007f', 'id': '46538781'}]",,,,
1168163499031302144,1168158346433703936,2019-09-01 09:07:36 CDT,2019-09-01,09:07:36,-0500,86511895,nyawiranjoroge,Nyawira.,,@Chydee It regards his recent deal with the NFL vs Colin Kaepernick and other stuff from his past. Like his drug dealing vs his current relationship with the cops. I think he also made some dumb remarks about gun violence and single mother households.,en,[],[],[],0,0,0,[],[],https://twitter.com/NyawiraNjoroge/status/1168163499031302144,False,,0,,chicago,,,,,,"[{'screen_name': 'Chydee', 'name': 'Chidi Okereke', 'id': '1094330083'}]",,,,
1168162880589586433,1168162880589586433,2019-09-01 09:05:08 CDT,2019-09-01,09:05:08,-0500,44484303,padschicago,AnnMarie Walsh 😷💉,,"On CTA red line. A black woman is saying very racist things about white people, that we are all devils and going to hell.",en,[],[],[],1,0,1,[],[],https://twitter.com/padschicago/status/1168162880589586433,False,,0,,chicago,,,,,,[],,,,
1168162307857190912,1167982344411549697,2019-09-01 09:02:52 CDT,2019-09-01,09:02:52,-0500,168764245,nicholasfortuna,Nick Fortuna,,"@JimKotowski @loudnuff4u @Breaking911 @TheyCallMeTomO1 If “Reasonable Criminals” started Reasonably following the “Reasonable Gun Laws” we already have on the books, I think I’d Reasonably consider that. Until that day, I think I’d like people to stop infringing on my rights because some scumbags are breaking existing laws.",en,[],[],[],41,73,990,[],[],https://twitter.com/NicholasFortuna/status/1168162307857190912,False,,0,,chicago,,,,,,"[{'screen_name': 'JimKotowski', 'name': 'Jim Kotowski', 'id': '2152274450'}, {'screen_name': 'loudnuff4u', 'name': '2Loud4u', 'id': '2153503148'}, {'screen_name': 'Breaking911', 'name': 'Breaking911', 'id': '375721095'}, {'screen_name': 'TheyCallMeTomO1', 'name': ""Thomas OConnor 🇺🇲 Born '62 🇺🇲 Only LEGAL VOTES"", 'id': '1017509607013474305'}]",,,,
1168162258524020738,1168162258524020738,2019-09-01 09:02:40 CDT,2019-09-01,09:02:40,-0500,13028322,craignewman,Craig Newman,,There’s a category 5 hurricane off the US coast and we just had another mass shooting. And this is our president.  https://t.co/APhySl6ClX,en,[],[],['https://pbs.twimg.com/media/EDYlYXhX4AAG43b.jpg'],0,6,19,[],[],https://twitter.com/craignewman/status/1168162258524020738,False,,1,https://pbs.twimg.com/media/EDYlYXhX4AAG43b.jpg,chicago,,,,,,[],,,,
1168161850594398208,1168049776656572416,2019-09-01 09:01:03 CDT,2019-09-01,09:01:03,-0500,629054744,izzybee__,𝕘𝕝𝕚𝕫𝕫𝕪 𝕚𝕫𝕫𝕪,,@pizzabbw That sounds like harassment at the work place,en,[],[],[],0,0,0,[],[],https://twitter.com/izzybee__/status/1168161850594398208,False,,0,,chicago,,,,,,[],,,,
1168161321554251776,1168161321554251776,2019-09-01 08:58:57 CDT,2019-09-01,08:58:57,-0500,2825420486,vincethecappie,Vince The Capitalist,,I hear that Ruth Bader Ginsberg has information that could lead to the arrest and conviction of @BillClinton and @HillaryClinton.  Spread the word. 😏,en,"[{'screen_name': 'billclinton', 'name': 'bill clinton', 'id': '1330457336'}, {'screen_name': 'hillaryclinton', 'name': 'hillary clinton', 'id': '1339835893'}]",[],[],0,0,0,[],[],https://twitter.com/vincethecappie/status/1168161321554251776,False,,0,,chicago,,,,,,[],,,,
1168160743604281345,1168160743604281345,2019-09-01 08:56:39 CDT,2019-09-01,08:56:39,-0500,567512736,nicktheman287,Nick19,,@ErikLambert1 do you think the Dolphins are shooting for the number 1 pick ?,en,[],[],[],0,0,0,[],[],https://twitter.com/nicktheman287/status/1168160743604281345,False,,0,,chicago,,,,,,[],,,,
1168151942297792513,1167951002705678342,2019-09-01 08:21:40 CDT,2019-09-01,08:21:40,-0500,2746571940,astern5556,womanofgod3,,@ananavarro @chastuff AAAAAAND the CULT OF NRA ARE dancing around their Golden altars topped with the SOLID GOLD AR-15'S! running with the fresh blood of the victims shot and murdered and injured in yesterday's massacres!,en,[],[],[],0,0,0,[],[],https://twitter.com/astern5556/status/1168151942297792513,False,,0,,chicago,,,,,,"[{'screen_name': 'ananavarro', 'name': 'Ana Navarro-Cárdenas', 'id': '19568591'}, {'screen_name': 'chastuff', 'name': 'Charmaine188', 'id': '329318863'}]",,,,
1168148640814313477,1168148640814313477,2019-09-01 08:08:33 CDT,2019-09-01,08:08:33,-0500,3159888878,dahliazahava,Dahlia Zahava,,"my neck, my back, my village is under attack",en,[],[],[],1,1,26,[],[],https://twitter.com/DahliaZahava/status/1168148640814313477,False,,0,,chicago,,,,,,[],,,,
1168147616728829953,1168147616728829953,2019-09-01 08:04:29 CDT,2019-09-01,08:04:29,-0500,923790379,attacka10,Coach Allison 🇺🇸,,How was this situation allowed to escalate from a traffic stop to a rolling mass shooting? And a vehicle exchange that was apparently unobserved?  https://t.co/thXn3yUjZc,en,[],['https://www.cnn.com/2019/09/01/us/odessa-texas-shooting-sunday/index.html'],[],0,0,1,[],[],https://twitter.com/AttackA10/status/1168147616728829953,False,,0,,chicago,,,,,,[],,,,
1168143673437118464,1168143673437118464,2019-09-01 07:48:49 CDT,2019-09-01,07:48:49,-0500,22034616,treatjazself,Jasmine,"{'type': 'Point', 'coordinates': [41.88466, -87.64923]}","Chicken sammies are all the rage right now! Let's do this less red meat thing... I'm about it. Tell me your favorite chicken sandwich. No, I still haven't had Popeye's. I know it'll be the best. What's second? @ The…  https://t.co/gbhPuI8fWD",en,[],['https://www.instagram.com/p/B13oGULFE8G/?igshid=1f0frbsh0xx1m'],[],0,0,0,[],[],https://twitter.com/treatjazself/status/1168143673437118464,False,,0,,chicago,,,,,,[],,,,
1168139176665112578,1167776385135497216,2019-09-01 07:30:57 CDT,2019-09-01,07:30:57,-0500,4744112715,john_forestry,John Paterson,,"@eleanormharris My Mother’s Family were from Annan- I have a nice little watercolour painted by a relative in the 1930’s The scene the Annan side of the Solway Firth ( or the battle ground of Scottish/ English half-netters, where things could/ still can? , get a wee bit violent!)",en,[],[],[],2,0,1,[],[],https://twitter.com/John_Forestry/status/1168139176665112578,False,,0,,chicago,,,,,,"[{'screen_name': 'eleanormharris', 'name': 'Eleanor M Harris', 'id': '31384630'}]",,,,
1168137746931695617,1168108757320196096,2019-09-01 07:25:16 CDT,2019-09-01,07:25:16,-0500,19380764,dimitri246,Shuri's Lab Partner,,@Twilightseven @TerryPr2520 @CNN It doesn’t change the fact that shooting 20 people gets you on CNN.,en,[],[],[],2,0,0,[],[],https://twitter.com/Dimitri246/status/1168137746931695617,False,,0,,chicago,,,,,,"[{'screen_name': 'Twilightseven', 'name': 'tribute 776 🇺🇸 🇯🇵 🏴\U000e0067\U000e0062\U000e0073\U000e0063\U000e0074\U000e007f', 'id': '46538781'}, {'screen_name': 'TerryPr2520', 'name': 'The Truth', 'id': '959508690385608705'}, {'screen_name': 'CNN', 'name': 'CNN', 'id': '759251'}]",,,,
1168137665881038848,1168137665881038848,2019-09-01 07:24:57 CDT,2019-09-01,07:24:57,-0500,1210098278,castonchris,Christine Caston,,@senatemajldr ‘raises the possibility’ he will ‘look at’ gun safety bills......he works for us...he’s forgotten that! He has to tell us WHY he blocks Gunsafety...WHY? 💰💰💰,en,[],[],[],0,1,0,[],[],https://twitter.com/CastonChris/status/1168137665881038848,False,https://twitter.com/DHStokyo/status/1167994762676228097,0,,chicago,,,,,,[],,,,
