id,conversation_id,created_at,date,time,timezone,user_id,username,name,place,tweet,language,mentions,urls,photos,replies_count,retweets_count,likes_count,hashtags,cashtags,link,retweet,quote_url,video,thumbnail,near,geo,source,user_rt_id,user_rt,retweet_id,reply_to,retweet_date,translate,trans_src,trans_dest
1088586918328221702,1088586918328221702,2019-01-24 17:58:40 CST,2019-01-24,17:58:40,-0500,11584622,brizzyc,Carrie Brown,,"Shutdown draws domestic violence shelters to the brink, imperiling life-or-death services for women  https://t.co/1BhcKfRSQt",en,[],['https://wapo.st/2FLSu8n?tid=ss_tw&utm_term=.5c3f43a685c3'],[],0,1,0,[],[],https://twitter.com/Brizzyc/status/1088586918328221702,False,,0,,new york city,,,,,,[],,,,
1088586450218770435,1088586450218770435,2019-01-24 17:56:49 CST,2019-01-24,17:56:49,-0500,1277172313,revdionneb,Dionne P. Boissiere,,"Because one day the bodies of women and girls will NOT be commodified, negotiated or used as weapons of war. We can and must end all forms of gender based violence in our lifetime!@wccWoMen @Thursdays_Black  #ThursdaysInBlack #LinkUp2EndGBV  https://t.co/xmifDA2Aaz",en,"[{'screen_name': 'thursdays_black', 'name': 'thursdays in black', 'id': '2313422724'}]",[],['https://pbs.twimg.com/media/DxtvmuwXgAAJ826.jpg'],0,7,9,"['thursdaysinblack', 'linkup2endgbv']",[],https://twitter.com/revdionneb/status/1088586450218770435,False,,1,https://pbs.twimg.com/media/DxtvmuwXgAAJ826.jpg,new york city,,,,,,[],,,,
1088586248942485510,1088532745259794433,2019-01-24 17:56:01 CST,2019-01-24,17:56:01,-0500,767383298,juanygomero,Juany #GunReformNow,,@davidhogg111 And remember not to vote for the current resident of the WH he cares more about stupid wall than gun control disregarding people lives let see if Florida put their 25 votes in the right way,en,[],[],[],0,0,0,[],[],https://twitter.com/juanygomero/status/1088586248942485510,False,,0,,new york city,,,,,,"[{'screen_name': 'davidhogg111', 'name': 'David Hogg 🌻', 'id': '1915033663'}]",,,,
1088585799820603393,1088585799820603393,2019-01-24 17:54:14 CST,2019-01-24,17:54:14,-0500,39764121,netsdaily,NetsDaily,,Nets won’t provide timeframe for an injured player’s return. It’s not about the fans or the media.  They simply don’t want to put pressure on players or medical/rehab/performance teams to meet a deadline that could change during rehab. I get it.,en,[],[],[],3,15,97,[],[],https://twitter.com/NetsDaily/status/1088585799820603393,False,,0,,new york city,,,,,,[],,,,
1088585675350384640,1088328313804750848,2019-01-24 17:53:44 CST,2019-01-24,17:53:44,-0500,28194276,jessidoyle,jessie doyle🇺🇦 RESIST,,"@RealJamesWoods you’re the only sick monster that would actually watch it. you love the gore, the abuse, the horror - that’s what you are. do you think posting this is helping? is that your heroic sitting-on-couch activism? brave jamie, bravo you sick monster",en,[],[],[],0,0,0,[],[],https://twitter.com/jessidoyle/status/1088585675350384640,False,,0,,new york city,,,,,,"[{'screen_name': 'RealJamesWoods', 'name': 'James Woods', 'id': '78523300'}]",,,,
1088584196933804032,1088584196933804032,2019-01-24 17:47:52 CST,2019-01-24,17:47:52,-0500,793170961,leekahlo,leeroy 🌚,,so that justifies the little racist shit’s actions ? mmmmmmmmm sounds qWHITE right,en,[],[],[],0,0,0,[],[],https://twitter.com/leekahlo/status/1088584196933804032,False,https://twitter.com/nypost/status/1088441652199542784,0,,new york city,,,,,,[],,,,
1088583740996182017,1088583740996182017,2019-01-24 17:46:03 CST,2019-01-24,17:46:03,-0500,500129408,addachy,Dachi,"{'type': 'Point', 'coordinates': [40.723056, -74.000833]}","Tired. 125+ editing hours this month.  Not including shooting time.  . 📸: @goddard_era @ SoHo, Manhattan  https://t.co/YrzAksYrYv",en,"[{'screen_name': 'goddard_era', 'name': 'aj', 'id': '1425346693'}]",['https://www.instagram.com/p/BtCUa8NBV4L/?utm_source=ig_twitter_share&igshid=1rw9tkj8weavp'],[],0,0,0,[],[],https://twitter.com/addachy/status/1088583740996182017,False,,0,,new york city,,,,,,[],,,,
1088582300256911362,1088582300256911362,2019-01-24 17:40:19 CST,2019-01-24,17:40:19,-0500,1051313227,deekevin56_m,Donna M Coles,,"As a survivor raped in college &amp; domestic abuse in a marriage I empathize with,Sen Ernst, I wish she had done the same for Dr Christina Ford. Hope Lindsey &amp; the other Republican men believe Joni more than they do other abuse survivors",en,[],[],[],0,0,0,[],[],https://twitter.com/deekevin56_m/status/1088582300256911362,False,https://twitter.com/nickiknowsnada/status/1088267388779405313,0,,new york city,,,,,,[],,,,
1088581012760739840,1088519578060230661,2019-01-24 17:35:12 CST,2019-01-24,17:35:12,-0500,766273415615578112,wattwherehow,WattWhereHow,,@CourseCharted There’s been next to no snow here this season. Brutal cold coming but no snow,en,[],[],[],1,0,0,[],[],https://twitter.com/WattWhereHow/status/1088581012760739840,False,,0,,new york city,,,,,,"[{'screen_name': 'CourseCharted', 'name': 'Alana | Course Charted ✈', 'id': '1029793559363416068'}]",,,,
1088580552180068352,1088541446393786368,2019-01-24 17:33:23 CST,2019-01-24,17:33:23,-0500,308238845,pbean25,Paul don’t care ‘bout your Freedumbs🇺🇸,,"@JoyAnnReid And how this wall will reduce violent crime, drugs, human trafficking. They can’t and they won’t.",en,[],[],[],0,0,1,[],[],https://twitter.com/pbean25/status/1088580552180068352,False,,0,,new york city,,,,,,"[{'screen_name': 'JoyAnnReid', 'name': 'Joy-Ann (Pro-Democracy) Reid 😷', 'id': '49698134'}]",,,,
1088579203325480961,1088527689500295169,2019-01-24 17:28:01 CST,2019-01-24,17:28:01,-0500,29330450,sheglar_gd,Gus u know the rest,,"@BSO Stephen love  https://t.co/3HZBxeaidc victim , when he be talking fake tough, rondo and kd should have checked him,",en,[],['http://to.play'],[],0,0,0,[],[],https://twitter.com/Sheglar_GD/status/1088579203325480961,False,,0,,new york city,,,,,,"[{'screen_name': 'BSO', 'name': 'Robert Littal BSO', 'id': '18823758'}]",,,,
1088577917280501765,1088520232786952192,2019-01-24 17:22:54 CST,2019-01-24,17:22:54,-0500,818633213233004545,staceywagoner,Swag718!,,@MuslimIQ Here we go!! This kid is gonna have a criminal record if he keeps up his racist ways! The mesia needs to stop we all know the deal,en,[],[],[],0,0,0,[],[],https://twitter.com/StaceyWagoner/status/1088577917280501765,False,,0,,new york city,,,,,,"[{'screen_name': 'MuslimIQ', 'name': 'Qasim Rashid', 'id': '1099817633497649154'}]",,,,
1088577635679129600,1088577635679129600,2019-01-24 17:21:47 CST,2019-01-24,17:21:47,-0500,23018544,amandastern,Amanda Stern,,"Do you ever worry, after giving a stranger directions, that you might have inadvertently helped a criminal commit a crime?",en,[],[],[],3,0,5,[],[],https://twitter.com/amandastern/status/1088577635679129600,False,,0,,new york city,,,,,,[],,,,
1088576948295610368,1088550939093458944,2019-01-24 17:19:03 CST,2019-01-24,17:19:03,-0500,137499507,awarriorscholar,Dan White,,@KG_NYK Even at the game last night Knox wasn’t in during the last few possessions. Have to put him in situations to understand pressure even if it’s him not shooting but to get a feel for it all.,en,[],[],[],1,0,0,[],[],https://twitter.com/AWarriorScholar/status/1088576948295610368,False,,0,,new york city,,,,,,"[{'screen_name': 'KG_NYK', 'name': 'Kim', 'id': '298012402'}]",,,,
1088576929467453440,1088576929467453440,2019-01-24 17:18:59 CST,2019-01-24,17:18:59,-0500,97905610,ri_ssh,Rish🌻,,People so quick to play the victim in every situation instead of taking accountability,en,[],[],[],0,2,2,[],[],https://twitter.com/ri_ssh/status/1088576929467453440,False,,0,,new york city,,,,,,[],,,,
1088575801421950976,1088567744457367553,2019-01-24 17:14:30 CST,2019-01-24,17:14:30,-0500,23710652,ginoorlandini,Gino Orlandini,,"@KidSuttree @nachosarah Anyone who uses the dismissive, sexist and completely ad hominem word “mansplain”  doesn’t have any ground to stand on regarding “missing the point.”",en,[],[],[],1,0,1,[],[],https://twitter.com/ginoorlandini/status/1088575801421950976,False,,0,,new york city,,,,,,"[{'screen_name': 'KidSuttree', 'name': 'Suttree', 'id': '1063474947320832000'}, {'screen_name': 'nachosarah', 'name': 'Sarah Beattie', 'id': '73251301'}]",,,,
1088575565890760704,1088575563927863297,2019-01-24 17:13:34 CST,2019-01-24,17:13:34,-0500,4248009076,sharkchar,shark shiver,,And get this you don't have to be a doctor or even murder the poor baby in the hospital you can just murder babies wherever you want.  These are vile disgusting people who do not value life so I don't value theirs I hope what they're doing comes back to them Sevenfold sick sick,en,[],[],[],0,0,0,[],[],https://twitter.com/sharkchar/status/1088575565890760704,False,,0,,new york city,,,,,,[],,,,
1088575563927863297,1088575563927863297,2019-01-24 17:13:33 CST,2019-01-24,17:13:33,-0500,4248009076,sharkchar,shark shiver,,NY has officially become Satan's hellhole I will never go to New York City again never I'll never spend a dime there I'll never do business with anybody from NY nothing it's a complete shit hole it's now ok to murder babies there sick I hope an earthquake hits n destroys the city,en,[],[],[],1,0,0,[],[],https://twitter.com/sharkchar/status/1088575563927863297,False,,0,,new york city,,,,,,[],,,,
1088574711867625472,1088451386319110145,2019-01-24 17:10:10 CST,2019-01-24,17:10:10,-0500,1922074248,laffinmal,Maryanne Laffin,,@nytimes Please come here and arrest donnyboy,en,[],[],[],0,0,1,[],[],https://twitter.com/LaffinMal/status/1088574711867625472,False,,0,,new york city,,,,,,"[{'screen_name': 'nytimes', 'name': 'The New York Times', 'id': '807095'}]",,,,
1088574438331826176,1088574438331826176,2019-01-24 17:09:05 CST,2019-01-24,17:09:05,-0500,266653082,joshuasealy,Joshua Sealy-Harrington,,"“I’m often asked: ‘What’s the theory that explains you?’ We don’t need a theory greater than love. If your theory doesn’t ease suffering ... you need a better theory.” Great conversation with @JennyBoylan, Azli Zengin, and Catherine Clune-Taylor on reframing transgender violence.  https://t.co/f6V7Qc4w0U",en,"[{'screen_name': 'jennyboylan', 'name': 'jenny boylan \U0001fac0', 'id': '15969172'}]",[],['https://pbs.twimg.com/media/DxtkraXWsAEZ7nC.jpg'],0,1,2,[],[],https://twitter.com/JoshuaSealy/status/1088574438331826176,False,,1,https://pbs.twimg.com/media/DxtkraXWsAEZ7nC.jpg,new york city,,,,,,[],,,,
