id,conversation_id,created_at,date,time,timezone,user_id,username,name,place,tweet,language,mentions,urls,photos,replies_count,retweets_count,likes_count,hashtags,cashtags,link,retweet,quote_url,video,thumbnail,near,geo,source,user_rt_id,user_rt,retweet_id,reply_to,retweet_date,translate,trans_src,trans_dest
1162509136296329216,1162483944161329152,2019-08-16 18:39:11 CDT,2019-08-16,18:39:11,-0500,756903193901162496,reesetheone1,NewDemocrat4Life,,@Wonderbitch81 @Rissaistired The tightroping between the hard left and moderates is dangerous... That put you in danger of being the 2020 Rubio. That's my biggest Kamala concern.   Warren and sanders got the hard left. Black folks are moderate... Stay center left.,en,[],[],[],4,0,18,[],[],https://twitter.com/reesetheone1/status/1162509136296329216,False,,0,,chicago,,,,,,"[{'screen_name': 'Rissaistired', 'name': 'Rissa', 'id': '1441867871890522114'}]",,,,
1162506224337903617,1162500561578725378,2019-08-16 18:27:36 CDT,2019-08-16,18:27:36,-0500,928829323,johnsmithchgo,John Smith Chicago,,"@WeRiseTogether Can you imagine how ferociously DannyV would be condeming Hillary if she was the one who claimed she was too busy running for president to notice sexual harassment  complaints &amp; payoffs, while  allowing the harassers to keep their job &amp; even promoting one? #Hypocrite",en,[],[],[],2,2,16,['hypocrite'],[],https://twitter.com/JohnSmithChgo/status/1162506224337903617,False,,0,,chicago,,,,,,"[{'screen_name': 'WeRiseTogether', 'name': 'WeRiseTogether', 'id': '1196892704254386178'}]",,,,
1162504745866670082,1162483944161329152,2019-08-16 18:21:44 CDT,2019-08-16,18:21:44,-0500,756903193901162496,reesetheone1,NewDemocrat4Life,,"@Wonderbitch81 @Rissaistired Center-left is where I hope she runs... You have to say the EXACT SAME THING on your stances... (She gave Joe an opening on busing in Iowa when he was in big trouble. Axelrod seized on it, and her numbers fell off since July 4th. Media Miami into an attack.",en,[],[],[],2,1,11,[],[],https://twitter.com/reesetheone1/status/1162504745866670082,False,,0,,chicago,,,,,,"[{'screen_name': 'Rissaistired', 'name': 'Rissa', 'id': '1441867871890522114'}]",,,,
1162503835375550466,1162483944161329152,2019-08-16 18:18:07 CDT,2019-08-16,18:18:07,-0500,756903193901162496,reesetheone1,NewDemocrat4Life,,"@Wonderbitch81 @Rissaistired That's fine... You can have input. Obama's stuttering and use of ""uh"" annoyed me in 07-08... The veiled misogyny toward Clinton wasn't cool either.",en,[],[],[],2,1,18,[],[],https://twitter.com/reesetheone1/status/1162503835375550466,False,,0,,chicago,,,,,,"[{'screen_name': 'Rissaistired', 'name': 'Rissa', 'id': '1441867871890522114'}]",,,,
1162502823419895808,1162502135403220993,2019-08-16 18:14:06 CDT,2019-08-16,18:14:06,-0500,373055112,isaiahg_aap,IsaiahG,,@hoopingsfuture Did you see the fake behind the back pass tho? Abuse,en,[],[],[],2,0,0,[],[],https://twitter.com/IsaiahG_AAP/status/1162502823419895808,False,,0,,chicago,,,,,,"[{'screen_name': 'hoopingsfuture', 'name': 'HAMEED', 'id': '65679319'}]",,,,
1162502545979379718,1162502135403220993,2019-08-16 18:12:59 CDT,2019-08-16,18:12:59,-0500,373055112,isaiahg_aap,IsaiahG,,"@hoopingsfuture Those were cool blow by’s, he gave tony straight abuse tho lol also Issa joke",en,[],[],[],1,0,0,[],[],https://twitter.com/IsaiahG_AAP/status/1162502545979379718,False,,0,,chicago,,,,,,"[{'screen_name': 'hoopingsfuture', 'name': 'HAMEED', 'id': '65679319'}]",,,,
1162501336027553792,1162501336027553792,2019-08-16 18:08:11 CDT,2019-08-16,18:08:11,-0500,988123237572923392,thebsbshow,The Backstage Boys Podcast,,Catch up with the BSB as you head out to @FreelanceWres &amp; @FreelanceUndrgd this weekend! @Beezzzzy will be shooting both shows and previews some highlights!  Listen Now ⬇️   https://t.co/CoxWY7dnQt,en,"[{'screen_name': 'freelancewres', 'name': 'freelance wrestling', 'id': '1342830768'}, {'screen_name': 'freelanceundrgd', 'name': 'freelance underground', 'id': '802461404'}, {'screen_name': 'beezzzzy', 'name': 'basil mahmud', 'id': '19045110'}]",['https://soundcloud.com/user-974302183/bsb-ep-43'],[],0,0,1,[],[],https://twitter.com/TheBSBshow/status/1162501336027553792,False,,0,,chicago,,,,,,[],,,,
1162497908551430144,1162497908551430144,2019-08-16 17:54:34 CDT,2019-08-16,17:54:34,-0500,3804067889,maskchicago_,M.A.S.K.,,@everybodydn Helping children &amp; families cope with the threat and  devastating emotional effects of #DailyGunViolence . #MASKChicago #75thAndStewart #Englewood #AuburnGresham  https://t.co/anGgPhaW38,en,[],['https://www.instagram.com/p/B1Pe773lQfn/?igshid=176m039wsdeg4'],[],0,0,0,"['dailygunviolence', 'maskchicago', '75thandstewart', 'englewood', 'auburngresham']",[],https://twitter.com/MASKchicago_/status/1162497908551430144,False,,0,,chicago,,,,,,[],,,,
1162494097137065984,1162472493551984640,2019-08-16 17:39:25 CDT,2019-08-16,17:39:25,-0500,15671472,alyshaba,"Alysha ""Balto"" Balog",,@adamconover @Deadspin @Kotaku Nooooo. I look forward to The Hater’s Guide to the WilliamSonoma Holiday Catalog every year!!!   Plus their sarcastic tone really soothed the burn when they reported on my high school’s sexual abuse sports scandal.,en,[],[],[],0,0,3,[],[],https://twitter.com/alyshaba/status/1162494097137065984,False,,0,,chicago,,,,,,"[{'screen_name': 'adamconover', 'name': 'Adam Conover', 'id': '5880462'}, {'screen_name': 'Deadspin', 'name': 'Deadspin', 'id': '13213122'}, {'screen_name': 'Kotaku', 'name': 'Kotaku', 'id': '11928542'}]",,,,
1162493888684335104,1162493888684335104,2019-08-16 17:38:35 CDT,2019-08-16,17:38:35,-0500,61537047,realparkerj,"Parker, Lorde of Memes 🧢🤡🎻🎠",,some things are so humbling. Richard had so much left to do. 27 club is brutal man. rip dude see you again someday,en,[],[],[],0,0,2,[],[],https://twitter.com/RealParkerJ/status/1162493888684335104,False,,0,,chicago,,,,,,[],,,,
1162490528610553856,1162490528610553856,2019-08-16 17:25:14 CDT,2019-08-16,17:25:14,-0500,851431958261485569,bigtheymess,just a cute lil commie fag,,"Felony murder literally lets cops get away with murder, and legally attach it to someone else. It’s gross. It should be universally abolished.",en,[],[],[],0,0,0,[],[],https://twitter.com/bigtheymess/status/1162490528610553856,False,https://twitter.com/soit_goes/status/1162362030390747137,0,,chicago,,,,,,[],,,,
1162485707446923264,1162485707446923264,2019-08-16 17:06:05 CDT,2019-08-16,17:06:05,-0500,14220770,chgohunt,Scott J Hunter (שמואל דוד צייד),,The US is truly a country of white racist fools ... mindlessly oblivious to their own demise due to their choices.,en,[],[],[],0,0,0,[],[],https://twitter.com/chgohunt/status/1162485707446923264,False,,0,,chicago,,,,,,[],,,,
1162482834478686209,1162482834478686209,2019-08-16 16:54:40 CDT,2019-08-16,16:54:40,-0500,39313993,mariagalanis,mariagalanis.eth,,So powerful.   The danger of silence by @ClintSmithIII  https://t.co/7ILcMmaXPX via @TEDTalks,en,"[{'screen_name': 'clintsmithiii', 'name': 'clint smith', 'id': '472587261'}, {'screen_name': 'tedtalks', 'name': 'ted talks', 'id': '15492359'}]",['https://www.ted.com/talks/clint_smith_the_danger_of_silence?utm_source=twitter.com&utm_medium=social&utm_campaign=tedspread'],[],0,1,4,[],[],https://twitter.com/mariagalanis/status/1162482834478686209,False,,0,,chicago,,,,,,[],,,,
1162477798327558144,1162477798327558144,2019-08-16 16:34:39 CDT,2019-08-16,16:34:39,-0500,195885430,dakarai_turner,Dakarai Turner,,Breaking: US Customs and Border Protection system-wide “processing systems” outage is causing large delays at airports nationwide. CPB officers are processing travelers by hand. Agency does *not* believe it to be a cyber attack.  Travelers @fly2ohare affected as well.,en,"[{'screen_name': 'fly2ohare', 'name': ""o'hare intl. airport"", 'id': '415683367'}]",[],[],0,1,0,[],[],https://twitter.com/Dakarai_Turner/status/1162477798327558144,False,,0,,chicago,,,,,,[],,,,
1162475642144940034,1162475642144940034,2019-08-16 16:26:05 CDT,2019-08-16,16:26:05,-0500,455469411,cordhazard,Cordell,,That first Attack Attack album still hits different,en,[],[],[],0,0,0,[],[],https://twitter.com/CordHazard/status/1162475642144940034,False,,0,,chicago,,,,,,[],,,,
1162474328375595010,1162474328375595010,2019-08-16 16:20:52 CDT,2019-08-16,16:20:52,-0500,2573428999,thvc_,salami with cheese,,Imagine having a business called Aztec Motors and being racist lmao make it make sense pinche estupidos,en,[],[],[],0,0,2,[],[],https://twitter.com/thvc_/status/1162474328375595010,False,https://twitter.com/theweekndsbebe/status/1162170438895583234,0,,chicago,,,,,,[],,,,
1162471130239815682,1162471130239815682,2019-08-16 16:08:09 CDT,2019-08-16,16:08:09,-0500,1549030728,danielqherbert,Daniel Q Herbert,,Tune into @wlsam890 radio tonight at 6:05pm to hear @JohnHowellWLS interview Dan Herbert (Herbert Law Firm) about the felony murder rule.  https://t.co/4RtSLi8mYU,en,"[{'screen_name': 'wlsam890', 'name': 'wls-am 890', 'id': '90934547'}, {'screen_name': 'johnhowellwls', 'name': 'big john howell', 'id': '1039653806'}]",['https://www.chicagotribune.com/news/breaking/ct-cb-old-mill-creek-felony-murder-rule-20190815-bdfgucyyr5ftnlcvf67xrfppxu-story.html'],[],0,2,1,[],[],https://twitter.com/DanielQHerbert/status/1162471130239815682,False,,0,,chicago,,,,,,[],,,,
1162466139756212229,1162466139756212229,2019-08-16 15:48:19 CDT,2019-08-16,15:48:19,-0500,972521408264835072,gkmc18,GoodKidsMadCity,,This shit is only going to get worst especially when it’s so easy for white supremacist to get guns! #GoodKidsRacistCountry,en,[],[],[],0,1,7,['goodkidsracistcountry'],[],https://twitter.com/GKMC18/status/1162466139756212229,False,https://twitter.com/ABC/status/1162422338090164224,0,,chicago,,,,,,[],,,,
1162465296759894016,1162465296759894016,2019-08-16 15:44:58 CDT,2019-08-16,15:44:58,-0500,972521408264835072,gkmc18,GoodKidsMadCity,,Racist places to avoid for $500 Alex,en,[],[],[],1,3,9,[],[],https://twitter.com/GKMC18/status/1162465296759894016,False,https://twitter.com/kayleighmcenany/status/1162075494571024385,0,,chicago,,,,,,[],,,,
1162459551112814594,1162140914640478216,2019-08-16 15:22:09 CDT,2019-08-16,15:22:09,-0500,3094321,dkaz,Derek K,,@TheMarkPantano @BernieSanders Mark Patano is the same dude whose pinned tweet is about his right to a machine gun. Now that’s next level redneck stupid.,en,[],[],[],0,0,1,[],[],https://twitter.com/dkaz/status/1162459551112814594,False,,0,,chicago,,,,,,"[{'screen_name': 'BernieSanders', 'name': 'Bernie Sanders', 'id': '216776631'}]",,,,
