id,conversation_id,created_at,date,time,timezone,user_id,username,name,place,tweet,language,mentions,urls,photos,replies_count,retweets_count,likes_count,hashtags,cashtags,link,retweet,quote_url,video,thumbnail,near,geo,source,user_rt_id,user_rt,retweet_id,reply_to,retweet_date,translate,trans_src,trans_dest
1080953880010096640,1080953880010096640,2019-01-03 16:27:42 CST,2019-01-03,16:27:42,-0500,114902819,guerrierfitness,Jouvenel Guerrier,"{'type': 'Point', 'coordinates': [32.81064, -117.11611]}","Stop worrying about how it looks or how it sounds, surgery looks like murder but it saves lives. BE you, BE relentless, BE undeniable, BE brave, BE strong, BELIEVE. @ Self Made Training…  https://t.co/cJ8PEYUcg4",en,[],['https://www.instagram.com/p/BsMGL6IgFuY/?utm_source=ig_twitter_share&igshid=r9sim1hw51l8'],[],0,0,0,[],[],https://twitter.com/GuerrierFitness/status/1080953880010096640,False,,0,,san diego,,,,,,[],,,,
1080953648765579265,1080949969543081985,2019-01-03 16:26:47 CST,2019-01-03,16:26:47,-0500,1349454619,ehukai411,Larry Shea,,@billmaher They hate the Bernie Bros because he wouldn’t lay down for the Queen so all her flying monkeys are on the attack.,en,[],[],[],0,0,0,[],[],https://twitter.com/Ehukai411/status/1080953648765579265,False,,0,,san diego,,,,,,"[{'screen_name': 'billmaher', 'name': 'Bill Maher', 'id': '19697415'}]",,,,
1080935328775467008,1080935328775467008,2019-01-03 15:13:59 CST,2019-01-03,15:13:59,-0500,1016740842512371712,noyoweb,Nicholas Paul DePalmer,,"$NBEV coordinated attack with today’s Seeking Alpha hit piece article. Shorts won’t be able to keep the PPS down with this volume. I don’t feel sorry for the weak hands. Way undervalued, buy all you can in low $5’s.",en,[],[],[],1,4,19,[],['nbev'],https://twitter.com/noyoweb/status/1080935328775467008,False,,0,,san diego,,,,,,[],,,,
1080927663718465536,1080927663718465536,2019-01-03 14:43:32 CST,2019-01-03,14:43:32,-0500,593890083,otero_kc22,Ruben,,The @Lakers will go down as the worst free throw shooting team in history,en,"[{'screen_name': 'lakers', 'name': 'los angeles lakers', 'id': '20346956'}]",[],[],0,0,0,[],[],https://twitter.com/otero_kc22/status/1080927663718465536,False,,0,,san diego,,,,,,[],,,,
1080923807311814656,1080923807311814656,2019-01-03 14:28:12 CST,2019-01-03,14:28:12,-0500,341249096,katthebinch,ketchup,,elder abuse,en,[],[],[],0,0,0,[],[],https://twitter.com/katthebinch/status/1080923807311814656,False,,0,,san diego,,,,,,[],,,,
1080921997889040384,1080919069384048641,2019-01-03 14:21:01 CST,2019-01-03,14:21:01,-0500,1560918404,tjtony82,C Rubio,,"@MZepeda77 @Weezer @javieramena @monlaferte Que pena me acuerdo cuando hace unos años el lineup eran más chingones Depeche Mode o blur, rage y muchos más ahora j balvin y hasta Ariana grande no manches",es,[],[],[],1,0,1,[],[],https://twitter.com/tjtony82/status/1080921997889040384,False,,0,,san diego,,,,,,"[{'screen_name': 'MZepeda77', 'name': 'Manuel Zepeda', 'id': '3242088566'}, {'screen_name': 'Weezer', 'name': 'weezer', 'id': '16685316'}, {'screen_name': 'javieramena', 'name': 'Javiera Mena', 'id': '20542393'}, {'screen_name': 'monlaferte', 'name': 'Mon Laferte', 'id': '118247792'}]",,,,
1080918870943125504,1080662413072945152,2019-01-03 14:08:35 CST,2019-01-03,14:08:35,-0500,378341723,charlesdainoff,Charles Dainoff,,"@commiegirl1 @TheYoungTurks @cenkuygur Just out of curiosity, do they ever attack men?",en,[],[],[],1,0,1,[],[],https://twitter.com/CharlesDainoff/status/1080918870943125504,False,,0,,san diego,,,,,,"[{'screen_name': 'commiegirl1', 'name': 'Master Rebecca Schoenkopf, Wonkette Editrix, King', 'id': '53259553'}, {'screen_name': 'TheYoungTurks', 'name': 'The Young Turks', 'id': '14957147'}, {'screen_name': 'cenkuygur', 'name': 'Cenk Uygur', 'id': '429227921'}]",,,,
1080910034673037312,1080910034673037312,2019-01-03 13:33:29 CST,2019-01-03,13:33:29,-0500,29912828,jeffkrapf,Jeff Krapf,"{'type': 'Point', 'coordinates': [32.80719, -117.11942]}","Shooting a few spots for California Live which will be airing 5 days a week on @nbcsandiego in SD, LA and SF. Excited to be a part of the show. Charlie came today to approve the final…  https://t.co/psB4UpbsZF",en,"[{'screen_name': 'nbcsandiego', 'name': 'nbc 7 san diego', 'id': '15535860'}]",['https://www.instagram.com/p/BsLyz9XnfaI/?utm_source=ig_twitter_share&igshid=1cfi0254y36kj'],[],0,0,0,[],[],https://twitter.com/jeffkrapf/status/1080910034673037312,False,,0,,san diego,,,,,,[],,,,
1080908739979313153,1080873817222787072,2019-01-03 13:28:20 CST,2019-01-03,13:28:20,-0500,771795931637379072,bhayes2016,Beverly Hayes,,"@honourableone @travis_view Why? Bc demacrat supremacist are getting away with trying to bankrupt Americans i.e.  IRS, keeping wars going, trying to start new ones (Russia).  Pelosi Husband awarded 450Million wind mill farm in desert, selling arms to ISIS via Libya. Dossier? SC with only dems on council....",en,[],[],[],1,0,0,[],[],https://twitter.com/bhayes2016/status/1080908739979313153,False,,0,,san diego,,,,,,"[{'screen_name': 'HonourableOne', 'name': 'Honourable One', 'id': '1265450812131680256'}, {'screen_name': 'travis_view', 'name': 'Travis View', 'id': '864674587518287872'}]",,,,
1080908673256382464,1080908673256382464,2019-01-03 13:28:04 CST,2019-01-03,13:28:04,-0500,817224743958908928,cristynutsxx,lupita,,some people think rap music is bad for the mind and if you fill your mind with things like guns and violence and curse words it’ll make you think negative.... butttttt that’s not the case at all!! I know so many people that hate rap music or hip hop,en,[],[],[],0,0,0,[],[],https://twitter.com/cristynutsxx/status/1080908673256382464,False,,0,,san diego,,,,,,[],,,,
1080897773032026112,1080897773032026112,2019-01-03 12:44:45 CST,2019-01-03,12:44:45,-0500,231511012,jordanalipscomb,"Jordana, Pom Mom🇺🇦",,I think Paul Whelan May be a spy and it seems Russia is going to imprison him there for that crime. That sounds like it’s within their rights,en,[],[],[],0,0,1,[],[],https://twitter.com/jordanalipscomb/status/1080897773032026112,False,,0,,san diego,,,,,,[],,,,
1080892948579987457,1080858978958172160,2019-01-03 12:25:35 CST,2019-01-03,12:25:35,-0500,994980360789282819,bobairborne,BobAirborne,,@DailyCaller @WeThePeopleFor Governor Brown's accomplice. Brown has to be arrested as a conspirator in the murder of a police officer.,en,[],[],[],0,0,0,[],[],https://twitter.com/BobAirborne/status/1080892948579987457,False,,0,,san diego,,,,,,"[{'screen_name': 'DailyCaller', 'name': 'Daily Caller', 'id': '39308549'}, {'screen_name': 'WeThePeopleFor', 'name': 'We The People *REACTIVATED*🦅🇺🇸', 'id': '707077738620780544'}]",,,,
1080888671509741568,1080858788750610432,2019-01-03 12:08:35 CST,2019-01-03,12:08:35,-0500,930788816494956545,hookscar,HOOKSCAR,,"@o456wop @tlglawson70 This is true. It is also a fact that those claiming to fight for the rights of registrants will only represent them AFTER harm has been done. Being reactive, not proactive, nothing will change.I have been on the registry for 20+ years.The majority of my adult life. #neverforgiven",en,[],[],[],0,0,0,['neverforgiven'],[],https://twitter.com/HOOKSCAR/status/1080888671509741568,False,,0,,san diego,,,,,,"[{'screen_name': 'o456wop', 'name': 'Richard Whitman', 'id': '763442707570262016'}, {'screen_name': 'tlglawson70', 'name': 'Tammie Lawson', 'id': '2875693614'}]",,,,
1080884097545691138,1080331676729786368,2019-01-03 11:50:25 CST,2019-01-03,11:50:25,-0500,15149945,tenthmuse,Joelle ✨,,"@AdonStandsAlone I took screenshots too. I’m not here to be aggressive. I just wish these kinds of convos didn’t lead to this level of rage. Can you not see I’m trying to be compassionate? I’m trying to understand. If I’m being ableist, maybe show me how and not rage at me?",en,[],[],[],1,0,0,[],[],https://twitter.com/tenthmuse/status/1080884097545691138,False,,0,,san diego,,,,,,"[{'screen_name': 'AdonStandsAlone', 'name': 'Terrell', 'id': '206076016'}]",,,,
1080881797737545729,1080331676729786368,2019-01-03 11:41:17 CST,2019-01-03,11:41:17,-0500,15149945,tenthmuse,Joelle ✨,,"@AngryBlackLady I had two diplomatic &amp; compassionate tweets here that I am now deleting because outrage is clouding reason and twisting my words. Call me names, attack me, whatever. FWIW, I’m genuinely sorry that happened to you.",en,[],[],[],1,0,0,[],[],https://twitter.com/tenthmuse/status/1080881797737545729,False,,0,,san diego,,,,,,"[{'screen_name': 'AngryBlackLady', 'name': '⚓️Imani Gandy⚓️', 'id': '46822887'}]",,,,
1080881291480846336,1080881291480846336,2019-01-03 11:39:16 CST,2019-01-03,11:39:16,-0500,596144748,susanfso,susan page,,"@cspan   we have seen in the shooting in Newman all the ""help"" illegals gave to  murderous fugituve, whom illegals aided and abetted to flee.  BTW, @MigrationPolicy supports open borders.",en,"[{'screen_name': 'migrationpolicy', 'name': 'migrationpolicy inst', 'id': '45421005'}]",[],[],0,0,0,[],[],https://twitter.com/susanfso/status/1080881291480846336,False,,0,,san diego,,,,,,[],,,,
1080867073071316992,1076161920116363266,2019-01-03 10:42:46 CST,2019-01-03,10:42:46,-0500,994980360789282819,bobairborne,BobAirborne,,"@KayColesJames And then Britain can stop supporting violent muslims, pack them up in rubber boats and send them back across the channel to the EU.",en,[],[],[],0,0,0,[],[],https://twitter.com/BobAirborne/status/1080867073071316992,False,,0,,san diego,,,,,,"[{'screen_name': 'KayColesJames', 'name': 'Kay C. James', 'id': '942089577975697408'}]",,,,
1080866582954266627,1080837263913832449,2019-01-03 10:40:49 CST,2019-01-03,10:40:49,-0500,15126802,orlandogotay,Orlando Gotay,,"@realDonaldTrump Victim, victim victim....poor little me...",en,[],[],[],0,0,1,[],[],https://twitter.com/orlandogotay/status/1080866582954266627,False,,0,,san diego,,,,,,"[{'screen_name': 'realDonaldTrump', 'name': 'Donald J. Trump', 'id': '25073877'}]",,,,
1080865435715686400,1080865435715686400,2019-01-03 10:36:16 CST,2019-01-03,10:36:16,-0500,771795931637379072,bhayes2016,Beverly Hayes,,Tammy Bruce: Romney's Trump attack rings especially hollow when you look at his treatment of Ric Grenell   https://t.co/EHNiigceT3,en,[],['https://www.foxnews.com/opinion/tammy-bruce-romneys-trump-attack-rings-especially-hollow-when-you-look-at-his-treatment-of-ric-grenell'],[],0,0,0,[],[],https://twitter.com/bhayes2016/status/1080865435715686400,False,,0,,san diego,,,,,,[],,,,
1080864269522989058,1080864269522989058,2019-01-03 10:31:37 CST,2019-01-03,10:31:37,-0500,771795931637379072,bhayes2016,Beverly Hayes,,Tucker Carlson: The left wants to take away your straws – but ignores actual environmental problems   https://t.co/3JYM3smXz5 The liberal supremacist like low issues but no solutions for biggest problems.  Liberal supremacist like to hear themselves talk but when do solutions come,en,[],['https://www.foxnews.com/opinion/tucker-carlson-the-left-wants-to-take-away-your-straws-but-ignores-actual-environmental-problems'],[],0,0,0,[],[],https://twitter.com/bhayes2016/status/1080864269522989058,False,,0,,san diego,,,,,,[],,,,
1080864175591546880,1080593402092314624,2019-01-03 10:31:15 CST,2019-01-03,10:31:15,-0500,9874942,keepintouch1,bakagaijin,,@peterbakernyt So the boycott of the 1980 Olympics in Moscow was in celebration of the invasion of Afghanistan not a protest against?,en,[],[],[],0,0,0,[],[],https://twitter.com/keepintouch1/status/1080864175591546880,False,,0,,san diego,,,,,,"[{'screen_name': 'peterbakernyt', 'name': 'Peter Baker', 'id': '123327472'}]",,,,
1080843538449846274,1080843538449846274,2019-01-03 09:09:15 CST,2019-01-03,09:09:15,-0500,157838822,mmboltz,boltzworth,,your Twitter may be private but I still follow you and all those racists sexist and homophobic tweets are going to BITE YOU IN THE ASS,en,[],[],[],0,0,0,[],[],https://twitter.com/mmBoltz/status/1080843538449846274,False,,0,,san diego,,,,,,[],,,,
1080834815585341440,1080834815585341440,2019-01-03 08:34:35 CST,2019-01-03,08:34:35,-0500,33700393,terrelllatimer,#RollTide 🐘🏈🏆 (he/him/his),"{'type': 'Point', 'coordinates': [32.7819891, -117.0854358]}","No weapon against my shall prosper, but it's welcome to form 🤙🏾💪🏾🙏🏾😎 . . . . . #PositiveVibesOnly  #2019  #NewYearSameMe  #Focused  #Goals  #Motivated  #Determined  #Driven @ Levanto…  https://t.co/5VOR9Dueeu",en,[],['https://www.instagram.com/p/BsLP1wlFRu0/?utm_source=ig_twitter_share&igshid=7rco0d91p68v'],[],1,0,1,"['positivevibesonly', 'newyearsameme', 'focused', 'goals', 'motivated', 'determined', 'driven']",[],https://twitter.com/terrelllatimer/status/1080834815585341440,False,,0,,san diego,,,,,,[],,,,
1080832592683753472,1080832592683753472,2019-01-03 08:25:45 CST,2019-01-03,08:25:45,-0500,17639065,demimancy,demi ✨💖💜💙✨,,"Hi, I’m a bi woman in a movie. I yearn, unfulfilled, for my best friend AND her male love interest and I die from brutal violence before the end.",en,[],[],[],0,0,4,[],[],https://twitter.com/demimancy/status/1080832592683753472,False,https://twitter.com/nicktheandersen/status/1080831587472887808,0,,san diego,,,,,,[],,,,
1080829472444542977,1080829472444542977,2019-01-03 08:13:21 CST,2019-01-03,08:13:21,-0500,432240724,asu_superfan,ASU_SuperFan,,"(1) I always sit in the first two rows, so what’s the harm? (2) It feels nice to stand, especially after a 4+ hr flight. (3) I AM an asshole, so deal with it.",en,[],[],[],1,0,5,[],[],https://twitter.com/ASU_SuperFan/status/1080829472444542977,False,https://twitter.com/MensHumor/status/1080828628114513920,0,,san diego,,,,,,[],,,,
1080753007728283649,1080263362183917568,2019-01-03 03:09:31 CST,2019-01-03,03:09:31,-0500,140324192,ddwebb30,Dwayne Webb,,@realDonaldTrump Kinda like the Republicans blocked Obama’s Supreme Court nomination so they could put a judge that sexually assault women and is a drunk on the bench!!,en,[],[],[],0,0,0,[],[],https://twitter.com/ddwebb30/status/1080753007728283649,False,,0,,san diego,,,,,,"[{'screen_name': 'realDonaldTrump', 'name': 'Donald J. Trump', 'id': '25073877'}]",,,,
1080735619683237888,1080735619683237888,2019-01-03 02:00:25 CST,2019-01-03,02:00:25,-0500,1064958067,sumsumnoodle,Summer Joy,,"Why is one of Elizabeth Smart’s kidnappers being released from a Utah prison? Here are answers to six big questions., via @sltrib  https://t.co/DNlB9N6iII Disgusting American judges and boards who decide. Did you decide its okay this witch watched DM rape a child",en,"[{'screen_name': 'sltrib', 'name': 'the salt lake tribune', 'id': '15369276'}]",['https://www.sltrib.com/news/2018/09/17/why-is-one-elizabeth'],[],0,0,0,[],[],https://twitter.com/sumsumnoodle/status/1080735619683237888,False,,0,,san diego,,,,,,[],,,,
1080708027458543616,1080708027458543616,2019-01-03 00:10:46 CST,2019-01-03,00:10:46,-0500,9422872,timjackson,TimJackson,,"Orange jumpsuits are going to be all the rage in 2019, @realDonaldTrump",en,"[{'screen_name': 'realdonaldtrump', 'name': 'donald j. trump', 'id': '25073877'}]",[],[],1,0,2,[],[],https://twitter.com/TimJackson/status/1080708027458543616,False,https://twitter.com/Nik0215/status/1080606514434490368,0,,san diego,,,,,,[],,,,
1080704744694239232,1080704744694239232,2019-01-02 23:57:44 CST,2019-01-02,23:57:44,-0500,18550652,xdr_jon3sx,xDR_JON3Sx 🍥,,"What is your favorite PVE weapon in Destiny right now, and if its not The Huckleberry, why are you wrong? #Destiny2  https://t.co/qnLs1HAOTO",en,[],[],['https://pbs.twimg.com/tweet_video_thumb/Dv9vOtuU8AAwFzM.jpg'],2,0,5,['destiny2'],[],https://twitter.com/xDR_JON3Sx/status/1080704744694239232,False,,1,https://pbs.twimg.com/tweet_video_thumb/Dv9vOtuU8AAwFzM.jpg,san diego,,,,,,[],,,,
1080703564475883520,1080703564475883520,2019-01-02 23:53:02 CST,2019-01-02,23:53:02,-0500,3248097078,suncoastchief,El Dub,,"Palm trees, ocean view, initial fire attack of the tank....or as we call it on the SunCoast. Wednesday",en,[],[],[],2,0,10,[],[],https://twitter.com/SunCoastChief/status/1080703564475883520,False,https://twitter.com/fox5sandiego/status/1080619772654440448,0,,san diego,,,,,,[],,,,
1080696579651035136,1080696579651035136,2019-01-02 23:25:17 CST,2019-01-02,23:25:17,-0500,502385901,dayesalani,dayesalani,,"After this @Lakers game, I’m going to watch my favorite Curb Your Enthusiasm episode. Fun fact: This ep helped get a dude out of jail. He was on parole. Arrested for murder I believe. He kept telling police he was at @dodgers game &amp; Super Dave Osborne was filming some show.  https://t.co/Vsa0pd5Au9",en,"[{'screen_name': 'lakers', 'name': 'los angeles lakers', 'id': '20346956'}, {'screen_name': 'dodgers', 'name': 'los angeles dodgers', 'id': '23043294'}]",[],['https://pbs.twimg.com/media/Dv9nzwRXQAAvVS8.jpg'],0,0,1,[],[],https://twitter.com/dayesalani/status/1080696579651035136,False,,1,https://pbs.twimg.com/media/Dv9nzwRXQAAvVS8.jpg,san diego,,,,,,[],,,,
1080694834409570306,1080694834409570306,2019-01-02 23:18:21 CST,2019-01-02,23:18:21,-0500,3311700643,amlahr224,Anne-Marie Lahr,,Cindy Crawford &amp; Rande Gerber’s Kids Out Of Control Amid Son Presley’s DUI Arrest - Radar Online  https://t.co/OYY0HaN7lw,en,[],['https://apple.news/AMAq0ehPFTXSpD1sz3pFwtg'],[],0,0,0,[],[],https://twitter.com/amlahr224/status/1080694834409570306,False,,0,,san diego,,,,,,[],,,,
1080690729674891265,1080690729674891265,2019-01-02 23:02:02 CST,2019-01-02,23:02:02,-0500,2814044250,sdresister,Seriously?,,Because rules and laws don’t apply to the #TrumpCrimeFamily and associates off said crime family.,en,[],[],[],0,0,0,['trumpcrimefamily'],[],https://twitter.com/SdResister/status/1080690729674891265,False,https://twitter.com/matthewamiller/status/1080608718071496705,0,,san diego,,,,,,[],,,,
1080688752828153856,1080488978204278785,2019-01-02 22:54:11 CST,2019-01-02,22:54:11,-0500,500437077,jessicammeza1,Jessica M Meza,,@USCCB @CoCatholicRadio How much $ is that going to cost and don’t forget over 80% of the cases are male to male abuse (pederasty and homosexuality),en,[],[],[],0,0,2,[],[],https://twitter.com/JessicaMMeza1/status/1080688752828153856,False,,0,,san diego,,,,,,"[{'screen_name': 'USCCB', 'name': 'U.S. Conference of Catholic Bishops', 'id': '19408552'}, {'screen_name': 'CoCatholicRadio', 'name': 'CoCatholicRadio', 'id': '3250745418'}]",,,,
1080687199656407042,1080517327215579137,2019-01-02 22:48:01 CST,2019-01-02,22:48:01,-0500,1242131310,dare_se,DaRe Se,,"@nowthisnews Horrible... may God have mercy on our souls. And shield them from any danger.  Amnesty is a human right. It can be asked at any U.S. port of entry. If they jump the fense, they can simply state that once on this side.",en,[],[],[],0,0,0,[],[],https://twitter.com/DaRe_Se/status/1080687199656407042,False,,0,,san diego,,,,,,"[{'screen_name': 'nowthisnews', 'name': 'NowThis', 'id': '701725963'}]",,,,
1080686950728622081,1080686950728622081,2019-01-02 22:47:01 CST,2019-01-02,22:47:01,-0500,4774844352,dragon69lover,Ken Sky Wilkerson,,@JillKassidyy Hi Jill &amp; hope your day was great &amp; mine was alright &amp; getting a few DM’s &amp; one from a fake of yours &amp; got it reported.  The fake is @JilKassidyy &amp; hope no one will fall victim to this creep.,en,"[{'screen_name': 'jilkassidyy', 'name': 'jill kassidy', 'id': '1154876991100686336'}]",[],[],0,0,1,[],[],https://twitter.com/Dragon69lover/status/1080686950728622081,False,,0,,san diego,,,,,,[],,,,
1080686802929733634,1080686802929733634,2019-01-02 22:46:26 CST,2019-01-02,22:46:26,-0500,771795931637379072,bhayes2016,Beverly Hayes,,Bernie Sanders on why he was unaware of sexual harassment claims rocking campaign: 'I was a little bit busy'   https://t.co/ucYVWjuP6t Sanders knew but was too busy getting paid off by Hillary/Obama to drop &amp; let fail candidate Hillary run.  Shame on Bernie almost 2 yrs later,en,[],['https://www.foxnews.com/politics/bernie-sanders-says-he-was-busy-amid-sexual-misconduct-allegations-during-campaign'],[],0,0,0,[],[],https://twitter.com/bhayes2016/status/1080686802929733634,False,,0,,san diego,,,,,,[],,,,
1080674132943990784,1080647162847883264,2019-01-02 21:56:05 CST,2019-01-02,21:56:05,-0500,494578670,merrediitth,m ❃,,@riddhish_rana **non violence** :),fr,[],[],[],2,0,0,[],[],https://twitter.com/merrediitth/status/1080674132943990784,False,,0,,san diego,,,,,,"[{'screen_name': 'riddhish_rana', 'name': 'Riddhish Singh Rana Ⓥ', 'id': '150779171'}]",,,,
1080667173490548737,1080667173490548737,2019-01-02 21:28:26 CST,2019-01-02,21:28:26,-0500,2658540716,bunnlcula,prana ferox,,"we would love to stop being ostracized, in danger of being denied healthcare, and often denied job protections but...go...off...I guess",en,[],[],[],0,2,12,[],[],https://twitter.com/BUNNlCULA/status/1080667173490548737,False,https://twitter.com/TransLawCenter/status/1080523534449938432,0,,san diego,,,,,,[],,,,
1080662523462901761,1080613472180883457,2019-01-02 21:09:57 CST,2019-01-02,21:09:57,-0500,204102003,bcline760,Spring Archer,,"@FenBorman @NateAbaurrea @JordanCarruth Pulisic feeding King or Callum Wilson would make Bournemouth’s attack pretty good. Even though they have an Arsenal-like defense, Pulisic would be good for the Cherries.",en,[],[],[],0,0,0,[],[],https://twitter.com/bcline760/status/1080662523462901761,False,,0,,san diego,,,,,,"[{'screen_name': 'FenBorman', 'name': 'Ben Forman', 'id': '24811033'}, {'screen_name': 'NateAbaurrea', 'name': 'Nate Abaurrea', 'id': '1589859523'}, {'screen_name': 'JordanCarruth', 'name': 'Jordan Carruth', 'id': '131382904'}]",,,,
1080661309048475649,1080661309048475649,2019-01-02 21:05:08 CST,2019-01-02,21:05:08,-0500,28927657,johnnyalonso,Johnny Alonso,,"Sneak peak at my #Rockabilly #haircut for the new #mob #film The Driver. Shooting this weekend back east. Love my undercover wop narc rat character Lenny Salamente. Go ahead, you couldn't touch this if you tried. I dare you. See you on set #TheDriverMovie #italians #mob #actor  https://t.co/7PksCBPWxJ",en,[],[],['https://pbs.twimg.com/media/Dv9HuhxXcAAihTt.jpg'],1,0,10,"['rockabilly', 'haircut', 'mob', 'film', 'thedrivermovie', 'italians', 'mob', 'actor']",[],https://twitter.com/johnnyalonso/status/1080661309048475649,False,,1,https://pbs.twimg.com/media/Dv9HuhxXcAAihTt.jpg,san diego,,,,,,[],,,,
1080658883536973825,1080658883536973825,2019-01-02 20:55:30 CST,2019-01-02,20:55:30,-0500,1065792255624044544,caravanasupport,Caravan Support Network #AsylumSeekers #Exodus,"{'type': 'Point', 'coordinates': [32.52235073, -117.06446424]}","customsborder claims they fired 3 canisters of OC tear gas. After initially treating several of the badly injured, including a likely broken knee cap, we can confirm #US #borderpatrol are…  https://t.co/m18Y6qV42U",en,[],['https://www.instagram.com/p/BsKAP6DBK1s/?utm_source=ig_twitter_share&igshid=1qj7pjj79v9do'],[],0,5,3,"['us', 'borderpatrol']",[],https://twitter.com/CaravanaSupport/status/1080658883536973825,False,,0,,san diego,,,,,,[],,,,
1080639281394118656,1080543022872477697,2019-01-02 19:37:36 CST,2019-01-02,19:37:36,-0500,20046700,flachituk,Stormsy,,@TheRickWilson General Urko was less racist.,en,[],[],[],0,0,0,[],[],https://twitter.com/flachituk/status/1080639281394118656,False,,0,,san diego,,,,,,"[{'screen_name': 'TheRickWilson', 'name': 'Rick Wilson', 'id': '19084896'}]",,,,
1080637593706876929,1080162639723089920,2019-01-02 19:30:54 CST,2019-01-02,19:30:54,-0500,345779170,brokenbose,John Becknell,,"@CatholicJames @SixthMansion And who gave you the impetus to make the decision that Francis isn't the Pope? Isn't that exactly what all Protestants do--protest against the ""errors of Rome""? If Francis is not the Pope, but he sits on Peter's Cathedras, then the Church has been overtaken by evil men, right?",en,[],[],[],1,0,0,[],[],https://twitter.com/brokenbose/status/1080637593706876929,False,,0,,san diego,,,,,,"[{'screen_name': 'CatholicJames', 'name': 'Saint James Catholic School', 'id': '1116068719128731653'}]",,,,
1080625340903387136,1080625340903387136,2019-01-02 18:42:12 CST,2019-01-02,18:42:12,-0500,310386655,buterabye,Tati🍄,,I wanna RAGE,en,[],[],[],0,0,3,[],[],https://twitter.com/buterabye/status/1080625340903387136,False,,0,,san diego,,,,,,[],,,,
1080618900776091648,1080618900776091648,2019-01-02 18:16:37 CST,2019-01-02,18:16:37,-0500,249460933,freddienoir_,BIG VI,,I feel like more women abuse men in relationships than the reciprocal,en,[],[],[],0,0,0,[],[],https://twitter.com/FreddieNoir_/status/1080618900776091648,False,,0,,san diego,,,,,,[],,,,
1080618825597345793,1080601409509384192,2019-01-02 18:16:19 CST,2019-01-02,18:16:19,-0500,390213607,mjcoad,Mamma Jamma,,"@eugenegu @nytimes I’m curious if you read the essay.  You two are actually saying something similar.  The author talks about using grudge-worthy events as a tool for learning, not holding onto anger at your own detriment.",en,[],[],[],0,0,4,[],[],https://twitter.com/MJCoad/status/1080618825597345793,False,,0,,san diego,,,,,,"[{'screen_name': 'eugenegu', 'name': 'Eugene Gu, MD', 'id': '65497475'}, {'screen_name': 'nytimes', 'name': 'The New York Times', 'id': '807095'}]",,,,
1080617532778676224,1080617530459283456,2019-01-02 18:11:11 CST,2019-01-02,18:11:11,-0500,615880714,chelsisparti,Chelsi Sparti,,It wasn’t a moral judgement or a challenge to the 2nd amendment. It was a curiosity about how we got to this fearful defense. Gun violence prevention is about how we relate to a weapon. How we train our children and neighbors to be sensible with weapons.  My friend was astonished,en,[],[],[],0,0,1,[],[],https://twitter.com/ChelsiSparti/status/1080617532778676224,False,,0,,san diego,,,,,,[],,,,
