id,conversation_id,created_at,date,time,timezone,user_id,username,name,place,tweet,language,mentions,urls,photos,replies_count,retweets_count,likes_count,hashtags,cashtags,link,retweet,quote_url,video,thumbnail,near,geo,source,user_rt_id,user_rt,retweet_id,reply_to,retweet_date,translate,trans_src,trans_dest
1132433480506331137,1132433480506331137,2019-05-25 18:49:16 CDT,2019-05-25,18:49:16,-0500,1057708383673954305,knockoutbros4k,KnockoutBrothers,,@FortniteGame - Emilio trying to get me to buy a #fortnite gun which is bigger than he is !  He's so excited and happy to see it :)  https://t.co/MC4wFN2kh8,en,[],[],['https://pbs.twimg.com/media/D7c2NgVWkAIgfYU.jpg'],0,0,0,['fortnite'],[],https://twitter.com/knockoutbros4k/status/1132433480506331137,False,,1,https://pbs.twimg.com/media/D7c2NgVWkAIgfYU.jpg,chicago,,,,,,[],,,,
1132426507022983168,1132426507022983168,2019-05-25 18:21:33 CDT,2019-05-25,18:21:33,-0500,426402737,eixelexie_,l e x i e 🧚🏾 ✨ 💞,,yeeeesss but i hate how much violence be going on in the summer ☹️😩,en,[],[],[],0,0,1,[],[],https://twitter.com/eixelexie_/status/1132426507022983168,False,https://twitter.com/AriTheDon/status/1132416615264464896,0,,chicago,,,,,,[],,,,
1132426420104380417,1131972244832436224,2019-05-25 18:21:12 CDT,2019-05-25,18:21:12,-0500,330410875,caitrose609,caitrose609,,"@gigboxstar @AshleyJudd Victim blaming, exhibit 5,000. We do tell people; they don’t listen or take us seriously. Educate yourself before blaming victims for their perpetrators’ actions.",en,[],[],[],0,0,0,[],[],https://twitter.com/caitrose609/status/1132426420104380417,False,,0,,chicago,,,,,,"[{'screen_name': 'AshleyJudd', 'name': 'ashley judd', 'id': '248747209'}]",,,,
1132421747188338694,1132379558609588224,2019-05-25 18:02:38 CDT,2019-05-25,18:02:38,-0500,616369407,whitemencantfnk,Mr. FOE-LAYY,,"@cosimo_sarti @ScoutWithBryan He can drive past a defender on a poor close out/after a pump fake (only a threat if he can knock down a shot), can back a smaller defender down &amp; make a decent read &amp; pass out of it, but in no way does Mirotic have the ball handling and passing skills to be a real threat in PNR",en,[],[],[],1,0,0,[],[],https://twitter.com/WhiteMenCantFnk/status/1132421747188338694,False,,0,,chicago,,,,,,"[{'screen_name': 'cosimo_sarti', 'name': 'Cosimo Sarti', 'id': '1665146221'}, {'screen_name': 'ScoutWithBryan', 'name': 'SCOUTWITHBRYAN', 'id': '114357339'}]",,,,
1132419868693868545,1132413516063870977,2019-05-25 17:55:10 CDT,2019-05-25,17:55:10,-0500,184650551,cardboardmovie,😎🌹,,"@realDonaldTrump Sir, I hearby proclaim a citizen’s arrest against you in accordance with US Law, for treason....against all laws of spelling/grammar!!!🤬",en,[],[],[],2,0,9,[],[],https://twitter.com/Cardboardmovie/status/1132419868693868545,False,,0,,chicago,,,,,,"[{'screen_name': 'realDonaldTrump', 'name': 'Donald J. Trump', 'id': '25073877'}]",,,,
1132418301622128640,1132379558609588224,2019-05-25 17:48:57 CDT,2019-05-25,17:48:57,-0500,616369407,whitemencantfnk,Mr. FOE-LAYY,,"@cosimo_sarti @ScoutWithBryan The problem is he’s really not THAT good at making plays doing those “other things” to make him a focal point of the offense. His best attribute is his 3pt shooting, but yet he can’t consistently knock down a 3pt shot on the catch and shoot.",en,[],[],[],1,0,0,[],[],https://twitter.com/WhiteMenCantFnk/status/1132418301622128640,False,,0,,chicago,,,,,,"[{'screen_name': 'cosimo_sarti', 'name': 'Cosimo Sarti', 'id': '1665146221'}, {'screen_name': 'ScoutWithBryan', 'name': 'SCOUTWITHBRYAN', 'id': '114357339'}]",,,,
1132417054651371522,1132417054651371522,2019-05-25 17:43:59 CDT,2019-05-25,17:43:59,-0500,1018651186398945280,burningblue5,Burningblue,"{'type': 'Point', 'coordinates': [41.98005103, -87.86112081]}","I will not be defeated!!   My fists are forged in the flames of murder! Your soul is fettered by goodness. Fall, and accept your fate!! I felt nothing...The path to mastery is lined with the corpses of the weak! You…  https://t.co/FXqRWw5S6L",en,[],['https://www.instagram.com/p/Bx5xgxhjdfe/?igshid=yzmni2fv0f66'],[],0,0,0,[],[],https://twitter.com/Burningblue5/status/1132417054651371522,False,,0,,chicago,,,,,,[],,,,
1132413308408143872,1132320851318247424,2019-05-25 17:29:06 CDT,2019-05-25,17:29:06,-0500,756903193901162496,reesetheone1,NewDemocrat4Life,,@brinstar9 @cbbruuno @T_FisherKing @lyn_cade @KaraCalavera Heart attack junction.... I've lost count of the hawks overtime playoff excursions... and being SLEEPY the next morning.,en,[],[],[],1,0,1,[],[],https://twitter.com/reesetheone1/status/1132413308408143872,False,,0,,chicago,,,,,,"[{'screen_name': 'cbbruuno', 'name': 'Kid Phantasm', 'id': '2508114499'}, {'screen_name': 'T_FisherKing', 'name': 'T. Fisher King 😉', 'id': '2570615502'}, {'screen_name': 'lyn_cade', 'name': ""Let's Go Cowboys!"", 'id': '4743638910'}, {'screen_name': 'KaraCalavera', 'name': 'Kara Calavera 🇺🇸 🇺🇦', 'id': '227010728'}]",,,,
1132410346176692225,1132410346176692225,2019-05-25 17:17:20 CDT,2019-05-25,17:17:20,-0500,95545581,nicktheyeller,gloom pop guy,,“Smelling like shit is not a protest”,en,[],[],[],0,1,6,[],[],https://twitter.com/NickTheYeller/status/1132410346176692225,False,,0,,chicago,,,,,,[],,,,
1132409060622589952,1132409060622589952,2019-05-25 17:12:13 CDT,2019-05-25,17:12:13,-0500,424661517,jaythomaswillis,Jay Thomas Willis,,There is a difference between being a nuisance and being a threat!!  https://t.co/JTNbOM5oaU,en,[],['http://jaythomaswillis.com'],[],0,0,0,[],[],https://twitter.com/JayThomasWillis/status/1132409060622589952,False,,0,,chicago,,,,,,[],,,,
1132405296545042432,1131716322369392646,2019-05-25 16:57:16 CDT,2019-05-25,16:57:16,-0500,432651122,sd3rd,Sidney Davis III,,@Rowehouse29 @NinaCra99775554 @realDonaldTrump @PressSec However I think most people would agree there are some people who abuse their freedom.   I was raised that rights abused are rights removed.,en,[],[],[],0,0,0,[],[],https://twitter.com/SD3rd/status/1132405296545042432,False,,0,,chicago,,,,,,"[{'screen_name': 'NinaCra99775554', 'name': 'Nina Crawford Sisroe', 'id': '1060818399549362177'}, {'screen_name': 'realDonaldTrump', 'name': 'Donald J. Trump', 'id': '25073877'}, {'screen_name': 'PressSec', 'name': 'Jen Psaki', 'id': '1349170292564905988'}]",,,,
1132404909016518656,1131716322369392646,2019-05-25 16:55:44 CDT,2019-05-25,16:55:44,-0500,432651122,sd3rd,Sidney Davis III,,"@Rowehouse29 @NinaCra99775554 @realDonaldTrump @PressSec No.  I’m basing my argument on the actions of the well regulated militia.   As one who sees The Who’s we won’t get fooled again as a mantra, decidedly necessary due to today’s circumstances, I am not anti gun.",en,[],[],[],0,0,0,[],[],https://twitter.com/SD3rd/status/1132404909016518656,False,,0,,chicago,,,,,,"[{'screen_name': 'NinaCra99775554', 'name': 'Nina Crawford Sisroe', 'id': '1060818399549362177'}, {'screen_name': 'realDonaldTrump', 'name': 'Donald J. Trump', 'id': '25073877'}, {'screen_name': 'PressSec', 'name': 'Jen Psaki', 'id': '1349170292564905988'}]",,,,
1132403102382985217,1132403102382985217,2019-05-25 16:48:33 CDT,2019-05-25,16:48:33,-0500,231667173,a_girlnamedbri,Hippolyta ✨,,The Casey Anthony documentary was named “an American murder mystery”.. bitch we all know she killed her child,en,[],[],[],0,0,5,[],[],https://twitter.com/A_GirlNamedBRI/status/1132403102382985217,False,,0,,chicago,,,,,,[],,,,
1132401902799544320,1132401902799544320,2019-05-25 16:43:47 CDT,2019-05-25,16:43:47,-0500,1062146929646276609,lilymuratalla,lily,,mexican families are so sexist. i hate it.,en,[],[],[],0,0,0,[],[],https://twitter.com/lilymuratalla/status/1132401902799544320,False,https://twitter.com/plntbasedcutie/status/1131945600751001602,0,,chicago,,,,,,[],,,,
1132399617788784642,1132399617788784642,2019-05-25 16:34:42 CDT,2019-05-25,16:34:42,-0500,65539615,omfgcows,Cows,,Someone in front of me is a huge racist tirade.,en,[],[],[],1,0,0,[],[],https://twitter.com/omfgcows/status/1132399617788784642,False,,0,,chicago,,,,,,[],,,,
1132398049882456064,1132384157932445696,2019-05-25 16:28:28 CDT,2019-05-25,16:28:28,-0500,65580536,fzzytiger,🏳️‍🌈Rad Plaid Dad🏳️‍🌈 🔜FWA,,@The_Joshiah Fuck. Id die. Of joy and from murder death snugs. 100% ok,en,[],[],[],0,0,1,[],[],https://twitter.com/FzzyTiger/status/1132398049882456064,False,,0,,chicago,,,,,,"[{'screen_name': 'The_Joshiah', 'name': 'Husbando Coyofolf @ Actual Home', 'id': '589424021'}]",,,,
1132393691535036416,1132393691535036416,2019-05-25 16:11:09 CDT,2019-05-25,16:11:09,-0500,45693272,callmelafleur,CallMeLaFleur⚜️,"{'type': 'Point', 'coordinates': [41.9479137, -87.6572762]}","Like seeing letterkennyproblems live VIP and meeting @michellemylett ,JK, @KTrevorWilson ,@markforwardd ,summmernate wasn't enough to be excited about.  On the 4th anniversary of a heart attack that should have…  https://t.co/BfuraQNt9h",en,"[{'screen_name': 'michellemylett', 'name': 'michelle mylett', 'id': '2330569200'}, {'screen_name': 'ktrevorwilson', 'name': 'k trevor wilson', 'id': '199856827'}, {'screen_name': 'markforwardd', 'name': 'mark forward', 'id': '25830585'}]",['https://www.instagram.com/p/Bx5m42iAt7l/?igshid=14h3q8jgxzh1q'],[],0,0,0,[],[],https://twitter.com/callmelafleur/status/1132393691535036416,False,,0,,chicago,,,,,,[],,,,
1132393159147835392,1132393159147835392,2019-05-25 16:09:02 CDT,2019-05-25,16:09:02,-0500,148903512,natedog06,Nathaniel Deveaux,,Crime pays in America. 🤦🏿‍♂️,en,[],[],[],0,0,0,[],[],https://twitter.com/Natedog06/status/1132393159147835392,False,,0,,chicago,,,,,,[],,,,
1132386072149798912,1132386072149798912,2019-05-25 15:40:52 CDT,2019-05-25,15:40:52,-0500,437279303,canikickit___,surf,,I’m literally just driving around the city going to day parties... I swear I need a partner in crime,en,[],[],[],1,0,4,[],[],https://twitter.com/CanIKickIt___/status/1132386072149798912,False,,0,,chicago,,,,,,[],,,,
1132384243064164353,1132384243064164353,2019-05-25 15:33:36 CDT,2019-05-25,15:33:36,-0500,247447973,kisseslikekay,MATERIAL GORL,,Ok but why did How To Get Away with Murder end like that?,en,[],[],[],1,1,1,[],[],https://twitter.com/KisseslikeKay/status/1132384243064164353,False,,0,,chicago,,,,,,[],,,,
1132371027466440704,1132371027466440704,2019-05-25 14:41:06 CDT,2019-05-25,14:41:06,-0500,271225949,_ravintwin,Unruly Trini Bad🤘🏾🇹🇹🇬🇩,,Mi ah real gun man suh di gyal dem love mi,in,[],[],[],0,0,0,[],[],https://twitter.com/_RavinTwin/status/1132371027466440704,False,,0,,chicago,,,,,,[],,,,
1132369793447792641,1132369793447792641,2019-05-25 14:36:11 CDT,2019-05-25,14:36:11,-0500,90011531,jasonpaisley, 𝘁𝗵𝗲 𝗡𝗮𝘀𝗵𝘃𝗶𝗹𝗹𝗲 𝗛𝘂𝗺𝗮𝗻𝗶𝘀𝘁 🇺🇦,,She was falsely accused of being racist in a video that went viral. Then some on the internet came to her rescue - CNN  https://t.co/40gfgiwyku,en,[],['https://www.cnn.com/2019/05/25/us/false-racism-internet-mob-chipotle-video/index.html'],[],0,0,0,[],[],https://twitter.com/jasonpaisley/status/1132369793447792641,False,,0,,chicago,,,,,,[],,,,
1132362104252579846,1132362104252579846,2019-05-25 14:05:38 CDT,2019-05-25,14:05:38,-0500,45791433,fightletereport,Sean Lennon,,Excited for @brittbaker @kyliera who are wrestling in a triple threat match w @nylarose #DoubleorNothing! Now the world will see why they are special and why this will be the most talked about match! I’m Rooting for all of them ❤️🙌🤘  https://t.co/AkYitX4g7j,en,"[{'screen_name': 'brittbaker', 'name': 'brittbaker', 'id': '16457037'}, {'screen_name': 'kyliera', 'name': 'mindy schultea', 'id': '17156776'}, {'screen_name': 'nylarose', 'name': 'glenda konrad', 'id': '31198522'}]",[],"['https://pbs.twimg.com/media/D7b1UnfXkAMxjqr.jpg', 'https://pbs.twimg.com/media/D7b1Un5WkAIoTSZ.jpg', 'https://pbs.twimg.com/media/D7b1Un4WkAMAfNs.jpg', 'https://pbs.twimg.com/media/D7b1Un5WwAAFKGF.jpg']",0,0,1,['doubleornothing'],[],https://twitter.com/FightleteReport/status/1132362104252579846,False,,1,https://pbs.twimg.com/media/D7b1UnfXkAMxjqr.jpg,chicago,,,,,,[],,,,
1132356012386783233,1132052951709736965,2019-05-25 13:41:26 CDT,2019-05-25,13:41:26,-0500,182530270,bruiser4eq,Josh V 😷,,"@warnerthuston @ZackFord Wait a second, I thought we wanted black people to outnumber whites so we can win elections. Now you’re telling me want to “murder black babies”. You should really make up your mind as to what evil plans liberals have.",en,[],[],[],1,0,0,[],[],https://twitter.com/Bruiser4Eq/status/1132356012386783233,False,,0,,chicago,,,,,,"[{'screen_name': 'warnerthuston', 'name': 'Warner Todd Huston', 'id': '14934964'}, {'screen_name': 'ZackFord', 'name': 'Zack Ford', 'id': '20093233'}]",,,,
1132351347121152000,1132351347121152000,2019-05-25 13:22:53 CDT,2019-05-25,13:22:53,-0500,87091888,joe_brand1,Joe Brand,,"So brutal. Hardly worked with Howard at UIC, but it didn’t take long to realize how genuine of a person he is.",en,[],[],[],0,0,2,[],[],https://twitter.com/Joe_Brand1/status/1132351347121152000,False,https://twitter.com/RyanBakerMedia/status/1132337472237703169,0,,chicago,,,,,,[],,,,
1132348582504349696,1132311788173844480,2019-05-25 13:11:54 CDT,2019-05-25,13:11:54,-0500,3168073040,jedimasterjulia,Julia Lopez,,@xcuppcak3x Stride for Peace. It’s a 5k to raise awareness for gun violence. I’ve always wanted to do a mud run!!!! That sounds like so much fun.,en,[],[],[],1,0,2,[],[],https://twitter.com/jedimasterjulia/status/1132348582504349696,False,,0,,chicago,,,,,,"[{'screen_name': 'xcuppcak3x', 'name': 'Cupcake', 'id': '2428862365'}]",,,,
1132347054955618304,1132347054955618304,2019-05-25 13:05:50 CDT,2019-05-25,13:05:50,-0500,1066128286194049025,rawneighbors,RAW - Resident Association of the Westside,"{'type': 'Point', 'coordinates': [41.8671, -87.6216]}",Have you heard of FDLA First Defense Legal Aid?   Less than 1.5% of people under arrest in Chicago get an attorney.   Call 1-800-law-rep4 1-800-529-7374 when someone is #arrested or #detained by #CPD to send #FREE…  https://t.co/6Rn6Iqu85s,en,[],['https://www.instagram.com/p/Bx5RrbYFOSA/?igshid=1y1yja4nanj31'],[],0,0,0,"['arrested', 'detained', 'cpd', 'free']",[],https://twitter.com/RAWneighbors/status/1132347054955618304,False,,0,,chicago,,,,,,[],,,,
1132345078993829889,1128487700166791168,2019-05-25 12:57:59 CDT,2019-05-25,12:57:59,-0500,36624477,2xisttheascntrk,Chemical Xesty,,@zalera483 whoever said that is stupid. Rape is the result of men feeling entitled. Theres nothing natural about it since it stems from societal notions,en,[],[],[],1,0,0,[],[],https://twitter.com/2xistTheAscntrk/status/1132345078993829889,False,,0,,chicago,,,,,,"[{'screen_name': 'zalera483', 'name': 'Mrs J.', 'id': '363921746'}]",,,,
1132343558340513792,1132093445743489024,2019-05-25 12:51:56 CDT,2019-05-25,12:51:56,-0500,15715669,krispekitty,Nunya,,@richmondchick1 @HowardA_Esq @MollyJongFast @jonvoight Or he’s committed a crime and looking for a pardon,en,[],[],[],0,0,14,[],[],https://twitter.com/krispekitty/status/1132343558340513792,False,,0,,chicago,,,,,,"[{'screen_name': 'richmondchick1', 'name': 'richmondchick', 'id': '1116130359027163136'}, {'screen_name': 'MollyJongFast', 'name': 'Molly Jong-Fast', 'id': '14298769'}, {'screen_name': 'jonvoight', 'name': 'Jon Voight', 'id': '759081003168112640'}]",,,,
1132343403084226566,1132093445743489024,2019-05-25 12:51:19 CDT,2019-05-25,12:51:19,-0500,15715669,krispekitty,Nunya,,"@jonvoight You are certainly entitled to this ridiculous opinion. I’m assuming you have committed a crime and are looking for a pardon, or you want a cabinet position.",en,[],[],[],0,1,0,[],[],https://twitter.com/krispekitty/status/1132343403084226566,False,,0,,chicago,,,,,,"[{'screen_name': 'jonvoight', 'name': 'Jon Voight', 'id': '759081003168112640'}]",,,,
1132338142755938304,1132312030025801729,2019-05-25 12:30:25 CDT,2019-05-25,12:30:25,-0500,1885595580,metaplexmovies,Brendan Hodgegoblin,,"@lindseyromain @lisagemeni I think Ridley is justifiably precious about Rey and representation to women that they should be cautious around problematic/toxic men. which like, GRANTED, Kylo did try to murder all her friends and also possibly herself  like we've all had bad dates but that takes the cake lol",en,[],[],[],0,0,13,[],[],https://twitter.com/metaplexmovies/status/1132338142755938304,False,,0,,chicago,,,,,,"[{'screen_name': 'LindseyRomain', 'name': 'lindsey romain', 'id': '1363535124336234498'}, {'screen_name': 'lisagemeni', 'name': 'Lisa (she/they) @ #writing 🏳️\u200d⚧️', 'id': '33773872'}]",,,,
1132332292909731840,1132332292909731840,2019-05-25 12:07:11 CDT,2019-05-25,12:07:11,-0500,608418034,jackiesouthee,Southee,,She heard what John Voight said and started a plan of attack.,en,[],[],[],0,0,3,[],[],https://twitter.com/JackieSouthee/status/1132332292909731840,False,https://twitter.com/washingtonpost/status/1132293646118793216,0,,chicago,,,,,,[],,,,
1132331550610083840,1132298197550940160,2019-05-25 12:04:14 CDT,2019-05-25,12:04:14,-0500,744824831913263104,fleischmansteve,“The Truth is Radical!” Harvey Goldberg 🌹,,"@Lollardfish David I agree. The pointless attack on marginalized communities is simply to mobilize fascist element for political advantage by the far right. The end game is of course protecting the wealth of the rich. Unfortunately, it’s succeeding unless we fight back!",en,[],[],[],0,0,2,[],[],https://twitter.com/FleischmanSteve/status/1132331550610083840,False,,0,,chicago,,,,,,"[{'screen_name': 'Lollardfish', 'name': 'David M. Perry', 'id': '108094234'}]",,,,
1132329965758951424,1132329726511595522,2019-05-25 11:57:56 CDT,2019-05-25,11:57:56,-0500,59967772,_theothereric,The Other Eric,,I dont like that 1 kid that's cripple. He need a gun or something. He's useless!,en,[],[],[],1,0,0,[],[],https://twitter.com/_theothereric/status/1132329965758951424,False,,0,,chicago,,,,,,[],,,,
1132329553102295040,1132329553102295040,2019-05-25 11:56:17 CDT,2019-05-25,11:56:17,-0500,756903193901162496,reesetheone1,NewDemocrat4Life,,"Dems had 218 in the house and 67 in the Senate in 74... control of both chambers. The pressure was much greater on Nixon,  as his vote counters told him he was fucked.  Trump's control of racist white voters that GOP members of Congress need to win insulate him from a Nixon fate.",en,[],[],[],15,26,93,[],[],https://twitter.com/reesetheone1/status/1132329553102295040,False,https://twitter.com/ArmandoNDK/status/1132310993416146944,0,,chicago,,,,,,[],,,,
1132327418692296704,1132018969664139264,2019-05-25 11:47:48 CDT,2019-05-25,11:47:48,-0500,1473587414,john_faidutti,il padrino,,"@ElitevtownVoter @citygirltoo21 @FreebirdjoJames @realDonaldTrump Well, I give you the first part.  But the Obama part, I disagree because Obama took plenty of abuse.   We know for sure that Obama didn’t lie as much.",en,[],[],[],2,0,0,[],[],https://twitter.com/john_faidutti/status/1132327418692296704,False,,0,,chicago,,,,,,"[{'screen_name': 'ElitevtownVoter', 'name': 'Independent Voter', 'id': '840977095161401344'}, {'screen_name': 'citygirltoo21', 'name': 'Newsjunky🇺🇸🗽', 'id': '776014540077010944'}, {'screen_name': 'realDonaldTrump', 'name': 'Donald J. Trump', 'id': '25073877'}]",,,,
1132325154590199809,1132319266139717632,2019-05-25 11:38:49 CDT,2019-05-25,11:38:49,-0500,756903193901162496,reesetheone1,NewDemocrat4Life,,"@Corbinburnsin @tomwatson Zero. It ain't happening. They all need his racist voters to show up to have ANY chance of winning. If you flip them, they won't run for re-election.. trust me! 🤣🤣",en,[],[],[],1,0,0,[],[],https://twitter.com/reesetheone1/status/1132325154590199809,False,,0,,chicago,,,,,,"[{'screen_name': 'Corbinburnsin', 'name': 'Joo-Dee', 'id': '1659143910'}, {'screen_name': 'tomwatson', 'name': 'Tom Watson', 'id': '1049171'}]",,,,
1132321700777996289,1132321700777996289,2019-05-25 11:25:05 CDT,2019-05-25,11:25:05,-0500,17212106,lauraf229,La Morenasa,"{'type': 'Point', 'coordinates': [41.86179321, -87.61652318]}",The heat was just brutal and I am a couple shades darker. At one point of the race I was just hoping it would begin to rain. Another medal for my collection! Yah!  . . . #running #correr #soldierfield10mile…  https://t.co/uJYH4n9anw,en,[],['https://www.instagram.com/p/Bx5GJn4FjcF/?igshid=7et6lr1ibue4'],[],0,0,3,"['running', 'correr', 'soldierfield10mile']",[],https://twitter.com/lauraf229/status/1132321700777996289,False,,0,,chicago,,,,,,[],,,,
1132318528374284288,1132311759489064962,2019-05-25 11:12:29 CDT,2019-05-25,11:12:29,-0500,115466912,angiestarphoto,Angela Estrella,,"@MyMixtapeKG Yes! and I’ll be at millennium park shooting Rae’s set at the house fest. There’s also this in the west loop, kid friendly.  https://t.co/1JVBeMSvcd",en,[],[],['https://pbs.twimg.com/media/D7bNsjiXYAAxwQp.jpg'],1,0,1,[],[],https://twitter.com/AngieStarPhoto/status/1132318528374284288,False,,1,https://pbs.twimg.com/media/D7bNsjiXYAAxwQp.jpg,chicago,,,,,,"[{'screen_name': 'MyMixtapeKG', 'name': '✨', 'id': '960216545594085376'}]",,,,
1132317323581415425,1132317323581415425,2019-05-25 11:07:42 CDT,2019-05-25,11:07:42,-0500,972521408264835072,gkmc18,GoodKidsMadCity,,"While the Mayor is putting more police on our blocks to terrorize us, we’ll be in affirming, loving, safe spaces that values us as Black teens &amp; don’t treat us like a threat! #AfricanLiberationDay  #WeWalkForHer #CareNotCops #GKMCHoops #OpenMic #GoodKidsMadCity  https://t.co/j8LGHZhigM",en,[],[],"['https://pbs.twimg.com/media/D7bMlmMW4AI4AJc.jpg', 'https://pbs.twimg.com/media/D7bMll7W0AEyPdM.jpg', 'https://pbs.twimg.com/media/D7bMll3W0AIOapF.jpg', 'https://pbs.twimg.com/media/D7bMlmPXoAAXE3V.jpg']",2,19,36,"['africanliberationday', 'wewalkforher', 'carenotcops', 'gkmchoops', 'openmic', 'goodkidsmadcity']",[],https://twitter.com/GKMC18/status/1132317323581415425,False,,1,https://pbs.twimg.com/media/D7bMlmMW4AI4AJc.jpg,chicago,,,,,,[],,,,
