id,conversation_id,created_at,date,time,timezone,user_id,username,name,place,tweet,language,mentions,urls,photos,replies_count,retweets_count,likes_count,hashtags,cashtags,link,retweet,quote_url,video,thumbnail,near,geo,source,user_rt_id,user_rt,retweet_id,reply_to,retweet_date,translate,trans_src,trans_dest
1168311777119150080,1168311777119150080,2019-09-01 18:56:48 CDT,2019-09-01,18:56:48,-0500,243905194,shariholistic,🧘🏾Sea Moss Gang🌱,,@_Killyaselff I love you baby you are worth it &amp; you will get through anything that may seem is hendering you no weapon formed against you shall prosper love stay prayed up and blessed baby girl I adore you 🏳️‍🌈😍,en,[],[],[],0,1,1,[],[],https://twitter.com/shariholistic/status/1168311777119150080,False,,0,,chicago,,,,,,[],,,,
1168311167489576962,1168297132358602753,2019-09-01 18:54:23 CDT,2019-09-01,18:54:23,-0500,523443923,abbu25,Abbu,,@Boqui11 No abuse.,en,[],[],[],0,0,0,[],[],https://twitter.com/abbu25/status/1168311167489576962,False,,0,,chicago,,,,,,"[{'screen_name': 'Boqui11', 'name': 'Oscar Fernández', 'id': '358528975'}]",,,,
1168305826500665344,1168302544889798657,2019-09-01 18:33:09 CDT,2019-09-01,18:33:09,-0500,899132934,gonzalezusa11,Edward S. Gonzalez,,@jor_heyjr @CNN Democrats will attack President Trump no matter what!!! They are sick &amp; anti-American to the core!!! For me and many majority of Americans will just laugh😆 at lib socialist and Jorge when Trump wins re-election 2020 🇺🇸,en,[],[],[],0,0,0,[],[],https://twitter.com/GonzalezUSA11/status/1168305826500665344,False,,0,,chicago,,,,,,"[{'screen_name': 'jor_heyjr', 'name': 'Jorge Godinez Jr', 'id': '1143503042'}, {'screen_name': 'CNN', 'name': 'CNN', 'id': '759251'}]",,,,
1168305671726665729,1168304095066828803,2019-09-01 18:32:32 CDT,2019-09-01,18:32:32,-0500,756903193901162496,reesetheone1,NewDemocrat4Life,,@blackwomenviews I shut off the cell for a couple hours just to turn it on and see folks angry about a person's gun violence prevention plan.  It is what it is....  I guess imitation is the best form of Flattery.,en,[],[],[],0,0,13,[],[],https://twitter.com/reesetheone1/status/1168305671726665729,False,,0,,chicago,,,,,,"[{'screen_name': 'BlackWomenViews', 'name': 'BlackWomenViews', 'id': '1182686511340371968'}]",,,,
1168304633355390976,1168177068321968128,2019-09-01 18:28:25 CDT,2019-09-01,18:28:25,-0500,326921489,modemjunkie,Leonard Grossman,,@Scaramucci @realDonaldTrump @DebraMessing When little kids have tantrums they have to take a time out.  When they abuse their toys the toys get taken away. What do we do when the president does both?,en,[],[],[],0,0,0,[],[],https://twitter.com/modemjunkie/status/1168304633355390976,False,,0,,chicago,,,,,,"[{'screen_name': 'Scaramucci', 'name': 'Anthony Scaramucci', 'id': '24578794'}, {'screen_name': 'realDonaldTrump', 'name': 'Donald J. Trump', 'id': '25073877'}, {'screen_name': 'DebraMessing', 'name': 'Debra Messing✍🏻', 'id': '499073990'}]",,,,
1168304095066828803,1168304095066828803,2019-09-01 18:26:16 CDT,2019-09-01,18:26:16,-0500,756903193901162496,reesetheone1,NewDemocrat4Life,,"You guys that support Harris, if you point out anything  about anyone else, it's an attack.... You know that right?  That's how it will be perceived, Khive.",en,[],[],[],19,8,97,[],[],https://twitter.com/reesetheone1/status/1168304095066828803,False,,0,,chicago,,,,,,[],,,,
1168303478365708290,1168191528071835648,2019-09-01 18:23:49 CDT,2019-09-01,18:23:49,-0500,15778911,nijc,National Immigrant Justice Center,,"The MPP program is inhumane &amp; violates the US obligation to offer refuge to people fleeing persecution. But even under the MPP guidelines, which exempt vulnerable populations, these youth should be permitted to enter &amp; seek asylum. Their lives are in danger. Call now ⬇️ 4/4  https://t.co/5jju9HcHs7",en,[],[],['https://pbs.twimg.com/media/EDal0XtX4AYhYDb.jpg'],1,3,2,[],[],https://twitter.com/NIJC/status/1168303478365708290,False,,1,https://pbs.twimg.com/media/EDal0XtX4AYhYDb.jpg,chicago,,,,,,[],,,,
1168300874369839104,1168189591351955457,2019-09-01 18:13:29 CDT,2019-09-01,18:13:29,-0500,897102022339694592,keithh6910,Keith,,"@greg_mueller They’re taking action, which is GREAT! Meanwhile, in Texas today, they’ve LOOSENED gun laws!!  The day after yesterday’s mass shooting. Now, guns can’t be restricted in schools, churches, etc. I feel like I’m living in an episode of the Twilight Zone.",en,[],[],[],1,0,2,[],[],https://twitter.com/KeithH6910/status/1168300874369839104,False,,0,,chicago,,,,,,"[{'screen_name': 'greg_mueller', 'name': 'Greg Mueller', 'id': '872418838301822976'}]",,,,
1168299149739143176,1168285591248801792,2019-09-01 18:06:37 CDT,2019-09-01,18:06:37,-0500,1170562555,ktclauser,katie,,@DinkEvie When I saw it was in Indiana I was really worried that I might know someone injured. But thank god you’re okay.,en,[],[],[],1,0,2,[],[],https://twitter.com/ktclauser/status/1168299149739143176,False,,0,,chicago,,,,,,"[{'screen_name': 'DinkEvie', 'name': 'Evie. 🌸', 'id': '1392292898822148098'}]",,,,
1168297939153895425,1168190110766129153,2019-09-01 18:01:49 CDT,2019-09-01,18:01:49,-0500,1726948620,countonrodney,ردني,,@KnownBreed Every Italian here in Chicago owns that gun lol I def fuck with that tho imma see the price how much it is,en,[],[],[],0,0,0,[],[],https://twitter.com/CountOnRodney/status/1168297939153895425,False,,0,,chicago,,,,,,"[{'screen_name': 'KnownBreed', 'name': 'T', 'id': '3234768909'}]",,,,
1168289003956822016,1168289003956822016,2019-09-01 17:26:18 CDT,2019-09-01,17:26:18,-0500,929021986067701762,intatheist,City Skeptic,,"In the U.S, increased religiosity is correlated with increased crime, rather than decreased crime.   You can't tell theists this; And there lies the problem, while they're in denial, the issue still persists. When they realized how nuts it is, maybe then it'll get better.  https://t.co/Y7b2HMyA7r",en,[],[],['https://pbs.twimg.com/media/EDaYqF2WwAAjjnL.jpg'],0,1,2,[],[],https://twitter.com/INTAtheist/status/1168289003956822016,False,,1,https://pbs.twimg.com/media/EDaYqF2WwAAjjnL.jpg,chicago,,,,,,[],,,,
1168288781205684224,1168288781205684224,2019-09-01 17:25:25 CDT,2019-09-01,17:25:25,-0500,37831300,northsideish,NorthsideIsh,,"Since some Christians take the Bible so literally, I don't think it says anything about owning a weapon of war and shooting people up just because they are having a bad day.",en,[],[],[],0,0,0,[],[],https://twitter.com/NorthSideIsh/status/1168288781205684224,False,https://twitter.com/RepMattSchaefer/status/1167989249745899521,0,,chicago,,,,,,[],,,,
1168286920645980162,1168286920645980162,2019-09-01 17:18:02 CDT,2019-09-01,17:18:02,-0500,587026018,deisy_xoch,xōchitl,,"In other words “I am not going to stop taking money from the NRA or strengthen any gun laws, in fact I’m going to do the complete opposite and disguise it as patriotism.”",en,[],[],[],1,0,2,[],[],https://twitter.com/deisy_xoch/status/1168286920645980162,False,https://twitter.com/RepMattSchaefer/status/1167989160507895809,0,,chicago,,,,,,[],,,,
1168284118142062593,1168280015521361921,2019-09-01 17:06:54 CDT,2019-09-01,17:06:54,-0500,929021986067701762,intatheist,City Skeptic,,@BeccaMarshall12 What's crazy is that Chicago has gun laws and these gangs are out of control with gun violence.,en,[],[],[],2,1,2,[],[],https://twitter.com/INTAtheist/status/1168284118142062593,False,,0,,chicago,,,,,,"[{'screen_name': 'BeccaMarshall12', 'name': 'Becca Marshall', 'id': '1338661140771917825'}]",,,,
1168280737633710082,1168218704762400768,2019-09-01 16:53:28 CDT,2019-09-01,16:53:28,-0500,2746571940,astern5556,womanofgod3,,@plsnobreadlines @ManMet80 AAAAAAND A SEXIST!,en,[],[],[],0,0,0,[],[],https://twitter.com/astern5556/status/1168280737633710082,False,,0,,chicago,,,,,,"[{'screen_name': 'ManMet80', 'name': 'VOTE FOR DEMOCRATS 🇺🇸', 'id': '612057704'}]",,,,
1168280190360965121,1165974359493742592,2019-09-01 16:51:17 CDT,2019-09-01,16:51:17,-0500,760585493339791360,maliyahlondyn,LiLi.,,"@alphamalekal @TonyHerren @MalikYoba Let’s talk about the fact the fact that the vast majority of trans murders are committed by men later confirmed to have had extended relationships with the person that they’ve murdered. Even in the event of deception, this doesn’t give anyone the right to commit murder.",en,[],[],[],1,1,7,[],[],https://twitter.com/MaliyahLondyn/status/1168280190360965121,False,,0,,chicago,,,,,,"[{'screen_name': 'alphamalekal', 'name': 'Keith Lewis', 'id': '22429450'}, {'screen_name': 'MalikYoba', 'name': 'Malik Yoba', 'id': '20472641'}]",,,,
1168280015521361921,1168280015521361921,2019-09-01 16:50:35 CDT,2019-09-01,16:50:35,-0500,929021986067701762,intatheist,City Skeptic,,There was another shooting at a Walmart in Memville.,en,[],[],[],2,2,3,[],[],https://twitter.com/INTAtheist/status/1168280015521361921,False,,0,,chicago,,,,,,[],,,,
1168279169404456961,1168279169404456961,2019-09-01 16:47:14 CDT,2019-09-01,16:47:14,-0500,23567189,stefon360,stef.,,Mass shooting raffle in the United states,en,[],[],[],0,0,0,[],[],https://twitter.com/stefon360/status/1168279169404456961,False,,0,,chicago,,,,,,[],,,,
1168277948656488448,1168277948656488448,2019-09-01 16:42:23 CDT,2019-09-01,16:42:23,-0500,912978542,buildabara,Iggy 🥞,,The Shadow of the Colossus OST is great for channeling my anger for sure,en,[],[],[],0,0,0,[],[],https://twitter.com/buildabara/status/1168277948656488448,False,,0,,chicago,,,,,,[],,,,
1168276707310276612,1168241865998647296,2019-09-01 16:37:27 CDT,2019-09-01,16:37:27,-0500,2993362769,afrikanlion3,Majadi Rodney Perry,,"@vexedinthecity If Black men were the perpetrators of mass shootings, we would have the death penalty for any gun offense.",en,[],[],[],0,0,22,[],[],https://twitter.com/AfrikanLion3/status/1168276707310276612,False,,0,,chicago,,,,,,"[{'screen_name': 'vexedinthecity', 'name': 'Corey Richardson', 'id': '16415036'}]",,,,
1168267492306890755,1168225063574880257,2019-09-01 16:00:50 CDT,2019-09-01,16:00:50,-0500,863480442707726337,tbarnett500,Tony Barnett,,"@j3mike @AshaRangappa_ Exactly. That’s why the same laws, registrations and insurance structure that regulate our automobiles needs to apply to every gun and gun owner.",en,[],[],[],0,1,23,[],[],https://twitter.com/tbarnett500/status/1168267492306890755,False,,0,,chicago,,,,,,"[{'screen_name': 'j3mike', 'name': 'James Michael', 'id': '738172558516723713'}, {'screen_name': 'AshaRangappa_', 'name': 'Asha Rangappa', 'id': '510464011'}]",,,,
1168266779401039873,1168266779401039873,2019-09-01 15:58:00 CDT,2019-09-01,15:58:00,-0500,1122533006,prinnylee,𝐀𝐚𝐥𝐢𝐲𝐚𝐡,,Woah the anger lol,en,[],[],[],0,0,0,[],[],https://twitter.com/prinnylee/status/1168266779401039873,False,https://twitter.com/WORLDSTAR/status/1168257929293848582,0,,chicago,,,,,,[],,,,
1168266304937218048,1168266304937218048,2019-09-01 15:56:07 CDT,2019-09-01,15:56:07,-0500,941344509568471041,mixedmediapaper,secular angel,,had a dream that i had violent period pains and went to go check my pad and as im standing up i look down and one of my organs is literally hanging out of me,en,[],[],[],1,0,2,[],[],https://twitter.com/mixedmediapaper/status/1168266304937218048,False,,0,,chicago,,,,,,[],,,,
1168266087252799488,1168265596775124999,2019-09-01 15:55:15 CDT,2019-09-01,15:55:15,-0500,326921489,modemjunkie,Leonard Grossman,,"@voxdotcom Just to be clear. That was the result of earlier decisions, but there was no excuse for relaxing gun laws then, either.",en,[],[],[],1,0,3,[],[],https://twitter.com/modemjunkie/status/1168266087252799488,False,,0,,chicago,,,,,,"[{'screen_name': 'voxdotcom', 'name': 'Vox', 'id': '2347049341'}]",,,,
1168264471846019074,1168146165130518528,2019-09-01 15:48:50 CDT,2019-09-01,15:48:50,-0500,863480442707726337,tbarnett500,Tony Barnett,,@SportDrinkeR @TweetJDUB2017 @PupMom76 @MLeeRanch @LeeHolly81 @realDonaldTrump I never said anything about banning guns. I’m for tougher laws in regards to obtain no and owning guns. Gun owners should have to carry liability and other insurance initiatives on ever gun owned. All guns should be registered and reached just like transport vehicles.,en,[],[],[],1,0,0,[],[],https://twitter.com/tbarnett500/status/1168264471846019074,False,,0,,chicago,,,,,,"[{'screen_name': 'SportDrinkeR', 'name': 'Wekenddrnks', 'id': '861134640'}, {'screen_name': 'TweetJDUB2017', 'name': 'JDUB', 'id': '2466334644'}, {'screen_name': 'PupMom76', 'name': 'Pup Mom', 'id': '1491641916'}, {'screen_name': 'LeeHolly81', 'name': 'Holly Lee', 'id': '779742611628175360'}, {'screen_name': 'realDonaldTrump', 'name': 'Donald J. Trump', 'id': '25073877'}]",,,,
1168264059608805379,1168264059608805379,2019-09-01 15:47:11 CDT,2019-09-01,15:47:11,-0500,360184253,du_stars,Dominican Stars,,WSOC | A smothering high-pressure attack keyed the Stars to a 1-0 win over Webster on Sunday afternoon at West Campus Field #DOMUnation  https://t.co/AGiF7Fch59  https://t.co/aurLumSawO,en,[],['http://bit.ly/30TOhaw'],['https://pbs.twimg.com/media/EDaB9_vW4AAwpf0.jpg'],0,4,11,['domunation'],[],https://twitter.com/DU_Stars/status/1168264059608805379,False,,1,https://pbs.twimg.com/media/EDaB9_vW4AAwpf0.jpg,chicago,,,,,,[],,,,
1168262935388594177,1168146165130518528,2019-09-01 15:42:43 CDT,2019-09-01,15:42:43,-0500,863480442707726337,tbarnett500,Tony Barnett,,"@SportDrinkeR @TweetJDUB2017 @PupMom76 @MLeeRanch @LeeHolly81 @realDonaldTrump “If someone wants an automatic weapon they'll get one.” Ur solution is not to make it harder, but...what, exactly? If someone wants heroin, he or she can get it. Difference is junkie isn’t going to mow down kids in 14 seconds. And if someone wants an automatic that bad: red flag.",en,[],[],[],1,0,0,[],[],https://twitter.com/tbarnett500/status/1168262935388594177,False,,0,,chicago,,,,,,"[{'screen_name': 'SportDrinkeR', 'name': 'Wekenddrnks', 'id': '861134640'}, {'screen_name': 'TweetJDUB2017', 'name': 'JDUB', 'id': '2466334644'}, {'screen_name': 'PupMom76', 'name': 'Pup Mom', 'id': '1491641916'}, {'screen_name': 'LeeHolly81', 'name': 'Holly Lee', 'id': '779742611628175360'}, {'screen_name': 'realDonaldTrump', 'name': 'Donald J. Trump', 'id': '25073877'}]",,,,
1168261474600419328,1168261474600419328,2019-09-01 15:36:55 CDT,2019-09-01,15:36:55,-0500,14665382,larryodean,Larry O. Dean,"{'type': 'Point', 'coordinates': [41.96106123, -87.70233089]}",Tonight—it’s The Injured Parties’ record release for Product Placement at @montrosesaloon joined by Letterbomb and Rent Party. Hope to see you there! #livemusic #indiemusic @ Montrose Saloon  https://t.co/demHp7tteX,en,"[{'screen_name': 'montrosesaloon', 'name': 'montrose saloon', 'id': '2977414049'}]",['https://www.instagram.com/p/B14dqV_B0YrfB7pCciWHeqFpzW2mDjZXX_YplY0/?igshid=84g79hqrssew'],[],0,0,0,"['livemusic', 'indiemusic']",[],https://twitter.com/larryodean/status/1168261474600419328,False,,0,,chicago,,,,,,[],,,,
1168261368488890368,1168261368488890368,2019-09-01 15:36:30 CDT,2019-09-01,15:36:30,-0500,268092867,grayeyesdontlie,"🏈⚾️🥎🏒🏀... 🩺💊💉 CMA, CPhT",,Double play to end your little threat. Good job Claudio.,en,[],[],[],0,0,0,[],[],https://twitter.com/grayeyesdontlie/status/1168261368488890368,False,,0,,chicago,,,,,,[],,,,
1168260638554120192,1168260638554120192,2019-09-01 15:33:36 CDT,2019-09-01,15:33:36,-0500,1726948620,countonrodney,ردني,,"The US over manufactured firearms, they made it so easy to obtain and make, there is no gun reform law in any way shape or form that will reduce crime.",en,[],[],[],0,0,3,[],[],https://twitter.com/CountOnRodney/status/1168260638554120192,False,,0,,chicago,,,,,,[],,,,
1168258693135241221,1168146165130518528,2019-09-01 15:25:52 CDT,2019-09-01,15:25:52,-0500,863480442707726337,tbarnett500,Tony Barnett,,"@TweetJDUB2017 @SportDrinkeR @PupMom76 @MLeeRanch @LeeHolly81 @realDonaldTrump I’m not against guns. I used to be a gun owner myself. What I am against are the loose laws connected to owning military grade weapons. Again, you do not need an automatic anything and with the modifications to semi automatics, the definition of such a weapon has changed.",en,[],[],[],1,0,0,[],[],https://twitter.com/tbarnett500/status/1168258693135241221,False,,0,,chicago,,,,,,"[{'screen_name': 'TweetJDUB2017', 'name': 'JDUB', 'id': '2466334644'}, {'screen_name': 'SportDrinkeR', 'name': 'Wekenddrnks', 'id': '861134640'}, {'screen_name': 'PupMom76', 'name': 'Pup Mom', 'id': '1491641916'}, {'screen_name': 'LeeHolly81', 'name': 'Holly Lee', 'id': '779742611628175360'}, {'screen_name': 'realDonaldTrump', 'name': 'Donald J. Trump', 'id': '25073877'}]",,,,
1168258328511885313,1168258328511885313,2019-09-01 15:24:25 CDT,2019-09-01,15:24:25,-0500,61632649,whodoulovenow,"jeannette with two N’s, esq.",,Would seriously murder someone right now for a pair of no-show socks that down slip down every 10 fucking steps 🤬🤬🤬,en,[],[],[],0,0,0,[],[],https://twitter.com/whodoulovenow/status/1168258328511885313,False,,0,,chicago,,,,,,[],,,,
1168249538857099266,1168249538857099266,2019-09-01 14:49:29 CDT,2019-09-01,14:49:29,-0500,18128447,notscwill,Will Applebee,,"This revisionist Melo history is insane. He isn’t getting jobs now because he’s a ballhog who now has zero shooting ability. Watch the tape. He sucks. He got old, it happens.",en,[],[],[],1,1,10,[],[],https://twitter.com/NOTSCWill/status/1168249538857099266,False,https://twitter.com/ScoopB/status/1168200038771830784,0,,chicago,,,,,,[],,,,
1168249534503444480,1168225010097491976,2019-09-01 14:49:28 CDT,2019-09-01,14:49:28,-0500,23582832,realleoperez,The Master P of Art,,@SuffoKait @JakeSomething_ @Walking_Weapon @AAWPro My favorite match was you in a handicap match against Mac and cheese and a burger!,en,[],[],[],0,0,1,[],[],https://twitter.com/RealLeoPerez/status/1168249534503444480,False,,0,,chicago,,,,,,"[{'screen_name': 'SuffoKait', 'name': 'Kait', 'id': '1256789479978926081'}, {'screen_name': 'JakeSomething_', 'name': 'Jake Something', 'id': '1532890346'}, {'screen_name': 'Walking_Weapon', 'name': 'Josh Alexander', 'id': '206214265'}, {'screen_name': 'AAWPro', 'name': 'AAW Wrestling', 'id': '24958827'}]",,,,
1168246902825136128,1168246902825136128,2019-09-01 14:39:01 CDT,2019-09-01,14:39:01,-0500,16584283,billvaccaro,Bill Vaccaro,,"“Instead, we’ll allow the Lone Star State to be overrun by white nationalists with assault weapons.”",en,[],[],[],0,0,0,[],[],https://twitter.com/billvaccaro/status/1168246902825136128,False,https://twitter.com/NBCNews/status/1167933749364809729,0,,chicago,,,,,,[],,,,
1168246399349211137,1168246399349211137,2019-09-01 14:37:01 CDT,2019-09-01,14:37:01,-0500,27513328,seanrosssapp,Sean Ross Sapp of Fightful.com,,At the airport but not participating in #Twittercrew draft out of protest,en,[],[],[],1,0,3,['twittercrew'],[],https://twitter.com/SeanRossSapp/status/1168246399349211137,False,,0,,chicago,,,,,,[],,,,
1168245033767714820,1168245033767714820,2019-09-01 14:31:35 CDT,2019-09-01,14:31:35,-0500,3735761294,soyjocelynnava,Joc,,Fucking sexist,en,[],[],[],0,2,0,[],[],https://twitter.com/soyjocelynnava/status/1168245033767714820,False,https://twitter.com/_Otbrawan/status/1167759421558026241,0,,chicago,,,,,,[],,,,
1168244655726747648,1168244655726747648,2019-09-01 14:30:05 CDT,2019-09-01,14:30:05,-0500,284082738,yasmeentv,Yasmeen Hassan,,I've lived in Chicago for 3 days. So far I have: - Gotten into 2 fights with uber drivers  - Walked in the wrong direction for 3 miles - Had a conversation with a man while he was committing a crime  https://t.co/GKjOA6TtTt,en,[],[],['https://pbs.twimg.com/tweet_video_thumb/EDZwUF6WsAIMWqS.jpg'],16,1,52,[],[],https://twitter.com/YasmeenTV/status/1168244655726747648,False,,1,https://pbs.twimg.com/tweet_video_thumb/EDZwUF6WsAIMWqS.jpg,chicago,,,,,,[],,,,
1168239901508345858,1168233249732210690,2019-09-01 14:11:12 CDT,2019-09-01,14:11:12,-0500,756903193901162496,reesetheone1,NewDemocrat4Life,,@APDaDUD3 @SPOTNEWSonIG Cops shooting hoops or playing Duck duck goose with community kids.,en,[],[],[],0,0,0,[],[],https://twitter.com/reesetheone1/status/1168239901508345858,False,,0,,chicago,,,,,,"[{'screen_name': 'APDaDUD3', 'name': 'Alvo Jones', 'id': '284913055'}, {'screen_name': 'SPOTNEWSonIG', 'name': 'Spot News', 'id': '580503984'}]",,,,
1168237703730814976,1168237703730814976,2019-09-01 14:02:28 CDT,2019-09-01,14:02:28,-0500,1009269193,replipinski,Former Rep. Daniel Lipinski,,My prayers are w/ the #Midland &amp; #Odessa communities. Yesterday’s shootings were another tragic reminder of what happens when no action is taken on commonsense gun legislation. The Senate must pass the #backgroundcheck bill when we return from recess. Our country demands reform.,en,[],[],[],1,2,10,"['midland', 'odessa', 'backgroundcheck']",[],https://twitter.com/RepLipinski/status/1168237703730814976,False,,0,,chicago,,,,,,[],,,,
1168237280999424002,1168237280999424002,2019-09-01 14:00:47 CDT,2019-09-01,14:00:47,-0500,756903193901162496,reesetheone1,NewDemocrat4Life,,I'm hawkish on crime...CJR is low on my priority list.,en,[],[],[],1,0,2,[],[],https://twitter.com/reesetheone1/status/1168237280999424002,False,https://twitter.com/Pray_Live_Peace/status/1168017744467390466,0,,chicago,,,,,,[],,,,
1168237025520246784,1168176501692534790,2019-09-01 13:59:46 CDT,2019-09-01,13:59:46,-0500,762060572099694592,dickportillos,Nosmo king,,@tidalzora @gearstation Ferdinand von Anger,de,[],[],[],0,0,0,[],[],https://twitter.com/dickportillos/status/1168237025520246784,False,,0,,chicago,,,,,,"[{'screen_name': 'tidalzora', 'name': 'Marissa 💫', 'id': '2393720246'}, {'screen_name': 'gearstation', 'name': 'eebied to a different deeby', 'id': '1551480200'}]",,,,
1168234514063273988,1166915616650883073,2019-09-01 13:49:47 CDT,2019-09-01,13:49:47,-0500,2890240666,rochaaidan,Aidan Rocha,,"@audreyalison Personally, I don’t believe that this film has anything to do with gun violence. It’s simple a criticism on society. I do hear your concern but I believe that these are very separate issues.",en,[],[],[],0,0,0,[],[],https://twitter.com/RochaAidan/status/1168234514063273988,False,,0,,chicago,,,,,,"[{'screen_name': 'audreyalison', 'name': 'Audrey Wauchope Lieberstein', 'id': '26947766'}]",,,,
1168231282930835457,1168231282930835457,2019-09-01 13:36:57 CDT,2019-09-01,13:36:57,-0500,380191960,ohkayx33,Kay,,"“Gosh Christy, can’t you just let people be racist in private? Wow”  LMFAOOOOOOOOOOOOOOOO no, Kathy.",en,[],[],[],0,3,2,[],[],https://twitter.com/ohKAYx33/status/1168231282930835457,False,https://twitter.com/cal_gal53/status/1168031044190105600,0,,chicago,,,,,,[],,,,
1168228130110234630,1168228130110234630,2019-09-01 13:24:25 CDT,2019-09-01,13:24:25,-0500,1525010869,join_rage,R.A.G.E. Englewood,,It’s ready...Are you excited about the new Englewood STEM HS opening? Check out what our President @mrs_englewood had to say &amp; share your thoughts!  https://t.co/fkEmcznPhH,en,"[{'screen_name': 'mrs_englewood', 'name': 'asiaha butler', 'id': '21509758'}]",['https://news.wttw.com/2019/09/01/cps-unveils-englewood-stem-high-school-after-controversial-closures'],[],0,1,9,[],[],https://twitter.com/Join_RAGE/status/1168228130110234630,False,,0,,chicago,,,,,,[],,,,
1168221707393540096,1168221707393540096,2019-09-01 12:58:54 CDT,2019-09-01,12:58:54,-0500,36618451,jillkonopka,Jill Konopka,,7 lives now lost in Texas mass shooting,en,[],[],[],0,0,1,[],[],https://twitter.com/jillkonopka/status/1168221707393540096,False,https://twitter.com/NYGovCuomo/status/1167957531177570306,0,,chicago,,,,,,[],,,,
1168221121969369088,1168221121969369088,2019-09-01 12:56:34 CDT,2019-09-01,12:56:34,-0500,756903193901162496,reesetheone1,NewDemocrat4Life,,Illinois should pass a statewide assault weapon ban and have it challenged in court... AGAIN.,en,[],[],[],1,2,13,[],[],https://twitter.com/reesetheone1/status/1168221121969369088,False,https://twitter.com/GarrettHaake/status/1168219668529799173,0,,chicago,,,,,,[],,,,
1168218806122139648,1168213594510520320,2019-09-01 12:47:22 CDT,2019-09-01,12:47:22,-0500,109140767,marcusdigital,✪🐐ÝőûŤúbēŕ 💯✪,,@MikeZombie Never even heard of it breh   That Pokemon masters is all the rage the last 72 hours for mobile games,en,[],[],[],1,0,0,[],[],https://twitter.com/MarcusDigital/status/1168218806122139648,False,,0,,chicago,,,,,,"[{'screen_name': 'MikeZombie', 'name': 'Mike Zombie ♋️🧟\u200d♂️🐐', 'id': '39189723'}]",,,,
1168217131831480321,1168217131831480321,2019-09-01 12:40:43 CDT,2019-09-01,12:40:43,-0500,22793236,westernpub,Heather West,,Greg Abbott is currently complaining about gun violence on TV. “Working on solutions”. Like the loosening of gun laws?,en,[],[],[],0,0,3,[],[],https://twitter.com/WesternPub/status/1168217131831480321,False,,0,,chicago,,,,,,[],,,,
1168216800372363265,1168216800372363265,2019-09-01 12:39:24 CDT,2019-09-01,12:39:24,-0500,3022706287,mr_tylerbanh,Mr. Banh,,"I wake up, I check Twitter, I see ANOTHER mass shooting in the news. We’ve BEEN at the point where we’ve become desensitized to these horrors.",en,[],[],[],0,0,0,[],[],https://twitter.com/Mr_TylerBanh/status/1168216800372363265,False,,0,,chicago,,,,,,[],,,,
1168214888910639104,1168214888910639104,2019-09-01 12:31:48 CDT,2019-09-01,12:31:48,-0500,53189483,gregjn,Greg Johnson,,AEW got out on notice last night here at the Sears Center! The recipients of this “suicide dive” were very fortunate that Orange Cassidy didn’t pull out his violent chops and low kicks afterwards.,en,[],[],[],1,0,1,[],[],https://twitter.com/GregJN/status/1168214888910639104,False,https://twitter.com/AEW/status/1167976795842367488,0,,chicago,,,,,,[],,,,
