id,conversation_id,created_at,date,time,timezone,user_id,username,name,place,tweet,language,mentions,urls,photos,replies_count,retweets_count,likes_count,hashtags,cashtags,link,retweet,quote_url,video,thumbnail,near,geo,source,user_rt_id,user_rt,retweet_id,reply_to,retweet_date,translate,trans_src,trans_dest
1155266177574117381,1155266177574117381,2019-07-27 18:58:15 CDT,2019-07-27,18:58:15,-0500,1398585649,chimuarellano25,Chimu_,,My boy Chance makes better music high and hurt then happy...🤦‍♀️,en,[],[],[],0,1,6,[],[],https://twitter.com/chimuarellano25/status/1155266177574117381,False,,0,,los angeles,,,,,,[],,,,
1155265056575086592,1154953333745975296,2019-07-27 18:53:47 CDT,2019-07-27,18:53:47,-0500,911133265,spoopyluna,"Daddy, c h i l l",,@MEDUSADRE FUCK ICE FUCK THE POLICE FUCK THIS FUCKED UP JUSTICE SYSTEM. IM FUCKING DONE. TRY ME. ILL HAPPILY GO TO JAIL FLAILING MY ARMS IF IT MEANS I GET TO PUNCH ONE OF THESE STUPID MOTHERFUCKERS IN THE FACEEEE,en,[],[],[],0,0,0,[],[],https://twitter.com/SpoopyLuna/status/1155265056575086592,False,,0,,los angeles,,,,,,"[{'screen_name': 'MEDUSADRE', 'name': 'Dre💥', 'id': '266752425'}]",,,,
1155261864114135040,1155261287317659648,2019-07-27 18:41:06 CDT,2019-07-27,18:41:06,-0500,499440487,d_leo16,your mf dad,,@loganebourgeois dead ass ????,en,[],[],[],0,0,0,[],[],https://twitter.com/d_leo16/status/1155261864114135040,False,,0,,los angeles,,,,,,"[{'screen_name': 'loganebourgeois', 'name': 'logan bourgeois', 'id': '1229793687837847553'}]",,,,
1155257740811358208,1154855509029093376,2019-07-27 18:24:43 CDT,2019-07-27,18:24:43,-0500,129998395,rfamovie,Radio Free Albemuth,,"@akoukouli @HopperMovieOOTB @devotifilm @TheGoodBreast @elizabethkarr @la_Biennale Thank you for spreading the news about Dennis Hopper's #OutOfTheBlue restoration and 40th anniversary re-release! @HopperMovieOOTB kick starter launch to help fund is Tuesday, July 30 at 11 AM PST!",en,"[{'screen_name': 'hoppermovieootb', 'name': 'outofthebluedennishopper', 'id': '1123381939270967296'}]",[],[],0,2,4,['outoftheblue'],[],https://twitter.com/rfamovie/status/1155257740811358208,False,,0,,los angeles,,,,,,"[{'screen_name': 'akoukouli', 'name': 'Anna Koukouli Born', 'id': '90448870'}, {'screen_name': 'HopperMovieOOTB', 'name': 'OutOfTheBlueDennisHopper', 'id': '1123381939270967296'}, {'screen_name': 'devotifilm', 'name': 'Devoti Tutti', 'id': '2845215456'}, {'screen_name': 'TheGoodBreast', 'name': 'The Good Breast', 'id': '2303995724'}, {'screen_name': 'elizabethkarr', 'name': 'Elizabeth Karr', 'id': '100453107'}, {'screen_name': 'la_Biennale', 'name': 'La Biennale di Venezia', 'id': '122728088'}]",,,,
1155255556950544384,1155253176737488898,2019-07-27 18:16:03 CDT,2019-07-27,18:16:03,-0500,206972192,kalipanameno,Nakyr 🇵🇦,,"@Who_Is_KD__ U do know he's strong without the suit, Right? The suit is used for other purposes as, the kinetic absorption of blows &amp; sending it back with like force. &amp; protecting him from bullets &amp; knives. Now...remove the liquid from the purple🌹...now it's Is This Your King?  https://t.co/YcPJ1ZEoi8",en,[],[],['https://pbs.twimg.com/tweet_video_thumb/EAhKzV8VUAALHqc.jpg'],0,0,8,[],[],https://twitter.com/KaliPanameno/status/1155255556950544384,False,,1,https://pbs.twimg.com/tweet_video_thumb/EAhKzV8VUAALHqc.jpg,los angeles,,,,,,"[{'screen_name': 'Who_Is_KD__', 'name': 'IG: ITSKINGKD', 'id': '154416309'}]",,,,
1155254351792705536,1154960991643324416,2019-07-27 18:11:15 CDT,2019-07-27,18:11:15,-0500,21916622,philranta,Phil Ranta,,@LtVic I would expect nothing less. It makes me miss the days of Shining Force.,en,[],[],[],0,0,1,[],[],https://twitter.com/PhilRanta/status/1155254351792705536,False,,0,,los angeles,,,,,,"[{'screen_name': 'LtVic', 'name': 'LtVictory', 'id': '1269886614'}]",,,,
1155254235958661120,1155073964634517505,2019-07-27 18:10:48 CDT,2019-07-27,18:10:48,-0500,365023609,focusfactory,Tony G.,,@realDonaldTrump Cummings is a bully?  https://t.co/0y1wgwnvdt,en,[],[],['https://pbs.twimg.com/tweet_video_thumb/EAhJmZ3VUAAlwxX.jpg'],0,0,0,[],[],https://twitter.com/FocusFactory/status/1155254235958661120,False,,1,https://pbs.twimg.com/tweet_video_thumb/EAhJmZ3VUAAlwxX.jpg,los angeles,,,,,,"[{'screen_name': 'realDonaldTrump', 'name': 'Donald J. Trump', 'id': '25073877'}]",,,,
1155253969335148545,1155253969335148545,2019-07-27 18:09:44 CDT,2019-07-27,18:09:44,-0500,1338386197,i19i97i,.,,yo like I fucks w anime but when niggas start reacting the shit I just be dead 💀,en,[],[],[],0,0,0,[],[],https://twitter.com/I19I97I/status/1155253969335148545,False,,0,,los angeles,,,,,,[],,,,
1155250992910237696,1155240345585750016,2019-07-27 17:57:54 CDT,2019-07-27,17:57:54,-0500,2814083575,flootchy,Gene Myrick,,@realDonaldTrump I support the death penalty for those who put foreign profits over the ideals and laws of our country.  #DeathPenaltyForTreason #TraitorTrump  #MoscowMitch  #ImpeachmentInquiryNow  https://t.co/hmbXu5GQtI,en,[],[],['https://pbs.twimg.com/media/EAhGp6BU8AAw4vW.jpg'],0,0,0,"['deathpenaltyfortreason', 'traitortrump', 'moscowmitch', 'impeachmentinquirynow']",[],https://twitter.com/flootchy/status/1155250992910237696,False,,1,https://pbs.twimg.com/media/EAhGp6BU8AAw4vW.jpg,los angeles,,,,,,"[{'screen_name': 'realDonaldTrump', 'name': 'Donald J. Trump', 'id': '25073877'}]",,,,
1155250533738770434,1154963263429304323,2019-07-27 17:56:05 CDT,2019-07-27,17:56:05,-0500,295001491,gracemckagan,Grace McKagan,,@jessejostark Bullet babe 🎙💙💙,tr,[],[],[],0,0,3,[],[],https://twitter.com/GraceMcKagan/status/1155250533738770434,False,,0,,los angeles,,,,,,"[{'screen_name': 'jessejostark', 'name': 'Jesse Jo Stark', 'id': '129009099'}]",,,,
1155250509474754560,1154918085746470913,2019-07-27 17:55:59 CDT,2019-07-27,17:55:59,-0500,48221606,mjtrustee,Marco Juarez,,"@SenSchumer Sen. Chuck Schumer, you &amp; your lazy-a**s congressional, elected persons HAVEN'T DONE ANYTHING or even given an idea to help secure our U.S. Borders. Hope no scrupulous, mischievous undocumented  immigrants ever interfere with your American freedoms or rights. Get off your dead a*",en,[],[],[],0,0,0,[],[],https://twitter.com/MjTrustee/status/1155250509474754560,False,,0,,los angeles,,,,,,"[{'screen_name': 'SenSchumer', 'name': 'Chuck Schumer', 'id': '17494010'}]",,,,
1155249472105938944,1155249472105938944,2019-07-27 17:51:52 CDT,2019-07-27,17:51:52,-0500,119200618,greentoxon,Eddie,,Man I'm pretty exhausted and the day still isn't even over. Feeling a little dead,en,[],[],[],0,0,0,[],[],https://twitter.com/GreenToxon/status/1155249472105938944,False,,0,,los angeles,,,,,,[],,,,
1155248015831027713,1155125395114434561,2019-07-27 17:46:05 CDT,2019-07-27,17:46:05,-0500,3271545313,prolificfuse,Prolific Fuse,,@myizonorion @CNNnewsroom @VictorBlackwell That’s scary to hear. Hope you didn’t discriminate and abuse your authority,en,[],[],[],0,0,0,[],[],https://twitter.com/ProlificFuse/status/1155248015831027713,False,,0,,los angeles,,,,,,"[{'screen_name': 'myizonorion', 'name': 'Faith', 'id': '18734216'}, {'screen_name': 'CNNnewsroom', 'name': 'CNN Newsroom', 'id': '9567972'}, {'screen_name': 'VictorBlackwell', 'name': 'Victor Blackwell CNN', 'id': '150240350'}]",,,,
1155245331631624193,1154966433329229824,2019-07-27 17:35:25 CDT,2019-07-27,17:35:25,-0500,1594531806,ayekron,LuhVinci💽,,@dflashh4 @Merrickn_Jr @SteibTyler It’s right in the replies bro😂What happens when a player get hurt and don’t have the same treatment as you? What happens when a weight room ain’t got everything they need to work as hard as you? They become limited and that’s just facts,en,[],[],[],1,0,4,[],[],https://twitter.com/AyeKron/status/1155245331631624193,False,,0,,los angeles,,,,,,"[{'screen_name': 'Merrickn_Jr', 'name': 'Lah Merk™️', 'id': '762868811724750848'}]",,,,
1155244379784658944,1155244379784658944,2019-07-27 17:31:38 CDT,2019-07-27,17:31:38,-0500,20922563,gratefulseconds,Grateful Seconds,,"If racism is a strategic path to victory, I will truly move to Canada in December 2020.  I can always listen to the Dead up there.",en,[],[],[],2,2,33,[],[],https://twitter.com/gratefulseconds/status/1155244379784658944,False,,0,,los angeles,,,,,,[],,,,
1155243202334511104,1155243202334511104,2019-07-27 17:26:57 CDT,2019-07-27,17:26:57,-0500,2348946866,brandwith2ee,AF (apirl fools),,At the ER phone is dead 🥺🙏🏾,en,[],[],[],0,0,0,[],[],https://twitter.com/brandwith2ee/status/1155243202334511104,False,,0,,los angeles,,,,,,[],,,,
1155242816370380800,1155242816370380800,2019-07-27 17:25:25 CDT,2019-07-27,17:25:25,-0500,50595242,jessicavaugn,Jessica Vaugn,,"Watching @TWooodley’s Fighter Roots featuring @BlessedMMA before #UFC240 tonight! A reason MMA connects deeply with me is the force with which champions defy statistically improbable &amp; unfavorable upbringings. Thanks for the transparency, it’s inspiring!  https://t.co/CkAkJOvHII",en,"[{'screen_name': 'twooodley', 'name': 'tyron t-wood woodley', 'id': '110340239'}, {'screen_name': 'blessedmma', 'name': 'max holloway', 'id': '42296641'}]",['https://youtu.be/KlSQzE0_tFc'],[],0,1,11,['ufc240'],[],https://twitter.com/JessicaVaugn/status/1155242816370380800,False,,0,,los angeles,,,,,,[],,,,
1155242046594015233,1155242046594015233,2019-07-27 17:22:21 CDT,2019-07-27,17:22:21,-0500,406607593,ogrejob,Brian Abel,,"@EAMaddenNFL there's a glitch where the kicker's meter goes away when trying to kick. I understand when the other team tries to ice the kicker, this is happening at random times.",en,[],[],[],0,0,0,[],[],https://twitter.com/Ogrejob/status/1155242046594015233,False,,0,,los angeles,,,,,,[],,,,
1155241738971172865,1155123033142513665,2019-07-27 17:21:08 CDT,2019-07-27,17:21:08,-0500,172982300,roeywrites,Roberta Dunn,,"@robreiner Before Mueller spoke pundits kept saying ask why he didn't subpoena Don, jr.! Not a lot being made of Mueller's answer: Cuz Dj is still under investigation. And being ""president"" won't save Donnie, jr. from a charge of treason. TREASON.   Brought back death penalty, just in time?",en,[],[],[],0,0,0,[],[],https://twitter.com/RoeyWrites/status/1155241738971172865,False,,0,,los angeles,,,,,,"[{'screen_name': 'robreiner', 'name': 'Rob Reiner', 'id': '738080573365702657'}]",,,,
1155240655855054850,1155240655855054850,2019-07-27 17:16:50 CDT,2019-07-27,17:16:50,-0500,1301600084,alyycon,ally,,dead ass I won’t lay in a tanning bed ever. (I don’t need to regardless but js) if that mf ain’t a walk in I ain’t walking in period,en,[],[],[],0,0,0,[],[],https://twitter.com/alyycon/status/1155240655855054850,False,,0,,los angeles,,,,,,[],,,,
1155239354597462016,1155140317538111490,2019-07-27 17:11:40 CDT,2019-07-27,17:11:40,-0500,147723974,allicinema,Allison M. 🌱 🔜 SXSW,,@itsSamCollins My worst fear is being a dead body,en,[],[],[],0,0,5,[],[],https://twitter.com/AlliCinema/status/1155239354597462016,False,,0,,los angeles,,,,,,"[{'screen_name': 'itsSamCollins', 'name': 'Sam Collins', 'id': '508232533'}]",,,,
1155239206660165632,1154954518246744064,2019-07-27 17:11:04 CDT,2019-07-27,17:11:04,-0500,26253284,tediously_brief,(michelle’s version)(she/her),,"@nataliemorales As a date rape survivor, I’m right there with you",en,[],[],[],0,0,0,[],[],https://twitter.com/tediously_brief/status/1155239206660165632,False,,0,,los angeles,,,,,,"[{'screen_name': 'nataliemorales', 'name': 'Natalie Morales', 'id': '23405114'}]",,,,
1155238859199807488,1155185248604262400,2019-07-27 17:09:41 CDT,2019-07-27,17:09:41,-0500,1136867153091522560,carefreemaroon,carefreemaroon,,@HeyImIvanna @khalielabooboo This is dead my favorite flavor 💀😩,en,[],[],[],1,0,0,[],[],https://twitter.com/carefreemaroon/status/1155238859199807488,False,,0,,los angeles,,,,,,"[{'screen_name': 'khalielabooboo', 'name': 'カーリル', 'id': '306306068'}]",,,,
1155238706720235521,1155226934839664640,2019-07-27 17:09:05 CDT,2019-07-27,17:09:05,-0500,2183968900,trueromancefest,Clarence Worley,,@Michael30634283 Clarence would be dead. And so would this movie to me 😃,en,[],[],[],0,0,0,[],[],https://twitter.com/trueromancefest/status/1155238706720235521,False,,0,,los angeles,,,,,,[],,,,
1155237958783524865,1155237958783524865,2019-07-27 17:06:07 CDT,2019-07-27,17:06:07,-0500,279897430,jmacdakid,J.Michael Trautmann,"{'type': 'Point', 'coordinates': [34.14453, -118.39561]}","Death knows my name well, but he has yet to Hear it.💀 You’re not promised today, let alone tomorrow. #NotToday @ Studio City, California  https://t.co/cX1PpH1BXs",en,[],['https://www.instagram.com/p/B0b7QYXglnJ/?igshid=iiozzzxou51m'],[],2,1,9,['nottoday'],[],https://twitter.com/JMACdaKID/status/1155237958783524865,False,,0,,los angeles,,,,,,[],,,,
1155237109290041344,1155237109290041344,2019-07-27 17:02:44 CDT,2019-07-27,17:02:44,-0500,21587797,dashawns2cents,HTG,,Waiting for a edible to kick in is like walking a tight rope of emotions 😂,en,[],[],[],0,1,5,[],[],https://twitter.com/dashawns2cents/status/1155237109290041344,False,,0,,los angeles,,,,,,[],,,,
1155235521301323776,1155235521301323776,2019-07-27 16:56:26 CDT,2019-07-27,16:56:26,-0500,46589936,aschoffespn,Edward Aschoff,,It actually makes a ton of sense. Players and coaches will be fine with an early kick. Fans are already up anyway. Now people on the East Coast see you live AND highlights during big games. I love the “idea”,en,[],[],[],1,0,2,[],[],https://twitter.com/AschoffESPN/status/1155235521301323776,False,https://twitter.com/Andy_Staples/status/1155087231469662208,0,,los angeles,,,,,,[],,,,
1155235513713844224,1154973691144335360,2019-07-27 16:56:24 CDT,2019-07-27,16:56:24,-0500,2201825232,neontruths,benafflecksmoking.jpg,,"@georgeedwardmoz Nah, that dude dead!",en,[],[],[],0,0,1,[],[],https://twitter.com/neontruths/status/1155235513713844224,False,,0,,los angeles,,,,,,"[{'screen_name': 'georgeedwardmoz', 'name': '𝙶𝚎𝚘𝚛𝚐𝚒𝚎𝚎𝚎𝚎', 'id': '3032204215'}]",,,,
1155233064919764993,1154807870615015425,2019-07-27 16:46:40 CDT,2019-07-27,16:46:40,-0500,1122408560992718848,knife_gnome,dvd gbrl,,@LibrisArcana @DevSparxx trans dice trans dice,fr,[],[],[],1,0,1,[],[],https://twitter.com/knife_gnome/status/1155233064919764993,False,,0,,los angeles,,,,,,"[{'screen_name': 'LibrisArcana', 'name': 'LibrisArcana.com', 'id': '965703626306895872'}]",,,,
1155232884220805120,1155232884220805120,2019-07-27 16:45:57 CDT,2019-07-27,16:45:57,-0500,1122408560992718848,knife_gnome,dvd gbrl,,Libris Arcana said Trans Rights,en,[],[],[],0,0,5,[],[],https://twitter.com/knife_gnome/status/1155232884220805120,False,https://twitter.com/LibrisArcana/status/1154807870615015425,0,,los angeles,,,,,,[],,,,
1155230407354224640,1155230407354224640,2019-07-27 16:36:06 CDT,2019-07-27,16:36:06,-0500,998570041,vickyrod119,Vic 🖤,,Of course the day I wear a white shirt I get 3 bloody noses,en,[],[],[],0,0,1,[],[],https://twitter.com/vickyrod119/status/1155230407354224640,False,,0,,los angeles,,,,,,[],,,,
1155226944910155776,1155132793430708224,2019-07-27 16:22:21 CDT,2019-07-27,16:22:21,-0500,931026785092829185,rick90631,Rick,,@Stonekettle @USNavyMomPA Trump is brain dead therefore what he says should be considered brain dead as well.,en,[],[],[],0,0,1,[],[],https://twitter.com/Rick90631/status/1155226944910155776,False,,0,,los angeles,,,,,,"[{'screen_name': 'Stonekettle', 'name': 'Stonekettle', 'id': '41223126'}, {'screen_name': 'USNavyMomPA', 'name': 'Navy Mom GET VAXXED', 'id': '23094875'}]",,,,
1155226929630367745,1155226929630367745,2019-07-27 16:22:17 CDT,2019-07-27,16:22:17,-0500,2371154011,deliauhhh,Delia Diaz,,Finally was able to get a bike to ride to work. Now just waiting on my knife set and bag. 😍  https://t.co/IZKVG9xZPY,en,[],[],['https://pbs.twimg.com/tweet_video_thumb/EAgwwwtUcAUseUf.jpg'],0,0,0,[],[],https://twitter.com/Deliauhhh/status/1155226929630367745,False,,1,https://pbs.twimg.com/tweet_video_thumb/EAgwwwtUcAUseUf.jpg,los angeles,,,,,,[],,,,
1155226735106912256,1155186632481488896,2019-07-27 16:21:31 CDT,2019-07-27,16:21:31,-0500,226262800,noz8504,🌮_Noz_O,,@megatron_death @CrazyFanTakes  https://t.co/Z4pAsXUfLw,und,[],[],['https://pbs.twimg.com/tweet_video_thumb/EAgwlYSUcAArGLJ.jpg'],0,0,0,[],[],https://twitter.com/Noz8504/status/1155226735106912256,False,,1,https://pbs.twimg.com/tweet_video_thumb/EAgwlYSUcAArGLJ.jpg,los angeles,,,,,,"[{'screen_name': 'megatron_death', 'name': 'Death megatron 2000', 'id': '1482092793732415491'}]",,,,
1155224502210461696,1155224502210461696,2019-07-27 16:12:39 CDT,2019-07-27,16:12:39,-0500,74960699,lolbeachgrill,Beachgrill,,We’re at Riot Games Battle Area to see  #TLWIN #TLWIN #TLWIN @TeamLiquidLoL @lolesports @riotgames,en,"[{'screen_name': 'teamliquidlol', 'name': 'team liquid lol', 'id': '964529942'}, {'screen_name': 'lolesports', 'name': 'lol esports', 'id': '614754689'}, {'screen_name': 'riotgames', 'name': 'riot games', 'id': '20523846'}]",[],[],0,0,4,"['tlwin', 'tlwin', 'tlwin']",[],https://twitter.com/LoLBeachgrill/status/1155224502210461696,False,,0,,los angeles,,,,,,[],,,,
1155223882262908928,1155223882262908928,2019-07-27 16:10:11 CDT,2019-07-27,16:10:11,-0500,1393542794,reuben81691,Reuben Hernandez,,Dodger offense needed an inning like that. Keep it going! #LetsGoDodgers #LABleedsBlue,en,[],[],[],0,0,0,"['letsgododgers', 'lableedsblue']",[],https://twitter.com/reuben81691/status/1155223882262908928,False,,0,,los angeles,,,,,,[],,,,
1155223069033500672,1155223069033500672,2019-07-27 16:06:57 CDT,2019-07-27,16:06:57,-0500,2993031609,castro_picasso,Castro_Picasso,,Bring me your Air Force ones today at my studio. Doing customs special all week.  $100 anything you want,en,[],[],[],0,0,0,[],[],https://twitter.com/castro_picasso/status/1155223069033500672,False,,0,,los angeles,,,,,,[],,,,
1155223019414884352,1155223019414884352,2019-07-27 16:06:45 CDT,2019-07-27,16:06:45,-0500,2280127622,akeirareddy,S. Akeira Reddy,,Y’all (maybe I’m late to the partay) but the song at the end of S1 E3 is the same as the song at the end of Season 3... End of S1 E3 - everyone thought Will was dead  S3 E8 - everyone thinks Hop is dead @Stranger_Things @strangerwriters #Heroes,en,"[{'screen_name': 'stranger_things', 'name': 'stranger things', 'id': '3320478908'}, {'screen_name': 'strangerwriters', 'name': 'stranger writers', 'id': '3243561805'}]",[],[],4,0,5,['heroes'],[],https://twitter.com/AkeiraReddy/status/1155223019414884352,False,,0,,los angeles,,,,,,[],,,,
1155222760982867968,1155004463284756480,2019-07-27 16:05:43 CDT,2019-07-27,16:05:43,-0500,21719982,johnroycomic,John Roy,,@MarthaKelly3 Read about her scamming AIDS patients in the 80s with victim blaming and magical thinking nonsense.  It’s much worse than simple flakery.,en,[],[],[],1,0,2,[],[],https://twitter.com/JohnRoycomic/status/1155222760982867968,False,,0,,los angeles,,,,,,"[{'screen_name': 'MarthaKelly3', 'name': 'Martha Kelly', 'id': '366830788'}]",,,,
1155221378838257664,1155221378838257664,2019-07-27 16:00:14 CDT,2019-07-27,16:00:14,-0500,826806553818779649,connectionshope,Rachel G Greenberg,"{'type': 'Point', 'coordinates': [33.86035266, -118.38846367]}",Since being suddenly widowed I’m no longer afraid of death. It’s as if overnight any and all fear of death completely disappeared.,en,[],[],[],3,2,34,[],[],https://twitter.com/ConnectionsHope/status/1155221378838257664,False,,0,,los angeles,,,,,,[],,,,
1155219461118386177,1155218534047182848,2019-07-27 15:52:37 CDT,2019-07-27,15:52:37,-0500,8891042,scandalous,@Jennifer Stavros ✍️🖤💀⚰️,,Today they found a dead animal on their side. I listened as they talked about it.  While I'm not scared of dead things I'm in my room wondering if they're actually going to keep it &amp; not dump it to our side too.,en,[],[],[],0,0,0,[],[],https://twitter.com/Scandalous/status/1155219461118386177,False,,0,,los angeles,,,,,,[],,,,
1155218718839828480,1155218718839828480,2019-07-27 15:49:40 CDT,2019-07-27,15:49:40,-0500,857338544523665409,jennayy_96,Jenn 🌸🌞,,My neighbors dog legit attacked me! I love dogs but I’ve never wanted to kick a dog so bad in my life 🤬,en,[],[],[],0,0,0,[],[],https://twitter.com/jennayy_96/status/1155218718839828480,False,,0,,los angeles,,,,,,[],,,,
1155218644944613377,1155218644944613377,2019-07-27 15:49:22 CDT,2019-07-27,15:49:22,-0500,796543192883609600,giselleee_c,Giselle 🎡,,peeped more shiz and now i’m even more hurt 😔,en,[],[],[],1,1,13,[],[],https://twitter.com/giselleee_c/status/1155218644944613377,False,https://twitter.com/giselleee_c/status/1155167275848105984,0,,los angeles,,,,,,[],,,,
1155218579026878464,1155218579026878464,2019-07-27 15:49:06 CDT,2019-07-27,15:49:06,-0500,18808013,aj_ali,A.J. Ali ✊🏾✌🏾❤️,,"There are many distinct differences between @RepCummings and @realDonaldTrump. For starters, one is a racist, misogynistic bully with no moral compass and the other is the exact opposite. Guess which one is which. Here are a couple of photos to help you decide.  https://t.co/7JPy86kQUF",en,"[{'screen_name': 'repcummings', 'name': 'elijah e. cummings', 'id': '787373558'}, {'screen_name': 'realdonaldtrump', 'name': 'donald j. trump', 'id': '25073877'}]",[],['https://pbs.twimg.com/media/EAgpLFOVUAApBiV.jpg'],0,1,3,[],[],https://twitter.com/aj_ali/status/1155218579026878464,False,,1,https://pbs.twimg.com/media/EAgpLFOVUAApBiV.jpg,los angeles,,,,,,[],,,,
1155218534047182848,1155218534047182848,2019-07-27 15:48:56 CDT,2019-07-27,15:48:56,-0500,8891042,scandalous,@Jennifer Stavros ✍️🖤💀⚰️,,My next door neighbor is an asshole. They have shrubs growing all on the fence my housemate installed.  At one point they cut a portion of the shrubs... on their end. They left all the overhang on our fence to just sit there... dead.  This is worrisome/ frustrating.,en,[],[],[],1,0,1,[],[],https://twitter.com/Scandalous/status/1155218534047182848,False,,0,,los angeles,,,,,,[],,,,
1155217828229742598,1155206062137643008,2019-07-27 15:46:07 CDT,2019-07-27,15:46:07,-0500,327191230,richrodz711,RichRodz711,,@AntoMat360 @DJxSpeedy @kayla_lone_wolf @AJStylesOrg This is true!! But it was meant for him to get the push on Monday instead of Rollins. But the King was hurt.,en,[],[],[],1,0,1,[],[],https://twitter.com/RichRodz711/status/1155217828229742598,False,,0,,los angeles,,,,,,"[{'screen_name': 'AntoMat360', 'name': 'Azmog-_-', 'id': '955175168925683713'}, {'screen_name': 'DJxSpeedy', 'name': 'Stefan aka DJ Speedy', 'id': '196618548'}, {'screen_name': 'kayla_lone_wolf', 'name': '😘 kayla_one_and_only 💖', 'id': '1054056777757667329'}, {'screen_name': 'AJStylesOrg', 'name': 'AJ Styles', 'id': '43769311'}]",,,,
1155217573849391105,1155217573849391105,2019-07-27 15:45:07 CDT,2019-07-27,15:45:07,-0500,52639880,hdilla,Henry Darrow McComas,,"1. JACKIE BROWN 2. PULP FICTION 3. INGLORIOUS BASTERDS 4. RESERVOIR DOGS 5. KILL BILL 6. DEATH PROOF 7. ONCE UPON A TIME...  8. DJANGO 9. HATEFUL EIGHT  Yeah, I really dug DEATH PROOF, say somethin!  https://t.co/T2kpV33mw1",en,[],[],['https://pbs.twimg.com/tweet_video_thumb/EAgoQdeU8AApMP4.jpg'],2,2,2,[],[],https://twitter.com/Hdilla/status/1155217573849391105,False,,1,https://pbs.twimg.com/tweet_video_thumb/EAgoQdeU8AApMP4.jpg,los angeles,,,,,,[],,,,
1155217482342252545,1155217482342252545,2019-07-27 15:44:45 CDT,2019-07-27,15:44:45,-0500,16037493,rickdware38,3rd World Diversity,,I feel all those protestor could be put to death by #Putin. Look at what that #asshole does around the world.  #Putin must be put down,en,[],[],[],0,0,0,"['putin', 'asshole', 'putin']",[],https://twitter.com/rickdware38/status/1155217482342252545,False,https://twitter.com/business/status/1155160731907756033,0,,los angeles,,,,,,[],,,,
1155217397818646528,1155217397818646528,2019-07-27 15:44:25 CDT,2019-07-27,15:44:25,-0500,2786149299,kyalbr,kyle a.b.,,"INT. LIVING ROOM, WAYNE'S PENTHOUSE — NIGHT   The Joker raises his knife from Rachel's cheek. She SLUGS him. He smiles.   THE JOKER: A little fight in you. I like that.   BATMAN (off screen): Then you’re going to love me.   THE JOKER:  https://t.co/hYGqoEnAwT",en,[],[],[],5,34,120,[],[],https://twitter.com/kyalbr/status/1155217397818646528,False,,1,https://pbs.twimg.com/ext_tw_video_thumb/1155217380349341697/pu/img/IoJOWh2quJJ4JTmo.jpg,los angeles,,,,,,[],,,,
1155217381951725568,1155217381951725568,2019-07-27 15:44:21 CDT,2019-07-27,15:44:21,-0500,860153142242979841,king___kemp,BigBallerKemp 💰🤘🏾💸,,Before the IPhones. There was The Side Kick 🙏🏾  https://t.co/yUeU6LI6Kb,en,[],[],"['https://pbs.twimg.com/media/EAgn3aPU0AAGvKB.jpg', 'https://pbs.twimg.com/media/EAgn3bHUEAA84bM.jpg', 'https://pbs.twimg.com/media/EAgn3ZRUwAE8V8n.jpg']",0,4,9,[],[],https://twitter.com/king___kemp/status/1155217381951725568,False,,1,https://pbs.twimg.com/media/EAgn3aPU0AAGvKB.jpg,los angeles,,,,,,[],,,,
1155216685697081344,1155143864316862465,2019-07-27 15:41:35 CDT,2019-07-27,15:41:35,-0500,16187845,meganthompson,Megan Thompson,,@KevinTWL I suggest Montana. Where every bug freezes to death before it becomes large and scary... however bears grow larger and scarier during the winter.,en,[],[],[],1,0,0,[],[],https://twitter.com/MeganThompson/status/1155216685697081344,False,,0,,los angeles,,,,,,"[{'screen_name': 'KevinTWL', 'name': 'Kevin Jordan', 'id': '48244546'}]",,,,
1155215944106434561,1155086779449397248,2019-07-27 15:38:38 CDT,2019-07-27,15:38:38,-0500,3851365392,museffect,MusEffect,,@jim_kretschmer It’s a hard habit to kick 🦵!,en,[],[],[],0,0,2,[],[],https://twitter.com/MusEffect/status/1155215944106434561,False,,0,,los angeles,,,,,,"[{'screen_name': 'jim_kretschmer', 'name': 'jimothy', 'id': '801952597976322048'}]",,,,
