id,conversation_id,created_at,date,time,timezone,user_id,username,name,place,tweet,language,mentions,urls,photos,replies_count,retweets_count,likes_count,hashtags,cashtags,link,retweet,quote_url,video,thumbnail,near,geo,source,user_rt_id,user_rt,retweet_id,reply_to,retweet_date,translate,trans_src,trans_dest
1080612829642649600,1080612829642649600,2019-01-02 17:52:30 CST,2019-01-02,17:52:30,-0500,2656804530,solid_cadence,✨🏳️‍⚧️René Desfartes🏳️‍⚧️✨,,"So if Nana's actions happen 6 frames after Popo's, can you dash attack cancel grab with a timing where Popo will grab but Nana will dash attack?",en,[],[],[],1,0,0,[],[],https://twitter.com/Solid_Cadence/status/1080612829642649600,False,,0,,san diego,,,,,,[],,,,
1080597481736392704,1080597481736392704,2019-01-02 16:51:30 CST,2019-01-02,16:51:30,-0500,21172097,kayevanessa,Vanessa Kaye,,"I mean I definitely know there's black on black crime but all I've been around in my 33 years is Racism, Racial Discrimination, &amp; Discrimination just in general! So forgive me if I seem a bit bias.",en,[],[],[],0,0,1,[],[],https://twitter.com/KayeVanessa/status/1080597481736392704,False,,0,,san diego,,,,,,[],,,,
1080597429693538304,1080574201562574856,2019-01-02 16:51:18 CST,2019-01-02,16:51:18,-0500,759110532741738497,lcgfrancis55lea,Lea Francis 🇺🇸🇺🇸 🇺🇦,,"@thehill Fat, dumb ass wipe. Letting good American workers go without pay, just to appease his 30% racist base.",en,[],[],[],0,0,0,[],[],https://twitter.com/Lcgfrancis55Lea/status/1080597429693538304,False,,0,,san diego,,,,,,"[{'screen_name': 'thehill', 'name': 'The Hill', 'id': '1917731'}]",,,,
1080585347744976896,1080559987150151680,2019-01-02 16:03:17 CST,2019-01-02,16:03:17,-0500,20327742,omeed,Omeed,,"@Cpt_Placeholder 1000% true if the game is, say, Fortnite - and has Epic's $ behind it. ;)  What if it's a midrange game betting heavily on the streaming community to get the word out? Being cut off from major streamers AND having them attack your launch could destroy your studio. You might pay.",en,[],[],[],1,0,0,[],[],https://twitter.com/Omeed/status/1080585347744976896,False,,0,,san diego,,,,,,"[{'screen_name': 'Cpt_Placeholder', 'name': 'John-Henry Drabeck', 'id': '2873567657'}]",,,,
1080580526845550592,1080548711107842049,2019-01-02 15:44:08 CST,2019-01-02,15:44:08,-0500,804834318858141696,risingmo0n,Rising Moon 🌙,,"@LoreniaCupcake Wake up a realize that photographers have always been racist, size-judgmental, and all around douchebags in a lot higher quantity than those that aren’t. And the models shouldn’t have to drop everything and pick up a camera to hold them to better standards.",en,[],[],[],1,0,0,[],[],https://twitter.com/risingmo0n/status/1080580526845550592,False,,0,,san diego,,,,,,"[{'screen_name': 'LoreniaCupcake', 'name': 'Laurel', 'id': '2352175410'}]",,,,
1080577618502537216,1080548711107842049,2019-01-02 15:32:35 CST,2019-01-02,15:32:35,-0500,804834318858141696,risingmo0n,Rising Moon 🌙,,"@LoreniaCupcake Hundreds of cosplayers have come forward with stories of being told by photographers that they “can’t shoot dark skin”. That’s racist, even if you don’t think it is. It’s no harder to shoot dark skin VS light skin, it’s the same as dark fabric VS light fabric.",en,[],[],[],1,0,0,[],[],https://twitter.com/risingmo0n/status/1080577618502537216,False,,0,,san diego,,,,,,"[{'screen_name': 'LoreniaCupcake', 'name': 'Laurel', 'id': '2352175410'}]",,,,
1080577304781176832,1080548711107842049,2019-01-02 15:31:20 CST,2019-01-02,15:31:20,-0500,804834318858141696,risingmo0n,Rising Moon 🌙,,"@LoreniaCupcake Being a PoC does not exclude you from being racist. And the portfolio speaks for itself. If you turn down all black or PoC cosplayers and that shows in the lack of diversity in your portfolio, that’s racist.",en,[],[],[],2,0,0,[],[],https://twitter.com/risingmo0n/status/1080577304781176832,False,,0,,san diego,,,,,,"[{'screen_name': 'LoreniaCupcake', 'name': 'Laurel', 'id': '2352175410'}]",,,,
1080576000591679488,1080548711107842049,2019-01-02 15:26:09 CST,2019-01-02,15:26:09,-0500,804834318858141696,risingmo0n,Rising Moon 🌙,,"@LoreniaCupcake But you shouldn’t have to avoid cosplaying because you fear rejection from photographers. Photogs should be held at the same standard as everyone else. If you’re racist, you get called out on that shit! You can’t hide your racism behind “personal artistic preference”.",en,[],[],[],2,0,0,[],[],https://twitter.com/risingmo0n/status/1080576000591679488,False,,0,,san diego,,,,,,"[{'screen_name': 'LoreniaCupcake', 'name': 'Laurel', 'id': '2352175410'}]",,,,
1080573735579467776,1080537940319596544,2019-01-02 15:17:09 CST,2019-01-02,15:17:09,-0500,3987300935,latinoinhi,JohnnyChingaso,,"@kirkovitch @YouCantFoolGod @TomiLahren Also, virtually all people who break in homes cause harm to the homeowner, whereas a minuscule percentage of people who come to this country cause harm to its citizens.",en,[],[],[],2,0,0,[],[],https://twitter.com/latinoinhi/status/1080573735579467776,False,,0,,san diego,,,,,,"[{'screen_name': 'kirkovitch', 'name': 'Walter Lester Kirk', 'id': '2939204566'}, {'screen_name': 'TomiLahren', 'name': 'Tomi Lahren', 'id': '468646961'}]",,,,
1080562331099136000,1080558008743198720,2019-01-02 14:31:50 CST,2019-01-02,14:31:50,-0500,704696823001124864,christie_d22,Christie,,@WalshFreedom k pretty sure it’s not Elizabeth Warren’s fault that Trump shut down the government over a racist wall so maybe stop,en,[],[],[],0,0,7,[],[],https://twitter.com/Christie_D22/status/1080562331099136000,False,,0,,san diego,,,,,,"[{'screen_name': 'WalshFreedom', 'name': 'Joe Walsh', 'id': '236487888'}]",,,,
1080558653348884480,1080528436249079808,2019-01-02 14:17:13 CST,2019-01-02,14:17:13,-0500,3010633722,sdnativejoe,Joe,,"@1TrueJasonKidd @RealJamesWoods @Israel I did and reread the same thing. Joking or not, when threatening harm or violence it is not free speech. Her comments were totally unacceptable in her position.",en,[],[],[],1,0,1,[],[],https://twitter.com/sdnativejoe/status/1080558653348884480,False,,0,,san diego,,,,,,"[{'screen_name': '1TrueJasonKidd', 'name': 'Jason Kidd', 'id': '2566376161'}, {'screen_name': 'RealJamesWoods', 'name': 'James Woods', 'id': '78523300'}, {'screen_name': 'Israel', 'name': 'Israel ישראל', 'id': '52660746'}]",,,,
1080558096399839232,1080558096399839232,2019-01-02 14:15:00 CST,2019-01-02,14:15:00,-0500,771795931637379072,bhayes2016,Beverly Hayes,,New York Times apologizes for including racial slur in crossword puzzle: 'It is simply not acceptable'   https://t.co/3C6TmcbjIN NYT BIASED AGAINST Latinoes &amp; President Trump.  How much longer will people comtinue to support this racist paper today them tomorrow you.,en,[],['https://www.foxnews.com/entertainment/new-york-times-apologizes-for-including-racial-slur-in-crossword-puzzle-it-is-simply-not-acceptable'],[],0,0,0,[],[],https://twitter.com/bhayes2016/status/1080558096399839232,False,,0,,san diego,,,,,,[],,,,
1080544593043644416,1080544593043644416,2019-01-02 13:21:21 CST,2019-01-02,13:21:21,-0500,298198632,neeneebucket,Leanne Howard Kenney,,#President #Trump #speaking to #Cabinet: Iran is a lot different country than it is today. Everyplace that was under #attack was because of #Iran. And #Obama had just gave them plane-loads of cash. #MAGA2020 MAGA,en,[],[],[],0,0,0,"['president', 'trump', 'speaking', 'cabinet', 'attack', 'iran', 'obama', 'maga2020']",[],https://twitter.com/neeneebucket/status/1080544593043644416,False,,0,,san diego,,,,,,[],,,,
1080534981254901760,1080534981254901760,2019-01-02 12:43:09 CST,2019-01-02,12:43:09,-0500,879308624,u6jair,Jairhead,,Make your first work out of the year brutal asf,en,[],[],[],0,1,4,[],[],https://twitter.com/U6Jair/status/1080534981254901760,False,,0,,san diego,,,,,,[],,,,
1080531596422180864,1080487233960988672,2019-01-02 12:29:42 CST,2019-01-02,12:29:42,-0500,1050890221,kwirsing1,kwirsing,,@fred_guttenberg 3) have clinical levels of paranoia and/or some delusional disorder...CDC should be given the $$ and the direction to study mental state of owners of multiple firearms..ATF should be studying economics of gun manufacturers: to whom are they selling all this high powered firearms?,en,[],[],[],0,0,0,[],[],https://twitter.com/kwirsing1/status/1080531596422180864,False,,0,,san diego,,,,,,"[{'screen_name': 'fred_guttenberg', 'name': 'Fred Guttenberg', 'id': '967027984426242053'}]",,,,
1080531106732994560,1080171818235953152,2019-01-02 12:27:45 CST,2019-01-02,12:27:45,-0500,26245050,jcct264,JJ Temple,,@politico Hey @politico ..the word you’re looking for is MISOGYNY,en,"[{'screen_name': 'politico', 'name': 'politico', 'id': '9300262'}]",[],[],0,0,0,[],[],https://twitter.com/jcct264/status/1080531106732994560,False,,0,,san diego,,,,,,"[{'screen_name': 'politico', 'name': 'POLITICO', 'id': '9300262'}]",,,,
1080530358335004672,1080487233960988672,2019-01-02 12:24:47 CST,2019-01-02,12:24:47,-0500,1050890221,kwirsing1,kwirsing,,"@fred_guttenberg 2)rifle he bought in 1930 to a nephew shortly before he died in 1971.  There is simply not enough volume in that scenario for gun manufs to be viable...they depend for $$ on high volume purchasers, loons with 30-100 guns in their basement.  Nobody needs that many guns unless they",en,[],[],[],1,0,0,[],[],https://twitter.com/kwirsing1/status/1080530358335004672,False,,0,,san diego,,,,,,"[{'screen_name': 'fred_guttenberg', 'name': 'Fred Guttenberg', 'id': '967027984426242053'}]",,,,
1080523579983224833,1080523578607427585,2019-01-02 11:57:51 CST,2019-01-02,11:57:51,-0500,22067186,atecorp,Advanced Test Equipment Corp. (ATEC),,Looking for the proper equipment to fulfill this test? Check out our ESD Gun inventory:  https://t.co/xfuL4rCqp9,en,[],['https://www.atecorp.com/category/esd-guns'],[],0,0,0,[],[],https://twitter.com/ATECorp/status/1080523579983224833,False,,0,,san diego,,,,,,[],,,,
1080512957686067200,1080109395357380613,2019-01-02 11:15:38 CST,2019-01-02,11:15:38,-0500,1242131310,dare_se,DaRe Se,,@Exposingpoliti1 @beenie48cf @Trixie12587126 @realDonaldTrump You need to follow this a lot more. Most people that are here illegally are from over stays of visas versus Crossing illegally. Saying you want a fence doesn't make you a racist. Allowing the racist to make such comments allows racism to continue. you are part of the problem.,en,[],[],[],0,0,1,[],[],https://twitter.com/DaRe_Se/status/1080512957686067200,False,,0,,san diego,,,,,,"[{'screen_name': 'Exposingpoliti1', 'name': 'Exposingpoliticalgames', 'id': '1050768893323747328'}, {'screen_name': 'beenie48cf', 'name': 'Charlene Fugler', 'id': '3230697356'}, {'screen_name': 'Trixie12587126', 'name': 'Trixie', 'id': '1009426810550063104'}, {'screen_name': 'realDonaldTrump', 'name': 'Donald J. Trump', 'id': '25073877'}]",,,,
1080512373478195201,1080512373478195201,2019-01-02 11:13:19 CST,2019-01-02,11:13:19,-0500,418523672,a____cole,Andrew Roger Cortez,,Do all places pierce your nose with a needle? Or do any use the gun?,en,[],[],[],1,0,0,[],[],https://twitter.com/A____COLE/status/1080512373478195201,False,,0,,san diego,,,,,,[],,,,
1080511028775931904,1080448677221621761,2019-01-02 11:07:58 CST,2019-01-02,11:07:58,-0500,300449643,papabark,paradox,,@thestevenwoods @BenAndWoods “Racist”,en,[],[],[],1,0,3,[],[],https://twitter.com/papabark/status/1080511028775931904,False,,0,,san diego,,,,,,"[{'screen_name': 'thestevenwoods', 'name': 'woods', 'id': '524020462'}, {'screen_name': 'BenAndWoods', 'name': 'Ben & Woods', 'id': '977963929367277568'}]",,,,
1080507262580346880,1079062763765284869,2019-01-02 10:53:00 CST,2019-01-02,10:53:00,-0500,1242131310,dare_se,DaRe Se,,@jmacthemonsta @WichitaPolice Thanks. I just looked up if hate crimes are offered bail. And they do! Any hate crime should not be offered bail as they inadvertently put any given group of people in danger. The law should be changed in this particular matter.,en,[],[],[],1,0,1,[],[],https://twitter.com/DaRe_Se/status/1080507262580346880,False,,0,,san diego,,,,,,"[{'screen_name': 'jmacthemonsta', 'name': 'Dirty Tocsin', 'id': '60611079'}, {'screen_name': 'WichitaPolice', 'name': 'Wichita Police', 'id': '24175660'}]",,,,
1080506717090177026,1079062763765284869,2019-01-02 10:50:50 CST,2019-01-02,10:50:50,-0500,1242131310,dare_se,DaRe Se,,"@WichitaPolice @jmacthemonsta Eventhough this is obviously an assault case, we must also realize the fact that it is a hate crime. Hate crimes put any given group of people in danger and should not be offered bail. He should have not been let go.  You have inadvertently put people in danger.",en,[],[],[],0,0,1,[],[],https://twitter.com/DaRe_Se/status/1080506717090177026,False,,0,,san diego,,,,,,"[{'screen_name': 'WichitaPolice', 'name': 'Wichita Police', 'id': '24175660'}, {'screen_name': 'jmacthemonsta', 'name': 'Dirty Tocsin', 'id': '60611079'}]",,,,
1080506170996113408,1080272522594213888,2019-01-02 10:48:40 CST,2019-01-02,10:48:40,-0500,30390827,fatherwelch,Mike Welch,,@MittRomney I am no longer a Mitt Romney fan. You have aligned yourself with those who would do harm to our country. Way to start your new  job.,en,[],[],[],1,0,0,[],[],https://twitter.com/FatherWelch/status/1080506170996113408,False,,0,,san diego,,,,,,"[{'screen_name': 'MittRomney', 'name': 'Mitt Romney', 'id': '50055701'}]",,,,
1080497262671745024,1080497262671745024,2019-01-02 10:13:16 CST,2019-01-02,10:13:16,-0500,278297689,daisyamos,Daisy Amos,,"Mike Huckabee on Trump's biggest wins of 2018  https://t.co/M5Dm7sFmJA via @YouTube #1: historic levels of unemployment for black &amp; Hispanic  communities! ‘Racist, xenophobic’ president?",en,"[{'screen_name': 'youtube', 'name': 'youtube', 'id': '10228272'}]",['https://youtu.be/Qm22aOEm0Bc'],[],0,0,0,[],[],https://twitter.com/daisyamos/status/1080497262671745024,False,,0,,san diego,,,,,,[],,,,
1080494719824625664,1080494719824625664,2019-01-02 10:03:10 CST,2019-01-02,10:03:10,-0500,326319661,tongvaboy,Emilio Reyes,,Please refrain from sharing racist memes and comments towards NTVS due to Elizabeth Warren’s ignorance. NTVS are affected by the things you say and post. Just because Trump said it doesn’t make it ok to repeat it. He is another ignorant fool with white privilege balls.,en,[],[],[],1,14,33,[],[],https://twitter.com/tongvaboy/status/1080494719824625664,False,,0,,san diego,,,,,,[],,,,
1080492352391634946,1080475217850519552,2019-01-02 09:53:46 CST,2019-01-02,09:53:46,-0500,936639555196813312,gwenannbarrett,Gwen Ann Barrett,,"@GOPChairwoman @realDonaldTrump More of you spineless cowards ought to be speaking against @realDonaldTrump , he’s a liar, a cheater, a racist, he is using our government to line his own pockets &amp; doing everything in his power to deepen the gap between the have and the have nots. #TrumpResign",en,"[{'screen_name': 'realdonaldtrump', 'name': 'donald j. trump', 'id': '25073877'}]",[],[],0,0,0,['trumpresign'],[],https://twitter.com/GwenAnnBarrett/status/1080492352391634946,False,,0,,san diego,,,,,,"[{'screen_name': 'GOPChairwoman', 'name': 'Ronna McDaniel', 'id': '2353605901'}, {'screen_name': 'realDonaldTrump', 'name': 'Donald J. Trump', 'id': '25073877'}]",,,,
1080480390576431104,1080480390576431104,2019-01-02 09:06:14 CST,2019-01-02,09:06:14,-0500,784884750,schleppynabucco,Schleppy Nabucco's,,Review: Met Opera’s ‘Adriana Lecouvreur’ Bristles With Passion and Danger  https://t.co/0XStLcy8qN,fr,[],['https://www.nytimes.com/2019/01/01/arts/music/review-adriana-lecouvreur-metropolitan-opera.html'],[],0,0,0,[],[],https://twitter.com/SchleppyNabucco/status/1080480390576431104,False,,0,,san diego,,,,,,[],,,,
1080463396162592769,1080463396162592769,2019-01-02 07:58:42 CST,2019-01-02,07:58:42,-0500,839595877530402816,10newsmarymac,Mary McKenzie 10News,,I guess our aging infrastructure didn’t make a New Year’s resolution. No homes appear in danger of flooding right now.,en,[],[],[],2,0,6,[],[],https://twitter.com/10NewsMaryMac/status/1080463396162592769,False,https://twitter.com/DMPickering/status/1080461853132697600,0,,san diego,,,,,,[],,,,
1080435253557088256,1080435253557088256,2019-01-02 06:06:52 CST,2019-01-02,06:06:52,-0500,786757174177304576,ella_fan_dvm,Wilgoren_Watch2.0,,"#Romney2020 will wipe the floor w/disgraced President #Pence2020.  Pledges to call out @realDonaldTrump if ""divisive, racist, sexist, anti-immigrant, dishonest or destructive to democratic institutions.""  In that case, Mitt's gonna be very very busy.  LOL   https://t.co/54ySjyuaGo",en,"[{'screen_name': 'realdonaldtrump', 'name': 'donald j. trump', 'id': '25073877'}]",['https://tinyurl.com/yd76rhrw'],[],0,0,1,"['romney2020', 'pence2020']",[],https://twitter.com/Ella_Fan_DVM/status/1080435253557088256,False,,0,,san diego,,,,,,[],,,,
1080424898512613376,1080424898512613376,2019-01-02 05:25:43 CST,2019-01-02,05:25:43,-0500,914481984109285377,nigellatat,⚜️ Present: ME ⚜️,,"#WeLoveYouBambam   #BamBam You’re such a beautiful human being 💚 I know that it’s hard for you being an idol. Haters try to harm you. We will try our best to protect you, to show you love after all the hard time u’ve been through. We’ll be fine 💚 credit pic: bammad  https://t.co/xYhAh28KMI",en,[],[],['https://pbs.twimg.com/media/Dv5wt2HU0AAf9Ke.jpg'],1,3,9,"['weloveyoubambam', 'bambam']",[],https://twitter.com/NigellaTat/status/1080424898512613376,False,,1,https://pbs.twimg.com/media/Dv5wt2HU0AAf9Ke.jpg,san diego,,,,,,[],,,,
