id,conversation_id,created_at,date,time,timezone,user_id,username,name,place,tweet,language,mentions,urls,photos,replies_count,retweets_count,likes_count,hashtags,cashtags,link,retweet,quote_url,video,thumbnail,near,geo,source,user_rt_id,user_rt,retweet_id,reply_to,retweet_date,translate,trans_src,trans_dest
1098005784565211136,1098005784565211136,2019-02-19 17:45:53 CST,2019-02-19,17:45:53,-0500,1036108673758576640,imaginaryevelyn,Lucky (monster),"{'type': 'Point', 'coordinates': [32.875046, -117.223175]}","Performance art prompt: ""wear something your character wouldn't be caught dead in."" #fuckdisney #disney #wifey #bow #polkadots #honestlywhatisthis @ Mesa Nueva…  https://t.co/kEqvcw6P1b",en,[],['https://www.instagram.com/p/BuFRFMrHUucbl4KxueK6Sdu9d0iYeHYhnCXXso0/?utm_source=ig_twitter_share&igshid=1d107c3xfwjqu'],[],0,0,0,"['fuckdisney', 'disney', 'wifey', 'bow', 'polkadots', 'honestlywhatisthis']",[],https://twitter.com/ImaginaryEvelyn/status/1098005784565211136,False,,0,,san diego,,,,,,[],,,,
1098005761374863360,1098005761374863360,2019-02-19 17:45:48 CST,2019-02-19,17:45:48,-0500,43568648,busagent12,harry brett,,An @pictureboston inspired stab at a pic of the #supermoon2019 between 2 buildings in #SanDiego last night  https://t.co/NCEkSOZfHo,en,"[{'screen_name': 'pictureboston', 'name': 'mark garfinkel', 'id': '109715034'}]",[],['https://pbs.twimg.com/media/DzzmafiVsAAUtae.jpg'],3,1,2,"['supermoon2019', 'sandiego']",[],https://twitter.com/busagent12/status/1098005761374863360,False,,1,https://pbs.twimg.com/media/DzzmafiVsAAUtae.jpg,san diego,,,,,,[],,,,
1098002802721214464,1097995742902243329,2019-02-19 17:34:02 CST,2019-02-19,17:34:02,-0500,2275564789,therealdillll,big dilly,,@DelinDaniel7 v aggressive Daniel..bravo bravo,it,[],[],[],1,0,0,[],[],https://twitter.com/therealdillll/status/1098002802721214464,False,,0,,san diego,,,,,,"[{'screen_name': 'DelinDaniel7', 'name': 'Daniel', 'id': '900029760'}]",,,,
1097998226462978048,1097910307895345154,2019-02-19 17:15:51 CST,2019-02-19,17:15:51,-0500,2922207056,sddonavan,SDDONAVAN,,@EmilyCWaldon Emily we are stunned absolutely stunned. But this fan knows we are a couple to a few years away from being a force and for that a lot has to go right!! But for now we’re drunk with excitement!!,en,[],[],[],1,0,4,[],[],https://twitter.com/SDDonavan/status/1097998226462978048,False,,0,,san diego,,,,,,"[{'screen_name': 'EmilyCWaldon', 'name': 'Emily Waldon', 'id': '489733778'}]",,,,
1097996057659600897,1097996057659600897,2019-02-19 17:07:14 CST,2019-02-19,17:07:14,-0500,76105892,thatcoolblknerd,Hank McCoy Is A Menace,,Happy Death Day,en,[],[],[],0,0,0,[],[],https://twitter.com/ThatCoolBlkNerd/status/1097996057659600897,False,https://twitter.com/BernieSanders/status/1097828878310096901,0,,san diego,,,,,,[],,,,
1097993987166588928,1097993270246936577,2019-02-19 16:59:00 CST,2019-02-19,16:59:00,-0500,92359562,jessethechef,weed & wagyu,,@MED_lowrey That hoe dead p,en,[],[],[],1,0,0,[],[],https://twitter.com/jessethechef/status/1097993987166588928,False,,0,,san diego,,,,,,"[{'screen_name': 'MED_lowrey', 'name': 'Paper Route Frank 🐬🐬🐬🐬🤙🏾', 'id': '303323415'}]",,,,
1097991711341522946,1097991711341522946,2019-02-19 16:49:58 CST,2019-02-19,16:49:58,-0500,633784295,livvyfraga,Olivia Fraga♏️,,You don’t gotta lie to kick it,en,[],[],[],0,1,4,[],[],https://twitter.com/livvyfraga/status/1097991711341522946,False,,0,,san diego,,,,,,[],,,,
1097990470888615936,1097990470888615936,2019-02-19 16:45:02 CST,2019-02-19,16:45:02,-0500,788911693787172865,likedust_i_rise,"🇺🇦🌻Little Miss Sunshine, BA, BSN, RN",,I know a guy! Lol! Dead 🤣,en,[],[],[],0,0,1,[],[],https://twitter.com/likedust_I_rise/status/1097990470888615936,False,https://twitter.com/1StevieKilner/status/1097228842194948096,0,,san diego,,,,,,[],,,,
1097990325233016834,1097990325233016834,2019-02-19 16:44:27 CST,2019-02-19,16:44:27,-0500,4282202173,aalkermd,𝐀𝐒𝐇𝐄𝐋𝐘 𝐀𝐋𝐊𝐄𝐑 𝐌𝐃,,Know the laws being passed in your state. It changes how medicine is practiced. Policies should be centered around patient care. NPs calling time of death in #Indiana?  https://t.co/c7SzABbjIu @AAEMRSA @aaeminfo @emresidents @EmergencyDocs  https://t.co/P8Sz0GeWrB,en,"[{'screen_name': 'aaemrsa', 'name': 'aaem/rsa', 'id': '250182493'}, {'screen_name': 'aaeminfo', 'name': 'aaem', 'id': '334252288'}, {'screen_name': 'emresidents', 'name': 'emresidents', 'id': '23119671'}, {'screen_name': 'emergencydocs', 'name': 'emergency physicians', 'id': '19788027'}]",['http://iga.in.gov/legislative/2019/bills/house/1097#digest-heading'],['https://pbs.twimg.com/media/DzzYYGxUYAALNas.jpg'],0,0,1,['indiana'],[],https://twitter.com/aalkermd/status/1097990325233016834,False,,1,https://pbs.twimg.com/media/DzzYYGxUYAALNas.jpg,san diego,,,,,,[],,,,
1097988536748335105,1097988536748335105,2019-02-19 16:37:21 CST,2019-02-19,16:37:21,-0500,396636981,alexrotta,Alex Rotta,,"@UHRainbowBabies #PedsICU chief fellow @caseymccluskey presenting her research on critical self-harm and suicide at #CCC48  Important data showing increased frequency of self harm in pre-teens (10-12 yo). Strong work bringing this vastly understudy topic to light, Casey!  https://t.co/k3JOdaqQbF",en,"[{'screen_name': 'caseymccluskey', 'name': 'casey mccluskey', 'id': '20168776'}]",[],"['https://pbs.twimg.com/media/DzzWv9TUUAEXh4i.jpg', 'https://pbs.twimg.com/media/DzzWv9OUUAErJ-H.jpg']",0,4,13,"['pedsicu', 'ccc48']",[],https://twitter.com/AlexRotta/status/1097988536748335105,False,,1,https://pbs.twimg.com/media/DzzWv9TUUAEXh4i.jpg,san diego,,,,,,[],,,,
1097983537234378757,1097968631453892608,2019-02-19 16:17:29 CST,2019-02-19,16:17:29,-0500,130989968,trenchcoach619,Coach Michael T,,"@AwesomeeAndy What if fucking is not the intention? What if a man legitimately enjoys being around her. Hence “let’s hang out?” Is that so crazy to think? Or do we need a preflight briefing before that?? Shivery is not dead, it is just lost in a chasm of mixed signals.",en,[],[],[],0,0,0,[],[],https://twitter.com/TrenchCoach619/status/1097983537234378757,False,,0,,san diego,,,,,,"[{'screen_name': 'awesomeeandy', 'name': 'Andy', 'id': '217495070'}]",,,,
1097982858537271296,1097982858537271296,2019-02-19 16:14:47 CST,2019-02-19,16:14:47,-0500,217252811,dwcron,Dean Cron,,That moment you realize the knife is getting a little too close for comfort 😯  https://t.co/f6oCTdaHK2,en,[],[],['https://pbs.twimg.com/media/DzzRlW8VAAABn7v.jpg'],0,0,0,[],[],https://twitter.com/dwcron/status/1097982858537271296,False,,1,https://pbs.twimg.com/media/DzzRlW8VAAABn7v.jpg,san diego,,,,,,[],,,,
1097976964952948736,1097976964952948736,2019-02-19 15:51:22 CST,2019-02-19,15:51:22,-0500,1095113219788627968,queer_riot,Destiny Gaylord,,I often come to work early and my boss just noticed approvingly. I'm livin' for it,en,[],[],[],0,0,1,[],[],https://twitter.com/Queer_riot/status/1097976964952948736,False,,0,,san diego,,,,,,[],,,,
1097976727194595328,1097976727194595328,2019-02-19 15:50:25 CST,2019-02-19,15:50:25,-0500,3002302203,sicupharmd,Tony Gerlach,,My state Ohio leads way in opiates stewardship but still leads in opiate death. Prescribing is one piece of puzzle @SCCM #CCC48  https://t.co/FtMzNq1hVb,en,"[{'screen_name': 'sccm', 'name': 'sccm', 'id': '14676901'}]",[],['https://pbs.twimg.com/media/DzzMAw4UcAA7F9E.jpg'],0,3,5,['ccc48'],[],https://twitter.com/SICUPharmD/status/1097976727194595328,False,,1,https://pbs.twimg.com/media/DzzMAw4UcAA7F9E.jpg,san diego,,,,,,[],,,,
1097976517684936704,1097976517684936704,2019-02-19 15:49:35 CST,2019-02-19,15:49:35,-0500,26634319,lalehg_md,Laleh G MD,,"I will never forget and am always thankful in ways I cannot describe that the security guard and RN allowed my husband to walk to the morgue with our son, Aydin, hours after his death. It showed many things, one was they considered him, a baby, a person deserving of dignity.",en,[],[],[],1,4,42,[],[],https://twitter.com/LalehG_MD/status/1097976517684936704,False,https://twitter.com/ahmedhankir/status/1097494815648948231,0,,san diego,,,,,,[],,,,
1097972739539779584,1097918466999214080,2019-02-19 15:34:35 CST,2019-02-19,15:34:35,-0500,14687985,icuirl,"J. H. Steuernagle, MD",,"@ogi_gajic @iwashyna @f_g_zampieri @HalliePrescott In other words, everyone dies and the probability of death increases as a function of age and co-morbids.",en,[],[],[],1,0,2,[],[],https://twitter.com/ICUIRL/status/1097972739539779584,False,,0,,san diego,,,,,,"[{'screen_name': 'ogi_gajic', 'name': 'Ognjen Gajic', 'id': '45228693'}, {'screen_name': 'iwashyna', 'name': 'Jack Iwashyna\U0001fac1', 'id': '1617927480'}, {'screen_name': 'f_g_zampieri', 'name': 'Fernando Zampieri', 'id': '703343590492266498'}, {'screen_name': 'HalliePrescott', 'name': 'Hallie Prescott', 'id': '1935940212'}]",,,,
1097963035723915264,1097963035723915264,2019-02-19 14:56:01 CST,2019-02-19,14:56:01,-0500,1095113219788627968,queer_riot,Destiny Gaylord,,"Oooh, I'm feeling this song. Really wakes up my inner teen angst   https://t.co/WQspXdZdhl",en,[],['https://open.spotify.com/track/6fJvrluu2B9iibgnlwujyb?si=DpHlmfzeTJ-BwJVmP-e9iQ'],[],0,0,0,[],[],https://twitter.com/Queer_riot/status/1097963035723915264,False,,0,,san diego,,,,,,[],,,,
1097961625749864448,1097961625749864448,2019-02-19 14:50:25 CST,2019-02-19,14:50:25,-0500,1095113219788627968,queer_riot,Destiny Gaylord,,A masterpiece 🙌🏼  https://t.co/iijGhvy3MQ,pl,[],['https://open.spotify.com/track/04BcODyhCDTV7SBFeJHOXe?si=Q9bo0ElYQY2iGUvs27JfPA'],[],0,0,0,[],[],https://twitter.com/Queer_riot/status/1097961625749864448,False,,0,,san diego,,,,,,[],,,,
1097953192279564288,1097953192279564288,2019-02-19 14:16:54 CST,2019-02-19,14:16:54,-0500,486143749,bigreemaa,BIG REEMA🌟,,Aisha dead ass came into ma life &amp; got me to fall back on red meat lol dat shit a dubbbbbbb,en,[],[],[],1,1,1,[],[],https://twitter.com/BIGREEMAA/status/1097953192279564288,False,,0,,san diego,,,,,,[],,,,
1097952149554622464,1097952149554622464,2019-02-19 14:12:46 CST,2019-02-19,14:12:46,-0500,54228824,britavg13,Brita Van Guilder,,Just kickedboxed for the first time and pretended every punch I was punching my ex in the face. Damn that felt good 💪🏽 #Iamstrong,en,[],[],[],0,0,3,['iamstrong'],[],https://twitter.com/britavg13/status/1097952149554622464,False,,0,,san diego,,,,,,[],,,,
