id,conversation_id,created_at,date,time,timezone,user_id,username,name,place,tweet,language,mentions,urls,photos,replies_count,retweets_count,likes_count,hashtags,cashtags,link,retweet,quote_url,video,thumbnail,near,geo,source,user_rt_id,user_rt,retweet_id,reply_to,retweet_date,translate,trans_src,trans_dest
1122287102941491202,1122287102941491202,2019-04-27 18:51:11 CDT,2019-04-27,18:51:11,-0500,541795301,omarinbcsd,Omari Fleming,,Poway synagogue shooting survivor says gunman was “..focused to kill. You saw the hate &amp; murder in his eyes.” #NBC7 @nbcsandiego 📹:@sdnewsphotog &amp; @BridgetNaso  https://t.co/k8AipB0ySt,en,"[{'screen_name': 'nbcsandiego', 'name': 'nbc 7 san diego', 'id': '15535860'}, {'screen_name': 'sdnewsphotog', 'name': 'scott baird', 'id': '397627018'}, {'screen_name': 'bridgetnaso', 'name': 'bridget naso', 'id': '123125728'}]",[],[],0,5,5,['nbc7'],[],https://twitter.com/OmariNBCSD/status/1122287102941491202,False,,1,https://pbs.twimg.com/ext_tw_video_thumb/1122287058272186368/pu/img/C5K3_0XAqgaQhUBq.jpg,san diego,,,,,,[],,,,
1122284219663699968,1122284219663699968,2019-04-27 18:39:43 CDT,2019-04-27,18:39:43,-0500,260832311,richardnews8,Richard Allyn,,Rancho Peñasquitos neighborhood remains on lockdown as police descend on home of Poway synagogue shooting suspect @CBS8  https://t.co/jrFEphpZ3g,en,"[{'screen_name': 'cbs8', 'name': 'cbs 8 san diego', 'id': '27745484'}]",[],['https://pbs.twimg.com/media/D5Mni33VUAAT7Jj.jpg'],0,5,4,[],[],https://twitter.com/RichardNews8/status/1122284219663699968,False,,1,https://pbs.twimg.com/media/D5Mni33VUAAT7Jj.jpg,san diego,,,,,,[],,,,
1122283316441337856,1122281801416871936,2019-04-27 18:36:08 CDT,2019-04-27,18:36:08,-0500,756263962426023936,tac261,Bill Freeman,,@CNNPolitics Why does this not surprise me? Any person of color is always wrong in the eyes of a racist.,en,[],[],[],0,0,3,[],[],https://twitter.com/tac261/status/1122283316441337856,False,,0,,san diego,,,,,,"[{'screen_name': 'CNNPolitics', 'name': 'CNN Politics', 'id': '13850422'}]",,,,
1122282190530678784,1122282190530678784,2019-04-27 18:31:39 CDT,2019-04-27,18:31:39,-0500,22167582,sdprobation,Probation Department,,Our thought and prayers are with those affected by the Chabad synagogue shooting. The Family Assistance Center will be at Poway High School @PowayHighTitans 15500 Espola Road. Relatives looking for loved ones from the synagogue can proceed here for information.,en,"[{'screen_name': 'powayhightitans', 'name': 'poway high school', 'id': '377788553'}]",[],[],0,1,5,[],[],https://twitter.com/sdprobation/status/1122282190530678784,False,,0,,san diego,,,,,,[],,,,
1122277334667542528,1122235848110555136,2019-04-27 18:12:22 CDT,2019-04-27,18:12:22,-0500,2533783604,herrick_a,william a herrick,,"@Bellatrixx2020 @mcspocky Several ppl's lives are ruined bc a white terrorist hopped up on hormones and bad ideology decided to give his unwanted opinion,and act upon it.",en,[],[],[],0,0,1,[],[],https://twitter.com/herrick_a/status/1122277334667542528,False,,0,,san diego,,,,,,"[{'screen_name': 'Bellatrixx2020', 'name': 'SimplyBellatrixx 🇺🇦🌻I Stand With Ukraine🌻🇺🇦', 'id': '838525493368483841'}, {'screen_name': 'mcspocky', 'name': '👽 McSpocky™ 🗣🇺🇸🇺🇦🌊💉 #BuildBackBetter', 'id': '18082945'}]",,,,
1122275134432169984,1122255110132748288,2019-04-27 18:03:37 CDT,2019-04-27,18:03:37,-0500,73452506,edjoyce,Ed Joyce,,"@SDSheriff @SanDiegoPD SACRAMENTO – “California sends our deepest and heartfelt condolences to the friends and families of the victims of today’s shooting at the Chabad of Poway,” @GavinNewsom “... no one should be targeted for practicing the tenets of their faith.”  #PowayStrong #Poway  https://t.co/biUFtHnwVx",en,"[{'screen_name': 'gavinnewsom', 'name': 'gavin newsom', 'id': '11347122'}]",[],['https://pbs.twimg.com/media/D5MfSNAUUAAiT3u.jpg'],0,1,1,"['powaystrong', 'poway']",[],https://twitter.com/EdJoyce/status/1122275134432169984,False,,1,https://pbs.twimg.com/media/D5MfSNAUUAAiT3u.jpg,san diego,,,,,,"[{'screen_name': 'SDSheriff', 'name': 'San Diego Sheriff', 'id': '73422598'}, {'screen_name': 'SanDiegoPD', 'name': 'San Diego Police Department', 'id': '135678842'}]",,,,
1122274899836334080,1122271580732608512,2019-04-27 18:02:41 CDT,2019-04-27,18:02:41,-0500,2767224393,xchinoiii,Vinny Ibarra,,"@SDSheriff @10NewsCoronel @sdcrimestoppers SHOOTS UP A SYNAGOGUE, KILLS 1, INJURES MORE....  AND THIS W-H-I-T-E PUNK DONT EVEN HAVE A SCRATCH ON HIM.... THIS IS SIGN 1,9852 THAT LAW ENFORCEMENT IS A BUNCH OF RACIST CRIMINALS IN UNIFORMS... I RESPECT NOTHING OF YOU GARBAGE",en,[],[],[],0,0,0,[],[],https://twitter.com/xchinoiii/status/1122274899836334080,False,,0,,san diego,,,,,,"[{'screen_name': 'SDSheriff', 'name': 'San Diego Sheriff', 'id': '73422598'}, {'screen_name': '10NewsCoronel', 'name': 'Marie Coronel', 'id': '904539540'}, {'screen_name': 'sdcrimestoppers', 'name': 'SD Crime Stoppers', 'id': '70497783'}]",,,,
1122273452533010432,1122273452533010432,2019-04-27 17:56:56 CDT,2019-04-27,17:56:56,-0500,160085349,diegornelas,Sunny Diego,,Sounds like the San Diego Police Department didn't act on a potential threat at the synagogue that happened this morning. The dumb kid posted something on Reddit stating he would do something.,en,[],[],[],0,0,0,[],[],https://twitter.com/diegornelas/status/1122273452533010432,False,,0,,san diego,,,,,,[],,,,
1122273385235353600,1122273385235353600,2019-04-27 17:56:40 CDT,2019-04-27,17:56:40,-0500,534963838,rjellyman,Jellyman,,"We’re in the Walkoff Danger Zone. B9, 2-2, @ParkAtThePark I called it last night. Perdomo closing. @domgfanclub @Padre_PoohBear @Zippy_TMS @bullpenbabe @DJBlunt25 @FriarGal @drpadres @SDGalGina @MrLuisMGuerrero @MissPadre @ThatHosGirl_1 @TeeOhEmm  https://t.co/4nSIoMCe3G",en,"[{'screen_name': 'parkatthepark', 'name': 'park at the park', 'id': '1200213974806978560'}, {'screen_name': 'domgfanclub', 'name': 'domg fan club', 'id': '2873290337'}, {'screen_name': 'padre_poohbear', 'name': 'sharon leary', 'id': '2821718345'}, {'screen_name': 'zippy_tms', 'name': 'roy, staring out the window, waiting for spring.', 'id': '1576567184'}, {'screen_name': 'bullpenbabe', 'name': 'bullpenbabe, #letthemeatcake', 'id': '15141077'}, {'screen_name': 'friargal', 'name': '𝕱𝖗𝖎𝖆𝖗𝕲𝖆𝖑 😷💉💉💉', 'id': '769402739960926208'}, {'screen_name': 'drpadres', 'name': 'david raney', 'id': '36714463'}, {'screen_name': 'sdgalgina', 'name': 'sdgalgina', 'id': '30323007'}, {'screen_name': 'mrluismguerrero', 'name': 'official luis m. guerrero', 'id': '551363019'}, {'screen_name': 'misspadre', 'name': 'jess maam', 'id': '2835409501'}, {'screen_name': 'teeohemm', 'name': 'teeohemm', 'id': '20530887'}]",[],['https://pbs.twimg.com/tweet_video_thumb/D5MdsFOU0AAuaD1.jpg'],2,0,3,[],[],https://twitter.com/RJellyman/status/1122273385235353600,False,,1,https://pbs.twimg.com/tweet_video_thumb/D5MdsFOU0AAuaD1.jpg,san diego,,,,,,[],,,,
1122269630070964224,1122269630070964224,2019-04-27 17:41:45 CDT,2019-04-27,17:41:45,-0500,2650286422,markiepinter,Mark Pinter,"{'type': 'Point', 'coordinates': [32.731, -117.164]}","@WorldJewishCong          Today Jews are marking both the last day Passover, and Shabbat. Our sincere condolences to the family of the victim. We pray for the speedy recovery of those injured - and for the end of…  https://t.co/J81b4Z6N3S",en,[],['https://www.instagram.com/p/Bwxq_k5BcRN/?igshid=1o8h1vxw2pb82'],[],0,0,0,[],[],https://twitter.com/markiepinter/status/1122269630070964224,False,,0,,san diego,,,,,,[],,,,
1122266179081469952,1122266173855367168,2019-04-27 17:28:02 CDT,2019-04-27,17:28:02,-0500,203060129,cairnational,CAIR National,,"1/2 In a statement, @CAIRSanDiego Executive Director @dustincraun said:  “We condemn this disturbing and despicable attack on our neighbors at a house of worship, offer our heartfelt condolences to the loved ones of those killed or injured, and express our solidarity with the...",en,"[{'screen_name': 'cairsandiego', 'name': 'cair sandiego', 'id': '930463309'}, {'screen_name': 'dustincraun', 'name': 'mustafa dustin craun', 'id': '137086417'}]",[],[],1,3,4,[],[],https://twitter.com/CAIRNational/status/1122266179081469952,False,,0,,san diego,,,,,,[],,,,
1122266177949065217,1122266173855367168,2019-04-27 17:28:02 CDT,2019-04-27,17:28:02,-0500,203060129,cairnational,CAIR National,,"Early news reports mention that one person has died and three people are injured in an apparent hate crime at the Congregation Chabad synagogue in Poway, Calif.  SEE: 1 Dead, Suspect Detained Following Synagogue Shooting in Poway  https://t.co/DJ4tf5qN2n",en,[],['https://www.nbcsandiego.com/news/local/poway-synagogue-shooting-chabad-way-san-diego-sherrifs-department-509162631.html'],[],1,2,2,[],[],https://twitter.com/CAIRNational/status/1122266177949065217,False,,0,,san diego,,,,,,[],,,,
1122266176871178240,1122266173855367168,2019-04-27 17:28:01 CDT,2019-04-27,17:28:01,-0500,203060129,cairnational,CAIR National,,"(WASHINGTON,DC,4/27/19)–Council on American-Islamic Relations (CAIR), the nation’s largest Muslim civil rights &amp; advocacy organization,today expressed solidarity with the Jewish community in the San Diego-area &amp; nationwide following a deadly shooting at a synagogue near that city",en,[],[],[],1,3,2,[],[],https://twitter.com/CAIRNational/status/1122266176871178240,False,,0,,san diego,,,,,,[],,,,
1122266173855367168,1122266173855367168,2019-04-27 17:28:01 CDT,2019-04-27,17:28:01,-0500,203060129,cairnational,CAIR National,,CAIR Expresses Solidarity with Jewish Community After Deadly San Diego Synagogue Attack  (THREAD)  READ FULL STATEMENT ONLINE HERE:  https://t.co/0OUG91TEqJ  #sandiegosynagogue  https://t.co/PXo5VZjyNG,en,[],['https://www.cair.com/cair_expresses_solidarity_with_jewish_community_after_deadly_san_diego_synagogue_attack'],['https://pbs.twimg.com/media/D5MVW6CWsAIjhX-.jpg'],1,9,18,['sandiegosynagogue'],[],https://twitter.com/CAIRNational/status/1122266173855367168,False,,1,https://pbs.twimg.com/media/D5MVW6CWsAIjhX-.jpg,san diego,,,,,,[],,,,
1122265754420645889,1122265754420645889,2019-04-27 17:26:21 CDT,2019-04-27,17:26:21,-0500,260832311,richardnews8,Richard Allyn,,Authorities are surrounding house where suspect in Congregation Chabad synagogue shooting is believed to live in Rancho Peñasquitos @CBS8  https://t.co/EbsSfE4ytg,en,"[{'screen_name': 'cbs8', 'name': 'cbs 8 san diego', 'id': '27745484'}]",[],"['https://pbs.twimg.com/media/D5MWv5qUcAAObbd.jpg', 'https://pbs.twimg.com/media/D5MWv5pVUAIeWBb.jpg']",2,6,7,[],[],https://twitter.com/RichardNews8/status/1122265754420645889,False,,1,https://pbs.twimg.com/media/D5MWv5qUcAAObbd.jpg,san diego,,,,,,[],,,,
1122263784641269760,1122263784641269760,2019-04-27 17:18:31 CDT,2019-04-27,17:18:31,-0500,3195437606,fizbantv,FizbanTV,,"My thoughts and sympathies go out to the survivors, victims, and victim's families at the Chabad Synagogue of Poway. We support you in this time of crisis. #synagogue",en,[],[],[],0,0,1,['synagogue'],[],https://twitter.com/FizbanTV/status/1122263784641269760,False,,0,,san diego,,,,,,[],,,,
1122263656085868544,1122263656085868544,2019-04-27 17:18:00 CDT,2019-04-27,17:18:00,-0500,322941566,vastuvision,Kalpesh Joshi,,Sorry to hear about San Diego Shooting killed 1 &amp; injured 3 at Synagogue. Our prayers with all effected. #synagogueshooting #SanDiego,en,[],[],[],0,0,0,"['synagogueshooting', 'sandiego']",[],https://twitter.com/vastuvision/status/1122263656085868544,False,,0,,san diego,,,,,,[],,,,
1122261003587076096,1122261003587076096,2019-04-27 17:07:28 CDT,2019-04-27,17:07:28,-0500,49776341,sherocco,Joe Sherocco 🇺🇦🇺🇸,,This shooting is too close to home. My heart breaks for the families involved. Prayers to the Jewish community of Poway/San Diego.,en,[],[],[],0,0,0,[],[],https://twitter.com/sherocco/status/1122261003587076096,False,,0,,san diego,,,,,,[],,,,
1122260316270645248,1122254403111718912,2019-04-27 17:04:44 CDT,2019-04-27,17:04:44,-0500,412528270,giannininini,mike,,"@RochNH2014 @zinemaniac @FuriousJohn @BernieSanders I have no idea where you live, but the US has a major gun problem that it refuses to address.",en,[],[],[],2,0,2,[],[],https://twitter.com/giannininini/status/1122260316270645248,False,,0,,san diego,,,,,,"[{'screen_name': 'RochNH2014', 'name': 'Keith Perkins', 'id': '393036926'}, {'screen_name': 'zinemaniac', 'name': 'ZineManiac', 'id': '20506600'}, {'screen_name': 'FuriousJohn', 'name': 'Furious John', 'id': '289741323'}, {'screen_name': 'BernieSanders', 'name': 'Bernie Sanders', 'id': '216776631'}]",,,,
1122260026171641856,1122260026171641856,2019-04-27 17:03:35 CDT,2019-04-27,17:03:35,-0500,509302621,johngibbinsexut,John Gibbins,,"San Diego police have evavuated a cul de sac in Rancho Peñasquitos, San Diego  and surrounded a house related to a synagogue shooting in Poway, CA that left one person dead and three wounded on Saturday April 27.  https://t.co/qBdnS3GNM5",en,[],[],"['https://pbs.twimg.com/media/D5MRimfUYAAPoZt.jpg', 'https://pbs.twimg.com/media/D5MRinTU8AAfuvH.jpg', 'https://pbs.twimg.com/media/D5MRimdU4AEVu0E.jpg', 'https://pbs.twimg.com/media/D5MRinTUUAALCww.jpg']",3,71,60,[],[],https://twitter.com/JohnGibbinsEXUT/status/1122260026171641856,False,,1,https://pbs.twimg.com/media/D5MRimfUYAAPoZt.jpg,san diego,,,,,,[],,,,
