id,conversation_id,created_at,date,time,timezone,user_id,username,name,place,tweet,language,mentions,urls,photos,replies_count,retweets_count,likes_count,hashtags,cashtags,link,retweet,quote_url,video,thumbnail,near,geo,source,user_rt_id,user_rt,retweet_id,reply_to,retweet_date,translate,trans_src,trans_dest
1090760946157568000,1090760946157568000,2019-01-30 17:57:29 CST,2019-01-30,17:57:29,-0500,2168714520,keepingupwliy,🦄,,400mH is death written all over it,en,[],[],[],0,0,0,[],[],https://twitter.com/keepingupwliy/status/1090760946157568000,False,https://twitter.com/TeamRunner4Life/status/1090636407591395329,0,,philadelphia,,,,,,[],,,,
1090760075487182848,1090760075487182848,2019-01-30 17:54:01 CST,2019-01-30,17:54:01,-0500,189864860,darealdoublekup,Main Event Double Kup,,If you got a man and just want to have a fling.. TELL ME🗣🗣🗣yeen gotta lie to kick it 🤣🤣🤣,en,[],[],[],0,0,0,[],[],https://twitter.com/DaRealDoubleKup/status/1090760075487182848,False,,0,,philadelphia,,,,,,[],,,,
1090759875032948738,1090759875032948738,2019-01-30 17:53:14 CST,2019-01-30,17:53:14,-0500,30888314,darin_toliver,"Darin Toliver, MSW 🇺🇸","{'type': 'Point', 'coordinates': [39.998, -75.1448]}",God please protect and help those in need of shelter. Don’t let anyone stay out in this cold! Force them in!! Don’t take no for an answer! Stay inside!!…  https://t.co/wvFe46L8L0,en,[],['https://www.instagram.com/p/BtRx5q1npXZvu5zyaAt2FZPC7iVt2EKn_FxZ640/?utm_source=ig_twitter_share&igshid=1e5qafqwd3fhz'],[],0,0,1,[],[],https://twitter.com/darin_toliver/status/1090759875032948738,False,,0,,philadelphia,,,,,,[],,,,
1090758961157099520,1090657806951292928,2019-01-30 17:49:36 CST,2019-01-30,17:49:36,-0500,465145682,cprtrainingco,JEFFREY D. DORFMAN,,"@DebiBurik @chuckerstogo @Change @maroon5 @trvisXX @BigBoi They can protest anything they want, but not while working and on my dime. The fact that they are protesting, doesn’t mean they have the right to force their views on me and that’s what right I spent over 20 years in the Navy for.",en,[],[],[],2,0,0,[],[],https://twitter.com/cprtrainingco/status/1090758961157099520,False,,0,,philadelphia,,,,,,"[{'screen_name': 'DebiBurik', 'name': 'Debi Burik', 'id': '855230652'}, {'screen_name': 'Change', 'name': 'Change.org', 'id': '15947602'}, {'screen_name': 'maroon5', 'name': 'Maroon 5', 'id': '24886570'}, {'screen_name': 'trvisXX', 'name': 'TRAVIS SCOTT', 'id': '135019364'}, {'screen_name': 'BigBoi', 'name': 'Big Boi', 'id': '29330030'}]",,,,
1090758921541877762,1090758921541877762,2019-01-30 17:49:26 CST,2019-01-30,17:49:26,-0500,24550498,mde___,bear.,,I'm dead hype I just ordered some Ox tails 🤤,en,[],[],[],0,0,0,[],[],https://twitter.com/MDE___/status/1090758921541877762,False,,0,,philadelphia,,,,,,[],,,,
1090755168092807170,1090743112866107393,2019-01-30 17:34:31 CST,2019-01-30,17:34:31,-0500,525934160,jbirdis_theword,J.B.,,@_BurnsHD Red dead????,en,[],[],[],0,0,2,[],[],https://twitter.com/JBirdIs_TheWord/status/1090755168092807170,False,,0,,philadelphia,,,,,,[],,,,
1090753924489990145,1090753924489990145,2019-01-30 17:29:35 CST,2019-01-30,17:29:35,-0500,58365074,tonyheyl,Councilman Tony Heyl,,"I care. The abuse towards trans people, from the right, left, or anyone, is wrong, painful, and needs to stop. There is no justification for this hate.",en,[],[],[],0,1,3,[],[],https://twitter.com/tonyheyl/status/1090753924489990145,False,https://twitter.com/TheMariaMontano/status/1090753034320261121,0,,philadelphia,,,,,,[],,,,
1090750917580853253,1090750584557395973,2019-01-30 17:17:38 CST,2019-01-30,17:17:38,-0500,3173194447,spacejam4900,longlivenine9️⃣,,@Tay24_7 😭😭😭😭 ion know bloody 🤷🏾‍♂️😭😭,en,[],[],[],1,0,0,[],[],https://twitter.com/spacejam4900/status/1090750917580853253,False,,0,,philadelphia,,,,,,"[{'screen_name': 'Tay24_7', 'name': 'Tay From The 6™', 'id': '208427252'}]",,,,
1090750527359590401,1090750527359590401,2019-01-30 17:16:05 CST,2019-01-30,17:16:05,-0500,612932167,pizazzlordon,DIRECTOR,,"Bro this shit hurt so much because you were so pure, harmless, genuine, and one of the first to believe in me musically and Ill never get to share the glory in flesh just in spirit your Legacy will shine Brother🧙🏾‍♂️  https://t.co/DekCojE7uD",en,[],[],"['https://pbs.twimg.com/media/DyMfz_YW0AA_GM1.jpg', 'https://pbs.twimg.com/media/DyMfz_QXQAIFkm-.jpg']",0,0,0,[],[],https://twitter.com/PizazzLORDON/status/1090750527359590401,False,,1,https://pbs.twimg.com/media/DyMfz_YW0AA_GM1.jpg,philadelphia,,,,,,[],,,,
1090750362657665026,1090750362657665026,2019-01-30 17:15:26 CST,2019-01-30,17:15:26,-0500,3429010480,__dantemorgan,XII,,I’ve watched 222 many movies where the weather is this deadly ... so 😅,en,[],[],[],0,0,0,[],[],https://twitter.com/__Dantemorgan/status/1090750362657665026,False,,0,,philadelphia,,,,,,[],,,,
1090749052419895296,1090749052419895296,2019-01-30 17:10:13 CST,2019-01-30,17:10:13,-0500,966096190596141057,ozzysdead,delusional thomas 🦇,,I was just listening to Pigs by @tylerthecreator and dead ass didn’t notice the cops and sirens behind me 🤷‍♂️🚓,en,"[{'screen_name': 'tylerthecreator', 'name': 't', 'id': '166747718'}]",[],[],1,0,1,[],[],https://twitter.com/ozzysdead/status/1090749052419895296,False,,0,,philadelphia,,,,,,[],,,,
1090748764351053830,1090698834617888768,2019-01-30 17:09:05 CST,2019-01-30,17:09:05,-0500,93090816,russman30,Russ B,,"@socaloscar @Mediaite It doesn't work while still in the womb either, in fact, it doesn't work at all. Pre birth is a stage of life, like infancy, childhood, adulthood, senior years and death. Every human being has a right to live!",en,[],[],[],0,0,3,[],[],https://twitter.com/russman30/status/1090748764351053830,False,,0,,philadelphia,,,,,,"[{'screen_name': 'socaloscar', 'name': 'Oscar R', 'id': '846001364'}, {'screen_name': 'Mediaite', 'name': 'Mediaite', 'id': '29465136'}]",,,,
1090747766987522050,1090661589353668610,2019-01-30 17:05:07 CST,2019-01-30,17:05:07,-0500,365651280,raine41879,raine,,"@LDforReal @TooFab I remember Tawana the ""manipsmanape me"" girl. lied about being raped by white boys! No proof no evidence all a BIG FAT LIE!",en,[],[],[],0,0,0,[],[],https://twitter.com/Raine41879/status/1090747766987522050,False,,0,,philadelphia,,,,,,"[{'screen_name': 'TooFab', 'name': 'TooFab', 'id': '116547240'}]",,,,
1090747378523561989,1090660925105934336,2019-01-30 17:03:34 CST,2019-01-30,17:03:34,-0500,534929961,h_vonn,Heather Vaughan / Illustrator/ alluring 🧀,,@laywastegames @TheNazzaro Ohhhh yeah! That is fresh to death lookin!,en,[],[],[],1,0,3,[],[],https://twitter.com/H_vonn/status/1090747378523561989,False,,0,,philadelphia,,,,,,"[{'screen_name': 'laywastegames', 'name': 'Lay Waste Games', 'id': '1002016885'}, {'screen_name': 'TheNazzaro', 'name': 'Nick Nazzaro', 'id': '370483689'}]",,,,
1090747365219274752,1090747365219274752,2019-01-30 17:03:31 CST,2019-01-30,17:03:31,-0500,822955270041141252,jayquellin31,Jacki 💋💋,,I have just been a victim of a fart and dart from my 6yr old. How can someone so little release something so lethal?,en,[],[],[],0,0,1,[],[],https://twitter.com/jayquellin31/status/1090747365219274752,False,,0,,philadelphia,,,,,,[],,,,
1090742041309560833,1090742041309560833,2019-01-30 16:42:22 CST,2019-01-30,16:42:22,-0500,435056728,fsfccp,Faculty & Staff Community College of Philadelphia,,Is @CCPedu ‘s board and admin going to impose 3 union busting concessionary contracts that will hurt students when they don’t get what they want? 😡That’s what our staff report they are threatening.  @PhillyMayor @RichLazerPHL @Darrell_Clarke  Is this @GeneralsGuy ‘s border wall?  https://t.co/2kOCQzKgGp,en,"[{'screen_name': 'ccpedu', 'name': 'community college of philadelphia', 'id': '282583684'}, {'screen_name': 'phillymayor', 'name': 'jim #vaxupphilly kenney', 'id': '4515563482'}, {'screen_name': 'richlazerphl', 'name': 'rich lazer', 'id': '343085953'}, {'screen_name': 'darrell_clarke', 'name': 'darrell clarke', 'id': '487661707'}, {'screen_name': 'generalsguy', 'name': 'guy generals', 'id': '481699484'}]",[],['https://pbs.twimg.com/media/DyMYGhsVYAAnm2M.jpg'],1,4,1,[],[],https://twitter.com/FSFCCP/status/1090742041309560833,False,,1,https://pbs.twimg.com/media/DyMYGhsVYAAnm2M.jpg,philadelphia,,,,,,[],,,,
1090740867890069504,1090727263513919489,2019-01-30 16:37:42 CST,2019-01-30,16:37:42,-0500,1703617687,delisha_renee,Delisha Renee,,@TheRochaSays @KristianHarloff @roxystriar @wongrel @ReillyAround Just finishing up. This was a wonderful interview. I'm going to have to give Deadly Class a try,en,[],[],[],1,0,4,[],[],https://twitter.com/Delisha_Renee/status/1090740867890069504,False,,0,,philadelphia,,,,,,"[{'screen_name': 'TheRochaSays', 'name': 'John Rocha aka The Outlaw Nation', 'id': '12754772'}, {'screen_name': 'KristianHarloff', 'name': 'Kristian Harloff', 'id': '1375126604'}, {'screen_name': 'roxystriar', 'name': 'Roxy Striar', 'id': '175475686'}, {'screen_name': 'wongrel', 'name': 'Benedict Wong', 'id': '35214545'}, {'screen_name': 'ReillyAround', 'name': 'Mark E Reilly', 'id': '296459256'}]",,,,
1090734697234288640,1090734697234288640,2019-01-30 16:13:11 CST,2019-01-30,16:13:11,-0500,259327913,jrowehawk,HawkNestMonster,,"Wrong for too many reasons to list in the confines of Twitter.  @GovernorTomWolf in the long run, your plan will create more problems than it fixes.  I hope this plan dies a quick death.",en,"[{'screen_name': 'governortomwolf', 'name': 'governor tom wolf', 'id': '2978837542'}]",[],[],0,0,2,[],[],https://twitter.com/jrowehawk/status/1090734697234288640,False,https://twitter.com/GovernorTomWolf/status/1090668397921296385,0,,philadelphia,,,,,,[],,,,
1090733589338177537,1090733589338177537,2019-01-30 16:08:47 CST,2019-01-30,16:08:47,-0500,3865434921,margueritesara1,Marguerite Sarah Ann,,The police officer got into Andrew G Hicks body because Sara Rothschild who is Marguerite DeWitt was being raped &amp; Sam was telling everyone she is a whore but you never see the men that she is whoring with. Where are these men?,en,[],[],[],0,0,0,[],[],https://twitter.com/MargueriteSara1/status/1090733589338177537,False,,0,,philadelphia,,,,,,[],,,,
1090731743097876480,1090731743097876480,2019-01-30 16:01:27 CST,2019-01-30,16:01:27,-0500,4269355829,momtoast_mel,Melissa Matos,,"In Drakir hive minded Wild and Free Folk have an uneasy truce. Glade's day job is to protect the Free world, while hiding her own Wild heritage. When she finds other mixed people dead she is blackmailed into hunting the murderer. #SFFpit #fa #myf #sfy",en,[],[],[],0,0,0,"['sffpit', 'fa', 'myf', 'sfy']",[],https://twitter.com/momtoast_mel/status/1090731743097876480,False,,0,,philadelphia,,,,,,[],,,,
