id,conversation_id,created_at,date,time,timezone,user_id,username,name,place,tweet,language,mentions,urls,photos,replies_count,retweets_count,likes_count,hashtags,cashtags,link,retweet,quote_url,video,thumbnail,near,geo,source,user_rt_id,user_rt,retweet_id,reply_to,retweet_date,translate,trans_src,trans_dest
1113591275742289920,1113591275742289920,2019-04-03 18:57:04 CDT,2019-04-03,18:57:04,-0500,93566212,xannitheblue,Xanni the Blue🏳️‍⚧️ (they/she),,I can’t believe my parents watch this victim blaming shit,en,[],[],[],6,0,11,[],[],https://twitter.com/xannitheblue/status/1113591275742289920,False,https://twitter.com/ndrew_lawrence/status/1113588468213518336,0,,chicago,,,,,,[],,,,
1113587634910187521,1113587634910187521,2019-04-03 18:42:36 CDT,2019-04-03,18:42:36,-0500,13433832,egockel,Eric Gockel,,"@imbibe if Don M from @moneygunchicago hasn't hit you up yet, Amanda's Dead Marshes cocktail with Kummel really needs to get featured",en,"[{'screen_name': 'moneygunchicago', 'name': 'moneygun', 'id': '4431626549'}]",[],[],0,0,1,[],[],https://twitter.com/egockel/status/1113587634910187521,False,,0,,chicago,,,,,,[],,,,
1113584961523724288,1113584961523724288,2019-04-03 18:31:58 CDT,2019-04-03,18:31:58,-0500,25235875,drewtangclan,Lil' Druzi Vert® BLM,,"Zed's dead remix of ""Take ü there"" never ceases to make me emo",en,[],[],[],0,0,1,[],[],https://twitter.com/DrewTangClan/status/1113584961523724288,False,,0,,chicago,,,,,,[],,,,
1113584822469976064,1113584822469976064,2019-04-03 18:31:25 CDT,2019-04-03,18:31:25,-0500,625264038,rroxysanchezz,Roxana,,.. I’m fucking hurt..,en,[],[],[],0,0,1,[],[],https://twitter.com/rroxysanchezz/status/1113584822469976064,False,https://twitter.com/RomeoSantosPage/status/1112882667039670272,0,,chicago,,,,,,[],,,,
1113584630442201088,1113532208646696960,2019-04-03 18:30:39 CDT,2019-04-03,18:30:39,-0500,26876056,lust_forlife,Bunna Wunna,,@MusBeNyce My chest hurt lmao,en,[],[],[],1,0,0,[],[],https://twitter.com/Lust_ForLife/status/1113584630442201088,False,,0,,chicago,,,,,,"[{'screen_name': 'MusBeNyce', 'name': 'It’s in my 🅿️ocket', 'id': '52772136'}]",,,,
1113583921692839936,1113583921692839936,2019-04-03 18:27:50 CDT,2019-04-03,18:27:50,-0500,1020803992501268481,leci_peci,Leci 🌸,,"How are going to honor the death of someone truly great, while acknowledging only your own “accomplishments”...that you didn’t even really accomplish 😭💀",en,[],[],[],0,0,2,[],[],https://twitter.com/Leci_Peci/status/1113583921692839936,False,https://twitter.com/MustBeCharm/status/1113420799321440259,0,,chicago,,,,,,[],,,,
1113583769183825920,1113281739680559105,2019-04-03 18:27:14 CDT,2019-04-03,18:27:14,-0500,17084948,kathychaney,kathychaney,,"@laurenchooljian @natalieymoore @royalpratt And, he's doing our favorite leg kick!",en,[],[],[],0,0,0,[],[],https://twitter.com/kathychaney/status/1113583769183825920,False,,0,,chicago,,,,,,"[{'screen_name': 'laurenchooljian', 'name': 'Lauren Chooljian', 'id': '24207575'}, {'screen_name': 'natalieymoore', 'name': 'Natalie Y Moore', 'id': '101823277'}, {'screen_name': 'royalpratt', 'name': 'Gregory Pratt', 'id': '88263959'}]",,,,
1113583314215030791,1113583314215030791,2019-04-03 18:25:26 CDT,2019-04-03,18:25:26,-0500,16469083,chingram,chingram.eth,"{'type': 'Point', 'coordinates': [41.886, -87.7903]}","Two of us are pumped for the @cubs to kick it into gear! . . . . #everybodyin #teddybryant #kb17 @ Oak Park, Illinois  https://t.co/HGNV2hvG9f",en,"[{'screen_name': 'cubs', 'name': 'chicago cubs', 'id': '41144996'}]",['https://www.instagram.com/p/Bvz47qXB9Rm/?utm_source=ig_twitter_share&igshid=1ozr4nabgxr98'],[],0,0,1,"['everybodyin', 'teddybryant', 'kb17']",[],https://twitter.com/chingram/status/1113583314215030791,False,,0,,chicago,,,,,,[],,,,
1113582376972640258,1113569465214603272,2019-04-03 18:21:42 CDT,2019-04-03,18:21:42,-0500,847253499301609473,indivisibleop,Indivisible Oak Park,,@lenny_phil They use Air Force One like Uber. Why are we paying for  DJTJ  &amp; the rest of the Trump spawn to go to campaign rallies?,en,[],[],[],0,0,0,[],[],https://twitter.com/IndivisibleOP/status/1113582376972640258,False,,0,,chicago,,,,,,"[{'screen_name': 'lenny_phil', 'name': 'Lenny Phil', 'id': '1256613928043339778'}]",,,,
1113581712737558533,1113581712737558533,2019-04-03 18:19:04 CDT,2019-04-03,18:19:04,-0500,1102808348,vyvansediaries,depressed girl diaries,,I’m about to hurt her feelings lol  https://t.co/GeEWCU02qp,en,[],[],['https://pbs.twimg.com/media/D3Q8qV9W4AALlxm.jpg'],1,0,8,[],[],https://twitter.com/vyvansediaries/status/1113581712737558533,False,,1,https://pbs.twimg.com/media/D3Q8qV9W4AALlxm.jpg,chicago,,,,,,[],,,,
1113580105417285632,1113580105417285632,2019-04-03 18:12:41 CDT,2019-04-03,18:12:41,-0500,260030646,1book1chicago,onebookonechicago,,Our program with @C2ST on The Science of Star Wars featuring Dr. Dirk K Morr starts off with a discussion of The Force! #OBOC  https://t.co/SPcvxO7nMS,en,"[{'screen_name': 'c2st', 'name': 'chicago council s&t', 'id': '21368237'}]",[],['https://pbs.twimg.com/media/D3Q7M1aXoAIBzgS.jpg'],0,0,4,['oboc'],[],https://twitter.com/1book1chicago/status/1113580105417285632,False,,1,https://pbs.twimg.com/media/D3Q7M1aXoAIBzgS.jpg,chicago,,,,,,[],,,,
1113577918683389957,1113577918683389957,2019-04-03 18:03:59 CDT,2019-04-03,18:03:59,-0500,2979880791,wlimestall,Will Limestall 🇺🇸,,I didn’t actually read the article. Not going to. This isn’t a post about politics. It’s a comment on the media use of “nuclear option”.    Is this (1) about a weapon?   Or (2) something that does a safe and reliable job for decades?   Because (1) != (2)    https://t.co/s4ahLtnPxU,en,[],['https://twitter.com/nbcnews/status/1113558321875886080?s=21'],[],1,3,2,[],[],https://twitter.com/WLimestall/status/1113577918683389957,False,https://twitter.com/nbcnews/status/1113558321875886080?s=21,0,,chicago,,,,,,[],,,,
1113576371241082880,1113557937547632642,2019-04-03 17:57:50 CDT,2019-04-03,17:57:50,-0500,758399119,immskiwi,kiwi,,@abdulmomin23 @h24rz @reen_deer Lmfaooooo I’m dead. My mom def will throw those words around when she’s real pissed.,en,[],[],[],1,0,3,[],[],https://twitter.com/immskiwi/status/1113576371241082880,False,,0,,chicago,,,,,,"[{'screen_name': 'abdulmomin23', 'name': 'Abdul Momin Burner Account', 'id': '163660585'}, {'screen_name': 'reen_deer', 'name': 'reendeer', 'id': '925809626'}]",,,,
1113575821032267776,1113575821032267776,2019-04-03 17:55:39 CDT,2019-04-03,17:55:39,-0500,114976861,buscemi_peter,Peter Buscemi,,"I applaud Pittsburgh mayor Bill Peduto! Pro-gun advocates can yell and scream that it’s not legal according to Pennsylvania statute to limit guns, but it’s common sense to not allow military assault firearms, armor piercing bullets, and taking someone’s gun temporarily.",en,[],[],[],0,0,0,[],[],https://twitter.com/buscemi_peter/status/1113575821032267776,False,,0,,chicago,,,,,,[],,,,
1113574883886284800,1113519799202648064,2019-04-03 17:51:56 CDT,2019-04-03,17:51:56,-0500,369818349,vsapiro,V Sapiro,,"@prof_mirya I understand, M., but that might have led me never to give my time to almost any organization. The ones who treated me worst are pretty much dead now....",en,[],[],[],2,0,2,[],[],https://twitter.com/VSapiro/status/1113574883886284800,False,,0,,chicago,,,,,,"[{'screen_name': 'prof_mirya', 'name': 'Mirya R. Holman', 'id': '250307159'}]",,,,
1113574815749824512,1113573673934446592,2019-04-03 17:51:39 CDT,2019-04-03,17:51:39,-0500,133005951,jaredmckiernan,Jared McKiernan,,@tonyxrandall I really haven’t used this mute much before either except for a few super aggressive RTers. I like seeing the dumb tweets actively removed in the convo which caused a mute: blocc could be good to mix in also,en,[],[],[],0,0,0,[],[],https://twitter.com/jaredmckiernan/status/1113574815749824512,False,,0,,chicago,,,,,,"[{'screen_name': 'tonyxrandall', 'name': 'Anthony Palomarez', 'id': '2259308904'}]",,,,
1113570285482016773,1113446244133867527,2019-04-03 17:33:39 CDT,2019-04-03,17:33:39,-0500,777295608,brianlb6336,Brian j field,,@bullyray5150 @BustedOpenRadio @davidlagreca1 Agree Bully,en,[],[],[],0,0,0,[],[],https://twitter.com/BrianLb6336/status/1113570285482016773,False,,0,,chicago,,,,,,"[{'screen_name': 'bullyray5150', 'name': 'Bully Ray', 'id': '627683371'}, {'screen_name': 'BustedOpenRadio', 'name': 'SiriusXM Busted Open', 'id': '37723675'}, {'screen_name': 'davidlagreca1', 'name': 'David LaGreca', 'id': '830424167593934852'}]",,,,
1113568589687218178,1113566725071675392,2019-04-03 17:26:55 CDT,2019-04-03,17:26:55,-0500,1379458784,rga_02,RJ,,@Fatal_Futanari @LeafCam (When are they going to make a good game period)  https://t.co/oTnRwCwlnD,en,[],[],['https://pbs.twimg.com/media/D3QwulYXkAITnIF.jpg'],1,0,0,[],[],https://twitter.com/rga_02/status/1113568589687218178,False,,1,https://pbs.twimg.com/media/D3QwulYXkAITnIF.jpg,chicago,,,,,,"[{'screen_name': 'Fatal_Futanari', 'name': 'Fatal Futanari', 'id': '1962235783'}, {'screen_name': 'LeafCam', 'name': 'Leafhopper', 'id': '272719668'}]",,,,
1113568230763847682,1113568230763847682,2019-04-03 17:25:29 CDT,2019-04-03,17:25:29,-0500,58071302,spookytanuki,Sp๏๏ky Tanuki 🍂,,"You know I did this one. I got the Robin Williams character from Dead Poets Society, which I STILL haven’t seen. 😅",en,[],[],[],0,0,0,[],[],https://twitter.com/SpookyTanuki/status/1113568230763847682,False,https://twitter.com/BuzzFeed/status/1113564849357742080,0,,chicago,,,,,,[],,,,
1113566761125855238,1113566761125855238,2019-04-03 17:19:39 CDT,2019-04-03,17:19:39,-0500,1098786015161012229,autumnoakqueen,Natalie Alicia Norment🌻🔮🌌🎍,,Pumpkinhead is dead. You're granted three wishes.  What do you wish for?,en,[],[],[],0,1,1,[],[],https://twitter.com/AutumnOakQueen/status/1113566761125855238,False,,0,,chicago,,,,,,[],,,,
