id,conversation_id,created_at,date,time,timezone,user_id,username,name,place,tweet,language,mentions,urls,photos,replies_count,retweets_count,likes_count,hashtags,cashtags,link,retweet,quote_url,video,thumbnail,near,geo,source,user_rt_id,user_rt,retweet_id,reply_to,retweet_date,translate,trans_src,trans_dest
1291758625652985856,1291755411473944583,2020-08-07 10:30:30 CDT,2020-08-07,10:30:30,-0500,289322631,ianadastra,Ian,,@GeorgeTakei How can one hurt omnipotence? Introducing religion replaces serious conversation with absurdity.,en,[],[],[],0,0,0,[],[],https://twitter.com/IanAdAstra/status/1291758625652985856,False,,0,,philadelphia,,,,,,"[{'screen_name': 'GeorgeTakei', 'name': 'George Takei', 'id': '237845487'}]",,,,
1291758256382185476,1291758256382185476,2020-08-07 10:29:02 CDT,2020-08-07,10:29:02,-0500,951476895769612288,phlveterans,City of Philadelphia Office of Veterans Affairs,,"August 7th is #NationalPurpleHeartDay. We honor  service members who’ve been killed, wounded in action against an enemy, or been mistreated as POWs with America’s oldest military decoration.  #PHLVeterans #Philadelphia #Philly #Veterans #military #PurpleHeart  https://t.co/5Ba7VhjgVg",en,[],[],['https://pbs.twimg.com/media/Ee0_SR1XkAACfj1.jpg'],1,7,11,"['nationalpurpleheartday', 'phlveterans', 'philadelphia', 'philly', 'veterans', 'military', 'purpleheart']",[],https://twitter.com/PHLVeterans/status/1291758256382185476,False,,1,https://pbs.twimg.com/media/Ee0_SR1XkAACfj1.jpg,philadelphia,,,,,,[],,,,
1291754424227028996,1291754424227028996,2020-08-07 10:13:49 CDT,2020-08-07,10:13:49,-0500,799348782093701120,reprabb,Rep. Chris Rabb,,"As a descendant of such traitors via #slavery &amp; #rape, I strongly believe these relics honor their treasonous actions against our nation. That said, we must not be complicit by accepting the lie that #whitesupremacy was invented by the #Confederacy, nor was crushed in its defeat.",en,[],[],[],0,3,10,"['slavery', 'rape', 'whitesupremacy', 'confederacy']",[],https://twitter.com/RepRabb/status/1291754424227028996,False,https://twitter.com/WomensLawProj/status/1291737675905589250,0,,philadelphia,,,,,,[],,,,
1291754222749470726,1291754222749470726,2020-08-07 10:13:00 CDT,2020-08-07,10:13:00,-0500,2546308076,evvey__,5600,,Being dead broke will make your hustle different. Only way is up,en,[],[],[],0,1,2,[],[],https://twitter.com/evvey__/status/1291754222749470726,False,,0,,philadelphia,,,,,,[],,,,
1291753737497845760,1291753737497845760,2020-08-07 10:11:05 CDT,2020-08-07,10:11:05,-0500,2546308076,evvey__,5600,,Back on my bully,en,[],[],[],0,0,1,[],[],https://twitter.com/evvey__/status/1291753737497845760,False,,0,,philadelphia,,,,,,[],,,,
1291752717292118016,1291735389275914240,2020-08-07 10:07:02 CDT,2020-08-07,10:07:02,-0500,146285303,modymalay,Malay Mody,,@EUpchurchPhoto @GABlueBean She lost her right to be called that when she didn't find it important to follow up on domestic abuse.,en,[],[],[],0,0,2,[],[],https://twitter.com/modymalay/status/1291752717292118016,False,,0,,philadelphia,,,,,,"[{'screen_name': 'GABlueBean', 'name': 'Bielemabro', 'id': '1304442961283907586'}]",,,,
1291752044248862720,1291686307899625472,2020-08-07 10:04:21 CDT,2020-08-07,10:04:21,-0500,55457772,frankplunkett,Frank Plunkett,,@RayClothier56 @Rena_XZ @TheScottCharles brain dying a slow death.....NOT,en,[],[],[],0,0,0,[],[],https://twitter.com/frankplunkett/status/1291752044248862720,False,,0,,philadelphia,,,,,,"[{'screen_name': 'RayClothier56', 'name': 'Ray Clothier', 'id': '755740221350830084'}, {'screen_name': 'Rena_XZ', 'name': 'Rena XZ', 'id': '824978596175413249'}, {'screen_name': 'TheScottCharles', 'name': 'Scott Charles', 'id': '1731223328'}]",,,,
1291747715303563266,1291747715303563266,2020-08-07 09:47:09 CDT,2020-08-07,09:47:09,-0500,3229619206,shortman213170,Paul Smith,,"Trump claimed Biden will ""hurt the Bible"" and ""hurt God.""  https://t.co/cKsvM5fMXN via @HuffPostPol Donnie Shitbag Trump denounced Biden a lifelong Catholic, when he had his retarded photo OP he held the bible upside down and backwards. Quote a verse from the bible donnie dump!!!!",en,"[{'screen_name': 'huffpostpol', 'name': 'huffpost politics', 'id': '15458694'}]",['https://www.huffpost.com/entry/trump-biden-religion-attack_n_5f2ce19bc5b6b9cff7ef8f09'],[],0,0,0,[],[],https://twitter.com/Shortman213170/status/1291747715303563266,False,,0,,philadelphia,,,,,,[],,,,
1291747096614391809,1291735991565406208,2020-08-07 09:44:41 CDT,2020-08-07,09:44:41,-0500,801992900703907840,gwboudreau,Dr. George W. Boudreau,,"@PressSec @WhiteHouse @realDonaldTrump 160,000 Americans are dead!!!",en,[],[],[],0,0,1,[],[],https://twitter.com/gwboudreau/status/1291747096614391809,False,,0,,philadelphia,,,,,,"[{'screen_name': 'PressSec', 'name': 'Jen Psaki', 'id': '1349170292564905988'}, {'screen_name': 'WhiteHouse', 'name': 'The White House', 'id': '1323730225067339784'}, {'screen_name': 'realDonaldTrump', 'name': 'Donald J. Trump', 'id': '25073877'}]",,,,
1291739403212271616,1291739403212271616,2020-08-07 09:14:07 CDT,2020-08-07,09:14:07,-0500,128313714,broadstbull,Sam Carchidi,,TB coach Jon Cooper gives lots of praise to #Flyers. Says they no longer get rattled and are a a much more mature team and an Eastern Conference force.,en,[],[],[],1,9,182,['flyers'],[],https://twitter.com/BroadStBull/status/1291739403212271616,False,,0,,philadelphia,,,,,,[],,,,
1291738531556134913,1291738531556134913,2020-08-07 09:10:39 CDT,2020-08-07,09:10:39,-0500,1101270461986496512,nwjs_jobs,Nationwide Job Search,"{'type': 'Point', 'coordinates': [39.983187, -75.412719]}","Want to work in Newtown Square, PA? Our latest opening.  https://t.co/hb2eL4pXJV. Life Force Elderly Svcs Inc.",en,[],['https://apli.us/q4x'],[],0,0,0,[],[],https://twitter.com/NWJS_jobs/status/1291738531556134913,False,,0,,philadelphia,,,,,,[],,,,
1291734500389650432,1291734500389650432,2020-08-07 08:54:38 CDT,2020-08-07,08:54:38,-0500,2531590110,ezaketz,Big Pizza 🍕,,"Thinking about becoming a knife guy, so I can say “you made the first cut in this line, but I’m about to make the deepest one” and flash my blade anytime someone budges me in the self-checkout lanes. Playtime is over.",en,[],[],[],0,0,0,[],[],https://twitter.com/EZaketz/status/1291734500389650432,False,,0,,philadelphia,,,,,,[],,,,
1291732334643949570,1291732334643949570,2020-08-07 08:46:02 CDT,2020-08-07,08:46:02,-0500,365651280,raine41879,raine,,"@PhillyMayor @PhilaStreets  My recycling been out for 4 weeks, along with everyone else the neighborhoods look like shit !  Jimmy when you going to give the street department a kick in the ass and pick up recycling? I see center city is clean .",en,"[{'screen_name': 'philastreets', 'name': 'philastreets', 'id': '117424097'}]",[],[],0,0,0,[],[],https://twitter.com/Raine41879/status/1291732334643949570,False,,0,,philadelphia,,,,,,[],,,,
1291731011420684290,1291425130669903873,2020-08-07 08:40:46 CDT,2020-08-07,08:40:46,-0500,226405344,robmwhitney,BobbyDubs🏈🏀⚾️🏒⚽️🥍💥,,@LadyDianna1228 @EstreyaSery @moneyymaya @Patreon @LadyDianna1228 I completely agree with you. She was dead wrong and insulted more black women than helped them. She shouldn’t be harassed or threatened but she  deserved to be called out. This sets a dangerous precedent that if someone calls you on BS you can silence them.,en,[],[],[],1,0,2,[],[],https://twitter.com/RobMWhitney/status/1291731011420684290,False,,0,,philadelphia,,,,,,"[{'screen_name': 'LadyDianna1228', 'name': 'Dianna', 'id': '1204604900547665921'}, {'screen_name': 'moneyymaya', 'name': 'Maya Angelique👑', 'id': '1146069338472034306'}, {'screen_name': 'Patreon', 'name': 'Patreon', 'id': '1228325660'}]",,,,
1291730098647900167,1291730098647900167,2020-08-07 08:37:09 CDT,2020-08-07,08:37:09,-0500,602300293,treythetrigga,Trigga,,you act like any rapper has done punch lines better than lil wayne,en,[],[],[],0,0,1,[],[],https://twitter.com/TreyTheTrigga/status/1291730098647900167,False,,0,,philadelphia,,,,,,[],,,,
1291729300606115841,1291726396830687232,2020-08-07 08:33:59 CDT,2020-08-07,08:33:59,-0500,2473424772,this_isadonis,Rest Easy Ham 💔,,@MrsPerez__ Bitchhhhhhh I’m dead,en,[],[],[],0,0,0,[],[],https://twitter.com/This_IsAdonis/status/1291729300606115841,False,,0,,philadelphia,,,,,,"[{'screen_name': 'MrsPerez__', 'name': 'Angelica Renee', 'id': '1094802033587245057'}]",,,,
1291729068573052928,1291729068573052928,2020-08-07 08:33:03 CDT,2020-08-07,08:33:03,-0500,960339009179353090,karencuthberts7,Karen Cuthbertson,,"There is nothing that he won't do to win just look at the numbers  160,000 dead Americans",en,[],[],[],0,0,0,[],[],https://twitter.com/KarenCuthberts7/status/1291729068573052928,False,https://twitter.com/JoyVBehar/status/1291496014591987714,0,,philadelphia,,,,,,[],,,,
1291728463439826947,1291728463439826947,2020-08-07 08:30:39 CDT,2020-08-07,08:30:39,-0500,2686756423,gabbyydicapua,gab🦇,,What I would do to kick someone in the face to @VarialsPA right now🎟,en,"[{'screen_name': 'varialspa', 'name': 'varials', 'id': '2382797011'}]",[],[],0,0,0,[],[],https://twitter.com/gabbyydicapua/status/1291728463439826947,False,,0,,philadelphia,,,,,,[],,,,
1291726279666958336,1291726279666958336,2020-08-07 08:21:58 CDT,2020-08-07,08:21:58,-0500,13251042,mathewpassy,🎙 Mathew Passy 🎙,,We have very aggressive expansion plans in the works.  #podcasting  https://t.co/dN24oxibYx,en,[],[],"['https://pbs.twimg.com/media/Ee0iNDZXoAAchua.jpg', 'https://pbs.twimg.com/media/Ee0iNDgXsAAeqvc.jpg']",2,0,31,['podcasting'],[],https://twitter.com/MathewPassy/status/1291726279666958336,False,,1,https://pbs.twimg.com/media/Ee0iNDZXoAAchua.jpg,philadelphia,,,,,,[],,,,
1291724032019243008,1291724032019243008,2020-08-07 08:13:02 CDT,2020-08-07,08:13:02,-0500,755740221350830084,rayclothier56,Ray Clothier,,"“I am become Death, the destroyer of worlds."" ~ Lord Krishna (Bhagavad Gita)",en,[],[],[],0,0,0,[],[],https://twitter.com/RayClothier56/status/1291724032019243008,False,,0,,philadelphia,,,,,,[],,,,
1291723968693579778,1291723968693579778,2020-08-07 08:12:47 CDT,2020-08-07,08:12:47,-0500,2484078988,keyz2dacity89,Keyz /Birdman 🕊🕊🕊🕊🕊,,I’m bout to start making my own sneakers .. this shit really ridiculous how you gotta pay double or triple everytime you want to grab a regular kick,en,[],[],[],0,0,0,[],[],https://twitter.com/keyz2dacity89/status/1291723968693579778,False,,0,,philadelphia,,,,,,[],,,,
1291723699742281731,1291723699742281731,2020-08-07 08:11:43 CDT,2020-08-07,08:11:43,-0500,394906732,meads_22,P.I.P WAYNE BOZ DOO,,"If it’s by force, it was neva a choice....",en,[],[],[],0,1,0,[],[],https://twitter.com/Meads_22/status/1291723699742281731,False,,0,,philadelphia,,,,,,[],,,,
1291719699940679680,1291719699940679680,2020-08-07 07:55:50 CDT,2020-08-07,07:55:50,-0500,1161754573465444353,chef_bully,Real Estate Bully 👨🏾‍🍳🦍,,People with safety nets move so much different.,en,[],[],[],0,0,0,[],[],https://twitter.com/Chef_Bully/status/1291719699940679680,False,,0,,philadelphia,,,,,,[],,,,
1291718158399741952,1291718158399741952,2020-08-07 07:49:42 CDT,2020-08-07,07:49:42,-0500,747602760,tammydavisphoto,Tammy Davis Photos,"{'type': 'Point', 'coordinates': [39.8664, -75.0947]}","Just being silly and showing off my bad ass shirt from neko_prints, repping my favorite brand, sipping on some RACKED, and getting ready to kick some wavemaster cardio bag ass!  Cause that how I choose to start my…  https://t.co/tCjk1IfcsA",en,[],['https://www.instagram.com/p/CDlqoHlJFZ5/?igshid=1bahqd2ymgtja'],[],0,0,0,[],[],https://twitter.com/TammyDavisPhoto/status/1291718158399741952,False,,0,,philadelphia,,,,,,[],,,,
1291717576716881920,1291717576716881920,2020-08-07 07:47:23 CDT,2020-08-07,07:47:23,-0500,1161754573465444353,chef_bully,Real Estate Bully 👨🏾‍🍳🦍,,At 14 I was going to work all summer. That made me different from all the other 14 year olds that was still going to camp at that age.,en,[],[],[],0,0,0,[],[],https://twitter.com/Chef_Bully/status/1291717576716881920,False,,0,,philadelphia,,,,,,[],,,,
1291706242868551681,1291706242868551681,2020-08-07 07:02:21 CDT,2020-08-07,07:02:21,-0500,2770008725,miyamontanaa_,I’M DIFFERENT‼️,,The system shut down at my job so I’ll just kick back until further notice 🙂,en,[],[],[],0,0,0,[],[],https://twitter.com/MiyaMontanaa_/status/1291706242868551681,False,,0,,philadelphia,,,,,,[],,,,
1291699755492540417,1291459285982093323,2020-08-07 06:36:34 CDT,2020-08-07,06:36:34,-0500,885509310595424256,allure_king,Allure King 🌱,,@joelockhart Imagine serving a God that could get hurt,en,[],[],[],0,0,0,[],[],https://twitter.com/allure_king/status/1291699755492540417,False,,0,,philadelphia,,,,,,"[{'screen_name': 'joelockhart', 'name': 'Joe Lockhart', 'id': '101816065'}]",,,,
1291698864760721408,1291698864760721408,2020-08-07 06:33:02 CDT,2020-08-07,06:33:02,-0500,1355504828,diddyradwv,Diddy,,Uhm hello 911? There's men talking loudly in my vicinity before 8am and I'm going to stab,en,[],[],[],0,0,7,[],[],https://twitter.com/DiddyRadWV/status/1291698864760721408,False,,0,,philadelphia,,,,,,[],,,,
1291696133346131968,1291403059046879232,2020-08-07 06:22:11 CDT,2020-08-07,06:22:11,-0500,801992900703907840,gwboudreau,Dr. George W. Boudreau,,"@Mike_Pence 160,000 Americans are dead of covid. Mike Pence is responsible.",en,[],[],[],0,0,0,[],[],https://twitter.com/gwboudreau/status/1291696133346131968,False,,0,,philadelphia,,,,,,"[{'screen_name': 'Mike_Pence', 'name': 'Mike Pence', 'id': '22203756'}]",,,,
1291694637325918209,1291694637325918209,2020-08-07 06:16:14 CDT,2020-08-07,06:16:14,-0500,220541704,xkraynec,Hot Koko 🍫,,can’t hurt my feelings but I like pain 😛,en,[],[],[],0,0,0,[],[],https://twitter.com/xKRAYneC/status/1291694637325918209,False,,0,,philadelphia,,,,,,[],,,,
1291694337198350339,1291694337198350339,2020-08-07 06:15:03 CDT,2020-08-07,06:15:03,-0500,727665066108194817,sharons33356941,Sharon Scott,,@MarkMeadows hey mark STOP BLAMING. DEMOCRATS FOR YOUR STUPIDITY AND REPUBLICAN PARTY STUPIDITY ITS GOING TOO HURT YOUR PARTY ..THERE BEEN A BILL ON THE TABLE SINCE APRIL AND YOU  KNOW IT,en,[],[],[],0,0,0,[],[],https://twitter.com/SharonS33356941/status/1291694337198350339,False,,0,,philadelphia,,,,,,[],,,,
1291687535308156928,1291642454727303168,2020-08-07 05:48:01 CDT,2020-08-07,05:48:01,-0500,1332021805,twalshtim,There R sum who call me TIM,,"@ChivalrousBlob1 @BrandonStraka It was the right apartment, boyfriend in bed next to her started shooting, officers responded in the same fashion, she ended up being a victim, bullets aren’t racist. No knock warrants could end up like this every time.",en,[],[],[],0,0,0,[],[],https://twitter.com/TwalshTim/status/1291687535308156928,False,,0,,philadelphia,,,,,,"[{'screen_name': 'ChivalrousBlob1', 'name': 'Chivalrous_Blobfish', 'id': '1276348024248123393'}, {'screen_name': 'BrandonStraka', 'name': 'Brandon Straka', 'id': '52338305'}]",,,,
1291687301710581765,1291687301710581765,2020-08-07 05:47:05 CDT,2020-08-07,05:47:05,-0500,66581488,tebowrozay,Anthony DeFelice,, https://t.co/EffTBWsvEK  New vid with riot shield,en,[],['https://youtu.be/_KR6JI16_2I'],[],0,0,0,[],[],https://twitter.com/tebowrozay/status/1291687301710581765,False,,0,,philadelphia,,,,,,[],,,,
1291686975909629952,1291686975909629952,2020-08-07 05:45:48 CDT,2020-08-07,05:45:48,-0500,295252093,c8miskell,c8,,ok well i’m dead sure that lola isn’t feeling love when she hears my voice lmao,en,[],[],[],0,0,0,[],[],https://twitter.com/c8miskell/status/1291686975909629952,False,https://twitter.com/UberFacts/status/1291538801697984512,0,,philadelphia,,,,,,[],,,,
1291684196730142722,1291684196730142722,2020-08-07 05:34:45 CDT,2020-08-07,05:34:45,-0500,1161754573465444353,chef_bully,Real Estate Bully 👨🏾‍🍳🦍,,Leaving the house without your mask &lt; Leaving your AirPods when you go work out,en,[],[],[],0,0,0,[],[],https://twitter.com/Chef_Bully/status/1291684196730142722,False,,0,,philadelphia,,,,,,[],,,,
1291683931033657344,1291664624035692544,2020-08-07 05:33:42 CDT,2020-08-07,05:33:42,-0500,1161754573465444353,chef_bully,Real Estate Bully 👨🏾‍🍳🦍,,@Newt_da_nupe Good luck 😂,en,[],[],[],1,0,0,[],[],https://twitter.com/Chef_Bully/status/1291683931033657344,False,,0,,philadelphia,,,,,,"[{'screen_name': 'Newt_da_nupe', 'name': 'Yoooo Newt👌🏿', 'id': '29144157'}]",,,,
1291683759364898818,1291683759364898818,2020-08-07 05:33:01 CDT,2020-08-07,05:33:01,-0500,1161754573465444353,chef_bully,Real Estate Bully 👨🏾‍🍳🦍,,"Most people fail not because the lack of Desire, But because of the lack of commitment &amp; discipline they have.",en,[],[],[],0,0,1,[],[],https://twitter.com/Chef_Bully/status/1291683759364898818,False,,0,,philadelphia,,,,,,[],,,,
1291677806976544770,1291576308456194049,2020-08-07 05:09:22 CDT,2020-08-07,05:09:22,-0500,254318813,xine08003,Hopeful- NJ Vegan,,"@MollyJongFast Surely there are more important things to defend Trump for.  I dont know, hmmm, lemme see...  Oh maybe that there are almost 160,000 Americans dead while he continues to spew disinformation, while politicizing mask wearing that can slow the disease down. Let's start there Danesh.",en,[],[],[],0,0,1,[],[],https://twitter.com/xine08003/status/1291677806976544770,False,,0,,philadelphia,,,,,,"[{'screen_name': 'MollyJongFast', 'name': 'Molly Jong-Fast', 'id': '14298769'}]",,,,
1291667330313981957,1291667330313981957,2020-08-07 04:27:44 CDT,2020-08-07,04:27:44,-0500,777665618740936705,ristagno_dman,Damian Ristagno🎶🇺🇸⚡🇺🇸🎵🌹🎶💀🎵🌍🌏🌎🏄‍♂🎶💚,,Joe Biden please don't hurt God,en,[],[],[],1,0,0,[],[],https://twitter.com/Ristagno_DMan/status/1291667330313981957,False,,0,,philadelphia,,,,,,[],,,,
1291665438099873792,1291665438099873792,2020-08-07 04:20:13 CDT,2020-08-07,04:20:13,-0500,1274328104513744897,robertgbrown13,"Hells Blameless and Ritz Cross, Ambitious Sick",,Don't hurt God's kingdom. God dont hurt God's kingdom.  #thankyouholyspirit #kids,en,[],[],[],0,0,0,"['thankyouholyspirit', 'kids']",[],https://twitter.com/RobertGBrown13/status/1291665438099873792,False,,0,,philadelphia,,,,,,[],,,,
1291646859455463426,1291573591671267329,2020-08-07 03:06:23 CDT,2020-08-07,03:06:23,-0500,707412980397424642,downwithduopoly,The Russian bot your libs warned you about,,@mynameispez I’m in a privileged position where I worked major overtime so my unemployment checks are livable. I’m just mainly getting stir-crazy since I usually travel 2-3 times a year. Also Philadelphia doesn’t force me to look for a job so I can be picky about my applications.,en,[],[],[],1,0,0,[],[],https://twitter.com/DownWithDuopoly/status/1291646859455463426,False,,0,,philadelphia,,,,,,"[{'screen_name': 'mynameispez', 'name': 'Your Mom', 'id': '2760820037'}]",,,,
1291639432768942082,1291637250388893696,2020-08-07 02:36:52 CDT,2020-08-07,02:36:52,-0500,266324583,juju_themaestro,"Ovaltine Papi, Big Body",,"@PerfectLegend Mobile and desktop? For desktop I disabled general hardware accel in site settings for Chrome and that somehow fixed it.   For mobile, I've just had to force close and re-open smh.",en,[],[],[],1,0,1,[],[],https://twitter.com/Juju_TheMaestro/status/1291639432768942082,False,,0,,philadelphia,,,,,,"[{'screen_name': 'PerfectLegend', 'name': 'Perfect Legend', 'id': '14233123'}]",,,,
1291631524924841985,1291628178256125952,2020-08-07 02:05:27 CDT,2020-08-07,02:05:27,-0500,266324583,juju_themaestro,"Ovaltine Papi, Big Body",,@SadizticKitten @WheelsFGC @LuminescentRuby Pls do not bully the mint chip,en,[],[],[],2,0,0,[],[],https://twitter.com/Juju_TheMaestro/status/1291631524924841985,False,,0,,philadelphia,,,,,,"[{'screen_name': 'SadizticKitten', 'name': ""🄰🄿🅁🄸🄻 🄾'🄽🄴🄸🄻 🏳️\u200d⚧"", 'id': '469975742'}, {'screen_name': 'WheelsFGC', 'name': 'Dayton (Wheels)', 'id': '335073412'}]",,,,
1291614135130742784,1291614135130742784,2020-08-07 00:56:21 CDT,2020-08-07,00:56:21,-0500,1022215990552211456,gabbythebaddie_,G ❤️‍🔥,,Ik Kylie going through the tags real hurt 😭😭😭😭😭,en,[],[],[],0,0,0,[],[],https://twitter.com/GabbyTheBaddie_/status/1291614135130742784,False,,0,,philadelphia,,,,,,[],,,,
1291610956829728768,1291610956829728768,2020-08-07 00:43:43 CDT,2020-08-07,00:43:43,-0500,1285932675640041477,appareltditd,TDITD_APPAREL,,Stay away from people who act like a victim in a problem they created. “the difference is the difference”,en,[],[],[],0,0,0,[],[],https://twitter.com/ApparelTditd/status/1291610956829728768,False,,0,,philadelphia,,,,,,[],,,,
1291606457939628035,1291199220343549953,2020-08-07 00:25:51 CDT,2020-08-07,00:25:51,-0500,1268644587498864641,jacovinimartin,Martin Jacovini,,"@NatalCicuto @NPR No offense but, whatever.",en,[],[],[],0,0,0,[],[],https://twitter.com/JacoviniMartin/status/1291606457939628035,False,,0,,philadelphia,,,,,,"[{'screen_name': 'NatalCicuto', 'name': 'Nat🇨🇦', 'id': '616697216'}, {'screen_name': 'NPR', 'name': 'NPR', 'id': '5392522'}]",,,,
1291603614142738432,1291603614142738432,2020-08-07 00:14:33 CDT,2020-08-07,00:14:33,-0500,212259609,sangiminaj,SANGI💎,,That bitch really got on Beyoncé’s Instagram app and called somebody’s dead baby a monkey and y’all still support her? Chilleeee ok🥴,en,[],[],[],0,0,2,[],[],https://twitter.com/SANGIMINAJ/status/1291603614142738432,False,,0,,philadelphia,,,,,,[],,,,
1291595686480404482,1291594508954669056,2020-08-06 23:43:03 CDT,2020-08-06,23:43:03,-0500,1146464935410589697,iamtaylorjanee,the girls that get it get it,,@ItsJustJordan_1 tryna get me caught up🤬and get my feelings hurt😔,en,[],[],[],1,0,6,[],[],https://twitter.com/iamtaylorjanee/status/1291595686480404482,False,,0,,philadelphia,,,,,,"[{'screen_name': 'ItsJustJordan_1', 'name': 'Gimme Ya Phone💭', 'id': '86484603'}]",,,,
