id,conversation_id,created_at,date,time,timezone,user_id,username,name,place,tweet,language,mentions,urls,photos,replies_count,retweets_count,likes_count,hashtags,cashtags,link,retweet,quote_url,video,thumbnail,near,geo,source,user_rt_id,user_rt,retweet_id,reply_to,retweet_date,translate,trans_src,trans_dest
1273041571949182976,1273041571949182976,2020-06-16 18:55:37 CDT,2020-06-16,18:55:37,-0500,233755534,mikeboard1200,Michael Board,,The rise from 33 on vents to 41 is something that needs to be watched closely.  Even one more death in SA that could have been prevented by wearing a mask or not going out to eat is too many.,en,[],[],[],2,2,7,[],[],https://twitter.com/MikeBoard1200/status/1273041571949182976,False,https://twitter.com/lauraelizabethm/status/1273038331274825735,0,,san antonio,,,,,,[],,,,
1273041213386641414,1273041213386641414,2020-06-16 18:54:11 CDT,2020-06-16,18:54:11,-0500,856931419804794880,claudiadmendoz1,Claudia D,,White privilege at its finest. Someone please remind me as to why #RashardBrooks deserved a death sentence? #BLM,en,[],[],[],0,0,1,"['rashardbrooks', 'blm']",[],https://twitter.com/ClaudiaDMendoz1/status/1273041213386641414,False,https://twitter.com/LoupeDaDon/status/1272892714254770179,0,,san antonio,,,,,,[],,,,
1273040706160951297,1273040706160951297,2020-06-16 18:52:10 CDT,2020-06-16,18:52:10,-0500,3284743909,babyboymino,Mino 𖤐,,you make my stomach hurt. no more butterflies. 🤨,en,[],[],[],0,1,2,[],[],https://twitter.com/babyboymino/status/1273040706160951297,False,,0,,san antonio,,,,,,[],,,,
1273018929762447372,1273018929762447372,2020-06-16 17:25:39 CDT,2020-06-16,17:25:39,-0500,2604102583,_yourfavearies,jenny ✨,,I think the worst about opening up to someone is when they use it to hurt you.,en,[],[],[],0,0,1,[],[],https://twitter.com/_yourfavearies/status/1273018929762447372,False,,0,,san antonio,,,,,,[],,,,
1273017625380114439,1273017623199055876,2020-06-16 17:20:28 CDT,2020-06-16,17:20:28,-0500,25162417,thatbravesgirl,Commish Cassie,,They are peaceful in the sense that no one is attacking or harming anyone. They need to be disruptive. That’s the whole point. To force people attention to the issues they’re advocating for. Anyway I said all that to say s/o to the ones that shut the connector down a few days ago,en,[],[],[],1,0,3,[],[],https://twitter.com/ThatBravesGirl/status/1273017625380114439,False,,0,,san antonio,,,,,,[],,,,
1273013634969542656,1273013634969542656,2020-06-16 17:04:36 CDT,2020-06-16,17:04:36,-0500,1627163923,sbranham42,sarah elisabeth,,Y’all ever hear something that you expected but then it hurt worse because you hoped you’d be wrong?,en,[],[],[],1,0,3,[],[],https://twitter.com/sbranham42/status/1273013634969542656,False,,0,,san antonio,,,,,,[],,,,
1273012350531010565,1272962832548671490,2020-06-16 16:59:30 CDT,2020-06-16,16:59:30,-0500,482531559,emmdenise_,♕ εмм,,@IceKing_21 I’m fucking dead 😂,en,[],[],[],0,0,0,[],[],https://twitter.com/emmdenise_/status/1273012350531010565,False,,0,,san antonio,,,,,,[],,,,
1273011298603802628,1272957503484166144,2020-06-16 16:55:19 CDT,2020-06-16,16:55:19,-0500,37783101,robertmenn,Robert Menn,,"@leothelionluna @SheaSerrano All your points are not tangible, that’s the problem. There are hard numbers to look at. Number of encounters and encounters ending in death. Hard numbers not “IF” numbers. That’s the point. Easy math. You can argue variables if you want but then it becomes much more complicated.",en,[],[],[],1,0,0,[],[],https://twitter.com/RobertMenn/status/1273011298603802628,False,,0,,san antonio,,,,,,"[{'screen_name': 'leothelionluna', 'name': 'Leo Luna', 'id': '3193200113'}, {'screen_name': 'SheaSerrano', 'name': 'Shea Serrano', 'id': '57162282'}]",,,,
1273010572754288642,1273010572754288642,2020-06-16 16:52:26 CDT,2020-06-16,16:52:26,-0500,37684258,markous02,markous,,i saw a video of some dispicable men throw a woman in a dumpster. they then proceeded to taunt &amp; bully her. viewing her face during the ordeal was heartbreaking. someone in that neighborhood need to hold them accountable! i wish i could offer assistance to this girl.,en,[],[],[],1,0,0,[],[],https://twitter.com/markous02/status/1273010572754288642,False,,0,,san antonio,,,,,,[],,,,
1273010333649711104,1273010333649711104,2020-06-16 16:51:29 CDT,2020-06-16,16:51:29,-0500,1175985921738641408,rocksasher,Carrie.asher.rocks,,Your girl got added to a new #Spotify playlist!! Go #support all these #artists &amp; give it a listen-I'll love you forever❤ #singer #songwriter #alternative #indie #aggressive #acoustic #folk #punk #rock #antifolk #music #IndependentMusic #indiemusic #originalmusic #dreamy #vibes,en,[],[],[],0,1,2,"['spotify', 'support', 'artists', 'singer', 'songwriter', 'alternative', 'indie', 'aggressive', 'acoustic', 'folk', 'punk', 'rock', 'antifolk', 'music', 'independentmusic', 'indiemusic', 'originalmusic', 'dreamy', 'vibes']",[],https://twitter.com/RocksAsher/status/1273010333649711104,False,https://twitter.com/TheWhatBandRock/status/1272984933942857729,0,,san antonio,,,,,,[],,,,
1273002258188455936,1272902606449451008,2020-06-16 16:19:24 CDT,2020-06-16,16:19:24,-0500,3017585076,lizarrdqueen,✨Im sorry Rum Ham!✨,,@c00lnat Did the test hurt 😬,en,[],[],[],1,0,0,[],[],https://twitter.com/lizarrdqueen/status/1273002258188455936,False,,0,,san antonio,,,,,,[],,,,
1273001574583894016,1273001574583894016,2020-06-16 16:16:41 CDT,2020-06-16,16:16:41,-0500,2990326189,dt99g,🌼Deets🌼,,"Brain dead. Opens everything up too early, removes county and met govt ability to enforce locally. Then blames everyone else for his dangerous leadership. Its time to go Abbott. You've had plenty time to show us how ineffectual a leader you are.",en,[],[],[],1,0,3,[],[],https://twitter.com/DT99G/status/1273001574583894016,False,https://twitter.com/TexasTribune/status/1272981311502929925,0,,san antonio,,,,,,[],,,,
1272997399833829379,1272997399833829379,2020-06-16 16:00:05 CDT,2020-06-16,16:00:05,-0500,417557176,rumhamqueen,Rum Ham,,Annnnnnddddd Riot Fest will be next year! Guess im holding onto my tickets for next year 🙃,en,[],[],[],0,0,1,[],[],https://twitter.com/RumHamQueen/status/1272997399833829379,False,,0,,san antonio,,,,,,[],,,,
1272992652951248898,1272992652951248898,2020-06-16 15:41:14 CDT,2020-06-16,15:41:14,-0500,1215086748457406464,rosieb821,Rosie_b_82,,Happy Birthday to the man that taught me how to throw a punch &amp; how to take one...lol! I love you bro! I am truly blessed &amp; honored to be your little sister!  https://t.co/gBsZNGUoF5,en,[],[],['https://pbs.twimg.com/media/EaqUEY8WoAcCLNt.jpg'],0,0,1,[],[],https://twitter.com/Rosieb821/status/1272992652951248898,False,,1,https://pbs.twimg.com/media/EaqUEY8WoAcCLNt.jpg,san antonio,,,,,,[],,,,
1272983013878648833,1272983013878648833,2020-06-16 15:02:56 CDT,2020-06-16,15:02:56,-0500,3142205150,kalebthewonder,kaleb,,"I love Nicki Minaj to death, but all y’all motherfuckers STANNINGA trollz are fucking disgusting. 6ix9ine is a registered PEDOFILE. How can y’all support that? Every time you buy or stream his music, you add to his ego, power, and wallet. Stupid ass barbz 🥴🥴🥴",en,[],[],[],0,0,4,[],[],https://twitter.com/KalebtheWonder/status/1272983013878648833,False,,0,,san antonio,,,,,,[],,,,
1272981412640161796,1272981412640161796,2020-06-16 14:56:34 CDT,2020-06-16,14:56:34,-0500,38101961,hearts_keeper_,Jaws Elyn,,"The hardest part of being by myself Is never knowing how I'll spend my nights And now I've hurt, I am hurt It's painful to keep on pushing through",en,[],[],[],0,1,2,[],[],https://twitter.com/Hearts_Keeper_/status/1272981412640161796,False,,0,,san antonio,,,,,,[],,,,
1272981021974290432,1272981021974290432,2020-06-16 14:55:01 CDT,2020-06-16,14:55:01,-0500,1261279240412110850,alberto48453306,Alberto Arellano,,Oh yeah hes dead with my mom right,en,[],[],[],0,0,0,[],[],https://twitter.com/Alberto48453306/status/1272981021974290432,False,,0,,san antonio,,,,,,[],,,,
1272979596007354369,1272979596007354369,2020-06-16 14:49:21 CDT,2020-06-16,14:49:21,-0500,843504096401412096,clb5_,C 💲,,"Bruh these hickeys hurt like hell, and ain’t no covering these hoes with makeup 😔",en,[],[],[],1,0,0,[],[],https://twitter.com/clb5_/status/1272979596007354369,False,,0,,san antonio,,,,,,[],,,,
1272979432748302337,1272958218013196289,2020-06-16 14:48:42 CDT,2020-06-16,14:48:42,-0500,42790269,texsandra210,Sandra 🇺🇸🇲🇽,,@therealpamack @El_Chingon70 @FOX4 @GregAbbott_TX Sweden is a horrible example of excess death due to poor/no response.   Taiwan is an example of how it should have been done.  https://t.co/ebN2tI4Id4  https://t.co/nsfSDHpFVI,en,[],['https://time.com/5851633/best-global-responses-covid-19/'],['https://pbs.twimg.com/media/EaqICBMWsAswquH.jpg'],0,0,1,[],[],https://twitter.com/TexSandra210/status/1272979432748302337,False,,1,https://pbs.twimg.com/media/EaqICBMWsAswquH.jpg,san antonio,,,,,,"[{'screen_name': 'therealpamack', 'name': 'Mack', 'id': '458755531'}, {'screen_name': 'El_Chingon70', 'name': 'El Chingon', 'id': '451844275'}, {'screen_name': 'FOX4', 'name': 'FOX 4 NEWS', 'id': '16656350'}, {'screen_name': 'GregAbbott_TX', 'name': 'Greg Abbott', 'id': '90651198'}]",,,,
1272977325005647881,1272977325005647881,2020-06-16 14:40:19 CDT,2020-06-16,14:40:19,-0500,412770924,boripool,Tori Pool,,One of my most proudest moments was when my son pulled out a plastic knife from the table when Chuck E Cheese tried to pull up on him.   He was six. ❤️🔪,en,[],[],[],0,0,5,[],[],https://twitter.com/boripool/status/1272977325005647881,False,,0,,san antonio,,,,,,[],,,,
1272976604604575747,1272976604604575747,2020-06-16 14:37:27 CDT,2020-06-16,14:37:27,-0500,2842382206,atweetbyej,EJ,,😔 doesn’t hurt to be too safe...,en,[],[],[],0,0,1,[],[],https://twitter.com/ATweetByEJ/status/1272976604604575747,False,https://twitter.com/AyoPrizzle/status/1272962047110774787,0,,san antonio,,,,,,[],,,,
1272973333496283138,1272973333496283138,2020-06-16 14:24:28 CDT,2020-06-16,14:24:28,-0500,104029464,justxavery,Avery K.C. 🇯🇲🇳🇬,,Mannn... Smh. Every single one of them boys dead as wrong for that &amp; need to be handled accordingly.,en,[],[],[],0,0,0,[],[],https://twitter.com/JustxAvery/status/1272973333496283138,False,https://twitter.com/confusedandokay/status/1272906182588588033,0,,san antonio,,,,,,[],,,,
1272971855272476672,1272971855272476672,2020-06-16 14:18:35 CDT,2020-06-16,14:18:35,-0500,1175985921738641408,rocksasher,Carrie.asher.rocks,,#HappyTuesday!!! A little tune to brighten your day @indieonair #tuesdayvibes #singersongwriter #alternative #indie #aggressive #acoustic #folk #punk #rock #antifolk #IndependentMusic #music #femaleartist #originalmusic #dreamy 'Finally'  https://t.co/twQf85IyVF,en,"[{'screen_name': 'indieonair', 'name': 'jeff popka', 'id': '23147579'}]",['https://youtu.be/mNuPp1Rs00s'],[],0,0,0,"['happytuesday', 'tuesdayvibes', 'singersongwriter', 'alternative', 'indie', 'aggressive', 'acoustic', 'folk', 'punk', 'rock', 'antifolk', 'independentmusic', 'music', 'femaleartist', 'originalmusic', 'dreamy']",[],https://twitter.com/RocksAsher/status/1272971855272476672,False,,0,,san antonio,,,,,,[],,,,
1272968129036115968,1272860605855260672,2020-06-16 14:03:47 CDT,2020-06-16,14:03:47,-0500,2839213583,hardly_quinn_,Hardly Quinn- NEW mememe REMIX OUT NOW!!!,,@dangerboylandon I have a plan. Okay so if we throw ragers for the next two weeks every night you wouldn’t even have to kick them out they might leave on their own.🤔🤭,en,[],[],[],1,0,2,[],[],https://twitter.com/Hardly_Quinn_/status/1272968129036115968,False,,0,,san antonio,,,,,,"[{'screen_name': 'dangerboylandon', 'name': 'bean 🔜 UBBI DUBBI', 'id': '193568892'}]",,,,
1272967115675447302,1272967115675447302,2020-06-16 13:59:45 CDT,2020-06-16,13:59:45,-0500,586473104,mmedinanews,Mariah Medina,,"BREAKING: Nearly three years after his death, arrests have been made in the shooting death of 4-year-old De’Earlvion Whitley.  https://t.co/d0R3vIlqNO",en,[],['https://www.kens5.com/mobile/article/news/local/east-side-vigils-remember-4-year-old-killed-in-drive-by-shooting/273-458732200'],[],1,2,5,[],[],https://twitter.com/MMedinanews/status/1272967115675447302,False,,0,,san antonio,,,,,,[],,,,
1272967099330310148,1272967099330310148,2020-06-16 13:59:41 CDT,2020-06-16,13:59:41,-0500,3386776813,xo_jewel_,jewels🍒,,"Work has me soooo drained that by the time I’m working out, I’m dead ASF from just my warm up 🤦🏻‍♀️",en,[],[],[],0,0,4,[],[],https://twitter.com/xo_jewel_/status/1272967099330310148,False,,0,,san antonio,,,,,,[],,,,
1272965024949174272,1272965024949174272,2020-06-16 13:51:27 CDT,2020-06-16,13:51:27,-0500,3528709395,jackthanites,JR,,I’m really not for a lot of ohhh we get what @Kaepernick7 was trying to say we finally get hell nall take your half woke mostly sleep asses back to the village because he was clear that it had nothing NOTHING TO DO WITH THE FLAG years ago death ears,en,"[{'screen_name': 'kaepernick7', 'name': 'colin kaepernick', 'id': '45055696'}]",[],[],0,0,0,[],[],https://twitter.com/jackthanites/status/1272965024949174272,False,,0,,san antonio,,,,,,[],,,,
1272957308394446848,1272957301704527874,2020-06-16 13:20:47 CDT,2020-06-16,13:20:47,-0500,936645535104151553,hope411adcock,Samantha,,"2)""Moments later, the ex-husband grabbed a handgun and shot the other man in the groin, police said. The victim ended up at a hospital. His condition was not available.""😳",en,[],[],[],0,0,1,[],[],https://twitter.com/hope411adcock/status/1272957308394446848,False,,0,,san antonio,,,,,,[],,,,
1272956629315727364,1272956629315727364,2020-06-16 13:18:05 CDT,2020-06-16,13:18:05,-0500,598669163,themobyh,Manzana 🇺🇦,"{'type': 'Point', 'coordinates': [29.4167, -98.5]}","Death Stranding IRL  #bikeSA @ San Antonio, Texas  https://t.co/wAUlekBwQt",en,[],['https://www.instagram.com/p/CBgXg75BDID/?igshid=1dn1rjsm66uyw'],[],0,0,0,['bikesa'],[],https://twitter.com/TheMobyh/status/1272956629315727364,False,,0,,san antonio,,,,,,[],,,,
1272950901079191554,1272950901079191554,2020-06-16 12:55:19 CDT,2020-06-16,12:55:19,-0500,995427698884390913,sebas_the_storm,Sebastian,,"Search your name + fantasy gown, crown and weapon   (I’m not mad)  https://t.co/SHJX8pKs3h",en,[],[],"['https://pbs.twimg.com/media/EapuGGwWsAM7Wbp.jpg', 'https://pbs.twimg.com/media/EapuGGxXQAIUApu.jpg', 'https://pbs.twimg.com/media/EapuGGyXsAEcZfU.jpg']",2,0,3,[],[],https://twitter.com/Sebas_the_storm/status/1272950901079191554,False,https://twitter.com/beverlylove/status/1272738654180397056,1,https://pbs.twimg.com/media/EapuGGwWsAM7Wbp.jpg,san antonio,,,,,,[],,,,
1272950668295385091,1272950668295385091,2020-06-16 12:54:24 CDT,2020-06-16,12:54:24,-0500,497569302,adrianagarcia5,ad,,It’s like nothing is going my way and I always get hurt. Lol,en,[],[],[],0,0,0,[],[],https://twitter.com/adrianagarcia5/status/1272950668295385091,False,,0,,san antonio,,,,,,[],,,,
1272942999392190464,1272925558863781890,2020-06-16 12:23:55 CDT,2020-06-16,12:23:55,-0500,25162417,thatbravesgirl,Commish Cassie,,"@VRKyle What do I know. If you’re feelings are that hurt track down the OP and take it up with them. Or better get, learn how to take a meme. Your online experience will be way more enjoyable that way 🤷‍♀️",en,[],[],[],1,0,0,[],[],https://twitter.com/ThatBravesGirl/status/1272942999392190464,False,,0,,san antonio,,,,,,"[{'screen_name': 'VRKyle', 'name': ""Louie's Dad"", 'id': '486638886'}]",,,,
1272940769549209604,1272940769549209604,2020-06-16 12:15:04 CDT,2020-06-16,12:15:04,-0500,2616516302,peepsalas,ali ♌️,,Anyone got a face I can punch? 😗,en,[],[],[],2,1,3,[],[],https://twitter.com/peepsalas/status/1272940769549209604,False,,0,,san antonio,,,,,,[],,,,
1272934538574999552,1272934538574999552,2020-06-16 11:50:18 CDT,2020-06-16,11:50:18,-0500,3145414992,xoaudgexo,A Superior Sigma Woman.,,My feelings are really hurt &amp; it’s crazy it be the closest people to you ..,en,[],[],[],0,0,0,[],[],https://twitter.com/xoaudgexo/status/1272934538574999552,False,,0,,san antonio,,,,,,[],,,,
1272933143549485058,1272933143549485058,2020-06-16 11:44:46 CDT,2020-06-16,11:44:46,-0500,330567507,sssaavy,sav,,LMFAOOO it’s the old ass near death folks that aren’t wearing masks in the stores but I digress,en,[],[],[],0,0,11,[],[],https://twitter.com/sssaavy/status/1272933143549485058,False,https://twitter.com/Newsweek/status/1272658400405487617,0,,san antonio,,,,,,[],,,,
1272931591053082624,1272931591053082624,2020-06-16 11:38:35 CDT,2020-06-16,11:38:35,-0500,33957518,lastnameisbravo,𓆸𝕄𝕚𝕤𝕤 𝔹𝕣𝕒𝕧𝕠,,"Embracing the ☀️ this year for sure, I actually wanna see how dark I get, it’s been decades since I’ve tried to get tanned, always been scared to death of skin cancer! I have to face my fears LOL",en,[],[],[],1,0,2,[],[],https://twitter.com/lastnameisbravo/status/1272931591053082624,False,,0,,san antonio,,,,,,[],,,,
1272930673339387908,1272930673339387908,2020-06-16 11:34:57 CDT,2020-06-16,11:34:57,-0500,926699264016830465,atonyg45,ᵉˡ ᵗᵒⁿʸ,,"Since the TL aggressive, I’m ready.   Don’t have beef with anybody, I just wanna argue 😔  https://t.co/AnjBWbJzaC",en,[],[],['https://pbs.twimg.com/media/EapbsdhXQAAwQxL.jpg'],0,2,5,[],[],https://twitter.com/atonyg45/status/1272930673339387908,False,,1,https://pbs.twimg.com/media/EapbsdhXQAAwQxL.jpg,san antonio,,,,,,[],,,,
1272928178324021249,1272928167825747968,2020-06-16 11:25:02 CDT,2020-06-16,11:25:02,-0500,936645535104151553,hope411adcock,Samantha,,"2) ""As Monterrosa knelt with his hands raised, an 18-year veteran of the Vallejo police force fired five shots through a police vehicle’s windshield. One of the bullets struck Monterrosa and killed him.""",en,[],[],[],0,0,0,[],[],https://twitter.com/hope411adcock/status/1272928178324021249,False,,0,,san antonio,,,,,,[],,,,
1272927228700110849,1272927228700110849,2020-06-16 11:21:15 CDT,2020-06-16,11:21:15,-0500,129016125,lovingforhoney,Ale ⋈ 🌻,,“And now all I’m left with is the memories of someone I never really knew and force to accept apologies” oof that hurt,en,[],[],[],0,0,1,[],[],https://twitter.com/lovingforhoney/status/1272927228700110849,False,,0,,san antonio,,,,,,[],,,,
1272918129816059910,1272918129816059910,2020-06-16 10:45:06 CDT,2020-06-16,10:45:06,-0500,36820385,jasmynmarie_,jas,,"My anxiety is out of the roof. I love being a nurse but being in healthcare during a pandemic is DRAINING. I work for a primary care clinic. It’s just my doctor and I. pts are scared, aggressive &amp; grumpy.   PLEASE DO YOUR PART AND STAY THE FC*K HOME &amp; STOP SAYING COVID IS FAKE.",en,[],[],[],0,0,12,[],[],https://twitter.com/jasmynmarie_/status/1272918129816059910,False,,0,,san antonio,,,,,,[],,,,
1272914108539682816,1272914108539682816,2020-06-16 10:29:07 CDT,2020-06-16,10:29:07,-0500,25162417,thatbravesgirl,Commish Cassie,,Why does this hurt so much!? 😭😭😭,en,[],[],[],2,0,4,[],[],https://twitter.com/ThatBravesGirl/status/1272914108539682816,False,https://twitter.com/andluedtke/status/1272542931585585153,0,,san antonio,,,,,,[],,,,
1272913438528897024,1272913438528897024,2020-06-16 10:26:27 CDT,2020-06-16,10:26:27,-0500,940999093769424896,beautifulsam95,🇵🇷🐂✨,,"Girl this couple posted a pic on FB and they both were dead ass looking at the ground, I was really trying to figure out wtf they were looking at 😂😂😂😂, they didn’t even have fresh new shoes on eithe so it wasn’t that 🤷‍♀️😭",en,[],[],[],1,0,0,[],[],https://twitter.com/beautifulsam95/status/1272913438528897024,False,https://twitter.com/Goldskxx/status/1272752376550756352,0,,san antonio,,,,,,[],,,,
1272909509292408834,1272538132307681280,2020-06-16 10:10:51 CDT,2020-06-16,10:10:51,-0500,1261279240412110850,alberto48453306,Alberto Arellano,,@WhiteHouse @realDonaldTrump And who calls those violence who who sacrifice innocent babies that were wonderful look at yourself in the mirror understand all Life is Beautiful look yourself in the mirror we understand he belongs in prison Not Dead it's expression of cause and effect sir ask yourselves no lie  https://t.co/FxVfghh4AU,en,[],[],['https://pbs.twimg.com/media/EapIcvWXsAIBXq8.jpg'],0,0,0,[],[],https://twitter.com/Alberto48453306/status/1272909509292408834,False,,1,https://pbs.twimg.com/media/EapIcvWXsAIBXq8.jpg,san antonio,,,,,,"[{'screen_name': 'WhiteHouse', 'name': 'The White House', 'id': '1323730225067339784'}, {'screen_name': 'realDonaldTrump', 'name': 'Donald J. Trump', 'id': '25073877'}]",,,,
1272907957962002435,1272907114160295937,2020-06-16 10:04:41 CDT,2020-06-16,10:04:41,-0500,1261279240412110850,alberto48453306,Alberto Arellano,,@TeamTrump Consensual understanding was always there you idiots wrong answer does it feel good eduardo arellano says I look and say in a soft sad hurt way I dont feel a thing!!!  https://t.co/ggO6LBsm0J  https://t.co/WxCSvGs1xO,en,[],['https://twitter.com/Alberto48453306/status/1272907558072745993/photo/1'],"['https://pbs.twimg.com/media/EapHBc0XsAkv3ZC.jpg', 'https://pbs.twimg.com/media/EapHB0wXYAUQ7x0.jpg', 'https://pbs.twimg.com/media/EapHCJzXYAAtcDb.jpg', 'https://pbs.twimg.com/media/EapHCfvXgAAR60e.jpg']",0,0,0,[],[],https://twitter.com/Alberto48453306/status/1272907957962002435,False,,1,https://pbs.twimg.com/media/EapHBc0XsAkv3ZC.jpg,san antonio,,,,,,"[{'screen_name': 'TeamTrump', 'name': 'Team Trump (Text TRUMP to 88022)', 'id': '729676086632656900'}]",,,,
1272907707029360648,1272907707029360648,2020-06-16 10:03:41 CDT,2020-06-16,10:03:41,-0500,2159895320,lexxismaariee,lex 🤘🏼,,working open to close 4 days in a row has a bitch fucking dead,en,[],[],[],0,0,4,[],[],https://twitter.com/lexxismaariee/status/1272907707029360648,False,,0,,san antonio,,,,,,[],,,,
1272907558072745993,1271453592017403906,2020-06-16 10:03:05 CDT,2020-06-16,10:03:05,-0500,1261279240412110850,alberto48453306,Alberto Arellano,,@CDCInjury @CDCgov Consensual understanding was always there you idiots wrong answer does it feel good eduardo arellano says I look and say in a soft sad hurt way I dont feel a thing!!!  https://t.co/ggO6LBsm0J,en,[],[],"['https://pbs.twimg.com/media/EapGqQVWAAIaMIx.jpg', 'https://pbs.twimg.com/media/EapGqrZXQAwQBTg.jpg', 'https://pbs.twimg.com/media/EapGq9aWkAE0efy.jpg', 'https://pbs.twimg.com/media/EapGrQSXYAM5L5B.jpg']",0,0,0,[],[],https://twitter.com/Alberto48453306/status/1272907558072745993,False,,1,https://pbs.twimg.com/media/EapGqQVWAAIaMIx.jpg,san antonio,,,,,,"[{'screen_name': 'CDCInjury', 'name': 'CDC Injury Center', 'id': '239971233'}, {'screen_name': 'CDCgov', 'name': 'CDC', 'id': '146569971'}]",,,,
1272905940405280769,1272902110888235010,2020-06-16 09:56:40 CDT,2020-06-16,09:56:40,-0500,1261279240412110850,alberto48453306,Alberto Arellano,,@TrumpWarRoom Believe in all life and handshake get on our knees and pray for true forgiveness not the ones who supported death molested go to prison and feel what you've done.... asshole god have mercy and remember I dont have to save you batman this time and superman tagteam trump and all🤝,en,[],[],[],0,0,0,[],[],https://twitter.com/Alberto48453306/status/1272905940405280769,False,,0,,san antonio,,,,,,"[{'screen_name': 'TrumpWarRoom', 'name': 'Trump War Room', 'id': '1108472017144201216'}]",,,,
1272904501360570370,1272904501360570370,2020-06-16 09:50:57 CDT,2020-06-16,09:50:57,-0500,833772515524747264,the_fierceking,Ty 🏳️‍🌈 Zuniga,,If yall need some more info on Racism and how it shaped the police force in this country. Please give this podcast a chance!  https://t.co/YaXrYEKmNh,en,[],[],['https://pbs.twimg.com/media/EapD4cUXsAIzbyD.jpg'],0,0,0,[],[],https://twitter.com/The_FierceKing/status/1272904501360570370,False,,1,https://pbs.twimg.com/media/EapD4cUXsAIzbyD.jpg,san antonio,,,,,,[],,,,
1272899473946140673,1272899473946140673,2020-06-16 09:30:58 CDT,2020-06-16,09:30:58,-0500,1261279240412110850,alberto48453306,Alberto Arellano,,Oh and im.sorry mr president I said Donald Trump its donald j trump.i didn't have enough type room I'm not convicted to death or my record mr president😉🙂🙃🙂🤓👍,en,[],[],[],0,0,0,[],[],https://twitter.com/Alberto48453306/status/1272899473946140673,False,,0,,san antonio,,,,,,[],,,,
1272899010848854016,1272899010848854016,2020-06-16 09:29:08 CDT,2020-06-16,09:29:08,-0500,1261279240412110850,alberto48453306,Alberto Arellano,,I stold food to stay alive and smoke weed to be lifted back on my feet to learn his way was not right thank you donald  trump🥺😭😭🤗🥰🥰🥰🥰🥰🥰🥰 and everyone for sticking it out to understand who's fault was it mainly and entrapped us all with abuse we never needed but to hear  https://t.co/Dk8y5oaFz6,en,[],[],['https://pbs.twimg.com/media/Eao-5gfXkAEc8ZD.jpg'],0,0,0,[],[],https://twitter.com/Alberto48453306/status/1272899010848854016,False,,1,https://pbs.twimg.com/media/Eao-5gfXkAEc8ZD.jpg,san antonio,,,,,,[],,,,
1272897773512413191,1272897773512413191,2020-06-16 09:24:13 CDT,2020-06-16,09:24:13,-0500,1261279240412110850,alberto48453306,Alberto Arellano,,Manipulation entrapment hex manipulation abuse on america and everywhere around the world abuse I stold cds to know love and sell for laptop Dell I told Yolanda Arellano for college greed of money abuse of my cps check stold close to stay warm and go to college I was entrapped to,en,[],[],[],1,0,0,[],[],https://twitter.com/Alberto48453306/status/1272897773512413191,False,,0,,san antonio,,,,,,[],,,,
