id,conversation_id,created_at,date,time,timezone,user_id,username,name,place,tweet,language,mentions,urls,photos,replies_count,retweets_count,likes_count,hashtags,cashtags,link,retweet,quote_url,video,thumbnail,near,geo,source,user_rt_id,user_rt,retweet_id,reply_to,retweet_date,translate,trans_src,trans_dest
1276269258842890241,1276269258842890241,2020-06-25 16:41:17 CDT,2020-06-25,16:41:17,-0500,3886304119,demiimarkie,dixienormus,,May I please get 2 friends to copy and repost? I am trying to demonstrate that someone is always listening.  #Suicide Awareness 1-800-273-8255  Just two. Any two. Copy- not retweet,en,[],[],[],0,0,1,['suicide'],[],https://twitter.com/demiimarkie/status/1276269258842890241,False,,0,,los angeles,,,,,,[],,,,
1276268797108695041,1276268797108695041,2020-06-25 16:39:27 CDT,2020-06-25,16:39:27,-0500,1234390185044926464,daplugsbrat,Da Trap Brat ✨,,"It’s okay to miss someone who hurt you .. but thug it out, better days is coming🖤",en,[],[],[],0,0,2,[],[],https://twitter.com/daplugsbrat/status/1276268797108695041,False,,0,,los angeles,,,,,,[],,,,
1276268504887390208,1276268504887390208,2020-06-25 16:38:18 CDT,2020-06-25,16:38:18,-0500,152437507,ndalittlebitnot,Bob Hantsch,,"@MattWalshBlog: your discussion of “are you a racist?” is, literally, completely wrong. Racism isn’t what you think in your head, it’s how you behave out in society. Argue you can shoot someone dead &amp; declare yourself not a killer “in your head.” You’re still a killer, out here.",en,[],[],[],0,0,0,[],[],https://twitter.com/ndalittlebitnot/status/1276268504887390208,False,,0,,los angeles,,,,,,[],,,,
1276267561735184384,1276249270010687489,2020-06-25 16:34:33 CDT,2020-06-25,16:34:33,-0500,1251618868239294465,julieerickson63,Julie Zarrow Erickson,,"@JoyAnnReid Yes. They hurt him so much more than Democrats do.  He knows, at the center of his black hole, that these republicans were too smart for him to fool. They emerge as unceasing torment through  @ProjectLincoln. Too smart, too good, too real for Donald.",en,"[{'screen_name': 'projectlincoln', 'name': 'the lincoln project', 'id': '1205226529455632385'}]",[],[],0,1,7,[],[],https://twitter.com/julieerickson63/status/1276267561735184384,False,,0,,los angeles,,,,,,"[{'screen_name': 'JoyAnnReid', 'name': 'Joy-Ann (Pro-Democracy) Reid 😷', 'id': '49698134'}]",,,,
1276266988474531840,1276266988474531840,2020-06-25 16:32:16 CDT,2020-06-25,16:32:16,-0500,4864693872,funnydavidlucas,David Lucas,,TBT - first time I ate pussy I brought a fork and a knife to the Bedroom,en,[],[],[],3,3,13,[],[],https://twitter.com/funnydavidlucas/status/1276266988474531840,False,,0,,los angeles,,,,,,[],,,,
1276266448873091074,1276223417092636673,2020-06-25 16:30:07 CDT,2020-06-25,16:30:07,-0500,478946647,robrodgersse,Rob Rodgers,,"@robo_tabby @kurteichenwald He didn’t say always withhold services always, only if services need to be rationed. There’s another difference. Those not wearing masks are directly hurting others, potentially many others. Opioid users hurt themselves.",en,[],[],[],0,0,1,[],[],https://twitter.com/RobRodgersSE/status/1276266448873091074,False,,0,,los angeles,,,,,,"[{'screen_name': 'robo_tabby', 'name': 'Tabby, kulak and lore collector', 'id': '598326041'}, {'screen_name': 'kurteichenwald', 'name': 'Kurt Eichenwald', 'id': '215207998'}]",,,,
1276266404207943680,1276266404207943680,2020-06-25 16:29:57 CDT,2020-06-25,16:29:57,-0500,1880353602,theaologies,thea✨🌙,,"Paramore’s Riot! (2007) is still one of the best albums ever, no I’m not taking other opinions",en,[],[],[],0,0,3,[],[],https://twitter.com/Theaologies/status/1276266404207943680,False,,0,,los angeles,,,,,,[],,,,
1276266209608994816,1276265122390925312,2020-06-25 16:29:10 CDT,2020-06-25,16:29:10,-0500,55183629,rdysethgo,TengoSeth🏹,,"@shadipetosky Nobody wanted that, that was network’s call. And I agree it could’ve been a huge opportunity to expand in the ways you’re describing. The heat of the #MeToo movement brought the show to its knees.They even cut the original production schedule in half which really hurt the process",en,[],[],[],0,0,0,['metoo'],[],https://twitter.com/RdySethGo/status/1276266209608994816,False,,0,,los angeles,,,,,,"[{'screen_name': 'shadipetosky', 'name': 'Shadi Petosky', 'id': '285368746'}]",,,,
1276265290335170561,1275885617444986886,2020-06-25 16:25:31 CDT,2020-06-25,16:25:31,-0500,116972959,viisampson,B€,,"@ayotristanie I just hope they get the virus and kick the can, literally a demonic race of people on a large scale and Im.mixed so i dont hate white ppl and a lot of kno first hand how fckd up their own are but every race has its bad ppl but their phenomena is different in this time",en,[],[],[],2,0,1,[],[],https://twitter.com/VIIsampson/status/1276265290335170561,False,,0,,los angeles,,,,,,"[{'screen_name': 'ayotristanie', 'name': 'Tris', 'id': '149190938'}]",,,,
1276264294053580800,1276264294053580800,2020-06-25 16:21:34 CDT,2020-06-25,16:21:34,-0500,90344035,johnnegron1,John Antony Negrón,,No family No county No city No state  No nation deserves this.  These are animals preying on the defenseless + deserve to be stripped + indicted for aggravated assault/manslaughter.   https://t.co/W2ZrT8M3LB  #ElijahMcClain,en,[],['https://youtu.be/q5NcyePEOJ8'],[],0,0,1,['elijahmcclain'],[],https://twitter.com/JohnNegron1/status/1276264294053580800,False,,0,,los angeles,,,,,,[],,,,
1276263965887041536,1275921380580573185,2020-06-25 16:20:15 CDT,2020-06-25,16:20:15,-0500,432051778,mrdonnab,DONNA,,@AyeshaPI @REDSEASHAWTY Someone def kidnapped her 😂,en,[],[],[],0,0,0,[],[],https://twitter.com/MrDonnaB/status/1276263965887041536,False,,0,,los angeles,,,,,,"[{'screen_name': 'AyeshaPI', 'name': 'Ayesha Perry Iqbal', 'id': '217201536'}, {'screen_name': 'REDSEASHAWTY', 'name': 'SALINA', 'id': '92631130'}]",,,,
1276262226144276480,1276262226144276480,2020-06-25 16:13:21 CDT,2020-06-25,16:13:21,-0500,233033586,theadamchance,Adam Chance,,My Star Wars-themed podcast has merchandise at  https://t.co/HgSoyyFjCx if you want to give in to the Dork Side of the Force.  https://t.co/IEVQNr0u1A,en,[],['http://Roguery.RedBubble.com'],"['https://pbs.twimg.com/media/EbYxuoLVcAAafD5.jpg', 'https://pbs.twimg.com/media/EbYxuoMUYAAaLr9.jpg']",3,5,82,[],[],https://twitter.com/TheAdamChance/status/1276262226144276480,False,,1,https://pbs.twimg.com/media/EbYxuoLVcAAafD5.jpg,los angeles,,,,,,[],,,,
1276261858794561537,1276167843965526016,2020-06-25 16:11:53 CDT,2020-06-25,16:11:53,-0500,1115596310759895040,bob29790056,bob,,@andrew87cooper 120 million dead from COVID. I guess that’s why only 2 people  showed up at his event,en,[],[],[],0,0,0,[],[],https://twitter.com/bob29790056/status/1276261858794561537,False,,0,,los angeles,,,,,,[],,,,
1276260951092637696,1276260951092637696,2020-06-25 16:08:17 CDT,2020-06-25,16:08:17,-0500,14168213,oahuaj,AjanaOrozco™,"{'type': 'Point', 'coordinates': [34.07073346, -118.44673634]}","My class schedule for fall 2020 at UCLA. Queer Diversity: Queer Historiography in Argentina, storytelling for Artists and Ted Talkers, Dancing at Brink of Abyss:Homosexuality from Weimar Berlin to Nazi Death Camps…  https://t.co/7RUsG2cDoA",en,[],['https://www.instagram.com/p/CB32JXpDJLg/?igshid=1lpddra8oq5ay'],[],0,0,0,[],[],https://twitter.com/OahuAJ/status/1276260951092637696,False,,0,,los angeles,,,,,,[],,,,
1276259746186657798,1276259746186657798,2020-06-25 16:03:29 CDT,2020-06-25,16:03:29,-0500,1241186606335180800,mestrada19___,mel,,i'm dead LMAO,en,[],[],[],1,0,3,[],[],https://twitter.com/mestrada19___/status/1276259746186657798,False,https://twitter.com/nydile23/status/1276020884562567168,0,,los angeles,,,,,,[],,,,
1276259723914801152,1276259723914801152,2020-06-25 16:03:24 CDT,2020-06-25,16:03:24,-0500,1546888454,pablosymone,pahblow,,It took me dating my girlfriend to find this out. The offense is real.,en,[],[],[],0,0,0,[],[],https://twitter.com/pablosymone/status/1276259723914801152,False,https://twitter.com/astridtoobossy/status/1275633752966705152,0,,los angeles,,,,,,[],,,,
1276259092755963906,1276142122102599680,2020-06-25 16:00:54 CDT,2020-06-25,16:00:54,-0500,1103450849370464256,tryagainbishhh,E.Rose🇨🇻,,@DrDreddyMurphy His tweet is gone lmao what did he say to you ?! Lmao dead af,en,[],[],[],1,0,0,[],[],https://twitter.com/tryagainBISHHH/status/1276259092755963906,False,,0,,los angeles,,,,,,"[{'screen_name': 'DrDreddyMurphy', 'name': '✨24k: Choppin Dawg 🏆🏆\U0001f977🏾🐍🏁△⃒⃘', 'id': '27757760'}]",,,,
1276259087076876288,1276259087076876288,2020-06-25 16:00:52 CDT,2020-06-25,16:00:52,-0500,16976061,4nikkolas,NIKKOLAS,,"#TamirRice would have graduated from high school this year. I'm proud to partner with @civilrightsorg to pay tribute to Tamir's life, which was cut short by police brutality at only 12 years old. Today, on his birthday, we must demand change.  https://t.co/2nH4VnkdWP",en,"[{'screen_name': 'civilrightsorg', 'name': 'the leadership conference', 'id': '58503762'}]",[],['https://pbs.twimg.com/media/EbYu30kU0AAWlhz.jpg'],9,344,904,['tamirrice'],[],https://twitter.com/4NIKKOLAS/status/1276259087076876288,False,,1,https://pbs.twimg.com/media/EbYu30kU0AAWlhz.jpg,los angeles,,,,,,[],,,,
1276258966943588354,1276258966943588354,2020-06-25 16:00:24 CDT,2020-06-25,16:00:24,-0500,1149479200325165057,lilcassxo,cass,,I hate passive aggressive people... just talk to me bitch ass.. 🥴,en,[],[],[],0,2,3,[],[],https://twitter.com/lilcassxo/status/1276258966943588354,False,,0,,los angeles,,,,,,[],,,,
1276258180205408256,1276242643752759297,2020-06-25 15:57:16 CDT,2020-06-25,15:57:16,-0500,34534137,ejkerrigan,Eleanor J. Kerrigan,,@TammyPescatelli @latimes @NewYorkTimesUSA @TheComedyStore @TammyPescatelli don’t be silly! That wouldn’t fit their narrative! How dare you talk from a positive experience. They only want the ones that got hurt by a building. “They didn’t pass us. Tear it down”,en,[],[],[],2,2,15,[],[],https://twitter.com/ejkerrigan/status/1276258180205408256,False,,0,,los angeles,,,,,,"[{'screen_name': 'TammyPescatelli', 'name': 'Tammy Pescatelli', 'id': '18484248'}, {'screen_name': 'latimes', 'name': 'Los Angeles Times', 'id': '16664681'}, {'screen_name': 'newyorktimesusa', 'name': 'New York Times', 'id': '1061538042438139905'}, {'screen_name': 'TheComedyStore', 'name': 'The Comedy Store', 'id': '22517388'}]",,,,
1276256408812417024,1276256408812417024,2020-06-25 15:50:14 CDT,2020-06-25,15:50:14,-0500,312328907,lerbyofficial,Lerby Seattle,,This game is bonkers now! That’s a Penal Kick! 🤾‍♂️ handball,en,[],[],[],0,0,0,[],[],https://twitter.com/LerbyOfficial/status/1276256408812417024,False,,0,,los angeles,,,,,,[],,,,
1276255861703204865,1276244943552446464,2020-06-25 15:48:03 CDT,2020-06-25,15:48:03,-0500,1262922087494070272,obamaisbettert2,obamaisbetterthantrump,,"@heykarlin Did Jon hurt you, Peter? Show me where he touched you  https://t.co/wttHjch2Pv",en,[],[],['https://pbs.twimg.com/tweet_video_thumb/EbYr8CsUcAA0CCO.jpg'],1,0,0,[],[],https://twitter.com/obamaisbettert2/status/1276255861703204865,False,,1,https://pbs.twimg.com/tweet_video_thumb/EbYr8CsUcAA0CCO.jpg,los angeles,,,,,,"[{'screen_name': 'heykarlin', 'name': 'Peter Karlin', 'id': '171672792'}]",,,,
1276255802723106819,1276255802723106819,2020-06-25 15:47:49 CDT,2020-06-25,15:47:49,-0500,92186516,djlordofficial,DjLORD,"{'type': 'Point', 'coordinates': [33.99114, -118.21854]}","On set...”’Bout ta start a Riot”🎥🧐⚔️💣 @MrFotogasm  #DjLORD #LosAngeles #RiotGear #SWAT #Videoshoot @ The Escarpment ""5610 Soto Studio""  https://t.co/Z3hKJE2YWs",en,"[{'screen_name': 'mrfotogasm', 'name': 'eitan miskevich', 'id': '167489054'}]",['https://www.instagram.com/p/CB3zW5LFJAN/?igshid=z5cris10ib4k'],[],0,0,2,"['djlord', 'losangeles', 'riotgear', 'swat', 'videoshoot']",[],https://twitter.com/DjLORDofficial/status/1276255802723106819,False,,0,,los angeles,,,,,,[],,,,
1276255455342260224,1275667860795396096,2020-06-25 15:46:26 CDT,2020-06-25,15:46:26,-0500,3022905931,yamstellaire,yam yam (ya’mi),,@notquitethis @melvaz22 @SweetToothAudio the problem with your thinking is that you fail to realize that the statement “men are trash” is not based on individual basis but the collective of what men represent and stand for in a patriarchal society. you are more concerned w/ your hurt ego than recognizing your privilege,en,[],[],[],1,1,10,[],[],https://twitter.com/yamstellaire/status/1276255455342260224,False,,0,,los angeles,,,,,,"[{'screen_name': 'notquitethis', 'name': 'NOTQUITEOFFICIAL', 'id': '1331741828291420160'}, {'screen_name': 'melvaz22', 'name': 'Mel 🇵🇷', 'id': '1027222266667589633'}, {'screen_name': 'SweetToothAudio', 'name': '🛒Problem Child | DPMO🛒', 'id': '989272598348414976'}]",,,,
1276253544895508480,1275837674407026688,2020-06-25 15:38:51 CDT,2020-06-25,15:38:51,-0500,19370700,kilroyrogers,Roy Rogers Oldenkamp,,"@_TRAV23 Many. Two dead (friends’ parents) and others ill, some hospitalized.",en,[],[],[],0,0,0,[],[],https://twitter.com/kilroyrogers/status/1276253544895508480,False,,0,,los angeles,,,,,,"[{'screen_name': '_TRAV23', 'name': 'TRAV', 'id': '895718892739452932'}]",,,,
1276252963950915585,1276252963950915585,2020-06-25 15:36:32 CDT,2020-06-25,15:36:32,-0500,3218189220,nolahaynes_,Nola Haynes,,"At the corner of Melrose &amp; Vine in front of Bogie’s Luquor, cops have their guns drawn &amp; pointed at a Black man. The entire community came out to make sure that man did not end up dead. My heart is beating out of my chest. Now, more cops &amp; helicopters.  https://t.co/aWacrO83mt",en,[],[],"['https://pbs.twimg.com/media/EbYpTNoU4AAGbRS.jpg', 'https://pbs.twimg.com/media/EbYpTNoUYAEmErB.jpg']",0,4,6,[],[],https://twitter.com/nolahaynes_/status/1276252963950915585,False,,1,https://pbs.twimg.com/media/EbYpTNoU4AAGbRS.jpg,los angeles,,,,,,[],,,,
1276252661524901888,1276252661524901888,2020-06-25 15:35:20 CDT,2020-06-25,15:35:20,-0500,259921934,nicjacksonmusic,Nic Jackson,"{'type': 'Point', 'coordinates': [34.16177, -118.3724]}","😡😡😡  #Repost @vanessa_bryan with @get_repost ・・・ I’m just gonna leave this right here. #JusticeForElijahMcClain . 💔  I listened to his innocence be snuffed out by pure ego, power-tripping malice. This is a bullet to…  https://t.co/W36ALCfAqc",en,"[{'screen_name': 'vanessa_bryan', 'name': 'vanessa bryan', 'id': '27294964'}, {'screen_name': 'get_repost', 'name': 'repost', 'id': '861721803395170305'}]",['https://www.instagram.com/p/CB3yYA8pKXB/?igshid=1n99239caq2po'],[],0,0,0,"['repost', 'justiceforelijahmcclain']",[],https://twitter.com/nicjacksonmusic/status/1276252661524901888,False,,0,,los angeles,,,,,,[],,,,
1276252090868748288,1276252090868748288,2020-06-25 15:33:04 CDT,2020-06-25,15:33:04,-0500,556482014,calebalman,Caleb Alman,,The @MayorOfLA has failed this city. Between the premature reopening followed by a spike in COVID cases and his response to Black Lives Matter and police brutality... Garcetti needs to resign.,en,"[{'screen_name': 'mayorofla', 'name': 'mayorofla', 'id': '17070113'}]",[],[],0,0,3,[],[],https://twitter.com/calebalman/status/1276252090868748288,False,https://twitter.com/latimes/status/1276240748392984576,0,,los angeles,,,,,,[],,,,
1276251956764270592,1276251956764270592,2020-06-25 15:32:32 CDT,2020-06-25,15:32:32,-0500,28913529,_theroach,Roach,,I just wanna go home and kick it 😩,en,[],[],[],0,0,0,[],[],https://twitter.com/_theRoach/status/1276251956764270592,False,,0,,los angeles,,,,,,[],,,,
1276251888673947648,1276251888673947648,2020-06-25 15:32:16 CDT,2020-06-25,15:32:16,-0500,4692262956,tontolao1,Tontolao,,"BIG WIN !!!!  AS KAYLEIGH MCENANY DECLARES MS MCENANY SAYS NOT ONE WORD ON 123,000 AMERICANS DEAD TO COVID-19  NOTHING TO THE FAMILIES OR FRIENDS  2.5 MILLION AMERICANS INFECTED  NOT 1 WORD FROM KAYLEIGH  trump ENDING TESTING END OF JUNE  REALLY,   DIES THAT SOUND LIKE A BIG WIN  https://t.co/RTjf5lE6mC",en,[],[],"['https://pbs.twimg.com/media/EbYoU5KU8AAXAYy.jpg', 'https://pbs.twimg.com/media/EbYoVDsU8AAL4BX.jpg']",0,0,1,[],[],https://twitter.com/Tontolao1/status/1276251888673947648,False,https://twitter.com/PressSec45/status/1276236046582374400,1,https://pbs.twimg.com/media/EbYoU5KU8AAXAYy.jpg,los angeles,,,,,,[],,,,
1276251613171036161,1276251613171036161,2020-06-25 15:31:10 CDT,2020-06-25,15:31:10,-0500,2177013614,brianachaavez,BRIANA🧚🏻🌙✨,,i took some melatonin gummies late last night and i dead ass could not wake up this morning,en,[],[],[],0,0,10,[],[],https://twitter.com/brianachaavez/status/1276251613171036161,False,,0,,los angeles,,,,,,[],,,,
1276251120575279104,1276251120575279104,2020-06-25 15:29:13 CDT,2020-06-25,15:29:13,-0500,251963851,lizzitoburrito,✨sexy lil mama✨ liz,,Can I please get 2 friends to copy and repost? I am trying to demonstrate that someone is always listening.  #Suicide Awareness 1-800-273-8255  Just two. Any two. Copy- not retweet,en,[],[],[],0,0,6,['suicide'],[],https://twitter.com/LizzitoBurrito/status/1276251120575279104,False,,0,,los angeles,,,,,,[],,,,
1276249700446826496,1275790782771806208,2020-06-25 15:23:34 CDT,2020-06-25,15:23:34,-0500,1523891821,analisa_swan,Analisa Swan 🆘 #DemForce🇺🇦⚖️💛🐝🥁🌹,,"@kylegriffin1 This makes me sick! Criminal abuse, negligence, and neglect of these innocent children! This is just AWFUL!!!",en,[],[],[],0,0,3,[],[],https://twitter.com/Analisa_Swan/status/1276249700446826496,False,,0,,los angeles,,,,,,"[{'screen_name': 'kylegriffin1', 'name': 'Kyle Griffin', 'id': '32871086'}]",,,,
1276249071951286273,1276249071951286273,2020-06-25 15:21:04 CDT,2020-06-25,15:21:04,-0500,253741134,bigsulu,Suluhishi S. Heru,,"If a little bitty stimulus check can make u overlook treason, collusion, sexual assault, stupidity, and racism: We Are Not The Same!",en,[],[],[],0,1,2,[],[],https://twitter.com/BigSulu/status/1276249071951286273,False,,0,,los angeles,,,,,,[],,,,
1276248734951591937,1276248734951591937,2020-06-25 15:19:44 CDT,2020-06-25,15:19:44,-0500,2432435059,jordyycakes,Jordan Cicoria,,May I please get 2 friends to copy and repost? I am trying to demonstrate that someone is always listening.  #Suicide Awareness 1-800-273-8255  Just two. Any two. Copy- not retweet,en,[],[],[],1,0,6,['suicide'],[],https://twitter.com/jordyycakes/status/1276248734951591937,False,,0,,los angeles,,,,,,[],,,,
1276248371368390666,1276248371368390666,2020-06-25 15:18:17 CDT,2020-06-25,15:18:17,-0500,840442453542940672,laguda_lou,Lou Lou Laguda,,"On this day in 2009, the legendary King Of Pop Michael Jackson died. Today will make it 11 years of his death. RIP Michael! U are truly missed.",en,[],[],[],0,0,0,[],[],https://twitter.com/laguda_lou/status/1276248371368390666,False,,0,,los angeles,,,,,,[],,,,
1276248319115710464,1276248319115710464,2020-06-25 15:18:05 CDT,2020-06-25,15:18:05,-0500,466943396,typicalzenn,zenab,,literally didn’t realize how much these daily police brutality videos were getting to me until i woke up this morning in tears??? literally this world is so terrible please take care of your mental health guys!,en,[],[],[],0,0,5,[],[],https://twitter.com/typicalzenn/status/1276248319115710464,False,,0,,los angeles,,,,,,[],,,,
1276246509810380800,1276246509810380800,2020-06-25 15:10:54 CDT,2020-06-25,15:10:54,-0500,51344692,npajayy,The Great,,Niggas learn you just to hurt you I’m like no Judas,en,[],[],[],0,0,0,[],[],https://twitter.com/npajayy/status/1276246509810380800,False,,0,,los angeles,,,,,,[],,,,
1276245250546098176,1276245250546098176,2020-06-25 15:05:53 CDT,2020-06-25,15:05:53,-0500,185820615,vale_mar11,magiccake💫,,I cannot wait to force @Allibaguette to cudddle with me.,en,"[{'screen_name': 'allibaguette', 'name': 'allison mary', 'id': '191709183'}]",[],[],1,0,5,[],[],https://twitter.com/vale_mar11/status/1276245250546098176,False,,0,,los angeles,,,,,,[],,,,
1276245153246777351,1276245153246777351,2020-06-25 15:05:30 CDT,2020-06-25,15:05:30,-0500,1032022461745782784,divinefem_,M.,,abolish police. abolish prisons. abolish the mf death penalty.,en,[],[],[],0,1,4,[],[],https://twitter.com/divinefem_/status/1276245153246777351,False,,0,,los angeles,,,,,,[],,,,
1276244965069164544,1276244965069164544,2020-06-25 15:04:45 CDT,2020-06-25,15:04:45,-0500,1057706472853782528,evashornalowell,Eva Sofia Horna Lowell,,This is fantastic!! @jimmyfallon don’t pass up an amazing opportunity for your viewers to learn about science from kick ass scientists!!,en,"[{'screen_name': 'jimmyfallon', 'name': 'jimmy fallon', 'id': '15485441'}]",[],[],1,1,10,[],[],https://twitter.com/EvaSHornaLowell/status/1276244965069164544,False,https://twitter.com/GoAstroMo/status/1275975762877841408,0,,los angeles,,,,,,[],,,,
1276244534872035328,1276244534872035328,2020-06-25 15:03:03 CDT,2020-06-25,15:03:03,-0500,93241358,reaganworld,Michael Reagan,,Democrats hope public pressure and civil unrest will force GOP to accept more drastic police reforms  https://t.co/PEjA1fSlWN,en,[],['https://washex.am/3ewzucP'],[],4,3,10,[],[],https://twitter.com/ReaganWorld/status/1276244534872035328,False,,0,,los angeles,,,,,,[],,,,
1276242997877694464,1276242997877694464,2020-06-25 14:56:56 CDT,2020-06-25,14:56:56,-0500,1058445055256489984,andeizar,secondary reality television personality,,"being latino &amp; rejecting food offered by latino elders is a complete nightmare, the disappointment in their faces is soul crushing. i have a hard time eating food that isn’t cooked by me or my family but the judgement following that “no, muchas gracias” hits like a bullet lmaooo",en,[],[],[],0,1,1,[],[],https://twitter.com/ANDEIZAR/status/1276242997877694464,False,,0,,los angeles,,,,,,[],,,,
1276242708575580161,1276242708575580161,2020-06-25 14:55:47 CDT,2020-06-25,14:55:47,-0500,25316830,linazaproudi,Lina Zaproudi-Ellman (she/her) 🇺🇦,,Explains a lot 👉 Your barber has more training than your police force  https://t.co/KkTHN5xbkR via @thesovereignman (via @RogerEllman),en,"[{'screen_name': 'thesovereignman', 'name': 'simon black', 'id': '173093507'}, {'screen_name': 'rogerellman', 'name': 'roger ellman', 'id': '25257254'}]",['https://www.sovereignman.com/trends/your-barber-has-more-training-than-your-police-force-28013/'],[],0,0,0,[],[],https://twitter.com/LinaZaproudi/status/1276242708575580161,False,,0,,los angeles,,,,,,[],,,,
1276242534256140288,1276242534256140288,2020-06-25 14:55:06 CDT,2020-06-25,14:55:06,-0500,1669120106,tripsaregood7,TRIPS (Michael Magaña),,May I please get 2 friends to copy and repost? I am trying to demonstrate that someone is always listening.  #Suicide Awareness 1-800-273-8255  Just two. Any two. Copy- not retweet.,en,[],[],[],1,0,5,['suicide'],[],https://twitter.com/tripsaregood7/status/1276242534256140288,False,,0,,los angeles,,,,,,[],,,,
1276240261761257472,1276240260452630528,2020-06-25 14:46:04 CDT,2020-06-25,14:46:04,-0500,411030160,phinni1,PFINN,,"2 of 3  six-year old Jeremy Mardis, all of them white people who were shot dead in instances of overly aggressive American policing in one single year, 2015. Most of these cases seem as though they would have made headlines if the victims had been black. But these names are",en,[],[],[],1,0,0,[],[],https://twitter.com/phinni1/status/1276240261761257472,False,,0,,los angeles,,,,,,[],,,,
1276240077148917760,1276240077148917760,2020-06-25 14:45:20 CDT,2020-06-25,14:45:20,-0500,784092204935458816,chewyourbeer,Robrt(ChewYourBeer)M,,@bertkreischer Would this be considered cooter punch?,en,[],[],[],0,0,2,[],[],https://twitter.com/ChewYourBeer/status/1276240077148917760,False,https://twitter.com/RexChapman/status/1276223866986250251,0,,los angeles,,,,,,[],,,,
1276239273251885056,1276239273251885056,2020-06-25 14:42:08 CDT,2020-06-25,14:42:08,-0500,1191815324661772288,charles99388684,charles alvarado,,"I go further than that. If arsonists, looters and the like persist, I say it's time to use live ammunition against them. BEFORE they burn our country down.",en,[],[],[],0,0,0,[],[],https://twitter.com/charles99388684/status/1276239273251885056,False,https://twitter.com/charliekirk11/status/1276231022141509632,0,,los angeles,,,,,,[],,,,
1276239098211004416,1276239098211004416,2020-06-25 14:41:27 CDT,2020-06-25,14:41:27,-0500,2868506347,zacharystern25,Zac Stern,,"Last time I was at Disneyland security profiled me and my ex, accused us of a crime, and after they were disproven  tried to kick us out of the park because “we were too loud.” Most humiliating experience of my life hands down. Fuck y’all",en,[],[],[],0,0,0,[],[],https://twitter.com/ZacharyStern25/status/1276239098211004416,False,https://twitter.com/DisneyParks/status/1276187686672437249,0,,los angeles,,,,,,[],,,,
1276237638467325952,1276237638467325952,2020-06-25 14:35:39 CDT,2020-06-25,14:35:39,-0500,19577477,lawjsharma,Law⚡️,,"@RexChapman is my favorite Twitter feed, so I’m honored. But it still hurt to make this 😂😭",en,[],[],[],12,104,429,[],[],https://twitter.com/LawJSharma/status/1276237638467325952,False,https://twitter.com/RexChapman/status/1276235443709923328,0,,los angeles,,,,,,[],,,,
1276235678666207232,1275573049077698567,2020-06-25 14:27:51 CDT,2020-06-25,14:27:51,-0500,1108989933077725185,johnzadaiii___,John Zada III,,"@MidWestSwing1 @ObviousTakeGuy @MikeObriann @ItzWakkOfficial @GameExamined Yup, They couldn’t bully the lakers anymore with bynum down there. They killed them on boards and inside buckets with pau at the center.",en,[],[],[],1,0,0,[],[],https://twitter.com/JohnZadaIII___/status/1276235678666207232,False,,0,,los angeles,,,,,,"[{'screen_name': 'MikeObriann', 'name': 'Mike', 'id': '1260709323895955456'}, {'screen_name': 'GameExamined', 'name': '💸', 'id': '772324189269143553'}]",,,,
