id,conversation_id,created_at,date,time,timezone,user_id,username,name,place,tweet,language,mentions,urls,photos,replies_count,retweets_count,likes_count,hashtags,cashtags,link,retweet,quote_url,video,thumbnail,near,geo,source,user_rt_id,user_rt,retweet_id,reply_to,retweet_date,translate,trans_src,trans_dest
1248383447250264064,1248383447250264064,2020-04-09 17:53:02 CDT,2020-04-09,17:53:02,-0500,1325349458,ldelao76,LisaDelao 🇺🇦,,#TrumpOwnsEveryDeath  #TrumpGenocide  #TrumpLiedPeopleDied  He is as DEADLY as the very virus he allowed to attack us! HE MUST GO !,en,[],[],[],0,2,2,"['trumpownseverydeath', 'trumpgenocide', 'trumpliedpeopledied']",[],https://twitter.com/ldelao76/status/1248383447250264064,False,https://twitter.com/erb_kay/status/1248090560637919237,0,,san antonio,,,,,,[],,,,
1248380338637664259,1248380338637664259,2020-04-09 17:40:41 CDT,2020-04-09,17:40:41,-0500,259859980,younotthefather,Maury Vasquez,,"""If being wrong's a crime I'm serving forever If being strong's your kind Then I need help here with this feather If being afraid is a crime We hang side by side At the swingin' party down the line...""",en,[],[],[],1,0,0,[],[],https://twitter.com/YouNOTthefather/status/1248380338637664259,False,https://twitter.com/BestCoast/status/1248371193100390400,0,,san antonio,,,,,,[],,,,
1248321554041225217,1248321554041225217,2020-04-09 13:47:05 CDT,2020-04-09,13:47:05,-0500,2439163164,8fca8b5354c1454,Texas K,,TEDROS of WHO threatened Pres. Trump with more body bsgs if he continues the drug therapy options. A THREAT. @realDonaldTrump @DonaldJTrumpJr  https://t.co/1i1KKrZp5S,en,"[{'screen_name': 'realdonaldtrump', 'name': 'donald j. trump', 'id': '25073877'}, {'screen_name': 'donaldjtrumpjr', 'name': 'donald trump jr.', 'id': '39344374'}]",['https://www.theguardian.com/world/2020/apr/08/now-is-not-the-time-to-cut-who-funds-says-official-after-trump-threat'],[],0,0,0,[],[],https://twitter.com/8fca8b5354c1454/status/1248321554041225217,False,,0,,san antonio,,,,,,[],,,,
1248311799666970626,1248311799666970626,2020-04-09 13:08:20 CDT,2020-04-09,13:08:20,-0500,1209855613792137216,duece_jackson,Duece Jackson,,"The building I am currently in is where I leave all animosity, anger and resentment. When I walk through those doors I will not carry this baggage with me.",en,[],[],[],0,0,0,[],[],https://twitter.com/duece_jackson/status/1248311799666970626,False,,0,,san antonio,,,,,,[],,,,
1248297162452209665,1248297162452209665,2020-04-09 12:10:10 CDT,2020-04-09,12:10:10,-0500,3145414992,xoaudgexo,A Superior Sigma Woman.,,Lmao you were called racist for stating your own personal liking.. but when they do it to us it’s not racist ..smdh,en,[],[],[],0,0,0,[],[],https://twitter.com/xoaudgexo/status/1248297162452209665,False,https://twitter.com/AlexxisHB/status/1248065758241972225,0,,san antonio,,,,,,[],,,,
1248290924230332417,1248273059934502912,2020-04-09 11:45:23 CDT,2020-04-09,11:45:23,-0500,979415045539971072,audreymg0928,Audrey,,@shirlynyvonne You won’t get me to stop voicing my opinion just because you don’t like it.  If you truly felt justified in your anger you sure wouldn’t be preoccupied with my Tweet. I should be irrelevant in your world. Scroll on.,en,[],[],[],1,0,0,[],[],https://twitter.com/audreymg0928/status/1248290924230332417,False,,0,,san antonio,,,,,,"[{'screen_name': 'shirlynyvonne', 'name': 'Black lives matter', 'id': '368037164'}]",,,,
1248286248755703809,1248273059934502912,2020-04-09 11:26:48 CDT,2020-04-09,11:26:48,-0500,979415045539971072,audreymg0928,Audrey,,"@shirlynyvonne Why are you still trying to change my mind? Be mad. I’m not mad, Im not stopping you from it, &amp; you won’t convince me to be mad either. You don’t need my approval to be mad. You don’t need to convince me your anger is justified. I feel differently than you &amp; it’s ok.",en,[],[],[],1,0,1,[],[],https://twitter.com/audreymg0928/status/1248286248755703809,False,,0,,san antonio,,,,,,"[{'screen_name': 'shirlynyvonne', 'name': 'Black lives matter', 'id': '368037164'}]",,,,
1248286172406845443,1248109520129310721,2020-04-09 11:26:30 CDT,2020-04-09,11:26:30,-0500,25162417,thatbravesgirl,Commish Cassie,,"@JayBraves14 @sydneashlyn It’s a brick facade on some plywood! We found them online at Home Depot’s website! Cut to size, nail gun to attach, speckling at the seams  and paint!  https://t.co/86WPvtGpIf",en,[],[],"['https://pbs.twimg.com/media/EVLNpu_U0AAxoJL.jpg', 'https://pbs.twimg.com/media/EVLNpvJUcAACtjW.jpg', 'https://pbs.twimg.com/media/EVLNpu8VAAA8E8z.jpg', 'https://pbs.twimg.com/media/EVLNpv2U0AEk761.jpg']",2,0,2,[],[],https://twitter.com/ThatBravesGirl/status/1248286172406845443,False,,1,https://pbs.twimg.com/media/EVLNpu_U0AAxoJL.jpg,san antonio,,,,,,"[{'screen_name': 'sydneashlyn', 'name': 's y d n e', 'id': '422843221'}]",,,,
1248283431949066242,1248273059934502912,2020-04-09 11:15:36 CDT,2020-04-09,11:15:36,-0500,979415045539971072,audreymg0928,Audrey,,"@shirlynyvonne And I am allowed NOT to be angry. Right? If you read about other students who have it worse &amp; you still don’t feel appreciative, that’s on you. I AM appreciative &amp; your anger about it doesn’t change that for me. I choose to remember everyone is struggling right now.",en,[],[],[],2,0,1,[],[],https://twitter.com/audreymg0928/status/1248283431949066242,False,,0,,san antonio,,,,,,"[{'screen_name': 'shirlynyvonne', 'name': 'Black lives matter', 'id': '368037164'}]",,,,
1248279331606061056,1248279331606061056,2020-04-09 10:59:19 CDT,2020-04-09,10:59:19,-0500,385525679,4caststeve,Steve,,"Severe weather today for our area keeps increasing. Areas that see any sunshine will cause more instability than others that don’t. Once storms pop, they’ll go severe quick. Large hail, damaging winds the main threat. Be ready SA! #SATwx",en,[],[],[],0,0,2,['satwx'],[],https://twitter.com/4CASTSteve/status/1248279331606061056,False,,0,,san antonio,,,,,,[],,,,
1248243840483348480,1248243840483348480,2020-04-09 08:38:17 CDT,2020-04-09,08:38:17,-0500,35944798,dbranscom,David Branscom,,Great Coaches Outreach this morning‼️  Thanks for leading it @Steve_Teel‼️🚨Ready to attack the day with an enthusiasm unknown to mankind (zoom edition)🥇👨🏼‍💻✍🏼️  🚨 #TCC  https://t.co/J9WjHuHcSY,en,"[{'screen_name': 'steve_teel', 'name': 'steve teel', 'id': '802848498'}]",[],"['https://pbs.twimg.com/media/EVKnJg7UUAAfOcG.jpg', 'https://pbs.twimg.com/media/EVKnJg7UcAMnIVt.jpg']",0,3,45,['tcc'],[],https://twitter.com/dbranscom/status/1248243840483348480,False,,1,https://pbs.twimg.com/media/EVKnJg7UUAAfOcG.jpg,san antonio,,,,,,[],,,,
1248235382543650818,1248235382543650818,2020-04-09 08:04:40 CDT,2020-04-09,08:04:40,-0500,1047971557,cwilltooill,“A Wetumpka Baby” Coming Soon 🤞🏾,,They are burrying non violent black prisoners who’ve died! Denying explanation to the families!!,en,[],[],[],0,0,0,[],[],https://twitter.com/Cwilltooill/status/1248235382543650818,False,,0,,san antonio,,,,,,[],,,,
1248227012851970048,1248227012851970048,2020-04-09 07:31:25 CDT,2020-04-09,07:31:25,-0500,45960951,divonvillebooks,Official Divon Delgado/Divonville Books,,"NATIONAL CHILD ABUSE PREVENTION MONTH. Every April, Child Abuse Prevention Month is an opportunity to learn about the signs of child abuse and how to prevent it. Communities around the nation come together 2 support families and children by reinforcing strategies that are working  https://t.co/VqOKwtOg7N",en,[],[],"['https://pbs.twimg.com/media/EVKX0XeUcAYa_Bm.jpg', 'https://pbs.twimg.com/media/EVKX06nU8AAZaxV.jpg', 'https://pbs.twimg.com/media/EVKX1G3U8AMzW8I.jpg']",0,0,0,[],[],https://twitter.com/Divonvillebooks/status/1248227012851970048,False,,1,https://pbs.twimg.com/media/EVKX0XeUcAYa_Bm.jpg,san antonio,,,,,,[],,,,
1248190904659259398,1248190904659259398,2020-04-09 05:07:56 CDT,2020-04-09,05:07:56,-0500,1092244023669075968,georgewl1,georgewl,,Arrest this ?doctor? If/when he next sets foot on US soil!!,en,[],[],[],0,0,0,[],[],https://twitter.com/georgewl1/status/1248190904659259398,False,https://twitter.com/DavidJHarrisJr/status/1248188908359151616,0,,san antonio,,,,,,[],,,,
1248177433687310337,1248103091355910146,2020-04-09 04:14:24 CDT,2020-04-09,04:14:24,-0500,38041417,realtormikedrew,Mike Drew 🤝🔑,,@thehoneybeaar I hear good things about attack on titan my bad I cresdhed out ☺️,en,[],[],[],0,0,0,[],[],https://twitter.com/Realtormikedrew/status/1248177433687310337,False,,0,,san antonio,,,,,,[],,,,
1248173164439502848,1248173025159233538,2020-04-09 03:57:26 CDT,2020-04-09,03:57:26,-0500,464105009,ineedmoretimeok,namesucks,,"Don't forget that you are our son Now go back to bed  We just know that you'll do well You won't come to harm  Death to all who stand in your way Wake, my dear",en,[],[],[],0,0,0,[],[],https://twitter.com/ineedmoretimeok/status/1248173164439502848,False,,0,,san antonio,,,,,,[],,,,
1248140688224440321,1247988919607664640,2020-04-09 01:48:24 CDT,2020-04-09,01:48:24,-0500,237915667,breopatra,this is for the niggas,,"@kaitlynpettis sis, you’re literally mixed with “a little bit of everything” 😂😂😂  you are the farthest thing from racist! &amp; I knew you well before UTSA days! they need to tf chill out!",en,[],[],[],1,0,1,[],[],https://twitter.com/breopatra/status/1248140688224440321,False,,0,,san antonio,,,,,,"[{'screen_name': 'kaitlynpettis', 'name': 'k8', 'id': '427784405'}]",,,,
