id,conversation_id,created_at,date,time,timezone,user_id,username,name,place,tweet,language,mentions,urls,photos,replies_count,retweets_count,likes_count,hashtags,cashtags,link,retweet,quote_url,video,thumbnail,near,geo,source,user_rt_id,user_rt,retweet_id,reply_to,retweet_date,translate,trans_src,trans_dest
1276303391535357958,1276303391535357958,2020-06-25 18:56:55 CDT,2020-06-25,18:56:55,-0500,563308687,kaysur_,frigid katy 🧊,,not leaving the house for 3 months made me forget how bad my pedestrian-equivalent road rage is,en,[],[],[],0,0,3,[],[],https://twitter.com/kaysur_/status/1276303391535357958,False,,0,,chicago,,,,,,[],,,,
1276302078865014784,1276302078865014784,2020-06-25 18:51:42 CDT,2020-06-25,18:51:42,-0500,26568182,artistrylikebam,Branden Melear,"{'type': 'Point', 'coordinates': [41.883222, -87.632496]}","Makeup on my muse, my partner in crime sparklewithmarii  Using @danessamyricks cover cream on the eyes and lips &amp; @coverfx natural radiance foundation on the skin #highlight is @narsissist orgasm loose powder Brows…  https://t.co/a00yQamYw7",en,"[{'screen_name': 'danessamyricks', 'name': 'danessa myricks', 'id': '104205316'}, {'screen_name': 'narsissist', 'name': '`', 'id': '1150124918463455233'}]",['https://www.instagram.com/p/CB4I2NxD981/?igshid=1m10ryzbbuib4'],[],0,0,0,['highlight'],[],https://twitter.com/artistrylikeBam/status/1276302078865014784,False,,0,,chicago,,,,,,[],,,,
1276302030567550977,1276297880068853766,2020-06-25 18:51:31 CDT,2020-06-25,18:51:31,-0500,260522898,windows95plus_,Windows95plus➐,,"Anyway its them racist white students and the groups that provide those old ""dixie"" incentives and privileges if you fall into their fold. And falling into the fold means HELLA DIFF THINGS DEPENDING ON WHO YOU ARE DOWN SOUTH. Its a fucked up form of corruption and shit.",en,[],[],[],0,0,0,[],[],https://twitter.com/windows95plus_/status/1276302030567550977,False,,0,,chicago,,,,,,[],,,,
1276299297907265541,1276241962820141061,2020-06-25 18:40:39 CDT,2020-06-25,18:40:39,-0500,2502717631,frankbednarz,Frank Bednarz 🇺🇸 🇺🇦,,"@raylehmann I don't know why D.C. statehood advocates attack Wyoming so frequently. Whenever I hear about the goat-to-persin ratio or whatever—or when folks cite resented federal control as an example of Wyoming's decedance (?)—well, I'm #TeamWyoming in that fight.",en,[],[],[],1,0,0,['teamwyoming'],[],https://twitter.com/FrankBednarz/status/1276299297907265541,False,,0,,chicago,,,,,,"[{'screen_name': 'raylehmann', 'name': 'R.J. Lehmann', 'id': '16215776'}]",,,,
1276298762755989506,1276298762755989506,2020-06-25 18:38:32 CDT,2020-06-25,18:38:32,-0500,1066128286194049025,rawneighbors,RAW - Resident Association of the Westside,,"“#Policing as the #solution to violence is just so tired. Hope we can find our way to turning police funds into #real community #investment quality jobs, healthcare, education, mental health services”  📸 Paul Goyette  #ThatPart #Tired #InvestSouthWest #AustinQualityOfLifePlan  https://t.co/XMpEAPDRFr",en,[],[],"['https://pbs.twimg.com/media/EbZS6O3XYAE7I1s.jpg', 'https://pbs.twimg.com/media/EbZS6PAXYAMGwU8.jpg', 'https://pbs.twimg.com/media/EbZS6PzXYAMcRem.jpg', 'https://pbs.twimg.com/media/EbZS6P4WoAAcpmp.jpg']",1,0,0,"['policing', 'solution', 'real', 'investment', 'thatpart', 'tired', 'investsouthwest', 'austinqualityoflifeplan']",[],https://twitter.com/RAWneighbors/status/1276298762755989506,False,,1,https://pbs.twimg.com/media/EbZS6O3XYAE7I1s.jpg,chicago,,,,,,[],,,,
1276297880068853766,1276297880068853766,2020-06-25 18:35:01 CDT,2020-06-25,18:35:01,-0500,260522898,windows95plus_,Windows95plus➐,,No one want to do it. I DO. I CLAIM THIS RACIST ASS DAUGHTER OF THE CONFEDERACY ASS WANNA BE ASS TRAITOR!  #NSU needs to address the fact that they do have some racist ass people in their administration.,en,[],[],[],1,0,0,['nsu'],[],https://twitter.com/windows95plus_/status/1276297880068853766,False,https://twitter.com/soledadobrien/status/1275617376390782977,0,,chicago,,,,,,[],,,,
1276294558251442177,1276294558251442177,2020-06-25 18:21:49 CDT,2020-06-25,18:21:49,-0500,797886046684008448,mario_arencibia,Mario Arencibia,,"I can’t believe that today we still deal with stupid fucking racism. I want one of you racist pricks to text me and tell me what it is you don’t like about black or brown have the balls to text me, and we’ll talk",en,[],[],[],0,0,0,[],[],https://twitter.com/mario_arencibia/status/1276294558251442177,False,,0,,chicago,,,,,,[],,,,
1276293370386812930,1276293370386812930,2020-06-25 18:17:06 CDT,2020-06-25,18:17:06,-0500,917496014,areelofonesown,Andrea Thompson,"{'type': 'Point', 'coordinates': [41.986732, -87.663395]}",Got home from work and was happy to find this happening! #nojusticenopeace #protest #chicago #blm #blacklivesmatter @ Edgewater  https://t.co/FVsX9xutOJ,en,[],['https://www.instagram.com/p/CB4E4_ZHLp1/?igshid=1xplaqo9bq2ar'],[],0,0,0,"['nojusticenopeace', 'protest', 'chicago', 'blm', 'blacklivesmatter']",[],https://twitter.com/areelofonesown/status/1276293370386812930,False,,0,,chicago,,,,,,[],,,,
1276292526752829440,1276292526752829440,2020-06-25 18:13:45 CDT,2020-06-25,18:13:45,-0500,3221755831,kimgrinerheinz,Kim Griner Heinz,"{'type': 'Point', 'coordinates': [41.88046793, -87.62614846]}","Ten years ago, if you wore a face mask, you were either a surgeon, a carpenter or a bank robber. 😂 But today in Chicago you can't tell who is what anymore. Everyone wears a mask everywhere.  It's a beautiful day in…  https://t.co/0JXsUmjip6",en,[],['https://www.instagram.com/p/CB4EgfSHnOW/?igshid=1cnd3pbpmpkr7'],[],0,0,1,[],[],https://twitter.com/KimGrinerHeinz/status/1276292526752829440,False,,0,,chicago,,,,,,[],,,,
1276289495172874240,1276261158006087680,2020-06-25 18:01:42 CDT,2020-06-25,18:01:42,-0500,54749712,callmekennyg,THUNDER GUN,,@jimspd @SteveKerr What do you call it when one person kills another that was no threat to them? 🤔,en,[],[],[],0,0,0,[],[],https://twitter.com/CallMeKennyG/status/1276289495172874240,False,,0,,chicago,,,,,,"[{'screen_name': 'jimspd', 'name': 'Jim Rutherford', 'id': '24785190'}, {'screen_name': 'SteveKerr', 'name': 'Steve Kerr', 'id': '27529312'}]",,,,
1276288976131850241,1276288976131850241,2020-06-25 17:59:38 CDT,2020-06-25,17:59:38,-0500,620599710,fionnameeks,Meeks,,"Why is it so hard for yall to wear a mask, mind your business, and not be racist?",en,[],[],[],0,4,16,[],[],https://twitter.com/FionnaMeeks/status/1276288976131850241,False,,0,,chicago,,,,,,[],,,,
1276287186007195650,1276280207750639617,2020-06-25 17:52:32 CDT,2020-06-25,17:52:32,-0500,2171186294,chicagomone,rory mone,,@ftbljosh Call it a protest! 😂,en,[],[],[],0,0,2,[],[],https://twitter.com/ChicagoMone/status/1276287186007195650,False,,0,,chicago,,,,,,"[{'screen_name': 'ftbljosh', 'name': 'Josh', 'id': '780371849389703168'}]",,,,
1276286085686050816,1276286085686050816,2020-06-25 17:48:09 CDT,2020-06-25,17:48:09,-0500,453653455,vicsan2012,Lamancha,,Ahora con la visita a Washington del #CacasnarcoObrador hay que enviarle a trump donde ordena soltar a ovidio y todos los tweet donde apoya al narco,es,[],[],[],0,0,0,['cacasnarcoobrador'],[],https://twitter.com/Vicsan2012/status/1276286085686050816,False,,0,,chicago,,,,,,[],,,,
1276285732848574465,1276008712000413696,2020-06-25 17:46:45 CDT,2020-06-25,17:46:45,-0500,3281182902,cait_elizab,@caitlynn.elizaa,,@tinaqueen_15 she sat there with her hands on her face like she was the victim 😂,en,[],[],[],0,0,1,[],[],https://twitter.com/cait_elizab/status/1276285732848574465,False,,0,,chicago,,,,,,"[{'screen_name': 'tinaqueen_15', 'name': 'Tina Turtle 🐢', 'id': '746730036699471872'}]",,,,
1276285029409308674,1276285029409308674,2020-06-25 17:43:57 CDT,2020-06-25,17:43:57,-0500,824920081423540225,vincentjuarez69,Planet Caravan,,"@TYTLive hey Cenk. If a suspected shopper/pedestrian is ""reaching for his gun"" but doesn't get it I didn't know that then gives the cops the right to summarily execute a shopper walking down the street.",en,[],[],[],0,0,0,[],[],https://twitter.com/VincentJuarez69/status/1276285029409308674,False,,0,,chicago,,,,,,[],,,,
1276284950942277632,1276284950942277632,2020-06-25 17:43:39 CDT,2020-06-25,17:43:39,-0500,47847824,illmaticones,Sunny Liston,,Besides being racist. YOU KARENS' ARE SOME DUMB MUTHA FUCKAS   Sacramento 'Karen' Punched in Face After Hurling N-Word at Woman  https://t.co/DLNYdL5ftC,en,[],['https://www.tmz.com/videos/062520-karen-n-word-4808611-0-0zrau1t0'],[],0,0,0,[],[],https://twitter.com/illmaticones/status/1276284950942277632,False,,0,,chicago,,,,,,[],,,,
1276284778568912897,1276284778568912897,2020-06-25 17:42:58 CDT,2020-06-25,17:42:58,-0500,585190513,helenabushong,@HelenaB'sCorner,,"So, it's ok for the Police to enforce the law to the point of death over a percieved crime? 'I DON't think so! #StopCopExceutions over bullshit!  #CopsareNOTMentalhealthcarepeople STOP the COP executions NOW! CopsdontneedReformtheyneedtransform",en,[],[],[],0,0,1,"['stopcopexceutions', 'copsarenotmentalhealthcarepeople']",[],https://twitter.com/HelenaBushong/status/1276284778568912897,False,,0,,chicago,,,,,,[],,,,
1276283733344235520,1276180872878854145,2020-06-25 17:38:48 CDT,2020-06-25,17:38:48,-0500,1132452978538024961,gregpapas3,Greg Papas,,@adslaughter1 @BreitbartNews I think this Black violent man hates his skin color. It's the reason they want to destroy anything White.,en,[],[],[],1,0,1,[],[],https://twitter.com/GregPapas3/status/1276283733344235520,False,,0,,chicago,,,,,,"[{'screen_name': 'adslaughter1', 'name': 'ADSlaughter', 'id': '3968940508'}, {'screen_name': 'BreitbartNews', 'name': 'Breitbart News', 'id': '457984599'}]",,,,
1276281068409233411,1275975774059876352,2020-06-25 17:28:13 CDT,2020-06-25,17:28:13,-0500,60764879,sosayskat,🇺🇦🇺🇦🇺🇦 end the war crimes,,"@marvelous_zach @shelleybeen @antipodesrex @OhNoSheTwitnt Jokes are bound to offend someone, especially if they are true.   And since you went there, I’ll take it one further.   Why is it that in an industry that is supposed to celebrate empowerment and change &amp; growth, that it runs rampant with  misogyny &amp; racism. Funny values to laud.",en,[],[],[],1,0,0,[],[],https://twitter.com/SoSaysKat/status/1276281068409233411,False,,0,,chicago,,,,,,"[{'screen_name': 'marvelous_zach', 'name': 'zach mcabee', 'id': '992226500102557696'}, {'screen_name': 'shelleybeen', 'name': 'shelleybeen', 'id': '16314435'}, {'screen_name': 'OhNoSheTwitnt', 'name': 'The Volatile Mermaid', 'id': '149249831'}]",,,,
1276280581752578050,1276280581752578050,2020-06-25 17:26:17 CDT,2020-06-25,17:26:17,-0500,1428719406,chicagocaps15,15th District – Austin,,"Today we promoted Positive Community Interaction to support all the families that have been impacted by gun violence with 15th District Commander Talley, Capt Hein and Caps. The 15th District DCOs, recruits, YDAC, Explores and Detectives. Summer Mobile, Area 4 Cart, Cook County  https://t.co/dLJ5MCq2nJ",en,[],[],"['https://pbs.twimg.com/media/EbZCX9eWsAAPf1e.jpg', 'https://pbs.twimg.com/media/EbZCY4ZXYAYEpLF.jpg', 'https://pbs.twimg.com/media/EbZCZxFWsAE3dNY.jpg', 'https://pbs.twimg.com/media/EbZCarXX0AIXu2Y.jpg']",1,3,14,[],[],https://twitter.com/ChicagoCAPS15/status/1276280581752578050,False,,1,https://pbs.twimg.com/media/EbZCX9eWsAAPf1e.jpg,chicago,,,,,,[],,,,
