id,conversation_id,created_at,date,time,timezone,user_id,username,name,place,tweet,language,mentions,urls,photos,replies_count,retweets_count,likes_count,hashtags,cashtags,link,retweet,quote_url,video,thumbnail,near,geo,source,user_rt_id,user_rt,retweet_id,reply_to,retweet_date,translate,trans_src,trans_dest
1279565530429612035,1279565530429612035,2020-07-04 18:59:30 CDT,2020-07-04,18:59:30,-0500,173694656,kevinmlevy,Kevin Levy,,Shout out to my cousin for tag teaming against grandma (R-NJ) who plans on buying a gun to protect herself when our town defunds/abolishes police and Its not safe to walk down the street because of Antifa or something.   My hometown is like 80% white and doesn’t have sidewalks.,en,[],[],[],0,0,2,[],[],https://twitter.com/KevinMLevy/status/1279565530429612035,False,,0,,philadelphia,,,,,,[],,,,
1279560262803247105,1279560262803247105,2020-07-04 18:38:34 CDT,2020-07-04,18:38:34,-0500,1081393930699182081,br1zzyy1,Briz From Da 4,,If that coochie get touched by another nigga i shall aim the gun &amp; pull the trigger,en,[],[],[],0,0,0,[],[],https://twitter.com/br1zzyy1/status/1279560262803247105,False,,0,,philadelphia,,,,,,[],,,,
1279556274078842883,1279556274078842883,2020-07-04 18:22:43 CDT,2020-07-04,18:22:43,-0500,321803872,thevirtuouslion,A S A D,,📸 Follow my on IG: @thevirtuouslion &amp; @virtuouslionprod for the most recent protest photos from the City of Brotherly Love ✊🏾  https://t.co/tOOKtnXdVp,en,"[{'screen_name': 'thevirtuouslion', 'name': 'a s a d', 'id': '321803872'}]",[],['https://pbs.twimg.com/media/EcHlpT8WAAAUmwX.jpg'],1,2,6,[],[],https://twitter.com/TheVirtuousLion/status/1279556274078842883,False,,1,https://pbs.twimg.com/media/EcHlpT8WAAAUmwX.jpg,philadelphia,,,,,,[],,,,
1279541294319185925,1279537074144673792,2020-07-04 17:23:11 CDT,2020-07-04,17:23:11,-0500,47500268,tagjim,Jim Taggart,,@wagssid Not gonna take this abuse much longer,en,[],[],[],0,0,0,[],[],https://twitter.com/tagjim/status/1279541294319185925,False,,0,,philadelphia,,,,,,"[{'screen_name': 'wagssid', 'name': 'James Wagner', 'id': '16724217'}]",,,,
1279538624233705473,1279538624233705473,2020-07-04 17:12:35 CDT,2020-07-04,17:12:35,-0500,45731216,marionleary,Marion Leary MSN MPH RN (she/her) 🏳️‍🌈,,"I can think of nothing more patriotic on this #July4th in #Philly than protesting @realDonaldTrump and his racist, hateful, incompetent administration. #phillyprotests #FourthofJuly #Resist  https://t.co/NPprfbyK8S",en,"[{'screen_name': 'realdonaldtrump', 'name': 'donald j. trump', 'id': '25073877'}]",[],['https://pbs.twimg.com/media/EcHVmBlX0AAejfC.jpg'],3,3,59,"['july4th', 'philly', 'phillyprotests', 'fourthofjuly', 'resist']",[],https://twitter.com/marionleary/status/1279538624233705473,False,,1,https://pbs.twimg.com/media/EcHVmBlX0AAejfC.jpg,philadelphia,,,,,,[],,,,
1279538385993060357,1278411587796127745,2020-07-04 17:11:38 CDT,2020-07-04,17:11:38,-0500,1104135917898485761,foxsss9,PeaceDot Sports,"{'type': 'Point', 'coordinates': [39.90990991, -74.90925654]}",@BenSimmonsGoat1   #bensimmons is the only player with #LeBron skillset minus shooting.  just be a decent shooter everything changes for Philly.  Until he is as good a shot as E.Snow 😄 def. Will not play honest in playoffs   https://t.co/dqmmsn9agb #Sixers  https://t.co/icqmG3qNfn,en,[],['https://philly-what.com/2019/10/24/what-ben-simmons-is-shooting-for'],['https://pbs.twimg.com/media/EcHVYXxXYAAGLc4.jpg'],0,0,0,"['bensimmons', 'lebron', 'sixers']",[],https://twitter.com/Foxsss9/status/1279538385993060357,False,,1,https://pbs.twimg.com/media/EcHVYXxXYAAGLc4.jpg,philadelphia,,,,,,[],,,,
1279535858106937346,1279500750167724038,2020-07-04 17:01:35 CDT,2020-07-04,17:01:35,-0500,2171245065,1tiananashay_,T.N💎,,@luxcolee Murder house,en,[],[],[],0,0,0,[],[],https://twitter.com/1tiananashay_/status/1279535858106937346,False,,0,,philadelphia,,,,,,"[{'screen_name': 'luxcolee', 'name': '🦂', 'id': '2864272363'}]",,,,
1279534822877257728,1279395990844260352,2020-07-04 16:57:29 CDT,2020-07-04,16:57:29,-0500,19042345,toddcohenspeaks,Inspiring Global Audiences to Feel Fantastic,,@alanlittle5 @scottiebateman @jtwpilot @sgiordano77 Interesting question. They got progressively more unbelievable. Although that airport with Heston was pretty good.  I mean the way it was portrayed it actually could happen. Guy has a heart attack flying a beach looks like a B 58 goes off course it’s the cockpit of a 747,en,[],[],[],0,0,1,[],[],https://twitter.com/toddcohenspeaks/status/1279534822877257728,False,,0,,philadelphia,,,,,,"[{'screen_name': 'alanlittle5', 'name': 'alan little', 'id': '457806010'}, {'screen_name': 'scottiebateman', 'name': 'Scott Bateman MBE 💙', 'id': '777449463656902656'}, {'screen_name': 'jtwpilot', 'name': 'JTW Pilot Channel ✈️', 'id': '2359348229'}]",,,,
1279533444599595009,1279533444599595009,2020-07-04 16:52:00 CDT,2020-07-04,16:52:00,-0500,833899008405995520,littrebecca,Becca Litt,,"I was walking around Philly, feeling a little lonely in a new city when I suddenly  heard protest chants and ran into two of the best people I know and I realized maybe I can call this place home.  https://t.co/sQEJAzwMu0",en,[],[],['https://pbs.twimg.com/media/EcHQ4b2WAAYVXdB.jpg'],4,1,44,[],[],https://twitter.com/LittRebecca/status/1279533444599595009,False,,1,https://pbs.twimg.com/media/EcHQ4b2WAAYVXdB.jpg,philadelphia,,,,,,[],,,,
1279528897953116160,1279528897953116160,2020-07-04 16:33:56 CDT,2020-07-04,16:33:56,-0500,177041360,pastorbusta,Edward Busta Fields,,Ballon release  Willing worshipers night  Food giveaway  Children’s protest  Sunday Best Filming  Sunday morning service  Homegoing celebration.....  God has been gracious,en,[],[],[],0,0,0,[],[],https://twitter.com/PastorBusta/status/1279528897953116160,False,,0,,philadelphia,,,,,,[],,,,
1279528330384019460,1278025941713686534,2020-07-04 16:31:41 CDT,2020-07-04,16:31:41,-0500,179428862,yellowduck1958,peter tsichlis,,"@Rulo123 @KimStrassel Better than a lier, white supremacist and Racist!  BLACK LIVES MATTER! Vote DEMOCRATIC!",en,[],[],[],0,0,0,[],[],https://twitter.com/yellowduck1958/status/1279528330384019460,False,,0,,philadelphia,,,,,,"[{'screen_name': 'Rulo123', 'name': 'Phillip Ruland', 'id': '42736819'}, {'screen_name': 'KimStrassel', 'name': 'Kimberley Strassel', 'id': '384910109'}]",,,,
1279526889418379264,1279510068606701568,2020-07-04 16:25:57 CDT,2020-07-04,16:25:57,-0500,179428862,yellowduck1958,peter tsichlis,,@realDonaldTrump White supremacist and Racist!  BLACK LIVES MATTER!  Vote DEMOCRATIC!  https://t.co/1VBaMO6z90,en,[],[],['https://pbs.twimg.com/tweet_video_thumb/EcHK6qtWsAA6dgc.jpg'],0,0,0,[],[],https://twitter.com/yellowduck1958/status/1279526889418379264,False,,1,https://pbs.twimg.com/tweet_video_thumb/EcHK6qtWsAA6dgc.jpg,philadelphia,,,,,,"[{'screen_name': 'realDonaldTrump', 'name': 'Donald J. Trump', 'id': '25073877'}]",,,,
1279516663520559105,1279516663520559105,2020-07-04 15:45:19 CDT,2020-07-04,15:45:19,-0500,250751320,vellastrations,Vinny Vella,,"Roberto Thornton organized Saturday’s protest with the Black Trans Assembly for Abolition.   He said the event was prompted by recent violence against trans women and the lack of outrage that he saw.   “We’re going to project our voices until our demands are heard,” he said.",en,[],[],[],0,0,2,[],[],https://twitter.com/Vellastrations/status/1279516663520559105,False,,0,,philadelphia,,,,,,[],,,,
1279514894044405765,1279504332312936448,2020-07-04 15:38:17 CDT,2020-07-04,15:38:17,-0500,108416118,phillyparttwo,Michael MPH 🇺🇸 ✌🏼,,"@WaltsWorld1971 @BuzzFeed Also, people shouldn't purposely drive their cars into people. Don't victim-blame.",en,[],[],[],3,0,1,[],[],https://twitter.com/PhillyPartTwo/status/1279514894044405765,False,,0,,philadelphia,,,,,,"[{'screen_name': 'WaltsWorld1971', 'name': 'Disneyfan714', 'id': '4705265191'}, {'screen_name': 'BuzzFeed', 'name': 'BuzzFeed', 'id': '5695632'}]",,,,
1279514613546188800,1279504332312936448,2020-07-04 15:37:10 CDT,2020-07-04,15:37:10,-0500,108416118,phillyparttwo,Michael MPH 🇺🇸 ✌🏼,,@BuzzFeed This is a lot of victim-blaming.  https://t.co/TRBrQlIi1P,en,[],[],['https://pbs.twimg.com/media/EcG_wmJX0Ag4nFh.jpg'],1,0,2,[],[],https://twitter.com/PhillyPartTwo/status/1279514613546188800,False,,1,https://pbs.twimg.com/media/EcG_wmJX0Ag4nFh.jpg,philadelphia,,,,,,"[{'screen_name': 'BuzzFeed', 'name': 'BuzzFeed', 'id': '5695632'}]",,,,
1279514242190884865,1279514242190884865,2020-07-04 15:35:42 CDT,2020-07-04,15:35:42,-0500,108416118,phillyparttwo,Michael MPH 🇺🇸 ✌🏼,,This is a lot of victim-blaming.  https://t.co/DtjSkNC1dh,en,[],[],['https://pbs.twimg.com/media/EcG_a7aWsAAn1HL.jpg'],0,0,1,[],[],https://twitter.com/PhillyPartTwo/status/1279514242190884865,False,,1,https://pbs.twimg.com/media/EcG_a7aWsAAn1HL.jpg,philadelphia,,,,,,[],,,,
1279512309799555078,1279512309799555078,2020-07-04 15:28:01 CDT,2020-07-04,15:28:01,-0500,1166471949431820288,fearofpieces,Céline Meenion 𓃰 🕋,,"One thing we gotta stop saying is ""niggas with money can get any woman they want so there's no reason for them to rape someone"" cause money and the power it gives them feeds the ego of these creepy ass niggas.",en,[],[],[],1,0,2,[],[],https://twitter.com/FearOfPieces/status/1279512309799555078,False,,0,,philadelphia,,,,,,[],,,,
1279510342406516736,1279510342406516736,2020-07-04 15:20:12 CDT,2020-07-04,15:20:12,-0500,15956584,jasonsalus,Jason Salus,,Fortunate to spend this July 4th at the #BlackLivesMatter protest organized by our @PWHS_CSD students.  https://t.co/hpkRR2jG5j,en,"[{'screen_name': 'pwhs_csd', 'name': 'pw high school', 'id': '2794894009'}]",[],['https://pbs.twimg.com/media/EcG73ubWkAE3eLH.jpg'],0,0,2,['blacklivesmatter'],[],https://twitter.com/JasonSalus/status/1279510342406516736,False,,1,https://pbs.twimg.com/media/EcG73ubWkAE3eLH.jpg,philadelphia,,,,,,[],,,,
1279510016018579457,1279404408636399616,2020-07-04 15:18:54 CDT,2020-07-04,15:18:54,-0500,3245477251,joeblaszczyk,Joseph Blaszczyk,,@KatMart502 @theangiestanton Would you be in favor of defending Planned Parenthood as they murder hundreds of thousands of black babies annually?,en,[],[],[],1,0,0,[],[],https://twitter.com/JoeBlaszczyk/status/1279510016018579457,False,,0,,philadelphia,,,,,,"[{'screen_name': 'KatMart502', 'name': 'Katherine Martin', 'id': '126608005'}, {'screen_name': 'theangiestanton', 'name': 'Angela Stanton King 🇺🇸', 'id': '332590264'}]",,,,
1279509763617968129,1279509763617968129,2020-07-04 15:17:54 CDT,2020-07-04,15:17:54,-0500,250751320,vellastrations,Vinny Vella,,"The impromptu rally that has stopped at 6th and Chesntut has focused on trans rights. Speakers have spoken out against violence toward trans men and women, and called for equality. The event seems to be winding down.  https://t.co/bDVsWhF0zM",en,[],[],['https://pbs.twimg.com/media/EcG7WGOWsAArhcs.jpg'],1,0,1,[],[],https://twitter.com/Vellastrations/status/1279509763617968129,False,,1,https://pbs.twimg.com/media/EcG7WGOWsAArhcs.jpg,philadelphia,,,,,,[],,,,
1279509268551675904,1279509268551675904,2020-07-04 15:15:56 CDT,2020-07-04,15:15:56,-0500,29143696,ms_espn87,Sierra Teresa,,My bf said I'm racist bc I don't like porn with white ppl😂😂😂😂   Pale genitals really creep me out,en,[],[],[],1,0,0,[],[],https://twitter.com/Ms_ESPN87/status/1279509268551675904,False,,0,,philadelphia,,,,,,[],,,,
1279507599986176000,1279437111058456577,2020-07-04 15:09:18 CDT,2020-07-04,15:09:18,-0500,16379909,bhanjawn,BhanJawn🇺🇦,,"@Lappos @justaghost____ Yup, guess this stunt isn’t going to plan 😂😂 Wonder if that lawyer is just a friend of hers, doing her a free favor? So this could be a money making as well as a racist grift. Still, she could lose her law license. As I told the target of her ire, my dad is a CPA, certified in",en,[],[],[],1,0,2,[],[],https://twitter.com/BhanJawn/status/1279507599986176000,False,,0,,philadelphia,,,,,,"[{'screen_name': 'Lappos', 'name': 'Cheese 4UR Whine', 'id': '47466910'}, {'screen_name': 'justaghost____', 'name': 'GHOST', 'id': '1459843433527394307'}]",,,,
1279504081317433345,1279503469796302850,2020-07-04 14:55:19 CDT,2020-07-04,14:55:19,-0500,250751320,vellastrations,Vinny Vella,,Seems that the trans rights protest that was happening at front and chestnut has joined with the larger city hall protest.,en,[],[],[],0,0,1,[],[],https://twitter.com/Vellastrations/status/1279504081317433345,False,,0,,philadelphia,,,,,,[],,,,
1279503469796302850,1279503469796302850,2020-07-04 14:52:53 CDT,2020-07-04,14:52:53,-0500,250751320,vellastrations,Vinny Vella,,"The protest has left city hall and is marching east on chestnut. They’ve stopped at 6th and chestnut, across from the liberty bell.  https://t.co/POa4RX9t2v",en,[],[],['https://pbs.twimg.com/media/EcG1nyKWAAAs8j9.jpg'],1,0,1,[],[],https://twitter.com/Vellastrations/status/1279503469796302850,False,,1,https://pbs.twimg.com/media/EcG1nyKWAAAs8j9.jpg,philadelphia,,,,,,[],,,,
1279498429228617729,1279498429228617729,2020-07-04 14:32:52 CDT,2020-07-04,14:32:52,-0500,1166471949431820288,fearofpieces,Céline Meenion 𓃰 🕋,,Looks violent,en,[],[],[],0,0,0,[],[],https://twitter.com/FearOfPieces/status/1279498429228617729,False,https://twitter.com/CornellGunter/status/1279497568519626752,0,,philadelphia,,,,,,[],,,,
1279496725284171776,1279496725284171776,2020-07-04 14:26:05 CDT,2020-07-04,14:26:05,-0500,176904003,gradioactive4,🥷🏾Gregory☢️Van Loan🐢,,Top Gun FTW!!! Happy birthday @TomCruise 😎,en,"[{'screen_name': 'tomcruise', 'name': 'tom cruise', 'id': '48410093'}]",[],[],0,0,0,[],[],https://twitter.com/gradioactive4/status/1279496725284171776,False,https://twitter.com/IMDb/status/1278991740859486209,0,,philadelphia,,,,,,[],,,,
1279494158374318080,1279476576288112643,2020-07-04 14:15:53 CDT,2020-07-04,14:15:53,-0500,794919487,donnamenn,DKellyN,,"@samstein @realDonaldTrump is now on his racist whistle stop tour saying FU to anyone who is no white. It started with Tulsa then Mount Rushmore, what is next perhaps Vieques in PR?, Japanese interment camps, Stonewall,  so@many communities to desecrate so little time",en,[],[],[],0,0,0,[],[],https://twitter.com/DonnaMEnn/status/1279494158374318080,False,,0,,philadelphia,,,,,,"[{'screen_name': 'samstein', 'name': 'Sam Stein', 'id': '15463671'}]",,,,
1279493513499967488,1279476576288112643,2020-07-04 14:13:20 CDT,2020-07-04,14:13:20,-0500,794919487,donnamenn,DKellyN,,@samstein @realDonaldTrump is yelling at the top of his lungs...I am a racist.  I embrace racism and all of its followers.  It seems louder than before,en,[],[],[],2,0,13,[],[],https://twitter.com/DonnaMEnn/status/1279493513499967488,False,,0,,philadelphia,,,,,,"[{'screen_name': 'samstein', 'name': 'Sam Stein', 'id': '15463671'}]",,,,
1279492036777959424,1279492036777959424,2020-07-04 14:07:28 CDT,2020-07-04,14:07:28,-0500,1483667844,billtruthfinder,Bill Fleisher,,"Synaptic Disconnection  is the only possible explanation.  Oh yes, one more, racist SOBs.",en,[],[],[],0,0,0,[],[],https://twitter.com/BillTruthfinder/status/1279492036777959424,False,https://twitter.com/RickFreedland/status/1279457021394325505,0,,philadelphia,,,,,,[],,,,
1279490266404184067,1279490266404184067,2020-07-04 14:00:25 CDT,2020-07-04,14:00:25,-0500,755968044,_viiixvi,❤️,,i need to relieve some stress &amp; pent up anger.,en,[],[],[],0,0,0,[],[],https://twitter.com/_VIIIXVI/status/1279490266404184067,False,,0,,philadelphia,,,,,,[],,,,
1279482993204178947,1279482993204178947,2020-07-04 13:31:31 CDT,2020-07-04,13:31:31,-0500,28219150,boonenotboom,Antonio,,#RIGHTNOW Protest  Police Terror March  https://t.co/JEA36urDmx,en,[],[],"['https://pbs.twimg.com/media/EcGi9vhXkAM9vFl.jpg', 'https://pbs.twimg.com/media/EcGi-YeWsAQSpCY.jpg', 'https://pbs.twimg.com/media/EcGi_HUWAAIPxMj.jpg', 'https://pbs.twimg.com/media/EcGi_oxWAAIjy-b.jpg']",0,0,2,['rightnow'],[],https://twitter.com/BooneNotBoom/status/1279482993204178947,False,,1,https://pbs.twimg.com/media/EcGi9vhXkAM9vFl.jpg,philadelphia,,,,,,[],,,,
1279482408052588546,1279471909906702336,2020-07-04 13:29:12 CDT,2020-07-04,13:29:12,-0500,1788321,covercash,𝕔𝕙𝕣𝕚𝕤 𝕠𝕧𝕖𝕣𝕔𝕒𝕤𝕙,,@elonmusk Does taunting the SEC count as harassment? 😂,en,[],[],[],0,0,0,[],[],https://twitter.com/covercash/status/1279482408052588546,False,,0,,philadelphia,,,,,,"[{'screen_name': 'elonmusk', 'name': 'Elon Musk', 'id': '44196397'}]",,,,
1279471473447645186,1279471473447645186,2020-07-04 12:45:45 CDT,2020-07-04,12:45:45,-0500,67498723,tryinghard1234,Lost,,"Yes, it's about time. Stop thinking &amp; do.  If it was 1 regular citizen you would have arrest warrants for us, came after us &amp; arrested us. No one is above the law. Now it's time to prove it. Show America we are a country of law &amp; order. Not all AMERICANS are corrput. Biden 4 Prez",en,[],[],[],0,0,0,[],[],https://twitter.com/tryinghard1234/status/1279471473447645186,False,https://twitter.com/bmangh/status/1279427286383628290,0,,philadelphia,,,,,,[],,,,
1279469829678923778,1279469829678923778,2020-07-04 12:39:13 CDT,2020-07-04,12:39:13,-0500,67208831,jravishing,Jose L Ramirez,,"Army identifies suspect in Vanessa Guillen’s disappearance, who committed suicide before arrest  https://t.co/amW6k4RySm",en,[],['https://www.nydailynews.com/news/national/ny-army-identified-suspect-in-vanessa-guillens-disappearance-20200702-p5wmixpa75dyxda7lacgpcpl4i-story.html'],[],0,0,0,[],[],https://twitter.com/jravishing/status/1279469829678923778,False,,0,,philadelphia,,,,,,[],,,,
1279468838346784770,1279459344719855622,2020-07-04 12:35:17 CDT,2020-07-04,12:35:17,-0500,93133013,_tayholder,The people's Champ♿️,,@SylvesterAni2 @ShannonSharpe If you could do me solid and sign this petition? A law was passed to make sure people that commit the same crime my brother did don’t get the same amount of time as him but now we’re working toward getting the bill retroactive  https://t.co/WCthlZQBFd,en,[],['https://twitter.com/_tayholder/status/1146389252856524800?s=21'],[],0,0,0,[],[],https://twitter.com/_TayHolder/status/1279468838346784770,False,https://twitter.com/_TayHolder/status/1146389252856524800,0,,philadelphia,,,,,,"[{'screen_name': 'ShannonSharpe', 'name': 'shannon sharpe', 'id': '371539066'}]",,,,
1279467191356862464,1279448717796532224,2020-07-04 12:28:44 CDT,2020-07-04,12:28:44,-0500,2984679029,ur_ninja,Unicorn Riot,,"Speaker at rally outside Philly city hall says the white supremacist history of American policing necessitates police abolition, says it’s a moral duty to work to free political prisoners  https://t.co/gI9UkYPvnm",en,[],[],[],4,83,194,[],[],https://twitter.com/UR_Ninja/status/1279467191356862464,False,,1,https://pbs.twimg.com/ext_tw_video_thumb/1279466988717387779/pu/img/AHgqsuHTjbpu3F_S.jpg,philadelphia,,,,,,[],,,,
1279465955425484801,1279249124781707266,2020-07-04 12:23:49 CDT,2020-07-04,12:23:49,-0500,2531590110,ezaketz,Big Pizza 🍕,,@ShovelingYou @flyingkatara @buzzcutsngravy @amyewalter Yes because there’s no incest or slavery or child marriage or “just murder” in the judeochristian Bible.,en,[],[],[],1,0,0,[],[],https://twitter.com/EZaketz/status/1279465955425484801,False,,0,,philadelphia,,,,,,"[{'screen_name': 'ShovelingYou', 'name': 'Geoff “TallNuts” Axworthy', 'id': '1173421205207957505'}, {'screen_name': 'flyingkatara', 'name': 'lui ☽︎☾︎', 'id': '1221586768249655296'}, {'screen_name': 'amyewalter', 'name': 'Amy Walter', 'id': '50073507'}]",,,,
1279465837561286657,1279465837561286657,2020-07-04 12:23:21 CDT,2020-07-04,12:23:21,-0500,1041117870,itsraining_jen,jenny,,"those happy that the cops who murdered Elijah Mcclain got fired, keep in mind that it wasn’t for his murder but a picture they took reenacting how they killed him 🙃 that is not justice #NoJusticeNoPeace #chargethem",en,[],[],[],0,1,5,"['nojusticenopeace', 'chargethem']",[],https://twitter.com/itsraining_JEN/status/1279465837561286657,False,,0,,philadelphia,,,,,,[],,,,
1279464101022961664,1279464101022961664,2020-07-04 12:16:27 CDT,2020-07-04,12:16:27,-0500,118157135,marchalem1995,The Month Of MarcH-alem,,"We should treat 4th of July this year like how we all treat that racist uncle at thanksgiving.  Say Hi, stay for the food, and when things get heated just like, subtly tell your country I MEAN Uncle to fuck off",en,[],[],[],0,0,0,[],[],https://twitter.com/marchalem1995/status/1279464101022961664,False,,0,,philadelphia,,,,,,[],,,,
1279463465950871552,1279451261709037569,2020-07-04 12:13:56 CDT,2020-07-04,12:13:56,-0500,708644198338039808,michaelgorham7,ike,,@FOX29philly Ok if they can gather to protest. Why can't they have the r of July fire work show. It makes no sense,en,[],[],[],0,0,1,[],[],https://twitter.com/MichaelGorham7/status/1279463465950871552,False,,0,,philadelphia,,,,,,"[{'screen_name': 'FOX29philly', 'name': 'FOX 29', 'id': '14787713'}]",,,,
1279461290486923265,1279461290486923265,2020-07-04 12:05:17 CDT,2020-07-04,12:05:17,-0500,118157135,marchalem1995,The Month Of MarcH-alem,,The good thing about the R-ds--ns changing their name is now we'll all get to know what percentage of those fans are good people and which ones are racist aholes!,en,[],[],[],0,0,0,[],[],https://twitter.com/marchalem1995/status/1279461290486923265,False,,0,,philadelphia,,,,,,[],,,,
1279460752399773697,1279460752399773697,2020-07-04 12:03:09 CDT,2020-07-04,12:03:09,-0500,67498723,tryinghard1234,Lost,," https://t.co/snBEkYoaBH  Trp promots division,incites violence,criminal,liar,crook, evil, sociopath, egotistical, pathetic, raciest, hypocrite,manipulator  Biden promotes hope, unity, compassion, empathy, diplomacy, respect, honesty, love, educated, inclusive, every life matter.",en,[],['https://www.aol.com/article/news/2020/07/04/maskless-trump-pushes-racial-division-in-speech-at-rushmore/24545266/'],[],0,1,3,[],[],https://twitter.com/tryinghard1234/status/1279460752399773697,False,,0,,philadelphia,,,,,,[],,,,
1279459943171620866,1279432888048594944,2020-07-04 11:59:56 CDT,2020-07-04,11:59:56,-0500,2531590110,ezaketz,Big Pizza 🍕,,"@outseide @MWMom123 @dampscribbler @zeynep My point wasn’t to challenge yours but to ask you to better illustrate it. You can tell us something is racist or you can show us. This is much clearer (and I agree with it), thank you.",en,[],[],[],1,0,4,[],[],https://twitter.com/EZaketz/status/1279459943171620866,False,,0,,philadelphia,,,,,,"[{'screen_name': 'outseide', 'name': 'Jill S.', 'id': '143694663'}, {'screen_name': 'MWMom123', 'name': 'Tee 💉💉💉🇺🇦🌻', 'id': '919982467'}, {'screen_name': 'dampscribbler', 'name': 'Dampscribbler', 'id': '18261310'}, {'screen_name': 'zeynep', 'name': 'zeynep tufekci', 'id': '65375759'}]",,,,
1279459493370265601,1279398711278305280,2020-07-04 11:58:09 CDT,2020-07-04,11:58:09,-0500,621964287,ppdchapfrank,Minister Frank,,@NatPoliceAssoc @ToledoPolice 14th Philadelphia Police Chaplains stand in prayer and Love for family friends and Department. We are saddened and sorry for his passing. An assault on 1LEO is an assault on ALL LAW ABIDING CITIZENS,en,[],[],[],0,0,2,[],[],https://twitter.com/PPDChapFrank/status/1279459493370265601,False,,0,,philadelphia,,,,,,"[{'screen_name': 'NatPoliceAssoc', 'name': 'National Police Association', 'id': '214924095'}, {'screen_name': 'ToledoPolice', 'name': 'Toledo Police', 'id': '73426269'}]",,,,
1279458936685551617,1279458936685551617,2020-07-04 11:55:56 CDT,2020-07-04,11:55:56,-0500,250751320,vellastrations,Vinny Vella,,"A pro life counter protest has arrived, trying to compete with the MOVE members as they speak.",en,[],[],[],0,2,0,[],[],https://twitter.com/Vellastrations/status/1279458936685551617,False,,0,,philadelphia,,,,,,[],,,,
1279457046073610240,1279457046073610240,2020-07-04 11:48:25 CDT,2020-07-04,11:48:25,-0500,1788321,covercash,𝕔𝕙𝕣𝕚𝕤 𝕠𝕧𝕖𝕣𝕔𝕒𝕤𝕙,,💡 one last season of Dexter where he kills all of the “bad apples” who got away with murder. It would redeem that shit ending.,en,[],[],[],0,0,0,[],[],https://twitter.com/covercash/status/1279457046073610240,False,,0,,philadelphia,,,,,,[],,,,
1279452269638045698,1279452269638045698,2020-07-04 11:29:26 CDT,2020-07-04,11:29:26,-0500,2303838683,sniperxbae,Who I Smoke ?,,definitely bringing my Nerf gun out 😭,en,[],[],[],0,0,1,[],[],https://twitter.com/SniperxBae/status/1279452269638045698,False,,0,,philadelphia,,,,,,[],,,,
1279451940242493443,1279451940242493443,2020-07-04 11:28:08 CDT,2020-07-04,11:28:08,-0500,1947567362,coacholaso,Coach Olaso,"{'type': 'Point', 'coordinates': [39.9489557, -75.1497758]}","🗽 How would they feel? 🗽 That their country is in such danger now? 🗽  🇺🇲 United States Declaration Of Independence 🇺🇲Created in June and July then Ratified on July 4, 1776 🇺🇲 Authored by Thomas Jefferson, John Adams,…  https://t.co/g5YSBBECvK",en,[],['https://www.instagram.com/p/CCOhPYChL-V/?igshid=pf0sxvw36l70'],[],0,0,0,[],[],https://twitter.com/CoachOlaso/status/1279451940242493443,False,,0,,philadelphia,,,,,,[],,,,
1279449603717414915,1279260142635233280,2020-07-04 11:18:51 CDT,2020-07-04,11:18:51,-0500,179428862,yellowduck1958,peter tsichlis,,@WhiteHouse Except for TRUMP'S WHITE SUPREMACIST AND RACIST GROUPS! BLACK LIVES MATTER! VOTE DEMOCRATIC!,en,[],[],[],0,0,0,[],[],https://twitter.com/yellowduck1958/status/1279449603717414915,False,,0,,philadelphia,,,,,,"[{'screen_name': 'WhiteHouse', 'name': 'The White House', 'id': '1323730225067339784'}]",,,,
1279448193881825280,1279448193881825280,2020-07-04 11:13:15 CDT,2020-07-04,11:13:15,-0500,40040533,djweirdnasty_,Ayo Weird,,People always misconstrue me telling my side of the story for playing the victim.,en,[],[],[],0,0,0,[],[],https://twitter.com/Djweirdnasty_/status/1279448193881825280,False,,0,,philadelphia,,,,,,[],,,,
