id,conversation_id,created_at,date,time,timezone,user_id,username,name,place,tweet,language,mentions,urls,photos,replies_count,retweets_count,likes_count,hashtags,cashtags,link,retweet,quote_url,video,thumbnail,near,geo,source,user_rt_id,user_rt,retweet_id,reply_to,retweet_date,translate,trans_src,trans_dest
1276303465833050114,1276303465833050114,2020-06-25 18:57:13 CDT,2020-06-25,18:57:13,-0500,3040373492,2k1flores,KB #24,,Can’t wait to see the 49ers kick sum ass here! #Niners,en,[],[],[],0,0,0,['niners'],[],https://twitter.com/2k1Flores/status/1276303465833050114,False,https://twitter.com/SoFiStadium/status/1276245740126232576,0,,los angeles,,,,,,[],,,,
1276303289668100096,1276303289668100096,2020-06-25 18:56:31 CDT,2020-06-25,18:56:31,-0500,55343577,mrcauseffect,Wheels Up 🛫,,How can dead people get one and I still can’t 🤦🏾‍♂️,en,[],[],[],0,0,0,[],[],https://twitter.com/MrCausEffect/status/1276303289668100096,False,https://twitter.com/CNBC/status/1276170580551753728,0,,los angeles,,,,,,[],,,,
1276303112903380992,1276303112903380992,2020-06-25 18:55:49 CDT,2020-06-25,18:55:49,-0500,43449778,dennydenn,Dennys Ilic,,It is staggeringly beyond my ability to understand why Trump &amp; his acolytes have not been dragged out of the Whitehouse in shackles for the misery &amp; death they are directly responsible for  Yet we just continue to sit back and watch the racist circus unfold and the bodycount rise,en,[],[],[],1,1,11,[],[],https://twitter.com/Dennydenn/status/1276303112903380992,False,,0,,los angeles,,,,,,[],,,,
1276302142924419073,1276302142924419073,2020-06-25 18:51:58 CDT,2020-06-25,18:51:58,-0500,1001835050889957376,lisacreed10,Lisa Creed,,Didn’t want u to kick the bucket BEFORE ya voted🤣🤣👩‍🎤👩‍🎤,en,[],[],[],1,0,1,[],[],https://twitter.com/LisaCreed10/status/1276302142924419073,False,https://twitter.com/link_dennis7467/status/1276301762912288770,0,,los angeles,,,,,,[],,,,
1276301842838740993,1276301842838740993,2020-06-25 18:50:46 CDT,2020-06-25,18:50:46,-0500,2746227842,yunglifter,RalphWitDaCrocs,,@Riiisssaaa and @40oztosam are trying to demonstrate someone is always listening!  They’re asking 2 people each to repost (not retweet)  #Suicide Awareness 1-800-273-8255,en,"[{'screen_name': '40oztosam', 'name': '🎱', 'id': '608608331'}]",[],[],0,0,0,['suicide'],[],https://twitter.com/yunglifter/status/1276301842838740993,False,,0,,los angeles,,,,,,[],,,,
1276301500688420866,1276301500688420866,2020-06-25 18:49:24 CDT,2020-06-25,18:49:24,-0500,27082147,collsmitty,colleen,,"Just when u thought 2020 couldn’t get any worse. @Jenna_Marbles you’ve been a bright spot in so many dark times..u literally helped me laugh thru cancer. You’ve grown so much since your old videos, addressed it plenty of times, &amp; it hurts to see u hurt. Take all the time u need.",en,"[{'screen_name': 'jenna_marbles', 'name': 'jenna 📁📂marbles', 'id': '66699013'}]",[],[],1,0,0,[],[],https://twitter.com/collsmitty/status/1276301500688420866,False,,0,,los angeles,,,,,,[],,,,
1276301431520329729,1276301431520329729,2020-06-25 18:49:08 CDT,2020-06-25,18:49:08,-0500,2511199994,ccmclaro,Kura Abella,"{'type': 'Point', 'coordinates': [34.22140717, -118.44202072]}",[Left-Handed] Deba Knife. Hideo Kitaoka Blue Steel No. 2 Damascus 180mm w/ Shitan Handle. All thanks to @seisukeknife  seisukeknife_kappabashi for the excellent and very fast shipping. All the way from…  https://t.co/8E1VD0Oprf,en,"[{'screen_name': 'seisukeknife', 'name': 'seisuke knife', 'id': '787172656848044032'}]",['https://www.instagram.com/p/CB4IjRTJHXv/?igshid=dtn5v91sm5zv'],[],0,0,0,[],[],https://twitter.com/ccmclaro/status/1276301431520329729,False,,0,,los angeles,,,,,,[],,,,
1276298782842347520,1276298782842347520,2020-06-25 18:38:36 CDT,2020-06-25,18:38:36,-0500,1001835050889957376,lisacreed10,Lisa Creed,,"Theory: scrotus is sacrificing the most vociferous, reality- intelligence-challenged magats to Covid19 in a desperate last ditch attempt to win Nov3; a lot will be sick or dead by then,( no masks at scrotus’ urging) but his 100% voting magats will still be a  strong 35% of voters",en,[],[],[],1,0,0,[],[],https://twitter.com/LisaCreed10/status/1276298782842347520,False,,0,,los angeles,,,,,,[],,,,
1276298545226608640,1276123002212581378,2020-06-25 18:37:40 CDT,2020-06-25,18:37:40,-0500,1561999536,skaared4life,Jena,,@MsDBZbabe @NianticHelp Ow! I felt that screen record so hard it physically hurt. It’s been almost 3 months for me now. I’ve read posts from people who have been locked even longer. They don’t care. It’s the only thing I can figure. Their devs are preventing them from making money. Nice business model.,en,[],[],[],0,0,0,[],[],https://twitter.com/Skaared4Life/status/1276298545226608640,False,,0,,los angeles,,,,,,"[{'screen_name': 'MsDBZbabe', 'name': '✨Maria✨', 'id': '35340690'}, {'screen_name': 'NianticHelp', 'name': 'Niantic Support', 'id': '849344094681870336'}]",,,,
1276298269883109376,1276298269883109376,2020-06-25 18:36:34 CDT,2020-06-25,18:36:34,-0500,2264167177,iseedre,dopeLINES_Forty,"{'type': 'Point', 'coordinates': [34.0564, -118.2445]}","#fakewoke @realdlhughley #crybaby #soft #victim #Biden #trump #2020 @ Los Angeles, California  https://t.co/OkOOGI3p9s",en,"[{'screen_name': 'realdlhughley', 'name': 'dl hughley', 'id': '58529612'}]",['https://www.instagram.com/p/CB4G-abg1VZ/?igshid=1hvdx76i1flvz'],[],0,0,0,"['fakewoke', 'crybaby', 'soft', 'victim', 'biden', 'trump']",[],https://twitter.com/iseedre/status/1276298269883109376,False,,0,,los angeles,,,,,,[],,,,
1276297159265021952,1276297159265021952,2020-06-25 18:32:09 CDT,2020-06-25,18:32:09,-0500,80995053,dstrk_kwby,Onset,,So 1 million dead ppl got stimulus checks? Go head &amp; add dat 2 REPARATIONS 4 BLACKS @federalreserve @USTreasury,en,"[{'screen_name': 'federalreserve', 'name': 'federal reserve', 'id': '26538229'}, {'screen_name': 'ustreasury', 'name': 'treasury department', 'id': '120176950'}]",[],[],0,0,0,[],[],https://twitter.com/DSTRK_KWBY/status/1276297159265021952,False,,0,,los angeles,,,,,,[],,,,
1276296849968726017,1276296849968726017,2020-06-25 18:30:56 CDT,2020-06-25,18:30:56,-0500,2246088440,jenetteskincare,cuttercutshaw@yahoo.com,"{'type': 'Point', 'coordinates': [34.0564, -118.2445]}","Support colorofchange (  https://t.co/JJgazK1HjJ) a non-profit organization that helps people respond effectively to injustice in the world around us. As a national online force driven by 1.7 million members, they…  https://t.co/nbwOtfE640",en,[],"['https://buff.ly/2QLyxAE', 'https://www.instagram.com/p/CB4Gd_CA0Oa/?igshid=hzecqq3l33mq']",[],0,0,0,[],[],https://twitter.com/JenetteSkinCare/status/1276296849968726017,False,,0,,los angeles,,,,,,[],,,,
1276295247702548481,1276295247702548481,2020-06-25 18:24:34 CDT,2020-06-25,18:24:34,-0500,732685960962572290,travellovefash,Kristi - Travel Blog,,"“As you move through this life and this world you change things slightly, you leave marks behind, however small. &amp; in return, life -- &amp; travel -- leaves marks on you. Most of the time, those marks -- on your body or on your heart -- are beautiful. Often, though, they hurt."" 💔  https://t.co/5K9qcFB5xv",en,[],[],['https://pbs.twimg.com/media/EbZPwwBU4AAUU9Y.jpg'],0,0,4,[],[],https://twitter.com/TravelLoveFash/status/1276295247702548481,False,,1,https://pbs.twimg.com/media/EbZPwwBU4AAUU9Y.jpg,los angeles,,,,,,[],,,,
1276292203443187714,1276291522422616064,2020-06-25 18:12:28 CDT,2020-06-25,18:12:28,-0500,30282234,stevenvspharma,Steven ♿️ Martin 🏳️‍🌈,,@TheRealestSpoon I would politely mention that you have a sensitivity to criticism and jokes about your body image and what she said stuck and it hurt.,en,[],[],[],0,0,0,[],[],https://twitter.com/StevenVsPharma/status/1276292203443187714,False,,0,,los angeles,,,,,,"[{'screen_name': 'TheRealestSpoon', 'name': 'The Youth Imam | حب', 'id': '932059269205250048'}]",,,,
1276292052032999425,1276292052032999425,2020-06-25 18:11:52 CDT,2020-06-25,18:11:52,-0500,22086087,echoisthename,EchoIsTheName™️ 🇩🇴💭,,the dollar is a unit of magical energy &amp; the dollar bill itself a magical talisman. it’s transformative but if anybody starts seein tools as something to pursue and worship....well you get a world where Trump wound up president and Tekashi69 has the number 1 record in the US,en,[],[],[],0,0,2,[],[],https://twitter.com/echoisthename/status/1276292052032999425,False,,0,,los angeles,,,,,,[],,,,
1276291857165631488,1276291857165631488,2020-06-25 18:11:05 CDT,2020-06-25,18:11:05,-0500,444286596,seansmcbride,Sean McBride,,It’s funny how much my nephew’s indifference to a gift I gave him hurt my soul.,en,[],[],[],1,0,1,[],[],https://twitter.com/seansmcbride/status/1276291857165631488,False,,0,,los angeles,,,,,,[],,,,
1276291235326464001,1276175852842221568,2020-06-25 18:08:37 CDT,2020-06-25,18:08:37,-0500,330530503,maximass1138,Max Cervantes,,@MuggleNet I can tell you this much I wouldn’t of bloody well snapped it in half like Harry did at the end of the movie 😜😁😜,en,[],[],[],0,0,0,[],[],https://twitter.com/maximass1138/status/1276291235326464001,False,,0,,los angeles,,,,,,"[{'screen_name': 'MuggleNet', 'name': 'MuggleNet: #1 Wizarding World Resource Since 1999', 'id': '14599470'}]",,,,
1276289756779823104,1276289756779823104,2020-06-25 18:02:44 CDT,2020-06-25,18:02:44,-0500,395585845,jdjleg,Jose deJesus Legaspi,,The most stupid asinine theatrical political stunt. Not only is he poking fun at death but also at justice. AZ is increasing cases and hospitalizations. He prefers intubation covering his mouth to a mask?,en,[],[],[],0,0,0,[],[],https://twitter.com/jdjleg/status/1276289756779823104,False,https://twitter.com/Bill_Maxwell_/status/1275955094995873793,0,,los angeles,,,,,,[],,,,
1276289180792844288,1276282163663523841,2020-06-25 18:00:27 CDT,2020-06-25,18:00:27,-0500,1881456794,ccortave24,Christian Cortave,,@Str8Edge4Life95 That’s great to hear! I heard his performance is up there with Punch-Drunk Love &amp; Uncut Gems,en,[],[],[],1,0,1,[],[],https://twitter.com/CCortave24/status/1276289180792844288,False,,0,,los angeles,,,,,,"[{'screen_name': 'Str8Edge4Life95', 'name': 'Marcus🥀Brown', 'id': '895096781461110784'}]",,,,
1276289059111895045,1276289059111895045,2020-06-25 17:59:58 CDT,2020-06-25,17:59:58,-0500,3290999659,teyanaa_,Teyana 🤍,,I sweeear call somebody a weirdo and they gon take offense 💀💀,en,[],[],[],0,0,0,[],[],https://twitter.com/Teyanaa_/status/1276289059111895045,False,https://twitter.com/astridtoobossy/status/1275633752966705152,0,,los angeles,,,,,,[],,,,
1276289039746859008,1276289039746859008,2020-06-25 17:59:54 CDT,2020-06-25,17:59:54,-0500,1155121353147785217,bria_backwoods,BRIA BACKWOODS®️,,i was just thinking bout this tbh. but two hour drive in cali?!?! dead lol,en,[],[],[],1,0,1,[],[],https://twitter.com/BRIA_BACKWOODS/status/1276289039746859008,False,https://twitter.com/francisco_ant/status/1276275300511313921,0,,los angeles,,,,,,[],,,,
1276288621851500545,1276251640975077376,2020-06-25 17:58:14 CDT,2020-06-25,17:58:14,-0500,14259138,brentpiaskoski,Brent Piaskoski,,"@robertdsheridan @zedlacher My cousin used to be married to the lead singer of Kick Axe. Then once while at the Winnipeg Yuk's, I was talking to an audience member and her cousin was the lead singer of Kick Axe. Fuck, can I weave a gripping story. I hope some showrunner's reading this thread.",en,[],[],[],4,0,3,[],[],https://twitter.com/BrentPiaskoski/status/1276288621851500545,False,,0,,los angeles,,,,,,"[{'screen_name': 'robertdsheridan', 'name': 'Rob Sheridan', 'id': '35762185'}, {'screen_name': 'zedlacher', 'name': 'Pete Zedlacher', 'id': '48925188'}]",,,,
1276288617233608708,1276288617233608708,2020-06-25 17:58:13 CDT,2020-06-25,17:58:13,-0500,3377690714,dannyfinnlive,Danny Finn 🏳️‍🌈,,This is a very difficult time for us all. Be brave and reach out ❤️❤️  Suicide Prevention 800-273-8255  Substance Abuse/Mental Health Helpline 1-800-662-4357  Sexual Assault Hotline  800-656-4673  Domestic Violence Hotline 800−799−7233  Crisis Text Line: Text HELLO to 741741,en,[],[],[],1,102,140,[],[],https://twitter.com/DannyFinnLive/status/1276288617233608708,False,,0,,los angeles,,,,,,[],,,,
1276288448475717639,1276288448475717639,2020-06-25 17:57:33 CDT,2020-06-25,17:57:33,-0500,1111463783094849536,emesgdontrankey,emesgv,,Did you ever stop to think about how i called the west coast wet backs stupid bitches.. Bitch im getting calls with death threats and letters to flush out of cali... Wtf??? YEAH!!! So i can live next to the next state to the bitches you love?? i dont know what to do here.....  https://t.co/TJDEIsnELt,en,[],[],['https://pbs.twimg.com/media/EbZJk9iVAAEp-UW.jpg'],0,0,0,[],[],https://twitter.com/emesgdontrankey/status/1276288448475717639,False,,1,https://pbs.twimg.com/media/EbZJk9iVAAEp-UW.jpg,los angeles,,,,,,[],,,,
1276288281156579330,1276288281156579330,2020-06-25 17:56:53 CDT,2020-06-25,17:56:53,-0500,36024495,ibreathereal,‘Deeces,,you just left me for dead. I’m so behind!,en,[],[],[],1,0,0,[],[],https://twitter.com/iBreatheReal/status/1276288281156579330,False,https://twitter.com/Nephew1800/status/1276262076231671808,0,,los angeles,,,,,,[],,,,
1276285629794418688,1276032197346988032,2020-06-25 17:46:21 CDT,2020-06-25,17:46:21,-0500,16060735,dougluberts,Doug Luberts,,"@DaggmaskTTV @DarkclawKalan @matthewmercer I am a victim. I lost my reputation, my job at a Major Studio, and my “friends” (I can live with that one... Too many nut jobs.) Oh, and I’m subject to the scorn and deragatory remarks of the classless Hollywood wanna-bes on this thread, who never even met me. Pain? Hah! Riiight.",en,[],[],[],0,0,0,[],[],https://twitter.com/dougluberts/status/1276285629794418688,False,,0,,los angeles,,,,,,"[{'screen_name': 'DaggmaskTTV', 'name': 'Daggmask', 'id': '209839643'}, {'screen_name': 'matthewmercer', 'name': 'Matthew Mercer', 'id': '24630350'}]",,,,
1276285130462519297,1276285130462519297,2020-06-25 17:44:21 CDT,2020-06-25,17:44:21,-0500,173917260,dizlizy,Lizette Castaneda,,"I took a nap (which i rarely do), and dreamed i scored a bicycle kick goal to win a championship- I actually physically woke up to me kicking up my leg harddd😩. First of all, I can’t even dribble a ball down the field, second, i didn’t injure myself, thankfully. 🤦🏽‍♀️😂",en,[],[],[],0,0,0,[],[],https://twitter.com/dizlizy/status/1276285130462519297,False,,0,,los angeles,,,,,,[],,,,
1276284339542568960,1276284339542568960,2020-06-25 17:41:13 CDT,2020-06-25,17:41:13,-0500,10540912,ericschwartz,Eric Schwartz,,I’m not surprised $1.4 BILLION in stimulus payments went to a million dead people. You wanna impress me? Make a million mail-in ballots come from dead people.,en,[],[],[],1,1,13,[],[],https://twitter.com/ericschwartz/status/1276284339542568960,False,,0,,los angeles,,,,,,[],,,,
1276282114783064064,1276282114783064064,2020-06-25 17:32:22 CDT,2020-06-25,17:32:22,-0500,1605328332,oliviiagarcia,liv,,#suicide awareness 1-800-273-8255 just two. any two. copy- not retweet.,en,[],[],[],0,0,1,['suicide'],[],https://twitter.com/oliviiagarcia/status/1276282114783064064,False,,0,,los angeles,,,,,,[],,,,
1276281609382215680,1276281609382215680,2020-06-25 17:30:22 CDT,2020-06-25,17:30:22,-0500,28860779,raffikiiihamkaa,Raffaella C Flores,"{'type': 'Point', 'coordinates': [34.0564, -118.2445]}","JUSTICE FOR BREONNA TAYLOR. 🌹  “But three months after plainclothes detectives serving a warrant busted into her Louisville, Kentucky, apartment and shot the 26-year-old Black woman to death, only one of the three…  https://t.co/g5I2Iw64em",en,[],['https://www.instagram.com/p/CB3_iqylGfl/?igshid=a14c8wg48um'],[],0,0,0,[],[],https://twitter.com/raffikiiiHamkaa/status/1276281609382215680,False,,0,,los angeles,,,,,,[],,,,
1276280327678226434,1276280327678226434,2020-06-25 17:25:16 CDT,2020-06-25,17:25:16,-0500,3253372950,mebeinghot,Eternals stan,,"This isn't to say that all Filipino parents are abusive but the amount of abuse ""memes"" i see on the Filipino Facebook group i'm in... that shit shouldn't be normal bro. To make memes about it, too? That's a cheap laugh.",en,[],[],[],0,0,2,[],[],https://twitter.com/mebeinghot/status/1276280327678226434,False,,0,,los angeles,,,,,,[],,,,
1276279930926460929,1276279930926460929,2020-06-25 17:23:42 CDT,2020-06-25,17:23:42,-0500,1073040361,nessssa13,Nessa🦋✨,,I can’t with my dad 🙄🙄 Someone kidnap me 😫,en,[],[],[],0,0,0,[],[],https://twitter.com/Nessssa13/status/1276279930926460929,False,,0,,los angeles,,,,,,[],,,,
1276279035094433792,1276279035094433792,2020-06-25 17:20:08 CDT,2020-06-25,17:20:08,-0500,830587286093918209,therealjaimep,Jaime Ponce 🧢 ☂,,"Pretty sure this is assault and battery perpetrated by the THUGS who call themselves “the police”. This is fucking ridiculous. With no aggression from the civilian, that bastard cop just walks up from behind and body slams him. Totally unprovoked.     https://t.co/xtH1WviyMT",en,[],[],[],0,0,1,[],[],https://twitter.com/TheRealJaimeP/status/1276279035094433792,False,,1,https://pbs.twimg.com/ext_tw_video_thumb/1275730702210867203/pu/img/wMvmMqKfFy_cHeXP.jpg,los angeles,,,,,,[],,,,
1276278620965617664,1276137207049396227,2020-06-25 17:18:30 CDT,2020-06-25,17:18:30,-0500,722844014647468034,heathdajoint,heath♡,,@destanneeee @callmeh_bf_no2 im dead asfc😭😂😂. we gotta do it again,en,[],[],[],1,0,0,[],[],https://twitter.com/heathdajoint/status/1276278620965617664,False,,0,,los angeles,,,,,,"[{'screen_name': 'destanneeee', 'name': 'destanee’s child', 'id': '3070139714'}, {'screen_name': 'callmeh_bf_no2', 'name': 'FRANK', 'id': '393700877'}]",,,,
1276278119960162305,1276278119960162305,2020-06-25 17:16:30 CDT,2020-06-25,17:16:30,-0500,3265818067,armdrag120,Alvarengutan,,can i please get 2 friends to copy and repost? i am trying to demonstrate that someone is always listening.  #suicide awareness 1-800-273-8255 just two. any two. copy- not retweet.,en,[],[],[],0,0,4,['suicide'],[],https://twitter.com/armdrag120/status/1276278119960162305,False,,0,,los angeles,,,,,,[],,,,
1276277770050404353,1276277770050404353,2020-06-25 17:15:07 CDT,2020-06-25,17:15:07,-0500,831650865299664898,sherrilaluv,Sherri & Mao in LA 🐾🌴,,I didn’t get a check... but a million dead people did! 🙄  https://t.co/yACScXLbRU,en,[],['https://www.google.com/amp/s/www.washingtonpost.com/us-policy/2020/06/25/irs-stimulus-checks-dead-people-gao/%3foutputType=amp'],[],0,0,0,[],[],https://twitter.com/SherriLALuv/status/1276277770050404353,False,,0,,los angeles,,,,,,[],,,,
1276277119878754305,1276269908876279809,2020-06-25 17:12:32 CDT,2020-06-25,17:12:32,-0500,1115596310759895040,bob29790056,bob,,@BreitbartNews However Biden did in fact say “120 million dead from COVID”,en,[],[],[],0,0,1,[],[],https://twitter.com/bob29790056/status/1276277119878754305,False,,0,,los angeles,,,,,,"[{'screen_name': 'BreitbartNews', 'name': 'Breitbart News', 'id': '457984599'}]",,,,
1276276729842069504,1276276729842069504,2020-06-25 17:10:59 CDT,2020-06-25,17:10:59,-0500,301903979,jordyneliz,🔪🥀Dazai’s Suicide Girl🥀🗡,,I was bullied a lot a few months ago..  I worked my ASS off day and night to get where I am right now. I was so proud of everything I was doing but there was always a hater in the BG constantly judging me and rating me out of 5. She is a bully and this is her. My island is good:(  https://t.co/XJTfqcFEBn,en,[],[],['https://pbs.twimg.com/media/EbY-63lUYAAZ9Zf.jpg'],0,0,8,[],[],https://twitter.com/JordynEliz/status/1276276729842069504,False,,1,https://pbs.twimg.com/media/EbY-63lUYAAZ9Zf.jpg,los angeles,,,,,,[],,,,
1276276029162532865,1275792822533267457,2020-06-25 17:08:12 CDT,2020-06-25,17:08:12,-0500,3377690714,dannyfinnlive,Danny Finn 🏳️‍🌈,,"@50shadesofgrubb @LampeJay @AshleyPurdy the Daily Grubb, common sense is truly your most satisfying weapon of choice and I’ve always appreciated your perspective and words. 👍🏻",en,[],[],[],1,0,2,[],[],https://twitter.com/DannyFinnLive/status/1276276029162532865,False,,0,,los angeles,,,,,,"[{'screen_name': '50shadesofgrubb', 'name': 'Justin Grubb', 'id': '370913245'}, {'screen_name': 'LampeJay', 'name': 'Jay Lampe', 'id': '762613229776429056'}, {'screen_name': 'AshleyPurdy', 'name': '☆ 𝗔𝗦𝗛𝗟𝗘𝗬 𝗣𝗨𝗥𝗗𝗬 ☆', 'id': '27023088'}]",,,,
1276275229623414784,1276273760010514432,2020-06-25 17:05:01 CDT,2020-06-25,17:05:01,-0500,1242369955,vamonosla,Dingbattitude!,,"@bushidosquirrel The Dead Sea is far lower (1400’ below sea level) but still pretty amazing, there are no 11000’ mountains anywhere near the Dead Sea!",en,[],[],[],0,0,1,[],[],https://twitter.com/VamonosLA/status/1276275229623414784,False,,0,,los angeles,,,,,,"[{'screen_name': 'bushidosquirrel', 'name': 'Bushido Squirrel: Level Zero With Calls Pending', 'id': '773667777185976320'}]",,,,
1276274663635611650,1276239427421925376,2020-06-25 17:02:46 CDT,2020-06-25,17:02:46,-0500,24066945,bb_hay,𝕳𝖆𝖞𝖑𝖊𝖞,,@HURTwordart Eiza González 😩💀 I’m hurt !!!,ca,[],[],[],0,0,1,[],[],https://twitter.com/bb_hay/status/1276274663635611650,False,,0,,los angeles,,,,,,"[{'screen_name': 'HURTwordart', 'name': 'I am Not the one', 'id': '2247659593'}]",,,,
1276274556206895105,1276274556206895105,2020-06-25 17:02:20 CDT,2020-06-25,17:02:20,-0500,526970848,iamking_rl,Control....What You Can Control,,May I please get 2 friends to copy and repost? I am trying to demonstrate that someone is always listening.  #Suicide Awareness 1-800-273-8255  Just two. Any two. Copy- not retweet,en,[],[],[],0,0,0,['suicide'],[],https://twitter.com/IamKing_RL/status/1276274556206895105,False,,0,,los angeles,,,,,,[],,,,
1276274187238166529,1276274187238166529,2020-06-25 17:00:52 CDT,2020-06-25,17:00:52,-0500,1238987445053489152,amberlyelem,amberlyelem,,Live now. Last episode of The Walking Dead Season Two 🧟‍♀️ @rtsmallstreams @SmallStreamersR  https://t.co/418v7Kx6F4,en,"[{'screen_name': 'rtsmallstreams', 'name': 'rt small streams', 'id': '1128878664572166144'}, {'screen_name': 'smallstreamersr', 'name': '#smallstreamersconnect rt', 'id': '1117168138192179202'}]",['http://Twitch.tv/biiviiolet'],[],2,3,5,[],[],https://twitter.com/amberlyelem/status/1276274187238166529,False,,0,,los angeles,,,,,,[],,,,
1276274058854830080,1276274058854830080,2020-06-25 17:00:22 CDT,2020-06-25,17:00:22,-0500,39931540,roccocomedy,Rocco Stowe,"{'type': 'Point', 'coordinates': [34.1465, -118.2539]}","#pulluporshutup #pullups #getsome @roguefitness 4 sets of 8 dead hang. Best exercise in the world. #tatoos #marine #usmc #yoga #rocyoga #rocco #italia #philly #76ers @ Glendale, California  https://t.co/AYTabfwsbq",en,"[{'screen_name': 'roguefitness', 'name': 'rogue fitness', 'id': '19458230'}]",['https://www.instagram.com/p/CB37pj6AKNw/?igshid=1fdakdhh79o15'],[],0,0,1,"['pulluporshutup', 'pullups', 'getsome', 'tatoos', 'marine', 'usmc', 'yoga', 'rocyoga', 'rocco', 'italia', 'philly', '76ers']",[],https://twitter.com/roccocomedy/status/1276274058854830080,False,,0,,los angeles,,,,,,[],,,,
1276273056533471233,1276258259268182016,2020-06-25 16:56:23 CDT,2020-06-25,16:56:23,-0500,133011840,nydodgerfan,LAdodgersfan,,"@PissSommelier @charles_kinbote Angeles Senic Highway, All through Malibu Canyons, Route 39. Have had to stop a bit because of summer classes but planning on going up PCH and to Route 33. Also big bear area and maybe a overnight trip to death valley if it’s safe",en,[],[],[],1,0,0,[],[],https://twitter.com/NYdodgerfan/status/1276273056533471233,False,,0,,los angeles,,,,,,"[{'screen_name': 'PissSommelier', 'name': 'word pedant 🐝', 'id': '1206790120256372736'}, {'screen_name': 'charles_kinbote', 'name': 'nuanced opinion guy', 'id': '2792163465'}]",,,,
1276272818796130306,1276272818796130306,2020-06-25 16:55:26 CDT,2020-06-25,16:55:26,-0500,1119753893049556992,daan1ellaaa,city by the sea🧜🏼‍♀️,,"imma that ex your girlfriend NOT gonna bully 😂 , wrong bitch baby, i can fight.",en,[],[],[],0,0,3,[],[],https://twitter.com/daan1ellaaa/status/1276272818796130306,False,,0,,los angeles,,,,,,[],,,,
1276271487687655424,1275835136328773637,2020-06-25 16:50:09 CDT,2020-06-25,16:50:09,-0500,35118943,leotheligerr,Melanated 👑🇭🇹,,@DwreckPerez @BethAnne__ This that hurt 😭😭,en,[],[],[],0,1,2,[],[],https://twitter.com/LeoTheLigerr/status/1276271487687655424,False,,0,,los angeles,,,,,,"[{'screen_name': 'DwreckPerez', 'name': 'dwreck', 'id': '388699798'}, {'screen_name': 'BethAnne__', 'name': 'Monikabae', 'id': '2312929401'}]",,,,
1276270798769020933,1276270798769020933,2020-06-25 16:47:25 CDT,2020-06-25,16:47:25,-0500,21978899,heatherfink,Heather Fink,,I know John &amp; Eric &amp; they are great &amp; haven’t heard anything contrary but this is straight up rape culture to presume people aren’t rapists bc we like them. I’ve experienced horrible things at the hands of well liked funny people. It could be anybody. STFU,en,[],[],[],2,0,9,[],[],https://twitter.com/heatherfink/status/1276270798769020933,False,https://twitter.com/notslimpug/status/1276024107209904128,0,,los angeles,,,,,,[],,,,
1276270613829582848,1276270613829582848,2020-06-25 16:46:40 CDT,2020-06-25,16:46:40,-0500,1127099168,kingmiller_,🥇🆙🔝👳🏿‍♂️,,im a real life Saiyan lmao I was on the brink of death and came back better.,en,[],[],[],1,1,2,[],[],https://twitter.com/KingMiller_/status/1276270613829582848,False,,0,,los angeles,,,,,,[],,,,
