id,conversation_id,created_at,date,time,timezone,user_id,username,name,place,tweet,language,mentions,urls,photos,replies_count,retweets_count,likes_count,hashtags,cashtags,link,retweet,quote_url,video,thumbnail,near,geo,source,user_rt_id,user_rt,retweet_id,reply_to,retweet_date,translate,trans_src,trans_dest
1252997584538537988,1252997584538537988,2020-04-22 11:27:58 CDT,2020-04-22,11:27:58,-0500,38313524,iammarybenton,Mary Benton,,"Mayor @SylvesterTurner joins @AbbieKamin @hawctalk @HoustonHealth @ArtAcevedo to speak directly to victims of domestic violence. Calls are up. This happens often in times often crisis. @Uber has given the city a $50,000 grant to help survivors escape an abusive environment.  https://t.co/mix9OImkKS",en,"[{'screen_name': 'sylvesterturner', 'name': 'sylvester turner', 'id': '115105973'}, {'screen_name': 'abbiekamin', 'name': 'abbie kamin', 'id': '240791591'}, {'screen_name': 'hawctalk', 'name': 'hawctalk', 'id': '119872862'}, {'screen_name': 'houstonhealth', 'name': 'houston health dept', 'id': '37303117'}, {'screen_name': 'artacevedo', 'name': 'chief art acevedo', 'id': '554468819'}, {'screen_name': 'uber', 'name': 'uber', 'id': '19103481'}]",[],"['https://pbs.twimg.com/media/EWOKqM6XgAAuSwT.jpg', 'https://pbs.twimg.com/media/EWOKqMdXgAw4DGb.jpg', 'https://pbs.twimg.com/media/EWOKqMeXQAEFkrJ.jpg']",0,5,23,[],[],https://twitter.com/IAmMaryBenton/status/1252997584538537988,False,,1,https://pbs.twimg.com/media/EWOKqM6XgAAuSwT.jpg,houston,,,,,,[],,,,
1252997388396101640,1252997388396101640,2020-04-22 11:27:11 CDT,2020-04-22,11:27:11,-0500,245661809,billkellytexas,Bill Kelly,,"Shout out to all these partners addressing domestic &amp; sexual violence.   I wouldn’t be a former @EllenCohen1 staffer if I didn’t also give a push for renewal of the Violence Against Women Act and closure of the boyfriend loophole.   Come on, US Senate, step up. Pass VAWA.",en,"[{'screen_name': 'ellencohen1', 'name': 'ellen cohen', 'id': '109388121'}]",[],[],1,2,12,[],[],https://twitter.com/billkellytexas/status/1252997388396101640,False,https://twitter.com/SylvesterTurner/status/1252994570536865792,0,,houston,,,,,,[],,,,
1252992165933875206,1252819545112248321,2020-04-22 11:06:26 CDT,2020-04-22,11:06:26,-0500,59205011,estebangbang,Steve From Houston,,@judge_big @Follome2success @yankeereport28 Deadass didn't think I would get asked about rape today. So there's that. Also thank you for finally believing me. I am the Messiah praise be.,en,[],[],[],0,0,0,[],[],https://twitter.com/EsteBangBang/status/1252992165933875206,False,,0,,houston,,,,,,"[{'screen_name': 'judge_big', 'name': 'Breggy the clown faced cheater', 'id': '1223359575300149259'}, {'screen_name': 'Follome2success', 'name': 'MITCH', 'id': '608328877'}]",,,,
1252989542765858817,1252989542765858817,2020-04-22 10:56:01 CDT,2020-04-22,10:56:01,-0500,334532467,antonybravo,BRAVO,,"Just as i foretold the fate of texas before, i shall do it again 🙌🏽  HEAR ME  The white man is DANGEROUS  They cry and file out to there elected officials offices and demand 'freedom' from their homes  They bring guns  They bring VIOLENCE  They will come for us.",en,[],[],[],0,0,2,[],[],https://twitter.com/AntonyBravo/status/1252989542765858817,False,,0,,houston,,,,,,[],,,,
1252987152910123008,1252932181447630848,2020-04-22 10:46:31 CDT,2020-04-22,10:46:31,-0500,862271814,krbinhouston,Mahogany Blue,,@Nvr4Get91101 @realDonaldTrump @POTUS Our ground troops are in more danger NOW than EVER under this POS president. I AM an ARMY VETERAN who contracts w/the Navy. Make NO MISTAKE. trump is the MOST hated &amp; distrusted Commander in Chief in my lifetime. All branches are having retention/enlistment issues bcuz of him!,en,[],[],[],1,0,0,[],[],https://twitter.com/krbinhouston/status/1252987152910123008,False,,0,,houston,,,,,,"[{'screen_name': 'Nvr4Get91101', 'name': 'I Yam What I Yam', 'id': '247002793'}, {'screen_name': 'realDonaldTrump', 'name': 'Donald J. Trump', 'id': '25073877'}, {'screen_name': 'POTUS', 'name': 'President Biden', 'id': '1349149096909668363'}]",,,,
1252978711378485248,1252978711378485248,2020-04-22 10:12:58 CDT,2020-04-22,10:12:58,-0500,2677861794,yee_hawty,tequila soda energy,,America: the only place in the world where people would protest against protecting their own health and safety.,en,[],[],[],0,3,20,[],[],https://twitter.com/yee_hawty/status/1252978711378485248,False,,0,,houston,,,,,,[],,,,
