id,conversation_id,created_at,date,time,timezone,user_id,username,name,place,tweet,language,mentions,urls,photos,replies_count,retweets_count,likes_count,hashtags,cashtags,link,retweet,quote_url,video,thumbnail,near,geo,source,user_rt_id,user_rt,retweet_id,reply_to,retweet_date,translate,trans_src,trans_dest
1253110493151211520,1253110493151211520,2020-04-22 18:56:37 CDT,2020-04-22,18:56:37,-0500,103772491,darriondadon_,#DarrionDaDon,,@Ebonyeezy hi gorgeous my name Don I’m shooting a video I’m looking for a male and female model today preferably someone who’s a couple or separate just looking for the models for 9 o’clock,en,[],[],[],0,0,0,[],[],https://twitter.com/DARRIONDADON_/status/1253110493151211520,False,,0,,houston,,,,,,[],,,,
1253110162312900609,1253110108873244672,2020-04-22 18:55:19 CDT,2020-04-22,18:55:19,-0500,167125018,judedudemude,A.J. the Comedian,,What more evidence you need to convince people that she is not on American's side? She sided with radical muslim terrorist groups and is hellbent on ruining America from within.,en,[],[],[],0,0,0,[],[],https://twitter.com/Judedudemude/status/1253110162312900609,False,,0,,houston,,,,,,[],,,,
1253109981056053249,1104007221891948545,2020-04-22 18:54:35 CDT,2020-04-22,18:54:35,-0500,167125018,judedudemude,A.J. the Comedian,,@elguapo64 What more evidence you need to convince people that she is not on American's side? She sided with radical muslim terrorist groups and is hellbent on ruining America from within.,en,[],[],[],0,0,0,[],[],https://twitter.com/Judedudemude/status/1253109981056053249,False,,0,,houston,,,,,,"[{'screen_name': 'elguapo64', 'name': 'Neanderthal El Guapo 👀', 'id': '18710344'}]",,,,
1253102943743750145,1253060846269456384,2020-04-22 18:26:37 CDT,2020-04-22,18:26:37,-0500,1242328343766274048,ruth89727789,ruth,,"@drtalley37 @KHOU I agree with you partially. I get and understand about wearing the masks . But it angers me about the the violation of 1,000 dollar fine when you release inmates on low bond or a PR bond . Murderer and Rapist and Assault charges . David Cruz murder my son !",en,[],[],[],0,0,2,[],[],https://twitter.com/ruth89727789/status/1253102943743750145,False,,0,,houston,,,,,,"[{'screen_name': 'drtalley37', 'name': 'DR. Talley', 'id': '822842857677537281'}, {'screen_name': 'KHOU', 'name': 'KHOU 11 News Houston', 'id': '15791186'}]",,,,
1253097460878237699,1253097460878237699,2020-04-22 18:04:50 CDT,2020-04-22,18:04:50,-0500,21818516,vinfrankl,Ann,,Sarah Brady: Idaho Woman Arrested Over ‘Playdate’ Coronavirus Protest  https://t.co/FRbh9ZTn0p via @heavysan,en,"[{'screen_name': 'heavysan', 'name': 'heavy.com', 'id': '22830650'}]",['https://heavy.com/news/2020/04/sarah-brady/'],[],1,0,0,[],[],https://twitter.com/vinfrankl/status/1253097460878237699,False,,0,,houston,,,,,,[],,,,
1253093607139160066,1253093607139160066,2020-04-22 17:49:31 CDT,2020-04-22,17:49:31,-0500,103772491,darriondadon_,#DarrionDaDon,,Need a male model for shooting today,en,[],[],[],0,0,2,[],[],https://twitter.com/DARRIONDADON_/status/1253093607139160066,False,,0,,houston,,,,,,[],,,,
1253084203907977217,1253084203907977217,2020-04-22 17:12:10 CDT,2020-04-22,17:12:10,-0500,2556616815,ic_ivory,Ivory,,"Socialist attack? Ha. You committed a criminal act, Toots.   https://t.co/l5He6vmHkf",en,[],['https://americanindependent.com/kelly-loeffler-stock-scandal-socialist-attack-gop-senate-insider-trading-fox-news/'],[],0,0,0,[],[],https://twitter.com/ic_ivory/status/1253084203907977217,False,,0,,houston,,,,,,[],,,,
1253080044429291521,1253080044429291521,2020-04-22 16:55:38 CDT,2020-04-22,16:55:38,-0500,1601164489,justkamg,Libra loner 👻,,How does a “trained” officer mistake a phone light for a gun shot spark... FIRED AND CHARGED!!!!!!!!,en,[],[],[],0,0,3,[],[],https://twitter.com/justkamg/status/1253080044429291521,False,https://twitter.com/NOLAnews/status/1253047468155117569,0,,houston,,,,,,[],,,,
1253077929526996992,1253077929526996992,2020-04-22 16:47:14 CDT,2020-04-22,16:47:14,-0500,172794406,infamous_danie,stay dangerous 🏁,,OOOOORRRR maybe she’s just a fuckin freak! Lmaoo..stop making this woman out to be a “victim” all the time,en,[],[],[],0,0,1,[],[],https://twitter.com/inFAMOUS_Danie/status/1253077929526996992,False,https://twitter.com/britshaniece/status/1252774969559433218,0,,houston,,,,,,[],,,,
1253077118508044288,1253077118508044288,2020-04-22 16:44:00 CDT,2020-04-22,16:44:00,-0500,162261875,progressivetex,The Masked Blue Texan 🇺🇦,,"Q: What kind of “peaceful protest” includes screaming idiots with assault rifles, confederate flags and Nazi apparel spreading racism and a deadly virus?                                                      A: One involving Trump supporters. #NepotismBarbie #ReopenAmerica",en,[],[],[],0,1,1,"['nepotismbarbie', 'reopenamerica']",[],https://twitter.com/ProgressiveTex/status/1253077118508044288,False,https://twitter.com/IvankaTrump/status/1252967915483267072,0,,houston,,,,,,[],,,,
1253075956891299841,1253075956891299841,2020-04-22 16:39:23 CDT,2020-04-22,16:39:23,-0500,3283796298,christycastelan,a huh ass bitch,,"Face coverings being lawfully enforced, our favorite barbs turned out to be like the rest of the racist yt’s, a restaurant in houston will be resuming dine in service despite covid-19, idiots protesting to reopen the country.....I mean I just can’t",en,[],[],[],0,0,0,[],[],https://twitter.com/ChristyCastelan/status/1253075956891299841,False,,0,,houston,,,,,,[],,,,
1253072670587080704,1253072670587080704,2020-04-22 16:26:20 CDT,2020-04-22,16:26:20,-0500,801140370801356800,littleseamoon,Chelsea Nichole ♡,,"Netflix finally has a series about WACO, and it’s kind of fucked up the way ATF and FBI killed people without any necessary cause to retaliate. This shit pisses me off so much.",en,[],[],[],6,6,38,[],[],https://twitter.com/littleseamoon/status/1253072670587080704,False,,0,,houston,,,,,,[],,,,
1253071517870628864,1253071517870628864,2020-04-22 16:21:45 CDT,2020-04-22,16:21:45,-0500,954495990156943366,andrewsweatman6,Andrew Sweatman,,@GregAbbott_TX GREAT News - tho many think this panicdemic was caused by the Media &amp; Hate Trumpers! You are 3x more likely to die from murder than Cov-19 in City of Hou - ~35 Cov19 Deaths nearly 100 Murders! Why r we shut down? HUGE hit on our economy - Ty the Mayor!,en,[],[],[],0,0,0,[],[],https://twitter.com/AndrewSweatman6/status/1253071517870628864,False,,0,,houston,,,,,,[],,,,
1253070147960680449,1253070147960680449,2020-04-22 16:16:18 CDT,2020-04-22,16:16:18,-0500,298611660,ummhmm_datz_him,B.Macc 🕴🏾👯‍♂️👯‍♂️,,So today I started my new job as a Camera man for my homegirl.  She didn’t tell me she was shooting videos for her only fans,en,[],[],[],0,0,0,[],[],https://twitter.com/ummhmm_datz_him/status/1253070147960680449,False,,0,,houston,,,,,,[],,,,
1253068518628691969,1252692854155153408,2020-04-22 16:09:50 CDT,2020-04-22,16:09:50,-0500,33921088,oge_babyyy,..STRangeFRuiT_Oge🇳🇬,,@2zero99 @droc_17 He should harm her. Y’all think playing with people’s sexuality is a joke. That Sh*t is TRAUMATIZING!! Find a gay man stop tricking straight men and thinking ur the victim! That is sick!,en,[],[],[],1,1,17,[],[],https://twitter.com/Oge_babyyy/status/1253068518628691969,False,,0,,houston,,,,,,"[{'screen_name': '2zero99', 'name': 'Twenny XCIX', 'id': '1158232182344884224'}, {'screen_name': 'droc_17', 'name': 'Dee', 'id': '946599440323837959'}]",,,,
1253068062938578945,1253068062938578945,2020-04-22 16:08:01 CDT,2020-04-22,16:08:01,-0500,33526482,mike_zierlein,Mike Zierlein,,You know what else fuels public anger...you when you are trying to make clever sound bites on Fox,en,[],[],[],1,1,8,[],[],https://twitter.com/Mike_Zierlein/status/1253068062938578945,False,https://twitter.com/DanPatrick/status/1253030636178341893,0,,houston,,,,,,[],,,,
1253064365533810691,1253064365533810691,2020-04-22 15:53:20 CDT,2020-04-22,15:53:20,-0500,365096971,couchsecurity,Texanus Giganticus,,"@GovAbbott you better seriously step in here before things go kinetic. We will absolutely not comply with this mandatory mask order, and we will absolutely resist arrest. If a single soul is fined or arrested, our judges and mayors MUST be prosecuted under § 39.03",en,[],[],[],1,3,3,[],[],https://twitter.com/couchsecurity/status/1253064365533810691,False,,0,,houston,,,,,,[],,,,
1253060531033866246,1252789492529991682,2020-04-22 15:38:05 CDT,2020-04-22,15:38:05,-0500,105995554,asaldate,Augie Saldate,,@JudgeClayJ @DallasCountyTx This guy? Texas official blames school shooting on too many exits and entrances - CNN  https://t.co/PpCbTHHR22,en,[],['https://www.cnn.com/2018/05/19/us/texas-school-shooting-exits-trnd/index.html'],[],0,0,0,[],[],https://twitter.com/asaldate/status/1253060531033866246,False,,0,,houston,,,,,,"[{'screen_name': 'JudgeClayJ', 'name': 'Clay Jenkins', 'id': '532562634'}, {'screen_name': 'DallasCountyTx', 'name': 'Dallas County', 'id': '283726651'}]",,,,
1253058347282169856,1253058347282169856,2020-04-22 15:29:25 CDT,2020-04-22,15:29:25,-0500,2167987970,paschal__,Chike,,Arrest this woman,en,[],[],[],0,0,0,[],[],https://twitter.com/Paschal__/status/1253058347282169856,False,https://twitter.com/IsabelAbutu/status/1252940362378854402,0,,houston,,,,,,[],,,,
1253058009468674048,1253058009468674048,2020-04-22 15:28:04 CDT,2020-04-22,15:28:04,-0500,86646950,willmoriarty86,Will Moriarty,,Brutal.,no,[],[],[],0,1,4,[],[],https://twitter.com/willmoriarty86/status/1253058009468674048,False,https://twitter.com/JeromeSolomon/status/1253054885693739009,0,,houston,,,,,,[],,,,
1253054438475956226,1253053368374870016,2020-04-22 15:13:53 CDT,2020-04-22,15:13:53,-0500,2536561231,abbygov,abby govindan,,@fbiagentidiot @ldebose83 Levi from real life is cute but he’s no Levi from Attack on Titan  https://t.co/3tfdKQgljz,en,[],[],['https://pbs.twimg.com/media/EWO-XjOXYAI47oE.jpg'],1,1,5,[],[],https://twitter.com/abbygov/status/1253054438475956226,False,,1,https://pbs.twimg.com/media/EWO-XjOXYAI47oE.jpg,houston,,,,,,"[{'screen_name': 'ldebose83', 'name': 'Levi Debose 🚀', 'id': '1367175080'}]",,,,
1253050497377976321,1253050497377976321,2020-04-22 14:58:13 CDT,2020-04-22,14:58:13,-0500,344850624,msdavis2them,MSDAVIS2THEM,,This is for the protest of a the virus ? This look like a villain movie honestly this crazy ..the fact they suited and booted like this is crazy,en,[],[],[],0,0,0,[],[],https://twitter.com/Msdavis2Them/status/1253050497377976321,False,https://twitter.com/shanedunlap/status/1252273164274536449,0,,houston,,,,,,[],,,,
1253047263745761284,1253037972217356290,2020-04-22 14:45:22 CDT,2020-04-22,14:45:22,-0500,1075160330,valentinbriagas,Valentin Pistolas,,@Based_Nemo Check gun broker cuz you can find them for better prices there,en,[],[],[],1,0,0,[],[],https://twitter.com/ValentinBriagas/status/1253047263745761284,False,,0,,houston,,,,,,"[{'screen_name': 'Based_Nemo', 'name': 'Tamps👲🏽', 'id': '1355710088'}]",,,,
1253044371567587334,1253044371567587334,2020-04-22 14:33:53 CDT,2020-04-22,14:33:53,-0500,21835599,mbprivals,Mark Passwaters,,Per @kbtxnews former Texas A&amp;M football player Vernon Jackson has been arrested by College Station PD on assault family violence strangulation charges in relation with a March 4 incident.,en,"[{'screen_name': 'kbtxnews', 'name': 'kbtx news', 'id': '20528383'}]",[],[],0,1,2,[],[],https://twitter.com/mbpRivals/status/1253044371567587334,False,,0,,houston,,,,,,[],,,,
1253042874503122955,1253042375183740928,2020-04-22 14:27:56 CDT,2020-04-22,14:27:56,-0500,31482392,cufarmer,Cufarmer 🇺🇸🐐,,"@Joe01769934 🤫 😮 my wife calls ""disagreeing with her"" emotional abuse. 😳",en,[],[],[],0,0,1,[],[],https://twitter.com/cufarmer/status/1253042874503122955,False,,0,,houston,,,,,,"[{'screen_name': 'Joe01769934', 'name': 'JoeforTrump', 'id': '1131867375643631616'}]",,,,
1253041903416807425,1253041903416807425,2020-04-22 14:24:04 CDT,2020-04-22,14:24:04,-0500,618278504,poojaontv,Pooja Lodhia,,The Houston Area Women's Center is taking more than 80 domestic violence calls a day - a 40% increase from usual.  More than half of those calls are from people needing shelter ASAP.  There are resources available for you. Contact @hawctalk 713-528-2121.  https://t.co/vvptjpflY3,en,"[{'screen_name': 'hawctalk', 'name': 'hawctalk', 'id': '119872862'}]",['https://abc13.com/houston-mayor-sylvester-turner-domestic-violence-in-plan-to-help-victims/6122119/'],[],0,0,2,[],[],https://twitter.com/PoojaOnTV/status/1253041903416807425,False,,0,,houston,,,,,,[],,,,
1253041642388566016,1253041642388566016,2020-04-22 14:23:02 CDT,2020-04-22,14:23:02,-0500,103483177,robertkusher,Real Nigga,,"I can finesse em without pulling out my gun, how he gone still hate me?",en,[],[],[],0,0,0,[],[],https://twitter.com/RobertKusher/status/1253041642388566016,False,,0,,houston,,,,,,[],,,,
1253041595634479104,1252977230508175360,2020-04-22 14:22:51 CDT,2020-04-22,14:22:51,-0500,285498363,alecarxim,Alejo - Ἀλέξανδρο  ☢,,"@Miguel_D_U @ClaudiaLopez @petrogustavo Estas confundido, creo que te refieres al incompetente de @sergio_fajardo !!! - @petrogustavo fue   En que se enfrentó por la presidencia al narco corrupto de @IvanDuque",es,"[{'screen_name': 'sergio_fajardo', 'name': 'sergio fajardo', 'id': '25185308'}, {'screen_name': 'petrogustavo', 'name': 'gustavo petro', 'id': '49849732'}, {'screen_name': 'ivanduque', 'name': 'iván duque 🇨🇴', 'id': '77653794'}]",[],[],0,0,1,[],[],https://twitter.com/ALECARXIM/status/1253041595634479104,False,,0,,houston,,,,,,"[{'screen_name': 'ClaudiaLopez', 'name': 'Claudia López Hernández', 'id': '137908875'}, {'screen_name': 'petrogustavo', 'name': 'Gustavo Petro', 'id': '49849732'}]",,,,
1253039438948700162,1252967915483267072,2020-04-22 14:14:17 CDT,2020-04-22,14:14:17,-0500,1242754120374726657,richard01897246,richard johnson,,@IvankaTrump President trump is cutting off the dems money 💰 when the USA 🇺🇸 CHARGING Venezuela’s dignitary with drug trafficking. By keeping that out the dems can’t make no money! That’s why they hate president trump  https://t.co/EKgYNrD55w,en,[],[],['https://pbs.twimg.com/media/EWOwubzXgAEf8p-.png'],0,0,0,[],[],https://twitter.com/richard01897246/status/1253039438948700162,False,,1,https://pbs.twimg.com/media/EWOwubzXgAEf8p-.png,houston,,,,,,"[{'screen_name': 'IvankaTrump', 'name': 'Ivanka Trump', 'id': '52544275'}]",,,,
1253039337723363331,1253039337723363331,2020-04-22 14:13:53 CDT,2020-04-22,14:13:53,-0500,861379798244970496,jasonhgtruitt,"Lent Mode (so, no bucket of chicken)",,I’m not saying I’d ever road rage and shoot some of Houston’s idiot drivers.   But I’d understand.  https://t.co/uMFPFyCV0F,en,[],[],['https://pbs.twimg.com/media/EWOwokmXkAYzxJb.jpg'],0,0,0,[],[],https://twitter.com/JasonHGTruitt/status/1253039337723363331,False,,1,https://pbs.twimg.com/media/EWOwokmXkAYzxJb.jpg,houston,,,,,,[],,,,
1253035628738088961,1253035628738088961,2020-04-22 13:59:08 CDT,2020-04-22,13:59:08,-0500,69392829,soniariveraus,𝕊𝕠𝕟𝕚𝕒 ℝ𝕚𝕧𝕖𝕣𝕒,,"@HarrisCoJudge Wow!!! When you get harsher punishment for not wearing a mask than for domestic violence, child abuse, assaults, robbery, murder ....😳  and putting additional strain on our @houstonpolice @HCSOTexas @HPOUTX  #SoniaintheCity  https://t.co/KroMeGHkD9",en,"[{'screen_name': 'houstonpolice', 'name': 'houston police', 'id': '104691452'}, {'screen_name': 'hcsotexas', 'name': 'hcsotexas', 'id': '1115569892'}, {'screen_name': 'hpoutx', 'name': ""houston police officers' union"", 'id': '1176634178'}]",[],['https://pbs.twimg.com/media/EWOtP0DXkAAY5ND.jpg'],0,0,0,['soniainthecity'],[],https://twitter.com/SoniaRiveraUS/status/1253035628738088961,False,,1,https://pbs.twimg.com/media/EWOtP0DXkAAY5ND.jpg,houston,,,,,,[],,,,
1253032078846894081,1252698734841847808,2020-04-22 13:45:02 CDT,2020-04-22,13:45:02,-0500,21154615,cocobunny78,EbonyLaDawn,,@BGisBrandonGray @YeaI_DidIt We have crime of passion laws so maybe. But another young life and for what?!,en,[],[],[],0,0,1,[],[],https://twitter.com/CocoBunny78/status/1253032078846894081,False,,0,,houston,,,,,,"[{'screen_name': 'BGisBrandonGray', 'name': '⚡BG', 'id': '451922770'}, {'screen_name': 'YeaI_Didit', 'name': 'Justin Case', 'id': '1458792094043148288'}]",,,,
1253024691557560320,1253024691557560320,2020-04-22 13:15:41 CDT,2020-04-22,13:15:41,-0500,112774988,cairhouston,cairhouston,"{'type': 'Point', 'coordinates': [29.7602, -95.3694]}","“Eat and drink from the provision of Allah, and do not commit abuse on the earth, spreading corruption.” (Quran 2:60)⁣⁣ ⁣⁣ Being stewards of the Earth, it is our responsibility to care for the environment. In Islam,…  https://t.co/YelQFbjKTl",en,[],['https://www.instagram.com/p/B_SvhBLjDkc/?igshid=1iwzxpyfh03pd'],[],0,1,2,[],[],https://twitter.com/cairhouston/status/1253024691557560320,False,,0,,houston,,,,,,[],,,,
1253023661705039873,1253003645077139458,2020-04-22 13:11:35 CDT,2020-04-22,13:11:35,-0500,53209684,adamclanton,Adam Clanton,,@CaptainTexas3 I’m standing by for the first idiot to call me racist for not wearing one. I can’t wait.,en,[],[],[],0,0,1,[],[],https://twitter.com/adamclanton/status/1253023661705039873,False,,0,,houston,,,,,,"[{'screen_name': 'CaptainTexas3', 'name': 'CaptainTexas', 'id': '1039496053928734720'}]",,,,
1253018766155354112,1252982137768345601,2020-04-22 12:52:08 CDT,2020-04-22,12:52:08,-0500,33526482,mike_zierlein,Mike Zierlein,,@backstrapfever3 @scottystroll @DLoesch I get that I hate the whiny we didn't get our way we list the election let's protest everything...but that's also what's starting to go on here...I think it's a slippery slope when we say forget the laws,en,[],[],[],0,0,0,[],[],https://twitter.com/Mike_Zierlein/status/1253018766155354112,False,,0,,houston,,,,,,"[{'screen_name': 'backstrapfever3', 'name': 'White Rationalist🇺🇸 Steve', 'id': '1187408399568384001'}, {'screen_name': 'scottystroll', 'name': 'Scotty', 'id': '900896700'}, {'screen_name': 'DLoesch', 'name': 'Dana Loesch', 'id': '7702542'}]",,,,
1253017614139482116,1253017614139482116,2020-04-22 12:47:33 CDT,2020-04-22,12:47:33,-0500,4106514132,et757022,Elzie,,A few hundred people at these so called protests are getting way to much attention.. Remember the millions of women protest in Washington and around world..,en,[],[],[],0,0,0,[],[],https://twitter.com/et757022/status/1253017614139482116,False,https://twitter.com/SykesCharlie/status/1252938878253662208,0,,houston,,,,,,[],,,,
1253014784154484736,1253014784154484736,2020-04-22 12:36:19 CDT,2020-04-22,12:36:19,-0500,971153791637598209,steph77520,Stephanie Arnold Long,,"BAN the global wildlife trade, which poses a horrific threat to animal welfare, our environment and human health #Banwildlifetrade #banwildlifemarkets #COVID19  https://t.co/s3ttETv2If",en,[],['https://secure.humanesociety.org/site/Advocacy?cmd=display&id=7702&page=UserAction&v=m&s_src=em_ha_04222020_131837.1&utm_source=convio&utm_medium=email&utm_campaign=earth_day_wildlife_market_ban_2020&utm_term=131837.1&utm_content=button'],[],0,0,0,"['banwildlifetrade', 'banwildlifemarkets', 'covid19']",[],https://twitter.com/Steph77520/status/1253014784154484736,False,,0,,houston,,,,,,[],,,,
1253013119540043776,1253013119540043776,2020-04-22 12:29:42 CDT,2020-04-22,12:29:42,-0500,348687715,christy_nguyen_,christy 💤,,"I’m just so confused on why people are bringing out their guns to protest a pandemic?? Y’all think people wanted this pandemic? Also ARE THEY PLANNING TO SHOOT THE VIRUS? + if there were black ppl on that truck, the cops would be all over it, this is white privlege fr",en,[],[],[],3,8,37,[],[],https://twitter.com/Christy_Nguyen_/status/1253013119540043776,False,https://twitter.com/miguelmarquez/status/1252294829154938881,0,,houston,,,,,,[],,,,
1253012722649911304,1253012722649911304,2020-04-22 12:28:07 CDT,2020-04-22,12:28:07,-0500,228420573,whyyayee,Yadira,,"Do i want new shoes, or a new gun?   Or both 🙃",en,[],[],[],0,0,2,[],[],https://twitter.com/WhyyAyee/status/1253012722649911304,False,,0,,houston,,,,,,[],,,,
1253009288546660353,1253009284583079936,2020-04-22 12:14:28 CDT,2020-04-22,12:14:28,-0500,921011895557083141,houston_cf,Houston Conservative Forum,,Thinking about the American Shooting Center tomorrow or Friday. #Texas  https://t.co/i5RJRNY5xK,en,[],['https://www.americanshootingcenters.com/'],[],0,0,0,['texas'],[],https://twitter.com/houston_cf/status/1253009288546660353,False,,0,,houston,,,,,,[],,,,
1253007900747972610,1253007900747972610,2020-04-22 12:08:57 CDT,2020-04-22,12:08:57,-0500,408573499,tank_texasboy99,"Tank Henry-Jackson , M.Ed.",,4-22-2018 was a hard pill to swallow. @deebony_lashae we love and miss you dearly.  RIP to our friend DeEbony and the other 3 lives that were taken in the deadly Waffle House shooting.  https://t.co/bkf9IOrSQ5,en,"[{'screen_name': 'deebony_lashae', 'name': 'petty spice 🤸🏾\u200d♀️', 'id': '532830222'}]",[],"['https://pbs.twimg.com/media/EWOUCwyX0AE0NlT.jpg', 'https://pbs.twimg.com/media/EWOUCwvXkAEBK7C.jpg']",0,8,64,[],[],https://twitter.com/tank_texasboy99/status/1253007900747972610,False,,1,https://pbs.twimg.com/media/EWOUCwyX0AE0NlT.jpg,houston,,,,,,[],,,,
1253007493074165769,1253007493074165769,2020-04-22 12:07:20 CDT,2020-04-22,12:07:20,-0500,817821992070029314,localyeehaw,baby yoda j.d.,,"how can y'all protest a virus do you think before this i was just saying ""yes"" to having sinusitis every 5 weeks???",en,[],[],[],0,0,2,[],[],https://twitter.com/localyeehaw/status/1253007493074165769,False,,0,,houston,,,,,,[],,,,
1253002607897071621,1252294829154938881,2020-04-22 11:47:56 CDT,2020-04-22,11:47:56,-0500,1172551483058872320,debbiestar19,ass-trology,,@miguelmarquez No affliation...so basically a bunch of white men hopped up on testosterone wanted to scream and hold murder machines.,en,[],[],[],0,0,1,[],[],https://twitter.com/debbiestar19/status/1253002607897071621,False,,0,,houston,,,,,,"[{'screen_name': 'miguelmarquez', 'name': 'Miguel Marquez', 'id': '21854543'}]",,,,
1253002324206895104,1253002324206895104,2020-04-22 11:46:48 CDT,2020-04-22,11:46:48,-0500,709835954228297728,bigoaktreemedia,Big Oak Tree Media,,"From bone-chilling murder investigations, to never-before-aired audio about Tejano music megastar Selena, to an inside scoop on all things space with NASA, get your fill of Texas history with these five Texan Podcasts.  https://t.co/ZvN0nCx8J0 #hounews",en,[],['https://preview.houstonchronicle.com/music/five-podcasts-every-texas-should-hear-15182925?utm_source=newsletter&utm_medium=email&utm_campaign=Chron_Preview&utm_term=features&utm_content=headlines&stn=nf'],[],0,1,2,['hounews'],[],https://twitter.com/bigoaktreemedia/status/1253002324206895104,False,,0,,houston,,,,,,[],,,,
1253002051275100162,1253002051275100162,2020-04-22 11:45:43 CDT,2020-04-22,11:45:43,-0500,2200631107,dysonreagan,rea💋,,tell all these old bitches they in danger,en,[],[],[],0,0,2,[],[],https://twitter.com/DysonReagan/status/1253002051275100162,False,,0,,houston,,,,,,[],,,,
1253001256911732736,1253001256911732736,2020-04-22 11:42:33 CDT,2020-04-22,11:42:33,-0500,228420573,whyyayee,Yadira,,Someone been watching how to get away with murder too much,en,[],[],[],0,0,0,[],[],https://twitter.com/WhyyAyee/status/1253001256911732736,False,https://twitter.com/abc13houston/status/1253000693079855111,0,,houston,,,,,,[],,,,
1253000955446034433,1253000955446034433,2020-04-22 11:41:22 CDT,2020-04-22,11:41:22,-0500,21836962,jeffsyptak,Jeff Syptak,,“We want to do everything we can to lower the amount of #domesticviolence happening in our city. #COVID19 does not give anyone the opportunity to engage in domestic violence.”-@SylvesterTurner,en,"[{'screen_name': 'sylvesterturner', 'name': 'sylvester turner', 'id': '115105973'}]",[],[],3,5,18,"['domesticviolence', 'covid19']",[],https://twitter.com/JeffSyptak/status/1253000955446034433,False,,0,,houston,,,,,,[],,,,
1253000940141109253,1253000940141109253,2020-04-22 11:41:18 CDT,2020-04-22,11:41:18,-0500,24684105,lorddblake,Chris Blake.,,"You cannot see your reflection in boiling water. Similarly, you cannot see truth in a state of anger.",en,[],[],[],2,9,13,[],[],https://twitter.com/lorddblake/status/1253000940141109253,False,,0,,houston,,,,,,[],,,,
1252999432225853440,1252982137768345601,2020-04-22 11:35:18 CDT,2020-04-22,11:35:18,-0500,33526482,mike_zierlein,Mike Zierlein,,@scottystroll @backstrapfever3 @DLoesch So if someone is commiting a crime on a law they don't agree with police should let it go....got it,en,[],[],[],1,0,0,[],[],https://twitter.com/Mike_Zierlein/status/1252999432225853440,False,,0,,houston,,,,,,"[{'screen_name': 'scottystroll', 'name': 'Scotty', 'id': '900896700'}, {'screen_name': 'backstrapfever3', 'name': 'White Rationalist🇺🇸 Steve', 'id': '1187408399568384001'}, {'screen_name': 'DLoesch', 'name': 'Dana Loesch', 'id': '7702542'}]",,,,
