id,conversation_id,created_at,date,time,timezone,user_id,username,name,place,tweet,language,mentions,urls,photos,replies_count,retweets_count,likes_count,hashtags,cashtags,link,retweet,quote_url,video,thumbnail,near,geo,source,user_rt_id,user_rt,retweet_id,reply_to,retweet_date,translate,trans_src,trans_dest
1215420971621998594,1215420971621998594,2020-01-09 17:51:55 CST,2020-01-09,17:51:55,-0500,66776059,fabricdragon,kirsten houseknecht,,"It was unintentional. The usa and fox news were saber rattling about an attack, and this civilian plane came into the airspace...",en,[],[],[],0,0,1,[],[],https://twitter.com/fabricdragon/status/1215420971621998594,False,https://twitter.com/RedTRaccoon/status/1215366167327649792,0,,philadelphia,,,,,,[],,,,
1215418191041781761,1215381804388978691,2020-01-09 17:40:52 CST,2020-01-09,17:40:52,-0500,14075680,jdkahler,jdkahler,,@KelinWonder @C_Stroop Don’t you remember Jesus saying to bring the children to me so I can attack and abuse them? I don’t either. Where do alleged Christians get this nonsense?,en,[],[],[],0,0,1,[],[],https://twitter.com/jdkahler/status/1215418191041781761,False,,0,,philadelphia,,,,,,"[{'screen_name': 'KelinWonder', 'name': 'Accidental Moss Farmer', 'id': '977348811336007680'}, {'screen_name': 'C_Stroop', 'name': 'Chrissy Stroop', 'id': '1220645714'}]",,,,
1215416269761142784,1215416269761142784,2020-01-09 17:33:14 CST,2020-01-09,17:33:14,-0500,3369762591,ouchasaurus,Prof Ouch,,Mass murderers hardback book by Time Life 1992 in excellent condition with the mailing cardboard box. $24 shipped to the USA. This is a very nice hardback book good for any true crime or killer Library  https://t.co/yNOwVFWDMa,en,[],[],['https://pbs.twimg.com/media/EN4GpTMU4AAkylD.jpg'],0,0,0,[],[],https://twitter.com/ouchasaurus/status/1215416269761142784,False,,1,https://pbs.twimg.com/media/EN4GpTMU4AAkylD.jpg,philadelphia,,,,,,[],,,,
1215414712957054976,1215414712957054976,2020-01-09 17:27:03 CST,2020-01-09,17:27:03,-0500,72477583,mel06890,melissa,,“Is lime juice considered a weapon” — @emmmiilly14,en,"[{'screen_name': 'emmmiilly14', 'name': 'emily ball', 'id': '1353313669'}]",[],[],0,0,0,[],[],https://twitter.com/mel06890/status/1215414712957054976,False,,0,,philadelphia,,,,,,[],,,,
1215414691599732736,1215414691599732736,2020-01-09 17:26:58 CST,2020-01-09,17:26:58,-0500,185194792,dominickambro,dominick ambrosia,, https://t.co/SYDXtzfUi9 No War on Iran protest taking place in Center City in Philadelphia,en,[],['https://www.inquirer.com/news/philadelphia-anti-war-protest-iran-move-on-city-hall-thursday-20200109.html'],[],0,1,1,[],[],https://twitter.com/dominickambro/status/1215414691599732736,False,,0,,philadelphia,,,,,,[],,,,
1215413149815525376,1215413149815525376,2020-01-09 17:20:50 CST,2020-01-09,17:20:50,-0500,27665061,theorangenblack,Matt,,"Guess we’ll see how valuable Al Horford is tonight. Another year, another brutal Embiid injury 🙄 Complete freak accident, but man.",en,[],[],[],0,1,2,[],[],https://twitter.com/TheOrangeNBlack/status/1215413149815525376,False,,0,,philadelphia,,,,,,[],,,,
1215413100683329536,1215413100683329536,2020-01-09 17:20:39 CST,2020-01-09,17:20:39,-0500,305297239,_sunflowerchick,✨ smoking henny & Drinking crack ✨,,It’s illegal to have sex with ANYONE 4 years younger then you  that kid was 10 the person was 18 it was rape and you’re slow .,en,[],[],[],0,0,1,[],[],https://twitter.com/_SunflowerChick/status/1215413100683329536,False,https://twitter.com/MLauryn_x/status/1215412015709196289,0,,philadelphia,,,,,,[],,,,
1215412702723629057,1215412702723629057,2020-01-09 17:19:04 CST,2020-01-09,17:19:04,-0500,55457772,frankplunkett,Frank Plunkett,,Is this Embiid guy ever not sick or injured. @sixers ?,en,"[{'screen_name': 'sixers', 'name': 'philadelphia 76ers', 'id': '16201775'}]",[],[],0,0,0,[],[],https://twitter.com/frankplunkett/status/1215412702723629057,False,,0,,philadelphia,,,,,,[],,,,
1215408917733433345,1215318047948333056,2020-01-09 17:04:01 CST,2020-01-09,17:04:01,-0500,470593031,thrashtom,Tom Tirado,,"@stevelane22 @healthnutmeg And for the record, I served in iraq I’ve been under mortar attack before So you go ahead and cowardly pretend I mourn terrorists",en,[],[],[],1,0,0,[],[],https://twitter.com/thrashtom/status/1215408917733433345,False,,0,,philadelphia,,,,,,"[{'screen_name': 'stevelane22', 'name': 'Steve L', 'id': '1196981470482419712'}, {'screen_name': 'healthnutmeg', 'name': 'Megan Carson', 'id': '795863685679849472'}]",,,,
1215408100964028417,1215408100964028417,2020-01-09 17:00:47 CST,2020-01-09,17:00:47,-0500,238010511,shann_anigan,shann,,I really need to stop listening to true crime podcast bc now i’m constantly thinking someone is going to try to kill me,en,[],[],[],0,0,7,[],[],https://twitter.com/SHANN_anigan/status/1215408100964028417,False,,0,,philadelphia,,,,,,[],,,,
1215408082521612288,1215408082521612288,2020-01-09 17:00:42 CST,2020-01-09,17:00:42,-0500,2149378217,jerrystiny1,Jerry Schroeder,,"We understand what happened and know stress from situation but using proxy to attack Americans for your benefit, whether hired or yourself are ultimately responsible for their actions.",en,[],[],[],0,0,0,[],[],https://twitter.com/jerrystiny1/status/1215408082521612288,False,https://twitter.com/Reuters/status/1215406646169686018,0,,philadelphia,,,,,,[],,,,
1215403200355934210,1215403200355934210,2020-01-09 16:41:18 CST,2020-01-09,16:41:18,-0500,21612335,danobrien_,Dan O'Brien,,I play this game in my neighborhood a few times per week where I cross the street to get home and cars try to murder me. We have fun.,en,[],[],[],0,1,5,[],[],https://twitter.com/DanOBrien_/status/1215403200355934210,False,,0,,philadelphia,,,,,,[],,,,
1215399700083376128,1215268037592584194,2020-01-09 16:27:24 CST,2020-01-09,16:27:24,-0500,2649202271,eliseeney,Hommie Shelby,,"@EldicaTaylor I mean...is it really what you want? I don’t have that “I got a gun on me, opps and the cops trying to kill me, two angry baby mommas that wanna beat the brakes off you, lying and you wondering where I’m at” type excitement 😂",en,[],[],[],1,0,1,[],[],https://twitter.com/EliSeeney/status/1215399700083376128,False,,0,,philadelphia,,,,,,[],,,,
1215394571116597255,1215376340381134848,2020-01-09 16:07:01 CST,2020-01-09,16:07:01,-0500,4624210763,dyck_robin,Dyck-robin-Greyson,,"@Alyssa_Milano Now that you backed up, you can see the real reason for the #Iranian attack by the #WH still covering their asses.",en,[],[],[],0,1,1,"['iranian', 'wh']",[],https://twitter.com/dyck_robin/status/1215394571116597255,False,,0,,philadelphia,,,,,,"[{'screen_name': 'Alyssa_Milano', 'name': 'Alyssa Milano', 'id': '26642006'}]",,,,
1215394512031354887,1215394512031354887,2020-01-09 16:06:47 CST,2020-01-09,16:06:47,-0500,128313714,broadstbull,Sam Carchidi,,Same knee he injured with Phantoms in 2014 and had ACL surgery.,en,[],[],[],0,1,2,[],[],https://twitter.com/BroadStBull/status/1215394512031354887,False,https://twitter.com/kmh027/status/1215378706279079936,0,,philadelphia,,,,,,[],,,,
1215391093652709376,1215391093652709376,2020-01-09 15:53:12 CST,2020-01-09,15:53:12,-0500,961036656550797312,___keej,Jan✨💞,,Every time she wild out on a nigga it be for a legitimate reason. These niggas just quick to play victim. She just got a different way of showing emotion I feel her! A bitch be tired of getting hurt 🥴🤷🏽‍♀️,en,[],[],[],1,1,2,[],[],https://twitter.com/___KeeJ/status/1215391093652709376,False,https://twitter.com/DuckworthDaya__/status/1215390676843737089,0,,philadelphia,,,,,,[],,,,
1215387481870422016,1215387481870422016,2020-01-09 15:38:51 CST,2020-01-09,15:38:51,-0500,2715563954,voxpopuli526,Dunstan Harding,,#ThursdayThoughts  The failure of the White House press  corps to come to Nancy Pelosi's defense to correct the record with respect to her response to Trump's murder of the Iranian general was worse than Trump's outrageous lies themselves. He  baited them and they took the hook.,en,[],[],[],0,0,0,['thursdaythoughts'],[],https://twitter.com/VoxPopuli526/status/1215387481870422016,False,,0,,philadelphia,,,,,,[],,,,
1215382637432508432,1215382637432508432,2020-01-09 15:19:36 CST,2020-01-09,15:19:36,-0500,722206447,consciousbrotha,Fig Newtons & Mint Chocolate Chip Ice Cream Stan,,"If some of y'all would stop being work snitches and wanna be managers, maybe workplace violence would drop and y'all wouldn't be getting shot up all the time.",en,[],[],[],0,0,7,[],[],https://twitter.com/consciousBrOtHa/status/1215382637432508432,False,,0,,philadelphia,,,,,,[],,,,
1215381405510905856,1215381405510905856,2020-01-09 15:14:42 CST,2020-01-09,15:14:42,-0500,2360221570,blevmontana_01,Blev Montana,,See one of my bitches warning ⚠️ me I ain’t listen that shit harm me I fucked up but I’m still learning 💯💯,en,[],[],[],0,0,0,[],[],https://twitter.com/BlevMontana_01/status/1215381405510905856,False,,0,,philadelphia,,,,,,[],,,,
1215380613735354377,1214267053043060738,2020-01-09 15:11:33 CST,2020-01-09,15:11:33,-0500,2195211950,tuviaklein,All ice creams are created equal,,@JZarif Are you still shooting down 737s.  🛩🚀✈️ do😡,en,[],[],[],0,0,0,[],[],https://twitter.com/tuviaklein/status/1215380613735354377,False,,0,,philadelphia,,,,,,"[{'screen_name': 'JZarif', 'name': 'Javad Zarif', 'id': '47813521'}]",,,,
