id,conversation_id,created_at,date,time,timezone,user_id,username,name,place,tweet,language,mentions,urls,photos,replies_count,retweets_count,likes_count,hashtags,cashtags,link,retweet,quote_url,video,thumbnail,near,geo,source,user_rt_id,user_rt,retweet_id,reply_to,retweet_date,translate,trans_src,trans_dest
1294782272202104832,1294686767459627008,2020-08-15 18:45:24 CDT,2020-08-15,18:45:24,-0500,3221901355,nathancats_,nathan,,"@rossjordanphoto HAHAHA IM DEAD that you saw them too!! And yes, that’s what it is 😬",en,[],[],[],0,0,1,[],[],https://twitter.com/Nathancats_/status/1294782272202104832,False,,0,,san diego,,,,,,"[{'screen_name': 'rossjordanphoto', 'name': 'Ross Jordan', 'id': '1071087886890487808'}]",,,,
1294777075371393024,1294777075371393024,2020-08-15 18:24:45 CDT,2020-08-15,18:24:45,-0500,1221486896787812353,myradee16,Myra Dee,,Lei and GENELL LAWYER GET READY HIT U ALL WITH THEFT CHARGES TRYING FORCE GIRLS PAY BILLS OF NOTHER FAMILY  WHO NOT LEO FAMILY THEY GOT SISTER WITH MEDUCAL CONDITION SEE HOW STUPID U R LOOKING SOUNDING U ALL CAN'T FORCE KATHY TO FINISH HURTING HUR SISTERS WHEN IT COME INSURENCE,en,[],[],[],0,0,0,[],[],https://twitter.com/MyraDee16/status/1294777075371393024,False,,0,,san diego,,,,,,[],,,,
1294776518665592834,1294776518665592834,2020-08-15 18:22:32 CDT,2020-08-15,18:22:32,-0500,1221486896787812353,myradee16,Myra Dee,,SO NOW SEC HOUSE  THAT U FORCED ME OUT OF I'M HOMELESS IS WAY ALARM WAS SET WHY R U IN HOUSE HARASSING COUPLE WHO NOW OWN OAK AND THEN IF SHE OWN HOUSE SO THAT POINT  WHY R U ALL saleing SHIT  under  MYRA FORCE  HUR TO PAY BILLS SHE DIDN'T  MAKE KEEP TALKING,en,[],[],[],0,0,0,[],[],https://twitter.com/MyraDee16/status/1294776518665592834,False,,0,,san diego,,,,,,[],,,,
1294775793382379520,1294270672907239425,2020-08-15 18:19:39 CDT,2020-08-15,18:19:39,-0500,15879459,releasethedogs,ɌҽlҽasҽThҽᗪoɠς🇺🇦🌻,,"@Gibsojus @DynamoNestico @TarmoKat I’m not for outing who this person’s victims are. They can come out if/when they feel it is safe. The person doing the abuse though, they need to be named and depowered. Once this has happened, the victims can be sure the community supports them and they can tell their story.",en,[],[],[],1,0,0,[],[],https://twitter.com/releasethedogs/status/1294775793382379520,False,,0,,san diego,,,,,,"[{'screen_name': 'Gibsojus', 'name': 'Emotionally Complex Rancor of Justice', 'id': '496465728'}, {'screen_name': 'DynamoNestico', 'name': 'Selling Cards Sucks', 'id': '1353646339'}, {'screen_name': 'TarmoKat', 'name': 'Kat, Queen of the Antibodies💉', 'id': '735570269176094720'}]",,,,
1294775644165824512,1294775644165824512,2020-08-15 18:19:03 CDT,2020-08-15,18:19:03,-0500,1221486896787812353,myradee16,Myra Dee,,NICHOLE U ALL TRYING FORCE MY FAMILY PUT UP OUR PARENT'S HOUSE AND OAK MR TEVEL LOST HIS HOME TO US 4 SALE ALL IT DID RAISE QUESTION  WHY DO THE FAMILY HAVE SALE SHIT IF THEY R NOT IN DEBT WAT FUCK R U ALL DOING HARASS LEO WIFE KIDS THAT IS EXACTLY WAT U ALL DID UP TILL SHE PAST,en,[],[],[],0,0,0,[],[],https://twitter.com/MyraDee16/status/1294775644165824512,False,,0,,san diego,,,,,,[],,,,
1294765800776036353,1294765800776036353,2020-08-15 17:39:57 CDT,2020-08-15,17:39:57,-0500,479287746,shenanigans330,Tom Phillips* 👁️⃤,,"Correction. You did nothing in Feb/March and 160k are dead because of that.   The fact that many are escaping to boats isnt a vote in your favor, dotard! 😉",en,[],[],[],0,0,0,[],[],https://twitter.com/Shenanigans330/status/1294765800776036353,False,https://twitter.com/atrupar/status/1294757116641763330,0,,san diego,,,,,,[],,,,
1294756444684693505,1294756444684693505,2020-08-15 17:02:46 CDT,2020-08-15,17:02:46,-0500,1221486896787812353,myradee16,Myra Dee,,HE LISTEN VERY WELL BUT NIKKI HE NOT LET U TUCH MY MONEY THAT POINT SO ADDIE HELPER  PISSED HIM OFF HE  NOT PAY 4 CARE SERVAICE HE NOT LET U ABUSE ME DUMMY,en,[],[],[],0,0,0,[],[],https://twitter.com/MyraDee16/status/1294756444684693505,False,,0,,san diego,,,,,,[],,,,
1294756106103742464,1294756106103742464,2020-08-15 17:01:25 CDT,2020-08-15,17:01:25,-0500,1221486896787812353,myradee16,Myra Dee,,GETTING better FASTER AND SWEET NIKKI FORCE  THE ROBBERY NOTE,en,[],[],[],0,0,0,[],[],https://twitter.com/MyraDee16/status/1294756106103742464,False,,0,,san diego,,,,,,[],,,,
1294755709330927616,1294404931642961926,2020-08-15 16:59:51 CDT,2020-08-15,16:59:51,-0500,15879459,releasethedogs,ɌҽlҽasҽThҽᗪoɠς🇺🇦🌻,,"@tasherron @Memers08 @KazePlays_JC This photo is really sort of offensive. Adderall isn’t a punch line, it’s something quite a few people need to be successful. It’s a treatment for a disability and I know you’re not the kind of person who would mock a disabled man.",en,[],[],[],3,0,5,[],[],https://twitter.com/releasethedogs/status/1294755709330927616,False,,0,,san diego,,,,,,"[{'screen_name': 'tasherron', 'name': 'Terri Sherron', 'id': '2698910700'}, {'screen_name': 'Memers08', 'name': 'Honorable Guilded Dirigible', 'id': '83963204'}]",,,,
1294754217068867584,1294542133718704130,2020-08-15 16:53:55 CDT,2020-08-15,16:53:55,-0500,445119841,lizzetteanessa,Anessa,,@sandragonzy @tbentley63 a rapist,en,[],[],[],0,0,0,[],[],https://twitter.com/LizzetteAnessa/status/1294754217068867584,False,,0,,san diego,,,,,,"[{'screen_name': 'sandragonzy', 'name': 'sg☀️', 'id': '725170148714287105'}, {'screen_name': 'tbentley63', 'name': 'TBENTLEY63', 'id': '1291778840193380353'}]",,,,
1294752792146370560,1294752792146370560,2020-08-15 16:48:15 CDT,2020-08-15,16:48:15,-0500,3027210915,ysmglilron,sadboymitch💕,,"good defense, better offense 🤷🏽‍♂️",en,[],[],[],0,1,4,[],[],https://twitter.com/YSMGLilRon/status/1294752792146370560,False,https://twitter.com/SportsCenter/status/1294741192375185414,0,,san diego,,,,,,[],,,,
1294749762814541824,1293647470409310209,2020-08-15 16:36:13 CDT,2020-08-15,16:36:13,-0500,623934032,rafasandiego,Rafa Castellanos,,"You don’t have to be smart, capable, or have better ideas, if you’re willing to lie, cheat, steal and abuse power to win an election.",en,[],[],[],1,1,1,[],[],https://twitter.com/RafaSanDiego/status/1294749762814541824,False,,0,,san diego,,,,,,[],,,,
1294749719395053568,1293647470409310209,2020-08-15 16:36:03 CDT,2020-08-15,16:36:03,-0500,623934032,rafasandiego,Rafa Castellanos,,"It’s not a policy controversy. It’s a full on physical assault on part of our voting system. To quote my 84 year-old mom, “ese  cabrón se quiere robar la elección.” You don’t need to speak Spanish to know what that means.",en,[],[],[],1,1,1,[],[],https://twitter.com/RafaSanDiego/status/1294749719395053568,False,,0,,san diego,,,,,,[],,,,
1294744379408527360,1294742149561323520,2020-08-15 16:14:49 CDT,2020-08-15,16:14:49,-0500,174661447,tkoppe22,Koppe22🇺🇦🇮🇪🇺🇲,,"@ahammTNT Of course they will, 200,000 people are dead and all they care about is football .",en,[],[],[],0,0,0,[],[],https://twitter.com/TKoppe22/status/1294744379408527360,False,,0,,san diego,,,,,,[],,,,
1294742360681668608,1294742360681668608,2020-08-15 16:06:48 CDT,2020-08-15,16:06:48,-0500,1097676763470020609,brittanyyvette_,Brittany 🏁,,"People don’t even get how like the little subtle things can hurt your feelings, but I mean it’s cool, I guess. 🙂",en,[],[],[],0,0,1,[],[],https://twitter.com/brittanyyvette_/status/1294742360681668608,False,,0,,san diego,,,,,,[],,,,
1294736527054913537,1294736527054913537,2020-08-15 15:43:37 CDT,2020-08-15,15:43:37,-0500,1221486896787812353,myradee16,Myra Dee,,She won't be created accident IN OUT IF I'M WITH KIDS LIKE SAID SHE WILL ABUSE CHILDREN WE SAW,en,[],[],[],0,0,0,[],[],https://twitter.com/MyraDee16/status/1294736527054913537,False,,0,,san diego,,,,,,[],,,,
1294734475033600001,1289610144867704832,2020-08-15 15:35:28 CDT,2020-08-15,15:35:28,-0500,1067795989723922433,highlan63620036,Highlander,,"@IHaveAThought2 @FSUatlanta @ChloeSalsameda @OANN @WSJ @VP @NikkiHaley Let me straighten you out, like your previous misconceptions. Flynn &amp; Stone. Obama administration instructed Comey and FBI agents to set them up, they got caught.  Epstein a scum predator includes Bill Clinton flew to Epsteins Island 23 times to sexually assault young girls.",en,[],[],[],2,0,0,[],[],https://twitter.com/Highlan63620036/status/1294734475033600001,False,,0,,san diego,,,,,,"[{'screen_name': 'IHaveAThought2', 'name': 'I Have A Thought', 'id': '1142458914073645056'}, {'screen_name': 'ChloeSalsameda', 'name': 'Chloe Salsameda', 'id': '1099207942572728320'}, {'screen_name': 'OANN', 'name': 'One America News', 'id': '1209936918'}, {'screen_name': 'WSJ', 'name': 'The Wall Street Journal', 'id': '3108351'}, {'screen_name': 'VP', 'name': 'Vice President Kamala Harris', 'id': '803694179079458816'}, {'screen_name': 'NikkiHaley', 'name': 'Nikki Haley', 'id': '1079776144524754944'}]",,,,
1294731764066217984,1294731764066217984,2020-08-15 15:24:42 CDT,2020-08-15,15:24:42,-0500,1221486896787812353,myradee16,Myra Dee,,COUNTY NEEDED SEE U ALL FULL ACT U ALL WITHERED  4 A FORMER CASE  WORKER SHE GOT HUR HOUSES  MILKING  FROM DISABLED SHE TOUGHT U ALL AND FAMILY HOW ABUSE AND MILK THAT  RAISES CONSERNS,en,[],[],[],0,0,0,[],[],https://twitter.com/MyraDee16/status/1294731764066217984,False,,0,,san diego,,,,,,[],,,,
1294731212490063872,1294731212490063872,2020-08-15 15:22:30 CDT,2020-08-15,15:22:30,-0500,1221486896787812353,myradee16,Myra Dee,,THE POINT CAN'T SAY MUCH WHY SHIT ENDING  UP ASS WAY WE ALL R HAVE BEEN SAYING MY MENTAL HEALTH  WILL NOT STOP MIKE FROM GETTING IN TROUBLE OVER FORCE  OUT OF HOUSE  NICHOLE U ALL PLAY ON HEALTH SO WHEN PEOPLE HEAR WAT U ALL HAVE DONE THEY HELP THE PERSON  OUT WHO BECAME HOMELESS,en,[],[],[],0,0,0,[],[],https://twitter.com/MyraDee16/status/1294731212490063872,False,,0,,san diego,,,,,,[],,,,
1294728529595138048,1294728529595138048,2020-08-15 15:11:51 CDT,2020-08-15,15:11:51,-0500,925606537,takeyialynn,takeyia harvey,,do they only count American citizens in the Covid death toll or do they include individuals without citizenship?? Bc if it’s counted the first way then that number has got to be higher,en,[],[],[],0,0,0,[],[],https://twitter.com/takeyialynn/status/1294728529595138048,False,,0,,san diego,,,,,,[],,,,
1294726997269049344,1294726997269049344,2020-08-15 15:05:45 CDT,2020-08-15,15:05:45,-0500,1221486896787812353,myradee16,Myra Dee,,SHE ASSISTED MIKE IN SKI HOUSE ABUSING MAN WHO GOT CABLE INNOCENT  SHE IS AND IF SO SHE SHOULD BE KUNKT PUNCHED LONG WITH JLHIM MISTREATENT PEOPLE SAUGHT CARE DIDN'T GET IT,en,[],[],[],0,0,0,[],[],https://twitter.com/MyraDee16/status/1294726997269049344,False,,0,,san diego,,,,,,[],,,,
1294716838308282368,1294716838308282368,2020-08-15 14:25:23 CDT,2020-08-15,14:25:23,-0500,47021357,kingcrablegs420,Natasha L,,If I ever had a kid that turned out to be a bully I would literally hold them down and let them get beat up by the person they were bullying,en,[],[],[],1,0,3,[],[],https://twitter.com/kingcrablegs420/status/1294716838308282368,False,,0,,san diego,,,,,,[],,,,
1294714102179172352,1294714102179172352,2020-08-15 14:14:31 CDT,2020-08-15,14:14:31,-0500,50078971,joleekirk,Joe Biden is a Corporate Cuck,,Hey @ewarren—are you going to stand up for victims of sexual assault by demanding that the @DNC REMOVE @MikeBloomberg from the speaking lineup at the Democratic National Convention?  You SEEMED to care during the debate.   No? Didn’t think ssssssssssssso.,en,"[{'screen_name': 'ewarren', 'name': 'elizabeth warren', 'id': '357606935'}, {'screen_name': 'dnc', 'name': 'democratic party', 'id': '722793491059769344'}, {'screen_name': 'mikebloomberg', 'name': 'mike bloomberg', 'id': '16581604'}]",[],[],0,0,0,[],[],https://twitter.com/joleekirk/status/1294714102179172352,False,https://twitter.com/ReadeAlexandra/status/1294710082345684999,0,,san diego,,,,,,[],,,,
1294710503525105664,1294710503525105664,2020-08-15 14:00:13 CDT,2020-08-15,14:00:13,-0500,21775167,timcjudd,Antifa’s HR Manager,,@realkatiejow I’m an evil leftist. Am I kidnapping and terrorizing tiny kids kids so I can drink their blood for adrenochrome? Why would I do that when I can buy it online for $50...please explain  https://t.co/hLSRaBOuL0,en,[],[],['https://pbs.twimg.com/media/Efe8VqoUEAIwluz.jpg'],0,0,0,[],[],https://twitter.com/TimCJudd/status/1294710503525105664,False,,1,https://pbs.twimg.com/media/Efe8VqoUEAIwluz.jpg,san diego,,,,,,[],,,,
1294708838323466242,1294706178950397954,2020-08-15 13:53:36 CDT,2020-08-15,13:53:36,-0500,174661447,tkoppe22,Koppe22🇺🇦🇮🇪🇺🇲,,"@JRB_OK @RedDirtSport Same thing on the New Mexico Air Force base. Guys test positive,  quarantine, come back and test positive again 5 months later . Lots of unknowns still.",en,[],[],[],1,0,1,[],[],https://twitter.com/TKoppe22/status/1294708838323466242,False,,0,,san diego,,,,,,"[{'screen_name': 'JRB_OK', 'name': 'J', 'id': '242232536'}, {'screen_name': 'RedDirtSport', 'name': 'RedDirtSport', 'id': '203810008'}]",,,,
1294707131849965569,1294706178950397954,2020-08-15 13:46:49 CDT,2020-08-15,13:46:49,-0500,174661447,tkoppe22,Koppe22🇺🇦🇮🇪🇺🇲,,@RedDirtSport With 6 negative tests in between.  Hes Air Force . You absolutely can get reinfected.,en,[],[],[],1,0,0,[],[],https://twitter.com/TKoppe22/status/1294707131849965569,False,,0,,san diego,,,,,,"[{'screen_name': 'RedDirtSport', 'name': 'RedDirtSport', 'id': '203810008'}]",,,,
1294704886605443072,1294704886605443072,2020-08-15 13:37:54 CDT,2020-08-15,13:37:54,-0500,345042332,vinnyfg5,VXNY,,Checking out but coming back to the room until they kick you out &gt;&gt;&gt;,en,[],[],[],0,0,1,[],[],https://twitter.com/VinnyFG5/status/1294704886605443072,False,,0,,san diego,,,,,,[],,,,
1294702972807426048,1294702972807426048,2020-08-15 13:30:17 CDT,2020-08-15,13:30:17,-0500,318089753,unusualshardel,MISS SHARDEL,,I’m such a chill girl I’m definitely not one to lie to even if you believe it’s going to hurt my feelings.,en,[],[],[],0,0,0,[],[],https://twitter.com/unusualshardel/status/1294702972807426048,False,,0,,san diego,,,,,,[],,,,
1294700912145887232,1294692780560670722,2020-08-15 13:22:06 CDT,2020-08-15,13:22:06,-0500,980162558056308736,writemadhushree,Dr. Madhushree Ghosh,,"Not dead. Please, not dead. Damn autocorrect. Dear. dear barista. Oy oy.",en,[],[],[],1,0,3,[],[],https://twitter.com/WriteMadhushree/status/1294700912145887232,False,,0,,san diego,,,,,,[],,,,
1294699757454200833,1294699757454200833,2020-08-15 13:17:31 CDT,2020-08-15,13:17:31,-0500,2378875243,okmayday,OK MAYDAY,,“So he kick push kick push kick push kick push coast....” - Blasted Lupe as the sun disappeared behind the vastness of the Pacific Blue. 🖤 #coronado  https://t.co/axXepYvqSD,en,[],[],['https://pbs.twimg.com/media/EfeykEBXYAER8Pc.jpg'],1,0,8,['coronado'],[],https://twitter.com/OKMAYDAY/status/1294699757454200833,False,,1,https://pbs.twimg.com/media/EfeykEBXYAER8Pc.jpg,san diego,,,,,,[],,,,
1294696122271715329,1292315992694108163,2020-08-15 13:03:04 CDT,2020-08-15,13:03:04,-0500,345779170,brokenbose,John Becknell,,"@BWSchank @JaydonHeireann @JeffPassage @JohnB89164889 @KateKadette @CatholicCharm And what is Abraham's bosom if only two places exist, heaven and hell?  The OT fathers couldn't go to heaven because Christ hadn't yet risen from the dead.  So what is this other place?",en,[],[],[],1,0,0,[],[],https://twitter.com/brokenbose/status/1294696122271715329,False,,0,,san diego,,,,,,"[{'screen_name': 'BWSchank', 'name': 'But_Now_Salt', 'id': '526555848'}, {'screen_name': 'JaydonHeireann', 'name': 'Saoirse na hÉireann', 'id': '1236342555903758344'}, {'screen_name': 'CatholicCharm', 'name': '☀️ Catholic Charm ✞ ☀️', 'id': '730096044973887489'}]",,,,
1294694607700164608,1294694607700164608,2020-08-15 12:57:03 CDT,2020-08-15,12:57:03,-0500,21775167,timcjudd,Antifa’s HR Manager,,"I’m fascinated by the #QAnons #Qidiots they believe that evil leftists kidnap toddlers, torture and terrorize them to make them produce adrenochrome...then drink their blood...on a massive scale.  That seems overly complicated when you can buy it online for $50...#WWGIWGA #QAnon  https://t.co/0S7oSC38qp",en,[],[],['https://pbs.twimg.com/media/Efet4ccUEAAdrWo.jpg'],0,1,0,"['qanons', 'qidiots', 'wwgiwga', 'qanon']",[],https://twitter.com/TimCJudd/status/1294694607700164608,False,,1,https://pbs.twimg.com/media/Efet4ccUEAAdrWo.jpg,san diego,,,,,,[],,,,
1294693926989832192,1294693926989832192,2020-08-15 12:54:21 CDT,2020-08-15,12:54:21,-0500,1040396104091688963,bobcarr58684439,bob carroll,,"Everything Happening In OUR Country, Not Trumps, Is A Direct Result Of A Lying, Corrupt, Hating, Devivsive, Immoral, Sickness and Death, ETC IS BECAUSE Of TRUMPS LEADERSHIP!!! Can Our Country Survive 4 MORE YEARS Of Trumps So Called Leadership???!!!",en,[],[],[],0,0,0,[],[],https://twitter.com/bobcarr58684439/status/1294693926989832192,False,,0,,san diego,,,,,,[],,,,
1294692055789137920,1162027150742044673,2020-08-15 12:46:54 CDT,2020-08-15,12:46:54,-0500,879022296588984321,lin__ars,Lina,,@phelan16 He’s not dead you can still cheer for him,en,[],[],[],1,0,0,[],[],https://twitter.com/lin__ars/status/1294692055789137920,False,,0,,san diego,,,,,,"[{'screen_name': 'phelan16', 'name': 'Pat Phelan', 'id': '201919883'}]",,,,
1294691345978675200,1294691345978675200,2020-08-15 12:44:05 CDT,2020-08-15,12:44:05,-0500,285182559,stephenhumd,"Stephen Hu, MD MPH",,"This is a great advancement! Especially for schools and sports, continued surveillance so we aren’t caught unawares and we don’t have to stab our kids multiple times!",en,[],[],[],0,0,0,[],[],https://twitter.com/stephenhumd/status/1294691345978675200,False,https://twitter.com/ASlavitt/status/1294654256763609090,0,,san diego,,,,,,[],,,,
1294690876262760449,1294688839483752448,2020-08-15 12:42:13 CDT,2020-08-15,12:42:13,-0500,835978597047271424,barbaramain07,Barbara Main 🌻,,"@FrakerMonica From the whole GOP🤷‍♀️ 170000 dead, 14 million still unemployed and millions facing eviction.... but enjoy the flowers! It’s time for a president for the people #BidenHarris2020ToSaveAmerica",en,[],[],[],0,0,3,['bidenharris2020tosaveamerica'],[],https://twitter.com/BarbaraMain07/status/1294690876262760449,False,,0,,san diego,,,,,,"[{'screen_name': 'FrakerMonica', 'name': 'Monica Fraker', 'id': '830159625093783552'}]",,,,
1294690617130278912,1294690617130278912,2020-08-15 12:41:11 CDT,2020-08-15,12:41:11,-0500,1167056910,lexwalsh444,lex,,"suicide rates are 3.5x more common in men than in women. don't ever think bc someone is strong that they do not struggle  check on your friends, no matter the fuck what   men's mental health is not talked about enough and we need to normalize men seeking help when needed ❗️❗️❗️❗️",en,[],[],[],0,2,6,[],[],https://twitter.com/lexwalsh444/status/1294690617130278912,False,,0,,san diego,,,,,,[],,,,
1294690153710067715,1294690153710067715,2020-08-15 12:39:21 CDT,2020-08-15,12:39:21,-0500,30153687,aidansheart,CJ Good,,The issue here is two things. 1) Good to see that MI had a structure to find dead people 2) How many got through because they sent out ballots to dead people    MI disallowed 846 ballots in last weeks primaries because they where dead   https://t.co/UbHZyRhnDO,en,[],['https://www.detroitnews.com/story/news/politics/2020/08/14/secretary-state-benson-6400-michigan-absentee-ballots-rejected-late-arrival/5584613002/'],[],1,0,0,[],[],https://twitter.com/Aidansheart/status/1294690153710067715,False,,0,,san diego,,,,,,[],,,,
1294687566583623681,1294687566583623681,2020-08-15 12:29:04 CDT,2020-08-15,12:29:04,-0500,1250903238209163271,queenzogie2,ehizogie,,"For a police force to actively support a political party... we can honestly say police officers cannot be impartial and will obviously side with those associated with their party. Therefore they need to be defunded! Plus doing this during BLM movement, just shows the racism..",en,[],[],[],0,0,1,[],[],https://twitter.com/queenzogie2/status/1294687566583623681,False,https://twitter.com/Quicktake/status/1294415822375530499,0,,san diego,,,,,,[],,,,
1294686090528354304,1294686090528354304,2020-08-15 12:23:12 CDT,2020-08-15,12:23:12,-0500,30153687,aidansheart,CJ Good,,"Watching Suicide Squad this AM.  You know who could be a great movie, Diablo",en,[],[],[],0,0,1,[],[],https://twitter.com/Aidansheart/status/1294686090528354304,False,,0,,san diego,,,,,,[],,,,
1294683249059360768,1294683249059360768,2020-08-15 12:11:55 CDT,2020-08-15,12:11:55,-0500,26322684,wamblieagleman,Wambli Eagleman,,I’m dead 😵 lmao 😂,en,[],[],[],0,0,1,[],[],https://twitter.com/WambliEagleman/status/1294683249059360768,False,https://twitter.com/xiaraaaaa_/status/1294325926696751106,0,,san diego,,,,,,[],,,,
1294679886204817409,1294662801894469632,2020-08-15 11:58:33 CDT,2020-08-15,11:58:33,-0500,412641828,coffeewithtee,teeeeeee,,@itsashquintero I think it’s amazing for kick starting weight loss. I lost 12lbs and was able to keep all off after slowly integrating carbs back into my diet,en,[],[],[],1,0,2,[],[],https://twitter.com/coffeewithtee/status/1294679886204817409,False,,0,,san diego,,,,,,"[{'screen_name': 'itsashquintero', 'name': 'Ash 🔪', 'id': '2317806157'}]",,,,
1294676910459379713,1293983769511124992,2020-08-15 11:46:44 CDT,2020-08-15,11:46:44,-0500,1107484652,coachdonjohnson,Coach Donald Johnson,,@Tha_Real_MrDell @RealDLHughley @FabTwinChick @cthagod The issue with her and the community has been in place before most knew her name. She has to account for that because people are not going to grant immunity because hate for Trump and because her skin color is like ours especially when it appears that she hurt that community.,en,[],[],[],2,0,0,[],[],https://twitter.com/COACHDONJOHNSON/status/1294676910459379713,False,,0,,san diego,,,,,,"[{'screen_name': 'Tha_Real_MrDell', 'name': 'Londell Richardson', 'id': '133908834'}, {'screen_name': 'RealDLHughley', 'name': 'DL Hughley', 'id': '58529612'}, {'screen_name': 'FabTwinChick', 'name': 'Rochelle Rene Ivory', 'id': '240888539'}, {'screen_name': 'cthagod', 'name': 'Charlamagne Tha God', 'id': '17878322'}]",,,,
1294676224984326144,1294676224984326144,2020-08-15 11:44:00 CDT,2020-08-15,11:44:00,-0500,1031013805,luiismendezz,Luiis,,Bloody marys and black coffee is my type of breakfast,en,[],[],[],0,0,0,[],[],https://twitter.com/luiismendezz/status/1294676224984326144,False,,0,,san diego,,,,,,[],,,,
1294670059625824257,1294670059625824257,2020-08-15 11:19:30 CDT,2020-08-15,11:19:30,-0500,205556009,cqlargoza,Sn,,Plant baby roll call cause it's watering day today and I figured an update couldn't hurt. I love my cheetah sistahs babies.  https://t.co/lqHyGMjG1G,en,[],[],"['https://pbs.twimg.com/media/EfeXjOoUYAUXrgy.jpg', 'https://pbs.twimg.com/media/EfeXjYzU0AAtEQ7.jpg', 'https://pbs.twimg.com/media/EfeXjk5VAAE5nUM.jpg', 'https://pbs.twimg.com/media/EfeXjtYVAAAxsXd.jpg']",1,0,10,[],[],https://twitter.com/cqlargoza/status/1294670059625824257,False,,1,https://pbs.twimg.com/media/EfeXjOoUYAUXrgy.jpg,san diego,,,,,,[],,,,
1294669659581554688,1294669659581554688,2020-08-15 11:17:55 CDT,2020-08-15,11:17:55,-0500,50563540,angieoverkill,Angela Hill,,The spirits could not decide the fate of the dead even main event &amp; exciting co-main so we had to turn to technology for the answer. Go to  https://t.co/uYiaDpZAny and use code OVERKILL to get extra money to bet with! (Click link for full vid) #MissOverkill  https://t.co/3Yt1OU9Qnv  https://t.co/ApAtczqfhW,en,[],"['http://MyBookie.Ag', 'https://www.instagram.com/tv/CD6lWLVB_oU/?igshid=yg6x1vo140yc']",[],8,7,140,['missoverkill'],[],https://twitter.com/AngieOverkill/status/1294669659581554688,False,,1,https://pbs.twimg.com/ext_tw_video_thumb/1294669587716272130/pu/img/QGkPFhdV2rTjigYF.jpg,san diego,,,,,,[],,,,
1294661101766860802,1294490733655683073,2020-08-15 10:43:54 CDT,2020-08-15,10:43:54,-0500,30153687,aidansheart,CJ Good,,@WillHolder9 Pitchers are being much more aggressive in the zone and Umpires have everybody guessing pitch to pitch. I am good with each ump having a different zone in makes baseball unique. I despise an umpire guessing which is happening a lot from pitch to pitch,en,[],[],[],0,0,1,[],[],https://twitter.com/Aidansheart/status/1294661101766860802,False,,0,,san diego,,,,,,"[{'screen_name': 'WillHolder9', 'name': 'Will Holder', 'id': '1067486807921545217'}]",,,,
1294656054119153664,1195040097491488768,2020-08-15 10:23:51 CDT,2020-08-15,10:23:51,-0500,466263649,acbowen,Andrew Bowen (he/him),,"Last night a driver struck a 69-year-old pedestrian as they were crossing Orange Ave in City Heights, then drove off. Victim went to the hospital with a broken leg. #VisionZero  https://t.co/pKxfpFmJgI",en,[],[],['https://pbs.twimg.com/media/EfeK0XuU8AIGWhR.jpg'],1,1,4,['visionzero'],[],https://twitter.com/acbowen/status/1294656054119153664,False,,1,https://pbs.twimg.com/media/EfeK0XuU8AIGWhR.jpg,san diego,,,,,,[],,,,
1294654859229069312,1294654859229069312,2020-08-15 10:19:06 CDT,2020-08-15,10:19:06,-0500,461350440,soldyouoregano,Ivette Trujillo,,Men will hurt you regardless so might as well date someone rich,en,[],[],[],0,0,0,[],[],https://twitter.com/soldyouoregano/status/1294654859229069312,False,,0,,san diego,,,,,,[],,,,
1294638247100915714,1294638247100915714,2020-08-15 09:13:05 CDT,2020-08-15,09:13:05,-0500,889910735073050627,dmunsonatl,Dan Munson,,"@WhipClyburn watching you NOT explain why you were FOR something under 44, but against it for 45 was pure Washington SWAMP! Economic hurt is economic hurt - but you play hypocrisy politics instead! #clyburn #hypocriet #SouthCarolina #COVID19 #politics #politicsoverpeople",en,[],[],[],0,0,0,"['clyburn', 'hypocriet', 'southcarolina', 'covid19', 'politics', 'politicsoverpeople']",[],https://twitter.com/dmunsonATL/status/1294638247100915714,False,,0,,san diego,,,,,,[],,,,
