id,conversation_id,created_at,date,time,timezone,user_id,username,name,place,tweet,language,mentions,urls,photos,replies_count,retweets_count,likes_count,hashtags,cashtags,link,retweet,quote_url,video,thumbnail,near,geo,source,user_rt_id,user_rt,retweet_id,reply_to,retweet_date,translate,trans_src,trans_dest
1276202557572911105,1276202557572911105,2020-06-25 12:16:15 CDT,2020-06-25,12:16:15,-0500,378974582,likemike025,Exhausted Brownie,,"If you want a perfect picture of government incompetence, look no further than this from @nytimes on the 1 billion given to dead people. The GAO actually recommended sending a notification to a DEAD PERSON to return the money. How stupid are we? Lmao  https://t.co/YJjLZGf3MN",en,"[{'screen_name': 'nytimes', 'name': 'the new york times', 'id': '807095'}]",[],['https://pbs.twimg.com/media/EbX7dBPU0AA-80Z.jpg'],0,0,2,[],[],https://twitter.com/LikeMike025/status/1276202557572911105,False,,1,https://pbs.twimg.com/media/EbX7dBPU0AA-80Z.jpg,los angeles,,,,,,[],,,,
1276202191640883200,1276202191640883200,2020-06-25 12:14:47 CDT,2020-06-25,12:14:47,-0500,473384312,nefaeriest,dandelion,,"i’m still healing a 2014 police brutality assault- (which i received when asking a cop FOR HELP) #8toAbolition   -was then arrested (w broken arm, chipped tooth, &amp; shredded shoulder)  put on trial &amp; faced 30days in jail    🙏💓the judge listened but PTSD ran statue of limitations",en,[],[],[],0,0,0,['8toabolition'],[],https://twitter.com/nefaeriest/status/1276202191640883200,False,https://twitter.com/OakSmith2018/status/1276198539626860544,0,,los angeles,,,,,,[],,,,
1276201696234893312,1276201696234893312,2020-06-25 12:12:49 CDT,2020-06-25,12:12:49,-0500,1045826976492277760,heymorgiee,morgsss💖,,Lol I promise you coming to LA doesn’t mean I’m gonna kick it with you 🤣,en,[],[],[],0,0,0,[],[],https://twitter.com/heymorgiee/status/1276201696234893312,False,,0,,los angeles,,,,,,[],,,,
1276201329614962688,1276201329614962688,2020-06-25 12:11:22 CDT,2020-06-25,12:11:22,-0500,789294479396122624,paaodank,Paola Sanchez,,Lmfao my lead just calls me over the walkie “aye there’s this guy over here with his whole ass out idk what to do” had me dead af 🤣🤣🤣,en,[],[],[],1,0,8,[],[],https://twitter.com/paaodank/status/1276201329614962688,False,,0,,los angeles,,,,,,[],,,,
1276201259087716359,1276201259087716359,2020-06-25 12:11:05 CDT,2020-06-25,12:11:05,-0500,171672792,heykarlin,Peter Karlin,,I would be found dead if I tried this.,en,[],[],[],1,4,21,[],[],https://twitter.com/heykarlin/status/1276201259087716359,False,https://twitter.com/lifehacker/status/1276201008708890630,0,,los angeles,,,,,,[],,,,
1276200784296738817,1275969282967572480,2020-06-25 12:09:12 CDT,2020-06-25,12:09:12,-0500,205240369,radicalleft562,ChickenButts,,@james_snader @PreetBharara You keep following your tyrannical leader to your death and choose not to wear a mask while you kill others on the way and scream about abortion while you’re dying.,en,[],[],[],0,0,1,[],[],https://twitter.com/RadicalLeft562/status/1276200784296738817,False,,0,,los angeles,,,,,,"[{'screen_name': 'james_snader', 'name': 'James Snader', 'id': '880922170620342272'}, {'screen_name': 'PreetBharara', 'name': 'Preet Bharara', 'id': '834081571493785600'}]",,,,
1276200669540540416,1276181547532652545,2020-06-25 12:08:44 CDT,2020-06-25,12:08:44,-0500,919746215465627654,golythefather,GOLY the father,,@BrandonMotta You stopped tapping in with me lol so yes bully,en,[],[],[],1,0,0,[],[],https://twitter.com/GolytheFather/status/1276200669540540416,False,,0,,los angeles,,,,,,"[{'screen_name': 'BrandonMotta', 'name': 'Brandon motta', 'id': '1681518559'}]",,,,
1276199460331089921,1276199460331089921,2020-06-25 12:03:56 CDT,2020-06-25,12:03:56,-0500,1214016903615664128,ineedmypesos,S E L F M A D E 💡,,I didn’t cheat she was just being nosey and got her feelings hurt,en,[],[],[],0,0,1,[],[],https://twitter.com/ineedmypesos/status/1276199460331089921,False,,0,,los angeles,,,,,,[],,,,
1276198981224153090,1276190554443956224,2020-06-25 12:02:02 CDT,2020-06-25,12:02:02,-0500,24700460,bearkoda446,Bearkoda/Brittany 💙,,"@HyperX Dead Space. It was the first ""boy"" game I played, and was able to do better on it than my male cousins. Showed me that I can game as well, and now I stream full time and love it ♥",en,[],[],[],0,0,0,[],[],https://twitter.com/bearkoda446/status/1276198981224153090,False,,0,,los angeles,,,,,,"[{'screen_name': 'HyperX', 'name': 'HyperX', 'id': '225125248'}]",,,,
1276198669155360768,1276198669155360768,2020-06-25 12:00:48 CDT,2020-06-25,12:00:48,-0500,210303898,hrmarioman,Hector 〄 🐺💗⚔️🍀☘️,,"11 years ago, on June 25, 2009.  We loss the great King Of Pop Michael Jackson.  His death still heartbroken.   His legacy of music, video, dance, and his moonwalk will always remember. His legend will never die.  😢🖤❤️👑🕯🌹 #MichaelJacksonForever #11YearsWithOutMichaelJackson  https://t.co/15OdvfSXWY",en,[],[],['https://pbs.twimg.com/media/EbX37EkVcAI4i9U.jpg'],1,0,1,"['michaeljacksonforever', '11yearswithoutmichaeljackson']",[],https://twitter.com/HRmarioman/status/1276198669155360768,False,,1,https://pbs.twimg.com/media/EbX37EkVcAI4i9U.jpg,los angeles,,,,,,[],,,,
1276198642093711367,1276198642093711367,2020-06-25 12:00:41 CDT,2020-06-25,12:00:41,-0500,1651515241,tatertatz_,tatiana foerster,,"🤯🤯🤯 IRS sent $1.4B in stimulus payments to 1.1M dead people, mostly after Trump called snafus a ‘tiny’ problem   https://t.co/tVCAOlxv0p",en,[],['https://www.dallasnews.com/news/politics/2020/06/25/irs-sent-14b-in-stimulus-payments-to-11m-dead-people-mostly-after-trump-called-snafus-a-tiny-problem/'],[],0,0,0,[],[],https://twitter.com/tatertatz_/status/1276198642093711367,False,,0,,los angeles,,,,,,[],,,,
