id,conversation_id,created_at,date,time,timezone,user_id,username,name,place,tweet,language,mentions,urls,photos,replies_count,retweets_count,likes_count,hashtags,cashtags,link,retweet,quote_url,video,thumbnail,near,geo,source,user_rt_id,user_rt,retweet_id,reply_to,retweet_date,translate,trans_src,trans_dest
1279447977225052161,1279246303038451712,2020-07-04 11:12:23 CDT,2020-07-04,11:12:23,-0500,96704463,realsavagegent,Savage Gentleman Victor Benjamin,,@VirtualBasement @MrHatfield4 I laugh in the face if danger!  https://t.co/Wzrljlts2q,en,[],[],['https://pbs.twimg.com/tweet_video_thumb/EcGDJV_WoAMpiNt.jpg'],1,0,3,[],[],https://twitter.com/RealSavageGent/status/1279447977225052161,False,,1,https://pbs.twimg.com/tweet_video_thumb/EcGDJV_WoAMpiNt.jpg,philadelphia,,,,,,"[{'screen_name': 'VirtualBasement', 'name': 'Virtual Basement®', 'id': '1202663388653989888'}, {'screen_name': 'MrHatfield4', 'name': 'Mr.Hatfield', 'id': '1306208268805574657'}]",,,,
1279442396032512000,1279442396032512000,2020-07-04 10:50:12 CDT,2020-07-04,10:50:12,-0500,78932443,newton_buchanan,"Yes, it’s me…",,Soooo...  A disgusting picture is what slarked action??   Not the disgusting murder??,en,[],[],[],1,0,0,[],[],https://twitter.com/newton_buchanan/status/1279442396032512000,False,https://twitter.com/CBSNews/status/1279146906158075907,0,,philadelphia,,,,,,[],,,,
1279441772377235458,1279420849800478720,2020-07-04 10:47:44 CDT,2020-07-04,10:47:44,-0500,409631422,2007wayne,wayne young,,@30SecFights Love your fights. This is to deep for this site and just allows trolls to go all in. Not being that guy but in this racist environment I cringed at looking in remarks,en,[],[],[],0,0,0,[],[],https://twitter.com/2007wayne/status/1279441772377235458,False,,0,,philadelphia,,,,,,"[{'screen_name': '30SecFights', 'name': 'Best Fights 🎬🍿', 'id': '1162002819592982531'}]",,,,
1279440978521325568,1279440525662306305,2020-07-04 10:44:34 CDT,2020-07-04,10:44:34,-0500,708644198338039808,michaelgorham7,ike,,@FOX29philly I don't get it . If people can protest why can't we have the fireworks show,en,[],[],[],0,0,1,[],[],https://twitter.com/MichaelGorham7/status/1279440978521325568,False,,0,,philadelphia,,,,,,"[{'screen_name': 'FOX29philly', 'name': 'FOX 29', 'id': '14787713'}]",,,,
1279440324746792961,1278077103058100224,2020-07-04 10:41:58 CDT,2020-07-04,10:41:58,-0500,801992900703907840,gwboudreau,Dr. George W. Boudreau,,"@mobeso9 @TONYxTWO @KamalaHarris If you don’t understand, feel happy. It’s a could misogynistic attack on women and African Americans.",en,[],[],[],0,0,0,[],[],https://twitter.com/gwboudreau/status/1279440324746792961,False,,0,,philadelphia,,,,,,"[{'screen_name': 'mobeso9', 'name': 'mo-be-so', 'id': '1153070057708240896'}, {'screen_name': 'TONYxTWO', 'name': 'TONY™️', 'id': '1261816778256265222'}, {'screen_name': 'KamalaHarris', 'name': 'Kamala Harris', 'id': '30354991'}]",,,,
1279437185566081025,1279437185566081025,2020-07-04 10:29:30 CDT,2020-07-04,10:29:30,-0500,250751320,vellastrations,Vinny Vella,,Ash’Raka Juel of Red Fists Rising says the group plans to march to city hall to link up with other protest events happening today. There are at least 5 planned in Center City.  https://t.co/8OWwXgMuKI,en,[],[],['https://pbs.twimg.com/media/EcF5Vk6WAAAWH1Z.jpg'],0,0,0,[],[],https://twitter.com/Vellastrations/status/1279437185566081025,False,,1,https://pbs.twimg.com/media/EcF5Vk6WAAAWH1Z.jpg,philadelphia,,,,,,[],,,,
1279436595242979328,1279436595242979328,2020-07-04 10:27:09 CDT,2020-07-04,10:27:09,-0500,2304371455,reneepwash,Renee Washington,,"People ask “why didn’t you speak up?” “What did you do about it it?”  As I told @brianhwaters before, people don’t realize all the layers to a toxic workplace ESPECIALLY any sort of harassment you deal with.. we need to provide safe, supportive work spaces for everyone❤️🙏🏾",en,"[{'screen_name': 'brianhwaters', 'name': 'brian h. waters', 'id': '125853084'}]",[],[],0,3,12,[],[],https://twitter.com/ReneePwash/status/1279436595242979328,False,https://twitter.com/brianhwaters/status/1279037021475016708,0,,philadelphia,,,,,,[],,,,
1279436120711979010,1279436120711979010,2020-07-04 10:25:16 CDT,2020-07-04,10:25:16,-0500,250751320,vellastrations,Vinny Vella,,"A group of about 20 protestors have gathered near 30th St Station. Called “Fists of the Fallen,” they’re painting their hands red and plan to march through the city in protest against police brutality.  https://t.co/E3UIO27NSg",en,[],[],['https://pbs.twimg.com/media/EcF4XizWAAIzGJI.jpg'],1,5,22,[],[],https://twitter.com/Vellastrations/status/1279436120711979010,False,,1,https://pbs.twimg.com/media/EcF4XizWAAIzGJI.jpg,philadelphia,,,,,,[],,,,
1279433204483731456,1279433204483731456,2020-07-04 10:13:41 CDT,2020-07-04,10:13:41,-0500,2227292650,khj_esq,Philly’s Original Harden,,Corporate Violence Against My Personhood: Volume 2  https://t.co/uPSXpNu4Od,en,[],[],"['https://pbs.twimg.com/media/EcF1tgzWoAEQ58a.jpg', 'https://pbs.twimg.com/media/EcF1tg1XkAE-dOP.jpg']",2,0,10,[],[],https://twitter.com/KHJ_Esq/status/1279433204483731456,False,,1,https://pbs.twimg.com/media/EcF1tgzWoAEQ58a.jpg,philadelphia,,,,,,[],,,,
1279425922752536576,1279425922752536576,2020-07-04 09:44:45 CDT,2020-07-04,09:44:45,-0500,1015792247156150272,jeffmaxie6,Jeff Maxie,,"I see the protest in Atlantic City is not enough jobs for the African community their is more deverse work invirment in the casino, county job in NJ are 78% African American",en,[],[],[],0,0,1,[],[],https://twitter.com/JeffMaxie6/status/1279425922752536576,False,,0,,philadelphia,,,,,,[],,,,
1279423833313853440,1279410823715307522,2020-07-04 09:36:27 CDT,2020-07-04,09:36:27,-0500,512595477,djst99,DMO,,@SJPFISH @TeaBoots @RudyGiuliani So Sad.  Is that gun Legal!,en,[],[],[],0,0,0,[],[],https://twitter.com/djst99/status/1279423833313853440,False,,0,,philadelphia,,,,,,"[{'screen_name': 'SJPFISH', 'name': '❌🇺🇸Steve🇺🇸🇺🇸America First🇺🇸🇮🇹MAGA🇺🇸KAG', 'id': '88426758'}, {'screen_name': 'TeaBoots', 'name': 'Ruthann🍊🍊🍊', 'id': '756988954755395584'}, {'screen_name': 'RudyGiuliani', 'name': 'Rudy W. Giuliani', 'id': '770781940341288960'}]",,,,
1279421126515490816,1279421126515490816,2020-07-04 09:25:41 CDT,2020-07-04,09:25:41,-0500,723208975513194496,minel_son,"Minèlson Dorcelus Louis-Baptiste, MPH 🇭🇹",,"Im always interested in how certain people are still trying to validate their racist, prejudice actions after being caught",en,[],[],[],0,0,0,[],[],https://twitter.com/Minel_son/status/1279421126515490816,False,,0,,philadelphia,,,,,,[],,,,
1279417234532847622,1279417234532847622,2020-07-04 09:10:13 CDT,2020-07-04,09:10:13,-0500,794919487,donnamenn,DKellyN,,"#amjoy  @realDonaldTrump is on a FU to all nonwhite people whistles too tour. He did FU to Black people in Tulsa, FU TO indigenous people at Mt. R, next stop stripping Japenese veterans of benefits at interment camp sites, attack trans people at Stonewall...",en,"[{'screen_name': 'realdonaldtrump', 'name': 'donald j. trump', 'id': '25073877'}]",[],[],0,0,1,['amjoy'],[],https://twitter.com/DonnaMEnn/status/1279417234532847622,False,,0,,philadelphia,,,,,,[],,,,
1279417097517490177,1279417097517490177,2020-07-04 09:09:41 CDT,2020-07-04,09:09:41,-0500,1092083908605292545,kater1960,teacher kate,,"@govkristinoem Foolish “you can stay home” if you’re worried about catching the virus. Were the workers, police, firefighters, etc allowed to stay home and avoid infection ? Or were they required to set up, police, and otherwise ensure the safety of attendees, despite the danger?",en,[],[],[],0,0,0,[],[],https://twitter.com/kater1960/status/1279417097517490177,False,,0,,philadelphia,,,,,,[],,,,
1279416940398891011,1279416940398891011,2020-07-04 09:09:03 CDT,2020-07-04,09:09:03,-0500,186180069,phillyreem,Reemo,,"“They say that we are prone to violence, but it’s Home Sweet Home.... #Philly",en,[],[],[],0,1,1,['philly'],[],https://twitter.com/PhillyReem/status/1279416940398891011,False,,0,,philadelphia,,,,,,[],,,,
1279415686650105856,1279415686650105856,2020-07-04 09:04:04 CDT,2020-07-04,09:04:04,-0500,2190400726,imaround3100,mizzy,,If you not whopping a racist person ass for talking shit don’t post the video we don’t care about you being a bigger person,en,[],[],[],0,0,0,[],[],https://twitter.com/imaround3100/status/1279415686650105856,False,,0,,philadelphia,,,,,,[],,,,
1279403979508723712,1279403979508723712,2020-07-04 08:17:33 CDT,2020-07-04,08:17:33,-0500,971832173815844865,laurasharma07,Laura Sharma,,I believe it.  The Dump crime family think they're above contracting this pedestrian virus.,en,[],[],[],0,0,0,[],[],https://twitter.com/LauraSharma07/status/1279403979508723712,False,https://twitter.com/DetHippieChick/status/1279247553100419074,0,,philadelphia,,,,,,[],,,,
1279402529088995330,1279399993850376194,2020-07-04 08:11:47 CDT,2020-07-04,08:11:47,-0500,2564281674,jesuis_greg,cinderella mitchell,,@Crystalejandro A murder scene,en,[],[],[],0,0,0,[],[],https://twitter.com/JeSuis_Greg/status/1279402529088995330,False,,0,,philadelphia,,,,,,"[{'screen_name': 'Crystalejandro', 'name': 'Crystal Alejandro', 'id': '40596482'}]",,,,
1279402154965467136,1279162247814811650,2020-07-04 08:10:18 CDT,2020-07-04,08:10:18,-0500,423960314,peteyberger,PeteXT,,@CodyRhodes Not seeing it...way to many good teams to see those guys as a threat,en,[],[],[],0,0,0,[],[],https://twitter.com/Peteyberger/status/1279402154965467136,False,,0,,philadelphia,,,,,,"[{'screen_name': 'CodyRhodes', 'name': 'Cody Rhodes', 'id': '516771605'}]",,,,
1279401675405615105,1279063826432958464,2020-07-04 08:08:24 CDT,2020-07-04,08:08:24,-0500,66776059,fabricdragon,kirsten houseknecht,,@montypython Why are you advising fans to commit murder and suicide?,en,[],[],[],0,0,4,[],[],https://twitter.com/fabricdragon/status/1279401675405615105,False,,0,,philadelphia,,,,,,"[{'screen_name': 'montypython', 'name': 'Monty Python', 'id': '2201496073'}]",,,,
1279401332466749440,1279401332466749440,2020-07-04 08:07:02 CDT,2020-07-04,08:07:02,-0500,253653901,octopussanta,Philip Repko,,"“I cried about having to wear a mask and you called me a coward and an asshole.  I brought my gun to a Denny’s.  Am I a coward and an asshole now????”  Yes, you are most definitely a coward and an asshole now.",en,[],[],[],0,0,0,[],[],https://twitter.com/OctopusSanta/status/1279401332466749440,False,,0,,philadelphia,,,,,,[],,,,
1279401151218233344,1279401151218233344,2020-07-04 08:06:19 CDT,2020-07-04,08:06:19,-0500,66776059,fabricdragon,kirsten houseknecht,," https://t.co/2wOZ37gdre Time for a general strike. Amazing how its so easy for them to fire women with kids, even if they can do the job #unionize #strike #misogyny",en,[],['https://www.thelily.com/florida-state-just-barred-many-employees-from-caring-for-kids-while-working-remotely-moms-ask-what-am-i-supposed-to-do/'],[],0,0,0,"['unionize', 'strike', 'misogyny']",[],https://twitter.com/fabricdragon/status/1279401151218233344,False,,0,,philadelphia,,,,,,[],,,,
1279398749341650947,1279248699579908102,2020-07-04 07:56:46 CDT,2020-07-04,07:56:46,-0500,44281014,pafar,Paula Farina,,"@NinStar_ @DineshDSouza TR running as a Progressive in 1912, because Taft wouldn't expand government enough, allowed Wilson, an actual racist and Democrat to be elected.  As opposed to a fake racist like Trump.",en,[],[],[],1,0,0,[],[],https://twitter.com/Pafar/status/1279398749341650947,False,,0,,philadelphia,,,,,,"[{'screen_name': 'NinStar_', 'name': 'Solo', 'id': '718618439531761664'}, {'screen_name': 'DineshDSouza', 'name': ""Dinesh D'Souza"", 'id': '91882544'}]",,,,
1279396312727851008,1279226403439837184,2020-07-04 07:47:05 CDT,2020-07-04,07:47:05,-0500,512595477,djst99,DMO,,@stillgray @mooney7dl Why are their so many white ppl and no black protesters if this is a BLM protest?  This white ppl are Idiots because the BLM isn’t who they say they are.,en,[],[],[],0,0,0,[],[],https://twitter.com/djst99/status/1279396312727851008,False,,0,,philadelphia,,,,,,"[{'screen_name': 'stillgray', 'name': 'Ian Miles Cheong', 'id': '16106584'}, {'screen_name': 'mooney7dl', 'name': 'David Hatter', 'id': '38388521'}]",,,,
1279395450936856581,1279226403439837184,2020-07-04 07:43:40 CDT,2020-07-04,07:43:40,-0500,512595477,djst99,DMO,,"@stillgray @mooney7dl Just stay off their property and don’t threaten to kill them or their dog then you can have a peaceful lawful protest, okay!",en,[],[],[],0,0,0,[],[],https://twitter.com/djst99/status/1279395450936856581,False,,0,,philadelphia,,,,,,"[{'screen_name': 'stillgray', 'name': 'Ian Miles Cheong', 'id': '16106584'}, {'screen_name': 'mooney7dl', 'name': 'David Hatter', 'id': '38388521'}]",,,,
1279393064788930560,1279354455297855490,2020-07-04 07:34:11 CDT,2020-07-04,07:34:11,-0500,21624893,herbertholler,(((herbertholler))),,@tibby17 @jk_rowling The Kool aid guy is hiding in there. Ready to rage and break through a wall.,en,[],[],[],0,0,0,[],[],https://twitter.com/herbertholler/status/1279393064788930560,False,,0,,philadelphia,,,,,,"[{'screen_name': 'tibby17', 'name': '📚Tibby♀️✡', 'id': '45497340'}, {'screen_name': 'jk_rowling', 'name': 'J.K. Rowling', 'id': '62513246'}]",,,,
1279391853767507974,1279391853767507974,2020-07-04 07:29:22 CDT,2020-07-04,07:29:22,-0500,20992322,drantbradley,"Anthony B. Bradley, PhD",,"School bullies are basically kids who do not receive physical affection from their parents or are abuse victims. Neglected boys externalize pain &amp; hurt others. If a teenager is abusive, assume he/she doesn’t receive affection at home, etc. esp. from dad.  https://t.co/mfh2pTQcpB",en,[],['https://psycnet.apa.org/record/1980-11765-001'],[],1,1,27,[],[],https://twitter.com/drantbradley/status/1279391853767507974,False,,0,,philadelphia,,,,,,[],,,,
1279378204847980544,1279364992215760898,2020-07-04 06:35:08 CDT,2020-07-04,06:35:08,-0500,839784595,millardfillmor1,Millard Fillmore,,@ABC @DavidJollyFL Brutal.,no,[],[],[],0,0,0,[],[],https://twitter.com/MillardFillmor1/status/1279378204847980544,False,,0,,philadelphia,,,,,,"[{'screen_name': 'ABC', 'name': 'ABC News', 'id': '28785486'}, {'screen_name': 'DavidJollyFL', 'name': 'David Jolly', 'id': '2178681566'}]",,,,
1279377858750746624,1279060373073809409,2020-07-04 06:33:45 CDT,2020-07-04,06:33:45,-0500,913907810458578945,domcisco926,Dominic A. M. Cisco,,"@longwoodgardens Everything is going to not be alright if you don't get your acts together. Worry about your vocapbulary buffaloes sold ja, hail ""tell US of DANGER"" it happens suddenly wonderland once Babylon began, SPITE and  Mystery. The Red Drag oN, Constitchewitz, Dogmatic Principaul,BEWARE!",en,[],[],[],0,0,0,[],[],https://twitter.com/DomCisco926/status/1279377858750746624,False,,0,,philadelphia,,,,,,"[{'screen_name': 'longwoodgardens', 'name': 'longwoodgardens', 'id': '32705833'}]",,,,
1279377192791744512,1279375785703473154,2020-07-04 06:31:07 CDT,2020-07-04,06:31:07,-0500,822422448293445633,loyalamerican17,LoyalAmerican17 #IStandWithGenFlynn ⭐⭐⭐,,@6abc Oh this should send the liberal cry babies over the edge. Waiting for someone to call them slave owners now. I'm sure some moron will protest.,en,[],[],[],2,0,1,[],[],https://twitter.com/LoyalAmerican17/status/1279377192791744512,False,,0,,philadelphia,,,,,,"[{'screen_name': '6abc', 'name': 'Action News on 6abc', 'id': '18391051'}]",,,,
