id,conversation_id,created_at,date,time,timezone,user_id,username,name,place,tweet,language,mentions,urls,photos,replies_count,retweets_count,likes_count,hashtags,cashtags,link,retweet,quote_url,video,thumbnail,near,geo,source,user_rt_id,user_rt,retweet_id,reply_to,retweet_date,translate,trans_src,trans_dest
1250210151598088193,1250114127013400576,2020-04-14 18:51:42 CDT,2020-04-14,18:51:42,-0500,248724961,patrickjmullan,Pádraic Mullan 🇺🇸⭐️🇺🇸,,@ShyDeplorable The Chinese have historically been racist and yet will scream racism if you don’t eat enough fortune cookies,en,[],[],[],0,0,0,[],[],https://twitter.com/patrickjmullan/status/1250210151598088193,False,,0,,new york city,,,,,,"[{'screen_name': 'ShyDeplorable', 'name': 'Shy 🇺🇸❤️', 'id': '1219055145234776065'}]",,,,
1250209374821376001,1250209374821376001,2020-04-14 18:48:37 CDT,2020-04-14,18:48:37,-0500,39121094,thisismytweeder,🌙 🥰🥳,,Dead coached myself through a panic attack. I’m so proud,en,[],[],[],0,0,0,[],[],https://twitter.com/thisismytweeder/status/1250209374821376001,False,,0,,new york city,,,,,,[],,,,
1250207617772896258,1250207617772896258,2020-04-14 18:41:38 CDT,2020-04-14,18:41:38,-0500,3429185109,iboxelite,iboxelite,"{'type': 'Point', 'coordinates': [40.82712467, -73.94330978]}",Nowadays everybody wanna buss they gun 🔫 instead of shooting the fair one👊🏾 #iboxelite #boxing #undefeated #champion #goat 🐐 @ Sugar Hill Historic District  https://t.co/wdyUjTbvhy,en,[],['https://www.instagram.com/p/B--uDYcJY5i/?igshid=197rge7vvko4i'],[],0,0,0,"['iboxelite', 'boxing', 'undefeated', 'champion', 'goat']",[],https://twitter.com/iboxelite/status/1250207617772896258,False,,0,,new york city,,,,,,[],,,,
1250206836583731200,1250206836583731200,2020-04-14 18:38:32 CDT,2020-04-14,18:38:32,-0500,863546299597152256,parientelunap,Luna Pariente,,Good for you to know this racist @IlhanMN that’s all she has in mind how to divide using Race. You will win cause after what we are going through as a nation no one will want someone like this Antisemite Anti America,en,"[{'screen_name': 'ilhanmn', 'name': 'ilhan omar', 'id': '783792992'}]",[],[],0,0,1,[],[],https://twitter.com/ParienteLunap/status/1250206836583731200,False,https://twitter.com/DaliaAlAqidi/status/1250196853146165258,0,,new york city,,,,,,[],,,,
1250206639677898752,1250206639677898752,2020-04-14 18:37:45 CDT,2020-04-14,18:37:45,-0500,6021962,tummler10,Tummler (means... Connector & Troublemaker),,Robber Barons and shitty bosses all. (Or most),en,[],[],[],0,2,4,[],[],https://twitter.com/tummler10/status/1250206639677898752,False,https://twitter.com/AndySlater/status/1250196152517001216,0,,new york city,,,,,,[],,,,
1250205798191575041,1250205798191575041,2020-04-14 18:34:24 CDT,2020-04-14,18:34:24,-0500,940654108792455168,glenncocoabuttr,Glenn Cocoa,,I’m the victim here. Whose side are you on??,en,[],[],[],1,1,0,[],[],https://twitter.com/GlennCocoaButtr/status/1250205798191575041,False,https://twitter.com/BigBabyRoyal/status/1250205526975275008,0,,new york city,,,,,,[],,,,
1250205775529521152,1250192505754324992,2020-04-14 18:34:19 CDT,2020-04-14,18:34:19,-0500,21441975,arash_tehran,Arash Azizi 🟣 آرش عزیزی,,@upuouo @IAmAnaDiamond @memarsadeghi Terrorism is a form of politics. That’s literally embedded in its standard definition (“violence against civilians used for political or religious purposes”),en,[],[],[],0,0,0,[],[],https://twitter.com/arash_tehran/status/1250205775529521152,False,,0,,new york city,,,,,,"[{'screen_name': 'upuouo', 'name': 'Lulu', 'id': '344938512'}, {'screen_name': 'IAmAnaDiamond', 'name': 'Ana Diamond • آننا دیاموند', 'id': '1013466626891624449'}, {'screen_name': 'memarsadeghi', 'name': 'Mariam Memarsadeghi', 'id': '46919036'}]",,,,
1250205370737471488,1250205370737471488,2020-04-14 18:32:42 CDT,2020-04-14,18:32:42,-0500,1126687966510735370,thrifty_pippa,Thrifty_pippa,,Harassment &amp; slander! Even as a child! Anne Salamanca is abusive &amp; cruel. Being @CarePointHealth &amp; @RWJBarnabas health experiment! So her fam. Comitt slander ! Press charges! @ACLUNJ @ACLU @cagoldberglaw,en,"[{'screen_name': 'carepointhealth', 'name': 'carepoint health', 'id': '84683103'}, {'screen_name': 'rwjbarnabas', 'name': 'rwjbarnabas', 'id': '45596617'}, {'screen_name': 'aclunj', 'name': 'aclu of new jersey', 'id': '50405341'}, {'screen_name': 'aclu', 'name': 'aclu', 'id': '13393052'}, {'screen_name': 'cagoldberglaw', 'name': 'carrie goldberg', 'id': '1643665106'}]",[],[],0,0,0,[],[],https://twitter.com/thrifty_pippa/status/1250205370737471488,False,,0,,new york city,,,,,,[],,,,
1250203117737717760,1250122731930124291,2020-04-14 18:23:45 CDT,2020-04-14,18:23:45,-0500,394879847,nycuratrix,Dr. Susan Perkins,,"@naturalist_chj They jumped on, shared screens (all phones), yelled expletives and disgusting racist and sexist things, one stayed quietly on then asked a question which turned out to be explicit. I had muted my computer but saw everyone’s faces. There are many ways to prevent. See zoom site.",en,[],[],[],1,0,2,[],[],https://twitter.com/NYCuratrix/status/1250203117737717760,False,,0,,new york city,,,,,,"[{'screen_name': 'naturalist_chj', 'name': 'Chinmay Hemant Joshi', 'id': '3034532994'}]",,,,
1250202617885712385,1250202617885712385,2020-04-14 18:21:46 CDT,2020-04-14,18:21:46,-0500,524076913,rr2go,its jork!,,Literally nothing anyone can say or do will convince me to vote for Joe Biden lmao not even with a fucking gun to my head,en,[],[],[],1,0,5,[],[],https://twitter.com/RR2GO/status/1250202617885712385,False,,0,,new york city,,,,,,[],,,,
1250200894530093056,1250200894530093056,2020-04-14 18:14:55 CDT,2020-04-14,18:14:55,-0500,1631573138,gerald_huggins,Bayi,,"If you can breathe, you can get a gun in Texas",en,[],[],[],1,4,7,[],[],https://twitter.com/Gerald_Huggins/status/1250200894530093056,False,,0,,new york city,,,,,,[],,,,
1250200398083895304,1250200398083895304,2020-04-14 18:12:57 CDT,2020-04-14,18:12:57,-0500,39121094,thisismytweeder,🌙 🥰🥳,,How do you stop a panic attack?,en,[],[],[],2,0,1,[],[],https://twitter.com/thisismytweeder/status/1250200398083895304,False,,0,,new york city,,,,,,[],,,,
1250199501572317189,1250199501572317189,2020-04-14 18:09:23 CDT,2020-04-14,18:09:23,-0500,35824481,wayzen,Way Zen,,"What a day! Waited more than 30 minutes in line to get into my local Chase. Never seen a banker’s long face before but, today there are plenty🤔 #COVID19 has no sound, no smell, no look yet it has done so much harm to our world. Be aware protect our inner peace🌻",en,[],[],[],0,0,2,['covid19'],[],https://twitter.com/wayzen/status/1250199501572317189,False,,0,,new york city,,,,,,[],,,,
1250197973021196299,1250174933264670725,2020-04-14 18:03:18 CDT,2020-04-14,18:03:18,-0500,1118541354924150791,officialo2muzik,OfficialO.2.,,@oldmanebro Kobe &amp; LeBron in the finals or D.Rose never gets injured,en,[],[],[],0,0,0,[],[],https://twitter.com/OfficialO2muzik/status/1250197973021196299,False,,0,,new york city,,,,,,"[{'screen_name': 'oldmanebro', 'name': 'Ebro', 'id': '574857684'}]",,,,
1250197714241028096,1250196223799197697,2020-04-14 18:02:17 CDT,2020-04-14,18:02:17,-0500,216103914,romudeth,Tony Polanco,,@SickHumorTV Good luck with that hard mode. Not being able to use items is going to be brutal.,en,[],[],[],1,0,1,[],[],https://twitter.com/Romudeth/status/1250197714241028096,False,,0,,new york city,,,,,,"[{'screen_name': 'SickHumorTV', 'name': 'SickHumorTV #JusticeForGeorgeFloyd', 'id': '1952886602'}]",,,,
1250197156515975172,1250197156515975172,2020-04-14 18:00:04 CDT,2020-04-14,18:00:04,-0500,414164102,drkimsue,"Kim Sue, MD, PhD",,"People with addiction need community treatment and harm reduction! Not incarceration and a preventable, tragic death from COVID-19  ⬇️",en,[],[],[],1,2,22,[],[],https://twitter.com/DrKimSue/status/1250197156515975172,False,https://twitter.com/DA_LarryKrasner/status/1250182790492061696,0,,new york city,,,,,,[],,,,
1250196606453981184,1250196606453981184,2020-04-14 17:57:53 CDT,2020-04-14,17:57:53,-0500,163870052,auntnyc,AuntChristine™ 🌻🐘🦏🐆🦛🦒🦓,,This man is INSANE.   He has been told many times over he doesn't boss the Governors or the states.  Please someone get him to a hospital.  He's a danger to himself and others,en,[],[],[],1,0,2,[],[],https://twitter.com/AuntNYC/status/1250196606453981184,False,https://twitter.com/ABC/status/1250195779102412802,0,,new york city,,,,,,[],,,,
1250196243038552067,1250165095604334592,2020-04-14 17:56:26 CDT,2020-04-14,17:56:26,-0500,2476842955,itsmcginn,McGinn,,@shellymarie19xx Just happy Machine Gun Kelly’s music is speaking for itself. 🤟🤟🤟 thank you!,en,[],[],[],1,0,1,[],[],https://twitter.com/ItsMcGinn/status/1250196243038552067,False,,0,,new york city,,,,,,"[{'screen_name': 'shellymarie19xx', 'name': 'Shelly-Let Your Light Shine ❌❌ BLM - 59 y.o.', 'id': '18288038'}]",,,,
1250195411354222592,1249732388625752065,2020-04-14 17:53:08 CDT,2020-04-14,17:53:08,-0500,1112390508956053505,brndn_hndz11,Brendan Santos,,"@STR0 @KyleLarsonRacin Bro you overreacting saying that he’s racist cos he used this word, udk this man to be bringing his kids into this, u from NY fam im sure you’ve used that word b4 should you be labeled as a racist cos of it? Should the Mets fire you if they ever hear you saying it?",en,[],[],[],0,0,3,[],[],https://twitter.com/Brndn_Hndz11/status/1250195411354222592,False,,0,,new york city,,,,,,"[{'screen_name': 'STR0', 'name': 'Marcus Stroman', 'id': '122261841'}, {'screen_name': 'KyleLarsonRacin', 'name': 'Kyle Larson', 'id': '56186139'}]",,,,
1250194805658877955,1250194805658877955,2020-04-14 17:50:43 CDT,2020-04-14,17:50:43,-0500,873071505336262656,deenvst,Deannatroi,,Had a anxiety attack in the shower &amp; it took the fun out of washing my hair,en,[],[],[],0,0,0,[],[],https://twitter.com/deenvst/status/1250194805658877955,False,,0,,new york city,,,,,,[],,,,
1250191493295464452,1250174933264670725,2020-04-14 17:37:34 CDT,2020-04-14,17:37:34,-0500,47972867,breezyf,.,,@oldmanebro Never got injured 🌹  https://t.co/5WS5IPtqWS,en,[],[],['https://pbs.twimg.com/tweet_video_thumb/EVmSh7-WAAMQFHw.jpg'],0,0,1,[],[],https://twitter.com/BreezyF/status/1250191493295464452,False,,1,https://pbs.twimg.com/tweet_video_thumb/EVmSh7-WAAMQFHw.jpg,new york city,,,,,,"[{'screen_name': 'oldmanebro', 'name': 'Ebro', 'id': '574857684'}]",,,,
1250190580593954818,1250190580593954818,2020-04-14 17:33:56 CDT,2020-04-14,17:33:56,-0500,68929587,oluwasozzy,Olusola  Afolabi,"{'type': 'Point', 'coordinates': [40.71217111, -74.01290202]}","“A woman of gentle grace gets respect, but men of rough violence grab for loot.” Proverbs 11:16 MSG  ________________________  #olusolaafolabi  #wordbygodimagebysozzy  #newyork #newyorker #newyork_ig…  https://t.co/mjuZDiIPut",en,[],['https://www.instagram.com/p/B--mtuLnwrm/?igshid=6cdvtj6xdjml'],[],0,0,1,"['olusolaafolabi', 'wordbygodimagebysozzy', 'newyork', 'newyorker', 'newyork_ig']",[],https://twitter.com/Oluwasozzy/status/1250190580593954818,False,,0,,new york city,,,,,,[],,,,
1250190242302365696,1250190242302365696,2020-04-14 17:32:35 CDT,2020-04-14,17:32:35,-0500,22400200,coreyandrew,Core Issues with Corey Andrew,,"The last time I saw a sociopath as unraveled as @realDonaldTrump is in this #PressBriefing, I was watching  serial murder profiles on the #IDchannel / #TrumpMeltdown #TrumpVirus #TrumpGenocide",en,"[{'screen_name': 'realdonaldtrump', 'name': 'donald j. trump', 'id': '25073877'}]",[],[],0,1,0,"['pressbriefing', 'idchannel', 'trumpmeltdown', 'trumpvirus', 'trumpgenocide']",[],https://twitter.com/COREYANDREW/status/1250190242302365696,False,https://twitter.com/mitchellreports/status/1250187509935542279,0,,new york city,,,,,,[],,,,
1250186947152302086,1250173322614263810,2020-04-14 17:19:30 CDT,2020-04-14,17:19:30,-0500,23596900,joycicle,Joyce Pedretti,,@ananavarro Why does the press even show up? Don’t give him anyone to abuse.,en,[],[],[],0,0,0,[],[],https://twitter.com/joycicle/status/1250186947152302086,False,,0,,new york city,,,,,,"[{'screen_name': 'ananavarro', 'name': 'Ana Navarro-Cárdenas', 'id': '19568591'}]",,,,
1250184730424881153,1250184730424881153,2020-04-14 17:10:41 CDT,2020-04-14,17:10:41,-0500,44277501,conleyfanclub,Con of the Creek 🇻🇨🏁,,I'm shooting 100% when it comes to predicting exactly wtf is gonna happen based off prior knowledge.,en,[],[],[],0,0,0,[],[],https://twitter.com/conleyfanclub/status/1250184730424881153,False,,0,,new york city,,,,,,[],,,,
1250178848848740359,1249460858196901888,2020-04-14 16:47:19 CDT,2020-04-14,16:47:19,-0500,33310578,marcuterie,Marcus Henry,,@Melorso1 Melly Issa staff so much cooler as a weapon than kunai but go off,en,[],[],[],0,0,0,[],[],https://twitter.com/marcuterie/status/1250178848848740359,False,,0,,new york city,,,,,,[],,,,
1250178021635522566,1250178021635522566,2020-04-14 16:44:02 CDT,2020-04-14,16:44:02,-0500,585054885,tony98tony,Tony Whitsett,,🛑 https://t.co/Gik9KKqEKW **Putin puppet Trump and his currupt Attorney General William Barr. Both are a threat to America🇺🇸national security.**And they both need to be investigated.,en,[],['https://www.washingtonpost.com/opinions/barr-sends-a-message-dont-ever-investigate-the-president-again/2020/04/13/d8855dda-7b70-11ea-a130-df573469f094_story.html'],[],0,0,0,[],[],https://twitter.com/Tony98Tony/status/1250178021635522566,False,,0,,new york city,,,,,,[],,,,
1250177481698676736,1250177481698676736,2020-04-14 16:41:53 CDT,2020-04-14,16:41:53,-0500,308554955,pliniobutten,plinio,,"“ If you attack me, I will respond”  https://t.co/4xCfvOXwy8",en,[],[],['https://pbs.twimg.com/media/EVmFytAWsAIQQre.jpg'],0,0,1,[],[],https://twitter.com/PLINIOBUTTEN/status/1250177481698676736,False,,1,https://pbs.twimg.com/media/EVmFytAWsAIQQre.jpg,new york city,,,,,,[],,,,
1250177066575761408,1250081301316669440,2020-04-14 16:40:14 CDT,2020-04-14,16:40:14,-0500,1095477860729536517,musicreviewer7,Get.Your.Boost.On,,"@JuddLegum It's more of the same dirty business that ties #WWE to #TrumpCrimeFamily. Vince McMahon was not going to pull out of Saudi Arabia deal after #JamalKhashoggi murder ordered by Prince MbS unless Trump ""told US companies not do do business with Saudis."" Ridiculous.",en,[],[],[],0,0,0,"['wwe', 'trumpcrimefamily', 'jamalkhashoggi']",[],https://twitter.com/MusicReviewer7/status/1250177066575761408,False,,0,,new york city,,,,,,"[{'screen_name': 'JuddLegum', 'name': 'Judd Legum', 'id': '15464697'}]",,,,
1250174246640328704,1250173157568282627,2020-04-14 16:29:02 CDT,2020-04-14,16:29:02,-0500,73284618,afleisch_says,Andrew,,@colbyhall Rage against the media. Did that land?,en,[],[],[],1,0,0,[],[],https://twitter.com/afleisch_says/status/1250174246640328704,False,,0,,new york city,,,,,,"[{'screen_name': 'colbyhall', 'name': 'Colby Hall', 'id': '16352566'}]",,,,
1250173998958358533,1250173998958358533,2020-04-14 16:28:03 CDT,2020-04-14,16:28:03,-0500,349128836,badgalcharlee,UNFORGETTABLE 💋,,"Racial preferences when dating is racist/colorist. Ion know how but it is, lmao",en,[],[],[],0,0,1,[],[],https://twitter.com/badgalcharlee/status/1250173998958358533,False,,0,,new york city,,,,,,[],,,,
1250171792112726025,1250171792112726025,2020-04-14 16:19:16 CDT,2020-04-14,16:19:16,-0500,47045467,juanpzapata,Juan P. Zapata,"{'type': 'Point', 'coordinates': [40.7142, -74.0064]}",. Missing so much creating photos ... and connecting with people live. So looking forward to shooting with Giovanna again 🙏🙏🙏 . . Giovanna giovannalungu  #BalletDancer #JPZimage_Giovanna . . . #photo #photoshoot…  https://t.co/2f5XL1TDds,en,[],['https://www.instagram.com/p/B--eK0dns2o/?igshid=kenraysm9000'],[],0,0,1,"['balletdancer', 'jpzimage_giovanna', 'photo', 'photoshoot']",[],https://twitter.com/juanpzapata/status/1250171792112726025,False,,0,,new york city,,,,,,[],,,,
1250170767570067459,1250170767570067459,2020-04-14 16:15:12 CDT,2020-04-14,16:15:12,-0500,838904461,mikecontento23,Mike,,More life Bigger Artist Damn It’s tough leaving off luv is rage 2 and painting pictures but you can only choose 3. Senior year of HS and freshman year of college powered by many of these albums,en,[],[],[],0,0,0,[],[],https://twitter.com/mikecontento23/status/1250170767570067459,False,https://twitter.com/XXL/status/1250137883115167747,0,,new york city,,,,,,[],,,,
1250170751291928585,1250161944000069632,2020-04-14 16:15:08 CDT,2020-04-14,16:15:08,-0500,297187864,bluntznhiphop,🇲🇽joints-n-metal🇲🇽,,@notyourpoison Looks like a heart attack,en,[],[],[],0,0,0,[],[],https://twitter.com/bluntznhiphop/status/1250170751291928585,False,,0,,new york city,,,,,,"[{'screen_name': 'notyourpoison', 'name': 'wannabe sapphic icon. 🗡️✨', 'id': '1236011779492372480'}]",,,,
1250169559170134017,1250157295989735425,2020-04-14 16:10:24 CDT,2020-04-14,16:10:24,-0500,75456506,propercriminals,Jayson,,@ddoniolvalcroze (correction) Murder mittens,en,[],[],[],0,0,2,[],[],https://twitter.com/propercriminals/status/1250169559170134017,False,,0,,new york city,,,,,,"[{'screen_name': 'ddoniolvalcroze', 'name': 'Diane Doniol-Valcroze', 'id': '1063685129661382656'}]",,,,
1250165682270097415,1250165682270097415,2020-04-14 15:55:00 CDT,2020-04-14,15:55:00,-0500,23449076,definitelyran,RanDAMan of DefinitelyAmazing.com,,"Kurt Danger Retired Monster Hunter is about a man who just wants to drink in peace, retired and fed up with monster hunting he takes one last job. Question is will it be his undoing?  https://t.co/HpA6dH3A7x",en,[],[],['https://pbs.twimg.com/media/EVl7DnvX0AILjzx.jpg'],0,0,1,[],[],https://twitter.com/DefinitelyRAN/status/1250165682270097415,False,,1,https://pbs.twimg.com/media/EVl7DnvX0AILjzx.jpg,new york city,,,,,,[],,,,
1250165411024379910,1250165411024379910,2020-04-14 15:53:55 CDT,2020-04-14,15:53:55,-0500,995781279156228101,mcgadys,Mr. McGady’s History Class,,"On this day 155 years ago - April 14, 1865 - President Abraham Lincoln was shot in Ford’s Theater in Washington D.C. by assassin John Wilkes Booth. Lincoln died the following morning at 7:22 in the Petersen House across the street from the theater.  https://t.co/xEkoYDPL7e",en,[],[],"['https://pbs.twimg.com/media/EVl60GUXkAMUoVz.jpg', 'https://pbs.twimg.com/media/EVl60GaWsAEYNAW.jpg']",0,0,2,[],[],https://twitter.com/McgadyS/status/1250165411024379910,False,,1,https://pbs.twimg.com/media/EVl60GUXkAMUoVz.jpg,new york city,,,,,,[],,,,
1250165105502887942,1250063051182747651,2020-04-14 15:52:42 CDT,2020-04-14,15:52:42,-0500,34966443,andrel1331,Andre,,@Blinkomatic1 @johnpavlovitz @realDonaldTrump That’s like lining 10 people up blind folding yourself and shooting while you swing a gun. Someone died but hey... it wasn’t you! 😀,en,[],[],[],0,0,0,[],[],https://twitter.com/Andrel1331/status/1250165105502887942,False,,0,,new york city,,,,,,"[{'screen_name': 'johnpavlovitz', 'name': 'John Pavlovitz', 'id': '493714995'}, {'screen_name': 'realDonaldTrump', 'name': 'Donald J. Trump', 'id': '25073877'}]",,,,
1250163795202379785,1250162596726091777,2020-04-14 15:47:30 CDT,2020-04-14,15:47:30,-0500,27538881,ebpersons,I'm Every Woman,,"You do yourself more harm exposing yourself to lies, attacks, threats, tantrums, illusions and fantasies that serve no purpose other than to create more fear, anxiety and disruption in your life. #canceltrump #BoycottTrumpBriefings",en,[],[],[],0,1,2,"['canceltrump', 'boycotttrumpbriefings']",[],https://twitter.com/ebpersons/status/1250163795202379785,False,,0,,new york city,,,,,,[],,,,
1250163666319745025,1250163666319745025,2020-04-14 15:46:59 CDT,2020-04-14,15:46:59,-0500,1217841565894414338,kdmonsterhunter,Kurt Danger,,Cant wait until I get the 1st reviews. Anyone interested in reviewing Kurt Danger Retired Monster Hunter? #WritingCommunity #reviews #readingcommunity,en,[],[],[],0,0,2,"['writingcommunity', 'reviews', 'readingcommunity']",[],https://twitter.com/KDMonsterHunter/status/1250163666319745025,False,,0,,new york city,,,,,,[],,,,
