id,conversation_id,created_at,date,time,timezone,user_id,username,name,place,tweet,language,mentions,urls,photos,replies_count,retweets_count,likes_count,hashtags,cashtags,link,retweet,quote_url,video,thumbnail,near,geo,source,user_rt_id,user_rt,retweet_id,reply_to,retweet_date,translate,trans_src,trans_dest
1291885543073161216,1291885543073161216,2020-08-07 18:54:50 CDT,2020-08-07,18:54:50,-0500,244996974,jpep20,Joe Pepe,,"With the 8.12 In The @British_Ballers listeners league I selected @ChaseEdmonds22   The cards as a whole produced a TON of RB1 backs (with DJ,Chase, and Drake). This is a high flying offense on the rise and I’m glad to have a talented back with an opportunity regardless of Drake  https://t.co/BaMcyASMV6",en,"[{'screen_name': 'chaseedmonds22', 'name': 'chase edmonds', 'id': '530813026'}]",[],['https://pbs.twimg.com/tweet_video_thumb/Ee2zC_JXkAErKQY.jpg'],1,1,1,[],[],https://twitter.com/jpep20/status/1291885543073161216,False,,1,https://pbs.twimg.com/tweet_video_thumb/Ee2zC_JXkAErKQY.jpg,philadelphia,,,,,,[],,,,
1291885301510569985,1291885301510569985,2020-08-07 18:53:52 CDT,2020-08-07,18:53:52,-0500,3187293797,omgitsniyy,niy,,I will never force nobody to fw.. i'll just fwy how you fwm.,en,[],[],[],0,1,0,[],[],https://twitter.com/omgitsniyy/status/1291885301510569985,False,,0,,philadelphia,,,,,,[],,,,
1291880663671603211,1291880663671603211,2020-08-07 18:35:26 CDT,2020-08-07,18:35:26,-0500,413745358,derekjones79,Derek Jones,,Magic are just more aggressive in the second.,en,[],[],[],0,0,0,[],[],https://twitter.com/DerekJones79/status/1291880663671603211,False,,0,,philadelphia,,,,,,[],,,,
1291879586528141312,1291879586528141312,2020-08-07 18:31:10 CDT,2020-08-07,18:31:10,-0500,1274328104513744897,robertgbrown13,"Hells Blameless and Ritz Cross, Ambitious Sick",,I think you over here is funny and unssen touching and unseen communication is rape because I asked you not to do that. I asked you come repair here.  #thankyouholyspirit #kids #findmaryj #FriendshipDay #LadyGagaIsOverParty #NationalGirlfriendDay #ARMYSelcaDay #Covid_19 #Science,en,[],[],[],0,0,0,"['thankyouholyspirit', 'kids', 'findmaryj', 'friendshipday', 'ladygagaisoverparty', 'nationalgirlfriendday', 'armyselcaday', 'covid_19', 'science']",[],https://twitter.com/RobertGBrown13/status/1291879586528141312,False,,0,,philadelphia,,,,,,[],,,,
1291878583523315712,1291877976414416896,2020-08-07 18:27:10 CDT,2020-08-07,18:27:10,-0500,15740946,pslutsky,Peter Slutsky,,"@ginab Are conferences dead? Will we ever come back together the way we did? BTW, panels as we knew them are dead. Panels in the post COVID/BLM world will look and feel and sound soooooo much different. I’m excited! Also, I’ll never be on another panel. But I’m GOOD with that.",en,[],[],[],1,0,3,[],[],https://twitter.com/pslutsky/status/1291878583523315712,False,,0,,philadelphia,,,,,,"[{'screen_name': 'ginab', 'name': 'Gina Bianchini', 'id': '72403'}]",,,,
1291876455421546496,1291217522918936576,2020-08-07 18:18:43 CDT,2020-08-07,18:18:43,-0500,1019033902764249089,matt_pyfer,Matt is my name,,"@capeann_jim @MKGenest Vote for Jo Jorgensen! The most common sense and competent candidate on the ticket. Also, she has 0 sexual assault allegations unlike the other two guy’s 33 combined. #LetHerSpeak #VoteGold",en,[],[],[],1,1,8,"['letherspeak', 'votegold']",[],https://twitter.com/matt_pyfer/status/1291876455421546496,False,,0,,philadelphia,,,,,,"[{'screen_name': 'capeann_jim', 'name': 'Jim Barber', 'id': '3462902369'}, {'screen_name': 'MKGenest', 'name': 'MK Genest 🌊', 'id': '920023898154065921'}]",,,,
1291872585559531521,1291872585559531521,2020-08-07 18:03:20 CDT,2020-08-07,18:03:20,-0500,1110174163,_crazy_eight,uǝɹɹɐM ʎzǝǝפ,,I love when they are dead wrong lol,en,[],[],[],0,0,0,[],[],https://twitter.com/_crazy_eight/status/1291872585559531521,False,https://twitter.com/dominicknero/status/1260623352273698816,0,,philadelphia,,,,,,[],,,,
1291871340916625410,1291870906105696256,2020-08-07 17:58:24 CDT,2020-08-07,17:58:24,-0500,709873308,phillyindiefan,Keith,,@philatticus An NFL player with a domestic abuse charge? Why I never...,en,[],[],[],0,0,0,[],[],https://twitter.com/phillyindiefan/status/1291871340916625410,False,,0,,philadelphia,,,,,,"[{'screen_name': 'philatticus', 'name': '#1 baja mode fan', 'id': '52752027'}]",,,,
1291863642821074945,1291863642821074945,2020-08-07 17:27:48 CDT,2020-08-07,17:27:48,-0500,8409192,str1cken,Stephen Bruckert,,This is the argument the Trump administration has been making.   Teachers can’t teach if they’re dead.   Primary Schumer.,en,[],[],[],0,1,3,[],[],https://twitter.com/str1cken/status/1291863642821074945,False,https://twitter.com/thehill/status/1291781344725553153,0,,philadelphia,,,,,,[],,,,
1291859119058694144,1291855743050747908,2020-08-07 17:09:50 CDT,2020-08-07,17:09:50,-0500,22731500,chainshaw511,jawn,,"I know I'm not saying anything new here, and I don't have the magic bullet to end fatphobia. But maybe if we took the airtime devoted to preying on people and instead used it to educate them, we could improve things just a tiny bit",en,[],[],[],0,0,1,[],[],https://twitter.com/chainshaw511/status/1291859119058694144,False,,0,,philadelphia,,,,,,[],,,,
1291857985845723137,1291857985845723137,2020-08-07 17:05:20 CDT,2020-08-07,17:05:20,-0500,509054863,s4davillain,@dareals4 🛫 LA,,Pleasure mixed with pain is a deadly combination.. ‼️,en,[],[],[],0,0,0,[],[],https://twitter.com/S4davillain/status/1291857985845723137,False,,0,,philadelphia,,,,,,[],,,,
1291857441244798978,1291851658754916357,2020-08-07 17:03:10 CDT,2020-08-07,17:03:10,-0500,33474857,fromearrth,david,,@Tyler_R_Norris jrpg gameplay and story telling are are different than western pacing tho you gotta admit. like yakuza or nier vs tlou or red dead,en,[],[],[],1,0,2,[],[],https://twitter.com/fromearrth/status/1291857441244798978,False,,0,,philadelphia,,,,,,"[{'screen_name': 'Tyler_R_Norris', 'name': 'xknifeprtyx', 'id': '2500971068'}]",,,,
1291855650402836480,1291851488298500099,2020-08-07 16:56:03 CDT,2020-08-07,16:56:03,-0500,16310951,gwensnyderphl,Gwen Snyder is uncivil,,"They hijack any and every conversation of ""Assad does genocide shit and Putin is a capitalist oligarch, stop defending them"" and take it to ""yup nuke Russia and put Chapo Trap House hosts in gulags"" so everyone critiquing Assad/Putin comes off as ridiculous by association",en,[],[],[],1,1,16,[],[],https://twitter.com/gwensnyderPHL/status/1291855650402836480,False,,0,,philadelphia,,,,,,[],,,,
1291852404682612736,1291852404682612736,2020-08-07 16:43:09 CDT,2020-08-07,16:43:09,-0500,29994677,kn_butler,Willow Ford 213,"{'type': 'Point', 'coordinates': [39.98944055, -75.16323161]}","Kick Ass Authors Writing Challenge Day #7: What is your MC's Greatest strength?   .  My MC, Kaleigha, has two main strengths. She's street smart so she can read motives and body language. Her growing powers are also…  https://t.co/aZYutfnopw",en,[],['https://www.instagram.com/p/CDmoUTEA_-g/?igshid=1kqrqozj127h8'],[],0,0,0,[],[],https://twitter.com/KN_Butler/status/1291852404682612736,False,,0,,philadelphia,,,,,,[],,,,
1291851619664121856,1291851619664121856,2020-08-07 16:40:02 CDT,2020-08-07,16:40:02,-0500,227313111,jragmusic,J Rag™,,Forbes needs to stop making shit up like Kanye West is only running as an operative to hurt Biden's campaign.. @Forbes #Forbes,en,"[{'screen_name': 'forbes', 'name': 'forbes', 'id': '91478624'}]",[],[],0,0,2,['forbes'],[],https://twitter.com/jragmusic/status/1291851619664121856,False,,0,,philadelphia,,,,,,[],,,,
1291848800584249344,1291848800584249344,2020-08-07 16:28:50 CDT,2020-08-07,16:28:50,-0500,1727568464,rep_nicki,tearison..,,You know why the number one cause of death is for our black people? HEART DISEASE!!!!!,en,[],[],[],1,1,1,[],[],https://twitter.com/Rep_Nicki/status/1291848800584249344,False,,0,,philadelphia,,,,,,[],,,,
1291848782150336512,1291540507416559617,2020-08-07 16:28:45 CDT,2020-08-07,16:28:45,-0500,2784494928,firedogchef,Nancy Berman,,"@LATiffani1 @JoeBiden More black and Brown folk are dying from Covid. Every day. Economy in the tank. 22,000,000+ unemployed. 160thousand dead and counting. 300,000 by Christmas. In court today trying to take away pre-existing conditions…",en,[],[],[],0,0,0,[],[],https://twitter.com/FireDogChef/status/1291848782150336512,False,,0,,philadelphia,,,,,,"[{'screen_name': 'LATiffani1', 'name': '🇺🇸Tiff 🇺🇸', 'id': '385142016'}, {'screen_name': 'JoeBiden', 'name': 'Joe Biden', 'id': '939091'}]",,,,
1291848405447254016,1291540507416559617,2020-08-07 16:27:15 CDT,2020-08-07,16:27:15,-0500,2784494928,firedogchef,Nancy Berman,,@LATiffani1 @JoeBiden 160k dead. In court today trying to remove preexisting conditions from health care. Over 22 million unemployed. Tax breaks to the rich. Partied w Epstein and owned by Putin... Ps I like motorcycles....,en,[],[],[],0,0,0,[],[],https://twitter.com/FireDogChef/status/1291848405447254016,False,,0,,philadelphia,,,,,,"[{'screen_name': 'LATiffani1', 'name': '🇺🇸Tiff 🇺🇸', 'id': '385142016'}, {'screen_name': 'JoeBiden', 'name': 'Joe Biden', 'id': '939091'}]",,,,
1291845138403262466,1291845138403262466,2020-08-07 16:14:16 CDT,2020-08-07,16:14:16,-0500,1081241618932469761,joecoxactivist,Joe Cox Activist for an Equitable Philadelphia,,Wow the giant deadly hole in the 11th st bike lane was finally fixed.,en,[],[],[],1,0,3,[],[],https://twitter.com/Joecoxactivist/status/1291845138403262466,False,,0,,philadelphia,,,,,,[],,,,
1291844935868719104,1291844492207837184,2020-08-07 16:13:28 CDT,2020-08-07,16:13:28,-0500,520743767,wristmotion,J Edgar Hoover slander account,,I’m hurt man. Tyler Craig was literally my favorite comedian.,en,[],[],[],0,0,0,[],[],https://twitter.com/wristmotion/status/1291844935868719104,False,,0,,philadelphia,,,,,,[],,,,
1291843195937185794,1291843195937185794,2020-08-07 16:06:33 CDT,2020-08-07,16:06:33,-0500,4491415332,treesey16,treesey #SaveOurDeocracy,,What happened to the 13 year old who has accused Trump of rape?  Did it just go away? Was she threatened?,en,[],[],[],0,0,0,[],[],https://twitter.com/Treesey16/status/1291843195937185794,False,,0,,philadelphia,,,,,,[],,,,
1291839778242125824,1291839778242125824,2020-08-07 15:52:59 CDT,2020-08-07,15:52:59,-0500,4865846417,sianibrownn,siani 🕷🕸❤️‍🔥🪐✨,,"the less you expect from people, the less likely you are to become disappointed or hurt.",en,[],[],[],0,0,2,[],[],https://twitter.com/SianiBrownn/status/1291839778242125824,False,,0,,philadelphia,,,,,,[],,,,
1291836425655246851,1291833587805937666,2020-08-07 15:39:39 CDT,2020-08-07,15:39:39,-0500,23214102,bucadimeggo,bucca di meggo,,@Joliedarrow Please bully me,en,[],[],[],0,0,2,[],[],https://twitter.com/bucadimeggo/status/1291836425655246851,False,,0,,philadelphia,,,,,,"[{'screen_name': 'Joliedarrow', 'name': 'Troll-ie Darrow', 'id': '572107254'}]",,,,
1291835666888904706,1291835666888904706,2020-08-07 15:36:38 CDT,2020-08-07,15:36:38,-0500,962812594800218113,jadaanayah,LIBRAT💫,,And dead ass any bitch can get tf slapped play with your mom not me bitch,en,[],[],[],0,0,0,[],[],https://twitter.com/jadaanayah/status/1291835666888904706,False,,0,,philadelphia,,,,,,[],,,,
1291831573038366720,1291831573038366720,2020-08-07 15:20:22 CDT,2020-08-07,15:20:22,-0500,26039305,ppd3066,Pedro Dixon,,@NBCPhiladelphia @ABC6 @CBSPhilly @69News @FOX29philly @TelemundoNews @CNN @ABC @NYTIMES @WASHINGTONPOST @MSNBC @CBSNEWS @FOXNEWS @AP @BBCWorld @Reuters  FOLKS! This Covid-19 is no foolish hero game. It is life or death. My grands lost their father 2 days ago. WEAR A MASKED! 😷,en,"[{'screen_name': 'abc6', 'name': 'abc6 news desk', 'id': '16547992'}, {'screen_name': 'cbsphilly', 'name': 'cbs philly', 'id': '16083576'}, {'screen_name': '69news', 'name': 'wfmz-tv 69news', 'id': '16542798'}, {'screen_name': 'fox29philly', 'name': 'fox 29', 'id': '14787713'}, {'screen_name': 'telemundonews', 'name': 'noticias telemundo', 'id': '152142811'}, {'screen_name': 'cnn', 'name': 'cnn', 'id': '759251'}, {'screen_name': 'abc', 'name': 'abc news', 'id': '28785486'}, {'screen_name': 'nytimes', 'name': 'the new york times', 'id': '807095'}, {'screen_name': 'washingtonpost', 'name': 'the washington post', 'id': '2467791'}, {'screen_name': 'msnbc', 'name': 'msnbc', 'id': '2836421'}, {'screen_name': 'cbsnews', 'name': 'cbs news', 'id': '15012486'}, {'screen_name': 'foxnews', 'name': 'fox news', 'id': '1367531'}, {'screen_name': 'ap', 'name': 'the associated press', 'id': '51241574'}, {'screen_name': 'bbcworld', 'name': 'bbc news (world)', 'id': '742143'}, {'screen_name': 'reuters', 'name': 'reuters', 'id': '1652541'}]",[],[],0,0,0,[],[],https://twitter.com/PPD3066/status/1291831573038366720,False,,0,,philadelphia,,,,,,[],,,,
1291823790071189504,1291711486042214406,2020-08-07 14:49:27 CDT,2020-08-07,14:49:27,-0500,152630727,il_moniker,Wil Populi’ish,,@JimRuss1980 @gazbod @Marknevard2 Well make it bloody clear will ya. Haha,en,[],[],[],0,0,0,[],[],https://twitter.com/il_moniker/status/1291823790071189504,False,,0,,philadelphia,,,,,,"[{'screen_name': 'JimRuss1980', 'name': 'Jamie Russell', 'id': '139137341'}, {'screen_name': 'gazbod', 'name': 'GazBod', 'id': '20378409'}, {'screen_name': 'Marknevard2', 'name': 'Mark nevard', 'id': '714174142988345344'}]",,,,
1291813791735468032,1291809858895917060,2020-08-07 14:09:43 CDT,2020-08-07,14:09:43,-0500,1227766320122486784,smack_daniels,dayna,,@Christ0pherLeeG @BrowMami Are those the grateful dead Nike SBs orrrrrr,en,[],[],[],1,0,2,[],[],https://twitter.com/smack_daniels/status/1291813791735468032,False,,0,,philadelphia,,,,,,"[{'screen_name': 'Christ0pherLeeG', 'name': 'christopher lee', 'id': '530046597'}, {'screen_name': 'BrowMami', 'name': 'KD', 'id': '878251323132719104'}]",,,,
1291813205224886278,1291813205224886278,2020-08-07 14:07:23 CDT,2020-08-07,14:07:23,-0500,332966560,sirslyremarks,Sir SLy_ReMarks,,"My track ""Dead Wait"" has been added to the @distrokid playlist, ""Wheel of Playlist"" #distrokid #GRIDWORLDRECORDS #ssr #deadwait  https://t.co/kqUy2qqF1b",en,"[{'screen_name': 'distrokid', 'name': 'distrokid', 'id': '1466086093'}]",['https://open.spotify.com/playlist/0MpxljPSptvSVbySSUAHSc'],[],0,1,1,"['distrokid', 'gridworldrecords', 'ssr', 'deadwait']",[],https://twitter.com/SirSLyReMarks/status/1291813205224886278,False,,0,,philadelphia,,,,,,[],,,,
1291811495484030978,1291810717574860802,2020-08-07 14:00:35 CDT,2020-08-07,14:00:35,-0500,50504624,jefferydh,Dan,,@colleen__hayes Busch Light on tap don't hurt too bad,en,[],[],[],1,0,0,[],[],https://twitter.com/jefferydh/status/1291811495484030978,False,,0,,philadelphia,,,,,,"[{'screen_name': 'colleen__hayes', 'name': '✨✨✨', 'id': '255595044'}]",,,,
1291810027259539463,1291810027259539463,2020-08-07 13:54:45 CDT,2020-08-07,13:54:45,-0500,487108853,__leighsmama,Kay Pinkk ✨,,I’ve always have had an aggressive personality &amp; I don’t give a fuck... 😌,en,[],[],[],0,0,1,[],[],https://twitter.com/__leighsmama/status/1291810027259539463,False,,0,,philadelphia,,,,,,[],,,,
1291809029451382785,1291809029451382785,2020-08-07 13:50:47 CDT,2020-08-07,13:50:47,-0500,941186772708536320,vlonerthestoner,Vloner Da Stoner,,As soon as her bf said “the cops are gonna come again” had me dead,en,[],[],[],0,0,0,[],[],https://twitter.com/vlonerthestoner/status/1291809029451382785,False,https://twitter.com/_SJPeace_/status/1291737973315252225,0,,philadelphia,,,,,,[],,,,
1291800596132102145,1291798459838799874,2020-08-07 13:17:17 CDT,2020-08-07,13:17:17,-0500,801992900703907840,gwboudreau,Dr. George W. Boudreau,,"@ProjectLincoln 160,000 Americans are dead of covid. Donald Trump is responsible.",en,[],[],[],0,0,1,[],[],https://twitter.com/gwboudreau/status/1291800596132102145,False,,0,,philadelphia,,,,,,"[{'screen_name': 'ProjectLincoln', 'name': 'The Lincoln Project', 'id': '1205226529455632385'}]",,,,
1291800254950641667,1291800254950641667,2020-08-07 13:15:55 CDT,2020-08-07,13:15:55,-0500,345493125,hazmatcorntail,tim,,"The goalposts moved so much around his series of tweets, I wound up needing Dramamine.",en,[],[],[],1,0,1,[],[],https://twitter.com/HazmatCorntail/status/1291800254950641667,False,https://twitter.com/DineshDSouza/status/1291754313556131841,0,,philadelphia,,,,,,[],,,,
1291800012712742912,1291800012712742912,2020-08-07 13:14:58 CDT,2020-08-07,13:14:58,-0500,721554485252853760,espn_rams_takes,Peedi_Peedi,,SelfLove my feet hurt like Fck 🥴🥴 needed this badly  Treat yourselves my guys it pays off  https://t.co/WLR4dzCRLb,en,[],[],['https://pbs.twimg.com/media/Ee1lOYkXYAAz75C.jpg'],0,0,1,[],[],https://twitter.com/ESPN_Rams_Takes/status/1291800012712742912,False,,1,https://pbs.twimg.com/media/Ee1lOYkXYAAz75C.jpg,philadelphia,,,,,,[],,,,
1291796971242557441,1291788658362769409,2020-08-07 13:02:53 CDT,2020-08-07,13:02:53,-0500,49867431,joetriscuit,Joe (100% Social Credit Score),,@PhillyMayor @PHLPublicHealth Gun violence is now more deadly in Philly than #COVID congrats Jim you did it!,en,[],[],[],1,2,11,['covid'],[],https://twitter.com/JoeTriscuit/status/1291796971242557441,False,,0,,philadelphia,,,,,,"[{'screen_name': 'PhillyMayor', 'name': 'Jim #VaxUpPhilly Kenney', 'id': '4515563482'}, {'screen_name': 'PHLPublicHealth', 'name': 'Philadelphia Public Health', 'id': '500964316'}]",,,,
1291793957454843907,1291793957454843907,2020-08-07 12:50:54 CDT,2020-08-07,12:50:54,-0500,1185080765412982784,r0xyboo,Roxanne🧸🔪,,To the random who got dropped during a ranked game - I don’t know who hurt you but I hope someone hugs you today. It would just be really unfortunate for life to snatch your ass up for all the foul things you called me.  https://t.co/f7krjdiGIM,en,[],[],['https://pbs.twimg.com/tweet_video_thumb/Ee1fwU4XkAATJY5.jpg'],1,0,4,[],[],https://twitter.com/r0xyboo/status/1291793957454843907,False,,1,https://pbs.twimg.com/tweet_video_thumb/Ee1fwU4XkAATJY5.jpg,philadelphia,,,,,,[],,,,
1291791281543413762,1291558062269095936,2020-08-07 12:40:16 CDT,2020-08-07,12:40:16,-0500,4465792940,jjzac43,Joe Z,,@NRA I hope it is from your cold dead hands and heart. Nothing could be more appropriate.,en,[],[],[],0,1,1,[],[],https://twitter.com/jjzac43/status/1291791281543413762,False,,0,,philadelphia,,,,,,"[{'screen_name': 'NRA', 'name': 'NRA', 'id': '21829541'}]",,,,
1291790922502606849,1291790922502606849,2020-08-07 12:38:50 CDT,2020-08-07,12:38:50,-0500,134325815,whatthe__tuck,Amb,,You can’t hurt my feelings but i like pain 🙃,en,[],[],[],0,0,0,[],[],https://twitter.com/WhatThe__TUCK/status/1291790922502606849,False,,0,,philadelphia,,,,,,[],,,,
1291784498573713411,1291777773472608258,2020-08-07 12:13:19 CDT,2020-08-07,12:13:19,-0500,2195211950,tuviaklein,All ice creams are created equal,,"@RealSarahIdan Remember this is the group that invented the suicide bomber. Marine barracks, US embassy Beirut, French paratroopers barracks .",en,[],[],[],0,1,2,[],[],https://twitter.com/tuviaklein/status/1291784498573713411,False,,0,,philadelphia,,,,,,"[{'screen_name': 'RealSarahIdan', 'name': 'Sarai (Sarah Idan) Miss Iraq', 'id': '203348714'}]",,,,
1291784380143239168,1291784380143239168,2020-08-07 12:12:51 CDT,2020-08-07,12:12:51,-0500,64515626,brockstar91,Brockstar☘️,,That kick save by Bob👀,en,[],[],[],0,0,0,[],[],https://twitter.com/brockstar91/status/1291784380143239168,False,,0,,philadelphia,,,,,,[],,,,
1291782756201103362,1291782756201103362,2020-08-07 12:06:23 CDT,2020-08-07,12:06:23,-0500,437112734,chippy_mar,Philly's Finest,,"Pocket full of homeboys, all of em dead",en,[],[],[],0,0,0,[],[],https://twitter.com/Chippy_Mar/status/1291782756201103362,False,,0,,philadelphia,,,,,,[],,,,
1291778877547786240,1291778877547786240,2020-08-07 11:50:59 CDT,2020-08-07,11:50:59,-0500,32768160,215gtownkid,Rémy Martin,,It’s so many reasons why I hate humans. If you see right lane closed for a mile why the fuck are you still in the right lane and then force yourself over at the very end?,en,[],[],[],0,1,4,[],[],https://twitter.com/215GtownKid/status/1291778877547786240,False,,0,,philadelphia,,,,,,[],,,,
1291778220635893760,1291773597782904832,2020-08-07 11:48:22 CDT,2020-08-07,11:48:22,-0500,2303883713,teamrichdollaz,❤Teamrichdollaz ❤️🥰im a female 🥰❤,,@MediaTakeoutTV Why wasn’t Tahiry kicked out she threw the first blow by throwing them damn apples 🍏 Vado was wrong but so was Tahiry too and nobody made own up to her part @DrIshMajor you need to do better Tahiry wasn’t the first victim Vado was #MarriageBootCampHipHop,en,"[{'screen_name': 'drishmajor', 'name': 'dr ish major', 'id': '1865628204'}]",[],[],0,2,3,['marriagebootcamphiphop'],[],https://twitter.com/teamrichdollaz/status/1291778220635893760,False,,0,,philadelphia,,,,,,"[{'screen_name': 'MediaTakeoutTV', 'name': 'MEDIATAKEOUT', 'id': '402778053'}]",,,,
1291777952099774465,1291575937520357376,2020-08-07 11:47:18 CDT,2020-08-07,11:47:18,-0500,26039305,ppd3066,Pedro Dixon,,"@JawnMurray @Oprah @CNN @ABC @NYTIMES @WASHINGTONPOST @MSNBC @CBSNEWS @FOXNEWS @AP @BBCWorld @Reuters Makes no since! You can just  kick in a door like a rage terrorist! Shoot up the place. And when the smoke settles. Announced ""Police"". Only, to discover! You had the wrong location! That's sick",en,"[{'screen_name': 'abc', 'name': 'abc news', 'id': '28785486'}, {'screen_name': 'nytimes', 'name': 'the new york times', 'id': '807095'}, {'screen_name': 'washingtonpost', 'name': 'the washington post', 'id': '2467791'}, {'screen_name': 'msnbc', 'name': 'msnbc', 'id': '2836421'}, {'screen_name': 'cbsnews', 'name': 'cbs news', 'id': '15012486'}, {'screen_name': 'foxnews', 'name': 'fox news', 'id': '1367531'}, {'screen_name': 'ap', 'name': 'the associated press', 'id': '51241574'}, {'screen_name': 'bbcworld', 'name': 'bbc news (world)', 'id': '742143'}, {'screen_name': 'reuters', 'name': 'reuters', 'id': '1652541'}]",[],[],0,0,0,[],[],https://twitter.com/PPD3066/status/1291777952099774465,False,,0,,philadelphia,,,,,,"[{'screen_name': 'JawnMurray', 'name': 'Jawn Murray', 'id': '32738894'}, {'screen_name': 'Oprah', 'name': 'Oprah Winfrey', 'id': '19397785'}]",,,,
1291773631073263616,1291773631073263616,2020-08-07 11:30:08 CDT,2020-08-07,11:30:08,-0500,3245477251,joeblaszczyk,Joseph Blaszczyk,,"Just saw a death cert indicating death by brain injury, had Covid listed. WTF!",en,[],[],[],0,0,0,[],[],https://twitter.com/JoeBlaszczyk/status/1291773631073263616,False,,0,,philadelphia,,,,,,[],,,,
1291773285328396288,1291411578793922561,2020-08-07 11:28:45 CDT,2020-08-07,11:28:45,-0500,2583466672,coachtbrooks,Troy Brooks M.Ed,,"@Coach_Linc @iamCoachAbe You know I won’t dispute that because not only the youth but the teachers, coaches and mentors as well who work directly with the youth. Everyone’s mental health has been comprised. But prayerfully we can put our heads together.",en,[],[],[],0,0,1,[],[],https://twitter.com/CoachTBrooks/status/1291773285328396288,False,,0,,philadelphia,,,,,,"[{'screen_name': 'Coach_Linc', 'name': 'Nick Lincoln', 'id': '835877754788851712'}, {'screen_name': 'iamCoachAbe', 'name': 'Vernard Abrams ACEQB', 'id': '107401882'}]",,,,
1291772248890716162,1291772248890716162,2020-08-07 11:24:38 CDT,2020-08-07,11:24:38,-0500,33180255,unrollthedutch,teya,,The fact that my brain spells no offense like “noah fence” off rip is so funny to me.,en,[],[],[],0,0,1,[],[],https://twitter.com/unrollthedutch/status/1291772248890716162,False,,0,,philadelphia,,,,,,[],,,,
1291770874480263169,1291770874480263169,2020-08-07 11:19:11 CDT,2020-08-07,11:19:11,-0500,2957214987,baldynfl,Brian Baldinger,,.@AtlantaFalcons #ChrisLindstrom made a huge impact on #Falcons offense in the final month. Anyone hungry for some RIBS? Make that a full rack! His style gets me excited #RiseUp #BaldysBreakdowns  https://t.co/1vV13eGjqi,en,"[{'screen_name': 'atlantafalcons', 'name': 'atlanta falcons', 'id': '16347506'}]",[],[],30,248,902,"['chrislindstrom', 'falcons', 'riseup', 'baldysbreakdowns']",[],https://twitter.com/BaldyNFL/status/1291770874480263169,False,,1,https://pbs.twimg.com/ext_tw_video_thumb/1291770740904271873/pu/img/ujXHIp0CppY4YYs3.jpg,philadelphia,,,,,,[],,,,
1291770498066636800,1291770498066636800,2020-08-07 11:17:41 CDT,2020-08-07,11:17:41,-0500,796426394523881472,rashad89_,FI$H,,Ex-FSU big man Michael Ojo dead at 27 after suffering heart attack at practice  https://t.co/EvHSeD4sW3 via @nypostsports SMH,en,"[{'screen_name': 'nypostsports', 'name': 'new york post sports', 'id': '589269098'}]",['https://nypost.com/2020/08/07/ex-florida-state-center-michael-ojo-dead-at-27-from-heart-attack/?utm_source=twitter_sitebuttons&utm_medium=site%20buttons&utm_campaign=site%20buttons'],[],0,0,0,[],[],https://twitter.com/rashad89_/status/1291770498066636800,False,,0,,philadelphia,,,,,,[],,,,
1291767651384033281,1291767651384033281,2020-08-07 11:06:22 CDT,2020-08-07,11:06:22,-0500,1490711226,kayfellowz,Kay The Prolife Witch,,Starting hormone injections today.  I don't want to.....  Someone come stab me cuz I can't.,en,[],[],[],5,0,3,[],[],https://twitter.com/KayFellowz/status/1291767651384033281,False,,0,,philadelphia,,,,,,[],,,,
1291765049418186754,1291763642216611846,2020-08-07 10:56:02 CDT,2020-08-07,10:56:02,-0500,3208397716,lothwolf_,Loth-wolf,,@Autarkis84 Is it weird that I think it'd be awesome if it turned out the world was being controlled by some otherworldly force though? lol  Batshit crazy conspiracy theorists aside obviously xD,en,[],[],[],0,0,0,[],[],https://twitter.com/lothwolf_/status/1291765049418186754,False,,0,,philadelphia,,,,,,[],,,,
