id,conversation_id,created_at,date,time,timezone,user_id,username,name,place,tweet,language,mentions,urls,photos,replies_count,retweets_count,likes_count,hashtags,cashtags,link,retweet,quote_url,video,thumbnail,near,geo,source,user_rt_id,user_rt,retweet_id,reply_to,retweet_date,translate,trans_src,trans_dest
1215784078735216640,1215784078735216640,2020-01-10 17:54:47 CST,2020-01-10,17:54:47,-0500,984406551715868672,chicalibrarian,Adela Justice 😷💉,,The book is so brutal and eye opening. I will see the movie when possible.,en,[],[],[],0,0,3,[],[],https://twitter.com/chicalibrarian/status/1215784078735216640,False,https://twitter.com/hereandnow/status/1215783126800175105,0,,houston,,,,,,[],,,,
1215782875968212996,1215504133811318785,2020-01-10 17:50:00 CST,2020-01-10,17:50:00,-0500,2664461592,thunderrr__,CADET⚡️ THUNDER,,@Its_RuBy77 @YungBaller @ZZDFVESSS @280robin Bosh...with 15 points shooting 42%. Wade didn’t play that game if that’s who you’re looking for.,en,[],[],[],0,0,5,[],[],https://twitter.com/thunderrr__/status/1215782875968212996,False,,0,,houston,,,,,,"[{'screen_name': 'YungBaller', 'name': 'Chris🦊', 'id': '907778566892474368'}, {'screen_name': 'ZZDFVESSS', 'name': '💲💫 \ue760', 'id': '2355623401'}]",,,,
1215781182010462209,1215781182010462209,2020-01-10 17:43:16 CST,2020-01-10,17:43:16,-0500,2263309443,_ctierra,chels.,,HOW DERANGED AND BLATANTLY RACIST CAN ONE BE?!? To insult this man who had nothing to do with the situation except be black.,en,[],[],[],0,0,0,[],[],https://twitter.com/_ctierra/status/1215781182010462209,False,https://twitter.com/Deweycotton/status/1215706709064220672,0,,houston,,,,,,[],,,,
1215776753265913857,1215776753265913857,2020-01-10 17:25:40 CST,2020-01-10,17:25:40,-0500,4907708557,ybb_22,🌲,,I got murder on my mind  https://t.co/Udhu4xYZhm,en,[],[],['https://pbs.twimg.com/media/EN9Ogx2WAAUyqkW.jpg'],0,1,3,[],[],https://twitter.com/Ybb_22/status/1215776753265913857,False,,1,https://pbs.twimg.com/media/EN9Ogx2WAAUyqkW.jpg,houston,,,,,,[],,,,
1215775404981673984,1215666142343237632,2020-01-10 17:20:19 CST,2020-01-10,17:20:19,-0500,1320201872,layc_jane,laceycrenshaw,,"@jodikantor Why is called a ""dramatic protest""? Is it dramatic because their women? This looks like a normal protest",en,[],[],[],0,0,4,[],[],https://twitter.com/layc_jane/status/1215775404981673984,False,,0,,houston,,,,,,"[{'screen_name': 'jodikantor', 'name': 'Jodi Kantor', 'id': '15891430'}]",,,,
1215772389411299329,1215772389411299329,2020-01-10 17:08:20 CST,2020-01-10,17:08:20,-0500,28177782,pantonetana,Tαɳα.,,Telling me you’d get me pregnant (knowing you’re broke) is not a compliment...it’s a threat and I’ma call the police.,en,[],[],[],4,18,51,[],[],https://twitter.com/PantoneTana/status/1215772389411299329,False,,0,,houston,,,,,,[],,,,
1215771040367960070,1215463277766987778,2020-01-10 17:02:58 CST,2020-01-10,17:02:58,-0500,1051164909332037632,l_d_washington,"LaToya Washington, M.Ed",,@ProfChazIII I showed this to a kid having a panic attack in class today. I'm so glad I ran across it earlier.,en,[],[],[],0,0,2,[],[],https://twitter.com/L_D_Washington/status/1215771040367960070,False,,0,,houston,,,,,,[],,,,
1215765624082829314,1215765624082829314,2020-01-10 16:41:27 CST,2020-01-10,16:41:27,-0500,1060920361322250241,eliestrada_11,Eli,,Racist bastards,en,[],[],[],0,0,2,[],[],https://twitter.com/eliestrada_11/status/1215765624082829314,False,https://twitter.com/ESPNFC/status/1215604470584922112,0,,houston,,,,,,[],,,,
1215763068468256768,1215763068468256768,2020-01-10 16:31:17 CST,2020-01-10,16:31:17,-0500,4348160839,huntiepooh,honey🗡🥀,,Northcutt hated us and had no problem letting us know when he said if there was a school shooting he’d stand in the corner and make us all stand around him,en,[],[],[],1,0,3,[],[],https://twitter.com/huntiepooh/status/1215763068468256768,False,https://twitter.com/judd_sandico/status/1215472060044120065,0,,houston,,,,,,[],,,,
1215755964156203008,1215755964156203008,2020-01-10 16:03:04 CST,2020-01-10,16:03:04,-0500,1099771423,mhai56,we are with Ukraine 🇺🇦🇺🇸,,So Trump killed Soleimani for his personal benefit not for the National security threat. Wake up America this selfish lunatic man must GO. We don’t know what he will do next to put our Country in a severe crisis.,en,[],[],[],0,0,0,[],[],https://twitter.com/mhai56/status/1215755964156203008,False,https://twitter.com/gtconway3d/status/1215660145042251782,0,,houston,,,,,,[],,,,
1215753305101676544,1215673320449957890,2020-01-10 15:52:30 CST,2020-01-10,15:52:30,-0500,760895361762234369,dogteam1988,Donovan Campbell,,@jkelley78377 @JaredKelley4 Is someone shooting a shotgun when the ball hits the target lol 😂💪🏾,en,[],[],[],0,0,3,[],[],https://twitter.com/dogteam1988/status/1215753305101676544,False,,0,,houston,,,,,,"[{'screen_name': 'jkelley78377', 'name': 'John Kelley', 'id': '808819898134708225'}, {'screen_name': 'JaredKelley4', 'name': 'Jared Kelley⚾️', 'id': '776209109406232576'}]",,,,
1215749579859165184,1215749579859165184,2020-01-10 15:37:42 CST,2020-01-10,15:37:42,-0500,719879668254515203,falconthegod,The God,,I carry feelings instead ah mi gun dem.,en,[],[],[],0,2,10,[],[],https://twitter.com/FalconTheGod/status/1215749579859165184,False,https://twitter.com/wisocial/status/1215419731089424385,0,,houston,,,,,,[],,,,
1215749189814059008,1215696872955940867,2020-01-10 15:36:09 CST,2020-01-10,15:36:09,-0500,94167395,jacastrottu,Jeff Castro,,@atxhobogrl Looks like a crime scene from a Law and Order episode.,en,[],[],[],0,0,0,[],[],https://twitter.com/JACastroTTU/status/1215749189814059008,False,,0,,houston,,,,,,"[{'screen_name': 'atxhobogrl', 'name': 'Larry FooteSack', 'id': '200264328'}]",,,,
1215743770932776961,1215743770932776961,2020-01-10 15:14:37 CST,2020-01-10,15:14:37,-0500,3223689937,187heaven,void,,Holy fuck my uncle has gun wound on his foot that he has to heal daily and he’s had it for 31 years,en,[],[],[],1,0,0,[],[],https://twitter.com/187heaven/status/1215743770932776961,False,,0,,houston,,,,,,[],,,,
1215742718628048896,1215742718628048896,2020-01-10 15:10:26 CST,2020-01-10,15:10:26,-0500,2299917888,ash_rog21,Ashley Rogers,,"They just played Selena Gomez's ""Lose You to Love Me"" on the radio, &amp; then followed it by Justin Bieber's ""Sorry"" ON THE RELEASE DATE FOR HER ALBUM #RareOutNow  Someone's past experience with emotional &amp; mental abuse is not for your viewers' shock effect, please and thank you.  https://t.co/KveT7A967R",en,[],[],['https://pbs.twimg.com/tweet_video_thumb/EN8vjTbXUAESWLB.jpg'],0,0,0,['rareoutnow'],[],https://twitter.com/ash_rog21/status/1215742718628048896,False,,1,https://pbs.twimg.com/tweet_video_thumb/EN8vjTbXUAESWLB.jpg,houston,,,,,,[],,,,
1215741090759946241,1215741090759946241,2020-01-10 15:03:58 CST,2020-01-10,15:03:58,-0500,428803809,champagn3_mamii,haydee,,This is what I mean by people are so quick to pull the race card. We can’t even use memes these days without being called a racist lol,en,[],[],[],0,0,5,[],[],https://twitter.com/Champagn3_mamii/status/1215741090759946241,False,https://twitter.com/mixedmediapaper/status/1214963753973891074,0,,houston,,,,,,[],,,,
1215738108173594625,1215738108173594625,2020-01-10 14:52:06 CST,2020-01-10,14:52:06,-0500,990778545084489728,allenac009,Allen AC,,"“As Texas’ governor promotes sensational stories of homeless violence and threatens a state crackdown, the people living on Austin’s streets tell a different story.”",en,[],[],[],0,0,0,[],[],https://twitter.com/AllenAC009/status/1215738108173594625,False,https://twitter.com/gusbova/status/1215709022898262018,0,,houston,,,,,,[],,,,
1215730999256145920,1215730999256145920,2020-01-10 14:23:52 CST,2020-01-10,14:23:52,-0500,23186472,dssmichael1991,Naturalized (Purple) Texan,,"@juliemason there is an imminent threat to all US embassies. That’s why they are built like fortresses on 10 acre plots, behind 10-15 foot high walls topped with razor wire.",en,[],[],[],0,0,2,[],[],https://twitter.com/dssmichael1991/status/1215730999256145920,False,,0,,houston,,,,,,[],,,,
1215726279661703168,1215726279661703168,2020-01-10 14:05:06 CST,2020-01-10,14:05:06,-0500,72158667,bbuffingtonhtx,Brett Buffington,,NEW: @Austin_Police admit protocols weren’t followed resulting in a 20 minute and 10 second response to last week’s stabbing attack at Freebird’s.,en,"[{'screen_name': 'austin_police', 'name': 'austin police department', 'id': '369031482'}]",[],[],0,2,1,[],[],https://twitter.com/BBuffingtonHTX/status/1215726279661703168,False,https://twitter.com/tplohetski/status/1215724109784547330,0,,houston,,,,,,[],,,,
1215726050413555712,1215726050413555712,2020-01-10 14:04:12 CST,2020-01-10,14:04:12,-0500,20278402,rolandb3,RJBIII,,"Because everything is geared to TV, and little energy is put toward the attending fan's experience. Mid-day games in Houston during September can be brutal. Thursday and week-day games...anything for tv, no consideration for those attending. Signed, a 10-year season ticket-holder",en,[],[],[],2,1,12,[],[],https://twitter.com/RolandB3/status/1215726050413555712,False,https://twitter.com/TheWilderThings/status/1215656272479113217,0,,houston,,,,,,[],,,,
