id,conversation_id,created_at,date,time,timezone,user_id,username,name,place,tweet,language,mentions,urls,photos,replies_count,retweets_count,likes_count,hashtags,cashtags,link,retweet,quote_url,video,thumbnail,near,geo,source,user_rt_id,user_rt,retweet_id,reply_to,retweet_date,translate,trans_src,trans_dest
1276235084182556673,1276235084182556673,2020-06-25 14:25:30 CDT,2020-06-25,14:25:30,-0500,4775078389,tiaoproperties,Tiao Properties,"{'type': 'Point', 'coordinates': [34.0564, -118.2445]}","What kind of legal force do LOI’s (letters of intent) have? Listen in as our recent speaker, Jeff Love, chimes in to give us insight on this topic. You can watch the entire Multifamily Meetup Webinar about…  https://t.co/puqoGdwIGs",en,[],['https://www.instagram.com/p/CB3qNCBDeFm/?igshid=1p7gx71z8lfga'],[],0,0,0,[],[],https://twitter.com/TiaoProperties/status/1276235084182556673,False,,0,,los angeles,,,,,,[],,,,
1276233610828189696,1276233610828189696,2020-06-25 14:19:38 CDT,2020-06-25,14:19:38,-0500,2387612868,peachykeenwit,Peachy Keen Witted,,And they still haven't sent me mine. 🙄 Audit: US sent $1.4B in virus relief payments to dead people  https://t.co/U6v7aJtQZj,en,[],['https://www.newsbreakapp.com/n/0PRGrVFV?s=a2&pd=02torlUd'],[],0,0,0,[],[],https://twitter.com/PeachyKeenWit/status/1276233610828189696,False,,0,,los angeles,,,,,,[],,,,
1276232996475920385,1276213747091156992,2020-06-25 14:17:12 CDT,2020-06-25,14:17:12,-0500,1165702129715036160,thepeteeffect,THE PETE EFFECT,,@deveautrain Wow that hurt,en,[],[],[],0,0,1,[],[],https://twitter.com/ThePeteEffect/status/1276232996475920385,False,,0,,los angeles,,,,,,"[{'screen_name': 'deveautrain', 'name': 'Dr. Laura A. De Veau 🐝🚂🛤', 'id': '289443194'}]",,,,
1276232345373290498,1276232345373290498,2020-06-25 14:14:37 CDT,2020-06-25,14:14:37,-0500,19047826,jwalsh53,Joe Walsh,"{'type': 'Point', 'coordinates': [34.1581, -118.249]}",Drinking a Space Bloody Orange by @AceCider @ We're Pouring Restaurant and Taphouse —  https://t.co/b6lsmIKaiy,en,"[{'screen_name': 'acecider', 'name': 'acecider', 'id': '766424052613382144'}]",['http://untp.beer/s/c910191781'],[],0,0,0,[],[],https://twitter.com/Jwalsh53/status/1276232345373290498,False,,0,,los angeles,,,,,,[],,,,
1276230634084511744,1276215697039929347,2020-06-25 14:07:49 CDT,2020-06-25,14:07:49,-0500,948118475729379328,jimmyfoles,Sunset Dist.,,@dkahanerules God is warning us. Souls of dead babies cry out for justice. We are the latter day Aztecs.,en,[],[],[],0,0,0,[],[],https://twitter.com/JimmyFoles/status/1276230634084511744,False,,0,,los angeles,,,,,,"[{'screen_name': 'dkahanerules', 'name': 'Michael Walsh', 'id': '395045176'}]",,,,
1276230026833223680,1276131433979863040,2020-06-25 14:05:24 CDT,2020-06-25,14:05:24,-0500,1167619108050882561,tonymcn94431787,Tony Mcneil,,@alexky2016 The Cutie Mark Crusaders Come Back to life &amp; lives again for the external Of Friendship That Cozy Glow Cries Forever That The Cutie Mark crusaders Died To Death. &amp; they brought back to life. We must defeat that phantom virus to save the CMCs From death &amp; cozy Glow two.  https://t.co/K6ho7kEFr6,en,[],[],['https://pbs.twimg.com/media/EbYUcihU8AAT5ph.jpg'],0,0,1,[],[],https://twitter.com/TonyMcn94431787/status/1276230026833223680,False,,1,https://pbs.twimg.com/media/EbYUcihU8AAT5ph.jpg,los angeles,,,,,,[],,,,
1276229645730365441,1276228885214949378,2020-06-25 14:03:53 CDT,2020-06-25,14:03:53,-0500,63028309,cvizzzy,林可林,,@g3Tb3TTER He’s been hurt for awhile so finally back 100% healthy,en,[],[],[],1,0,0,[],[],https://twitter.com/cvizzzy/status/1276229645730365441,False,,0,,los angeles,,,,,,"[{'screen_name': 'g3Tb3TTER', 'name': '🍫 #Chocolate', 'id': '942009428'}]",,,,
1276229598921912320,1275962596408078337,2020-06-25 14:03:42 CDT,2020-06-25,14:03:42,-0500,2906494399,samuelerdahl,Sam i am,,"@JessMcGrath1 It is so painfully truthful. You feel every wound that she puts on display. It’s remarkably honest and reserved acting, especially for 1941.",en,[],[],[],0,0,2,[],[],https://twitter.com/samuelerdahl/status/1276229598921912320,False,,0,,los angeles,,,,,,"[{'screen_name': 'JessMcGrath1', 'name': 'Jess McGrath', 'id': '100056409'}]",,,,
1276229257170055168,1275862560605188096,2020-06-25 14:02:20 CDT,2020-06-25,14:02:20,-0500,1184627294121287680,spychrs,Politicuski,,@clyded @tribelaw Bully would be welcomed. But he is evil and that is not.,en,[],[],[],1,0,1,[],[],https://twitter.com/SpychRs/status/1276229257170055168,False,,0,,los angeles,,,,,,"[{'screen_name': 'clyded', 'name': 'Clyde Doughty Jr', 'id': '23499471'}, {'screen_name': 'tribelaw', 'name': 'Laurence Tribe', 'id': '4091551984'}]",,,,
1276228600975331328,1276228600975331328,2020-06-25 13:59:44 CDT,2020-06-25,13:59:44,-0500,171227200,g8rlitig8r,Cheryl Priest Ainsworth,,"“I’m so sad Bloody Finger Mail isn’t around anymore.” Seriously, that service was the best. Anonymous bloody finger messages? I mean, it’s fun for the whole family!",en,[],[],[],0,0,0,[],[],https://twitter.com/g8rlitig8r/status/1276228600975331328,False,https://twitter.com/gavinthomas2015/status/1275784313733349376,0,,los angeles,,,,,,[],,,,
1276227863285391360,1276227863285391360,2020-06-25 13:56:48 CDT,2020-06-25,13:56:48,-0500,19092048,animalmachine87,Ian K. Loren,,I Am SO HERE FOR THIS !!!Sacramento ‘Karen’ Punched Out After Repeatedly Calling Black Customer The N-word -  https://t.co/ZQFOqyhTJE,en,[],['https://theguardiansofdemocracy.com/sacramento-karen-punched-out-after-she-repeatedly-called-black-customer-the-n-word/'],[],0,0,0,[],[],https://twitter.com/AnimalMachine87/status/1276227863285391360,False,,0,,los angeles,,,,,,[],,,,
1276227713812975616,1276032197346988032,2020-06-25 13:56:12 CDT,2020-06-25,13:56:12,-0500,16060735,dougluberts,Doug Luberts,,"@DaggmaskTTV @DarkclawKalan @matthewmercer Here is one unbiased site that Deals with abuse of the Domestic Violence Restraining Orders, since you are not interested in Civil Harassment, which is worse in terms of abuse of process. Especially in Californian where Judges give them out like candy.   https://t.co/Fo1Jh4k8ag",en,[],['https://www.hg.org/legal-articles/when-protection-orders-are-misused-40032'],[],2,0,0,[],[],https://twitter.com/dougluberts/status/1276227713812975616,False,,0,,los angeles,,,,,,"[{'screen_name': 'DaggmaskTTV', 'name': 'Daggmask', 'id': '209839643'}, {'screen_name': 'matthewmercer', 'name': 'Matthew Mercer', 'id': '24630350'}]",,,,
1276227311809867777,1276227311809867777,2020-06-25 13:54:36 CDT,2020-06-25,13:54:36,-0500,40487426,kennabearrrr,Kenna 𓍊𓋼,,"You’re going to avoid opposite sex relationships because your scared someone might “lie about assault and mess up your life”??? I can’t with you anitwit men, honestly.",en,[],[],[],1,0,4,[],[],https://twitter.com/kennabearrrr/status/1276227311809867777,False,,0,,los angeles,,,,,,[],,,,
1276226376069079040,1276226376069079040,2020-06-25 13:50:53 CDT,2020-06-25,13:50:53,-0500,14468193,ryanleighseaton,Ryan is vibes upon vibes,,...the way some of y'all talk about ur guns... Before you start with me: 659 wounded and 162 dead in mass shootings in this year of COVID between January and May so sit the f*ck down.  https://t.co/Bg3NoH7qkv,en,[],['https://youtu.be/ZLgTHiusbvI'],[],0,0,0,[],[],https://twitter.com/ryanleighseaton/status/1276226376069079040,False,,0,,los angeles,,,,,,[],,,,
1276226301796290566,1276220331267522560,2020-06-25 13:50:36 CDT,2020-06-25,13:50:36,-0500,17981338,sasquatchstacy,c e c e l i a,,"and i’m really really sorry if i’ve been shit at replying to texts and messages and tweets and comments. i know i always am but this has been really hard. please forgive me. or don’t, i guess. but know that i am not trying to hurt anyone.. when i am dealing with something like",en,[],[],[],1,0,3,[],[],https://twitter.com/sasquatchstacy/status/1276226301796290566,False,,0,,los angeles,,,,,,[],,,,
1276225387991728129,1276225387991728129,2020-06-25 13:46:58 CDT,2020-06-25,13:46:58,-0500,940684784954511360,arsenal_la,Arsenal Los Angeles,,Get it!!!!!!  2-0. Joe Willock nets it after several blocks following the free kick. #SOUARS,en,[],[],[],0,0,1,['souars'],[],https://twitter.com/Arsenal_LA/status/1276225387991728129,False,,0,,los angeles,,,,,,[],,,,
1276223876590997504,1276211068533125120,2020-06-25 13:40:57 CDT,2020-06-25,13:40:57,-0500,779706327966679046,ada_ziv,Aduchka / Ada Bar-Ziv,,@Thomas1774Paine Who’s death Exectly? Isn’t it a threat? Isn’t it the spreading of the dangerous poison what ignites the rioters to the vicious violence criminality?Let him have a taste of his own wish. #Hollywood #LosAngeles rioters admitted “we’re going after the rich &amp; famous let them feel ..”,en,[],[],[],0,1,0,"['hollywood', 'losangeles']",[],https://twitter.com/ada_ziv/status/1276223876590997504,False,,0,,los angeles,,,,,,"[{'screen_name': 'Thomas1774Paine', 'name': 'Thomas Paine', 'id': '275276082'}]",,,,
1276223699926970371,1276185040955731969,2020-06-25 13:40:15 CDT,2020-06-25,13:40:15,-0500,18059664,realtordonna,RealtorDonna,,@IBeatCancer2019 @TheColyerLolyer @tina_patel @CBSLA It had a bite wound on its neck. Experts speculate that’s why it left its normal habitat,en,[],[],[],0,0,0,[],[],https://twitter.com/RealtorDonna/status/1276223699926970371,False,,0,,los angeles,,,,,,"[{'screen_name': 'IBeatCancer2019', 'name': '2019CancerSurvivor', 'id': '1187503902758862848'}, {'screen_name': 'TheColyerLolyer', 'name': ""51 more days until he's gone"", 'id': '1209358445456941056'}, {'screen_name': 'tina_patel', 'name': 'Tina Patel', 'id': '233168568'}, {'screen_name': 'CBSLA', 'name': 'CBS Los Angeles', 'id': '24928809'}]",,,,
1276223520796602369,1276223520796602369,2020-06-25 13:39:33 CDT,2020-06-25,13:39:33,-0500,94860963,iamgarythomas,Gary Thomas,,"Idk how ima make it to the gym today. At this point my muscles aren’t even sore, they hurt!",en,[],[],[],0,0,0,[],[],https://twitter.com/IAmGaryThomas/status/1276223520796602369,False,,0,,los angeles,,,,,,[],,,,
1276223209025597440,1276223209025597440,2020-06-25 13:38:18 CDT,2020-06-25,13:38:18,-0500,805410427618197504,zayathaartist,Zaya T.A,,"damn, them niggaz iz cold-hearted, the pigz plottin’ death on niggaz before it even happen . sheesh🧐 ; where my blower at 😂✨💯",en,[],[],[],0,0,0,[],[],https://twitter.com/zayathaartist/status/1276223209025597440,False,https://twitter.com/HotNewHipHop/status/1276222330973368320,0,,los angeles,,,,,,[],,,,
1276222513668743169,1276220501489340419,2020-06-25 13:35:32 CDT,2020-06-25,13:35:32,-0500,166757282,talldarknotugly,Thomas Petborisooth 🍥,,@comicsexplained Words hurt bro...  https://t.co/gT7Xcx7qeu,en,[],[],['https://pbs.twimg.com/tweet_video_thumb/EbYNmyoU8AUPMjg.jpg'],0,0,1,[],[],https://twitter.com/TallDarkNotUgly/status/1276222513668743169,False,,1,https://pbs.twimg.com/tweet_video_thumb/EbYNmyoU8AUPMjg.jpg,los angeles,,,,,,"[{'screen_name': 'comicsexplained', 'name': 'Robert Jefferson', 'id': '177778854'}]",,,,
1276222471415361536,1276222471415361536,2020-06-25 13:35:22 CDT,2020-06-25,13:35:22,-0500,860754378965229568,jo_anuh,{💙💛❤️},,"{+} The art of a pressed flower teaches that even in the face of (an ego) Death, Grace does not die. #foreverimmortal #grace #hydrangeas  https://t.co/e0Bf2iApJ1",en,[],[],['https://pbs.twimg.com/media/EbYNknlVcAAro1D.jpg'],0,2,3,"['foreverimmortal', 'grace', 'hydrangeas']",[],https://twitter.com/Jo_anuh/status/1276222471415361536,False,,1,https://pbs.twimg.com/media/EbYNknlVcAAro1D.jpg,los angeles,,,,,,[],,,,
1276222278674481153,1276221557497450497,2020-06-25 13:34:36 CDT,2020-06-25,13:34:36,-0500,191586452,drewdroege,Drew Droege,,@AndyBeckerman And a name that sounds like a villain’s chemical weapon,en,[],[],[],1,0,7,[],[],https://twitter.com/drewdroege/status/1276222278674481153,False,,0,,los angeles,,,,,,"[{'screen_name': 'AndyBeckerman', 'name': 'Andy Beckerman', 'id': '37558888'}]",,,,
1276222129566932992,1276222129566932992,2020-06-25 13:34:01 CDT,2020-06-25,13:34:01,-0500,934550776025722880,backlynnn,BACK$,,My period cramps hurt so bad 🤧 I want to vomit 🤮,en,[],[],[],0,0,1,[],[],https://twitter.com/backlynnn/status/1276222129566932992,False,,0,,los angeles,,,,,,[],,,,
1276221732026605569,1276221732026605569,2020-06-25 13:32:26 CDT,2020-06-25,13:32:26,-0500,47695096,spinnellii,Auntie Can,,after almost 6 months finaaaaallllly successfully purchased ammunition in LA lol,en,[],[],[],0,0,11,[],[],https://twitter.com/spinnellii/status/1276221732026605569,False,,0,,los angeles,,,,,,[],,,,
1276221084778614784,1276221084778614784,2020-06-25 13:29:52 CDT,2020-06-25,13:29:52,-0500,1410332592,culver_citypd,Culver City PD,"{'type': 'Point', 'coordinates': [34.02056501, -118.39520975]}",WHERE WE STAND- A look at Culver City Police Department’s Use of Force Policies   The Culver City Police Department feels our policies closely mirror the recommendations being asked for by the “8 Can’t Wait”…  https://t.co/HA5pvdFnwW,en,[],['https://www.instagram.com/p/CB3kBCfFaol/?igshid=1x0omsb4thzne'],[],0,0,5,[],[],https://twitter.com/Culver_cityPD/status/1276221084778614784,False,,0,,los angeles,,,,,,[],,,,
1276220848865599488,1276220848865599488,2020-06-25 13:28:56 CDT,2020-06-25,13:28:56,-0500,342967955,tayyb19,𝒯𝒶𝓎🦋,,My next tattoo is going to hurt like a bitch... I can’t wait 😝,en,[],[],[],2,0,4,[],[],https://twitter.com/Tayyb19/status/1276220848865599488,False,,0,,los angeles,,,,,,[],,,,
1276220364285112320,1276220364285112320,2020-06-25 13:27:00 CDT,2020-06-25,13:27:00,-0500,3002975444,jarc98my,EL__BOOOOOO,,Can I please get 2 friends to copy and repost? I am trying to demonstrate that someone is always listening.  #Suicide Awareness 1-800-273-8255  Just two. Any two. Copy- not retweet,en,[],[],[],1,0,0,['suicide'],[],https://twitter.com/Jarc98My/status/1276220364285112320,False,,0,,los angeles,,,,,,[],,,,
1276219989343629312,1276219989343629312,2020-06-25 13:25:31 CDT,2020-06-25,13:25:31,-0500,1313672004,ngo_nick,Nick Ngo,,still shook my neighbor believes kobes death is fake and george floyd was scripted. bro what,en,[],[],[],2,0,7,[],[],https://twitter.com/ngo_nick/status/1276219989343629312,False,,0,,los angeles,,,,,,[],,,,
1276218335445712896,1275833675507253255,2020-06-25 13:18:56 CDT,2020-06-25,13:18:56,-0500,51256062,mellysweeney,Borderline Housewife,,@DonaldJrPeebles @TheRealFrankieD @ABC7NY Omg. I’m NOT making you the victim. You said YOURSELF you should have just said Bill not “Bill is stupid too” WHICH I insinuates the victims were stupid. Yoh acknowledged the poor choice of words so I don’t know why you’re still confused. No one is projecting trauma.,en,[],[],[],1,0,0,[],[],https://twitter.com/mellysweeney/status/1276218335445712896,False,,0,,los angeles,,,,,,"[{'screen_name': 'DonaldJrPeebles', 'name': 'Donald Peebles Jr.', 'id': '180650949'}, {'screen_name': 'TheRealFrankieD', 'name': 'Frankie D', 'id': '25812294'}, {'screen_name': 'ABC7NY', 'name': 'Eyewitness News', 'id': '16715398'}]",,,,
1276217854673555456,1276217854673555456,2020-06-25 13:17:02 CDT,2020-06-25,13:17:02,-0500,294799480,odiliaromero,Odilia Yego,,"using an untrained indigenous Interpreter increases human rights violation of a victim, families &amp; children . Using volunteers interpreters  is a labor violation. Your are suppose to be part of the solution not the problem @ConsulMexOxn @INALIMEXICO  @DEELAYUUK @M_OlgaSCordero",en,"[{'screen_name': 'consulmexoxn', 'name': 'consulmex oxnard', 'id': '143526254'}, {'screen_name': 'inalimexico', 'name': 'inalimexico', 'id': '183760159'}, {'screen_name': 'deelayuuk', 'name': 'adelfo regino montes', 'id': '303477501'}, {'screen_name': 'm_olgascordero', 'name': 'olga sánchez cordero', 'id': '972171133704314880'}]",[],[],2,20,55,[],[],https://twitter.com/OdiliaRomero/status/1276217854673555456,False,,0,,los angeles,,,,,,[],,,,
1276217154694557696,1276214897852813312,2020-06-25 13:14:15 CDT,2020-06-25,13:14:15,-0500,591388750,_daddydisco,DeVaughn Taylor,,"@BookishPlinko @HorrorQueers Love this podcast so much, @TracedThurman &amp; @bstolemyremote have killer chemistry together. I believe I started with Knife + Heart, another favorite was the Blade: Trinity episode. But I asked for an American Psycho episode and they delivered, so so good.",en,"[{'screen_name': 'tracedthurman', 'name': 'trace thurman @ #sxsw', 'id': '21837458'}, {'screen_name': 'bstolemyremote', 'name': 'joe lipsett', 'id': '393566861'}]",[],[],1,0,3,[],[],https://twitter.com/_daddydisco/status/1276217154694557696,False,,0,,los angeles,,,,,,"[{'screen_name': 'BookishPlinko', 'name': 'Anya Stanley', 'id': '2615042646'}, {'screen_name': 'HorrorQueers', 'name': 'Horror Queers', 'id': '1207351033233580032'}]",,,,
1276215959590584320,1276215122298466305,2020-06-25 13:09:30 CDT,2020-06-25,13:09:30,-0500,599715719,morifoki,vil8a,,@MattSoms17 I will RIOT,en,[],[],[],1,0,0,[],[],https://twitter.com/morifoki/status/1276215959590584320,False,,0,,los angeles,,,,,,"[{'screen_name': 'MattSoms17', 'name': 'Señor Shitposter', 'id': '232680887'}]",,,,
1276215339299172352,1276215339299172352,2020-06-25 13:07:02 CDT,2020-06-25,13:07:02,-0500,2327594367,i_sack41,iSaak,,can i please get 2 friends to copy and repost? i am trying to demonstrate that someone is always listening.  #suicide awareness 1-800-273-8255 just two. any two. copy- not retweet.,en,[],[],[],0,0,0,['suicide'],[],https://twitter.com/I_Sack41/status/1276215339299172352,False,,0,,los angeles,,,,,,[],,,,
1276215298417242113,1276215298417242113,2020-06-25 13:06:52 CDT,2020-06-25,13:06:52,-0500,57730566,djsaintjulian,Dj Saint Julian,,So I’d be better off dead ya what your telling me? Because I ain’t never got that shit.,en,[],[],[],0,0,0,[],[],https://twitter.com/DjSaintJulian/status/1276215298417242113,False,https://twitter.com/KTLA/status/1276209456938811392,0,,los angeles,,,,,,[],,,,
1276215286866120704,1276186755792691201,2020-06-25 13:06:49 CDT,2020-06-25,13:06:49,-0500,143582221,kaleidorabbit,𝕂𝕒𝕝𝕖𝕚𝕕𝕠,,@stupidgagaluver @Ae_gustus @NasifNadrun @ChanceOfShade I’m DEAD ... THE SLAP 💀,en,[],[],[],0,0,1,[],[],https://twitter.com/kaleidoRabbit/status/1276215286866120704,False,,0,,los angeles,,,,,,"[{'screen_name': 'stupidgagaluver', 'name': 'Lady Gaga’s Ass🍑', 'id': '1080842701803728898'}, {'screen_name': 'NasifNadrun', 'name': '𝑵𝒂𝒔', 'id': '1140314651969802240'}, {'screen_name': 'ChanceOfShade', 'name': 'ok sis', 'id': '901177128942620672'}]",,,,
1276214629291581440,1276193960910782466,2020-06-25 13:04:13 CDT,2020-06-25,13:04:13,-0500,24066945,bb_hay,𝕳𝖆𝖞𝖑𝖊𝖞,,"@EricJRacy @SoCalValleyGal @cnnbrk the ride is unsettling, like the ride definitely focuses around outrunning death &amp; rituals of violence, but I personally don’t see racist imagery in the ride.. however you’re absolutely right that the context of being based on a racist movie is enough to make the ride problematic",en,[],[],[],1,0,0,[],[],https://twitter.com/bb_hay/status/1276214629291581440,False,,0,,los angeles,,,,,,"[{'screen_name': 'EricJRacy', 'name': 'Eric Racy', 'id': '23639272'}, {'screen_name': 'SoCalValleyGal', 'name': 'Diane', 'id': '826550703258791937'}, {'screen_name': 'cnnbrk', 'name': 'CNN Breaking News', 'id': '428333'}]",,,,
1276213831644016640,1275524160681361408,2020-06-25 13:01:03 CDT,2020-06-25,13:01:03,-0500,1127099168,kingmiller_,🥇🆙🔝👳🏿‍♂️,,@clubpenguinrave @666icc @DBvbiii @xxxashcash @cannotlast @fentysnasa so you wouldn’t argue with someone who demonizes a dead man of which you didn’t know in real life correct???  Oh.. it never works both ways huh? we didn’t know him personally but the media definitely was spreading lies about him and y’all ignore the disputed rebuttals constantly.,en,[],[],[],1,0,3,[],[],https://twitter.com/KingMiller_/status/1276213831644016640,False,,0,,los angeles,,,,,,"[{'screen_name': 'clubpenguinrave', 'name': 'el', 'id': '1311079194781200384'}, {'screen_name': '666icc', 'name': 'diabla 𖤐', 'id': '1242698261271588864'}, {'screen_name': 'xxxashcash', 'name': '𝕬𝖘𝖍 𝕮𝖆𝖘𝖍 - XXX', 'id': '108159512'}]",,,,
1276212974730964992,1276212974730964992,2020-06-25 12:57:38 CDT,2020-06-25,12:57:38,-0500,14827591,jaredjacovich,Jared Jacovich,,Capitalism is a death cult.,en,[],[],[],0,0,3,[],[],https://twitter.com/JaredJacovich/status/1276212974730964992,False,https://twitter.com/ASlavitt/status/1276159092504104961,0,,los angeles,,,,,,[],,,,
1276211332950274049,1276210994079916032,2020-06-25 12:51:07 CDT,2020-06-25,12:51:07,-0500,205141839,alonsocuhh,Enzo 👾,,@v_manduh May I please get 2 friends to copy and repost? I am trying to demonstrate that someone is always listening.  #Suicide Awareness 1-800-273-8255  Just two. Any two. Copy- not retweet,en,[],[],[],1,1,0,['suicide'],[],https://twitter.com/Alonsocuhh/status/1276211332950274049,False,,0,,los angeles,,,,,,"[{'screen_name': 'v_manduh', 'name': '🤝', 'id': '1103538077123796992'}]",,,,
1276210424388579328,1276210424388579328,2020-06-25 12:47:30 CDT,2020-06-25,12:47:30,-0500,1210005069208272897,pillofawoman,𝙴𝚇𝙸𝙻𝙴,,Call it “Land of The Free” when this country is really a Indian Grave Yard. A land that was Rich and Peaceful before it was taken.  So much independence and purity before it was taken. So many innocents raped and murdered after trust. Tell me again why MAKE AMERICA GREAT AGAIN?,en,[],[],[],0,1,1,[],[],https://twitter.com/pillofawoman/status/1276210424388579328,False,,0,,los angeles,,,,,,[],,,,
1276209471589617664,1276206279946633218,2020-06-25 12:43:43 CDT,2020-06-25,12:43:43,-0500,950481307460689920,_arketa_,EP | Arketa,,"@dead_thehype @WatchYouLose b13 is unsafe after db1, do b3 then hitconfirm",en,[],[],[],1,0,1,[],[],https://twitter.com/_Arketa_/status/1276209471589617664,False,,0,,los angeles,,,,,,"[{'screen_name': 'dead_thehype', 'name': '.', 'id': '1243400375241035776'}, {'screen_name': 'WatchYouLose', 'name': 'YiWorld🤍', 'id': '1247032631650377728'}]",,,,
1276209017048592385,1276209017048592385,2020-06-25 12:41:55 CDT,2020-06-25,12:41:55,-0500,418282500,shivawalks,THN,,When you also think about it. Police officers should have the same health and fitness routine as fire fighters. How can we expect a cop to chase and apprehend someone when their fat ass would rather be lazy and shoot someone dead than to run.,en,[],[],[],0,0,0,[],[],https://twitter.com/shivawalks/status/1276209017048592385,False,https://twitter.com/ayomaurice_/status/1275703049017851905,0,,los angeles,,,,,,[],,,,
1276207484722491392,1276207484722491392,2020-06-25 12:35:49 CDT,2020-06-25,12:35:49,-0500,227655241,taylorrrrrb,Taylor.✌,,"I’m chilling! I like country, so Kane Brown won’t hurt my feelings 😊",en,[],[],[],0,0,0,[],[],https://twitter.com/TaylorrrrrB/status/1276207484722491392,False,https://twitter.com/MrFANTastic_/status/1275799826022662145,0,,los angeles,,,,,,[],,,,
1276206807975784449,1276206807975784449,2020-06-25 12:33:08 CDT,2020-06-25,12:33:08,-0500,65758778,nyinabonita,Niina Coleman,,"“If you're ever hurt, then I'm gonna bleed But I'll pick you up and put you back on your feet, That's how this works, I put you first  Yeah, I do for you, what you want me to”... ❤️",en,[],[],[],0,0,0,[],[],https://twitter.com/NyinaBonita/status/1276206807975784449,False,,0,,los angeles,,,,,,[],,,,
1276205389579616257,1276073804444254208,2020-06-25 12:27:30 CDT,2020-06-25,12:27:30,-0500,51260023,tharealcoreyt,💿DIFFERxSOON📀,,@tajjackson3 I pray so hard for the Jackson family today because it’s just not easy.... if we hurt the way we do as fans it really pains me to even try to imagine how they felt waking up today... does it ever get easier for you all because ... it’s been very hard for me @tajjackson3,en,"[{'screen_name': 'tajjackson3', 'name': 'taj jackson', 'id': '6148462'}]",[],[],0,0,1,[],[],https://twitter.com/ThaRealCoreyT/status/1276205389579616257,False,,0,,los angeles,,,,,,"[{'screen_name': 'tajjackson3', 'name': 'Taj Jackson', 'id': '6148462'}]",,,,
1276205015749677057,1276179136571011073,2020-06-25 12:26:01 CDT,2020-06-25,12:26:01,-0500,768927218151993344,johnblizzardxo,John Blizzard,,@brandyke_ My dead grandma got her stimulus check before me. So. lol,en,[],[],[],0,0,2,[],[],https://twitter.com/JohnBlizzardxo/status/1276205015749677057,False,,0,,los angeles,,,,,,"[{'screen_name': 'brandyke_', 'name': 'let’s go, me', 'id': '595067984'}]",,,,
1276203698947887105,1276203698947887105,2020-06-25 12:20:47 CDT,2020-06-25,12:20:47,-0500,765638818938621952,kayhanlife,Kayhan Life,,"Iran’s New Coronavirus Death Toll Climbs Above 10,000   #Iran recorded 134 deaths in the past 24 hours, taking its total so far to 10,130. The total number of cases in the country has reached 215,096 #COVID19 #CoronavirusOutbreak  #KayhanLife   https://t.co/9OxFFaWBau",en,[],['https://kayhanlife.com/news/iran/irans-new-coronavirus-death-toll-climbs-above-10000/'],[],0,3,5,"['iran', 'covid19', 'coronavirusoutbreak', 'kayhanlife']",[],https://twitter.com/KayhanLife/status/1276203698947887105,False,,0,,los angeles,,,,,,[],,,,
1276203478428389376,1276203478428389376,2020-06-25 12:19:54 CDT,2020-06-25,12:19:54,-0500,39815405,lovegalo,LOVEGALO Canote,"{'type': 'Point', 'coordinates': [34.0564, -118.2445]}","TBT - Make is Dead!  . . #makeiadead #makedontpaintanymore #makeisahasbeen #makestn #makewillliveon @ Los Angeles, California  https://t.co/wZHoLaF7tx",en,[],['https://www.instagram.com/p/CB3cAeOp9mE/?igshid=7ln5y50scjbd'],[],0,0,0,"['makeiadead', 'makedontpaintanymore', 'makeisahasbeen', 'makestn', 'makewillliveon']",[],https://twitter.com/LoveGalo/status/1276203478428389376,False,,0,,los angeles,,,,,,[],,,,
