id,conversation_id,created_at,date,time,timezone,user_id,username,name,place,tweet,language,mentions,urls,photos,replies_count,retweets_count,likes_count,hashtags,cashtags,link,retweet,quote_url,video,thumbnail,near,geo,source,user_rt_id,user_rt,retweet_id,reply_to,retweet_date,translate,trans_src,trans_dest
1294613470537637888,1294613470537637888,2020-08-15 07:34:38 CDT,2020-08-15,07:34:38,-0500,3124673581,beeeccaaaaaaa,Rebecca Kincade,,dead ass.,en,[],[],[],0,3,1,[],[],https://twitter.com/beeeccaaaaaaa/status/1294613470537637888,False,https://twitter.com/RuskiCmb/status/1294372644423311361,0,,san diego,,,,,,[],,,,
1294607721572966400,1294607721572966400,2020-08-15 07:11:48 CDT,2020-08-15,07:11:48,-0500,2908761669,topitopaz,Angel,,"my wig gave me such a bad headache! it hurt so bad 🤕  also my bf was like baaby 😍15/10  but then when i took it off from the sheer pain it was causing me, he said i looked like gotye from the somebody that i used to know music video 🤡  https://t.co/tPYnfkU3KD",en,[],[],['https://pbs.twimg.com/media/Efde2f4UEAAbbNp.jpg'],0,0,0,[],[],https://twitter.com/topitopaz/status/1294607721572966400,False,,1,https://pbs.twimg.com/media/Efde2f4UEAAbbNp.jpg,san diego,,,,,,[],,,,
1294574202843009027,1294574202843009027,2020-08-15 04:58:36 CDT,2020-08-15,04:58:36,-0500,138366134,vwotieno,Vinstinct,"{'type': 'Point', 'coordinates': [32.7206207, -117.1603555]}","Tomorrow is the BIG day people !! ""6:59"" Short film. Bringing awareness to police brutality. #659FILM . PREMERE August 16! .subscribe on YouTube.  https://t.co/QbHu2kEckJ .  Follow @vwotieno &amp; @raft_theater for…  https://t.co/DtsY1ny5wG",en,"[{'screen_name': 'vwotieno', 'name': 'vinstinct', 'id': '138366134'}]","['http://www.youtube.com/vinstinctch', 'https://www.instagram.com/p/CD5-BjYDDD1/?igshid=1av5o9yv3a04q']",[],1,1,5,['659film'],[],https://twitter.com/vwotieno/status/1294574202843009027,False,,0,,san diego,,,,,,[],,,,
1294557402461663234,1294040427004399618,2020-08-15 03:51:51 CDT,2020-08-15,03:51:51,-0500,25348386,jimfromsd,Jim From SD CA 📚📖📚📕,,"@RalphNader @AOC Since I blame you for W and therefore 9/11 and Iraq, 1000s more dead and 4 trillion, debt, the recession, leading up to where we are now with the GOP, etc., could you please do me a favor and STFU? TYVM.",en,[],[],[],0,0,1,[],[],https://twitter.com/jimfromsd/status/1294557402461663234,False,,0,,san diego,,,,,,"[{'screen_name': 'RalphNader', 'name': 'Ralph Nader', 'id': '77314692'}, {'screen_name': 'AOC', 'name': 'Alexandria Ocasio-Cortez', 'id': '138203134'}]",,,,
1294528954095689728,1294528783131713536,2020-08-15 01:58:48 CDT,2020-08-15,01:58:48,-0500,1221486896787812353,myradee16,Myra Dee,,When we see u kiss DEAD mouth  https://t.co/HgrCJFJb2f,en,[],[],['https://pbs.twimg.com/media/EfcXOGzU8AAvJ4C.jpg'],0,0,0,[],[],https://twitter.com/MyraDee16/status/1294528954095689728,False,,1,https://pbs.twimg.com/media/EfcXOGzU8AAvJ4C.jpg,san diego,,,,,,[],,,,
1294526839797379073,1294526839797379073,2020-08-15 01:50:24 CDT,2020-08-15,01:50:24,-0500,1221486896787812353,myradee16,Myra Dee,,Take your ideas 4 books wat HOW should name  HIM seems NOW bother THE  URO LATIN KING DEAD AT HIS PRIME SLASH  https://t.co/vlDpPCO0Gm,en,[],[],['https://pbs.twimg.com/media/EfcVTOtUwAELAMx.jpg'],0,0,0,[],[],https://twitter.com/MyraDee16/status/1294526839797379073,False,,1,https://pbs.twimg.com/media/EfcVTOtUwAELAMx.jpg,san diego,,,,,,[],,,,
1294520113073229827,1294520113073229827,2020-08-15 01:23:40 CDT,2020-08-15,01:23:40,-0500,403029093,abottleoffiji,nigglet,,why y’all didn’t tell me bout death parade??,en,[],[],[],0,0,0,[],[],https://twitter.com/abottleofFIJI/status/1294520113073229827,False,,0,,san diego,,,,,,[],,,,
1294517712996057088,1294517712996057088,2020-08-15 01:14:08 CDT,2020-08-15,01:14:08,-0500,34021291,spiceeshonna,Trap House Shonna aka Mrs. Niggaz,,This nigga really trying to do tik tok dances at this little kick back. Jesus fix it 🥴🥴🥴,en,[],[],[],0,0,1,[],[],https://twitter.com/SpiceeShonna/status/1294517712996057088,False,,0,,san diego,,,,,,[],,,,
1294513794874396678,1294491711578812416,2020-08-15 00:58:34 CDT,2020-08-15,00:58:34,-0500,254751148,jasonmobbs_thf,Jason Mobbs,,@red_j13 @cambernius @ESPNStatsInfo I never said that. Go back and review. His style and game do not translate to winning when it matters. Not sure why you continue to dispute this.,en,[],[],[],0,0,0,[],[],https://twitter.com/JasonMobbs_THF/status/1294513794874396678,False,,0,,san diego,,,,,,"[{'screen_name': 'cambernius', 'name': 'Dalai Lama', 'id': '981726335688237056'}, {'screen_name': 'ESPNStatsInfo', 'name': 'ESPN Stats & Info', 'id': '53120768'}]",,,,
1294509827972952070,1294509827972952070,2020-08-15 00:42:48 CDT,2020-08-15,00:42:48,-0500,19580862,cmcameron,Chris Cameron,,Happy birthday @SteveMartinToGo   Thanks for the coronavirus banjo posts. It helps. You just can’t be sad...’Oh death and grief and sorrow and murder...”  https://t.co/nDxKcPJJPj,en,"[{'screen_name': 'stevemartintogo', 'name': 'steve martin', 'id': '14824849'}]",[],['https://pbs.twimg.com/tweet_video_thumb/EfcF0i1UwAAsfBG.jpg'],0,0,0,[],[],https://twitter.com/cmcameron/status/1294509827972952070,False,,1,https://pbs.twimg.com/tweet_video_thumb/EfcF0i1UwAAsfBG.jpg,san diego,,,,,,[],,,,
1294508117682614272,1294508117682614272,2020-08-15 00:36:00 CDT,2020-08-15,00:36:00,-0500,1221486896787812353,myradee16,Myra Dee,,My rich unk USNT THAT KIND NIKKI HE HAS ZERO PATIENCE  WHEN U HURT MISTREAT HIS OWN FLESH  https://t.co/Dzf2dDJi5Y,en,[],[],['https://pbs.twimg.com/media/EfcERYEU0AA15nD.jpg'],0,0,0,[],[],https://twitter.com/MyraDee16/status/1294508117682614272,False,,1,https://pbs.twimg.com/media/EfcERYEU0AA15nD.jpg,san diego,,,,,,[],,,,
1294495720808931328,1294495483348443137,2020-08-14 23:46:45 CDT,2020-08-14,23:46:45,-0500,14964449,redthetrucker,Ken Gartin,,@Padres Bloody hell #manscaped  https://t.co/tGW9F0tQF9,en,[],[],"['https://pbs.twimg.com/media/Efb4_z1UwAE-2Xz.jpg', 'https://pbs.twimg.com/media/Efb4_z4UMAE5bZG.jpg']",3,0,15,['manscaped'],[],https://twitter.com/RedTheTrucker/status/1294495720808931328,False,,1,https://pbs.twimg.com/media/Efb4_z1UwAE-2Xz.jpg,san diego,,,,,,"[{'screen_name': 'Padres', 'name': 'San Diego Padres', 'id': '37837907'}]",,,,
1294490221745061888,1294490221745061888,2020-08-14 23:24:53 CDT,2020-08-14,23:24:53,-0500,29122498,619sports,Craig Elsten,,"Well, we could win with a two-run HR Well, we can take the lead on a grand slam Well, we can still tie it with a slam Oh, we’re totally dead now  The boy is learning to be a #Padres fan, alright.",en,[],[],[],8,2,67,['padres'],[],https://twitter.com/619sports/status/1294490221745061888,False,,0,,san diego,,,,,,[],,,,
1294487693586358272,1294487693586358272,2020-08-14 23:14:51 CDT,2020-08-14,23:14:51,-0500,29199266,wealthlegacygrp,RJ Kelly,,Tucker Carlson suggests Democrats are using coronavirus 'as a political weapon' in hope of winning in November   https://t.co/11Y5y5W051,en,[],['https://www.foxnews.com/opinion/tucker-carlson-democrats-using-coronavirus-political-weapon'],[],1,1,1,[],[],https://twitter.com/WealthLegacyGrp/status/1294487693586358272,False,,0,,san diego,,,,,,[],,,,
1294487653862084609,1294487653862084609,2020-08-14 23:14:41 CDT,2020-08-14,23:14:41,-0500,26349719,whats__goodson,Goody,,Ima let my future kid live with me until I’m dead... they get free rent and i get someone to change my diaper,en,[],[],[],0,0,0,[],[],https://twitter.com/Whats__GoodSon/status/1294487653862084609,False,,0,,san diego,,,,,,[],,,,
1294484304689418240,1294484304689418240,2020-08-14 23:01:23 CDT,2020-08-14,23:01:23,-0500,52245894,sdca_equipment,SDCA Neighborhood Equip. Co,,This offense is offensive. #PadresRazaTwitter #PadresTwitter #FriarFaithful,en,[],[],[],0,0,3,"['padresrazatwitter', 'padrestwitter', 'friarfaithful']",[],https://twitter.com/SDCA_Equipment/status/1294484304689418240,False,,0,,san diego,,,,,,[],,,,
1294483715435814912,1294474527343128576,2020-08-14 22:59:02 CDT,2020-08-14,22:59:02,-0500,1114970489942753280,buddjenn,Jenn Budd,,"@alt_localgov I feel like Dems are not fighting hard enough. Can’t believe they are on vacation with 165,000 dead, USPS under attack, election rigging and DHS attacking protesters.",en,[],[],[],1,0,3,[],[],https://twitter.com/BuddJenn/status/1294483715435814912,False,,0,,san diego,,,,,,"[{'screen_name': 'alt_localgov', 'name': 'ProTip', 'id': '877422306242572288'}]",,,,
1294483350321631232,1294443877126946817,2020-08-14 22:57:35 CDT,2020-08-14,22:57:35,-0500,1114970489942753280,buddjenn,Jenn Budd,,"@Haleaziz It’s ok @Haleaziz. @DHS_Wolf is not a real Secretary, nor is he an experienced professional law enforcement manager. He is a professional ass kisser and wannabe cop with a hard on for old fascists who wear toupees and sexually assault women.",en,"[{'screen_name': 'haleaziz', 'name': 'hamed aleaziz', 'id': '27052147'}, {'screen_name': 'dhs_wolf', 'name': 'acting secretary chad wolf', 'id': '1191733036133552128'}]",[],[],6,15,103,[],[],https://twitter.com/BuddJenn/status/1294483350321631232,False,,0,,san diego,,,,,,"[{'screen_name': 'Haleaziz', 'name': 'Hamed Aleaziz', 'id': '27052147'}]",,,,
1294483262933331970,1294483262933331970,2020-08-14 22:57:14 CDT,2020-08-14,22:57:14,-0500,967521402,mattstephen16,JUDGE BOOTY,,I’ll die before I open up to anybody else again that shits so dead,en,[],[],[],0,0,1,[],[],https://twitter.com/Mattstephen16/status/1294483262933331970,False,,0,,san diego,,,,,,[],,,,
1294482046471950336,1294482046471950336,2020-08-14 22:52:24 CDT,2020-08-14,22:52:24,-0500,907438152859529218,gomez_ryan85,InTatisJrWeTrust,,Waiting for @Padres offense to show up...  https://t.co/vgjBJzWXTR,en,"[{'screen_name': 'padres', 'name': 'san diego padres', 'id': '37837907'}]",[],['https://pbs.twimg.com/tweet_video_thumb/Efbsjs4UYAYds7N.jpg'],0,0,1,[],[],https://twitter.com/Gomez_Ryan85/status/1294482046471950336,False,,1,https://pbs.twimg.com/tweet_video_thumb/Efbsjs4UYAYds7N.jpg,san diego,,,,,,[],,,,
1294479565759197186,1294428125418237953,2020-08-14 22:42:33 CDT,2020-08-14,22:42:33,-0500,25348386,jimfromsd,Jim From SD CA 📚📖📚📕,,"@worldincrisis1 @YouTube @DavidBowieReal Absolutely. There were other venues too, on Long Island and downtown Manhattan, but I saw the majority at MSG. Doors, Cream, Dead, Allmans, Bowie, Zep, Rod, Elton, Stones, Styx, Foreigner, Billy Joel, I know I'm missing some...",en,[],[],[],3,1,1,[],[],https://twitter.com/jimfromsd/status/1294479565759197186,False,,0,,san diego,,,,,,"[{'screen_name': 'worldincrisis1', 'name': 'ThommytheCat3', 'id': '3024400694'}, {'screen_name': 'YouTube', 'name': 'YouTube', 'id': '10228272'}, {'screen_name': 'DavidBowieReal', 'name': 'David Bowie Official', 'id': '40139016'}]",,,,
1294477413053632513,1294477413053632513,2020-08-14 22:34:00 CDT,2020-08-14,22:34:00,-0500,1221486896787812353,myradee16,Myra Dee,,STOP the ABUSE u don't return u help NO ONE THAT KEEP RETURN TO SAME SHIT  AS U CAN SEE ALL LOST THOSE VICTIMS  HOMES TO START FRESH CANT,en,[],[],[],0,0,0,[],[],https://twitter.com/MyraDee16/status/1294477413053632513,False,,0,,san diego,,,,,,[],,,,
1294476857354719232,1294476857354719232,2020-08-14 22:31:47 CDT,2020-08-14,22:31:47,-0500,1221486896787812353,myradee16,Myra Dee,,Nope WE R DONE THEY GET KICK OUT OF ALL HOUSES WHO HOUSE THEM I DON'T CARE I CAN'T HOYSE MY SELF SO BITCH GO GET JOB,en,[],[],[],0,0,0,[],[],https://twitter.com/MyraDee16/status/1294476857354719232,False,,0,,san diego,,,,,,[],,,,
1294476136005505024,1294476136005505024,2020-08-14 22:28:55 CDT,2020-08-14,22:28:55,-0500,3171110886,raysg_sd,Raymond San Giovanni,,If our offense doesn’t get this W for Lamet I swear to god...#FriarFaithful,en,[],[],[],0,0,0,['friarfaithful'],[],https://twitter.com/RaySG_SD/status/1294476136005505024,False,,0,,san diego,,,,,,[],,,,
1294474178247012352,1294474178247012352,2020-08-14 22:21:08 CDT,2020-08-14,22:21:08,-0500,1221486896787812353,myradee16,Myra Dee,,LET him in HOUSE with KID HE HURT THEN U IN RETURN WENT AFTER THE KIDS SO U ALL LIVE OFF STOP  SIGNALING  ALL KNOW GAMBLE,en,[],[],[],0,0,0,[],[],https://twitter.com/MyraDee16/status/1294474178247012352,False,,0,,san diego,,,,,,[],,,,
1294468110682972160,1294084802312720385,2020-08-14 21:57:02 CDT,2020-08-14,21:57:02,-0500,250270561,sarabrownevents,S B | E V E N T S,,"@JoshuaDPetrie I’m so sorry to hear that. Hang in there, there is a strong force of SD planners working towards a solution so that there is no delay of what the plan looks like when can open. We’re in this together!",en,[],[],[],0,0,1,[],[],https://twitter.com/sarabrownevents/status/1294468110682972160,False,,0,,san diego,,,,,,"[{'screen_name': 'JoshuaDPetrie', 'name': 'Joshua Petrie', 'id': '835697982'}]",,,,
1294464914270982145,1294464914270982145,2020-08-14 21:44:20 CDT,2020-08-14,21:44:20,-0500,3213373713,maxsd09,Max- Rooster gon’ Roost 🐔,,Crone the victim of bad luck right there.,en,[],[],[],0,0,1,[],[],https://twitter.com/MaxSD09/status/1294464914270982145,False,,0,,san diego,,,,,,[],,,,
1294462414512037888,1294462414512037888,2020-08-14 21:34:24 CDT,2020-08-14,21:34:24,-0500,1221486896787812353,myradee16,Myra Dee,,KEPT NEW BISNESS NO ONE LOOSES JOBS  DIDN'T HURT NO ONE,en,[],[],[],0,0,0,[],[],https://twitter.com/MyraDee16/status/1294462414512037888,False,,0,,san diego,,,,,,[],,,,
1294461357442715648,1294461357442715648,2020-08-14 21:30:12 CDT,2020-08-14,21:30:12,-0500,175281443,mariussose,SD Master Trainer,"{'type': 'Point', 'coordinates': [32.7155, -117.1585]}","When closet racist try to cover up racism and police brutality with their weak deflection strategies this exactly how they go.   Stumbling then fall right on their face!  Lol. 🚫🧢 @ San Diego, California  https://t.co/FcOY6NqmGm",en,[],['https://www.instagram.com/p/CD5KokpniO-/?igshid=1lkg7ietdvi50'],[],0,0,0,[],[],https://twitter.com/MariusSose/status/1294461357442715648,False,,0,,san diego,,,,,,[],,,,
