id,conversation_id,created_at,date,time,timezone,user_id,username,name,place,tweet,language,mentions,urls,photos,replies_count,retweets_count,likes_count,hashtags,cashtags,link,retweet,quote_url,video,thumbnail,near,geo,source,user_rt_id,user_rt,retweet_id,reply_to,retweet_date,translate,trans_src,trans_dest
1444812957649551361,1444748862091145222,2021-10-03 18:53:47 CDT,2021-10-03,18:53:47,-0500,2353415005,pjc_dc,"Dr. Peter James Callahan/Matt Dillon, US Marshal",,"@Evan_H357 @GarrettHaake It was constituents but it was a bad move. You don't follow folks to the bathroom especially while you're filming or shooting photos. This isn't so much an opinion as it is a code of human decency/conduct whether you're a journo, activist or anyone.",en,[],[],[],1,1,3,[],[],https://twitter.com/PJC_dc/status/1444812957649551361,False,,0,,phoenix,,,,,,"[{'screen_name': 'Evan_H357', 'name': 'Evan', 'id': '835019421559189508'}, {'screen_name': 'GarrettHaake', 'name': 'Garrett Haake', 'id': '47991586'}]",,,,
1444800272895647746,1444800272895647746,2021-10-03 18:03:22 CDT,2021-10-03,18:03:22,-0500,558190717,calecampbell88,Cale Campbell,,Just put in the backups Kliff. Don’t get anyone else injured,en,[],[],[],0,0,0,[],[],https://twitter.com/calecampbell88/status/1444800272895647746,False,,0,,phoenix,,,,,,[],,,,
1444797404922802181,1444797404922802181,2021-10-03 17:51:59 CDT,2021-10-03,17:51:59,-0500,1157474628,threat_lvl_mdnt,x - clinched,,Little Red Sea baby! @mikal_bridges,en,"[{'screen_name': 'mikal_bridges', 'name': 'mikal bridges', 'id': '994335752312979463'}]",[],[],0,0,0,[],[],https://twitter.com/threat_lvl_mdnt/status/1444797404922802181,False,,0,,phoenix,,,,,,[],,,,
1444796872288190464,1444796872288190464,2021-10-03 17:49:52 CDT,2021-10-03,17:49:52,-0500,1388313655,big_red_rage,🏆🏀💥The Red Rage💥🏀🏆,,#Rams YOU SUCK! BAHAHAHAHA!!! 😂🤣😂 #AZCardinals 4-0 BABY!!! WOOOOOO!!! #RedSea @AZCardinals @budlight  https://t.co/FwADt26lmF,en,"[{'screen_name': 'azcardinals', 'name': 'arizona cardinals', 'id': '389038362'}, {'screen_name': 'budlight', 'name': 'bud light', 'id': '742011151'}]",[],['https://pbs.twimg.com/media/FAzzGOeVQAMHj-X.jpg'],1,2,5,"['rams', 'azcardinals', 'redsea']",[],https://twitter.com/Big_Red_Rage/status/1444796872288190464,False,,1,https://pbs.twimg.com/media/FAzzGOeVQAMHj-X.jpg,phoenix,,,,,,[],,,,
1444796748602298370,1444796748602298370,2021-10-03 17:49:22 CDT,2021-10-03,17:49:22,-0500,284259049,arieldelamora1,Ariel De La Mora,,Show recommendations that no one asked for but here they are: • Sex Education • Atypical  • Wentworth • Manifest • Clickbait • Nurse Jackie • Grace &amp; Frankie • Shameless • Mindy Project • Jane the Virgin • How to Get Way w/ Murder • Schitt’s Creek • Working Moms,en,[],[],[],1,0,10,[],[],https://twitter.com/ArielDeLaMora1/status/1444796748602298370,False,,0,,phoenix,,,,,,[],,,,
1444792021256785924,1444790238723776519,2021-10-03 17:30:35 CDT,2021-10-03,17:30:35,-0500,447599483,reganinaz,Regan,,@Sandman9595 He’s a weapon!,en,[],[],[],0,0,0,[],[],https://twitter.com/ReganInAZ/status/1444792021256785924,False,,0,,phoenix,,,,,,"[{'screen_name': 'Sandman9595', 'name': 'Rich Cantrell', 'id': '162144676'}]",,,,
1444780963473489920,1444780963473489920,2021-10-03 16:46:39 CDT,2021-10-03,16:46:39,-0500,1230712134549430273,whitepawsphx,White PAWS,,"Woody wasn’t perfect and it’s critical to condemn the Indigenous erasure in his most famous song. With contradictions, we remember him today as an example of how white folks have historically been involved in the essential anti-racist and anti-fascist work. #landback #antifascist  https://t.co/WOyTnWJIAr",en,[],[],"['https://pbs.twimg.com/media/FAzkoMoVgAAvH8t.jpg', 'https://pbs.twimg.com/media/FAzkoMnUYAQfYeo.jpg']",0,0,2,"['landback', 'antifascist']",[],https://twitter.com/whitepawsphx/status/1444780963473489920,False,,1,https://pbs.twimg.com/media/FAzkoMoVgAAvH8t.jpg,phoenix,,,,,,[],,,,
1444780960877146113,1444780574342737924,2021-10-03 16:46:38 CDT,2021-10-03,16:46:38,-0500,90895400,stanleyroberts,Stanley Roberts,,@SusanDReynolds someone would call it racist 😳,en,[],[],[],1,0,13,[],[],https://twitter.com/StanleyRoberts/status/1444780960877146113,False,,0,,phoenix,,,,,,"[{'screen_name': 'SusanDReynolds', 'name': 'Susan Dyer Reynolds', 'id': '1345188134426791939'}]",,,,
1444779242294628353,1444779242294628353,2021-10-03 16:39:48 CDT,2021-10-03,16:39:48,-0500,1271429149,jackunlawful,jack🏜,,I have information that could lead to the arrest and imprisonment of James Robert Crane,en,[],[],[],0,0,1,[],[],https://twitter.com/jackunlawful/status/1444779242294628353,False,,0,,phoenix,,,,,,[],,,,
1444778889599799297,1444778889599799297,2021-10-03 16:38:24 CDT,2021-10-03,16:38:24,-0500,418347589,carlsanders13,Carl Sanders,,Met Police Officer From Same Unit as Sarah Everard Killer Charged With Rape   https://t.co/hMPxsI66BB,en,[],['https://sputniknews.com/20211003/met-police-officer-from-same-unit-as-sarah-everard-killer-charged-with-rape-1089633928.html'],[],0,1,1,[],[],https://twitter.com/carlsanders13/status/1444778889599799297,False,,0,,phoenix,,,,,,[],,,,
1444775465026129922,1444775465026129922,2021-10-03 16:24:48 CDT,2021-10-03,16:24:48,-0500,22815722,ralphbelairny,Cassius 🇭🇹,,A Black man calling BLM a terrorist organization 🤣🤦🏾‍♂️‼️,en,[],[],[],0,0,0,[],[],https://twitter.com/ralphbelairny/status/1444775465026129922,False,https://twitter.com/RonFilipkowski/status/1444774083963543557,0,,phoenix,,,,,,[],,,,
1444771140728238083,1444771140728238083,2021-10-03 16:07:37 CDT,2021-10-03,16:07:37,-0500,454931021,deviltukee,DevilTukee,,That's a brutal call on Thompson.,en,[],[],[],0,0,2,[],[],https://twitter.com/DevilTukee/status/1444771140728238083,False,,0,,phoenix,,,,,,[],,,,
1444770389565980676,1444770389565980676,2021-10-03 16:04:38 CDT,2021-10-03,16:04:38,-0500,1157474628,threat_lvl_mdnt,x - clinched,,James Conner has the truck stick permanently moving forward!,en,[],[],[],0,0,0,[],[],https://twitter.com/threat_lvl_mdnt/status/1444770389565980676,False,,0,,phoenix,,,,,,[],,,,
1444762796059619330,1444762090703495170,2021-10-03 15:34:27 CDT,2021-10-03,15:34:27,-0500,19788132,azsportsmaven,#OnToThePhxSuns,,"@azmadame_x I thought I saw Lee, I almost had a heart attack...",en,[],[],[],0,0,1,[],[],https://twitter.com/AZSportsMaven/status/1444762796059619330,False,,0,,phoenix,,,,,,"[{'screen_name': 'azmadame_x', 'name': 'Sue H', 'id': '34041407'}]",,,,
1444758162314121218,1444758162314121218,2021-10-03 15:16:02 CDT,2021-10-03,15:16:02,-0500,1157474628,threat_lvl_mdnt,x - clinched,,They so worried about DT its opening up the whole court for everyone else,en,[],[],[],0,0,0,[],[],https://twitter.com/threat_lvl_mdnt/status/1444758162314121218,False,,0,,phoenix,,,,,,[],,,,
1444758139518156800,1444758139518156800,2021-10-03 15:15:57 CDT,2021-10-03,15:15:57,-0500,891441065412055040,iheartsfg_,iheartsfg,,Let’s go baby face assassin lol,en,[],[],[],0,0,1,[],[],https://twitter.com/iheartsfg_/status/1444758139518156800,False,,0,,phoenix,,,,,,[],,,,
1444752814354296833,1444752814354296833,2021-10-03 14:54:47 CDT,2021-10-03,14:54:47,-0500,1157474628,threat_lvl_mdnt,x - clinched,,David Johnson was so good man. Geez,en,[],[],[],0,0,0,[],[],https://twitter.com/threat_lvl_mdnt/status/1444752814354296833,False,https://twitter.com/NoContextCards/status/1444685764391014401,0,,phoenix,,,,,,[],,,,
1444750499568226304,1444750499568226304,2021-10-03 14:45:35 CDT,2021-10-03,14:45:35,-0500,1157474628,threat_lvl_mdnt,x - clinched,,All the time baby! Wont stop me! Lol,en,[],[],[],0,0,1,[],[],https://twitter.com/threat_lvl_mdnt/status/1444750499568226304,False,https://twitter.com/nuclearpasta_/status/1444145883428257801,0,,phoenix,,,,,,[],,,,
1444748159603728386,1444748159603728386,2021-10-03 14:36:18 CDT,2021-10-03,14:36:18,-0500,768875249563607040,azdolphinsfb,Arizona Dolphins,,"Might be the most dominant d-lineman in the state @mgardner2023 is physical at the point of attack, sheds blocks well, and finishes.   Coaches check out his tape!!",en,"[{'screen_name': 'mgardner2023', 'name': 'my’keil gardner', 'id': '1227695811892350978'}]",[],[],2,0,3,[],[],https://twitter.com/azdolphinsfb/status/1444748159603728386,False,https://twitter.com/mgardner2023/status/1444729270287273988,0,,phoenix,,,,,,[],,,,
1444747002353385472,1444747002353385472,2021-10-03 14:31:42 CDT,2021-10-03,14:31:42,-0500,1388313655,big_red_rage,🏆🏀💥The Red Rage💥🏀🏆,,My BUDdies have arrived! Ha! Ha! WOOOOOO!!!  #RiseUp #RedSea #AZCardinals #GameDay #AZvsLAR @budlight @AZCardinals  https://t.co/En09ezxAEI,en,"[{'screen_name': 'budlight', 'name': 'bud light', 'id': '742011151'}, {'screen_name': 'azcardinals', 'name': 'arizona cardinals', 'id': '389038362'}]",[],['https://pbs.twimg.com/media/FAzFvd4VkAMuY7F.jpg'],0,1,5,"['riseup', 'redsea', 'azcardinals', 'gameday', 'azvslar']",[],https://twitter.com/Big_Red_Rage/status/1444747002353385472,False,,1,https://pbs.twimg.com/media/FAzFvd4VkAMuY7F.jpg,phoenix,,,,,,[],,,,
1444746240923602944,1444746240923602944,2021-10-03 14:28:40 CDT,2021-10-03,14:28:40,-0500,832813644673003520,azpolitico22,Arizona Politico 🇺🇸🇺🇦,,Fun fact about me: I have Sinema’s personal email address.   Another fun fact: I would never abuse that privilege by emailing her about anything to do with her job.   Y’all are being counterproductive in your approach &amp; she’ll just dig her heels in further if you keep it up.,en,[],[],[],3,0,9,[],[],https://twitter.com/azpolitico22/status/1444746240923602944,False,,0,,phoenix,,,,,,[],,,,
1444745233338540032,1444744787723100160,2021-10-03 14:24:40 CDT,2021-10-03,14:24:40,-0500,22815722,ralphbelairny,Cassius 🇭🇹,,@BtwoTimes Brutal 🤣🤣🤣🤣🤣‼️🖕🏾,no,[],[],[],0,0,1,[],[],https://twitter.com/ralphbelairny/status/1444745233338540032,False,,0,,phoenix,,,,,,"[{'screen_name': 'BtwoTimes', 'name': 'Drums Are Better Than Flats', 'id': '22715322'}]",,,,
1444740566198013956,1444740566198013956,2021-10-03 14:06:07 CDT,2021-10-03,14:06:07,-0500,1157474628,threat_lvl_mdnt,x - clinched,,Taurasi picking up where she left off i guess!,en,[],[],[],0,0,1,[],[],https://twitter.com/threat_lvl_mdnt/status/1444740566198013956,False,,0,,phoenix,,,,,,[],,,,
1444736582099955716,1444736582099955716,2021-10-03 13:50:17 CDT,2021-10-03,13:50:17,-0500,1157474628,threat_lvl_mdnt,x - clinched,,Same @Candace_Parker . I would make the same face if i saw someone making a one handed jumper like that 🤣🤣🤣  https://t.co/eVdgQfX54v,en,"[{'screen_name': 'candace_parker', 'name': 'candace parker', 'id': '22657202'}]",[],[],0,0,0,[],[],https://twitter.com/threat_lvl_mdnt/status/1444736582099955716,False,,1,https://pbs.twimg.com/ext_tw_video_thumb/1444736557399769089/pu/img/J-JH8umI_2WO8mho.jpg,phoenix,,,,,,[],,,,
1444734356749107202,1444734356749107202,2021-10-03 13:41:27 CDT,2021-10-03,13:41:27,-0500,1157474628,threat_lvl_mdnt,x - clinched,,We got the @PhoenixMercury and the @AZCardinals today!!!  https://t.co/RRi6p5apsU,en,"[{'screen_name': 'phoenixmercury', 'name': 'phoenix mercury', 'id': '29779226'}, {'screen_name': 'azcardinals', 'name': 'arizona cardinals', 'id': '389038362'}]",[],['https://pbs.twimg.com/tweet_video_thumb/FAy6PNBVgAM7N33.jpg'],0,0,1,[],[],https://twitter.com/threat_lvl_mdnt/status/1444734356749107202,False,,1,https://pbs.twimg.com/tweet_video_thumb/FAy6PNBVgAM7N33.jpg,phoenix,,,,,,[],,,,
1444729762136539147,1444729762136539147,2021-10-03 13:23:11 CDT,2021-10-03,13:23:11,-0500,418347589,carlsanders13,Carl Sanders,,Illegal Drugs &amp; Arrest of Bollywood Superstar's Son: What is Known About Raid on Mumbai Cruise Rave?   https://t.co/IKakuDMNSU,en,[],['https://sputniknews.com/20211003/illegal-drugs--arrest-of-bollywood-superstars-son-what-is-known-about-raid-on-mumbai-cruise-rave-1089624661.html'],[],0,1,1,[],[],https://twitter.com/carlsanders13/status/1444729762136539147,False,,0,,phoenix,,,,,,[],,,,
1444729388558258182,1444656008383639563,2021-10-03 13:21:42 CDT,2021-10-03,13:21:42,-0500,3224557602,mikeflanagan001,Mike Flanagan,,@BCOOL333 Why would Twitter let the head of a crime family back on their platform? What would be the upside?,en,[],[],[],0,0,0,[],[],https://twitter.com/MikeFlanagan001/status/1444729388558258182,False,,0,,phoenix,,,,,,"[{'screen_name': 'BCOOL333', 'name': 'BCOOL', 'id': '1145314909233848320'}]",,,,
1444718322759581699,1444718322759581699,2021-10-03 12:37:44 CDT,2021-10-03,12:37:44,-0500,366999390,_aj1996_,Twinkie Mcdoublestuffed,,If you have fallin victim to @BeatboxBevs you might be entitled to compensation,en,"[{'screen_name': 'beatboxbevs', 'name': 'beatbox beverages🧃', 'id': '532328208'}]",[],[],0,0,1,[],[],https://twitter.com/_aj1996_/status/1444718322759581699,False,https://twitter.com/lylecrisco/status/1444717282110935040,0,,phoenix,,,,,,[],,,,
1444718197156892676,1444715442463920131,2021-10-03 12:37:14 CDT,2021-10-03,12:37:14,-0500,1257164489562046465,nutz_beat,BeatNutz,,@IlluminatiRichy Is that shit good? Lowkey been looking for a back gun,en,[],[],[],1,0,2,[],[],https://twitter.com/nutz_beat/status/1444718197156892676,False,,0,,phoenix,,,,,,"[{'screen_name': 'IlluminatiRichy', 'name': 'RICH 🏰 Killmilord 🔜 Houston', 'id': '3160429429'}]",,,,
1444713163237191681,1444713163237191681,2021-10-03 12:17:14 CDT,2021-10-03,12:17:14,-0500,90895400,stanleyroberts,Stanley Roberts,,I just posted the most bizarre audio threat on my @SuperFollows account. Apparently my whole family and children were threatened. It was a series of audio recordings left in @instagram my direct messages.,en,"[{'screen_name': 'superfollows', 'name': 'super follows', 'id': '1425859260248854535'}, {'screen_name': 'instagram', 'name': 'instagram', 'id': '180505807'}]",[],[],19,8,39,[],[],https://twitter.com/StanleyRoberts/status/1444713163237191681,False,,0,,phoenix,,,,,,[],,,,
1444712187189104640,1444712187189104640,2021-10-03 12:13:21 CDT,2021-10-03,12:13:21,-0500,1356247164385517569,turtlepuncherx,TurtlPuncherXx,,Gaskin against Leonard and you don't attack that?!,en,[],[],[],0,0,0,[],[],https://twitter.com/TurtlepuncherX/status/1444712187189104640,False,,0,,phoenix,,,,,,[],,,,
1444700922827792390,1444700922827792390,2021-10-03 11:28:35 CDT,2021-10-03,11:28:35,-0500,2395705982,louboatxx,louix,,no weapon formed against me cause im covered in the blood,en,[],[],[],0,0,0,[],[],https://twitter.com/louboatxx/status/1444700922827792390,False,,0,,phoenix,,,,,,[],,,,
1444675063718952972,1444421243969490944,2021-10-03 09:45:50 CDT,2021-10-03,09:45:50,-0500,524003607,azsportsrealtor,Azsportsrealtor,,"@BeanElite @luisaz1513 @OfflineMike @mikalbridge The guy who’s scared to play the 5? Who shot a ton of jumpers and didn’t do anything against us before getting injured? Ayton plays him fine, not worried until AD can stay healthy and be a man at the 5",en,[],[],[],2,0,0,[],[],https://twitter.com/AZSportsRealtor/status/1444675063718952972,False,,0,,phoenix,,,,,,"[{'screen_name': 'BeanElite', 'name': 'Bean🐺', 'id': '1062937938646822912'}, {'screen_name': 'luisaz1513', 'name': 'LEV', 'id': '2907607788'}, {'screen_name': 'mikalbridge', 'name': 'x - Isaac (53-14)', 'id': '871036856434950144'}]",,,,
1444674162576875521,1444644419102248962,2021-10-03 09:42:15 CDT,2021-10-03,09:42:15,-0500,860234566132408320,estherannepaul1,AZcatladysupportsBiden,,@kyblueblood There was a Twitter video that circulated within the last two years of the Phoenix PD holding a African American pregnant woman and child at gun point because they may or may not have shoplifted from a dollar store.,en,[],[],[],0,0,0,[],[],https://twitter.com/EstherAnnePaul1/status/1444674162576875521,False,,0,,phoenix,,,,,,"[{'screen_name': 'kyblueblood', 'name': 'Robin Osborne 🌻 Activist ~ #Dem~ #CriptheVote ♿', 'id': '27707682'}]",,,,
1444672211361558537,1444644419102248962,2021-10-03 09:34:30 CDT,2021-10-03,09:34:30,-0500,860234566132408320,estherannepaul1,AZcatladysupportsBiden,,"@kyblueblood That’s amazing. AZ police are no better. Until Arpaio got fired by voters, driving while Hispanic was a problem. The Phoenix PD shot a half naked man near my office  because they thought he had a gun. (Only wearing skimpy shorts) All on camera. His crime, walking while poor.",en,[],[],[],1,0,0,[],[],https://twitter.com/EstherAnnePaul1/status/1444672211361558537,False,,0,,phoenix,,,,,,"[{'screen_name': 'kyblueblood', 'name': 'Robin Osborne 🌻 Activist ~ #Dem~ #CriptheVote ♿', 'id': '27707682'}]",,,,
1444669234345172996,1444644419102248962,2021-10-03 09:22:40 CDT,2021-10-03,09:22:40,-0500,860234566132408320,estherannepaul1,AZcatladysupportsBiden,,"@kyblueblood This was brutal and frightening. If this happened now, at least I feel we could have got them fired or suspended. My dad explained to me what was going. I was young and naive enough to assume people were better than this. It affected how I feel about law enforcement to this day.",en,[],[],[],1,0,1,[],[],https://twitter.com/EstherAnnePaul1/status/1444669234345172996,False,,0,,phoenix,,,,,,"[{'screen_name': 'kyblueblood', 'name': 'Robin Osborne 🌻 Activist ~ #Dem~ #CriptheVote ♿', 'id': '27707682'}]",,,,
1444562119496667137,1444562119496667137,2021-10-03 02:17:02 CDT,2021-10-03,02:17:02,-0500,1161277381274824704,caminosamantha,samantha camino,,"Counter attack goal with possession obtained by Kenzie Jost, who plays a through ball to Samantha Camino who touches it to Nathalie Lewis and she slots it across goal for Jost to finish  https://t.co/EJXqjpQJEe",en,[],[],[],0,0,2,[],[],https://twitter.com/CaminoSamantha/status/1444562119496667137,False,,1,https://pbs.twimg.com/ext_tw_video_thumb/1444562005122170881/pu/img/1AoYMBa5JNQnNcCB.jpg,phoenix,,,,,,[],,,,
1444540627761336323,1444540627761336323,2021-10-03 00:51:38 CDT,2021-10-03,00:51:38,-0500,4600559292,oohjazz_,Jasmine♒️,,Why my bf just make me play Russian roulette with a nerf gun and the rush I had was insane 😂😂,en,[],[],[],0,0,11,[],[],https://twitter.com/oohjazz_/status/1444540627761336323,False,,0,,phoenix,,,,,,[],,,,
1444518145876643840,1444518145876643840,2021-10-02 23:22:18 CDT,2021-10-02,23:22:18,-0500,891441065412055040,iheartsfg_,iheartsfg,,This is so brutal dude.,en,[],[],[],1,0,5,[],[],https://twitter.com/iheartsfg_/status/1444518145876643840,False,https://twitter.com/nyyplswin/status/1444500188043923460,0,,phoenix,,,,,,[],,,,
1444517136160854016,1444515692548530176,2021-10-02 23:18:17 CDT,2021-10-02,23:18:17,-0500,18436057,gallandro1,Yancy Evans,,@SunDevilMatt42 Yup all this talent continually shooting themselves in the foot.,en,[],[],[],1,0,1,[],[],https://twitter.com/gallandro1/status/1444517136160854016,False,,0,,phoenix,,,,,,"[{'screen_name': 'SunDevilMatt42', 'name': 'matt', 'id': '416837178'}]",,,,
