id,conversation_id,created_at,date,time,timezone,user_id,username,name,place,tweet,language,mentions,urls,photos,replies_count,retweets_count,likes_count,hashtags,cashtags,link,retweet,quote_url,video,thumbnail,near,geo,source,user_rt_id,user_rt,retweet_id,reply_to,retweet_date,translate,trans_src,trans_dest
1355967676879757313,1350671786287927296,2021-01-31 13:54:21 CST,2021-01-31,13:54:21,-0500,797103314718621696,janis_wilds,Janis Wilds,,"@DanaStargazer @myersb68 @ched_TL @Lesdoggg If you vote for a white supremacist then you are either one yourself or you are ok with ppl who are. My fellow white ppl need to take a stand against the wht supremacy fascism being peddled by MTG &amp; the Republicans. It’s not hard, chose equality or choose racism, no middle ground",en,[],[],[],0,0,0,[],[],https://twitter.com/janis_wilds/status/1355967676879757313,False,,0,,san diego,,,,,,"[{'screen_name': 'DanaStargazer', 'name': 'Dana & Piper', 'id': '600528537'}, {'screen_name': 'myersb68', 'name': 'Brian Myers', 'id': '28862248'}, {'screen_name': 'ched_TL', 'name': 'Chris', 'id': '3391350635'}, {'screen_name': 'Lesdoggg', 'name': 'Leslie Jones 🦋', 'id': '47216804'}]",,,,
1355953040977629185,1355938738409402374,2021-01-31 12:56:12 CST,2021-01-31,12:56:12,-0500,797103314718621696,janis_wilds,Janis Wilds,,"@AshaRangappa_ @Delta @BankofAmerica What @AsaHutchinson said is excusing anti-semitism, racism, incitement of violence, threats to Congress members and their staffs, harassment of citizens. MTG is the Republican Party of white supremacy fascism and there is no excusing it. You are either all in or you are against.",en,"[{'screen_name': 'asahutchinson', 'name': 'gov. asa hutchinson', 'id': '269992801'}]",[],[],0,1,2,[],[],https://twitter.com/janis_wilds/status/1355953040977629185,False,,0,,san diego,,,,,,"[{'screen_name': 'AshaRangappa_', 'name': 'Asha Rangappa', 'id': '510464011'}, {'screen_name': 'Delta', 'name': 'Delta', 'id': '5920532'}, {'screen_name': 'BankofAmerica', 'name': 'Bank of America', 'id': '204881628'}]",,,,
1355950432204406784,1355950432204406784,2021-01-31 12:45:50 CST,2021-01-31,12:45:50,-0500,1191106290098946049,fo__________fo,Fo Fo,,Complete insanity that wasn’t a shooting foul Jesus,en,[],[],[],0,0,0,[],[],https://twitter.com/Fo__________Fo/status/1355950432204406784,False,,0,,san diego,,,,,,[],,,,
1355948620533571584,1355927685432799239,2021-01-31 12:38:38 CST,2021-01-31,12:38:38,-0500,797103314718621696,janis_wilds,Janis Wilds,,"@CREWcrew @gonzosmom @AsaHutchinson your statement is anti-Semitic, MTG is an armed violent dangerous racist who has threatened the lives of colleagues. She creates a hostile work environment for Capital staff and Congress members. This would not stand in the private sector, she needs to go NOW!",en,[],[],[],0,2,8,[],[],https://twitter.com/janis_wilds/status/1355948620533571584,False,,0,,san diego,,,,,,"[{'screen_name': 'CREWcrew', 'name': 'Citizens for Ethics', 'id': '22187085'}, {'screen_name': 'gonzosmom', 'name': 'Jen B ♈️🌹☮️', 'id': '2881946306'}]",,,,
1355947249436557314,1355947249436557314,2021-01-31 12:33:11 CST,2021-01-31,12:33:11,-0500,985932653168742401,earth616survivr,Earth616Survivor,,Remember when Machine Gun Kelly tried to diss Eminem...  I know Machine Gun Kelly tries not to.     https://t.co/xZHwKNNgPA,en,[],['https://open.spotify.com/track/1jo3TwNGCXfNdB5uba3ZVv?si=lLLxY2_KSCqxVf0igNtOrw'],[],0,0,0,[],[],https://twitter.com/earth616survivr/status/1355947249436557314,False,,0,,san diego,,,,,,[],,,,
1355940399076892675,1355934486886756357,2021-01-31 12:05:57 CST,2021-01-31,12:05:57,-0500,812131645704663040,fanewazny,Fane Wazny,,"@NoahScape4 @JackPosobiec @jaketapper Weaver left the Lincoln Project in summer. Meanwhile, you support a man who bragged about walking in on underaged girls while they were naked, who bragged about grabbing women by the pussy and who brought young women down to Mar-a-Lago for the proven pedophile Epstein. Thoughts?",en,[],[],[],2,0,18,[],[],https://twitter.com/fanewazny/status/1355940399076892675,False,,0,,san diego,,,,,,"[{'screen_name': 'NoahScape4', 'name': 'Noah_Scape', 'id': '1355912154122219522'}, {'screen_name': 'JackPosobiec', 'name': 'Jack Posobiec 🇺🇸', 'id': '592730371'}, {'screen_name': 'jaketapper', 'name': 'Jake Tapper', 'id': '14529929'}]",,,,
1355936900104605697,1355912312998264834,2021-01-31 11:52:03 CST,2021-01-31,11:52:03,-0500,15147651,butlerb,Greg Butler,,@DonaldJTrumpJr @TheRickWilson @SteveSchmidtSES @reedgalen @gtconway3d @madrid_mike @stuartpstevens Calling someone a pedophile seems to be the go to word for those that have no defense for what or who they support is no working.,en,[],[],[],0,0,0,[],[],https://twitter.com/butlerb/status/1355936900104605697,False,,0,,san diego,,,,,,"[{'screen_name': 'DonaldJTrumpJr', 'name': 'Donald Trump Jr.', 'id': '39344374'}, {'screen_name': 'TheRickWilson', 'name': 'Rick Wilson', 'id': '19084896'}, {'screen_name': 'SteveSchmidtSES', 'name': 'Steve Schmidt', 'id': '786309892990574592'}, {'screen_name': 'reedgalen', 'name': 'Reed Galen', 'id': '1120698997327294464'}, {'screen_name': 'gtconway3d', 'name': 'George Conway🌻', 'id': '471677441'}, {'screen_name': 'madrid_mike', 'name': 'Mike Madrid', 'id': '450341380'}, {'screen_name': 'stuartpstevens', 'name': 'stuart stevens', 'id': '1543986138'}]",,,,
1355933258341515266,1355931614526676995,2021-01-31 11:37:35 CST,2021-01-31,11:37:35,-0500,48635751,vani_valentine,Donut Level Black Mage,,"@TheChrisPranger Nice! Work was too crazy so I only got to play the last 2 hrs of the event. No shiny but it’s okay, it was still fun. 3 star max attack/def is great! XL candy that B!:)",en,[],[],[],0,0,1,[],[],https://twitter.com/vani_valentine/status/1355933258341515266,False,,0,,san diego,,,,,,"[{'screen_name': 'TheChrisPranger', 'name': 'Chris Pranger', 'id': '114060882'}]",,,,
1355915659117428736,1355915659117428736,2021-01-31 10:27:39 CST,2021-01-31,10:27:39,-0500,1650944808,rileyperk,Riley Perkins,,"So to clarify, where do to stand on the terrorist attack launched against the Capitol...? You were so respected Rubio, now you’re just a nutcase...",en,[],[],[],0,0,0,[],[],https://twitter.com/rileyperk/status/1355915659117428736,False,https://twitter.com/marcorubio/status/1355500753469759495,0,,san diego,,,,,,[],,,,
1355914528781783044,1355914528781783044,2021-01-31 10:23:09 CST,2021-01-31,10:23:09,-0500,1020375547505926144,phlesio,Phlesio,,#BidenLied when he said the frenzy wasn’t a good gun in valorant  https://t.co/w8962nwoIa,en,[],[],[],0,0,0,['bidenlied'],[],https://twitter.com/phlesio/status/1355914528781783044,False,,1,https://pbs.twimg.com/ext_tw_video_thumb/1355914487530876928/pu/img/ApqQk2ZTSMD2fmiP.jpg,san diego,,,,,,[],,,,
1355913293706084355,1355913293706084355,2021-01-31 10:18:15 CST,2021-01-31,10:18:15,-0500,1003364527,as_kapoor,Avinder Singh Kapoor,,""" The farmer protest is not politically motivated "" is the biggest lie.  It is politically motivated at local level, state level, national level &amp; international level. Every one is eyeing gains that they can make by using farmers name.",en,[],[],[],0,0,1,[],[],https://twitter.com/as_kapoor/status/1355913293706084355,False,https://twitter.com/TimesNow/status/1355907772689252356,0,,san diego,,,,,,[],,,,
1355902411479502852,1355894131386679298,2021-01-31 09:35:01 CST,2021-01-31,09:35:01,-0500,19552423,aciulla,Anthony Ciulla,,@ChrisRexTO @PhonesAkimbo @MSNBC Threatening someone with murder is a crime you fool.,en,[],[],[],1,0,12,[],[],https://twitter.com/aciulla/status/1355902411479502852,False,,0,,san diego,,,,,,"[{'screen_name': 'ChrisRexTO', 'name': 'Chris Rex 🏴', 'id': '1277687459544027137'}, {'screen_name': 'PhonesAkimbo', 'name': 'JoJo', 'id': '191682995'}, {'screen_name': 'MSNBC', 'name': 'MSNBC', 'id': '2836421'}]",,,,
1355871834487488513,1355871834487488513,2021-01-31 07:33:30 CST,2021-01-31,07:33:30,-0500,868282544973692930,robertzawodski,Eggs&HoneyGuy@FaustoPaolo$ozzini,,"ThanX for plagiarizing someone else's tweet...however, your Presidente @46 prevails completely handy with abuse of #BULL_PEN #HarshWritingAdvice",en,"[{'screen_name': '46', 'name': '4 6', 'id': '5779482'}]",[],[],0,0,0,"['bull_pen', 'harshwritingadvice']",[],https://twitter.com/RobertZawodski/status/1355871834487488513,False,https://twitter.com/StephenKing/status/1355701103606833154,0,,san diego,,,,,,[],,,,
1355871364364660743,1355871364364660743,2021-01-31 07:31:38 CST,2021-01-31,07:31:38,-0500,159537262,whereismybeer3,Melinda Hooker,,Because their client is a raving lunatic who gets startegic advice from an ex crackhead pillow guy and a psychotic gun toting nut job QAnon lady.,en,[],[],[],0,0,0,[],[],https://twitter.com/whereismybeer3/status/1355871364364660743,False,https://twitter.com/crampell/status/1355692042861604864,0,,san diego,,,,,,[],,,,
1355866456504721410,1352022875402760198,2021-01-31 07:12:08 CST,2021-01-31,07:12:08,-0500,1330726156027318273,richardfiorent8,Richard Fiorentino,,@Veteran4Trump @Adak1978 I always wanted to know who created the word “terror”  “Terrorists”  I am 60 and for the second time in my life ... I feel a threat here in San Diego LESS now after the government is shutting down the people the individuals who attacked our Capital... what country were they from,en,[],[],[],0,0,0,[],[],https://twitter.com/RichardFiorent8/status/1355866456504721410,False,,0,,san diego,,,,,,"[{'screen_name': 'Veteran4Trump', 'name': 'Veteran For Trump', 'id': '3293118434'}, {'screen_name': 'Adak1978', 'name': 'Adak1978', 'id': '1023390116'}]",,,,
1355860227569029121,1355860227569029121,2021-01-31 06:47:23 CST,2021-01-31,06:47:23,-0500,159537262,whereismybeer3,Melinda Hooker,,"She forgot @ProjectLincoln are reptilians in skin suits and are all really over 7ft tall. She doesn't read, she is a wackadoodle, even worse a wackadoodle with access to an armory, and chases every passing car looking for blood thirsty pedophile liberals. Another waste of space.",en,"[{'screen_name': 'projectlincoln', 'name': 'the lincoln project', 'id': '1205226529455632385'}]",[],[],0,0,0,[],[],https://twitter.com/whereismybeer3/status/1355860227569029121,False,https://twitter.com/TheRickWilson/status/1355729362939650051,0,,san diego,,,,,,[],,,,
1355849133475520513,1355849133475520513,2021-01-31 06:03:18 CST,2021-01-31,06:03:18,-0500,409364604,commachaser,Kevin Ruby,,Wifey and I watched Enola Hughes last night. We thought it was cute. I think this is also the first program of any kind in about six months I watched kn Netflix that didn’t involve a murder investigation or a monster.,en,[],[],[],1,0,0,[],[],https://twitter.com/CommaChaser/status/1355849133475520513,False,,0,,san diego,,,,,,[],,,,
1355821160127053824,1355664540843835402,2021-01-31 04:12:09 CST,2021-01-31,04:12:09,-0500,17057934,bballer,bballer,,"@ChrisMegerian Arrest, remove, and keep the vaccinations going!!!",en,[],[],[],0,0,0,[],[],https://twitter.com/bballer/status/1355821160127053824,False,,0,,san diego,,,,,,"[{'screen_name': 'ChrisMegerian', 'name': 'Chris Megerian', 'id': '31532083'}]",,,,
1355796972246945800,1355793511828779011,2021-01-31 02:36:02 CST,2021-01-31,02:36:02,-0500,989923321,_nickmartinez,₦Î₵₭,,@SadboiRoland13 @kyantewilson Because it's an attack on his integrity as an artist. People take that very personally,en,[],[],[],0,0,1,[],[],https://twitter.com/_NickMartinez/status/1355796972246945800,False,,0,,san diego,,,,,,"[{'screen_name': 'kyantewilson', 'name': 'Kyante🦍 🔜 EDCLV ⚡️', 'id': '1300058696'}]",,,,
1355771832746426373,1355771832746426373,2021-01-31 00:56:08 CST,2021-01-31,00:56:08,-0500,967521402,mattstephen16,JUDGE BOOTY,,If Joe Biden wasn’t racist he would’ve free’d Bobby Shmurda a long ass time ago. I’d take that over Kodak’s retarded ass,en,[],[],[],0,0,3,[],[],https://twitter.com/Mattstephen16/status/1355771832746426373,False,,0,,san diego,,,,,,[],,,,
1355756623956897801,1355649318187765764,2021-01-30 23:55:42 CST,2021-01-30,23:55:42,-0500,15557891,aquart,aquart,,@chadloder Arrest every one of those murderers.,en,[],[],[],0,0,0,[],[],https://twitter.com/aquart/status/1355756623956897801,False,,0,,san diego,,,,,,"[{'screen_name': 'chadloder', 'name': 'Chad Loder', 'id': '98575337'}]",,,,
1355736866536874000,1355736866536874000,2021-01-30 22:37:12 CST,2021-01-30,22:37:12,-0500,1190558838,xo_a22,P,,my sibling is going to give his birth giver a heart attack one of these days 🤦🏻‍♀️,en,[],[],[],0,0,4,[],[],https://twitter.com/xo_a22/status/1355736866536874000,False,,0,,san diego,,,,,,[],,,,
1355729751831265281,1355533311070920709,2021-01-30 22:08:55 CST,2021-01-30,22:08:55,-0500,15147651,butlerb,Greg Butler,,"@newtgingrich That still wouldn’t match the times Trump incited violence against opponents the press and the whole January 6th insurrection,sorry both sides on this one is a non starter.",en,[],[],[],0,0,0,[],[],https://twitter.com/butlerb/status/1355729751831265281,False,,0,,san diego,,,,,,"[{'screen_name': 'newtgingrich', 'name': 'Newt Gingrich', 'id': '20713061'}]",,,,
1355724943535693824,1355675664230219777,2021-01-30 21:49:49 CST,2021-01-30,21:49:49,-0500,534963838,rjellyman,Jellyman,,"Still have .394 left. Moving on to John Wick 3. The most front to back violent, martial arts, kick ass, totally hard to follow. Movie. Diggin’ on Halle Barrie. #LetsRock  https://t.co/l2B5FWixK2",en,[],[],['https://pbs.twimg.com/tweet_video_thumb/EtCApW3VcAQ9ZDO.jpg'],1,0,4,['letsrock'],[],https://twitter.com/RJellyman/status/1355724943535693824,False,,1,https://pbs.twimg.com/tweet_video_thumb/EtCApW3VcAQ9ZDO.jpg,san diego,,,,,,[],,,,
1355704005192679424,1355704005192679424,2021-01-30 20:26:37 CST,2021-01-30,20:26:37,-0500,4320426800,kevintweets__,Kevin,,Assault.,pt,[],[],[],0,0,0,[],[],https://twitter.com/KevinTweets__/status/1355704005192679424,False,https://twitter.com/NHLGIFs/status/1355702922387083265,0,,san diego,,,,,,[],,,,
1355702643012694025,1355702643012694025,2021-01-30 20:21:12 CST,2021-01-30,20:21:12,-0500,42429403,1rayj,Ray Johnson,,True; She is also a clear and present danger to members of Congress aswell..,en,[],[],[],0,0,0,[],[],https://twitter.com/1RayJ/status/1355702643012694025,False,https://twitter.com/AmyAThatcher/status/1355597897371447300,0,,san diego,,,,,,[],,,,
1355700008620679174,1355700008620679174,2021-01-30 20:10:44 CST,2021-01-30,20:10:44,-0500,2394273222,blrrrrdddd,some random nigga,,Nex gen 2k so bad somebody buy my ps5 only brings me anger snd stress,en,[],[],[],0,0,0,[],[],https://twitter.com/Blrrrrdddd/status/1355700008620679174,False,,0,,san diego,,,,,,[],,,,
1355698786140479492,1355698786140479492,2021-01-30 20:05:52 CST,2021-01-30,20:05:52,-0500,862565306,anabolic_sean,Anabolic Sean,,💎 Stoner LMG gameplay with 26X BRUTAL killstreak 🔥 + 27.0 K/D MVP🏅in TDM My recent 10 games averaged = 6.4 K/D ratio! 💪😎   https://t.co/yafctrW5TV  #cod #CallofDuty #BlackOpsColdWar #CODTOPPLAYS #XboxShare #Xbox,en,[],['https://youtu.be/UWQ67wQiwUc'],[],1,0,4,"['cod', 'callofduty', 'blackopscoldwar', 'codtopplays', 'xboxshare', 'xbox']",[],https://twitter.com/Anabolic_Sean/status/1355698786140479492,False,,0,,san diego,,,,,,[],,,,
1355683437043040261,1355683437043040261,2021-01-30 19:04:53 CST,2021-01-30,19:04:53,-0500,1955187745,franklinsrule,Elisabeth 🇺🇸🇺🇦,,Arrest them now.,en,[],[],[],1,0,1,[],[],https://twitter.com/FranklinsRule/status/1355683437043040261,False,https://twitter.com/Mikel_Jollett/status/1355642351297785856,0,,san diego,,,,,,[],,,,
1355678552826339331,1355678552826339331,2021-01-30 18:45:28 CST,2021-01-30,18:45:28,-0500,36106134,mckelmer,MacKenzie Elmer,,There’s a car-based protest blocking 30th Street demanding rent be cancelled. #SanDiego,en,[],[],[],1,0,1,['sandiego'],[],https://twitter.com/mckelmer/status/1355678552826339331,False,,0,,san diego,,,,,,[],,,,
1355677443672035331,1355677443672035331,2021-01-30 18:41:04 CST,2021-01-30,18:41:04,-0500,42429403,1rayj,Ray Johnson,,I like shows like this and cold case files. Noone should ever getaway with murder. You take someone's life. You should be caught and punished; no matter how long it takes. I get some satisfaction from seeing these people get caught and punished.🗽  https://t.co/uy7W4O1vzV,en,[],[],['https://pbs.twimg.com/media/EtBVcnSVoAIenl-.jpg'],0,0,1,[],[],https://twitter.com/1RayJ/status/1355677443672035331,False,,1,https://pbs.twimg.com/media/EtBVcnSVoAIenl-.jpg,san diego,,,,,,[],,,,
