id,conversation_id,created_at,date,time,timezone,user_id,username,name,place,tweet,language,mentions,urls,photos,replies_count,retweets_count,likes_count,hashtags,cashtags,link,retweet,quote_url,video,thumbnail,near,geo,source,user_rt_id,user_rt,retweet_id,reply_to,retweet_date,translate,trans_src,trans_dest
1463615302923472900,1463545523063906306,2021-11-24 15:07:35 CST,2021-11-24,15:07:35,-0500,1239685345685295104,kcochranlongojd,Kimberly Cochran,,@laurenboebert Yeah.  Just like it Lauren.  The better analogy perhaps is a private citizen uninvited  bringing a  gun from out of state - to a violent protest killing people then claiming HE was threatened?  Like that Lauen?,en,[],[],[],0,0,0,[],[],https://twitter.com/KCochranLongojd/status/1463615302923472900,False,,0,,san diego,,,,,,"[{'screen_name': 'laurenboebert', 'name': 'Lauren Boebert', 'id': '1201670995435646976'}]",,,,
1463613818953629703,1463613818953629703,2021-11-24 15:01:41 CST,2021-11-24,15:01:41,-0500,1693265342,tshombe77,Bishop Cornelius Bowser Sr.,,Accountability is not true justice. We must continue to fight for true justice for Black men in whom white supremacy sees as a threat.,en,[],[],[],0,0,0,[],[],https://twitter.com/Tshombe77/status/1463613818953629703,False,https://twitter.com/ABC/status/1463592811513659396,0,,san diego,,,,,,[],,,,
1463604942208307202,1463465756306264069,2021-11-24 14:26:25 CST,2021-11-24,14:26:25,-0500,3268740704,juncocanche,Junco Canché,,"@voidmstr @TheSigmaMaster Not everyone will agree with the original tweet, and that's fine. But being decisive, a leader, and self assured are goals I set for myself, and pursuing them has been beneficial. It's not about misogyny. That is why I shared it.",en,[],[],[],1,0,0,[],[],https://twitter.com/juncocanche/status/1463604942208307202,False,,0,,san diego,,,,,,"[{'screen_name': 'voidmstr', 'name': 'Dennis Wilen דניאל', 'id': '42334536'}, {'screen_name': 'TheSigmaMaster', 'name': 'Sigma Master⚡️', 'id': '1449094287694589952'}]",,,,
1463604360689033223,1463604360689033223,2021-11-24 14:24:06 CST,2021-11-24,14:24:06,-0500,849062510242144256,ginnymorse3,Ginny Morse,,"@BetoORourke I am so glad you are running against the sociopath Abbott.  Gun control:  consider allowing for a statewide vote on gun control issues.  Let the people decide on ban of assault weapons, open carry, registration &amp; back ground checks.  Win! Win! Win!",en,[],[],[],0,0,1,[],[],https://twitter.com/GinnyMorse3/status/1463604360689033223,False,,0,,san diego,,,,,,[],,,,
1463597827003543556,1463597827003543556,2021-11-24 13:58:08 CST,2021-11-24,13:58:08,-0500,419063106,obey_little,Sebastian Gorka Izagirre🏴☭🚩,,When someone sends you this pic to prove that they aren't racist...  https://t.co/dtcKl4uEpp,en,[],[],['https://pbs.twimg.com/media/FE--d3qVIAU_yz-.jpg'],1,0,3,[],[],https://twitter.com/obey_little/status/1463597827003543556,False,,1,https://pbs.twimg.com/media/FE--d3qVIAU_yz-.jpg,san diego,,,,,,[],,,,
1463588452612534272,1463574116804415497,2021-11-24 13:20:53 CST,2021-11-24,13:20:53,-0500,4846773898,scottculkin,ScottCulkin 🇺🇸/🏴󠁧󠁢󠁳󠁣󠁴󠁿/🚒🚑(ret.)/🚴/🥁/⚽,,@barkflight I chose violence. I went to Costco 😐,en,[],[],[],2,1,17,[],[],https://twitter.com/scottculkin/status/1463588452612534272,False,,0,,san diego,,,,,,"[{'screen_name': 'barkflight', 'name': 'Cascadia Fire Has No Season', 'id': '314024592'}]",,,,
1463583828019073027,1463583828019073027,2021-11-24 13:02:31 CST,2021-11-24,13:02:31,-0500,79210192,bobbydupree,Bobby Dupree,,"#BREAKING: Gregory McMichael, his son Travis McMichael &amp; their neighbor, William Bryan, found guilty of murder in the 2020 shooting death of Ahmaud Arbery  https://t.co/GQQsImiS7O",en,[],['https://fox5sandiego.com/news/national-news/ahmaud-arbery-case-jury-deliberations-continue-a-2nd-day'],[],0,2,5,['breaking'],[],https://twitter.com/bobbydupree/status/1463583828019073027,False,,0,,san diego,,,,,,[],,,,
1463583752961937409,1463583752961937409,2021-11-24 13:02:13 CST,2021-11-24,13:02:13,-0500,1285605042704113664,sansingles,SDDRFS,,"I’ve never seen a game with so many mods released to well, just fix the game. Rather than mod funny car mods and weapon mods people are making the game -work lol @RockstarGames",en,"[{'screen_name': 'rockstargames', 'name': 'rockstar games', 'id': '29758446'}]",[],[],0,0,0,[],[],https://twitter.com/SanSingles/status/1463583752961937409,False,,0,,san diego,,,,,,[],,,,
1463581039209574402,1463552596841537536,2021-11-24 12:51:26 CST,2021-11-24,12:51:26,-0500,19627046,jjschaible,Jake Schaible,,"@PostOpinions @brianklaas Why are we presuming the radical Left really wants to prevent the Right from ""lurching towards violent authoritian lunacy""?    Extreme Right &amp; Left are but sides of the same authoritian coin.   The path to peace starts by choosing more Liberty.",en,[],[],[],0,0,2,[],[],https://twitter.com/JJSchaible/status/1463581039209574402,False,,0,,san diego,,,,,,"[{'screen_name': 'PostOpinions', 'name': 'Washington Post Opinions', 'id': '14345812'}, {'screen_name': 'brianklaas', 'name': 'Brian Klaas', 'id': '39279821'}]",,,,
1463578607389851648,1463578607389851648,2021-11-24 12:41:46 CST,2021-11-24,12:41:46,-0500,1684114082,fulltimehoops1,Aaron Burgin,,"Jury shooting a high percentage this morning, I see",en,[],[],[],1,0,11,[],[],https://twitter.com/FullTimeHoops1/status/1463578607389851648,False,,0,,san diego,,,,,,[],,,,
1463547739296317441,1463546414504595464,2021-11-24 10:39:07 CST,2021-11-24,10:39:07,-0500,1349454619,ehukai411,Larry Shea,,@MrAndyNgo You’re assuming racist ideology motivated the attack when it could be as simple as anarchy as the ideology and racism as a rationalization.   Lack of purpose in all the mayhem seems chaotic unless chaos is the purpose.,en,[],[],[],2,0,1,[],[],https://twitter.com/Ehukai411/status/1463547739296317441,False,,0,,san diego,,,,,,"[{'screen_name': 'MrAndyNgo', 'name': 'Andy Ngô 🏳️\u200d🌈', 'id': '2835451658'}]",,,,
1463547591019225090,1463542493648064519,2021-11-24 10:38:31 CST,2021-11-24,10:38:31,-0500,2859443952,omariwarren,Omari Warren,,@theautumnwind80 Those work well too. Just try to tap into calming things that bring you happy and can override the anger until you can diagnose the source of it.,en,[],[],[],0,0,2,[],[],https://twitter.com/OmariWarren/status/1463547591019225090,False,,0,,san diego,,,,,,"[{'screen_name': 'theautumnwind80', 'name': 'TheAutumnWind80', 'id': '1417271712815620110'}]",,,,
1463542852860870658,1463542852860870658,2021-11-24 10:19:42 CST,2021-11-24,10:19:42,-0500,4842785802,realcaligrl,realcaligrl,,"young money wanna sign me, my rap jacket too violent 🤭",en,[],[],[],0,0,0,[],[],https://twitter.com/realcaligrl/status/1463542852860870658,False,,0,,san diego,,,,,,[],,,,
1463521632417320967,1463521632417320967,2021-11-24 08:55:22 CST,2021-11-24,08:55:22,-0500,18144612,ronnehring,Ron Nehring,,"California’s Propositions 47+57, “criminal justice reform” that effectively decriminalized crime in CA, are disasters and must be repealed. Our residents and visitors deserve to be safe and feel safe again.",en,[],[],[],1,3,18,[],[],https://twitter.com/RonNehring/status/1463521632417320967,False,,0,,san diego,,,,,,[],,,,
1463517127705448449,1463302104932626437,2021-11-24 08:37:28 CST,2021-11-24,08:37:28,-0500,19627046,jjschaible,Jake Schaible,,"@inlanddefense @jkempcpa It was worse.  In 2016, most GOP candidates actually choose NOT to attack each other (till way too late) fearing it would piss off opponent base. As a result, got painted as ""weak"".",en,[],[],[],0,0,1,[],[],https://twitter.com/JJSchaible/status/1463517127705448449,False,,0,,san diego,,,,,,"[{'screen_name': 'inlanddefense', 'name': 'Robert Little', 'id': '1511657858'}, {'screen_name': 'jkempcpa', 'name': 'Jeff Kemp 🇺🇸🇺🇦', 'id': '248481789'}]",,,,
1463491336045170690,1463491336045170690,2021-11-24 06:54:59 CST,2021-11-24,06:54:59,-0500,1422575611038507009,robymyersnewsie,Roby Myers,,"Dry, Santa Ana Winds will gust 30 to 50 miles per hour with Elevated Fire Danger through Thanksgiving Holiday Weekend! #sdwx @10News @10NewsPaz  https://t.co/w43yD6OT8Y",en,"[{'screen_name': '10news', 'name': 'abc 10news san diego', 'id': '9616062'}, {'screen_name': '10newspaz', 'name': 'vanessa paz', 'id': '596456990'}]",[],"['https://pbs.twimg.com/media/FE9dnCXVQAM0mvj.jpg', 'https://pbs.twimg.com/media/FE9dnRYVkAQqX-c.jpg']",0,0,0,['sdwx'],[],https://twitter.com/RobyMyersNewsie/status/1463491336045170690,False,,1,https://pbs.twimg.com/media/FE9dnCXVQAM0mvj.jpg,san diego,,,,,,[],,,,
1463481754082156545,1463481754082156545,2021-11-24 06:16:55 CST,2021-11-24,06:16:55,-0500,1422575611038507009,robymyersnewsie,Roby Myers,,"#FireWeatherWarning goes into effect through Thanksgiving, beginning 4am tomorrow and lasting through Friday 6pm with Dry Santa Ana Winds gusting 30 to 50 mph and with Elevated Fire Danger! Any small sparks of fire can spread very rapidly! #sdwx @10News @10NewsPaz  https://t.co/duVmatvHEj",en,"[{'screen_name': '10news', 'name': 'abc 10news san diego', 'id': '9616062'}, {'screen_name': '10newspaz', 'name': 'vanessa paz', 'id': '596456990'}]",[],['https://pbs.twimg.com/media/FE9U5eBUcA0ONBD.jpg'],0,0,0,"['fireweatherwarning', 'sdwx']",[],https://twitter.com/RobyMyersNewsie/status/1463481754082156545,False,,1,https://pbs.twimg.com/media/FE9U5eBUcA0ONBD.jpg,san diego,,,,,,[],,,,
1463417448833507328,1463417448833507328,2021-11-24 02:01:23 CST,2021-11-24,02:01:23,-0500,228958639,bigdaddyyyjayyy,JayRod,,The assassin creed games have the best sale I’ve ever seen all 12 games for 120 but it’s originally 520 that’s insane,en,[],[],[],0,0,0,[],[],https://twitter.com/BigDaddyyyJayyy/status/1463417448833507328,False,,0,,san diego,,,,,,[],,,,
1463409162533019651,1463409162533019651,2021-11-24 01:28:27 CST,2021-11-24,01:28:27,-0500,1414328804097495044,abluntterrorist,Blunt View.,,"I feel safe whenever a woman with a chest tattoo is around, because I know she got a gun in her purse.",en,[],[],[],1,3,8,[],[],https://twitter.com/ABluntTerrorist/status/1463409162533019651,False,,0,,san diego,,,,,,[],,,,
1463407722561359875,1463407722561359875,2021-11-24 01:22:44 CST,2021-11-24,01:22:44,-0500,1414328804097495044,abluntterrorist,Blunt View.,,Knowing people who share in that same rage 🤝,en,[],[],[],0,1,1,[],[],https://twitter.com/ABluntTerrorist/status/1463407722561359875,False,https://twitter.com/im_kdthoee/status/1463406729979314177,0,,san diego,,,,,,[],,,,
1463406718956621824,1463406718956621824,2021-11-24 01:18:45 CST,2021-11-24,01:18:45,-0500,1414328804097495044,abluntterrorist,Blunt View.,,"You can’t tweet like a simp too much, you’ll slip up and someone’s airing out your issues with women. Either you abuse them or you really a bum who dick down the lonely and the easily manipulated.",en,[],[],[],0,0,0,[],[],https://twitter.com/ABluntTerrorist/status/1463406718956621824,False,,0,,san diego,,,,,,[],,,,
1463402395606700037,1463402395606700037,2021-11-24 01:01:34 CST,2021-11-24,01:01:34,-0500,175281443,mariussose,SD Master Trainer,"{'type': 'Point', 'coordinates': [32.7155, -117.1585]}","#powerful and true however white Supremacist were also found believing building and killing cops to frame protestors in hopes of winning an election.  Propaganda over lives. @ San Diego, California  https://t.co/ITyx6FaqIZ",en,[],['https://www.instagram.com/p/CWpkOMnrrAK/?utm_medium=twitter'],[],0,0,0,['powerful'],[],https://twitter.com/MariusSose/status/1463402395606700037,False,,0,,san diego,,,,,,[],,,,
1463398395393966083,1463395741196382210,2021-11-24 00:45:40 CST,2021-11-24,00:45:40,-0500,51715555,analogfilmphoto,Carlos LM,,"2021 was the busiest and most stressful wedding season I’ve had in my 10 years doing this. I shot my last wedding of the year last Saturday, now I’m off on vacation mode shooting film 🎞😀",en,[],[],[],1,0,8,[],[],https://twitter.com/analogfilmphoto/status/1463398395393966083,False,,0,,san diego,,,,,,[],,,,
1463395741196382210,1463395741196382210,2021-11-24 00:35:07 CST,2021-11-24,00:35:07,-0500,51715555,analogfilmphoto,Carlos LM,,"Shooting a vertical today,  #believeinfilm  https://t.co/1S60B5QXvU",en,[],[],['https://pbs.twimg.com/media/FE8GqufVcAENhFI.jpg'],2,0,28,['believeinfilm'],[],https://twitter.com/analogfilmphoto/status/1463395741196382210,False,,1,https://pbs.twimg.com/media/FE8GqufVcAENhFI.jpg,san diego,,,,,,[],,,,
1463393494009987074,1463322766388563972,2021-11-24 00:26:12 CST,2021-11-24,00:26:12,-0500,51715555,analogfilmphoto,Carlos LM,,@greytoneduo That’s a good idea. I think the note that I put on the cap will work as I always see the lens before shooting. I’ll shoot again those remaining two frames :),en,[],[],[],0,0,2,[],[],https://twitter.com/analogfilmphoto/status/1463393494009987074,False,,0,,san diego,,,,,,"[{'screen_name': 'greytoneduo', 'name': 'greytoneduo', 'id': '4694524159'}]",,,,
1463381169118928904,1462166687470342146,2021-11-23 23:37:13 CST,2021-11-23,23:37:13,-0500,71346327,garyrikard,Gary Rikard,,"#WhereIsShuaiPeng it has been 21 days since anyone has seen or heard from Shuai Peng, a world tennis champion, inspiration to young girls all over the world, and rape survivor. I do not accept Olympic Committee and PLA. An adult, Shuai can speak for herself as a free woman.",en,[],[],[],1,0,1,['whereisshuaipeng'],[],https://twitter.com/garyrikard/status/1463381169118928904,False,,0,,san diego,,,,,,[],,,,
1463379503623786500,1463377386687238150,2021-11-23 23:30:36 CST,2021-11-23,23:30:36,-0500,2922207056,sddonavan,SDDONAVAN,,@PadresNoHitter Ahhh good ole murder porn!! Nothing beats a good doc. Better have actual crime scene photos!,en,[],[],[],0,0,1,[],[],https://twitter.com/SDDonavan/status/1463379503623786500,False,,0,,san diego,,,,,,"[{'screen_name': 'PadresNoHitter', 'name': 'Padres No Hitter 🇺🇦', 'id': '3161544535'}]",,,,
1463371503634763776,1463371503634763776,2021-11-23 22:58:49 CST,2021-11-23,22:58:49,-0500,41389715,rebeccaromani,RebeccaMRomani,,I love it! Crime by the dish!  So...who's writing the script....?,en,[],[],[],0,0,3,[],[],https://twitter.com/rebeccaromani/status/1463371503634763776,False,https://twitter.com/LATACO/status/1463254410142760961,0,,san diego,,,,,,[],,,,
1463370693710548992,1463370693710548992,2021-11-23 22:55:36 CST,2021-11-23,22:55:36,-0500,455562384,angelbvby_,Angel Madriaga,,Idc how you do me ima keep being nice because I’m not the one who has to deal with the consequences at the end of the day. Don’t let anger change/consume you 💙,en,[],[],[],0,0,0,[],[],https://twitter.com/Angelbvby_/status/1463370693710548992,False,,0,,san diego,,,,,,[],,,,
1463367662084395015,1463367662084395015,2021-11-23 22:43:33 CST,2021-11-23,22:43:33,-0500,481008500,budmanthegreat,The Stoned Buddha,,Friendly reminder.  @TuckerCarlson is a white supremacist,en,"[{'screen_name': 'tuckercarlson', 'name': 'tucker carlson', 'id': '22703645'}]",[],[],0,0,0,[],[],https://twitter.com/Budmanthegreat/status/1463367662084395015,False,,0,,san diego,,,,,,[],,,,
1463339931896410114,1463339931896410114,2021-11-23 20:53:21 CST,2021-11-23,20:53:21,-0500,1693265342,tshombe77,Bishop Cornelius Bowser Sr.,,"Join us for a Day of Divine Protection.   After Thanksgiving, violence &amp; crimes increases, and 2021 has been a violent year. God only knows what is ahead of us. You need God’s protection.  We will have free food and live entertainment. See flyer for details. #protection  https://t.co/tyetGuPTMu",en,[],[],[],0,0,1,['protection'],[],https://twitter.com/Tshombe77/status/1463339931896410114,False,,1,https://pbs.twimg.com/ext_tw_video_thumb/1463339906214752260/pu/img/R8wo0ZFkAOOgCset.jpg,san diego,,,,,,[],,,,
1463334514218790914,1463334514218790914,2021-11-23 20:31:50 CST,2021-11-23,20:31:50,-0500,868282544973692930,robertzawodski,Eggs&HoneyGuy@FaustoPaolo$ozzini,,"Do you recall when @46 was a white supremacist senator from Wilmington, Delaware...@36 years¡? #RemembranceTuesday",en,"[{'screen_name': '46', 'name': '4 6', 'id': '5779482'}, {'screen_name': '36', 'name': 'ну вот мне и стукнул', 'id': '7754042'}]",[],[],0,1,1,['remembrancetuesday'],[],https://twitter.com/RobertZawodski/status/1463334514218790914,False,https://twitter.com/pewpewonepew/status/1463292883696558080,0,,san diego,,,,,,[],,,,
1463329198257283072,1463329198257283072,2021-11-23 20:10:42 CST,2021-11-23,20:10:42,-0500,67952688,firstpossession,Anthony Ware,,THET WORST CRIME YOU CAN COMMMIT AGAINST GOD IS REJECT THOSE WHO HE SENDS ITS LIKE REJECTING HIM. CHRISTIANS GLORIFY THE SIN OF REJECTING CHRIST! SMH,en,[],[],[],0,0,0,[],[],https://twitter.com/firstpossession/status/1463329198257283072,False,https://twitter.com/firstpossession/status/1463328278886825991,0,,san diego,,,,,,[],,,,
1463325217615335424,1463325217615335424,2021-11-23 19:54:53 CST,2021-11-23,19:54:53,-0500,481008500,budmanthegreat,The Stoned Buddha,,"🤔🤔🤔 he's pretty much admitting crime. Cool. FBI should really make an actual case and lock his ass up. They won't, right wing and white is the hands off combo.",en,[],[],[],0,1,1,[],[],https://twitter.com/Budmanthegreat/status/1463325217615335424,False,https://twitter.com/RonFilipkowski/status/1463211379557609473,0,,san diego,,,,,,[],,,,
