id,conversation_id,created_at,date,time,timezone,user_id,username,name,place,tweet,language,mentions,urls,photos,replies_count,retweets_count,likes_count,hashtags,cashtags,link,retweet,quote_url,video,thumbnail,near,geo,source,user_rt_id,user_rt,retweet_id,reply_to,retweet_date,translate,trans_src,trans_dest
1372336778619744258,1372336778619744258,2021-03-17 18:59:19 CDT,2021-03-17,18:59:19,-0500,911943760019316736,iamshanebscott,Shane B Scott,,You know what’s most disheartening about the Atlanta shooting?  It’s not just that it’s racist!  But that is a diabolical mixture of misogyny &amp; sexism.  And just as America dismissed the sexists and misogynistic behavior of #DonaldJTrump they are doing it again for a killer!,en,[],[],[],0,0,0,['donaldjtrump'],[],https://twitter.com/iamshanebscott/status/1372336778619744258,False,,0,,los angeles,,,,,,[],,,,
1372336706519638017,1372336706519638017,2021-03-17 18:59:02 CDT,2021-03-17,18:59:02,-0500,1099058876,kinirotonada,K-San 🌮💙💛 🌻,,Glad they caught this domestic terrorist before he could have done anything.   https://t.co/mlxSLSpi1D,en,[],['https://www.npr.org/978363447'],[],0,1,0,[],[],https://twitter.com/KiniroTonada/status/1372336706519638017,False,,0,,los angeles,,,,,,[],,,,
1372335438422106112,1372335438422106112,2021-03-17 18:53:59 CDT,2021-03-17,18:53:59,-0500,81529453,benzmariie,Mamacita,,Kraft services is going to send me into a sugar attack! Why is everything sooooo sugaryyyy!!,en,[],[],[],0,0,0,[],[],https://twitter.com/BenzMariie/status/1372335438422106112,False,,0,,los angeles,,,,,,[],,,,
1372334426747629570,1372260168449294342,2021-03-17 18:49:58 CDT,2021-03-17,18:49:58,-0500,1255036714541895683,edgarasatryan7,Edgar_ICED_OUT,,"@robsmithonline You sound like a White Supremacist, with that racist strawman.",en,[],[],[],0,0,0,[],[],https://twitter.com/EdgarAsatryan7/status/1372334426747629570,False,,0,,los angeles,,,,,,"[{'screen_name': 'robsmithonline', 'name': 'Rob Smith 🇺🇸', 'id': '110542860'}]",,,,
1372333263063183362,1372333263063183362,2021-03-17 18:45:21 CDT,2021-03-17,18:45:21,-0500,1142126106457198592,wieckingchris,Dr. Nobody Out Pizzas the Hut! \__,,"Kyrie Irving finished the last game. Played great. Has a day off, now he is out ""injured"". Kyrie is a punk ass bitch who thinks he is the next Malcolm X, when in fact he is closer to Malcolm in the Middle. Kyrie is a joke. #NetsWorld",en,[],[],[],0,0,2,['netsworld'],[],https://twitter.com/WieckingChris/status/1372333263063183362,False,,0,,los angeles,,,,,,[],,,,
1372332874653822977,1372332874653822977,2021-03-17 18:43:48 CDT,2021-03-17,18:43:48,-0500,1240426069582180352,jasongancedo,Jason Gancedo,,"More gun control, please.",en,[],[],[],0,0,3,[],[],https://twitter.com/JasonGancedo/status/1372332874653822977,False,,0,,los angeles,,,,,,[],,,,
1372332703618531334,1372231060403204100,2021-03-17 18:43:07 CDT,2021-03-17,18:43:07,-0500,1255036714541895683,edgarasatryan7,Edgar_ICED_OUT,,@williesco760 @SumbryofWales @TheRightMelissa Was it a hate crime?,en,[],[],[],1,0,0,[],[],https://twitter.com/EdgarAsatryan7/status/1372332703618531334,False,,0,,los angeles,,,,,,"[{'screen_name': 'TheRightMelissa', 'name': 'Melissa Tate', 'id': '762389795037294592'}]",,,,
1372332395278438403,1372332395278438403,2021-03-17 18:41:54 CDT,2021-03-17,18:41:54,-0500,19230397,nikkibalzzz,❤️‍🔥 Nikki Balzzz ❤️‍🔥,,"MANY bad days... usually I want my own life to end, not others. Yes we need mental health help in this country. But there is NO excuse to MURDER anyone, unless it is self defense. They would have said that shit if he was any other color but WHITE tho 😏",en,[],[],[],1,0,1,[],[],https://twitter.com/NikkiBalzzz/status/1372332395278438403,False,https://twitter.com/itsJeffTiedrich/status/1372237636979601410,0,,los angeles,,,,,,[],,,,
1372331871338594310,1372331871338594310,2021-03-17 18:39:49 CDT,2021-03-17,18:39:49,-0500,494586723,phivdo,phi,,You have to be fucking kidding me. I’m sick of white privilege and this constant narrative by presented by police/ media that white people are just having a “bad day”. But when POC are having a “bad day” we’re either killed or incarcerated. Don’t downplay this horrific attack,en,[],[],[],0,0,5,[],[],https://twitter.com/phivdo/status/1372331871338594310,False,https://twitter.com/skbaer/status/1372311417089454080,0,,los angeles,,,,,,[],,,,
1372329328185282562,1372329328185282562,2021-03-17 18:29:43 CDT,2021-03-17,18:29:43,-0500,164120417,patrickcduncan,Patrick Coleman Duncan,,#StopTheHate This cop is a racist POS! Fire him! @KeishaBottoms @GeorgeTakei #AsianLivesMatter  https://t.co/VmCfJQnsjS,en,"[{'screen_name': 'keishabottoms', 'name': 'keisha lance bottoms', 'id': '305818748'}, {'screen_name': 'georgetakei', 'name': 'george takei', 'id': '237845487'}]",['https://www.buzzfeednews.com/article/skbaer/spa-shooter-bad-day-racist-facebook'],[],0,0,0,"['stopthehate', 'asianlivesmatter']",[],https://twitter.com/PatrickCDuncan/status/1372329328185282562,False,,0,,los angeles,,,,,,[],,,,
1372329321419837440,1372328897983832064,2021-03-17 18:29:41 CDT,2021-03-17,18:29:41,-0500,28447135,aimierocks,aimie billon,,"My heart is with Rex’s birth mom, whom we love very much, as it is with my many AAPI loved ones, as well as all of the AAPI community hurting right now because of more senseless violence by yet another white male mass shooter.",en,[],[],[],1,0,0,[],[],https://twitter.com/AimieRocks/status/1372329321419837440,False,,0,,los angeles,,,,,,[],,,,
1372328596920967170,1372328596920967170,2021-03-17 18:26:48 CDT,2021-03-17,18:26:48,-0500,114644839,silverlakerr,Silverlaker,,@YouTube - you got some explaining to do.  How are you allowing rape to have a platform?,en,[],[],[],0,0,0,[],[],https://twitter.com/Silverlakerr/status/1372328596920967170,False,https://twitter.com/kattenbarge/status/1371933628767346692,0,,los angeles,,,,,,[],,,,
1372328440926334977,1372328440926334977,2021-03-17 18:26:11 CDT,2021-03-17,18:26:11,-0500,380920185,vol4bourbon,VOL4Bourbon,,"@CityofAtlanta needs to fire that racist asshole, Jay Baker immediately!  No pension!  No severance!  No retirement!  Make a goddamn statement!",en,[],[],[],0,0,0,[],[],https://twitter.com/Vol4Bourbon/status/1372328440926334977,False,,0,,los angeles,,,,,,[],,,,
1372327688522723329,1372327688522723329,2021-03-17 18:23:12 CDT,2021-03-17,18:23:12,-0500,21978899,heatherfink,Heather Fink,,This whole thread from the top details Stephan’s assault &amp; aftermath ❤️💔 #StopAsianHate,en,[],[],[],0,0,2,['stopasianhate'],[],https://twitter.com/heatherfink/status/1372327688522723329,False,https://twitter.com/stephanmlee/status/1372229813839233026,0,,los angeles,,,,,,[],,,,
1372326306709311488,1372248730343211009,2021-03-17 18:17:42 CDT,2021-03-17,18:17:42,-0500,1110198781,tonyamckenziepr,"Tonya McKenzie, Master Storyteller",,"@RepValDemings Something feels off that we even have to CELEBRATE laws about “voting rights” “equal rights” &amp; “violence against women”. You have to wonder, “Who are the people that oppose these laws making them hard to pass?”   What is wrong with your soul? #GOP #heartless #oppositionparty",en,[],[],[],0,0,1,"['gop', 'heartless', 'oppositionparty']",[],https://twitter.com/TonyaMcKenziePR/status/1372326306709311488,False,,0,,los angeles,,,,,,"[{'screen_name': 'RepValDemings', 'name': 'Rep. Val Demings', 'id': '798973032362606600'}]",,,,
1372324612336283651,1372324612336283651,2021-03-17 18:10:58 CDT,2021-03-17,18:10:58,-0500,145160674,mohammadmolaei,Prince of Persia,,USA CRIME DICTIONARY  (A GUIDE FOR HOW TO DESCRIBE CRIMINALS IN AMERICA)  Muslims = Terrorists  Black people = Thugs and animals Mexicans = Rapists and drug dealers White people = HAVING A BAD DAY   #AsianLivesMatter #Atlanta #BLM #atlantaspa,en,[],[],[],0,0,1,"['asianlivesmatter', 'atlanta', 'blm', 'atlantaspa']",[],https://twitter.com/MohammadMolaei/status/1372324612336283651,False,,0,,los angeles,,,,,,[],,,,
1372323628809871362,1372323628809871362,2021-03-17 18:07:04 CDT,2021-03-17,18:07:04,-0500,27551626,trjamsbunk,TR Rodriguez,,The racist rapist is a murderer too,en,[],[],[],0,0,0,[],[],https://twitter.com/trjamsbunk/status/1372323628809871362,False,,0,,los angeles,,,,,,[],,,,
1372323102739243010,1372323102739243010,2021-03-17 18:04:58 CDT,2021-03-17,18:04:58,-0500,1105686830,jackielastra,Jackie Lastra 💙 Ignihyde,,"This is disgusting. Never in my life have I had a bad day and decided to kill people. That’s not a bad day, that’s straight up murder, don’t defend that atrocious act!",en,[],[],[],8,11,102,[],[],https://twitter.com/JackieLastra/status/1372323102739243010,False,https://twitter.com/atrupar/status/1372203730481864713,0,,los angeles,,,,,,[],,,,
1372321906590806020,1372299140181467138,2021-03-17 18:00:13 CDT,2021-03-17,18:00:13,-0500,17554515,ross_meyerson,ross,,@ByYourLogic @kenklippenstein Not few. Most. That typo is brutal,en,[],[],[],0,0,0,[],[],https://twitter.com/ross_meyerson/status/1372321906590806020,False,,0,,los angeles,,,,,,"[{'screen_name': 'ByYourLogic', 'name': '30 year old man saying he is homesick', 'id': '4726207589'}, {'screen_name': 'kenklippenstein', 'name': 'Ken Klippenstein', 'id': '1634248890'}]",,,,
1372321901314408450,1372321901314408450,2021-03-17 18:00:12 CDT,2021-03-17,18:00:12,-0500,124909369,thethirdjesus,Mercury Tardigrades,,I want to be the mypillow guy and flame random nonsense out of my ass until the feds finally tazer me and I die of a massive heart attack.,en,[],[],[],0,0,0,[],[],https://twitter.com/thethirdjesus/status/1372321901314408450,False,,0,,los angeles,,,,,,[],,,,
1372321725149454338,1372321725149454338,2021-03-17 17:59:30 CDT,2021-03-17,17:59:30,-0500,3827830753,iampoliticsgirl,PoliticsGirl,,"All but 29 Republicans voted AGAINST the Violence Against Women Act? Seriously, who does the GOP represent??",en,[],[],[],37,143,438,[],[],https://twitter.com/IAmPoliticsGirl/status/1372321725149454338,False,https://twitter.com/CraigCaplan/status/1372294834929688578,0,,los angeles,,,,,,[],,,,
1372320420972535808,1372320420972535808,2021-03-17 17:54:19 CDT,2021-03-17,17:54:19,-0500,172884865,htluckybs,Lucky Luciano,,It should be a crime to have a mandatory camera on during zoom meetings,en,[],[],[],0,0,2,[],[],https://twitter.com/HTLuckybs/status/1372320420972535808,False,,0,,los angeles,,,,,,[],,,,
1372320349015052288,1372320349015052288,2021-03-17 17:54:02 CDT,2021-03-17,17:54:02,-0500,3189998119,lexxierra,lexi ♡,,"how is it even a QUESTION if this was a racist hate crime?? i don’t fucking care what “issue” he claims to have, he is a racist murderer that deserves to rot in prison for the rest of his life and give the families of the victims some justice.",en,[],[],[],1,0,2,[],[],https://twitter.com/lexxierra/status/1372320349015052288,False,https://twitter.com/ejknoodles/status/1372211150067277826,0,,los angeles,,,,,,[],,,,
1372318872276115458,1372184447077003267,2021-03-17 17:48:10 CDT,2021-03-17,17:48:10,-0500,76259858,mrbradleypierce,Bradley Pierce,,"@IcyyyNate__ @GinaRosar @DFodet @itsJeffTiedrich What it changes is that the charges escalate from murder to hate based terrorism. The fact that his victims were targeted for their appearance or their occupation is relevant, and important to address.",en,[],[],[],0,0,2,[],[],https://twitter.com/MrBradleyPierce/status/1372318872276115458,False,,0,,los angeles,,,,,,"[{'screen_name': 'IcyyyNate__', 'name': 'Nate⚡️', 'id': '1349385733337968642'}, {'screen_name': 'GinaRosar', 'name': 'Gina HasNoFucks she/her 🏳️\u200d🌈🏳️\u200d⚧️ BLM 💉💉💉😷', 'id': '592339804'}, {'screen_name': 'DFodet', 'name': 'David Fodét 🇺🇲✊🇺🇲✊🇺🇲✊', 'id': '1253959021779750912'}, {'screen_name': 'itsJeffTiedrich', 'name': 'Jeff Tiedrich', 'id': '1009577803304656896'}]",,,,
1372316566193201153,1371959303649816580,2021-03-17 17:39:00 CDT,2021-03-17,17:39:00,-0500,3976518680,andy_mccormac,Andy McCormac,,"@CarrieQThinks @AaronBroadley @flyaway_k Maybe because they arrest the perpetrators of the crimes? Many have been arrested and charged in Portland, Seattle etc.",en,[],[],[],0,0,0,[],[],https://twitter.com/andy_mccormac/status/1372316566193201153,False,,0,,los angeles,,,,,,"[{'screen_name': 'CarrieQThinks', 'name': 'Carrie ❤️America 🇺🇸', 'id': '1369035629611352076'}, {'screen_name': 'AaronBroadley', 'name': 'Aaron Broadley', 'id': '303732712'}, {'screen_name': 'flyaway_k', 'name': '🍺 ℍ𝕖𝕣𝕖ℍ𝕠𝕝𝕕𝕄𝕪𝔹𝕖𝕖𝕣 🍺', 'id': '932085767131758592'}]",,,,
1372315971738767361,1372315971738767361,2021-03-17 17:36:38 CDT,2021-03-17,17:36:38,-0500,884601902670921728,lapulse_la,#LAPulse_LA,,It’s time to get these guns off our streets! This Saturday in #SouthLA help spread the word to reach a goal of getting guns off our streets thru the Anonymous #GunBuyBack on #CentralAve. Please #Share &amp; let’s reduce these crime rates.  https://t.co/sTu37mPVS6,en,[],[],['https://pbs.twimg.com/media/EwtyGMXUcAAG9He.jpg'],0,0,0,"['southla', 'gunbuyback', 'centralave', 'share']",[],https://twitter.com/LAPulse_LA/status/1372315971738767361,False,,1,https://pbs.twimg.com/media/EwtyGMXUcAAG9He.jpg,los angeles,,,,,,[],,,,
1372314892586283011,1372314892586283011,2021-03-17 17:32:21 CDT,2021-03-17,17:32:21,-0500,921256591898185728,neurokev,Kevin Tan,,mass shooting Asian women as 'enablers of sexual addiction' seems like a terroristic hate crime to me 🤷🏻‍♂️,en,[],[],[],1,0,15,[],[],https://twitter.com/neurokev/status/1372314892586283011,False,https://twitter.com/atrupar/status/1372197013060775937,0,,los angeles,,,,,,[],,,,
1372314668304199680,1372314668304199680,2021-03-17 17:31:27 CDT,2021-03-17,17:31:27,-0500,205253687,violanerd,Diana Wade,,I am completely outraged by the ongoing violence against AAPI people in this country and so disheartened by the way many journalists have failed this community time and again in their coverage (or lack thereof) of events such as yesterday’s clear targeting of Asian women.,en,[],[],[],1,0,2,[],[],https://twitter.com/violanerd/status/1372314668304199680,False,,0,,los angeles,,,,,,[],,,,
1372314251927322624,1372296943406317571,2021-03-17 17:29:48 CDT,2021-03-17,17:29:48,-0500,42048593,nanatoyou,Joyce Mitchell,,@mkraju Would he prefer “domestic terrorist attack”?,en,[],[],[],0,1,5,[],[],https://twitter.com/nanatoyou/status/1372314251927322624,False,,0,,los angeles,,,,,,"[{'screen_name': 'mkraju', 'name': 'Manu Raju', 'id': '39155029'}]",,,,
1372312982571511808,1372312982571511808,2021-03-17 17:24:46 CDT,2021-03-17,17:24:46,-0500,94653255,chynnatown11,"Fat, Funny and FOINE 😈",,🗣YALL BETTER NOT POST THAT RACIST ASS YELLOW ASS SQUARE IN “SOLIDARITY” FOR ASIANS! #yellowsquares #StopAsianHate  https://t.co/UFXut6xvIN,en,[],[],['https://pbs.twimg.com/tweet_video_thumb/EwtvYcLVcAEYR8i.jpg'],0,0,2,"['yellowsquares', 'stopasianhate']",[],https://twitter.com/ChynnaTown11/status/1372312982571511808,False,,1,https://pbs.twimg.com/tweet_video_thumb/EwtvYcLVcAEYR8i.jpg,los angeles,,,,,,[],,,,
1372312881342017544,1372312881342017544,2021-03-17 17:24:21 CDT,2021-03-17,17:24:21,-0500,204106510,vic_gwooooddd,vic_gwooooddd.eth,,Funfact @HawleyMO  has yet to say anything about the victims of our most recent domestic terrorism attack....now its not his state but he was throwing his fist up before the captial riot.....why sooo quiet Joshyy?????,en,"[{'screen_name': 'hawleymo', 'name': 'josh hawley', 'id': '2352629311'}]",[],[],0,0,3,[],[],https://twitter.com/Vic_Gwooooddd/status/1372312881342017544,False,,0,,los angeles,,,,,,[],,,,
1372312102753366018,1372312102753366018,2021-03-17 17:21:16 CDT,2021-03-17,17:21:16,-0500,94653255,chynnatown11,"Fat, Funny and FOINE 😈",,Bruh...Fashion Nova is a terrorist organization😭 #fashionnova  https://t.co/qQH4BtoCPI,en,[],[],['https://pbs.twimg.com/media/EwtulSmVcAIO0DZ.jpg'],0,0,0,['fashionnova'],[],https://twitter.com/ChynnaTown11/status/1372312102753366018,False,,1,https://pbs.twimg.com/media/EwtulSmVcAIO0DZ.jpg,los angeles,,,,,,[],,,,
1372312002694017029,1372312002694017029,2021-03-17 17:20:52 CDT,2021-03-17,17:20:52,-0500,38308690,gojamespark,James Park | JP,,My mans at the Cherokee County Sheriff dept deleting his racist social media posts  https://t.co/xKZ9B4tfKi,en,[],[],[],0,0,0,[],[],https://twitter.com/gojamespark/status/1372312002694017029,False,,1,https://pbs.twimg.com/ext_tw_video_thumb/1341893264568430592/pu/img/d7L1ONswqNrERFKV.jpg,los angeles,,,,,,[],,,,
1372310087264391172,1372225293042212866,2021-03-17 17:13:15 CDT,2021-03-17,17:13:15,-0500,1266954597832077314,soberlosangeles,LA Recovery,,"@BenjaminAyres @RexChapman “Bad days” for addicts lead to reaching out to people for help, entering treatment, or joining a 12-step program.   I have met THOUSANDS of addicts who would never hurt a soul, even on the worst days in their addictions.   “Addiction” is never an excuse for violence.",en,[],[],[],0,0,0,[],[],https://twitter.com/soberLosAngeles/status/1372310087264391172,False,,0,,los angeles,,,,,,"[{'screen_name': 'BenjaminAyres', 'name': 'Benjamin Ayres', 'id': '44284703'}, {'screen_name': 'RexChapman', 'name': 'Rex Chapman🏇🏼', 'id': '324703658'}]",,,,
1372308854583615489,1372304958486315011,2021-03-17 17:08:21 CDT,2021-03-17,17:08:21,-0500,1052521493874192385,dan_blue_oc2co,Dan,,"@pamelasm I despair for the depths to which our nation has sunk. I knew there were many deeply racist, I cannot understand the xenophobia &amp; cowardice to assault seniors and women. The GOP's failure to condemn this behavior encourages others to do the same. Pitiful.",en,[],[],[],1,0,3,[],[],https://twitter.com/Dan_Blue_OC2CO/status/1372308854583615489,False,,0,,los angeles,,,,,,"[{'screen_name': 'pamelasm', 'name': 'Pamelasm', 'id': '7075972'}]",,,,
1372308380740509696,1372308380740509696,2021-03-17 17:06:28 CDT,2021-03-17,17:06:28,-0500,28142683,thatmanhour,Mo’Bass Musik 🔉🔥🎶,,"Literally as far back as I can research, they always wanted the black ppl to “stay calm” or not respond with “rage”",en,[],[],[],0,2,5,[],[],https://twitter.com/thatmanhour/status/1372308380740509696,False,,0,,los angeles,,,,,,[],,,,
1372307897846177794,1372307897846177794,2021-03-17 17:04:33 CDT,2021-03-17,17:04:33,-0500,61349804,notketchup,Erika Kerekes,,The threat is real and persistent.,en,[],[],[],0,0,1,[],[],https://twitter.com/notketchup/status/1372307897846177794,False,https://twitter.com/MacFarlaneNews/status/1372280212495470605,0,,los angeles,,,,,,[],,,,
1372307710872489987,1372242176529244162,2021-03-17 17:03:49 CDT,2021-03-17,17:03:49,-0500,20823753,nanorich,Nancy Richardson,,"@digby56 I have seen right wingers trying to justify this because he was just targeting sex workers.  Nothing racist here, oh boy.",en,[],[],[],0,0,0,[],[],https://twitter.com/nanorich/status/1372307710872489987,False,,0,,los angeles,,,,,,"[{'screen_name': 'digby56', 'name': 'digby', 'id': '7794142'}]",,,,
1372306789778124801,1372304930459901954,2021-03-17 17:00:09 CDT,2021-03-17,17:00:09,-0500,272396530,ryankickassa,Ryan Bourassa,,I'll admit I have a bit of a habit of pissing people off with my jokes but all that tells me is they don't have a sense of humor on top of being a violent caveman.,en,[],[],[],0,1,4,[],[],https://twitter.com/ryankickassa/status/1372306789778124801,False,,0,,los angeles,,,,,,[],,,,
1372306687000858625,1372306687000858625,2021-03-17 16:59:45 CDT,2021-03-17,16:59:45,-0500,778184023,itstiffanyalice,Tiffany Alice (she/her),,"""He had a bad day, and this is what he did.""  Oh, he had a bad day? And he just happened to murder people and commit a hate crime? Just a bad day? PUH-LEAZ!!!! That man is a terrorist and was targeting Asians! Call it what it is. #AsianLivesMatter #StopAsianHate",en,[],[],[],0,0,0,"['asianlivesmatter', 'stopasianhate']",[],https://twitter.com/itsTiffanyAlice/status/1372306687000858625,False,,0,,los angeles,,,,,,[],,,,
1372303562076655617,1372303562076655617,2021-03-17 16:47:20 CDT,2021-03-17,16:47:20,-0500,16541331,lizinlala,liz,,"Had a bad day yesterday, might murder 8 people. (See how this logic is flawed?)",en,[],[],[],0,0,4,[],[],https://twitter.com/lizinlala/status/1372303562076655617,False,,0,,los angeles,,,,,,[],,,,
1372303179136733186,1372303179136733186,2021-03-17 16:45:48 CDT,2021-03-17,16:45:48,-0500,21129818,bohan,Bo Han 한보형,,"Folks of color in this country have sadly become too good at compartmentalizing. It’s a defense mechanism.   All day today, I‘ve to put this sadness &amp; rage in a box, and I’ve been forcing myself to ‘smile’ in meetings.  Imagine the privilege of never feeling the need to do that.",en,[],[],[],17,83,562,[],[],https://twitter.com/bohan/status/1372303179136733186,False,,0,,los angeles,,,,,,[],,,,
1372302977348767747,1372302977348767747,2021-03-17 16:45:00 CDT,2021-03-17,16:45:00,-0500,22774951,kirbopher,Chris Niosi,,Feeling a lot of quakes over the last day or so. I like to think it's the earth itself shaking in anger at the human race's collective stupidity.,en,[],[],[],3,1,39,[],[],https://twitter.com/Kirbopher/status/1372302977348767747,False,,0,,los angeles,,,,,,[],,,,
1372302181269794817,1372302181269794817,2021-03-17 16:41:50 CDT,2021-03-17,16:41:50,-0500,2841329687,leftcrewpolitic,Left Crew Politics,,Thread. What a horrible account of an assault and it’s aftermath.,en,[],[],[],0,0,0,[],[],https://twitter.com/LeftCrewPolitic/status/1372302181269794817,False,https://twitter.com/stephanmlee/status/1372229782004510724,0,,los angeles,,,,,,[],,,,
1372301834782670853,1372195916598370312,2021-03-17 16:40:28 CDT,2021-03-17,16:40:28,-0500,512317118,bushido49ers,🅑🅛🅐🅒🅚 Bruce Wayne ☭🔻,,@jimsciutto Hate Crime.,en,[],[],[],0,0,5,[],[],https://twitter.com/bushido49ers/status/1372301834782670853,False,,0,,los angeles,,,,,,"[{'screen_name': 'jimsciutto', 'name': 'Jim Sciutto', 'id': '22129280'}]",,,,
1372301299618697218,1372301299618697218,2021-03-17 16:38:20 CDT,2021-03-17,16:38:20,-0500,292016951,badreprint,Brad Painter🇺🇦,,"I’m a young white guy. I’ve had a pretty bad week. And yet, like a normal person, I didn’t take that as an opportunity to become a fucking domestic terrorist.  There’s no excuse for this shit. We need gun control, we need diversity, and we need to #StopAsianHate",en,[],[],[],0,0,1,['stopasianhate'],[],https://twitter.com/badreprint/status/1372301299618697218,False,,0,,los angeles,,,,,,[],,,,
1372301168475471872,1372301168475471872,2021-03-17 16:37:49 CDT,2021-03-17,16:37:49,-0500,565132779,esports_kobe,Sam Hartman-Kenzler,,The shooting in Atlanta just yesterday is absolutely terrifying. All this horrendous violence and hate has to stop. #StopAsianHate   https://t.co/wb4ZiQmDTi,en,[],['https://anti-asianviolenceresources.carrd.co/'],[],2,16,325,['stopasianhate'],[],https://twitter.com/esports_kobe/status/1372301168475471872,False,https://twitter.com/jfwong/status/1371565516112850944,0,,los angeles,,,,,,[],,,,
1372299841439637504,1372299841439637504,2021-03-17 16:32:32 CDT,2021-03-17,16:32:32,-0500,28865825,danawickens,Dana Wickens!,,0% surprise that cops continue to shoot BIPOC for nothing and give white racist terrorists lollipops for their “grumpy” days 🍭 #StopAsianHate,en,[],[],[],0,1,14,['stopasianhate'],[],https://twitter.com/danawickens/status/1372299841439637504,False,,0,,los angeles,,,,,,[],,,,
1372299715769888773,1372299208250814471,2021-03-17 16:32:02 CDT,2021-03-17,16:32:02,-0500,3165691046,bader_diedrich,Diedrich Bader,,@horn_sco Yes i did! They were shooting a hillbillies reunion show at CBS television city and i went to meet him  Enormous guy  Hand like a ham,en,[],[],[],1,1,11,[],[],https://twitter.com/bader_diedrich/status/1372299715769888773,False,,0,,los angeles,,,,,,[],,,,
1372299506235052033,1372299506235052033,2021-03-17 16:31:13 CDT,2021-03-17,16:31:13,-0500,2445767372,emmatoureau,Emma Toureau,,It’s a fucking hate crime. The over-sexualization of AAPI women is based in racist objectification.  Call it what it is.,en,[],[],[],1,1,8,[],[],https://twitter.com/EmmaToureau/status/1372299506235052033,False,https://twitter.com/nowthisnews/status/1372199025450049536,0,,los angeles,,,,,,[],,,,
1372299344301367297,1372299344301367297,2021-03-17 16:30:34 CDT,2021-03-17,16:30:34,-0500,589484477,joelesterphotos,Joe Lester Photos,"{'type': 'Point', 'coordinates': [34.139529, -118.412975]}",Was so great to be back shooting @hw_football @hwschool last #fridaynightlights #prepfootball #ciffootball @cifssthisweek @cifss @hwathletics #football #highschool #harvardwestlake #schoolsportsphotographer  https://t.co/g7E3wrPBfq,en,"[{'screen_name': 'hw_football', 'name': 'headwrapz football', 'id': '1209875534'}, {'screen_name': 'hwschool', 'name': 'harvard-westlake', 'id': '215178780'}, {'screen_name': 'cifssthisweek', 'name': 'cifssthisweek', 'id': '1235376413907152896'}, {'screen_name': 'cifss', 'name': 'cif southern section', 'id': '69361450'}, {'screen_name': 'hwathletics', 'name': 'harvard-westlake', 'id': '31229577'}]",['https://www.instagram.com/p/CMiPWgMnqBj/?igshid=hket0z5c83k1'],[],0,1,2,"['fridaynightlights', 'prepfootball', 'ciffootball', 'football', 'highschool', 'harvardwestlake', 'schoolsportsphotographer']",[],https://twitter.com/JoeLesterPhotos/status/1372299344301367297,False,,0,,los angeles,,,,,,[],,,,
1372299325183721474,1372299325183721474,2021-03-17 16:30:29 CDT,2021-03-17,16:30:29,-0500,26363131,yonfon,Fellowship Of The Prog Member,,Having a bad day. Might commit a crime or something 🤷🏽,en,[],[],[],0,0,0,[],[],https://twitter.com/Yonfon/status/1372299325183721474,False,,0,,los angeles,,,,,,[],,,,
