id,conversation_id,created_at,date,time,timezone,user_id,username,name,place,tweet,language,mentions,urls,photos,replies_count,retweets_count,likes_count,hashtags,cashtags,link,retweet,quote_url,video,thumbnail,near,geo,source,user_rt_id,user_rt,retweet_id,reply_to,retweet_date,translate,trans_src,trans_dest
1356382565888782337,1356368443382099972,2021-02-01 17:22:58 CST,2021-02-01,17:22:58,-0500,17057934,bballer,bballer,,"@bblock29 They’re used to defending Mafia crime families, so I t should be great entertainment.",en,[],[],[],0,0,0,[],[],https://twitter.com/bballer/status/1356382565888782337,False,,0,,san diego,,,,,,"[{'screen_name': 'bblock29', 'name': 'Agolf Twitler Slayer', 'id': '1949789970'}]",,,,
1356382230059376644,1356382230059376644,2021-02-01 17:21:38 CST,2021-02-01,17:21:38,-0500,21121865,mysandiegoagent,Colleen  K. Cotter,"{'type': 'Point', 'coordinates': [32.70876064, -117.23797376]}",Today’s Challenge:  Eliminate one emotional terrorist today.  #emotionalintelligence #abuse #codependentnomore #selfish @ La Playa Point Loma  https://t.co/ihQpFEsf2B,en,[],['https://www.instagram.com/p/CKxI0zPDs0e/?igshid=dt5bw6qmwcvm'],[],0,0,0,"['emotionalintelligence', 'abuse', 'codependentnomore', 'selfish']",[],https://twitter.com/mySanDiegoAgent/status/1356382230059376644,False,,0,,san diego,,,,,,[],,,,
1356380862074347523,1356219175656685569,2021-02-01 17:16:12 CST,2021-02-01,17:16:12,-0500,340021961,dewsweb,MEGA,,@farai WTH! Every one of those so called “police officers”  should be relieved of duty and brought up on charges of child abuse! #RochesterPD #childabuse,en,[],[],[],0,0,1,"['rochesterpd', 'childabuse']",[],https://twitter.com/dewsweb/status/1356380862074347523,False,,0,,san diego,,,,,,"[{'screen_name': 'farai', 'name': 'Farai Chideya', 'id': '19152977'}]",,,,
1356373092151435264,1356272852316479499,2021-02-01 16:45:20 CST,2021-02-01,16:45:20,-0500,33551230,jadvphd,j.a.d. vargas phd stands with 🇺🇦,,@rex_woodbury But is that a good thing? Did you read @tim_cook statement on privacy today? It’s an interesting position of a similar type of dilemma between what is being done vs what is the harm of doing it.,en,"[{'screen_name': 'tim_cook', 'name': 'tim cook', 'id': '1636590253'}]",[],[],0,0,0,[],[],https://twitter.com/jadvphd/status/1356373092151435264,False,,0,,san diego,,,,,,"[{'screen_name': 'rex_woodbury', 'name': 'Rex Woodbury', 'id': '1150205216232357888'}]",,,,
1356359103581282309,1356273727047143425,2021-02-01 15:49:44 CST,2021-02-01,15:49:44,-0500,2494659186,ljford1012,🍀Lisa Votes Blue🍀 🇺🇸🇮🇪,,@Jim_Jordan Pedophile enabler,fr,[],[],[],0,0,0,[],[],https://twitter.com/Ljford1012/status/1356359103581282309,False,,0,,san diego,,,,,,"[{'screen_name': 'Jim_Jordan', 'name': 'Rep. Jim Jordan', 'id': '18166778'}]",,,,
1356358571315785728,1356358571315785728,2021-02-01 15:47:37 CST,2021-02-01,15:47:37,-0500,48325671,chipfranklin,Chip Franklin.com,,It’s not anger. It’s intelligent curiousity. That’s why you’re confused. @Sethrogen,en,"[{'screen_name': 'sethrogen', 'name': 'seth rogen', 'id': '443215941'}]",[],[],3,23,166,[],[],https://twitter.com/chipfranklin/status/1356358571315785728,False,https://twitter.com/TheLaurenChen/status/1356354074338340878,0,,san diego,,,,,,[],,,,
1356346361692651521,1356281937342689282,2021-02-01 14:59:06 CST,2021-02-01,14:59:06,-0500,62680724,cuisinart1965,Brent Morton,,"@NikkiHaley What happened on January 6, 2021, at the US Capital is another failure of the racist and conspiratorial Trump administration. In exchange for 4 more years in office, the GOP was willing to lie, subvert democracy and sacrifice the life of 5 Americans. It was an American tragedy.",en,[],[],[],0,0,0,[],[],https://twitter.com/Cuisinart1965/status/1356346361692651521,False,,0,,san diego,,,,,,"[{'screen_name': 'NikkiHaley', 'name': 'Nikki Haley', 'id': '1079776144524754944'}]",,,,
1356330890213814272,1356323135432359943,2021-02-01 13:57:38 CST,2021-02-01,13:57:38,-0500,340384031,awesomesaucedan,Danny B.,,"@mtgreenee @realDonaldTrump I wonder consider recordings of you being a racist, conspiracy theory psychopath to be a smear campaign. You said the words. RESIGN NOW!",en,[],[],[],0,0,0,[],[],https://twitter.com/awesomesauceDan/status/1356330890213814272,False,,0,,san diego,,,,,,"[{'screen_name': 'mtgreenee', 'name': 'Marjorie Taylor Greene 🇺🇸', 'id': '826065164504006657'}, {'screen_name': 'realDonaldTrump', 'name': 'Donald J. Trump', 'id': '25073877'}]",,,,
1356327225197531136,1356327225197531136,2021-02-01 13:43:04 CST,2021-02-01,13:43:04,-0500,175281443,mariussose,SD Master Trainer,"{'type': 'Point', 'coordinates': [32.803001, -117.237575]}",Thee face of the league!    The Golden Arm!  Gun slinger!   @patrickmahomes if the #kansascitychiefs get behind any other QB you may panic but not with Mahomes you’re still in the game. @ Pacific Beach  https://t.co/fFd1jTWIcX,en,"[{'screen_name': 'patrickmahomes', 'name': 'patrick mahomes ii', 'id': '353178677'}]",['https://www.instagram.com/p/CKwwEeMno4p/?igshid=1ie8ts73d5tek'],[],0,0,0,['kansascitychiefs'],[],https://twitter.com/MariusSose/status/1356327225197531136,False,,0,,san diego,,,,,,[],,,,
1356317043264352256,1356317043264352256,2021-02-01 13:02:36 CST,2021-02-01,13:02:36,-0500,843048410,tgj619,Theo,,"I said it then, and I’ll say it again IDGAF who doesn’t like it, a good chunk of population here in The states, has been focusing their anger/slander at the wrong people. Another reason why we are in the situation were in.",en,[],[],[],0,0,0,[],[],https://twitter.com/tgj619/status/1356317043264352256,False,,0,,san diego,,,,,,[],,,,
1356314457576628224,1356314431148355584,2021-02-01 12:52:20 CST,2021-02-01,12:52:20,-0500,132308239,pzlpiecesmktg,Puzzle Pieces Marketing,,"Gucci then made the mind-blowing 🤯statement that it didn’t know blackface images were racist. 😬  In 2020, Aunt Jemima came under renewed criticism amid protests sparked by the death of George Floyd. 7/8",en,[],[],[],1,0,0,[],[],https://twitter.com/PzlPiecesMktg/status/1356314457576628224,False,,0,,san diego,,,,,,[],,,,
1356314455919849473,1356314431148355584,2021-02-01 12:52:20 CST,2021-02-01,12:52:20,-0500,132308239,pzlpiecesmktg,Puzzle Pieces Marketing,,"The tone of the Aunt Jemima ads also portrayed and contributed to racist stereotypes of Blacks as domestic servants. Over 100 years since the creation of the Aunt Jemima mammy logo, you’d hope that brands would have moved on from using racist stereotypes. 5/8",en,[],[],[],1,0,0,[],[],https://twitter.com/PzlPiecesMktg/status/1356314455919849473,False,,0,,san diego,,,,,,[],,,,
1356314431148355584,1356314431148355584,2021-02-01 12:52:14 CST,2021-02-01,12:52:14,-0500,132308239,pzlpiecesmktg,Puzzle Pieces Marketing,,"It's #BlackHistoryMonth, y'all!  For the first week of Black History Month, we’re going to focus our posts on the history of racism in marketing. We decided to take a look at some racist branding, logos, and advertisements throughout the years. 1/8  https://t.co/fHCIVvEGzf",en,[],[],['https://pbs.twimg.com/media/EtKYyRBUcAAZ2Le.jpg'],1,2,5,['blackhistorymonth'],[],https://twitter.com/PzlPiecesMktg/status/1356314431148355584,False,,1,https://pbs.twimg.com/media/EtKYyRBUcAAZ2Le.jpg,san diego,,,,,,[],,,,
1356302735323197440,1356302735323197440,2021-02-01 12:05:45 CST,2021-02-01,12:05:45,-0500,1250903238209163271,queenzogie2,ehizogie,,I remember getting into a car accident while struggling with serious mental health issues. One police officer helped me get out of my car I was trapped in. The other police officers threatened to arrest me and do what he can to revoke my license because of my mental illness.,en,[],[],[],0,0,1,[],[],https://twitter.com/queenzogie2/status/1356302735323197440,False,https://twitter.com/nytimes/status/1356195603743649796,0,,san diego,,,,,,[],,,,
1356301340348096518,1356301340348096518,2021-02-01 12:00:13 CST,2021-02-01,12:00:13,-0500,2629489590,higginsgggg,NEO-EXPOSINGTRUTH,,"BLM Is not a Group that cares about Black lives or anyone lives it's a front group designed to make it appear system change is needed, that change will afford organized crime "" Our Government""  to trample even enslave ANYONE IT CHOOSES",en,[],[],[],0,0,0,[],[],https://twitter.com/higginsgggg/status/1356301340348096518,False,,0,,san diego,,,,,,[],,,,
1356299451762057216,1356299451762057216,2021-02-01 11:52:42 CST,2021-02-01,11:52:42,-0500,18454831,nedanews8,Neda Iranpour,,The area around Kansas and Monroe and Madison Streets are blocked off in #NorthPark due to this deadly shooting. @CBS8,en,"[{'screen_name': 'cbs8', 'name': 'cbs 8 san diego', 'id': '27745484'}]",[],[],1,1,3,['northpark'],[],https://twitter.com/NedaNews8/status/1356299451762057216,False,https://twitter.com/tsardinatv/status/1356298672326148096,0,,san diego,,,,,,[],,,,
1356298884721553414,1356008538963898376,2021-02-01 11:50:27 CST,2021-02-01,11:50:27,-0500,2629489590,higginsgggg,NEO-EXPOSINGTRUTH,,@End_TheFederalR Absolutley JFK Stated when Peaceful activism fails to change a corrupt system violent revolutions are the only remaining option Our system is a mass murdering satanic construct designed to enslave all,en,[],[],[],0,0,0,[],[],https://twitter.com/higginsgggg/status/1356298884721553414,False,,0,,san diego,,,,,,"[{'screen_name': 'End_TheFederalR', 'name': '𝕴𝖑𝖑𝖚𝖒𝖎𝖓𝖆𝖙𝖎 𝖐𝖎𝖑𝖑𝖊𝖗', 'id': '806214506263232514'}]",,,,
1356297204974043136,1356295137727569920,2021-02-01 11:43:47 CST,2021-02-01,11:43:47,-0500,797103314718621696,janis_wilds,Janis Wilds,,@TomJChicago The talking point of Republican politicians in defending MTG is we can’t expel or censure her for having different ideas. Which would be laughable if she wasn’t armed &amp; a danger to her colleagues while pushing lies she apparently knows are lies. All the while grifting $$$.,en,[],[],[],0,1,12,[],[],https://twitter.com/janis_wilds/status/1356297204974043136,False,,0,,san diego,,,,,,"[{'screen_name': 'TomJChicago', 'name': 'Tom Joseph', 'id': '14542977'}]",,,,
1356289680216477696,1356289680216477696,2021-02-01 11:13:53 CST,2021-02-01,11:13:53,-0500,2629489590,higginsgggg,NEO-EXPOSINGTRUTH,,"@HM_sthIm ohh how Jeckle and hyde remind many of the scarlett letter, reference to yr profile pic (not a personal attack) if yr doin good works stay with it God bless",en,[],[],[],0,0,1,[],[],https://twitter.com/higginsgggg/status/1356289680216477696,False,,0,,san diego,,,,,,[],,,,
1356285956723105792,1356269577756237824,2021-02-01 10:59:05 CST,2021-02-01,10:59:05,-0500,2629489590,higginsgggg,NEO-EXPOSINGTRUTH,,@10News And when they accept this prize I hope the family member and friends of those murdered and had their property completely destroyed stand outside of that  building and say your nothing but murder'ers,en,[],[],[],1,0,2,[],[],https://twitter.com/higginsgggg/status/1356285956723105792,False,,0,,san diego,,,,,,"[{'screen_name': '10News', 'name': 'ABC 10News San Diego', 'id': '9616062'}]",,,,
1356280928323002369,1356280327690465285,2021-02-01 10:39:06 CST,2021-02-01,10:39:06,-0500,759110532741738497,lcgfrancis55lea,Lea Francis 🇺🇸🇺🇸 🇺🇦,,"@ProjectLincoln That’s how they roll, deflection and victim hood, just like 45.",en,[],[],[],1,3,45,[],[],https://twitter.com/Lcgfrancis55Lea/status/1356280928323002369,False,,0,,san diego,,,,,,"[{'screen_name': 'ProjectLincoln', 'name': 'The Lincoln Project', 'id': '1205226529455632385'}]",,,,
1356275649342660608,1356275649342660608,2021-02-01 10:18:07 CST,2021-02-01,10:18:07,-0500,42429403,1rayj,Ray Johnson,,"If this attack had been carried out by any other group of terrorists, we would be getting and entirely different response from the Republican Party.",en,[],[],[],0,1,2,[],[],https://twitter.com/1RayJ/status/1356275649342660608,False,https://twitter.com/DemocracyInn/status/1356274138504196107,0,,san diego,,,,,,[],,,,
1356269741363453952,1356269741363453952,2021-02-01 09:54:39 CST,2021-02-01,09:54:39,-0500,1114970489942753280,buddjenn,Jenn Budd,,"When they tell you there were too many insurgents to arrest and that the courts would be overwhelmed, that’s just white supremacy bullshit.",en,[],[],[],2,46,112,[],[],https://twitter.com/BuddJenn/status/1356269741363453952,False,https://twitter.com/eji_org/status/1356240892609265668,0,,san diego,,,,,,[],,,,
1356251324766068737,1356046680064462849,2021-02-01 08:41:28 CST,2021-02-01,08:41:28,-0500,2629489590,higginsgggg,NEO-EXPOSINGTRUTH,,"@NRA Ohhhh say can who see "" those whom choose to look"" how important staged mass shooting whistle blowers can be, Oh how America leaves Whistle blowers alone they become hunted by wolves after prey yet I whistled for you and me.Truth is a extreme threat to power.c blog on profile",en,[],[],[],0,0,0,[],[],https://twitter.com/higginsgggg/status/1356251324766068737,False,,0,,san diego,,,,,,"[{'screen_name': 'NRA', 'name': 'NRA', 'id': '21829541'}]",,,,
1356245133339967490,1356245133339967490,2021-02-01 08:16:52 CST,2021-02-01,08:16:52,-0500,3258057762,ivorydream1,Ivory Dream,,"It's her power.  I sée nothing for us.  She professes violence, death to Pelosi for one.  It's dangerous.  She says the Parkland school shooting didn't happen, and on.  She has to go!",en,[],[],[],0,0,0,[],[],https://twitter.com/IvoryDream1/status/1356245133339967490,False,https://twitter.com/PattyBeamer/status/1356110011492085761,0,,san diego,,,,,,[],,,,
1356230612734996487,1356054620968165381,2021-02-01 07:19:10 CST,2021-02-01,07:19:10,-0500,126357043,tomahawk2154,Thomas Sanchez,,@RBReich Arrest and charge them with treason,en,[],[],[],0,1,1,[],[],https://twitter.com/Tomahawk2154/status/1356230612734996487,False,,0,,san diego,,,,,,"[{'screen_name': 'RBReich', 'name': 'Robert Reich', 'id': '148529707'}]",,,,
1356199089151598592,1356180545642835968,2021-02-01 05:13:54 CST,2021-02-01,05:13:54,-0500,19552423,aciulla,Anthony Ciulla,,"@DonnaLeVangie @CNN So then why did the police cuff, assault and pepper spray her?  I know your answer: ""for her protection"". She needs to be protected from the police",en,[],[],[],4,1,190,[],[],https://twitter.com/aciulla/status/1356199089151598592,False,,0,,san diego,,,,,,"[{'screen_name': 'DonnaLeVangie', 'name': 'Donna', 'id': '1342158103'}, {'screen_name': 'CNN', 'name': 'CNN', 'id': '759251'}]",,,,
1356149216532332546,1356149216532332546,2021-02-01 01:55:43 CST,2021-02-01,01:55:43,-0500,1246185016373047296,imgonnablowmyf1,im gonna blow my fucking brains out,,can’t wait to play rage cage with the boys again so i can put the AOT final season op on for the last couple cups,en,[],[],[],1,1,3,[],[],https://twitter.com/imgonnablowmyf1/status/1356149216532332546,False,,0,,san diego,,,,,,[],,,,
1356146340208791558,1356119296146087939,2021-02-01 01:44:18 CST,2021-02-01,01:44:18,-0500,629049326,andeemorandini,OGValleygirl,,@CartwrightUS Part 1 of your question is Success!  Part 2  Those that started the insurrection and have been identified are being punished. I know of 140 court cases already filed 2 of them for murder. Or perhaps I don’t understand your question.,en,[],[],[],0,0,0,[],[],https://twitter.com/AndeeMorandini/status/1356146340208791558,False,,0,,san diego,,,,,,"[{'screen_name': 'CartwrightUS', 'name': 'Indubitably', 'id': '180449562'}]",,,,
1356122475055120385,1356122475055120385,2021-02-01 00:09:28 CST,2021-02-01,00:09:28,-0500,77637934,sweetbabynicco,nicco.eth,,This mf @JxNxTHxNL really wears his shit in attack mode 🤢🤢🤢🤢  https://t.co/ycYjIXtdF5,en,"[{'screen_name': 'jxnxthxnl', 'name': 'jonathan', 'id': '176499450'}]",[],['https://pbs.twimg.com/media/EtHqNCkVoAMpoDp.jpg'],2,0,9,[],[],https://twitter.com/SweetBabyNicco/status/1356122475055120385,False,,1,https://pbs.twimg.com/media/EtHqNCkVoAMpoDp.jpg,san diego,,,,,,[],,,,
1356104655067967491,1356104655067967491,2021-01-31 22:58:39 CST,2021-01-31,22:58:39,-0500,1693265342,tshombe77,Bishop Cornelius Bowser Sr.,,After Serving 32 Years In Prison For Murder Former Gang Member Aubra McN...  https://t.co/rL3lTAFhmf via @YouTube,en,"[{'screen_name': 'youtube', 'name': 'youtube', 'id': '10228272'}]",['https://youtu.be/AJOTC8g_oco'],[],0,0,0,[],[],https://twitter.com/Tshombe77/status/1356104655067967491,False,,0,,san diego,,,,,,[],,,,
1356102921952264193,1356008600238514177,2021-01-31 22:51:46 CST,2021-01-31,22:51:46,-0500,84493735,engmac18,Engel Martínez ☭🇲🇽,,"@21x106 @BaffledPenguin @jeffe_mr @jacobinmag It's a war crime. As are U.S interventions in Iraq, Afghanistan, Libya, Vietnam, East Timor, Cambodia, Nicaragua, Chile, El Salvador, etc etc",ro,[],[],[],0,0,0,[],[],https://twitter.com/engmac18/status/1356102921952264193,False,,0,,san diego,,,,,,"[{'screen_name': 'jeffe_mr', 'name': '𝕁 ☻', 'id': '2896629755'}, {'screen_name': 'jacobinmag', 'name': 'jacobinmag', 'id': '1395760177538863107'}]",,,,
1356100233936031747,1356100233936031747,2021-01-31 22:41:05 CST,2021-01-31,22:41:05,-0500,593810774,rockinfinancial,Rockin,,Attack on Titan is so good,en,[],[],[],0,0,2,[],[],https://twitter.com/rockinfinancial/status/1356100233936031747,False,,0,,san diego,,,,,,[],,,,
1356098974340448259,1356098974340448259,2021-01-31 22:36:05 CST,2021-01-31,22:36:05,-0500,1693265342,tshombe77,Bishop Cornelius Bowser Sr.,,Coo Coo is a former member gang member of the West Coast Crips &amp; He served 32 years in prison for murder.  In this clip Coo Coo shares with us how there is no difference between Bloods and Crips and to end the violence you have to think for yourself and stop being a follower.  https://t.co/GQR4Y3pnVx,en,[],[],[],0,2,5,[],[],https://twitter.com/Tshombe77/status/1356098974340448259,False,,1,https://pbs.twimg.com/ext_tw_video_thumb/1356098875660988419/pu/img/1vJWjmEzmFP0JcOw.jpg,san diego,,,,,,[],,,,
1356089463412117507,1356033560591929344,2021-01-31 21:58:17 CST,2021-01-31,21:58:17,-0500,609714376,tfrileypd,I own deplorables,,"@AngieBrownPNW @AuthorJCHowell @alavelle07 @laurenboebert Patriots! What a joke right? The only reason they were there was to rectify an election they WANTED TO BELIEVE was stolen. They were there at the behest of a crime boss, carrying out a hit. No sympathy at all for these assholes.",en,[],[],[],2,0,1,[],[],https://twitter.com/tfrileypd/status/1356089463412117507,False,,0,,san diego,,,,,,"[{'screen_name': 'AngieBrownPNW', 'name': 'Angie Brown', 'id': '899331344454397952'}, {'screen_name': 'AuthorJCHowell', 'name': 'JC Howell', 'id': '840642514214346752'}, {'screen_name': 'alavelle07', 'name': 'Addison Lavelle', 'id': '1040017522962194432'}, {'screen_name': 'laurenboebert', 'name': 'Lauren Boebert', 'id': '1201670995435646976'}]",,,,
1356089353810845696,1356089353810845696,2021-01-31 21:57:51 CST,2021-01-31,21:57:51,-0500,1064958067,sumsumnoodle,Summer Joy,,"So they can share more of the lies, hate, and encouragement of violence. Disgusted",en,[],[],[],0,0,0,[],[],https://twitter.com/sumsumnoodle/status/1356089353810845696,False,https://twitter.com/DonaldJTrumpJr/status/1355126188662898691,0,,san diego,,,,,,[],,,,
1356088388936376323,1356088388936376323,2021-01-31 21:54:01 CST,2021-01-31,21:54:01,-0500,149461977,karchainsd,Karcha,,I think DoorDash and Uber Eats are more of a threat to the restaurant industry than short term shut downs.,en,[],[],[],0,0,0,[],[],https://twitter.com/KarchaInSD/status/1356088388936376323,False,,0,,san diego,,,,,,[],,,,
1356083945763336197,1356033560591929344,2021-01-31 21:36:22 CST,2021-01-31,21:36:22,-0500,609714376,tfrileypd,I own deplorables,,"@JohnsonKallie @luvcommala @AuthorJCHowell @alavelle07 @laurenboebert She was lawfully shot, and you know it. Watch the video. The gun was trained on her for 15 long seconds and everyone was yelling ""He has a gun"" She decided to call the Officer's bluff, by insisting on crawling through the window.",en,[],[],[],0,0,0,[],[],https://twitter.com/tfrileypd/status/1356083945763336197,False,,0,,san diego,,,,,,"[{'screen_name': 'JohnsonKallie', 'name': 'Kallie Johnson', 'id': '612826457'}, {'screen_name': 'luvcommala', 'name': '@TrumpIsGone', 'id': '1348288369277755400'}, {'screen_name': 'AuthorJCHowell', 'name': 'JC Howell', 'id': '840642514214346752'}, {'screen_name': 'alavelle07', 'name': 'Addison Lavelle', 'id': '1040017522962194432'}, {'screen_name': 'laurenboebert', 'name': 'Lauren Boebert', 'id': '1201670995435646976'}]",,,,
1356069797138579462,1356069797138579462,2021-01-31 20:40:08 CST,2021-01-31,20:40:08,-0500,25877022,muddyinpb,Shelby LaFontaine,,Giuliani given till Wednesday to retract Lincoln Project defamation in brutal letter from attorneys  https://t.co/xQ3wtRZZT1,en,[],['https://www.rawstory.com/rudy-giuliani-insurrection/'],[],0,0,1,[],[],https://twitter.com/muddyinpb/status/1356069797138579462,False,,0,,san diego,,,,,,[],,,,
1356042481461153794,1355948059176255488,2021-01-31 18:51:36 CST,2021-01-31,18:51:36,-0500,2281786801,danielbeeman1,"Daniel Beeman,real person",,"@LoveForgivPeace @MarcusBush_NC??? Waz going on down there? When do ALL lives really matter?? @NoraVargasSD i really hope first Hispanic woman leader of @SanDiegoCounty District will #StandUp &amp; #ShoutOut b/c life IS worth more. No one is perfect, but shooting &amp; kill NOT Right answer! ✌+💓=🌈!!!  https://t.co/H9NqFmWWZW",en,"[{'screen_name': 'noravargassd', 'name': 'nora e. vargas', 'id': '3110399054'}, {'screen_name': 'sandiegocounty', 'name': 'sandiegocounty', 'id': '17200375'}]",[],"['https://pbs.twimg.com/media/EtGhREAVgAAm0kD.jpg', 'https://pbs.twimg.com/media/EtGhVUTU0AEchbc.jpg', 'https://pbs.twimg.com/media/EtGhagSVoAEmhux.jpg', 'https://pbs.twimg.com/media/EtGhcw4UYAEoTcb.jpg']",0,0,0,"['standup', 'shoutout']",[],https://twitter.com/DanielBeeman1/status/1356042481461153794,False,,1,https://pbs.twimg.com/media/EtGhREAVgAAm0kD.jpg,san diego,,,,,,"[{'screen_name': 'LoveForgivPeace', 'name': 'Tasha Williamson', 'id': '2239657458'}]",,,,
1356027259086274562,1356027259086274562,2021-01-31 17:51:06 CST,2021-01-31,17:51:06,-0500,191896357,mdmunds,Mary,,the worlds just itching to rage  https://t.co/wbya8a4PKa,en,[],[],['https://pbs.twimg.com/media/EtGTmktU4AEhB36.jpg'],0,0,3,[],[],https://twitter.com/mdmunds/status/1356027259086274562,False,,1,https://pbs.twimg.com/media/EtGTmktU4AEhB36.jpg,san diego,,,,,,[],,,,
1356009949650771968,1355927762062737409,2021-01-31 16:42:20 CST,2021-01-31,16:42:20,-0500,797103314718621696,janis_wilds,Janis Wilds,,"@janschakowsky @Solutioneer72 Thank you, please also support @RepNikema &amp; @RepSaraJacobs Resolution of Censure and call for resignation of Majorie Taylor Greene. I urge the House to use every available option to remove Greene from power, she is a danger to Congress members and staff as well as the country.",en,"[{'screen_name': 'repnikema', 'name': 'congresswoman nikema williams', 'id': '1345461797361504259'}, {'screen_name': 'repsarajacobs', 'name': 'congresswoman sara jacobs', 'id': '1345103905869455361'}]",[],[],0,2,3,[],[],https://twitter.com/janis_wilds/status/1356009949650771968,False,,0,,san diego,,,,,,"[{'screen_name': 'janschakowsky', 'name': 'Jan Schakowsky', 'id': '24195214'}, {'screen_name': 'Solutioneer72', 'name': 'Raj 🦅 #DemCast 🗽 Balasubramanian 🥁', 'id': '1566650000'}]",,,,
1355989708057137155,1355940446124601356,2021-01-31 15:21:54 CST,2021-01-31,15:21:54,-0500,50332002,carldeluca,Carl🏳️‍🌈,,@ChrisMurphyCT Fuck bipartisanship. There’s only one party in America. The GOP has become a terrorist organization trying to hurt the American people. Why can’t Democrats see that. Steamroll them. Get the agenda moving and secure democracy. If we don’t we’re fucked.,en,[],[],[],0,0,0,[],[],https://twitter.com/carldeluca/status/1355989708057137155,False,,0,,san diego,,,,,,"[{'screen_name': 'ChrisMurphyCT', 'name': 'Chris Murphy', 'id': '150078976'}]",,,,
1355975231240687617,1355974619300290563,2021-01-31 14:24:22 CST,2021-01-31,14:24:22,-0500,810534787689709568,vinniepalma,MacroMinded,,@maggieNYT Always the victim. Poor baby,en,[],[],[],0,0,1,[],[],https://twitter.com/vinniepalma/status/1355975231240687617,False,,0,,san diego,,,,,,"[{'screen_name': 'maggieNYT', 'name': 'Maggie Haberman', 'id': '93069110'}]",,,,
1355971893086457859,1355967431496376325,2021-01-31 14:11:06 CST,2021-01-31,14:11:06,-0500,1937161,jaimeas2000,J.A.S. (Jim),,@contradiction70 Does this victim of your sexual militia have any idea they are such a target?,en,[],[],[],0,0,1,[],[],https://twitter.com/jaimeas2000/status/1355971893086457859,False,,0,,san diego,,,,,,"[{'screen_name': 'contradiction70', 'name': '𝓜51♕ ☠︎', 'id': '1092159541280677889'}]",,,,
1355968258310959107,1355641979569319940,2021-01-31 13:56:40 CST,2021-01-31,13:56:40,-0500,19946588,gabrieladow,Gaby Dow 🇺🇸✨🇲🇽✨🇮🇪✨🇺🇦✨❤️,,"@LikeSmize @Amy_Siskind This was just last night, 15 mins away from my home in north #SanDiego, so yeah, sadly this gross racism is passed down from parents to kids. The young man was previously filmed at an anti-mask rally &amp; already posted a “I’m not really racist, just a Trump supporter” excuse video.",en,[],[],[],0,0,0,['sandiego'],[],https://twitter.com/GabrielaDow/status/1355968258310959107,False,https://twitter.com/ndelriego/status/1355900606163152900,0,,san diego,,,,,,"[{'screen_name': 'LikeSmize', 'name': 'Squirrel.', 'id': '713147129594707968'}, {'screen_name': 'Amy_Siskind', 'name': 'Amy Siskind 🏳️\u200d🌈', 'id': '15976705'}]",,,,
