id,conversation_id,created_at,date,time,timezone,user_id,username,name,place,tweet,language,mentions,urls,photos,replies_count,retweets_count,likes_count,hashtags,cashtags,link,retweet,quote_url,video,thumbnail,near,geo,source,user_rt_id,user_rt,retweet_id,reply_to,retweet_date,translate,trans_src,trans_dest
1464015483745628172,1463972310537449477,2021-11-25 17:37:46 CST,2021-11-25,17:37:46,-0500,919747532284076032,gabster0802,Gaby Villalobos,,@KloheFernandez @Earpervoting6 @bbferrar @Earpapalooza @KatBarrell @DominiqueP_C One of my favs panels. Before shooting season 4❤ #WynonnaEarp  #BringWynonnaHome,en,[],[],[],0,0,3,"['wynonnaearp', 'bringwynonnahome']",[],https://twitter.com/gabster0802/status/1464015483745628172,False,,0,,san diego,,,,,,"[{'screen_name': 'KloheFernandez', 'name': 'Klohe', 'id': '1618073456'}, {'screen_name': 'Earpervoting6', 'name': '#FightForWynonna', 'id': '889290388216872965'}, {'screen_name': 'bbferrar', 'name': 'Bonnie Ferrar', 'id': '350001019'}, {'screen_name': 'Earpapalooza', 'name': 'Earp-a-palooza', 'id': '909133016194256896'}, {'screen_name': 'KatBarrell', 'name': '✌🏼Kat Barrell ✌🏼', 'id': '389898091'}, {'screen_name': 'DominiqueP_C', 'name': 'Dominique P-C', 'id': '263914081'}]",,,,
1464010717464461313,1463721977512873984,2021-11-25 17:18:49 CST,2021-11-25,17:18:49,-0500,24012354,jailerma,Yesterdays Gas is Not Todays Gas,,@NBA_NewYork Once a Knicks always a Knicks we lead it us to the playoff I respect him for taking all our bullshit with class...He was nothing but a southern gentleman's...thank You elfryd and apologize for being constant terrorist in your algorithm,en,[],[],[],0,0,1,[],[],https://twitter.com/Jailerma/status/1464010717464461313,False,,0,,san diego,,,,,,"[{'screen_name': 'NBA_NewYork', 'name': 'New York Basketball', 'id': '1202854989158375425'}]",,,,
1464009424012341265,1464009101411643411,2021-11-25 17:13:41 CST,2021-11-25,17:13:41,-0500,353941519,azael18a,Azael ✪ 🗽,,"@rasta_yisus Brutal, toy que me mudo.",es,[],[],[],2,0,0,[],[],https://twitter.com/Azael18A/status/1464009424012341265,False,,0,,san diego,,,,,,"[{'screen_name': 'rasta_yisus', 'name': 'Jesús', 'id': '331295092'}]",,,,
1463997681622151169,1463996640507928586,2021-11-25 16:27:01 CST,2021-11-25,16:27:01,-0500,42817478,engendrux,Carlos 🔥,,"@ManadaPolitica Ni eso muchos de los que conozco lo hacen por odio y desprecio a estados unidos y apoyan narco dictaduras como Venezuela, Cuba o Nicaragua.",es,[],[],[],0,0,0,[],[],https://twitter.com/engendrux/status/1463997681622151169,False,,0,,san diego,,,,,,"[{'screen_name': 'ManadaPolitica', 'name': 'Saimon ™', 'id': '1385274747387367428'}]",,,,
1463995156877615105,1463995156877615105,2021-11-25 16:16:59 CST,2021-11-25,16:16:59,-0500,1448428512298168322,itsyungemac,Hen Hefner,,Refs be getting away with murder smh,en,[],[],[],0,0,0,[],[],https://twitter.com/ItsYungEmac/status/1463995156877615105,False,,0,,san diego,,,,,,[],,,,
1463993718629814273,1463993718629814273,2021-11-25 16:11:16 CST,2021-11-25,16:11:16,-0500,36115074,thebriandez,Brian Dèz ☽,,They’re racist out there so...,en,[],[],[],0,0,0,[],[],https://twitter.com/TheBrianDez/status/1463993718629814273,False,https://twitter.com/fox5sandiego/status/1463990873407041545,0,,san diego,,,,,,[],,,,
1463986196594376706,1463986196594376706,2021-11-25 15:41:23 CST,2021-11-25,15:41:23,-0500,914029679014584320,kwarner87,Keith Thomas Warner,,@laurenboebert is your hubby a pedophile?,en,[],[],[],0,0,0,[],[],https://twitter.com/KWarner87/status/1463986196594376706,False,https://twitter.com/srogers844/status/1457474448148271106,0,,san diego,,,,,,[],,,,
1463983008466157586,1463610804121575424,2021-11-25 15:28:43 CST,2021-11-25,15:28:43,-0500,207794036,doctorocto,David Edelman,,"@joelockhart The GOP, its leadership, and elected representatives aren’t partners in American governance; they’re a ‘monkey wrench gang’ determined to destroy American democracy by any and all means necessary, including the scuttling of long overdue legislation and the incitement of violence.",en,[],[],[],0,0,0,[],[],https://twitter.com/DoctorOcto/status/1463983008466157586,False,,0,,san diego,,,,,,"[{'screen_name': 'joelockhart', 'name': 'Joe Lockhart', 'id': '101816065'}]",,,,
1463956817910779905,1463950731304603649,2021-11-25 13:44:39 CST,2021-11-25,13:44:39,-0500,2613148374,malikearnest,Malik Earnest,,Radio traffic indicates immediate wind-driven fire threat to homes along Hill Creek Drive is contained. Air assets are continuing to fight flames of the #MagnoliaFire in the Santee area as it burns up towards a water tank. 🎥: @SDGE  https://t.co/LkVQXKxfur,en,"[{'screen_name': 'sdge', 'name': 'sdg&e', 'id': '34968878'}]",[],[],0,3,14,['magnoliafire'],[],https://twitter.com/MalikEarnest/status/1463956817910779905,False,,1,https://pbs.twimg.com/ext_tw_video_thumb/1463956767251984397/pu/img/PQzdMe6ft2dsU5Ij.jpg,san diego,,,,,,[],,,,
1463955604750299137,1463955604750299137,2021-11-25 13:39:49 CST,2021-11-25,13:39:49,-0500,20550947,nattidd,Natalie D'angelo,,"@SDSheriff I appreciate the notice. In the future please indicate the emergency. I had no idea if it was a plane crash, shooting, explosion, etc.  For those also sent into a panic #MagnoliaFire Be safe.  https://t.co/8AvVkXpYW3",en,[],[],['https://pbs.twimg.com/media/FFED3TZVIAAR7BN.jpg'],1,1,8,['magnoliafire'],[],https://twitter.com/Nattidd/status/1463955604750299137,False,,1,https://pbs.twimg.com/media/FFED3TZVIAAR7BN.jpg,san diego,,,,,,[],,,,
1463938707979862017,1463938707979862017,2021-11-25 12:32:41 CST,2021-11-25,12:32:41,-0500,1955187745,franklinsrule,Elisabeth 🇺🇸🇺🇦,,Arrest her for animal abuse.,en,[],[],[],0,1,0,[],[],https://twitter.com/FranklinsRule/status/1463938707979862017,False,https://twitter.com/airlivenet/status/1463920063971536900,0,,san diego,,,,,,[],,,,
1463909592333570056,1463909592333570056,2021-11-25 10:36:59 CST,2021-11-25,10:36:59,-0500,15066288,zachamon,🌈 Art Director says...,,"#Thanksgiving Reminder:   When describing all your turkey ideas to friends &amp; family, some will hear you describing gratuitous acts of murder and post-mortem carcass mutilation and would prefer to not hear it.  Please be respectful to our veg friends this Holiday. Thanks!😊💚🙏🌱",en,[],[],[],0,0,0,['thanksgiving'],[],https://twitter.com/Zachamon/status/1463909592333570056,False,,0,,san diego,,,,,,[],,,,
1463891498533941250,1463712529360646154,2021-11-25 09:25:05 CST,2021-11-25,09:25:05,-0500,19946588,gabrieladow,Gaby Dow 🇺🇸✨🇲🇽✨🇮🇪✨🇺🇦✨❤️,,"@neurodruid @SethCotlar And for that we are “thankful” 🙄 … as well as somehow insisting on being both the perpetual victim + invincible hero at all times. Great thread, but boy is it exhausting to witness religion slide farther right/fascist &amp; away from historical facts/reality. #HappyThanksgiving2021",en,[],[],[],0,0,1,['happythanksgiving2021'],[],https://twitter.com/GabrielaDow/status/1463891498533941250,False,,0,,san diego,,,,,,"[{'screen_name': 'neurodruid', 'name': 'dr. johnny bananas', 'id': '1037420996'}, {'screen_name': 'SethCotlar', 'name': 'Seth Cotlar', 'id': '2477854855'}]",,,,
1463878423474950145,1463878423474950145,2021-11-25 08:33:08 CST,2021-11-25,08:33:08,-0500,1099769002648190977,grubenpamela,Pamela Gruben,,"My thoughts exactly. I imagine they think that  they are three southern good old boys ""doing what comes naturally"".  they are born and bred racists. Hell, they even video recorded their vigilante murder.",en,[],[],[],0,0,1,[],[],https://twitter.com/GrubenPamela/status/1463878423474950145,False,https://twitter.com/mdnij34/status/1463644373183344641,0,,san diego,,,,,,[],,,,
1463857964792487942,1463857964792487942,2021-11-25 07:11:50 CST,2021-11-25,07:11:50,-0500,31420071,dwoodyd,DeWayne Woods,,"Prayer Starter: Father, I don't want to be a victim of my circumstances. I want to change. I receive Your strength and Your freedom today. I believe that real change can occur in my life as I walk with You.",en,[],[],[],2,4,19,[],[],https://twitter.com/dwoodyd/status/1463857964792487942,False,,0,,san diego,,,,,,[],,,,
1463844356226355212,1463844356226355212,2021-11-25 06:17:46 CST,2021-11-25,06:17:46,-0500,1422575611038507009,robymyersnewsie,Roby Myers,,#FireWeatherWarning which went into effect at 9pm last night is now in effect thru Thanksgiving ( until 6pm Friday) with Dry Santa Ana Winds gusting 30 to 40 miles per hour &amp; with Critical Fire Danger! #sdwx @10News @10NewsPaz  https://t.co/QAOywmOxYA,en,"[{'screen_name': '10news', 'name': 'abc 10news san diego', 'id': '9616062'}, {'screen_name': '10newspaz', 'name': 'vanessa paz', 'id': '596456990'}]",[],['https://pbs.twimg.com/media/FFCeru0UYAUyCSY.jpg'],0,0,0,"['fireweatherwarning', 'sdwx']",[],https://twitter.com/RobyMyersNewsie/status/1463844356226355212,False,,1,https://pbs.twimg.com/media/FFCeru0UYAUyCSY.jpg,san diego,,,,,,[],,,,
1463820152282107905,1463624982236319747,2021-11-25 04:41:35 CST,2021-11-25,04:41:35,-0500,716202792491220993,susandfinsd,Nana Sue says Save democracy VOTE Blue in 22,,"@TulsiGabbard If America wasn't a racist country Arbery would be having Thanksgiving dinner today He might have even gone for a run, waved to 3 white men who would have waved back &amp; said Happy Thanksgiving  But insyead Arbery is dead, 3 men are in jail, a former prosecutor is under indictment",en,[],[],[],0,0,0,[],[],https://twitter.com/SusanDFinSD/status/1463820152282107905,False,,0,,san diego,,,,,,"[{'screen_name': 'TulsiGabbard', 'name': 'Tulsi Gabbard 🌺', 'id': '26637348'}]",,,,
1463772484692439045,1463772484692439045,2021-11-25 01:32:10 CST,2021-11-25,01:32:10,-0500,47059723,mariam_101,Mariam,,Sometimes I will choose violence,en,[],[],[],0,0,0,[],[],https://twitter.com/mariam_101/status/1463772484692439045,False,,0,,san diego,,,,,,[],,,,
1463764134642675716,1463764134642675716,2021-11-25 00:58:59 CST,2021-11-25,00:58:59,-0500,481008500,budmanthegreat,The Stoned Buddha,,@JayarJackson that point about the difference in shooting someone and doing it with ya fists is sooooo fitting. People don't understand those points.,en,[],[],[],0,0,0,[],[],https://twitter.com/Budmanthegreat/status/1463764134642675716,False,,0,,san diego,,,,,,[],,,,
1463748313698603009,1463635315592073218,2021-11-24 23:56:07 CST,2021-11-24,23:56:07,-0500,18798897,stevieunholy,Stevie “Maricona Chingona” Unholy,,"@astrudqueen Not just that but also he’s wildly racist and just problematic in general, this MF was down for Tr*mp 🤢",en,[],[],[],0,0,1,[],[],https://twitter.com/StevieUnholy/status/1463748313698603009,False,,0,,san diego,,,,,,"[{'screen_name': 'astrudqueen', 'name': 'Astrud Aurelia', 'id': '2899728367'}]",,,,
1463746546910916608,1463746546910916608,2021-11-24 23:49:06 CST,2021-11-24,23:49:06,-0500,1693265342,tshombe77,Bishop Cornelius Bowser Sr.,,"Poverty, trauma, and being black is not an excuse for crime and violence  https://t.co/JuWcBBvuXH via @YouTube",en,"[{'screen_name': 'youtube', 'name': 'youtube', 'id': '10228272'}]",['https://youtu.be/OpY_sGiLTCo'],[],0,0,0,[],[],https://twitter.com/Tshombe77/status/1463746546910916608,False,,0,,san diego,,,,,,[],,,,
1463731180012859405,1463731180012859405,2021-11-24 22:48:02 CST,2021-11-24,22:48:02,-0500,1693265342,tshombe77,Bishop Cornelius Bowser Sr.,,"“When they hurled their insults at him, he did not retaliate; when he suffered, he made no threats. Instead, he entrusted himself to him who judges justly.” 1 Peter 2:23 NIV  https://t.co/tePyA8ITsQ",en,[],[],['https://pbs.twimg.com/media/FFA3wAGVIAknw4M.jpg'],0,0,0,[],[],https://twitter.com/Tshombe77/status/1463731180012859405,False,,1,https://pbs.twimg.com/media/FFA3wAGVIAknw4M.jpg,san diego,,,,,,[],,,,
1463722068499783680,1463722068499783680,2021-11-24 22:11:50 CST,2021-11-24,22:11:50,-0500,14277967,ideasatrandom,Ideas At Random ...,,Just saw a huge shooting star or meteor 💫☄️ #chulavista,en,[],[],[],0,0,1,['chulavista'],[],https://twitter.com/ideasatrandom/status/1463722068499783680,False,,0,,san diego,,,,,,[],,,,
1463720302576214020,1463659506156589060,2021-11-24 22:04:49 CST,2021-11-24,22:04:49,-0500,4011209060,scott82163,Great Scott,,"@sward111770 DST, That's so racist  https://t.co/WaVf99HGj9",en,[],[],['https://pbs.twimg.com/tweet_video_thumb/FFAt2t9VUAARtsY.jpg'],0,0,0,[],[],https://twitter.com/scott82163/status/1463720302576214020,False,,1,https://pbs.twimg.com/tweet_video_thumb/FFAt2t9VUAARtsY.jpg,san diego,,,,,,"[{'screen_name': 'sward111770', 'name': 'stacey ward', 'id': '1346609852064428033'}]",,,,
1463717769485041667,1463659831072632836,2021-11-24 21:54:45 CST,2021-11-24,21:54:45,-0500,4011209060,scott82163,Great Scott,,@YetiYeff Yes I fired a real gun but I've never fired a nail gun,en,[],[],[],0,0,1,[],[],https://twitter.com/scott82163/status/1463717769485041667,False,,0,,san diego,,,,,,"[{'screen_name': 'YetiYeff', 'name': 'YetiYeff', 'id': '1386704827619622915'}]",,,,
1463707894298275848,1463491068880732162,2021-11-24 21:15:31 CST,2021-11-24,21:15:31,-0500,16016450,nadomom,Cindy McNary,,"@DoYouHaveData @ThatGuy07446764 @michelledelong @KrisGoldsmith85 @RogerMissoCNY Great point. ISIS, schmISIS. White evangelical nationalists have been a bigger threat to this nation than any other group here or abroad.",en,[],[],[],0,0,3,[],[],https://twitter.com/Nadomom/status/1463707894298275848,False,,0,,san diego,,,,,,"[{'screen_name': 'DoYouHaveData', 'name': 'Stand with UKRAINE! 🌻🇺🇦💙💛', 'id': '1190279588850601989'}, {'screen_name': 'ThatGuy07446764', 'name': 'ThatGuy', 'id': '1210410683625562112'}, {'screen_name': 'michelledelong', 'name': 'Michelle De Long', 'id': '31894671'}, {'screen_name': 'KrisGoldsmith85', 'name': 'Kristofer Goldsmith', 'id': '266975216'}, {'screen_name': 'RogerMissoCNY', 'name': 'Roger Misso', 'id': '1113103716561969152'}]",,,,
1463703015026663427,1463676887067099136,2021-11-24 20:56:07 CST,2021-11-24,20:56:07,-0500,400279782,brucewaynemaw,Bruceman,,@kstate_kj @TKoppe22 Koppe do you know this guy? Is this supposed to be funny? Sex abuse jokes?,en,[],[],[],1,0,1,[],[],https://twitter.com/BruceWaynemaw/status/1463703015026663427,False,,0,,san diego,,,,,,"[{'screen_name': 'kstate_kj', 'name': 'kj', 'id': '1356776301592535043'}, {'screen_name': 'TKoppe22', 'name': 'Koppe22🇺🇦🇮🇪🇺🇲', 'id': '174661447'}]",,,,
1463688231510151175,1463685281479942148,2021-11-24 19:57:23 CST,2021-11-24,19:57:23,-0500,1684114082,fulltimehoops1,Aaron Burgin,,Aidan Collins led SFC with 16 points and 6-4 2023 F Daniel Greathouse added 10 and 8 rebounds. The Torreys bottled up the Eagles perimeter shooters (3-20 3fg) while shooting 13/32 from deep.,en,[],[],[],0,0,0,[],[],https://twitter.com/FullTimeHoops1/status/1463688231510151175,False,,0,,san diego,,,,,,[],,,,
1463686247835062272,1463686247835062272,2021-11-24 19:49:30 CST,2021-11-24,19:49:30,-0500,67952688,firstpossession,Anthony Ware,,"PEOPLE YOU ARE FREE TO LIVE YOUR LIVES THE WAY YOU SEE FIT. YOU DO NOT HAVE TO PLAY THE GAMES OF DECEIT THAT SATAN USES TO OPPRESS, RAPE, MISLEAD, AND CAUSE CHAOS.",en,[],[],[],0,0,1,[],[],https://twitter.com/firstpossession/status/1463686247835062272,False,,0,,san diego,,,,,,[],,,,
1463683535735189504,1463681754556866560,2021-11-24 19:38:43 CST,2021-11-24,19:38:43,-0500,2689007845,junkershiryu,JunkersHiryu ●BLM●🎮🕹,,"But at the same time, watching all the drama and racist shit storms on twitch and nonsense that infest this medium I guess to some extent was a blessing. Just.... Ugh.",en,[],[],[],1,0,1,[],[],https://twitter.com/Junkershiryu/status/1463683535735189504,False,,0,,san diego,,,,,,[],,,,
1463676887067099136,1463676887067099136,2021-11-24 19:12:18 CST,2021-11-24,19:12:18,-0500,174661447,tkoppe22,Koppe22🇺🇦🇮🇪🇺🇲,,There is a fantastic documentary on Netflix on the catholic priests in Kansas City and the sex abuse that occurred specifically at my gradeschool in Brookside St Elizabeth's. Its called #Procession.,en,[],[],[],5,0,3,['procession'],[],https://twitter.com/TKoppe22/status/1463676887067099136,False,,0,,san diego,,,,,,[],,,,
1463673545452576775,1463673545452576775,2021-11-24 18:59:01 CST,2021-11-24,18:59:01,-0500,14750177,scrippshealth,Scripps Health,,"#Heartburn can cause pain similar to a heart attack, but the type of discomfort felt during a #HeartAttack differs from indigestion. ❤️ How can you tell the difference between the two? Learn the signs and symptoms of a heart attack vs. indigestion ➡️  https://t.co/U5KkRUQkMs  https://t.co/MkIVLVOWq7",en,[],['http://www.scripps.org/5348t'],['https://pbs.twimg.com/media/FFADVLFX0AQQllv.jpg'],0,1,1,"['heartburn', 'heartattack']",[],https://twitter.com/ScrippsHealth/status/1463673545452576775,False,,1,https://pbs.twimg.com/media/FFADVLFX0AQQllv.jpg,san diego,,,,,,[],,,,
1463671968096419844,1463671968096419844,2021-11-24 18:52:45 CST,2021-11-24,18:52:45,-0500,1684114082,fulltimehoops1,Aaron Burgin,,"Now it’s Country Day’s turn. The Torreys on a 10-3 run to start the quarter behind hot shooting from Tate Smith, lead 24-18, 4:31 2nd",en,[],[],[],0,0,1,[],[],https://twitter.com/FullTimeHoops1/status/1463671968096419844,False,,0,,san diego,,,,,,[],,,,
1463665862339010563,1463665862339010563,2021-11-24 18:28:29 CST,2021-11-24,18:28:29,-0500,1422575611038507009,robymyersnewsie,Roby Myers,,SANTA ANA CONDITIONS: #RedFlagWarning through Thanksgiving with Dry Santa Ana Winds gusting 30 to 40 miles per hour &amp; Elevated Fire Danger! #sdwx @10News @10NewsCampos  https://t.co/czhxQoA8bf,en,"[{'screen_name': '10news', 'name': 'abc 10news san diego', 'id': '9616062'}, {'screen_name': '10newscampos', 'name': 'angelica campos', 'id': '384069833'}]",[],['https://pbs.twimg.com/media/FE_8WAEVgAEI_Ci.jpg'],0,0,0,"['redflagwarning', 'sdwx']",[],https://twitter.com/RobyMyersNewsie/status/1463665862339010563,False,,1,https://pbs.twimg.com/media/FE_8WAEVgAEI_Ci.jpg,san diego,,,,,,[],,,,
1463665481642954753,1463665481642954753,2021-11-24 18:26:59 CST,2021-11-24,18:26:59,-0500,1422575611038507009,robymyersnewsie,Roby Myers,,STRONG SANTA ANAS TONIGHT: Dry Santa Ana Winds gusting 30 to 50 miles per hour overnight with Elevated Fire Danger through Thanksgiving &amp; Warm &amp; Dry Weather next week! Critical Fire Danger in place through Thanksgiving! #sdwx @10News @10NewsCampos  https://t.co/FIfpB2VsPD,en,"[{'screen_name': '10news', 'name': 'abc 10news san diego', 'id': '9616062'}, {'screen_name': '10newscampos', 'name': 'angelica campos', 'id': '384069833'}]",[],['https://pbs.twimg.com/media/FE_7_1NVIAc2S7t.jpg'],0,0,0,['sdwx'],[],https://twitter.com/RobyMyersNewsie/status/1463665481642954753,False,,1,https://pbs.twimg.com/media/FE_7_1NVIAc2S7t.jpg,san diego,,,,,,[],,,,
1463665345843974147,1463665345843974147,2021-11-24 18:26:26 CST,2021-11-24,18:26:26,-0500,3295943761,dsrved759,Ed Welch,,All 3 Men Found Guilty of Murder in Death of Ahmaud Arbery  https://t.co/v8b5gawsMC   Download our app to read more at  https://t.co/VORUb3nrxC,en,[],"['https://link.theepochtimes.com/mkt_app/all-3-men-found-guilty-of-murder-in-death-of-ahmaud-arbery_4122552.html?utm_source=appan2028231', 'https://ept.ms/DownloadApp']",[],0,0,0,[],[],https://twitter.com/dsrved759/status/1463665345843974147,False,,0,,san diego,,,,,,[],,,,
1463662189273759746,1463662189273759746,2021-11-24 18:13:54 CST,2021-11-24,18:13:54,-0500,1422575611038507009,robymyersnewsie,Roby Myers,,SANTA ANA WINDS-- Dry Santa Ana Winds gusting in excess of 50 miles per hour and with Elevated Fire Danger through Thanksgiving! #sdwx @10News @10NewsCampos @Sophia10News  https://t.co/DhzLWOfqo0,en,"[{'screen_name': '10news', 'name': 'abc 10news san diego', 'id': '9616062'}, {'screen_name': '10newscampos', 'name': 'angelica campos', 'id': '384069833'}, {'screen_name': 'sophia10news', 'name': 'sophia carolina hernandez', 'id': '563220109'}]",[],['https://pbs.twimg.com/media/FE_5AK8UYAEQnQS.jpg'],0,0,0,['sdwx'],[],https://twitter.com/RobyMyersNewsie/status/1463662189273759746,False,,1,https://pbs.twimg.com/media/FE_5AK8UYAEQnQS.jpg,san diego,,,,,,[],,,,
1463661736926453760,1463661736926453760,2021-11-24 18:12:06 CST,2021-11-24,18:12:06,-0500,1422575611038507009,robymyersnewsie,Roby Myers,,#FireWeatherWarning will now go into effect tonight 9pm as and will continue through Friday 6pm ( through Thanksgiving) with Dry Santa Ana Winds exceeding 50 miles per hour and with Elevated Fire Danger! #sdwx @10News @10NewsCampos @Sophia10News  https://t.co/SMet9MxjGY,en,"[{'screen_name': '10news', 'name': 'abc 10news san diego', 'id': '9616062'}, {'screen_name': '10newscampos', 'name': 'angelica campos', 'id': '384069833'}, {'screen_name': 'sophia10news', 'name': 'sophia carolina hernandez', 'id': '563220109'}]",[],['https://pbs.twimg.com/media/FE_4l2RVIAArEGA.jpg'],0,0,0,"['fireweatherwarning', 'sdwx']",[],https://twitter.com/RobyMyersNewsie/status/1463661736926453760,False,,1,https://pbs.twimg.com/media/FE_4l2RVIAArEGA.jpg,san diego,,,,,,[],,,,
1463660856940449795,1463660856940449795,2021-11-24 18:08:36 CST,2021-11-24,18:08:36,-0500,1422575611038507009,robymyersnewsie,Roby Myers,,"Red Flag Warning Preparations are now in progress, issued by the National Weather Service with Elevated Fire Danger &amp; Dry Santa Ana Wind Conditions! @Sophia10News has details on @10News at 4, 5 &amp; 6 STORY LINK:  https://t.co/PDFlX1JUQi  https://t.co/FuQ43KXgHO",en,"[{'screen_name': 'sophia10news', 'name': 'sophia carolina hernandez', 'id': '563220109'}, {'screen_name': '10news', 'name': 'abc 10news san diego', 'id': '9616062'}]",['http://www.10news.com'],['https://pbs.twimg.com/media/FE_3yqEVEAAuh2n.jpg'],0,0,0,[],[],https://twitter.com/RobyMyersNewsie/status/1463660856940449795,False,,1,https://pbs.twimg.com/media/FE_3yqEVEAAuh2n.jpg,san diego,,,,,,[],,,,
1463656949094907904,1463656949094907904,2021-11-24 17:53:04 CST,2021-11-24,17:53:04,-0500,1158138001731440640,revbrucej1,RevBruceJ,,Sic semper tyrannis were the words of the assassin John Wilkes Booth but they seem to echo in the latest wave of corporate splitting &amp; conglomerate dismantling $GE $T $O big companies die hard slow. I'm not complaining about my shares of $YUM $KFT 😉 #IJS  https://t.co/AA1yUD9X68,en,[],['https://www.npr.org/sections/money/2021/11/23/1057446470/the-conglomerate-paradox-as-ge-splinters-facebook-becomes-meta'],[],0,0,0,['ijs'],"['ge', 't', 'o', 'yum', 'kft']",https://twitter.com/RevBruceJ1/status/1463656949094907904,False,,0,,san diego,,,,,,[],,,,
1463654081075953665,1463654081075953665,2021-11-24 17:41:40 CST,2021-11-24,17:41:40,-0500,1191106290098946049,fo__________fo,Fo Fo,,Aaron Rodgers feet on my timeline is assault,en,[],[],[],0,0,0,[],[],https://twitter.com/Fo__________Fo/status/1463654081075953665,False,,0,,san diego,,,,,,[],,,,
1463652615833612288,1463652615833612288,2021-11-24 17:35:51 CST,2021-11-24,17:35:51,-0500,1422575611038507009,robymyersnewsie,Roby Myers,,"#FireWeatherWarning goes into effect through Thanksgiving ( Thursday-Friday) w/ Dry Santa Ana exceeding 50 mph &amp; Elevated Fire Danger! @10NewsCampos explain further throughout the evening, beginning at  4pm! @10News #sdwx  https://t.co/recgTy1aij",en,"[{'screen_name': '10newscampos', 'name': 'angelica campos', 'id': '384069833'}, {'screen_name': '10news', 'name': 'abc 10news san diego', 'id': '9616062'}]",[],['https://pbs.twimg.com/media/FE_wS_gVUAQJSPB.jpg'],0,0,0,"['fireweatherwarning', 'sdwx']",[],https://twitter.com/RobyMyersNewsie/status/1463652615833612288,False,,1,https://pbs.twimg.com/media/FE_wS_gVUAQJSPB.jpg,san diego,,,,,,[],,,,
1463649838902366208,1463649838902366208,2021-11-24 17:24:49 CST,2021-11-24,17:24:49,-0500,1265706039313223680,edgarbased,edgar,,Terrorist football,en,[],[],[],1,0,0,[],[],https://twitter.com/EdgarBased/status/1463649838902366208,False,https://twitter.com/xGPhilosophy/status/1463627013663698956,0,,san diego,,,,,,[],,,,
1463645862614110212,1463613041027788807,2021-11-24 17:09:01 CST,2021-11-24,17:09:01,-0500,716202792491220993,susandfinsd,Nana Sue says Save democracy VOTE Blue in 22,,"@bionicbritt86 @chris_notcapn It's racist, ableist, homophobic and misogynistic...it handles stereotypical family dysfunctionality in a ham fisted way (unironically)...even with some great &amp; some good actors it's super cringe... I guess you can tell I didn't like it lol",en,[],[],[],1,0,1,[],[],https://twitter.com/SusanDFinSD/status/1463645862614110212,False,,0,,san diego,,,,,,"[{'screen_name': 'bionicbritt86', 'name': 'Brittany ♐️ Blackness ✊🏾 Bball 💜💛', 'id': '80510649'}, {'screen_name': 'chris_notcapn', 'name': 'chris evans', 'id': '1139189085241794562'}]",,,,
1463632841036550144,1463500374225178630,2021-11-24 16:17:16 CST,2021-11-24,16:17:16,-0500,71346327,garyrikard,Gary Rikard,,"@jwhoopes2 This poor kid. Lacking adult guidance resulting into horrific tragedy, and still he is not getting any guidance he desperately needs. His only option now is enlist in military for any hope of salvaging his life and not doing more harm.",en,[],[],[],0,0,1,[],[],https://twitter.com/garyrikard/status/1463632841036550144,False,,0,,san diego,,,,,,"[{'screen_name': 'jwhoopes2', 'name': '🇺🇸Vote Blue in 2022 🇺🇦', 'id': '17701397'}]",,,,
1463631219472547842,1463631219472547842,2021-11-24 16:10:50 CST,2021-11-24,16:10:50,-0500,18144612,ronnehring,Ron Nehring,,Nobody robs a Nordstrom out of desperation.  These are bad people taking advantage of California’s decision to decriminalize crime.,en,[],[],[],2,3,16,[],[],https://twitter.com/RonNehring/status/1463631219472547842,False,,0,,san diego,,,,,,[],,,,
