id,conversation_id,created_at,date,time,timezone,user_id,username,name,place,tweet,language,mentions,urls,photos,replies_count,retweets_count,likes_count,hashtags,cashtags,link,retweet,quote_url,video,thumbnail,near,geo,source,user_rt_id,user_rt,retweet_id,reply_to,retweet_date,translate,trans_src,trans_dest
1480321116073873413,1480321116073873413,2022-01-09 17:30:31 CST,2022-01-09,17:30:31,-0500,279678521,bossmane_dro,B.O.N ♈️💯🎤,,It might look like I ain’t got my gun on me.. but I promise it stay on me 😉,en,[],[],[],0,0,0,[],[],https://twitter.com/BossMane_Dro/status/1480321116073873413,False,,0,,houston,,,,,,[],,,,
1480309171664867336,1480309171664867336,2022-01-09 16:43:03 CST,2022-01-09,16:43:03,-0500,875566957159788544,lordfrankie_,Alex Mata💂🏻‍♀️🇸🇻,,Filled with so much anger right now🤬,en,[],[],[],0,0,0,[],[],https://twitter.com/lordfrankie_/status/1480309171664867336,False,,0,,houston,,,,,,[],,,,
1480287203922173952,1480280207118458880,2022-01-09 15:15:46 CST,2022-01-09,15:15:46,-0500,722246918408044544,jadedone666,Alone + Easy Target,,"@BudgetQuickshot @neverbenotcool Not all of us who listen to his podcast are racist &amp; brain deadm Yeah he's abrasive as fuck about the stuff he hates but no one else of note these days seems to understand what pro wrestling was &amp; is supposed to be. Look past his vitriol &amp; he's right about alot of stuff, IMO",en,[],[],[],0,0,0,[],[],https://twitter.com/JadedOne666/status/1480287203922173952,False,,0,,houston,,,,,,"[{'screen_name': 'BudgetQuickshot', 'name': 'Quickshot 👉🤪', 'id': '746289504151969792'}, {'screen_name': 'neverbenotcool', 'name': 'McCoseph J’Mormick', 'id': '1078309683553812480'}]",,,,
1480287087924502537,1480287087924502537,2022-01-09 15:15:18 CST,2022-01-09,15:15:18,-0500,140731700,jsmilez,Jonathan Oye,,Keep Shooting! ✨  https://t.co/bfcBWKA2Ok,en,[],[],[],0,0,0,[],[],https://twitter.com/JSmilez/status/1480287087924502537,False,,1,https://pbs.twimg.com/ext_tw_video_thumb/1480287047860604943/pu/img/-WF64OUf397V9mBj.jpg,houston,,,,,,[],,,,
1480281499484229634,1479983431111122947,2022-01-09 14:53:06 CST,2022-01-09,14:53:06,-0500,930822474,mary_busby,Mary Busby,,@JackPosobiec This was a crime against our Constitution. This was a crime against the President of the United States. This never should have been allowed to happen.,en,[],[],[],0,0,0,[],[],https://twitter.com/mary_busby/status/1480281499484229634,False,,0,,houston,,,,,,"[{'screen_name': 'JackPosobiec', 'name': 'Jack Posobiec 🇺🇸', 'id': '592730371'}]",,,,
1480251292438212609,1480251292438212609,2022-01-09 12:53:04 CST,2022-01-09,12:53:04,-0500,3301773650,mcxiinee,DA GOAT♑️,,quiet but im violent #20🥳  https://t.co/lWHJKIvnYg,en,[],[],"['https://pbs.twimg.com/media/FIros91WYAIVCMS.jpg', 'https://pbs.twimg.com/media/FIros91XoAMG2B3.jpg']",2,7,43,[],[],https://twitter.com/mcxiinee/status/1480251292438212609,False,,1,https://pbs.twimg.com/media/FIros91WYAIVCMS.jpg,houston,,,,,,[],,,,
1480243780120940547,1480243780120940547,2022-01-09 12:23:13 CST,2022-01-09,12:23:13,-0500,929566587832684544,katemcclarnon83,Kate ⚔️ 💙 🏈,,"Right or wrong, I associate bathroom attendants with violent clubs, or clubs where people are likely to do coke. The Texans bathrooms have attendants and it’s messing with my head. Let me wash my hands. Stop trying to hand me things. Go away.",en,[],[],[],0,0,0,[],[],https://twitter.com/KateMcClarnon83/status/1480243780120940547,False,,0,,houston,,,,,,[],,,,
1480229668779343873,1480221620862164998,2022-01-09 11:27:09 CST,2022-01-09,11:27:09,-0500,3254294702,hairbyyasna,Women from another planet!!,,"@luciahoff @ScottMorrisonMP 🇦🇺  set up Novak!!!First they call him, approved  his visa,than when he come they revoke his visa....All the world know what they are doing!!!!#BoycottAustralianOpen  #racist #Discrimination #boycotAustralia",en,[],[],[],2,0,3,"['boycottaustralianopen', 'racist', 'discrimination', 'boycotaustralia']",[],https://twitter.com/hairbyyasna/status/1480229668779343873,False,,0,,houston,,,,,,"[{'screen_name': 'luciahoff', 'name': 'TENNISMEDIA', 'id': '43306669'}, {'screen_name': 'ScottMorrisonMP', 'name': 'Scott Morrison', 'id': '34116377'}]",,,,
1480221327218860033,1480221327218860033,2022-01-09 10:54:00 CST,2022-01-09,10:54:00,-0500,34296757,that_boi_smooth,THE KID,,@EASPORTS guys can you please start penalizing the rage quitters on #Madden ???? People quit way too often  rather than play with good sportsmanship and take their L.. #NBA2K penalizes quitters by restricting access to play. Would make a world of a difference for your severs too,en,[],[],[],0,0,0,"['madden', 'nba2k']",[],https://twitter.com/That_Boi_Smooth/status/1480221327218860033,False,,0,,houston,,,,,,[],,,,
1480215902322843658,1480215902322843658,2022-01-09 10:32:26 CST,2022-01-09,10:32:26,-0500,28636828,feoamante,Feo Amante 🇺🇦,,"I got the vax, boosters, and still got a mild case of Covid. It's not fair. My kid wore helmet and pads and still got injured in football. It's so unjust. I have airbags and wore my seatbelt and still got a bruise from my car accident. This isn't right. Yes. I'm mocking you.",en,[],[],[],3,12,31,[],[],https://twitter.com/FeoAmante/status/1480215902322843658,False,,0,,houston,,,,,,[],,,,
1480212803180978177,1480212803180978177,2022-01-09 10:20:07 CST,2022-01-09,10:20:07,-0500,178141580,adamstorm_,λÐλM╰☆╮SŦØƦM CROWN PRINCE OF ZOOTENVAAL,,"It’s like people forget Tariq St. Patrick the same lil nigga that stole a gun from the feds, got kicked outta school for drugs, and shot his daddy!!! 😂😂 why’s we rooting for him 🙃",en,[],[],[],0,0,0,[],[],https://twitter.com/adamstorm_/status/1480212803180978177,False,,0,,houston,,,,,,[],,,,
1480198449224204288,1480198330462449667,2022-01-09 09:23:05 CST,2022-01-09,09:23:05,-0500,282392161,tmainesdotcom,Trav,,@_thelindsayerin Boy got murder on his mind &amp; you can’t tell me no different,en,[],[],[],1,0,0,[],[],https://twitter.com/TMainesDOTcom/status/1480198449224204288,False,,0,,houston,,,,,,"[{'screen_name': '_thelindsayerin', 'name': 'Lindsay Erin ✨', 'id': '1235744173573185537'}]",,,,
1480197580608921602,1479681885915824130,2022-01-09 09:19:38 CST,2022-01-09,09:19:38,-0500,1364003111195480065,ajvictorymd,"Amani Jambhekar MD, MBA, FACS",,"@knottedthreads @Katheri53730237 Wow. I also did HS debate and this woman who is grappling with her own internalized misogyny should NOT be allowed to crush the dreams of female teenagers who have shown the perseverance and dedication to even do CX, not the easiest of events.",en,[],[],[],0,0,1,[],[],https://twitter.com/AjvictoryMD/status/1480197580608921602,False,,0,,houston,,,,,,"[{'screen_name': 'knottedthreads', 'name': 'E. C. Chang 🌻⚗️🏳️\u200d🌈🇺🇦', 'id': '72646140'}, {'screen_name': 'Katheri53730237', 'name': 'Katherine Holmes', 'id': '877555538673807360'}]",,,,
1480196345583620099,1480185442234421258,2022-01-09 09:14:44 CST,2022-01-09,09:14:44,-0500,109657942,ysl_ron,T.U.C.K. (Top U Can Keep),,@doctuh_p Gun to your head...You gotta either Cook or Top. What you choosing?  https://t.co/MfI7fxDeI9,en,[],[],[],1,0,2,[],[],https://twitter.com/YSL_Ron/status/1480196345583620099,False,,1,https://pbs.twimg.com/ext_tw_video_thumb/1480196311207104512/pu/img/d9R7qzFBvflFVPAf.jpg,houston,,,,,,"[{'screen_name': 'doctuh_p', 'name': 'Doc McStuffins', 'id': '894582715152035840'}]",,,,
1480081533570592769,1479070613738242053,2022-01-09 01:38:30 CST,2022-01-09,01:38:30,-0500,3273162162,samubaarak,Arjumand Mubaarak,,"@disclosetv Ostrasizing, punishing  and excommunicating the unvaxxed in France! This is horrible. Democracy and individual freedoms are under attack in Europe and the US.  https://t.co/mdoP2XnspA",en,[],[],['https://pbs.twimg.com/media/FIpOTmGXoAA2EL6.jpg'],0,0,0,[],[],https://twitter.com/samubaarak/status/1480081533570592769,False,,1,https://pbs.twimg.com/media/FIpOTmGXoAA2EL6.jpg,houston,,,,,,"[{'screen_name': 'disclosetv', 'name': 'Disclose.tv', 'id': '15392486'}]",,,,
1480074738219241475,1479574233500033029,2022-01-09 01:11:30 CST,2022-01-09,01:11:30,-0500,1215750055157817344,ebmannie,Rosamel Fierro,,"@DoctorShades24 @TheSurgeSG No what you call ""banter"" is harassment. Don't antagonize strangers, don't act aggressive and you won't get an aggressive response. That's it. It's simple. Support your team and go about your business without trash talking strangers and nothing happens. Talk about childish",en,[],[],[],2,0,0,[],[],https://twitter.com/EbMannie/status/1480074738219241475,False,,0,,houston,,,,,,"[{'screen_name': 'DoctorShades24', 'name': 'Shades', 'id': '851926446'}, {'screen_name': 'TheSurgeSG', 'name': 'The Surge Supporters Group', 'id': '1146244615592402944'}]",,,,
1480067474217488384,1480067474217488384,2022-01-09 00:42:38 CST,2022-01-09,00:42:38,-0500,566110635,tshedzom,"Shaun Maswanganyi, OLY",,Oh how I missed Attack on Titan Sundays,en,[],[],[],1,6,21,[],[],https://twitter.com/tshedzom/status/1480067474217488384,False,,0,,houston,,,,,,[],,,,
1480066827527069697,1480066827527069697,2022-01-09 00:40:04 CST,2022-01-09,00:40:04,-0500,715211464953319424,usgs_texasrain,USGS TX RainWatch,"{'type': 'Point', 'coordinates': [29.76217336, -95.5577213]}","#USGS08073600 - Buffalo Bayou at W Belt Dr, Houston, TX  Violent Rain (2.4 in/hr) over the last 15 minutes   https://t.co/bKDxc6x0Bn",en,[],['http://waterdata.usgs.gov/tx/nwis/uv?site_no=08073600&t=20220109003000'],[],0,0,0,['usgs08073600'],[],https://twitter.com/USGS_TexasRain/status/1480066827527069697,False,,0,,houston,,,,,,[],,,,
1480045198017277953,1480045198017277953,2022-01-08 23:14:07 CST,2022-01-08,23:14:07,-0500,1120074973,msilvers1979,Michael Silvers,,Maybe stop shooting glove side. #NYR,en,[],[],[],0,1,3,['nyr'],[],https://twitter.com/msilvers1979/status/1480045198017277953,False,,0,,houston,,,,,,[],,,,
1480012019680124930,1479878685792608267,2022-01-08 21:02:17 CST,2022-01-08,21:02:17,-0500,905138029,mikediaz285,Michael Diaz,,@TrueTXProject @RepStickland @JeffCasonTexas Wu Yuanzhi's district is so full of Human trafficking they had to change the laws in Houston..#CruzCrew  👇   https://t.co/DcOLl4PR5b,en,[],['https://www.click2houston.com/news/investigates/2021/09/16/hpd-using-new-law-to-crack-down-on-those-paying-for-sex/'],[],0,0,3,['cruzcrew'],[],https://twitter.com/MikeDiaz285/status/1480012019680124930,False,,0,,houston,,,,,,"[{'screen_name': 'TrueTXProject', 'name': 'True Texas Project', 'id': '129531185'}, {'screen_name': 'RepStickland', 'name': 'Jonathan Stickland', 'id': '412316336'}, {'screen_name': 'JeffCasonTexas', 'name': 'Jeff Cason', 'id': '1143534229051117570'}]",,,,
1480008183884177410,1479953156863844353,2022-01-08 20:47:02 CST,2022-01-08,20:47:02,-0500,946844190,libertywatch_,LibertyWatch🗽,,"@RealSpikeCohen Trying new recipes, Grilling/smoking meats, whiskey, cigars, shooting, watching friday night movies with my kids.",en,[],[],[],0,0,1,[],[],https://twitter.com/LibertyWatch_/status/1480008183884177410,False,,0,,houston,,,,,,"[{'screen_name': 'RealSpikeCohen', 'name': 'Spike Cohen', 'id': '1204095351944368139'}]",,,,
1479975186388635651,1479662659217862662,2022-01-08 18:35:55 CST,2022-01-08,18:35:55,-0500,168727608,jrcerasuolo,Stan for Cabeza de Vaca,,"@ShelleyLuther @GeneforTexas We have about 25 young men in our Boy Scout troop in Pearland who's parents were born in China. They came here for school, work, and one would assume a better life. Luther's racist insinuations are ludicrous. These families are EMBRACING what it means to be a good citizen.",en,[],[],[],0,1,3,[],[],https://twitter.com/JRCerasuolo/status/1479975186388635651,False,,0,,houston,,,,,,"[{'screen_name': 'ShelleyLuther', 'name': 'Shelley Luther', 'id': '1261042310969806849'}, {'screen_name': 'GeneforTexas', 'name': 'Gene Wu', 'id': '438529528'}]",,,,
1479969700750794754,1479964774880268290,2022-01-08 18:14:07 CST,2022-01-08,18:14:07,-0500,4559295560,jeffyork13,"Jeff York, “Granddad”",,"@lisaraquelv I’d have to say OJ. He murdered two people.  Baldwin accidentally killed one.  I could actually see myself doing what he did, especially if I’d been instructed to not “mess” with the gun.  Smollet mainly made a fool of himself, but also cost the taxpayers money.",en,[],[],[],0,0,2,[],[],https://twitter.com/JeffYork13/status/1479969700750794754,False,,0,,houston,,,,,,"[{'screen_name': 'lisaraquelv', 'name': 'lisa davis', 'id': '997192114088820736'}]",,,,
1479927411403894786,1479854590086553606,2022-01-08 15:26:05 CST,2022-01-08,15:26:05,-0500,1390281210,thomassflowers,Thomas S Flowers,,@SlasherDiva Brutal!!,no,[],[],[],1,0,1,[],[],https://twitter.com/ThomasSFlowers/status/1479927411403894786,False,,0,,houston,,,,,,"[{'screen_name': 'SlasherDiva', 'name': 'Her Name is Dayna🔪🌹🏳️\u200d⚧️', 'id': '884799883'}]",,,,
1479912139175436291,1479912139175436291,2022-01-08 14:25:24 CST,2022-01-08,14:25:24,-0500,33661083,ctchouston,Classical Theatre Co,"{'type': 'Point', 'coordinates': [29.7760214, -95.33654692]}",Working on some stage violence on set. #ctchouston #houarts #rur #karelcapek @ The DeLUXE Theater  https://t.co/uTqqwd5Y8J,en,[],['https://www.instagram.com/p/CYe3_AmJBd_/?utm_medium=twitter'],[],0,1,1,"['ctchouston', 'houarts', 'rur', 'karelcapek']",[],https://twitter.com/CTCHouston/status/1479912139175436291,False,,0,,houston,,,,,,[],,,,
1479900618227691526,1479899652552069125,2022-01-08 13:39:37 CST,2022-01-08,13:39:37,-0500,2915139882,greybuilder,Adam,,@Grammarous I think I would have.  Just brutal.,en,[],[],[],1,0,1,[],[],https://twitter.com/Greybuilder/status/1479900618227691526,False,,0,,houston,,,,,,"[{'screen_name': 'Grammarous', 'name': 'Elle-isson Becker', 'id': '92610526'}]",,,,
1479899125974016002,1479899125974016002,2022-01-08 13:33:41 CST,2022-01-08,13:33:41,-0500,2873202455,dixon_everett,Everett Dixon,,"Open SmartNews and read ""Kentucky Teacher Fired After Telling Black Student And Gunshot Victim He Was ‘Just Another Black Boy Who Got Shot’"" here:  https://t.co/8ClYXUXEbw  To read it on the web, tap here:  https://t.co/7Ij6aJBHdS",en,[],"['https://share.smartnews.com/jYy62', 'https://share.smartnews.com/b5JKE']",[],0,0,0,[],[],https://twitter.com/dixon_everett/status/1479899125974016002,False,,0,,houston,,,,,,[],,,,
1479895759197810695,1479895759197810695,2022-01-08 13:20:18 CST,2022-01-08,13:20:18,-0500,4841951071,siilysanto,COGNAC KING (｡•̀ᴗ-)✧,,jewelers being sexist to me saying name plates are “for women” like okay??? you just lost your sale babes &lt;3,en,[],[],[],1,0,15,[],[],https://twitter.com/siilysanto/status/1479895759197810695,False,,0,,houston,,,,,,[],,,,
1479888772296855555,1479815050810597379,2022-01-08 12:52:32 CST,2022-01-08,12:52:32,-0500,1363348770268852227,khawarizmi99,Khawarizmi99,,@NaghamAbouzeid @LebISF What do you expect from a society and a system that always blames the victim . People don’t realize the mental and psychological damage that victims has to live with all their lives .,en,[],[],[],0,0,0,[],[],https://twitter.com/khawarizmi99/status/1479888772296855555,False,,0,,houston,,,,,,"[{'screen_name': 'NaghamAbouzeid', 'name': 'Nagham', 'id': '1323263892651450368'}, {'screen_name': 'LebISF', 'name': 'قوى الامن الداخلي', 'id': '1481786138'}]",,,,
1479840427444473866,1479840427444473866,2022-01-08 09:40:26 CST,2022-01-08,09:40:26,-0500,1097449701278924805,isaiahrobledo15,Isaiah Robledo D.D.,,I'm a deadly weapon,en,[],[],[],0,0,0,[],[],https://twitter.com/IsaiahRobledo15/status/1479840427444473866,False,,0,,houston,,,,,,[],,,,
1479828699973406723,1479828699973406723,2022-01-08 08:53:50 CST,2022-01-08,08:53:50,-0500,1097449701278924805,isaiahrobledo15,Isaiah Robledo D.D.,,My soldiers act like that and I'm shooting chad  https://t.co/ehhS5CJDwf,en,[],[],"['https://pbs.twimg.com/media/FIloQ4_XwAElYZn.jpg', 'https://pbs.twimg.com/media/FIloWmEXEAM5nMK.jpg', 'https://pbs.twimg.com/media/FIloXAuX0AMGKu_.jpg']",0,0,0,[],[],https://twitter.com/IsaiahRobledo15/status/1479828699973406723,False,,1,https://pbs.twimg.com/media/FIloQ4_XwAElYZn.jpg,houston,,,,,,[],,,,
1479824303256387587,1479824303256387587,2022-01-08 08:36:22 CST,2022-01-08,08:36:22,-0500,1097449701278924805,isaiahrobledo15,Isaiah Robledo D.D.,,Gun safety first right chad  https://t.co/JBIBL4SJi1,en,[],[],"['https://pbs.twimg.com/media/FIlkW52XsAkarHe.jpg', 'https://pbs.twimg.com/media/FIlkXGBWQAU7efY.jpg']",0,0,0,[],[],https://twitter.com/IsaiahRobledo15/status/1479824303256387587,False,,1,https://pbs.twimg.com/media/FIlkW52XsAkarHe.jpg,houston,,,,,,[],,,,
1479821723734265863,1479821723734265863,2022-01-08 08:26:07 CST,2022-01-08,08:26:07,-0500,18097883,brentsullivan,BrentSullivan🔻Ⓥ🌹🏳️‍🌈🏳️‍⚧️🇺🇦,,Cruz had it right  terrorist - one who employs the unlawful use of force or violence against persons or property in order to coerce or intimidate a government or the civilian population in furtherance of political or social objectives.  Jan 6=terrorism   https://t.co/YWcsSR5r5S,en,[],['https://www.theguardian.com/us-news/2022/jan/08/ted-cruz-capitol-attack-tucker-carlson-interview?CMP=Share_AndroidApp_Other'],[],0,0,0,[],[],https://twitter.com/BrentSullivan/status/1479821723734265863,False,,0,,houston,,,,,,[],,,,
1479813904431820814,1479813904431820814,2022-01-08 07:55:03 CST,2022-01-08,07:55:03,-0500,780485761892229120,kimcastrowx,Kim Castro,,"SEVERE STORM THREAT: We have it for today... Though it’s on the low end of the spectrum, a 1 on the 1-5 scale. Biggest likelihood of seeing that will be tonight into very early tomorrow morning. What are the threats? Why? And exactly when?  I’ll show you at 9 AM on @KHOU #khou11  https://t.co/zB5bju5L49",en,"[{'screen_name': 'khou', 'name': 'khou 11 news houston', 'id': '15791186'}]",[],['https://pbs.twimg.com/media/FIla5pPWQAMhBL6.jpg'],1,3,16,['khou11'],[],https://twitter.com/KimCastroWX/status/1479813904431820814,False,,1,https://pbs.twimg.com/media/FIla5pPWQAMhBL6.jpg,houston,,,,,,[],,,,
1479806783757692928,1479806783757692928,2022-01-08 07:26:45 CST,2022-01-08,07:26:45,-0500,1192538732378935296,deja_entenbrew,a girl named Tex,,First gun show of the new year. Let's goooooo Pasadena.,en,[],[],[],0,0,0,[],[],https://twitter.com/Deja_Entenbrew/status/1479806783757692928,False,,0,,houston,,,,,,[],,,,
1479782099674611712,1479587478537310208,2022-01-08 05:48:40 CST,2022-01-08,05:48:40,-0500,1441416158092005385,yohanibis,Yohanibis $8.01🦍@MEDU-NETER#369👑🖤🦍,,"@Trader107296701 @TaraBull808 Simple case of ""CRIME"" 👀🤷🏾‍♂️//🦍💯🦍",en,[],[],[],0,0,5,[],[],https://twitter.com/yohanibis/status/1479782099674611712,False,,0,,houston,,,,,,"[{'screen_name': 'Trader107296701', 'name': 'Here for the MOASS', 'id': '1404897816179261446'}, {'screen_name': 'TaraBull808', 'name': 'TaraBull\uea00', 'id': '1374968033265864706'}]",,,,
1479765114442108929,1479765114442108929,2022-01-08 04:41:10 CST,2022-01-08,04:41:10,-0500,591013735,aggiekat03,Kathryn Dennis,,"I lost a dear friend today to domestic abuse. Murder suicide is never the answer.   If you are in an abusive situation please call 1-800-799-7233  24/7 for free &amp; confidential resources.   Be a survivor, not a statistic.   #abusiverelationship #abusiverelationships #gethelp  https://t.co/9VRp3KfBdy",en,[],[],['https://pbs.twimg.com/media/FIkuhtnWQAEsead.jpg'],1,0,2,"['abusiverelationship', 'abusiverelationships', 'gethelp']",[],https://twitter.com/AggieKat03/status/1479765114442108929,False,,1,https://pbs.twimg.com/media/FIkuhtnWQAEsead.jpg,houston,,,,,,[],,,,
1479732753881088002,1479732753881088002,2022-01-08 02:32:35 CST,2022-01-08,02:32:35,-0500,70867821,seyi_my_name,🥀 ꜱᴇʏɪɪʀØꜱᴇ 🥀,,I be boiling in anger but on the outside I'm like this  https://t.co/kOslQVg14B,en,[],[],['https://pbs.twimg.com/media/FIkRGQwXsAAb484.jpg'],0,0,0,[],[],https://twitter.com/Seyi_My_Name/status/1479732753881088002,False,,1,https://pbs.twimg.com/media/FIkRGQwXsAAb484.jpg,houston,,,,,,[],,,,
1479722173971505156,1479697005173788673,2022-01-08 01:50:32 CST,2022-01-08,01:50:32,-0500,2864289757,opietellem,dreamvillain,,@marielatrev_ Bestie they’re racist😂😂it’s texas tho we’re used to it sadly,en,[],[],[],0,0,0,[],[],https://twitter.com/OpieTellEm/status/1479722173971505156,False,,0,,houston,,,,,,[],,,,
1479710067586912264,1479710067586912264,2022-01-08 01:02:26 CST,2022-01-08,01:02:26,-0500,1432880991799025665,cocohoustonnow,COCO,,@asiasocietytx @AsianChamberHou @BBCNewsAsia @becool2asians year of the Tiger  ... release the Tiger Moms on this racist ... #StopAsianHate #StopAAPIHate,en,"[{'screen_name': 'asianchamberhou', 'name': 'asianchamberhou', 'id': '2328328298'}, {'screen_name': 'bbcnewsasia', 'name': 'bbc asia', 'id': '1642135962'}, {'screen_name': 'becool2asians', 'name': 'be cool 2 asians', 'id': '1242189123529486336'}]",[],[],0,0,1,"['stopasianhate', 'stopaapihate']",[],https://twitter.com/cocohoustonnow/status/1479710067586912264,False,https://twitter.com/HoustonChron/status/1479667955189305348,0,,houston,,,,,,[],,,,
