id,conversation_id,created_at,date,time,timezone,user_id,username,name,place,tweet,language,mentions,urls,photos,replies_count,retweets_count,likes_count,hashtags,cashtags,link,retweet,quote_url,video,thumbnail,near,geo,source,user_rt_id,user_rt,retweet_id,reply_to,retweet_date,translate,trans_src,trans_dest
1491198717625778181,1491198717625778181,2022-02-08 17:54:14 CST,2022-02-08,17:54:14,-0500,4056209999,jaywwalker1,Jay W. (#NoHateInNYC) Walker,,".@harrisonjaime, yes #FraudFearFascism; but also #whitesupremacy, #misogyny, #antiscience, #lies, #transphobia, and #homophobia.",en,"[{'screen_name': 'harrisonjaime', 'name': 'jaime harrison, dnc chair', 'id': '73754019'}]",[],[],0,0,0,"['fraudfearfascism', 'whitesupremacy', 'misogyny', 'antiscience', 'lies', 'transphobia', 'homophobia']",[],https://twitter.com/jaywwalker1/status/1491198717625778181,False,https://twitter.com/harrisonjaime/status/1491046695370510339,0,,new york city,,,,,,[],,,,
1491198252016111619,1491198252016111619,2022-02-08 17:52:23 CST,2022-02-08,17:52:23,-0500,995292015633096704,auydaplease,danny anthony,,"#meichi , Really racist i came to this store  asked for Fireball and the owner stated I have the wrong Neighborhood. These are the type of attitude that we have to deal . #7NEWS with ,#BlackHistoryMonth #asian are racist also. #BlackTwitter #NYC  https://t.co/dVHsPruhAd",en,[],[],['https://pbs.twimg.com/tweet_video_thumb/FLHM5eiWQAMqEaA.jpg'],0,0,0,"['meichi', '7news', 'blackhistorymonth', 'asian', 'blacktwitter', 'nyc']",[],https://twitter.com/auydaplease/status/1491198252016111619,False,,1,https://pbs.twimg.com/tweet_video_thumb/FLHM5eiWQAMqEaA.jpg,new york city,,,,,,[],,,,
1491197843222237190,1491167805726773254,2022-02-08 17:50:45 CST,2022-02-08,17:50:45,-0500,721915908852211713,xanthus_rotgut,Margaret Michele Waldman Savage,,"It's criminal to kidnap use kids throughout their lives as crime bait.  The child/adult relationship is always that no matter how old they grow.  This may be why some avoid pigs who commit crimes, constantly trying to frame or force you as if anyone is more entitled.",en,[],[],[],2,0,0,[],[],https://twitter.com/xanthus_rotgut/status/1491197843222237190,False,,0,,new york city,,,,,,[],,,,
1491197494142939136,1490811894197886981,2022-02-08 17:49:22 CST,2022-02-08,17:49:22,-0500,841274172,mblakey777,Mark Blakey,,@emilyhewertson He’s teaching that kid abuse is funny.  How about we kick his son across the room and then say sorry if some people got upset?,en,[],[],[],0,0,0,[],[],https://twitter.com/mblakey777/status/1491197494142939136,False,,0,,new york city,,,,,,"[{'screen_name': 'emilyhewertson', 'name': 'Emily Hewertson 🇬🇧', 'id': '2194905277'}]",,,,
1491197384709210112,1491049574869258243,2022-02-08 17:48:56 CST,2022-02-08,17:48:56,-0500,18569280,sdgold60,The only David X Cohen in the book,,@BraveForGaga95 She has a song oscar..this was 4 acting. She could another song nom for top gun..apples and 🍊,en,[],[],[],0,0,0,[],[],https://twitter.com/sdgold60/status/1491197384709210112,False,,0,,new york city,,,,,,"[{'screen_name': 'BraveForGaga95', 'name': 'ionuț 95', 'id': '229226630'}]",,,,
1491191898627018753,1491191898627018753,2022-02-08 17:27:08 CST,2022-02-08,17:27:08,-0500,1378618739491545091,ghostkellzxiii,yunghost,,ROBERT PATTERSON FINNA MURDER BATMAN MIGHT AS WELL GIVE HIM THE OSCAR NOW,en,[],[],[],0,0,0,[],[],https://twitter.com/ghostkellzXIII/status/1491191898627018753,False,,0,,new york city,,,,,,[],,,,
1491186294617423876,1491186294617423876,2022-02-08 17:04:52 CST,2022-02-08,17:04:52,-0500,455385378,rennieluke,Giancarlo Stantonio,,"""I was gonna go see Rage Against The Machine until I saw they wanna see your papers, now, after 25 years of absolutely adoring them, I fucking hate them"" is a very strange way to say ""I don't have 300 dollars"". It's also a strange way to tell people who you voted for in 2020.",en,[],[],[],0,0,2,[],[],https://twitter.com/RennieLuke/status/1491186294617423876,False,,0,,new york city,,,,,,[],,,,
1491184539598823431,1491184539598823431,2022-02-08 16:57:53 CST,2022-02-08,16:57:53,-0500,1246992738161168384,king_nick____,Cool story bro,,ND filters gonna be my best friend when I start shooting outside in the sun,en,[],[],[],0,0,0,[],[],https://twitter.com/king_nick____/status/1491184539598823431,False,,0,,new york city,,,,,,[],,,,
1491184167555846146,1490775896122445830,2022-02-08 16:56:25 CST,2022-02-08,16:56:25,-0500,18531414,geofcantor,geofcantor,,"@Limeylizzie Because it’s a sport and not a high-school, movie theater, protest, synagogue,or church… oh and skis. A lot of our best shooters don’t ski.",en,[],[],[],0,0,0,[],[],https://twitter.com/geofcantor/status/1491184167555846146,False,,0,,new york city,,,,,,"[{'screen_name': 'Limeylizzie', 'name': 'Elizabeth West', 'id': '21953248'}]",,,,
1491180383274430464,1491180383274430464,2022-02-08 16:41:22 CST,2022-02-08,16:41:22,-0500,455385378,rennieluke,Giancarlo Stantonio,,"I just found out people think Rage Against The Machine is a group of sellouts for running with the herd and being vaccinated. Not only do vaccinations have nothing to do with political standpoints, but they were never on the side of the rednecks. They're black Harvard students.",en,[],[],[],1,0,0,[],[],https://twitter.com/RennieLuke/status/1491180383274430464,False,,0,,new york city,,,,,,[],,,,
1491180223328829444,1491033906837352448,2022-02-08 16:40:44 CST,2022-02-08,16:40:44,-0500,117884167,sweetly_brutal,Jhawo Can SB19 X @US_ATIN,,"@OfficialKpex Without Toni, baka sa pansitan lang aabot ang PBB. She worked her ass off to be in the place where she is right now. WTF!!! husgahan nyo yung tao pati religious belief nya??? That’s Super Low!!! That’s her choice. Cancel culture is never okay!",en,[],[],[],2,1,29,[],[],https://twitter.com/sweetly_brutal/status/1491180223328829444,False,,0,,new york city,,,,,,"[{'screen_name': 'OfficialKpex', 'name': 'ⓀⓅⒺⓍ Official \uea00🥧', 'id': '1346700075632713728'}]",,,,
1491178268896407554,1491178268896407554,2022-02-08 16:32:58 CST,2022-02-08,16:32:58,-0500,16222099,latoyadjordan,LaToya Jordan,,This Tiny Nightmares book is amazing &amp; creepy! And also 100% do not recommend reading a story about mass murder by pushing people off subway platforms to combat climate change while you are standing on the subway platform in a prime push location.  https://t.co/qSwjqrZmun,en,[],[],['https://pbs.twimg.com/media/FLG6updXsAYQvJ4.jpg'],2,3,23,[],[],https://twitter.com/latoyadjordan/status/1491178268896407554,False,,1,https://pbs.twimg.com/media/FLG6updXsAYQvJ4.jpg,new york city,,,,,,[],,,,
1491178197848887302,1491167805726773254,2022-02-08 16:32:41 CST,2022-02-08,16:32:41,-0500,721915908852211713,xanthus_rotgut,Margaret Michele Waldman Savage,,How about this scenario the cop falsely pulls you over with a lie as to why he did so.  You're like to work you get fired.  You committed penny crime for food that week.  Cause crime.  Think I'll go get drunk now kind of stuff.,en,[],[],[],1,0,0,[],[],https://twitter.com/xanthus_rotgut/status/1491178197848887302,False,,0,,new york city,,,,,,[],,,,
1491178037035302913,1491178037035302913,2022-02-08 16:32:03 CST,2022-02-08,16:32:03,-0500,66740926,cgrove13,conn,,never have i ever come back from a trip so injured. and that's saying something. health week starts now go pats,en,[],[],[],0,0,1,[],[],https://twitter.com/cgrove13/status/1491178037035302913,False,,0,,new york city,,,,,,[],,,,
1491177819560361988,1491167805726773254,2022-02-08 16:31:11 CST,2022-02-08,16:31:11,-0500,721915908852211713,xanthus_rotgut,Margaret Michele Waldman Savage,,It seems these people actually spread and cause crime.,en,[],[],[],1,0,0,[],[],https://twitter.com/xanthus_rotgut/status/1491177819560361988,False,,0,,new york city,,,,,,[],,,,
1491177777730822148,1491177777730822148,2022-02-08 16:31:01 CST,2022-02-08,16:31:01,-0500,321221719,mmlunlimited,Miles Marshall Lewis,,joe tex be singing about rape half the time and that shit is still on the radio… smh,en,[],[],[],1,1,3,[],[],https://twitter.com/MMLunlimited/status/1491177777730822148,False,,0,,new york city,,,,,,[],,,,
1491177378789265409,1491167805726773254,2022-02-08 16:29:26 CST,2022-02-08,16:29:26,-0500,721915908852211713,xanthus_rotgut,Margaret Michele Waldman Savage,,Vikki admits to having becoming an aux cop abt 15 yrs ago lying to me. All Vicky talks abt is committing crime while trying to constantly frame me. I had no knowledge of any law enforcement affiliation earlier. They're the worst criminals I'd personally imagine. Long-term.,en,[],[],[],1,0,0,[],[],https://twitter.com/xanthus_rotgut/status/1491177378789265409,False,,0,,new york city,,,,,,[],,,,
1491175046735605763,1491175046735605763,2022-02-08 16:20:10 CST,2022-02-08,16:20:10,-0500,841795905577705472,lauren_keyson,Lauren Keyson,,Mitch McConnell (R-Ky): Most Americans don’t agree with the Republican Party’s characterization of Jan. 6 white supremest attack on the nation’s capitol — including Senate Minority Leader Mitch McConnell (R-Ky.).  By Amber Phillips,en,[],[],[],0,0,0,[],[],https://twitter.com/lauren_keyson/status/1491175046735605763,False,,0,,new york city,,,,,,[],,,,
1491174686256173056,1491174686256173056,2022-02-08 16:18:44 CST,2022-02-08,16:18:44,-0500,18587173,amescg,Ames Grawert ☃️,,"Crime increased all over the country in 2020-21, in communities of all sizes and political alignments. It’s afactual and irresponsible to politicize crime in this manner.",en,[],[],[],0,4,17,[],[],https://twitter.com/AmesCG/status/1491174686256173056,False,https://twitter.com/CBedfordDC/status/1491173567513624576,0,,new york city,,,,,,[],,,,
1491174276216815616,1491174276216815616,2022-02-08 16:17:06 CST,2022-02-08,16:17:06,-0500,55007056,511ny123,511NY 123 Lines,"{'type': 'Point', 'coordinates': [40.841894, -73.873488]}",Incident on #2Line NB from E 180 St to Gun Hill Rd  https://t.co/r4QGfVred5,en,[],['http://511ny.org/EventDetails/TRANSCOM/ORT200202169'],[],0,0,0,['2line'],[],https://twitter.com/511ny123/status/1491174276216815616,False,,0,,new york city,,,,,,[],,,,
